date,title
2022/06/30  00:00:00,Private health reform and new independent authority proposed by AMA
2022/06/30  00:00:00,Vietnam Warily Weighs A China Base In Cambodia
2022/06/30  00:00:00,Solihull LGBTQ+ rainbow road to be made a 'permanent' feature
2022/06/30  00:00:00,Liz Cheney raises the stakes in anti-Trump efforts: The Note
2022/06/30  00:00:00,"IIOJK witnesses 191 killing, 72 military operations since Jan 2022"
2022/06/30  00:00:00,LVMH buys Napa Valleys Joseph Phelps Vineyards
2022/06/30  00:00:00,Ben & Jerry's to be sold in illegal Israeli settlements against company's will following Unilever decision
2022/06/30  00:00:00,Seven tips to gas savings from AAA
2022/06/30  00:00:00,Delhi Police team at Alt News co-founder Mohammed Zubair's residence in Bengaluru
2022/06/30  00:00:00,Women try to board plane with luggage filled with over 100 snakes and armadillos
2022/06/30  00:00:00,"The White House Explains the Troop Deployment Across Europe to ""Contain Russia"""
2022/06/30  00:00:00,The Obsidian WROTE Collection And Black Writers Workspace Launch Writing Competition For Black Creators
2022/06/30  00:00:00,P.M. Sharif Stresses on Economic Cooperation in Meeting with Chinese Official
2022/06/30  00:00:00,Kells blooms for Ukraine as national flowers planted on approach road
2022/06/30  00:00:00,Minority demands $34m breakdown cost in AMERI relocation
2022/06/30  00:00:00,Expert: Lukashenka To Use Belarusian Military Same Way As Donbass 'Mobics'
2022/06/30  00:00:00,Azerbaijan And Iran Discuss Joint Reconstruction Of Khudaferin Bridge (PHOTO)
2022/06/30  00:00:00,Pakistan: TTP says FATA's demerger from Khyber Pakhtunkhwa is primary demand
2022/06/30  00:00:00,THE VOICE OF VIETNAM - VOV World
2022/06/30  00:00:00,Prosecutor: Member of suruhnu's legal team assisted accuser
2022/06/30  00:00:00,Netanyahu's trial amid the Israeli election campaign
2022/06/30  00:00:00,"DeFazio, Wyden send letter to Bureau of Ocean Energy Management on Oregon coast offshore wind project"
2022/06/30  00:00:00,Lawmaker: Time running out to end Russias blockade of Ukraines food
2022/06/30  00:00:00,Lasse Laukkarinen Claims The Festival Tallinn Main Event Day 1B Chip Lead
2022/06/30  00:00:00,Chasing reporters will just put them on high alert | Editorial
2022/06/30  00:00:00,"IIOJK witnesses 191 killing, 72 military operations since Jan 2022"
2022/06/30  00:00:00,Cassidy Hutchinson and a Story from Ancient Syria
2022/06/30  00:00:00,US Navy awards contract modifications for two T-AO oilers and ESB ship
2022/06/30  00:00:00,Masks off when the heat is on in Japan
2022/06/30  00:00:00,"To get their young children a COVID vaccine, Canadian parents are going to the U.S."
2022/06/30  00:00:00,CJ: Factors beyond courts control slowing cases
2022/06/30  00:00:00,Ethiopian Government and TPLF Wrangle Over Peace Talks Mediation
2022/06/30  00:00:00,Ukrainian Aviation Strikes Enemy Ammo And Weapons Depots
2022/06/30  00:00:00,Vietnam Warily Weighs A China Base In Cambodia
2022/06/30  00:00:00,Melton residents living in a doctor desert
2022/06/30  00:00:00,"Stitt requests audit, Hofmeister requests law enforcement investigation and school land office secretary's resignation"
2022/06/30  00:00:00,Johnson City Schools offers internships to students
2022/06/30  00:00:00,"Essential oils Market Research Report by Raw Material, by Application, by End-Use Industry, by Region - Global Forecast to 2028 - Cumulative Impact of COVID-19 - by The Insight Partners"
2022/06/30  00:00:00,DTE impersonators drained Rochester Hills woman's checking account using Zelle app
2022/06/30  00:00:00,THE VOICE OF VIETNAM - VOV World
2022/06/30  00:00:00,OPINION | BLAKE RUTHERFORD: A step backward
2022/06/30  00:00:00,Nothing Phone (1) Appeared On Amazon Germany: Prices Known
2022/06/30  00:00:00,The making and breaking of Maha Vikas Aghadi: Timeline
2022/06/30  00:00:00,"Ask a Ranger: Everett Ruess and Flagstaff, Part 2"
2022/06/30  00:00:00,"Readers comment on the school district's backpack policy, anti-LGBTQ discrimination, more"
2022/06/30  00:00:00,JCT's Tal Campus for Women: The dream of Stuart Hershkowitz
2022/06/30  00:00:00,Delhi Police team at Alt News co-founder Mohammed Zubair's residence in Bengaluru
2022/06/30  00:00:00,3 Types Of Product Development Outsourcing Compared
2022/06/30  00:00:00,"UK court again remand Ekweremadu for custody, hearing go hold July 7"
2022/06/30  00:00:00,"11 Nigerians, eight Ghanaians don land Africa afta dem chop deportation from UK goment"
2022/06/30  00:00:00,Housing plan stretches Palo Altos height limit
2022/06/30  00:00:00,OTHER OPINIONS: Abortion In The States After Roe v. Wade
2022/06/30  00:00:00,Gorbea defends fundraiser hosted by oil lobbyist who's given to other RI Dems
2022/06/30  00:00:00,Myanmar fighter jet crosses into Thailand's air space in Tak
2022/06/30  00:00:00,Consultant: Environmental studies  next step in bridge location choice
2022/06/30  00:00:00,Human Rights Watch Statement to International Commission of Human Rights Experts on Ethiopia
2022/06/30  00:00:00,Johnson City Schools offers internships to students
2022/06/30  00:00:00,Alt News co-founder Mohammed Zubair brought to B'luru for probe (Ld)
2022/06/30  00:00:00,"Taliban, US Officials To Meet In Doha Over Unfreezing Afghan Assets"
2022/06/30  00:00:00,Johor speaker Puad Zakarshi offers to sue Dr Mahathir RM3b over Pulau Batu Puteh issue
2022/06/30  00:00:00,The making and breaking of Maha Vikas Aghadi: Timeline
2022/06/30  00:00:00,Penny Wong returns to Malaysian home town in South-East Asia soft power push
2022/06/30  00:00:00,"IIOJK witnesses 191 killing, 72 military operations since Jan 2022"
2022/06/30  00:00:00,New witness statements and DNA technology lie behind Sophie Tuscan du Plantier case review
2022/06/30  00:00:00,Former aide: Trump was told protesters had weapons on Jan. 6
2022/06/30  00:00:00,LVMH buys Napa Valleys Joseph Phelps Vineyards
2022/06/30  00:00:00,Uddhav Thackeray: Reluctant Chief Minister Whose Tenure Cut Short By Rebellion
2022/06/30  00:00:00,Ukrainian troops getting weapons training in UK
2022/06/30  00:00:00,Theres a Raging Bull headed to Victoria
2022/06/30  00:00:00,State sets public meeting on Birth Center closing
2022/06/30  00:00:00,Lawmaker: Time running out to end Russias blockade of Ukraines food
2022/06/30  00:00:00,Indigenous Brazilians' legal fight for Amazon
2022/06/30  00:00:00,"Stitt requests audit, Hofmeister requests law enforcement investigation and school land office secretary's resignation"
2022/06/30  00:00:00,"Coronavirus / Very small number of Covid hospital admissions, NHS chief says"
2022/06/30  00:00:00,Editorial: Please  leave fireworks to the professionals
2022/06/30  00:00:00,Samsung is preparing a budget foldable smartphone under $800
2022/06/30  00:00:00,Blood money: Europes secretive trade in Syrian phosphates
2022/06/30  00:00:00,Digital Bridge: Policing the metaverse  Kids online safety  Digital tax next steps
2022/06/30  00:00:00,Netanyahu's trial amid the Israeli election campaign
2022/06/30  00:00:00,"Update on Patent Office Rulings Against Bright Data Patents, Impacts Data-as-a-Service and Proxy Products"
2022/06/30  00:00:00,Myanmar fighter jet crosses into Thailand's air space in Tak
2022/06/30  00:00:00,Analysis-Saudi Arabia walks oil policy tightrope between Biden and Putin
2022/06/30  00:00:00,"Editorial cartoon for June 30, 2022"
2022/06/30  00:00:00,PM Narendra Modi addresses Udyami Bharat Programme in New Delhi; Launches several schemes and programmes and Distributes National MSME Awards
2022/06/30  00:00:00,Ecclestone would 'take a bullet' for Putin
2022/06/30  00:00:00,Minbos and Stamicarbon sign MoU on green ammonia
2022/06/30  00:00:00,Honduras: Rights Agenda for the Castro Administration
2022/06/30  00:00:00,Price caps for Russian oil imports far from imminent: Germany to EU
2022/06/30  00:00:00,Transworld Group: The one-stop solution for shipping and logistics services
2022/06/30  00:00:00,Candles in the Dark: LUMS and IBA
2022/06/30  00:00:00,Iranian Border Guards Wound An Afghan Child In A Border Clash
2022/06/30  00:00:00,Rabbi Ruvi New: Combing the beaches for Chabad from Bondi to Boca
2022/06/30  00:00:00,"Memphis People in Business: June 30, 2022"
2022/06/30  00:00:00,JCT's Tal Campus for Women: The dream of Stuart Hershkowitz
2022/06/30  00:00:00,"Lavrov, Makei hold talks in Minsk"
2022/06/30  00:00:00,NIA To Bring Udaipur Murder Accused Duo To Delhi
2022/06/30  00:00:00,"July streaming picks: Canadian drama 'Scarborough,' Neil Patrick Harris's 'Uncoupled'"
2022/06/30  00:00:00,Analysis-Saudi Arabia walks oil policy tightrope between Biden and Putin
2022/06/30  00:00:00,Gorbea defends fundraiser hosted by oil lobbyist who's given to other RI Dems
2022/06/30  00:00:00,Blood money: Europes secretive trade in Syrian phosphates
2022/06/30  00:00:00,Vietnam Warily Weighs A China Base In Cambodia
2022/06/30  00:00:00,Art House arising on Helena College campus
2022/06/30  00:00:00,Editorial: Please  leave fireworks to the professionals
2022/06/30  00:00:00,Johor speaker Puad Zakarshi offers to sue Dr Mahathir RM3b over Pulau Batu Puteh issue
2022/06/30  00:00:00,TTP Reiterates Demand for Reversal of FATA Merger with KP
2022/06/30  00:00:00,"Azerbaijan, Turkiye Discuss Cooperation In Various Sectors Of Economy"
2022/06/30  00:00:00,P.M. Sharif Stresses on Economic Cooperation in Meeting with Chinese Official
2022/06/30  00:00:00,Briefs: Open house enrollment event slated at OSU Marion
2022/06/30  00:00:00,Lola Tillyaeva (Till) and Timur Tillyaev's You Are Not Alone Foundation resumes life-saving surgeries as the Covid pandemic subsides   USA - English      France - Franais
2022/06/30  00:00:00,"ALEIA, LAUM and Omexom Launch the AUTEND Project to Accelerate Nuclear Power Plant Inspections With Artificial Intelligence"
2022/06/30  00:00:00,Rabbi Ruvi New: Combing the beaches for Chabad from Bondi to Boca
2022/06/30  00:00:00,Report estimates cost to insure undocumented Connecticut residents
2022/06/30  00:00:00,Myanmar fighter jet crosses into Thailand's air space in Tak
2022/06/30  00:00:00,India conducts flight test of high-speed expendable aerial target Abhyas
2022/06/30  00:00:00,"July streaming picks: Canadian drama 'Scarborough,' Neil Patrick Harris's 'Uncoupled'"
2022/06/30  00:00:00,Iranian Border Guards Wound An Afghan Child In A Border Clash
2022/06/30  00:00:00,"MoD of Russia Report June 29, 2022"
2022/06/30  00:00:00,Melton residents living in a doctor desert
2022/06/30  00:00:00,"Brookfield pays $140m to get back inside AGL Energy, Groks heads"
2022/06/30  00:00:00,Elbit Systems to supply Lizard modular kits to Asia-Pacific nation
2022/06/30  00:00:00,Westminster raids Welsh Government funds to pay for military aid for Ukraine
2022/06/30  00:00:00,Ukrainian troops getting weapons training in UK
2022/06/30  00:00:00,Lawmaker: Time running out to end Russias blockade of Ukraines food
2022/06/30  00:00:00,Briefs: Open house enrollment event slated at OSU Marion
2022/06/30  00:00:00,"Editorial cartoon for June 30, 2022"
2022/06/30  00:00:00,Red Cross winding down supports for Ukrainian arrivals at Edmonton airport
2022/06/30  00:00:00,Blood money: Europes secretive trade in Syrian phosphates
2022/06/30  00:00:00,Ukrainian Aviation Strikes Enemy Ammo And Weapons Depots
2022/06/30  00:00:00,Johnson City Schools offers internships to students
2022/06/30  00:00:00,"Paving work underway in Anderson, Madison County"
2022/06/30  00:00:00,OPINION | BLAKE RUTHERFORD: A step backward
2022/06/30  00:00:00,Luxembourg PMs same-sex husband seated next to Viktor Orbn at summit
2022/06/30  00:00:00,Swiggy Offers $23 Million Liquidity For Employees With Stock Options Plan
2022/06/30  00:00:00,"From near and far, visitors return to Yellowstone National Park"
2022/06/30  00:00:00,Avelo Airlines New Orlando Base Takes Flight
2022/06/30  00:00:00,"Former, sitting MPs' train travel bill Rs 62 cr in past 5 years, Rs 2.5 cr in Covid-hit 20-21: RTI"
2022/06/30  00:00:00,Digital Bridge: Policing the metaverse  Kids online safety  Digital tax next steps
2022/06/30  00:00:00,Contractor says Panthers should be on hook for failed Rock Hill facility
2022/06/30  00:00:00,Amazon leaks the Nothing (1) phone's midrange price
2022/06/30  00:00:00,Delta guber: Senator Omo-Agege announces running mate
2022/06/30  00:00:00,"3 Red Hook, NY Teenagers Save Drowning Teen on Cape Cod"
2022/06/30  00:00:00,Vietnam Warily Weighs A China Base In Cambodia
2022/06/30  00:00:00,HINES SETS NET ZERO GOAL ACROSS ALL BUILDINGS BY 2040 WITHOUT BUYING OFFSETS
2022/06/30  00:00:00,"Readers comment on the school district's backpack policy, anti-LGBTQ discrimination, more"
2022/06/30  00:00:00,New witness statements and DNA technology lie behind Sophie Tuscan du Plantier case review
2022/06/30  00:00:00,Blood money: Europes secretive trade in Syrian phosphates
2022/06/30  00:00:00,States medical officer ties school openings to COVID vaccinations
2022/06/30  00:00:00,BYD sees Hefei plants first vehicle come off line
2022/06/30  00:00:00,GAC Group-backed chip supplier CanSemi bags RMB4.5 billion
2022/06/30  00:00:00,Ben & Jerry's to be sold in illegal Israeli settlements against company's will following Unilever decision
2022/06/30  00:00:00,Video conference shares Xinjiang stories with Jordanian guests
2022/06/30  00:00:00,Chinese vice president puts forward 4-point proposal on developing China-Philippines ties
2022/06/30  00:00:00,U.S.-led task force freezes $30B of oligarchs wealth
2022/06/30  00:00:00,UK Prime Minister's Special Envoy for Girls' Education visits Jordan
2022/06/30  00:00:00,Swoop takes off from Comox with new non-stop service to Edmonton
2022/06/30  00:00:00,JCT's Tal Campus for Women: The dream of Stuart Hershkowitz
2022/06/30  00:00:00,"MoD of Russia Report June 29, 2022"
2022/06/30  00:00:00,Vietnam Warily Weighs A China Base In Cambodia
2022/06/30  00:00:00,Russia Withdraws from Ukraine's Snake Island
2022/06/30  00:00:00,Teddy and the Rough Riders Streamline Their Sound on Margo Price-Produced LP
2022/06/30  00:00:00,"3D Cell Culture Market Key Players : Corning Incorporated, Synthecon, Inc. Merck KGaA, Becton"
2022/06/30  00:00:00,Lasse Laukkarinen Claims The Festival Tallinn Main Event Day 1B Chip Lead
2022/06/30  00:00:00,DTE impersonators drained Rochester Hills woman's checking account using Zelle app
2022/06/30  00:00:00,Iranian Border Guards Wound An Afghan Child In A Border Clash
2022/06/30  00:00:00,Red Cross winding down supports for Ukrainian arrivals at Edmonton airport
2022/06/30  00:00:00,The making and breaking of Maha Vikas Aghadi: Timeline
2022/06/30  00:00:00,US Navy awards contract modifications for two T-AO oilers and ESB ship
2022/06/30  00:00:00,Service Supplier visa (Global Business Mobility)
2022/06/30  00:00:00,Briefs: Open house enrollment event slated at OSU Marion
2022/06/30  00:00:00,News Briefs: Women's Connection to meet July 12
2022/06/30  00:00:00,Luxembourg PMs same-sex husband seated next to Viktor Orbn at summit
2022/06/30  00:00:00,Poland Completes Anti-Migrant Belarus Border Wall
2022/06/30  00:00:00,"Courtesy call by Minister of State in the Ministry of Foreign Affairs and International Cooperation in the United Arab Emirates, Sheikh Shakhboot Nahyan Al Nahyan, on President Wavel Ramkalawan   |30 June 2022"
2022/06/30  00:00:00,PM meeting with President Yoon: 30 June 2022
2022/06/30  00:00:00,TTP chief says Pakistan side in talks being led by Peshawar Corps Commander
2022/06/30  00:00:00,Avery Research Center receives MLK speech and other donated items
2022/06/30  00:00:00,"Ireland's sailing, boating & maritime magazine"
2022/06/30  00:00:00,Buffer zone: KCBC delegation meets Kerala Chief Minister Pinarayi Vijayan
2022/06/30  00:00:00,Russia Withdraws from Ukraine's Snake Island
2022/06/30  00:00:00,"OPSC Interview Schedule 2022 (Released) for Assistant Professor (English) Post @opsc.gov.in, Download PDF"
2022/06/30  00:00:00,University of Manchester twins with Ukrainian counterpart
2022/06/30  00:00:00,Origin Of Virus Variation: Real-Time Evolution Of SARS-CoV-2 In An Immunocompromised Patient
2022/06/30  00:00:00,"US Govt calls TikTok a Chinese spyware, asks Apple and Google to remove app from app store"
2022/06/30  00:00:00,P.M. Sharif Stresses on Economic Cooperation in Meeting with Chinese Official
2022/06/30  00:00:00,Ben & Jerrys criticises deal that will resume sales in occupied territories
2022/06/30  00:00:00,3 Red-Hot Stocks to Buy for the Long Haul
2022/06/30  00:00:00,The Era Of Patient Gathered Health Data
2022/06/30  00:00:00,ESCAPED OWL RECAPTURED BY WISCONSIN ZOO AFTER BREAK-IN
2022/06/30  00:00:00,News Briefs: Women's Connection to meet July 12
2022/06/30  00:00:00,UN experts on arbitrary detention to conduct official visit: Botswana
2022/06/30  00:00:00,"Nigerias Secret Police, DSS Clear Ebonyi PDP Spokesperson Queried Over Biafra-themed Cake"
2022/06/30  00:00:00,The making and breaking of Maha Vikas Aghadi: Timeline
2022/06/30  00:00:00,Letter from Human Rights Watch to President Xiomara Castro
2022/06/30  00:00:00,Split in Stance Over Roe v. Wade Reversal Among Corporate Executives
2022/06/30  00:00:00,"UCHICAGO MEDICINE, SINAI JOIN CHICAGO ARC AS HEALTHCARE PARTNERS FOR HEALTH EQUITY INNOVATION"
2022/06/30  00:00:00,When public servants and Qantas did their jobs
2022/06/30  00:00:00,MidAmerica National Bank raises funds for Canton fireworks
2022/06/30  00:00:00,Candles in the Dark: LUMS and IBA
2022/06/30  00:00:00,MAYA Capital closes second fund with $100M for early-stage Latin American startups
2022/06/30  00:00:00,TTP chief says Pakistan side in talks being led by Peshawar Corps Commander
2022/06/30  00:00:00,Hunton Andrews Kurth Expands Energy and Infrastructure Team with Addition of Counsel Christian Rudloff
2022/06/30  00:00:00,"THURS: Customer rates fuel debate around New Mexico power plant, + More"
2022/06/30  00:00:00,this company extracts dead peoples tattoos and preserves them into framed artworks
2022/06/30  00:00:00,"BJP's Devendra Fadnavis Goes From ""Not In Government"" To Eknath Shinde's Deputy"
2022/06/30  00:00:00,Digital Bridge: Policing the metaverse  Kids online safety  Digital tax next steps
2022/06/30  00:00:00,University of Manchester twins with Ukrainian counterpart
2022/06/30  00:00:00,"Ireland's sailing, boating & maritime magazine"
2022/06/30  00:00:00,The making and breaking of Maha Vikas Aghadi: Timeline
2022/06/30  00:00:00,Ben & Jerry's to be sold in illegal Israeli settlements against company's will following Unilever decision
2022/06/30  00:00:00,PM Narendra Modi addresses Udyami Bharat Programme in New Delhi; Launches several schemes and programmes and Distributes National MSME Awards
2022/06/30  00:00:00,3 Types Of Product Development Outsourcing Compared
2022/06/30  00:00:00,D. R. Bahlman: Round and round we go 
2022/06/30  00:00:00,Govt to routinely evaluate development in FMD situation
2022/06/30  00:00:00,Feds making $1B available to reconnect communities where highways left their mark
2022/06/30  00:00:00,Honduras: Rights Agenda for the Castro Administration
2022/06/30  00:00:00,George Wajackoyah's manifesto: Here are his ten salient points
2022/06/30  00:00:00,Avery Research Center receives MLK speech and other donated items
2022/06/30  00:00:00,Facebook statements aim to put courthouse altercation to rest
2022/06/30  00:00:00,Poland Completes Anti-Migrant Belarus Border Wall
2022/06/30  00:00:00,BYD sees Hefei plants first vehicle come off line
2022/06/30  00:00:00,Buffer zone: KCBC delegation meets Kerala Chief Minister Pinarayi Vijayan
2022/06/30  00:00:00,"OPSC Interview Schedule 2022 (Released) for Assistant Professor (English) Post @opsc.gov.in, Download PDF"
2022/06/30  00:00:00,News Briefs: Women's Connection to meet July 12
2022/06/30  00:00:00,Indonesia invites Ukraine to G20 foreign ministers' meeting
2022/06/30  00:00:00,3 Red-Hot Stocks to Buy for the Long Haul
2022/06/30  00:00:00,My side of the story: On Yiddish food and a bar mitzvah
2022/06/30  00:00:00,Penny Wong returns to Malaysian home town in South-East Asia soft power push
2022/06/30  00:00:00,"Ireland's sailing, boating & maritime magazine"
2022/06/30  00:00:00,"Construction, improvements topics of Continental meeting"
2022/06/30  00:00:00,The making and breaking of Maha Vikas Aghadi: Timeline
2022/06/30  00:00:00,China's Xi says Hong Kong has 'risen from the ashes'
2022/06/30  00:00:00,Danes search Bahrain Victorious riders hotel ahead of Tour
2022/06/30  00:00:00,Cassidy Hutchinson and a Story from Ancient Syria
2022/06/30  00:00:00,Constitutional Court to decide on same-sex marriages
2022/06/30  00:00:00,"July streaming picks: Canadian drama 'Scarborough,' Neil Patrick Harris's 'Uncoupled'"
2022/06/30  00:00:00,"Sweden to provide Ukraine with anti-tank weapons, support weapons, demining equipment worth SEK 500 mln"
2022/06/30  00:00:00,Andhra Pradesh: BJP MLC calls withdrawal of money from GPF accounts a daylight robbery
2022/06/30  00:00:00,"Resurection, How Guithele Ruiz Nicholas found life after death"
2022/06/30  00:00:00,UK Prime Minister's Special Envoy for Girls' Education visits Jordan
2022/06/30  00:00:00,Three Gazprom liquefied natural gas tankers have been seized by Germany for an indefinite period of time
2022/06/30  00:00:00,ESCAPED OWL RECAPTURED BY WISCONSIN ZOO AFTER BREAK-IN
2022/06/30  00:00:00,IDAI alerts parents on MIS-C after COVID-19 infection
2022/06/30  00:00:00,Honduras: Rights Agenda for the Castro Administration
2022/06/30  00:00:00,Poland Completes Anti-Migrant Belarus Border Wall
2022/06/30  00:00:00,Indonesia invites Ukraine to G20 foreign ministers' meeting
2022/06/30  00:00:00,Biden mistakes Sweden for SWITZERLAND at NATO press conference before taking questions from reporters on prepared list
2022/06/30  00:00:00,Govt to routinely evaluate development in FMD situation
2022/06/30  00:00:00,Steve Mulroy tackles his biggest cause yet: Running for Shelby County District Attorney General
2022/06/30  00:00:00,Russian Ambassador calls on Foreign Minister Peiris
2022/06/30  00:00:00,The three alternative school year dates suggested for Wales
2022/06/30  00:00:00,GOP rep accuses Boebert of wanting a Christian Taliban
2022/06/30  00:00:00,Organ harvesting: Ekweremadu appears in court as UK considers transferring case to Nigeria
2022/06/30  00:00:00,Unilever sells local Ben & Jerrys business to Israeli firm
2022/06/30  00:00:00,Letter from Human Rights Watch to President Xiomara Castro
2022/06/30  00:00:00,UN experts on arbitrary detention to conduct official visit: Botswana
2022/06/30  00:00:00,Government of Canada announces spectrum auction rules supporting high-quality and affordable wireless services  Franais
2022/06/30  00:00:00,Makei: Iron Curtain is taking shape
2022/06/30  00:00:00,NIA To Bring Udaipur Murder Accused Duo To Delhi
2022/06/30  00:00:00,Russia Withdraws from Ukraine's Snake Island
2022/06/30  00:00:00,2 Whitmer kidnap suspects back in court with a request: Let us go
2022/06/30  00:00:00,New Zealand Designates US Proud Boys Terrorist Group
2022/06/30  00:00:00,Three Gazprom liquefied natural gas tankers have been seized by Germany for an indefinite period of time
2022/06/30  00:00:00,PM Narendra Modi addresses Udyami Bharat Programme in New Delhi; Launches several schemes and programmes and Distributes National MSME Awards
2022/06/30  00:00:00,"Governor Edwards, State, and Local Leaders Break Ground on Phase II of LA-1 Improvement Project"
2022/06/30  00:00:00,"Medical Marijuana, Inc. Subsidiary Kannaway Hosts Regional Conference in South Africa"
2022/06/30  00:00:00,Consultant: Environmental studies  next step in bridge location choice
2022/06/30  00:00:00,"July streaming picks: Canadian drama 'Scarborough,' Neil Patrick Harris's 'Uncoupled'"
2022/06/30  00:00:00,Steps on to form a road on the eastern bund of Koraiyar
2022/06/30  00:00:00,George Wajackoyah's manifesto: Here are his ten salient points
2022/06/30  00:00:00,Iranian Border Guards Wound An Afghan Child In A Border Clash
2022/06/30  00:00:00,LVMH buys Napa Valleys Joseph Phelps Vineyards
2022/06/30  00:00:00,"Courtesy call by Minister of State in the Ministry of Foreign Affairs and International Cooperation in the United Arab Emirates, Sheikh Shakhboot Nahyan Al Nahyan, on President Wavel Ramkalawan   |30 June 2022"
2022/06/30  00:00:00,On the Move: 30 June 2022
2022/06/30  00:00:00,This Girls Life: On Growing Up Trans in Texas
2022/06/30  00:00:00,Briefs: Open house enrollment event slated at OSU Marion
2022/06/30  00:00:00,Unilever sells local Ben & Jerrys business to Israeli firm
2022/06/30  00:00:00,Buffer zone: KCBC delegation meets Kerala Chief Minister Pinarayi Vijayan
2022/06/30  00:00:00,GOP rep accuses Boebert of wanting a Christian Taliban
2022/06/30  00:00:00,University of Manchester twins with Ukrainian counterpart
2022/06/30  00:00:00,Poland Completes Anti-Migrant Belarus Border Wall
2022/06/30  00:00:00,Rabbi Ruvi New: Combing the beaches for Chabad from Bondi to Boca
2022/06/30  00:00:00,New York Woman Hung Hudson Valley Child Over Fire Escape Railing
2022/06/30  00:00:00,THE BANK OF LONDON APPOINTS TAM HOLMES AS CO-PRESIDENT & GROUP CHIEF PRODUCT OFFICER
2022/06/30  00:00:00,Across China: Conservation of breeding habitat for migratory birds
2022/06/30  00:00:00,Indian Time - A Voice from the Eastern Door
2022/06/30  00:00:00,Video conference shares Xinjiang stories with Jordanian guests
2022/06/30  00:00:00,2 Whitmer kidnap suspects back in court with a request: Let us go
2022/06/30  00:00:00,George Wajackoyah's manifesto: Here are his ten salient points
2022/06/30  00:00:00,President Xi meets CPPCC National Committee Vice Chairman Leung Chun-ying
2022/06/30  00:00:00,DRC: Vital Kamerhe met Flix Tshisekedi after his acquittal
2022/06/30  00:00:00,Johnson City Schools offers internships to students
2022/06/30  00:00:00,Portland Man Builds Dummies for Ventriloquists Around The World
