date,title
2022/07/03  00:00:00,Historic Bumbleberry business near Zion National Park returns from the ashes
2022/07/03  00:00:00,201 animal cubs of 43 species in Beijing Zoo start to meet public
2022/07/03  00:00:00,Around the world in 40 days: The PM and top ministers overseas blitz
2022/07/03  00:00:00,"Maryland, Virginia govs respond to letter from Supreme Court marshal calling on them to protect justices"
2022/07/03  00:00:00,Daphne du Maurier: Novelist who traced past to a French debtors' jail
2022/07/03  00:00:00,Rupert Murdoch sent Jerry Hall email to say marriage was at an end
2022/07/03  00:00:00,Supreme Court marshal asked Maryland and Virginia governors to protect justices. Heres what they said.
2022/07/03  00:00:00,Ukrainians: We Cannot Pause Our Lives'
2022/07/03  00:00:00,WILL THAULT: Freedom Month Part 1: Freedom of Speech
2022/07/03  00:00:00,GLOBALink | China-Laos Railway transit yard put into operation for transporting goods to Thailand
2022/07/03  00:00:00,ASHLAND MEMORIES: Surveyors go 'tick tuck' all day long
2022/07/03  00:00:00,Google to erase more location info as abortion bansexpand
2022/07/03  00:00:00,Maharashtra: Sena vs Sena battle hots up with separate whips for speaker poll
2022/07/03  00:00:00,Dust off the Commonwealth SG elections
2022/07/03  00:00:00,"Buhari travels 11 times in five months, returns from Portugal"
2022/07/03  00:00:00,Google says it will delete the location history for visitors to US abortion clinics
2022/07/03  00:00:00,Native Americans Describe the Rez Accent
2022/07/03  00:00:00,Lukashenko reportedly says Belarus intercepted attempted missile strikes by Ukraine
2022/07/03  00:00:00,Ukraine: The teachers swapping classrooms for trenches
2022/07/03  00:00:00,Airplane cabin innovations from saunas to sleeping pods
2022/07/03  00:00:00,Prophet row: Jamaat-e-Islami Hind seeks Nupur Sharma's arrest
2022/07/03  00:00:00,"Flogging a thief, AK-47 poser, flaunting a stolen BMW"
2022/07/03  00:00:00,'Five Days Of ED Probe A Medal...': Rahul Gandhi Alleges BJP-CPI(M) 'Understanding' In Kerala
2022/07/03  00:00:00,Daphne du Maurier: Novelist who traced past to a French debtors' jail
2022/07/03  00:00:00,Musings at the Threshold of the Next Dimension
2022/07/03  00:00:00,Kids Grow Green Campers stop to study the flowers at Sweet Briar College
2022/07/03  00:00:00,"Founders Of Duarte Inc, Meylah, Kaya17, And Etha Share Their Stories On The Industry Show"
2022/07/03  00:00:00,WILL THAULT: Freedom Month Part 1: Freedom of Speech
2022/07/03  00:00:00,Israeli show creators attend int'l television conference
2022/07/03  00:00:00,Sheffield Hallam drops English literature course over graduate job prospects
2022/07/03  00:00:00,"Sidharth Malhotra, Chris Patt talk about 'fart breaks' during their recent interaction"
2022/07/03  00:00:00,Dust off the Commonwealth SG elections
2022/07/03  00:00:00,India hands over 50-bedded hospital to Tajikistan
2022/07/03  00:00:00,"Buhari travels 11 times in five months, returns from Portugal"
2022/07/03  00:00:00,Maharashtra: Sena vs Sena battle hots up with separate whips for speaker poll
2022/07/03  00:00:00,"As COVID hospitalisations soar, France recommends return to masks"
2022/07/03  00:00:00,Google says it will delete the location history for visitors to US abortion clinics
2022/07/03  00:00:00,Zelensky's Advisor Admits Key Eastern Ukraine City Could Fall
2022/07/03  00:00:00,FRIM joins IUCN firefly conservation efforts
2022/07/03  00:00:00,Supreme Court marshal asked Maryland and Virginia governors to protect justices. Heres what they said.
2022/07/03  00:00:00,"Flogging a thief, AK-47 poser, flaunting a stolen BMW"
2022/07/03  00:00:00,Getting youths ready for the polls
2022/07/03  00:00:00,Musings at the Threshold of the Next Dimension
2022/07/03  00:00:00,WILL THAULT: Freedom Month Part 1: Freedom of Speech
2022/07/03  00:00:00,"On Supreme Court's Remarks On Nupur Sharma, Law Minister Says This"
2022/07/03  00:00:00,"""Images of America: Glen Allen"" pictorial history of Rapidan writer's girlhood town"
2022/07/03  00:00:00,Ukraine: The teachers swapping classrooms for trenches
2022/07/03  00:00:00,"Google to delete location history for visits to abortion clinics, counseling centers and other personal places"
2022/07/03  00:00:00,GLOBALink | China-Laos Railway transit yard put into operation for transporting goods to Thailand
2022/07/03  00:00:00,"Buhari travels 11 times in five months, returns from Portugal"
2022/07/03  00:00:00,Lebanon's Hezbollah flies drones to Mediterranean gas field
2022/07/03  00:00:00,LWV of Maryland provides voter education tool VOTE411
2022/07/03  00:00:00,More than 200 Fort Bragg paratroopers to return from Poland Sunday
2022/07/03  00:00:00,Maharashtra: Sena vs Sena battle hots up with separate whips for speaker poll
2022/07/03  00:00:00,Lukashenko reportedly says Belarus intercepted attempted missile strikes by Ukraine
2022/07/03  00:00:00,ARTS AND HUMANITIES: Art exhibition focuses on democracy
2022/07/03  00:00:00,Waco gets medical cannabis pickup site
2022/07/03  00:00:00,Ukrainians: We Cannot Pause Our Lives'
2022/07/03  00:00:00,Zelensky's Advisor Admits Key Eastern Ukraine City Could Fall
2022/07/03  00:00:00,Dust off the Commonwealth SG elections
2022/07/03  00:00:00,Airplane cabin innovations from saunas to sleeping pods
2022/07/03  00:00:00,Google says it will delete location history data of users visiting abortion clinics
2022/07/03  00:00:00,Leaders of print at BMPAs Vision Conclave - The Noel DCunha Sunday Column
2022/07/03  00:00:00,"Founders Of Duarte Inc, Meylah, Kaya17, And Etha Share Their Stories On The Industry Show"
2022/07/03  00:00:00,"Flogging a thief, AK-47 poser, flaunting a stolen BMW"
2022/07/03  00:00:00,Tiger Shroff to roar in Portugal
2022/07/03  00:00:00,"Buhari travels 11 times in five months, returns from Portugal"
2022/07/03  00:00:00,"Woman brought baby, stash of drugs to Florida prison visit"
2022/07/03  00:00:00,"Maryland, Virginia govs respond to letter from Supreme Court marshal calling on them to protect justices"
2022/07/03  00:00:00,"The Global Awards for Afrobeats Music, The Headie Awards, Hosts U.S. Launch Event in Hollywood 						 						 							 							 								  													USA - English 													     															USA - English"
2022/07/03  00:00:00,Supreme Court marshal asked Maryland and Virginia governors to protect justices. Heres what they said.
2022/07/03  00:00:00,Robin Richmond Mason: Looking for a loser
2022/07/03  00:00:00,Lukashenko reportedly says Belarus intercepted attempted missile strikes by Ukraine
2022/07/03  00:00:00,ASHLAND MEMORIES: Surveyors go 'tick tuck' all day long
2022/07/03  00:00:00,FRIM joins IUCN firefly conservation efforts
2022/07/03  00:00:00,Texas A&M Forest Service encourages caution this Fourth of July weekend
2022/07/03  00:00:00,Around the world in 40 days: The PM and top ministers overseas blitz
2022/07/03  00:00:00,Pima County launches 70 free internet hot spots in Tucson area
2022/07/03  00:00:00,Leaders of print at BMPAs Vision Conclave - The Noel DCunha Sunday Column
2022/07/03  00:00:00,More than 200 Fort Bragg paratroopers to return from Poland Sunday
2022/07/03  00:00:00,Report: Some in Cabinet standing in way of anti-hopping legislation
2022/07/03  00:00:00,Ted Walker: 'We all stood up' for freedom
2022/07/03  00:00:00,"Buhari travels 11 times in five months, returns from Portugal"
2022/07/03  00:00:00,Native Americans Describe the Rez Accent
2022/07/03  00:00:00,Prophet row: Jamaat-e-Islami Hind seeks Nupur Sharma's arrest
2022/07/03  00:00:00,Prince Harry 'insists' that Netflix drama The Crown does not reach Megxit saga
2022/07/03  00:00:00,"Drought, Wildfire Danger Nix Some US July 4 Fireworks"
2022/07/03  00:00:00,WABE's Week In Review: More Roe impact in Georgia and a review of the new state voting laws in 2022
2022/07/03  00:00:00,GLOBALink | China-Laos Railway transit yard put into operation for transporting goods to Thailand
2022/07/03  00:00:00,ASHLAND MEMORIES: Surveyors go 'tick tuck' all day long
2022/07/03  00:00:00,Google to delete user location history on US abortion clinic visits
2022/07/03  00:00:00,Biden invites Bongbong Marcos to Washington
2022/07/03  00:00:00,"COVID-19 in Shanghai: 2 local cases, 12 imported infections"
2022/07/03  00:00:00,Seabirds and the struggle against marine debris in the Gulf of Maine
2022/07/03  00:00:00,Political elite planning to deny Igbo presidency  Ohanaeze
2022/07/03  00:00:00,3 districts chosen for cluster-based forest fire prevention pilot
2022/07/03  00:00:00,"Maryland, Virginia govs respond to letter from Supreme Court marshal calling on them to protect justices"
2022/07/03  00:00:00,Ted Walker: 'We all stood up' for freedom
2022/07/03  00:00:00,"For now, wary US treads water with transformed COVID-19"
2022/07/03  00:00:00,Women pull Subhadras chariot in Baripada
2022/07/03  00:00:00,"New Zealand reports 4,924 community cases of COVID-19"
2022/07/03  00:00:00,"Founders Of Duarte Inc, Meylah, Kaya17, And Etha Share Their Stories On The Industry Show"
2022/07/03  00:00:00,Back to Country: Henry Atkinson to participate in National Resting Place talks
2022/07/03  00:00:00,Senate to probe ex-CJN after recess
2022/07/03  00:00:00,Prince Harry 'insists' that Netflix drama The Crown does not reach Megxit saga
2022/07/03  00:00:00,"Wyden speaks at Bend Planned Parenthood, clinic expects influx of patients seeking abortions"
2022/07/03  00:00:00,Chinese Government Edits Thor: Love and Thunder to Cut Thors 20-Minute Speech About China Being an Impotent Military Force
2022/07/03  00:00:00,Jharkhand Health Minister Donates Blood To Patient During Hospital Visit
2022/07/03  00:00:00,Imo urges calm over military presence
2022/07/03  00:00:00,Maharashtra: Sena vs Sena battle hots up with separate whips for speaker poll
2022/07/03  00:00:00,"COVID-19 in Shanghai: 2 local cases, 12 imported infections"
2022/07/03  00:00:00,"Prisoner grabs San Diego deputy's gun, fires round inside Scripps Mercy Hospital"
2022/07/03  00:00:00,The Women Who Leave Anti-Abortion Picket Lines to Get Abortions
2022/07/03  00:00:00,"'Walker: Independence' replaces canceled 'Roswell, New Mexico' at Santa Fe Studios"
2022/07/03  00:00:00,NSUI holds dharna seeking bus shelters
2022/07/03  00:00:00,BJP's Smriti Irani lashes out at Telangana CM KCR for snubbing PM Modi
2022/07/03  00:00:00,Chennai: AIADMK rift plays out before Droupadi Murmu
2022/07/03  00:00:00,Another 'Cassidy Blasey Ford' Claim Appears Headed to the January 6 Committee Dumpster
2022/07/03  00:00:00,"PM Shmyhal Discusses Ukraine's Reconstruction With G7 Ambassadors, Heads Of International Organizations"
2022/07/03  00:00:00,Political elite planning to deny Igbo presidency  Ohanaeze
2022/07/03  00:00:00,Ted Walker: 'We all stood up' for freedom
2022/07/03  00:00:00,This Week in West Virginia History
2022/07/03  00:00:00,Biden invites Bongbong Marcos to Washington
2022/07/03  00:00:00,Tucson to tackle building permit backlog
2022/07/03  00:00:00,UAE-India travel: Airfares rival those of European destinations
2022/07/03  00:00:00,Tiger Shroff to roar in Portugal
2022/07/03  00:00:00,"Revolutionary high court term on abortion, guns and more"
2022/07/03  00:00:00,Maryville College names Fitzgerald director of disability resources
2022/07/03  00:00:00,China coal: fat margins for producers as green energy pauses
2022/07/03  00:00:00,"'Walker: Independence' replaces canceled 'Roswell, New Mexico' at Santa Fe Studios"
2022/07/03  00:00:00,"For now, wary US treads water with transformed COVID-19"
2022/07/03  00:00:00,Senate to probe ex-CJN after recess
2022/07/03  00:00:00,North Korea says US seeking an excuse for an Asian NATO with South Korea and Japan
2022/07/03  00:00:00,NSUI holds dharna seeking bus shelters
2022/07/03  00:00:00,"Land tops William Ruto, Raila Odinga agenda for Coast"
2022/07/03  00:00:00,Business Intel: Ultimate Shine Car Wash
2022/07/03  00:00:00,"$380 Per Barrel: The Likely Price Of Oil If Russia Pulls Its Supplies, Jpmorgan Says"
2022/07/03  00:00:00,Chennai: AIADMK rift plays out before Droupadi Murmu
2022/07/03  00:00:00,Qatar Stresses Active Participation Of Afghan Women In Peace-Making
2022/07/03  00:00:00,Biden invites Bongbong Marcos to Washington
2022/07/03  00:00:00,Another 'Cassidy Blasey Ford' Claim Appears Headed to the January 6 Committee Dumpster
2022/07/03  00:00:00,Big hit: Merson says Tottenham player would flourish at Everton
2022/07/03  00:00:00,Christina Ricci Traded a Hollywood Bungalow for a Brooklyn Townhouse
2022/07/03  00:00:00,Aramis Knight lists similarities he shares with his 'Ms. Marvel' character
2022/07/03  00:00:00,Four observations about the Dobbs decision
2022/07/03  00:00:00,"New, Airline Pilot Club / Skyborne Air Academy Partnership Offers Pathway"
2022/07/03  00:00:00,A PAWA Award for Bukar Usman
2022/07/03  00:00:00,Crown Prince Checks On Readiness Of Civil Defence Department
2022/07/03  00:00:00,Libyan National Army Supports Demands Of Protesters
2022/07/03  00:00:00,US funds software for Russians to slip past censors
2022/07/03  00:00:00,My Take: The Christian 'Taliban' wants to impose their religion on the rest of us
2022/07/03  00:00:00,Education For All Top Priority: Al Nuaimi
2022/07/03  00:00:00,Maryville College names Fitzgerald director of disability resources
2022/07/03  00:00:00,India Hands Over 50-Bedded Hospital To Tajikistan
2022/07/03  00:00:00,American Eagle Credit Card Login & Bills Payment [2022]
2022/07/03  00:00:00,Voting machines tested before and after NM elections
2022/07/03  00:00:00,Kerala RJ and single mother on a solo bike ride across India for defence widows
2022/07/03  00:00:00,Qatar Participates In Transformation Education Pre-Summit In Paris
2022/07/03  00:00:00,CHSL exam: 3 impersonators held during test
2022/07/03  00:00:00,"CM Shinde-camp MLAs, Deputy CM Fadnavis hold meeting in Mumbai"
2022/07/03  00:00:00,The Observer view on Chinas rule over Hong Kong
2022/07/03  00:00:00,Russians Fire Smerch MLRS At Kramatorsk
2022/07/03  00:00:00,"Nigeria, Others Review Political Situation in Mali, Guinea, Burkina Faso"
2022/07/03  00:00:00,UAE-India travel: Airfares rival those of European destinations
2022/07/03  00:00:00,Schreiner University: Global Scholars  program thriving post-COVID
2022/07/03  00:00:00,Syndicate joins regional pub push with $20m Taree deal
2022/07/03  00:00:00,"PM Shmyhal Discusses Ukraine's Reconstruction With G7 Ambassadors, Heads Of International Organizations"
2022/07/03  00:00:00,Anhui reports 61 new confirmed cases
2022/07/03  00:00:00,Xi inspects PLA garrison in Hong Kong
2022/07/03  00:00:00,Toll now at 53 in San Antonio as families wait for answers
2022/07/03  00:00:00,Headstone donated for grave of one-time slave in Alabama
2022/07/03  00:00:00,Group locates Morgan County graves of Revolutionary War veterans
2022/07/03  00:00:00,"Watch: Sidharth Malhotra, Chris Pratt discuss Indian food, 'fart breaks', and more"
2022/07/03  00:00:00,Critics Take A Swipe At The Draft 22Nd Amendment To The Lankan Constitution
2022/07/03  00:00:00,"'They're everywhere': microplastics in oceans, air and human body"
2022/07/03  00:00:00,This Week in West Virginia History
2022/07/03  00:00:00,Hezbollah Sends Drones towards Disputed Field with Israel
2022/07/03  00:00:00,1893 property tax ledger book takes circuitous route home
2022/07/03  00:00:00,Aboubakar Kamara: Olympiacos sign Mauritania striker from Aris Thessaloniki FC
2022/07/03  00:00:00,"Nigeria, Others Review Political Situation in Mali, Guinea, Burkina Faso"
2022/07/03  00:00:00,Voting machines tested before and after NM elections
2022/07/03  00:00:00,Lukashenko says Ukraine fired missiles at Belarus military posts
2022/07/03  00:00:00,Syndicate joins regional pub push with $20m Taree deal
2022/07/03  00:00:00,UAE-India travel: Airfares rival those of European destinations
2022/07/03  00:00:00,Schreiner University: Global Scholars  program thriving post-COVID
2022/07/03  00:00:00,China coal: fat margins for producers as green energy pauses
2022/07/03  00:00:00,MSU inks MoUs with intl varsities
2022/07/03  00:00:00,Robotic fireflies canvassed to aid search-and-rescue operations
2022/07/03  00:00:00,Musk with the Pope: Tech billionaire meets Pontifex
2022/07/03  00:00:00,The Observer view on Chinas rule over Hong Kong
2022/07/03  00:00:00,"Executive board of UNDP, UNFPA & UNOPS visits Bangladesh"
2022/07/03  00:00:00,Anhui reports 61 new confirmed cases
2022/07/03  00:00:00,"Kazakhstan, Latvia Fms Discuss Bilateral Economic Cooperation"
2022/07/03  00:00:00,150 kg of gutkha products seized in Villupuram; one held
2022/07/03  00:00:00,Covid impact: Talent acquisition trends to look at in layoffs era
2022/07/03  00:00:00,"In fire's wake, NM examines its prescribed forest burns"
2022/07/03  00:00:00,Fact-checking The Undeclared War: A hacker could turn off the lights in Putins office
2022/07/03  00:00:00,North Korea suggests balloons flown from South brought COVID-19
2022/07/03  00:00:00,Critics Take A Swipe At The Draft 22Nd Amendment To The Lankan Constitution
2022/07/03  00:00:00,High-speed rail: Ruling allows eminent domain use for project
2022/07/03  00:00:00,Rights groups questions choice of Rome Statute opponent to lead Suhakam
2022/07/03  00:00:00,Uttar Pradesh CM Yogi Adityanath Offers Prayer at BhagyaLaxmi Mandir in Hyderabad (Watch Video)
2022/07/03  00:00:00,"CM Shinde-camp MLAs, Deputy CM Fadnavis hold meeting in Mumbai"
2022/07/03  00:00:00,Education For All Top Priority: Al Nuaimi
2022/07/03  00:00:00,Voting machines tested before and after NM elections
2022/07/03  00:00:00,Out of their own hands: Women of Crete and the German Occupation 1941-1944
2022/07/03  00:00:00,Schreiner University: Global Scholars  program thriving post-COVID
2022/07/03  00:00:00,Armed Forces Tribunal: Stick to choice of United Nations mission or staff college
2022/07/03  00:00:00,Kerala RJ and single mother on a solo bike ride across India for defence widows
2022/07/03  00:00:00,"AP briefs: For now, wary US treads water with transformed COVID-19"
2022/07/03  00:00:00,Visit Of Representatives Of Think Tanks Of Member And Observer Countries Of Organization Of Turkic States To Shusha Began
2022/07/03  00:00:00,Germany sendscaution over Russian oil
2022/07/03  00:00:00,This Week in West Virginia History
2022/07/03  00:00:00,Aboubakar Kamara: Olympiacos sign Mauritania striker from Aris Thessaloniki FC
2022/07/03  00:00:00,Larsson recalls scoring on his United debut
2022/07/03  00:00:00,Hezbollah Sends Drones towards Disputed Field with Israel
2022/07/03  00:00:00,"Ireland's sailing, boating & maritime magazine"
2022/07/03  00:00:00,"NEET UG 2022: NSUI sides with students, pens letter to Education minister"
2022/07/03  00:00:00,Rights groups questions choice of Rome Statute opponent to lead Suhakam
2022/07/03  00:00:00,Qatar and Egypt discuss legal cooperation
2022/07/03  00:00:00,"Azerbaijani, Turkish Units Hold Joint Drills"
2022/07/03  00:00:00,Group locates Morgan County graves of Revolutionary War veterans
2022/07/03  00:00:00,"FSM, US meet on Compact of Free Association negotiations"
2022/07/03  00:00:00,Azerbaijani State Customs Committee To Launch Service Expanding Country's Transit Capabilities
2022/07/03  00:00:00,Critics Take A Swipe At The Draft 22Nd Amendment To The Lankan Constitution
2022/07/03  00:00:00,MSU inks MoUs with intl varsities
2022/07/03  00:00:00,A PAWA Award for Bukar Usman
2022/07/03  00:00:00,State ministry chief gets egg on face after 'eat fewer eggs' comment
2022/07/03  00:00:00,Uttar Pradesh CM Yogi Adityanath Offers Prayer at BhagyaLaxmi Mandir in Hyderabad (Watch Video)
2022/07/03  00:00:00,Toll now at 53 in San Antonio as families wait for answers
2022/07/03  00:00:00,The Observer view on Chinas rule over Hong Kong
2022/07/03  00:00:00,Fact-checking The Undeclared War: A hacker could turn off the lights in Putins office
2022/07/03  00:00:00,"Nigeria, Others Review Political Situation in Mali, Guinea, Burkina Faso"
2022/07/03  00:00:00,Out of their own hands: Women of Crete and the German Occupation 1941-1944
2022/07/03  00:00:00,"Executive board of UNDP, UNFPA & UNOPS visits Bangladesh"
2022/07/03  00:00:00,Robotic fireflies canvassed to aid search-and-rescue operations
2022/07/03  00:00:00,Armed Forces Tribunal: Stick to choice of United Nations mission or staff college
2022/07/03  00:00:00,Guide Who Protected Jewish Youths Against Lynching Arabs near Ariel Reenacts Event for Police
2022/07/03  00:00:00,High-speed rail: Ruling allows eminent domain use for project
2022/07/03  00:00:00,Qatar and Egypt discuss legal cooperation
2022/07/03  00:00:00,Rights groups questions choice of Rome Statute opponent to lead Suhakam
2022/07/03  00:00:00,Families of deceased cops receive N21m cheque in Abia
2022/07/03  00:00:00,MSU inks MoUs with intl varsities
2022/07/03  00:00:00,"Ireland's sailing, boating & maritime magazine"
2022/07/03  00:00:00,Big hit: Merson says Tottenham player would flourish at Everton
2022/07/03  00:00:00,"QFCRA, HBKU's College Of Law Sign Mou"
2022/07/03  00:00:00,"Madhya Pradesh: Woman belonging to primitive tribe set ablaze, filmed"
2022/07/03  00:00:00,A PAWA Award for Bukar Usman
2022/07/03  00:00:00,5.29 min: Noida cops top in response time
2022/07/03  00:00:00,Round four: Aggressive Israel Adesanya lands two-punch combo on Cannonier
2022/07/03  00:00:00,"Executive board of UNDP, UNFPA & UNOPS visits Bangladesh"
2022/07/03  00:00:00,"CM Shinde-camp MLAs, Deputy CM Fadnavis hold meeting in Mumbai"
2022/07/03  00:00:00,"In Shamshera, a masala potboiler and Ranbir Kapoor as never seen before"
2022/07/03  00:00:00,Schreiner University: Global Scholars  program thriving post-COVID
2022/07/03  00:00:00,Fact-checking The Undeclared War: A hacker could turn off the lights in Putins office
2022/07/03  00:00:00,"Man, lover end lives in lodge"
2022/07/03  00:00:00,High-speed rail: Ruling allows eminent domain use for project
2022/07/03  00:00:00,Covid impact: Talent acquisition trends to look at in layoffs era
2022/07/03  00:00:00,U.S. Embassy & Consulate in Kazakhstan
2022/07/03  00:00:00,"Nigeria, Others Review Political Situation in Mali, Guinea, Burkina Faso"
2022/07/03  00:00:00,"In fire's wake, NM examines its prescribed forest burns"
2022/07/03  00:00:00,Voting machines tested before and after NM elections
2022/07/03  00:00:00,Qatar And Egypt Discuss Legal Cooperation
2022/07/03  00:00:00,Students fill backpacks at Food on Foot
2022/07/03  00:00:00,Sterling and Lancaster organists team up to run local Guild of Organists
2022/07/03  00:00:00,2023: Amaechi tells angry APC supporters who to vote
2022/07/03  00:00:00,Sean OMalley vs. Pedro Munhoz Ruled A No-Contest After Eye Poke  UFC 276 Highlights
2022/07/03  00:00:00,"Executive board of UNDP, UNFPA & UNOPS visits Bangladesh"
2022/07/03  00:00:00,"Before he turns off the lights,  Kim Carr has a message for his colleagues"
2022/07/03  00:00:00,Group locates Morgan County graves of Revolutionary War veterans
2022/07/03  00:00:00,Biden has invited Bongbong Marcos to visit US envoy
2022/07/03  00:00:00,Qatar and Egypt discuss legal cooperation
2022/07/03  00:00:00,QIIB launches Personal Finance via its mobile and internet banking
2022/07/03  00:00:00,My Take: The Christian 'Taliban' wants to impose their religion on the rest of us
2022/07/03  00:00:00,A Case For Private Investment In Colombo Airport
2022/07/03  00:00:00,U.S. Embassy & Consulate in Kazakhstan
2022/07/03  00:00:00,"Nigeria, Others Review Political Situation in Mali, Guinea, Burkina Faso"
2022/07/03  00:00:00,Voting machines tested before and after NM elections
2022/07/03  00:00:00,Federal govt ended Sehat cards in ex- FATA
2022/07/03  00:00:00,"In Shamshera, a masala potboiler and Ranbir Kapoor as never seen before"
2022/07/03  00:00:00,"Hezbollah drones 'delivered the message' to Israel, says pro-Iranian media - analysis"
2022/07/03  00:00:00,Lukashenko says Ukraine fired missiles at Belarus military posts
2022/07/03  00:00:00,1893 property tax ledger book takes circuitous route home
2022/07/03  00:00:00,"Watch: Sidharth Malhotra, Chris Pratt discuss Indian food, 'fart breaks', and more"
2022/07/03  00:00:00,Yin Transformation: The Harmonists Newest Perfume
2022/07/03  00:00:00,Group locates Morgan County graves of Revolutionary War veterans
2022/07/03  00:00:00,Larsson recalls scoring on his United debut
2022/07/03  00:00:00,"FSM, US meet on Compact of Free Association negotiations"
2022/07/03  00:00:00,Havasu veterans  |   David Eaton: From submarine school to the Lake Havasu City Police Department
2022/07/03  00:00:00,Chemical removal plant in Chino Hills totals $18 million
2022/07/03  00:00:00,Visit Of Representatives Of Think Tanks Of Member And Observer Countries Of Organization Of Turkic States To Shusha Began
2022/07/03  00:00:00,"Executive board of UNDP, UNFPA & UNOPS visits Bangladesh"
2022/07/03  00:00:00,Land tops William Ruto and Raila Odinga agenda for Coast
2022/07/03  00:00:00,Cops find over 115 pounds of ganja at Abary house -labourer held
2022/07/03  00:00:00,International Atomic Energy Agency Director General visits Australia
2022/07/03  00:00:00,Talal Abu-Ghazaleh Global Takes Part in BITTCOIN-JO Projects' Activities
2022/07/03  00:00:00,High-speed rail: Ruling allows eminent domain use for project
2022/07/03  00:00:00,"Evans Kidero appeals to Uhuru Kenyatta, Raila Odinga for varsity charter"
2022/07/03  00:00:00,Moeldoko views Pesantren as medium to develop national character
2022/07/03  00:00:00,Child Safe Governance Review of Launceston General Hospital and Human Resources
2022/07/03  00:00:00,Counties group debates public records reform
2022/07/03  00:00:00,Rains cover country six days ahead: IMD
2022/07/03  00:00:00,"In Shamshera, a masala potboiler and Ranbir Kapoor as never seen before"
2022/07/03  00:00:00,Hezbollah drones challenge possible Israel-Lebanon deal
