date,title
2022/05/24  00:00:00,"Lackawanna College, Marywood University Sign Agreement"
2022/05/24  00:00:00,Qantas takes a lion's share in TripADeal
2022/05/24  00:00:00,Rolling Stones Exile on Main St.': A Track-by-Track Guide
2022/05/24  00:00:00,"Storm Recovery conversation with David Younger, Clinical Psychologist"
2022/05/24  00:00:00,"At The MACC on Signal Mountain:  The Irish Brothers, Part I"
2022/05/24  00:00:00,Opponents of federal vaccine mandate seekrehearing
2022/05/24  00:00:00,"Weakened by Bernie, partys Finn-ished for controversial Liberal MP"
2022/05/24  00:00:00,"BJP using EC, ED to overthrow CM"
2022/05/24  00:00:00,Local health care providers keep watchful eye of COVID-19 numbers
2022/05/24  00:00:00,"News brief: Biden on Taiwan, monkeypox cases, Ukraine-Polish border"
2022/05/24  00:00:00,Nazanin Zaghari-Ratcliffe says Iranian authorities forced her to sign false confession as condition of release
2022/05/24  00:00:00,Ridgefield's Inventing Sisters - Sophie and Lily Zezula
2022/05/24  00:00:00,Nurse creates mindfulness program geared toward Black women
2022/05/24  00:00:00,Maine State Police Briefs From Troop F  (May 2  22)
2022/05/24  00:00:00,Vicky White and Casey White's Indiana motel room now has waiting list and higher price
2022/05/24  00:00:00,The Clamour for an Amaechi  Presidency
2022/05/24  00:00:00,From Afghanistan's finance minister to cab driver in the US
2022/05/24  00:00:00,"Oren Eini on RavenDB, Including Consistency Guarantees and C# as the Implementation Language"
2022/05/24  00:00:00,Qantas takes a lion's share in TripADeal
2022/05/24  00:00:00,"Azerbaijan, Armenia ready for border delimitation"
2022/05/24  00:00:00,Soil carbon increases under cover crops
2022/05/24  00:00:00,Arsenal planning 25 million offer for Youri Tielemans
2022/05/24  00:00:00,Covid-19: New Zealand to stay at orange traffic light setting - Government
2022/05/24  00:00:00,DGAP-AGM: Multitude SE: Decisions of the Annual General Meeting of Shareholders of Multitude SE
2022/05/24  00:00:00,"Franken meet and greets in Elkader, Fayette on Sunday"
2022/05/24  00:00:00,"Canada considering smallpox vaccine for monkeypox cases, says Dr. Theresa Tam"
2022/05/24  00:00:00,Chipmaker Broadcom's deal history under chief Hock Tan
2022/05/24  00:00:00,Biden Disinfo Board Advisor Michael Chertoff Tied to Soros-Funded Aspen Institute
2022/05/24  00:00:00,USA  Casting Cleaning Resources expanding to Wisconsin
2022/05/24  00:00:00,Long Branch considers legal action against TikTok over party ads
2022/05/24  00:00:00,Local health care providers keep watchful eye of COVID-19 numbers
2022/05/24  00:00:00,SHAREHOLDER ALERT: Pomerantz Law Firm Reminds Shareholders with Losses on their Investment in Credit Suisse Group AG of Class Action Lawsuit and Upcoming Deadline - CS
2022/05/24  00:00:00,Maine State Police Briefs From Troop F  (May 2  22)
2022/05/24  00:00:00,Vicky White and Casey White's Indiana motel room now has waiting list and higher price
2022/05/24  00:00:00,Nazanin Zaghari-Ratcliffe says Iranian authorities forced her to sign false confession as condition of release
2022/05/24  00:00:00,Community Message from Darien First Selectman Monica McNally
2022/05/24  00:00:00,2 bike-borne men snatch DSPs phone
2022/05/24  00:00:00,Chalice Mining stitches up $100m equity deal
2022/05/24  00:00:00,Solomon Islands says Chinas foreign minister to arrive this week to sign pacts
2022/05/24  00:00:00,Hemant inspects Centre of Excellence at Dhurwa school
2022/05/24  00:00:00,IPEF: Modi joins Bidens plank to counter Chinese influence
2022/05/24  00:00:00,Rolling Stones Exile on Main St.': A Track-by-Track Guide
2022/05/24  00:00:00,"Austin, Milley: War end defined by Ukraine, not us"
2022/05/24  00:00:00,"Planned Parenthood CEO, Wife of Soros Partner, on the Board of Private All-Girls School"
2022/05/24  00:00:00,Sarawak submits formula on special grant for review
2022/05/24  00:00:00,"BJP using EC, ED to overthrow CM"
2022/05/24  00:00:00,Three firms bid for supplying 7.5 L MT of imported coal against MP Genco tenders
2022/05/24  00:00:00,Mount Washington Commission continues master plan discussion
2022/05/24  00:00:00,N.Y. State Sen. Alessandra Biaggi to challenge selfish Rep. Sean Patrick Maloney for contentious House seat
2022/05/24  00:00:00,Heads of diplomatic offices of Turkmenistan in Iran visited Golestan province
2022/05/24  00:00:00,"Lackawanna College, Marywood University Sign Agreement"
2022/05/24  00:00:00,Engineering panel told to submit report on OGH
2022/05/24  00:00:00,Oklahoma Democrat Suggests Mandatory Vasectomies After Legislatures Abortion Ban
2022/05/24  00:00:00,Nazanin Zaghari-Ratcliffe says Iranian authorities forced her to sign false confession as condition of release
2022/05/24  00:00:00,Pakistan 'detaining' supporters of Imran Khan ahead of major rally
2022/05/24  00:00:00,AC Milan join Manchester United in Victor Osimhen race
2022/05/24  00:00:00,"Philadelphia school district reinstates mask mandate for students and staff, citing increased COVID-19 cases"
2022/05/24  00:00:00,"WIN OR LOSE, PETER OBI HAS MADE A MARK"
2022/05/24  00:00:00,Avon to evaluate locations for additional emergency sirens in northern communities
2022/05/24  00:00:00,Rolling Stones Exile on Main St.': A Track-by-Track Guide
2022/05/24  00:00:00,Louisiana Legislature approves tenure study task force
2022/05/24  00:00:00,McConnell pressing the Biden administration to fast-track NATO expansion
2022/05/24  00:00:00,Parshottam Rupala visited Brazil from 16th to 20th May 2022
2022/05/24  00:00:00,"Guyana - Dominica To Partner In Corn Production, Youth Shade House Project"
2022/05/24  00:00:00,Arsenal planning 25 million offer for Youri Tielemans
2022/05/24  00:00:00,Governor suggests possible water restrictions for California
2022/05/24  00:00:00,China Brags Repressive Lockdowns Will Keep Monkeypox Out
2022/05/24  00:00:00,Eight Montana affordable rental properties invited to apply for federal Housing Tax Credit
2022/05/24  00:00:00,CM M K Stalin in Salem to open Mettur dam
2022/05/24  00:00:00,"Build a custom email digest by following topics, people, and firms published on JD Supra."
2022/05/24  00:00:00,Valley groups protest extension of Title 42
2022/05/24  00:00:00,"Austin, Milley: War end defined by Ukraine, not us"
2022/05/24  00:00:00,Last call: Final phone booths removed from NYC streets
2022/05/24  00:00:00,"News brief: Biden on Taiwan, monkeypox cases, Ukraine-Polish border"
2022/05/24  00:00:00,Tencent's Pony Ma causes stir with repost of article on China's economy
2022/05/24  00:00:00,Marcos names personalities to key Cabinet posts
2022/05/24  00:00:00,Indiana cities experiment with gunshot detection tools
2022/05/24  00:00:00,Second Harvest of the Big Bend holding diaper drive
2022/05/24  00:00:00,The Clamour for an Amaechi  Presidency
2022/05/24  00:00:00,"Nissan, Mitsubishi to release ultra-small EV"
2022/05/24  00:00:00,IPEF: Modi joins Bidens plank to counter Chinese influence
2022/05/24  00:00:00,Parshottam Rupala visited Brazil from 16th to 20th May 2022
2022/05/24  00:00:00,"Temasek-backed Leapfrog raising $1b fund, IFC may come in as LP"
2022/05/24  00:00:00,Ken Watanabe responds to white savior criticism of Tom Cruise role in The Last Samurai
2022/05/24  00:00:00,"WIN OR LOSE, PETER OBI HAS MADE A MARK"
2022/05/24  00:00:00,ICYMI - Biden and Yellen will discussa review of US tariffs on China
2022/05/24  00:00:00,Ministry recalls Land Rover-Range Rover 2022 model
2022/05/24  00:00:00,Gunnas Bond Proposal Included His Parents Forfeiting Their Homes If He Violated the Conditions
2022/05/24  00:00:00,State elections report: James Craig and Perry Johnson filed too few signatures for ballot
2022/05/24  00:00:00,Harvard Law School Awards Anoush Baghdassarian for Pro Bono Work
2022/05/24  00:00:00,"Planned Parenthood CEO, Wife of Soros Partner, on the Board of Private All-Girls School"
2022/05/24  00:00:00,SHAREHOLDER ALERT: Pomerantz Law Firm Reminds Shareholders with Losses on their Investment in Credit Suisse Group AG of Class Action Lawsuit and Upcoming Deadline - CS
2022/05/24  00:00:00,"News brief: Biden on Taiwan, monkeypox cases, Ukraine-Polish border"
2022/05/24  00:00:00,Valley groups protest extension of Title 42
2022/05/24  00:00:00,Governor suggests possible water restrictions for California
2022/05/24  00:00:00,"BJP using EC, ED to overthrow CM"
2022/05/24  00:00:00,"Azerbaijan, Armenia ready for border delimitation"
2022/05/24  00:00:00,Tencent's Pony Ma causes stir with repost of article on China's economy
2022/05/24  00:00:00,China Brags Repressive Lockdowns Will Keep Monkeypox Out
2022/05/24  00:00:00,Vibrant Ceiling Frescoes Depicting Egyptian Goddesses Discovered In The Temple Of Khnum At Esna
2022/05/24  00:00:00,Russian diplomat quits over war in Ukraine Share
2022/05/24  00:00:00,Goa CM for old tariff over mining export
2022/05/24  00:00:00,Civil hosp parking contractor asked to display rate list
2022/05/24  00:00:00,Hanley Investment Group Arranges Sale of New Construction Starbucks Drive-Thru in North Kansas City for $2.3 Million
2022/05/24  00:00:00,McConnell pressing the Biden administration to fast-track NATO expansion
2022/05/24  00:00:00,AMD Ryzen 7000 series showcased with 5.5 GHz clock speed
2022/05/24  00:00:00,Resident asks for movement on Mill Creek cleanup
2022/05/24  00:00:00,Biden Disinfo Board Advisor Michael Chertoff Tied to Soros-Funded Aspen Institute
2022/05/24  00:00:00,Chinese FM meets UN human rights chief
2022/05/24  00:00:00,Bizmen hail Centres decision on import and export duties
2022/05/24  00:00:00,Truck Displaying Antisemitic Messages Drives Through Beverly Hills
2022/05/24  00:00:00,"News brief: Biden on Taiwan, monkeypox cases, Ukraine-Polish border"
2022/05/24  00:00:00,Three firms bid for supplying 7.5 L MT of imported coal against MP Genco tenders
2022/05/24  00:00:00,Avon to evaluate locations for additional emergency sirens in northern communities
2022/05/24  00:00:00,"Oren Eini on RavenDB, Including Consistency Guarantees and C# as the Implementation Language"
2022/05/24  00:00:00,Buffalo Strong: Organizations ensuring no neighbor left behind amid Tops supermarket closure
2022/05/24  00:00:00,SHAREHOLDER ALERT: Pomerantz Law Firm Reminds Shareholders with Losses on their Investment in Credit Suisse Group AG of Class Action Lawsuit and Upcoming Deadline - CS
2022/05/24  00:00:00,Oklahoma Democrat Suggests Mandatory Vasectomies After Legislatures Abortion Ban
2022/05/24  00:00:00,"Build a custom email digest by following topics, people, and firms published on JD Supra."
2022/05/24  00:00:00,Goa CM for old tariff over mining export
2022/05/24  00:00:00,"At The MACC on Signal Mountain:  The Irish Brothers, Part I"
2022/05/24  00:00:00,"Belton bus tour: Council learns about ongoing, future projects"
2022/05/24  00:00:00,"Planned Parenthood CEO, Wife of Soros Partner, on the Board of Private All-Girls School"
2022/05/24  00:00:00,Local health care providers keep watchful eye of COVID-19 numbers
2022/05/24  00:00:00,Stellantis making Indiana announcement; may be battery plant
2022/05/24  00:00:00,China Brags Repressive Lockdowns Will Keep Monkeypox Out
2022/05/24  00:00:00,GOP lawmakers consider controversial budget amendment
2022/05/24  00:00:00,Resident asks for movement on Mill Creek cleanup
2022/05/24  00:00:00,UK envoy summoned over rainbow flag
2022/05/24  00:00:00,"The Brief for Monday, May 23, 2022"
2022/05/24  00:00:00,Atlanta-based analyst discusses Georgia primary elections
2022/05/24  00:00:00,Senior GOP Senator Asked  Watchdog to Report After Whistleblower Action at IRS
2022/05/24  00:00:00,"Capitol Report (May 23): DC Attorney General Suing Zuckerberg; Judge Says Title 42 Remains, for Now"
2022/05/24  00:00:00,Sebi moves to deepen liquidity in passive funds
2022/05/24  00:00:00,"Ontario party leaders visit areas damaged by storm; Horwath, Schreiner wrapping up COVID isolation"
2022/05/24  00:00:00,Yams Market: North America to Contribute 71% Market Growth | Technavio
2022/05/24  00:00:00,"Weakened by Bernie, partys Finn-ished for controversial Liberal MP"
2022/05/24  00:00:00,Sarawak submits formula on special grant for review
2022/05/24  00:00:00,Parshottam Rupala visited Brazil from 16th to 20th May 2022
2022/05/24  00:00:00,Republican senator supports Biden backing Taiwan against China
2022/05/24  00:00:00,"Build a custom email digest by following topics, people, and firms published on JD Supra."
2022/05/24  00:00:00,Heads of diplomatic offices of Turkmenistan in Iran visited Golestan province
2022/05/24  00:00:00,Chinese FM meets UN human rights chief
2022/05/24  00:00:00,SHAREHOLDER ALERT: Pomerantz Law Firm Reminds Shareholders with Losses on their Investment in Credit Suisse Group AG of Class Action Lawsuit and Upcoming Deadline - CS
2022/05/24  00:00:00,Lagos enrolls 107 MDAs on e-procurement platform
2022/05/24  00:00:00,"Lawmakers tour Reynolds Hall, new home of West Virginia University's business college"
2022/05/24  00:00:00,"Guyana - Dominica To Partner In Corn Production, Youth Shade House Project"
2022/05/24  00:00:00,Governor suggests possible water restrictions for California
2022/05/24  00:00:00,Bidens nuclear deterrence remarks send shock waves
2022/05/24  00:00:00,Meet the Russian diplomat who took aim at Putin on his way out
2022/05/24  00:00:00,The Clamour for an Amaechi  Presidency
2022/05/24  00:00:00,FIU plans to review cash transaction reporting Share
2022/05/24  00:00:00,DAILY MAIL COMMENT: Boris must face down these union wreckers
2022/05/24  00:00:00,Missoula Inmate Attacks Cellmate Over a Missing Tablet
2022/05/24  00:00:00,"Ventura College Area Community Council to discuss fire prevention, crime statistics"
2022/05/24  00:00:00,Ridgefield's Inventing Sisters - Sophie and Lily Zezula
2022/05/24  00:00:00,"World Has 10-Week Supply Of Wheat Remaining: 'This Is Seismic,' Expert Says"
2022/05/24  00:00:00,144 Housing Units For Public Servants In Jamaica
2022/05/24  00:00:00,Milipol Qatar to kick off today
2022/05/24  00:00:00,Chipmaker Broadcom's deal history under chief Hock Tan
2022/05/24  00:00:00,Montrose County signs off on transfer of hospitals real property
2022/05/24  00:00:00,Kate Moss Set To Testify In Ex Johnny Depp & Amber Heard's Trial
2022/05/24  00:00:00,Ukrainian exchange student will stay in mid-Michigan and attend CMU
2022/05/24  00:00:00,Louisiana Legislature approves tenure study task force
2022/05/24  00:00:00,DEC to begin spraying for spongy moth in Allegany State Park
2022/05/24  00:00:00,Biden: US would intervene with military to defend Taiwan
2022/05/24  00:00:00,David McCormick sues over counting mail ballots in Pa. Senate race
2022/05/24  00:00:00,Long Branch considers legal action against TikTok over party ads
2022/05/24  00:00:00,Resident asks for movement on Mill Creek cleanup
2022/05/24  00:00:00,Heads of diplomatic offices of Turkmenistan in Iran visited Golestan province
2022/05/24  00:00:00,Apollo High School Class of 2022
2022/05/24  00:00:00,Rais Yatim: Malaysia-Indonesia understanding key for Malay to be Asean official language
2022/05/24  00:00:00,"Booted from GOP ballot, Trump House pick to advise ex-rival"
2022/05/24  00:00:00,"Adani Group, Andhra Pradesh Govt sign MoU at World Economic Forum"
2022/05/24  00:00:00,Ukraines Zelensky Compares His Country to Israel at Davos
2022/05/24  00:00:00,Qantas takes a lion's share in TripADeal
2022/05/24  00:00:00,SHAREHOLDER ALERT: Pomerantz Law Firm Reminds Shareholders with Losses on their Investment in Credit Suisse Group AG of Class Action Lawsuit and Upcoming Deadline - CS
2022/05/24  00:00:00,"Ventura College Area Community Council to discuss fire prevention, crime statistics"
2022/05/24  00:00:00,Bidens nuclear deterrence remarks send shock waves
2022/05/24  00:00:00,"Build a custom email digest by following topics, people, and firms published on JD Supra."
2022/05/24  00:00:00,Sri Ram to remain as prosecutor
2022/05/24  00:00:00,Western district GOP candidates stake out positions on ag
2022/05/24  00:00:00,Yes teaming up with a legendary industrial designer to reimagine McDonalds packaging
2022/05/24  00:00:00,Long Branch considers legal action against TikTok over party ads
2022/05/24  00:00:00,Fishermen battle to reel in GIGANTIC 12ft sea monster weighing a whopping 97st
2022/05/24  00:00:00,Kane heading to rehab facility after court hearing
2022/05/24  00:00:00,"Capitol Report (May 23): DC Attorney General Suing Zuckerberg; Judge Says Title 42 Remains, for Now"
2022/05/24  00:00:00,U.S. Rep. Steil: Collects nomination signatures at gas station in South Milwaukee
2022/05/24  00:00:00,United Steelworkers officials describe details of tentative Arconic agreement
2022/05/24  00:00:00,"Marcos Receives Envoys From US, Japan, SoKor, India"
2022/05/24  00:00:00,Valley groups protest extension of Title 42
2022/05/24  00:00:00,"Azerbaijan, Armenia ready for border delimitation"
2022/05/24  00:00:00,SHAREHOLDER ALERT: Pomerantz Law Firm Reminds Shareholders with Losses on their Investment in Credit Suisse Group AG of Class Action Lawsuit and Upcoming Deadline - CS
2022/05/24  00:00:00,McConnell pressing the Biden administration to fast-track NATO expansion
2022/05/24  00:00:00,"Cuellar, lone anti-abortion Democrat in House, faces third showdown with progressive Cisneros"
2022/05/24  00:00:00,"Ventura College Area Community Council to discuss fire prevention, crime statistics"
2022/05/24  00:00:00,"Build a custom email digest by following topics, people, and firms published on JD Supra."
2022/05/24  00:00:00,Chinese FM meets UN human rights chief
2022/05/24  00:00:00,Bidens nuclear deterrence remarks send shock waves
2022/05/24  00:00:00,OP Chautalas assets 103% of known income sources: Court
2022/05/24  00:00:00,"'One country, two systems' key to HK"
2022/05/24  00:00:00,Marcos names personalities to key Cabinet posts
2022/05/24  00:00:00,Robertson will blow 2023 Budget - Willis
2022/05/24  00:00:00,"Capitol Report (May 23): DC Attorney General Suing Zuckerberg; Judge Says Title 42 Remains, for Now"
2022/05/24  00:00:00,"Gov. Abbott in Eagle Pass, Holds Briefing on Border Security"
2022/05/24  00:00:00,"Marcos Receives Envoys From US, Japan, SoKor, India"
2022/05/24  00:00:00,Lagos enrolls 107 MDAs on e-procurement platform
2022/05/24  00:00:00,"Qutub Minar row intensifies after Hindu, Jain idols found on site, govt considering iconography"
2022/05/24  00:00:00,Fishermen battle to reel in GIGANTIC 12ft sea monster weighing a whopping 97st
2022/05/24  00:00:00,Special education fund to aid Sabahan kids
2022/05/24  00:00:00,PM Jacinda Ardern to New York today after Covid delays
2022/05/24  00:00:00,N.Y. State Sen. Alessandra Biaggi to challenge selfish Rep. Sean Patrick Maloney for contentious House seat
2022/05/24  00:00:00,"World Has 10-Week Supply Of Wheat Remaining: 'This Is Seismic,' Expert Says"
2022/05/24  00:00:00,"Lawmakers tour Reynolds Hall, new home of West Virginia University's business college"
2022/05/24  00:00:00,Valley groups protest extension of Title 42
2022/05/24  00:00:00,Dozer Days puts kids at the wheel of heavy machinery
2022/05/24  00:00:00,State Farm Wants to Indoctrinate Kids. Consumers' Research Has the Receipts.
2022/05/24  00:00:00,"Planned Parenthood CEO, Wife of Soros Partner, on the Board of Private All-Girls School"
2022/05/24  00:00:00,"Kenya, Uganda to conduct joint marketing to woos foreign tourists"
2022/05/24  00:00:00,State elections report: James Craig and Perry Johnson filed too few signatures for ballot
2022/05/24  00:00:00,"Franken meet and greets in Elkader, Fayette on Sunday"
2022/05/24  00:00:00,'Evita' Peron stars once again on Argentine bills
2022/05/24  00:00:00,Ukrainian exchange student will stay in mid-Michigan and attend CMU
2022/05/24  00:00:00,Gov. Whitmer announces tutoring investment proposal
2022/05/24  00:00:00,Pakistan 'detaining' supporters of Imran Khan ahead of major rally
2022/05/24  00:00:00,Sri Ram to remain as prosecutor
2022/05/24  00:00:00,Founder alleges that YC-backed fintech startup is copy-and-pasting its business
2022/05/24  00:00:00,Bidens nuclear deterrence remarks send shock waves
2022/05/24  00:00:00,Lagos enrolls 107 MDAs on e-procurement platform
2022/05/24  00:00:00,China Brags Repressive Lockdowns Will Keep Monkeypox Out
2022/05/24  00:00:00,"Marcos Receives Envoys From US, Japan, SoKor, India"
2022/05/24  00:00:00,"Build a custom email digest by following topics, people, and firms published on JD Supra."
2022/05/24  00:00:00,Marcos names personalities to key Cabinet posts
2022/05/24  00:00:00,Rath weighs running against Giambra for GOP Senate nod
2022/05/24  00:00:00,"NZ stays at orange, Omicron second wave tipped for winter"
2022/05/24  00:00:00,Union Health and Red Cross to host blood drive - here are the details
2022/05/24  00:00:00,Meet the Russian diplomat who took aim at Putin on his way out
2022/05/24  00:00:00,A California police department offered gas money for unwanted guns. It ran out
2022/05/24  00:00:00,"State agencies hold meeting on Grassy Mountain, proposed gold mine in Vale"
2022/05/24  00:00:00,Ukraines Zelensky Compares His Country to Israel at Davos
2022/05/24  00:00:00,"Trump, Pence deliver final pitches for Kemp, Perdue"
2022/05/24  00:00:00,"Vicky And Casey White's Hideout Motel Room Has Waiting List, Spike In Price"
2022/05/24  00:00:00,Gun Barrel City sets runoff election
2022/05/24  00:00:00,Western district GOP candidates stake out positions on ag
2022/05/24  00:00:00,King Carl Gustaf watches military defence exercises
2022/05/24  00:00:00,'Special Report' All-Star Panel on Title 42 ruling
2022/05/24  00:00:00,"World Has 10-Week Supply Of Wheat Remaining: 'This Is Seismic,' Expert Says"
2022/05/24  00:00:00,Indiana cities experiment with gunshot detection tools
2022/05/24  00:00:00,Bidens nuclear deterrence remarks send shock waves
2022/05/24  00:00:00,Defendant Exits Through Second Floor Courthouse Fire Escape Prior To Hearing
2022/05/24  00:00:00,USA  Casting Cleaning Resources expanding to Wisconsin
2022/05/24  00:00:00,"Cuellar, lone anti-abortion Democrat in House, faces third showdown with progressive Cisneros"
2022/05/24  00:00:00,World Food Program Chief Presses Billionaires to Step Up'
2022/05/24  00:00:00,State elections report: James Craig and Perry Johnson filed too few signatures for ballot
2022/05/24  00:00:00,Nurse creates mindfulness program geared toward Black women
2022/05/24  00:00:00,Governor suggests possible water restrictions for California
2022/05/24  00:00:00,Truck Displaying Antisemitic Messages Drives Through Beverly Hills
2022/05/24  00:00:00,Utica University professor on New York's congressional redistricting changes
2022/05/24  00:00:00,"The Brief for Monday, May 23, 2022"
2022/05/24  00:00:00,"Biden tees up four-way talks with India, Japan, Australia"
2022/05/24  00:00:00,Meet the Russian diplomat who took aim at Putin on his way out
2022/05/24  00:00:00,SHAREHOLDER ALERT: Pomerantz Law Firm Reminds Shareholders with Losses on their Investment in Credit Suisse Group AG of Class Action Lawsuit and Upcoming Deadline - CS
2022/05/24  00:00:00,"Donald Trump, Mike Pence deliver final pitches for Brian Kemp, David Perdue"
2022/05/24  00:00:00,Doctor talks about switching baby formula as parents wait for supply to improve
2022/05/24  00:00:00,ANALYSIS: All The Times Joe Biden Appeared In Hunters Business Schemes
2022/05/24  00:00:00,Last call: Final phone booths removed from NYC streets
2022/05/24  00:00:00,Biden mulls dropping tariffs on China
2022/05/24  00:00:00,"Planned Parenthood CEO, Wife of Soros Partner, on the Board of Private All-Girls School"
2022/05/24  00:00:00,Gun Barrel City sets runoff election
2022/05/24  00:00:00,City Commission to hold meeting at Paducah Recreation Center in Fountain Avenue neighborhood
2022/05/24  00:00:00,Avon to evaluate locations for additional emergency sirens in northern communities
2022/05/24  00:00:00,"Franken meet and greets in Elkader, Fayette on Sunday"
2022/05/24  00:00:00,Governor suggests possible water restrictions for California
2022/05/24  00:00:00,USA  Casting Cleaning Resources expanding to Wisconsin
2022/05/24  00:00:00,State elections report: James Craig and Perry Johnson filed too few signatures for ballot
2022/05/24  00:00:00,"Kenya, Uganda to conduct joint marketing to woos foreign tourists"
2022/05/24  00:00:00,"World Has 10-Week Supply Of Wheat Remaining: 'This Is Seismic,' Expert Says"
2022/05/24  00:00:00,California could see mandatory water restrictions amid ongoing drought: Gov. Newsom
2022/05/24  00:00:00,"'One country, two systems' key to HK"
2022/05/24  00:00:00,Frye assumes command of USS Frank Cable
2022/05/24  00:00:00,ANALYSIS: All The Times Joe Biden Appeared In Hunters Business Schemes
2022/05/24  00:00:00,Mount Washington Commission continues master plan discussion
2022/05/24  00:00:00,Atlanta-based analyst discusses Georgia primary elections
2022/05/24  00:00:00,Valley groups protest extension of Title 42
2022/05/24  00:00:00,Rolling Stones Exile on Main St.': A Track-by-Track Guide
2022/05/24  00:00:00,Indiana cities experiment with gunshot detection tools
2022/05/24  00:00:00,"Philadelphia school district reinstates mask mandate for students and staff, citing increased COVID-19 cases"
2022/05/24  00:00:00,"Planned Parenthood CEO, Wife of Soros Partner, on the Board of Private All-Girls School"
2022/05/24  00:00:00,Fishermen battle to reel in GIGANTIC 12ft sea monster weighing a whopping 97st
2022/05/24  00:00:00,Lawmakers draft historic bill on Puerto Rico's territorial status
2022/05/24  00:00:00,King Carl Gustaf watches military defence exercises
2022/05/24  00:00:00,Local pastor responds to Southern Baptist Convention investigation
2022/05/24  00:00:00,"NZ stays at orange, Omicron second wave tipped for winter"
2022/05/24  00:00:00,Republican senator supports Biden backing Taiwan against China
