date,title
2022/09/11  00:00:00,Crises forge Beshear's role as Kentucky's consoler in chief
2022/09/11  00:00:00,"Abay Bank, MoR, INSA sign agreement on e-tax system - Capital Newspaper"
2022/09/11  00:00:00,Sunday Night Crews - 11 Sep 22 - 4BC
2022/09/11  00:00:00,Watch CMA Fest Season 18 Episode 1 CMA Fest Online
2022/09/11  00:00:00,European Retailers Could Learn Energy Saving From South Africa - BNN Bloomberg
2022/09/11  00:00:00,Pumpkin paddlers to make a splash at first regatta in Shelburne | CBC News
2022/09/11  00:00:00,Free Fire - Video Games Forum
2022/09/11  00:00:00,Nuclear submarines = uranium mines - CPA
2022/09/11  00:00:00,"St Deiniol, St Protus and St Hyacinth | ICN"
2022/09/11  00:00:00,List of All Temtem - Temtem Wiki Guide - IGN
2022/09/11  00:00:00,Everything We Know About 'Captain America: New World Order' So Far
2022/09/11  00:00:00,Line in the Sand Drawn Over Sons' Habit of Dropping By
2022/09/11  00:00:00,Fans Would Rather Take the Escalator
2022/09/11  00:00:00,"Wordle today: Answer, clues for Sunday, September 11 2022 word of the day"
2022/09/11  00:00:00,Al Franken Presses GOP Strategist About Her Misleading SCOTUS Take On CNN
2022/09/11  00:00:00,Buick Will Offer Buyouts To Dealerships That Don't Want To Sell EVs
2022/09/11  00:00:00,Actors Who Refuse To Share A Same-Sex Kiss On-Screen
2022/09/11  00:00:00,EXPLAINER: The intel review of documents at Trump's estate
2022/09/11  00:00:00,UPDATE | Kimberley water trickling back
2022/09/11  00:00:00,Belle by Kim Gravel Ribbed Knit Long Sleeve Henley Top - QVC.com
2022/09/11  00:00:00,Denim & Co. Canyon Retreat 3/4 Sleeve Texture Knit Printed Top - QVC.com
2022/09/11  00:00:00,Denim & Co. Canyon Retreat Cozy Plaid Collared Button Front Shacket - QVC.com
2022/09/11  00:00:00,Quacker Factory Hello Fall 3/4-Sleeve Appliqued Top - QVC.com
2022/09/11  00:00:00,Cuddl Duds Comfortwear Regular or Petite Slim Pants - QVC.com
2022/09/11  00:00:00,Candace Cameron Bure Printed Mock-Neck Long- Sleeve Top - QVC.com
2022/09/11  00:00:00,The fate of the New Zealand Academy of Fine Arts
2022/09/11  00:00:00,"Ukrainian forces push north, east and south in Kharkiv region- army chief"
2022/09/11  00:00:00,Mariners use two homers to stop Braves - TSN.ca
2022/09/11  00:00:00,"Jays reinstate OF Hernandez, option INF Lopez - TSN.ca"
2022/09/11  00:00:00,Mali Suspends Rotation of UN Forces
2022/09/11  00:00:00,Ukraine Presses New Offensive as Russian Troops Retreat From Kharkiv Region
2022/09/11  00:00:00,What they're saying in Russia about Ukraine's advances
2022/09/11  00:00:00,Canadian mining company begins surveying for copper near Butte
2022/09/11  00:00:00,El CF Lorca Deportiva se deja dos puntos en el primer partido (0-0)
2022/09/11  00:00:00,Burglars captured inside a residence in the Fairview Fire evacuation zone - KESQ
2022/09/11  00:00:00,"Start your week smart: Ukraine, Earthquake, King Charles III, The Queen, Mar-a-Lago - KESQ"
2022/09/11  00:00:00,"Rising Up With Sonali - August 5, 2022 | KPFA"
2022/09/11  00:00:00,Select Walmart stores in Texas resuming COVID-19 vaccination pop-up events
2022/09/11  00:00:00,"ABC-7 StormTRACK Weather: Tropical moisture enters Tuesday, but keeping average temperatures - KVIA"
2022/09/11  00:00:00,Antigua and Barbuda may try to remove King Charles III as its head of state
2022/09/11  00:00:00,Peter Facinelli planning to recruit teenage daughter to babysit newborn - KXLY
2022/09/11  00:00:00,National Restaurant Association Show Reunites Foodservice Industry With Triumphant 2022 Return
2022/09/11  00:00:00,Your Move with Andy Stanley - UPtv
2022/09/11  00:00:00,VEON Backs Uzbekistan Bid to Become Central Asia IT Hub
2022/09/11  00:00:00,Procession in Scotland to move Queen Elizabeth II's coffin
2022/09/11  00:00:00,"Visa, Mastercard, AmEx to start categorizing gun shop sales"
2022/09/11  00:00:00,SpaceX launches 34 Starlink satellites from Cape Canaveral
2022/09/11  00:00:00,News Team - WGAL News 8
2022/09/11  00:00:00,WMJK-FM 100.9 Coast Country - Part 6
2022/09/11  00:00:00,WMJK-FM 100.9 Coast Country - Part 2
2022/09/11  00:00:00,News Team - WMTW 8 News
2022/09/11  00:00:00,Earthquake of magnitude 7.6 strikes Eastern New Guinea region in Papua New Guinea
2022/09/11  00:00:00,"Jennifer Hudson, Sherri Shepherd part of daytime TV makeover"
2022/09/11  00:00:00,Kanye West & 50 Cent Go Back And Forth Over Fake Diarrhea Post | Y105
2022/09/11  00:00:00,"Shipwrecks, Legal Landscapes and Mediterranean Paradigms"
2022/09/11  00:00:00,Von der deutschen Flugscheibe zum Nazi-UFO
2022/09/11  00:00:00,"CA WFO LOS ANGELES Warnings, Watches, and Advisories"
2022/09/11  00:00:00,2022 British Superbikes Snetterton- Race Results (3)
2022/09/11  00:00:00,10 Carry-On Bags To Tote Cross-Country
2022/09/11  00:00:00,Secrets of the Royal Flight - Secrets of Royal Travel
2022/09/11  00:00:00,Russian troops in big retreat as Ukraine offensive advances in Kharkiv
2022/09/11  00:00:00,"'Govt making small businesses pay for pageantry', if we have public holiday for the Queen"
2022/09/11  00:00:00,US Support for Human Rights in North Korea - BORGEN
2022/09/11  00:00:00,Philadelphia braces for possibility migrant buses from Texas will be sent to city
2022/09/11  00:00:00,Germany to introduce 'green card' to bolster workforce | DW | 08.09.2022
2022/09/11  00:00:00,Hexy Studio's Animal Tribe Leader Game Uluk Now Live On Kickstarter
2022/09/11  00:00:00,Downtown crawfish boil benefit Columbia non-profit Saturday
2022/09/11  00:00:00,"Halo: The Master Chief Collection Windows, XONE game"
2022/09/11  00:00:00,CJ shakes up matrimonial asset disputes settlement rules
2022/09/11  00:00:00,"CA WFO LAS VEGAS Warnings, Watches, and Advisories"
2022/09/11  00:00:00,"CA WFO SAN DIEGO Warnings, Watches, and Advisories"
2022/09/11  00:00:00,49ers gain from Bears' obscure unsportsmanlike conduct penalty
2022/09/11  00:00:00,"WA WFO SEATTLE Warnings, Watches, and Advisories"
2022/09/11  00:00:00,"CA WFO LOS ANGELES Warnings, Watches, and Advisories"
2022/09/11  00:00:00,"Rian Johnson unpeels 'Glass Onion,' his 'Knives Out' sequel"
2022/09/11  00:00:00,Subscribe to read | Financial Times
2022/09/11  00:00:00,Prince Harry has to bow to Queen Consort Camilla as 'protocol changes'
2022/09/11  00:00:00,"Joe Wicks - Latest news, views, gossip, pictures, video"
2022/09/11  00:00:00,"Andy Carroll - Latest news, transfers, pictures, video, opinion"
2022/09/11  00:00:00,"On the Market: Home with nearly 1,400 square feet of living space for sale in Rockford"
2022/09/11  00:00:00,"X METAVERSE PRO, a video-centric, user-led, decentralized Web3 platform"
2022/09/11  00:00:00,Association of Colleges conference plans meat-free only menu
2022/09/11  00:00:00,(LISTEN) Otep talks to Mike Z-Wired In The Empire
2022/09/11  00:00:00,"Noem wanted to seal records, investigation shows"
2022/09/11  00:00:00,Nebraska Fires Coach Scott Frost | KKTX-AM
2022/09/11  00:00:00,5 Seconds Of Summer Share New Single 'Older' Featuring Sierra Deaton
2022/09/11  00:00:00,"Mets use 8-run fourth to slam Marlins, 11-3"
2022/09/11  00:00:00,Packers WR Allen Lazard returns after signing RFA tender
2022/09/11  00:00:00,Swallows respond on Citizens sponsorship | Kickoff
2022/09/11  00:00:00,"Natasha Coutinho Dsouza 271 : Latest News, Photos, Videos on Natasha Coutinho Dsouza 271 - Mid-Day"
2022/09/11  00:00:00,WikiLeaks Says Julian Assange's Internet Access Cut Off By 'State Party'
2022/09/11  00:00:00,"Verse of the day: Sep. 11, 2022"
2022/09/11  00:00:00,Lapu-Lapu may soon require businesses to have drug-free workplace for permit renewals
2022/09/11  00:00:00,Topic | Wearables | The Age
2022/09/11  00:00:00,Topic | Race Day fashion | The Age
2022/09/11  00:00:00,Topic | Federal budget | The Age
2022/09/11  00:00:00,What they're saying in Russia about Ukraine's advances
2022/09/11  00:00:00,AP News Summary at 9:15 p.m. EDT
2022/09/11  00:00:00,Topic | Royal family | WAtoday
2022/09/11  00:00:00,Topic | National News Live | WAtoday
2022/09/11  00:00:00,MLB roundup: Albert Pujols clubs HR No. 696
2022/09/11  00:00:00,Virginia Tech pulls away to defeat Boston College
2022/09/11  00:00:00,"Industry News: The Crown, Handmaid's Tale, Claire Danes + More! - WUUQ-FM"
2022/09/11  00:00:00,"China-aided sports, cultural center handed over to Tunisia"
2022/09/11  00:00:00,Australians Peers And Sanders Clinch U.S. Open Mixed Doubles - iAfrica
2022/09/11  00:00:00,Game Center: No. 21 BYU vs. No. 9 Baylor
2022/09/11  00:00:00,LEGO Star Wars: The Skywalker Saga News & Rumors | N4G
2022/09/11  00:00:00,Newspaper: Armenia PM is preparing changes in government
2022/09/11  00:00:00,"Rachmanism, n. : Oxford English Dictionary"
2022/09/11  00:00:00,"VIZ: The Official Website for Butterflies, Flowers"
2022/09/11  00:00:00,VIZ: The Official Website for Alice 19th
2022/09/11  00:00:00,Ukraine pushes Russia into retreat in counteroffensive
2022/09/11  00:00:00,"Forget 2011, Kyle Busch Close to Deal with Richard Childress Racing NASCAR Cup Team"
2022/09/11  00:00:00,King Charles III: Proclamations take place in North Yorkshire
2022/09/11  00:00:00,B-triple road train rule changes for Queensland
2022/09/11  00:00:00,7 Metro cops bust for murder | Dailysun
2022/09/11  00:00:00,Chiefs expect DE Clark to play vs. Cardinals
2022/09/11  00:00:00,"Judge, Yankees start with 7 straight hits, rout Kluber, Rays"
2022/09/11  00:00:00,DC Bike Ride draws thousands of cyclists raising money for local non-profits
2022/09/11  00:00:00,About Gun Talk | Talk Radio 105.9 - KNRS
2022/09/11  00:00:00,Guns.com Business Development Team :: Guns.com
2022/09/11  00:00:00,HLTV.org - The home of competitive Counter-Strike
2022/09/11  00:00:00,Liz Truss was told about The Queen hours before the news was made public
2022/09/11  00:00:00,AP News in Brief at 12:04 a.m. EDT
2022/09/11  00:00:00,Manchester United star Anthony Martial slams Jose Mourinho and Ole Gunnar Solskjaer
2022/09/11  00:00:00,Himachal Pradesh CM Jairam Thakur Launches Various Developmental Projects Worth Rs 148.68 Crores in Kangra | LatestLY
2022/09/11  00:00:00,Microbial Link between Gut Health and Gestational Diabetes Mellitus (GDM)
2022/09/11  00:00:00,Benefits of Sage Leaves | Herbs and Health: Sage
2022/09/11  00:00:00,Cholesterol Level Counter | Cholesterol Counter
2022/09/11  00:00:00,"Health Benefits of Apricot - Nutritional Values, Recipes"
2022/09/11  00:00:00,"Health Benefits of Oysters - Nutritional Information, Potential Health Risks, Recipes"
2022/09/11  00:00:00,"Shatabdi Chowdhury: Latest News, Photos, Videos on Shatabdi Chowdhury - NDTV.COM"
2022/09/11  00:00:00,Resign And Face Election: Aaditya Thackeray's Dare To Team Eknath Shinde
2022/09/11  00:00:00,"Greta Reid's Greta's Sushi offers pop-ups, catering and private omakases"
2022/09/11  00:00:00,TAKING STOCK WITH MANDY JOHNSTON | Newstalk
2022/09/11  00:00:00,Lauren Boebert news & latest pictures from Newsweek.com
2022/09/11  00:00:00,Tom Clancy's The Division Heartland | PCGamesN
2022/09/11  00:00:00,15 College Scholarships for Arts Students
2022/09/11  00:00:00,Thoughts on Leadership: Lessons for Today
2022/09/11  00:00:00,Ukraine releases information on draft dodgers
2022/09/11  00:00:00,Calls for Afghan Girls' Schools to Reopen Amid Intl Focus on Illiteracy | TOLOnews
2022/09/11  00:00:00,Immigration Dept rounds up 55 illegals
2022/09/11  00:00:00,"Rescue workers monitoring high tide situation, conditions nominal for now"
2022/09/11  00:00:00,Russan troops retreat after Ukraine counteroffensive
2022/09/11  00:00:00,WRAL News Streaming | Get the latest news today with WRAL :: WRAL.com
2022/09/11  00:00:00,"OWI and the ""Battle of Sweden"""
2022/09/11  00:00:00,Every Butt Deserves A Bidet | Digg
2022/09/11  00:00:00,Chukwueze scores and assists as Villarreal beat Lech Poznan | Goal.com Tanzania
2022/09/11  00:00:00,New Balance release striking Gold Pack football boots | Goal.com English Kuwait
2022/09/11  00:00:00,ttt - titel thesen temperamente - Filmfest Venedig - Kulturmagazin
2022/09/11  00:00:00,"KNAC.COM - Reviews - GOATWHORE, INCANTATION In Los Angeles With Photos!"
2022/09/11  00:00:00,News Categories | TSNN Trade Show News
2022/09/11  00:00:00,Massachusetts district attorney races and the progressive prosecutor
2022/09/11  00:00:00,Russia hits power stations after Ukraine counteroffensive
2022/09/11  00:00:00,Russia announces troop pullback from Ukraine's Kharkiv area
2022/09/11  00:00:00,"Ashcroft Trailer Hire Ltd, Newtownabbey - Trailer Hire Newtownabbey Trailer Hire Belfast Trailer Hire Northern Ireland"
2022/09/11  00:00:00,"Mainebank Electrical Services, Ballymena - Electricians Ballymena Electrical Contractors Antrim Portable Appliance Testing Antrim PAT Testing Ballymena Antrim Electrical Inspections Ballymena Maintenance of Sewage Handling Plants Northern Ireland NICEIC Approved Contractor Ballymena"
2022/09/11  00:00:00,Xi leaves China for first time since COVID pandemic began to meet Putin
2022/09/11  00:00:00,Fall Out Boy Were Working On 'Guitar-Based' New Music But Set It Aside | ALT 101.1
2022/09/11  00:00:00,Quake Strikes Papua in Indonesia | Al Bawaba
2022/09/11  00:00:00,Projects filtered by area | ArchDaily
2022/09/11  00:00:00,Someone Is Selling A Completely Unique 1979 Datsun 280ZX 2+2 GL Factory Prototype | Carscoops
2022/09/11  00:00:00,In pics: Parineeti Chopra cleans beaches post-Ganpati Visarjan in Mumbai
2022/09/11  00:00:00,Spielberg confronts his childhood as 'Fabelmans' premieres in Toronto
2022/09/11  00:00:00,Inflammatory material causes India to meet Wikipedia officials
2022/09/11  00:00:00,IAF carries out post midnight mission to evacuate injured BSF jawan
2022/09/11  00:00:00,"Villetta o condominio, acqua calda o corrente: guida per risparmiare con l'energia solare - Economia"
2022/09/11  00:00:00,Procession in Scotland moves Queen Elizabeth II's coffin to Edinburgh
2022/09/11  00:00:00,McGill University researchers shed light on Optimal
2022/09/11  00:00:00,Articles by Phil Mistry at PetaPixel
2022/09/11  00:00:00,Kanye West & 50 Cent Go Back And Forth Over Fake Diarrhea Post | Real 99.3
2022/09/11  00:00:00,Kanye West & 50 Cent Go Back And Forth Over Fake Diarrhea Post | STAR 94.1
2022/09/11  00:00:00,Courtney explains four-wide Pukekohe crash - Speedcafe
2022/09/11  00:00:00,NCIS & NCIS: Hawaii Premiere Crossover Event Promos *Updated 11th September 2022*
2022/09/11  00:00:00,Saudi owned Public Investment Fund invests $7 billion in US Stocks
2022/09/11  00:00:00,"Rolling Stone founder pens rock 'n' roll memoir, David Milch's 'Life's Work': 5 new books"
2022/09/11  00:00:00,Traffic | Sacramento Tower Bridge to close Sunday for Farm-to-Fork event
2022/09/11  00:00:00,"Uniform rate: Tk 108/dollar max for remittance, Tk 99/dollar for export income from tomorrow | Daily Sun |"
2022/09/11  00:00:00,"Swimwear - Latest Fashion, Pictures, Trends & Brands - Daily Star"
2022/09/11  00:00:00,South Africa's Jansen and Rabada polish off England tail in 3rd Test
2022/09/11  00:00:00,Brammer Buck & Hickman renamed 'Rubix'
2022/09/11  00:00:00,Kfm 94.5 - Shows - Jonathan Duguid
2022/09/11  00:00:00,"US 12 closed from Packwood to White Pass as wildfire grows from 90 to over 2,200 acres"
2022/09/11  00:00:00,"European Metals Holdings Share Chat. Chat About EMH Shares - Stock Quote, Charts, Trade History, Share Chat, Financial Terms Glossary."
2022/09/11  00:00:00,"Europa Oil&gas Share Chat. Chat About EOG Shares - Stock Quote, Charts, Trade History, Share Chat, Financial Terms Glossary."
2022/09/11  00:00:00,Russia announces troop pullback from Ukraine's Kharkiv area
2022/09/11  00:00:00,"UTEP Miners get defense sorted out, top New Mexico State Aggies"
2022/09/11  00:00:00,Kanye West & 50 Cent Go Back And Forth Over Fake Diarrhea Post | 103.1 KCDA
2022/09/11  00:00:00,"Panthers Fall to North Dakota, Start Season 0-2"
2022/09/11  00:00:00,Singapore's Largest Bank Makes Pivot to Metaverse With Sandbox Partnership - BeInCrypto
2022/09/11  00:00:00,"Back to school, back to the mall | The Sunday Magazine with Piya Chattopadhyay | Live Radio | CBC Listen"
2022/09/11  00:00:00,Tom Thomson Brings Back Fall Programming
2022/09/11  00:00:00,"Texas Tech upends No. 25 Houston in 2OT, 33-30"
2022/09/11  00:00:00,Xi leaves China for first time since COVID pandemic began to meet Putin
2022/09/11  00:00:00,WHO mission visits Qatar to assist in STEPwise survey
2022/09/11  00:00:00,Nebraska Fires Coach Scott Frost | HITS 100.3
2022/09/11  00:00:00,"Paul Rudd, Evangeline Lily, & Jonathan Majors Tease 'Ant-Man and the Wasp: Quantumania' at D23 Expo | paul rudd evangeline lily tease ant man 3 at d23 10 - Photo"
2022/09/11  00:00:00,"Queen Elizabeth's Casket Seen for the First Time, Begins Journey to Final Resting Place | queen elizabeth rip 13 - Photo"
2022/09/11  00:00:00,"Queen Elizabeth's Casket Seen for the First Time, Begins Journey to Final Resting Place | queen elizabeth rip 08 - Photo"
2022/09/11  00:00:00,Lukas Gage Dons Bold Blue at TIFF's 'How to Blow Up a Pipeline' Premiere | lukas gage pipeline tiff 2022 40 - Photo
2022/09/11  00:00:00,Brendan Fraser & Sadie Sink Share A Hug at 'The Whale' Premiere in Toronto | brendan fraser sadie sink whale premiere tiff 18 - Photo
2022/09/11  00:00:00,Brendan Fraser & Sadie Sink Share A Hug at 'The Whale' Premiere in Toronto | brendan fraser sadie sink whale premiere tiff 17 - Photo
2022/09/11  00:00:00,Melanie Lynskey & Juno Temple Twin in Lime Green Look at Paramount's Emmy Party | juno temple melanie lynskey amanda kloots more paramount emmy party 43 - Photo
2022/09/11  00:00:00,Melanie Lynskey & Juno Temple Twin in Lime Green Look at Paramount's Emmy Party | juno temple melanie lynskey amanda kloots more paramount emmy party 50 - Photo
2022/09/11  00:00:00,Politics chat: State courts v. legislatures on election laws; Same-sex marriage bill
2022/09/11  00:00:00,Sigma-Aldrich Canada Co. - Lab Canada
2022/09/11  00:00:00,Actress Ruthy Nutifafa donates to Teshie Children's Home | News Ghana
2022/09/11  00:00:00,"Gardeneur Plant Market at San Francisco Ferry Building in San Francisco - September 11, 2022 | SF Station"
2022/09/11  00:00:00,RagnarLocker Ransomware Gang Claims TAP Air Portugal as Its Second Victim in Two Weeks | Spiceworks
2022/09/11  00:00:00,Kanye West & 50 Cent Go Back And Forth Over Fake Diarrhea Post | Star 101.3
2022/09/11  00:00:00,Idris Elba wants fans to 'see themselves' in The Beast
2022/09/11  00:00:00,Forum | Lego Portman Road by Jeff_winger
2022/09/11  00:00:00,Forum | DJ Chaz3 by dominiciawful
2022/09/11  00:00:00,SquidGrips for Xbox One and Xbox 360 Review | TheXboxHub
2022/09/11  00:00:00,"Adriano Carlo Basile, Lettore di VareseNews"
2022/09/11  00:00:00,'Embedded' ArtPrize entry moves into Frederik Meijer Gardens
2022/09/11  00:00:00,Steelers safety Minkah Fitzpatrick opens season with pick-six of Joe Burrow
2022/09/11  00:00:00,Your Voice: Visiting foreign countries without leaving Hong Kong
2022/09/11  00:00:00,Auckland South Immigration Consultants | Experienced NZ immigration and education adviseres
2022/09/11  00:00:00,"Azerbaijan administers 1,353 COVID-19 jabs in 24 hours"
2022/09/11  00:00:00,"Azerbaijan administers 1,356 COVID-19 jabs in 24 hours"
2022/09/11  00:00:00,"Gangrene & Roc Marciano - ""Greneberg"" EP"
2022/09/11  00:00:00,Timbaland feat 50 Cent & Tony Yayo- Come And Get Me
2022/09/11  00:00:00,Cleveland Browns vs Carolina Panthers Thread 09.11.2022 1 PM EST CBS
2022/09/11  00:00:00,"Peter Bjorn and John | Artist | CD102.5 - The Alternative Radio Station - Columbus, OH"
2022/09/11  00:00:00,"Love and Rockets | Artist | CD102.5 - The Alternative Radio Station - Columbus, OH"
2022/09/11  00:00:00,warfighting | Center for International Maritime Security
2022/09/11  00:00:00,"Hugh Bailey, Editorial Page Editor - Connecticut Post"
2022/09/11  00:00:00,"Dengue Fever, Crimean-Congo Hemorrhagic Fever, and COVID-19 Triple Co-infection: Out of the Frying Pan Into the Fire"
2022/09/11  00:00:00,"What's on September 12-18/2022 | DTiNews - Dan Tri International, the news gateway of Vietnam"
2022/09/11  00:00:00,"Red, white and blue by rickie"
2022/09/11  00:00:00,Xi leaves China for first time since COVID pandemic began to meet Putin
2022/09/11  00:00:00,Russia Grip On Northeast Ukraine Loosens After Kyiv Severs S...
2022/09/11  00:00:00,"Shira Haas To Play Sabra, Tim Blake Nelson Leader In 'Capta..."
2022/09/11  00:00:00,WHO: nasal vaccinations could aid in control of Covid
2022/09/11  00:00:00,Williamson Should Step Aside As Skipper In One Format To Co...
2022/09/11  00:00:00,"Point Of Contact, Michael-John Toste's Ebook Travels One Tri..."
2022/09/11  00:00:00,Kuwait's Amb. Presents His Credentials To Iraq's FM
2022/09/11  00:00:00,Mangrove Forests...Qatar's Green Fortress To Tackle Carbon: ...
2022/09/11  00:00:00,Reliance Infra Files $1.7 Billion Claim In Power Deal With A...
2022/09/11  00:00:00,Azerbaijani National Rhythmic Gymnastics Team On Their Way T...
2022/09/11  00:00:00,KCR Discusses Agenda Of Proposed National Party With Kumara...
2022/09/11  00:00:00,"UAE President, Serbian President Discuss Bilateral Relations..."
2022/09/11  00:00:00,"UAE: Tadweer Processes Over 1.8 Million Tons Of Waste, Diver..."
2022/09/11  00:00:00,IAEA: External Electricity Restored At Zaporizhzhia NPP
2022/09/11  00:00:00,Peter Facinelli planning to recruit teenage daughter to babysit newborn
2022/09/11  00:00:00,Queen Elizabeth II's coffin takes long road through Scotland
2022/09/11  00:00:00,Charlie Blackmon batting fourth for Rockies on Sunday
2022/09/11  00:00:00,Lewis Brinson in San Francisco's lineup Sunday night
2022/09/11  00:00:00,MR ACCURACY REPORTS - press releases
2022/09/11  00:00:00,"Process and Control Today | Sensia, A Schlumberger Company (Jiskoot Ltd)"
2022/09/11  00:00:00,Process and Control Today | IRISS Ltd
2022/09/11  00:00:00,"Digital Wallets, Money Management, and More | PayPal US"
2022/09/11  00:00:00,"Egypt, Vietnam hold ninth round of political consultations"
2022/09/11  00:00:00,MI Lottery - 9 & 10 News
2022/09/11  00:00:00,Kanye West & 50 Cent Go Back And Forth Over Fake Diarrhea Post | 96.1 KISSFM
2022/09/11  00:00:00,Woman Goes Over 68-Foot Waterfall Trying To Retrieve Cell Phone | AM 620 WJDX
2022/09/11  00:00:00,Jaishankar co-chairs India-Saudi Partnership Council committee
2022/09/11  00:00:00,Frozen Planet II - Series 1: 1. Frozen Worlds
2022/09/11  00:00:00,Bill Handel - NewsRadio 800 WVHU
2022/09/11  00:00:00,Next Gateway XB8 - Technicolor CGM4981COM Wi-Fi 6E - Comcast XFINITY
2022/09/11  00:00:00,Robinson strikes before South Africa fight back in England finale - Daily Times
2022/09/11  00:00:00,God Centered Life - Faith Radio
2022/09/11  00:00:00,Living on the Edge - Faith Radio
2022/09/11  00:00:00,Essentia Health: Hospitals To Remain Open During Nurse's Strike - Fox21Online
2022/09/11  00:00:00,Mohammad Rafi Zeyaei - Artist Profile
2022/09/11  00:00:00,Lucas Santiago Varela - Artist Profile
2022/09/11  00:00:00,Over 2.6 Million Iranians Travel to Iraq for Arbaeen
2022/09/11  00:00:00,Taliban negotiating with UAE over airspace control
2022/09/11  00:00:00,About Kim Komando | KNST AM 790
2022/09/11  00:00:00,Kiera D'Amato use of poor man's altitude to prepare for Berlin
2022/09/11  00:00:00,The Story of the Fed is the Story of a Crime - LewRockwell
2022/09/11  00:00:00,Stasera in TV: i film da non perdere di domenica 11 settembre 2022
2022/09/11  00:00:00,alice + olivia spring 23 inspired by home decor
2022/09/11  00:00:00,NRL WAG Tahlia Giumelli takes daughters to football
2022/09/11  00:00:00,Clair McCaskill: Lawmakers MOCKED Biden for being Obama's VP
2022/09/11  00:00:00,SpaceX rocket blasts 34 Starlink satellites into space in Florida
2022/09/11  00:00:00,PREVIEW-Xi leaves China for first time since COVID pandemic began to meet Putin
2022/09/11  00:00:00,Ella Mitta's traditional food journey from Greece to Turkey and... home
2022/09/11  00:00:00,No. 6 Jimmies Stay Hot With Sweep of Morningside
2022/09/11  00:00:00,Pageantry and procession in the rain in Hillsborough
2022/09/11  00:00:00,"Eagles-Lions Week 1 inactives, with analysis"
2022/09/11  00:00:00,Planet Rock - Where Rock Lives
2022/09/11  00:00:00,Toronto Blue Jays 2022 Salaries Payroll
2022/09/11  00:00:00,"Trout HR 6th game in row; Ohtani blister, Angels top Astros | Taiwan News | 2022-09-11 11:16:40"
2022/09/11  00:00:00,North Taiwan woman trapped upside down in clothing recycling bin | Taiwan News | 2022-09-11 18:48:00
2022/09/11  00:00:00,"Jesus, only one of three things - The Citizen"
2022/09/11  00:00:00,Nicholas Singleton helps Penn State pummel Ohio
2022/09/11  00:00:00,"WA WFO SPOKANE Warnings, Watches, and Advisories"
2022/09/11  00:00:00,Report: Kyle Busch to RCR after long Gibbs run
2022/09/11  00:00:00,"CAD Forum - error 2337 | CAD tips for AutoCAD, LT, Inventor, Revit, Map, Autodesk, HP"
2022/09/11  00:00:00,Talking Points: 3-day Minnesota nurses strike set to begin Monday morning
2022/09/11  00:00:00,PAK vs SL: Fast and furious Haris Rauf bowled Danushka to ensure speed game in final
2022/09/11  00:00:00,"Bruce, QS Nurses | Kansas Press Association"
2022/09/11  00:00:00,"KUNA : Saudi, Indian FMs discuss bilateral ties - Politics"
2022/09/11  00:00:00,LIVE. Cortegiul funerar al Reginei Elisabeta a II-a paraseste Balmoral si se indreapta catre Edinburgh
2022/09/11  00:00:00,Lilybee's PartyBox | Children's Party Supplies NZ
2022/09/11  00:00:00,Services | SAPS (South African Police Service)
2022/09/11  00:00:00,Leo Kottke - Leo Live (15 tracks) +Album Reviews
2022/09/11  00:00:00,AAP Ferg - ALWAYS STRIVE AND PROSPER (18 tracks)
2022/09/11  00:00:00,Rams WR Lance McCutcheon & S Russ Yeast participate in panel discussion for RISE with the Rams event at NFL headquarters
2022/09/11  00:00:00,Queen Elizabeth II's corgis will go to her son Prince Andrew and his ex-wife
2022/09/11  00:00:00,Kanye West & 50 Cent Go Back And Forth Over Fake Diarrhea Post | 93.9 KISS FM
