date,title
2022/07/03  00:00:00,TAIPEI TIMES Beijing blacklisting more Taiwanese books: source
2022/07/03  00:00:00,Summit County Pest Control Is Going After The American Cockroach -- Summit County Pest Control
2022/07/03  00:00:00,Lucy continues to stabilize its solar array before its October flyby
2022/07/03  00:00:00,The Maha thriller: Corroborating facets and ramifications
2022/07/03  00:00:00,Benguet farmer's daughter marches as magna cum laude
2022/07/03  00:00:00,Francis James Gillen: The 19th Century Aboriginal Activist
2022/07/03  00:00:00,"Nigerian Anti-narcotics Agency, NDLEA Intercepts N4.5bn Heroin In Baby Food As Ex-BRT Driver Excretes 90 Pellets Of Cocaine"
2022/07/03  00:00:00,Zimbabwean president meets with senior Chinese diplomat on bilateral cooperation
2022/07/03  00:00:00,OzTech: NSW seeks to bolster semiconductor industry; 4 unis suffered cyberattacks; MacTel DC still awaiting approval; WA creative tech hub; Ransomware targets liquidators
2022/07/03  00:00:00,Tyson's Storm Lake pork plant turns 40 years old
2022/07/03  00:00:00,"Klarna looks to raise cash at truncated $6.5b valuation from Sequoia, others"
2022/07/03  00:00:00,Adani Enterprises lowest bidder in CIL import tender
2022/07/03  00:00:00,"2,672 test positive in Tamil Nadu"
2022/07/03  00:00:00,Adel Al-Jubeir attends CARICOM meet in Suriname
2022/07/03  00:00:00,Mayors demand rethink on Suburban Rail Loop plans
2022/07/03  00:00:00,Newsom July 4 ad targets DeSantis: 'Freedom is under attack'
2022/07/03  00:00:00,"Two tales of partnership: Tech, city celebrate while McMurry, Hardin-Simmons squabble"
2022/07/03  00:00:00,"""Looking For An Eknath Shinde"": Chirag Paswan's Dig At BJP, Nitish Kumar"
2022/07/03  00:00:00,70 flights to Iceland with Icelandair
2022/07/03  00:00:00,France and Australia hint at reviving trilateral with India
2022/07/03  00:00:00,"G20 foreign ministers meet: Jaishankar to outline India's view on food, energy security"
2022/07/03  00:00:00,J&K polls after electoral roll revision: LG Manoj Sinha
2022/07/03  00:00:00,"MLK tapes, other civil rights items returning to Charleston"
2022/07/03  00:00:00,Montecito Fire Dept. to host wildfire preparedness community meeting
2022/07/03  00:00:00,There could be more than one criminal referral: Jan. 6 select committee members preview evidence to be presented in July hearings
2022/07/03  00:00:00,SoftBank's Fortress offers $1.5b to buy Japanese department store Sogo & Seibu
2022/07/03  00:00:00,Defence Ministry considering medical safeguards for 'injured' Agniveers
2022/07/03  00:00:00,COAS charges troops to complement kinetic efforts with spiritual intervention
2022/07/03  00:00:00,Zelensky Hails Israels Top Court for Allowing Visa Exemption for Ukrainians Fleeing War
2022/07/03  00:00:00,Women supplied undercover police officer with class A drugs in Berwick during county lines operation
2022/07/03  00:00:00,Mayors demand rethink on Suburban Rail Loop plans
2022/07/03  00:00:00,"Ireland's sailing, boating & maritime magazine"
2022/07/03  00:00:00,Audit Report: Senate Summons PTDF Boss over N2bn Land Compensation
2022/07/03  00:00:00,League backs Lebanon on IMF stand
2022/07/03  00:00:00,Adani Enterprises lowest bidder in CIL import tender
2022/07/03  00:00:00,Reality Bites: Diyar Leaders chutzpah at G-7 & Operation Louts
2022/07/03  00:00:00,Benguet farmer's daughter marches as magna cum laude
2022/07/03  00:00:00,"Two tales of partnership: Tech, city celebrate while McMurry, Hardin-Simmons squabble"
2022/07/03  00:00:00,Kansas Police Department Adds Tesla Model Y To Fleet
2022/07/03  00:00:00,Montecito Fire Dept. to host wildfire preparedness community meeting
2022/07/03  00:00:00,Transphobic Clown Jordan Peterson Whines That He Cant Deadname Elliot Page
2022/07/03  00:00:00,SoftBank's Fortress offers $1.5b to buy Japanese department store Sogo & Seibu
2022/07/03  00:00:00,"World News | Germany, Ireland Slam UK Move Toward Overriding Brexit Deal"
2022/07/03  00:00:00,< Election deniers have taken their fraud theories on tour  to nearly every state
2022/07/03  00:00:00,ZooTampa joins forces with Puerto Rico conservation center to rescue manatee
2022/07/03  00:00:00,"""Looking For An Eknath Shinde"": Chirag Paswan's Dig At BJP, Nitish Kumar"
2022/07/03  00:00:00,Rep. Adam Kinzinger Puts on Clown Makeup Before Going Full 'Orange Man Bad' on CNN
2022/07/03  00:00:00,"Cheney: Committee, DOJ could each make Trump criminal referrals in connection with Jan. 6"
2022/07/03  00:00:00,"MLK tapes, other civil rights items returning to Charleston"
2022/07/03  00:00:00,"G20 foreign ministers meet: Jaishankar to outline India's view on food, energy security"
2022/07/03  00:00:00,Taipei court throws out case against Sherwood
2022/07/03  00:00:00,Eknath Shinde Takes Back Key Party Post Before Test To Prove Majority
2022/07/03  00:00:00,Trump suggests Cassidy Hutchinson has to be related to 'total RINO stiff' Arkansas Gov. Asa Hutchinson after the 25-year-old former aide told the January 6 panel that ex-president lunged at his security detail and threw plates
2022/07/03  00:00:00,Soaring prices extend energy and resource export boom
2022/07/03  00:00:00,Sudan extradites wanted Muslim Brotherhood affiliates to Egypt
2022/07/03  00:00:00,Tnaiste turns first sod for Kilkenny Cheese plant
2022/07/03  00:00:00,70 flights to Iceland with Icelandair
2022/07/03  00:00:00,BCs Tales of the Pacific | This generations legacy to the world
2022/07/03  00:00:00,Supreme Court marshal to Maryland and Virginia officials: enforce laws banning protests
2022/07/03  00:00:00,League backs Lebanon on IMF stand
2022/07/03  00:00:00,Zelensky Hails Israels Top Court for Allowing Visa Exemption for Ukrainians Fleeing War
2022/07/03  00:00:00,Stanley Thermos memories - Burke County Notebook
2022/07/03  00:00:00,"World News | Germany, Ireland Slam UK Move Toward Overriding Brexit Deal"
2022/07/03  00:00:00,The Arkadelphian : Hostess inks agreement with EDCCC
2022/07/03  00:00:00,Hamilton County inmate escapes custody from University of Cincinnati Medical Center
2022/07/03  00:00:00,Women supplied undercover police officer with class A drugs in Berwick during county lines operation
2022/07/03  00:00:00,"G20 foreign ministers meet: Jaishankar to outline India's view on food, energy security"
2022/07/03  00:00:00,Amber Heard Requests Johnny Depp Trial Do-Over Due To Alleged Fake Juror
2022/07/03  00:00:00,Today's letters: Readers comment on Roe v Wade and the Jan. 6 hearings
2022/07/03  00:00:00,Jacob Sullum: Maximalists threaten a federalist compromise on abortion
2022/07/03  00:00:00,Galesburg rally  We wont go back
2022/07/03  00:00:00,"July. 3 Letters to the Editor, Part 2: Our Readers Opinions"
2022/07/03  00:00:00,Fact Check: 17-year-old image of Belarusian prisoner shared as that of 'Nazi' Ukrainian soldier
2022/07/03  00:00:00,"Galaxy Z Flip3 Endures More Than 142 Hours Of Folding Livestream And 418,502 Folds"
2022/07/03  00:00:00,Audit Report: Senate Summons PTDF Boss over N2bn Land Compensation
2022/07/03  00:00:00,< Election deniers have taken their fraud theories on tour  to nearly every state
2022/07/03  00:00:00,TAIPEI TIMES Beijing blacklisting more Taiwanese books: source
2022/07/03  00:00:00,"Russia says its taken Lysychansk, and thus all of Luhansk"
2022/07/03  00:00:00,Israel elections: Yamina skirting electoral threshold - poll
2022/07/03  00:00:00,The Arkadelphian : Hostess inks agreement with EDCCC
2022/07/03  00:00:00,Latter-day Saints reflect on history of Tokyo Japan Temple
2022/07/03  00:00:00,Liz Cheney says the January 6 panel won't 'stand by' and let 'men who are claiming executive privilege' attack Cassidy Hutchinson's character
2022/07/03  00:00:00,"Bargain Buys  Byrne, Hillen and Harris in Search of More July Sale Riches"
2022/07/03  00:00:00,Baladna joins Qatar Charity as Humanitarian Partner
2022/07/03  00:00:00,"Woman charged S$15 for veggie, curry chicken & rice from S'pore Little India eatery"
2022/07/03  00:00:00,Pitcher Partners promotes seven partners and one executive director
2022/07/03  00:00:00,Ukraine round-up: Russia takes Lysychansk and border city hit
2022/07/03  00:00:00,MOFA announces unified number for digital services to citizens abroad
2022/07/03  00:00:00,Tnaiste turns first sod for Kilkenny Cheese plant
2022/07/03  00:00:00,Adel Al-Jubeir attends CARICOM meet in Suriname
2022/07/03  00:00:00,"Two tales of partnership: Tech, city celebrate while McMurry, Hardin-Simmons squabble"
2022/07/03  00:00:00,Sudan extradites wanted Muslim Brotherhood affiliates to Egypt
2022/07/03  00:00:00,"Glenn Youngkin Mulling a 2024 Presidential Run, Met With Megadonors"
2022/07/03  00:00:00,Francis James Gillen: The 19th Century Aboriginal Activist
2022/07/03  00:00:00,TAIPEI TIMES Beijing blacklisting more Taiwanese books: source
2022/07/03  00:00:00,Manchester United preparing to sell Alex Telles
2022/07/03  00:00:00,"Cheney: Committee, DOJ could each make Trump criminal referrals in connection with Jan. 6"
2022/07/03  00:00:00,"Jan. 6 panel could make multiple criminal referrals of Trump to DOJ, Cheney says"
2022/07/03  00:00:00,Amber Heard Requests Johnny Depp Trial Do-Over Due To Alleged Fake Juror
2022/07/03  00:00:00,Trump suggests Cassidy Hutchinson has to be related to 'total RINO stiff' Arkansas Gov. Asa Hutchinson after the 25-year-old former aide told the January 6 panel that ex-president lunged at his security detail and threw plates
2022/07/03  00:00:00,Zelensky Hails Israels Top Court for Allowing Visa Exemption for Ukrainians Fleeing War
2022/07/03  00:00:00,"MLK tapes, other civil rights items returning to Charleston"
2022/07/03  00:00:00,"Nicaragua closes Mother Teresa charity, 100 other groups"
2022/07/03  00:00:00,Israel's interim PM Lapid holds 1st cabinet meeting
2022/07/03  00:00:00,Supreme Court marshal to Maryland and Virginia officials: enforce laws banning protests
2022/07/03  00:00:00,"Leeds make enquiry for Ivory Coast international Hamed Traore, but face stiff competition from AC Milan"
2022/07/03  00:00:00,EXCLUSIVE: Text Messages Show Cassidy Hutchinson Referring To January 6 Committee As BS
2022/07/03  00:00:00,Sudan extradites wanted Muslim Brotherhood affiliates to Egypt
2022/07/03  00:00:00,"UAE Minister Of State For Foreign Trade Participates In Selectusa Investment Summit, Meets US Commerce Secretary And Governor Of Michigan"
2022/07/03  00:00:00,Latter-day Saints reflect on history of Tokyo Japan Temple
2022/07/03  00:00:00,Draupadi of Peter Brook's 'Mahabharata' recalls her days with the Master
2022/07/03  00:00:00,Caught: Bomber linked to BJP at least till May
2022/07/03  00:00:00,Baladna joins Qatar Charity as Humanitarian Partner
2022/07/03  00:00:00,PNG votes in heavily guarded elections
2022/07/03  00:00:00,"Cheney: Committee, DOJ could each make Trump criminal referrals in connection with Jan. 6"
2022/07/03  00:00:00,"Water Authority chief, Spanish ambassador discuss cooperation"
2022/07/03  00:00:00,"Bargain Buys  Byrne, Hillen and Harris in Search of More July Sale Riches"
2022/07/03  00:00:00,< Election deniers have taken their fraud theories on tour  to nearly every state
2022/07/03  00:00:00,EU mulls complaints from Balkan states over accession
2022/07/03  00:00:00,Iran chief nuclear negotiator discusses atomic deal in unannounced Russia visit: Moscow
2022/07/03  00:00:00,Israel's interim PM Lapid holds 1st cabinet meeting
2022/07/03  00:00:00,Sunbeds: Young use Wales tanning salons without ID checks
2022/07/03  00:00:00,Liz Truss mulls seizure of Russian assets in UK to give to Ukraine
2022/07/03  00:00:00,Letter From Alexander Hamilton on Display in Boston
2022/07/03  00:00:00,Newsom July 4 ad targets DeSantis: 'Freedom is under attack'
2022/07/03  00:00:00,"UAE Minister Of State For Foreign Trade Participates In Selectusa Investment Summit, Meets US Commerce Secretary And Governor Of Michigan"
2022/07/03  00:00:00,"Indigenous seeds sprout solidarity, A Growing Culture event hears"
2022/07/03  00:00:00,Sudan extradites wanted Muslim Brotherhood affiliates to Egypt
2022/07/03  00:00:00,Zimbabwean president meets with senior Chinese diplomat on bilateral cooperation
2022/07/03  00:00:00,Manchester United preparing to sell Alex Telles
2022/07/03  00:00:00,Siem Reap gains air link to Danang
2022/07/03  00:00:00,"Leeds make enquiry for Ivory Coast international Hamed Traore, but face stiff competition from AC Milan"
2022/07/03  00:00:00,Fact Check: 17-year-old image of Belarusian prisoner shared as that of 'Nazi' Ukrainian soldier
2022/07/03  00:00:00,The taste of Tobago in just one dish
2022/07/03  00:00:00,"Databricks adds data governance, machine learning to lakehouse"
2022/07/03  00:00:00,"Flake shortages, GAA jerseys and a pulsating finish"
2022/07/03  00:00:00,Caught: Bomber linked to BJP at least till May
2022/07/03  00:00:00,Two coyotes detained in Darien Gap
2022/07/03  00:00:00,Play along with the Philharmonic Orchestra
2022/07/03  00:00:00,Liz Truss mulls seizure of Russian assets in UK to give to Ukraine
2022/07/03  00:00:00,Podcast: AMG C43 and Tiguan Allspace driven
2022/07/03  00:00:00,Avan has flipped into a paddock in NorthCanterbury
2022/07/03  00:00:00,The Arkadelphian : Hostess inks agreement with EDCCC
2022/07/03  00:00:00,"UAE Minister Of State For Foreign Trade Participates In Selectusa Investment Summit, Meets US Commerce Secretary And Governor Of Michigan"
2022/07/03  00:00:00,Stanley Thermos memories - Burke County Notebook
2022/07/03  00:00:00,PNG votes in heavily guarded elections
2022/07/03  00:00:00,"Nicaragua closes Mother Teresa charity, 100 other groups"
2022/07/03  00:00:00,The 5 Q's: Sang-Heui Lee with PSU highlights SeoulTech Summer Global Management Camp
2022/07/03  00:00:00,Four Brazil destinations for different types of travel
2022/07/03  00:00:00,"Survey gauges Jordanians knowledge, attitudes, behaviour on climate change"
2022/07/03  00:00:00,"Johnson 'Swept Pincher Allegations Under Carpet To Save His Own Skin', Say Labour"
2022/07/03  00:00:00,Letter From Alexander Hamilton on Display in Boston
2022/07/03  00:00:00,Iran chief nuclear negotiator discusses atomic deal in unannounced Russia visit: Moscow
2022/07/03  00:00:00,The taste of Tobago in just one dish
2022/07/03  00:00:00,CDTC Executive Director discusses planned I-787 study
2022/07/03  00:00:00,Iranian-flagged tanker in Greece tugged to Piraeus port
2022/07/03  00:00:00,"Potter Park Zoo sends nearly 2,000 toad tadpoles to Puerto Rico for repopulation"
2022/07/03  00:00:00,Caught: Bomber linked to BJP at least till May
2022/07/03  00:00:00,Guest opinion: The Road Map to Liberty
2022/07/03  00:00:00,Two coyotes detained in Darien Gap
2022/07/03  00:00:00,"UAE Minister Of State For Foreign Trade Participates In Selectusa Investment Summit, Meets US Commerce Secretary And Governor Of Michigan"
2022/07/03  00:00:00,Siem Reap gains air link to Danang
2022/07/03  00:00:00,EU mulls complaints from Balkan states over accession
2022/07/03  00:00:00,Belarus leader stands with Russia in campaign
2022/07/03  00:00:00,Op-ed: A statement on abortion from the League of Women Voters and other local organizations
2022/07/03  00:00:00,Play along with the Philharmonic Orchestra
2022/07/03  00:00:00,MFA: Ukraine Severs Diplomatic Relations With Syria
2022/07/03  00:00:00,PNG votes in heavily guarded elections
2022/07/03  00:00:00,Kiev says Turkey detained Russian ship carrying Ukrainian grain
2022/07/03  00:00:00,Fox News's Kurtz Slams Media's Pro-Abortion Coverage
2022/07/03  00:00:00,Four Brazil destinations for different types of travel
2022/07/03  00:00:00,5 Tennessee law enforcement officers graduate from FBI National Academy
2022/07/03  00:00:00,Iran chief nuclear negotiator discusses atomic deal in unannounced Russia visit: Moscow
2022/07/03  00:00:00,The 5 Q's: Sang-Heui Lee with PSU highlights SeoulTech Summer Global Management Camp
2022/07/03  00:00:00,Guest opinion: The Road Map to Liberty
2022/07/03  00:00:00,Red Sox SS Xander Bogaerts Day-to-Day After Getting 7 Stitches for Thigh Injury
