date,title
2022/07/03  00:00:00,Parliamentary Secretary Oliphant to travel to Switzerland and United Kingdom
2022/07/03  00:00:00,Biden Admin Proposes New Offshore Oil and Gas Drilling in Stark Betrayal
2022/07/03  00:00:00,"7 books to help you understand Web3, blockchain, the metaverse, and other visions for the internet's future"
2022/07/03  00:00:00,Albanese visits war-ravaged towns in Ukraine
2022/07/03  00:00:00,"Oyebanji meets former Minister, Adelusi-Adeluyi, Lagos Police Commissioner, Alabi"
2022/07/03  00:00:00,The Return of Canadas National Family Law Program to In-Person Status
2022/07/03  00:00:00,Govt to issue red warrant to repatriate Farah
2022/07/03  00:00:00,Max Scherzers minor league postgame feast
2022/07/03  00:00:00,Forget Galaxy Z Fold 4! A cheap Samsung foldable phone likely on way
2022/07/03  00:00:00,Scottish independence: Greens back general election route to indyref2
2022/07/03  00:00:00,Google to delete location history for visits to abortion clinics
2022/07/03  00:00:00,Seven Rivers inmates graduate from NOUN
2022/07/03  00:00:00,Palestinian Authority hands bullet in Abu Akleh killing to US for 'examination'
2022/07/03  00:00:00,"Spanberger cranks up campaign in Culpeper, Orange, Prince William and Fredericksburg"
2022/07/03  00:00:00,Pakistan round-up: Close aide of Imran Khan's wife could face Red Corner Notice
2022/07/03  00:00:00,Compaia Mara Pags: An Ode to Time review  flamencos grande dame flies
2022/07/03  00:00:00,"India Gifts 75 Ambulances, 17 School Buses To Nepal"
2022/07/03  00:00:00,When Arizona Was Young:  Kofa began as a tent city
2022/07/03  00:00:00,"Letters to the editor: The Jan. 6 hearings, e-bikes and climate change"
2022/07/03  00:00:00,Judge puts Biden on the spot over immunity for Saudi crown prince
2022/07/03  00:00:00,China's Xi ushers in the end of global Hong Kong
2022/07/03  00:00:00,Foreign Ministry spokesman to head the National Public Diplomacy Directorate
2022/07/03  00:00:00,PA official tells 'Post' the Palestinians' 5 demands for Biden
2022/07/03  00:00:00,Russian diplomats declared personae non grata leaving Bulgaria  embassy
2022/07/03  00:00:00,Israel's interim PM Lapid holds 1st cabinet meeting
2022/07/03  00:00:00,Shelter from the storm: Hoosier missionaries in Ukraine reflect on invasion
2022/07/03  00:00:00,Albanese visits war-ravaged towns in Ukraine
2022/07/03  00:00:00,Vietnam reports 512 new COVID-19 cases
2022/07/03  00:00:00,"Post-Tribune |   			Driver who fled state police, jumped in Grand Cal had car connected to murder investigation: records"
2022/07/03  00:00:00,Seven Rivers inmates graduate from NOUN
2022/07/03  00:00:00,"Tucson-area authors with books on new beginnings, war, religion"
2022/07/03  00:00:00,Gavin Newsom goes on the air against Ron DeSantis as political rivalry grows
2022/07/03  00:00:00,"Capito, Smith visit site of Nucor's planned steel mill in Mason County"
2022/07/03  00:00:00,Wilde Aparthotels by Staycity Goes to Portugal
2022/07/03  00:00:00,"Jim Dey | For Illinois GOP, it's all over but the voting"
2022/07/03  00:00:00,Palestinian Authority hands bullet in Abu Akleh killing to US for 'examination'
2022/07/03  00:00:00,China's Xi ushers in the end of global Hong Kong
2022/07/03  00:00:00,"In the Herald: July 4, 1988"
2022/07/03  00:00:00,Curt Prendergast: Use gun safety model for border deaths
2022/07/03  00:00:00,"India News | Udaipur Killing: Some Forces Want to Humiliate India in World, Says Vijayvargiya"
2022/07/03  00:00:00,Intending Pilgrims from Niger stranded in Minna
2022/07/03  00:00:00,Akufo-Addo Is The IGP Of Demonstrations  Kumchacha
2022/07/03  00:00:00,Judge puts Biden on the spot over immunity for Saudi crown prince
2022/07/03  00:00:00,"Oyebanji meets former Minister, Adelusi-Adeluyi, Lagos Police Commissioner, Alabi"
2022/07/03  00:00:00,PA official tells 'Post' the Palestinians' 5 demands for Biden
2022/07/03  00:00:00,When Arizona Was Young:  Kofa began as a tent city
2022/07/03  00:00:00,"Spanberger cranks up campaign in Culpeper, Orange, Prince William and Fredericksburg"
2022/07/03  00:00:00,"Letters to the editor: The Jan. 6 hearings, e-bikes and climate change"
2022/07/03  00:00:00,Living History: Bringing the Past to Life
2022/07/03  00:00:00,"Capito, Smith visit site of Nucor's planned steel mill in Mason County"
2022/07/03  00:00:00,Russian ship carrying Ukrainian grain detained by Turkish customs
2022/07/03  00:00:00,OIA invests in medicine developer BioGenomics
2022/07/03  00:00:00,"Advanced Wall Radar, Rescue Dogs Look For Survivors In Manipur Landslide"
2022/07/03  00:00:00,Ethiopian Airlines commences Chennai-Addis Ababa direct flight
2022/07/03  00:00:00,Over 350 health workers attend Indo-Arab conference on COVID-19 impact
2022/07/03  00:00:00,Gaylord still waiting on FEMA response
2022/07/03  00:00:00,"Transcript: Homeland Security Secretary Alejandro Mayorkas on ""Face the Nation,"" July 3, 2022"
2022/07/03  00:00:00,"Tinubu Presidency: Afenifere urges Akande, Osinbajo, others to midwife genuine reconciliation"
2022/07/03  00:00:00,BJP national meet held in Hyderabad only to target KCR: TRS
2022/07/03  00:00:00,"Lawmakers ask city, other stakeholders for ideas on property tax reform"
2022/07/03  00:00:00,"World News | Indian Naval Ships Sahyadri, Kadmatt Visit Singapore for South East Asia Deployment"
2022/07/03  00:00:00,"Cheney says January 6 committee could make multiple criminal referrals, including of Trump"
2022/07/03  00:00:00,Albanese visits war-ravaged towns in Ukraine
2022/07/03  00:00:00,"Andhra Pradesh: Srikakulam to get a cancer hospital soon, says Collector"
2022/07/03  00:00:00,"7 books to help you understand Web3, blockchain, the metaverse, and other visions for the internet's future"
2022/07/03  00:00:00,Irans Foreign Minister Visits Assad in Damascus
2022/07/03  00:00:00,When Arizona Was Young:  Kofa began as a tent city
2022/07/03  00:00:00,"Spanberger cranks up campaign in Culpeper, Orange, Prince William and Fredericksburg"
2022/07/03  00:00:00,Andhra Pradesh: Visakha Ukku Parirakshana Porata Committee to stage black badge protest on July 4
2022/07/03  00:00:00,LeT terrorist apprehended by Reasi villagers formerly led BJP Jammu's IT cell; party responds [details]
2022/07/03  00:00:00,Ethiopian Airlines commences Chennai-Addis Ababa direct flight
2022/07/03  00:00:00,"Oyebanji meets former Minister, Adelusi-Adeluyi, Lagos Police Commissioner, Alabi"
2022/07/03  00:00:00,Face the Facts: Plans to Move Data Centers to Connecticut
2022/07/03  00:00:00,"Jaishankar, Wang may meet in Indonesia to end stalemate on India-China border stand-off"
2022/07/03  00:00:00,Road to Makkah feature works by VCUarts Qatar alumni
2022/07/03  00:00:00,"In the Herald: July 4, 1988"
2022/07/03  00:00:00,"Letters to the editor: The Jan. 6 hearings, e-bikes and climate change"
2022/07/03  00:00:00,"TCPS considers adding, repurposing virtual instruction days"
2022/07/03  00:00:00,More martyrs' remains to be returned to China from ROK
2022/07/03  00:00:00,Over 350 health workers attend Indo-Arab conference on COVID-19 impact
2022/07/03  00:00:00,Whistling while walking: Hymns from the pioneer trail
2022/07/03  00:00:00,"Namedropper: Shanen Aranmor, Reetika Dhawan, Tom Tyree, Linda Elliott-Nelson, Vic Smith"
2022/07/03  00:00:00,Google to delete location history for visits to abortion clinics
2022/07/03  00:00:00,Wilde Aparthotels by Staycity Goes to Portugal
2022/07/03  00:00:00,"Kadyrov talks about the mosque, located in the Moabit district in central Berlin, Germany"
2022/07/03  00:00:00,CGTN: Hong Kong on highway to become global tech and innovation hub 25 years on   USA - English      India - English     USA - espaol     USA - Polski     USA - P     Latin America - espaol     USA - Franais
2022/07/03  00:00:00,"Post-Tribune |   			Driver who fled state police, jumped in Grand Cal had car connected to murder investigation: records"
2022/07/03  00:00:00,Chris Cuomo returns to social media with on-scene photos from Ukraine
2022/07/03  00:00:00,Ministry of Finance signs agreements for offset projects
2022/07/03  00:00:00,"Tinubu Presidency: Afenifere urges Akande, Osinbajo, others to midwife genuine reconciliation"
2022/07/03  00:00:00,Woman pushes maid from four-storey building in Anambra
2022/07/03  00:00:00,"Letters to the Editor: July 3, 2022"
2022/07/03  00:00:00,"Tinubu: Afenifere urges South-West unity, synergy with other zones"
2022/07/03  00:00:00,Seven Rivers inmates graduate from NOUN
2022/07/03  00:00:00,Jeff Mills  From the clubs of Detroit to the Philharmonie in Luxembourg
2022/07/03  00:00:00,"10,000 flood victim families of Sylhet-Sunamganj to get Tk 10,000 each"
2022/07/03  00:00:00,LeT terrorist apprehended by Reasi villagers formerly led BJP Jammu's IT cell; party responds [details]
2022/07/03  00:00:00,Cheney says its possible Jan. 6 panel will make criminal referral against Trump
2022/07/03  00:00:00,Eastern Naval Command | Indian Naval Ships visit Singapore
2022/07/03  00:00:00,"Lawmakers ask city, other stakeholders for ideas on property tax reform"
2022/07/03  00:00:00,Punjab: Free power scheme to cost Bhagwant Mann-govt Rs 1.8K crore more
2022/07/03  00:00:00,Commentary roundup: What newspapers around the state are saying
2022/07/03  00:00:00,"Manchester United battle Chelsea, Tottenham for Jose Maria Gimenez"
2022/07/03  00:00:00,Over 350 health workers attend Indo-Arab conference on COVID-19 impact
2022/07/03  00:00:00,Rural children try their hand at art forms
2022/07/03  00:00:00,Samyukt Kisan Morcha takes 15 Punjab outfits back to its fold
2022/07/03  00:00:00,India News | Reach out to Deprived and Weaker Sections Among Minorities as Well: Modi to BJP Workers
2022/07/03  00:00:00,LTA starts trial of contactless green man button at 2 pedestrian crossings
2022/07/03  00:00:00,National Bank of Canada (NTIOF) Stock Forecast & Price Target
2022/07/03  00:00:00,"Transcript: Homeland Security Secretary Alejandro Mayorkas on ""Face the Nation,"" July 3, 2022"
2022/07/03  00:00:00,Archived: the proposed Bill of Rights and social work
2022/07/03  00:00:00,Intending Pilgrims from Niger stranded in Minna
2022/07/03  00:00:00,"Gov Ortom departs Nigeria for UK, US"
2022/07/03  00:00:00,'Road to Makkah' feature works by VCUarts Qatar alumni
2022/07/03  00:00:00,"Jaishankar, Wang may meet in Indonesia to end stalemate on India-China border stand-off"
2022/07/03  00:00:00,Eastern Naval Command | Indian Naval Ships visit Singapore
2022/07/03  00:00:00,Max Scherzers minor league postgame feast
2022/07/03  00:00:00,Irans Foreign Minister Visits Assad in Damascus
2022/07/03  00:00:00,Monroe Crossing returns to Spirit Lake on July 10
2022/07/03  00:00:00,West African bloc studies sanctions for coup-hit states
2022/07/03  00:00:00,Jeff Mills  From the clubs of Detroit to the Philharmonie in Luxembourg
2022/07/03  00:00:00,Governor Activates National Guard for Lingle Flooding
2022/07/03  00:00:00,Ministry of Finance signs agreements for offset projects
2022/07/03  00:00:00,Commentary roundup: What newspapers around the state are saying
2022/07/03  00:00:00,Shanghai reports one local asymptomatic COVID-19 case
2022/07/03  00:00:00,To the people of the United States
2022/07/03  00:00:00,Throwback Tulsa: Gilcrease Museum's Declaration of Independence goes on display four years ago
2022/07/03  00:00:00,Stars Align for Cody's Wish and Namesake Cody Dorman
2022/07/03  00:00:00,Over 350 health workers attend Indo-Arab conference on COVID-19 impact
2022/07/03  00:00:00,"Lawmakers ask city, other stakeholders for ideas on property tax reform"
2022/07/03  00:00:00,Gavin Newsom goes on the air against Ron DeSantis as political rivalry grows
2022/07/03  00:00:00,"Manchester United battle Chelsea, Tottenham for Jose Maria Gimenez"
2022/07/03  00:00:00,On the hunt for invasive moths in Alaska
2022/07/03  00:00:00,"Post-Tribune |   			Driver who fled state police, jumped in Grand Cal had car connected to murder investigation: records"
2022/07/03  00:00:00,Nile Parting Ways With Bassist-Vocalist Brad Parris
2022/07/03  00:00:00,Devon Energy Donates to Wyoming Agriculture in the Classroom
2022/07/03  00:00:00,"Letters to the Editor: July 3, 2022"
2022/07/03  00:00:00,More martyrs' remains to be returned to China from ROK
2022/07/03  00:00:00,Living History: Bringing the Past to Life
2022/07/03  00:00:00,Google will erase location history info from smartphones about visits to abortion clinics
2022/07/03  00:00:00,Lithuania invites Taiwan to mark US centennial ties
2022/07/03  00:00:00,Beijing blacklisting more Taiwanese books: source
2022/07/03  00:00:00,"Brutus, Blanhum appointed Assistant Commissioners of Police"
2022/07/03  00:00:00,"Gov Ortom departs Nigeria for UK, US"
2022/07/03  00:00:00,"Senate president, House speaker meet head of Azeri National Assembly"
2022/07/03  00:00:00,Stephen M. Young On Taiwan: More thoughts on Ukraines significance to cross-strait tensions
2022/07/03  00:00:00,The Supreme Court marshal asks state officials to act on protests at justices' homes
2022/07/03  00:00:00,Rural children try their hand at art forms
2022/07/03  00:00:00,"Russia receives more than 29,000 refugees from Donbass and Ukraine"
2022/07/03  00:00:00,The Penguin Copies The Joker In Dark Knight (Batman #125 Spoilers)
2022/07/03  00:00:00,"Manchester United battle Chelsea, Tottenham for Jose Maria Gimenez"
2022/07/03  00:00:00,Road to Makkah feature works by VCUarts Qatar alumni
2022/07/03  00:00:00,PM Lapid meets with Health Minister amid rise in COVID rates
2022/07/03  00:00:00,The Washington Brief -- The Washington Times Foundation
2022/07/03  00:00:00,Manchester United 'warn wantaway Cristiano Ronaldo that he MUST travel on their pre-season tour of Thailand and Australia this week' after the striker's bombshell demand that the Red Devils let him leave this summer
2022/07/03  00:00:00,"City, county looking at future of industry in Dawson Springs"
2022/07/03  00:00:00,Eel Pond Sewer Line Project Given Green Light
2022/07/03  00:00:00,The Maha thriller: Corroborating facets and ramifications
2022/07/03  00:00:00,Comments sought on one of best pumped storage sites in Washington
2022/07/03  00:00:00,"Kadyrov talks about the mosque, located in the Moabit district in central Berlin, Germany"
2022/07/03  00:00:00,Whistling while walking: Hymns from the pioneer trail
2022/07/03  00:00:00,Russian cargo ship detained in Turkey at Kievs request  Ukrainian ambassador
2022/07/03  00:00:00,Amravati killing: MP Navneet Rana meets slain chemist Umesh Kolhe's family
2022/07/03  00:00:00,Supporters thronged BJP meet venue since morning
2022/07/03  00:00:00,"Lawmakers ask city, other stakeholders for ideas on property tax reform"
2022/07/03  00:00:00,The Penguin Copies The Joker In Dark Knight (Batman #125 Spoilers)
2022/07/03  00:00:00,The Supreme Court marshal asks state officials to act on protests at justices' homes
2022/07/03  00:00:00,India News | Reach out to Deprived and Weaker Sections Among Minorities as Well: Modi to BJP Workers
2022/07/03  00:00:00,AEC to fight Taipower waste ruling
2022/07/03  00:00:00,"Nigerian Anti-narcotics Agency, NDLEA Intercepts N4.5bn Heroin In Baby Food As Ex-BRT Driver Excretes 90 Pellets Of Cocaine"
2022/07/03  00:00:00,"Cheney says January 6 committee could make multiple criminal referrals, including of Trump"
2022/07/03  00:00:00,Beijing blacklisting more Taiwanese books: source
2022/07/03  00:00:00,Stephen M. Young On Taiwan: More thoughts on Ukraines significance to cross-strait tensions
2022/07/03  00:00:00,Manchester United 'warn wantaway Cristiano Ronaldo that he MUST travel on their pre-season tour of Thailand and Australia this week' after the striker's bombshell demand that the Red Devils let him leave this summer
2022/07/03  00:00:00,Ukraine starts exporting electricity to Romania
2022/07/03  00:00:00,"Pax tecum, et cum spirituo tuo: Sunday reflection"
2022/07/03  00:00:00,"Manchester United battle Chelsea, Tottenham for Jose Maria Gimenez"
2022/07/03  00:00:00,Reward for low-ranking do-gooders from Bangkok governor
2022/07/03  00:00:00,Amravati killing: MP Navneet Rana meets slain chemist Umesh Kolhe's family
2022/07/03  00:00:00,"MG PH's 'Coming Home' available on Spotify, YouTube Music"
2022/07/03  00:00:00,"Lawmakers ask city, other stakeholders for ideas on property tax reform"
2022/07/03  00:00:00,"Gantz can appoint new IDF chief despite elections, DM lawyer tells A-G"
2022/07/03  00:00:00,"Maine authors visit MDI for signings, talks"
2022/07/03  00:00:00,"Letters to the Editor: July 3, 2022"
2022/07/03  00:00:00,LTA starts trial of contactless green man button at 2 pedestrian crossings
2022/07/03  00:00:00,"City, county looking at future of industry in Dawson Springs"
2022/07/03  00:00:00,A spectrum of belief among the founding fathers
2022/07/03  00:00:00,"Mandsaur: Last-ditch efforts by Congress, BJP to garner votes; Congress promises efficient mgmt of water bodies"
2022/07/03  00:00:00,Governor Activates National Guard for Lingle Flooding
2022/07/03  00:00:00,"Nigerian Anti-narcotics Agency, NDLEA Intercepts N4.5bn Heroin In Baby Food As Ex-BRT Driver Excretes 90 Pellets Of Cocaine"
2022/07/03  00:00:00,Anime Expo 2022 SPY x FAMILY English Dub Cast Panel
2022/07/03  00:00:00,31 Shot Friday into Sunday Morning in Mayor Lori Lightfoots Chicago
2022/07/03  00:00:00,Commentary roundup: What newspapers around the state are saying
2022/07/03  00:00:00,"Manchester United battle Chelsea, Tottenham for Jose Maria Gimenez"
2022/07/03  00:00:00,The start-ups taking nanoneedles into the clinic
2022/07/03  00:00:00,The Washington Brief -- The Washington Times Foundation
2022/07/03  00:00:00,The Role of Luxury Wellness and Fitness Retreats in Europe and UK
2022/07/03  00:00:00,Lithuania invites Taiwan to mark US centennial ties
2022/07/03  00:00:00,TMS to stop SIM spin in the Zimbabwe
2022/07/03  00:00:00,Scholz hints at Lufthansa-like bailout for gas giant Uniper
2022/07/03  00:00:00,Chris Pincher suspension: Boris Johnson unaware of specific claims - minister
2022/07/03  00:00:00,"Gantz can appoint new IDF chief despite elections, DM lawyer tells A-G"
2022/07/03  00:00:00,Author to discuss writing at the JesupJuly 7
2022/07/03  00:00:00,The Supreme Court marshal asks state officials to act on protests at justices' homes
2022/07/03  00:00:00,Manchester United 'warn wantaway Cristiano Ronaldo that he MUST travel on their pre-season tour of Thailand and Australia this week' after the striker's bombshell demand that the Red Devils let him leave this summer
2022/07/03  00:00:00,A spectrum of belief among the founding fathers
2022/07/03  00:00:00,"Health News Roundup: Guinea culls 200,000 poultry at risk of H5N1 bird flu contamination - govt; EU proposes ban on flavored heated tobacco products and more"
2022/07/03  00:00:00,Watch: Silent vigil held in Ilford to bring home Zara Aleena
2022/07/03  00:00:00,"APC VP slot: Tinubu considers Shettima, Zulum, El-Rufai, Ganduje out"
2022/07/03  00:00:00,COVID-19: Israel's health minister recommends wearing masks indoors
2022/07/03  00:00:00,Jim McKee: Many names for East Campus
2022/07/03  00:00:00,"Indore: Nipania, Pipliyakumar residents want separate police station"
2022/07/03  00:00:00,Explained | The functioning of the National Investigation Agency Premium
2022/07/03  00:00:00,The start-ups taking nanoneedles into the clinic
2022/07/03  00:00:00,N1.8bn: Recall Buratai for investigation  PDP tasks Buhari
2022/07/03  00:00:00,"Liz Cheney says the Jan. 6 committee could potentially make multiple criminal referrals, including one against Trump"
2022/07/03  00:00:00,CPC To Assure Fuel To Companies That Pay In USD
2022/07/03  00:00:00,"Kwara to recruit 197 medical personnel, health workers"
2022/07/03  00:00:00,Big Techs days are numbered: GETTR expands platform with DMs for July 4
2022/07/03  00:00:00,The Maha thriller: Corroborating facets and ramifications
2022/07/03  00:00:00,Stephen M. Young On Taiwan: More thoughts on Ukraines significance to cross-strait tensions
2022/07/03  00:00:00,Prison labour used to build new parts of Waikeria Prison
2022/07/03  00:00:00,Chelsea squeeze United in the 'race' for De Jong
2022/07/03  00:00:00,Steve VanderVeen: Former mayor Henry Kremers bridged a political-economic divide
2022/07/03  00:00:00,"Mandsaur: Last-ditch efforts by Congress, BJP to garner votes; Congress promises efficient mgmt of water bodies"
2022/07/03  00:00:00,Seven Prisoners Graduate From Nigerian University With Second-Class Upper And Lower Degrees
2022/07/03  00:00:00,The Knesset dissolved itself - opinion
2022/07/03  00:00:00,FM meets with counterpart from Myanmar
2022/07/03  00:00:00,"""Opposition To Aarey Metro Car Shed Likely Sponsored"": Devendra Fadnavis"
2022/07/03  00:00:00,Amravati killing: MP Navneet Rana meets slain chemist Umesh Kolhe's family
2022/07/03  00:00:00,Eknath Shinde-Led Maharashtra Govt to Face Floor Test Tomorrow
2022/07/03  00:00:00,"Klarna looks to raise cash at truncated $6.5b valuation from Sequoia, others"
2022/07/03  00:00:00,Manchester United 'warn wantaway Cristiano Ronaldo that he MUST travel on their pre-season tour of Thailand and Australia this week' after the striker's bombshell demand that the Red Devils let him leave this summer
2022/07/03  00:00:00,Facebook Tells Judge To Crack the Whip To Gag Black Whistleblower Alleging Human Trafficking
2022/07/03  00:00:00,The US watery Indo-Pacific alphabet soup
2022/07/03  00:00:00,"City, county looking at future of industry in Dawson Springs"
2022/07/03  00:00:00,"Indore: Nipania, Pipliyakumar residents want separate police station"
2022/07/03  00:00:00,19 Years Of Personal Data Was Stolen From ANU. It Could Show Up On The Dark Web
2022/07/03  00:00:00,10 LGBTQ Lane County and statewide resources you should know about
2022/07/03  00:00:00,Hold talks with the opponents China urges Myanmar junta
2022/07/03  00:00:00,IA Readies Enforcement of New Elder Abuse Law
2022/07/03  00:00:00,N1.8bn: Recall Buratai for investigation  PDP tasks Buhari
2022/07/03  00:00:00,Lithuania invites Taiwan to mark US centennial ties
2022/07/03  00:00:00,Chris Pincher suspension: Boris Johnson unaware of specific claims - minister
2022/07/03  00:00:00,The Knesset dissolved itself - opinion
2022/07/03  00:00:00,California Gov. Newsom runs ads in Florida attacking GOP
2022/07/03  00:00:00,Eel Pond Sewer Line Project Given Green Light
2022/07/03  00:00:00,"Nigerian Anti-narcotics Agency, NDLEA Intercepts N4.5bn Heroin In Baby Food As Ex-BRT Driver Excretes 90 Pellets Of Cocaine"
2022/07/03  00:00:00,University of Dhaka: The Trillion Dollar Opportunity Cost
2022/07/03  00:00:00,Eknath Shinde-Led Maharashtra Govt to Face Floor Test Tomorrow
2022/07/03  00:00:00,"Former DHS sec. says if Biden decides not to run in 2024, he should announce 'sooner rather than later'"
2022/07/03  00:00:00,Steve VanderVeen: Former mayor Henry Kremers bridged a political-economic divide
2022/07/03  00:00:00,The Maha thriller: Corroborating facets and ramifications
2022/07/03  00:00:00,"NNPP only option for South-East, says Kwankwaso"
2022/07/03  00:00:00,"Ireland's sailing, boating & maritime magazine"
2022/07/03  00:00:00,FM meets with counterpart from Myanmar
2022/07/03  00:00:00,TAIPEI TIMES Army to launch Mighty Eagle helicopter drills
2022/07/03  00:00:00,"Transcript: Rep. Adam Schiff on ""Face the Nation,"" July 3, 2022"
2022/07/03  00:00:00,Watch: Silent vigil held in Ilford to bring home Zara Aleena
2022/07/03  00:00:00,Manchester United 'warn wantaway Cristiano Ronaldo that he MUST travel on their pre-season tour of Thailand and Australia this week' after the striker's bombshell demand that the Red Devils let him leave this summer
2022/07/03  00:00:00,Present evidence-based arguments: Japanese ambassador to TIB
2022/07/03  00:00:00,"APC VP slot: Tinubu considers Shettima, Zulum, El-Rufai, Ganduje out"
2022/07/03  00:00:00,The start-ups taking nanoneedles into the clinic
2022/07/03  00:00:00,"Osun: APC campaign council, debate organizer trade tackles over Oyetolas absence"
2022/07/03  00:00:00,"G20 foreign ministers meet: Jaishankar to outline India's view on food, energy security"
2022/07/03  00:00:00,Cheney: Jan. 6 panel could make multiple criminal referrals of Trump
2022/07/03  00:00:00,Govt. to urge Centre to slash GST rates for manufacturing SUP alternatives
2022/07/03  00:00:00,"Sahara: New York Hosts Seminar on Territorial Autonomy, Devolution of Legislative Powers"
2022/07/03  00:00:00,Benguet farmer's daughter marches as magna cum laude
2022/07/03  00:00:00,Google to Clear Search History of Users Visiting Abortion Clinics
2022/07/03  00:00:00,Soaring prices extend energy and resource export boom
2022/07/03  00:00:00,Adani Enterprises lowest bidder in CIL import tender
2022/07/03  00:00:00,The US watery Indo-Pacific alphabet soup
2022/07/03  00:00:00,Hamilton County inmate escapes custody from University of Cincinnati Medical Center
2022/07/03  00:00:00,10 LGBTQ Lane County and statewide resources you should know about
2022/07/03  00:00:00,France and Australia hint at reviving trilateral with India
2022/07/03  00:00:00,"""Opposition To Aarey Metro Car Shed Likely Sponsored"": Devendra Fadnavis"
2022/07/03  00:00:00,The Knesset dissolved itself - opinion
2022/07/03  00:00:00,"City, county looking at future of industry in Dawson Springs"
2022/07/03  00:00:00,"2,672 test positive in Tamil Nadu"
2022/07/03  00:00:00,War brought back good ol letters  temporarily
2022/07/03  00:00:00,Stephen M. Young On Taiwan: More thoughts on Ukraines significance to cross-strait tensions
2022/07/03  00:00:00,"G20 foreign ministers meet: Jaishankar to outline India's view on food, energy security"
2022/07/03  00:00:00,California Gov. Newsom runs ads in Florida attacking GOP
2022/07/03  00:00:00,"Woman charged S$15 for veggie, curry chicken & rice from S'pore Little India eatery"
2022/07/03  00:00:00,University of Dhaka: The Trillion Dollar Opportunity Cost
