date,title
2022/09/11  00:00:00,McWhorter to engineer CIE's future | WilmingtonBiz
2022/09/11  00:00:00,"Headline News | Aero-News Network - The Aviation and Aerospace World's Daily, Real-time News and Information Service"
2022/09/11  00:00:00,"Airborne 09.07.22: G100UL Approvals, Alaska Floatplane Attack, Disney Gulfstream"
2022/09/11  00:00:00,Airbus axes remaining A350 jet deal with Qatar -sources
2022/09/11  00:00:00,Indian company to develop Nepal hydropower plant left by China
2022/09/11  00:00:00,8 digital benefits of a Citizen Times subscription
2022/09/11  00:00:00,"Stephen Lang Photos, News, and Videos"
2022/09/11  00:00:00,"Glass Onion Photos, News, and Videos"
2022/09/11  00:00:00,"Andrew Garfield Photos, News, and Videos"
2022/09/11  00:00:00,"Darren Aronofsky Photos, News, and Videos"
2022/09/11  00:00:00,"Samantha Hanratty Photos, News, and Videos"
2022/09/11  00:00:00,"Fai Khadra Photos, News, and Videos"
2022/09/11  00:00:00,"DeJa Skye Photos, News, and Videos"
2022/09/11  00:00:00,"Noah Beck Photos, News, and Videos"
2022/09/11  00:00:00,Texas Shooting News | Live Feed & Top Stories
2022/09/11  00:00:00,NewsNow: Earthquakes news | Breaking News & Search 24/7
2022/09/11  00:00:00,Antigua and Barbuda News | Latest News
2022/09/11  00:00:00,NewsNow: Air Accidents news | Breaking News & Search 24/7
2022/09/11  00:00:00,Afghanistan News | Afghanistan Latest News 24/7
2022/09/11  00:00:00,US Politics News | Latest News
2022/09/11  00:00:00,California Wildfires News | Latest & Breaking News
2022/09/11  00:00:00,NewsNow: Radiation news | Breaking News & Search 24/7
2022/09/11  00:00:00,NewsNow: Miscarriage news | Breaking News & Search 24/7
2022/09/11  00:00:00,U.S. Rep. Mariannette Miller-Meeks campaigns with U.S. Sen. Rick Scott at Johnson County event
2022/09/11  00:00:00,Investors to recover part of money swindled by Microsoft exec
2022/09/11  00:00:00,"TX WFO MIDLAND/ODESSA Warnings, Watches, and Advisories"
2022/09/11  00:00:00,"THE CITIZEN EDITORIAL, The Citizen - Independent Journalism | Indian News | The Citizen"
2022/09/11  00:00:00,White Papers and Case Studies Library - Thomasnet
2022/09/11  00:00:00,Saints WR Michael Thomas active vs. Falcons
2022/09/11  00:00:00,White Sox' Tony La Russa to watch as A's honor Dave Stewart
2022/09/11  00:00:00,GHKPM: Neil and Ayesha's fans get into war over THIS BALH2 scene [Find Out]
2022/09/11  00:00:00,Take 5: Nebraska coaching candidates to replace Scott Frost
2022/09/11  00:00:00,Polk S.W.A.T. Medics Train to Stay Sharp - DailyRidge.com
2022/09/11  00:00:00,"Blue Thumb Pool Care Services Lake Wales, Frostproof, Babson Park, Indian Lake Estates, and Surrounding Areas! - DailyRidge.com"
2022/09/11  00:00:00,38 Yr Old Winter Haven Woman The Tip Of The Iceberg In 53 Million Dollar Methamphetamine Bust - DailyRidge.com
2022/09/11  00:00:00,Armed Suspects Try To 77 Yr. Old At ATM - DailyRidge.com
2022/09/11  00:00:00,"Lucresia Granados of Lake Wales, Florida | 1940 - 2015 - DailyRidge.com"
2022/09/11  00:00:00,If Either President Trump Or Presidential Candidate Biden Were To Die Or Become Incapacitated A Divided Congress Would Assure No Delay In Election - DailyRidge.com
2022/09/11  00:00:00,Notice Regarding Traffic Along Hwy 542 (Dundee Rd) - DailyRidge.com
2022/09/11  00:00:00,PCSO Detectives Seeking Public's Help Locating Attempted Armed Robbery Suspect with Warrant - DailyRidge.com
2022/09/11  00:00:00,Man Steals Over $400 Worth of Meat From Walmart - DailyRidge.com
2022/09/11  00:00:00,Man Steals Tire From Walmart And Refuses to Show Receipt When Stopped - DailyRidge.com
2022/09/11  00:00:00,"Man Grabs Speakers From Walmart, Stuffs Them Into Stolen Backpack and Darts Out The Door - DailyRidge.com"
2022/09/11  00:00:00,Cooking on the Ridge: Pork Chops with Apple Cider Glaze - DailyRidge.com
2022/09/11  00:00:00,Fire It Up! offers barbecue judging class
2022/09/11  00:00:00,Crochet postbox topper made for village postbox
2022/09/11  00:00:00,Aventura sobre ruedas: La viajera misionera que recorre las rutas en moto junto a su perro
2022/09/11  00:00:00,Business Loop 70 CID looks ahead to Mizzou North demolition
2022/09/11  00:00:00,Transformers Legacy Tarantulas Found at Gamestop Canada
2022/09/11  00:00:00,"Parliamentary correspondents task NASS on accelerated passage of audit, budget reform bills"
2022/09/11  00:00:00,Politics of the Commons: Prometheus Unbound
2022/09/11  00:00:00,Pageantry and procession in the rain in Hillsborough
2022/09/11  00:00:00,Kin of forest personnel dying in duty to get higher solatium of Rs 50 lakh: ...
2022/09/11  00:00:00,"Data Kasus & Kematian Covid-19 di Jakarta, 11 September 2022"
2022/09/11  00:00:00,Douglas Elliman Real Estate | Greenwich Daily Voice
2022/09/11  00:00:00,Healthy Hydroponics launches Pathogen Mini and Pathogen+
2022/09/11  00:00:00,"NCAA Season 98 Box Scores: CSB Blazers vs LPU Pirates, September 11, 2022 | NCAA Philippines"
2022/09/11  00:00:00,"Boron Nitride BN powder_integra927.com | Nanomaterials, Chemical Products"
2022/09/11  00:00:00,"Spherical Niobium Powder_integra927.com | Nanomaterials, Chemical Products"
2022/09/11  00:00:00,"Ti6Al4V Powder_integra927.com | Nanomaterials, Chemical Products"
2022/09/11  00:00:00,"Nano silica powder application_integra927.com | Nanomaterials, Chemical Products"
2022/09/11  00:00:00,"silicon nitride_integra927.com | Nanomaterials, Chemical Products"
2022/09/11  00:00:00,"Water reducer_integra927.com | Nanomaterials, Chemical Products"
2022/09/11  00:00:00,"Concrete Foaming Agent_integra927.com | Nanomaterials, Chemical Products"
2022/09/11  00:00:00,"spherical quartz powder_integra927.com | Nanomaterials, Chemical Products"
2022/09/11  00:00:00,"WS2 powder_integra927.com | Nanomaterials, Chemical Products"
2022/09/11  00:00:00,"316L powder_integra927.com | Nanomaterials, Chemical Products"
2022/09/11  00:00:00,High Purity 3D Printing Ti6Al4V Powder TC4 Powder
2022/09/11  00:00:00,Polyvinyl Alcohol Fiber PVA Fiber for Concrete
2022/09/11  00:00:00,"Zinc sulfide ZnS powder_integra927.com | Nanomaterials, Chemical Products"
2022/09/11  00:00:00,"Overview of spherical quartz SiO2 powder_integra927.com | Nanomaterials, Chemical Products"
2022/09/11  00:00:00,"concrete slump_integra927.com | Nanomaterials, Chemical Products"
2022/09/11  00:00:00,Market Trend and Demand The domestic steel market prices continue to rise Will Affact the Price of Silica powder
2022/09/11  00:00:00,Influence of Concrete Foaming Agent on Foam Concrete (2)
2022/09/11  00:00:00,The market application of the glass reinforced polyamide
2022/09/11  00:00:00,"Aerogel Felt Price_integra927.com | Nanomaterials, Chemical Products"
2022/09/11  00:00:00,"Hafnium Diboride Suppliers_integra927.com | Nanomaterials, Chemical Products"
2022/09/11  00:00:00,"manganese silicide suppliers_integra927.com | Nanomaterials, Chemical Products"
2022/09/11  00:00:00,"gallium oxide overview_integra927.com | Nanomaterials, Chemical Products"
2022/09/11  00:00:00,"Global sodium myristate, sodium myristate overview, sodium myristate application, sodium myristate suppliers, sodium myristate price market trend 2025-2030 Overview of Sodium Myristate by Newsintegra927"
2022/09/11  00:00:00,IEA Intends to Release Strategic Oil Reserves Again Will Affect the Price of superfine spherical aluminum nitride powder
2022/09/11  00:00:00,"Zirconium disilicide zrsi2 powder_integra927.com | Nanomaterials, Chemical Products"
2022/09/11  00:00:00,"overview of zirconium disilicide zrsi2 powder_integra927.com | Nanomaterials, Chemical Products"
2022/09/11  00:00:00,"Silicon Nitride Overview_integra927.com | Nanomaterials, Chemical Products"
2022/09/11  00:00:00,"Port Jefferson Chamber of Commerce in Long Island, Port Jefferson, NY"
2022/09/11  00:00:00,"Theodore Roosevelt Sanctuary and Audubon Center in Long Island, Oyster Bay, NY"
2022/09/11  00:00:00,Lightning sparks fires across western Montana
2022/09/11  00:00:00,Russian forces retreat amid Ukrainian counteroffensive
2022/09/11  00:00:00,Jumper Frog - Free Online Games
2022/09/11  00:00:00,Papa Cherry Saga - Free Online Games
2022/09/11  00:00:00,Pizza Ninja 3 - Free Online Games
2022/09/11  00:00:00,"Fortuna de Isabel II supera la Kim Kardashian, Beyonce, Oprah Winfrey y Bill Gates"
2022/09/11  00:00:00,"Barron, Weber St. defense suffocate Utah St. 35-7"
2022/09/11  00:00:00,Poland says Ukraine ready to offer power as coal alternative
2022/09/11  00:00:00,Springfield springs big plays on Wildcats
2022/09/11  00:00:00,Dnipro and Nikopol under Russian attacks
2022/09/11  00:00:00,Russia hits Dnipropetrovsk power sites: governor
2022/09/11  00:00:00,"Wentz tosses 4 TDs, Commanders come back to beat Jaguars"
2022/09/11  00:00:00,"Panthers player, wife fostering relationships between police, Charlotte youth"
2022/09/11  00:00:00,E-Racers: JSU toils but downs old OVC rival Murray State
2022/09/11  00:00:00,Boston 25 News Sunday morning forecast
2022/09/11  00:00:00,Canada's Conservatives pick populist Pierre Poilievre to take on Trudeau
2022/09/11  00:00:00,Bengals QB Joe Burrow throws pick-6 to Minkah Fitzpatrick on his first pass of season
2022/09/11  00:00:00,WBZ News update for September 11
2022/09/11  00:00:00,Caribbean Premier League 2022 - Discussion Thread
2022/09/11  00:00:00,Dolci 5 Layer Cast Stretch Film Extrusion Line In Asia
2022/09/11  00:00:00,Maddie B. Barkate | Writer Page | The Harvard Crimson
2022/09/11  00:00:00,"VIP Armenia Community forums, chat, blogs, games"
2022/09/11  00:00:00,Springdale looks to add to packed senior center
2022/09/11  00:00:00,Antigua and Barbuda plans to vote on King Charles's role as head of state
2022/09/11  00:00:00,Inflammatory material causes India to meet Wikipedia officials
2022/09/11  00:00:00,AIA-CKC Home Tour: Emily Fisher brings a 1950s ranch back to its mid-century roots
2022/09/11  00:00:00,AIA-CKC Home Tour: Anne Del Prince on opening up a traditional bungalow into the Gruenig Residence
2022/09/11  00:00:00,GLOBALink | Seamless rail-welding technician of China's high-speed railway
2022/09/11  00:00:00,Amit Shah attends Annual General Meeting (AGM) of major cooperatives in Gujarat
2022/09/11  00:00:00,Report: Rams had eyes on 49ers QB Jimmy Garoppolo
2022/09/11  00:00:00,St. Michael the Archangel - Saints & Angels - Catholic Online
2022/09/11  00:00:00,Nicene Creed (Latin) - Prayers - Catholic Online
2022/09/11  00:00:00,Lee bolsters investigative efforts with 12-person Public Service team
2022/09/11  00:00:00,Ferne McCann yanks off bra after huge SAS Who Dares Wins wardrobe malfunction
2022/09/11  00:00:00,"Karen Graham, Author at Digital Journal"
2022/09/11  00:00:00,"Confronting history, Congress studies addition of lynching sites to national park system - Florida Phoenix"
2022/09/11  00:00:00,Dodge County Court Judge leaving the bench in Sept. 2
2022/09/11  00:00:00,AP News in Brief at 6:04 a.m. EDT
2022/09/11  00:00:00,Germany's Scholz sees no imminent nuclear deal with Iran
2022/09/11  00:00:00,Queen Elizabeth II's Coffin Makes Journey Through Scotland
2022/09/11  00:00:00,Property assessment changes highlighted at League of Municipalities
2022/09/11  00:00:00,Politics in air as Biden visits future Intel plant in Ohio - New Delhi Times - India Only International Newspaper
2022/09/11  00:00:00,Australia and New Zealand proclaim Charles III as monarch
2022/09/11  00:00:00,Russian forces retreat amid Ukrainian counteroffensive
2022/09/11  00:00:00,The Yankees Give Themselves a Clinic
2022/09/11  00:00:00,Chiefs' Reid takes over kicking duties after Butker injury | RiverBender.com
2022/09/11  00:00:00,Six old photos of Slough which includes a visit from King George VI and Elizabeth Queen Consort
2022/09/11  00:00:00,Pageantry and procession in the rain in Hillsborough
2022/09/11  00:00:00,The Week That Perished - Taki's Magazine
2022/09/11  00:00:00,"Sterling Shepard active, Kayvon Thibodeaux inactive for Giants"
2022/09/11  00:00:00,Pitch Black - Tours at Undertheradar
2022/09/11  00:00:00,Interview: You Am I - New Zealand Tour
2022/09/11  00:00:00,NH Business: Senate GOP candidates take on inflation
2022/09/11  00:00:00,CMC memo to employees slams Boston Globe story on former heart surgeon (copy)
2022/09/11  00:00:00,"Mewar Spring Festival 2022 date : 4.4.2022 - 6.4.2022,Mewar Festival | Spring Festival | Mewar Festival of Udaipur"
2022/09/11  00:00:00,"Union territory Delhi - Land, People, Festival, Tourism, Economy"
2022/09/11  00:00:00,Russia hits power stations after Ukraine counter-offensive
2022/09/11  00:00:00,Pierre Poilievre: Populist takes helm of Canada's Conservatives | Politics News - WiredPRNews.com
2022/09/11  00:00:00,"Hindu Temple, Abbotsford, and Hope Gurukul, in BC, Canada jointly organized Ganpati Visarjan"
2022/09/11  00:00:00,"Buccaneer Boating, New Zealand | Boat Builders, NZ"
2022/09/11  00:00:00,Sri Lanka : Court orders to sell 5000 liters of confiscated kerosene and deposit the proceeds in the Consumer Authority Account
2022/09/11  00:00:00,Photo from the front page of DailySource
2022/09/11  00:00:00,"Urgent: 6.0-magnitude quake hits 175 km WSW of Pariaman, Indonesia -- USGS"
2022/09/11  00:00:00,Roundup: Chinese astronauts talk from space with African youth
2022/09/11  00:00:00,Three McDonald's: The Myth of Regeneration Through Violence
2022/09/11  00:00:00,Nvidia GeForce Now Games List - Every Game Available to
2022/09/11  00:00:00,TQ0178 :: Browse 44 Images :: Geograph Britain and Ireland
2022/09/11  00:00:00,Hawke's Bay New Zealand | Official Tourism Website
2022/09/11  00:00:00,"455 Summer St Lanesborough, MA 01237 / iBerkshires.com - The Berkshires online guide to events, news and Berkshire County community information."
2022/09/11  00:00:00,"42 West Sheffield Rd Great Barrington, MA 01230 / iBerkshires.com - The Berkshires online guide to events, news and Berkshire County community information."
2022/09/11  00:00:00,"Krishnam Raju to be cremated with state honours; Mahesh Babu, Prabhas reach Telugu star's house"
2022/09/11  00:00:00,Holocaust | The Jewish Press - JewishPress.com
2022/09/11  00:00:00,Dmitriy Shapiro (JNS) | The Jewish Press - JewishPress.com
2022/09/11  00:00:00,"VBG Gardens in Mehdipatnam, Hyderabad: Price, Brochure, Floor Plan, Reviews"
2022/09/11  00:00:00,"Royal Enclave in New Town, Kolkata: Price, Brochure, Floor Plan, Reviews"
2022/09/11  00:00:00,Lost In Translation | PAUL GRAVETT
2022/09/11  00:00:00,Government IT News and Analysis in Pakistan - ProPakistani
2022/09/11  00:00:00,"Justin Phillips, Columnist - San Francisco Chronicle"
2022/09/11  00:00:00,Connect | Grants available to Texas landowners for prescribed burning TFS
2022/09/11  00:00:00,Tamkeen backs training of 100 Bahrainis in iOS app development
2022/09/11  00:00:00,Trina Solar brings next-generation PV to MEA
2022/09/11  00:00:00,Addressing Security And Connectivity With Cash Drawer Configuration Options
2022/09/11  00:00:00,AP News in Brief at 6:04 p.m. EDT
2022/09/11  00:00:00,Fox added digital field marks to Bears-49ers after rain washed them away
2022/09/11  00:00:00,North Dakota getting omicron-targeting COVID boosters
2022/09/11  00:00:00,B.C. business' lawsuit against client who posted negative Google review allowed to proceed
2022/09/11  00:00:00,Birding: Out and about on the Peninsula
2022/09/11  00:00:00,NAPA Auto Parts - Gulf Coast Parts Supply
2022/09/11  00:00:00,Florida Dermatology and Skin Cancer Centers
2022/09/11  00:00:00,Dunkin' Donuts - Inverness Stone Way
2022/09/11  00:00:00,A-1 Title Of The Nature Coast Inc.
2022/09/11  00:00:00,The Floral City Church Of Christ
2022/09/11  00:00:00,'Rumble' returns to the Lemoore Recreation Center
2022/09/11  00:00:00,Ask Amy: Retired couple signed prenuptial agreement to keep finances separate
2022/09/11  00:00:00,"Brandon Nimmo, Tomas Nido help Mets bash Marlins"
2022/09/11  00:00:00,Peter Facinelli planning to recruit teenage daughter to babysit newborn
2022/09/11  00:00:00,Taking action from 'Hills to Oceans'
2022/09/11  00:00:00,"NL Injury Notes: Madrigal, Wisdom, Dominguez, Eflin, Wheeler, Bryant"
2022/09/11  00:00:00,Jaishankar co-chairs India-Saudi Partnership Council committee
2022/09/11  00:00:00,6 Fixes For People Behind on Retirement Savings
2022/09/11  00:00:00,Immortality game screenshots - Image #31231
2022/09/11  00:00:00,Debts: FCTA drags 413 land owners to court
2022/09/11  00:00:00,Brotality Band on Backstage With Mothership - Solid Rock Radio
2022/09/11  00:00:00,Pageantry and procession in the rain in Hillsborough
2022/09/11  00:00:00,Teen Defends Family With Shotgun Killing 2 Intruders Breaking Into Home | Talk Radio 105.9
2022/09/11  00:00:00,MSU addressing Stanley contract amid board pressure for him to retire
2022/09/11  00:00:00,Gearing up to serve global hyperscalers
2022/09/11  00:00:00,ED stops Abhishek Banerjee's sister-in-law from boarding Bangkok-bound flight at Kolkata airport
2022/09/11  00:00:00,School and football club submit synthetic pitch plans
2022/09/11  00:00:00,Alternative Energy Company - OMG Roofing Products | AltEnergyMag
2022/09/11  00:00:00,Andersen Global Broadens Footprint in Ethiopia with Tax Firm HIMA
2022/09/11  00:00:00,Phosphorus Partners with Tindo to Expand xIoT Security to Singapore and Southeast Asia
2022/09/11  00:00:00,Carbon Streaming Closes Community Carbon Stream
2022/09/11  00:00:00,HDMI 2.1 Rx PHY Samsung (14nm) IP Core
2022/09/11  00:00:00,FReeper Canteen ~ Sunday Chapel ~ ROBIN WILLIAMS: HUMAN BEING ~ 11 September 2022
2022/09/11  00:00:00,Memaliaj - Destination City Guides By In Your Pocket
2022/09/11  00:00:00,Steindamm 99 | Restaurants | Kaliningrad
2022/09/11  00:00:00,Sweden holds vote expected to boost anti-immigration party - Netscape Money & Business
2022/09/11  00:00:00,Tshisekedi il s'appelait | Le Soft international
2022/09/11  00:00:00,"Visa, Mastercard, AmEx to start categorizing gun shop sales"
2022/09/11  00:00:00,Group Fitness Class & HIIT Workouts | Orangetheory Fitness US
2022/09/11  00:00:00,Romanian company sells pinewood pellets 6 mm
2022/09/11  00:00:00,"Biodiesel Market Size Worth $73.05 Billion by 2030 at CAGR 10.0%: Grand View Research, Inc."
2022/09/11  00:00:00,medicare supplement insurance plan quote - Yahoo Search Yahoo Search Results
2022/09/11  00:00:00,5 MHz allocations in Southern Africa | Southgate Amateur Radio News
2022/09/11  00:00:00,Zelensky: Ukraine intends to start supplying electricity to Poland in December | tellerreport.com
2022/09/11  00:00:00,Dr. Ajay Kothari | The Space Show
2022/09/11  00:00:00,Kiwi Farms: The Slippery Slope of Curating the Web * TorrentFreak
2022/09/11  00:00:00,Russan troops retreat after Ukraine counteroffensive
2022/09/11  00:00:00,Little known Temesgen to lead Ethiopia Bunna to the future - Capital Newspaper
2022/09/11  00:00:00,Walia partner with music sensation Rophnan - Capital Newspaper
2022/09/11  00:00:00,THE HUMAN SCALE - Capital Newspaper
2022/09/11  00:00:00,NJ beach weather and waves: Jersey Shore Report for Sun 9/11
2022/09/11  00:00:00,"Russian military leaving Kharkiv region ""temporarily,"" says Russian-backed administration"
2022/09/11  00:00:00,New York Jets Flight Connections 9/11/22
2022/09/11  00:00:00,The Mechanics of Philotimo: Volunteers Repair Cars Damaged in Floods
2022/09/11  00:00:00,Roberto Bernocchi - Tutti gli articoli
2022/09/11  00:00:00,La Crosse neighbors: Obituaries for September 11
2022/09/11  00:00:00,Scone recipes for kicking off cooler weather
2022/09/11  00:00:00,Saturday Evening Forecast Sept 10th | News Channel 3-12
2022/09/11  00:00:00,"Antonio Ledezma, autor en Noticiero Digital"
2022/09/11  00:00:00,Pageantry and procession in the rain in Hillsborough
2022/09/11  00:00:00,What they're saying in Russia about Ukraine's advances
2022/09/11  00:00:00,"3.5-trillion-yen package adopted to deal with surging prices | The Asahi Shimbun: Breaking News, Japan News and Analysis"
2022/09/11  00:00:00,"Mediation Room: When you close a door, open a window"
2022/09/11  00:00:00,Dining in the city thinking to the country - Villaggio Globale
2022/09/11  00:00:00,Combine Fire in a field by Smiley
2022/09/11  00:00:00,8 Factors to Consider When Selecting Water Softener
2022/09/11  00:00:00,Powassan Voodoos blank Cochrane Crunch 5-0
2022/09/11  00:00:00,1875-CC T$1 Trade Dollar - Coin Community Forum
2022/09/11  00:00:00,2 Franc Ceres 1870 A - Please Grade - Coin Community Forum
2022/09/11  00:00:00,Teagasc generating breeding values for sheep for methane production
2022/09/11  00:00:00,"Occupational Medicine Market Size & Growth | Research Report [2029] | Market Share, Growth Rate, Key Players, Trends, Key Region, Upstream & Downstream Analysis, Restraints & Challenges, and Revenue Analysis | Industry Research Biz"
2022/09/11  00:00:00,AmeriCorps CEO Statement on Unity through Service to Honor 9/11 Day
2022/09/11  00:00:00,Statement by the Prime Minister on Nayrouz
2022/09/11  00:00:00,VinFast Participates in Global Home Energy and Electric Vehicle Show Fully Charged
2022/09/11  00:00:00,NewswireToday Leading Press Releases & Newswire Distribution Service
2022/09/11  00:00:00,Miss Universe Spain 2022 is Alicia Faubel of Valencia
2022/09/11  00:00:00,Oba of Benin tasks surgeons on reduction of distorted medical procedures - P.M. News
2022/09/11  00:00:00,Queen Elizabeth and the End of History
2022/09/11  00:00:00,"Elche CF - Athletic Club (16:15), formaciones iniciales - TODOmercadoWEB.es"
2022/09/11  00:00:00,"Seven Seas Licenses Orange -To You, Dear One- Manga"
2022/09/11  00:00:00,Drifting Home Anime Film's 2-Minute Clip Shows Characters Encountering 'Ghost'
2022/09/11  00:00:00,AP News Summary at 3:34 a.m. EDT
2022/09/11  00:00:00,Ask Elliman: Sally Slater On Equestrian Living
2022/09/11  00:00:00,CBN Injects $7.6bn To Stabilise Naira
2022/09/11  00:00:00,Accession proclamation read to people of Northern Ireland at Hillsborough Castle
2022/09/11  00:00:00,"FG flags off cash grants for vulnerable groups in Imo, Abia states"
2022/09/11  00:00:00,Top Missouri Prospect Profile: OT Logan Reichert
2022/09/11  00:00:00,"AP PHOTOS: At roving fairs, sellers keep bartering tradition"
2022/09/11  00:00:00,The Sandy Hook families and other key people behind the Alex Jones trial in CT
2022/09/11  00:00:00,Inflammatory material causes India to meet Wikipedia officials
2022/09/11  00:00:00,Visa to Start Categorizing Gun Shop Sales Separately
2022/09/11  00:00:00,"Sterling Shepard active, Kayvon Thibodeaux inactive for Giants"
2022/09/11  00:00:00,Queen's coffin will pass through Perth on journey to Edinburgh
2022/09/11  00:00:00,The Papers: Queen's 'final journey' and Russia's 'revenge attacks'
2022/09/11  00:00:00,Pakistan records 139 new COVID-19 cases
2022/09/11  00:00:00,Queen Elizabeth II's corgis will go to her son Prince Andrew and his ex-wife
2022/09/11  00:00:00,Line in the sand drawn over sons' habit of dropping by
2022/09/11  00:00:00,AP News Summary at 7:27 a.m. EDT
2022/09/11  00:00:00,"Deion Sanders, Jackson State Delivered in Southern Heritage Classic"
2022/09/11  00:00:00,President: Iran Could Swiftly Return to Pre-JCPOA Conditions - Nuclear news - Tasnim News Agency
2022/09/11  00:00:00,Yemeni Information Minister Highlights Support for Palestine - World news - Tasnim News Agency
2022/09/11  00:00:00,"Wait for recovery signs before entering FMCG, worst over for IT in short term: Astha Jain"
2022/09/11  00:00:00,About The Mark Moss Show | News Radio 570 WWNC
2022/09/11  00:00:00,Military Station In Arunachal Town Named After Gen Rawat | Guwahati News - Times of India
2022/09/11  00:00:00,Jain monk Acharya Vijay Hansratnasur fasts for 180 days for the sixth time | Ahmedabad News - Times of India
2022/09/11  00:00:00,Eight Covid Cases In City | Ludhiana News - Times of India
2022/09/11  00:00:00,"Karnataka: Pernal, 2 others to get Konkani Sahitya award | Mangaluru News - Times of India"
2022/09/11  00:00:00,Gujarat sees 171 new Covid cases | Rajkot News - Times of India
2022/09/11  00:00:00,Govt deputes CISF to provide security consultancy for Kashi Vishwanath temple complex | India News - Times of India
2022/09/11  00:00:00,J&K BJP Gujjar member Khatana nominated to Rajya Sabha | India News - Times of India
2022/09/11  00:00:00,Falcons inactives: Two Falcons rookies listed as inactive ahead of Week 1 showdown with New Orleans Saints
2022/09/11  00:00:00,Building Empathetic Clinical Trial Recruitment Programs
2022/09/11  00:00:00,Making Risk-Based Monitoring Technology A Friend: Considerations For Practical Execution Of An RBM Strategy
2022/09/11  00:00:00,Preparing Clinical Trial Documents For Europe's New CTIS
2022/09/11  00:00:00,Rob Thomson - MLB Trade Rumors
2022/09/11  00:00:00,Rico Garcia - MLB Trade Rumors
2022/09/11  00:00:00,Maury Ahram | MLB Trade Rumors
2022/09/11  00:00:00,"New Health, Medical, & Dental Supplies and Equipment Products"
2022/09/11  00:00:00,PublicRadioFan.com - Listings by program: Through the Night
2022/09/11  00:00:00,PublicRadioFan.com - Listings by station: KWIT 3
2022/09/11  00:00:00,PublicRadioFan.com - Listings by program: Seani B
2022/09/11  00:00:00,PublicRadioFan.com - Listings by program: 5 live Science
2022/09/11  00:00:00,PublicRadioFan.com - Listings by program: Blue Dimensions
2022/09/11  00:00:00,PublicRadioFan.com - Listings by program: San Francisco Symphony
2022/09/11  00:00:00,PublicRadioFan.com - Listings by station: WUNC
2022/09/11  00:00:00,PublicRadioFan.com - Listings by program: Plugged In
2022/09/11  00:00:00,PublicRadioFan.com - Listings by station: KUER
2022/09/11  00:00:00,PublicRadioFan.com - Listings by program: The Sunday Hour
2022/09/11  00:00:00,PublicRadioFan.com - Listings by program: Cityscape (WFUV)
2022/09/11  00:00:00,PublicRadioFan.com - Listings by program: Music Time in Africa
2022/09/11  00:00:00,PublicRadioFan.com - Listings by program: Classical Music with Dennis Bartel
2022/09/11  00:00:00,PublicRadioFan.com - Listings by station: WXXI-FM
