date,title
2022/05/24  00:00:00,Liberals discussed dumping Morrison in Coalitions final months
2022/05/24  00:00:00,US Congressman Neal: No big hurdles to leap on protocol
2022/05/24  00:00:00,SP likely to field Sibal as its Rajya Sabha poll candidate
2022/05/24  00:00:00,"The Lumineers, Brandi Carlile & More to Headline BeachLife Ranch"
2022/05/24  00:00:00,Political Notes: And the endorsement goes to
2022/05/24  00:00:00,Pope Francis names Arkansas priest to lead Diocese of St. Augustine
2022/05/24  00:00:00,"Pakistani Rupee In Free Fall, Crosses 200 Mark Against US Dollar"
2022/05/24  00:00:00,Medical University of South Carolina Joins Forces with Butterfly Network
2022/05/24  00:00:00,C. H. Booth Library Free Programs via Zoom
2022/05/24  00:00:00,Oregon politics taking shape post primary
2022/05/24  00:00:00,"Engineers, GMs go the distance to keep Alaskas remote stations on the air"
2022/05/24  00:00:00,Sultan Bin Ahmed Al Qasimi Inspects Solar House At Uos
2022/05/24  00:00:00,Recalled peanut butter found in Billings
2022/05/24  00:00:00,Stephenson County Health Department advises families on formula shortage and recalls
2022/05/24  00:00:00,Eleven days in May: 2. The storming of Al Aqsa
2022/05/24  00:00:00,China and Russia Fly Bombers Near Japan as Biden Leads Quad Summit in Tokyo
2022/05/24  00:00:00,Amazon Web Services' Growth Strategy In Latin America: Still Day 1
2022/05/24  00:00:00,"Ka Moolelo o Au Hou ma Wakinekona, D.C. | The Story Behind the Hawaiian Canoe in Washington, D.C."
2022/05/24  00:00:00,"'Star Trek: Strange New Worlds' episode 3 builds up backstories for Number One, M'Benga"
2022/05/24  00:00:00,Uttarakhand Police collaborates with IIT Roorkee for Devbhoomi Cyber Hackathon 2.0
2022/05/24  00:00:00,Margaret Atwood Auctions Unburnable Edition Of The Handmaids Tale To Protest Book Bans
2022/05/24  00:00:00,View from the Window at Le Gras by Joseph Nicphore Nipce  Iconic Photograph
2022/05/24  00:00:00,Baron & Budd Investigates Potential Cybersecurity Fraud Cases
2022/05/24  00:00:00,Concerning survey findings on Israel-American Jewry relations - comment
2022/05/24  00:00:00,Release pending salaries of teachers  NSF
2022/05/24  00:00:00,"Russia, China hold nuclear military drill during Biden Japan trip"
2022/05/24  00:00:00,"Quad Summit Day 2: PM Modi discusses Indo-Pacific, China, Ukraine war, Covid-19"
2022/05/24  00:00:00,J&K LG calls on Rahul Bhat's family members in Jammu
2022/05/24  00:00:00,"Japan Sends Protest Note To Russia, China Over Overflights Near Its Territory"
2022/05/24  00:00:00,"3,150 Nigerians contributed money for my APC nomination forms  Nwajiuba"
2022/05/24  00:00:00,Buena officials meet in private about Landisville fire company litigation
2022/05/24  00:00:00,Pentagon Weighing on Sending Special Forces to Protect US Embassy in Kyiv
2022/05/24  00:00:00,Researchers Weigh up a Carbon Tax vs Low-Carbon Subsidy in Supply Chains
2022/05/24  00:00:00,Liberals discussed dumping Morrison in Coalitions final months
2022/05/24  00:00:00,Tebboune sacks the governor of Algeria's central bank
2022/05/24  00:00:00,MCD releases pending salaries for one month
2022/05/24  00:00:00,"MoF, PSBs talk Sri Lanka crisis with its lenders"
2022/05/24  00:00:00,Missouri Sen. Josh Hawley follows Gov. DeSantis in Disney attack by targeting Mickey Mouse copyright
2022/05/24  00:00:00,Watch: PM Jacinda Ardern speaks to media in US
2022/05/24  00:00:00,Two senators battle for single seat
2022/05/24  00:00:00,"Ka Moolelo o Au Hou ma Wakinekona, D.C. | The Story Behind the Hawaiian Canoe in Washington, D.C."
2022/05/24  00:00:00,Polish bishops leader: Vaticans approach to Russia naive and utopian
2022/05/24  00:00:00,"Also in the news / Energy price concern, space planning update, short films wanted and more"
2022/05/24  00:00:00,Pope Francis names Arkansas priest to lead Diocese of St. Augustine
2022/05/24  00:00:00,"Mandatory Time Off, Reflections On The Post-George Floyd Era And More For C-Suite Leaders"
2022/05/24  00:00:00,"GCASA recognizes board, staff, scholars, friends"
2022/05/24  00:00:00,Dollar hosiery plans major operation expansion in south
2022/05/24  00:00:00,Drones that deliver critical medical supplies coming to Brazil
2022/05/24  00:00:00,UAE Highlights National Vision At World Economic Forum
2022/05/24  00:00:00,Mike Pompeo and David Friedman film Bible documentary in Israel
2022/05/24  00:00:00,US a 'ways away' from sending troops to Ukraine: Joint Chiefs chairman
2022/05/24  00:00:00,Scholz follows Senegal gas visit with Sasol SAF launch
2022/05/24  00:00:00,"Battle Still Underway: Hawley, Senators Demand Biden Disinfo Board Turn Over Internal Records"
2022/05/24  00:00:00,"Russian, Chinese jets near Japan amid Quad"
2022/05/24  00:00:00,China Starting Next Global Crisis by Gobbling Up Sri Lanka
2022/05/24  00:00:00,Nueva Vizcaya plays up tourism in festival
2022/05/24  00:00:00,Democrats Are Scrambling to Find an Alternative to Joe Biden in 2024
2022/05/24  00:00:00,PCG: Mercraft owner to compensate victims
2022/05/24  00:00:00,SRM signs MoU with Defence Services Staff College
2022/05/24  00:00:00,Polish President To Address Ukrainian Parliament
2022/05/24  00:00:00,Shining a TV light on Quebecs English-language authors
2022/05/24  00:00:00,"Delhi Allowed Over 60,000 Trees to Be Cut for Roads, Buildings, Metro Between 2015 and 2021: Report"
2022/05/24  00:00:00,Buena officials meet in private about Landisville fire company litigation
2022/05/24  00:00:00,TRT Director General Sobaci Addresses European Broadcasters
2022/05/24  00:00:00,Slot Gacor Scatter78 - Link Daftar Situs Slot Online Gacor Terpercaya Hari Ini
2022/05/24  00:00:00,Court Ends Suspension of NGO in Uganda
2022/05/24  00:00:00,Kids vaccine delivered to local governments
2022/05/24  00:00:00,Google Street View uses new camera to reach new areas
2022/05/24  00:00:00,FROM THE ARCHIVES: Exploring smaller archive holdings
2022/05/24  00:00:00,"Canada Shipping 20,000 Rounds of Artillery Ammunition to Ukraine"
2022/05/24  00:00:00,Monarch butterflies bounce back in Mexico wintering grounds
2022/05/24  00:00:00,Loumies' owners focused on bringing home cooking and Levantine cuisine to Ithaca
2022/05/24  00:00:00,Neptune: The farthest planet from our sun
2022/05/24  00:00:00,Relations in mixed cities one year on from the May 2021 disturbances - comment
2022/05/24  00:00:00,Hungary and Poland hold up EU decisions on oil and corporate tax
2022/05/24  00:00:00,Photos: Voters head to the polls for Primary Elections
2022/05/24  00:00:00,"Fighter vs. Writer: Kevin Holland reveals latest heroics, Logan Storley responds to Michael Venom Page and Scott Coker"
2022/05/24  00:00:00,"Depp-Heard, Jews and the social media war - opinion"
2022/05/24  00:00:00,U.S. releases vaccine for those exposed to monkeypox
2022/05/24  00:00:00,"Vicky White and Casey Whites motel room hideout now has a wait list, higher price"
2022/05/24  00:00:00,USD 407 Board of Education Discusses Collaboration with Russell Regional Hospital for Daycare
2022/05/24  00:00:00,Eleven days in May: 2. The storming of Al Aqsa
2022/05/24  00:00:00,Scott Ritter: Ukraine War Has No End in Sight
2022/05/24  00:00:00,Sena may field Kolhapur leader in Rajya Sabha polls amid impasse with Sambhajiraje
2022/05/24  00:00:00,Missouri Sen. Josh Hawley follows Gov. DeSantis in Disney attack by targeting Mickey Mouse copyright
2022/05/24  00:00:00,"SICOG, city of Pocatello awarded funding for EPA Brownfield projects"
2022/05/24  00:00:00,Smart Infinity's Infinite Legacies spotlights Stephanie Kienle-Gonzalez
2022/05/24  00:00:00,Manchester City: Erling Haaland to complete move as Pep Guardiola eyes Kalvin Phillips
2022/05/24  00:00:00,Ministers of Fifth Orbn Government Sworn In
2022/05/24  00:00:00,PCG: Mercraft owner to compensate victims
2022/05/24  00:00:00,Here's what the Topeka mayor and interim city manager said at their monthly press conference
2022/05/24  00:00:00,Oprah Winfrey urges Ellen DeGeneres to do what she didn't after ending talk show
2022/05/24  00:00:00,A father-son team are covering the West in Uncle Bob's buttermilk syrup
2022/05/24  00:00:00,UAE Banks Federation Strategic Partner Of ACFE Fraud Conference Middle East 2022
2022/05/24  00:00:00,Drones that deliver critical medical supplies coming to Brazil
2022/05/24  00:00:00,"Build a custom email digest by following topics, people, and firms published on JD Supra."
2022/05/24  00:00:00,Population Commission engages Nigerian Army over 2023 census
2022/05/24  00:00:00,Caroline Glick: Radicals at war against Judeo-Christian roots of Western society
2022/05/24  00:00:00,FROM THE ARCHIVES: Exploring smaller archive holdings
2022/05/24  00:00:00,Coronavirus update: Long COVID symptoms can last a year or more
2022/05/24  00:00:00,Alexander Lebedev severs links with Independent after Canada sanctions
2022/05/24  00:00:00,Christiansen Creative shows Hudson High School graphic design students around
2022/05/24  00:00:00,"Chicago Public Schools requires masks at one school, 20 other classrooms as COVID cases increase"
2022/05/24  00:00:00,US Congressman Neal: No big hurdles to leap on protocol
2022/05/24  00:00:00,ACEN Australia starts building 50-MW battery for solar farm
2022/05/24  00:00:00,10 Louisiana Businesses Selected for Rural Entrepreneurship Program
2022/05/24  00:00:00,Watch out for SuperStream complexity when shutting down your SMSF
2022/05/24  00:00:00,Dollar hosiery plans major operation expansion in south
2022/05/24  00:00:00,SRM signs MoU with Defence Services Staff College
2022/05/24  00:00:00,"News Scan for May 24, 2022"
2022/05/24  00:00:00,USD 407 Board of Education Discusses Collaboration with Russell Regional Hospital for Daycare
2022/05/24  00:00:00,Close call for Port Bruce boaters
2022/05/24  00:00:00,"Georgian Cyber Security Bureau, NATO representatives discuss challenges in Georgian cyberspace"
2022/05/24  00:00:00,Its AIPAC vs. Bernie Sanders in Too-close-to-call Texas Democratic Runoff
2022/05/24  00:00:00,"Build a custom email digest by following topics, people, and firms published on JD Supra."
2022/05/24  00:00:00,Manchester City: Erling Haaland to complete move as Pep Guardiola eyes Kalvin Phillips
2022/05/24  00:00:00,Hungary and Poland hold up EU decisions on oil and corporate tax
2022/05/24  00:00:00,"EXCLUSIVE: Nigerias Attorney-General Malami Writes Emefiele, Asks Central Bank Gov To Release $418m To Ned Nwoko, 5 Other Controversial Paris Club Consultants"
2022/05/24  00:00:00,UAE Banks Federation Strategic Partner Of ACFE Fraud Conference Middle East 2022
2022/05/24  00:00:00,Indore Municipal Corporation sanitation workers find two fetuses in a litterbin
2022/05/24  00:00:00,GBP/USD Price Analysis: Faces a wall of resistance around 1.2600 and retraces towards 1.2530s
2022/05/24  00:00:00,Relations in mixed cities one year on from the May 2021 disturbances - comment
2022/05/24  00:00:00,TRT Director General Sobaci Addresses European Broadcasters
2022/05/24  00:00:00,Abu Dhabi to partner with British Petroleum on hydrogen power
2022/05/24  00:00:00,"Stellantis, Samsung SDI will invest $2.5 billion for battery plant in Indiana"
2022/05/24  00:00:00,UK Backs Plan to Escort Grain Ships Past Russias Naval Blockade of Ukraine
2022/05/24  00:00:00,"SFD, UN-Habitat discuss development projects in emerging countries"
2022/05/24  00:00:00,Neptune: The farthest planet from our sun
2022/05/24  00:00:00,Sultan Bin Ahmed Al Qasimi Inspects Solar House At Uos
2022/05/24  00:00:00,"On Taiwan, Biden Is At War With His Own Words"
2022/05/24  00:00:00,Ronald Reagan's campaign chair launches committee to 'draft' Ron DeSantis to jump into 2024 presidential race before Trump does
2022/05/24  00:00:00,"Japan Sends Protest Note To Russia, China Over Overflights Near Its Territory"
2022/05/24  00:00:00,"MoF, PSBs talk Sri Lanka crisis with its lenders"
2022/05/24  00:00:00,"3,150 Nigerians contributed money for my APC nomination forms  Nwajiuba"
2022/05/24  00:00:00,"RevoluGROUP Canada Inc. Corporate Update, Card Issuer, DFSA, DCE, DA Forex"
2022/05/24  00:00:00,China Starting Next Global Crisis by Gobbling Up Sri Lanka
2022/05/24  00:00:00,SDRPY launches project to rehabilitate Haijat Al-Abed road
2022/05/24  00:00:00,Court Ends Suspension of NGO in Uganda
2022/05/24  00:00:00,"EXCLUSIVE: Nigerias Attorney-General Malami Writes Emefiele, Asks Central Bank Gov To Release $418m To Ned Nwoko, 5 Other Controversial Paris Club Consultants"
2022/05/24  00:00:00,Former Trump aides Kellyanne Conway and Alyssa Farah Griffin clash on The View
2022/05/24  00:00:00,Bayard short $200K for key sewer project
2022/05/24  00:00:00,Kenya Moore Shades Marlo Hampton As An Ex-Con
2022/05/24  00:00:00,"Police reports for Tuesday, May 24, 2022"
2022/05/24  00:00:00,Here's what the Topeka mayor and interim city manager said at their monthly press conference
2022/05/24  00:00:00,Hungary and Poland hold up EU decisions on oil and corporate tax
2022/05/24  00:00:00,"Georgian, Croatian PMs discuss deepening cooperation"
2022/05/24  00:00:00,Indonesia discusses MSME challenges at 2nd DWG side event
2022/05/24  00:00:00,Raghav reviews progress of 7th Economic Census
2022/05/24  00:00:00,China and Russia Fly Bombers Near Japan as Biden Leads Quad Summit in Tokyo
2022/05/24  00:00:00,"Iran's IRGC will remain on terrorist blacklist, Biden told Bennett - report"
2022/05/24  00:00:00,"SFD, UN-Habitat discuss development projects in emerging countries"
2022/05/24  00:00:00,New Jersey AG launches another freedom-hating fishing expedition
2022/05/24  00:00:00,US Congressman Neal: No big hurdles to leap on protocol
2022/05/24  00:00:00,Political Notes: And the endorsement goes to
2022/05/24  00:00:00,Eleven days in May: 2. The storming of Al Aqsa
2022/05/24  00:00:00,"GCASA recognizes board, staff, scholars, friends"
2022/05/24  00:00:00,Biden's National Security Advisor Was Fully Briefed on Hillary's Russia Scam
2022/05/24  00:00:00,Polish bishops leader: Vaticans approach to Russia naive and utopian
2022/05/24  00:00:00,"Build a custom email digest by following topics, people, and firms published on JD Supra."
2022/05/24  00:00:00,Bayard short $200K for key sewer project
2022/05/24  00:00:00,Here's what the Topeka mayor and interim city manager said at their monthly press conference
2022/05/24  00:00:00,Kern County Superintendent of Schools candidate: Mary Barlow
2022/05/24  00:00:00,Missouri Sen. Josh Hawley follows Gov. DeSantis in Disney attack by targeting Mickey Mouse copyright
2022/05/24  00:00:00,"EXCLUSIVE: Nigerias Attorney-General Malami Writes Emefiele, Asks Central Bank Gov To Release $418m To Ned Nwoko, 5 Other Controversial Paris Club Consultants"
2022/05/24  00:00:00,Pope Francis names Arkansas priest to lead Diocese of St. Augustine
2022/05/24  00:00:00,Didmus Barasa wanted over branding of GK vehicle with UDA party colours
2022/05/24  00:00:00,Two senators battle for single seat
2022/05/24  00:00:00,Picture God created has home at St. John shrine
2022/05/24  00:00:00,$1.6 million Powerball ticket set to expire
2022/05/24  00:00:00,RI Commerce Secretary Pryor to run for state treasurer
2022/05/24  00:00:00,Youth Book Discussion Re Substance Use to be Held in Simsbury
2022/05/24  00:00:00,IDF scholarship: The night both sides lost - analysis
2022/05/24  00:00:00,"Georgian, Croatian PMs discuss deepening cooperation"
2022/05/24  00:00:00,"Russian, Chinese jets near Japan amid Quad"
2022/05/24  00:00:00,Indonesia discusses MSME challenges at 2nd DWG side event
2022/05/24  00:00:00,Wisconsin Division of Health Services shifting 200 employees to northwest side building
2022/05/24  00:00:00,Court Ends Suspension of NGO in Uganda
2022/05/24  00:00:00,National News |   			Former Army colonel to investigate source of Supreme Courts Roe v. Wade leak
2022/05/24  00:00:00,Political Notes: And the endorsement goes to
2022/05/24  00:00:00,Scavo received subpoena to testify before Jan. 6 riot committee
2022/05/24  00:00:00,Regional Center for Border Health leader speaks on busing migrants apprehended in Yuma area
2022/05/24  00:00:00,UK Backs Plan to Escort Grain Ships Past Russias Naval Blockade of Ukraine
2022/05/24  00:00:00,Shining a TV light on Quebecs English-language authors
2022/05/24  00:00:00,Delaware: Governor Vetoes Marijuana Depenalization Measure
2022/05/24  00:00:00,"GEBE staff sends letter to Dutch State Secretary, Prime Minister Rutte and 2nd Chamber."
2022/05/24  00:00:00,Loumies' owners focused on bringing home cooking and Levantine cuisine to Ithaca
2022/05/24  00:00:00,ACEN Australia starts building 50-MW battery for solar farm
2022/05/24  00:00:00,"Build a custom email digest by following topics, people, and firms published on JD Supra."
2022/05/24  00:00:00,Population Commission engages Nigerian Army over 2023 census
2022/05/24  00:00:00,Nueva Vizcaya plays up tourism in festival
2022/05/24  00:00:00,Louisiana Senate Committee to Determine Fate of Constitutional Carry Bill
2022/05/24  00:00:00,"GCASA recognizes board, staff, scholars, friends"
2022/05/24  00:00:00,"Mongolia launches smartphone app on rare species of wild fauna, flora"
2022/05/24  00:00:00,"'Rescind $1-million grants to anti-Israel NGOs,' Republican senators tell Blinken"
2022/05/24  00:00:00,"Arbor Metals Summer Exploration Program on Jarnet Lithium Project, James Bay, Quebec, Canada"
2022/05/24  00:00:00,US Congressman Neal: No big hurdles to leap on protocol
2022/05/24  00:00:00,Taste of Dent County set for June 4
2022/05/24  00:00:00,Enercon secures wind turbine supply contract from Ripple Energy
2022/05/24  00:00:00,Caroline Glick: Radicals at war against Judeo-Christian roots of Western society
2022/05/24  00:00:00,Breaking the Silence may speak at Jewish Agency pre-army programs
2022/05/24  00:00:00,"3,150 Nigerians contributed money for my APC nomination forms  Nwajiuba"
2022/05/24  00:00:00,Tennessee Hemp Producers Reminded Of Upcoming Deadlines
2022/05/24  00:00:00,Democrats Are Scrambling to Find an Alternative to Joe Biden in 2024
2022/05/24  00:00:00,TAIPEI TIMES Ten nations back Taiwan at the WHA
2022/05/24  00:00:00,Political Notes: And the endorsement goes to
2022/05/24  00:00:00,Manchester City: Erling Haaland to complete move as Pep Guardiola eyes Kalvin Phillips
2022/05/24  00:00:00,"Build a custom email digest by following topics, people, and firms published on JD Supra."
2022/05/24  00:00:00,Kiribati included in China's Foreign Ministers visit to Pacific region
2022/05/24  00:00:00,Scott Ritter: Ukraine War Has No End in Sight
2022/05/24  00:00:00,Dollar hosiery plans major operation expansion in south
2022/05/24  00:00:00,Eleven days in May: 2. The storming of Al Aqsa
2022/05/24  00:00:00,Russian enemy list includes a DC Council member
2022/05/24  00:00:00,"Russian, Chinese jets near Japan amid Quad"
2022/05/24  00:00:00,Picture God created has home at St. John shrine
2022/05/24  00:00:00,New Entries in the CFR Cyber Operations Tracker: Q4 2021
2022/05/24  00:00:00,Russians Forcing Kherson Farmers To Sell Vegetables To Occupied Crimea At Dumped Prices
2022/05/24  00:00:00,US CDC Recommends Re-Isolation If COVID Recurs After Taking Pfizer's Pill
2022/05/24  00:00:00,Iowa Dem used official position to help clients of husband's marketing firm
2022/05/24  00:00:00,"2023: Tinubu Is In Distress, He Feels Ruling APC Should Reward Him With Presidency  Okorocha"
2022/05/24  00:00:00,Stellantis to build new battery plant in Indiana
2022/05/24  00:00:00,UK Backs Plan to Escort Grain Ships Past Russias Naval Blockade of Ukraine
2022/05/24  00:00:00,"Manchin, Capito, 2 other senators reintroduce bill to halt Veterans Affairs cutbacks"
2022/05/24  00:00:00,UAE Highlights National Vision At World Economic Forum
2022/05/24  00:00:00,China and Russia Fly Bombers Near Japan as Biden Leads Quad Summit in Tokyo
2022/05/24  00:00:00,Solomon Islands says Chinas Wang to visit this week
2022/05/24  00:00:00,Political Notes: And the endorsement goes to
2022/05/24  00:00:00,Manchester City: Erling Haaland to complete move as Pep Guardiola eyes Kalvin Phillips
2022/05/24  00:00:00,"MoF, PSBs talk Sri Lanka crisis with its lenders"
2022/05/24  00:00:00,"Build a custom email digest by following topics, people, and firms published on JD Supra."
2022/05/24  00:00:00,"Opinion | Todd Myers, Washington Policy Center: Green activists dismiss science in favor of political dogma on salmon and climate"
2022/05/24  00:00:00,Yakuzas Kazuma and Sayama are(nt) joining the Rainbow Six Siege roster
2022/05/24  00:00:00,New sculptures bedeck Park Rapids trail
2022/05/24  00:00:00,Taste of Dent County set for June 4
2022/05/24  00:00:00,Sweden & Finland to NATO  US Russian Economy Compared
2022/05/24  00:00:00,"Iran's IRGC will remain on terrorist blacklist, Biden told Bennett - report"
2022/05/24  00:00:00,"FBI Spearheaded Case Against All-Black Militia Leader, Court Hears"
2022/05/24  00:00:00,Samantha Power Assures Ranil USAID Support
2022/05/24  00:00:00,Hungary and Poland hold up EU decisions on oil and corporate tax
2022/05/24  00:00:00,Polish bishops leader: Vaticans approach to Russia naive and utopian
2022/05/24  00:00:00,Missouri Sen. Josh Hawley follows Gov. DeSantis in Disney attack by targeting Mickey Mouse copyright
2022/05/24  00:00:00,China and Russia Fly Bombers Near Japan as Biden Leads Quad Summit in Tokyo
2022/05/24  00:00:00,"Police reports for Tuesday, May 24, 2022"
2022/05/24  00:00:00,Qatar Charity Delivers Advanced Medical Equipment To Tunisia's Hospitals
2022/05/24  00:00:00,Iowa Dem used official position to help clients of husband's marketing firm
2022/05/24  00:00:00,St. Vincent Healthcare Endows New Midwifery Program at MSU College of Nursing
2022/05/24  00:00:00,"Canada's OTPP, Max Healthcare lead the race for Sahyadri Hospitals"
2022/05/24  00:00:00,Delaware: Governor Vetoes Marijuana Depenalization Measure
2022/05/24  00:00:00,Kids vaccine delivered to local governments
2022/05/24  00:00:00,"Canadian eConsult services provided much-needed Covid information, specialty consults for primary care doctors"
2022/05/24  00:00:00,Russians Forcing Kherson Farmers To Sell Vegetables To Occupied Crimea At Dumped Prices
2022/05/24  00:00:00,"Russian, Chinese jets near Japan amid Quad"
2022/05/24  00:00:00,"EXCLUSIVE: Nigerias Attorney-General Malami Writes Emefiele, Asks Central Bank Gov To Release $418m To Ned Nwoko, 5 Other Controversial Paris Club Consultants"
2022/05/24  00:00:00,TAIPEI TIMES Representative to the US stresses self-defense after Bidens Taiwan comment
2022/05/24  00:00:00,"Exclusive  Tina Descovich: Moms for Liberty Focused on Parental Rights in Education, Has Chapters in 37 States"
2022/05/24  00:00:00,Watch: PM Jacinda Ardern speaks to media in US
2022/05/24  00:00:00,"SFD, UN-Habitat discuss development projects in emerging countries"
2022/05/24  00:00:00,"Bennett, EU Parliament president discuss increased cooperation on food, energy"
2022/05/24  00:00:00,"Build a custom email digest by following topics, people, and firms published on JD Supra."
2022/05/24  00:00:00,Wisconsin Division of Health Services shifting 200 employees to northwest side building
2022/05/24  00:00:00,"J&K | LG Manoj Sinha Visited the Residence & Met the Family of Rahul Bhat, an ... - Latest Tweet by ANI"
2022/05/24  00:00:00,Scott Ritter: Ukraine War Has No End in Sight
2022/05/24  00:00:00,"Alexandria Ocasio-Cortez, Mark Zuckerberg and Morgan Freeman among Americans banned from Russia"
2022/05/24  00:00:00,EPL: You may end up like Lukaku  Smicer warns Man Citys Haaland
2022/05/24  00:00:00,IDF scholarship: The night both sides lost - analysis
2022/05/24  00:00:00,"Delhi Allowed Over 60,000 Trees to Be Cut for Roads, Buildings, Metro Between 2015 and 2021: Report"
2022/05/24  00:00:00,"Canada's OTPP, Max Healthcare lead the race for Sahyadri Hospitals"
2022/05/24  00:00:00,Drones that deliver critical medical supplies coming to Brazil
2022/05/24  00:00:00,Monarch butterflies bounce back in Mexico wintering grounds
2022/05/24  00:00:00,Sena may field Kolhapur leader in Rajya Sabha polls amid impasse with Sambhajiraje
2022/05/24  00:00:00,Democrats Are Scrambling to Find an Alternative to Joe Biden in 2024
2022/05/24  00:00:00,"India News | TN CM Attacks Centre, Takes Veiled Swipe Against Gyanvapi Row"
2022/05/24  00:00:00,Taste of Dent County set for June 4
2022/05/24  00:00:00,India News | Congress Claims Stake over RS Berth from Jharkhand After Sonia Gandhi and Hemant Soren Meet
2022/05/24  00:00:00,Polish bishops leader: Vaticans approach to Russia naive and utopian
2022/05/24  00:00:00,Two senators battle for single seat
2022/05/24  00:00:00,"After primary, Mastriano rejoins closed Pa. Senate GOP meetings"
2022/05/24  00:00:00,"GEBE staff sends letter to Dutch State Secretary, Prime Minister Rutte and 2nd Chamber."
2022/05/24  00:00:00,Kiribati included in China's Foreign Ministers visit to Pacific region
2022/05/24  00:00:00,Biden's National Security Advisor Was Fully Briefed on Hillary's Russia Scam
2022/05/24  00:00:00,EPL: You may end up like Lukaku  Smicer warns Man Citys Haaland
2022/05/24  00:00:00,TAIPEI TIMES Ten nations back Taiwan at the WHA
2022/05/24  00:00:00,Russians Forcing Kherson Farmers To Sell Vegetables To Occupied Crimea At Dumped Prices
2022/05/24  00:00:00,Caroline Glick: Radicals at war against Judeo-Christian roots of Western society
2022/05/24  00:00:00,"Bennett, EU Parliament president discuss increased cooperation on food, energy"
2022/05/24  00:00:00,"Panel recommends new names for Fort Bragg, other Army bases"
2022/05/24  00:00:00,U.S. Book Show: Ukrainian Novelist Andrey Kurkov on Wartime Reality for Writers and Publishers
2022/05/24  00:00:00,"Opinion | Todd Myers, Washington Policy Center: Green activists dismiss science in favor of political dogma on salmon and climate"
2022/05/24  00:00:00,RI Commerce Secretary Pryor to run for state treasurer
