date,title
2022/01/06  00:00:00,Penelope Cruz keeps it edgy in black-patterned pants and matching plunging vest combination as she promotes The 355 on ELLEN
2022/01/06  00:00:00,Magseis Fairfield in Conditional OBN Survey Award
2022/01/06  00:00:00,Borrell sayseyewitnessed consequences of aggression against Ukraine
2022/01/06  00:00:00,Gautam Gambhir writes: Delhi gets a thekedar instead of chief minister
2022/01/06  00:00:00,"TUI, Jet2, BA, easyJet, RyanAir: Latest travel rules for Brits heading to USA, Netherlands, Switzerland and Croatia"
2022/01/06  00:00:00,MacIver Minute: Minimum Bail Requirements for Repeat Offenders
2022/01/06  00:00:00,Gomez urges MACC to reveal minutes of Nov 24 meet
2022/01/06  00:00:00,Robin Vos ordered to sit for deposition as part of election probe records lawsuit
2022/01/06  00:00:00,Duped Thai workers freed in Cambodia
2022/01/06  00:00:00,Supplying Natural Products in the Cosmetics Industry
2022/01/06  00:00:00,The Apprentice's Navid Sole's anti-vax tweets unearthed ahead of new BBC series
2022/01/06  00:00:00,"Erling Haalandchooses next club as Chelsea, Man Utd learn strikers fate"
2022/01/06  00:00:00,UAE - Adnoc invests Dh3.5b to develop historic Umm Shaif field
2022/01/06  00:00:00,Israel to tests schoolchildren for COVID daily to allow in-class learning
2022/01/06  00:00:00,Mirra proposes free college for police officers
2022/01/06  00:00:00,DGAP-News: Multitude SE: Multitude SE: Multitude Group financial calendar for 2022
2022/01/06  00:00:00,Derbyshire's Geoff Hoon in dramatic claim about Iraq war legal advice
2022/01/06  00:00:00,"""Son Called From His Unit"": Belarusian Military Sent To Suppress Protests In Kazakhstan"
2022/01/06  00:00:00,Dundalk companies invited to discuss business with Australian ambassador
2022/01/06  00:00:00,"""The Book of Hope"" delves into the mind of Jane Goodall"
2022/01/06  00:00:00,Reviewing the evolution of pro-Islamic State propaganda in South Asia
2022/01/06  00:00:00,Ghana Nkosuo Nti gifts to Countryside Childrens Welfare Home
2022/01/06  00:00:00,White Hall students to mask for 7 days
2022/01/06  00:00:00,"Covid PCR tests in Abu Dhabi, Dubai explained: Prices; drive-through, at-home options"
2022/01/06  00:00:00,Contractors slowing down ongoing payment process  Construction Chamber
2022/01/06  00:00:00,Psychiatric hospital gets wards for substance abuse victims
2022/01/06  00:00:00,Gautam Gambhir writes: Delhi gets a thekedar instead of chief minister
2022/01/06  00:00:00,Bulli Bai app: Fourth man held over auction of Muslim women
2022/01/06  00:00:00,BOC hears from business auditing company
2022/01/06  00:00:00,Westerfield sees his senate district change
2022/01/06  00:00:00,IFRS and VAS Part 2: Presentation of Balance Sheet
2022/01/06  00:00:00,Simon Coveney to meet Liz Truss today
2022/01/06  00:00:00,Spiritfilled Ltd: Award-winning Independent Bottler Spiritfilled Release The Next Two Single Cask Whiskies In Their Mythical Beast Series
2022/01/06  00:00:00,"Also in the news / Co-op hypocrisy, Walls power cut, Loganair birthday, media shortlists and improvement notice served"
2022/01/06  00:00:00,Derbyshire's Geoff Hoon in dramatic claim about Iraq war legal advice
2022/01/06  00:00:00,Mubadala-backed Reef in cloud kitchen JV with Middle East's biggest F&B operator Americana
2022/01/06  00:00:00,COVID exposures at Scotiabank Bahamas; bank urges use of digital channels amid resulting office closures
2022/01/06  00:00:00,Settlement leader Yossi Dagan sets up protest tent outside PMO's office
2022/01/06  00:00:00,Israel to tests schoolchildren for COVID daily to allow in-class learning
2022/01/06  00:00:00,Dundalk companies invited to discuss business with Australian ambassador
2022/01/06  00:00:00,George Tsounis testimony on 12 January about the position of ambassador to Greece
2022/01/06  00:00:00,Magseis Fairfield in Conditional OBN Survey Award
2022/01/06  00:00:00,Lithuanian president calls for de-escalation plan with China
2022/01/06  00:00:00,Maxwell lawyers call for retrial over juror comments
2022/01/06  00:00:00,"GLOBALink | TCM helps fight against COVID-19 resurgence in Xi'an, China"
2022/01/06  00:00:00,Ukraines Buffer Zone Illusion: The Russia-Wests War of Words Escalates
2022/01/06  00:00:00,"After Foreign Secretary, Senior Indian Naval Officer Visits Myanmar"
2022/01/06  00:00:00,"Erling Haalandchooses next club as Chelsea, Man Utd learn strikers fate"
2022/01/06  00:00:00,"Liberia: Students Sit On Floor To Learn At Special Project Public School, As COP Aids With Arm-Chairs"
2022/01/06  00:00:00,"Goldman, UBS order staff to leave offices in Hong Kong"
2022/01/06  00:00:00,SPG is tasked with protecting the Prime Minister. Here's how they do it
2022/01/06  00:00:00,Birds fluttering around the lake in winter
2022/01/06  00:00:00,Brittany Ferries new LNG-fuelled E-Flexer enters BV classification
2022/01/06  00:00:00,Roy Exum: Mayo Clinic Fires 700
2022/01/06  00:00:00,Hong Kong: Police informal freeze of bank accounts held invalid - Implications for financial institutions and businesses
2022/01/06  00:00:00,"For The Nigerian Left: Facing 2022, By Edwin Madunagu"
2022/01/06  00:00:00,"University of California, Davis: Researchers Pinpoint Which Bird Species Pose Food Safety Risk to Crops"
2022/01/06  00:00:00,"Ukraine - U.S., Europe laid out two paths to influence Putin - Blinken"
2022/01/06  00:00:00,"Khairy: Another 123 Covid-19 Omicron cases detected, 88 from umrah returnees"
2022/01/06  00:00:00,Debris in temporary dumping station in SRP now being hauled to landfill  Councilor Rama
2022/01/06  00:00:00,PM Modi briefs President Kovind on his security breach during Punjab visit
2022/01/06  00:00:00,House Finance Committee Members Grill Tourism Officials On Budget Request
2022/01/06  00:00:00,Brankas Scores 287 Billion Rupiah Series B Funding Led by Insignia Ventures
2022/01/06  00:00:00,"TUI, Jet2, BA, easyJet, RyanAir: Latest travel rules for Brits heading to USA, Netherlands, Switzerland and Croatia"
2022/01/06  00:00:00,"PNP: NCR, Bulacan inbound travelers required to present vaccination card"
2022/01/06  00:00:00,Covid-19: ACIP Backs Vax Boosters for Teens Age 12-15
2022/01/06  00:00:00,"Muslim bachelor, 29, who plastered himself on billboards to find a wife gets 2,000 responses - and will use a spreadsheet to whittle down the candidates by age, location, and personality (but not looks)"
2022/01/06  00:00:00,Slovenia's Expo pavilion to host three business delegations
2022/01/06  00:00:00,"Ireland's sailing, boating & maritime magazine"
2022/01/06  00:00:00,Dominican Foreign Minister meets Qatari Acting Charg d'Affaires
2022/01/06  00:00:00,Salty water flowing through pipes in Portland
2022/01/06  00:00:00,Headlines / Quote of the Week
2022/01/06  00:00:00,From Paris to New York: The Story of Eugne Atget & Berenice Abbott
2022/01/06  00:00:00,Comment: GOP draws from apocalyptic narratives in 'Demoncrat' conspiracy theories
2022/01/06  00:00:00,"In Saudi Arabia, PIA hires 11 companies for quarantine services"
2022/01/06  00:00:00,West: Syria must answer 20 questions on its chemical weapons
2022/01/06  00:00:00,PM Modi briefs President Kovind on his security breach during Punjab visit
2022/01/06  00:00:00,Weather office issues advisory for J&K
2022/01/06  00:00:00,Russia Sends Paratroopers to Kazakhstan to Quell Deadly Unrest
2022/01/06  00:00:00,Ventes Avenues crafts campaign for Tanishqs Utsaah collection on Picsart
2022/01/06  00:00:00,El Salvador allows two Cuban journalists to enter country
2022/01/06  00:00:00,Bereavement notices for Cavan and Monaghan
2022/01/06  00:00:00,Generous Dumfries Tesco shoppers donate enough food for nearly 800 meals
2022/01/06  00:00:00,UK: Air Products to supply liquid hydrogen for zero emissions bus fleet
2022/01/06  00:00:00,"Epiphany  Sakellaropoulou in Gavdos, Mitsotakis in Ai Strati and Lemnos"
2022/01/06  00:00:00,Judiciary officials linked to criminal gangs: Tunisia president
2022/01/06  00:00:00,Lithuanian president calls for de-escalation plan with China
2022/01/06  00:00:00,"Azerbaijani, Turkish FMs mull situation in Kazakhstan"
2022/01/06  00:00:00,Japanese FM requests curfew for US military bases
2022/01/06  00:00:00,Settlement leader Yossi Dagan sets up protest tent outside PMO's office
2022/01/06  00:00:00,Union Minister Nityanand Rai Tests Covid Positive
2022/01/06  00:00:00,MoS Home Nityanand Rai tests Covid positive
2022/01/06  00:00:00,Sheriff Candidate Forum Offers Chance to Discuss Prison Reform
2022/01/06  00:00:00,Lawmakers debate legislation requiring gun owners to properly secure firearms
2022/01/06  00:00:00,"TUI, Jet2, BA, easyJet, RyanAir: Latest travel rules for Brits heading to USA, Netherlands, Switzerland and Croatia"
2022/01/06  00:00:00,ExxonMobil kicks off drilling operations offshore Cyprus
2022/01/06  00:00:00,THE VOICE OF VIETNAM - VOV World
2022/01/06  00:00:00,Robin Vos ordered to sit for deposition as part of election probe records lawsuit
2022/01/06  00:00:00,"Winter coats to be distributed to veterans, military personnel at Taunton VFW"
2022/01/06  00:00:00,CSTO forces sent to Kazakhstan to guard government and military property: Secretariat
2022/01/06  00:00:00,George Tsounis testimony on 12 January about the position of ambassador to Greece
2022/01/06  00:00:00,Indigenous Intermediate Jet Trainer completes six-turn spins
2022/01/06  00:00:00,US to Israel: Preparing Alternative Options if Iran Nuclear Talks Fail
2022/01/06  00:00:00,Trumps 1/6 finished the job of 9/11
2022/01/06  00:00:00,Bulli Bai app: Fourth man held over auction of Muslim women
2022/01/06  00:00:00,MP: Much ado over a Delhi trip & ministers Dilli-wadi dig
2022/01/06  00:00:00,Lithuanian president calls for de-escalation plan with China
2022/01/06  00:00:00,ADISCO Old Students donate to Apinto Govt Hospital
2022/01/06  00:00:00,Japan asks US forces to stay on base as COVID-19 cases jump
2022/01/06  00:00:00,Kuwait FM receives Moroccan envoy's credentials
2022/01/06  00:00:00,Ukraines Buffer Zone Illusion: The Russia-Wests War of Words Escalates
2022/01/06  00:00:00,Liberia: ANCs Political Leader Cummings Says Colleagues in the CPP Wants to Corrupt Him
2022/01/06  00:00:00,Roy Exum: Mayo Clinic Fires 700
2022/01/06  00:00:00,125 passengers onboard chartered flight from Italy test Covid positive upon arrival in Amritsar
2022/01/06  00:00:00,"Cabral Gold Inc.: Cabral Gold Reviews 2021 Achievements and Outlines Plans for 2022 at Cui Cui Gold District, Brazil"
2022/01/06  00:00:00,"Parents in 'limbo' as schools close, return to virtual learning amid COVID-19 surge"
2022/01/06  00:00:00,"""The Book of Hope"" delves into the mind of Jane Goodall"
2022/01/06  00:00:00,"Muslim bachelor, 29, who plastered himself on billboards to find a wife gets 2,000 responses - and will use a spreadsheet to whittle down the candidates by age, location, and personality (but not looks)"
2022/01/06  00:00:00,Russian peacekeepers depart for Kazakhstan (VIDEO)
2022/01/06  00:00:00,"Latest Met Eireann weather forecast for Ireland with snow, hail and thunderstorms in forecast"
2022/01/06  00:00:00,Waltham issues indoor mask mandate for all residents
2022/01/06  00:00:00,"Ireland's sailing, boating & maritime magazine"
2022/01/06  00:00:00,Covid-19: ACIP Backs Vax Boosters for Teens Age 12-15
2022/01/06  00:00:00,WT South Asias sequel to the first ever thematic film for Tata Pravesh
2022/01/06  00:00:00,Afghan Taliban turn blind eye to Pakistani militants
2022/01/06  00:00:00,"Erling Haalandchooses next club as Chelsea, Man Utd learn strikers fate"
2022/01/06  00:00:00,"Also in the news / Co-op hypocrisy, Walls power cut, Loganair birthday, media shortlists and improvement notice served"
2022/01/06  00:00:00,MP: Much ado over a Delhi trip & ministers Dilli-wadi dig
2022/01/06  00:00:00,Sex And The Citys Mr Big will not return to And Just Like That as Chris Noth is cut from series finale
2022/01/06  00:00:00,Roy Exum: Mayo Clinic Fires 700
2022/01/06  00:00:00,125 passengers onboard chartered flight from Italy test Covid positive upon arrival in Amritsar
2022/01/06  00:00:00,MoS Home Nityanand Rai tests Covid positive
2022/01/06  00:00:00,SA Council of Churches: Renaming Cape Town airport after Tutu worth pursuing
2022/01/06  00:00:00,"Azerbaijani, Turkish FMs mull situation in Kazakhstan"
2022/01/06  00:00:00,More rock boulders arrive for Hoarafushi Airport shore protection
2022/01/06  00:00:00,Samaria Regional Council Leader and Yehuda Dimentmans Father Pitch Protest Tent Outside Bennetts Office
2022/01/06  00:00:00,DGAP-News: Multitude SE: Multitude SE: Multitude Group financial calendar for 2022
2022/01/06  00:00:00,Around 70 Armenian peacekeepers sent to Kazakhstan
2022/01/06  00:00:00,"TUI, Jet2, BA, easyJet, RyanAir: Latest travel rules for Brits heading to USA, Netherlands, Switzerland and Croatia"
2022/01/06  00:00:00,Union Minister Nityanand Rai Tests Covid Positive
2022/01/06  00:00:00,Saudi Arabia cuts February crude prices to Asia - sources
2022/01/06  00:00:00,"Khairy: Another 123 Covid-19 Omicron cases detected, 88 from umrah returnees"
2022/01/06  00:00:00,"""Son Called From His Unit"": Belarusian Military Sent To Suppress Protests In Kazakhstan"
2022/01/06  00:00:00,"Jan. 6 committee examines FBI, DHS documents for answers on intel failure"
2022/01/06  00:00:00,Ghana Nkosuo Nti gifts to Countryside Childrens Welfare Home
2022/01/06  00:00:00,Mary Patrick sworn in as Ionia city clerk
2022/01/06  00:00:00,Birds fluttering around the lake in winter
2022/01/06  00:00:00,El Salvador allows two Cuban journalists to enter country
2022/01/06  00:00:00,Time Travel Back To 17th Century London - With This Royalist Reenactment Along The Mall
2022/01/06  00:00:00,SPG is tasked with protecting the Prime Minister. Here's how they do it
2022/01/06  00:00:00,Contractors slowing down ongoing payment process  Construction Chamber
2022/01/06  00:00:00,MacIver Minute: Minimum Bail Requirements for Repeat Offenders
2022/01/06  00:00:00,Lithuanian president calls for de-escalation plan with China
2022/01/06  00:00:00,MoS Home Nityanand Rai tests Covid positive
2022/01/06  00:00:00,"Jaishankar holds talks with Australia, Indonesia, Maldives, Bhutan counterparts"
2022/01/06  00:00:00,Afghan Taliban turn blind eye to Pakistani militants
2022/01/06  00:00:00,Ukraines Buffer Zone Illusion: The Russia-Wests War of Words Escalates
2022/01/06  00:00:00,US to Israel: Preparing Alternative Options if Iran Nuclear Talks Fail
2022/01/06  00:00:00,Reviewing the evolution of pro-Islamic State propaganda in South Asia
2022/01/06  00:00:00,Russia Sends Paratroopers to Kazakhstan to Quell Deadly Unrest
2022/01/06  00:00:00,"Jan. 6 committee examines FBI, DHS documents for answers on intel failure"
2022/01/06  00:00:00,"CCPO, military to deploy personnel for Fiesta Seor opening salvo"
2022/01/06  00:00:00,Generous Dumfries Tesco shoppers donate enough food for nearly 800 meals
2022/01/06  00:00:00,Japanese FM requests curfew for US military bases
2022/01/06  00:00:00,"2022 Honda Civic in Malaysia  3 variants, 1.5L VTEC Turbo engine, CVT and Honda Sensing as standard!"
2022/01/06  00:00:00,"Liberia: Students Sit On Floor To Learn At Special Project Public School, As COP Aids With Arm-Chairs"
2022/01/06  00:00:00,PAF to procure additional S-70i Black Hawk combat utility helicopters
2022/01/06  00:00:00,West: Syria must answer 20 questions on its chemical weapons
2022/01/06  00:00:00,US CDC panel recommends Pfizer boosters for 12-15-yr-olds
2022/01/06  00:00:00,"On gospel, myth of separation, and Tutu"
2022/01/06  00:00:00,Kyrgyzstan evacuating its citizens from Kazakhstan
2022/01/06  00:00:00,"Parents in 'limbo' as schools close, return to virtual learning amid COVID-19 surge"
2022/01/06  00:00:00,THE VOICE OF VIETNAM - VOV World
2022/01/06  00:00:00,"Yermak, Donfried discuss situation around Ukraine's borders"
2022/01/06  00:00:00,Aarey Trees > Kashmiri Lives: Tweet By Mehbooba Muftis Daughter Irks BJP
2022/01/06  00:00:00,Missouri hearing held on McCloskeys' bid to get their guns back
2022/01/06  00:00:00,Lawmakers debate legislation requiring gun owners to properly secure firearms
2022/01/06  00:00:00,EC reviews Covid situation in poll-bound states with health officials
2022/01/06  00:00:00,Waltham issues indoor mask mandate for all residents
2022/01/06  00:00:00,Sex And The Citys Mr Big will not return to And Just Like That as Chris Noth is cut from series finale
2022/01/06  00:00:00,Gavi and India's Bharat discuss possible COVAX use of Covaxin
2022/01/06  00:00:00,"Around 100 Lithuanians in Almaty, no requests for help yet  PM adviser"
2022/01/06  00:00:00,Oswego County Airport to receive funds for infrastructure improvements
2022/01/06  00:00:00,Hair-raising: Jawed Habib creates furore by spitting on woman's head
2022/01/06  00:00:00,From Paris to New York: The Story of Eugne Atget & Berenice Abbott
2022/01/06  00:00:00,Globe: Customer service channels stay open as COVID alert level raised
2022/01/06  00:00:00,US to Israel: Preparing Alternative Options if Iran Nuclear Talks Fail
2022/01/06  00:00:00,"Neeraj Bishnoi, creator of 'Bulli Bai' app, held from Assam"
2022/01/06  00:00:00,"Fliers left on cars in Florida with New York plates, tell them to leave state if they are 'woke'"
2022/01/06  00:00:00,Headlines / Quote of the Week
2022/01/06  00:00:00,"Gwadar, Kech Declared Calamity-Hit Following Torrential Rainfall"
2022/01/06  00:00:00,"In Norway, Kids Slice Out Cod Tongues for Serious Money"
2022/01/06  00:00:00,THE VOICE OF VIETNAM - VOV World
2022/01/06  00:00:00,"Azerbaijani, Turkish FMs mull situation in Kazakhstan"
2022/01/06  00:00:00,Lithuanian president calls for de-escalation plan with China
2022/01/06  00:00:00,Holiday Inn Express & Suites Johor Bahru
2022/01/06  00:00:00,"TUI, Jet2, BA, easyJet, RyanAir: Latest travel rules for Brits heading to USA, Netherlands, Switzerland and Croatia"
2022/01/06  00:00:00,South32 and Alcoa to resume production at Brazilian aluminium smelter
2022/01/06  00:00:00,Gov't to facilitate East Nusa Tenggara's post-disaster recovery
2022/01/06  00:00:00,Mary Patrick sworn in as Ionia city clerk
2022/01/06  00:00:00,Missouri hearing held on McCloskeys' bid to get their guns back
2022/01/06  00:00:00,"Pakistan International Airlines preparing to restart Europe operations, says minister"
2022/01/06  00:00:00,Duped Thai workers freed in Cambodia
2022/01/06  00:00:00,Satellite phones set to be given to 27 barangays  Mandaue CDRRMO chief
2022/01/06  00:00:00,Debris in temporary dumping station in SRP now being hauled to landfill  Councilor Rama
2022/01/06  00:00:00,Supplying Natural Products in the Cosmetics Industry
2022/01/06  00:00:00,"Chennai Metro revises train timings due to night curfew, services shut on Sundays | Check details"
2022/01/06  00:00:00,PROJECTS: Qatar Energy awards EPCI contract for North Field expansion project
2022/01/06  00:00:00,Pritzker working remotely after contact with infected worker
2022/01/06  00:00:00,"""Son Called From His Unit"": Belarusian Military Sent To Suppress Protests In Kazakhstan"
2022/01/06  00:00:00,Solar power projects see the light on former Appalachian coal land
2022/01/06  00:00:00,Judge draws marriage of Michael Gove and Sarah Vine to a close
2022/01/06  00:00:00,Bulli Bai app: Fourth man held over auction of Muslim women
2022/01/06  00:00:00,House Finance Committee Members Grill Tourism Officials On Budget Request
2022/01/06  00:00:00,125 passengers of Italy-Amritsar chartered flight test positive for Covid-19
2022/01/06  00:00:00,Chinese Bridge Over Pangong Lake In Illegally Held Territory: Government
2022/01/06  00:00:00,"Restaurants Brace for Another Surge, Another Variant"
2022/01/06  00:00:00,Salty water flowing through pipes in Portland
2022/01/06  00:00:00,Indonesian government invites public to receive vaccine booster
2022/01/06  00:00:00,"Vaccines, trade and infrastructure as Chinese FM visits Africa"
2022/01/06  00:00:00,French Parliament Gives Initial Nod To Vaccine Pass After Tumult
2022/01/06  00:00:00,CLEARLAKE CAPITAL-BACKED WHEEL PROS ACQUIRES THROTL
2022/01/06  00:00:00,Zoomcar PH launches Zoomcar Host to allow private car owners to rent out vehicles
2022/01/06  00:00:00,"DHEC asks SC residents waiting on COVID test results to call, email Care Line"
2022/01/06  00:00:00,Sankara assassination trial: Ghanaian late President Rawlings testimony tackles Blaise Compaore
2022/01/06  00:00:00,Folino's goes for three: New Williston pizza restaurant follows Shelburne and Burlington
2022/01/06  00:00:00,Blitzer says new ownership plans to bring back Utah Royals
2022/01/06  00:00:00,Missouri hearing held on McCloskeys' bid to get their guns back
2022/01/06  00:00:00,Sen. Hawley faces no real political ramifications back home for Jan. 6 actions
2022/01/06  00:00:00,"Forum Energy Metals Corp.: Forum Options Highrock Uranium Project in the Athabasca Basin, Saskatchewan to Sassy Resources"
2022/01/06  00:00:00,From Paris to New York: The Story of Eugne Atget & Berenice Abbott
2022/01/06  00:00:00,George Tsounis testimony on 12 January about the position of ambassador to Greece
2022/01/06  00:00:00,"Louisiana governor pardons Homer Plessy, subject of landmark Supreme Court case"
2022/01/06  00:00:00,"Jaishankar holds talks with Australia, Indonesia, Maldives, Bhutan counterparts"
2022/01/06  00:00:00,Lawmakers debate legislation requiring gun owners to properly secure firearms
2022/01/06  00:00:00,"Pope Francis encourages a 'courageous and prophetic faith,' decries consumerism"
2022/01/06  00:00:00,US to Israel: Preparing Alternative Options if Iran Nuclear Talks Fail
2022/01/06  00:00:00,Headlines / Quote of the Week
2022/01/06  00:00:00,"Clemons, Perry seeking to remake Alachua County government in their own image"
2022/01/06  00:00:00,"Ahmedabad BJP Chief, leaders test Covid positive after attending 'Dharmacharya Ashirwad Samaroh'"
2022/01/06  00:00:00,Main Street Cafe in downtown Watertown expands
2022/01/06  00:00:00,Kuya Silver Corporation: Kuya Silver Announces Initial Mineral Resource Estimate at Bethania Silver Project
2022/01/06  00:00:00,Sokoman and Benton Continue to Expand the Kraken Lithium Pegmatite Swarm in Newfoundland and Initiate Drill Mobilization
2022/01/06  00:00:00,"Chennai Metro revises train timings due to night curfew, services shut on Sundays | Check details"
2022/01/06  00:00:00,"Muslim bachelor, 29, who plastered himself on billboards to find a wife gets 2,000 responses - and will use a spreadsheet to whittle down the candidates by age, location, and personality (but not looks)"
2022/01/06  00:00:00,DepEd: 32 NCR schools halt face-to-face classes
2022/01/06  00:00:00,Returning Filipino from Kenya is IIoilo's first Omicron case
2022/01/06  00:00:00,"Forum Energy Metals Corp.: Forum Options Highrock Uranium Project in the Athabasca Basin, Saskatchewan to Sassy Resources"
2022/01/06  00:00:00,Homer Plessy pardon attempts to remove historic stain of Jim Crow laws
2022/01/06  00:00:00,EC reviews Covid situation in poll-bound states with health officials
2022/01/06  00:00:00,Rekindle the Spirit takes over Rialto Theatre
2022/01/06  00:00:00,From the Editor-in-Chiefs desk: Your January 7 briefing
2022/01/06  00:00:00,Dutch government set to discuss 2G rules as COVID-19 infection rate rises
2022/01/06  00:00:00,"Vaccines, trade and infrastructure as Chinese FM visits Africa"
2022/01/06  00:00:00,Headlines / Quote of the Week
2022/01/06  00:00:00,"Khairy: Malaysia could see 30,000 daily Covid-19 cases by March if Omicron wave not suppressed"
2022/01/06  00:00:00,Gulf World Marine Institute in Panama City Beach rehabs stranded bottlenose dolphin
2022/01/06  00:00:00,State policy on vaccinating foster kids without parents' OK concerns Central Mass. lawyers
2022/01/06  00:00:00,Azerbaijani vessels continue cargo transportation to Kazakhstan
2022/01/06  00:00:00,Indonesian government invites public to receive vaccine booster
2022/01/06  00:00:00,"Australia, Japan Sign Bilateral Defense Treaty"
2022/01/06  00:00:00,Solar power projects see the light on former Appalachian coal land
2022/01/06  00:00:00,"Lapid talks Ukraine, Iran in call with Blinken"
2022/01/06  00:00:00,Managed workspace provider Simpliwork forays into Chennai
2022/01/06  00:00:00,"Parents in 'limbo' as schools close, return to virtual learning amid COVID-19 surge"
2022/01/06  00:00:00,Pfizer and Biohaven close collaboration agreements
2022/01/06  00:00:00,Ukraines Buffer Zone Illusion: The Russia-Wests War of Words Escalates
2022/01/06  00:00:00,125 passengers of Italy-Amritsar chartered flight test positive for Covid-19
2022/01/06  00:00:00,LGH considering federal strike team amid latest COVID-19 surge
2022/01/06  00:00:00,The number of patients in Hull hospitals with Covid right now
2022/01/06  00:00:00,Belfast International Airport: RECAP as emergency services called to incident
2022/01/06  00:00:00,'Khuda Haafiz' director Faruk Kabir joins AlHayah TV Network's talk show as guest
2022/01/06  00:00:00,Ukraines Buffer Zone Illusion: The Russia-Wests War of Words Escalates
2022/01/06  00:00:00,Canadas Assent Compliance lands $350M from Vista Equity for supply chain data management
2022/01/06  00:00:00,"From the Archives, 1987: Ruxton clashes with delegates"
2022/01/06  00:00:00,"Pope Francis encourages a 'courageous and prophetic faith,' decries consumerism"
2022/01/06  00:00:00,Honor Jazz Band hosts weekend concerts
2022/01/06  00:00:00,"Forum Energy Metals Corp.: Forum Options Highrock Uranium Project in the Athabasca Basin, Saskatchewan to Sassy Resources"
