date,title
2022/05/24  00:00:00,Irish Charities Regulator issue a reminder over Ukraine support
2022/05/24  00:00:00,Gov. Whitmer proposes using revenue surplus to expand tutoring options for students
2022/05/24  00:00:00,"Biden's Taiwan comment hangs over summit with leaders of Japan, India and Australia on final day of Asia trip"
2022/05/24  00:00:00,Sri Lanka chooses 2 int'l firms to advise on debt restructuring
2022/05/24  00:00:00,Teams begin inspection of stone quarries
2022/05/24  00:00:00,Tachyum Demonstrates Prodigy Emulation System at ISC High Performance 2022
2022/05/24  00:00:00,'A size 10 foot in a size 9 shoe': Inlet Beach development proposal to eliminate 2 townhomes
2022/05/24  00:00:00,MFA Nasser Bourita: Morocco Supports Single Candidacy of Louise Mushikiwabo to Continue Reforms.
2022/05/24  00:00:00,"Consolidation of judicial relations between Morocco, USA discussed in Rabat"
2022/05/24  00:00:00,Joint Statement Between the UnitedStates and the European Commission on European EnergySecurity
2022/05/24  00:00:00,"Japan says China, Russia jets flew nearby as Quad met"
2022/05/24  00:00:00,APC primary: Group drums support for Osinbajo
2022/05/24  00:00:00,She thought a dark moment in her past was forgotten. Then she scanned her face online
2022/05/24  00:00:00,Morocco records three suspected cases of monkeypox
2022/05/24  00:00:00,"Saudia, NEOM to start regular international flights from NEOM Bay Airport"
2022/05/24  00:00:00,Silicon Valley Billionaire Storms Into Texas to Bail Out Abortion Foe Henry Cuellar
2022/05/24  00:00:00,"Turkiye To Host Talks With Sweden, Finland On NATO Bids"
2022/05/24  00:00:00,"Plate, Google Asia-Pacific President discuss digital ecosystem"
2022/05/24  00:00:00,Pair of Black Mamba Snakes Found on the Same Property
2022/05/24  00:00:00,US Navy exercises $423m contract option for Raytheons SPY-6 radar
2022/05/24  00:00:00,Home Ministry to discuss with new source countries on recruiting security workers
2022/05/24  00:00:00,Luis Suarez talks up reunion with Lionel Messi at Inter Miami
2022/05/24  00:00:00,"Sweden, Finland to send delegations to Turkey over NATO bids"
2022/05/24  00:00:00,Cannes 2022: Netflix and Apple still splashing the cash
2022/05/24  00:00:00,'A size 10 foot in a size 9 shoe': Inlet Beach development proposal to eliminate 2 townhomes
2022/05/24  00:00:00,Perdue Concludes Anemic Campaign With Some Desperate Old-Fashioned Racism
2022/05/24  00:00:00,"Informatica Expands Microsoft, Google Cloud Partnerships For Data Management"
2022/05/24  00:00:00,"20,000 migrant Lao workers register with Thai authorities"
2022/05/24  00:00:00,India says Quad countries understand its position on Ukraine
2022/05/24  00:00:00,Slot Gacor Scatter78 - Link Daftar Situs Slot Online Gacor Terpercaya Hari Ini
2022/05/24  00:00:00,"Trial Attorney Yanique L. Otto, Founder of The Otto Law Group, Joins Kelley|Uustal as a Partner"
2022/05/24  00:00:00,"Oman, Austria hold political consultations session"
2022/05/24  00:00:00,McCarthy Tops Out University of Arizona Research Facility
2022/05/24  00:00:00,U.S. says China and Russia bomber drill shows depth of their alignment
2022/05/24  00:00:00,Police in England and Wales to get anti-racism training
2022/05/24  00:00:00,Hidden: Google is Masking Something in Cedar Rapids [PHOTOS]
2022/05/24  00:00:00,Pediatrician answers parents' questions about COVID-19 vaccine for kids under 5
2022/05/24  00:00:00,Home Ministry to discuss with new source countries on recruiting security workers
2022/05/24  00:00:00,"Plate, Google Asia-Pacific President discuss digital ecosystem"
2022/05/24  00:00:00,Lithium Corporation Signs Letter Of Intent - North Big Smoky Property Nevada
2022/05/24  00:00:00,New pretrial deadlines set in Baltimore States Attorney Marilyn Mosbys criminal case
2022/05/24  00:00:00,"Biden's Taiwan comment hangs over summit with leaders of Japan, India and Australia on final day of Asia trip"
2022/05/24  00:00:00,CM Pema Khandu underlines Arunachal's potential for trade
2022/05/24  00:00:00,'A size 10 foot in a size 9 shoe': Inlet Beach development proposal to eliminate 2 townhomes
2022/05/24  00:00:00,Southeast Asian Nations Roll the Dice on Bidens Indo-Pacific Framework
2022/05/24  00:00:00,"Tattarang shops around Perth logistics park, CBRE hired"
2022/05/24  00:00:00,"PM Modi, President Biden meet in Japan; discuss defence, vaccine, education collaborations"
2022/05/24  00:00:00,Long-time Victorian ham and bacon maker Tibaldi dressed for sale
2022/05/24  00:00:00,Perdue Concludes Anemic Campaign With Some Desperate Old-Fashioned Racism
2022/05/24  00:00:00,"Donna Brazile: George Floyd, the 10 Black people killed in Buffalo ought to be alive today"
2022/05/24  00:00:00,Researchers start planting space-bred seeds returned by Shenzhou-13
2022/05/24  00:00:00,"NJ Senate President Scutari, political foes settle Linden feud over 'serial absenteeism'"
2022/05/24  00:00:00,Allinson to introduce Assisted Dying Bill
2022/05/24  00:00:00,Lower Brule sues Lyman County for voter redistricting
2022/05/24  00:00:00,Abu Dhabi International Airport resumes Terminal 2 operations
2022/05/24  00:00:00,"University of Tennessee, Knoxville Expands Relationship with Noodle to Launch an Online Master of Business Administration"
2022/05/24  00:00:00,Lithium Corporation Signs Letter Of Intent - North Big Smoky Property Nevada
2022/05/24  00:00:00,PU signs MoU with French University
2022/05/24  00:00:00,Billionaire Moderna CEO Stphane Bancel Pledges Stock Options Worth $355 Million To Undisclosed Charitable Causes
2022/05/24  00:00:00,Dodd introduces broadband expansion blueprint bill
2022/05/24  00:00:00,Developments on Major Fronts in Ukraine: AFU General Staffs Report
2022/05/24  00:00:00,Calvin Harris and Radio 1 DJ Vick Hope 'dated for weeks' in Ibiza before going public
2022/05/24  00:00:00,"PM Modi, President Biden meet in Japan; discuss defence, vaccine, education collaborations"
2022/05/24  00:00:00,"Japan says China, Russia jets flew nearby as Quad met"
2022/05/24  00:00:00,"Ex-Gombe Governor, Goje clears air on partaking in PDP primary"
2022/05/24  00:00:00,"Imran throws ball in the court of 'neutrals', judiciary"
2022/05/24  00:00:00,Desiree Peterkin Bell Gives Perspective on Supreme Court and Ketanji Brown Jackson's Confirmation
2022/05/24  00:00:00,Kate Moss expected to be called by Johnny Depp's legal team as witness this week
2022/05/24  00:00:00,Taiwans Keelung launches landmark sign with message for COVID fighters
2022/05/24  00:00:00,The two genres of Trump book
2022/05/24  00:00:00,Kuwait: Plan to replace expats with Bidoon
2022/05/24  00:00:00,Thailand News Today | Thailand to develop and launch monkeypox Test
2022/05/24  00:00:00,"Turkiye To Host Talks With Sweden, Finland On NATO Bids"
2022/05/24  00:00:00,"The Rise of China: Propaganda, impact, influence, censorship, aggressive strikes on Tibet: A report"
2022/05/24  00:00:00,EC President Von Der Leyen Condemns 'Russia's Blackmail' on Food and Fuel
2022/05/24  00:00:00,Second group of L2FH Rotation 4 heads for South Sudan
2022/05/24  00:00:00,Home Ministry to discuss with new source countries on recruiting security workers
2022/05/24  00:00:00,U.S. says China and Russia bomber drill shows depth of their alignment
2022/05/24  00:00:00,"Garamendi adds provisions to water bill to help Solano, Delta region"
2022/05/24  00:00:00,"University of Tennessee, Knoxville Expands Relationship with Noodle to Launch an Online Master of Business Administration"
2022/05/24  00:00:00,Escaping Mares Nest: The case of Afghan Hazara
2022/05/24  00:00:00,Apple expands Today at Apple Creative Studios
2022/05/24  00:00:00,"Donna Brazile: George Floyd, the 10 Black people killed in Buffalo ought to be alive today"
2022/05/24  00:00:00,Candidates for the Colombian Presidency Attended a Debate
2022/05/24  00:00:00,APC primary: Group drums support for Osinbajo
2022/05/24  00:00:00,"Japan says China, Russia jets flew nearby as leaders met during Quad Summit in Tokyo"
2022/05/24  00:00:00,Beaufort County conducts traffic study on US 278 in Okatie
2022/05/24  00:00:00,MFA Nasser Bourita: Morocco Supports Single Candidacy of Louise Mushikiwabo to Continue Reforms.
2022/05/24  00:00:00,"2-Day Virtual Seminar on Building a Robust Vendor Qualification Program for FDA Regulated Industries (August 25-26, 2022) - ResearchAndMarkets.com"
2022/05/24  00:00:00,Glass Lewis Recommends New York City REIT Stockholders Vote FOR Sharon Stern on the WHITE Proxy Card
2022/05/24  00:00:00,"Japan says China, Russia jets flew nearby as Quad met"
2022/05/24  00:00:00,BBC Springwatch comes live from Northumberland Coast on three-week road trip
2022/05/24  00:00:00,She thought a dark moment in her past was forgotten. Then she scanned her face online
2022/05/24  00:00:00,KWESST Micro Systems Inc.: Persistent Systems Designates KWESST as Authorized Integrator
2022/05/24  00:00:00,"More Industrial Automation, Robots and Unmanned Vehicles Resources"
2022/05/24  00:00:00,"Plate, Google Asia-Pacific President discuss digital ecosystem"
2022/05/24  00:00:00,Ukrainian Military Pounds Russian Forces With Western Artillery
2022/05/24  00:00:00,Governor Tours Border Near Eagle Pass
2022/05/24  00:00:00,Oxford High School Selects ZeroEyes' AI Gun Detection for Pilot Program
2022/05/24  00:00:00,Governor Holcomb meets with 2022 Governors STEM Team including Columbus student
2022/05/24  00:00:00,Russian sappers begin mine-clearing operations near Mariupol coastline
2022/05/24  00:00:00,Home Ministry to discuss with new source countries on recruiting security workers
2022/05/24  00:00:00,Gi-Wook Shin on Gwangju and South Koreas Democracy
2022/05/24  00:00:00,U.S. says China and Russia bomber drill shows depth of their alignment
2022/05/24  00:00:00,Silicon Valley Billionaire Storms Into Texas to Bail Out Abortion Foe Henry Cuellar
2022/05/24  00:00:00,"Palantir, Trafigura to Track Carbon Emissions for Oil, Metals industry"
2022/05/24  00:00:00,UAEs VPS Healthcare launches Burjeel Holdings to support growth plans
2022/05/24  00:00:00,America's Frontier Fund to Convene the Quad Investor Network   USA - English      India - Hindi     India - English
2022/05/24  00:00:00,Rock Solid CEO Says Shreveport Has Awarded Them Contract to Run Pools
2022/05/24  00:00:00,Spiking of university students to be tackled
2022/05/24  00:00:00,"Imran throws ball in the court of 'neutrals', judiciary"
2022/05/24  00:00:00,"Turkiye To Host Talks With Sweden, Finland On NATO Bids"
2022/05/24  00:00:00,Sungrow supplying BESS to Tata Power Solars tender-winning project in India
2022/05/24  00:00:00,Boy pictured in old P500 banknote now a nurse in New York City
2022/05/24  00:00:00,"Elusive Trucker From Babruisk Managed To ""Insult"" Lukashenka And His Officials 54 Times"
2022/05/24  00:00:00,"Ingredion Incorporated: Ingredion Releases 2021 Diversity, Equity, and Inclusion Report: ""Beyond Belonging"""
2022/05/24  00:00:00,Orsu Metals Corporation: Orsu Metals to Complete Transformative Transaction to Become a Global Helium Explorer
2022/05/24  00:00:00,Click It or Ticket enforcement begins
2022/05/24  00:00:00,Jarrod Bowen and James Justin get first England call-ups as Tomori returns
2022/05/24  00:00:00,"Speech by Economic Secretary John Glen, at the Association of British Credit Unions Limited"
2022/05/24  00:00:00,Lower Brule sues Lyman County for voter redistricting
2022/05/24  00:00:00,PM Chinh meets with friends of Vietnam in the US
2022/05/24  00:00:00,Planned Parenthood of Illinois Offering Abortion Pills Through Mail
2022/05/24  00:00:00,Researchers start planting space-bred seeds returned by Shenzhou-13
2022/05/24  00:00:00,"Japan says China, Russia jets flew nearby as Quad met"
2022/05/24  00:00:00,"Tattarang shops around Perth logistics park, CBRE hired"
2022/05/24  00:00:00,Chinas Foreign Minister to Visit South Pacific Island Nations After Security Pact With Solomon Islands
2022/05/24  00:00:00,"Turkiye To Host Talks With Sweden, Finland On NATO Bids"
2022/05/24  00:00:00,China foreign minister to stop at eight nations on Pacific tour
2022/05/24  00:00:00,Taylor Schaefer selected as 75th Alice in Dairyland
2022/05/24  00:00:00,"Japan says China, Russia jets flew nearby as leaders met during Quad Summit in Tokyo"
2022/05/24  00:00:00,Spiking of university students to be tackled
2022/05/24  00:00:00,"Consolidation of judicial relations between Morocco, USA discussed in Rabat"
2022/05/24  00:00:00,Commonwealth of Learning |24 May 2022
2022/05/24  00:00:00,India says Quad countries understand its position on Ukraine
2022/05/24  00:00:00,Georgia primary pits Pence-endorsed Brian Kemp against Trump-backed David Perdue
2022/05/24  00:00:00,"PM Modi hands over memorial gifts to Australian, Japanese PM and US President"
2022/05/24  00:00:00,Jarrod Bowen and James Justin get first England call-ups as Tomori returns
2022/05/24  00:00:00,Billionaire Moderna CEO Stphane Bancel Pledges Stock Options Worth $355 Million To Undisclosed Charitable Causes
2022/05/24  00:00:00,"Turkey to host delegations from Sweden, Finland to discuss NATO bid"
2022/05/24  00:00:00,Philadelphia school district reinstates mask requirement
2022/05/24  00:00:00,President Ramkalawan meets delegates from Commonwealth of Learning |24 May 2022
2022/05/24  00:00:00,"Kuleba discusses with Blinken supply of weapons to Ukraine, unblocking of Ukrainian food exports"
2022/05/24  00:00:00,"Walmart pulls Juneteenth ice cream, local Black-owned Creamalicious touted"
2022/05/24  00:00:00,Planned Parenthood of Illinois Offering Abortion Pills Through Mail
2022/05/24  00:00:00,"Oman, Austria hold political consultations session"
2022/05/24  00:00:00,PJX Resources Inc.: Sullivan Mining District - High Grade Gold Mineralization Intersected on Strike of PJX Resources' David Gold Zone
2022/05/24  00:00:00,Governor Tours Border Near Eagle Pass
2022/05/24  00:00:00,'One-sided set of facts': Staunton group asks merchants to push governor for courthouse veto
2022/05/24  00:00:00,Proxy Adviser Urges Exxon Mobil Shareholders to Oust Darren Woods as Chairman
2022/05/24  00:00:00,China Is Doing Bidens Work for Him
2022/05/24  00:00:00,Escaping Mares Nest: The case of Afghan Hazara
2022/05/24  00:00:00,"2023 Honda CR-V preview shows evolutionary look, less chrome"
2022/05/24  00:00:00,Silicon Valley Billionaire Storms Into Texas to Bail Out Abortion Foe Henry Cuellar
2022/05/24  00:00:00,"Garamendi adds provisions to water bill to help Solano, Delta region"
2022/05/24  00:00:00,Donald Kaberuka and Pascal Lamy on the need for clean-energy partnerships between Africa and Europe
2022/05/24  00:00:00,Georgia primary pits Pence-endorsed Brian Kemp against Trump-backed David Perdue
2022/05/24  00:00:00,Shoplifter barred from every M&S and Sainsbury's in Cambridgeshire
2022/05/24  00:00:00,"Turkey to host delegations from Sweden, Finland to discuss NATO bid"
2022/05/24  00:00:00,Provocative sloganeering: Two PFI activists held
2022/05/24  00:00:00,Slot Gacor Scatter78 - Link Daftar Situs Slot Online Gacor Terpercaya Hari Ini
2022/05/24  00:00:00,Brightside World Tour: The Lumineers return to South Africa for two shows
2022/05/24  00:00:00,"China, Russia conduct joint aerial patrol in military exercise"
2022/05/24  00:00:00,U.S. says China and Russia bomber drill shows depth of their alignment
2022/05/24  00:00:00,India says Quad countries understand its position on Ukraine
2022/05/24  00:00:00,Carney Activates Delaware National Guard to Support Stockley Center
2022/05/24  00:00:00,Virgil Ablohs Final Project For Nike X Louis Vuitton On Display In Brooklyn
2022/05/24  00:00:00,"Trial Attorney Yanique L. Otto, Founder of The Otto Law Group, Joins Kelley|Uustal as a Partner"
2022/05/24  00:00:00,Delek to develop Cypriot gas field without Israel's consent
2022/05/24  00:00:00,Commonwealth of Learning |24 May 2022
2022/05/24  00:00:00,"Garamendi adds provisions to water bill to help Solano, Delta region"
2022/05/24  00:00:00,Pfizer Says 3 Doses of COVID Vaccine Effective For Children Under The Age of 5
2022/05/24  00:00:00,"From the Archives, 1982: Rendezvous with mountain gunman"
2022/05/24  00:00:00,"ROCKY MOUNTAIN INDUSTRIALS CLOSES $23,000,000 COMMERCIAL FINANCING"
2022/05/24  00:00:00,Bank of America to More Than Double Electrify America Ultra-Fast Charging Stations at Financial Centers
2022/05/24  00:00:00,Rare Haut-Brion helps Prince Robert of Luxembourg cellar auction smash estimate
2022/05/24  00:00:00,"Berkshire Bank to sell historic North Street building in Pittsfield, a bank address since 1846"
2022/05/24  00:00:00,PU signs MoU with French University
2022/05/24  00:00:00,Community Q&A: Yakima pediatrician Dr. Jocelyn Pedrosa discusses formula shortage and advice for families
2022/05/24  00:00:00,"2023: PDP politicians without source of income doling out dollars, buying candidates  Coalition alleges"
2022/05/24  00:00:00,Governor's Job Fair coming to The Communiversity at EMCC
2022/05/24  00:00:00,"Pankaj Tripathi, Sayani Gupta tweet BTS picture from 'Sherdil: The Pilibhit Saga'"
2022/05/24  00:00:00,Carney Activates Delaware National Guard to Support Stockley Center
2022/05/24  00:00:00,Desiree Peterkin Bell Gives Perspective on Supreme Court and Ketanji Brown Jackson's Confirmation
2022/05/24  00:00:00,Harvard Business School calls on Columbus execs for leadership program
2022/05/24  00:00:00,Governor Tours Border Near Eagle Pass
2022/05/24  00:00:00,"China, Russia conduct joint aerial patrol in military exercise"
2022/05/24  00:00:00,PM Orbn Holds Talk with EU Council President on EU Oil Embargo
2022/05/24  00:00:00,Gi-Wook Shin on Gwangju and South Koreas Democracy
2022/05/24  00:00:00,USAFs 53rd Wing and RAAF conduct joint test exercise Black Flag 22-1
2022/05/24  00:00:00,Iran sees Israeli message on Syria and nuclear talks in assassination
2022/05/24  00:00:00,Tech Policy in Congress and the European Union: Highlights from My Conversation with Peter Brown
2022/05/24  00:00:00,Delek to develop Cypriot gas field without Israel's consent
2022/05/24  00:00:00,Pentagon Chief: 20 Countries Sending New Security Aid to Ukraine
2022/05/24  00:00:00,Renesas Electronics Corporation: Renesas Will Demonstrate the First Working Silicon Based on the Recently Debuted Arm Cortex-M85 Processor
2022/05/24  00:00:00,"PM Modi hands over memorial gifts to Australian, Japanese PM and US President"
2022/05/24  00:00:00,Kate Moss expected to be called by Johnny Depp's legal team as witness this week
2022/05/24  00:00:00,PU signs MoU with French University
2022/05/24  00:00:00,India says Quad countries understand its position on Ukraine
2022/05/24  00:00:00,Antam to pay 50% of profit as dividend
2022/05/24  00:00:00,"Ireland's sailing, boating & maritime magazine"
2022/05/24  00:00:00,10 Prehistoric Battle Sites Around the World
2022/05/24  00:00:00,Works gather pace on 100m Metro Flow project in UK
2022/05/24  00:00:00,"Stranded La Jolla Woman, 87, Brings Treats to Firefighters Who Gave Her a Lift"
2022/05/24  00:00:00,Boy pictured in old P500 banknote now a nurse in New York City
2022/05/24  00:00:00,Chelsea set sights on Raheem Sterling
2022/05/24  00:00:00,Desiree Peterkin Bell Gives Perspective on Supreme Court and Ketanji Brown Jackson's Confirmation
2022/05/24  00:00:00,Letters: Room now for a centrist party
2022/05/24  00:00:00,Harvard Business School calls on Columbus execs for leadership program
2022/05/24  00:00:00,Ukraines Getting Harpoon Anti-Ship Missiles. They Could Free Up A Whole Tank Brigade.
2022/05/24  00:00:00,Letter: Recent B2H article only had part of the facts
2022/05/24  00:00:00,Defence Procurement Minister speech at Combined Naval Event
2022/05/24  00:00:00,"DFSK EC35 EV van launched in Malaysia  two- or five-seat options, 200 km city range, RM130k or via leasing"
2022/05/24  00:00:00,"University of Tennessee, Knoxville Expands Relationship with Noodle to Launch an Online Master of Business Administration"
2022/05/24  00:00:00,Sensirion Inside: Temperature and Humidity Monitor THEye
2022/05/24  00:00:00,Mark Drakeford defends spending 4.25m on a farm for Green Man Festival
2022/05/24  00:00:00,"Ireland's sailing, boating & maritime magazine"
2022/05/24  00:00:00,CBI moves plea to attach former Haryana CMs assets in DA case
2022/05/24  00:00:00,N.Y. Attorney General James in Schenectady for update on St. Clares pensioners
2022/05/24  00:00:00,China wields COVID-19 to neuter UN human rights trip to Xinjiang
2022/05/24  00:00:00,Lower Brule sues Lyman County for voter redistricting
2022/05/24  00:00:00,10 Prehistoric Battle Sites Around the World
2022/05/24  00:00:00,UTC Students Conducting Research For The Chattanooga Zoo This Summer
2022/05/24  00:00:00,Billionaire Moderna CEO Stphane Bancel Pledges Stock Options Worth $355 Million To Undisclosed Charitable Causes
2022/05/24  00:00:00,"Spanish PM Pedro Snchez Champions Freedom, Democracy and Post-Fossil Fuel Era"
2022/05/24  00:00:00,Teens to remain in adult prison as part of homicide cases
2022/05/24  00:00:00,Harvard Business School calls on Columbus execs for leadership program
2022/05/24  00:00:00,Proxy Adviser Urges Exxon Mobil Shareholders to Oust Darren Woods as Chairman
2022/05/24  00:00:00,Dealer Asking For Reconfirmation of Order
2022/05/24  00:00:00,Minister pitches for traditional Maharashtrian ceremonies for convocation at varsities
2022/05/24  00:00:00,Donald Kaberuka and Pascal Lamy on the need for clean-energy partnerships between Africa and Europe
2022/05/24  00:00:00,"The Rise of China: Propaganda, impact, influence, censorship, aggressive strikes on Tibet: A report"
2022/05/24  00:00:00,Top in ID: Monkeypox virus in US; trained dogs sniff out COVID-19
2022/05/24  00:00:00,Bourgogne Grapples With Fighting Frost Without Producing Emissions
2022/05/24  00:00:00,NI waiting lists: Health service in court over hospital waits
2022/05/24  00:00:00,Commonwealth of Learning |24 May 2022
2022/05/24  00:00:00,Embraer and 4AIR Partner to Offer Free Carbon Offsetting
2022/05/24  00:00:00,The two genres of Trump book
2022/05/24  00:00:00,German chancellor woos allies in Africa
2022/05/24  00:00:00,Letters: Room now for a centrist party
2022/05/24  00:00:00,Germany's COVID-19 vaccine panel recommends single dose for kids aged 5 to 11
2022/05/24  00:00:00,Queen Mary forms strategic partnership with Universiti Sains Malaysia
2022/05/24  00:00:00,"Uttar Pradesh: Allahabad HC asks man accused of mob violence to distribute cold water, sherbat"
2022/05/24  00:00:00,"Illinois Forest Preserves, Nature Centers Summer Program Roundup"
2022/05/24  00:00:00,Ananda Developments Plc - Exercise of Warrants
2022/05/24  00:00:00,APC group drags Justice Benson Anya before Abia State chief judge
2022/05/24  00:00:00,Gi-Wook Shin on Gwangju and South Koreas Democracy
2022/05/24  00:00:00,"""White House LNG Task Force Compared to Secretive Cheney Oil Group"""
2022/05/24  00:00:00,PU signs MoU with French University
2022/05/24  00:00:00,Planned Parenthood of Illinois Offering Abortion Pills Through Mail
2022/05/24  00:00:00,"Ireland's sailing, boating & maritime magazine"
2022/05/24  00:00:00,Minister Ottley meets with CPS to discuss Monkeypox virus outbreak.
2022/05/24  00:00:00,Vietnam's VinFast to shift legal HQ to SG ahead of first exports
2022/05/24  00:00:00,"Indiana lawmakers set for technical session; veto override, technical corrections on agenda"
2022/05/24  00:00:00,Around the Region - May 25
2022/05/24  00:00:00,"Oman, Austria hold political consultations session"
2022/05/24  00:00:00,Delek to develop Cypriot gas field without Israel's consent
2022/05/24  00:00:00,Texas Dem runoff pits progressive Cisneros vs establishment-backed Cuellar
2022/05/24  00:00:00,"Build a custom email digest by following topics, people, and firms published on JD Supra."
2022/05/24  00:00:00,Harvard Business School calls on Columbus execs for leadership program
2022/05/24  00:00:00,Teams begin inspection of stone quarries
2022/05/24  00:00:00,Letters: Room now for a centrist party
2022/05/24  00:00:00,"Charleston lawmaker, who is a brother of Emanuel AME victim, to visit shooting site in Buffalo"
2022/05/24  00:00:00,"Japan says China, Russia jets flew nearby as leaders met during Quad Summit in Tokyo"
2022/05/24  00:00:00,CGTN: The key Xi Jinping learned from his father   USA - English      Brazil - Portugus     Latin America - espaol     USA - espaol     USA - slovenina     USA - Polski
2022/05/24  00:00:00,Greek Defense Min. meets with Chinese Ambassador
2022/05/24  00:00:00,"Rivian, city partner to host monthly employee farmers' markets"
2022/05/24  00:00:00,China Is Doing Bidens Work for Him
2022/05/24  00:00:00,Central Bank of Armenia: exchange rates and prices of precious metals - 24-05-22 | ARMENPRESS Armenian News Agency
2022/05/24  00:00:00,Perth teacher who completed pupils' history tests struck off
2022/05/24  00:00:00,"The Lessons Behind The Stories Of Celebrities, Mansions, And Mortgages"
2022/05/24  00:00:00,Head Of Ukrainian Intelligence About The End Of The War Active Phase
2022/05/24  00:00:00,German chancellor woos allies in Africa
2022/05/24  00:00:00,'One-sided set of facts': Staunton group asks merchants to push governor for courthouse veto
2022/05/24  00:00:00,Routes to Medical School for the High School Student
2022/05/24  00:00:00,"Kuleba discusses with Blinken supply of weapons to Ukraine, unblocking of Ukrainian food exports"
2022/05/24  00:00:00,Tech Policy in Congress and the European Union: Highlights from My Conversation with Peter Brown
2022/05/24  00:00:00,Expert: Lukashenka's Statements May Be Prerequisites To Involve Belarusian Army In The War
2022/05/24  00:00:00,Developments on Major Fronts in Ukraine: AFU General Staffs Report
2022/05/24  00:00:00,GPDRR chance for sharing disaster mitigation experiences: BNPB
2022/05/24  00:00:00,"Itasca DFL endorses Samuelson, Blake, Boos"
