date,title
2022/06/30  00:00:00,Coup for Sydney as leading culture festival South by Southwest heads Down Under
2022/06/30  00:00:00,Leeds United battle Nice for Moses Simon
2022/06/30  00:00:00,SC stays implementation of Tripura HC orders on security cover to Ambanis
2022/06/30  00:00:00,Joe Rogan says Florida Gov. Ron DeSantis would be a 'good president' and calls Joe Biden a 'dead man'
2022/06/30  00:00:00,"A Father, a Son, a Disease, and a Camera"
2022/06/30  00:00:00,ThePolice Commissioner says they tried everything in their power to get protesters at Wellington's Mahanga Bay to leavevoluntarily
2022/06/30  00:00:00,Melbourne MSP Crash Technology to acquire Tek Support
2022/06/30  00:00:00,UN: Well-Armed M23 Rebels Resurgent in DRC
2022/06/30  00:00:00,"Indonesian calls, messages at G7 Summit"
2022/06/30  00:00:00,"Charles Heidsieck Champagne Charlie: Act III, Scene I"
2022/06/30  00:00:00,"Mukesh Ambanis Succession Plan: Focus on GenNext, after infocomm Akash, Isha poised for telecom & retail holding cos chair"
2022/06/30  00:00:00,Newcastle United enter race for Joshua Zirkzee
2022/06/30  00:00:00,Prayut vows EV production within year
2022/06/30  00:00:00,"Committee of Public Health, Social Development, and Labor of Parliament to meet with the Minister of Public Health, Social Development and Labor (VSA)."
2022/06/30  00:00:00,Nigeria produces over 420 tons of pipes annually  NCDMB
2022/06/30  00:00:00,"Build a custom email digest by following topics, people, and firms published on JD Supra."
2022/06/30  00:00:00,"Sweet and sour 											Fond memories, family connection found in pungent Polish soup   							By: AV Kitching Posted: 7:00 PM CDT Wednesday, Jun. 29, 2022"
2022/06/30  00:00:00,USS Kearsarge takes part in chaplains swap during NATOs big Baltic exercise
2022/06/30  00:00:00,"The United States provides American Visa Online for tourism, transit visits, and business visits"
2022/06/30  00:00:00,Nets Spend Nearly Twice the Time Touting Trump Steering Wheel Tale vs. Denials
2022/06/30  00:00:00,"Odisha receives investment intents worth Rs 21,000cr (Ld, changing dateline)"
2022/06/30  00:00:00,We saved you a bite: Cedar Grill (Lebanon Valley Food Critics)
2022/06/30  00:00:00,SXSW Goes Down Under With SXSW Sydney
2022/06/30  00:00:00,Dawan Ferguson trial enters day 4
2022/06/30  00:00:00,"Abercrombie back in Humm chair, Fahour extends options deal"
2022/06/30  00:00:00,"Night & Day // June 30  July 6, 2022"
2022/06/30  00:00:00,"Bangladeshi Navy detains 135 Indian fishermen, seizes 8 trawlers"
2022/06/30  00:00:00,Borden-Henryville to offer On My Way PreK
2022/06/30  00:00:00,China to hand over completed new parliament building to Zimbabwe
2022/06/30  00:00:00,"From near and far, visitors return to Yellowstone National Park"
2022/06/30  00:00:00,Comments sought on one of best pumped storage sites in Washington
2022/06/30  00:00:00,Putin meets with Azerbaijans Aliyev in Ashgabat
2022/06/30  00:00:00,Irans Raisi offers Putin to cooperate on Caspian Sea
2022/06/30  00:00:00,Josh Duggar Transferred To Texas Prison To Finish Serving Sentence
2022/06/30  00:00:00,"Easterseals Arc shows off hands-on training labs for health care, hospitality"
2022/06/30  00:00:00,"JMA Global with Jeanette Abraham, president and CEO"
2022/06/30  00:00:00,"Odisha receives investment intents worth Rs 21,000cr (Ld, changing dateline)"
2022/06/30  00:00:00,"Taizhou Toplong Electrical & Mechanical Co.,Ltd Launches Various Oxygen Compressors And Hydrogen Generators to Adapt to Different Working Environments"
2022/06/30  00:00:00,Robbery witness: 'In the doorway is standing a guy and he is carrying an assault rifle'
2022/06/30  00:00:00,"McDowell shareholders, creditor battle it out for Rs 920-cr UB shares"
2022/06/30  00:00:00,"Build a custom email digest by following topics, people, and firms published on JD Supra."
2022/06/30  00:00:00,Pope Francis pushes to purge liturgy of ideology in new document
2022/06/30  00:00:00,"Abercrombie back in Humm chair, Fahour extends options deal"
2022/06/30  00:00:00,"Indonesian calls, messages at G7 Summit"
2022/06/30  00:00:00,"New Concordia OR hits snag in effort to cut surgery backlog 										  							By: Danielle Da Silva Posted: 7:00 PM CDT Wednesday, Jun. 29, 2022"
2022/06/30  00:00:00,"Sweet and sour 											Fond memories, family connection found in pungent Polish soup   							By: AV Kitching Posted: 7:00 PM CDT Wednesday, Jun. 29, 2022"
2022/06/30  00:00:00,"Xi inspects Wuhan, stresses sci-tech innovation, COVID-19 control, community management"
2022/06/30  00:00:00,Jointworks Solutions Provides Clients with Design Experts
2022/06/30  00:00:00,Turkey Visa Application  Details of Visas granted by New Zealand
2022/06/30  00:00:00,"Google sign-up 'fast track to surveillance', consumer groups say"
2022/06/30  00:00:00,"Indoor Farmer's Market in Orangeburg County provides fresh, locally-grown produce"
2022/06/30  00:00:00,"Behind Closed Doors, Xu Zhiyong and Ding Jiaxi Stand Trial for Subversion of State Power"
2022/06/30  00:00:00,Heavy to extremely heavy rainfall likely in these states: Check IMDs latest forecast
2022/06/30  00:00:00,"Lithium plant developer zeros in on Thunder Bay refinery site  by Ian Ross (Northern Ontario Business  June 29, 2022)"
2022/06/30  00:00:00,"A Father, a Son, a Disease, and a Camera"
2022/06/30  00:00:00,UN: Well-Armed M23 Rebels Resurgent in DRC
2022/06/30  00:00:00,China to hand over completed new parliament building to Zimbabwe
2022/06/30  00:00:00,"Charles Heidsieck Champagne Charlie: Act III, Scene I"
2022/06/30  00:00:00,Newcastle United enter race for Joshua Zirkzee
2022/06/30  00:00:00,Joe Rogan says Florida Gov. Ron DeSantis would be a 'good president' and calls Joe Biden a 'dead man'
2022/06/30  00:00:00,AMD claims potential attack from RansomHouse gang
2022/06/30  00:00:00,Palisade finalises Sunshine Coast Airport runway payment
2022/06/30  00:00:00,"Ware House traders call on LG, highlight various issues, demands"
2022/06/30  00:00:00,ESG reporting the norm for ASX 200: ACSI
2022/06/30  00:00:00,Russia-Ukraine latest updates: Moscow using Soviet-era missiles
2022/06/30  00:00:00,Turkey Visa Application  Details of Visas granted by New Zealand
2022/06/30  00:00:00,Democratic Candidate for Governor Stacey Abrams visits McIntyre
2022/06/30  00:00:00,"Sweet and sour 											Fond memories, family connection found in pungent Polish soup   							By: AV Kitching Posted: 7:00 PM CDT Wednesday, Jun. 29, 2022"
2022/06/30  00:00:00,Digital Diabetes Management Platform LLENA (AI) Health Solutions Inc. Partners With Top Box Foods Louisiana
2022/06/30  00:00:00,Natrona County Arrest Log (6/27/22  6/29/22)
2022/06/30  00:00:00,"McDowell shareholders, creditor battle it out for Rs 920-cr UB shares"
2022/06/30  00:00:00,Dr Jitendra leads India-Norway bilateral Ministerial talks
2022/06/30  00:00:00,2022 Young Leaders Institute: International Security and Defense
2022/06/30  00:00:00,"Indonesian calls, messages at G7 Summit"
2022/06/30  00:00:00,Leeds United battle Nice for Moses Simon
2022/06/30  00:00:00,Bronze plaques pried from 13 veterans' gravesites in Wellsville
2022/06/30  00:00:00,"Latest SIU Paul Simon Institute research analyzes 2020 election, provides context for 22"
2022/06/30  00:00:00,Panel to examine extent of human rights impunity in the north
2022/06/30  00:00:00,"Tottenham, Leeds and Newcastle United tracking Noni Madueke"
2022/06/30  00:00:00,Uddhavs soft Hindutva is being Challenged by shiv Sena Hardliners
2022/06/30  00:00:00,Hochul stalls on signing mayoral control and smaller class size bills
2022/06/30  00:00:00,Doug Ford government to recall Ontario legislature in August: sources
2022/06/30  00:00:00,"Behind Closed Doors, Xu Zhiyong and Ding Jiaxi Stand Trial for Subversion of State Power"
2022/06/30  00:00:00,The US border crisis - in four graphs
2022/06/30  00:00:00,"Iowa City pools: City Park is seeping, rec center swimmers fight likely closure and Mercer may be heating up"
2022/06/30  00:00:00,"A Father, a Son, a Disease, and a Camera"
2022/06/30  00:00:00,Russia-Ukraine latest updates: Moscow using Soviet-era missiles
2022/06/30  00:00:00,Prayut vows EV production within year
2022/06/30  00:00:00,Canadian parents are coming to Montana to vaccinate their young kids against COVID-19
2022/06/30  00:00:00,"US Visa for British, Spanish, German Citizens"
2022/06/30  00:00:00,USS Kearsarge takes part in chaplains swap during NATOs big Baltic exercise
2022/06/30  00:00:00,"Charles Heidsieck Champagne Charlie: Act III, Scene I"
2022/06/30  00:00:00,"Barilaro inquired about NY trade job before public ads, as NSW minister calls for him to withdraw"
2022/06/30  00:00:00,NZ King Salmon pours cold water on takeover talk
2022/06/30  00:00:00,Democratic Candidate for Governor Stacey Abrams visits McIntyre
2022/06/30  00:00:00,NET Health offering COVID vaccines for children 6 months and above
2022/06/30  00:00:00,"Google sign-up 'fast track to surveillance', consumer groups say"
2022/06/30  00:00:00,Hong Kong: 25 Years after the Handover
2022/06/30  00:00:00,"GLOBALink | Turkey greenlights Sweden, Finland's NATO bid, internal conflicts remain"
2022/06/30  00:00:00,"Potter Park Zoo sends nearly 2,000 toad tadpoles to Puerto Rico for repopulation"
2022/06/30  00:00:00,Dr Jitendra leads India-Norway bilateral Ministerial talks
2022/06/30  00:00:00,"FOX 13 Investigates: Hundreds of Utah, Idaho National Guard soldiers could be unvaccinated despite deadline"
2022/06/30  00:00:00,Uddhavs soft Hindutva is being Challenged by shiv Sena Hardliners
2022/06/30  00:00:00,Forum features six school board candidates competing for three seats
2022/06/30  00:00:00,George Crier: Living in a town like George
2022/06/30  00:00:00,"Yoon Meets Biden, Kishida for Overdue 3-Way Summit"
2022/06/30  00:00:00,"US Visa for British, Spanish, German Citizens"
2022/06/30  00:00:00,Panel to examine extent of human rights impunity in the north
2022/06/30  00:00:00,Russia-Ukraine latest updates: Moscow using Soviet-era missiles
2022/06/30  00:00:00,Samsung builds console-free Xbox gaming into some TVs
2022/06/30  00:00:00,"Behind Closed Doors, Xu Zhiyong and Ding Jiaxi Stand Trial for Subversion of State Power"
2022/06/30  00:00:00,Palestinian American medical delegation performs surgeries in Gaza
2022/06/30  00:00:00,IAEA Director General in Portugal: Nuclear Cooperation and Saving Ocean
2022/06/30  00:00:00,"Abercrombie back in Humm chair, Fahour extends options deal"
2022/06/30  00:00:00,Roe vs. Wade: Abortion Provider Braces for Increased Number of Patients from the Restrictive States
2022/06/30  00:00:00,"NATO sends a message to Putin 										  							By: Editorial 				Posted: 7:00 PM CDT Wednesday, Jun. 29, 2022"
2022/06/30  00:00:00,"Bangladeshi Navy detains 135 Indian fishermen, seizes 8 trawlers"
2022/06/30  00:00:00,SC stays Tripura HC orders on scrutiny of Ambani security cover
2022/06/30  00:00:00,Salem: Brother of Kodanad case suspect held in unrelated case
2022/06/30  00:00:00,"The United States provides American Visa Online for tourism, transit visits, and business visits"
2022/06/30  00:00:00,Hong Kong: 25 Years after the Handover
2022/06/30  00:00:00,"Odisha receives investment intents worth Rs 21,000cr (Ld, changing dateline)"
2022/06/30  00:00:00,"JMA Global with Jeanette Abraham, president and CEO"
2022/06/30  00:00:00,"Indonesian calls, messages at G7 Summit"
2022/06/30  00:00:00,Sri Lankan President to visit UAE to procure fuel
2022/06/30  00:00:00,Ambitious JK AMC targets pole position
2022/06/30  00:00:00,Perrigo set to make Grand Rapids home to North American headquarters
2022/06/30  00:00:00,"Yoon Meets Biden, Kishida for Overdue 3-Way Summit"
2022/06/30  00:00:00,Two Former Dunder Mifflin Accountants Reunite Over A Microphone
2022/06/30  00:00:00,Hochul stalls on signing mayoral control and smaller class size bills
2022/06/30  00:00:00,Views of the News: Covering the fall of Roe v. Wade
2022/06/30  00:00:00,The Tajuddin Tale: The Man Who Spilled The Tea On UMNOs Infighting & Plan To Install Anwar As PM
2022/06/30  00:00:00,DEB FISCHER: A Landmark Pro-Life Ruling
2022/06/30  00:00:00,UN: Well-Armed M23 Rebels Resurgent in DRC
2022/06/30  00:00:00,"D4M $loan, Philadelphia hip-hop artist, actor, and creator signs a million-dollar deal with AWAL, a subsidiary of Sony Music."
2022/06/30  00:00:00,Panel to examine extent of human rights impunity in the north
2022/06/30  00:00:00,IAEA Director General in Portugal: Nuclear Cooperation and Saving Ocean
2022/06/30  00:00:00,"Brookfields infra, private equity arms involved in AGL buying"
2022/06/30  00:00:00,Republican lawmakers push special session back to July 25
2022/06/30  00:00:00,Irans Raisi offers Putin to cooperate on Caspian Sea
2022/06/30  00:00:00,South by Southwest launches annual Sydney festival
2022/06/30  00:00:00,"Jan. 6 committee subpoenas Pat Cipollone, former WH counsel"
2022/06/30  00:00:00,"Committee of Public Health, Social Development, and Labor of Parliament to meet with the Minister of Public Health, Social Development and Labor (VSA)."
2022/06/30  00:00:00,"Pritzker, Giannoulias, Kaegi win Democratic primaries; Bailey GOP's nominee for governor"
2022/06/30  00:00:00,"A Father, a Son, a Disease, and a Camera"
2022/06/30  00:00:00,"Pro-, anti-Marcos rallyists gather in Manila"
2022/06/30  00:00:00,"Sen. Josh Hawley wants to use political terrorism, fascism in GOPs war on democracy, says MSNBC op-ed"
2022/06/30  00:00:00,"Google sign-up 'fast track to surveillance', consumer groups say"
2022/06/30  00:00:00,Will Basta Talks About The Growth Of Ascend Ecom
2022/06/30  00:00:00,ABC's Jonathan Karl defends tweet thanking January 6 select committee witness
2022/06/30  00:00:00,Dogs are sniffing out disease in animals vital to traditions of the Blackfeet tribe
2022/06/30  00:00:00,The Tajuddin Tale: The Man Who Spilled The Tea On UMNOs Infighting & Plan To Install Anwar As PM
2022/06/30  00:00:00,The US border crisis - in four graphs
2022/06/30  00:00:00,UN: Well-Armed M23 Rebels Resurgent in DRC
2022/06/30  00:00:00,"G7 Takes Aim At China Over ""Non-Transparent, Market-Distorting"" Practices"
2022/06/30  00:00:00,IAEA Director General in Portugal: Nuclear Cooperation and Saving Ocean
2022/06/30  00:00:00,Heavy to extremely heavy rainfall likely in these states: Check IMDs latest forecast
2022/06/30  00:00:00,Toll now at 53 in San Antonio as families wait for answers
2022/06/30  00:00:00,Utah governor sends messages to those on both sides of abortion debate
2022/06/30  00:00:00,Telangana: 65 farmers get back land encroached by Eatala Rajenders poultry
2022/06/30  00:00:00,Russia-Ukraine latest updates: Moscow using Soviet-era missiles
2022/06/30  00:00:00,KSP: VA man fled from troopers on UTV
2022/06/30  00:00:00,"Behind Closed Doors, Xu Zhiyong and Ding Jiaxi Stand Trial for Subversion of State Power"
2022/06/30  00:00:00,Dr Jitendra leads India-Norway bilateral Ministerial talks
2022/06/30  00:00:00,Nigeria produces over 420 tons of pipes annually  NCDMB
2022/06/30  00:00:00,"Taizhou Toplong Electrical & Mechanical Co.,Ltd Launches Various Oxygen Compressors And Hydrogen Generators to Adapt to Different Working Environments"
2022/06/30  00:00:00,The Momentum Center to provide voter registration and COVID-19 vaccines in July
2022/06/30  00:00:00,"James, Adams roll out lawsuits against 'ghost gun' companies"
2022/06/30  00:00:00,Forum features six school board candidates competing for three seats
2022/06/30  00:00:00,Coca-Cola switches up packaging with Marshmello collab
2022/06/30  00:00:00,2022 Young Leaders Institute: International Security and Defense
2022/06/30  00:00:00,Doug Ford government to recall Ontario legislature in August: sources
2022/06/30  00:00:00,"Sweet and sour 											Fond memories, family connection found in pungent Polish soup   							By: AV Kitching Posted: 7:00 PM CDT Wednesday, Jun. 29, 2022"
2022/06/30  00:00:00,Jan. 6 committee subpoenas Trump White House counsel Pat Cipollone to testify
2022/06/30  00:00:00,"Pro-, anti-Marcos rallyists gather in Manila"
2022/06/30  00:00:00,Josh Duggar Transferred To Texas Prison To Finish Serving Sentence
2022/06/30  00:00:00,Relic of saint installed at SB college
2022/06/30  00:00:00,Palestinian American medical delegation performs surgeries in Gaza
2022/06/30  00:00:00,Russia-Ukraine latest updates: Moscow using Soviet-era missiles
2022/06/30  00:00:00,Abbott: Texas to expand border security efforts
2022/06/30  00:00:00,Steinburg secures $12.5M for COA simulation center
2022/06/30  00:00:00,"GLOBALink | Turkey greenlights Sweden, Finland's NATO bid, internal conflicts remain"
2022/06/30  00:00:00,Misfire: California AG publishes names and addresses of judges and police on gun website
2022/06/30  00:00:00,Lincoln Middle students visit Gundersen in La Crosse to explore careers
2022/06/30  00:00:00,"NATO sends a message to Putin 										  							By: Editorial 				Posted: 7:00 PM CDT Wednesday, Jun. 29, 2022"
2022/06/30  00:00:00,"Lavrov, Guterres discuss global food security challenges over phone"
2022/06/30  00:00:00,South by Southwest launches annual Sydney festival
2022/06/30  00:00:00,SC stays implementation of Tripura HC orders on security cover to Ambanis
2022/06/30  00:00:00,Teaching Canadian kids about Pinoy food
2022/06/30  00:00:00,"Pritzker, Giannoulias, Kaegi win Democratic primaries; Bailey GOP's nominee for governor"
2022/06/30  00:00:00,"Committee of Public Health, Social Development, and Labor of Parliament to meet with the Minister of Public Health, Social Development and Labor (VSA)."
2022/06/30  00:00:00,Josh Duggar Transferred To Texas Prison To Finish Serving Sentence
2022/06/30  00:00:00,He found a set of old dog tags in a French house. The Internet is helping bring them back to Mesa.
2022/06/30  00:00:00,Trump's legal exposure may be growing  and 4 other takeaways from the Jan. 6 hearing
2022/06/30  00:00:00,"Taizhou Toplong Electrical & Mechanical Co.,Ltd Launches Various Oxygen Compressors And Hydrogen Generators to Adapt to Different Working Environments"
2022/06/30  00:00:00,World News | Mom of US Veteran Held in Ukraine Speaks to Son by Phone
2022/06/30  00:00:00,Prayut vows EV production within year
2022/06/30  00:00:00,"CJPC names three summer interns in editorial, marketing"
2022/06/30  00:00:00,Putin meets with Azerbaijans Aliyev in Ashgabat
2022/06/30  00:00:00,Irans Raisi offers Putin to cooperate on Caspian Sea
2022/06/30  00:00:00,Hong Kong: 25 Years after the Handover
2022/06/30  00:00:00,The US border crisis - in four graphs
2022/06/30  00:00:00,Bronze plaques pried from 13 veterans' gravesites in Wellsville
2022/06/30  00:00:00,"Charles Heidsieck Champagne Charlie: Act III, Scene I"
2022/06/30  00:00:00,Navy Canceling Early Discharges and Offering Extensions to Keep More Sailors in Uniform
2022/06/30  00:00:00,"Bangladeshi Navy detains 135 Indian fishermen, seizes 8 trawlers"
2022/06/30  00:00:00,"Xi inspects Wuhan, stresses sci-tech innovation, COVID-19 control, community management"
2022/06/30  00:00:00,Pope Francis pushes to purge liturgy of ideology in new document
2022/06/30  00:00:00,"Sen. Josh Hawley wants to use political terrorism, fascism in GOPs war on democracy, says MSNBC op-ed"
2022/06/30  00:00:00,Abbott: Texas to expand border security efforts
2022/06/30  00:00:00,"Live At The Linda: ""Old-time Strings"""
2022/06/30  00:00:00,Julia Roberts and Cameron Diaz Are Kicking Off the Rom-Com Renaissance
2022/06/30  00:00:00,Nadia Bartels Henne moves into new channel
2022/06/30  00:00:00,"P.E Nation, Bianca Spender, Carla Zampatti help drive $6 million result"
2022/06/30  00:00:00,Getting Western Australians ready for jobs in resources sector
2022/06/30  00:00:00,Panel to examine extent of human rights impunity in the north
2022/06/30  00:00:00,Teaching Canadian kids about Pinoy food
2022/06/30  00:00:00,"Easterseals Arc shows off hands-on training labs for health care, hospitality"
2022/06/30  00:00:00,"Latest SIU Paul Simon Institute research analyzes 2020 election, provides context for 22"
2022/06/30  00:00:00,Canadian parents are coming to Montana to vaccinate their young kids against COVID-19
2022/06/30  00:00:00,Debris burning closes in Lewis and Clark County
2022/06/30  00:00:00,"A Father, a Son, a Disease, and a Camera"
2022/06/30  00:00:00,IAEA Director General in Portugal: Nuclear Cooperation and Saving Ocean
2022/06/30  00:00:00,Possible US cyberattack targets Chinese information systems
2022/06/30  00:00:00,Lincoln Middle students visit Gundersen in La Crosse to explore careers
2022/06/30  00:00:00,Democratic Candidate for Governor Stacey Abrams visits McIntyre
2022/06/30  00:00:00,Ex-aide sets Donald Trump ball moving
2022/06/30  00:00:00,Virgin Orbit launches seven satellites for US Space Force and NASA
2022/06/30  00:00:00,UN: Well-Armed M23 Rebels Resurgent in DRC
2022/06/30  00:00:00,Russia-Ukraine latest updates: Moscow using Soviet-era missiles
2022/06/30  00:00:00,"P.E Nation, Bianca Spender, Carla Zampatti help drive $6 million result"
2022/06/30  00:00:00,Joe Rogan says Florida Gov. Ron DeSantis would be a 'good president' and calls Joe Biden a 'dead man'
2022/06/30  00:00:00,"Behind Closed Doors, Xu Zhiyong and Ding Jiaxi Stand Trial for Subversion of State Power"
2022/06/30  00:00:00,"Potter Park Zoo sends nearly 2,000 toad tadpoles to Puerto Rico for repopulation"
2022/06/30  00:00:00,The US border crisis - in four graphs
2022/06/30  00:00:00,Fort Hood and Killeen sign intergovernmental agreement to take on Fort Hoods animal services
2022/06/30  00:00:00,"G7 Takes Aim At China Over ""Non-Transparent, Market-Distorting"" Practices"
2022/06/30  00:00:00,Canadian parents are coming to Montana to vaccinate their young kids against COVID-19
2022/06/30  00:00:00,Ambitious JK AMC targets pole position
2022/06/30  00:00:00,NATO's Asia-Pacific move a triple trap
2022/06/30  00:00:00,Turkey e-Visa allows citizens from foreign countries to make short-term visits
2022/06/30  00:00:00,Emmett Till's family seeks the arrest of a woman after a 1955 warrant is found
2022/06/30  00:00:00,Turkey Visa Application  Details of Visas granted by New Zealand
2022/06/30  00:00:00,"Medlab Asia and Asia Health to host live, in-person event in Thailand"
2022/06/30  00:00:00,"Sen. Josh Hawley wants to use political terrorism, fascism in GOPs war on democracy, says MSNBC op-ed"
2022/06/30  00:00:00,UN: Well-Armed M23 Rebels Resurgent in DRC
2022/06/30  00:00:00,Leeds United battle Nice for Moses Simon
2022/06/30  00:00:00,3 new troopers assigned to local ISP post
2022/06/30  00:00:00,"Behind Closed Doors, Xu Zhiyong and Ding Jiaxi Stand Trial for Subversion of State Power"
2022/06/30  00:00:00,Forum features six school board candidates competing for three seats
2022/06/30  00:00:00,Pope Francis pushes to purge liturgy of ideology in new document
2022/06/30  00:00:00,Groups Sue Biden Administration Over Wyoming Oil and Gas Lease Sale
2022/06/30  00:00:00,2022 Young Leaders Institute: International Security and Defense
2022/06/30  00:00:00,Abbott: Texas to expand border security efforts
2022/06/30  00:00:00,Comments sought on one of best pumped storage sites in Washington
2022/06/30  00:00:00,"Pritzker, Giannoulias, Kaegi win Democratic primaries; Bailey GOP's nominee for governor"
2022/06/30  00:00:00,"Barilaro inquired about NY trade job before public ads, as NSW minister calls for him to withdraw"
2022/06/30  00:00:00,"Claflin launches new nursing, education effort; TITAN part of statewide HBCU program"
2022/06/30  00:00:00,"Iowa City pools: City Park is seeping, rec center swimmers fight likely closure and Mercer may be heating up"
2022/06/30  00:00:00,True crime psychologist sharing insights with Central Illinois library-goers
2022/06/30  00:00:00,Sri Lankan President to visit UAE to procure fuel
2022/06/30  00:00:00,"James, Adams roll out lawsuits against 'ghost gun' companies"
2022/06/30  00:00:00,"P.E Nation, Bianca Spender, Carla Zampatti help drive $6 million result"
2022/06/30  00:00:00,Utah governor sends messages to those on both sides of abortion debate
2022/06/30  00:00:00,Up Close and Slaying with Drag Queens Hibiscus and Misty Mountains Davenport
2022/06/30  00:00:00,GOP Senate Candidate Eric Greitens Launches No MO RINOs Statewide Tour in Missouri
2022/06/30  00:00:00,"Charles Heidsieck Champagne Charlie: Act III, Scene I"
2022/06/30  00:00:00,Toll now at 53 in San Antonio as families wait for answers
2022/06/30  00:00:00,Joe Rogan says Florida Gov. Ron DeSantis would be a 'good president' and calls Joe Biden a 'dead man'
2022/06/30  00:00:00,The Rolling Stones: Some Girls Live in Texas
2022/06/30  00:00:00,MSP Trooper receives Purple Heart for 2021 traffic stop
2022/06/30  00:00:00,NATO's Asia-Pacific move a triple trap
2022/06/30  00:00:00,KSP: VA man fled from troopers on UTV
2022/06/30  00:00:00,Abbott: Texas to expand border security efforts
2022/06/30  00:00:00,"Bahrain, Egypt stress two-state solution must for Palestinian-Israeli conflict"
2022/06/30  00:00:00,Pope Francis pushes to purge liturgy of ideology in new document
2022/06/30  00:00:00,Help to Grow: Management  privacy notice
2022/06/30  00:00:00,Steinburg secures $12.5M for COA simulation center
2022/06/30  00:00:00,Natrona County Arrest Log (6/27/22  6/29/22)
2022/06/30  00:00:00,Republican lawmakers push special session back to July 25
2022/06/30  00:00:00,Solid Solutions sold to US firm by LDC
2022/06/30  00:00:00,DEB FISCHER: A Landmark Pro-Life Ruling
2022/06/30  00:00:00,"Sen. Josh Hawley wants to use political terrorism, fascism in GOPs war on democracy, says MSNBC op-ed"
2022/06/30  00:00:00,ABC's Jonathan Karl defends tweet thanking January 6 select committee witness
2022/06/30  00:00:00,3 new troopers assigned to local ISP post
2022/06/30  00:00:00,Sudanese leader says army expect to hand power to elected gov't
