date,title
2022/06/30  00:00:00,EXCLUSIVE: Joe Biden considered REPUBLICAN Ohio governor John Kasich as his running mate in 2020 after son Hunter and top donor and Walmart chairman Greg Penner devised plan for a bipartisan ticket to 'repair' divided nation
2022/06/30  00:00:00,Ms. Marvel co-creator Sana Amanat discusses the Red Dagger and Kamala's trip to Karachi
2022/06/30  00:00:00,Mark Guillaudeu Wins the Best USA Sommelier Association Finals 						 						 							 							 								  													USA - English 													     															USA - English
2022/06/30  00:00:00,Heritage Florida Jewish News - Central Florida's Independent Jewish Voice
2022/06/30  00:00:00,Advisory Firms Respond to Roe Rollback
2022/06/30  00:00:00,"Build a custom email digest by following topics, people, and firms published on JD Supra."
2022/06/30  00:00:00,"The Indo-Pacific, Natos new way to curb Chinas ambitions"
2022/06/30  00:00:00,Saudi Lifts Pandemic Ban On Citizens' Travel To Turkey
2022/06/30  00:00:00,Gabriel reveals five pillars of the European Innovation Agenda
2022/06/30  00:00:00,"Upper East Side Getting Hit By NYC's Lifeguard Shortage, Lawmaker Says"
2022/06/30  00:00:00,Two view points on Roe v. Wade ruling
2022/06/30  00:00:00,"Running mate: El-Rufai, Ganduje, North-West leaders to meet Tinubu"
2022/06/30  00:00:00,Discovery Channel series episode set to chronicle Teton Dam Disaster
2022/06/30  00:00:00,Reporter's Notebook: The trio responsible for Supreme Court's conservative majority overturning Roe v. Wade
2022/06/30  00:00:00,"Podcast Collection: Eight Early-Career Researchers on Their Inspirations, Methods, and Goals"
2022/06/30  00:00:00,Governors functioning as agents of ruling party at Centre: Yashwant Sinha
2022/06/30  00:00:00,Life For Relief And Development 'Waters' The World
2022/06/30  00:00:00,Ukraine begins exporting electricity to Europe
2022/06/30  00:00:00,"Russian Defence Ministry report on the progress of the special military operation in Ukraine ( June 30, 2022)"
2022/06/30  00:00:00,Horse Progress Days arrives in Daviess County
2022/06/30  00:00:00,Mark Guillaudeu Wins the Best USA Sommelier Association Finals 						 						 							 							 								  													USA - English 													     															USA - English
2022/06/30  00:00:00,North Vancouver firefighters rescue SkipTheDishes order following crash
2022/06/30  00:00:00,Arnaut Danjuma pushing for West Ham United move
2022/06/30  00:00:00,The Hills 12:30 Report  Supreme Court wraps up divisive term
2022/06/30  00:00:00,Heritage Florida Jewish News - Central Florida's Independent Jewish Voice
2022/06/30  00:00:00,The Red Army: Liberators only in the Jewish perspective - opinion
2022/06/30  00:00:00,"Upper East Side Getting Hit By NYC's Lifeguard Shortage, Lawmaker Says"
2022/06/30  00:00:00,Hirsch makes bail in Yan shooting
2022/06/30  00:00:00,"Trump to rally for Alaska candidates: Former president visiting Anchorage to pull for Palin, Dunleavy and Tshibaka"
2022/06/30  00:00:00,U.S. ambassador meets with local Cambodian American community
2022/06/30  00:00:00,"Kim Fields Talks Iconic Roles, The Upshaws, RHOA, Living Single + More"
2022/06/30  00:00:00,The police and the journalist Premium
2022/06/30  00:00:00,Monsterverse's Godzilla and Titans Series Casts 'Pachinko' Star Anna Sawai and Kiersey Clemons
2022/06/30  00:00:00,I-T raids in several places in Chhattisgarh
2022/06/30  00:00:00,Kavan: Flashy Elvis mostly lands the right notes
2022/06/30  00:00:00,Far right extremism with Thomas LeCaque on Thursday's Access Utah
2022/06/30  00:00:00,"Jokowi: Putin to provide secure food, fertilizer supplies from Russia, Ukraine"
2022/06/30  00:00:00,"APC governors, guber candidates, ministers from North-West meet in Kaduna"
2022/06/30  00:00:00,South Australian Liberal leader and state MPs to mentor young people at anti-abortion event
2022/06/30  00:00:00,Laurene Powell Jobs XQ is backing 2 new NYC high schools
2022/06/30  00:00:00,Discovery Channel series episode set to chronicle Teton Dam Disaster
2022/06/30  00:00:00,Repairing Nature With DNA  And Drones
2022/06/30  00:00:00,"CoveCare Center receives $50,000 Grant form Field Hall Foundation"
2022/06/30  00:00:00,Harford Realtors hold blood drive as blood and platelet supplies take holiday dip
2022/06/30  00:00:00,Defense Dept. and Air Force plan a research center led by an HBCU
2022/06/30  00:00:00,"Ireland's sailing, boating & maritime magazine"
2022/06/30  00:00:00,Yellowstone to reopen north loopJuly 2and suspend Alternating License Plate System
2022/06/30  00:00:00,"Bernhard Schlagheck, Ayaz Sadiq To Discuss Matter Of Mutual Interest"
2022/06/30  00:00:00,The Hills 12:30 Report  Supreme Court wraps up divisive term
2022/06/30  00:00:00,Republicans Kim David and Todd Thomsen headed for runoff in Corporation Commission race
2022/06/30  00:00:00,Vilsack Makes One Last Stop In Iowa Promoting Derecho Farm Relief
2022/06/30  00:00:00,Mothertongues: Learn about Cant and Traveller culture
2022/06/30  00:00:00,Heritage Florida Jewish News - Central Florida's Independent Jewish Voice
2022/06/30  00:00:00,Former Gov. Snyder pleads the Fifth Amendment in federal courtroom
2022/06/30  00:00:00,Justice Thomas cites claim that Covid vaccines are made with cells from 'aborted children'
2022/06/30  00:00:00,"FL, Big Tech Trade Associations to Ask SCOTUS to Review Florida Censorship Law: Report"
2022/06/30  00:00:00,"UWG, Georgia Highlands College sign psychology path partnership"
2022/06/30  00:00:00,March of the penguin: the forces behind the secessionist Victorian Independence Movement
2022/06/30  00:00:00,Russia pulls forces out of Ukraine island
2022/06/30  00:00:00,Gold jewellery from Periyapalayams Bhavani Amman temple handed over to SBI
2022/06/30  00:00:00,Players Guild Theatre leaving Canton's Cultural Center for Kent State Stark
2022/06/30  00:00:00,JKS Financial Sponsors Program To Teach High School Students Investment Skills
2022/06/30  00:00:00,U.S. Coast Guard: Required clearance for new I-5 Bridge is 178 feet
2022/06/30  00:00:00,"Ireland's sailing, boating & maritime magazine"
2022/06/30  00:00:00,Red River Named as a VMware Regional Academy for IT Support and Training
2022/06/30  00:00:00,NBCs Today Show Puts Bozeman in the Spotlight
2022/06/30  00:00:00,"Corpus Christi teachers union, Coastal Bend Trans Alliance distribute free LGBTQ books"
2022/06/30  00:00:00,Laxatives swapped with anti-depressants at north Scottsdale Walmart
2022/06/30  00:00:00,2023: AIbom APC Protests Role of INEC in Partys Affairs
2022/06/30  00:00:00,China Speaks To Dhammika On Promoting Chinese Projects
2022/06/30  00:00:00,Heritage Florida Jewish News - Central Florida's Independent Jewish Voice
2022/06/30  00:00:00,South Australian Liberal leader and state MPs to mentor young people at anti-abortion event
2022/06/30  00:00:00,Laurene Powell Jobs XQ is backing 2 new NYC high schools
2022/06/30  00:00:00,Thailand Scrambles F-16s As Myanmar Jet Violates Airspace
2022/06/30  00:00:00,Hirsch makes bail in Yan shooting
2022/06/30  00:00:00,Abendroth Fortel Releases the Thermal Coal Market Assessment
2022/06/30  00:00:00,"Amazon Labor Union takes its NLRB fight to Phoenix, Arizona"
2022/06/30  00:00:00,80 surgeons get training in VR robotic telesurgery
2022/06/30  00:00:00,"2,490 terrorists children surrender to troops  DHQ"
2022/06/30  00:00:00,"Rotary recognizes incoming, outgoing officers and new members"
2022/06/30  00:00:00,Home is Where the Pipeline Ends
2022/06/30  00:00:00,Diplomats: Iran Making New Demands in Nuclear Talks
2022/06/30  00:00:00,Plastic tubing left inside Swindon man after operation
2022/06/30  00:00:00,Tap Into History project places Centre County Underground Railroad history at your fingertips
2022/06/30  00:00:00,"Build a custom email digest by following topics, people, and firms published on JD Supra."
2022/06/30  00:00:00,Port St. Lucie budget proposal includes one-time trash credit
2022/06/30  00:00:00,Madhya Pradesh: Burhanpur district hospital in the dock again after woman delivers stillborn
2022/06/30  00:00:00,Players Guild Theatre leaving Canton's Cultural Center for Kent State Stark
2022/06/30  00:00:00,Central African Republic: MINUSCA recaptures Ouanda-Djall from rebels
2022/06/30  00:00:00,"UWG, Georgia Highlands College sign psychology path partnership"
2022/06/30  00:00:00,"Ben & Jerrys Condemns Parent Company Unilevers Decision to Sell Rights to Israeli Franchisee, Defanging Boycott"
2022/06/30  00:00:00,Thailand Scrambles F-16s As Myanmar Jet Violates Airspace
2022/06/30  00:00:00,The Red Army: Liberators only in the Jewish perspective - opinion
2022/06/30  00:00:00,"Dem Governor Fundraises For Pregnant People In Pro-Abortion Fundraising Campaign, Email Shows"
2022/06/30  00:00:00,Davenport Fest to highlight electric motors along with their connection to Brandon's history
2022/06/30  00:00:00,The Bank of London: THE BANK OF LONDON APPOINTS TAM HOLMES AS CO-PRESIDENT & GROUP CHIEF PRODUCT OFFICER
2022/06/30  00:00:00,Life For Relief And Development 'Waters' The World
2022/06/30  00:00:00,Two view points on Roe v. Wade ruling
2022/06/30  00:00:00,Heritage Florida Jewish News - Central Florida's Independent Jewish Voice
2022/06/30  00:00:00,Maternity leave to be made available for councillors in Kilkenny
2022/06/30  00:00:00,Family is at the heart of Mesa's water drive for one Valley woman
2022/06/30  00:00:00,The police and the journalist Premium
2022/06/30  00:00:00,NMC to host Northeast riders meet
2022/06/30  00:00:00,Tap Into History project places Centre County Underground Railroad history at your fingertips
2022/06/30  00:00:00,Northeast B.C. geothermal project enters testing phase
2022/06/30  00:00:00,Russia abandons Snake Island in victory for Ukraine
2022/06/30  00:00:00,"Community Bank assigns corporatewide culture, diversity officer"
2022/06/30  00:00:00,Central African Republic: MINUSCA recaptures Ouanda-Djall from rebels
2022/06/30  00:00:00,The Hills 12:30 Report  Supreme Court wraps up divisive term
2022/06/30  00:00:00,Kyiv sending large delegation to recovery talks in Switzerland
2022/06/30  00:00:00,NATO Summit: Sweden Sends More Weapons to Ukraine
2022/06/30  00:00:00,"Build a custom email digest by following topics, people, and firms published on JD Supra."
2022/06/30  00:00:00,"Midday Nowcast: Warm, Muggy, Scattered Afternoon Storms"
2022/06/30  00:00:00,The Bank of London: THE BANK OF LONDON APPOINTS TAM HOLMES AS CO-PRESIDENT & GROUP CHIEF PRODUCT OFFICER
2022/06/30  00:00:00,Heritage Florida Jewish News - Central Florida's Independent Jewish Voice
2022/06/30  00:00:00,Mark Guillaudeu Wins the Best USA Sommelier Association Finals 						 						 							 							 								  													USA - English 													     															USA - English
2022/06/30  00:00:00,"Americas nuclear waste chief: Two MIT degrees, genderfluid, role-plays dogs"
2022/06/30  00:00:00,U.S. ambassador meets with local Cambodian American community
2022/06/30  00:00:00,"Wilson and Takita adapt worlds first novel, Genji, into manga"
2022/06/30  00:00:00,Medvedev: sanctions can be regarded as an act of international aggression
2022/06/30  00:00:00,Asian Americans sound off on overturning of Roe v. Wade
2022/06/30  00:00:00,"Telling the story of Pittsylvania County, Danville, one day at a time"
2022/06/30  00:00:00,Hmm. Biden set to a nominate Republican pro-life lawyer to the federal bench in Kentucky
2022/06/30  00:00:00,"Berkeley Council Donates Lots, 250K To Habitat For Humanity"
2022/06/30  00:00:00,"Arsenal, Manchester United, Barcelona priced out of Ruben Neves chase"
2022/06/30  00:00:00,Ministry Of Industry And Mineral Resources Reviews Mining Opportunities With Companies And Investors In France
2022/06/30  00:00:00,Warren pins Roe on her revival
2022/06/30  00:00:00,"Build a custom email digest by following topics, people, and firms published on JD Supra."
2022/06/30  00:00:00,Afghan Sikhs Off To New Delhi With Singh's Ashes
2022/06/30  00:00:00,Belfast Orange Order among objectors to bleak Weavers Cross plan
2022/06/30  00:00:00,Roe is the Canary in the Coal Mine
2022/06/30  00:00:00,Two view points on Roe v. Wade ruling
2022/06/30  00:00:00,The Red Army: Liberators only in the Jewish perspective - opinion
2022/06/30  00:00:00,"The Indo-Pacific, Natos new way to curb Chinas ambitions"
2022/06/30  00:00:00,Russians withdraw old military equipment from storage on Sakhalin and in Kaliningrad Ministry of Defence
2022/06/30  00:00:00,Heritage Florida Jewish News - Central Florida's Independent Jewish Voice
2022/06/30  00:00:00,Troy University podcast to focus on Wiregrass
2022/06/30  00:00:00,"< News brief: Supreme Court winds down, Biden news conference, election deniers"
2022/06/30  00:00:00,"Midday Nowcast: Warm, Muggy, Scattered Afternoon Storms"
2022/06/30  00:00:00,"Telling the story of Pittsylvania County, Danville, one day at a time"
2022/06/30  00:00:00,"Exclaim! Comics Return with Dicks on TV, Expensive Summer Drinks and French 79"
2022/06/30  00:00:00,Juventus targeting 35m-rated Liverpool star cannot be ruled out  club trying to exploit Rabiot card
2022/06/30  00:00:00,Sanjiv Mehta to be Unilever Indonesias President Commissioner
2022/06/30  00:00:00,"Hedge Fund and Insider Trading News: Ray Dalio, Ken Griffin, Cannell Capital, Elliott Management, Senvest Management, Crescat Capital, Three Arrows Capital, Childrens Place Inc (PLCE), Booz Allen Hamilton Holding Corporation (BAH), and More"
2022/06/30  00:00:00,Tap Into History project places Centre County Underground Railroad history at your fingertips
2022/06/30  00:00:00,2023: AIbom APC Protests Role of INEC in Partys Affairs
2022/06/30  00:00:00,"Trump to rally for Alaska candidates: Former president visiting Anchorage to pull for Palin, Dunleavy and Tshibaka"
2022/06/30  00:00:00,Savage resident to bike in 20th Habitat 500
2022/06/30  00:00:00,"Build a custom email digest by following topics, people, and firms published on JD Supra."
2022/06/30  00:00:00,Mothertongues: Learn about Cant and Traveller culture
2022/06/30  00:00:00,China Speaks To Dhammika On Promoting Chinese Projects
2022/06/30  00:00:00,"Berkeley Council Donates Lots, 250K To Habitat For Humanity"
2022/06/30  00:00:00,Four Sri Lankan refugees arrive at Dhanushkodi
2022/06/30  00:00:00,"Vice-Chancellors Urge Buhari To Hasten Resolutions With ASUU, NASU, Others"
2022/06/30  00:00:00,The Red Army: Liberators only in the Jewish perspective - opinion
2022/06/30  00:00:00,Heritage Florida Jewish News - Central Florida's Independent Jewish Voice
2022/06/30  00:00:00,The President of Indonesia said that he conveyed Zelensky's message to Putin
2022/06/30  00:00:00,GOP's Ted Cruz feuds with Elmo over kids getting COVID-19 vaccines
2022/06/30  00:00:00,PICE Qatar Chapter conducts community outreach
2022/06/30  00:00:00,Saudi Lifts Pandemic Ban On Citizens' Travel To Turkey
2022/06/30  00:00:00,NMiF reviews governors abortion action & The Journey of African American Homesteaders in N.M.
2022/06/30  00:00:00,"Opposition Party, PDP Presidential Candidate, Atiku Reacts To Fresh Crisis Among Governors, Other Top Members"
2022/06/30  00:00:00,"Corpus Christi teachers union, Coastal Bend Trans Alliance distribute free LGBTQ books"
2022/06/30  00:00:00,Radio host Ralph Bailey's fundraiser for Honor Flight Kern County
2022/06/30  00:00:00,"Jokowi: Putin to provide secure food, fertilizer supplies from Russia, Ukraine"
2022/06/30  00:00:00,Reps plan separate contributory pension scheme for National Assembly
2022/06/30  00:00:00,"UCLA, USC leaving Pac-12 to join Big Ten in 2024"
2022/06/30  00:00:00,Adamawa APC gov candidate picks ex-Rep as running mate
2022/06/30  00:00:00,"Gassed in their cells, begging for food at Auckland Womens prison"
2022/06/30  00:00:00,"NATO Ends Summit with Strengthened Posture Against Russia, China"
2022/06/30  00:00:00,U.S. ambassador meets with local Cambodian American community
2022/06/30  00:00:00,TAIPEI TIMES CDC issues alert for 44 states with monkeypox cases
2022/06/30  00:00:00,2023: AIbom APC Protests Role of INEC in Partys Affairs
2022/06/30  00:00:00,Thailand Scrambles F-16s As Myanmar Jet Violates Airspace
2022/06/30  00:00:00,"2,490 terrorists children surrender to troops  DHQ"
2022/06/30  00:00:00,Heritage Florida Jewish News - Central Florida's Independent Jewish Voice
2022/06/30  00:00:00,"FL, Big Tech Trade Associations to Ask SCOTUS to Review Florida Censorship Law: Report"
2022/06/30  00:00:00,ISIS hostage David Haines asked his captors to 'make it quick' before he was killed
2022/06/30  00:00:00,Russia abandons Snake Island in victory for Ukraine
2022/06/30  00:00:00,South Africa national power utility extends high-level load shedding due to strike
2022/06/30  00:00:00,Elbit to Supply Precision Guidance Kits to Asia-Pacific Country
2022/06/30  00:00:00,Abu Dhabi National Oil Company sends ammonia to Japan
2022/06/30  00:00:00,"Combined $100K in severance paid to former Town manager, finance director"
2022/06/30  00:00:00,"ASUU strike: Mobilise for national protest, NLC directs affiliates"
2022/06/30  00:00:00,"3 bats infected with rabies, humans and dogs exposed to the disease in Utah"
2022/06/30  00:00:00,Ukraine round-up: Russia leaves Snake Island and Putin's topless G7 comments
2022/06/30  00:00:00,5 takeaways from the Republican debate for Arizona governor
2022/06/30  00:00:00,TheDuke of York's civil sex assault case accuser Virginia Roberts Giuffre is reportedly working with Monica Lewinsky's celebritypublicist
2022/06/30  00:00:00,"Dem Governor Fundraises For Pregnant People In Pro-Abortion Fundraising Campaign, Email Shows"
2022/06/30  00:00:00,March of the penguin: the forces behind the secessionist Victorian Independence Movement
2022/06/30  00:00:00,Adamawa APC gov candidate picks ex-Rep as running mate
2022/06/30  00:00:00,Heritage Florida Jewish News - Central Florida's Independent Jewish Voice
2022/06/30  00:00:00,Troy University podcast to focus on Wiregrass
2022/06/30  00:00:00,Savage resident to bike in 20th Habitat 500
2022/06/30  00:00:00,Pentagon reviewing industry proposals for innovative weapons ideas to send to Ukraine
2022/06/30  00:00:00,"UCLA, USC leaving Pac-12 to join Big Ten in 2024"
2022/06/30  00:00:00,"2,490 terrorists children surrender to troops  DHQ"
2022/06/30  00:00:00,Russia pulls out of Snake Island
2022/06/30  00:00:00,"Build a custom email digest by following topics, people, and firms published on JD Supra."
2022/06/30  00:00:00,Colorado Parks and Wildlife sets trap for bear that entered west Steamboat home
2022/06/30  00:00:00,Jackson Katz on getting men to talk about gender violence
2022/06/30  00:00:00,Enforcement actions issued at Rainbow Gathering
2022/06/30  00:00:00,Steve Carell was a fife-playing colonial reenactor while growing up in Mass.
2022/06/30  00:00:00,Hirsch makes bail in Yan shooting
2022/06/30  00:00:00,Horse Progress Days arrives in Daviess County
2022/06/30  00:00:00,Asian Americans sound off on overturning of Roe v. Wade
2022/06/30  00:00:00,Diplomats: Iran Making New Demands in Nuclear Talks
2022/06/30  00:00:00,Heritage Florida Jewish News - Central Florida's Independent Jewish Voice
2022/06/30  00:00:00,"NATO Ends Summit with Strengthened Posture Against Russia, China"
2022/06/30  00:00:00,"Combined $100K in severance paid to former Town manager, finance director"
2022/06/30  00:00:00,Gold jewellery from Periyapalayams Bhavani Amman temple handed over to SBI
2022/06/30  00:00:00,"Goldfinch is 13th to finish R2AK: One boat arrives at Thomas Basin on Tuesday, nine teams still sailing"
2022/06/30  00:00:00,"Letter: Lissa Savaglio,Loudoun County Democratic Committee"
2022/06/30  00:00:00,"Dem Governor Fundraises For Pregnant People In Pro-Abortion Fundraising Campaign, Email Shows"
2022/06/30  00:00:00,"Build a custom email digest by following topics, people, and firms published on JD Supra."
2022/06/30  00:00:00,"Supreme Court releases EPA, immigration decisions"
2022/06/30  00:00:00,Afghan Sikhs Off To New Delhi With Singh's Ashes
2022/06/30  00:00:00,"Things To Do |   			She stepped in with a minutes notice to conduct the CSO and save a concert. Now, the orchestra is clamoring to keep her for another year."
2022/06/30  00:00:00,Texas sheriff drives four migrants to border after Border Patrol refuses
2022/06/30  00:00:00,Abrar Fahads younger brother gets chance in BUET
2022/06/30  00:00:00,"Corpus Christi teachers union, Coastal Bend Trans Alliance distribute free LGBTQ books"
2022/06/30  00:00:00,"Amazon Labor Union takes its NLRB fight to Phoenix, Arizona"
2022/06/30  00:00:00,Bank foundation donates to Pee Dee communities
2022/06/30  00:00:00,"2,490 terrorists children surrender to troops  DHQ"
2022/06/30  00:00:00,Heritage Florida Jewish News - Central Florida's Independent Jewish Voice
2022/06/30  00:00:00,Kristi Noem Has Some Thoughts on Liz Cheney
2022/06/30  00:00:00,Horse Progress Days arrives in Daviess County
2022/06/30  00:00:00,Players Guild Theatre leaving Canton's Cultural Center for Kent State Stark
2022/06/30  00:00:00,Indian Visa for US Citizens  Details of Visas granted by India
2022/06/30  00:00:00,"Letter: Lissa Savaglio,Loudoun County Democratic Committee"
2022/06/30  00:00:00,"Combined $100K in severance paid to former Town manager, finance director"
2022/06/30  00:00:00,Hirsch makes bail in Yan shooting
2022/06/30  00:00:00,Diplomats: Iran Making New Demands in Nuclear Talks
2022/06/30  00:00:00,"Ben & Jerrys Condemns Parent Company Unilevers Decision to Sell Rights to Israeli Franchisee, Defanging Boycott"
2022/06/30  00:00:00,"Build a custom email digest by following topics, people, and firms published on JD Supra."
2022/06/30  00:00:00,Watervliet rolls out police body camera program
2022/06/30  00:00:00,China Speaks To Dhammika On Promoting Chinese Projects
2022/06/30  00:00:00,Factbox-Russia ramps up missile strikes in Ukraine
2022/06/30  00:00:00,"Gassed in their cells, begging for food at Auckland Womens prison"
2022/06/30  00:00:00,"UWG, Georgia Highlands College sign psychology path partnership"
2022/06/30  00:00:00,"Podcast Collection: Eight Early-Career Researchers on Their Inspirations, Methods, and Goals"
2022/06/30  00:00:00,Asian Americans sound off on overturning of Roe v. Wade
2022/06/30  00:00:00,Kristi Noem Has Some Thoughts on Liz Cheney
2022/06/30  00:00:00,Kavan: Flashy Elvis mostly lands the right notes
2022/06/30  00:00:00,U.S. ambassador meets with local Cambodian American community
2022/06/30  00:00:00,Mary T. Boyle Sworn in As CPSC Commissioner
2022/06/30  00:00:00,Heritage Florida Jewish News - Central Florida's Independent Jewish Voice
2022/06/30  00:00:00,"Letter: Lissa Savaglio,Loudoun County Democratic Committee"
2022/06/30  00:00:00,"Combined $100K in severance paid to former Town manager, finance director"
2022/06/30  00:00:00,Elbit to Supply Precision Guidance Kits to Asia-Pacific Country
2022/06/30  00:00:00,UW begins nuclear energy research project
2022/06/30  00:00:00,Senator Kiffmeyer: Third Amendment to the United States Constitution
2022/06/30  00:00:00,"Build a custom email digest by following topics, people, and firms published on JD Supra."
2022/06/30  00:00:00,Afghan Sikhs Off To New Delhi With Singh's Ashes
2022/06/30  00:00:00,Factbox-Russia ramps up missile strikes in Ukraine
2022/06/30  00:00:00,"Taliban Hold Islamic Scholars' Huddle to Show Strength, Legitimacy"
2022/06/30  00:00:00,"Hedge Fund and Insider Trading News: Ray Dalio, Ken Griffin, Cannell Capital, Elliott Management, Senvest Management, Crescat Capital, Three Arrows Capital, Childrens Place Inc (PLCE), Booz Allen Hamilton Holding Corporation (BAH), and More"
2022/06/30  00:00:00,"Corpus Christi teachers union, Coastal Bend Trans Alliance distribute free LGBTQ books"
2022/06/30  00:00:00,Governors functioning as agents of ruling party at Centre: Yashwant Sinha
2022/06/30  00:00:00,Eric J Garrett: From Grassroots Movement To Mature Marketplace
2022/06/30  00:00:00,Documentary To Launch Frenchy Cannoli Foundation
2022/06/30  00:00:00,Legal Briefs: News From Around NH
2022/06/30  00:00:00,"Arsenal, Manchester United, Barcelona priced out of Ruben Neves chase"
2022/06/30  00:00:00,Spearfish students attend SkillsUSA National Conference
2022/06/30  00:00:00,Heritage Florida Jewish News - Central Florida's Independent Jewish Voice
2022/06/30  00:00:00,Plastic tubing left inside Swindon man after operation
2022/06/30  00:00:00,Sandy Fire grows to 64 acres
2022/06/30  00:00:00,Ukraine round-up: Russia leaves Snake Island and Putin's topless G7 comments
2022/06/30  00:00:00,U.S. ambassador meets with local Cambodian American community
2022/06/30  00:00:00,Life For Relief And Development 'Waters' The World
2022/06/30  00:00:00,"Jokowi: Putin to provide secure food, fertilizer supplies from Russia, Ukraine"
2022/06/30  00:00:00,NMiF reviews governors abortion action & The Journey of African American Homesteaders in N.M.
2022/06/30  00:00:00,"NEWS 6.30.22: Iowa Hog Lot Ruling, Pro-Choice Protesters Arrested in Sioux Falls, Lifejacket Safety, Saturday in The Park Update, and More"
2022/06/30  00:00:00,ZuoRAT Can Take Over Widely Used SOHO Routers
2022/06/30  00:00:00,EXCLUSIVE: Sen. Blackburn To Introduce Legislation Backing National Guard Members Set To Be Fired Over COVID Vaccine Refusal
2022/06/30  00:00:00,Senator Kiffmeyer: Third Amendment to the United States Constitution
2022/06/30  00:00:00,NMC's Shai selected as food systems scholar
2022/06/30  00:00:00,My word: The prisoners' dilemma - opinion
2022/06/30  00:00:00,Legal Briefs: News From Around NH
2022/06/30  00:00:00,"First Street closing planned for bridge, instream project"
2022/06/30  00:00:00,"Wike visited Tinubu in France, says APC chieftain, Joe Igbokwe"
2022/06/30  00:00:00,OnPolitics: POTUS backs changing filibuster to codify abortion into law
