date,title
2022/01/06  00:00:00,Today's D Brief: Russian military tries to quell Kazakh unrest; The legacy of Jan. 6; The extremists of Jan. 6; And a bit more.
2022/01/06  00:00:00,"Phife Dawg, Prodigy & Jam Master Jay sculptures coming to Queens Public Library"
2022/01/06  00:00:00,Heritage Florida Jewish News - Central Florida's Independent Jewish Voice
2022/01/06  00:00:00,WHO says Omicron appears less severe
2022/01/06  00:00:00,Ted Cruz: January 6 Protests on Capitol Hill a Violent Terrorist Attack
2022/01/06  00:00:00,Esigie Aguele on digital identity in Nigeria
2022/01/06  00:00:00,Attorney General Todd Rokita: Indiana took the fight to robocallers in 2021
2022/01/06  00:00:00,Tigrayans being forcibly disappeared: HRW report
2022/01/06  00:00:00,READ: Full text of Biden's speech about the Jan. 6 attack on the Capitol
2022/01/06  00:00:00,2 From Greene Critical After White Pine Shooting
2022/01/06  00:00:00,You turn to us for voices you won't hear anywhere else.
2022/01/06  00:00:00,Dubai travel: Emirates to operate daily flights to South Africa
2022/01/06  00:00:00,Flipping the script on the uphill battle of cybersecurity
2022/01/06  00:00:00,"Construction Stalls at Biggy Coffee in Allegan, MI"
2022/01/06  00:00:00,Photos: A look back at the Jan. 6 insurrection
2022/01/06  00:00:00,High-Powered Omani Business Delegation Calls On FM Qureshi
2022/01/06  00:00:00,Purdue Global partners with Nebraska medical center
2022/01/06  00:00:00,U.S. and U.K. strike Houthi targets in Yemen
2022/01/06  00:00:00,NSW hospitals bracing for tripling of Covid patients
2022/01/06  00:00:00,LeMahieu says Senate Republicans plan to pursue new elections bills ahead of Gableman review findings
2022/01/06  00:00:00,Smooth Covid-19 vaccination process for Primary 1 to 3 kids at Nee Soon East CC
2022/01/06  00:00:00,The Weeknd Delivers The Dawn FM Tracklist
2022/01/06  00:00:00,FNCs Carlson: January 6 Was Not a Violent Terrorist Attack  Pretending It Was a Failed Coup Is Dems Midterm Election Strategy
2022/01/06  00:00:00,Attorney General Todd Rokita: Indiana took the fight to robocallers in 2021
2022/01/06  00:00:00,Argentine Foreign Minister highlights Celacs role
2022/01/06  00:00:00,Gov. DeSantis lays out new 'seniors first' approach for COVID testing
2022/01/06  00:00:00,Heritage Florida Jewish News - Central Florida's Independent Jewish Voice
2022/01/06  00:00:00,COVID-19: No sweets in return of Three Wise Men in Madrid
2022/01/06  00:00:00,Tigrayans being forcibly disappeared: HRW report
2022/01/06  00:00:00,27 barangays in Mandaue to receive satellite phones
2022/01/06  00:00:00,Collecting In the Wake of January 6
2022/01/06  00:00:00,You turn to us for voices you won't hear anywhere else.
2022/01/06  00:00:00,New Mexico legislators visit MTC facilities in Chaparral
2022/01/06  00:00:00,"The 355, review: standard spies-gone-rogue fare repackaged in girl-power wrapping"
2022/01/06  00:00:00,Rep. Cori Bush: Members of Congress Aided the January 6th Insurrection. Expel Them
2022/01/06  00:00:00,Esigie Aguele on digital identity in Nigeria
2022/01/06  00:00:00,The French Presidency of the Council of the European Union
2022/01/06  00:00:00,2021 proved that Murkowski has abandoned Alaska
2022/01/06  00:00:00,Research must be done on services of Qazi Hussain Ahmad: Asad Qaiser
2022/01/06  00:00:00,Today's D Brief: Russian military tries to quell Kazakh unrest; The legacy of Jan. 6; The extremists of Jan. 6; And a bit more.
2022/01/06  00:00:00,"Ireland's sailing, boating & maritime magazine"
2022/01/06  00:00:00,Bewildered Ryanair passenger spots 'UFO' in clouds on flight to Edinburgh airport
2022/01/06  00:00:00,Gov. DeSantis lays out new 'seniors first' approach for COVID testing
2022/01/06  00:00:00,"Governor Edwards pardons Homer Plessy, of 'separate but equal' ruling"
2022/01/06  00:00:00,Ted Cruz: January 6 Protests on Capitol Hill a Violent Terrorist Attack
2022/01/06  00:00:00,CT asks nursing homes to accept COVID-positive admissions from hospitals
2022/01/06  00:00:00,"CECC reports 40 imported, three domestic cases"
2022/01/06  00:00:00,Heritage Florida Jewish News - Central Florida's Independent Jewish Voice
2022/01/06  00:00:00,Four arrests made in two cases by Mercer County Sheriff's Department detectives
2022/01/06  00:00:00,Crime stats to test Adams admin. early
2022/01/06  00:00:00,Commissioners discuss end of Trousdale's wheel tax
2022/01/06  00:00:00,Clinical Challenges: FLT3 Inhibitors After Allo-Transplant in AML
2022/01/06  00:00:00,"AM News Brief: Record COVID numbers, storm warning & illegal hunting"
2022/01/06  00:00:00,"City of Cambridge, C-I Schools address vaccination mandates"
2022/01/06  00:00:00,Former President Carter Speaks Out On American Divide
2022/01/06  00:00:00,Chinas Big Fund to Secure Chip Independence
2022/01/06  00:00:00,And Just Like That Chris Noth's Scene's Scrapped By HBO MAX
2022/01/06  00:00:00,"Build a custom email digest by following topics, people, and firms published on JD Supra."
2022/01/06  00:00:00,Couple carves artist haven from old dairy farm
2022/01/06  00:00:00,Again Ex-President Jonathan Visits Buhari In Aso Villa
2022/01/06  00:00:00,"North Korea missile test Minister for Asia statement, January 2022"
2022/01/06  00:00:00,"Biden Walks Line Between Persuasion, Fight In Jan. 6 Speech"
2022/01/06  00:00:00,Governor's Texas Task Force On Concert Safety Holds Meeting In San Antonio
2022/01/06  00:00:00,Foreign Currency Dealers' Alert from TTPS
2022/01/06  00:00:00,PRC: Jagan asks employeees to think practically
2022/01/06  00:00:00,BBC StoryWorks film shows inclusive mobile camera innovations from TECNO
2022/01/06  00:00:00,"Cincinnati Children's starts giving COVID-19 boosters to kids 12-15, offers vaccine clinics"
2022/01/06  00:00:00,"The 355, review: standard spies-gone-rogue fare repackaged in girl-power wrapping"
2022/01/06  00:00:00,News / 												Virus rules hit Hong Kong airfreight just as Cathay freighters limp back into action
2022/01/06  00:00:00,Arcade1Up steps up its replica arcade cabinets with full-size promachines
2022/01/06  00:00:00,Covid-19 on the rise in Fannin County
2022/01/06  00:00:00,Quebec court reserves order on AAI/AI plea
2022/01/06  00:00:00,"Legislative preview: liens, bonds and corporate taxes among many issues"
2022/01/06  00:00:00,"AM News Brief: Record COVID numbers, storm warning & illegal hunting"
2022/01/06  00:00:00,"Greensky Hill offers online worship series, 'God is Holding Your Life'"
2022/01/06  00:00:00,"Gov Ortom Urges Buhari To Declare Miyetti Allah, Fulani Group As Terrorists"
2022/01/06  00:00:00,Joshua Bassett Unfollows Olivia Rodrigo Ahead Of 'HSMTMTS' Reunion
2022/01/06  00:00:00,"High school language learners create projects on health, education and climate at UNC-Chapel Hill"
2022/01/06  00:00:00,"North Korea missile test Minister for Asia statement, January 2022"
2022/01/06  00:00:00,GOP leader Devin LeMahieu says Gov. Tony Evers should put more funding to nursing homes amid a COVID-19 surge
2022/01/06  00:00:00,"Maha notches 36K-plus Covid cases; 20,181 in Mumbai alone"
2022/01/06  00:00:00,"Mission Health medical director Hathaway leaves HCA in midst of patient, nurse complaints"
2022/01/06  00:00:00,Bollinger Shipyards delivers final Bahrain-bound Fast Response Cutter to U.S. Coast Guard
2022/01/06  00:00:00,"Governor Laura Kelly Directs State Agencies to Waive Fees for Farmers, Ranchers Affected by Wildfires"
2022/01/06  00:00:00,Fact Check: Crowd at Yogis UP rally passed off as turnout at PM Modis Punjab event
2022/01/06  00:00:00,"Central, eastern Europe fund to be created"
2022/01/06  00:00:00,Governor Mike DeWine meets with Ohio National Guard members assisting states hospitals
2022/01/06  00:00:00,Again Ex-President Jonathan Visits Buhari In Aso Villa
2022/01/06  00:00:00,"Hausa Community, CLO, others react to Udoms ban on scavenging in Akwa Ibom, calls for review"
2022/01/06  00:00:00,"AM News Brief: Record COVID numbers, storm warning & illegal hunting"
2022/01/06  00:00:00,Heritage Florida Jewish News - Central Florida's Independent Jewish Voice
2022/01/06  00:00:00,"Legislative preview: liens, bonds and corporate taxes among many issues"
2022/01/06  00:00:00,Federal Bureau Of Prisons Director Michael Carvajal To Resign
2022/01/06  00:00:00,New Mexico legislators visit MTC facilities in Chaparral
2022/01/06  00:00:00,"Covid Ireland: 23,817 new cases confirmed as officials meet to discuss further restrictions"
2022/01/06  00:00:00,COVID-19: Japan wants restrictions on US troops
2022/01/06  00:00:00,Covid 19: France lifts travel restrictions on South African travelers
2022/01/06  00:00:00,Sandy Zamor Calixte to run for Suffolk County sheriff
2022/01/06  00:00:00,"North Korea missile test Minister for Asia statement, January 2022"
2022/01/06  00:00:00,"Data Privacy Detective Podcast - Episode 78: Data Localization, the Case of Turkey"
2022/01/06  00:00:00,Melwood planning affordable housing complex in Arlington
2022/01/06  00:00:00,City students return to the classroom amid omicron surge
2022/01/06  00:00:00,"""Va. Governor-Elect Taps Trump EPA Chief For Key Post"""
2022/01/06  00:00:00,Gov. DeWine meets with Ohio National Guard members assisting states hospitals
2022/01/06  00:00:00,Amazon and Google Deploy Army of Shills to Fight Regulation
2022/01/06  00:00:00,"CECC reports 40 imported, three domestic cases"
2022/01/06  00:00:00,Nikki Fried accuses Gov. Ron DeSantis of stockpiling COVID-19 rapid tests
2022/01/06  00:00:00,Heritage Florida Jewish News - Central Florida's Independent Jewish Voice
2022/01/06  00:00:00,CT asks nursing homes to accept COVID-positive admissions from hospitals
2022/01/06  00:00:00,Burgundy's Louis Jadot Expands Its Oregon Footprint
2022/01/06  00:00:00,"STERIFRE MEDICAL GRANTED EPA REGISTRATION FOR AUTOMATED, POINT OF CARE DISINFECTANT SYSTEM TO HELP COMBAT COVID-19 AND OTHER HEALTHCARE ASSOCIATED PATHOGENS"
2022/01/06  00:00:00,Texas Task Force on Concert Safety holds meeting in San Antonio
2022/01/06  00:00:00,"Landmark $1B, 109-acre Biotech Campus Slated for Morrisville"
2022/01/06  00:00:00,Kerala Soaps spreading its fragrance across India
2022/01/06  00:00:00,"Again, Jonathan, Buhari meet at presidential villa"
2022/01/06  00:00:00,Florida providing 1 million at-home COVID tests for seniors
2022/01/06  00:00:00,"Maha notches 36K-plus Covid cases; 20,181 in Mumbai alone"
2022/01/06  00:00:00,"Legislative preview: liens, bonds and corporate taxes among many issues"
2022/01/06  00:00:00,"Full transcript: Biden, Harris speak from Capitol Hill on Jan. 6 anniversary"
2022/01/06  00:00:00,"PM Imran meets Maulana Tariq Jameel, discusses NRA's role"
2022/01/06  00:00:00,Research must be done on services of Qazi Hussain Ahmad: Asad Qaiser
2022/01/06  00:00:00,History of VA and its administrations
2022/01/06  00:00:00,GOP leader Devin LeMahieu says Gov. Tony Evers should put more funding to nursing homes amid a COVID-19 surge
2022/01/06  00:00:00,Heritage Florida Jewish News - Central Florida's Independent Jewish Voice
2022/01/06  00:00:00,Union home secretary reviews Covid situation in Delhi-NCR
2022/01/06  00:00:00,Sudden storms  of rain and Covid
2022/01/06  00:00:00,"Build a custom email digest by following topics, people, and firms published on JD Supra."
2022/01/06  00:00:00,"Ireland's sailing, boating & maritime magazine"
2022/01/06  00:00:00,In-Depth: Worker's rights advocates call for COVID sick leave to return in California
2022/01/06  00:00:00,Local OSHP Post Commander updates on local operations
2022/01/06  00:00:00,Today's D Brief: Russian military tries to quell Kazakh unrest; The legacy of Jan. 6; The extremists of Jan. 6; And a bit more.
2022/01/06  00:00:00,Judge's order sets parameters for Whiting vs. City of Athens
2022/01/06  00:00:00,"Watch: Jordans street vendor returns $25,000 to owner - who rewards him only $7"
2022/01/06  00:00:00,BBC StoryWorks film shows inclusive mobile camera innovations from TECNO
2022/01/06  00:00:00,Govt closely follows up on conditions of Jordanians in Kazakhstan  PM
2022/01/06  00:00:00,Covid-19 on the rise in Fannin County
2022/01/06  00:00:00,"Again, Jonathan, Buhari meet at presidential villa"
2022/01/06  00:00:00,"Rep. Johnson: One year later,  'We're not better prepared to defend the U.S. Capitol'"
2022/01/06  00:00:00,Fossil will add Alexa support to its smartwatches
2022/01/06  00:00:00,"AM News Brief: Record COVID numbers, storm warning & illegal hunting"
2022/01/06  00:00:00,Farm Bureau urges masks at convention; Vilsack to speak
2022/01/06  00:00:00,Sandy tracts of land turn green pastures for Vellore Corpn.
2022/01/06  00:00:00,"Build a custom email digest by following topics, people, and firms published on JD Supra."
2022/01/06  00:00:00,"Stinson Man part of state, local history"
2022/01/06  00:00:00,FROSTMAN COLUMN: 2022 starts off with major case regarding vax mandates
2022/01/06  00:00:00,Crime stats to test Adams admin. early
2022/01/06  00:00:00,"SPLC: Give them a bench, they'll take a mile"
2022/01/06  00:00:00,Weinberg taking board of directors role with Horizon Blue Cross Blue Shield
2022/01/06  00:00:00,City students return to the classroom amid omicron surge
2022/01/06  00:00:00,Photos: A look back at the Jan. 6 insurrection
2022/01/06  00:00:00,"Illinois House, Senate send proposal for new judicial 'subcircuits' to governor's desk"
2022/01/06  00:00:00,Governor Mike DeWine meets with Ohio National Guard members assisting states hospitals
2022/01/06  00:00:00,Rubber Board inks MoU with Singapore firm for research on natural rubber
2022/01/06  00:00:00,Federal Relief Fund Dumps Nearly $15M into Town Utility Budgets
2022/01/06  00:00:00,10 new cases raise Omicron spectre
2022/01/06  00:00:00,PM ushers Australians to support payment
2022/01/06  00:00:00,Pope Francis: Every Christian Is Called to Be a Missionary
2022/01/06  00:00:00,Boris Johnson branded plush Downing Street flat 'a tip' as he begged Tory donors for cash
2022/01/06  00:00:00,China and America prepare for a human-rights showdown at the UN
2022/01/06  00:00:00,Sandy Zamor Calixte to run for Suffolk County sheriff
2022/01/06  00:00:00,Heritage Florida Jewish News - Central Florida's Independent Jewish Voice
2022/01/06  00:00:00,Finding the Stars: A Review of There Once Was a Sky Full of Stars
2022/01/06  00:00:00,125 passengers on flight from Italy test Covid-positive
2022/01/06  00:00:00,Smithtown Fire Dept. Donates Equipment To Kentucky Firefighters
2022/01/06  00:00:00,The politics of a Minimum Support Price
2022/01/06  00:00:00,Collecting In the Wake of January 6
2022/01/06  00:00:00,Banks in HK resume work from home splits
2022/01/06  00:00:00,"Hochul announces 14-mile-long Interborough Express, connecting Bay Ridge to Jackson Heights"
2022/01/06  00:00:00,Freezing Migrants Found in Sealed Trailer near West Texas Mountains
2022/01/06  00:00:00,"Covid-19: Israel to lift travel ban to UAE, US, UK"
2022/01/06  00:00:00,"Former Navy Seal Officer, Jocko Willink, To Headline Lucido Global Event 						 						 							 							 								  													USA - English 													     															USA - English"
2022/01/06  00:00:00,"Olubadan: Ladoja breaks silence, says Lekan Balogun next in line"
2022/01/06  00:00:00,Two foreign returnees who contracted Omicron recover
2022/01/06  00:00:00,"Gov Ortom Urges Buhari To Declare Miyetti Allah, Fulani Group As Terrorists"
2022/01/06  00:00:00,"Amit Shah virtually launches projects worth Rs 2,450 cr in Manipur"
2022/01/06  00:00:00,"2021 El Pasoan of the Year: Dr. Richard Lange, President, Texas Tech University Health Sciences Center El Paso"
2022/01/06  00:00:00,Flipping the script on the uphill battle of cybersecurity
2022/01/06  00:00:00,"Hausa Community, CLO, others react to Udoms ban on scavenging in Akwa Ibom, calls for review"
2022/01/06  00:00:00,US Rep. Veronica Escobar reflects on Jan. 6 insurrection at US Capitol one year later
2022/01/06  00:00:00,Gatwick and Heathrow: Covid entry requirements for Germany and France
2022/01/06  00:00:00,Again Ex-President Jonathan Visits Buhari In Aso Villa
2022/01/06  00:00:00,Reptiland hosting animal guests from Lake Tobias Wildlife Park
2022/01/06  00:00:00,Jack Rowan and Tahirah Sharif lead the cast for A Town Called Malice
2022/01/06  00:00:00,"Stinson Man part of state, local history"
2022/01/06  00:00:00,Profile: Arensmeyer takes command of Stafford's engineering program
2022/01/06  00:00:00,She's rolling fresh fruits and veggies into Richmond's food deserts
2022/01/06  00:00:00,Unpaid salaries: Return to negotiation table with TASCE staff  NANS to Ogun govt
2022/01/06  00:00:00,Sen. Lindsey Graham reacts to the president and VPs speeches over the Capitol insurrection
2022/01/06  00:00:00,"Program to Feature Jessamine Spear Johnson, Early Western Photographer"
2022/01/06  00:00:00,13 +ve Passengers Of Chartered Flight From Italy To Punjab Flee From Hospital
2022/01/06  00:00:00,Deadline Extended: 2022 HD/West Elm Student Product Design Competition
2022/01/06  00:00:00,Ruling of release for former HDP MP Abdullah Zeydan
2022/01/06  00:00:00,UBports releases Ubuntu Touch OTA-21 with a redesigned greeter
2022/01/06  00:00:00,Bewildered Ryanair passenger spots 'UFO' in clouds on flight to Edinburgh airport
2022/01/06  00:00:00,Govt closely follows up on conditions of Jordanians in Kazakhstan  PM
2022/01/06  00:00:00,Smithtown Fire Dept. Donates Equipment To Kentucky Firefighters
2022/01/06  00:00:00,BJP targeting Channi because he is a Dalit CM: Gehlot
2022/01/06  00:00:00,Two foreign returnees who contracted Omicron recover
2022/01/06  00:00:00,The House Of Representatives Roadmap Committee meets with UN Secretary-General Special Adviser on Libya.
2022/01/06  00:00:00,"Jordans King, Israeli Defense Minister Reset Ties"
2022/01/06  00:00:00,Stimulus: Rent Relief Ending In Some States
2022/01/06  00:00:00,"Ashoka Univ co-founder, Gupta brothers siphoned of loans to buy assets: CBI"
2022/01/06  00:00:00,"GNARBOXs Original Team Gone, Assets in Hands of Investors"
2022/01/06  00:00:00,"Nassau County Exec Tells Schools, Indoor Venues To End Mask Mandates"
2022/01/06  00:00:00,Biden nominee ripped for link with 'pit bull for the Left'
2022/01/06  00:00:00,Gatwick and Heathrow: Covid entry requirements for Germany and France
2022/01/06  00:00:00,Crisis Firm Red Banyan Hires Whitney Bain as Account Coordinator in Denver
2022/01/06  00:00:00,Covid 19: France lifts travel restrictions on South African travelers
2022/01/06  00:00:00,Tigrayans being forcibly disappeared: HRW report
2022/01/06  00:00:00,Sudden storms  of rain and Covid
2022/01/06  00:00:00,Smooth Covid-19 vaccination process for Primary 1 to 3 kids at Nee Soon East CC
2022/01/06  00:00:00,Ontario will set aside vaccination appointments for education and child-care workers
2022/01/06  00:00:00,Kerala Soaps spreading its fragrance across India
2022/01/06  00:00:00,Viewpoint:A tug-of-war over students and taxes
2022/01/06  00:00:00,CNN Is Trying to Use BBC Interview After Ghislaine Maxwell Conviction Against Alan Dershowitz in His Defamation Lawsuit
2022/01/06  00:00:00,VA Weather: Snow Accumulation Estimates For Thursday Night Storm
2022/01/06  00:00:00,The Weeknd Delivers The Dawn FM Tracklist
2022/01/06  00:00:00,Finite: Bringing Direct Solar Investment Opportunities To The Average Investor
2022/01/06  00:00:00,Heritage Florida Jewish News - Central Florida's Independent Jewish Voice
2022/01/06  00:00:00,"Coors, Anheuser-Busch deliver drinking water for fire relief efforts"
2022/01/06  00:00:00,"City of Cambridge, C-I Schools address vaccination mandates"
2022/01/06  00:00:00,Jay Ashcroft pushes for governor to call special elections for vacant Missouri House seats
2022/01/06  00:00:00,CFIUS Should Revisit Intel-SK Hynix Merger Given Chinas 3rd Party Remedy
2022/01/06  00:00:00,"Mission Health medical director Hathaway leaves HCA in midst of patient, nurse complaints"
2022/01/06  00:00:00,Collecting In the Wake of January 6
2022/01/06  00:00:00,$240M in special ed. funds statewide
2022/01/06  00:00:00,Cardinal Cupich: Pope Francis Mass translation change another sign that Vatican II endures
2022/01/06  00:00:00,Amazon and Google Deploy Army of Shills to Fight Regulation
2022/01/06  00:00:00,Veolia Environnement: Information Relating to the Total Number of Voting Rights Forming the Share Capital
2022/01/06  00:00:00,Quebec court reserves order on AAI/AI plea
2022/01/06  00:00:00,Shin Bet vs. Hamas: Protecting the technology that provides the protection
2022/01/06  00:00:00,"The Commando: Jeff Fahey Talks Action Film, Veterans & Lawnmower Man"
2022/01/06  00:00:00,Attorney General Merrick Garland: No Higher Priority than Prosecuting January 6 Rioters
2022/01/06  00:00:00,"Hochul announces 14-mile-long Interborough Express, connecting Bay Ridge to Jackson Heights"
2022/01/06  00:00:00,"Build a custom email digest by following topics, people, and firms published on JD Supra."
2022/01/06  00:00:00,News / 												Virus rules hit Hong Kong airfreight just as Cathay freighters limp back into action
2022/01/06  00:00:00,Ruling of release for former HDP MP Abdullah Zeydan
2022/01/06  00:00:00,"Latvia to send weapons, equipment to Ukraine"
2022/01/06  00:00:00,They Left the Republican Party Because of Jan. 6. Heres What They Think One Year Later.
2022/01/06  00:00:00,"Dot Cocktail Lounge owner, Philanzo King reacts to extended mask mandate"
2022/01/06  00:00:00,Wisconsin Assembly Speaker Robin Vos in talks with Michael Gableman to extend contract for 2020 election review
2022/01/06  00:00:00,"DeSantis announces 1 million at-home COVID-19 tests will go to seniors, ignores vaccines"
2022/01/06  00:00:00,America250: Air Force Veteran Gerald W. Johnson
2022/01/06  00:00:00,Jay Ashcroft pushes for governor to call special elections for vacant Missouri House seats
2022/01/06  00:00:00,"Mission Health medical director Hathaway leaves HCA in midst of patient, nurse complaints"
2022/01/06  00:00:00,Arts Festival Honoring Dennis Wayne Strickland In The Planning Stages
2022/01/06  00:00:00,"Illinois House, Senate send proposal for new judicial 'subcircuits' to governor's desk"
2022/01/06  00:00:00,Corizon Health and State of Maryland Make Prison Vaccination Blitz
2022/01/06  00:00:00,TriMech Acquires MACDAC Engineering and Compumachine Assets
2022/01/06  00:00:00,"Again, Jonathan, Buhari meet at presidential villa"
2022/01/06  00:00:00,Declare Miyetti Allah as terrorist organisation -Ortom tells FG
2022/01/06  00:00:00,Recap: Police tape off street in village
2022/01/06  00:00:00,PRC: Jagan asks employeees to think practically
2022/01/06  00:00:00,"PM Modi security lapse | Punjab, Centre form panels"
2022/01/06  00:00:00,Ruling of release for former HDP MP Abdullah Zeydan
2022/01/06  00:00:00,"Minneapolis, St. Paul restore mask mandates as COVID-19 virus, omicron variant spreads"
2022/01/06  00:00:00,"Dot Cocktail Lounge owner, Philanzo King reacts to extended mask mandate"
2022/01/06  00:00:00,Cops Find Thousands of Undelivered Amazon Packages in Home
2022/01/06  00:00:00,Were hitting our limits: Madison hospitals stretched to capacity as COVID-19 continues to surge
2022/01/06  00:00:00,Photos: A look back at the Jan. 6 insurrection
2022/01/06  00:00:00,Ukraine chasing R&D reforms to adapt to European Research Area
2022/01/06  00:00:00,"Zone your presidential slots to South-East, Anyim appeals to parties"
2022/01/06  00:00:00,"Mitch McConnell says the U.S. Capitol was stormed by criminals on Jan. 6, 2021"
2022/01/06  00:00:00,Fact Check: Crowd at Yogis UP rally passed off as turnout at PM Modis Punjab event
2022/01/06  00:00:00,"PM Imran meets Maulana Tariq Jameel, discusses NRA's role"
2022/01/06  00:00:00,"Hochul announces 14-mile-long Interborough Express, connecting Bay Ridge to Jackson Heights"
2022/01/06  00:00:00,Youngkin names Mary Baldwin University grad as Secretary of Administration
2022/01/06  00:00:00,Corizon Health and State of Maryland Make Prison Vaccination Blitz
2022/01/06  00:00:00,"NC health officials recommend COVID-19 boosters for children ages 12 to 15"
2022/01/06  00:00:00,Taiwanese army troops stage urban battle exercise in front of fake 'O'Donoghue's' Irish pub
2022/01/06  00:00:00,Recap: Police tape off street in village
2022/01/06  00:00:00,TriMech Acquires MACDAC Engineering and Compumachine Assets
2022/01/06  00:00:00,Shin Bet vs. Hamas: Protecting the technology that provides the protection
2022/01/06  00:00:00,Indoor Mask Mandate Issued In Middletown
2022/01/06  00:00:00,Telangana winding up airport surveillance as 'Omicron spread is now local'
2022/01/06  00:00:00,VA Weather: Snow Accumulation Estimates For Thursday Night Storm
2022/01/06  00:00:00,"Dot Cocktail Lounge owner, Philanzo King reacts to extended mask mandate"
2022/01/06  00:00:00,Declare Miyetti Allah as terrorist organisation -Ortom tells FG
2022/01/06  00:00:00,Viewpoint:A tug-of-war over students and taxes
2022/01/06  00:00:00,City students return to the classroom amid omicron surge
2022/01/06  00:00:00,"2021 El Pasoan of the Year: Dr. Richard Lange, President, Texas Tech University Health Sciences Center El Paso"
2022/01/06  00:00:00,"Illinois House, Senate send proposal for new judicial 'subcircuits' to governor's desk"
2022/01/06  00:00:00,University of Illinois system adds booster requirement
2022/01/06  00:00:00,China and America prepare for a human-rights showdown at the UN
2022/01/06  00:00:00,"Mitch McConnell says the U.S. Capitol was stormed by criminals on Jan. 6, 2021"
2022/01/06  00:00:00,"Build a custom email digest by following topics, people, and firms published on JD Supra."
