date,title
2022/01/06  00:00:00,Three NC counties completely out of state-provided COVID-19 tests
2022/01/06  00:00:00,ACHI: Number of Arkansas school districts in high-infection zones quintuple
2022/01/06  00:00:00,Nur Sajat intends to set up shop in Sydney
2022/01/06  00:00:00,Coast Guard Rescues Missing Backcountry Hikers Who Wrote 'SOS' In The Snow
2022/01/06  00:00:00,Maryland State Police airlift sick crewmember from tanker ship in Chesapeake Bay
2022/01/06  00:00:00,"5 takeaways from the Capitol riot criminal cases, one year later"
2022/01/06  00:00:00,Analysts: Son involved in road rage shooting knew his father was planning to shoot
2022/01/06  00:00:00,"Allen West, running for Texas governor, stops in Killeen to talk with voters"
2022/01/06  00:00:00,8 ways teachers are talking about Jan. 6 in their classrooms
2022/01/06  00:00:00,Moss Point School District continues masking up as COVID cases rise
2022/01/06  00:00:00,"Area school return strategy: Testing, masks, and 'stay home if you're sick'"
2022/01/06  00:00:00,"COVID-19 is a Designed Bioweapon with a Toxic structure says US Army Retired Colonel, explains China & US Darpa ties"
2022/01/06  00:00:00,Delhi govt directs its hospitals to ramp up Covid beds
2022/01/06  00:00:00,Georgia lawmakers present at Capitol during insurrection | Jan. 6 one year later
2022/01/06  00:00:00,Beating a retreat with zinda laut paaya parting shot
2022/01/06  00:00:00,What Hochul left out of her State of the State address
2022/01/06  00:00:00,In Defense of Async: Function Colors Are Rusty
2022/01/06  00:00:00,Gadsden City High School to be virtual rest of the week; mask mandate back for system
2022/01/06  00:00:00,Roll up your sleeves in Tarneit
2022/01/06  00:00:00,"Build a custom email digest by following topics, people, and firms published on JD Supra."
2022/01/06  00:00:00,Postal Service Seeks Temporary Exemption From Biden's Vaccine-or-Test Mandate
2022/01/06  00:00:00,US monitoring Kazakhstan protests - WH
2022/01/06  00:00:00,schemata architects clads entire tokyo restaurant interior in artificial wood films
2022/01/06  00:00:00,Face Coverings Required in City Facilities Beginning January 10
2022/01/06  00:00:00,Rep. Bustos shares Capitol riot experiences with Rock Island students
2022/01/06  00:00:00,"LB Landry, Martin Behrman going back to virtual learning"
2022/01/06  00:00:00,Blinken says no Russia progress with 'gun to Ukraine's head'
2022/01/06  00:00:00,11 set for termination from MRH after refusing vaccine mandate
2022/01/06  00:00:00,"5 takeaways from the Capitol riot criminal cases, one year later"
2022/01/06  00:00:00,Colorado Edition: Western Slope voters in new district; Arizona water cutbacks; high country COVID-19; housing for Marshall Fire survivors
2022/01/06  00:00:00,Analysts: Son involved in road rage shooting knew his father was planning to shoot
2022/01/06  00:00:00,This Home-Shopping Preferred Stock Offers a 7% Yield
2022/01/06  00:00:00,Marine sent to brig over Afghan remarks rips Lloyd Austin's COVID focus: 'Wanted to put my head through wall'
2022/01/06  00:00:00,'Political hand grenade': Family sues Mayo Clinic in Jacksonville to allow ivermectin for dying COVID patient
2022/01/06  00:00:00,Horsford to discuss $38 million boost to Nevada electric carnetwork
2022/01/06  00:00:00,Georgia lawmakers present at Capitol during insurrection | Jan. 6 one year later
2022/01/06  00:00:00,Parents of Brian Laundrie fight to get hold of sons notebook from FBI
2022/01/06  00:00:00,LIFE INSURANCE business LIFELESS for long
2022/01/06  00:00:00,K'taka initiates special surveillance measures for arrivals from Goa
2022/01/06  00:00:00,"Build a custom email digest by following topics, people, and firms published on JD Supra."
2022/01/06  00:00:00,Roll up your sleeves in Tarneit
2022/01/06  00:00:00,"Cops foil attempt to rob bank near Pipavav port, one held"
2022/01/06  00:00:00,"Minneapolis, St. Paul Reinstate Indoor Mask Mandates"
2022/01/06  00:00:00,Shariah assets to make one-fourth of Bangladesh Finances balance sheet in a year
2022/01/06  00:00:00,Postal Service Seeks Temporary Exemption From Biden's Vaccine-or-Test Mandate
2022/01/06  00:00:00,Blinken says no Russia progress with 'gun to Ukraine's head'
2022/01/06  00:00:00,"Blinken, Israeli Foreign Minister discuss Russia, Iran issues: State Dept"
2022/01/06  00:00:00,"COVID-19 is a Designed Bioweapon with a Toxic structure says US Army Retired Colonel, explains China & US Darpa ties"
2022/01/06  00:00:00,"As Toshiba investors carp, No. 2 shareholder urges EGM vote on break-up plan"
2022/01/06  00:00:00,China Secures Foothold In This Strategic Middle East Oil State
2022/01/06  00:00:00,Razer designed its own limited edition Fossil Gen 6Smartwatch
2022/01/06  00:00:00,Saskatchewan monitoring COVID-19 measures needed to keep essential workers healthy
2022/01/06  00:00:00,Maryland State Police airlift sick crewmember from tanker ship in Chesapeake Bay
2022/01/06  00:00:00,Out-of-control 4-ton Russian rocket stage reenters Earth's atmosphere over the Pacific Ocean while traveling at 4.7 miles per second
2022/01/06  00:00:00,Commission balks at eliminating qualified immunity
2022/01/06  00:00:00,"Jan. 6 artifacts collected at American History Museum point to organization, planning and violence"
2022/01/06  00:00:00,Adventus And Salazar Provide an Exploration Update on its Projects in Ecuador - Including Additional Curipamba Drill Results from the Agua Santa Target
2022/01/06  00:00:00,"2 M-4 Carbines, 1 AK rifle recovered from slain terrorists in J&K (3rd Ld)"
2022/01/06  00:00:00,Drive Is On To Mail Cards To Wisconsin Woman About To Turn 100 Years-Old
2022/01/06  00:00:00,Coast Guard Rescues Missing Backcountry Hikers Who Wrote 'SOS' In The Snow
2022/01/06  00:00:00,"5 takeaways from the Capitol riot criminal cases, one year later"
2022/01/06  00:00:00,Draft of Masterplan-2031 for Varanasi prepared on GIS platform
2022/01/06  00:00:00,"State Health Commissioner Dr. Kris Box reinfected with COVID-19, isolating at home"
2022/01/06  00:00:00,Blinken says no Russia progress with 'gun to Ukraine's head'
2022/01/06  00:00:00,"Build a custom email digest by following topics, people, and firms published on JD Supra."
2022/01/06  00:00:00,Marine sent to brig over Afghan remarks rips Lloyd Austin's COVID focus: 'Wanted to put my head through wall'
2022/01/06  00:00:00,Details of PFOA suit settlement topic of online meetings
2022/01/06  00:00:00,Louisiana governor pardons plaintiff in landmark Supreme Court racial segregation case
2022/01/06  00:00:00,In Conversation with Regina Jackson and Selena Wilson about East Oakland Youth Development Center (EOYDC)
2022/01/06  00:00:00,8 ways teachers are talking about Jan. 6 in their classrooms
2022/01/06  00:00:00,State monitoring air quality in neighborhoods affected by Marshall Fire
2022/01/06  00:00:00,"ASU team makes, distributes DIY air filters for Valley classrooms"
2022/01/06  00:00:00,Where Things Stand: J.D. Vances Last Straw Was As Shallow As Any Trump Grievance
2022/01/06  00:00:00,Wake up sheeple! Shepherd uses her flock to make a point about vaccines
2022/01/06  00:00:00,"Adam Gentle drops CD 25 challenge, swaps to HD 120 contest"
2022/01/06  00:00:00,Van Gogh exhibit employees to be paid hundreds of hours in missed Sick & Safe time
2022/01/06  00:00:00,"Covid-19, Trustee Boundary Lines Topics of SCSD#1 Board Work Session"
2022/01/06  00:00:00,Gadsden City High School to be virtual rest of the week; mask mandate back for system
2022/01/06  00:00:00,DNR: Felon asked wife to pretend she shot trophy buck
2022/01/06  00:00:00,G Herbo Channels Kanye West Lyrics To Outline Chicago Short Life Spans
2022/01/06  00:00:00,'Political hand grenade': Family sues Mayo Clinic in Jacksonville to allow ivermectin for dying COVID patient
2022/01/06  00:00:00,"Area school return strategy: Testing, masks, and 'stay home if you're sick'"
2022/01/06  00:00:00,"SheFly Selects Gunnison, Colorado to Establish Company Headquarters"
2022/01/06  00:00:00,Moss Point School District continues masking up as COVID cases rise
2022/01/06  00:00:00,Rep. Bustos shares Capitol riot experiences with Rock Island students
2022/01/06  00:00:00,"LB Landry, Martin Behrman going back to virtual learning"
2022/01/06  00:00:00,Out-of-control 4-ton Russian rocket stage reenters Earth's atmosphere over the Pacific Ocean while traveling at 4.7 miles per second
2022/01/06  00:00:00,"Lebanon registers 5,818 new COVID-19 cases, 746,632 in total"
2022/01/06  00:00:00,U.S. and Germany touch base before meeting with Russia about Ukraine tensions
2022/01/06  00:00:00,"Blinken, Israeli Foreign Minister discuss Russia, Iran issues: State Dept"
2022/01/06  00:00:00,Adventus And Salazar Provide an Exploration Update on its Projects in Ecuador - Including Additional Curipamba Drill Results from the Agua Santa Target
2022/01/06  00:00:00,8 ways teachers are talking about Jan. 6 in their classrooms
2022/01/06  00:00:00,In brief: News from around the Pacific
2022/01/06  00:00:00,Inside The Book of Boba Fett With Stars Temuera Morrison and Ming-Na Wen
2022/01/06  00:00:00,"Workforce Management Software Market Swot Analysis By Key Players | Calabrio, ATOSS, Genesys"
2022/01/06  00:00:00,Blinken says no Russia progress with 'gun to Ukraine's head'
2022/01/06  00:00:00,Two questions from the Jan. 6 Capitol riot
2022/01/06  00:00:00,Ghislaine Maxwell to seek new trial after jurors sexual abuse claim  lawyer
2022/01/06  00:00:00,Minister McConalogue addresses Oxford farming conference
2022/01/06  00:00:00,Campeche passenger train studied by federal government
2022/01/06  00:00:00,Rep. Raul Ruiz looks to represent Imperial County
2022/01/06  00:00:00,"Noida: As active Covid cases cross 1,000, only 50% allowed in eateries, malls"
2022/01/06  00:00:00,"Build a custom email digest by following topics, people, and firms published on JD Supra."
2022/01/06  00:00:00,North Korea claims latest launch was 'hypersonic missile'
2022/01/06  00:00:00,MSPCA nabs rare African serval cat in Lincoln neighborhood
2022/01/06  00:00:00,Saskatchewan monitoring COVID-19 measures needed to keep essential workers healthy
2022/01/06  00:00:00,Centre cuts home isolation duration for  Covid patients to 7 days from 10
2022/01/06  00:00:00,"ASU team makes, distributes DIY air filters for Valley classrooms"
2022/01/06  00:00:00,"Quick hits: Illinois news in brief for Wednesday, Jan. 5, 2022"
2022/01/06  00:00:00,"Blinken, Israeli Foreign Minister discuss Russia, Iran issues: State Dept"
2022/01/06  00:00:00,A guide to URs spring opening plans
2022/01/06  00:00:00,"Bulli Bai case: BJP politicians, cop pitch for arrested girl's pardon"
2022/01/06  00:00:00,Biden poised to nominate Caroline Kennedy as US ambassador to Australia
2022/01/06  00:00:00,In brief: News from around the Pacific
2022/01/06  00:00:00,U.S. Secretary of Education Miguel Cardona discusses the push to keep schools open
2022/01/06  00:00:00,North Korea Says Launch on Wednesday Was Hypersonic Missile
2022/01/06  00:00:00,Some Nebraska Schools Require Indoor Mask Mandates Again
2022/01/06  00:00:00,Beating a retreat with zinda laut paaya parting shot
2022/01/06  00:00:00,US monitoring Kazakhstan protests - WH
2022/01/06  00:00:00,"Build a custom email digest by following topics, people, and firms published on JD Supra."
2022/01/06  00:00:00,ACHI: Number of Arkansas school districts in high-infection zones quintuple
2022/01/06  00:00:00,San Diego Senior Citizens Brace for Omicron Wave
2022/01/06  00:00:00,"15,014: Most daily Covid cases in Mumbai since pandemic began"
2022/01/06  00:00:00,CCISD partners with City-County Health District to administer vaccines
2022/01/06  00:00:00,"As COVID-19 cases surge, children's hospitals feel impact of omicron"
2022/01/06  00:00:00,Schools adapt for return from break as COVID-19 cases surge
2022/01/06  00:00:00,Letters: BR school districts should reflect increase in Black population
2022/01/06  00:00:00,Keynote Address with Gen. Kenneth F. McKenzie Jr.
2022/01/06  00:00:00,Ghislaine Maxwell: Lawyers call for retrial over juror comments
2022/01/06  00:00:00,Blinken says no Russia progress with 'gun to Ukraine's head'
2022/01/06  00:00:00,Fire Chief to ask for New Fire Station  Response Team Facility
2022/01/06  00:00:00,Chastanet Writes Controller of Customs over Decision to Withdraw Hilaires Case
2022/01/06  00:00:00,2 reporters who were in the Capitol on Jan. 6 talk about media coverage of the attack
2022/01/06  00:00:00,"ASU team makes, distributes DIY air filters for Valley classrooms"
2022/01/06  00:00:00,Minister McConalogue addresses Oxford farming conference
2022/01/06  00:00:00,"Lebanon registers 5,818 new COVID-19 cases, 746,632 in total"
2022/01/06  00:00:00,Beating a retreat with zinda laut paaya parting shot
2022/01/06  00:00:00,Parliament to discuss letter from Attorney General.
2022/01/06  00:00:00,"Maldives, Comoros Seen as Prospects for Normalization"
2022/01/06  00:00:00,Muni Market's Regulator Is Seeking Standards for Disclosure on ESG Debt: Joe Mysak
2022/01/06  00:00:00,K'taka initiates special surveillance measures for arrivals from Goa
2022/01/06  00:00:00,In brief: News from around the Pacific
2022/01/06  00:00:00,Campeche passenger train studied by federal government
2022/01/06  00:00:00,Some Nebraska Schools Require Indoor Mask Mandates Again
2022/01/06  00:00:00,Cowboys players doing cowboy things :mjsmh:
2022/01/06  00:00:00,CSTO to deploy peacekeeping forces to Kazakhstan
2022/01/06  00:00:00,Rep. Bustos shares Capitol riot experiences with Rock Island students
2022/01/06  00:00:00,Russia-Led Alliance to Send Forces to Unrest-Hit Kazakhstan
2022/01/06  00:00:00,Arkansas hospitals seeing more children with COVID-19
2022/01/06  00:00:00,"Biden, Harris to visit Atlanta Tuesday to discuss right to vote legislation"
2022/01/06  00:00:00,"Tampa Fire Rescue Battles Blazes In Seminole, Ybor Heights"
2022/01/06  00:00:00,Reaction to governor's State of the State
2022/01/06  00:00:00,"CHEO hosting priority vaccination clinic for teachers, education workers and childcare workers"
2022/01/06  00:00:00,DNA Special: Reality of allegations of Congress's hate for PM Modi
2022/01/06  00:00:00,State GOP Senate leader: Vetoed election bills likely to return
2022/01/06  00:00:00,"Army chief, UAE military delegation discuss enhancing military cooperation"
2022/01/06  00:00:00,"Quick hits: Illinois news in brief for Wednesday, Jan. 5, 2022"
2022/01/06  00:00:00,Inside The Book of Boba Fett With Stars Temuera Morrison and Ming-Na Wen
2022/01/06  00:00:00,Lawmakers question MDH over COVID-19 vaccine vendor after I-Team report
2022/01/06  00:00:00,A guide to URs spring opening plans
2022/01/06  00:00:00,11 set for termination from MRH after refusing vaccine mandate
2022/01/06  00:00:00,North Korea claims latest launch was 'hypersonic missile'
2022/01/06  00:00:00,COVID Surge Prompts Return To Virtual Meetings For Claremont
2022/01/06  00:00:00,Medical Service Corps Officer Serves in Alaska Air Guard
2022/01/06  00:00:00,Minister McConalogue addresses Oxford farming conference
2022/01/06  00:00:00,"Build a custom email digest by following topics, people, and firms published on JD Supra."
2022/01/06  00:00:00,Muni Market's Regulator Is Seeking Standards for Disclosure on ESG Debt: Joe Mysak
2022/01/06  00:00:00,Tennessee opens $40M lodge at Fall Creek Falls State Park
2022/01/06  00:00:00,"Iran's top nuclear negotiator terms Vienna talks as constructive, progressive"
2022/01/06  00:00:00,South Carolina sued over newly drawn state House districts
2022/01/06  00:00:00,2 reporters who were in the Capitol on Jan. 6 talk about media coverage of the attack
2022/01/06  00:00:00,VanTrust sells Amazon warehouse for $103.5 million
2022/01/06  00:00:00,"Bulli Bai case: BJP politicians, cop pitch for arrested girl's pardon"
2022/01/06  00:00:00,"Jeffrey Epstein and the Mainstream Media Cover-Up, Part I"
2022/01/06  00:00:00,Complicated Covid protocols hassling arriving passengers: Vietnamese airlines
2022/01/06  00:00:00,COVID-19 infects 214 on five cruise ships in Brazilian waters
2022/01/06  00:00:00,Nuvo Group Partners with Charit - Universittsmedizin Berlin to Establish a Remote Fetal Surveillance Protocol for Europe and Study Predictive Analytics on Preeclampsia Patients   Israel - English      Deutschland - Deutsch
2022/01/06  00:00:00,"Maldives, Comoros Seen as Prospects for Normalization"
2022/01/06  00:00:00,DNA Special: Reality of allegations of Congress's hate for PM Modi
2022/01/06  00:00:00,Businesses discuss returning to curbside service amidst COVID surge
2022/01/06  00:00:00,Blinken says no Russia progress with 'gun to Ukraine's head'
2022/01/06  00:00:00,K'taka initiates special surveillance measures for arrivals from Goa
2022/01/06  00:00:00,8 ways teachers are talking about Jan. 6 in their classrooms
2022/01/06  00:00:00,Marine sent to brig over Afghan remarks rips Lloyd Austin's COVID focus: 'Wanted to put my head through wall'
2022/01/06  00:00:00,Iraq to acquire Exxon Mobils stake in West Qurna oilfield -minister
2022/01/06  00:00:00,"Blinken, Israeli Foreign Minister discuss Russia, Iran issues: State Dept"
2022/01/06  00:00:00,Sheriff's deputies question placement on Laurie List
2022/01/06  00:00:00,New York Times Media Columnist Ben Smith Leaving Outlet for Global News Start-Up
2022/01/06  00:00:00,Lawmakers question MDH over COVID-19 vaccine vendor after I-Team report
2022/01/06  00:00:00,"Manitoba rapid test shipments pale beside Saskatchewan demands 										  							By: Dylan Robertson 				Posted: 7:00 PM CST Wednesday, Jan. 5, 2022"
2022/01/06  00:00:00,"Naomi Preview: Kaci Walfall Talks Series, Man of Steel Mystery & More"
2022/01/06  00:00:00,Matt King Launches Campaign for Ohio House
2022/01/06  00:00:00,2022 predictions from the REIA president
2022/01/06  00:00:00,"Advocates, good government groups parse N.Y. Gov. Hochuls COVID recovery plans, policy proposals"
2022/01/06  00:00:00,"Tories once again prove themselves to be penny-wise, COVID-foolish 										  							By: Dan Lett Posted: 5:25 PM CST Wednesday, Jan. 5, 2022  				Last Modified: 5:56 PM CST Wednesday, Jan. 5, 2022 Updates"
2022/01/06  00:00:00,Top cooks and chefs share $14 family feeds from World Vision's downloadable cookbook
2022/01/06  00:00:00,Here are Gov. Hochul's 2022 plans that impact the North Country
2022/01/06  00:00:00,Georgia lawmakers present at Capitol during insurrection | Jan. 6 one year later
2022/01/06  00:00:00,"Jeffrey Epstein and the Mainstream Media Cover-Up, Part I"
2022/01/06  00:00:00,8 ways teachers are talking about Jan. 6 in their classrooms
2022/01/06  00:00:00,Louisiana governor pardons plaintiff in landmark Supreme Court racial segregation case
2022/01/06  00:00:00,COVID-19: Italy makes vaccine mandatory for over-50s
2022/01/06  00:00:00,COVID-19 infects 214 on five cruise ships in Brazilian waters
2022/01/06  00:00:00,Italy requiring everyone over 50 to get a COVID vaccine
2022/01/06  00:00:00,House Jan. 6 committee seeks to question Fox News' Sean Hannity about the Capitol riot
2022/01/06  00:00:00,"U.S., Japan to Hold Virtual Talks on Security, Indo-Pacific Region"
2022/01/06  00:00:00,Muni Market's Regulator Is Seeking Standards for Disclosure on ESG Debt: Joe Mysak
2022/01/06  00:00:00,"Bill 21 'authorizes interference by the state in religion,' says federal antisemitism envoy Irwin Cotler"
2022/01/06  00:00:00,Ghislaine Maxwell to seek new trial after jurors sexual abuse claim  lawyer
2022/01/06  00:00:00,Humongous ribs! | Brothers convert school bus into Texas-sized food truck
2022/01/06  00:00:00,In Defense of Async: Function Colors Are Rusty
2022/01/06  00:00:00,"Build a custom email digest by following topics, people, and firms published on JD Supra."
2022/01/06  00:00:00,North Korea claims latest launch was 'hypersonic missile'
2022/01/06  00:00:00,"Uttarakhand HC to EC: Explore if voting can be online, rallies virtual"
2022/01/06  00:00:00,"Lala Kent Reveals She Had A Prenup With Ex-Fianc Randall Emmett: 'What's Mine Is Mine, Go Away'"
2022/01/06  00:00:00,KKK literature distributed in Calvert County neighborhood
2022/01/06  00:00:00,Louisiana governor pardons plaintiff in landmark Supreme Court racial segregation case
2022/01/06  00:00:00,"Minneapolis, St. Paul Reinstate Indoor Mask Mandates"
2022/01/06  00:00:00,Nikola Drops $2 Billion Patent Suit Against Tesla
2022/01/06  00:00:00,Senate Judiciary votes on resolution to pressure U.S. Supreme Court
2022/01/06  00:00:00,VanTrust sells Amazon warehouse for $103.5 million
2022/01/06  00:00:00,Cops rope in locals to monitortraffic at Maha border villages
2022/01/06  00:00:00,Parliament to discuss letter from Attorney General.
2022/01/06  00:00:00,"10,000 constables begin training Monday, IGP meets colleges heads"
2022/01/06  00:00:00,Covid-19 Ireland: Punters may soon need a booster vaccine to get into pubs
2022/01/06  00:00:00,Senators Barasso and Lummis Join Supreme Court Brief Opposing Biden Vaccine Mandate
2022/01/06  00:00:00,"5 takeaways from the Capitol riot criminal cases, one year later"
2022/01/06  00:00:00,Photos: Tigers at the Animal Park at the Conservators Center
2022/01/06  00:00:00,AIG Odumosu and travails of the Nigerian citizen
2022/01/06  00:00:00,MSPCA nabs rare African serval cat in Lincoln neighborhood
2022/01/06  00:00:00,Analysts: Son involved in road rage shooting knew his father was planning to shoot
2022/01/06  00:00:00,Green Bay mayor seeks sanctions against head of GOP election probe
2022/01/06  00:00:00,8 ways teachers are talking about Jan. 6 in their classrooms
2022/01/06  00:00:00,Opinion: Praise for Harry Reid must acknowledge settlement of water wars | Bruce Bledsoe
2022/01/06  00:00:00,North Korea fires ballistic missile into the sea
2022/01/06  00:00:00,Sheriff's deputies question placement on Laurie List
2022/01/06  00:00:00,Louisiana governor pardons plaintiff in landmark Supreme Court racial segregation case
2022/01/06  00:00:00,"Build a custom email digest by following topics, people, and firms published on JD Supra."
2022/01/06  00:00:00,Covid-19 testing policy put under the microscope as Omicron sweeps world
2022/01/06  00:00:00,Parkland diagnoses patients with COVID and flu at the same time
2022/01/06  00:00:00,11 set for termination from MRH after refusing vaccine mandate
2022/01/06  00:00:00,COVID Surge Prompts Return To Virtual Meetings For Claremont
2022/01/06  00:00:00,Russia-Led Alliance to Send Forces to Unrest-Hit Kazakhstan
2022/01/06  00:00:00,A guide to URs spring opening plans
2022/01/06  00:00:00,US hails dairy trade ruling in dispute with Canada
2022/01/06  00:00:00,Food Adventures in Cole Camp  Calgaros Pizza
2022/01/06  00:00:00,Commission balks at eliminating qualified immunity
2022/01/06  00:00:00,Georgia lawmakers present at Capitol during insurrection | Jan. 6 one year later
2022/01/06  00:00:00,"Lebanon registers 5,818 new COVID-19 cases, 746,632 in total"
2022/01/06  00:00:00,Coloradans Say Suncor Is Making Them Sick. Cultivando Intends to Prove It
2022/01/06  00:00:00,Letters: Parent: Truth on program was hidden behind what Sito Narcisse said
2022/01/06  00:00:00,AIG Odumosu and travails of the Nigerian citizen
2022/01/06  00:00:00,Marine sent to brig over Afghan remarks rips Lloyd Austin's COVID focus: 'Wanted to put my head through wall'
2022/01/06  00:00:00,"Navajo Nation will send $2,000 to adults and $600 to kids in COVID-19 hardshipaid"
2022/01/06  00:00:00,U.S. and Germany touch base before meeting with Russia about Ukraine tensions
2022/01/06  00:00:00,"Alabama House GOP priorities: Permitless carry, critical race theory, pay raises"
2022/01/06  00:00:00,NM policymakers reflect on Capitol attack
2022/01/06  00:00:00,What Hochul left out of her State of the State address
2022/01/06  00:00:00,Meet the police dogs sniffing out COVID-19 at Massachusetts schools
2022/01/06  00:00:00,U.S. Secretary of Education Miguel Cardona discusses the push to keep schools open
2022/01/06  00:00:00,Cops rope in locals to monitortraffic at Maha border villages
2022/01/06  00:00:00,Rep. Bustos shares Capitol riot experiences with Rock Island students
2022/01/06  00:00:00,"Ottawa to Send 140 Million COVID-19 Rapid Tests to Provinces, Territories"
2022/01/06  00:00:00,Chamber of Commerce relocating to Historic Deerfield
2022/01/06  00:00:00,Prince Andrew 'asked Emily Maitlis if he should mention he couldn't sweat in their Newsnight interview'
2022/01/06  00:00:00,Van Gogh exhibit employees to be paid hundreds of hours in missed Sick & Safe time
2022/01/06  00:00:00,Mask policies being revisited at  school districts across the Cape Fear
2022/01/06  00:00:00,Reproductions and interlibrary loans for individuals
2022/01/06  00:00:00,Letters: Parent: Truth on program was hidden behind what Sito Narcisse said
2022/01/06  00:00:00,Commission balks at eliminating qualified immunity
2022/01/06  00:00:00,Analysts: Son involved in road rage shooting knew his father was planning to shoot
2022/01/06  00:00:00,In Defense of Async: Function Colors Are Rusty
2022/01/06  00:00:00,China Secures Foothold In This Strategic Middle East Oil State
2022/01/06  00:00:00,"Noida: As active Covid cases cross 1,000, only 50% allowed in eateries, malls"
2022/01/06  00:00:00,Two questions from the Jan. 6 Capitol riot
2022/01/06  00:00:00,"Pandemic Sidelines Police, Fire and Teachers in California"
2022/01/06  00:00:00,"Blinken, Israeli Foreign Minister discuss Russia, Iran issues: State Dept"
2022/01/06  00:00:00,"Jan. 6 artifacts collected at American History Museum point to organization, planning and violence"
