date,title
2022/09/11  00:00:00,"foaming agents_integra927.com | Nanomaterials, Chemical Products"
2022/09/11  00:00:00,"Iron Oxide Nanoparticles_integra927.com | Nanomaterials, Chemical Products"
2022/09/11  00:00:00,"Bismuth oxide Bi2O3 powder price_integra927.com | Nanomaterials, Chemical Products"
2022/09/11  00:00:00,"Mo2C Powder_integra927.com | Nanomaterials, Chemical Products"
2022/09/11  00:00:00,"Zinc Sulfide ZnS_integra927.com | Nanomaterials, Chemical Products"
2022/09/11  00:00:00,"foam concrete_integra927.com | Nanomaterials, Chemical Products"
2022/09/11  00:00:00,"concrete superplasticizer_integra927.com | Nanomaterials, Chemical Products"
2022/09/11  00:00:00,"Molybdenum disulfide price_integra927.com | Nanomaterials, Chemical Products"
2022/09/11  00:00:00,"sodium myristate price_integra927.com | Nanomaterials, Chemical Products"
2022/09/11  00:00:00,"Titanium Disilicide_integra927.com | Nanomaterials, Chemical Products"
2022/09/11  00:00:00,"Alloy Inconel718_integra927.com | Nanomaterials, Chemical Products"
2022/09/11  00:00:00,"Molybdenum Carbide Mo2C Price_integra927.com | Nanomaterials, Chemical Products"
2022/09/11  00:00:00,"M&V Limo Wine Tours in Long Island, Commack, NY"
2022/09/11  00:00:00,"Flowerfield in Long Island, St. James, NY"
2022/09/11  00:00:00,"Kids Country Day Camp in Long Island, Mt. Sinai, NY"
2022/09/11  00:00:00,FDA authorizes reformulated COVID-19 booster shot for the fall
2022/09/11  00:00:00,Euro Penalty Cup 2021 - Free Online Games
2022/09/11  00:00:00,Mighty Ducts - Duct Cleaning in Steinbach
2022/09/11  00:00:00,Jewel Aquarium - Free Online Games
2022/09/11  00:00:00,Pine to Palm - Tree Service in Steinbach and Winnipeg
2022/09/11  00:00:00,DF Music - Steinbach Piano Teacher
2022/09/11  00:00:00,Harlingen officials negotiating new STEC agreement
2022/09/11  00:00:00,Power out for Huber Heights Dispatch Center; All Huber Heights 911 calls transferred to Englewood
2022/09/11  00:00:00,Fleet Week participants train with Baltimore's Freestate ChalleNGe Academy cadets
2022/09/11  00:00:00,AP Top U.S. News at 1:39 a.m. EDT
2022/09/11  00:00:00,L-A Maples getting their Irish up for playoff bout against Shamrocks
2022/09/11  00:00:00,"Japan Plans to Scrap Daily Arrival Cap by October, Nikkei Says"
2022/09/11  00:00:00,Where KJ Jefferson falls in Total QBR in the SEC
2022/09/11  00:00:00,Philadelphia braces for possibility migrant buses from Texas will be sent to city
2022/09/11  00:00:00,"Face The Nation: Patta, Markarova, Lumumba"
2022/09/11  00:00:00,Oppenheimer Says Biotech Stocks Look a Bit Brighter Right Now; Here Are 2 Names to Consider
2022/09/11  00:00:00,Residents clean up downtown Phoenix streets
2022/09/11  00:00:00,McCarthy and HTX republican delegation pledge- count offense against Chinese aggression.
2022/09/11  00:00:00,Texas Report Card: PFF grades from the Alabama game
2022/09/11  00:00:00,"Partly Cloudy, Warm & Humid, Slight Chance of a Sprinkle"
2022/09/11  00:00:00,SpaceX now targeting Tuesday for next Falcon 9 Starlink mission liftoff
2022/09/11  00:00:00,Free-Grace Press publishes novels in Shenandoah
2022/09/11  00:00:00,"Be Assertive, Be Yourself - PatnaDaily"
2022/09/11  00:00:00,Comexi 8 Colors CI Flexo Printing Press In Europe
2022/09/11  00:00:00,Itellum Chooses Hughes Managed Satellite Services to Help Bridge Costa Rica's Digital Divide
2022/09/11  00:00:00,Gaming's pet peeves - Retro & Other Gaming Forum
2022/09/11  00:00:00,"Truss, Macron discuss work on energy crisis"
2022/09/11  00:00:00,"Ghazi Salahuddin:Writer - The News International: Latest News Breaking, Pakistan News"
2022/09/11  00:00:00,Ethereum blockchain set for 'monumental' overhaul
2022/09/11  00:00:00,Dodgers Minor League Report - True Blue LA
2022/09/11  00:00:00,VIP Armenia Community - Dr. J. Jookiba's Album: Galactic Federation and others
2022/09/11  00:00:00,"The Captivating Harlem Swing Rhythms of Freddie Green, John Trueheart, Bernard Addison, Morris White, and Al Casey | Acoustic Guitar"
2022/09/11  00:00:00,Nicole Grace Melton - Wade James Gerlick
2022/09/11  00:00:00,"Solomon Islands PM: Australia, NZ exempt from naval ship moratorium"
2022/09/11  00:00:00,Now & Then: Fourth & Liberty Live!
2022/09/11  00:00:00,On the Level: A storage issue for owner of a new townhome
2022/09/11  00:00:00,"As small businesses raise prices, some customers push back - Channel3000.com"
2022/09/11  00:00:00,Chippewa Falls neighbors: Obituaries for September 10
2022/09/11  00:00:00,"Sri Lanka vs Pakistan Dream11 Prediction, Fantasy Cricket Tips, Dream11 Team, Playing XI, Pitch Report, Injury Update- Asia Cup 2022"
2022/09/11  00:00:00,Crook and Chase - Eagle 92.9
2022/09/11  00:00:00,King Charles' ex-classmate says he hoarded monarch's hair clippings for 50 years
2022/09/11  00:00:00,"Liberia: Cuttington University Alumni in America Raises Nearly US$200,000 for Alma mater"
2022/09/11  00:00:00,Christopher Gerlacher - Sports Betting Writer - Gaming Today
2022/09/11  00:00:00,"Mets use 8-run fourth to slam Marlins, 11-3"
2022/09/11  00:00:00,BSP signs MOU with Kyrgyzstan central bank
2022/09/11  00:00:00,Money Marketing : UK latest financial news
2022/09/11  00:00:00,"Edmonds Police Blotter: Aug. 24-Sept. 7, 2022 - My Edmonds News"
2022/09/11  00:00:00,"Rian Johnson unpeels 'Glass Onion,' his 'Knives Out' sequel"
2022/09/11  00:00:00,Loeb Reverses Course on Push to Get Disney to Spin Off ESPN
2022/09/11  00:00:00,Russia announces troop pullback from Ukraine's Kharkiv area
2022/09/11  00:00:00,"Visa, Mastercard, AmEx to start categorizing gun shop sales"
2022/09/11  00:00:00,Daniel Gazdag leads Union past Orlando City
2022/09/11  00:00:00,Procession in Scotland moves Queen Elizabeth II's coffin to Edinburgh
2022/09/11  00:00:00,"Contracts signed: Land Bank, Crestline company ink deal to demolish former Westinghouse properties"
2022/09/11  00:00:00,"Common Man & T-Bone Flashback September 11, 2022"
2022/09/11  00:00:00,One Piece Episode #1032 Anime Review
2022/09/11  00:00:00,USA Archives - The Last Refuge
2022/09/11  00:00:00,"Janet Karim, Author at The Maravi Post"
2022/09/11  00:00:00,3 Beaten-Down Stocks to Buy Right Now @themotleyfool #stocks $HD $ABT $SBUX
2022/09/11  00:00:00,Nasdaq Bear Market: 3 Growth Stocks You'll Regret Not Buying on the Dip @themotleyfool #stocks $ROKU $ADBE $OPEN
2022/09/11  00:00:00,"Buy Tickets to Sasquatch, Whammy Bar, Auckland"
2022/09/11  00:00:00,"Nahbo + Half/Time + Te Kupu + MC Wiya - MOON, Wellington"
2022/09/11  00:00:00,Gov. Chris Sununu: Chuck Morse for U.S. Senate
2022/09/11  00:00:00,"Stops in Berlin, Gorham eyed for possible night train service between Montreal and Portland/Boston>"
2022/09/11  00:00:00,Russian troops in big retreat as Ukraine offensive advances in Kharkiv
2022/09/11  00:00:00,Qatar: Minister of State for Foreign Affairs Meets Ethiopian Ambassador - Ventures Africa
2022/09/11  00:00:00,Inflammatory material causes India to meet Wikipedia officials
2022/09/11  00:00:00,"MP CM , Union ministers Yadav, Tomar inspect Kuno National Park ahead of cheetah reintroduction"
2022/09/11  00:00:00,"Union territory Dadra and Nagar Haveli - Land, People, Festival, Tourism, Economy"
2022/09/11  00:00:00,"Haryana, Haryana index page, Haryana state, People, Fairs and Festivals, Arts, Tourism, Land"
2022/09/11  00:00:00,"Public notices: New roundabout, road closures and alcohol licenses"
2022/09/11  00:00:00,"Andhra Guide.com :: Latest Andhra News, Regional,Political and Telangana News"
2022/09/11  00:00:00,"Inactives: Justin Pugh, J.J. Watt Sitting For Cardinals Against Chiefs"
2022/09/11  00:00:00,SAF and Defense Distributed ghost gun ban busters
2022/09/11  00:00:00,The Myth of the Liberal Media - Everything2.com
2022/09/11  00:00:00,TQ8223 :: Browse 79 Images :: Geograph Britain and Ireland
2022/09/11  00:00:00,SN9916 :: Browse 23 Images :: Geograph Britain and Ireland
2022/09/11  00:00:00,"151 Fox Run St Lee, MA 01238 / iBerkshires.com - The Berkshires online guide to events, news and Berkshire County community information."
2022/09/11  00:00:00,"92 Hospital Ave North Adams, MA 01247 / iBerkshires.com - The Berkshires online guide to events, news and Berkshire County community information."
2022/09/11  00:00:00,"546 Main St Great Barrington, MA 01230 / iBerkshires.com - The Berkshires online guide to events, news and Berkshire County community information."
2022/09/11  00:00:00,Bennett Ruda | The Jewish Press - JewishPress.com
2022/09/11  00:00:00,US | The Jewish Press - JewishPress.com
2022/09/11  00:00:00,Forum series allows Republican candidates for governor to state their cases
2022/09/11  00:00:00,"Titanium One in Ulwe, Navi Mumbai: Price, Brochure, Floor Plan, Reviews"
2022/09/11  00:00:00,"Dudhwala Aqua Pearl in Agripada, Mumbai: Price, Brochure, Floor Plan, Reviews"
2022/09/11  00:00:00,"Sumadhura Aspire Amber in Whitefield, Bangalore: Price, Brochure, Floor Plan, Reviews"
2022/09/11  00:00:00,"Gokul Aangan in Vasai West, Mumbai: Price, Brochure, Floor Plan, Reviews"
2022/09/11  00:00:00,CM insists on remedial classes for students | The Navhind Times
2022/09/11  00:00:00,Privacy Policy | The Navhind Times
2022/09/11  00:00:00,Contact us | The Navhind Times
2022/09/11  00:00:00,Let Me Feel Your Finger First | PAUL GRAVETT
2022/09/11  00:00:00,The Associated Press | The Republic News
2022/09/11  00:00:00,Legal Aid to have free clinic | The Republic News
2022/09/11  00:00:00,Qatar Tourism features David Beckham in new campaign
2022/09/11  00:00:00,Emirates Glass partners with Schott for fire-resistant glass
2022/09/11  00:00:00,Russian forces retreat amid Ukrainian counteroffensive
2022/09/11  00:00:00,"Ask the PC Doctor: Google Slides is like PowerPoint, but free"
2022/09/11  00:00:00,ABBAmania coming to area in support of Diabetes Canada
2022/09/11  00:00:00,Antigua and Barbuda plans to vote on King Charles's role as head of state
2022/09/11  00:00:00,Top Doctors 2022 Spotlight: Ohio State Critical Care Medicine Specialist Philip Diaz
2022/09/11  00:00:00,Crises forge Beshear's role as Kentucky's consoler in chief
2022/09/11  00:00:00,Work starts on 265 affordable homes in the city | Cork Independent
2022/09/11  00:00:00,Andhra Pradesh restarts efforts to develop Amaravati
2022/09/11  00:00:00,Karen Smith scholarship show for 'Edna'
2022/09/11  00:00:00,"Padres Activate Pierce Johnson From 60-Day Injured List, Designate Matt Beaty"
2022/09/11  00:00:00,"A's Designate Domingo Tapia, Select Collin Wiles"
2022/09/11  00:00:00,Esbenshade Series: The Bob Thompson Quartet with Meredith Dean Augustin
2022/09/11  00:00:00,Magnitude 7.6 Quake Hits Papua New Guinea
2022/09/11  00:00:00,"State historic marker honors Casa Feliz, Winter Park architect Rogers"
2022/09/11  00:00:00,"Building collapse: Stakeholders meet, discuss solutions"
2022/09/11  00:00:00,Flutterwave planned IPO and the lessons for Nigeria
2022/09/11  00:00:00,Accession proclamation read to people of Northern Ireland at Hillsborough Castle
2022/09/11  00:00:00,"Sounders vs. Austin FC: Highlights, stats and quotes"
2022/09/11  00:00:00,"DEVIN HANEY PREDICTS CANELO VS GGG 3 ""IT GOES TO DECISION"", SHIELDS-MARSHALL, & MAYER-BAUMGARDNER"
2022/09/11  00:00:00,"PHOTO GALLERY: Stepping up: Next generation of royals to see more scrutiny | News, Sports, Jobs"
2022/09/11  00:00:00,Alternative Energy Products - Energy Storage & Distribution | AltEnergyMag
2022/09/11  00:00:00,Joe Biden uses 9/11 Speech To Aim At Political Enemies
2022/09/11  00:00:00,Daily Mass Gospel Reflection- Lost and Found
2022/09/11  00:00:00,Elizabeth II: A Life of Duty [1 hour doc via YT]
2022/09/11  00:00:00,#12 Florida Gators fall at home to the #20 Kentucky Wildcats
2022/09/11  00:00:00,Electrician NZ | Electrical Company & Services
2022/09/11  00:00:00,A Garden Gift from George Washington Carver
2022/09/11  00:00:00,Community - Western Neighborhoods Project - San Francisco History
2022/09/11  00:00:00,"Buying wood pellets, 8 mm, 1 truck, certified, EXW"
2022/09/11  00:00:00,Garbarino offers bipartisan bill providing $4B for low-income energy assistance program
2022/09/11  00:00:00,compare medicare supplement plan - Yahoo Search Yahoo Search Results
2022/09/11  00:00:00,medicare supplement insurance plan quote - Yahoo Search Yahoo Search Results
2022/09/11  00:00:00,CQ Magazine news | Southgate Amateur Radio News
2022/09/11  00:00:00,DISD trustees to consider approving tax rate
2022/09/11  00:00:00,Cubs who circled bases on triple-and-error
2022/09/11  00:00:00,Progress Edition 2022: Readers share job and career advice
2022/09/11  00:00:00,Little known Temesgen to lead Ethiopia Bunna to the future - Capital Newspaper
2022/09/11  00:00:00,Walia partner with music sensation Rophnan - Capital Newspaper
2022/09/11  00:00:00,The issue of price inflation - Capital Newspaper
2022/09/11  00:00:00,Local products to supersede over import - Capital Newspaper
2022/09/11  00:00:00,Alleged Melody Hookah Lounge shooter appears for preliminary hearing
2022/09/11  00:00:00,Spain's Easy EP Teams Up With Carta Worldwide To Support Southern European Fintech Sector - Crowdfund Insider
2022/09/11  00:00:00,"Preston Hollow: North of Walnut Hill, residents have it made in the shade"
2022/09/11  00:00:00,MOOTH: Possibilities to alleviate teacher shortage
2022/09/11  00:00:00,Queen Elizabeth II's corgis will go to her son Prince Andrew and his ex-wife
2022/09/11  00:00:00,Photos: Jones Dairy Farm and its 1922 barn
2022/09/11  00:00:00,Thoughts on Over-Order Premium Hearings From Pa. Milk Marketing Board
2022/09/11  00:00:00,MLB roundup: Albert Pujols clubs HR No. 696
2022/09/11  00:00:00,Eighteen showcases state of art lifestyle in Dubai - Pakistan Observer
2022/09/11  00:00:00,Governor appoints permanent VCs for four universities - Pakistan Observer
2022/09/11  00:00:00,Railways restores train operations upto Rohri - Pakistan Observer
2022/09/11  00:00:00,Chelum of Hazrat Imam Hussain observed - Pakistan Observer
2022/09/11  00:00:00,"17 bids to smuggle wheat, flour foiled; 9,424 bags confiscated - Pakistan Observer"
2022/09/11  00:00:00,Queen's Cortege: Gamekeepers to move Queen's coffin from Balmoral ballroom on her final journey
2022/09/11  00:00:00,AP News in Brief at 12:04 a.m. EDT
2022/09/11  00:00:00,Saturday Magazine independent candidate for Kew Sophie Torney
2022/09/11  00:00:00,First and only responders: Ukrainian firefighters at the front
2022/09/11  00:00:00,"Hogs run wild: Arkansas up to the task, carve Gamecocks"
2022/09/11  00:00:00,"China sends college students to quarantine under zero-COVID | The Asahi Shimbun: Breaking News, Japan News and Analysis"
2022/09/11  00:00:00,"Halifax, Nova Scotia | THE COAST"
2022/09/11  00:00:00,"Pearl Jam Play New York City's Apollo Theater: Photos, Set List"
2022/09/11  00:00:00,Real Madrid Player Ratings vs Real Mallorca
2022/09/11  00:00:00,The Burmese Way to Fascism --- Asia Pacific Media Service
2022/09/11  00:00:00,"21st Austria weekly - Andritz, Valneva, FACC, CA Immo (08/09/2022) | boerse-social.com"
2022/09/11  00:00:00,"Darlings - Film Cast, Release Date, Darlings Full Movie Download, Online MP3 Songs, HD Trailer | Bollywood Life"
2022/09/11  00:00:00,Continuing List To Show Everyones Latest Acquisitions - Page 469 - Coin Community Forum
2022/09/11  00:00:00,1864 2 Cent Guess The Grade - Coin Community Forum
2022/09/11  00:00:00,Question For Coin Hoarders - Page 2 - Coin Community Forum
2022/09/11  00:00:00,Dark Scars & Blisters On Each Face Of The 1982 P Lincoln Memorial Cent / LMC - Coin Community Forum
2022/09/11  00:00:00,Anson Williams and Jackie Gerkin | Married Divorced Children Ex
2022/09/11  00:00:00,Universal breeding index needed for both dairy and beef farmers
2022/09/11  00:00:00,King Charles divides over one issue
2022/09/11  00:00:00,Black Fern Kendra Cocksedge is allowing herself a brief moment of reflection as she hangs up her domestic boots - 11-Sep-2022
2022/09/11  00:00:00,Natalie Lawrence is the new A-League football coach at the Wellington Phoenix - 12-Sep-2022
2022/09/11  00:00:00,"InvestEgate | Company Announcements | Home | FTSE 100, 250, AIM, techMARK"
2022/09/11  00:00:00,Kids To Get the Best CS Teachers $15/Hr Can Buy - Slashdot
2022/09/11  00:00:00,Legislative Assembly of Tonga | Fale Alea o Tonga
2022/09/11  00:00:00,"Rabiu Kwankwaso not stepping down for Atiku, Tinubu - P.M. News"
2022/09/11  00:00:00,Obidients are more like a loose canon than a guided missile - P.M. News
2022/09/11  00:00:00,La Vetta #34946 Rental Property Det...
2022/09/11  00:00:00,What they're saying in Russia about Ukraine's advances
2022/09/11  00:00:00,Skuxx Food | Tandoori Chicken Flatbreads
2022/09/11  00:00:00,"OPC, Fulani group trade words over attacks in Kwara"
2022/09/11  00:00:00,EPL: Premier League could swap venues for next weekend's fixtures
2022/09/11  00:00:00,"Niger Gov, Sani Bello eulogises Etsu Nupe at 70"
2022/09/11  00:00:00,"Traffic Collision, Ambulance En Route at 0 Myrtle Ave"
2022/09/11  00:00:00,EXPLAINER: The intel review of documents at Trump's estate
2022/09/11  00:00:00,Yankees OF Harrison Bader (foot) to start rehab assignment
2022/09/11  00:00:00,"Texans sign Demone Harris, Kevin Pierre-Louis to active roster | NewsRadio 740 KTRH"
2022/09/11  00:00:00,Switzerland Says Area near Germany to Be Proposed for Nuclear Waste Site - Other Media news - Tasnim News Agency
2022/09/11  00:00:00,RASHID KHAN & ADAM HOSE PLAYING IN THIS HERO CPL 2022 | The Bajan Reporter
2022/09/11  00:00:00,Swathi Moorthy news: Read stories by Swathi Moorthy on The Economic Times
2022/09/11  00:00:00,Consultations underway with stakeholders for making national e-commerce policy: DPIIT secretary Anurag Jain
2022/09/11  00:00:00,Queen Elizabeth II's coffin takes long road through Scotland
2022/09/11  00:00:00,About The Mark Moss Show | The Patriot KEIB AM 1150
2022/09/11  00:00:00,SP-JD(U) poster dares Modi government | India News - Times of India
2022/09/11  00:00:00,Karnataka: Academy wants Konkani till class 5 in schools | Mangaluru News - Times of India
2022/09/11  00:00:00,Ambient Air Cleaning Project To Be Tested In Pandesara Gidc | Surat News - Times of India
2022/09/11  00:00:00,Times of India Newsletter Signup & Subscription | News Subscription Online
2022/09/11  00:00:00,"1,200 gifts received by PM to be auctioned, proceeds to go for Namami Ganga project | India News - Times of India"
2022/09/11  00:00:00,Resolutum Global Leverages Medrio To Succeed In A Complex Phase 1 Oncology Study
2022/09/11  00:00:00,Method Migration Of Size-Exclusion And Ion- Exchange Methods For Monoclonal Antibody Analysis From HPLC To The Arc Premier System
2022/09/11  00:00:00,Purdue and Indiana University split joint venture at IUPUI
2022/09/11  00:00:00,NGO: Venezuela's food basket costs more than 21 times the minimum wage - La Prensa Latina Media
2022/09/11  00:00:00,"EDP - Energias de Portugal, S.A. informs: Conclusion of Asset Rotation Deal of a 172 MW Wind Portfolio in Italy | MarketScreener"
2022/09/11  00:00:00,Patrick Wisdom - MLB Trade Rumors
2022/09/11  00:00:00,Kohei Arihara - MLB Trade Rumors
2022/09/11  00:00:00,New Thermal & Heating Equipment Products
2022/09/11  00:00:00,PublicRadioFan.com - Listings by program: Science Hour
2022/09/11  00:00:00,PublicRadioFan.com - Listings by program: Jazz on the Latin Side
2022/09/11  00:00:00,PublicRadioFan.com - Listings by station: KAWC
2022/09/11  00:00:00,PublicRadioFan.com - Listings by station: KAJX
2022/09/11  00:00:00,PublicRadioFan.com - Listings by station: WCNY
2022/09/11  00:00:00,PublicRadioFan.com - Listings by station: WTIP
2022/09/11  00:00:00,PublicRadioFan.com - Listings by station: Campus FM
2022/09/11  00:00:00,PublicRadioFan.com - Listings by program: Jazz America
2022/09/11  00:00:00,PublicRadioFan.com - Listings by program: Documentary (BBC WS)
2022/09/11  00:00:00,PublicRadioFan.com - Listings by program: Cross Country Checkup
2022/09/11  00:00:00,PublicRadioFan.com - Listings by program: Woody's Children
2022/09/11  00:00:00,PublicRadioFan.com - Listings by program: Classical 24 with Melissa Ousley
2022/09/11  00:00:00,PublicRadioFan.com - Listings by program: Dave's World
2022/09/11  00:00:00,PublicRadioFan.com - Listings by program: XPN Music Mix
2022/09/11  00:00:00,PublicRadioFan.com - Listings by station: KRWG
2022/09/11  00:00:00,PublicRadioFan.com - Listings by program: Hidden Brain
2022/09/11  00:00:00,PublicRadioFan.com - Listings by program: Snap Judgment
2022/09/11  00:00:00,PublicRadioFan.com - Listings by station: KCRW 3
2022/09/11  00:00:00,PublicRadioFan.com - Listings by program: The Story (BBC WS)
2022/09/11  00:00:00,PublicRadioFan.com - Listings by program: Stuart Maconie's Freak Zone
2022/09/11  00:00:00,PublicRadioFan.com - Listings by station: WOI-AM (IPR News)
2022/09/11  00:00:00,amor tag | Blogs El Espectador
2022/09/11  00:00:00,A Quarterly of Criticism and Review
2022/09/11  00:00:00,"China science, technology news summary -- Sept. 11"
2022/09/11  00:00:00,AP News Summary at 9:15 p.m. EDT
2022/09/11  00:00:00,Queen Elizabeth II's coffin takes long road through Scotland
2022/09/11  00:00:00,Astro Bob: Jupiter-moon mash-up / BlueWalker 3 stalks the sky
2022/09/11  00:00:00,Roadworks leave residents with two mile drive to their homes
2022/09/11  00:00:00,Popular Starbucks Coffee Drink Faces Recall
2022/09/11  00:00:00,Central Iowa farm to host field days on perennial groundcover in corn and soybeans
2022/09/11  00:00:00,PUBLIC MEETINGS SCHEDULED AT SEVER MISSOURI STATE PARKS AND HISTORIC SITES
2022/09/11  00:00:00,Kyprios makes class count in Irish St Leger
2022/09/11  00:00:00,Iran's Raisi to attend SCO Summit in Uzbekistan
2022/09/11  00:00:00,Nebraska Fires Coach Scott Frost: Report | News Talk 99.5 WRNO
2022/09/11  00:00:00,Charles asks for removal of offending pen holder
2022/09/11  00:00:00,Strictly's Rose visits dance partner Giovanni's family in Sicily
2022/09/11  00:00:00,Itsuptoyou Upsets In P.E.I. Colt Stakes
2022/09/11  00:00:00,"TTP, al Qaeda militants arrested in Karachi, weapons recovered | The Express Tribune"
2022/09/11  00:00:00,Kruse's days at Wolfsburg are over: Kovac | The Express Tribune
2022/09/11  00:00:00,"Emerging, a tripolar world | The Express Tribune"
2022/09/11  00:00:00,Terms of Use - The Islamic Monthly
2022/09/11  00:00:00,"Davide Mastracci, Author at The Islamic Monthly"
2022/09/11  00:00:00,Ukraine pushes Russia into retreat in counteroffensive
2022/09/11  00:00:00,Professor Akshaya Vijayalakshmi and Professor Pritha Dev and Professor Vaibhavi Kulkarni Blog - Times of India Blog
2022/09/11  00:00:00,Outside Mullinger Comes to the Lakes Area
2022/09/11  00:00:00,Charles to carry out engagements in Northern Ireland on Tuesday
2022/09/11  00:00:00,"Tyne Bridge - News, views, gossip, pictures, video"
2022/09/11  00:00:00,"Plant Tour: Holland Composites, Lelystad, Netherlands"
2022/09/11  00:00:00,UMS starts mobile rural health service | Daily Express Online - Sabah's Leading News Portal
2022/09/11  00:00:00,Keeno666's Public Profile Page on ExtraLunchMoney
2022/09/11  00:00:00,Sarah Aroeste | Jewish Rock Radio
2022/09/11  00:00:00,"Terror Links: Nigerian Secret Police, DSS Detains, Grills Terrorists' Negotiator, Mamu's Worker"
2022/09/11  00:00:00,Our Author Catalog | Telemachus Press
2022/09/11  00:00:00,"Albert Pujols - Bio, News, Photos - Washington Times"
2022/09/11  00:00:00,"Visa, Mastercard, AmEx to start categorizing gun shop sales"
2022/09/11  00:00:00,Sidhu Moose Wala case: Deepak Munda with 2 associates taken to Mansa
2022/09/11  00:00:00,"Sterling Shepard active, Kayvon Thibodeaux inactive for Giants"
2022/09/11  00:00:00,"Security Product Integration Services Market Scope and overview, To Develop with Increased Global Emphasis on Industrialization 2029 | Johnson Controls, Convergint Technologies, ADT"
2022/09/11  00:00:00,"Rangers call up RHP Tyson Miller, DFA Kohei Arihara"
2022/09/11  00:00:00,"Karnataka: 1,24,740 cusec water released from Sonna Barrage due to heavy rain"
2022/09/11  00:00:00,AP News in Brief at 12:04 a.m. EDT
2022/09/11  00:00:00,Russia hits power stations after Ukraine counter-offensive
2022/09/11  00:00:00,Russian troops retreat after Ukraine counteroffensive
2022/09/11  00:00:00,"Photos: Faces and Places, September 11, 2022"
2022/09/11  00:00:00,At least three months required to drain out floodwater in Sindh: CM
2022/09/11  00:00:00,"WSU pulls off stunner, knocks off No. 19 Wisconsin"
2022/09/11  00:00:00,I infuse fruits in my water bottles - Abayomi Odunola The Nation Newspaper
2022/09/11  00:00:00,Crises forge Beshear's role as Kentucky's consoler in chief
2022/09/11  00:00:00,Randi Economou | Twin Cities Business
2022/09/11  00:00:00,FOWLER: Protect time with unique approach to no
2022/09/11  00:00:00,Personal Lines Underwriter - Insurance Carrier - 100% REMOTE at Work At Home Vintage Experts / Insurance Journal Jobs
2022/09/11  00:00:00,Insurance - MGA - Commercial and Personal Lines Underwriter - 100% REMOTE at Work At Home Vintage Experts / Insurance Journal Jobs
2022/09/11  00:00:00,Insurance - Data Analyst - REMOTE at Work At Home Vintage Experts / Insurance Journal Jobs
2022/09/11  00:00:00,Ilary Blasi risponde a Francesco Totti: ecco cosa ha detto
2022/09/11  00:00:00,Softball-16 inch: Varsity vs. Chicago (Kennedy) (Away)
2022/09/11  00:00:00,Fire hydrant sign | Model Engineer
2022/09/11  00:00:00,"Quake info: Strong mag. 5.2 earthquake - 0.9 km east of Leon, Nicaragua, on Tuesday, Sep 6, 2022 at 1:35 am (GMT -6) - 156 user experience reports"
2022/09/11  00:00:00,GA English on Sunday: News in Brief from Bonn and the region
2022/09/11  00:00:00,"Visa, Mastercard, AmEx to start categorizing gun shop sales"
2022/09/11  00:00:00,Editorials Archives - Riverhead News Review
2022/09/11  00:00:00,Keeping their cool: Fan drive aids local Meals on Wheels clients
2022/09/11  00:00:00,"Carlos III y Truss, en Buckingham: la Casa Real muestra muy pocas veces la escena de este viernes"
