date,title
2022/01/06  00:00:00,Muni Market's Regulator Is Seeking Standards for Disclosure on ESG Debt: Joe Mysak
2022/01/06  00:00:00,A guide to URs spring opening plans
2022/01/06  00:00:00,China Initiative: Effect Of Espionage Mission's Drift From Focus
2022/01/06  00:00:00,"Quick hits: Illinois news in brief for Wednesday, Jan. 5, 2022"
2022/01/06  00:00:00,State health officials discuss learning to live with COVID
2022/01/06  00:00:00,"Advocates, good government groups parse N.Y. Gov. Hochuls COVID recovery plans, policy proposals"
2022/01/06  00:00:00,Food Adventures in Cole Camp  Calgaros Pizza
2022/01/06  00:00:00,Quebec still aiming for Jan.17 return to class
2022/01/06  00:00:00,"Business in the 318: Minden featured on HGTV, Louisiana businessman facing 15 years of prison"
2022/01/06  00:00:00,"Colorado Cat Hides in Recliner, Donates Itself to Thrift Store"
2022/01/06  00:00:00,COVID Surge Prompts Return To Virtual Meetings For Claremont
2022/01/06  00:00:00,Task Force on Domestic Violence Cases to hold meetings open to the public
2022/01/06  00:00:00,Prince Andrew 'asked Emily Maitlis if he should mention he couldn't sweat in their Newsnight interview'
2022/01/06  00:00:00,Pima County faces 'stark upswing' in COVID cases as officials prep for Omicronvariant
2022/01/06  00:00:00,"Alabama House GOP priorities: Permitless carry, critical race theory, pay raises"
2022/01/06  00:00:00,'Political hand grenade': Family sues Mayo Clinic in Jacksonville to allow ivermectin for dying COVID patient
2022/01/06  00:00:00,FBR to launch National Sales Tax Return
2022/01/06  00:00:00,Violinist Xie Nan to perform with her students
2022/01/06  00:00:00,The 355 Featurette Previews Unique Choreography and Fight Scenes
2022/01/06  00:00:00,"5 takeaways from the Capitol riot criminal cases, one year later"
2022/01/06  00:00:00,Missouri Attorney General Eric Schmitt files lawsuit over St. Louis County's latest mask mandate
2022/01/06  00:00:00,Secretary Antony J. Blinken and German Foreign Minister Annalena Baerbock at a Joint Press Availability
2022/01/06  00:00:00,RSU Radio Partners with Osage Nation to launch podcast
2022/01/06  00:00:00,North Carolina's Research Triangle Park to Expand by 109 Acres
2022/01/06  00:00:00,Wanxiang Blockchain Launches Vena Consortium to Build One-Stop Digitalization Solutions for Enterprises
2022/01/06  00:00:00,A guide to URs spring opening plans
2022/01/06  00:00:00,PNP to file complaint vs another quarantine violator if probable cause found
2022/01/06  00:00:00,"Tong, Lamont file petition in case against SALT tax caps"
2022/01/06  00:00:00,Prince Andrew 'asked Emily Maitlis if he should mention he couldn't sweat in their Newsnight interview'
2022/01/06  00:00:00,Oregon USDA hosts Beginning Farmer Ranchers: In The Know
2022/01/06  00:00:00,Governor schedules Thursday news conference to discuss COVID surge
2022/01/06  00:00:00,"Biden, Harris to visit Atlanta Tuesday to discuss right to vote legislation"
2022/01/06  00:00:00,Lt Gen Sengupta new chief of crucial 14 Corps amid LAC row
2022/01/06  00:00:00,Pima County faces 'stark upswing' in COVID cases as officials prep for Omicronvariant
2022/01/06  00:00:00,Unions Take Biden To Court Over COVID Protections For Health Care Workers
2022/01/06  00:00:00,Department of Education hosting webinar for Advanced Opportunities program
2022/01/06  00:00:00,Medical Service Corps Officer Serves in Alaska Air Guard
2022/01/06  00:00:00,Meet Jordan Imhoff: the Vermont National Guards new psychological health coordinator
2022/01/06  00:00:00,Secretary Antony J. Blinken and German Foreign Minister Annalena Baerbock at a Joint Press Availability
2022/01/06  00:00:00,Ross County adjusts COVID-19 return-to-work policy for employees
2022/01/06  00:00:00,Honolulu Caps Capacity of Large Indoor Events To Slow Covid Spread
2022/01/06  00:00:00,US Deputy Secretary Sherman's call with Georgian FM Zalkaliani
2022/01/06  00:00:00,Meet the police dogs sniffing out COVID-19 at Massachusetts schools
2022/01/06  00:00:00,Mask policies being revisited at  school districts across the Cape Fear
2022/01/06  00:00:00,Matt King Launches Campaign for Ohio House
2022/01/06  00:00:00,"ABSL Mutual Fund to launch silver ETF, FOF"
2022/01/06  00:00:00,News briefs: Ohio EMA offers rebates to homeowners for Tornado Safe Rooms
2022/01/06  00:00:00,"Pandemic Sidelines Police, Fire and Teachers in California"
2022/01/06  00:00:00,Avalanche activate defenseman Ryan Murray from long-term injured reserve
2022/01/06  00:00:00,Needham police attend seminar on fatal police shootings
2022/01/06  00:00:00,Arkansas hospitals seeing more children with COVID-19
2022/01/06  00:00:00,A guide to URs spring opening plans
2022/01/06  00:00:00,"5 takeaways from the Capitol riot criminal cases, one year later"
2022/01/06  00:00:00,ACHI: Number of Arkansas school districts in high-infection zones quintuple
2022/01/06  00:00:00,Google Under Closer Scrutiny From German Antitrust Watchdog
2022/01/06  00:00:00,Postal Service Seeks Temporary Exemption From Biden's Vaccine-or-Test Mandate
2022/01/06  00:00:00,Federal judges hear testimony in Alabama redistricting lawsuit
2022/01/06  00:00:00,US Deputy Secretary Sherman's call with Georgian FM Zalkaliani
2022/01/06  00:00:00,Honolulu Caps Capacity of Large Indoor Events To Slow Covid Spread
2022/01/06  00:00:00,CCISD partners with City-County Health District to administer vaccines
2022/01/06  00:00:00,"Sherry Gay-Dagnogo, Shri Thanedar announce runs to replace US Rep Brenda Lawrence"
2022/01/06  00:00:00,Pima County faces 'stark upswing' in COVID cases as officials prep for Omicronvariant
2022/01/06  00:00:00,CCPH reports COVID-19 surge from various factors
2022/01/06  00:00:00,"Ann Coulter: The Great Epstein Cover-up, Part I"
2022/01/06  00:00:00,San Diego Senior Citizens Brace for Omicron Wave
2022/01/06  00:00:00,Long-term care confronts the omicron wave
2022/01/06  00:00:00,Muni Market's Regulator Is Seeking Standards for Disclosure on ESG Debt: Joe Mysak
2022/01/06  00:00:00,One million visits to YourSuper comparison tool
2022/01/06  00:00:00,"Chinese, Eritrean FMs issue joint statement"
2022/01/06  00:00:00,Japanese FM requests curfew for U.S. bases amid rampant COVID-19 spread
2022/01/06  00:00:00,South Dakota Army National Guard deploys to Cuba
2022/01/06  00:00:00,"Quick hits: Illinois news in brief for Wednesday, Jan. 5, 2022"
2022/01/06  00:00:00,10 Real People Who Died Searching For Mythical Places
2022/01/06  00:00:00,China Initiative: Effect Of Espionage Mission's Drift From Focus
2022/01/06  00:00:00,Full Gear motorcycle safety program heads north
2022/01/06  00:00:00,County allots federal COVID relief dollars
2022/01/06  00:00:00,"5 takeaways from the Capitol riot criminal cases, one year later"
2022/01/06  00:00:00,Manchester Selectboard hears case for cannabis
2022/01/06  00:00:00,Maine Supreme Court to weigh in on suit against anti-CMP corridor law
2022/01/06  00:00:00,Colorado Edition: Western Slope voters in new district; Arizona water cutbacks; high country COVID-19; housing for Marshall Fire survivors
2022/01/06  00:00:00,NM Game& Fish Offers Online Webinars for Big Game Draws
2022/01/06  00:00:00,Robot tractors may be heading to a farm near you
2022/01/06  00:00:00,Avalanche activate defenseman Ryan Murray from long-term injured reserve
2022/01/06  00:00:00,Christina Witham files for county commissioner
2022/01/06  00:00:00,Coloradans Say Suncor Is Making Them Sick. Cultivando Intends to Prove It
2022/01/06  00:00:00,Capitol Riot: Arizona representatives look back on year since January 6 insurrection
2022/01/06  00:00:00,Complicated Covid protocols hassling arriving passengers: Vietnamese airlines
2022/01/06  00:00:00,Deputy Chief of Turkish General Staff calls on CJCSC
2022/01/06  00:00:00,Two questions from the Jan. 6 Capitol riot
2022/01/06  00:00:00,Search - Built to Spill :: Live
2022/01/06  00:00:00,Needham police attend seminar on fatal police shootings
2022/01/06  00:00:00,"Business in the 318: Minden featured on HGTV, Louisiana businessman facing 15 years of prison"
2022/01/06  00:00:00,Secretary Antony J. Blinken and German Foreign Minister Annalena Baerbock at a Joint Press Availability
2022/01/06  00:00:00,Labor releases Covid Response Framework for Tasmania
2022/01/06  00:00:00,Banks slice bond holdings in response to APRA liquidity order
2022/01/06  00:00:00,China Tech Digest: Chinas Sky Eye FAST Detects About 500 New Pulsars; Chinese Residents Can Order Food Deliveries In Digital RMB
2022/01/06  00:00:00,Israel becomes test case for fourth vaccine shot amid record cases
2022/01/06  00:00:00,"5 takeaways from the Capitol riot criminal cases, one year later"
2022/01/06  00:00:00,10 Real People Who Died Searching For Mythical Places
2022/01/06  00:00:00,Avalanche Watch issued in Northwest Montana
2022/01/06  00:00:00,Missouri Attorney General Eric Schmitt files lawsuit over St. Louis County's latest mask mandate
2022/01/06  00:00:00,"Feeney, Steiner field questions at forum ahead of Jan. 11 special election"
2022/01/06  00:00:00,Gadkari lays foundation of six-lanebridge over Ganga in Shringverpur
2022/01/06  00:00:00,"Alabama House GOP priorities: Permitless carry, critical race theory, pay raises"
2022/01/06  00:00:00,"Quick hits: Illinois news in brief for Wednesday, Jan. 5, 2022"
2022/01/06  00:00:00,U.S. Capitol Police intelligence thought Louie Gohmert appeared to encourage violence before insurrection
2022/01/06  00:00:00,Vadodara: 9-month-old baby among five Omicron cases
2022/01/06  00:00:00,Coloradans Say Suncor Is Making Them Sick. Cultivando Intends to Prove It
2022/01/06  00:00:00,Meet the police dogs sniffing out COVID-19 at Massachusetts schools
2022/01/06  00:00:00,Area schools open campuses while preparing for COVID variants
2022/01/06  00:00:00,"During Jan. 6 anniversary remarks, Biden will discuss 'the role his predecessor had,' White House press secretary says"
2022/01/06  00:00:00,"Navajo Nation will send $2,000 to adults and $600 to kids in COVID-19 hardshipaid"
2022/01/06  00:00:00,"ABSL Mutual Fund to launch silver ETF, FOF"
2022/01/06  00:00:00,Banks slice bond holdings in response to APRA liquidity order
2022/01/06  00:00:00,"There are no signs DOJ is looking at Trump and his inner circle, says top Politico reporter"
2022/01/06  00:00:00,San Diego lawmakers reflect on US Capitol insurrection one year later
2022/01/06  00:00:00,Full Gear motorcycle safety program heads north
2022/01/06  00:00:00,"Advocates, good government groups parse N.Y. Gov. Hochuls COVID recovery plans, policy proposals"
2022/01/06  00:00:00,US recommends Pfizer's COVID-19 booster for ages 12 to 15
2022/01/06  00:00:00,Georgia lawmakers present at Capitol during insurrection | Jan. 6 one year later
2022/01/06  00:00:00,Missouri Attorney General Eric Schmitt files lawsuit over St. Louis County's latest mask mandate
2022/01/06  00:00:00,Chinese FM meets with Eritrean FM
2022/01/06  00:00:00,Abrams Planetarium exhibit has pieces of every known meteor to strike Michigan
2022/01/06  00:00:00,"5 takeaways from the Capitol riot criminal cases, one year later"
2022/01/06  00:00:00,Dan Engemann tapped for Missouri Farm Bureau director role
2022/01/06  00:00:00,IAG maintains up to $10b reinsurance program
2022/01/06  00:00:00,Avalanche Watch issued in Northwest Montana
2022/01/06  00:00:00,CDC recommends Pfizer's COVID-19 booster for ages 12 to 15
2022/01/06  00:00:00,Overview of political finance laws in UK and elsewhere
2022/01/06  00:00:00,New York governor touts return of 'Drinks-to-Go' in her 1st (and maybe only) state of the state address
2022/01/06  00:00:00,Long-term care confronts the omicron wave
2022/01/06  00:00:00,Needham police attend seminar on fatal police shootings
2022/01/06  00:00:00,Secretary Antony J. Blinken and German Foreign Minister Annalena Baerbock at a Joint Press Availability
2022/01/06  00:00:00,PAC asks DISCOs to transfer long-serving officials
2022/01/06  00:00:00,"Alabama House GOP priorities: Permitless carry, critical race theory, pay raises"
2022/01/06  00:00:00,FBR to launch National Sales Tax Return
2022/01/06  00:00:00,"Quick hits: Illinois news in brief for Wednesday, Jan. 5, 2022"
2022/01/06  00:00:00,Department of Education hosting webinar for Advanced Opportunities program
2022/01/06  00:00:00,ACHI: Number of Arkansas school districts in high-infection zones quintuple
2022/01/06  00:00:00,HK to build up offshore renminbi assets market
2022/01/06  00:00:00,Toyota CMO promoted to lead Lexus Australia
2022/01/06  00:00:00,Bob the miniature dishwasher can wash and dry a small load of dishes in 20 minutes
2022/01/06  00:00:00,2 reporters who were in the Capitol on Jan. 6 talk about media coverage of the attack
2022/01/06  00:00:00,BlackRock Identifies Factors Fueling the Growth of Private Equity
2022/01/06  00:00:00,"Navajo Nation will send $2,000 to adults and $600 to kids in COVID-19 hardshipaid"
2022/01/06  00:00:00,TRIUMPH BONNEVILLE 900 Bikes for Sale
2022/01/06  00:00:00,Overview of political finance laws in UK and elsewhere
2022/01/06  00:00:00,Harris aide heads to Capitol Hill as exodus from vice presidents office continues
2022/01/06  00:00:00,China Tech Digest: Chinas Sky Eye FAST Detects About 500 New Pulsars; Chinese Residents Can Order Food Deliveries In Digital RMB
2022/01/06  00:00:00,"Coops anchor Odette relief, rehab in Bucas Grande"
2022/01/06  00:00:00,"Tong, Lamont file petition in case against SALT tax caps"
2022/01/06  00:00:00,Angel and Julia Diaz open dine-in business in Fairfield
2022/01/06  00:00:00,Secretary Antony J. Blinken and German Foreign Minister Annalena Baerbock at a Joint Press Availability
2022/01/06  00:00:00,PM chairs meeting on Lahore road projects
2022/01/06  00:00:00,Pro-Mandate Rep. Eric Swalwell Spotted Maskless in Florida
2022/01/06  00:00:00,Chinese FM meets with Eritrean FM
2022/01/06  00:00:00,COVID-19: Japan seeks restrictions on US troops after virus surge
2022/01/06  00:00:00,Chinese scientists use telecom optical fiber to monitor aftershocks
2022/01/06  00:00:00,Jones County High School administrators to begin random screening with metal detecting wands
2022/01/06  00:00:00,CRT Testimony Heard in Senate Committee Hearing on Education Bill
2022/01/06  00:00:00,10 Real People Who Died Searching For Mythical Places
2022/01/06  00:00:00,State health officials discuss learning to live with COVID
2022/01/06  00:00:00,US recommends Pfizer's COVID-19 booster for ages 12 to 15
2022/01/06  00:00:00,CDC recommends Pfizer/BioNTech Covid-19 vaccine boosters for children as young as 12
2022/01/06  00:00:00,2 Omicron cases detected in Aligarh
2022/01/06  00:00:00,THE TEARS OF A CLOWNS SUPPORTERS
2022/01/06  00:00:00,Neher to run for Sheriff of Klickitat County
2022/01/06  00:00:00,"In their first debate, Pa. GOP gov. candidates promise lower taxes, school choice"
2022/01/06  00:00:00,Harris aide heads to Capitol Hill as exodus from vice presidents office continues
2022/01/06  00:00:00,Attorneys for accused murderer Brad Scott Compher question determination of state expert
2022/01/06  00:00:00,San Diego lawmakers reflect on US Capitol insurrection one year later
2022/01/06  00:00:00,Georgia lawmakers present at Capitol during insurrection | Jan. 6 one year later
2022/01/06  00:00:00,"Cavushoglu, Stoltenberg hold phone call ahead of critical NATO talks"
2022/01/06  00:00:00,Capitol Police Chief says force sure 'to get tested again'
2022/01/06  00:00:00,"Texas 1836 Project to Examine States History, Future"
2022/01/06  00:00:00,"Boston mayor cites unvaccinated toll on hospitals, schools"
2022/01/06  00:00:00,Roundup: Jen Racca candidacy / G2 Net-Zero / ExxonMobil discovery
2022/01/06  00:00:00,Japanese FM requests curfew for U.S. bases amid rampant COVID-19 spread
2022/01/06  00:00:00,"Madison mayor takes look forward, back in 2022 address"
2022/01/06  00:00:00,Stocking loans an option for buying fertiliser
2022/01/06  00:00:00,"Ann Coulter: The Great Epstein Cover-up, Part I"
2022/01/06  00:00:00,10 Real People Who Died Searching For Mythical Places
2022/01/06  00:00:00,Cyberspace Solarium Commission to Reboot as a Non-Profit
2022/01/06  00:00:00,History Inoculation: OSU professor draws parallels of two pandemics 100 years apart
2022/01/06  00:00:00,Department of Education hosting webinar for Advanced Opportunities program
2022/01/06  00:00:00,Retired Army Lt. Col. Carroll Swain left mark on Roanoke government
2022/01/06  00:00:00,Secretary Antony J. Blinken and German Foreign Minister Annalena Baerbock at a Joint Press Availability
2022/01/06  00:00:00,COVID-19 testing traffic blocks access to Kingston businesses
2022/01/06  00:00:00,U.S. bases in Japan requested to impose curfews amid COVID spread
2022/01/06  00:00:00,Overview of political finance laws in UK and elsewhere
2022/01/06  00:00:00,PM looks forward to scrutiny of PPP and PML-Ns funding
2022/01/06  00:00:00,Scientists estimate transmission advantage of Omicron over Delta variant as +105%
2022/01/06  00:00:00,Hotel JEN extends partnership with digital agency for social media work
2022/01/06  00:00:00,CSTO Collective Security Council to deploy peacekeeping forces to Kazakhstan
2022/01/06  00:00:00,Telangana likely to impose Covid curfews again
2022/01/06  00:00:00,Task Force on Domestic Violence Cases to hold meetings open to the public
2022/01/06  00:00:00,"Tong, Lamont file petition in case against SALT tax caps"
2022/01/06  00:00:00,Pro-Mandate Rep. Eric Swalwell Spotted Maskless in Florida
2022/01/06  00:00:00,KWs Brooke Lijewski Signs with Dawson College
2022/01/06  00:00:00,"Stocks in the news: GAIL, Vedanta, NHPC, RBL Bank and Spandana Sphoorty"
2022/01/06  00:00:00,Manchester Selectboard hears case for cannabis
2022/01/06  00:00:00,"When Princeton imposes a mandate, it should show its work"
2022/01/06  00:00:00,PAC asks DISCOs to transfer long-serving officials
2022/01/06  00:00:00,Education Station: Artist brings African-American figurines to Charles Dickens Elementary School students
2022/01/06  00:00:00,Iraq to buy Exxon stake in West Qurna 1
2022/01/06  00:00:00,Oregon USDA hosts Beginning Farmer Ranchers: In The Know
2022/01/06  00:00:00,"During Jan. 6 anniversary remarks, Biden will discuss 'the role his predecessor had,' White House press secretary says"
2022/01/06  00:00:00,"5 takeaways from the Capitol riot criminal cases, one year later"
2022/01/06  00:00:00,COVID-19: Jammu and Kashmir govt imposes complete restrictions on non-essential movement from 9 pm to 6 am
2022/01/06  00:00:00,Chinese FM meets with Eritrean FM
2022/01/06  00:00:00,10 Real People Who Died Searching For Mythical Places
2022/01/06  00:00:00,Live At The Linda featuring Biscuits 'N' Gravy and Alexis P. Suter
2022/01/06  00:00:00,Cyberspace Solarium Commission to Reboot as a Non-Profit
2022/01/06  00:00:00,"COVID prompts child care, virtual learning changes"
2022/01/06  00:00:00,Japanese FM requests curfew for U.S. bases amid rampant COVID-19 spread
2022/01/06  00:00:00,"Ekiti 2022: Vote for Competent Person, Not Opportunist, Bishop Tells Electorate"
2022/01/06  00:00:00,Blinken speaks with Lapid amid fresh round of talks on Irans nuclear program
2022/01/06  00:00:00,"In their first debate, Pa. GOP gov. candidates promise lower taxes, school choice"
2022/01/06  00:00:00,FBR to launch National Sales Tax Return
2022/01/06  00:00:00,Unvaccinated staff spread COVID-19 in California prisons
2022/01/06  00:00:00,PAC asks DISCOs to transfer long-serving officials
2022/01/06  00:00:00,"Three varsities sign MoU for education, research"
2022/01/06  00:00:00,Pro-Mandate Rep. Eric Swalwell Spotted Maskless in Florida
2022/01/06  00:00:00,Needham police attend seminar on fatal police shootings
2022/01/06  00:00:00,Deputy Chief of Turkish General Staff calls on CJCSC
2022/01/06  00:00:00,"Boston mayor cites unvaccinated toll on hospitals, schools"
2022/01/06  00:00:00,Fox News and Sean Hannity have a big Jan. 6 problem
2022/01/06  00:00:00,"Rukamani Devi Nishad, Sister Of 'Bandit Queen' Phoolan Devi, Joins Samajwadi Party"
2022/01/06  00:00:00,"Senate probes BPE, alleges unremitted $679.4m rent on ports concession"
2022/01/06  00:00:00,Detained PDP Chief Mehbooba Mufti To Meet Party Delegation On Monday
2022/01/06  00:00:00,RSU Radio Partners with Osage Nation to launch podcast
2022/01/06  00:00:00,Roundup: Jen Racca candidacy / G2 Net-Zero / ExxonMobil discovery
2022/01/06  00:00:00,Cyberspace Solarium Commission to Reboot as a Non-Profit
2022/01/06  00:00:00,Fayetteville Police arrest Tulsa homicide suspects
2022/01/06  00:00:00,Brucellosis found in Montana cattle herd
2022/01/06  00:00:00,CSTO Collective Security Council to deploy peacekeeping forces to Kazakhstan
2022/01/06  00:00:00,10 Real People Who Died Searching For Mythical Places
2022/01/06  00:00:00,"The Way of The Linguist: A Language Learning Odyssey, Thirty Seven- Resistance to Language Learning"
2022/01/06  00:00:00,"Cavushoglu, Stoltenberg hold phone call ahead of critical NATO talks"
2022/01/06  00:00:00,"Three varsities sign MoU for education, research"
2022/01/06  00:00:00,US recommends Pfizer's COVID-19 booster for ages 12 to 15
2022/01/06  00:00:00,COVID-19: Japan seeks restrictions on US troops after virus surge
2022/01/06  00:00:00,Chinese FM meets with Eritrean FM
2022/01/06  00:00:00,State Assembly Members discuss increasing home care worker pay
2022/01/06  00:00:00,Deputy Chief of Turkish General Staff calls on CJCSC
2022/01/06  00:00:00,Biden to call out Trump on Capitol riot anniversary
2022/01/06  00:00:00,CRT Testimony Heard in Senate Committee Hearing on Education Bill
2022/01/06  00:00:00,"In their first debate, Pa. GOP gov. candidates promise lower taxes, school choice"
2022/01/06  00:00:00,PM looks forward to scrutiny of PPP and PML-Ns funding
2022/01/06  00:00:00,"Feeney, Steiner field questions at forum ahead of Jan. 11 special election"
2022/01/06  00:00:00,NASCAR Hits the Brakes on Lets Go Brandon Cryptocurrency as Sponsor for Brandon Brown
2022/01/06  00:00:00,Robot tractors may be heading to a farm near you
2022/01/06  00:00:00,Ross County adjusts COVID-19 return-to-work policy for employees
2022/01/06  00:00:00,Jim Dey | Illinois Democrats set sights on local judicial races
2022/01/06  00:00:00,Area schools open campuses while preparing for COVID variants
2022/01/06  00:00:00,"Cavushoglu, Stoltenberg hold phone call ahead of critical NATO talks"
2022/01/06  00:00:00,Labor releases Covid Response Framework for Tasmania
2022/01/06  00:00:00,"Peru, Uruguay Edge Closer to Crypto Regulation with Draft Law, Policy Advisory Report"
2022/01/06  00:00:00,San Diego lawmakers reflect on US Capitol insurrection one year later
2022/01/06  00:00:00,Honolulu Caps Capacity of Large Indoor Events To Slow Covid Spread
2022/01/06  00:00:00,10 Montana health care and public health associations campaign for kids ages 5+ to be vaccinated
2022/01/06  00:00:00,budi pradono reinterprets vernacular architecture in rural indonesia
2022/01/06  00:00:00,Rep. Marjorie Taylor Greene Says Shes Racked Up Tens of Thousands in Mask Fines
2022/01/06  00:00:00,"COVID prompts child care, virtual learning changes"
2022/01/06  00:00:00,Analyst outlines Omicron impact on oil demand
2022/01/06  00:00:00,Vadodara: 9-month-old baby among five Omicron cases
2022/01/06  00:00:00,"5 takeaways from the Capitol riot criminal cases, one year later"
2022/01/06  00:00:00,Taiwan floats $200m fund to counter Chinese pressure on Lithuania
2022/01/06  00:00:00,Schumer champions Corning Inc. expansion in Oneonta
2022/01/06  00:00:00,Gujarat: Coronavirus cases in west zone head northwards
2022/01/06  00:00:00,US Attorney General: Officials at Any Level Linked to US Capitol Riot Will Be Pursued
2022/01/06  00:00:00,Jim Dey | Illinois Democrats set sights on local judicial races
2022/01/06  00:00:00,Somalia - Jake Sullivan Must Resolve Biden's Berbera Impasse
2022/01/06  00:00:00,Blinken speaks with Lapid amid fresh round of talks on Irans nuclear program
2022/01/06  00:00:00,"Ciryl Gane dropped Francis Ngannou in sparring, claims Fernand Lopez: Ill release the footage"
2022/01/06  00:00:00,Probe begins into Osun attempted jailbreak
2022/01/06  00:00:00,"Airborne-Unmanned 01.05.21: Kawasaki UAV, Autel EVO-Nano, Next-Gen Reaper"
2022/01/06  00:00:00,Tucker Carlson: Democrats fixation on Jan. 6 reveals their midterm strategy
2022/01/06  00:00:00,"Tong, Lamont file petition in case against SALT tax caps"
2022/01/06  00:00:00,Panama - Calls for Prince Andrew to lose military titles
2022/01/06  00:00:00,Oregon USDA hosts Beginning Farmer Ranchers: In The Know
2022/01/06  00:00:00,State health officials discuss learning to live with COVID
2022/01/06  00:00:00,Secretary Antony J. Blinken and German Foreign Minister Annalena Baerbock at a Joint Press Availability
2022/01/06  00:00:00,"Watch now: Kinzinger rules out run for governor, U.S. senate"
2022/01/06  00:00:00,COVID-19: Japan seeks restrictions on US troops after virus surge
2022/01/06  00:00:00,Lt Gen Sengupta new chief of crucial 14 Corps amid LAC row
2022/01/06  00:00:00,CDC Change: Give Boosters to All Over 12
2022/01/06  00:00:00,Islamic Financial Principles: A Comparative Strength
2022/01/06  00:00:00,"More on the North Korean missile launch - a test-firing of a ""hypersonic"" missile"
2022/01/06  00:00:00,Matt King Launches Campaign for Ohio House
2022/01/06  00:00:00,Georgia lawmakers present at Capitol during insurrection | Jan. 6 one year later
2022/01/06  00:00:00,NASAs James Webb Space Telescope fully deploys its massive sunshield
2022/01/06  00:00:00,SCOTUS Rules 6-3 Biden Admin MUST Reinstate the Remain in Mexico Policy
