date,title
2022/07/03  00:00:00,Magnum photographers challenged to picture Swiss democracy
2022/07/03  00:00:00,"FSM, US meet on Compact of Free Association negotiations"
2022/07/03  00:00:00,U.S. Embassy & Consulate in Kazakhstan
2022/07/03  00:00:00,Reintroduction of controversial Water Resources Bill: Count us out  Benue Govt fumes
2022/07/03  00:00:00,Biden has invited Bongbong Marcos to visit US envoy
2022/07/03  00:00:00,Super American Circus returns to Guam
2022/07/03  00:00:00,Cops find over 115 pounds of ganja at Abary house -labourer held
2022/07/03  00:00:00,Pulitzer-winning Kashmiri journalist Sana Irshad Mattoo stopped from traveling abroad
2022/07/03  00:00:00,High-speed rail: Ruling allows eminent domain use for project
2022/07/03  00:00:00,"Delta Offers $10,000 Incentive for Passengers to Leave Oversold Flight"
2022/07/03  00:00:00,EPL: Chelsea to break bank for 70m-rated star
2022/07/03  00:00:00,Victorias gas shake-up takes aim at household users
2022/07/03  00:00:00,"CM Shinde-camp MLAs, Deputy CM Fadnavis hold meeting in Mumbai"
2022/07/03  00:00:00,Havasu veterans  |   David Eaton: From submarine school to the Lake Havasu City Police Department
2022/07/03  00:00:00,"QFCRA, HBKU's College Of Law Sign Mou"
2022/07/03  00:00:00,Hugo Boss makes F1 return with Aston Martin
2022/07/03  00:00:00,Magnum photographers challenged to picture Swiss democracy
2022/07/03  00:00:00,Kolkata Police issues lookout circular for suspended BJP spokesperson Nupur Sharma
2022/07/03  00:00:00,U.S. Embassy & Consulate in Kazakhstan
2022/07/03  00:00:00,The nation in brief: Tropical Storm Colin forms off Carolinas
2022/07/03  00:00:00,Hezbollah drones challenge possible Israel-Lebanon deal
2022/07/03  00:00:00,"Navi Mumbai: NMMC to inoculate 29,646 against COVID during July, at 225 schools"
2022/07/03  00:00:00,"Medford budget: Mayor's salary used as leverage to restore money for teachers, library"
2022/07/03  00:00:00,"Before he turns off the lights,  Kim Carr has a message for his colleagues"
2022/07/03  00:00:00,Drama as Joe Igbokwe Pulls down Post on Wike Visiting Tinubu in France
2022/07/03  00:00:00,Sterling and Lancaster organists team up to run local Guild of Organists
2022/07/03  00:00:00,Chisago Commissioners take a closer look at Planning Commission makeup
2022/07/03  00:00:00,Bulgaria hiring RMG workers from Bangladesh
2022/07/03  00:00:00,Child Safe Governance Review of Launceston General Hospital and Human Resources
2022/07/03  00:00:00,Covid-19: Nauru records first death; Niue records 10 community cases
2022/07/03  00:00:00,UK not giving up on Hong Kong is 19th-century balderdash
2022/07/03  00:00:00,"Understand Ongkili's speech first, PBS Youth tells Sabah Umno"
2022/07/03  00:00:00,THE VOICE OF VIETNAM - VOV World
2022/07/03  00:00:00,"Brics, G 7 and Putin-Modi tele-conversation: India engaging different poles"
2022/07/03  00:00:00,DNR Gearing Up For Wildfire Season In Washington State
2022/07/03  00:00:00,"Evans Kidero appeals to Uhuru Kenyatta, Raila Odinga for varsity charter"
2022/07/03  00:00:00,Israel sends observers to military drills in Morocco
2022/07/03  00:00:00,Conman Sukesh 'Clandestinely' Sending Letters From Tihar Jail
2022/07/03  00:00:00,Reintroduction of controversial Water Resources Bill: Count us out  Benue Govt fumes
2022/07/03  00:00:00,"Medford budget: Mayor's salary used as leverage to restore money for teachers, library"
2022/07/03  00:00:00,U.S. Embassy & Consulate in Kazakhstan
2022/07/03  00:00:00,"Ganja seized, 3 women arrested in Kamakhya Railway Station"
2022/07/03  00:00:00,Drama as Joe Igbokwe Pulls down Post on Wike Visiting Tinubu in France
2022/07/03  00:00:00,Peace Ambassador Gurudev Sri Sri Ravi Shankar bringing global IStandforPeace campaign to Guyana
2022/07/03  00:00:00,The nation in brief: Tropical Storm Colin forms off Carolinas
2022/07/03  00:00:00,Moeldoko views Pesantren as medium to develop national character
2022/07/03  00:00:00,"Biden team proposes up to 11 oil, gas lease sales"
2022/07/03  00:00:00,"Zelensky's Participation In G20 Summit To Depend On Security Situation In Ukraine, Names Of Participants"
2022/07/03  00:00:00,"At least 3,000 Dead Dolphins in the Black Sea  Military Sonars Blind them"
2022/07/03  00:00:00,"Brics, G 7 and Putin-Modi tele-conversation: India engaging different poles"
2022/07/03  00:00:00,Rains cover country six days ahead: IMD
2022/07/03  00:00:00,Kuwait Finance HouseBahrain Collaborates with the BIBF to Launch Waed Program to Train and Employ Bahraini Graduates
2022/07/03  00:00:00,Dr Zhivagos heroine takes centre stage in plagiarism row
2022/07/03  00:00:00,Israel sends observers to military drills in Morocco
2022/07/03  00:00:00,Turning the lens on the artist's studio
2022/07/03  00:00:00,UK not giving up on Hong Kong is 19th-century balderdash
2022/07/03  00:00:00,"Congress, BJP lock horns over Nupur Sharma's remarks"
2022/07/03  00:00:00,Havasu veterans  |   David Eaton: From submarine school to the Lake Havasu City Police Department
2022/07/03  00:00:00,Kolkata Police issues lookout circular for suspended BJP spokesperson Nupur Sharma
2022/07/03  00:00:00,Drama as Joe Igbokwe Pulls down Post on Wike Visiting Tinubu in France
2022/07/03  00:00:00,"Crime Branch issues notice to Swapna Suresh in conspiracy case, calls her for interrogation"
2022/07/03  00:00:00,THE VOICE OF VIETNAM - VOV World
2022/07/03  00:00:00,"Evans Kidero appeals to Uhuru Kenyatta, Raila Odinga for varsity charter"
2022/07/03  00:00:00,Reintroduction of controversial Water Resources Bill: Count us out  Benue Govt fumes
2022/07/03  00:00:00,Land tops William Ruto and Raila Odinga agenda for Coast
2022/07/03  00:00:00,Covid-19: Nauru records first death; Niue records 10 community cases
2022/07/03  00:00:00,"Before he turns off the lights,  Kim Carr has a message for his colleagues"
2022/07/03  00:00:00,"4 nabbed, drug den dismantled in Leyte"
2022/07/03  00:00:00,Bulgaria hiring RMG workers from Bangladesh
2022/07/03  00:00:00,Hezbollah drones challenge possible Israel-Lebanon deal
2022/07/03  00:00:00,"Brics, G 7 and Putin-Modi tele-conversation: India engaging different poles"
2022/07/03  00:00:00,Access All Areas by Barbara Charone review  my rocknroll friends
2022/07/03  00:00:00,"CJCSC Gen Raza, Iranian president discuss long-lasting defence cooperation"
2022/07/03  00:00:00,Climate change education program echoes in inner city
2022/07/03  00:00:00,Somaliland: Ilig And Abdijabbar Free After 82 Days
2022/07/03  00:00:00,Pulitzer-winning Kashmiri journalist Sana Irshad Mattoo stopped from traveling abroad
2022/07/03  00:00:00,Author observes Charlie Brown through the decades | DON NOBLE
2022/07/03  00:00:00,Havasu veterans  |   David Eaton: From submarine school to the Lake Havasu City Police Department
2022/07/03  00:00:00,North Korea FM spokesman: US creating an Asian NATO with South Korea and Japan
2022/07/03  00:00:00,X-plan question after purchase order without it
2022/07/03  00:00:00,Queries mount as IEBC prepares for August 9 elections
2022/07/03  00:00:00,"Ireland's sailing, boating & maritime magazine"
2022/07/03  00:00:00,Enemy Strikes Villa Quarter In Kyvyi Rih District
2022/07/03  00:00:00,"Zelensky's Participation In G20 Summit To Depend On Security Situation In Ukraine, Names Of Participants"
2022/07/03  00:00:00,Dr Zhivagos heroine takes centre stage in plagiarism row
2022/07/03  00:00:00,"At least 3,000 Dead Dolphins in the Black Sea  Military Sonars Blind them"
2022/07/03  00:00:00,"Reported Kaizer Chiefs target Mayele not for sale, Young Africans SC urge"
2022/07/03  00:00:00,Evelyn Maxwell: A Defender of the Vulnerable
2022/07/03  00:00:00,"Brics, G 7 and Putin-Modi tele-conversation: India engaging different poles"
2022/07/03  00:00:00,Russia's Nord Stream shuts down for ten days for annual maintenance
2022/07/03  00:00:00,THE VOICE OF VIETNAM - VOV World
2022/07/03  00:00:00,Chuck considering second room for Black River courthouse
2022/07/03  00:00:00,Ukraine Hits Russian Base With Over 30 Strikes In Melitopol
2022/07/03  00:00:00,OPINION: Jan. 6 committee is orchestrating a witch hunt
2022/07/03  00:00:00,Climate change education program echoes in inner city
2022/07/03  00:00:00,Access All Areas by Barbara Charone review  my rocknroll friends
2022/07/03  00:00:00,OPINION | REX NELSON: Lyon Colleges gamble
2022/07/03  00:00:00,Author observes Charlie Brown through the decades | DON NOBLE
2022/07/03  00:00:00,BJP's Urdu counter to Gujarati tweets by TRS
2022/07/03  00:00:00,"Medford budget: Mayor's salary used as leverage to restore money for teachers, library"
2022/07/03  00:00:00,"Adaku Ononogbo, Mona Shaikh & Ms. Marvel"
2022/07/03  00:00:00,Flipkart signs MoU with KSDC to provide supply chain operations training
2022/07/03  00:00:00,Madhya Pradesh police investigating pro-Pakistan slogans in Katni
2022/07/03  00:00:00,Chisago Commissioners take a closer look at Planning Commission makeup
2022/07/03  00:00:00,Pulitzer-winning Kashmiri journalist Sana Irshad Mattoo stopped from traveling abroad
2022/07/03  00:00:00,Thoughts on Leadership: Leading Like Duke
2022/07/03  00:00:00,India And Egypt Work Towards Building Strategic Relationship With Focus On Defence And Security
2022/07/03  00:00:00,"Meet professors, PhD holders in Zulums government"
2022/07/03  00:00:00,Villagers in Kurigram put up bamboo wall to control water flow of Brahmaputra River
2022/07/03  00:00:00,Overturned Truck on a Utah Highway Releases At Least 10 Million Bees Into the Air
2022/07/03  00:00:00,Red Arrows schedule today as times and routes for Silverstone and other transit times released
2022/07/03  00:00:00,"Ireland's sailing, boating & maritime magazine"
2022/07/03  00:00:00,Access All Areas by Barbara Charone review  my rocknroll friends
2022/07/03  00:00:00,Power ministry team visits  CIL arm to monitor coal availability
2022/07/03  00:00:00,"During Ideas Fest, SCOTUS decisions a main topic of analysis"
2022/07/03  00:00:00,"Guest opinion: DeSantis, Republicans want to roll back our reproductive rights even further"
2022/07/03  00:00:00,"4 nabbed, drug den dismantled in Leyte"
2022/07/03  00:00:00,"Advisory issued for tourists, pilgrims, truck movement in J&K"
2022/07/03  00:00:00,Tulsa Riverside Airport to formulate long-range vision in master plan
2022/07/03  00:00:00,The life and work of Mary Terrell
2022/07/03  00:00:00,FARAH STOCKMAN: The Democrat who's flipping the campaign script
2022/07/03  00:00:00,"Swan, Bomber, Demon and Crow sanctioned by MRO"
2022/07/03  00:00:00,"Azerbaijani Health Ministry, National Confederation of Entrepreneurs ink MoU"
2022/07/03  00:00:00,Dr Zhivagos heroine takes centre stage in plagiarism row
2022/07/03  00:00:00,"Baku, Prague discuss future ties, regional security issues"
2022/07/03  00:00:00,Russian plant plans to purchase raw materials for pipe coating from Azerbaijan
2022/07/03  00:00:00,US leads int'l passenger interdiction training
2022/07/03  00:00:00,Overturned Truck on a Utah Highway Releases At Least 10 Million Bees Into the Air
2022/07/03  00:00:00,"Ireland's sailing, boating & maritime magazine"
2022/07/03  00:00:00,Indian Embassy in Nepal gifted 75 ambulances to various organizations and 17 buses to various schools
2022/07/03  00:00:00,China's top diplomat Wang Yi visits Myanmar amid opposition protest
2022/07/03  00:00:00,Food-related CIOs plan to form food union
2022/07/03  00:00:00,THE VOICE OF VIETNAM - VOV World
2022/07/03  00:00:00,Trkei scheint Offensive in Nordsyrien zu verschieben
2022/07/03  00:00:00,Thomas Suddes: Roe ruling will give Ohio judicial hopefuls something to discuss besides weather
2022/07/03  00:00:00,COVID & the Global South: the Nigerian Case
2022/07/03  00:00:00,Lapid tells cabinet to conduct itself 'as if there's no elections'
2022/07/03  00:00:00,Area plan reveals the site earmarked for sewage works
2022/07/03  00:00:00,"Guest opinion: DeSantis, Republicans want to roll back our reproductive rights even further"
2022/07/03  00:00:00,"Nebraska Admirals Association, Grand Island Port"
2022/07/03  00:00:00,Tri-Valley innovation: Monitoring impacts on multiple organs
2022/07/03  00:00:00,Steve Carell returns with another 'Minions'
2022/07/03  00:00:00,Bezos-backed start-up that aims to cheat death targets Cambridge talent
2022/07/03  00:00:00,"During Ideas Fest, SCOTUS decisions a main topic of analysis"
2022/07/03  00:00:00,Flipkart signs MoU with KSDC to provide supply chain operations training
2022/07/03  00:00:00,Evelyn Maxwell: A Defender of the Vulnerable
2022/07/03  00:00:00,Aussie Foreign Minister Penny Wong to 'keep heat on' Annapuranee's case
2022/07/03  00:00:00,Diggin down with Upward Bound: WKU becomes dig site for young archaeologists
2022/07/03  00:00:00,India And Egypt Work Towards Building Strategic Relationship With Focus On Defence And Security
2022/07/03  00:00:00,Trkei scheint Offensive in Nordsyrien zu verschieben
2022/07/03  00:00:00,Korean Air Resumes Passenger Flights from Seoul to Vienna
2022/07/03  00:00:00,"Taiwan deputy foreign minister, envoy to US to attend Lithuanian freedom forum"
2022/07/03  00:00:00,"Meet professors, PhD holders in Zulums government"
2022/07/03  00:00:00,Red Arrows schedule today as times and routes for Silverstone and other transit times released
2022/07/03  00:00:00,The life and work of Mary Terrell
2022/07/03  00:00:00,"Ireland's sailing, boating & maritime magazine"
2022/07/03  00:00:00,Yashwant Sinha urges Droupadi Murmu to affirm she won't be 'rubber stamp Rashtrapati'
2022/07/03  00:00:00,Fulham eyeing loan move for Eric Bailly
2022/07/03  00:00:00,Thomas Suddes: Roe ruling will give Ohio judicial hopefuls something to discuss besides weather
2022/07/03  00:00:00,"Hicks: Hold up on waltzing into those history books, Gov. McMaster"
2022/07/03  00:00:00,Climate change education program echoes in inner city
2022/07/03  00:00:00,COVID & the Global South: the Nigerian Case
2022/07/03  00:00:00,China's top diplomat Wang Yi visits Myanmar amid opposition protest
2022/07/03  00:00:00,Indian Embassy in Nepal gifted 75 ambulances to various organizations and 17 buses to various schools
2022/07/03  00:00:00,FARAH STOCKMAN: The Democrat who's flipping the campaign script
2022/07/03  00:00:00,THE VOICE OF VIETNAM - VOV World
2022/07/03  00:00:00,IndiGo and Turkish airline resume codeshare agreement
2022/07/03  00:00:00,A Kashmiri pandit's search for her home
2022/07/03  00:00:00,Lukashenko talks with participants of patriotic youth project Memory Train
2022/07/03  00:00:00,"Nebraska Admirals Association, Grand Island Port"
2022/07/03  00:00:00,President to send special envoy to Saudi Arabia
2022/07/03  00:00:00,US leads int'l passenger interdiction training
2022/07/03  00:00:00,Nepal yet to inform the US of its withdrawal from the State Partnership Program
2022/07/03  00:00:00,Access All Areas by Barbara Charone review  my rocknroll friends
2022/07/03  00:00:00,Sinha urges Murmu to affirm she won't be 'rubber stamp Rashtrapati'
2022/07/03  00:00:00,ASEAN envoy ends Myanmar trip with call for dialog
2022/07/03  00:00:00,Trkei scheint Offensive in Nordsyrien zu verschieben
2022/07/03  00:00:00,"DWP: People on PIP could get up to 2,000 in cost of living payments"
2022/07/03  00:00:00,Steve Carell returns with another 'Minions'
2022/07/03  00:00:00,"Taiwan deputy foreign minister, envoy to US to attend Lithuanian freedom forum"
2022/07/03  00:00:00,Swiss conference to highlight decentralised and democratic Ukraine
2022/07/03  00:00:00,Tulsa Riverside Airport to formulate long-range vision in master plan
2022/07/03  00:00:00,Author observes Charlie Brown through the decades | DON NOBLE
2022/07/03  00:00:00,THE VOICE OF VIETNAM - VOV World
2022/07/03  00:00:00,"Reported Kaizer Chiefs target Mayele not for sale, Young Africans SC urge"
2022/07/03  00:00:00,Developers let Chinese farmers pay for homes with watermelons
2022/07/03  00:00:00,FARAH STOCKMAN: The Democrat who's flipping the campaign script
2022/07/03  00:00:00,Overturned Truck on a Utah Highway Releases At Least 10 Million Bees Into the Air
2022/07/03  00:00:00,Climate change education program echoes in inner city
2022/07/03  00:00:00,"During Ideas Fest, SCOTUS decisions a main topic of analysis"
2022/07/03  00:00:00,Albanese visits war-ravaged towns in Ukraine
2022/07/03  00:00:00,Thomas Suddes: Roe ruling will give Ohio judicial hopefuls something to discuss besides weather
2022/07/03  00:00:00,"Nebraska Admirals Association, Grand Island Port"
2022/07/03  00:00:00,Reminisce: Teen breaks brother and another out of jail
2022/07/03  00:00:00,Aussie Foreign Minister Penny Wong to 'keep heat on' Annapuranee's case
2022/07/03  00:00:00,Chef Mike Brustad Joins the Hyatt Centric Downtown Minneapolis
2022/07/03  00:00:00,"Diego Morales, Destiny Wells and Judge Luttig"
2022/07/03  00:00:00,"Rann Kali, the war memorial built by BSF at the request of Christian and Muslim soldiers"
2022/07/03  00:00:00,ASEAN envoy ends Myanmar trip with call for dialog
2022/07/03  00:00:00,Look back: Sheriff's substation opens in Moravia
2022/07/03  00:00:00,Trkei scheint Offensive in Nordsyrien zu verschieben
2022/07/03  00:00:00,"Hicks: Hold up on waltzing into those history books, Gov. McMaster"
2022/07/03  00:00:00,THE VOICE OF VIETNAM - VOV World
2022/07/03  00:00:00,Google India Purged 4L Bad Content Pieces In May
2022/07/03  00:00:00,Judge puts Biden on the spot over immunity for Saudi crown prince
2022/07/03  00:00:00,"Twitter CEO Parag Agrawal, Hands Full At Coffee Counter, Serves Staff"
2022/07/03  00:00:00,Kwik Trip 250 at Elkhart Lake: NASCAR DFS Picks
2022/07/03  00:00:00," Russian Defence Ministry report on the progress of the special military operation in Ukraine (July 3, 2022)"
2022/07/03  00:00:00,Fish Farming At Industrial Scale: A Turkish Case Study
2022/07/03  00:00:00,Albanese visits war-ravaged towns in Ukraine
2022/07/03  00:00:00,PM directs immediate functioning of shut down power plants
2022/07/03  00:00:00,Banditry: Matawalle launches Community Protection Guards in Zamfara
2022/07/03  00:00:00,Gavin Newsom goes on the air against Ron DeSantis as political rivalry grows
2022/07/03  00:00:00,Tropical Storm Colin Weakens over North Carolina
2022/07/03  00:00:00,L.A. Film Industry Revives Mask Mandate for Crew Members
2022/07/03  00:00:00,"Rann Kali, the war memorial built by BSF at the request of Christian and Muslim soldiers"
2022/07/03  00:00:00,India gifts school buses to Nepali organisations
2022/07/03  00:00:00,Nepal yet to inform the US of its withdrawal from the State Partnership Program
2022/07/03  00:00:00,MasterChef recap: Raise your glasses to the actual fan fave who hasn't made the final five
2022/07/03  00:00:00,Sinha urges Murmu to affirm she won't be 'rubber stamp Rashtrapati'
2022/07/03  00:00:00,Top Economists Back Boosts To Jobseeker And Social Housing Over Tax Cuts
2022/07/03  00:00:00,Swiss conference to highlight decentralised and democratic Ukraine
2022/07/03  00:00:00,Corporation plans vending zones to decongest busy areas in Coimbatore city
2022/07/03  00:00:00,FARAH STOCKMAN: The Democrat who's flipping the campaign script
2022/07/03  00:00:00,Tri-Valley innovation: Monitoring impacts on multiple organs
2022/07/03  00:00:00,BJP's opposition to TMC mere eyewash: CPM leader
2022/07/03  00:00:00,$4.8M Cape Breton facility to preserve knowledge of Mi'kmaw elders
2022/07/03  00:00:00,"Capito, Smith visit site of Nucor's planned steel mill in Mason County"
2022/07/03  00:00:00,Belarusians Identify Flayer: He Pushed Swan Into Car Trunk In Vitebsk Region
2022/07/03  00:00:00,Browns medical school to partner with Central Falls SMART Clinic on school pathways program
2022/07/03  00:00:00,Aussie Foreign Minister Penny Wong to 'keep heat on' Annapuranee's case
2022/07/03  00:00:00,Oman  Military Hajj Mission leaves for the sacred land
2022/07/03  00:00:00,Fish Farming At Industrial Scale: A Turkish Case Study
2022/07/03  00:00:00,Reminisce: Teen breaks brother and another out of jail
2022/07/03  00:00:00,studiolav and sandhelden create 3D printed nomadic sand tribe from the future
2022/07/03  00:00:00,Kwik Trip 250 at Elkhart Lake: NASCAR DFS Picks
2022/07/03  00:00:00,"Twitter CEO Parag Agrawal, Hands Full At Coffee Counter, Serves Staff"
2022/07/03  00:00:00,President to send special envoy to Saudi Arabia
2022/07/03  00:00:00,Albanese visits war-ravaged towns in Ukraine
2022/07/03  00:00:00,ASEAN envoy ends Myanmar trip with call for dialog
2022/07/03  00:00:00,Top Economists Back Boosts To Jobseeker And Social Housing Over Tax Cuts
2022/07/03  00:00:00,Swiss conference to highlight decentralised and democratic Ukraine
2022/07/03  00:00:00,Melissa Harris-Perry Compares Dobbs Case to Dred Scott on NPR Stations
2022/07/03  00:00:00,BBC Antiques Roadshow values Leicester group's deeply personal Ugandan Asian memorabilia
2022/07/03  00:00:00,Pastor Adeboye clarifies reports alleging he asked Christians to buy guns
2022/07/03  00:00:00,Prime minister to return from Europe before Fiji trip
2022/07/03  00:00:00,"Pakistan: Sindh CM, his aides distribute face masks to bus passengers"
2022/07/03  00:00:00,Russia Says It Holds All Of Ukraine's Luhansk With Capture Of Last City
2022/07/03  00:00:00,L.A. Film Industry Revives Mask Mandate for Crew Members
2022/07/03  00:00:00,The Return of Canadas National Family Law Program to In-Person Status
2022/07/03  00:00:00,"7 books to help you understand Web3, blockchain, the metaverse, and other visions for the internet's future"
2022/07/03  00:00:00,PM directs immediate functioning of shut down power plants
2022/07/03  00:00:00,Trinidads First Citizens interested in Guyana banking licence  CEO
2022/07/03  00:00:00,Enemy Continuously Fires Oniks Missiles At Odesa Region
2022/07/03  00:00:00,R500000 worth of abalone confiscated in Gqeberha
2022/07/03  00:00:00,Gavin Newsom goes on the air against Ron DeSantis as political rivalry grows
2022/07/03  00:00:00,Corporation plans vending zones to decongest busy areas in Coimbatore city
2022/07/03  00:00:00,"3 Red Hook, NY Teenagers Save Drowning Teen on Cape Cod"
2022/07/03  00:00:00,FARAH STOCKMAN: The Democrat who's flipping the campaign script
2022/07/03  00:00:00,Curt Prendergast: Use gun safety model for border deaths
2022/07/03  00:00:00,Kaylyn Carsten of Ida graduates from University of Toledo
2022/07/03  00:00:00,Judge puts Biden on the spot over immunity for Saudi crown prince
2022/07/03  00:00:00,Swiss conference to highlight decentralised and democratic Ukraine
2022/07/03  00:00:00,"Capito, Smith visit site of Nucor's planned steel mill in Mason County"
2022/07/03  00:00:00,Pastor Adeboye clarifies reports alleging he asked Christians to buy guns
2022/07/03  00:00:00,L.A. Film Industry Revives Mask Mandate for Crew Members
2022/07/03  00:00:00,Long View names deputy police chief
2022/07/03  00:00:00,MasterChef recap: Raise your glasses to the actual fan fave who hasn't made the final five
2022/07/03  00:00:00,Rockies turn to Chad Kuhl to topple Diamondbacks
2022/07/03  00:00:00,Melissa Harris-Perry Compares Dobbs Case to Dred Scott on NPR Stations
2022/07/03  00:00:00,State Food Ministers to discuss PDS and nutritional security on July 5
2022/07/03  00:00:00,"Pakistan: Sindh CM, his aides distribute face masks to bus passengers"
2022/07/03  00:00:00,Reminisce: Teen breaks brother and another out of jail
2022/07/03  00:00:00,PA official tells 'Post' the Palestinians' 5 demands for Biden
2022/07/03  00:00:00,Ask Us: Plans nebulous for vacant DQ on Hwy 169
2022/07/03  00:00:00,Tri-Valley innovation: Monitoring impacts on multiple organs
2022/07/03  00:00:00,The Return of Canadas National Family Law Program to In-Person Status
2022/07/03  00:00:00,"India Gifts 75 Ambulances, 17 School Buses To Nepal"
2022/07/03  00:00:00,PM directs immediate functioning of shut down power plants
2022/07/03  00:00:00," Russian Defence Ministry report on the progress of the special military operation in Ukraine (July 3, 2022)"
2022/07/03  00:00:00,"Twitter CEO Parag Agrawal, Hands Full At Coffee Counter, Serves Staff"
2022/07/03  00:00:00,"Capito, Smith visit site of Nucor's planned steel mill in Mason County"
2022/07/03  00:00:00,When Arizona Was Young:  Kofa began as a tent city
2022/07/03  00:00:00,"Meet a 39-year-old remote worker making $116,000 who says he could quit and get a job that pays more  but he'd rather have the flexibility to work from home"
2022/07/03  00:00:00,BBC Antiques Roadshow values Leicester group's deeply personal Ugandan Asian memorabilia
2022/07/03  00:00:00,Trinidads First Citizens interested in Guyana banking licence  CEO
2022/07/03  00:00:00,Fish Farming At Industrial Scale: A Turkish Case Study
2022/07/03  00:00:00,"Pospisil: The women who built Omaha; and remembering Bob Marks, Omaha's history detective"
2022/07/03  00:00:00,Browns medical school to partner with Central Falls SMART Clinic on school pathways program
2022/07/03  00:00:00,Thaco subsidiary exports car seat covers to RoK
2022/07/03  00:00:00,Nicola Forrest challenges Anthony Albanese to take charge of early education overhaul
2022/07/03  00:00:00,Palestinian Authority hands bullet in Abu Akleh killing to US for 'examination'
2022/07/03  00:00:00,Tri-Valley innovation: Monitoring impacts on multiple organs
2022/07/03  00:00:00,Stars Align for Cody's Wish and Namesake Cody Dorman
2022/07/03  00:00:00,PA official tells 'Post' the Palestinians' 5 demands for Biden
2022/07/03  00:00:00,"Tinubu Presidency: Afenifere urges Akande, Osinbajo, others to midwife genuine reconciliation"
2022/07/03  00:00:00,"Spanberger cranks up campaign in Culpeper, Orange, Prince William and Fredericksburg"
2022/07/03  00:00:00,Pakistan round-up: Close aide of Imran Khan's wife could face Red Corner Notice
2022/07/03  00:00:00,Compaia Mara Pags: An Ode to Time review  flamencos grande dame flies
2022/07/03  00:00:00,"U.S. Sens. Rubio, Scott Praise Pro-Life Movement With Resolution"
