date,title
2022/09/11  00:00:00,PublicRadioFan.com - Listings by program: Claudia on Sunday
2022/09/11  00:00:00,PublicRadioFan.com - Listings by program: Radiolab
2022/09/11  00:00:00,PublicRadioFan.com - Listings by program: VOA Asia
2022/09/11  00:00:00,PublicRadioFan.com - Listings by program: Raul Campos
2022/09/11  00:00:00,11 | September | 2022 | RUTHFULLY YOURS
2022/09/11  00:00:00,Well+Being: Mental Health - Washington Post
2022/09/11  00:00:00,Quake jolts 273 km away from Almaty
2022/09/11  00:00:00,Texas vs. No. 1 Alabama: Five observations and Sunday chat
2022/09/11  00:00:00,GLOBALink | Tanzania's Zanzibar awards medals to Chinese medical team
2022/09/11  00:00:00,Mayo karate star launching his own academy | Connaught Telegraph
2022/09/11  00:00:00,Accession proclamation read to people of Northern Ireland at Hillsborough Castle
2022/09/11  00:00:00,Emma Seiwell - New York Daily News
2022/09/11  00:00:00,Nicholas Williams - New York Daily News
2022/09/11  00:00:00,Nebraska Fires Coach Scott Frost | News Radio 94.3 WSC
2022/09/11  00:00:00,Nebraska Fires Coach Scott Frost | News/Talk 1130 WISN
2022/09/11  00:00:00,Zetta struts its stuff at radio dual conferences in KL - RadioInfo Australia
2022/09/11  00:00:00,"Massachusetts to distribute 5 million at-home COVID tests, plus masks and other PPE"
2022/09/11  00:00:00,"Modi to attend SCO summit with Pakistan, Russia, China | The Express Tribune"
2022/09/11  00:00:00,"Floods, the press and democracy | The Express Tribune"
2022/09/11  00:00:00,"AP Top 25 Takeaways: Bryce saves 'Bama; A&M, ND Sun Belted"
2022/09/11  00:00:00,Privacy Policy - The Islamic Monthly
2022/09/11  00:00:00,Two Muslim Reverts - The Islamic Monthly
2022/09/11  00:00:00,"SpearIt, Author at The Islamic Monthly"
2022/09/11  00:00:00,A Timeline Of World Events From HM Queen Elizabeth's Life
2022/09/11  00:00:00,China sends college students to quarantine under zero-COVID
2022/09/11  00:00:00,"Aldi and Lidl: What's in the middle aisles from Sunday, September 11"
2022/09/11  00:00:00,Russia hits power stations after Ukraine counter-offensive
2022/09/11  00:00:00,JLF Colorado Returns to the Boulder Public Library on Sept. 17 and 18 | City of Boulder
2022/09/11  00:00:00,Shortie93's Public Profile Page on ExtraLunchMoney
2022/09/11  00:00:00,Swoonoverme00's Public Profile Page on ExtraLunchMoney
2022/09/11  00:00:00,Eliana Light | Jewish Rock Radio
2022/09/11  00:00:00,Joanie & Matt | Jewish Rock Radio
2022/09/11  00:00:00,"Anfield - Latest news updates, pictures, video, reaction"
2022/09/11  00:00:00,Our Author Catalog | Telemachus Press
2022/09/11  00:00:00,Robin O'Herin Acoustic Blues and Gospel
2022/09/11  00:00:00,"Will Charles - Bio, News, Photos - Washington Times"
2022/09/11  00:00:00,AP News in Brief at 9:04 p.m. EDT
2022/09/11  00:00:00,12 Kg gold worth Rs 5.38 Crore seized by Mumbai Airport customs
2022/09/11  00:00:00,Visa to Start Categorizing Gun Shop Sales Separately
2022/09/11  00:00:00,Rename Rajasthan as Kartavyasthan: Shashi Tharoor on renaming Rajpath
2022/09/11  00:00:00,IGCF workshops to explore future of government communication
2022/09/11  00:00:00,Ravens RB J.K. Dobbins (knee) inactive vs. Jets
2022/09/11  00:00:00,Report: Kyle Busch leaving JGR for rival Childress group
2022/09/11  00:00:00,49ers TE George Kittle (groin) inactive vs. Bears
2022/09/11  00:00:00,Woman Goes Over 68-Foot Waterfall Trying To Retrieve Cell Phone | KOA 850 AM & 94.1 FM
2022/09/11  00:00:00,Nebraska Fires Coach Scott Frost: Report | KOA 850 AM & 94.1 FM
2022/09/11  00:00:00,Pageantry and procession in the rain in Hillsborough
2022/09/11  00:00:00,Check Engine Warning: Possible Causes and Solutions
2022/09/11  00:00:00,Nebraska Fires Coach Scott Frost: Report | News Radio 1450 WILM
2022/09/11  00:00:00,2022 NFL Week 1 open thread
2022/09/11  00:00:00,Ex-Gov. Johnson questions demonstrators against Eastman
2022/09/11  00:00:00,Pakistan records 139 new COVID-19 cases
2022/09/11  00:00:00,"Singapore reports 1,440 new COVID-19 cases"
2022/09/11  00:00:00,"Dead Trees: 'Drastically alter' fire behavior, reduce options"
2022/09/11  00:00:00,"Sarah Craig, Author at The Georgetown Voice"
2022/09/11  00:00:00,Russian troops retreat after Ukraine counteroffensive
2022/09/11  00:00:00,David Mitchell | Twin Cities Business
2022/09/11  00:00:00,Kalen Schwartz | Twin Cities Business
2022/09/11  00:00:00,Codename Red will take the Assassin's Creed franchise to feudal Japan
2022/09/11  00:00:00,MIL-OSI Global: Remarks by Vice President Harris During Visit with Members of Alpha Kappa Alpha Sorority
2022/09/11  00:00:00,"AVP Loss Analytics & Reserving at The Travelers Companies, Inc. / Insurance Journal Jobs"
2022/09/11  00:00:00,"Regina Elisabetta, la madre di Joe Biden chiedeva al figlio di non inginocchiarsi"
2022/09/11  00:00:00,UTS College introduces new pathways to law
2022/09/11  00:00:00,Wheel and Pinion Depthing | Model Engineer
2022/09/11  00:00:00,India issues advisory for students planning to study in China
2022/09/11  00:00:00,"Industrial Automation, Robots and Unmanned Vehicles Company - Brenton Engineering Company | RoboticsTomorrow"
2022/09/11  00:00:00,ImmunoGen Presents Additional Analyses Evaluating Mirvetuximab Soravtansine in Ovarian Cancer at ESMO
2022/09/11  00:00:00,Plasma donation bank eyes old Aldi location
2022/09/11  00:00:00,Huskers fall at home 45-42 to Georgia Southern
2022/09/11  00:00:00,Taliban negotiating with UAE over airspace control
2022/09/11  00:00:00,Post News Group | PNG - Part 2124
2022/09/11  00:00:00,About The Jesus Christ Show | KFI AM 640
2022/09/11  00:00:00,People aged 65 and over urged to book Covid-19 booster jab
2022/09/11  00:00:00,"AP PHOTOS: At roving fairs, sellers keep bartering tradition"
2022/09/11  00:00:00,School capacity concerns brought to lawmakers
2022/09/11  00:00:00,President Murmu appoints Gulam Ali from Jammu & Kashmir to Rajya Sabha
2022/09/11  00:00:00,Nayara Energy seeks Centre's approval on independent directors' pay
2022/09/11  00:00:00,Compatibilidad del seguro privado y la Seguridad Social
2022/09/11  00:00:00,"Almudena Heredero, nueva directora de Primavera Sound Madrid"
2022/09/11  00:00:00,Terra Classic (LUNC) se recupera un 460% en un mes
2022/09/11  00:00:00,UNSKILLED ZIMBAS FACE THE BOOT FROM SA
2022/09/11  00:00:00,Demonstrators explain protests of Buffalo Tops reopening
2022/09/11  00:00:00,Falcon medicine to treat airsacullitis developed in Qatar
2022/09/11  00:00:00,Reliance Infra files $1.7 billion claim in power deal with Adani
2022/09/11  00:00:00,"A quick view of Wentian, China's space lab"
2022/09/11  00:00:00,CDC Releases Data on COVID Vaccine-Linked Heart Inflammation
2022/09/11  00:00:00,Cemiplimab Offers Chemo-Free First-Line Option for Advanced NSCLC
2022/09/11  00:00:00,Kirby Smart Provides an Injury Update on Adonai Mitchell
2022/09/11  00:00:00,"Packers QB Rodgers Tackles California Lawmakers, COVID Mandates"
2022/09/11  00:00:00,Teen Defends Family With Shotgun Killing 2 Intruders Breaking Into Home | Newsradio WFLA Orlando
2022/09/11  00:00:00,"Michigan State backfield, defense flex their muscle in stress-free rout of Akron"
2022/09/11  00:00:00,"New Zealand, Jay Bhattacharya, and excess mortality"
2022/09/11  00:00:00,In Other Views: Let's clean up West Virginia
2022/09/11  00:00:00,Slight Creedence - Washington Free Beacon
2022/09/11  00:00:00,DTG's expansion looms over trails at Rocky Top west of Yakima
2022/09/11  00:00:00,The Dispatch - Eyes On The Prize
2022/09/11  00:00:00,Decorative Egg-shaped Object by Thumbscribes | Significant Objects
2022/09/11  00:00:00,Tiny Jar of Mayo by Rick Moody | Significant Objects
2022/09/11  00:00:00,Flip-Flop Frame by Merrill Markoe | Significant Objects
2022/09/11  00:00:00,SARS Mask by Helen DeWitt | Significant Objects
2022/09/11  00:00:00,Poodle Figurine by Peter Rock | Significant Objects
2022/09/11  00:00:00,Pepper Shaker by Philip Graham | Significant Objects
2022/09/11  00:00:00,Menswear Style on Details Style Syndicate
2022/09/11  00:00:00,"Diamond Infrastructure Development On The Future of Alternative Energy ""Without Foreign Control"" in America"
2022/09/11  00:00:00,"Franchise Market Size, Share, Growth | Forecast, 2029 | Demand Insights, Trends, Key Players, Type & Application, Expansion Plan, Restraints and Challenges, Revenue, Cost Analysis and Supply Chain Research | Industry Research Biz"
2022/09/11  00:00:00,Mixed Martial Arts-Diaz submits Ferguson to end UFC tenure with a win
2022/09/11  00:00:00,People aged 65 and over urged to book Covid-19 booster jab
2022/09/11  00:00:00,Technip Energies Purchases Biosuccinium Technology from DSM
2022/09/11  00:00:00,Scott Hollifield: Tracking down a guy who shares my name
2022/09/11  00:00:00,Chris Cagle to perform at Apache Casino Hotel
2022/09/11  00:00:00,Line in the sand drawn over sons' habit of dropping by
2022/09/11  00:00:00,AP News in Brief at 6:04 p.m. EDT
2022/09/11  00:00:00,"Manipat Attractions, Manipat Tourist Places, hill stations in India"
2022/09/11  00:00:00,Tender for purchase & delivery of books to international exhibitions - ARAB TIMES - KUWAIT NEWS
2022/09/11  00:00:00,Hashish seized from an Indian passenger on airport - ARAB TIMES - KUWAIT NEWS
2022/09/11  00:00:00,AP News in Brief at 12:04 a.m. EDT
2022/09/11  00:00:00,Louis C.K. at The Palace Theatre in Stamford
2022/09/11  00:00:00,252 Firearms Collected at Supervisor Hahn and LBPD Gun Buy-Back Event
2022/09/11  00:00:00,"Portable, solar-powered Radar speed sign installed by road commission"
2022/09/11  00:00:00,In Pictures: King Charles III's visits to Suffolk
2022/09/11  00:00:00,EPA Plans for Cuts Under Lower Budget - Natural Gas Intelligence
2022/09/11  00:00:00,Law and Crime | South China Morning Post
2022/09/11  00:00:00,Virus Outbreak South Korea Daily Life
2022/09/11  00:00:00,Automobile more than an industry in car cradle Changchun
2022/09/11  00:00:00,"Mixing Efficiencies For The 2,000L imPULSE Single-Use Mixer"
2022/09/11  00:00:00,MPC should consider a pause in hikes
2022/09/11  00:00:00,"Jennifer Hudson, Sherri Shepherd part of daytime TV makeover"
2022/09/11  00:00:00,"Sen. Tim Scott on GOP Midterm Candidates: Issues, Momentum on Our Side"
2022/09/11  00:00:00,Kathy Lette | The Sydney Morning Herald
2022/09/11  00:00:00,Topic | Urban planning | The Sydney Morning Herald
2022/09/11  00:00:00,Rob Harris | The Sydney Morning Herald
2022/09/11  00:00:00,'An instinct to come together': Keir Starmer attends Camden proclamation
2022/09/11  00:00:00,About Leo Laporte - The Tech Guy | AM 620 WJDX
2022/09/11  00:00:00,About Leo Laporte - The Tech Guy | NewsRadio WKCY
2022/09/11  00:00:00,AP News Summary at 8:44 p.m. EDT
2022/09/11  00:00:00,Gators Fall To #20 Kentucky | 96.3 | 102.5 NewsRadio WFLA
2022/09/11  00:00:00,Major shareholders throw more of their (considerable) weight around
2022/09/11  00:00:00,What they're saying in Russia about Ukraine's advances
2022/09/11  00:00:00,AP News in Brief at 12:04 a.m. EDT
2022/09/11  00:00:00,Pain and Gain | Corona Coming Attractions
2022/09/11  00:00:00,Buffy the Vampire Slayer | Corona Coming Attractions
2022/09/11  00:00:00,Trans Am | Corona Coming Attractions
2022/09/11  00:00:00,Pirates of the Caribbean 5 | Corona Coming Attractions
2022/09/11  00:00:00,The Umbrella Academy | Corona Coming Attractions
2022/09/11  00:00:00,Drive Angry | Corona Coming Attractions
2022/09/11  00:00:00,Star Wars Episode VI: Return of the Jedi | Corona Coming Attractions
2022/09/11  00:00:00,The Sitter | Corona Coming Attractions
2022/09/11  00:00:00,"Sanders helps No. 16 Arkansas rocket past South Carolina | News, Sports, Jobs"
2022/09/11  00:00:00,Griffiths Construction - Civil Construction and Project Management
2022/09/11  00:00:00,9-10-22 high speed chase-dodge county | 98.7 FM The Great 98 WMDC-FM
2022/09/11  00:00:00,Charles asks for removal of offending pen holder
2022/09/11  00:00:00,Israel | Council on Foreign Relations
2022/09/11  00:00:00,Saudi Arabia | Council on Foreign Relations
2022/09/11  00:00:00,Indoor Fall Safety Audits: A Quick Guide -- Occupational Health & Safety
2022/09/11  00:00:00,Waterloo and Cedar Falls neighbors: Obituaries for September 11
2022/09/11  00:00:00,AP News Summary at 2:04 p.m. EDT
2022/09/11  00:00:00,About iHeart Sunday Night Podcasts | 570 WSYR
2022/09/11  00:00:00,Stock Market | FinancialContent Business Page
2022/09/11  00:00:00,Gx Copper Miners ETF Stock Quote | Stock Price for COPX | FinancialContent Business Page
2022/09/11  00:00:00,Biomx Ltd Stock Quote | Stock Price for PHGE | FinancialContent Business Page
2022/09/11  00:00:00,Enochian Biosciences Inc Stock Quote | Stock Price for ENOB | FinancialContent Business Page
2022/09/11  00:00:00,Titans: Joseph Morgan Posts Season 4 Wrap Audio Message & More
2022/09/11  00:00:00,Pageantry and procession in the rain in Hillsborough
2022/09/11  00:00:00,The Secrets of Bella Vista | Hallmark Movies and Mysteries
2022/09/11  00:00:00,Visa to apply new code identifying sales at U.S. gun stores
2022/09/11  00:00:00,#MostRequestedLive Ask Anything Chat: Sunset West | Z-94 | Most Requested Live with Romeo
2022/09/11  00:00:00,#MostRequestedLive Ask Anything Chat: Niki | Z100 Portland | Most Requested Live with Romeo
2022/09/11  00:00:00,Consider Reintroducing Luxury Vehicle Tax - Economist To Government:
2022/09/11  00:00:00,Rapid City neighbors: Obituaries for September 11
2022/09/11  00:00:00,"Rian Johnson unpeels 'Glass Onion,' his 'Knives Out' sequel"
2022/09/11  00:00:00,"Buy (400 Pieces) New AirPod Pro (2nd generation) $67,600/www.brianelectronics.com - General English to Spanish Translation - Trusted Translations Forums"
2022/09/11  00:00:00,Utah State Cross Country Teams Set to Open Season at Sagebrush Invitational - Utah State University Athletics
2022/09/11  00:00:00,Maryland Athletics 2022 Hall of Fame Spotlight: Taylor Twellman - University of Maryland Athletics
2022/09/11  00:00:00,UFC 279 Live Blog: Nate Diaz vs. Tony Ferguson
2022/09/11  00:00:00,Alachua County Commissioner Marihelen Wheeler sued for alleged residency violation - The Independent Florida Alligator
2022/09/11  00:00:00,Bale Fungibility & Pakistan's Cotton Disaster - AG INFORMATION NETWORK OF THE WEST
2022/09/11  00:00:00,Kentucky Downs Reschedules Sunday's Last Nine Races To Tuesday - Horse Racing News | Paulick Report
2022/09/11  00:00:00,About Little Steven's Underground Garage | 102.5 WDVE
2022/09/11  00:00:00,Coast to Coast AM with George Noory - Twin Cities News Talk
2022/09/11  00:00:00,Home - New Zealand Warbirds Association Inc
2022/09/11  00:00:00,House of Hair with Dee Snider
2022/09/11  00:00:00,Hemus Air and Lufhansa Technik build a new airport complex - Bulgaria Gazette - News from Bulgaria
2022/09/11  00:00:00,Wolf by Mumford and Sons on KSLG
2022/09/11  00:00:00,President nominates J&K Gujjar leader Gulam Ali Khatana to Rajya Sabha - Northlines
2022/09/11  00:00:00,Bewley's to sell Sligo designers coffee mugs
2022/09/11  00:00:00,The Five Books of Peterson by Ken Myers
2022/09/11  00:00:00,The Cosmic Cemetery by Thomas S. Buchanan
2022/09/11  00:00:00,The Life of Sean by David F. Watson
2022/09/11  00:00:00,Flying High at Trinity by Leon J. Podles
2022/09/11  00:00:00,Leisure Suits Us by Ken Myers
2022/09/11  00:00:00,Activist for Life by James M. Kushiner
2022/09/11  00:00:00,Visa to apply new code identifying sales at U.S. gun stores
2022/09/11  00:00:00,Powerball rolls over to $193 million
2022/09/11  00:00:00,Life Clinic Immigration Express - Official eMedical in Wellington CBD
2022/09/11  00:00:00,Preference for foreign languages affecting Nigerian languages-Runsewe | The Guardian Nigeria News - Nigeria and World News
2022/09/11  00:00:00,Healing the Nigerian polity and politics | The Guardian Nigeria News - Nigeria and World News
2022/09/11  00:00:00,"NFL World Reacts To Jimmy Garoppolo, Rams Report"
2022/09/11  00:00:00,NFL World Reacts To Epic National Anthem On Sunday
2022/09/11  00:00:00,DPWH working on proposal to address C. Luzon flooding - BusinessMirror
2022/09/11  00:00:00,Brighton plan Moises Caicedo contract talks with Manchester United circling
2022/09/11  00:00:00,Temple to serve base camp for Sharda Peeth pilgrimage under construction in Teetwal area of Kashmir. - Jammu Kashmir Latest News | Tourism | Breaking News J&K
2022/09/11  00:00:00,12/09/2022 - Jammu Kashmir Latest News | Tourism | Breaking News J&K
2022/09/11  00:00:00,Early mock draft has SF Giants drafting two-way player Paul Skenes
2022/09/11  00:00:00,"All Indiana Bets: September 11, 2022 (NFL Week 1)"
2022/09/11  00:00:00,The Runner | Surrey Art Gallery hosts talk about the relationship between animals and humans
2022/09/11  00:00:00,Bangsamoro Peace and the U.S.-Philippines Alliance
2022/09/11  00:00:00,Walia partner with music sensation Rophnan - Capital Newspaper
2022/09/11  00:00:00,British Academy of Film & Television Arts Headquarters / Benedetti Architects
2022/09/11  00:00:00,THE HUMAN SCALE - Capital Newspaper
2022/09/11  00:00:00,Share Your Stories About Hasidic Schools
2022/09/11  00:00:00,Site in northern Switzerland picked for nuclear waste storage | News
2022/09/11  00:00:00,Tuku for forming cross sector body for protection of child rights | News
2022/09/11  00:00:00,Call of Duty: Modern Warfare 2 - IGN
2022/09/11  00:00:00,Santa Cruz Hightower CC review - MBR
2022/09/11  00:00:00,"British royal line of succession lists Archie, Lilibet as 'master' and 'miss'"
2022/09/11  00:00:00,Belle by Kim Gravel TripleLuxe Knit Set of 2 Tops - QVC.com
2022/09/11  00:00:00,Patricia Nash Vintage Leather Chelsey Crossbody - QVC.com
2022/09/11  00:00:00,Quacker Factory Fall Charm 3/4 Sleeve Top - QVC.com
2022/09/11  00:00:00,Isaac Mizrahi Live! Cashmere Open Front Chevron Stitch Sweater - QVC.com
2022/09/11  00:00:00,Blue Jays drop series finale to Rangers - TSN.ca
2022/09/11  00:00:00,Swiatek Defeats Jabeur to Clinch US Open Crown
2022/09/11  00:00:00,Argentina Vice President Asks Demonstrators to Go Home After Unrest
2022/09/11  00:00:00,Turkey's Erdogan Eyes Reset With Syria
2022/09/11  00:00:00,Staff of Nicaragua's La Prensa Newspaper Flee Abroad
2022/09/11  00:00:00,Pelosi to attend Foulkes rally in Providence Sunday | ABC6
2022/09/11  00:00:00,What they're saying in Russia about Ukraine's advances
2022/09/11  00:00:00,News Team - KCRA 3 News
2022/09/11  00:00:00,"Auburn holds off big underdog San Jose State, 24-16 - KESQ"
2022/09/11  00:00:00,2 California Highway Patrol officers struck on interstate - KESQ
2022/09/11  00:00:00,WORKERS ON WAGES: Taco Bell employee talks pay & burnout amid record inflation
2022/09/11  00:00:00,"The Soul Suite - September 3, 2022 | KPFA"
2022/09/11  00:00:00,Queen Elizabeth II's corgis will go to her son Prince Andrew and his ex-wife - KRBD
2022/09/11  00:00:00,Send in your pictures to news@ktlo.com
2022/09/11  00:00:00,Lost 80's Live! at the Straz Center
2022/09/11  00:00:00,"F1, Mattarella saluta il pubblico di Monza dopo il Gran Premio"
2022/09/11  00:00:00,Touched By An Angel - UPtv
2022/09/11  00:00:00,Power Tools Stolen from English School District Van in Stephenville
2022/09/11  00:00:00,Newfoundland-based Play Set to Tour Throughout Canada
2022/09/11  00:00:00,Queen Elizabeth II's corgis to live with the Duke and Duchess of York
2022/09/11  00:00:00,News Team - WAPT 16 News
2022/09/11  00:00:00,Woman Goes Over 68-Foot Waterfall Trying To Retrieve Cell Phone | WBHP
2022/09/11  00:00:00,Justin Mills-Crawford County Circuit Court judge.jpeg
2022/09/11  00:00:00,Recap | Towson Tigers 29- Morgan Bears 21
2022/09/11  00:00:00,"CA WFO SAN JOAQUIN VALLEY Warnings, Watches, and Advisories"
2022/09/11  00:00:00,CT New York NY Zone Forecast
2022/09/11  00:00:00,TX Austin/San Antonio TX Zone Forecast
2022/09/11  00:00:00,"CA WFO SAN DIEGO Warnings, Watches, and Advisories"
2022/09/11  00:00:00,"CA WFO LOS ANGELES Warnings, Watches, and Advisories"
2022/09/11  00:00:00,"USED 2012 Black Peugeot 207 XR Hatchbackfor sale in Docklands, VIC | Drive Cars For Sale"
2022/09/11  00:00:00,7 Keyboard Tips for Your Phone
2022/09/11  00:00:00,Quick Sketch: Meet new Conservative leader Pierre Poilievre
2022/09/11  00:00:00,Mintos and Wildcats tie in back-and-forth contest
2022/09/11  00:00:00,US Support for Human Rights in North Korea - BORGEN
2022/09/11  00:00:00,"Swae Lee Has 1-Year-Old Daughter, Files for Joint Custody"
2022/09/11  00:00:00,Fantasy: Week 1 Rankings (Sunday Update)
2022/09/11  00:00:00,Sunday News: From the Editorial pages
2022/09/11  00:00:00,Germany to shut controversial Gorleben nuclear waste facility | DW | 17.09.2021
2022/09/11  00:00:00,African Roots Podcast: Tracing those who shaped Africa | DW | 29.08.2022
2022/09/11  00:00:00,"Brazil: Bolsonaro, Lula trade blows ahead of election | DW | 23.08.2022"
2022/09/11  00:00:00,Market Comparison: Modern New Development Options In The Western U.S.
2022/09/11  00:00:00,Lesotho: call for bids for provision of Assistive Technology
2022/09/11  00:00:00,GitHub - ShlomoStept/hn_bot: A Bot that searches for and posts links to archived versions of articles after scanning all of HackerNews' top articles for those that contain a link to a site that requires a subscription.
2022/09/11  00:00:00,"IT PRO | Enterprise & Business IT News, Reviews, Features & How Tos"
2022/09/11  00:00:00,"NY WFO NEW YORK CITY Warnings, Watches, and Advisories"
2022/09/11  00:00:00,TX Fort Worth TX Zone Forecast
2022/09/11  00:00:00,Border Patrol halts tweets from agency's West Texas region
2022/09/11  00:00:00,Crises forge Beshear's role as Kentucky's consoler in chief
2022/09/11  00:00:00,"TX WFO MIDLAND/ODESSA Warnings, Watches, and Advisories"
2022/09/11  00:00:00,Subscribe to read | Financial Times
2022/09/11  00:00:00,Victoria Beckham knows Peltz family can 'offer' Brooklyn 'things she cannot'
2022/09/11  00:00:00,Prince Andrew to take on Queen's corgis and dorgis
2022/09/11  00:00:00,"Peter Andre - Latest news, views, gossip, pictures, video"
2022/09/11  00:00:00,"AP Top 25 Takeaways: Bryce saves 'Bama; A&M, ND Sun Belted"
2022/09/11  00:00:00,Nissan Xterra Is Going To Every National Park With A Hole In The Roof
2022/09/11  00:00:00,About Fifty + | KPRC AM 950
2022/09/11  00:00:00,Capital Accountant job with The Falkland Islands Government | 4170546
2022/09/11  00:00:00,"Lapid slams parallel drawn by Liberman between Netanyahu and Goebbels, Stalin"
2022/09/11  00:00:00,Cam Rising throws 3 TDs as No. 13 Utah steamrolls Southern Utah
2022/09/11  00:00:00,"Mets use 8-run fourth to slam Marlins, 11-3"
2022/09/11  00:00:00,DStv Premiership match report AmaZulu v Golden Arrows 24 August 2022 | Kickoff
2022/09/11  00:00:00,Generate unlimited leads with 41% off LeadClosure
2022/09/11  00:00:00,"Iran, Belarus to team up on manufacturing of heavy-duty mining dump trucks"
2022/09/11  00:00:00,Australia's Acting High Commissioner speaks after royal meeting
2022/09/11  00:00:00,Topic | New music | The Age
2022/09/11  00:00:00,"V.Verona, Fresco: ""Cambi dovuti al minutaggio, in difesa sbagliato poco"""
2022/09/11  00:00:00,Topic | Australian music | WAtoday
2022/09/11  00:00:00,Topic | World markets | WAtoday
2022/09/11  00:00:00,Topic | Formula 1 | WAtoday
2022/09/11  00:00:00,"Alice In Chains, Breaking Benjamin and Bush"
2022/09/11  00:00:00,Yankees reinstate Josh Donaldson from paternity list
2022/09/11  00:00:00,Colts sign G Quenton Nelson to 4-year extension
2022/09/11  00:00:00,What they're saying in Russia about Ukraine's advances
2022/09/11  00:00:00,5 Seconds Of Summer Share New Single 'Older' Featuring Sierra Deaton
2022/09/11  00:00:00,Mississippi St. QB Will Rogers carves up Arizona in rout
2022/09/11  00:00:00,EXPLAINER: The intel review of documents at Trump's estate
2022/09/11  00:00:00,Argonne's Energy Justice Webinar on GREET Bioenergy Life-Cycle Analysis
2022/09/11  00:00:00,Deep Tracks | CJSF 90.1FM Radio
2022/09/11  00:00:00,CKDO - Durham's Classic Hits - CIBC Run For The Cure
2022/09/11  00:00:00,The Coalition News & Rumors | N4G
2022/09/11  00:00:00,GameStop News & Rumors | N4G
2022/09/11  00:00:00,Charles III proclaimed king of Australia and New Zealand
2022/09/11  00:00:00,VIZ: The Official Website for Black Bird
2022/09/11  00:00:00,Nebraska Fires Coach Scott Frost: Report | 93-7 NOW
2022/09/11  00:00:00,Aurora buys control of major B.C. hothouse veg firm - AGCanada
2022/09/11  00:00:00,Junkyard Gem: 2003 Ford Crown Victoria Police Interceptor
2022/09/11  00:00:00,Queen Elizabeth II: Coffin to travel by road from Balmoral to Edinburgh
2022/09/11  00:00:00,Charles III: Antigua and Barbuda plans vote on King's role as head of state
2022/09/11  00:00:00,"Council Examining Possibility Of Footpath Between Park, Lees Road & Drumcliffe - Clare FM"
2022/09/11  00:00:00,Biden Energy Secretary Granholm mocked for touting 30% tax credit on solar panels for middle-class Americans
2022/09/11  00:00:00,"Phoebe and Her Unicorn by Dana Simpson for September 11, 2022 | GoComics.com"
2022/09/11  00:00:00,Careers - Apply for A Position :: Guns.com
2022/09/11  00:00:00,HLTV.org - The home of competitive Counter-Strike
2022/09/11  00:00:00,Rep. Karen Bass Says Her Firearms Were Swiped In Home Burglary
2022/09/11  00:00:00,Al Franken Presses GOP Strategist About Her Misleading SCOTUS Take On CNN
2022/09/11  00:00:00,Liz Truss was told about The Queen hours before the news was made public
2022/09/11  00:00:00,"Charles III proclaimed King in Scotland, Northern Ireland and Wales | ITV News"
2022/09/11  00:00:00,Sinn Fein to attend royal events after staying away from King's proclamation | ITV News
2022/09/11  00:00:00,Slava Raytheon: Zelensky To Headline Conference Of US Defense Companies
2022/09/11  00:00:00,More on New England Clean Energy Connect's challenges and what they say about our ability to transition to renewable energy | JD Supra
2022/09/11  00:00:00,Jasper takes time out to remember 9-11
