date,title
2023/01/22  00:00:00,Renewed appeal for Scots mum missing without warning as family ask 'please come home'
2023/01/22  00:00:00,Bolsonarismo has been defeated but it is not yet buried
2023/01/22  00:00:00,Donald Trump plans campaign stops targeting Republican opponents  and prosecutors
2023/01/22  00:00:00,Fuel scarcity: Shehu Sani reveals those responsible
2023/01/22  00:00:00,Microsofts Request to Pause Activision Blizzard Merger Lawsuit Denied by Judge
2023/01/22  00:00:00,The coming legal showdown over abortion pills
2023/01/22  00:00:00,"SAT, ACT test scores are optional at many universities  and fewer Hampton Roads students are taking them"
2023/01/22  00:00:00,"Suspect in Monterey Park mass shooting killed self in van, authorities say; motive remains unknown"
2023/01/22  00:00:00,"New AI app lets you talk to historical figures, including Hitler"
2023/01/22  00:00:00,Private security guard shot dead in Bihars Darbhanga for opposing unloading of illicit liquor at petrol pump
2023/01/22  00:00:00,Ex-lawyer Alex Murdaugh's murder trial starts Monday. What we know about the crime saga.
2023/01/22  00:00:00,"Meet Vincent LeVien, Advance Man of the East End"
2023/01/22  00:00:00,Abbasi calls upon judiciary to right the wrongs done to Nawaz Sharif
2023/01/22  00:00:00,"With town officials stepping down, Calais waits to see who might fill the void"
2023/01/22  00:00:00,Donald Trump plans campaign stops targeting Republican opponents  and prosecutors
2023/01/22  00:00:00,Three of Guy Fieris Favorite Meals Ever Are Served in Maine and New Hampshire
2023/01/22  00:00:00,Oregon Sen. Jeff Merkley tour reveals Morrow County  residents frustration with groundwater inaction
2023/01/22  00:00:00,Reactions Pouring in After Monterey Park Mass Shooting
2023/01/22  00:00:00,Texas college students say 'censorship of TikTok over guns' says a lot about how officials prioritize safety
2023/01/22  00:00:00,Meet one of the first Muslim representatives in Texas House
2023/01/22  00:00:00,Pakistan: Media executive Mohsin Raza Naqvi appointed Punjabs caretaker chief minister
2023/01/22  00:00:00,CNN guest blasted for suggesting the word 'violent' doesn't describe Atlanta riots: 'What a joke'
2023/01/22  00:00:00,Opinion: Bending the arc to embrace the promise of justice
2023/01/22  00:00:00,"After Georgia Police Kill Left-Wing Activist, Antifa Riots in Atlanta"
2023/01/22  00:00:00,Australia buys potent and powerful sea mines to deter China
2023/01/22  00:00:00,Bolsonarismo has been defeated but it is not yet buried
2023/01/22  00:00:00,Former PACE exec sues Pavilions under Whistleblower Act
2023/01/22  00:00:00,"Pair of shootings an hour apart in Brooklyn and the Bronx leave two dead, four wounded"
2023/01/22  00:00:00,At least 10 people killed during mass shooting in Los Angeles
2023/01/22  00:00:00,Egypt signs $1.5 bln financing agreement with ITFC - CNBC Arabia
2023/01/22  00:00:00,ECP picks Mohsin Naqvi as Punjab caretaker CM
2023/01/22  00:00:00,US Teen Dies After Being Stabbed By A Gang
2023/01/22  00:00:00,PM accuses Imran of being agent of chaos
2023/01/22  00:00:00,Disneyland Facing Legal Action: Employees Allegedly Laughed at Disabled Woman Before Accident That Caused Her Death
2023/01/22  00:00:00,US hails Eritrean pullout in Ethiopia
2023/01/22  00:00:00,Opinion: Bending the arc to embrace the promise of justice
2023/01/22  00:00:00,"Fresh appeal and reward posted on anniversary of death of Kennie Carter, 16"
2023/01/22  00:00:00,Pompeo to INN: You cant give an inch on things that matter most
2023/01/22  00:00:00,PM accuses Imran of being agent of chaos
2023/01/22  00:00:00,Ukraine war: Resilient civilians return to liberated town of Lyman
2023/01/22  00:00:00,"Local News | 

			Developers chosen to build hundreds of apartments at Carlsbads two train stations"
2023/01/22  00:00:00,"Mumbai: Uddhav Thackeray, Prakash Ambedkar to announce alliance for BMC polls"
2023/01/22  00:00:00,Justice Department investigating Abbott baby formula plant
2023/01/22  00:00:00,US hails Eritrean pullout in Ethiopia
2023/01/22  00:00:00,Burkina Faso demands the departure of French troops within a month
2023/01/22  00:00:00,"With dangerous anti-immigrant rhetoric, history risks repeating itself"
2023/01/22  00:00:00,Mumbai: BMC finally rebuilds MU wall demolished for PM Modi event
2023/01/22  00:00:00,CT lawmaker among those seeking to bar insurrectionists from holding office
2023/01/22  00:00:00,"Fresh appeal and reward posted on anniversary of death of Kennie Carter, 16"
2023/01/22  00:00:00,Burkina Faso demands the departure of French troops within a month
2023/01/22  00:00:00,Michel Martin 'very concerned' for Irish prisoner in Iran
2023/01/22  00:00:00,Ryanair flight escorted by fighter jets after bomb scare
2023/01/22  00:00:00,Ex-Las Vegas judge who resigned to settle ethics probe dies
2023/01/22  00:00:00,European common security and defence policy is now more important than ever
2023/01/22  00:00:00,Burkina Faso's military leader demands French departure
2023/01/22  00:00:00,How Europe needs freight trains to cross Russia from China
2023/01/22  00:00:00,APC North-West chair debunks working for Obi
2023/01/22  00:00:00,"Germany and France vow support for Ukraine, including military"
2023/01/22  00:00:00,American lawmakers urge U.S. to ship Abrams tanks to Ukraine
2023/01/22  00:00:00,Michel Martin 'very concerned' for Irish prisoner in Iran
2023/01/22  00:00:00,2023: Now is time for North to repay Tinubus support  Shettima
2023/01/22  00:00:00,"Vice President Harris hammers Floridas radical abortion ban, promises to keep fighting to protect rightsVice President Kamala Harris marks the anniversary of Roe v. Wade in Tallahassee. Jan. 22, 20123"
2023/01/22  00:00:00,"Germany and France vow support for Ukraine, including military"
2023/01/22  00:00:00,Our guber candidate has advantages  Rivers PDP to APCs Cole
2023/01/22  00:00:00,"Black mayors call public safety, homelessness biggest issues for New York, LA and Houston"
2023/01/22  00:00:00,Former PACE exec sues Pavilions under Whistleblower Act
2023/01/22  00:00:00,"Germany and France vow support for Ukraine, including military"
2023/01/22  00:00:00,Lawmakers seek to bar insurrectionists from holding office
2023/01/22  00:00:00,APC North-West chair debunks working for Obi
2023/01/22  00:00:00,U.S. Coalition Against Terrorism Should Include Latin America
2023/01/22  00:00:00,2023: Now is time for North to repay Tinubus support  Shettima
2023/01/22  00:00:00,"Vice President Harris hammers Floridas radical abortion ban, promises to keep fighting to protect rightsVice President Kamala Harris marks the anniversary of Roe v. Wade in Tallahassee. Jan. 22, 20123"
2023/01/22  00:00:00,Democratic mayoral control in big cities is the new blue wall
2023/01/22  00:00:00,"Germany and France vow support for Ukraine, including military"
2023/01/22  00:00:00,"Mass Shooter Dead, Identified, Motive Still Being Sought"
2023/01/22  00:00:00,Burkina Faso demands the departure of French troops within a month
2023/01/22  00:00:00,"Vice President Harris hammers Floridas radical abortion ban, promises to keep fighting to protect rightsVice President Kamala Harris marks the anniversary of Roe v. Wade in Tallahassee. Jan. 22, 20123"
2023/01/22  00:00:00,U.S. Coalition Against Terrorism Should Include Latin America
2023/01/22  00:00:00,CT lawmaker among those seeking to bar insurrectionists from holding office
2023/01/22  00:00:00,Israeli chef offers a taste of the Middle East to food influencers in Mumbai
2023/01/22  00:00:00,Rob Shaw: Expect Eby to press street safety with Trudeau on Sunday  even if its at a parade
2023/01/22  00:00:00,Sri Lanka to hold local councils polls in March
2023/01/22  00:00:00,"Concerns grow for missing man Ross Kinghorn, 57, who travelled to Blair Atholl"
2023/01/22  00:00:00,Ex-Las Vegas judge who resigned to settle ethics probe dies
2023/01/22  00:00:00,Poland is angry with Germany and urges the countries to support Kyiv with modern weapons
2023/01/22  00:00:00,Crime is a top issue in Chicago mayoral race: How the nine candidates plan to address it
2023/01/22  00:00:00,London tried to mediate Lebanese-Israeli peace in the 1990's - report
2023/01/22  00:00:00,CNN guest blasted for suggesting the word 'violent' doesn't describe Atlanta riots: 'What a joke'
2023/01/22  00:00:00,American lawmakers urge U.S. to ship Abrams tanks to Ukraine
2023/01/22  00:00:00,"Oklahoma town grieves 4-year-old Athena Brownfield, many unanswered questions remain"
2023/01/22  00:00:00,Poland is angry with Germany and urges the countries to support Kyiv with modern weapons
2023/01/22  00:00:00,London tried to mediate Lebanese-Israeli peace in the 1990's - report
2023/01/22  00:00:00,"Pope calls for end to violence in Peru, respect for human rights"
2023/01/22  00:00:00,Dzmitry Bandarenka: Belarusian Military Dont Want To Die
2023/01/22  00:00:00,13 striking photos show how people are celebrating the 2023 Lunar New Year around the world
2023/01/22  00:00:00,Poland is angry with Germany and urges the countries to support Kyiv with modern weapons
2023/01/22  00:00:00,US: Violent protest in downtown Atlanta over police killing of environmentalist
2023/01/22  00:00:00,"Centre's agri policies moving in direction set by UPA, says NCP chief Sharad Pawar"
2023/01/22  00:00:00,Ex-Las Vegas judge who resigned to settle ethics probe dies
2023/01/22  00:00:00,Govt failed at economic front: Chairman PEW
2023/01/22  00:00:00,Nan approached by 'angel' outside hospital who held her hand
2023/01/22  00:00:00,Russia says Wests supply of heavy arms to Ukraine will trigger global catastrophe
2023/01/22  00:00:00,A Promised Land: Jamaicans who call Ghana home find peace and happiness
2023/01/22  00:00:00,Artemis Accords: What are they & which countries are involved?
2023/01/22  00:00:00,Nigerias New Port Doubles Cargo Capacity
2023/01/22  00:00:00,"Meet Vincent LeVien, Advance Man of the East End"
2023/01/22  00:00:00,Federal admin careers starting at $26/hr
2023/01/22  00:00:00,"Meet IAS officer Adapa Karthik, who gave up Harvard, Cambridge scholarships to crack UPSC with AIR 1"
2023/01/22  00:00:00,American lawmakers urge U.S. to ship Abrams tanks to Ukraine
2023/01/22  00:00:00,London tried to mediate Lebanese-Israeli peace in the 1990's - report
2023/01/22  00:00:00,Dzmitry Bandarenka: Belarusian Military Dont Want To Die
2023/01/22  00:00:00,5 dead as militants storm government office in Somalia capital
2023/01/22  00:00:00,"Suspect in Monterey Park mass shooting killed self in van, authorities say; motive remains unknown"
2023/01/22  00:00:00,We raised our army in battles
2023/01/22  00:00:00,Ex-Las Vegas judge who resigned to settle ethics probe dies
2023/01/22  00:00:00,Lunar New Year mass shooting: Whats known about suspected gunman Huu Can Tran
2023/01/22  00:00:00,Four New Reasons Why the U.S. Must Stay Engaged in the South Caucasus
2023/01/22  00:00:00,Artemis Accords: What are they & which countries are involved?
2023/01/22  00:00:00,10 killed in mass shooting in Southern California
2023/01/22  00:00:00,"BBC Modi documentary: In Govt vs Opposition, blocked links resurface on Twitter"
2023/01/22  00:00:00,5 dead as militants storm government office in Somalia capital
2023/01/22  00:00:00,Pompeo to INN: You cant give an inch on things that matter most
2023/01/22  00:00:00,All you need to do is hit one rock and youre in trouble: Lochaber Mountain Rescue team look back on busy season
2023/01/22  00:00:00,Opinion: Bending the arc to embrace the promise of justice
2023/01/22  00:00:00,Poland is angry with Germany and urges the countries to support Kyiv with modern weapons
2023/01/22  00:00:00,Artemis Accords: What are they & which countries are involved?
2023/01/22  00:00:00,Dzmitry Bandarenka: Belarusian Military Dont Want To Die
2023/01/22  00:00:00,Alpha Beta: PDP asks EFCC to provide update on petition against Tinubu
2023/01/22  00:00:00,Nan approached by 'angel' outside hospital who held her hand
2023/01/22  00:00:00,Opinion: Bending the arc to embrace the promise of justice
2023/01/22  00:00:00,"2023 election: US speaks on preferred candidate, party"
2023/01/22  00:00:00,Former PACE exec sues Pavilions under Whistleblower Act
2023/01/22  00:00:00,Brazil's newly elected Lula heads to Argentina on first trip abroad
2023/01/22  00:00:00,Jack Knox: Sending handmade love through the Victoria-Ukraine pipeline
2023/01/22  00:00:00,Crime is a top issue in Chicago mayoral race: How the nine candidates plan to address it
2023/01/22  00:00:00,Prominent Cameroon journalist found dead after abduction
2023/01/22  00:00:00,Jack Knox: Sending handmade love through the Victoria-Ukraine pipeline
2023/01/22  00:00:00,"With town officials stepping down, Calais waits to see who might fill the void"
2023/01/22  00:00:00,President Lula sacks Brazils army chief after anti-government riots
2023/01/22  00:00:00,Turkish elections to be held on May 14 -Erdogan
2023/01/22  00:00:00,Oregon Sen. Jeff Merkley tour reveals Morrow County  residents frustration with groundwater inaction
2023/01/22  00:00:00,WH Pulled A Fast One On Reporters As DOJ Searched Biden's Home For More Documents
2023/01/22  00:00:00,There is no room: anti-immigration protesters march in Dublin
2023/01/22  00:00:00,"Suspect in Monterey Park mass shooting killed self in van, authorities say; motive remains unknown"
2023/01/22  00:00:00,GOP Rep. Comer: Evidence Everywhere that Biden Family Involved in Influence-Peddling Schemes
2023/01/22  00:00:00,Jack Knox: Sending handmade love through the Victoria-Ukraine pipeline
2023/01/22  00:00:00,"10 things you need to know today: January 22, 2023"
2023/01/22  00:00:00,Gov Ganduje unveils Kano State anthem
2023/01/22  00:00:00,Disneyland Facing Legal Action: Employees Allegedly Laughed at Disabled Woman Before Accident That Caused Her Death
2023/01/22  00:00:00,"Show your solid proof Perikatan did not bribe voters in GE15, Hamzah told"
2023/01/22  00:00:00,Peru closes Machu Picchu as unrest escalates
2023/01/22  00:00:00,DeSantis appointees could transform New College for the better | Opinion
2023/01/22  00:00:00,Austin Butler is solemn as he attends Lisa Marie Presley's Graceland memorial with girlfriend Kaia Gerber... after depicting her legendary father in Elvis film
2023/01/22  00:00:00,US hails Eritrean pullout in Ethiopia
2023/01/22  00:00:00,"Attack kills 10 in Syria, Kurdish forces arrest 52 militants"
2023/01/22  00:00:00,Desperate people who can't get help are looking for it online. The consequences can be shattering
2023/01/22  00:00:00,Jack Knox: Sending handmade love through the Victoria-Ukraine pipeline
2023/01/22  00:00:00,Disneyland Facing Legal Action: Employees Allegedly Laughed at Disabled Woman Before Accident That Caused Her Death
2023/01/22  00:00:00,Vatican probe launched into 'lockdown sex party' hosted at UK cathedral
2023/01/22  00:00:00,Late MCCC President David Nixon remembered for his contributions to Monroe community
2023/01/22  00:00:00,Power Play: Speedy transfer of power a show of caucus unity
2023/01/22  00:00:00,Folajimi-Olubumni Adewole: Plaque unveiled for Thames hero
2023/01/22  00:00:00,"Attack kills 10 in Syria, Kurdish forces arrest 52 militants"
2023/01/22  00:00:00,Read the chilling six-word text doomsday conspiracy theorist sent his 'daughter' in the middle of a bloody firefight with elite specialist police - as she opens up about cop-killer trio's bizarre love triangle
2023/01/22  00:00:00,London tried to mediate Lebanese-Israeli peace in the 1990's - report
2023/01/22  00:00:00,Peru closes Machu Picchu as unrest escalates
2023/01/22  00:00:00,Former PACE exec sues Pavilions under Whistleblower Act
2023/01/22  00:00:00,Austin Butler is solemn as he attends Lisa Marie Presley's Graceland memorial with girlfriend Kaia Gerber... after depicting her legendary father in Elvis film
2023/01/22  00:00:00,Prominent Cameroon journalist found dead after abduction
2023/01/22  00:00:00,Opinion: Bending the arc to embrace the promise of justice
2023/01/22  00:00:00,Donald Trump plans campaign stops targeting Republican opponents  and prosecutors
2023/01/22  00:00:00,Canada to pay Indigenous abuse survivors more than US$2b
2023/01/22  00:00:00,"Opinion | 

			SANDAG board weighs in on who has the power"
2023/01/22  00:00:00,Protesters demand Iran free jailed Belgian aid worker
2023/01/22  00:00:00,Iraqi Kurdish govt collecting unlicensed arms in exchange for money
2023/01/22  00:00:00,"Travel biz recovery to pick up in 2023, says Thomas Cook"
2023/01/22  00:00:00,Desperate people who can't get help are looking for it online. The consequences can be shattering
2023/01/22  00:00:00,"Pak PM Travelling Around The World With ""Begging Bowl"", Says Imran Khan"
2023/01/22  00:00:00,Donald Trump plans campaign stops targeting Republican opponents  and prosecutors
2023/01/22  00:00:00,Canada to pay Indigenous abuse survivors more than $2bn
2023/01/22  00:00:00,What the Kardashians can teach climate activists
2023/01/22  00:00:00,U.S. Coalition Against Terrorism Should Include Latin America
2023/01/22  00:00:00,"6 arrested after Cop City protesters lit Atlanta PD cruiser ablaze, smashed windows"
2023/01/22  00:00:00,NI leaders united on bringing forward organ donation law
2023/01/22  00:00:00,Texas Republican sounds alarm on border security legislation
2023/01/22  00:00:00,"Ireland's sailing, boating & maritime magazine"
2023/01/22  00:00:00,Russian lower house delegation arrives in Iran on official visit
2023/01/22  00:00:00,Dzmitry Bandarenka: Belarusian Military Dont Want To Die
2023/01/22  00:00:00,Texas college students say 'censorship of TikTok over guns' says a lot about how officials prioritize safety
2023/01/22  00:00:00,Lula accuses Bolsonaro of genocide against Yanomami in Amazon
2023/01/22  00:00:00,Govt failed at economic front: Chairman PEW
2023/01/22  00:00:00,American lawmakers urge U.S. to ship Abrams tanks to Ukraine
2023/01/22  00:00:00,The United States has a new plan to cut your visa wait time
2023/01/22  00:00:00,"Meet Vincent LeVien, Advance Man of the East End"
2023/01/22  00:00:00,Texas Republican sounds alarm on border security legislation
2023/01/22  00:00:00,Grant applications open for small businesses affected by COVID-19
2023/01/22  00:00:00,"162 Years Ago, this Missouri Battlefield Saw 2,500 Souls Perish"
2023/01/22  00:00:00,Congress To Protest Against BJP At 300 Locations In Bengaluru Tomorrow
2023/01/22  00:00:00,Turkish elections to be held on May 14 -Erdogan
2023/01/22  00:00:00,Govt failed at economic front: Chairman PEW
2023/01/22  00:00:00,"Vice President Harris hammers Floridas radical abortion ban, promises to keep fighting to protect rightsVice President Kamala Harris marks the anniversary of Roe v. Wade in Tallahassee. Jan. 22, 20123"
2023/01/22  00:00:00,Alec Baldwin will not be charged with the shooting of Rust director
2023/01/22  00:00:00,Rob Shaw: Expect Eby to press street safety with Trudeau on Sunday  even if its at a parade
2023/01/22  00:00:00,Brazil's newly elected Lula heads to Argentina on first trip abroad
2023/01/22  00:00:00,Google celebrates Lunar New Year 2023 with Year of the Rabbit doodle
2023/01/22  00:00:00,Latin American presidents throw weight behind campaign to free Julian Assange
2023/01/22  00:00:00,"162 Years Ago, this Missouri Battlefield Saw 2,500 Souls Perish"
2023/01/22  00:00:00,Policies bringing new prospects for sci-tech market
2023/01/22  00:00:00,PM tells police chiefs to repeal obsolete laws in States
2023/01/22  00:00:00,Alpha Beta: PDP asks EFCC to provide update on petition against Tinubu
2023/01/22  00:00:00,Abbasi calls upon judiciary to right the wrongs done to Nawaz Sharif
2023/01/22  00:00:00,Desperate people who can't get help are looking for it online. The consequences can be shattering
2023/01/22  00:00:00,"Montana beef processing ramps up with help from feds, but more butchers are needed"
2023/01/22  00:00:00,GOP Rep. Comer: Evidence Everywhere that Biden Family Involved in Influence-Peddling Schemes
2023/01/22  00:00:00,"Ten killed in mass shooting in Los Angeles area, police say"
2023/01/22  00:00:00,Australia buys potent and powerful sea mines to deter China
2023/01/22  00:00:00,Accelerating trade with innovation and green tech
2023/01/22  00:00:00,"Meet Vincent LeVien, Advance Man of the East End"
2023/01/22  00:00:00,Grant applications open for small businesses affected by COVID-19
2023/01/22  00:00:00,"Gujarat School Posts Unique Ad For Math Teacher, Applicants Asked To Solve Equation To 'Unlock' Phone Number"
2023/01/22  00:00:00,GOP Rep. Comer: Evidence Everywhere that Biden Family Involved in Influence-Peddling Schemes
2023/01/22  00:00:00,"GOP, Dems agree that Biden classified documents scandal must be investigated"
2023/01/22  00:00:00,CEO of large S.D. non-profit agency remains in his job despite federal sexual harassment settlement
2023/01/22  00:00:00,Power Play: Speedy transfer of power a show of caucus unity
2023/01/22  00:00:00,Army Burns Catholic Church and Convent to the Ground in Myanmar
2023/01/22  00:00:00,"Punjab govt considering film city project, says CM Bhagwant Mann"
2023/01/22  00:00:00,Iraqi Kurdish govt collecting unlicensed arms in exchange for money
2023/01/22  00:00:00,We Need to Build an Abortion Rights Movement That Demands More Than Roe
2023/01/22  00:00:00,"Maryam to return to Pakistan on Jan 28, says Rana Sanaullah"
2023/01/22  00:00:00,Latin American presidents throw weight behind campaign to free Julian Assange
2023/01/22  00:00:00,"Mumbai: Minor raped with threat to parents, HC upholds conviction under POCSO"
2023/01/22  00:00:00,"2023: Gandujes son promises effective representation, delivery of democratic dividends to Kano constituents"
2023/01/22  00:00:00,Los Angeles-Area Mass Shooting Leaves At Least 10 Dead
2023/01/22  00:00:00,Alpha Beta: PDP asks EFCC to provide update on petition against Tinubu
2023/01/22  00:00:00,South African President Ramaphosa extends warm wishes to China on Lunar New Year
2023/01/22  00:00:00,Texas college students say 'censorship of TikTok over guns' says a lot about how officials prioritize safety
2023/01/22  00:00:00,Boris Johnson visits Ukraine amid fresh sleaze allegations
2023/01/22  00:00:00,"Opposition Leaders Tweet Link To BBC Series On PM, Slam ""Censorship"""
2023/01/22  00:00:00,Erdogan key to normalising ties with Syria
2023/01/22  00:00:00,Alpha Beta: PDP asks EFCC to provide update on petition against Tinubu
2023/01/22  00:00:00,Lula accuses Bolsonaro of genocide against Yanomami in Amazon
2023/01/22  00:00:00,Texas college students say 'censorship of TikTok over guns' says a lot about how officials prioritize safety
2023/01/22  00:00:00,Stark County roundup: News from around the Canton region
2023/01/22  00:00:00,"Travel biz recovery to pick up in 2023, says Thomas Cook"
2023/01/22  00:00:00,WH Pulled A Fast One On Reporters As DOJ Searched Biden's Home For More Documents
2023/01/22  00:00:00,Alpha Beta: PDP asks EFCC to provide update on petition against Tinubu
2023/01/22  00:00:00,President Lula sacks Brazils army chief after anti-government riots
2023/01/22  00:00:00,"Growing demand.

Lifting the smokescreen from cannabis"
2023/01/22  00:00:00,Bolsonarismo has been defeated but it is not yet buried
2023/01/22  00:00:00,Rob Shaw: Expect Eby to press street safety with Trudeau on Sunday  even if its at a parade
2023/01/22  00:00:00,American lawmakers urge US to ship Abrams tanks to Ukraine
2023/01/22  00:00:00,Latin American presidents throw weight behind campaign to free Julian Assange
2023/01/22  00:00:00,How Europe needs freight trains to cross Russia from China
2023/01/22  00:00:00,"Embracing Lunar New Year with lucky money, lion dance"
2023/01/22  00:00:00,U.S. Coalition Against Terrorism Should Include Latin America
2023/01/22  00:00:00,"Ireland's sailing, boating & maritime magazine"
2023/01/22  00:00:00,"Rare, recovered 1930s footage of steamship offers glimpse of Okanagan's past"
2023/01/22  00:00:00,"Loud Light Kansas Politics Recap: abortion, oil spill, tax holiday, elections, and more"
2023/01/22  00:00:00,PM tells police chiefs to repeal obsolete laws in States
2023/01/22  00:00:00,American lawmakers urge US to ship Abrams tanks to Ukraine
2023/01/22  00:00:00,B.C. researcher unveils space yeast that could enable deep-space travel
2023/01/22  00:00:00,Latin American presidents throw weight behind campaign to free Julian Assange
2023/01/22  00:00:00,Stark County roundup: News from around the Canton region
2023/01/22  00:00:00,Army Burns Catholic Church and Convent to the Ground in Myanmar
2023/01/22  00:00:00,India News | Punjab Police Conduct Searches on Persons Linked with Gangster Lakhbir Landa
2023/01/22  00:00:00,President Lula sacks Brazils army chief after anti-government riots
2023/01/22  00:00:00,PM tells police chiefs to repeal obsolete laws in States
2023/01/22  00:00:00,"Ganduje unveils Kano anthem, promises state legislation"
2023/01/22  00:00:00,Alpha Beta: PDP asks EFCC to provide update on petition against Tinubu
2023/01/22  00:00:00,Four New Reasons Why the U.S. Must Stay Engaged in the South Caucasus
2023/01/22  00:00:00,"Netanyahu must step up, find Israeli judicial reform compromise - comment"
2023/01/22  00:00:00,US Teen Dies After Being Stabbed By A Gang
2023/01/22  00:00:00,ECP appoints media tycoon Naqvi as Punjab caretaker chief minister
2023/01/22  00:00:00,Coal power stations fired up and customers paid to cut energy use in UK cold snap
2023/01/22  00:00:00,Ex-Las Vegas judge who resigned to settle ethics probe dies
2023/01/22  00:00:00,"BJP leader holds demo in support of Dhirendra Shastri, asks seers to speak out against religious conversions"
2023/01/22  00:00:00,Indian Boarding Schools Testimony a Step Towards Healing
2023/01/22  00:00:00,"PM Modi Seeks Enhanced Cooperation Between State Police, Central Agencies"
