date,title
2023/01/22  00:00:00,List of Countries Where Indians Can Travel Without Passport: Check Complete Details Here
2023/01/22  00:00:00,Students wrote to Enoch Burke over attendance at school
2023/01/22  00:00:00,"Coronavirus: Policymakers Should Augment Hospital Capacity Where Needed, Not Mandate Permanent Excess Capacity"
2023/01/22  00:00:00,Preaching peace amid violence: Pope heads back to Africa
2023/01/22  00:00:00,Talking Politics with Nistula Hebbar | Rajasthan Congress Crisis | What is Sachin Pilots end game?
2023/01/22  00:00:00,Goa-bound Azur Air charter flight makes emergency landing in Uzbekistan
2023/01/22  00:00:00,"Over 16,000 illegals rounded up in single week in Saudi Arabia"
2023/01/22  00:00:00,Murder case registered against gangster-turned-politician Mukhtar Ansari in 2001 gang war case
2023/01/22  00:00:00,"Saudi Arabia: SR5,000 fine for illegally transporting passengers from airport"
2023/01/22  00:00:00,Virginia Gov. Youngkin stokes 2024 campaign speculation after killing Ford battery plant over its links to China
2023/01/22  00:00:00,Civics Project: Can good government and artificial intelligence go hand-in-hand?
2023/01/22  00:00:00,How cancer treatment led Italian police to fugitive mafia boss
2023/01/22  00:00:00,"Oil wells guzzle precious California water. Next door, residents cant use the tap"
2023/01/22  00:00:00,Preaching peace amid violence: Pope heads back to Africa
2023/01/22  00:00:00,News briefs: Kiwanis 2023 Ohio Statehood Day Achievement award nominations accepted
2023/01/22  00:00:00,How A Serial Killer Used The Highways In Texas And Oklahoma To Help Him Get Away With Multiple Murders
2023/01/22  00:00:00,Around Prince William: Pleasant memories and painful recollections
2023/01/22  00:00:00,Indian-Origin Man Shot Dead During Armed Robbery In US: Report
2023/01/22  00:00:00,"IMD alert: Heavy rainfall, hailstorm predicted in these northern states till 26 Jan. 10 points"
2023/01/22  00:00:00,8 Months Pregnant US Woman Laid Off By Google A Week Before Her Maternity Leave
2023/01/22  00:00:00,Musk recounts to jury his provocative tweet
2023/01/22  00:00:00,Gokulraj murder case | Madras High Court judges inspect temple and crime spot in Namakkal
2023/01/22  00:00:00,Natrain Batra: U.S. House gridlock could be broken; call it an impossible possible
2023/01/22  00:00:00,Brother unveils artwork honoring Fargo man fatally shot by police
2023/01/22  00:00:00,A group of Black residents in Portland is suing the city for displacement from their homes
2023/01/22  00:00:00,Indonesias New Penal Code: A Setback for Indonesian Democracy
2023/01/22  00:00:00,How Gas Stoves Became Part of Americas Raging Culture Wars
2023/01/22  00:00:00,Kamala Harris to highlight abortion fight at Roe v. Wade anniversary speech Sunday in TallahasseeKamala Harris fires up the base over reproductive rights.
2023/01/22  00:00:00,Brother unveils artwork honoring Fargo man fatally shot by police
2023/01/22  00:00:00,How Russian fake news paints 'the Germans'
2023/01/22  00:00:00,Biden calls on Congress to protect abortion on Roe anniversary
2023/01/22  00:00:00,"Oil wells guzzle precious California water. Next door, residents cant use the tap"
2023/01/22  00:00:00,Unpaid parking tickets in Allentown can land you in jail. Why at least one City Council member wants to change that
2023/01/22  00:00:00,Russians Injure 914 Children In Ukraine
2023/01/22  00:00:00,"Prince Harry and Meghan Markle Wont Join King Charles at Buckingham Palace For Historic Coronation Moment, Say Reports"
2023/01/22  00:00:00,New Columbia tattoo parlors have harder time finding spots to open under city rules
2023/01/22  00:00:00,Kamala Harris Speaks Out On Abortion Rights On Roe v Wade Anniversary
2023/01/22  00:00:00,How Russian fake news paints 'the Germans'
2023/01/22  00:00:00,Major parties likely to skip Congresss Srinagar rally to mark culmination of Bharat Jodo Yatra on Jan 30
2023/01/22  00:00:00,Unpaid parking tickets in Allentown can land you in jail. Why at least one City Council member wants to change that
2023/01/22  00:00:00,How Gas Stoves Became Part of Americas Raging Culture Wars
2023/01/22  00:00:00,Brother unveils artwork honoring Fargo man fatally shot by police
2023/01/22  00:00:00,"19 German Leopard 2 tanks available for transfer to Ukraine, reports Der Spiegel"
2023/01/22  00:00:00,"London Design Museum features teen-designed propagation tool, Eco Seed"
2023/01/22  00:00:00,A group of Black residents in Portland is suing the city for displacement from their homes
2023/01/22  00:00:00,"Rajya Sabha MP writes to FM Sitharaman, seeks duty on import of polyester spun yarn"
2023/01/22  00:00:00,Ghislaine Maxwell claims infamous Prince Andrew photo is 'fake' and she never met him
2023/01/22  00:00:00,How Gas Stoves Became Part of Americas Raging Culture Wars
2023/01/22  00:00:00,Battle raged over future of Herefordshire pub as closure threat loomed
2023/01/22  00:00:00,List of Countries Where Indians Can Travel Without Passport: Check Complete Details Here
2023/01/22  00:00:00,Students wrote to Enoch Burke over attendance at school
2023/01/22  00:00:00,"UK: Russia Will Likely Struggle to Staff, Equip Planned Force Expansion"
2023/01/22  00:00:00,Prisoners who sliced Nadine Lott killer open from temple to chin in brutal attack identified
2023/01/22  00:00:00,Kamala Harris to highlight abortion fight at Roe v. Wade anniversary speech Sunday in TallahasseeKamala Harris fires up the base over reproductive rights.
2023/01/22  00:00:00,Special remission programme: 189 Maharashtra jail inmates to be released on Republic Day
2023/01/22  00:00:00,It's Debatable: Has Elon Musk made Twitter unsafe?
2023/01/22  00:00:00,Thousands take to the streets of Madrid to demand the resignation of Spains Prime Minister Pedro Snchez
2023/01/22  00:00:00,When was Andrew Tate in prison and why was he released?
2023/01/22  00:00:00,Foreign Secretary would like to see Ukrainians equipped with German tanks
2023/01/22  00:00:00,Beyonc Returns To The Stage After A 5-Year Hiatus For The Grand Reveal of Atlantis The Royal in Dubai
2023/01/22  00:00:00,Indonesias New Penal Code: A Setback for Indonesian Democracy
2023/01/22  00:00:00,Across China: Ice-and-snow tourism gains steam in NE China
2023/01/22  00:00:00,Little known change could make a huge difference to Liverpool's elections
2023/01/22  00:00:00,Ghislaine Maxwell claims infamous Prince Andrew photo is 'fake' and she never met him
2023/01/22  00:00:00,Across China: French designer makes Chinese ancient town aglow with fireworks
2023/01/22  00:00:00,"Oil wells guzzle precious California water. Next door, residents cant use the tap"
2023/01/22  00:00:00,Thousands take to the streets of Madrid to demand the resignation of Spains Prime Minister Pedro Snchez
2023/01/22  00:00:00,Wilkes-Barre council OKs rail study that would include route to Philadelphia through the Lehigh Valley. But the mayor hits the brakes on it
2023/01/22  00:00:00,Crude bombs recovered near TMC leader's house a day after violence in Bengal's Bhangar
2023/01/22  00:00:00,Brother unveils artwork honoring Fargo man fatally shot by police
2023/01/22  00:00:00,Global Precious Metal Catalysts Market Outlook Report 2022-2027 - Lucrative Opportunities as Demand Increases from the Automotive and Pharmaceutical Industries
2023/01/22  00:00:00,News briefs: Kiwanis 2023 Ohio Statehood Day Achievement award nominations accepted
2023/01/22  00:00:00,Across China: Ice-and-snow tourism gains steam in NE China
2023/01/22  00:00:00,"10 dead, 10 wounded in mass shooting in Monterey Park, California, with suspect found dead"
2023/01/22  00:00:00,Wilkes-Barre council OKs rail study that would include route to Philadelphia through the Lehigh Valley. But the mayor hits the brakes on it
2023/01/22  00:00:00,Local Government Was No Sure Thing In Hawaii  Until Prince Kuhio Got Involved
2023/01/22  00:00:00,Russian Defense Ministry Says Discussed Bilateral Cooperation With CAR Prime Minister
2023/01/22  00:00:00,Brother unveils artwork honoring Fargo man fatally shot by police
2023/01/22  00:00:00,J&K Govt spending Rs 2-crore every day on treatment of common masses [details]
2023/01/22  00:00:00,100 gecs announce North American tour dates with Machine Girl
2023/01/22  00:00:00,"Ukraine war: 'Global catastrophe' threats, 'corruption' at Ukrainian MoD, Berlin tank stance slammed"
2023/01/22  00:00:00,Across China: French designer makes Chinese ancient town aglow with fireworks
2023/01/22  00:00:00,Qantas flight to Sydney forced to turn back and land in Fiji after crew notices 'fumes' billowing from the aircraft - as major concerns are raised over the airline's fifth turnback this week
2023/01/22  00:00:00,"Plane makes emergency landing on interstate in Knoxville, Tennessee"
2023/01/22  00:00:00,Wilkes-Barre council OKs rail study that would include route to Philadelphia through the Lehigh Valley. But the mayor hits the brakes on it
2023/01/22  00:00:00,A Carbon Bomb Lurks in Americas Marshlands
2023/01/22  00:00:00,No decline in farm deaths in Lancaster County; children most at risk
2023/01/22  00:00:00,"DPWH seeking China grants for Visayas, Mindanao bridges"
2023/01/22  00:00:00,2024 Watch: Top Haley adviser poached by Pence as shadow GOP presidential primary heats up
2023/01/22  00:00:00,8 Months Pregnant US Woman Laid Off By Google A Week Before Her Maternity Leave
2023/01/22  00:00:00,Local Government Was No Sure Thing In Hawaii  Until Prince Kuhio Got Involved
2023/01/22  00:00:00,Tory says he doesn't know about Nadhim Zahawi's tax affairs as he was busy 'shopping'
2023/01/22  00:00:00,2024 Watch: Top Haley adviser poached by Pence as shadow GOP presidential primary heats up
2023/01/22  00:00:00,Brother unveils artwork honoring Fargo man fatally shot by police
2023/01/22  00:00:00,Iranian Parliament Speaker meets IRGC headquarters
2023/01/22  00:00:00,TVTC Governor Meets Federal Minister for Overseas Pakistanis
2023/01/22  00:00:00,"Meet Jan Dougherty, volunteer advocate for people with disabilities"
2023/01/22  00:00:00,Local Government Was No Sure Thing In Hawaii  Until Prince Kuhio Got Involved
2023/01/22  00:00:00,UK space launch: What next for Space Forge after mission failure?
2023/01/22  00:00:00,Retail pharmacies may now dispense abortion pills but not in Arizona
2023/01/22  00:00:00,"Nearly 13,000 Covid-related hospital deaths in one week in China"
2023/01/22  00:00:00,2024 Watch: Top Haley adviser poached by Pence as shadow GOP presidential primary heats up
2023/01/22  00:00:00,Bank of Dave review  Rory Kinnear lifts real-life Burnley local hero drama
2023/01/22  00:00:00,Girl asks police to run DNA test on Christmas cookie for evidence of Santa Claus
2023/01/22  00:00:00,2024 Watch: Top Haley adviser poached by Pence as shadow GOP presidential primary heats up
2023/01/22  00:00:00,PM Anwar: Malaysia strongly condemns politicians Quran burning act in Sweden
2023/01/22  00:00:00,Speaker: Debates on gun control proposals possible in Texas House but approval unlikely
2023/01/22  00:00:00,Kielkucki: Educational savings accounts would reduce barriers for families
2023/01/22  00:00:00,"Ukraine war: 'Global catastrophe' threats, 'corruption' at Ukrainian MoD, Berlin tank stance slammed"
2023/01/22  00:00:00,Forbes Will Build First Middle East Tower in Egypts New Capital
2023/01/22  00:00:00,Germany will not keep Poland from sending tanks to Ukraine
2023/01/22  00:00:00,PM Anwar: Malaysia strongly condemns politicians Quran burning act in Sweden
2023/01/22  00:00:00,Local Government Was No Sure Thing In Hawaii  Until Prince Kuhio Got Involved
2023/01/22  00:00:00,2024 Watch: Top Haley adviser poached by Pence as shadow GOP presidential primary heats up
2023/01/22  00:00:00,U.S. Food Aid Should Focus on Combating Hunger and Malnutrition in Poor Nations
2023/01/22  00:00:00,Exact date 'snow bomb' to hit UK as Birmingham faces arctic freeze
2023/01/22  00:00:00,Ohanaeze Begs As IPOBs Simon Ekpa Threatens Peter Obis Supporters
2023/01/22  00:00:00,No decline in farm deaths in Lancaster County; children most at risk
2023/01/22  00:00:00,205 MPH?! The Fastest Speeding Ticket Ever Issued in Minnesota
2023/01/22  00:00:00,"Rajya Sabha MP writes to FM Sitharaman, seeks duty on import of polyester spun yarn"
2023/01/22  00:00:00,Gunman kills 10 near Lunar New Year festival in California
2023/01/22  00:00:00,Ghislaine Maxwell claims infamous Prince Andrew photo is 'fake' and she never met him
2023/01/22  00:00:00,No decline in farm deaths in Lancaster County; children most at risk
2023/01/22  00:00:00,News briefs: Kiwanis 2023 Ohio Statehood Day Achievement award nominations accepted
2023/01/22  00:00:00,I used to work on Mars rovers and now I develop self-driving cars. Here's how I made the pivot from NASA's JPL to Amazon's Zoox.
2023/01/22  00:00:00,Local Government Was No Sure Thing In Hawaii  Until Prince Kuhio Got Involved
2023/01/22  00:00:00,DUP warns PM against serving up half-baked deal on NI Protocol
2023/01/22  00:00:00,Abbasi says no quick fix to current problems
2023/01/22  00:00:00,"Ive still got plenty in the tank to lead Scotland, says Sturgeon"
2023/01/22  00:00:00,Endangered White-tailed Eagle found dead in Cavan
2023/01/22  00:00:00,Zulus Commemorate Anniversary of Epic Win Over British in South Africa
2023/01/22  00:00:00,18 tonnes of ration rice seized
2023/01/22  00:00:00,Chief diplomats boycott Libya-hosted Arab League meeting
2023/01/22  00:00:00,Brazilian meat giant under fire for allegedly misleading investors
2023/01/22  00:00:00,Four Pakistani journalists killed in 2022: CPNE report
2023/01/22  00:00:00,"Coronavirus: Policymakers Should Augment Hospital Capacity Where Needed, Not Mandate Permanent Excess Capacity"
2023/01/22  00:00:00,Winner and Loser of the Week in Florida politics  Week of 1.15.23
2023/01/22  00:00:00,Preaching peace amid violence: Pope heads back to Africa
2023/01/22  00:00:00,Illinois poised to require paid leave for workers: Dont we think that should be a basic human right?
2023/01/22  00:00:00,Person who makes a difference: Dubuque woman reaches 300 blood donations
2023/01/22  00:00:00,Reeves vows Labour would drain the swamp amid Tory scandals
2023/01/22  00:00:00,A group of Black residents in Portland is suing the city for displacement from their homes
2023/01/22  00:00:00,Germany will not keep Poland from sending tanks to Ukraine
2023/01/22  00:00:00,"When I struggled with breastfeeding, ancient images of motherhood helped me feel less isolated"
2023/01/22  00:00:00,Fiji's new coalition govt reaffirms one-China policy
2023/01/22  00:00:00,Love Island Olivia and Zara feud continues as they clash over Tom in argument
2023/01/22  00:00:00,Mitch Albom: A story about second chances  and who gets to give them
2023/01/22  00:00:00,Reeves vows Labour would drain the swamp amid Tory scandals
2023/01/22  00:00:00,"Netanyahu Submits to Supreme Court Ruling, FiresDeri as a Minister"
2023/01/22  00:00:00,"Coronavirus: Policymakers Should Augment Hospital Capacity Where Needed, Not Mandate Permanent Excess Capacity"
2023/01/22  00:00:00,Stunning Red Dress Made by 370 Artisans in 50 Countries Over 13 Years Tells Womens Stories
2023/01/22  00:00:00,Indonesias New Penal Code: A Setback for Indonesian Democracy
2023/01/22  00:00:00,Ten killed in shooting at Lunar New Year party in Monterey Park
2023/01/22  00:00:00,Speaker: Debates on gun control proposals possible in Texas House but approval unlikely
2023/01/22  00:00:00,Love Island Olivia and Zara feud continues as they clash over Tom in argument
2023/01/22  00:00:00,Human rights lawyer Thulani Maseko shot dead outside home in eSwatini
2023/01/22  00:00:00,Swedish prime minister condemns Koran burning
2023/01/22  00:00:00,"Oil wells guzzle precious California water. Next door, residents cant use the tap"
2023/01/22  00:00:00,University student dies as bus hits her in Dhaka
2023/01/22  00:00:00,Swedish prime minister condemns Koran burning
2023/01/22  00:00:00,News briefs: Kiwanis 2023 Ohio Statehood Day Achievement award nominations accepted
2023/01/22  00:00:00,Local Government Was No Sure Thing In Hawaii  Until Prince Kuhio Got Involved
2023/01/22  00:00:00,Court seeks explanation from Delhi Police commissioner over non-updation of SCRB data
2023/01/22  00:00:00,Human rights lawyer Thulani Maseko shot dead outside home in eSwatini
2023/01/22  00:00:00,2 remanded for attempted robbery on Mohakhali flyover
2023/01/22  00:00:00,Swedish prime minister condemns Koran burning
2023/01/22  00:00:00,Enraged Man Hired Contract Killer To Slay Wife and Her Boyfriend
2023/01/22  00:00:00,Swedish prime minister condemns Koran burning
2023/01/22  00:00:00,University student dies as bus hits her in Dhaka
2023/01/22  00:00:00,US Treasury Secretary Yellen visits notorious 'House of Slaves' in Senegal
2023/01/22  00:00:00,Kamala Harris Speaks Out On Abortion Rights On Roe v Wade Anniversary
2023/01/22  00:00:00,Bangladesh strongly condemns burning Holy Quran in Stockholm
2023/01/22  00:00:00,"Buzz Aldrin, the US astronaut who went to the moon, marries for 4th time on 93rd birthday"
2023/01/22  00:00:00,Indonesian President Jokowis approval rating at all-time high
2023/01/22  00:00:00,"Cash shortages, its impact on rural businesses"
2023/01/22  00:00:00,European Doors and Windows Industry to 2028 - New Construction and Growing Home Improvement Activities Drives Growth
2023/01/22  00:00:00,"Patient, 89, 'beaten to death' on hospital ward weeks after wife died as man arrested"
2023/01/22  00:00:00,"Rahul Gandhi creating hatred among people to regain power, tarnishing India's image: Rajnath Singh"
2023/01/22  00:00:00,"Rajya Sabha MP writes to FM Sitharaman, seeks duty on import of polyester spun yarn"
2023/01/22  00:00:00,Sister's grief for brother 'she raised herself' who was killed in WWII attack
2023/01/22  00:00:00,List of Countries Where Indians Can Travel Without Passport: Check Complete Details Here
2023/01/22  00:00:00,Indonesias New Penal Code: A Setback for Indonesian Democracy
2023/01/22  00:00:00,Exact date 'snow bomb' to hit UK as Birmingham faces arctic freeze
2023/01/22  00:00:00,Mitch Albom: A story about second chances  and who gets to give them
2023/01/22  00:00:00,DeSantis elections police force is in shambles | Steve Bousquet
2023/01/22  00:00:00,Air India offers Sale: Attractive discounts on domestic destinations
2023/01/22  00:00:00,Local Government Was No Sure Thing In Hawaii  Until Prince Kuhio Got Involved
2023/01/22  00:00:00,'Siren service' for Chinese tourist lands three police officers in trouble in resort town of Pattaya
2023/01/22  00:00:00,Stunning Red Dress Made by 370 Artisans in 50 Countries Over 13 Years Tells Womens Stories
2023/01/22  00:00:00,Mitch Albom: A story about second chances  and who gets to give them
2023/01/22  00:00:00,"Italys FM meets with Egyptian officials on migration, Libya"
2023/01/22  00:00:00,I'm not a 'green laird' says bidder for 10m Argyll estate
2023/01/22  00:00:00,"Afghanistan, Pakistan condemn burning of Holy Quran in Sweden"
2023/01/22  00:00:00,How cancer treatment led Italian police to fugitive mafia boss
2023/01/22  00:00:00,Slain California deputy honored with 50-mile procession
2023/01/22  00:00:00,"Oil wells guzzle precious California water. Next door, residents cant use the tap"
2023/01/22  00:00:00,Speaker: Debates on gun control proposals possible in Texas House but approval unlikely
2023/01/22  00:00:00,Authorities swarm van possibly linked to Los Angeles Lunar New Year mass shooting that left 10 dead
2023/01/22  00:00:00,Exact date 'snow bomb' to hit UK as Birmingham faces arctic freeze
2023/01/22  00:00:00,"Afghanistan, Pakistan condemn burning of Holy Quran in Sweden"
2023/01/22  00:00:00,Suspect in dance club shooting killed self after foiled 2nd attack; motive still unclear
2023/01/22  00:00:00,"These are B.C.'s translator kids, helping their immigrant families navigate Canadian life"
2023/01/22  00:00:00,News briefs: Kiwanis 2023 Ohio Statehood Day Achievement award nominations accepted
2023/01/22  00:00:00,Aubrey Plaza's Saturday Night Live Hosting Stint Featured A Surprise Admission From Joe Biden
2023/01/22  00:00:00,Netanyahu: US has genuine desire to reach understandings on Iran
2023/01/22  00:00:00,Endangered White-tailed Eagle found dead in Cavan
2023/01/22  00:00:00,Speaker: Debates on gun control proposals possible in Texas House but approval unlikely
2023/01/22  00:00:00,This week's most read stories for the Western  Telegraph
2023/01/22  00:00:00,Authorities swarm van possibly linked to Los Angeles Lunar New Year mass shooting that left 10 dead
2023/01/22  00:00:00,How Gas Stoves Became Part of Americas Raging Culture Wars
2023/01/22  00:00:00,"Afghanistan, Pakistan condemn burning of Holy Quran in Sweden"
2023/01/22  00:00:00,Fargo mayor objects to North Dakota bill that would outlaw approval voting
2023/01/22  00:00:00,Iran's parliament to label European militaries as 'terror organizations'
2023/01/22  00:00:00,First opposition rally in six years excites Tanzanian politicians
2023/01/22  00:00:00,"Rahul Gandhi creating hatred among people to regain power, tarnishing India's image: Rajnath Singh"
2023/01/22  00:00:00,NASA scientist explains why Venus is Earth's 'evil twin' (video)
2023/01/22  00:00:00,"Madhya Pradesh: Rahul Gandhi creating hatred among people to regain power, tarnishing India's image, says Rajnath Singh"
2023/01/22  00:00:00,DeSantis elections police force is in shambles | Steve Bousquet
2023/01/22  00:00:00,"Tanzania: Chadema party seeks to reach ""all wards and villages"" after rally ban lifted"
2023/01/22  00:00:00,Stunning Red Dress Made by 370 Artisans in 50 Countries Over 13 Years Tells Womens Stories
2023/01/22  00:00:00,First opposition rally in six years excites Tanzanian politicians
2023/01/22  00:00:00,Local Government Was No Sure Thing In Hawaii  Until Prince Kuhio Got Involved
2023/01/22  00:00:00,"Madhya Pradesh: Rahul Gandhi creating hatred among people to regain power, tarnishing India's image, says Rajnath Singh"
2023/01/22  00:00:00,North Korea Arming Russias Wagner Group in War on Ukraine
2023/01/22  00:00:00,Kentucky State Police to be equipped with body cameras
2023/01/22  00:00:00,In Ascension by Martin MacInnes review   a deep dive into sea and space
2023/01/22  00:00:00,"Security for Jewish communities still vital a year after Colleyville hostage crisis, groups say"
2023/01/22  00:00:00,"A day after twin blasts in Jammu, Rahul Gandhi resumes Bharat Jodo Yatra from Hiranagar area of J&K [details]"
2023/01/22  00:00:00,This week's most read stories for the Western  Telegraph
2023/01/22  00:00:00,Battle of Isandlwana - the Zulu nation's pride!
2023/01/22  00:00:00,Kamala Harris to highlight abortion fight at Roe v. Wade anniversary speech Sunday in TallahasseeKamala Harris fires up the base over reproductive rights.
2023/01/22  00:00:00,University student dies as bus hits her in Dhaka
2023/01/22  00:00:00,Ukraine 'like First World War' with stream of hapless Russians slain in 'no man's land'
2023/01/22  00:00:00,"Security for Jewish communities still vital a year after Colleyville hostage crisis, groups say"
2023/01/22  00:00:00,NASA scientist explains why Venus is Earth's 'evil twin' (video)
2023/01/22  00:00:00,Thread: House Oversight Launches Probe Into Border Crisis Under Biden Administration
2023/01/22  00:00:00,Kamala Harris Speaks Out On Abortion Rights On Roe v Wade Anniversary
2023/01/22  00:00:00,Battle of Isandlwana - the Zulu nation's pride!
2023/01/22  00:00:00,Enraged Man Hired Contract Killer To Slay Wife and Her Boyfriend
2023/01/22  00:00:00,What is the Lunar New Year and is it different to Chinese New Year?
2023/01/22  00:00:00,WATCH: SP leader Swami Prasad Maurya targets Tulsidas; demands ban on Ramcharitmanas
2023/01/22  00:00:00,Voices/Joseph Bauers | A strange day in a strange world
2023/01/22  00:00:00,I wish Santa Claus existed: she asks the police to test the DNA of a cookie
2023/01/22  00:00:00,Arab prisoner sinks teeth into Jewish cellmate because he 'likes Ben-Gvir'
2023/01/22  00:00:00,"Our opinion: Sheriffs, prosecutors don't get to pick laws to enforce"
2023/01/22  00:00:00,Boris Johnson signs his name on Ukrainian anti-armour weapon as he visits wreckage of battered Kyiv suburb - and meets again with President Zelensky
2023/01/22  00:00:00,Rohit Shetty remembers 'Chennai Express' while shooting train sequence
2023/01/22  00:00:00,"Ukraine war: 'Global catastrophe' threats, 'corruption' at Ukrainian MoD, Berlin tank stance slammed"
2023/01/22  00:00:00,Ukraine Latest: Germany Signals Approval for Poles to Send Tanks
2023/01/22  00:00:00,What is behind  the outpost evacuation?
2023/01/22  00:00:00,University student dies as bus hits her in Dhaka
2023/01/22  00:00:00,"Security for Jewish communities still vital a year after Colleyville hostage crisis, groups say"
2023/01/22  00:00:00,Then Again: Years of research reveal details of bomber crash on Camels Hump
2023/01/22  00:00:00,FACT SHEET:PresidentBiden to Sign Presidential Memorandum on Ensuring Safe Access to MedicationAbortion
2023/01/22  00:00:00,Monterey Park Mass Shooter Killed Himself As Police Closed In
2023/01/22  00:00:00,SC to hear CBI appeal challenging Bombay HC order granting bail to ex-minister Anil Deshmukh
2023/01/22  00:00:00,"Our opinion: Sheriffs, prosecutors don't get to pick laws to enforce"
2023/01/22  00:00:00,Florida Woman Shoots Her Terminally Ill Husband Inside Hospital Room
2023/01/22  00:00:00,"We will shame you, Ruto reacts to Raila's planned Kamukunji public meeting"
2023/01/22  00:00:00,Gang Of Valletta Thugs Looking For A Fight Beat Up And Hospitalise Young Maltese Teens
2023/01/22  00:00:00,Neighbours not interested? Montecito bookstore reveals it has only sold 30 copies of Prince Harry's autobiography Spare - despite the controversial book's record-breaking sales
