date,title
2023/01/22  00:00:00,"Covid curbs over, China's tourists hit Thai beaches for first time in three years"
2023/01/22  00:00:00,"Atlanta police arrest 6 in night of chaos after violent protesters lit cop car ablaze, smashed windows"
2023/01/22  00:00:00,Twin blasts leave nine injured in Jammu
2023/01/22  00:00:00,Mandeville mayor rethinking walking away from politics
2023/01/22  00:00:00,Chinese pray for health in Lunar New Year as COVID death toll rises
2023/01/22  00:00:00,1st Chinese tourist group arrives in Egypt since COVID-19 outbreak
2023/01/22  00:00:00,"Nigerians are ready to take back their country from APC  Arigbe-Osula, Reps ex-Dep Minority Leader"
2023/01/22  00:00:00,"In rural Wisconsin, former employees lift curtain on troubled crypto mine"
2023/01/22  00:00:00,NM Secretary of State on the rise of political violence
2023/01/22  00:00:00,Chinas FM urges IEA to ensure safety of Chinese nationals over New Year
2023/01/22  00:00:00,Biden Admin Reports Record 250K Migrant Encounters Along Southwest Border in December
2023/01/22  00:00:00,Energy Suppliers Warned to Stop Customer Mistreatment: Business Secretary
2023/01/22  00:00:00,"2023 polls: Uncertainty as unknown gunmen, bandits renew attacks, killings"
2023/01/22  00:00:00,One hospitalized in stabbing near Boston deli
2023/01/22  00:00:00,Big Brother scare campaign shows the depths clubs industry will plumb
2023/01/22  00:00:00,Cop martyred in K-P check post attack
2023/01/22  00:00:00,Watch  Trump Gives Eulogy at Ineitha Lynette Diamond Hardaway Funeral: Fantastic Woman that We Lost
2023/01/22  00:00:00,Voter Photo Identification: Protecting the Security of Elections
2023/01/22  00:00:00,Twin blasts leave nine injured in Jammu
2023/01/22  00:00:00,New Zealand Cup winner steals an Aussie Group One
2023/01/22  00:00:00,"2023 polls: Uncertainty as unknown gunmen, bandits renew attacks, killings"
2023/01/22  00:00:00,Chris Hipkins appeals for his family's privacy to be respected
2023/01/22  00:00:00,Russia's NGO Law: An Attack on Freedom and Civil Society
2023/01/22  00:00:00,City moves forward with $2 million bridge study
2023/01/22  00:00:00,Mysuru: Boy killed in suspected leopard attack in T.Narsipura taluk
2023/01/22  00:00:00,"2023 polls: Uncertainty as unknown gunmen, bandits renew attacks, killings"
2023/01/22  00:00:00,Authorities: Local sheriff's deputy shoots high-speed chase suspect who aimed vehicle at him
2023/01/22  00:00:00,Mandeville mayor rethinking walking away from politics
2023/01/22  00:00:00,"Teens involved in what looked like abduction at Chesterfield Towne Center are safe, police say"
2023/01/22  00:00:00,"News | 

			As Haitian gangs expand control, cops family is left shaken"
2023/01/22  00:00:00,NM Secretary of State on the rise of political violence
2023/01/22  00:00:00,"Who is Christina Schwarzenegger? Actor introduces stunning daughter, 31"
2023/01/22  00:00:00,NUSTs proposed Khuzdar campus will be a game changer
2023/01/22  00:00:00,Cop martyred in K-P check post attack
2023/01/22  00:00:00,1st Evidence Of Russias S-400 Triumf Defense System Destroyed In Ukraine War Surfaces On Social Media
2023/01/22  00:00:00,Cheap holiday destinations for 2023 including Spain and Prague
2023/01/22  00:00:00,"DOJ Searches Bidens Home, Finds More Documents with Classified Markings"
2023/01/22  00:00:00,Coillte's controversy: A UK-based investor fund and a ministerial summons
2023/01/22  00:00:00,China-UAE travel: Beijing allows group tourists to visit Emirates from next month
2023/01/22  00:00:00,Envoy says Taiwan learns from Ukraine war
2023/01/22  00:00:00,"On this day in history, January 22, 1973, Supreme Court issues landmark Roe v. Wade decision"
2023/01/22  00:00:00,Iqbal accuses Imran of creating anarchy
2023/01/22  00:00:00,The Observer view on the free market thinking that failed Britishvolt
2023/01/22  00:00:00,City moves forward with $2 million bridge study
2023/01/22  00:00:00,"Matric results are not a fluke, says MEC"
2023/01/22  00:00:00,Senior British Parliamentarians visiting Kazakhstan blocked by Kazakh government from meeting officials and Zhanbolat Mamay
2023/01/22  00:00:00,NM Secretary of State on the rise of political violence
2023/01/22  00:00:00,Republic Day 2023: See speech ideas and tips for school students
2023/01/22  00:00:00,"Marcos attendance at WEF yields more opportunities for PH in trade, investment"
2023/01/22  00:00:00,Livestreamers bring specialties of remote villages to center stage
2023/01/22  00:00:00,China-UAE travel: Beijing allows group tourists to visit Emirates from next month
2023/01/22  00:00:00,Republic Day 2023: See speech ideas and tips for school students
2023/01/22  00:00:00,PCG probes harassment of Filipino fishermen by Chinese coast guard in Ayungin Shoal
2023/01/22  00:00:00,Leopard tank dilemma as Germany tears itself in two over Ukraine
2023/01/22  00:00:00,Mumbai: SP MLA Abu Asim Azmi says he received death threat on PA's phone; FIR registered
2023/01/22  00:00:00,Bonnie Rybak 2022 Citizen of the Year
2023/01/22  00:00:00,"DOJ Searches Bidens Home, Finds More Documents with Classified Markings"
2023/01/22  00:00:00,1st Chinese tourist group arrives in Egypt since COVID-19 outbreak
2023/01/22  00:00:00,City moves forward with $2 million bridge study
2023/01/22  00:00:00,Cop martyred in K-P check post attack
2023/01/22  00:00:00,Livestreamers bring specialties of remote villages to center stage
2023/01/22  00:00:00,Twin blasts leave nine injured in Jammu
2023/01/22  00:00:00,Worcester schools chief stops plans to shuttle sex ed students off La Familia campus
2023/01/22  00:00:00,"Man shot in the butt during argument in north Houston, police say"
2023/01/22  00:00:00,PCG probes harassment of Filipino fishermen by Chinese coast guard in Ayungin Shoal
2023/01/22  00:00:00,Shraddha murder case: Delhi Police files 3000-page chargesheet with list of 100 witnesses against Aaftab Poonawala
2023/01/22  00:00:00,Tennessee Christian school principal indicted on 11 new child sex charges after 2022 arrest
2023/01/22  00:00:00,COVID-19 intranasal vaccine iNCOVACC to be out January 26
2023/01/22  00:00:00,TN teacher suspended for sexually harassing girl students
2023/01/22  00:00:00,Mumbai crime: MBBS student Sanes murder suspects police custody extended
2023/01/22  00:00:00,4.2 Million Migrants Apprehended Along Southwest Border Under Biden Admin
2023/01/22  00:00:00,Shraddha murder case: Delhi Police files 3000-page chargesheet with list of 100 witnesses against Aaftab Poonawala
2023/01/22  00:00:00,Joy Corrigan looks ethereal in white mini corset dress as she turns the sidewalk into a runway while arriving at Craig's in West Hollywood
2023/01/22  00:00:00,Cop martyred in K-P check post attack
2023/01/22  00:00:00,"On this day in history, January 22, 1973, Supreme Court issues landmark Roe v. Wade decision"
2023/01/22  00:00:00,6 displaced after fire in Chelsea apartment building
2023/01/22  00:00:00,EC assures CPI(M)-Cong delegation of peaceful polling in Tripura
2023/01/22  00:00:00,What Can Be Done to Stop Vehicular Terrorist Attacks
2023/01/22  00:00:00,Cop martyred in K-P check post attack
2023/01/22  00:00:00,FD Capital Launches FD and CFO Headhunting Service
2023/01/22  00:00:00,Energy Suppliers Warned to Stop Customer Mistreatment: Business Secretary
2023/01/22  00:00:00,Here's Why You Should Pick Up A New Hobby In 2023
2023/01/22  00:00:00,What is Lunar New Year and how is it celebrated?
2023/01/22  00:00:00,What Can Be Done to Stop Vehicular Terrorist Attacks
2023/01/22  00:00:00,COVID-19 intranasal vaccine iNCOVACC to be out January 26
2023/01/22  00:00:00,"Army frees abducted women, babies in Burkina Faso"
2023/01/22  00:00:00,This exhibition offers an insight into the history of Holocaust in Marathi
2023/01/22  00:00:00,'Frustrated' Gauff breaks down in tears after Australian Open exit
2023/01/22  00:00:00,"In rural Wisconsin, former employees lift curtain on troubled crypto mine"
2023/01/22  00:00:00,Kerala Forest Department Tranquilises Rogue Tusker
2023/01/22  00:00:00,Chinas FM urges IEA to ensure safety of Chinese nationals over New Year
2023/01/22  00:00:00,Putin's new 'ruthless' commander in Ukraine would 'take a sledgehammer to smash a nut'
2023/01/22  00:00:00,"Curfew irks Manchester residents, business owners"
2023/01/22  00:00:00,"On this day in history, January 22, 1973, Supreme Court issues landmark Roe v. Wade decision"
2023/01/22  00:00:00,Leeds drugs: Three men arrested over 2m cocaine and MDMA seizure
2023/01/22  00:00:00,Shraddha murder case: Delhi Police files 3000-page chargesheet with list of 100 witnesses against Aaftab Poonawala
2023/01/22  00:00:00,Coolidge 14-Year-Old Girl Killed In Drive By Shooting
2023/01/22  00:00:00,PA thanks Saudis for refusing to normalize ties with Israel
2023/01/22  00:00:00,The Observer view on the free market thinking that failed Britishvolt
2023/01/22  00:00:00,Birmingham dad kept in jail for almost three years despite being cleared of GBH
2023/01/22  00:00:00,What Can Be Done to Stop Vehicular Terrorist Attacks
2023/01/22  00:00:00,"Delhi Police Arrest Man For Impersonating UAE Govt Official, Cheating Leela Palace Hotel Of Rs 23L"
2023/01/22  00:00:00,"Fulfilling the UN dreams of Kale, a teenager battling cancer"
2023/01/22  00:00:00,"Italian American Writer Extends Festival Greetings, Shares New Year Expectations"
2023/01/22  00:00:00,"Feature: Ewenki herders combine traditions, new methods to raise reindeer in mountains"
2023/01/22  00:00:00,Bryan Kohberger was likely motivated by sexual arousal and 'hatred':  experts
2023/01/22  00:00:00,Lufthansa Bids For Stake In ITA Airways
2023/01/22  00:00:00,Campus blues: mass layoffs put IITians on edge
2023/01/22  00:00:00,Feds seize more than $600 million in assets from FTX founder Sam Bankman-Fried: Court filing
2023/01/22  00:00:00,"Feature: Ewenki herders combine traditions, new methods to raise reindeer in mountains"
2023/01/22  00:00:00,So-Safe arrests two for kidnapping herdsman in Ogun
2023/01/22  00:00:00,"About 3,000 tech employees now being fired a day on average in Jan"
2023/01/22  00:00:00,A round up of court cases heard in Cumbria this week
2023/01/22  00:00:00,"China's Economy to See Robust Recovery This Year, Says Researcher"
2023/01/22  00:00:00,How Netaji lived on as 'Gumnami Baba' in the minds of believers
2023/01/22  00:00:00,Phoenix PD Wants To Curb Soaring Crime Rate By Hiring More Female Officers
2023/01/22  00:00:00,Yes Bank Scam: Rana Kapoors daughter cant travel abroad orders special court
2023/01/22  00:00:00,Family of BLM leader Patrisse Cullors' cousin files $50m damages claim against LAPD after he died while being tasered by cops following crash: LAPD union claims he was uncooperative and high on coke
2023/01/22  00:00:00,"Downtown Atlanta protest turns into riot, six arrested, police say"
2023/01/22  00:00:00,"Rajasthan govt to rent out drones to farmers to help spray fertilisers, insecticides"
2023/01/22  00:00:00,"Italian American Writer Extends Festival Greetings, Shares New Year Expectations"
2023/01/22  00:00:00,Council to consider Highlawn TIF district creation following public hearing Monday
2023/01/22  00:00:00,Birmingham dad kept in jail for almost three years despite being cleared of GBH
2023/01/22  00:00:00,Joshimath: So far 863 buildings identified where cracks found due to land subsidence
2023/01/22  00:00:00,"In rural Wisconsin, former employees lift curtain on troubled crypto mine"
2023/01/22  00:00:00,"Before last pre-general election Budget, PM Modi convenes Council of Ministers"
2023/01/22  00:00:00,Recording studio at The Village Network is a therapeutic space for creativity
2023/01/22  00:00:00,"Italian American Writer Extends Festival Greetings, Shares New Year Expectations"
2023/01/22  00:00:00,PM Modis BBC documentary: Former RAW chief calls it prejudiced
2023/01/22  00:00:00,IRGC commander to EU: Don't make a mistake by blacklisting us as a terrorist organization
2023/01/22  00:00:00,"In rural Wisconsin, former employees lift curtain on troubled crypto mine"
2023/01/22  00:00:00,Expanded search resumes Saturday in Brookfield with still no sign of Brittany Tee
2023/01/22  00:00:00,"Before last pre-general election Budget, PM Modi convenes Council of Ministers"
2023/01/22  00:00:00,Yes Bank Scam: Rana Kapoors daughter cant travel abroad orders special court
2023/01/22  00:00:00,Leopard tank dilemma as Germany tears itself in two over Ukraine
2023/01/22  00:00:00,Plans to split Cebu archdiocese into 3 dioceses underway
2023/01/22  00:00:00,'Appalling and extremely disturbing' | Texas teacher fired after giving students assignment with offensive and racial slurs
2023/01/22  00:00:00,Police investigating after dog thrown from cliff - Mount Ousley
2023/01/22  00:00:00,A round up of court cases heard in Cumbria this week
2023/01/22  00:00:00,Yes Bank Scam: Rana Kapoors daughter cant travel abroad orders special court
2023/01/22  00:00:00,Leopard tank dilemma as Germany tears itself in two over Ukraine
2023/01/22  00:00:00,Bobby Pottinger continues to   bat well as he approaches 90
2023/01/22  00:00:00,Russia's NGO Law: An Attack on Freedom and Civil Society
2023/01/22  00:00:00,Senior British Parliamentarians visiting Kazakhstan blocked by Kazakh government from meeting officials and Zhanbolat Mamay
2023/01/22  00:00:00,Glasgow crime: The story of police war hero John McAulay
2023/01/22  00:00:00,A round up of court cases heard in Cumbria this week
2023/01/22  00:00:00,"Aubrey Plaza and Amy Poehler reunite on 'SNL,' revive 'Parks and Rec' characters"
2023/01/22  00:00:00,"Crochet, cards and cils: Civil War women behind bars"
2023/01/22  00:00:00,China continues to expand old-age insurance coverage
2023/01/22  00:00:00,How Netaji lived on as 'Gumnami Baba' in the minds of believers
2023/01/22  00:00:00,Bonnie Rybak 2022 Citizen of the Year
2023/01/22  00:00:00,Leopard tank dilemma as Germany tears itself in two over Ukraine
2023/01/22  00:00:00,"Appeal after assault, pursuit - Northern Beaches"
2023/01/22  00:00:00,We could have caused a major air disaster: Pink Floyd and the pig that flew away
2023/01/22  00:00:00,US Justice Dept found more classified items in Biden home search
2023/01/22  00:00:00,'Godmother of Botox' says 'everyone thought it was a crazy idea that would go nowhere'
2023/01/22  00:00:00,How Netaji lived on as 'Gumnami Baba' in the minds of believers
2023/01/22  00:00:00,"On this day in history, January 22, 1973, Supreme Court issues landmark Roe v. Wade decision"
2023/01/22  00:00:00,Man charged with kidnapping following a high-speed chase in Waterville
2023/01/22  00:00:00,Leopard tank dilemma as Germany tears itself in two over Ukraine
2023/01/22  00:00:00,Saseendrans tiger cull: Kerala forest minister made a gaffe; but states human-wildlife conflict needs redressal
2023/01/22  00:00:00,Expanded search resumes Saturday in Brookfield with still no sign of Brittany Tee
2023/01/22  00:00:00,Hidden away: the treatment of Civil War internees
2023/01/22  00:00:00,Man who duped hotel in Delhi caught in Karnataka
2023/01/22  00:00:00,Schoolies + Drugs = Jail in Bali
2023/01/22  00:00:00,EC assures CPI(M)-Cong delegation of peaceful polling in Tripura
2023/01/22  00:00:00,A round up of court cases heard in Cumbria this week
2023/01/22  00:00:00,Russia's NGO Law: An Attack on Freedom and Civil Society
2023/01/22  00:00:00,Raj Thackeray asks MNS members to work for party's win in civic polls
2023/01/22  00:00:00,Gujarat: Broker ends life due to lenders torture
2023/01/22  00:00:00,Tripura forms separate entity for intra-state electricity transmission
2023/01/22  00:00:00,Charges announced for those arrested in protests over controversial Cop City and fatal police shooting of activist
2023/01/22  00:00:00,Man charged with kidnapping following a high-speed chase in Waterville
2023/01/22  00:00:00,HK films showcased in London to embrace Year of Rabbit
2023/01/22  00:00:00,"Set Up For Bangla Refugees In 1971, MP's Chopna PS Top-Ranked By Home Ministry"
2023/01/22  00:00:00,Housing Project for Non-Billionaires Makes Waves in Nantucket
2023/01/22  00:00:00,"Crochet, cards and cils: Civil War women behind bars"
2023/01/22  00:00:00,China continues to expand old-age insurance coverage
2023/01/22  00:00:00,Bryan Kohberger was likely motivated by sexual arousal and 'hatred':  experts
2023/01/22  00:00:00,"Appeal after assault, pursuit - Northern Beaches"
2023/01/22  00:00:00,Saseendrans tiger cull: Kerala forest minister made a gaffe; but states human-wildlife conflict needs redressal
2023/01/22  00:00:00,Simon Napier-Bell: I arranged for Wham! to play Communist China
2023/01/22  00:00:00,Virginia lawmaker proposes waiting period for gun purchases in wake of Walmart mass shooting
2023/01/22  00:00:00,UK judge rejects Uyghur bid to halt Xinjiang cotton imports
2023/01/22  00:00:00,"From India and Canadas Quebec to the Netherlands, what does the metaphor of slavery disguise?"
2023/01/22  00:00:00,A North Pole man is the suspect in a Delta Junction double homicide
2023/01/22  00:00:00,"Before last pre-general election Budget, PM Modi convenes Council of Ministers"
2023/01/22  00:00:00,Mickey Rourke declares 'no way in hell' Alec Baldwin should be charged in fatal 'Rust' shooting
2023/01/22  00:00:00,Worcester schools chief stops plans to shuttle sex ed students off La Familia campus
2023/01/22  00:00:00,Australia imports its gas policy from Equatorial Guinea
2023/01/22  00:00:00,How to Get Ecuador Residency and Citizenship by Investment
2023/01/22  00:00:00,Bush Sends Troops to the Border
2023/01/22  00:00:00,"Mob crackdown shows South Florida is still home for organized crime, feds say"
2023/01/22  00:00:00,Two Hands nursery by vPPR is where design flair meets sustainability
2023/01/22  00:00:00,'Parakram Diwas' and 'Desh Nayak Diwas': Why are they celebrated on Netaji Subhash Chandra Bose's Jayanti?
2023/01/22  00:00:00,UK judge rejects Uyghur bid to halt Xinjiang cotton imports
2023/01/22  00:00:00,Bryan Kohberger was likely motivated by sexual arousal and 'hatred':  experts
2023/01/22  00:00:00,The Worlds of a Political Traveller
2023/01/22  00:00:00,"Mob crackdown shows South Florida is still home for organized crime, feds say"
2023/01/22  00:00:00,Worcester schools chief stops plans to shuttle sex ed students off La Familia campus
2023/01/22  00:00:00,"Vaccination rates in children drop again with estimated 275,000 kindergarteners unprotected"
2023/01/22  00:00:00,"Maritime Photo and Art Exhibit  The Return of Byron Huart: Before, After and Present at Montclair Public Library"
2023/01/22  00:00:00,Developed countries should be more proactive to ensure food security: Agri minister
2023/01/22  00:00:00,Housing Project for Non-Billionaires Makes Waves in Nantucket
2023/01/22  00:00:00,Mickey Rourke declares 'no way in hell' Alec Baldwin should be charged in fatal 'Rust' shooting
2023/01/22  00:00:00,"From India and Canadas Quebec to the Netherlands, what does the metaphor of slavery disguise?"
2023/01/22  00:00:00,Elysee Treaty: 60 years of Franco-German friendship
2023/01/22  00:00:00,TN teacher suspended for sexually harassing girl students
2023/01/22  00:00:00,Philippine world-known Boracay island waits for global tourists' return
2023/01/22  00:00:00,"Vaccination rates in children drop again with estimated 275,000 kindergarteners unprotected"
2023/01/22  00:00:00,"CM Eknath Shinde positive about old pension scheme for teachers, govt employees"
2023/01/22  00:00:00,Tripura forms separate entity for intra-state electricity transmission
2023/01/22  00:00:00,Jeremy Renner Fractured Over 30 Bones In Snow Plough Accident
2023/01/22  00:00:00,Fort Worth police shoot man they say presented a deadly threat during pursuit
2023/01/22  00:00:00,"Mob crackdown shows South Florida is still home for organized crime, feds say"
2023/01/22  00:00:00,Will Ranil Wickremesinghe walk the talk and implement 13th Amendment?
2023/01/22  00:00:00,China-UAE travel: Beijing allows group tourists to visit Emirates from next month
2023/01/22  00:00:00,Modi To Flag Off BJP's Campaign Against BRS In Run-Up To T'gana Polls
2023/01/22  00:00:00,German Defense Minister Pistorius May Visit Ukraine In Coming Weeks
2023/01/22  00:00:00,Jacinda Ardern will need 'more ongoing protection than any PM in NZ's history'
2023/01/22  00:00:00,"From India and Canadas Quebec to the Netherlands, what does the metaphor of slavery disguise?"
2023/01/22  00:00:00,Worcester schools chief stops plans to shuttle sex ed students off La Familia campus
2023/01/22  00:00:00,A North Pole man is the suspect in a Delta Junction double homicide
2023/01/22  00:00:00,India considers full implementation of 13th Amendment in Sri Lanka
2023/01/22  00:00:00,"About 3,000 tech employees now being fired a day on average in Jan"
2023/01/22  00:00:00,"In Uttar Pradesh, bride calls off wedding as groom fails to count money"
2023/01/22  00:00:00,Leopard tank dilemma as Germany tears itself in two over Ukraine
2023/01/22  00:00:00,The nine male bodies that remain unidentified in the East Midlands
2023/01/22  00:00:00,"From India and Canadas Quebec to the Netherlands, what does the metaphor of slavery disguise?"
2023/01/22  00:00:00,Do you want sex? Just point at the ceiling
2023/01/22  00:00:00,"Before last pre-general election Budget, PM Modi convenes Council of Ministers"
2023/01/22  00:00:00,How Netaji lived on as 'Gumnami Baba' in the minds of believers
2023/01/22  00:00:00,A North Pole man is the suspect in a Delta Junction double homicide
2023/01/22  00:00:00,Blast Claimed by Separatist Group Derails Train in Southwest Pakistan
2023/01/22  00:00:00,Burkina Faso Demands Departure Of French Troops
2023/01/22  00:00:00,"Florida cites CRT, Black Struggle, and communism in rejected African American course"
2023/01/22  00:00:00,Saseendrans tiger cull: Kerala forest minister made a gaffe; but states human-wildlife conflict needs redressal
2023/01/22  00:00:00,"JDS Sindagi candidate Shivananda Patil, 54, dies of heart attack"
2023/01/22  00:00:00,CNH Industrial union workers end strike at two U.S. plants with deal
2023/01/22  00:00:00,"Before last pre-general election Budget, PM Modi convenes Council of Ministers"
2023/01/22  00:00:00,Modi To Flag Off BJP's Campaign Against BRS In Run-Up To T'gana Polls
2023/01/22  00:00:00,Saseendrans tiger cull: Kerala forest minister made a gaffe; but states human-wildlife conflict needs redressal
2023/01/22  00:00:00,"Mob crackdown shows South Florida is still home for organized crime, feds say"
2023/01/22  00:00:00,"Before last pre-general election Budget, PM Modi convenes Council of Ministers"
2023/01/22  00:00:00,Jacinda Ardern will need 'more ongoing protection than any PM in NZ's history'
2023/01/22  00:00:00,How Netaji lived on as 'Gumnami Baba' in the minds of believers
2023/01/22  00:00:00,"Rare historic sword collection of 'eccentric' Leicestershire antiques dealer sold for 130,000"
2023/01/22  00:00:00,Why Dubai Police Museum saw a 20 per cent spike in visitors
2023/01/22  00:00:00,Chhattisgarh man axes wife to death over drinking habit
2023/01/22  00:00:00,Bryan Kohberger was likely motivated by sexual arousal and 'hatred':  experts
2023/01/22  00:00:00,"JDS Sindagi candidate Shivananda Patil, 54, dies of heart attack"
2023/01/22  00:00:00,How Netaji lived on as 'Gumnami Baba' in the minds of believers
2023/01/22  00:00:00,Summer prices are soaring: Heres how to book a cheap holiday in 2023
2023/01/22  00:00:00,"Rare historic sword collection of 'eccentric' Leicestershire antiques dealer sold for 130,000"
2023/01/22  00:00:00,Bryan Kohberger was likely motivated by sexual arousal and 'hatred':  experts
2023/01/22  00:00:00,Simon Napier-Bell: I arranged for Wham! to play Communist China
2023/01/22  00:00:00,"Review: Indulge in lip-smacking street-side flavours of Mumbai at Juhus newly-opened restaurant, Bambai"
2023/01/22  00:00:00,Voter Photo Identification: Protecting the Security of Elections
2023/01/22  00:00:00,"Mob crackdown shows South Florida is still home for organized crime, feds say"
2023/01/22  00:00:00,Lawmakers hoping to prevent psychiatric hospital from opening next to BR elementary school
2023/01/22  00:00:00,Assam CM assures Shah Rukh Khan of security amid on anti-Pathaan protests
2023/01/22  00:00:00,'People are dying like flies' The Welsh town crumbling under the weight of homelessness and drugs
2023/01/22  00:00:00,The mysterious Rs 60 cr paid as fine by Ansals for trauma centre
2023/01/22  00:00:00,"Review: Indulge in lip-smacking street-side flavours of Mumbai at Juhus newly-opened restaurant, Bambai"
2023/01/22  00:00:00,"26 years on, victims' families still knocking in vain on doors of justice"
2023/01/22  00:00:00,"Latvia, Estonia, Lithuania urge Germany to send tanks to Ukraine"
2023/01/22  00:00:00,Glasgow crime: The story of police war hero John McAulay
2023/01/22  00:00:00,'People are dying like flies' The Welsh town crumbling under the weight of homelessness and drugs
2023/01/22  00:00:00,"Mob crackdown shows South Florida is still home for organized crime, feds say"
2023/01/22  00:00:00,UAE health workers ramp up fight against zoonotic diseases
2023/01/22  00:00:00,"JDS Sindagi candidate Shivananda Patil, 54, dies of heart attack"
2023/01/22  00:00:00,"'Women, Life and Freedom' in Iran"
2023/01/22  00:00:00,"Delhi-Amritsar-Katra Expressway: Total length, route map, cost, completion date, maximum speed, facilities, updates"
2023/01/22  00:00:00,Peters Township seniors share South American sojourn with classmates
2023/01/22  00:00:00,Four men have been arrested after Sydney police pursuit
2023/01/22  00:00:00,Tripura forms separate entity for intra-state electricity transmission
2023/01/22  00:00:00,Judge dismisses suspended state attorneys lawsuit against DeSantis
2023/01/22  00:00:00,Glasgow crime: The story of police war hero John McAulay
2023/01/22  00:00:00,"'Women, Life and Freedom' in Iran"
