date,title
2023/01/22  00:00:00,Before the Voice: Political posturing and failed ambition
2023/01/22  00:00:00,"Pedophile was ignored in Israel, then arrested in the US"
2023/01/22  00:00:00,Israeli-US ties must be safeguarded - editorial
2023/01/22  00:00:00,Israeli-US ties must be safeguarded - editorial
2023/01/22  00:00:00,Before the Voice: Political posturing and failed ambition
2023/01/22  00:00:00,Before the Voice: Political posturing and failed ambition
2023/01/22  00:00:00,'Its a little bit of a challenge': Local pharmacists adjusting to new prescribing powers
2023/01/22  00:00:00,Who are the voice actors in Fire Emblem Engage? Full voice cast
2023/01/22  00:00:00,Price tag for new Ottawa police facility in Barrhaven jumps by $60 million
2023/01/22  00:00:00,"Slow, unaccountable and riven: Is the national healthcare watchdog sick?"
2023/01/22  00:00:00,San Diego Police Chief speaks at memorial for slain Riverside County deputy
2023/01/22  00:00:00,Prominent Quebec Cardinal Marc Ouellet denies second allegation of sexual misconduct
2023/01/22  00:00:00,"Family members of man shot, killed in Aliquippa speak out after his death"
2023/01/22  00:00:00,"Bhutan, China cannot agree on anything without Indias OK"
2023/01/22  00:00:00,"Bhutan, China cannot agree on anything without Indias OK"
2023/01/22  00:00:00,"Seroprevalence of SARS-CoV-2 Antibodies in Denmark: Results of Two Nationwide Population-Based Surveys, February and May 2021"
2023/01/22  00:00:00,"Bhutan, China cannot agree on anything without Indias OK"
2023/01/22  00:00:00,'We're in an exciting time': How Manitoba's educational institutions are dealing with AI-generated assignments
2023/01/22  00:00:00,"Bobbi Wilson, 9-year-old spotted lanternfly 'hero' from Caldwell, honored in Montclair"
2023/01/22  00:00:00,Popular downtown Vernon restaurant changing hands
2023/01/22  00:00:00,Sandi Toksvig to meet Archbishop of Canterbury amid same-sex marriage debate
2023/01/22  00:00:00,"Adelekes men responsible for my hotel demolition  Ex-PDP chieftain, Adeyi"
2023/01/22  00:00:00,"Bhutan, China cannot agree on anything without Indias OK"
2023/01/22  00:00:00,Brazil Declares Public Health Emergency for Yanomami People
2023/01/22  00:00:00,"Wife fatally shoots terminally ill husband at Daytona Beach hospital, police say"
2023/01/22  00:00:00,Yellen says debt standoff risks calamity
2023/01/22  00:00:00,Ottawa Humane Society launches program for dogs to visit fire stations
2023/01/22  00:00:00,A broken heart is officially a disease
2023/01/22  00:00:00,Murder of Freedom Fighter: Police have no clue about who killed him
2023/01/22  00:00:00,Israelis press on with protests against new government
2023/01/22  00:00:00,"Three years on, how COVID-19 has changed health care"
2023/01/22  00:00:00,"Adelekes men responsible for my hotel demolition  Ex-PDP chieftain, Adeyi"
2023/01/22  00:00:00,Brazil President Sacks Army Chief After January 8 Riots: Report
2023/01/22  00:00:00,"Adelekes men responsible for my hotel demolition  Ex-PDP chieftain, Adeyi"
2023/01/22  00:00:00,Brazil Congress riots: President Lula sacks army commander
2023/01/22  00:00:00,"King Charles' coronation to be held in May, Buckingham Palace announces"
2023/01/22  00:00:00,"In Senegal, Yellen talks about future of US-Africa relations"
2023/01/22  00:00:00,Brazil Congress riots: President Lula sacks army commander
2023/01/22  00:00:00,Zelenskyy honours allies who died in helicopter crash
2023/01/22  00:00:00,Police: Armed man fatally shot by officers in Barrio Logan after pursuit
2023/01/22  00:00:00,"People visit lantern festival at ancient city wall in Xi'an, Shaanxi"
2023/01/22  00:00:00,ShaCarri Richardson says she was removed from an American Airlines plane after arguing with a flight attendant
2023/01/22  00:00:00,Brazil Declares Public Health Emergency for Yanomami People
2023/01/22  00:00:00,ShaCarri Richardson says she was removed from an American Airlines plane after arguing with a flight attendant
2023/01/22  00:00:00,"Royal Court chief meets with representatives of Fuheis, Aqaba Womens Committee"
2023/01/22  00:00:00,Governor Reynolds Pens an Open Letter to Iowans on School Choice
2023/01/22  00:00:00,Suspended sentence for drugs in Portlaoise
2023/01/22  00:00:00,"King Tides engulf Mission Bay marsh, flood parts of San Diego"
2023/01/22  00:00:00,Governor Reynolds Pens an Open Letter to Iowans on School Choice
2023/01/22  00:00:00,South Korea authorises Novavax Covid-19 vaccine as booster dose
2023/01/22  00:00:00,ShaCarri Richardson says she was removed from an American Airlines plane after arguing with a flight attendant
2023/01/22  00:00:00,Brazil Declares Public Health Emergency for Yanomami People
2023/01/22  00:00:00,San Diego Police Chief speaks at memorial for slain Riverside County deputy
2023/01/22  00:00:00,"B.C. school district says 'personal data' on 19,000 students and staff was released"
2023/01/22  00:00:00,"Screen Legend, Oscar-Winner Robert DeNiro Is Filming in Kentucky"
2023/01/22  00:00:00,Terror chief who planned to bomb London Stock Exchange loses bid to be released from prison
2023/01/22  00:00:00,Roundup: Experts highlight challenges in fighting COVID-19 at WEF
2023/01/22  00:00:00,Gala night heralds Chinese Lunar New Year in Ghana
2023/01/22  00:00:00,"Family members of man shot, killed in Aliquippa speak out after his death"
2023/01/22  00:00:00,OMG Elizabeth Holmes Tried To Flee To Mexico After Being Found Guilty Of Fraud!
2023/01/22  00:00:00,'Homicide in slow motion': Police urged to tackle stalking amid rise of tracking tech
2023/01/22  00:00:00,2 suspects arrested in connection to New Year's Day murder of 19-year-old
2023/01/22  00:00:00,"Chinese Lunar New Year celebrated in Serbia with grand gala, fireworks"
2023/01/22  00:00:00,'Homicide in slow motion': Police urged to tackle stalking amid rise of tracking tech
2023/01/22  00:00:00,Aron Lund comments: What is next with Trkiye-Syria relations?
2023/01/22  00:00:00,'Homicide in slow motion': Police urged to tackle stalking amid rise of tracking tech
2023/01/22  00:00:00,"For minors convicted as adults, the sentence is 'purgatory'"
2023/01/22  00:00:00,NSW police boost to target bikie gangs in regional areas
2023/01/22  00:00:00,"For minors convicted as adults, the sentence is 'purgatory'"
2023/01/22  00:00:00,"311 polluted stretches along 279 rivers, watchdog finds"
2023/01/22  00:00:00,ShaCarri Richardson says she was removed from an American Airlines plane after arguing with a flight attendant
2023/01/22  00:00:00,"Russians Shell Six Communities In Sumy Region, 17-Year-Old Boy Injured"
2023/01/22  00:00:00,2 suspects arrested in connection to New Year's Day murder of 19-year-old
2023/01/22  00:00:00,DOJ Shows Resistance to House Republicans Investigations; GOP Says Department Is Scared
2023/01/22  00:00:00,US Military: Somalia Strike Killed 30 Al-Shabab Fighters
2023/01/22  00:00:00,"More rain, snow headed to Maine starting Sunday evening"
2023/01/22  00:00:00,Russia To Retaliate After RT Accounts Frozen In France: Reports
2023/01/22  00:00:00,"Enemy Shells Nikopol District, Industrial Enterprise Damaged"
2023/01/22  00:00:00,Brazils Lula fires army commander in wake of riots
2023/01/22  00:00:00,Three active-duty Marines arrested for participating in Jan. 6 US Capitol riot
2023/01/22  00:00:00,Update: Australia confirms acquisition of 40 UH-60Ms for army
2023/01/22  00:00:00,"Slow, unaccountable and riven: Is the national healthcare watchdog sick?"
2023/01/22  00:00:00,Before the Voice: Political posturing and failed ambition
2023/01/22  00:00:00,Accused El Paso Walmart gunman will plead guilty to federal charges
2023/01/22  00:00:00,Brazil Congress riots: President Lula sacks army commander
2023/01/22  00:00:00,Man released from custody after woman found dead in Lilydale
2023/01/22  00:00:00,"Russians Shell Six Communities In Sumy Region, 17-Year-Old Boy Injured"
2023/01/22  00:00:00,IMF Chief Kristalina Georgieva Optimistic Ahead Of Rwanda Visit
2023/01/22  00:00:00,Brazil's army chief fired in aftermath of capital uprising
2023/01/22  00:00:00,Brazil Declares Public Health Emergency for Yanomami People
2023/01/22  00:00:00,US Military: Somalia Strike Killed 30 Al-Shabab Fighters
2023/01/22  00:00:00,"Eskom calls for killer instinct, not paper tigers"
2023/01/22  00:00:00,Brazil's army chief fired in aftermath of capital uprising
2023/01/22  00:00:00,Brazil.. Dismissal of the army chief on the background of the riots
2023/01/22  00:00:00,New German defence minister to travel to Ukraine soon - Bild am Sonntag
2023/01/22  00:00:00,Sydney's Chinatowns hope to bounce back in the Year of the Rabbit
2023/01/22  00:00:00,Lula fires Brazils top Army Chief Arruda after riots in capital
2023/01/22  00:00:00,Canberra to work closely with new NZ PM
2023/01/22  00:00:00,Brazil Declares Public Health Emergency for Yanomami People
2023/01/22  00:00:00,"Bhutan, China cannot agree on anything without Indias OK"
2023/01/22  00:00:00,NSW police boost to target bikie gangs in regional areas
2023/01/22  00:00:00,Brazil Declares Public Health Emergency for Yanomami People
2023/01/22  00:00:00,Fredericksburg regional companies look to interns for help
2023/01/22  00:00:00,Boaters cautiously return to normal activity as New River drawbridge reopens
2023/01/22  00:00:00,Brazil's army chief fired in aftermath of capital uprising
2023/01/22  00:00:00,Fredericksburg regional companies look to interns for help
2023/01/22  00:00:00,Brazil President Sacks Army Chief After January 8 Riots: Report
2023/01/22  00:00:00,Increased demand in Asia pushes Finnair to increase European flights
2023/01/22  00:00:00,Brazil.. Dismissal of the army chief on the background of the riots
2023/01/22  00:00:00,"Scoot Airlines responds to DGCA notice, provide relief options for passengers left behind at Amritsar airport"
2023/01/22  00:00:00,Brazil President Sacks Army Chief After January 8 Riots: Report
2023/01/22  00:00:00,Brazil Congress riots: President Lula sacks army commander
2023/01/22  00:00:00,How Ukraine war led to a new Indian beer in Poland
2023/01/22  00:00:00,Brazil Declares Public Health Emergency for Yanomami People
2023/01/22  00:00:00,Fredericksburg regional companies look to interns for help
2023/01/22  00:00:00,Police: Four escaped inmates from Missouri captured in Ohio
2023/01/22  00:00:00,Three active-duty Marines arrested for participating in Jan. 6 US Capitol riot
2023/01/22  00:00:00,'Homicide in slow motion': Police urged to tackle stalking amid rise of tracking tech
2023/01/22  00:00:00,CBN to clamp down on illegal PoS operators
2023/01/22  00:00:00,Judge rules Van Gogh painting on loan to the DIA can't be seized
2023/01/22  00:00:00,Attorneys for Keenan Andersons estate file $50 million claim of damages against city of Los Angeles
2023/01/22  00:00:00,'Homicide in slow motion': Police urged to tackle stalking amid rise of tracking tech
2023/01/22  00:00:00,Girl asks police to test cookie for DNA proof of Santa
2023/01/22  00:00:00,'Homicide in slow motion': Police urged to tackle stalking amid rise of tracking tech
2023/01/22  00:00:00,Budzinski praised from all corners during ceremonial swearing-in
2023/01/22  00:00:00,Australia seek improvement despite opening Quad series win over England
2023/01/22  00:00:00,Rana Sanaullah says Maryam Nawaz to land in Pakistan on Jan 28
2023/01/22  00:00:00,Sea of Thieves ship PvP combat  tips and strategies
2023/01/22  00:00:00,Attorneys for Keenan Andersons estate file $50 million claim of damages against city of Los Angeles
2023/01/22  00:00:00,Geneva protesters call for democracy in Iran
2023/01/22  00:00:00,"[UPDATED] While Friday's 'Night of Rage' in Atlanta Remained Quiet, Saturday Protests Turned Violent"
2023/01/22  00:00:00,Australia seek improvement despite opening Quad series win over England
2023/01/22  00:00:00,IMF Chief Kristalina Georgieva Optimistic Ahead Of Rwanda Visit
2023/01/22  00:00:00,Lunar New Year: Chinese families meet for bittersweet reunions
2023/01/22  00:00:00,"Bhutan, China cannot agree on anything without Indias OK"
2023/01/22  00:00:00,CBN to clamp down on illegal PoS operators
2023/01/22  00:00:00,Lunar New Year: Chinese families meet for bittersweet reunions
2023/01/22  00:00:00,Australia seek improvement despite opening Quad series win over England
2023/01/22  00:00:00,"Joint Statement by the National Security Advisors of the UnitedStates of America, Israel, Bahrain, and the United ArabEmirates"
2023/01/22  00:00:00,"In Senegal, Yellen talks about future of US-Africa relations"
2023/01/22  00:00:00,Live: Chris Hipkins and Carmel Sepuloni confirmed as PM and Deputy
2023/01/22  00:00:00,Insights on the Modular Construction Global Market to 2027 - Increasing Requirement for Time and Cost-effective Construction Solutions Drives Growth
2023/01/22  00:00:00,"Joint Statement by the National Security Advisors of the UnitedStates of America, Israel, Bahrain, and the United ArabEmirates"
2023/01/22  00:00:00,"The glossy con that cost one couple $146,000 after they were hoodwinked by a 'slick professional' scam - and how crafty bank bosses got the cash back"
2023/01/22  00:00:00,Sporeans flock to JB for the long weekend
2023/01/22  00:00:00,"His, not mine: Meghan leaves Harry to fly solo on Spare blitz"
2023/01/22  00:00:00,"Bhutan, China cannot agree on anything without Indias OK"
2023/01/22  00:00:00,Dunkin set to open in West Temple Wednesday
2023/01/22  00:00:00,The President Of Turkmenistan Held Talks With The Prime Minister Of Russia
2023/01/22  00:00:00,World News | Tourist's Entry to Machu Picchu Suspended Amid Unrest in Peru
2023/01/22  00:00:00,Budzinski praised from all corners during ceremonial swearing-in
2023/01/22  00:00:00,"Rana Kapoors daughter cant go to US, says special CBI court"
2023/01/22  00:00:00,2 suspects arrested in connection to New Year's Day murder of 19-year-old
2023/01/22  00:00:00,BRiCM working to develop national production capacity: Officials
2023/01/22  00:00:00,Sporeans flock to JB for the long weekend
2023/01/22  00:00:00,"Joint Statement by the National Security Advisors of the UnitedStates of America, Israel, Bahrain, and the United ArabEmirates"
2023/01/22  00:00:00,Do white sex trafficking victims get more attention? Broward summit takes aim at bias
2023/01/22  00:00:00,The State Department's refugee resettlement program isn't such a new idea
2023/01/22  00:00:00,Police: Florida woman arrested after fatally shooting terminally ill husband inside hospital
2023/01/22  00:00:00,South Korea authorises Novavax Covid-19 vaccine as booster dose
2023/01/22  00:00:00,"His, not mine: Meghan leaves Harry to fly solo on Spare blitz"
2023/01/22  00:00:00,"The glossy con that cost one couple $146,000 after they were hoodwinked by a 'slick professional' scam - and how crafty bank bosses got the cash back"
2023/01/22  00:00:00,Price tag for new Ottawa police facility in Barrhaven jumps by $60 million
2023/01/22  00:00:00,"Casinos | 

			In unprecedented move, Rincon withdraws from California tribal gaming compact"
2023/01/22  00:00:00,Police: Florida woman arrested after fatally shooting terminally ill husband inside hospital
2023/01/22  00:00:00,Reddit Blasts Man Who Sneakily Told Wifes Boss That Shes Overworked: The 1950s Called
2023/01/22  00:00:00,Take it back: inside Pathfinder and AAGs claim against Mozambique
2023/01/22  00:00:00,Multiple shootings in Yuma leave 4 seriously injured
2023/01/22  00:00:00,Judge OKs trial for Illinois paramedics in patient's death
2023/01/22  00:00:00,Elon Musk Plans Big Change: New Subscription For Ad-Free Twitter
2023/01/22  00:00:00,Missing Evansville Man Found Deceased after Crashing his Vehicle
2023/01/22  00:00:00,Brazil's President Fires Army Chief After Anti-Government Riots
2023/01/22  00:00:00,IMF Chief Kristalina Georgieva Optimistic Ahead Of Rwanda Visit
2023/01/22  00:00:00,"Idaho killer Bryan Kohberger is a fantasist with no common sense & returned to scene to live out dream, expert claims"
2023/01/22  00:00:00,"NDLEA, EFCC seize fake $269,000, cannabis warehouse razed"
2023/01/22  00:00:00,US default could cause a global financial crisis: Treasury secretary
2023/01/22  00:00:00,Price tag for new Ottawa police facility in Barrhaven jumps by $60 million
2023/01/22  00:00:00,"Idaho killer Bryan Kohberger is a fantasist with no common sense & returned to scene to live out dream, expert claims"
2023/01/22  00:00:00,BVI - The University Of Southampton Signs Partnership Agreement
2023/01/22  00:00:00,Ottawa Humane Society launches program for dogs to visit fire stations
2023/01/22  00:00:00,Florida police say woman shot terminally ill husband at hospital
2023/01/22  00:00:00,A tale of two Chinatowns: a closer look at Box Hill and Melbourne's hubs
2023/01/22  00:00:00,Ottawa announces $2.8 billion to settle remaining part of B.C. day scholar lawsuit
2023/01/22  00:00:00,Florida police say woman shot terminally ill husband at hospital
2023/01/22  00:00:00,"People visit lantern festival at ancient city wall in Xi'an, Shaanxi"
2023/01/22  00:00:00,Sydney's Chinatowns hope to bounce back in the Year of the Rabbit
2023/01/22  00:00:00,Ottawa Humane Society launches program for dogs to visit fire stations
2023/01/22  00:00:00,Alberta premier promises email search amid questions over prosecutor interference
2023/01/22  00:00:00,GLOBALink | Int'l students in NW China celebrate Spring Festival
2023/01/22  00:00:00,Price tag for new Ottawa police facility in Barrhaven jumps by $60 million
2023/01/22  00:00:00,"Canada will repatriate Britain's 'Jihadi Jack', 28, from Syrian prison camp - raising fears scores of ISIS sympathisers could soon return to their home countries"
2023/01/22  00:00:00,"US Sanctions Russian Wagner Group, Urges Others to Follow"
2023/01/22  00:00:00,Aron Lund comments: What is next with Trkiye-Syria relations?
2023/01/22  00:00:00,Alberta premier promises email search amid questions over prosecutor interference
2023/01/22  00:00:00,Chinese New Year global gala night staged online in New Zealand
2023/01/22  00:00:00,"Lawyers, PSC union say IGPs tenure extension illegal"
2023/01/22  00:00:00,"Chinese Lunar New Year celebrated in Serbia with grand gala, fireworks"
2023/01/22  00:00:00,Single dadfrom war-torn Syria finds refuge with B.C. church community
2023/01/22  00:00:00,"Chinese Lunar New Year celebrated in Serbia with grand gala, fireworks"
2023/01/22  00:00:00,Durban II: Lessons for U.S. Engagement with the U.N. on Human Rights
2023/01/22  00:00:00,Brevard a community of low COVID-19 levels again as cases and hospitalizations dip slightly
2023/01/22  00:00:00,"Canada will repatriate Britain's 'Jihadi Jack', 28, from Syrian prison camp - raising fears scores of ISIS sympathisers could soon return to their home countries"
2023/01/22  00:00:00,Roundup: Experts highlight challenges in fighting COVID-19 at WEF
2023/01/22  00:00:00,NSW police boost to target bikie gangs in regional areas
2023/01/22  00:00:00,Live: Chris Hipkins and Carmel Sepuloni confirmed as PM and Deputy
2023/01/22  00:00:00,"Feature: Chinese Lunar New Year celebrated in Serbia with grand gala, fireworks"
2023/01/22  00:00:00,"Lawyers, PSC union say IGPs tenure extension illegal"
2023/01/22  00:00:00,Elon Musk Plans Big Change: New Subscription For Ad-Free Twitter
2023/01/22  00:00:00,Bill to ban Chinese citizens & government from buying Texas land gains steam among Republicans
2023/01/22  00:00:00,"Chinese Lunar New Year celebrated in Serbia with grand gala, fireworks"
2023/01/22  00:00:00,Omaha police seek public help locating 2020 homicide suspect
2023/01/22  00:00:00,Matteo Messina Denaro: How silence and compliance kept Mafia boss at large
2023/01/22  00:00:00,"Enemy Shells Nikopol District, Industrial Enterprise Damaged"
2023/01/22  00:00:00,Lunar New Year or Chinese New Year? Display in NTU gets vandalised
2023/01/22  00:00:00,Roundup: Experts highlight challenges in fighting COVID-19 at WEF
2023/01/22  00:00:00,"Missouri AG says lawsuit shows dystopian ties of big tech, federal agencies to suppress speech"
2023/01/22  00:00:00,"Stakeholders recommend stiffer punishments, education as Ogun ritual killings rise"
2023/01/22  00:00:00,"At NYC Lunar New Year Parade, Falun Gong Adherents Have Message for the World"
2023/01/22  00:00:00,Durban II: Lessons for U.S. Engagement with the U.N. on Human Rights
2023/01/22  00:00:00,"Twin blasts triggered by timer IEDs rock Narwal; 9 injured, many vehicles damaged"
2023/01/22  00:00:00,"Feature: Chinese Lunar New Year celebrated in Serbia with grand gala, fireworks"
2023/01/22  00:00:00,Mom Sneaks into Hudson Valley School Before Her Kids Fight
2023/01/22  00:00:00,Lunar New Year or Chinese New Year? Display in NTU gets vandalised
2023/01/22  00:00:00,"Pedophile was ignored in Israel, then arrested in the US"
2023/01/22  00:00:00,Mom Sneaks into Hudson Valley School Before Her Kids Fight
2023/01/22  00:00:00,"At NYC Lunar New Year Parade, Falun Gong Adherents Have Message for the World"
2023/01/22  00:00:00,Buhari has failed to address herders problems  MACBAN President
2023/01/22  00:00:00,"As Kolkatas Jewish community dwindles, one woman dreams of the legacy they should leave behind"
2023/01/22  00:00:00,"Wife fatally shoots terminally ill husband at Daytona Beach hospital, police say"
2023/01/22  00:00:00,Violence erupts in heart of Kolkata as ISF protesters clash with cops
2023/01/22  00:00:00,"Pre-poll raids: Nagaland police seize drugs, contrabands worth of Rs 18.50 cr in one week"
2023/01/22  00:00:00,Smart people saying smart things (1.21.23)
2023/01/22  00:00:00,Police: Armed man fatally shot by officers in Barrio Logan after pursuit
2023/01/22  00:00:00,Paul And His Recent Interpreters:  A Summary And Review
2023/01/22  00:00:00,Durban II: Lessons for U.S. Engagement with the U.N. on Human Rights
2023/01/22  00:00:00,Police academy cadets join search for missing woman in central Mass.
2023/01/22  00:00:00,'Homicide in slow motion': Police urged to tackle stalking amid rise of tracking tech
2023/01/22  00:00:00,Vernon volunteer wins NexusBC Community Resource Centres contest
2023/01/22  00:00:00,Tennessee Gov. Bill Lee sworn in for 2nd term
2023/01/22  00:00:00,Florida Woman Shoots Her Terminally Ill Husband Inside Hospital Room
2023/01/22  00:00:00,Canada settles residential schools lawsuit for $2.8bn
2023/01/22  00:00:00,Attorneys for Keenan Andersons estate file $50 million claim of damages against city of Los Angeles
2023/01/22  00:00:00,More Biden documents found after DOJ searches his Delaware home
2023/01/22  00:00:00,'Homicide in slow motion': Police urged to tackle stalking amid rise of tracking tech
2023/01/22  00:00:00,Nepal plane crash: Relatives of 4 Indians yet to receive dead bodies
2023/01/22  00:00:00,"Rana Kapoors daughter cant go to US, says special CBI court"
2023/01/22  00:00:00,Florida Woman Shoots Her Terminally Ill Husband Inside Hospital Room
2023/01/22  00:00:00,Widow sentenced to over 3 years in prison for drug dealing
2023/01/22  00:00:00,Finland Writes History With Crowdsourced Copyright Law
2023/01/22  00:00:00,Tennessee Gov. Bill Lee sworn in for 2nd term
2023/01/22  00:00:00,A tale of two Chinatowns: a closer look at Box Hill and Melbourne's hubs
2023/01/22  00:00:00,Space related startups got boost under PM Modis leadership: Jitendra Singh
2023/01/22  00:00:00,Suspect arrested in Iowa 9 months after Arizona killing
2023/01/22  00:00:00,Durban II: Lessons for U.S. Engagement with the U.N. on Human Rights
2023/01/22  00:00:00,San Diego Police Chief speaks at memorial for slain Riverside County deputy
2023/01/22  00:00:00,Brazil's President Fires Army Chief After Anti-Government Riots
2023/01/22  00:00:00,Taxi firm drops Tommy Tiernan sponsorship after offensive joke
2023/01/22  00:00:00,Arizona murder suspect arrested in Charles City after nine-month manhunt
2023/01/22  00:00:00,Two officers charged with assault after man injured during arrest in Melbourne
2023/01/22  00:00:00,Yellen Says Debt Standoff Risks Calamity
2023/01/22  00:00:00,Murder of Freedom Fighter: Police have no clue about who killed him
2023/01/22  00:00:00,Taiwan Urged To Leverage Tech For Security Cooperation With NATO
2023/01/22  00:00:00,A woman was arrested for killing her terminally ill husband at a Florida hospital
2023/01/22  00:00:00,Brazil's President Fires Army Chief After Anti-Government Riots
2023/01/22  00:00:00,Widow sentenced to over 3 years in prison for drug dealing
2023/01/22  00:00:00,Lunar New Year: Chinese families meet for bittersweet reunions
2023/01/22  00:00:00,"Stakeholders recommend stiffer punishments, education as Ogun ritual killings rise"
2023/01/22  00:00:00,Attorneys for Keenan Andersons estate file $50 million claim of damages against city of Los Angeles
2023/01/22  00:00:00,"Pedophile was ignored in Israel, then arrested in the US"
2023/01/22  00:00:00,IMF Chief Kristalina Georgieva Optimistic Ahead Of Rwanda Visit
2023/01/22  00:00:00,Arizona murder suspect arrested in Charles City after nine-month manhunt
2023/01/22  00:00:00,"Twin blasts triggered by timer IEDs rock Narwal; 9 injured, many vehicles damaged"
2023/01/22  00:00:00,"Shots fired at Minnetonka complex lead to evacuation, standoff"
2023/01/22  00:00:00,Tennessee Gov. Bill Lee sworn in for 2nd term
2023/01/22  00:00:00,You've Been Pronouncing Raven-Symon's Name Wrong This Whole Time
2023/01/22  00:00:00,Why this controversial prison firm's $69 million Nauru asylum seeker deal is under scrutiny
2023/01/22  00:00:00,Lunar New Year: Chinese families meet for bittersweet reunions
2023/01/22  00:00:00,"Study reveals several genes, individual genetic variations are associated with atrial fibrillation"
2023/01/22  00:00:00,"Rana Kapoors daughter cant go to US, says special CBI court"
2023/01/22  00:00:00,"After New York ban, indigenous Nations want to help public schools nix offensive mascots"
