date,title
2023/08/20  00:00:00,"Local News | 

			The Column: Money does grow on trees, apparently"
2023/08/20  00:00:00,"The Netherlands and Denmark will give F-16 fighter jets to Ukraine, the Dutch prime minister says"
2023/08/20  00:00:00,Republicans pretend to be the party of family values in NC. Theyre not. | Opinion
2023/08/20  00:00:00,Lebanons central bank reports $8.6 bln in liquid foreign assets
2023/08/20  00:00:00,King Charles's relative hosts posh safari for sanctioned Russian oligarch
2023/08/20  00:00:00,Tensions rise over proposal to loan ancient Jesus mosaic to US museum
2023/08/20  00:00:00,Ukraine's President Zelenskyy vows harsh retaliation for Russia's missile assault in Chernihiv that killed seven people
2023/08/20  00:00:00,Minister hands over financing aid for three tourism villages in Banten
2023/08/20  00:00:00,"Once in danger, Mexicos green jewel has become a model of conservation"
2023/08/20  00:00:00,Former West Virginia police officer indicted for missing K-9 arrested in Henry County
2023/08/20  00:00:00,"News | 

			With government on the verge of resting, sexual harassment, Chinatown deal, secret FBI recordings stir Tim Mapes case"
2023/08/20  00:00:00,"South Africa gears up to host BRICS Summit, over 45 delegations along with 5 member countries to attend"
2023/08/20  00:00:00,"Magnolia LNG Export Facility, Lake Charles, Louisiana"
2023/08/20  00:00:00,Tanker believed to hold sanctioned Iran oil begins to be offloaded near Texas despite Tehran threats
2023/08/20  00:00:00,"Local News | 

			The Column: Money does grow on trees, apparently"
2023/08/20  00:00:00,Iran says West using protesters to threaten elections
2023/08/20  00:00:00,"Minister of Royal Office receives ambassadors of Iraq, Syria"
2023/08/20  00:00:00,"Tech, talent and culture: Why Dayton entrepreneurs never stop innovating"
2023/08/20  00:00:00,"Onion farmers protest Centres 40% duty on export, halts auction in Maharashtra"
2023/08/20  00:00:00,"News | 

			With government on the verge of resting, sexual harassment, Chinatown deal, secret FBI recordings stir Tim Mapes case"
2023/08/20  00:00:00,"History Teaches Us Military Actions Have Brought Heartbreaks Instead Of Stability In Africa, Algeria Warns ECOWAS, Niger Junta"
2023/08/20  00:00:00,NYSC Director-General calls for more support from NASS
2023/08/20  00:00:00,Photo Gallery: Party animals make celebration fun at Benchmark Senior Living
2023/08/20  00:00:00,Police appeal to locate missing elderly woman - Belrose
2023/08/20  00:00:00,Tanker believed to hold sanctioned Iran oil begins to be offloaded near Texas despite Tehran threats
2023/08/20  00:00:00,Multiple agencies work collaboratively to help restore Minnesotas struggling moose population
2023/08/20  00:00:00,Dana White reacts to Sean OMalley dethroning Aljamain Sterling at UFC 292
2023/08/20  00:00:00,Was your degree really worth it?
2023/08/20  00:00:00,Rossi pushing Bezzecchi to remain with VR46 in MotoGP despite factory bike offer
2023/08/20  00:00:00,Effort to stop solar project in Porter County over after application rejection by planning department
2023/08/20  00:00:00,"Local News | 

			The Column: Money does grow on trees, apparently"
2023/08/20  00:00:00,"Ulan Bator holds cultural festival to promote nomadic intangible culture, tourism"
2023/08/20  00:00:00,"Opinion | 

			Road to Middle East peace runs through Palestinian state"
2023/08/20  00:00:00,"When your elderly Connecticut mom gets scammed, what do you do? Start a crusade, of course."
2023/08/20  00:00:00,Valli Arunachalams fight for her rights against gender bias in Murugappa Group. Explained
2023/08/20  00:00:00,"Militancy is down, but suicide rate among students at all-time high in J&K"
2023/08/20  00:00:00,Dubai boy with cancer aces A levels despite the odds
2023/08/20  00:00:00,Pro-coup rally in Niger after military leader warns against foreign intervention
2023/08/20  00:00:00,Multiple agencies work collaboratively to help restore Minnesotas struggling moose population
2023/08/20  00:00:00,"Militancy is down, but suicide rate among students at all-time high in J&K"
2023/08/20  00:00:00,Climate victory in Montana a lesson for Florida
2023/08/20  00:00:00,American Airlines sues travel site after banning teen for using skiplagging scheme
2023/08/20  00:00:00,Kanye West and 'wife' Bianca Censori's relationship timeline: A look inside the couple's whirlwind romance and walk down the aisle just TWO months after finalizing divorce from Kim Kardashian
2023/08/20  00:00:00,Lebanons central bank reports $8.6 bln in liquid foreign assets
2023/08/20  00:00:00,West Virginia lawmakers pour around $100 million into improving the jails system. Its not nearly enough.
2023/08/20  00:00:00,Effort to stop solar project in Porter County over after application rejection by planning department
2023/08/20  00:00:00,"The Netherlands and Denmark will give F-16 fighter jets to Ukraine, the Dutch prime minister says"
2023/08/20  00:00:00,PFAS detected in 15 local public water systems over proposed EPA guidelines
2023/08/20  00:00:00,Valli Arunachalams fight for her rights against gender bias in Murugappa Group. Explained
2023/08/20  00:00:00,MOH signs agreement for Kidney Dialysis Unit in Bidiyah Hospital
2023/08/20  00:00:00,Explained: Why doctors are opposing govt's directive on prescription of generic medicines
2023/08/20  00:00:00,"News | 

			With government on the verge of resting, sexual harassment, Chinatown deal, secret FBI recordings stir Tim Mapes case"
2023/08/20  00:00:00,"ECOWAS special envoys meet Niger's ousted president, junta leader"
2023/08/20  00:00:00,"Georgia Conservatives' Warning To GOP: Nominate Trump, And We Will Lose"
2023/08/20  00:00:00,"Local News | 

			The Column: Money does grow on trees, apparently"
2023/08/20  00:00:00,"ECOWAS special envoys meet Niger's ousted president, junta leader"
2023/08/20  00:00:00,PFAS detected in 15 local public water systems over proposed EPA guidelines
2023/08/20  00:00:00,"Things To Do | 

			Ask the Lawyer: Can employer refuse to accommodate religious practices?"
2023/08/20  00:00:00,Pornography will no longer be crime in Ukraine
2023/08/20  00:00:00,MOH signs agreement for Kidney Dialysis Unit in Bidiyah Hospital
2023/08/20  00:00:00,Niger coup leader Gen Tchiani promises to handover power in three years
2023/08/20  00:00:00,"Meet Rodney Hall, Army Ranger and soon-to-be first Black Republican in MS House since 1894"
2023/08/20  00:00:00,PFAS detected in 15 local public water systems over proposed EPA guidelines
2023/08/20  00:00:00,NYSC Director-General calls for more support from NASS
2023/08/20  00:00:00,"Magnolia LNG Export Facility, Lake Charles, Louisiana"
2023/08/20  00:00:00,"Samangan residents complain of drinking, irrigation water shortage"
2023/08/20  00:00:00,PFAS detected in 15 local public water systems over proposed EPA guidelines
2023/08/20  00:00:00,"6-year-old girl, father of 4, and student: What we know about those killed in Chernihiv"
2023/08/20  00:00:00,Highest levels of security by Natjoints at BRICSSummit
2023/08/20  00:00:00,"Starved Rock among Illinois' best places for hiking, waterfalls. Heres what to know."
2023/08/20  00:00:00,Victoria Beckham flashes bra in cosy snaps with husband David as they celebrate huge win
2023/08/20  00:00:00,How German Foreign Ministers Cancelled Trip Due to Plane Problems Is Symbolic of Countrys Decline
2023/08/20  00:00:00,"ECOWAS special envoys meet Niger's ousted president, junta leader"
2023/08/20  00:00:00,Police to highlight domestic crimes at 17th AMMTC in Labuan Bajo
2023/08/20  00:00:00,NYSC Director-General calls for more support from NASS
2023/08/20  00:00:00,Ministry dispatches 358 Indonesia Maju Scholarship awardees
2023/08/20  00:00:00,Willis proposes March 4 start date for Trump's Georgia election interference trial
2023/08/20  00:00:00,"Starved Rock among Illinois' best places for hiking, waterfalls. Heres what to know."
2023/08/20  00:00:00,Effort to stop solar project in Porter County over after application rejection by planning department
2023/08/20  00:00:00,Police to highlight domestic crimes at 17th AMMTC in Labuan Bajo
2023/08/20  00:00:00,Photo Gallery: Party animals make celebration fun at Benchmark Senior Living
2023/08/20  00:00:00,Indian couple  son found dead in US  police suspect double suicide-murder
2023/08/20  00:00:00,"News | 

			With government on the verge of resting, sexual harassment, Chinatown deal, secret FBI recordings stir Tim Mapes case"
2023/08/20  00:00:00,Indonesia seeks to emulate Indias Jan Aushadhi Kendra model
2023/08/20  00:00:00,PFAS detected in 15 local public water systems over proposed EPA guidelines
2023/08/20  00:00:00,"Local News | 

			Would you add that to your cemetery? Dakota activists work to preserve sacred burial mounds in St. Paul"
2023/08/20  00:00:00,NYSC Director-General calls for more support from NASS
2023/08/20  00:00:00,"70 per cent of settlements in Kano not well-planned, saysdon"
2023/08/20  00:00:00,Kuwait: INS Visakhapatnam docks at Al-Shuwaikh Port
2023/08/20  00:00:00,"EU should implement principle of fair transition for sustainable trade, investment practices, says Tengku Zafrul"
2023/08/20  00:00:00,"News | 

			With government on the verge of resting, sexual harassment, Chinatown deal, secret FBI recordings stir Tim Mapes case"
2023/08/20  00:00:00,WATCH: Chaos Erupts At Gwalior's Atal Auditorium Ahead Of Amit Shah's Visit As BJP Minister Gopal Bhargav Denied Entry
2023/08/20  00:00:00,"Rs 6,000 a day! Begging racket busted in Hyderabad"
2023/08/20  00:00:00,"Police Chief, AMMTC delegates enjoy welcome parade in Labuan Bajo"
2023/08/20  00:00:00,Smart Start to increase funds; Council on Aging's new board members and Champions for Wildlife's new staff
2023/08/20  00:00:00,Multiple agencies work collaboratively to help restore Minnesotas struggling moose population
2023/08/20  00:00:00,Police to highlight domestic crimes at 17th AMMTC in Labuan Bajo
2023/08/20  00:00:00,"News | 

			With government on the verge of resting, sexual harassment, Chinatown deal, secret FBI recordings stir Tim Mapes case"
2023/08/20  00:00:00,Ukraines Zelenskiy in Netherlands in push to boost air defences
2023/08/20  00:00:00,UK supports two of Indonesia's PED: Trade Minister
2023/08/20  00:00:00,USA's recent moves on Bangladesh will only strengthen Islamists & anti-liberation forces
2023/08/20  00:00:00,The case for optimism about the Supreme Court
2023/08/20  00:00:00,Multiple agencies work collaboratively to help restore Minnesotas struggling moose population
2023/08/20  00:00:00,China celebrates achievements of its national parks
2023/08/20  00:00:00,Zelenskyy vows retaliation for Chernihiv attack that killed seven people and wounded almost 150
2023/08/20  00:00:00,Indonesia seeks to emulate Indias Jan Aushadhi Kendra model
2023/08/20  00:00:00,'Stuck in The Middle': Natalie Portman 'Having Second Thoughts' About 'Trial' Separation With Accused Cheating Husband
2023/08/20  00:00:00,Minister expects EU-ABC to give solutions to challenges in cooperation
2023/08/20  00:00:00,China celebrates achievements of its national parks
2023/08/20  00:00:00,Highest levels of security by Natjoints at BRICSSummit
2023/08/20  00:00:00,EU poll observer mission boss says stunned by claims of Zimbabwe poll interference
2023/08/20  00:00:00,Multiple agencies work collaboratively to help restore Minnesotas struggling moose population
2023/08/20  00:00:00,UK supports two of Indonesia's PED: Trade Minister
2023/08/20  00:00:00,American Airlines sues travel site after banning teen for using skiplagging scheme
2023/08/20  00:00:00,Investment flows into ASEAN grew 5 percent in 2022
2023/08/20  00:00:00,"Rajiv Ratna Gandhis life history, family, achievements, contribution, and some interesting facts"
2023/08/20  00:00:00,"Police Chief, AMMTC delegates enjoy welcome parade in Labuan Bajo"
2023/08/20  00:00:00,"Pakistan Plunges Into Further Chaos, President Arif Alvi Goes On Social Media Denying Signing Army Act, Secrets Law"
2023/08/20  00:00:00,"Egyptian journalist briefly detained following mysterious plane coverage, his employer says"
2023/08/20  00:00:00,Springs hospital accused of mishandling bodies
2023/08/20  00:00:00,Investment flows into ASEAN grew 5 percent in 2022
2023/08/20  00:00:00,Minister expects EU-ABC to give solutions to challenges in cooperation
2023/08/20  00:00:00,Victoria Beckham flashes bra in cosy snaps with husband David as they celebrate huge win
2023/08/20  00:00:00,BJP flays CM Mann for neglecting people of Punjab in need of hour
2023/08/20  00:00:00,Investment flows into ASEAN grew 5 percent in 2022
2023/08/20  00:00:00,"Flashpoint: Possible UAW strike, the Michigan accent, and an update on Paul Whelan"
2023/08/20  00:00:00,Hyderabad: Health min launches Centralized Emergency Response Center
2023/08/20  00:00:00,"Can fruits and vegetables be made better? With gene editing, Durham firm believes so."
2023/08/20  00:00:00,Niger Coup: Algeria Rejects ECOWAS Military Intervention
2023/08/20  00:00:00,King Charless heartbreaking four-word response when asked about Prince Harry
2023/08/20  00:00:00,"NCP chief Sharad Pawar raises concern over CBSE circular to schools on Partition, terms it incorrect for students"
2023/08/20  00:00:00,"Pakistan Plunges Into Further Chaos, President Arif Alvi Goes On Social Media Denying Signing Army Act, Secrets Law"
2023/08/20  00:00:00,Parineeti Chopra And Raghav Chadha To Get Married On September 25: Report
2023/08/20  00:00:00,Royal Family fears Prince Andrew faces more 'bombs' over Jeffrey Epstein friendship
2023/08/20  00:00:00,Suddes: Inside-the-Washington Beltway analyses;' is wrong. Here's how Issue 1 was killed
2023/08/20  00:00:00,Islamabad Police confirms arrest of former Pakistan minister Shireen Mazaris daughter
2023/08/20  00:00:00,Pope Francis: Christians are invited to be open to change
2023/08/20  00:00:00,"Four SWest states mark Isese Day, declare Monday holiday"
2023/08/20  00:00:00,"News | 

			With government on the verge of resting, sexual harassment, Chinatown deal, secret FBI recordings stir Tim Mapes case"
2023/08/20  00:00:00,King Charles's relative hosts posh safari for sanctioned Russian oligarch
2023/08/20  00:00:00,How conservatives use verbal jiu-jitsu to turn liberals language against them
2023/08/20  00:00:00,"Gretchen Whitmer Is Taking Her Defense Of Abortion, LGBTQ+ Rights Directly To Red States"
2023/08/20  00:00:00,Disarmament pre-condition for talks: Yechury on Manipur crisis
2023/08/20  00:00:00,Indonesia seeks to emulate Indias Jan Aushadhi Kendra model
2023/08/20  00:00:00,Adrian Flannelly Show signs off for the last time after 50 years
2023/08/20  00:00:00,"Opinion | 

			Road to Middle East peace runs through Palestinian state"
2023/08/20  00:00:00,Dubai boy with cancer aces A levels despite the odds
2023/08/20  00:00:00,"War unnecessary, but were ready to defend ourselves, Niger junta tells ECOWAS"
2023/08/20  00:00:00,Right calls for new military campaign as IDF searches for Huwara shooter
2023/08/20  00:00:00,Niger coup leader Gen Tchiani promises to handover power in three years
2023/08/20  00:00:00,What deafening sounds will be heard along I-295 at I-76 and for how long?
2023/08/20  00:00:00,Dubai boy with cancer aces A levels despite the odds
2023/08/20  00:00:00,Israel says its Iron Dome system downed drone launched from Gaza Strip
2023/08/20  00:00:00,Dennis Sun: Corner Crossing -- What Do We Do?
2023/08/20  00:00:00,Kuwait: INS Visakhapatnam docks at Al-Shuwaikh Port
2023/08/20  00:00:00,Cream of the crop for Baileys Cow
2023/08/20  00:00:00,Amarnath yatra to be temporarily suspended from August 23 for track restoration works
2023/08/20  00:00:00,Kuwait: INS Visakhapatnam docks at Al-Shuwaikh Port
2023/08/20  00:00:00,West Virginia lawmakers pour around $100 million into improving the jails system. Its not nearly enough.
2023/08/20  00:00:00,PFAS detected in 15 local public water systems over proposed EPA guidelines
2023/08/20  00:00:00,Amarnath yatra to be temporarily suspended from August 23 for track restoration works
2023/08/20  00:00:00,Cocaine dealer hired by failing pub to petrol bomb successful rival
2023/08/20  00:00:00,King Charles's relative hosts posh safari for sanctioned Russian oligarch
2023/08/20  00:00:00,Please wait while your request is being verified...
2023/08/20  00:00:00,Talking with U.S. Rep. Rosendale about military matters
2023/08/20  00:00:00,Iran says West using protesters to threaten elections
2023/08/20  00:00:00,PFAS detected in 15 local public water systems over proposed EPA guidelines
2023/08/20  00:00:00,"Samangan residents complain of drinking, irrigation water shortage"
2023/08/20  00:00:00,"War unnecessary, but were ready to defend ourselves, Niger junta tells ECOWAS"
2023/08/20  00:00:00,American Airlines sues travel site after banning teen for using skiplagging scheme
2023/08/20  00:00:00,'A fallen hero': Rudy Giuliani faces the music
2023/08/20  00:00:00,"Minister of Royal Office receives ambassadors of Iraq, Syria"
2023/08/20  00:00:00,"Stalled Justice: Lawsuit on boys 2011 death is long over, but Cook County still hasnt tried his mom for murder"
2023/08/20  00:00:00,A BRICS no-show speaks volumes about Putins shrinking horizons
2023/08/20  00:00:00,Kuwait: INS Visakhapatnam docks at Al-Shuwaikh Port
2023/08/20  00:00:00,"Starved Rock among Illinois' best places for hiking, waterfalls. Heres what to know."
2023/08/20  00:00:00,"Samangan residents complain of drinking, irrigation water shortage"
2023/08/20  00:00:00,Rabbi Ya'akov Ariel on Light Rail: 'No need for it on Shabbat'
2023/08/20  00:00:00,How conservatives use verbal jiu-jitsu to turn liberals language against them
2023/08/20  00:00:00,Lawyers To Report Suspicious Transactions In Fight Against Money Laundering
2023/08/20  00:00:00,"Samangan residents complain of drinking, irrigation water shortage"
2023/08/20  00:00:00,Family of former Prime Minister say they're sorry for 'vile' slave trading ancestor
2023/08/20  00:00:00,'A fallen hero': Rudy Giuliani faces the music
2023/08/20  00:00:00,Air Travel in Crisis: JetBlue and Delta Flights Face Emergency Landings Amid Safety Concerns
2023/08/20  00:00:00,"Meet Chris, The Man With The Vision Behind Maltas Latest Thrifting Spot"
2023/08/20  00:00:00,'A fallen hero': Rudy Giuliani faces the music
2023/08/20  00:00:00,'A fallen hero': Rudy Giuliani faces the music
2023/08/20  00:00:00,Rabbi Ya'akov Ariel on Light Rail: 'No need for it on Shabbat'
2023/08/20  00:00:00,Springs hospital accused of mishandling bodies
2023/08/20  00:00:00,King Charles's relative hosts posh safari for sanctioned Russian oligarch
2023/08/20  00:00:00,American Airlines sues travel site after banning teen for using skiplagging scheme
2023/08/20  00:00:00,Challenges mount for Darfur Joint Force after failure to protect civilians
2023/08/20  00:00:00,"Stalled Justice: Lawsuit on boys 2011 death is long over, but Cook County still hasnt tried his mom for murder"
2023/08/20  00:00:00,"Starved Rock among Illinois' best places for hiking, waterfalls. Heres what to know."
2023/08/20  00:00:00,Challenges mount for Darfur Joint Force after failure to protect civilians
2023/08/20  00:00:00,UNISFA says helicopter targeted in South Kordofan State
2023/08/20  00:00:00,Sharad Pawar raises concern over CBSE circular to schools on Partition
2023/08/20  00:00:00,Fani Williss Indictment of Donald Trump and a Voting-System Breach
2023/08/20  00:00:00,Air Travel in Crisis: JetBlue and Delta Flights Face Emergency Landings Amid Safety Concerns
2023/08/20  00:00:00,"Militancy is down, but suicide rate among students at all-time high in J&K"
2023/08/20  00:00:00,Ogun: Man who killed his two nieces held in prison
2023/08/20  00:00:00,"US, Japan and Australia plan joint navy drills in disputed South China Sea, say Philippine security officials"
2023/08/20  00:00:00,PM asks Kon Tum to optimise potential for faster development
2023/08/20  00:00:00,NASA's Lunar Trailblazer satellite is ready to hunt for water on the moon
2023/08/20  00:00:00,"Daily Southtown | 

			Monthly south suburban police meetings at Markham courthouse a good networking tool'"
2023/08/20  00:00:00,"Man, 26, Killed In Bar Fight That Only Lasted 90 Seconds In Australia"
2023/08/20  00:00:00,"War unnecessary, but were ready to defend ourselves, Niger junta tells ECOWAS"
2023/08/20  00:00:00,Challenges mount for Darfur Joint Force after failure to protect civilians
2023/08/20  00:00:00,Ibadan taught me to turn everything into opportunity  Shettima
2023/08/20  00:00:00,How conservatives use verbal jiu-jitsu to turn liberals language against them
2023/08/20  00:00:00,Lawyers To Report Suspicious Transactions In Fight Against Money Laundering
2023/08/20  00:00:00,Lucy Letby CEO who 'shut down concerns over killer nurse' leaves NHS with 1.5m pension
2023/08/20  00:00:00,Niger coup leader Gen Tchiani promises to handover power in three years
2023/08/20  00:00:00,"Daily Southtown | 

			Monthly south suburban police meetings at Markham courthouse a good networking tool'"
2023/08/20  00:00:00,Ukraines Zelenskiy in Netherlands in push to boost air defences
2023/08/20  00:00:00,Kansas and Evergy need to help people save money on their soaring electricity costs | Opinion
2023/08/20  00:00:00,"Govt, UNDP sign documents for 2 projects"
2023/08/20  00:00:00,Ukraine's Zelenskyy in Netherlands in push to boost air defences
2023/08/20  00:00:00,Geri Horner addresses rumours that the Spice Girls will headline Glastonbury next year amid band reunion for their 30th anniversary
2023/08/20  00:00:00,"Govt, UNDP sign documents for 2 projects"
2023/08/20  00:00:00,"Man charged after teen shot in Wythe County, authorities say"
2023/08/20  00:00:00,"Editorial: The robotaxi revolution is here. L.A., other cities need to be able to regulate driverless cars"
2023/08/20  00:00:00,Pro-coup rally in Niger after military leader warns against foreign intervention
2023/08/20  00:00:00,"Man, 26, Killed In Bar Fight That Only Lasted 90 Seconds In Australia"
2023/08/20  00:00:00,"Egyptian journalist briefly detained following mysterious plane coverage, his employer says"
2023/08/20  00:00:00,Suddes: Inside-the-Washington Beltway analyses;' is wrong. Here's how Issue 1 was killed
2023/08/20  00:00:00,"Daily Southtown | 

			Monthly south suburban police meetings at Markham courthouse a good networking tool'"
2023/08/20  00:00:00,Israel says its Iron Dome system downed drone launched from Gaza Strip
2023/08/20  00:00:00,Two former Tesla employees left the company to start an ambitious new business venture: [We had] a really high bar
2023/08/20  00:00:00,Ukraine's Zelenskyy in Netherlands in push to boost air defences
2023/08/20  00:00:00,Kazakh Presidents visit to Vietnam testifies to high political trust: Diplomat
2023/08/20  00:00:00,Gujarat Gas hikes industrial gas price from August 21: Sources
2023/08/20  00:00:00,"The Netherlands and Denmark will give F-16 fighter jets to Ukraine, the Dutch prime minister says"
2023/08/20  00:00:00,50th anniversary of Vietnam-Canada diplomatic ties marked in HC City
2023/08/20  00:00:00,"Sarawak Gold 1 variant set to be game-changer in Malaysias pineapple industry, says industry board"
2023/08/20  00:00:00,Village Headman arrested for offering bribe to police officer
2023/08/20  00:00:00,"Drone crashes into Russian railway station, leaving 5 injured"
2023/08/20  00:00:00,Air Travel in Crisis: JetBlue and Delta Flights Face Emergency Landings Amid Safety Concerns
2023/08/20  00:00:00,Trade Minister suggests reactivating bilateral forum with Vietnam
2023/08/20  00:00:00,How conservatives use verbal jiu-jitsu to turn liberals language against them
2023/08/20  00:00:00,Ads that give a legislator goosebumps: Why Idaho leaders praise fentanyl awareness drive
2023/08/20  00:00:00,Ukraines Zelenskiy in Netherlands in push to boost air defences
2023/08/20  00:00:00,50th anniversary of Vietnam-Canada diplomatic ties marked in HC City
2023/08/20  00:00:00,"The Netherlands and Denmark will give F-16 fighter jets to Ukraine, the Dutch prime minister says"
2023/08/20  00:00:00,Who is Doug Burgum? 5 takeaways on the North Dakota governor running for the White House in 2024
2023/08/20  00:00:00,Kazakh Presidents visit to Vietnam testifies to high political trust: Diplomat
2023/08/20  00:00:00,China celebrates achievements of its national parks
2023/08/20  00:00:00,Former Vietnamese volunteer troops and advisors in Laos exchange with Lao cadets
2023/08/20  00:00:00,Trump expected to surrender to Fulton County jail on Thursday or Friday
2023/08/20  00:00:00,Air Travel in Crisis: JetBlue and Delta Flights Face Emergency Landings Amid Safety Concerns
2023/08/20  00:00:00,Kazakh Presidents visit to Vietnam testifies to high political trust: Diplomat
2023/08/20  00:00:00,"Exclusive: In Oklahoma, hundreds of students go to court for school infractions"
2023/08/20  00:00:00,Nepalese president proposes increasing cooperation with Vietnam
2023/08/20  00:00:00,Israeli delegation combats desertification in Chad
2023/08/20  00:00:00,Bangla Version Of Bangladeshinfo.com is comming soon. Please stay with us.
2023/08/20  00:00:00,50th anniversary of Vietnam-Canada diplomatic ties marked in HC City
2023/08/20  00:00:00,"Man, 26, Killed In Bar Fight That Only Lasted 90 Seconds In Australia"
2023/08/20  00:00:00,Delhi Police cancel permission for panchayat on Nun violence at Jantar Mantar
2023/08/20  00:00:00,Chamisa penultimate rally set for Bulawayo
2023/08/20  00:00:00,Trump expected to surrender to Fulton County jail on Thursday or Friday
2023/08/20  00:00:00,"Man, 26, Killed In Bar Fight That Only Lasted 90 Seconds In Australia"
2023/08/20  00:00:00,Delhi Police cancel permission for panchayat on Nun violence at Jantar Mantar
2023/08/20  00:00:00,Trade Ministry Says Indonesia Shows Interests in Joining BRICS
