date,title
2023/08/20  00:00:00,Netherlands and Denmark to give long pleaded-for F-16s to Ukraine
2023/08/20  00:00:00,Zelensky hails historic supply of F-16s as Ukraine seeks to counter Russian air supremacy
2023/08/20  00:00:00,Erdoan holds high-level talks during Budapest visit
2023/08/20  00:00:00,Ukraine victory as Netherlands and Denmark agree to supply Zelensky with F-16 fighter jets
2023/08/20  00:00:00,"Chandrayaan-3 | How NASA, ESA will support ISRO during the Moon landing on August 23"
2023/08/20  00:00:00,"Russia-Ukraine war may last decades, West's support will dry up soon: Former Kremlin leader Dmitry Medvedev"
2023/08/20  00:00:00,Primate Rescue Center dedicated for decades to help animals heal
2023/08/20  00:00:00,Iranian president says ready to exchange experiences with Colombia in anti-narcotics fight
2023/08/20  00:00:00,Centre blocks The Kashmir Walla website and its social media accounts without serving notice
2023/08/20  00:00:00,Zelensky hails historic supply of F-16s as Ukraine seeks to counter Russian air supremacy
2023/08/20  00:00:00,"Caretaker govt unconstitutional, UN intervention in polls not feasible"
2023/08/20  00:00:00,Waitrose offers free coffees to on-duty police officers in bid to deter thieves - as long as they bring a re-useable cup
2023/08/20  00:00:00,"Expansion of BRICS, use of national currency among key agendas of summit: India's BRICS Sherpa Dammu Ravi"
2023/08/20  00:00:00,Ukraine victory as Netherlands and Denmark agree to supply Zelensky with F-16 fighter jets
2023/08/20  00:00:00,How Israel targets Palestinian first responders in occupied West Bank
2023/08/20  00:00:00,"Russia-Ukraine war may last decades, West's support will dry up soon: Former Kremlin leader Dmitry Medvedev"
2023/08/20  00:00:00,"Washington governor, lands commissioner visit Spokane wildfire victims"
2023/08/20  00:00:00,Bnei Brak: Benny Gantz visits haredi yeshiva
2023/08/20  00:00:00,"'Neutral' China is supplying Putin's forces with helicopters, drones, and crucial raw materials, report says"
2023/08/20  00:00:00,$74 million announced for small nuclear reactor project in Saskatchewan
2023/08/20  00:00:00,Mumbai News: Central Railway's Assistant Loco Pilot Dies By Suicide At Residence In Kalyan
2023/08/20  00:00:00,So much for never forgetting: Feds shamefully could take death penalty off the table for 9/11 terrorists (opinion)
2023/08/20  00:00:00,Update: West Kelowna evacuation orders to remain in place for Sunday at least
2023/08/20  00:00:00,Bnei Brak: Benny Gantz visits haredi yeshiva
2023/08/20  00:00:00,Heat causes China Spring farmers market vendors to take a break
2023/08/20  00:00:00,"A local's guide to the 24-hour, Eastern European cuisine of Brighton Beach"
2023/08/20  00:00:00,So much for never forgetting: Feds shamefully could take death penalty off the table for 9/11 terrorists (opinion)
2023/08/20  00:00:00,Zelensky Arrived In The Netherlands To Discuss F-16 Fighter Jets Supplies To Ukraine
2023/08/20  00:00:00,"Jadavpur University student death: One more held, court remands him to police custody till August 24"
2023/08/20  00:00:00,Primate Rescue Center dedicated for decades to help animals heal
2023/08/20  00:00:00,We want F-16s to be in Ukrainian arsenal as soon as possible  Dutch PM
2023/08/20  00:00:00,Japan's plan to release radioactive water into Pacific causes fear despite atomic agency nod
2023/08/20  00:00:00,"Australia, Japan, and U.S. Counter Beijing Aggression with Navy Drills in South China Sea"
2023/08/20  00:00:00,Biden will see 'complete and utter devastation' during Maui visit: FEMA administrator
2023/08/20  00:00:00,Reunion celebrates legacy of Clarissa Street
2023/08/20  00:00:00,"CM KCR visits newly inaugurated market, interacts with farmers in Suryapet"
2023/08/20  00:00:00,Japan's plan to release radioactive water into Pacific causes fear despite atomic agency nod
2023/08/20  00:00:00,Media: Ukrainian Forces Can Open New Unexpected For Russians Front In The South
2023/08/20  00:00:00,Biden To The Stand: Hunter's Team Threatens To Involve President If Charges Pressed
2023/08/20  00:00:00,"Wildfire on Spain's popular tourist island of Tenerife was started deliberately, official says"
2023/08/20  00:00:00,We want F-16s to be in Ukrainian arsenal as soon as possible  Dutch PM
2023/08/20  00:00:00,Opinion: Could a police raid on newspapers happen in S.C.? The answer is yes
2023/08/20  00:00:00,NDLEA intercepts fake $20m notes on Lokoja-Abuja Highway
2023/08/20  00:00:00,Zelensky Arrived In The Netherlands To Discuss F-16 Fighter Jets Supplies To Ukraine
2023/08/20  00:00:00,Concern and alarm at escalating violence against women and girls in Sudan and Darfur  IGAD womens forum
2023/08/20  00:00:00,Zelensky hails 'historic' decision to hand F-16 fighter jets to Ukraine
2023/08/20  00:00:00,"From suits to sweats, see historical photos of students moving in at the University of Michigan"
2023/08/20  00:00:00,Erdoan holds high-level talks during Budapest visit
2023/08/20  00:00:00,Indonesian president to attend Brics summit in South Africa
2023/08/20  00:00:00,"Chandrayaan-3 | How NASA, ESA will support ISRO during the Moon landing on August 23"
2023/08/20  00:00:00,Arsenal transfer incredibly collapses as attacker refuses to accept offer after mysterious U-turn
2023/08/20  00:00:00,"From suits to sweats, see historical photos of students moving in at the University of Michigan"
2023/08/20  00:00:00,Lawmaker decries spate of kidnapping as gunmen abduct 2 in Bauchi
2023/08/20  00:00:00,"Mark Meadows asks judge to dismiss Fulton County indictment charges, claims immunity"
2023/08/20  00:00:00,We want F-16s to be in Ukrainian arsenal as soon as possible  Dutch PM
2023/08/20  00:00:00,Erdoan holds high-level talks during Budapest visit
2023/08/20  00:00:00,Egyptian journalist 'forcibly disappeared' after Zambia mystery plane reports
2023/08/20  00:00:00,From Busan to UP: South Korean Woman Travels To India To Marry Boyfriend from Shahjahanpur
2023/08/20  00:00:00,Zelensky Arrived In The Netherlands To Discuss F-16 Fighter Jets Supplies To Ukraine
2023/08/20  00:00:00,Primate Rescue Center dedicated for decades to help animals heal
2023/08/20  00:00:00,Arsenal transfer incredibly collapses as attacker refuses to accept offer after mysterious U-turn
2023/08/20  00:00:00,NYT: DOJ Planned to Let Hunter Biden Off the Hook Until Whistleblowers Emerged
2023/08/20  00:00:00,2 arrested in Jammu hate speech case: police
2023/08/20  00:00:00,From Busan to UP: South Korean Woman Travels To India To Marry Boyfriend from Shahjahanpur
2023/08/20  00:00:00,Erdoan holds high-level talks during Budapest visit
2023/08/20  00:00:00,Arsenal transfer incredibly collapses as attacker refuses to accept offer after mysterious U-turn
2023/08/20  00:00:00,'Almost a miracle' - Tenerife firefighters make gains overnight
2023/08/20  00:00:00,Canada fires evolve as Spain firefighters work a miracle
2023/08/20  00:00:00,An IRS agent fatally shot a another agent while they were training at a Phoenix gun range
2023/08/20  00:00:00,"Police: Sanford man on the run after shooting, killing cousin"
2023/08/20  00:00:00,'Almost a miracle' - Tenerife firefighters make gains overnight
2023/08/20  00:00:00,Nazi-era Tactics Revived? Russian Soldiers Allegedly Use Amphetamines In Ukraine
2023/08/20  00:00:00,Erdoan holds high-level talks during Budapest visit
2023/08/20  00:00:00,Primate Rescue Center dedicated for decades to help animals heal
2023/08/20  00:00:00,"Police: Sanford man on the run after shooting, killing cousin"
2023/08/20  00:00:00,Burgum acknowledges lack of name recognition in dodging Trump questions
2023/08/20  00:00:00,Overnight drop in temperatures helps Tenerife firefighters battle wildfire
2023/08/20  00:00:00,Erdoan holds high-level talks during Budapest visit
2023/08/20  00:00:00,Three arrested in double murder case in U.P.'s Sitapur
2023/08/20  00:00:00,"DeSantis Shrugs Off Leaked Debate Memo, Says He Is Ready to Throw Punches at GOP Opponents on Stage"
2023/08/20  00:00:00,The most normal guy in the GOP primary?
2023/08/20  00:00:00,Pasco boy critically injured while driving ATV
2023/08/20  00:00:00,"Shashi Tharoor says hes humbled, grateful after Congress top panel inclusion"
2023/08/20  00:00:00,Nolan Show moves from BBC broadcasting House
2023/08/20  00:00:00,Opposition Bloc INDIA Likely To Unveil Logo At Mumbai Meet On September 1
2023/08/20  00:00:00,"Washington governor, lands commissioner visit Spokane wildfire victims"
2023/08/20  00:00:00,No false promises like KCR: Kharge to SC and ST leaders of Telangana Congress
2023/08/20  00:00:00,WOW: New emails show Biden was using his alias to carry out all SORTS of business with Hunter and Ukraine
2023/08/20  00:00:00,Unleash Your Brands Potential with Effective Content Marketing Services in Montana
2023/08/20  00:00:00,PSLCE star to be rewarded K1 million
2023/08/20  00:00:00,"Speculations on political defections gain momentum again in Karnataka as BJP MLA meets CM, JD(S) leader meets Dy. CM"
2023/08/20  00:00:00,Burgum acknowledges lack of name recognition in dodging Trump questions
2023/08/20  00:00:00,Nolan Show moves from BBC broadcasting House
2023/08/20  00:00:00,"Police: Sanford man on the run after shooting, killing cousin"
2023/08/20  00:00:00,"No BJP leader will go to Congress, says Pralhad Joshi"
2023/08/20  00:00:00,Man Utd & Bayern Munich made aware of Marco Verratti availability amid Saudi Arabia talks
2023/08/20  00:00:00,Canada fires evolve as Spain firefighters work a miracle
2023/08/20  00:00:00,The GOP is obsessed with controlling queer & female bodies. Weve seen this before.
2023/08/20  00:00:00,No false promises like KCR: Kharge to SC and ST leaders of Telangana Congress
2023/08/20  00:00:00,"Police: Sanford man on the run after shooting, killing cousin"
2023/08/20  00:00:00,G20 Trade and Investment Working Group meeting in Jaipur on Aug 24-25
2023/08/20  00:00:00,"Washington governor, lands commissioner visit Spokane wildfire victims"
2023/08/20  00:00:00,Pence wont say if criminal conviction should rule Trump out as president
2023/08/20  00:00:00,Congress blames CM Pramod Sawant for religious unrest in Goa
2023/08/20  00:00:00,The Large-Scale Flow of Cubans to Nicaragua Continues
2023/08/20  00:00:00,"Congress will provide succour to the poor if voted to power, says Chinta Mohan"
2023/08/20  00:00:00,Gun violence addressed at event held Saturday at DaySpring Baptist Church in NE Gainesville
2023/08/20  00:00:00,AICC skirts factional politics to elevate Tharoor to the CWC
2023/08/20  00:00:00,Emmy Award-winning actor Ron Cephas-Jones passes away  A look at his career
2023/08/20  00:00:00,Timeline: What has happened in Niger since the coup?
2023/08/20  00:00:00,The most normal guy in the GOP primary?
2023/08/20  00:00:00,Netherlands and Denmark to donate up to 61 F-16 fighter jets to Ukraine
2023/08/20  00:00:00,The Civil War in Richland County Part I: Camp Bartley
2023/08/20  00:00:00,Opposition INDIA alliance logo likely to be unveiled during Mumbai meet on August 31
2023/08/20  00:00:00,How to handle a scary diagnosis
2023/08/20  00:00:00,Drug Dealer Responsible for Michael K. Williams' Death Sentenced
2023/08/20  00:00:00,No false promises like KCR: Kharge to SC and ST leaders of Telangana Congress
2023/08/20  00:00:00,The Large-Scale Flow of Cubans to Nicaragua Continues
2023/08/20  00:00:00,"Local News | 

			Rich Archbold: Mother-daughter team make church banners adorned with sermons"
2023/08/20  00:00:00,"Category 1 Hurricane Hilary barrels toward California, still threatening floods"
2023/08/20  00:00:00,Nine Mandapam fishermen return home after being released from Sri Lanka
2023/08/20  00:00:00,Columbia Marine killed during live-fire training exercise at Camp Pendleton in California
2023/08/20  00:00:00,Starbucks told to pay $2.7 million in lost wages to manager fired after arrest of 2 Black men
2023/08/20  00:00:00,Argentina and Brazil strengthen their maritime cooperation after a six-year hiatus
2023/08/20  00:00:00,"Bidens Goes on Another Vacation: Joe, Hunter at Billionaire Climate Investor Tom Steyer's $18M Lake Tahoe Mansion as It Emerges He's Spent 40% of his Time in Office on Holiday"
2023/08/20  00:00:00,Kilgore students report on travel to other states in exchange program
2023/08/20  00:00:00,"China using trade probe to interfere with presidential election, MAC says"
2023/08/20  00:00:00,Columbia Marine killed during live-fire training exercise at Camp Pendleton in California
2023/08/20  00:00:00,Gun violence addressed at event held Saturday at DaySpring Baptist Church in NE Gainesville
2023/08/20  00:00:00,Three rescued from sunken boat near Portstewart after Storm Betty batters Irish coastline
2023/08/20  00:00:00,Over $3.2M in federal funding for NY fire departments
2023/08/20  00:00:00,SOF Pic of the Day: 3rd Special Forces Group Feeling a Bit Randy in Afghanistan
2023/08/20  00:00:00,"3 Things to Do in Sitka, Alaska: 1 Day Itinerary"
2023/08/20  00:00:00,PTI to approach SC after Alvis claims
2023/08/20  00:00:00,How one 80s drag queen revolutionized what it means to be fabulous
2023/08/20  00:00:00,Chinas Extensive Satellite Surveillance Over Australia: A New Frontier in Military Intelligence
2023/08/20  00:00:00,"DPP China policy is confrontation, not peace: KMT"
2023/08/20  00:00:00,Waitrose offers free coffees to on-duty police officers in bid to deter thieves - as long as they bring a re-useable cup
2023/08/20  00:00:00,The most normal guy in the GOP primary?
2023/08/20  00:00:00,Motorcyclist dies in head-on crash in western Wisconsin
2023/08/20  00:00:00,Pence wont say if criminal conviction should rule Trump out as president
2023/08/20  00:00:00,SOF Pic of the Day: 3rd Special Forces Group Feeling a Bit Randy in Afghanistan
2023/08/20  00:00:00,Opinion: Could a police raid on newspapers happen in S.C.? The answer is yes
2023/08/20  00:00:00,Three rescued from sunken boat near Portstewart after Storm Betty batters Irish coastline
2023/08/20  00:00:00,Ukraine hails 'historic' decision to provide F-16 jets
2023/08/20  00:00:00,"PH, UK to strengthen bilateral trade"
2023/08/20  00:00:00,The most normal guy in the GOP primary?
2023/08/20  00:00:00,"China using trade probe to interfere with presidential election, MAC says"
2023/08/20  00:00:00,Denmark confirms plans to donate 19 F-16 fighter jets to Ukraine (updated)
2023/08/20  00:00:00,Denmark and Netherlands pledge to give F-16 fighter jets to Ukraine as Zelenskyy visits
2023/08/20  00:00:00,GOP candidate Doug Burgum reluctant to talk Trump indictments: Its not the critic that counts
2023/08/20  00:00:00,"After Amit Shah releases report card of BJP rule in MP, Congress calls it failed state"
2023/08/20  00:00:00,Indian-American Vivek Ramaswamy only behind Donald Trump as Republican pick for 2024 US presidential polls
2023/08/20  00:00:00,"After Shah releases report card of BJP rule in MP, Congress calls it failed state"
2023/08/20  00:00:00,JSP leader Kona Tata Rao dares Education Minister for a debate on Rushikonda constructions in Visakhapatnam
2023/08/20  00:00:00,German minister uses UPI to buy chillies from vegetable vendor in Bengaluru. Watch
2023/08/20  00:00:00,"After Amit Shah releases report card of BJP rule in MP, Congress calls it failed state"
2023/08/20  00:00:00,Biden to reassure Lahaina residents they will control rebuilding
2023/08/20  00:00:00,Denmark and Netherlands pledge to give F-16 fighter jets to Ukraine as Zelenskyy visits
2023/08/20  00:00:00,UNPO affirms support for peaceful solution of Indo-Naga issue
2023/08/20  00:00:00,"Content Marketing Strategies That Drive Business Growth: Spotlight on Missouri, United States"
2023/08/20  00:00:00,GOP candidate Doug Burgum reluctant to talk Trump indictments: Its not the critic that counts
2023/08/20  00:00:00,"Chandrayaan-3 | How NASA, ESA will support ISRO during the Moon landing on August 23"
2023/08/20  00:00:00,Biden will see 'complete and utter devastation' during Maui visit: FEMA administrator
2023/08/20  00:00:00,Ecuador: Leftist Luisa Gonzalez leads presidential election
2023/08/20  00:00:00,Denmark and Netherlands pledge to give F-16 fighter jets to Ukraine as Zelenskyy visits
2023/08/20  00:00:00,How one 80s drag queen revolutionized what it means to be fabulous
2023/08/20  00:00:00,The Large-Scale Flow of Cubans to Nicaragua Continues
2023/08/20  00:00:00,"A local's guide to the 24-hour, Eastern European cuisine of Brighton Beach"
2023/08/20  00:00:00,Opinion: Could a police raid on newspapers happen in S.C.? The answer is yes
2023/08/20  00:00:00,Ecuadoreans vote for president in election marred by candidate's murder
2023/08/20  00:00:00,100 injured in Habiganj AL-BNP clash
2023/08/20  00:00:00,"Explosion rocks Pakistan's North Waziristan district, 13 die"
2023/08/20  00:00:00,"CM KCR visits newly inaugurated market, interacts with farmers in Suryapet"
2023/08/20  00:00:00,NJ schools controversial trans student policy blocked by judge
2023/08/20  00:00:00,"China using trade probe to interfere with presidential election, MAC says"
2023/08/20  00:00:00,"10 things you need to know today: August 20, 2023"
2023/08/20  00:00:00,"Explosion rocks Pakistan's North Waziristan district, 13 die"
2023/08/20  00:00:00,Christine Cheng Among Top Accountancy Professors
2023/08/20  00:00:00,"King, Crown Prince congratulate Hungary president on National Day"
2023/08/20  00:00:00,A country slightly bigger than Texas is projected to match the US population by 2050  and it shows how radically the world is changing
2023/08/20  00:00:00,Tensions rise as Nigers citizens resist possible regional intervention
2023/08/20  00:00:00,Maryland AARP to honor local Legacy of Honor Project founder; support for USNA vice admiral | READER COMMENTARY
2023/08/20  00:00:00,Lawmaker decries spate of kidnapping as gunmen abduct 2 in Bauchi
2023/08/20  00:00:00,Runsewe harps on role of traditional rulers in tackling youths restiveness
2023/08/20  00:00:00,"Australia, Japan, and U.S. Counter Beijing Aggression with Navy Drills in South China Sea"
2023/08/20  00:00:00,"Nations aspire to join BRICS for 'unfinished business' of last century, says senior Indian diplomat"
2023/08/20  00:00:00,Dundalk Rotary Club members honoured with awards
2023/08/20  00:00:00,This Is Us star and veteran stage actor Ron Cephas Jones dies aged 66
2023/08/20  00:00:00,"China using trade probe to interfere with presidential election, MAC says"
2023/08/20  00:00:00,Special Ops: Lioness Season 1 Episode 6 Review: The Lie Is the Truth
2023/08/20  00:00:00,How Israel targets Palestinian first responders in occupied West Bank
2023/08/20  00:00:00,Biden to reassure Lahaina residents they will control rebuilding
2023/08/20  00:00:00,"1,000 Baguio students given cash assistance"
2023/08/20  00:00:00,"Australia, Japan, and U.S. Counter Beijing Aggression with Navy Drills in South China Sea"
2023/08/20  00:00:00,Netherlands and Denmark to donate up to 61 F-16 fighter jets to Ukraine
2023/08/20  00:00:00,"Nations aspire to join BRICS for 'unfinished business' of last century, says senior Indian diplomat"
2023/08/20  00:00:00,PTI to approach SC after Alvis claims
2023/08/20  00:00:00,Biden to reassure Lahaina residents they will control rebuilding
2023/08/20  00:00:00,Starbucks told to pay $2.7 million in lost wages to manager fired after arrest of 2 Black men
2023/08/20  00:00:00,Netherlands and Denmark to donate up to 61 F-16 fighter jets to Ukraine
2023/08/20  00:00:00,An IRS agent fatally shot a another agent while they were training at a Phoenix gun range
2023/08/20  00:00:00,Biden to reassure Lahaina residents they will control rebuilding
2023/08/20  00:00:00,Netanyahu fails to refute claims Israel agrees to Saudi nuclear power
2023/08/20  00:00:00,Starbucks told to pay $2.7 million in lost wages to manager fired after arrest of 2 Black men
2023/08/20  00:00:00,Special Ops: Lioness Season 1 Episode 6 Review: The Lie Is the Truth
2023/08/20  00:00:00,Stephen M. Young On Taiwan: Taiwans Next Presidential Election
2023/08/20  00:00:00,$74 million announced for small nuclear reactor project in Saskatchewan
2023/08/20  00:00:00,Biden to reassure Lahaina residents they will control rebuilding
2023/08/20  00:00:00,Netherlands and Denmark to donate up to 61 F-16 fighter jets to Ukraine
2023/08/20  00:00:00,Israel opposes Saudi uranium enrichment - Prime Minister's Office
2023/08/20  00:00:00,"Flesh-eating bacteria kills eight in US, prompting warnings of swimming in sea and eating shellfish"
2023/08/20  00:00:00,Netherlands and Denmark to donate up to 61 F-16 fighter jets to Ukraine
2023/08/20  00:00:00,$74 million announced for small nuclear reactor project in Saskatchewan
2023/08/20  00:00:00,"Pakistan: Imran Khan's party to challenge army, secrets bills in SC after President's signature row"
2023/08/20  00:00:00,"Bidens Goes on Another Vacation: Joe, Hunter at Billionaire Climate Investor Tom Steyer's $18M Lake Tahoe Mansion as It Emerges He's Spent 40% of his Time in Office on Holiday"
2023/08/20  00:00:00,Netherlands and Denmark to donate up to 61 F-16 fighter jets to Ukraine
2023/08/20  00:00:00,Amber Heard Now: Where Is the Actress Today?
2023/08/20  00:00:00,Singaporean PM says recent political scandals will not delay leadership renewal
2023/08/20  00:00:00,"A local's guide to the 24-hour, Eastern European cuisine of Brighton Beach"
2023/08/20  00:00:00,Hasina to head for Johannesburg Tuesday to join BRICS summit
2023/08/20  00:00:00,Singaporean PM says recent political scandals will not delay leadership renewal
2023/08/20  00:00:00,$74 million announced for small nuclear reactor project in Saskatchewan
2023/08/20  00:00:00,"Ive Turned You To A Reggae artiste, Shehu Sani Mocks El-Rufai"
2023/08/20  00:00:00,Mobile speed cameras in Hull and East Yorkshire Aug 21-27 including M62 and east Hull route
2023/08/20  00:00:00,Hasina to head for Johannesburg Tuesday to join BRICS summit
2023/08/20  00:00:00,"India, China continue discussions to resolve issues in Eastern Ladakh"
2023/08/20  00:00:00,Gun violence addressed at event held Saturday at DaySpring Baptist Church in NE Gainesville
2023/08/20  00:00:00,Heat causes China Spring farmers market vendors to take a break
2023/08/20  00:00:00,"China using trade probe to interfere with presidential election, MAC says"
2023/08/20  00:00:00,"Nepal, China set to resume military engagements stalled by Covid-19 pandemic"
2023/08/20  00:00:00,"National News | 

			Denmark joins Netherlands in offering F-16 jets to Ukraine as Zelenskyy visits"
2023/08/20  00:00:00,Hasina to head for Johannesburg Tuesday to join BRICS summit
2023/08/20  00:00:00,"Local News | 

			Rich Archbold: Mother-daughter team make church banners adorned with sermons"
2023/08/20  00:00:00,Bank Nizwas Shariah compliant Minor Account sees overwhelming Response
2023/08/20  00:00:00,"Australia, Japan, and U.S. Counter Beijing Aggression with Navy Drills in South China Sea"
2023/08/20  00:00:00,"Commercial registries in Al Sharqiyah South reach 19,470"
2023/08/20  00:00:00,Ex-BJP minister S T Somashekar meets CM Siddaramaiah amid buzz about Operation Hasta
2023/08/20  00:00:00,"New Delhi: Hate speech erupts at Hindu Mahapanchayat in Jantar Mantar, police step in and call a halt"
2023/08/20  00:00:00,"Explosion rocks Pakistan's North Waziristan district, 13 die"
2023/08/20  00:00:00,"Judge-led statutory inquiry needed on Letby murders, Tory health committee chair says"
2023/08/20  00:00:00,"One Year Ago Today (August 20, 2022)Los Angeles Seeks Ideas for Memorial to 1871 Chinese Massacre Victims"
2023/08/20  00:00:00,Three rescued from sunken boat near Portstewart after Storm Betty batters Irish coastline
2023/08/20  00:00:00,Egyptian opposition figure Ahmed Douma freed after presidential pardon
2023/08/20  00:00:00,Fires continue to rage in British Columbia as more evacuations ordered
2023/08/20  00:00:00,Fires continue to rage in British Columbia as more evacuations ordered
2023/08/20  00:00:00,38 aid workers killed in Afghanistan in past 2 years: OCHA
2023/08/20  00:00:00,Mumbai News: Central Railway's Assistant Loco Pilot Dies By Suicide At Residence In Kalyan
2023/08/20  00:00:00,Israel opposes Saudi uranium enrichment - Prime Minister's Office
2023/08/20  00:00:00,Logo of opposition INDIA alliance likely to be unveiled during its upcoming Mumbai meeting
2023/08/20  00:00:00,Mumbai: Man Held For Allegedly Cheating Girlfriend Of 38 Lakh On Pretext Of Marriage
2023/08/20  00:00:00,"Major OTT platforms turned down film on CAA, says director N. Arun"
2023/08/20  00:00:00,Pakistan President Alvi claims he had been betrayed by his staff
2023/08/20  00:00:00,"Ratan Tata an institution: CM Shinde, says industries in Maharashtra main strength of growth engine"
2023/08/20  00:00:00,"Senior Delhi govt official took friend's daughter under his wing, raped her several times and terminated pregnancy"
2023/08/20  00:00:00,Mark Meadows Undermines Trumps Defense That He Declassified Confidential Documents
2023/08/20  00:00:00,Pakistan President Alvi claims he had been betrayed by his staff
2023/08/20  00:00:00,Commemoration marks 101st anniversary of Collins' assassination
2023/08/20  00:00:00,Netanyahu fails to refute claims Israel agrees to Saudi nuclear power
2023/08/20  00:00:00,GOP candidate Doug Burgum reluctant to talk Trump indictments: Its not the critic that counts
2023/08/20  00:00:00,Pakistan President Alvi claims he had been betrayed by his staff
2023/08/20  00:00:00,Biden to reassure Maui's Lahaina residents they will control rebuilding after devastating wildfires
2023/08/20  00:00:00,Netanyahu fails to refute claims Israel agrees to Saudi nuclear power
2023/08/20  00:00:00,WOW: New emails show Biden was using his alias to carry out all SORTS of business with Hunter and Ukraine
2023/08/20  00:00:00,Fires continue to rage in British Columbia as more evacuations ordered
