date,title
2023/08/05  00:00:00,AEW Reveals New Dates For Fall Schedule: New City Debut and Exciting Returns
2023/08/05  00:00:00,13 Back to School Rallies hosted in Central Ky.
2023/08/05  00:00:00,OECS Concludes Successful 10th Council of Ministers meeting on Environmental Sustainability in Anguilla
2023/08/05  00:00:00,Architect of Sierra Leones post-war police force speaks out
2023/08/05  00:00:00,Tinubus ministerial nominee apologises to senators for his past sin
2023/08/05  00:00:00,UAPA - 'Watali' Precedent Won't Apply If Evidence Is Of Low Probative Value On Surface Level Analysis : Supreme Court
2023/08/05  00:00:00,Davis Broadcasting hosts Tools 4 School event
2023/08/05  00:00:00,OECS Concludes Successful 10th Council of Ministers meeting on Environmental Sustainability in Anguilla
2023/08/05  00:00:00,Distinguished Young Women event is tonight
2023/08/05  00:00:00,"Sierra Nevada Journeys, Nature Conservancy in Nevada to host family STEM night"
2023/08/05  00:00:00,Culver's Custard: 11 Facts About The Frozen Dairy Treat And Why It's So Delicious
2023/08/05  00:00:00,No plan to relocate cheetahs from Kuno National Park: Bhupender Yadav
2023/08/05  00:00:00,Kremlin officials rush to ditch BMWs for Ladas after Putin pushes home-built cars
2023/08/05  00:00:00,RHOC Star Addresses Shannon Beador Stating That She May Be an Idiot
2023/08/05  00:00:00,13 Back to School Rallies hosted in Central Ky.
2023/08/05  00:00:00,Culver's Custard: 11 Facts About The Frozen Dairy Treat And Why It's So Delicious
2023/08/05  00:00:00,Naval Drone Strikes Will Likely Slow Russian Oil And Grain Exports
2023/08/05  00:00:00,NASCAR Puts Noah Gragson on Indefinite Suspension
2023/08/05  00:00:00,"Influencer with terminal cancer, 36, tells two young kids shes going to die: Sick to my stomach"
2023/08/05  00:00:00,Inside Ukraines counter offensive as mine-hampered soldiers prepare for Stage Three
2023/08/05  00:00:00,"Tugboat sinks in Suez Canal after colliding with tanker, rescue underway"
2023/08/05  00:00:00,'Science on display': Inside Ohio State's new Pelotonia Research Center in Carmenton
2023/08/05  00:00:00,"Academia Sinica, hospital rebut online blood rumor"
2023/08/05  00:00:00,King Charles enjoys a wee dram as Mey Highland Games gets underway
2023/08/05  00:00:00,Two Henrico students recognized as community leaders by Bank of America program
2023/08/05  00:00:00,Inside Ukraines counter offensive as mine-hampered soldiers prepare for Stage Three
2023/08/05  00:00:00,"Sierra Nevada Journeys, Nature Conservancy in Nevada to host family STEM night"
2023/08/05  00:00:00,ASEAN can help keep regional balance
2023/08/05  00:00:00,"Take a walk through history, highlighting Black New Brunswickers"
2023/08/05  00:00:00,Two Henrico students recognized as community leaders by Bank of America program
2023/08/05  00:00:00,Overturning Affirmative Action will Hurt Diversity in College Admissions
2023/08/05  00:00:00,ASEAN can help keep regional balance
2023/08/05  00:00:00,Kremlin officials rush to ditch BMWs for Ladas after Putin pushes home-built cars
2023/08/05  00:00:00,"Business | 

			What does the wild weather  dry May, smoky June, wet July  mean for Lehigh Valley farmers?"
2023/08/05  00:00:00,"Houston shooting on Hillcroft Street: Woman fires shots in large crowd, striking two people"
2023/08/05  00:00:00,Kuwait warns bilateral ties could sour over Lebanese ministers comments
2023/08/05  00:00:00,"Nottm Forest delight with European club destined to accept offer for Tottenham target, but one big hurdle remains"
2023/08/05  00:00:00,Culver's Custard: 11 Facts About The Frozen Dairy Treat And Why It's So Delicious
2023/08/05  00:00:00,Mumbai: Nitin Desai's daughter urges Maharashtra govt to look into his death case
2023/08/05  00:00:00,Delhi Riots: Court to hear arguments against UAPA accused on day-to-day basis
2023/08/05  00:00:00,Threat calls to Gadkari: NIA moves HC for transfer of case proceedings to Mumbai court
2023/08/05  00:00:00,Two Israelis arrested after Palestinian man killed in West Bank
2023/08/05  00:00:00,"2023 National Night Out: Communities, law enforcement, emergency members come together"
2023/08/05  00:00:00,Wow! The Tiniest Town in America Is in Massachusetts!
2023/08/05  00:00:00,France backs efforts of West African regional body ECOWAS to derail Niger military coup
2023/08/05  00:00:00,90 Day Fiance Alum Juliana Custodio Marries Ben Obscura 1 Year After Michael Jessen Divorce
2023/08/05  00:00:00,Arrogance and the Perfect Autocratic Storm
2023/08/05  00:00:00,"Niger's coup leaders ask Russian mercenary group, Wagner, for help"
2023/08/05  00:00:00,Inside Ukraines counter offensive as mine-hampered soldiers prepare for Stage Three
2023/08/05  00:00:00,Birmingham gang in 25k Argos store heist caught after police chase over Welsh border
2023/08/05  00:00:00,Threat calls to Gadkari: NIA moves HC for transfer of case proceedings to Mumbai court
2023/08/05  00:00:00,Windrush generation commemorated in new Warwickshire exhibition
2023/08/05  00:00:00,Truth Social Post Prompts Jack Smith to Ask Judge to Prevent Trump from Releasing Discovery Evidence to Public
2023/08/05  00:00:00,A Warm July in China-Nicaragua Relations
2023/08/05  00:00:00,"CREDAI expresses concern over flat registration fee, wants government to rollback hike"
2023/08/05  00:00:00,Nudists spot plenty of great tits as they strip off for sponsored bird walk
2023/08/05  00:00:00,Russia Threatens Ecological War In The Black Sea
2023/08/05  00:00:00,African Food and Art: Sharing History and Heritage
2023/08/05  00:00:00,Birmingham gang in 25k Argos store heist caught after police chase over Welsh border
2023/08/05  00:00:00,Sahitya Akademi to bring out collection of poems from G-20 nations
2023/08/05  00:00:00,A Closer Look: F-35s Edge Over Su-57 in Advanced Warfare
2023/08/05  00:00:00,Tinubus ministerial nominee apologises to senators for his past sin
2023/08/05  00:00:00,Inside Ukraines counter offensive as mine-hampered soldiers prepare for Stage Three
2023/08/05  00:00:00,Birmingham gang in 25k Argos store heist caught after police chase over Welsh border
2023/08/05  00:00:00,Threat calls to Gadkari: NIA moves HC for transfer of case proceedings to Mumbai court
2023/08/05  00:00:00,"NYT slapped as hypocritical for implying Aldean song is racist, but downplaying alleged anti-White chant"
2023/08/05  00:00:00,"Nottm Forest delight with European club destined to accept offer for Tottenham target, but one big hurdle remains"
2023/08/05  00:00:00,UPDATE: K9 Bosco returned to former handler amid heated emotional controversy
2023/08/05  00:00:00,Mumbai: Nitin Desai's daughter urges Maharashtra govt to look into his death case
2023/08/05  00:00:00,Birmingham gang in 25k Argos store heist caught after police chase over Welsh border
2023/08/05  00:00:00,"First batch of Agniveers graduate from Sikh and Ladakh Regimental centres, 61 Calavry"
2023/08/05  00:00:00,"Pakistan-origin TikToker, mother convicted of murder in fatal crash"
2023/08/05  00:00:00,Samantha Prabhu Denies Financial Help for Treatment; Sushmita Sen Recalls Trolling For Taali Poster
2023/08/05  00:00:00,'Everyone told me not to do it': Below Deck's Captain Sandy is coming to Manchester
2023/08/05  00:00:00,Insiders share Ryan Tubridy's RTE return date as pay deal paves way for comeback
2023/08/05  00:00:00,Culver's Custard: 11 Facts About The Frozen Dairy Treat And Why It's So Delicious
2023/08/05  00:00:00,Nudists spot plenty of great tits as they strip off for sponsored bird walk
2023/08/05  00:00:00,Police plan heavy presence after two violent nights
2023/08/05  00:00:00,TN man opens fire at Jewish school before police standoff: Echoes of family tragedy resurface
2023/08/05  00:00:00,Senior Israeli officials discuss regime collapse to draw action plans
2023/08/05  00:00:00,Kremlin officials rush to ditch BMWs for Ladas after Putin pushes home-built cars
2023/08/05  00:00:00,Fancy Farm returns as the Beshear vs. Cameron governors race takes center stage
2023/08/05  00:00:00,Wanted criminal surrenders self to Nigeria Police Force in Kano state
2023/08/05  00:00:00,Somalia: SSC Council Elects Chairman of Executive Council in Lasanod
2023/08/05  00:00:00,Fancy Farm returns as the Beshear vs. Cameron governors race takes center stage
2023/08/05  00:00:00,Security expert says classification process needs to be updated following U.S. Sailor's espionage case
2023/08/05  00:00:00,"Sierra Nevada Journeys, Nature Conservancy in Nevada to host family STEM night"
2023/08/05  00:00:00,Another Montana tribe targeted in Arizona sober-living home scam
2023/08/05  00:00:00,Traitor: Trump supporters harangue Pence in New Hampshire
2023/08/05  00:00:00,Is Donald Trump Leading the U.S. Into Another Civil War? Russian Commentator Says Things Are Getting 'Really Bad'
2023/08/05  00:00:00,Ukrainian envoy Polishchuk to arrive in Delhi on August 8; set to take charge soon
2023/08/05  00:00:00,China only P5 nation opposing India's UNSC entry: S Jaishankar
2023/08/05  00:00:00,Coup: War isnt option in Niger  MURIC warns Tinubu
2023/08/05  00:00:00,Security expert says classification process needs to be updated following U.S. Sailor's espionage case
2023/08/05  00:00:00,Kit Knightly (Off-Guardian): The War On Climate-Change Is Coming Again
2023/08/05  00:00:00,"Israel killed 37 Palestinian children since start of year, says Defense for Children International"
2023/08/05  00:00:00,'Next 50 Yrs in Mind': Vaishnaw on 'Master Plan' for 508 Redeveloped Railway Stations | Exclusive
2023/08/05  00:00:00,35-Year-Old US Woman Dies After Drinking 2 Litres Of Water In 20 Minutes
2023/08/05  00:00:00,"ASUU Demands Immediate Resignation Of FUTO VC, Prof Nnenna Oti Over Alleged Corruption"
2023/08/05  00:00:00,Farmers To Get Relief Following Tropical Storm Bret
2023/08/05  00:00:00,Missouri man sentenced to nearly 16 years in prison for setting fire that destroyed Islamic Center in 2020
2023/08/05  00:00:00,Beware!  Drivers Watch Out For This Dangerous Maine GPS Glitch
2023/08/05  00:00:00,Rajah Sir Muthiah Chettiar Birthday Commemoration Award presented to Irai Anbu
2023/08/05  00:00:00,Coup: War isnt option in Niger  MURIC warns Tinubu
2023/08/05  00:00:00,UTHSCs new strategic plan aims to improve health for Tennessee | Opinion
2023/08/05  00:00:00,NSA Ajit Doval in Jeddah for two-day conference on Ukraine crisis
2023/08/05  00:00:00,Senior Spotlight: Carson High School's Ruby Nguyen driven by academics and NJROTC
2023/08/05  00:00:00,The dangerous convergence of religious nationalism in Israel and America
2023/08/05  00:00:00,Taiwan in Time: Worshipping a human skull
2023/08/05  00:00:00,Usada Pekora Joining Hololive Fighting Game Idol Showdown
2023/08/05  00:00:00,Last Messaging App 'Disappears' From Turkmenistan Amid World's Slowest Internet Speed
2023/08/05  00:00:00,The adorable birthday tradition Meghan Markle may pass down to Archie and Lilibet
2023/08/05  00:00:00,"Once Upon A Time, Keanu Reeves Almost Played Spike In A Live-Action Cowboy Bebop Movie"
2023/08/05  00:00:00,"Lebanon seeks to reassure Gulf, Germany after travel warnings"
2023/08/05  00:00:00,Lula to host South American summit on saving the Amazon
2023/08/05  00:00:00,"We Are In Support Of ECOWAS, France Endorses Bid To Quash Niger Republic Coup"
2023/08/05  00:00:00,Conservative Activist Sues VC Fund Supporting Black-Women-Owned Businesses
2023/08/05  00:00:00,Three-quarters of prisons in England and Wales in appalling conditions as overcrowding fears grow
2023/08/05  00:00:00,Meet Me @ The Altar cover Take Me Away from Freaky Friday
2023/08/05  00:00:00,Southwest Calgary garage gutted in early-morning blaze
2023/08/05  00:00:00,This is not a game. This is his life. Attorney for man who served murder sentence says client was unfairly put back in prison
2023/08/05  00:00:00,Pak ruling alliance hails ex-PM Imran's conviction  arrest in corruption case
2023/08/05  00:00:00,Ive watched people just fall apart: inside the nightmare world of English and Welsh jails
2023/08/05  00:00:00,"ASUU Demands Immediate Resignation Of FUTO VC, Prof Nnenna Oti Over Alleged Corruption"
2023/08/05  00:00:00,"Companies that compete with Adani group for prized assets face raids from CBI, ED and Income Tax, alleges Congress"
2023/08/05  00:00:00,Constitutional Court allows absent witness testimony
2023/08/05  00:00:00,Around 170 students from violence-hit Manipur join Karnatakas schools and colleges
2023/08/05  00:00:00,Co Down pervert back in court over breaching sex order more than 100 times
2023/08/05  00:00:00,Constitutional Court allows absent witness testimony
2023/08/05  00:00:00,Trump indictments plus handful of lawsuits forecast chaotic months ahead as 2024 campaign ramps up
2023/08/05  00:00:00,The Observer view on the latest charges against Donald Trump: America needs to see the ex-president brought to justice
2023/08/05  00:00:00,"How the abrogation of Article 370 has brought a new era of peace, progress and prosperity"
2023/08/05  00:00:00,Around 170 students from violence-hit Manipur join Karnatakas schools and colleges
2023/08/05  00:00:00,Black man's conviction overturned after judge says he 'looks like a criminal to me'
2023/08/05  00:00:00,Protests continue for their 31st week despite terror attack in Tel Aviv
2023/08/05  00:00:00,Special Counsels Office Asks To Limit Comms After Trumps Social Media Promises of Retribution
2023/08/05  00:00:00,Threat calls to Gadkari: NIA moves HC for transfer of case proceedings to Mumbai court
2023/08/05  00:00:00,Russian shelling kills 1 in Sumy Oblast
2023/08/05  00:00:00,Sophia Bush Files For Divorce After 13 Months Of Marriage
2023/08/05  00:00:00,UP court acquits 22 accused in 23-year-old case of sectarian riots
2023/08/05  00:00:00,Motorcyclist injured after colliding with car in San Diego's Ridgeview-Webster neighborhood
2023/08/05  00:00:00,Ukrainian envoy Polishchuk to arrive in Delhi on August 8; set to take charge soon
2023/08/05  00:00:00,Constitutional Court allows absent witness testimony
2023/08/05  00:00:00,Kentucky voters weigh in on McConnells health scare
2023/08/05  00:00:00,This is not a game. This is his life. Attorney for man who served murder sentence says client was unfairly put back in prison
2023/08/05  00:00:00,Fuel subsidy removal: Lagos LGA rolls out 14 mini-buses to ease hardship
2023/08/05  00:00:00,"Take a walk through history, highlighting Black New Brunswickers"
2023/08/05  00:00:00,Fancy Farm returns as the Beshear vs. Cameron governors race takes center stage
2023/08/05  00:00:00,NSA Ajit Doval in Jeddah for two-day conference on Ukraine crisis
2023/08/05  00:00:00,Writers Blast Latest AMPTP Efforts to Resume Negotiations: Insulting and Out-of-Touch
2023/08/05  00:00:00,Legal question delays release of deputy-involved shooting report
2023/08/05  00:00:00,"Take a walk through history, highlighting Black New Brunswickers"
2023/08/05  00:00:00,Two Israelis arrested after Palestinian man killed in West Bank
2023/08/05  00:00:00,Memory of civil rights movement must inform journalism: Fight that fight
2023/08/05  00:00:00,"'Fighting for their lives': 2 Orlando police officers shot during traffic stop, police say"
2023/08/05  00:00:00,Back to school: LI public districts will start fromAug. 30 to Sept. 7
2023/08/05  00:00:00,NSA Ajit Doval in Jeddah for two-day conference on Ukraine crisis
2023/08/05  00:00:00,Trios actions to ward off attack hailed in S Korea
2023/08/05  00:00:00,"Back to school days: Weld County students, teachers and staff prepare to begin classes for 2023-24 academic year"
2023/08/05  00:00:00,Ukrainian envoy Polishchuk to arrive in Delhi on August 8; set to take charge soon
2023/08/05  00:00:00,'US is India's Key Ally in Countering Terrorism': EAM Briefs Parl Panel; Cong Remains Absent | Exclusive
2023/08/05  00:00:00,"'People thought I was crazy' - Revisit Josh Hartnett's unconventional Hollywood journey, post-rejecting Superman"
2023/08/05  00:00:00,Auckland Lotto Player Wins $1 Million
2023/08/05  00:00:00,Memory of civil rights movement must inform journalism: Fight that fight
2023/08/05  00:00:00,Kate tipped to take over new Charles role  but must 'make first move'
2023/08/05  00:00:00,'US is India's Key Ally in Countering Terrorism': EAM Briefs Parl Panel; Cong Remains Absent | Exclusive
2023/08/05  00:00:00,VP Harris mocked for proclaiming 'community banks are in the community' once again: 'Another pearl of wisdom'
2023/08/05  00:00:00,Inside world's most 'unliveable' city with 52C highs as even the streets need air con
2023/08/05  00:00:00,"12 horses, 24 dogs found dead on Collin County property, woman arrested"
2023/08/05  00:00:00,Mnangagwa honours Apostle Ezekiel Gutis life and achievements
2023/08/05  00:00:00,Kate tipped to take over new Charles role  but must 'make first move'
2023/08/05  00:00:00,TAIPEI TIMES TSMC agrees to stricter oversight for the construction of Arizona chip plant
2023/08/05  00:00:00,Farmers To Get Relief Following Tropical Storm Bret
2023/08/05  00:00:00,"'Wait Wait' for August 5th, 2023: With Not My Job guest Maggie Smith"
2023/08/05  00:00:00,Ukrainian envoy Polishchuk to arrive in Delhi on August 8; set to take charge soon
2023/08/05  00:00:00,"Bihar Shocker: Man abducts, slits sister's throat with machete over extra-marital affair; arrested"
2023/08/05  00:00:00,Memory of civil rights movement must inform journalism: Fight that fight
2023/08/05  00:00:00,JUST IN: Resident doctors begin strike in Kaduna state
2023/08/05  00:00:00,Oregon ends ban on self-service gas pumps after 72 years: Confused motorists turn to 'how-to' guides and station attendants' union slams the change as 'blatant cash grab'
2023/08/05  00:00:00,"Denise Damato Coe, 59, found shot, killed in Danville, New Hampshire home"
2023/08/05  00:00:00,Judge asked to intervene after Trump threatens revenge on witnesses
2023/08/05  00:00:00,"Niger's coup leaders ask Russian mercenary group, Wagner, for help"
2023/08/05  00:00:00,"Interactive map shows Surrey UFO sightings, including saucer-shaped vapour trail and submarine and bell-shaped objects"
2023/08/05  00:00:00,"INDIA alliance's next meeting in Mumbai will be significant session in view of SC relief to Rahul Gandhi, says Congress"
2023/08/05  00:00:00,"Walmart workers who became truck drivers on up to $110,000-a-year say big-salary job has changed their lives"
2023/08/05  00:00:00,Judge: State must return or destroy blood samples taken without parents permission
2023/08/05  00:00:00,"Brooklyn man, 17, charged with hate crime murder in death of dancer O'Shae Sibley"
2023/08/05  00:00:00,Fundraiser Started For Family Of 19-Year-Old Shot To Death In Duluth
2023/08/05  00:00:00,"Meeteetses Cowboy Bar, An Outlaw Joint Like No Other In Wyoming, Is For Sale"
2023/08/05  00:00:00,'Kidnapper' went on Judge Judy using alias before 'imprisoning woman in cinderblock cell'
2023/08/05  00:00:00,JUST IN: Resident doctors begin strike in Kaduna state
2023/08/05  00:00:00,"Charles Ogletree, Famed Harvard Law Professor, Passes Away At Age 70"
2023/08/05  00:00:00,DeSantis responds to 2 Orlando police officers injured in shooting
2023/08/05  00:00:00,Rudy Giuliani Concedes He Made Defamatory Statements About 2 Georgia Poll Workers
2023/08/05  00:00:00,Columbus police: Man fatally shot on Far South Side was charging officer with broken bottle
2023/08/05  00:00:00,'Kidnapper' went on Judge Judy using alias before 'imprisoning woman in cinderblock cell'
2023/08/05  00:00:00,"Hamas gunmen foil large-scale economic protests, warns PA sparking Gaza rallies"
2023/08/05  00:00:00,Rudy Giuliani Concedes He Made Defamatory Statements About 2 Georgia Poll Workers
2023/08/05  00:00:00,"""Aaftab Poonawala Chopped Up Body In Toilet"": Shraddha Walkar's Father To Court"
2023/08/05  00:00:00,Gatwick and Heathrow travel rules for travelling to Spain during summer holidays
2023/08/05  00:00:00,"UP signs MoU with Mexico for investment in tourism, infrastructure, pharma sectors"
2023/08/05  00:00:00,I Took My 15-Year-Old Son To See 'Barbie' Because I'm Worried He Could Become Ken
2023/08/05  00:00:00,Employee Says That Her Manager Wrote Her Up For 'Emotional Instability'  'Is This Even Legal?'
2023/08/05  00:00:00,"Man accused of conning Home Depot out of $300,000 with door-return scam"
2023/08/05  00:00:00,Samantha Prabhu Denies Financial Help for Treatment; Sushmita Sen Recalls Trolling For Taali Poster
2023/08/05  00:00:00,Gatwick and Heathrow travel rules for travelling to Spain during summer holidays
2023/08/05  00:00:00,"'Fighting for their lives': 2 Orlando police officers shot during traffic stop, police say"
2023/08/05  00:00:00,Three bodies recovered from James River in Rockbridge County
2023/08/05  00:00:00,Chinas importance to German exporters on the wane
2023/08/05  00:00:00,Insiders share Ryan Tubridy's RTE return date as pay deal paves way for comeback
2023/08/05  00:00:00,Ukrainian envoy Polishchuk to arrive in Delhi on August 8; set to take charge soon
2023/08/05  00:00:00,Dr Ranj Singh throws shade at This Morning in health update after hospital dash
2023/08/05  00:00:00,Lula to host South American summit on saving the Amazon
2023/08/05  00:00:00,DeSantis responds to 2 Orlando police officers injured in shooting
2023/08/05  00:00:00,Columbus police: Man fatally shot on Far South Side was charging officer with broken bottle
2023/08/05  00:00:00,Columbus police: Man fatally shot on Far South Side was charging officer with broken bottle
2023/08/05  00:00:00,US President Joe Biden to visit India on Sept 7 for G-20 Summit
2023/08/05  00:00:00,"Shootings Following Street Brawl Claim One Life, Injure 4 Others"
2023/08/05  00:00:00,"New Strategic Systems, AI-Powered Missiles Delivered to IRGC Navy"
2023/08/05  00:00:00,The Weight Of Justice: Donald Trump's Charges Could Lead To 641 Years In Jail
2023/08/05  00:00:00,The dangerous convergence of religious nationalism in Israel and America
2023/08/05  00:00:00,France backs efforts to quash Niger coup ahead of Sunday deadline
2023/08/05  00:00:00,Bhopal: Woman Kills Self Due To Financial Stress
2023/08/05  00:00:00,Here's the 'Democrat Dream Scenario' for the Trump Trial Ted Cruz Warns to Be Mindful Of
2023/08/05  00:00:00,"How the abrogation of Article 370 has brought a new era of peace, progress and prosperity"
2023/08/05  00:00:00,Oregon ends ban on self-service gas pumps after 72 years: Confused motorists turn to 'how-to' guides and station attendants' union slams the change as 'blatant cash grab'
2023/08/05  00:00:00,Times When Tom Schwartz Proved Hes Just as Bad as Tom Sandoval
2023/08/05  00:00:00,Taiwan in Time: Worshipping a human skull
2023/08/05  00:00:00,Senior Spotlight: Carson High School's Ruby Nguyen driven by academics and NJROTC
2023/08/05  00:00:00,Bhopal: Woman Kills Self Due To Financial Stress
2023/08/05  00:00:00,Russian shelling kills 1 in Sumy Oblast
2023/08/05  00:00:00,"Alyosha tank crew hit two Ukrainian T-72B tanks, six military vehicles in battle"
2023/08/05  00:00:00,"Some Idaho Republicans worry presidential caucus will reduce turnout, divide party"
2023/08/05  00:00:00,The dangerous convergence of religious nationalism in Israel and America
2023/08/05  00:00:00,"Nottm Forest delight with European club destined to accept offer for Tottenham target, but one big hurdle remains"
2023/08/05  00:00:00,DeSantis responds to 2 Orlando police officers injured in shooting
2023/08/05  00:00:00,"Ministerial screening: I tweeted out of anger, Bosun Tijani tells senators"
2023/08/05  00:00:00,"Bengaluru Start-Up Lays Off 18 Employees, Co-Founders Offer To Help Find New Jobs"
2023/08/05  00:00:00,Sadiq Khan accused of letting slip Labour's secret plot to roll out ULEZ across Britain
2023/08/05  00:00:00,"Niger: Senate urges Tinubu, ECOWAS to explore political, diplomatic options"
2023/08/05  00:00:00,TSMC agrees to stricter oversight for the construction of Arizona chip plant
2023/08/05  00:00:00,Ukrainian envoy Polishchuk to arrive in Delhi on August 8; set to take charge soon
2023/08/05  00:00:00,Pavan K Varma | The nationalist's economic argument against hate
2023/08/05  00:00:00,"Rivers gov absent as Atiku, PDP govs, stakeholders meet in Abuja"
2023/08/05  00:00:00,Tinubus ministerial nominee apologises to senators for his past sin
2023/08/05  00:00:00,"Rivers gov absent as Atiku, PDP govs, stakeholders meet in Abuja"
2023/08/05  00:00:00,"Some Idaho Republicans worry presidential caucus will reduce turnout, divide party"
2023/08/05  00:00:00,NRC alerts train passengersof fake ticketing website
2023/08/05  00:00:00,Memory of civil rights movement must inform journalism: Fight that fight
2023/08/05  00:00:00,Russia Threatens Ecological War In The Black Sea
2023/08/05  00:00:00,Belfast Web Design Agency Profiletree Launches New Agency Services Integrating Ai
2023/08/05  00:00:00,VP Harris mocked for proclaiming 'community banks are in the community' once again: 'Another pearl of wisdom'
2023/08/05  00:00:00,"PM Modi speaks with Nepalese counterpart, reviews various aspects of Indo-Nepal cooperation"
2023/08/05  00:00:00,"Politico chews out Bidens for their dogs biting WH staffers: 'Lousy,' 'entitled' behavior by the first family"
2023/08/05  00:00:00,18-year-old man dead in police-involved shooting at Vancouver park
2023/08/05  00:00:00,Somalia: SSC Council Elects Chairman of Executive Council in Lasanod
2023/08/05  00:00:00,'Two cheetahs - Tejas & Suraj died of infection': Minister
2023/08/05  00:00:00,Intl moot seeks resolution of Kashmir dispute based on UN resolutions
2023/08/05  00:00:00,Russian shelling kills 1 in Sumy Oblast
2023/08/05  00:00:00,US President Joe Biden to visit India on Sept 7 for G-20 Summit
2023/08/05  00:00:00,The female doctor who served Salem residents from 1890 to 1941
2023/08/05  00:00:00,"5 Best Sites To Buy 50 Instagram Followers (Real, Active and Instant)"
