date,title
2023/08/20  00:00:00,Fades and braids - how a barbering course is helping at-risk students
2023/08/20  00:00:00,G20 summit: Hotels in Delhi pull out all the stops as world checks in
2023/08/20  00:00:00,"Seven killed, 90 wounded in Russian missile strike on Ukraines Chernihiv"
2023/08/20  00:00:00,"Russian missile strike kills seven, injures over 100 in Ukraine's Chernihiv"
2023/08/20  00:00:00,Pakistani police say they are under 'tremendous pressure' to find family members of murdered ten-year-old Sara Sharif amid claims the British High Commission is threatening to 'send their own investigators'
2023/08/20  00:00:00,Man sought in murder of 11-year-old Texas girl captured in Shreveport
2023/08/20  00:00:00,Pakistani police say they are under 'tremendous pressure' to find family members of murdered ten-year-old Sara Sharif amid claims the British High Commission is threatening to 'send their own investigators'
2023/08/20  00:00:00,Pakistani police say they are under 'tremendous pressure' to find family members of murdered ten-year-old Sara Sharif amid claims the British High Commission is threatening to 'send their own investigators'
2023/08/20  00:00:00,ABC audience responds to survey on whether extinct thylacine should be brought back to life
2023/08/20  00:00:00,Indigenous students take up space internships with NASA
2023/08/20  00:00:00,"Umno has options to Zahid, but none popular enough to unseat him, analysts say"
2023/08/20  00:00:00,Heritage Minister says Meta news block endangers lives as Canadians flee wildfires
2023/08/20  00:00:00,"High in the Andes, Lake Titicacas water levels fall to historic lows"
2023/08/20  00:00:00,Heritage Minister says Meta news block endangers lives as Canadians flee wildfires
2023/08/20  00:00:00,B.C. orders fire-zone travel bans as evacuations soar
2023/08/20  00:00:00,"After Maui and Canada, can Australia avoid another Black Summer bushfire event?"
2023/08/20  00:00:00,"Justice Isa visits Jaranwala, meets members of Christian community"
2023/08/20  00:00:00,Family of 11-year-old Maria Gonzalez releases statement after man accused of killing her was captured
2023/08/20  00:00:00,B.C. orders fire-zone travel bans as evacuations soar
2023/08/20  00:00:00,Maui residents begin to discuss how to rebuild
2023/08/20  00:00:00,Ive found the perfect way to see Japan
2023/08/20  00:00:00,B.C. orders fire-zone travel bans as evacuations soar
2023/08/20  00:00:00,"41 years after dacoity, man gets 10 years in jail in UP"
2023/08/20  00:00:00,Ex-Border Force boss accuses EU of fuelling migrant crisis as 'Brexit punishment'
2023/08/20  00:00:00,"Tony Abbott, Australian Leader Who Successfully Stopped Boat Migrants Tells Britain to Try Harder"
2023/08/20  00:00:00,Sarawak still not equipped to handle homeless folks with mental issues
2023/08/20  00:00:00,"Amid strife, Manipur hill people prefer Guwahati to Imphal for medical needs"
2023/08/20  00:00:00,The Pursuit Of Peace In Yemen  OpEd
2023/08/20  00:00:00,"Vacate forest land in 15 days, Orissa HC tells power company"
2023/08/20  00:00:00,"Ulfa-govt peace talks held, no headway yet"
2023/08/20  00:00:00,A story about a Sarawak Governor and two fishermen
2023/08/20  00:00:00,Qureshi arrested by FIA in missing cypher case
2023/08/20  00:00:00,Canadian firefighters wage epic battle to save communities after mass evacuations
2023/08/20  00:00:00,The Texas Chain Saw Massacre Happened 50 Years Ago Today
2023/08/20  00:00:00,PM says caretaker setup committed to financial prudence
2023/08/20  00:00:00,Alarming surge in Sutlej Rivers water level
2023/08/20  00:00:00,Potentially Catastrophic Flooding in Mountains and Deserts as Hilary Nears San Diego
2023/08/20  00:00:00,Sweden Raises Terror Threat Over Quran Burnings
2023/08/20  00:00:00,Lucy Letby: What prison life will look like with no hope of parole for child killer
2023/08/20  00:00:00,Ex-Border Force boss accuses EU of fuelling migrant crisis as 'Brexit punishment'
2023/08/20  00:00:00,"People should have a cash machine within a mile of where they live, says Andrew Griffith"
2023/08/20  00:00:00,"Yes, Minister! Stay the course, detached from turbulent politics"
2023/08/20  00:00:00,Lucy Letby: What prison life will look like with no hope of parole for child killer
2023/08/20  00:00:00,How Putins War Is Unleashing a Crisis Back Home in Russia
2023/08/20  00:00:00,"Yes, Minister! Stay the course, detached from turbulent politics"
2023/08/20  00:00:00,"Maharashtra CM chair may soon see a change, says Congress neta, BJP state president hits back"
2023/08/20  00:00:00,"Gang members convicted in 2018 killings in Athens, Gwinnett County"
2023/08/20  00:00:00,Stay inside to avoid wildfire smoke: City of Richmond
2023/08/20  00:00:00,BJP takes a jibe as Bihar Government tussles with Raj Bhavan
2023/08/20  00:00:00,Minister of Energy and Natural Resources talks wildfire response in Saskatoon
2023/08/20  00:00:00,Kelowna wildfire razes communities as province brings new support measures to fight blazes
2023/08/20  00:00:00,Minister of Energy and Natural Resources talks wildfire response in Saskatoon
2023/08/20  00:00:00,Minister of Energy and Natural Resources talks wildfire response in Saskatoon
2023/08/20  00:00:00,The Pursuit Of Peace In Yemen  OpEd
2023/08/20  00:00:00,Court orders FIR against 5 UP cops for beating teen to death
2023/08/20  00:00:00,Fades and braids - how a barbering course is helping at-risk students
2023/08/20  00:00:00,"Ron Cephas Jones, Emmy-Winning 'This Is Us' Star, Dead at 66"
2023/08/20  00:00:00,"Criminal indictments against Donald Trump are political persecution, Utah GOP leaders say"
2023/08/20  00:00:00,"Criminal indictments against Donald Trump are political persecution, Utah GOP leaders say"
2023/08/20  00:00:00,B-2 Flies Mock Strike Mission From Iceland To Alaska
2023/08/20  00:00:00,Tennessee hiking couple found safe in Alaska after search and rescue
2023/08/20  00:00:00,Armed groups seize up to 8 schools in Lebanon's Ain Al-Helweh: UN refugee body
2023/08/20  00:00:00,"Why devolution must work for children, youth, women and marginalised groups in Kenya"
2023/08/20  00:00:00,INTERACTIVE: Malaysias thriving fruits and vegetables
2023/08/20  00:00:00,"Yes, Minister! Stay the course, detached from turbulent politics"
2023/08/20  00:00:00,"Kohberger still on track for October trial, but several looming deadlines will need to be met in next six weeks"
2023/08/20  00:00:00,"Their beds ripped daily, rivers fly into a rage"
2023/08/20  00:00:00,Making Inroads On Womens Economic Empowerment
2023/08/20  00:00:00,Armed groups seize up to 8 schools in Lebanon's Ain Al-Helweh: UN refugee body
2023/08/20  00:00:00,"Local News | 

			Classic car owners say Woodward Dream Cruise keeps memories alive"
2023/08/20  00:00:00,Alarming surge in Sutlej Rivers water level
2023/08/20  00:00:00,The moment I knew: I had a realisation  if the plane crashed Id die without Laura knowing I loved her
2023/08/20  00:00:00,Progressive Culture | Scholars & Rogues
2023/08/20  00:00:00,Iran-Pakistan Pipeline Suspension Could Backfire For US  Analysis
2023/08/20  00:00:00,Delay in elections: PTI says will move SC against ECPs decision
2023/08/20  00:00:00,Putin humiliation as frontline commander admits troops can't beat Ukraine in major blow
2023/08/20  00:00:00,Qureshi arrested by FIA in missing cypher case
2023/08/20  00:00:00,Making Inroads On Womens Economic Empowerment
2023/08/20  00:00:00,Omaha Mayor To Lead Ireland Delegation
2023/08/20  00:00:00,Labor members greenlight agenda for 'bright future'
2023/08/20  00:00:00,B-2 Flies Mock Strike Mission From Iceland To Alaska
2023/08/20  00:00:00,Japan's Kishida visits Fukushima plant to highlight safety before start of treated water release
2023/08/20  00:00:00,"Top Office Dog, Charles the Dalmatian from Newcastle in the running for coveted good boy award"
2023/08/20  00:00:00,Putin humiliation as frontline commander admits troops can't beat Ukraine in major blow
2023/08/20  00:00:00,Labor members greenlight agenda for 'bright future'
2023/08/20  00:00:00,Robert Reich: Samuel Bankman-Fried And The Perversion Of Civic Virtue  OpEd
2023/08/20  00:00:00,"Man shot by police after tying up woman, sending children running for help"
2023/08/20  00:00:00,"National News | 

			Grandson of Jimmy and Rosalynn Carter says were in the final chapter in health update"
2023/08/20  00:00:00,"Top Office Dog, Charles the Dalmatian from Newcastle in the running for coveted good boy award"
2023/08/20  00:00:00,Bear cubs captured in Tahoe learning to be wild again at Sonoma County Wildlife Rescue
2023/08/20  00:00:00,Leroy Mac's Merino baby blankets produced in Lexton by McErvale farmers
2023/08/20  00:00:00,"Tennessee couple, 50 and 37, are found alive after going missing in the Alaskan wilderness for EIGHT DAYS - as photo shows them wide-eyed and covered in dirt just after being saved"
2023/08/20  00:00:00,Pawty animal: Cheyenne Potter's Pawty Time Puppy Parties get the pawty started for pampered pooches
2023/08/20  00:00:00,The US-China Tech Competition Takes Center Stage  Analysis
2023/08/20  00:00:00,Community marches to remember Clara Luper and the OKC sit-in movement's 65th anniversary
2023/08/20  00:00:00,Leroy Mac's Merino baby blankets produced in Lexton by McErvale farmers
2023/08/20  00:00:00,Jeffrey Epsteins notorious multi-million dollar New Mexico 'Zorro Ranch' finally sold to mysterious buyer
2023/08/20  00:00:00,State Democrats near unanimous in party chair removal
2023/08/20  00:00:00,"'Grandmother tree' at centre of development battle at Kariong over Darkinjung land council plan, as photographer Ken Duncan speaks out"
2023/08/20  00:00:00,The US-China Tech Competition Takes Center Stage  Analysis
2023/08/20  00:00:00,Mass arrests target Iranian activists nearly one year after Mahsa Amini's death
2023/08/20  00:00:00,The moment I knew: I had a realisation  if the plane crashed Id die without Laura knowing I loved her
2023/08/20  00:00:00,Profile: The solid embankment for people -- China's courageous first-responders to floods
2023/08/20  00:00:00,"Tennessee couple, 50 and 37, are found alive after going missing in the Alaskan wilderness for EIGHT DAYS - as photo shows them wide-eyed and covered in dirt just after being saved"
2023/08/20  00:00:00,Robert Reich: Samuel Bankman-Fried And The Perversion Of Civic Virtue  OpEd
2023/08/20  00:00:00,"ED finds Rs 1 crore cash, Rs 25 crore gold & jewellery with Sharad Pawar's aide"
2023/08/20  00:00:00,Russian missile attack kills 7 in northern Ukrainian city as Zelenskyy visits NATO candidate Sweden
2023/08/20  00:00:00,Indigenous students take up space internships with NASA
2023/08/20  00:00:00,"Police investigating after Rockland man struck, killed in car crash"
2023/08/20  00:00:00,Niger: Well Hand Over In 3 Years  General Tchiani
2023/08/20  00:00:00,Robert Reich: Samuel Bankman-Fried And The Perversion Of Civic Virtue  OpEd
2023/08/20  00:00:00,"Tennessee couple, 50 and 37, are found alive after going missing in the Alaskan wilderness for EIGHT DAYS - as photo shows them wide-eyed and covered in dirt just after being saved"
2023/08/20  00:00:00,Profile: The solid embankment for people -- China's courageous first-responders to floods
2023/08/20  00:00:00,Carson City Library hosts first Bionics Camp in February
2023/08/20  00:00:00,Making Inroads On Womens Economic Empowerment
2023/08/20  00:00:00,"ED finds Rs 1 crore cash, Rs 25 crore gold & jewellery with Sharad Pawar's aide"
2023/08/20  00:00:00,Niger: Well Hand Over In 3 Years  General Tchiani
2023/08/20  00:00:00,Progressive Culture | Scholars & Rogues
2023/08/20  00:00:00,"Man shot by police after tying up woman, sending children running for help"
2023/08/20  00:00:00,21 Dinnerware Sets Our Editors Love
2023/08/20  00:00:00,J&K Bank dismisses chief manager after probe finds him to be ISI's 'deep asset'
2023/08/20  00:00:00,Can Utahs political figures disagree better on social media?
2023/08/20  00:00:00,"Raid on Marion County newspaper likely broke the law, experts say. But which one?"
2023/08/20  00:00:00,Ex Green deputy set to sue party after he was sacked from his position 'due to views on gender' in a 'fanatical clampdown on legitimate debate'
2023/08/20  00:00:00,"High in the Andes, Lake Titicacas water levels fall to historic lows"
2023/08/20  00:00:00,Family of 11-year-old Maria Gonzalez releases statement after man accused of killing her was captured
2023/08/20  00:00:00,Ive found the perfect way to see Japan
2023/08/20  00:00:00,Barrie residents honour soldiers from Dieppe Raid on 81st anniversary
2023/08/20  00:00:00,Family of 11-year-old Maria Gonzalez releases statement after man accused of killing her was captured
2023/08/20  00:00:00,Japan's Kishida visits Fukushima plant to highlight safety before start of treated water release
2023/08/20  00:00:00,Family of 11-year-old Maria Gonzalez releases statement after man accused of killing her was captured
2023/08/20  00:00:00,"Fire tourists, drone fliers told to stay clear of British Columbia blazes"
2023/08/20  00:00:00,"British Columbia wildfires intensify, doubling evacuations to over 35,000"
2023/08/20  00:00:00,"Gang members convicted in 2018 killings in Athens, Gwinnett County"
2023/08/20  00:00:00,Sask. survivors renew calls to declare children's home a residential school
2023/08/20  00:00:00,Dealer Sentenced After Selling The Wire Actor Fentanyl-Laced Heroin Which Killed Him
2023/08/20  00:00:00,"Fire tourists, drone fliers told to stay clear of British Columbia blazes"
2023/08/20  00:00:00,Flair launching new pilot training at Collingwood Airport
2023/08/20  00:00:00,Koala deaths on Campbelltown area roads spike with more in the past week
2023/08/20  00:00:00,Barrie residents honour soldiers from Dieppe Raid on 81st anniversary
2023/08/20  00:00:00,We want to make no country think war is worth it: Wong
2023/08/20  00:00:00,Remembering Kofi Annan: Global Icon Of Peace  OpEd
2023/08/20  00:00:00,"Fire tourists, drone fliers told to stay clear of British Columbia blazes"
2023/08/20  00:00:00,Victim relieved wolf-hybrid is in custody after vicious attack
2023/08/20  00:00:00,Barrie residents honour soldiers from Dieppe Raid on 81st anniversary
2023/08/20  00:00:00,Marcos Stressed Economics To Keep China Engaged In Philippines Development Agenda  Analysis
2023/08/20  00:00:00,"Poor storage in reservoir, reduced flows upset farmers in Rayalaseema region"
2023/08/20  00:00:00,Ecuador elections dominated by fears of assassination and violence
2023/08/20  00:00:00,Marcos Stressed Economics To Keep China Engaged In Philippines Development Agenda  Analysis
2023/08/20  00:00:00,Methane-busting seaweed scaled up ready for production
2023/08/20  00:00:00,A story about a Sarawak Governor and two fishermen
2023/08/20  00:00:00,"Wildfires can have global impact and are set to intensify, experts say"
2023/08/20  00:00:00,ABC audience responds to survey on whether extinct thylacine should be brought back to life
2023/08/20  00:00:00,Japan's Kishida visits Fukushima plant to highlight safety before start of treated water release
2023/08/20  00:00:00,Methane-busting seaweed scaled up ready for production
2023/08/20  00:00:00,Mississippi grand jury cites shoddy investigations by police department at center of mistrial
2023/08/20  00:00:00,Man shot near Wicker Park bar on New Year's Eve has died: medical examiner
2023/08/20  00:00:00,Scientists use death masks to recreate the face of 18th century royal
2023/08/20  00:00:00,PwC charged health department to provide risk management workshop in weeks before scandal
2023/08/20  00:00:00,Victim critically injured after stabbing outside Albany Care
2023/08/20  00:00:00,Mississippi grand jury cites shoddy investigations by police department at center of mistrial
2023/08/20  00:00:00,Methane-busting seaweed scaled up ready for production
2023/08/20  00:00:00,"Parents, educators meet with lawmakers on early childhood education goals"
2023/08/20  00:00:00,Russian missile attack kills 7 in northern Ukrainian city as Zelenskyy visits NATO candidate Sweden
2023/08/20  00:00:00,ABC audience responds to survey on whether extinct thylacine should be brought back to life
2023/08/20  00:00:00,Borroloola Bushman's Carnival celebrates budding campdraft and rodeo competitors
2023/08/20  00:00:00,Foreign policy: Why Nigeria is not taken seriously  Prof. Akinyemi
2023/08/20  00:00:00,B-2 Flies Mock Strike Mission From Iceland To Alaska
2023/08/20  00:00:00,Tropical flower supply tightens as rain dampens the north's dry season
2023/08/20  00:00:00,"British Columbia wildfires intensify, doubling evacuations to over 35,000"
2023/08/20  00:00:00,Four skiers plunge to ground as chairlift detaches from cable at ski resort
2023/08/20  00:00:00,"Canada fires intensify, more residents set to evacuate"
2023/08/20  00:00:00,"World News | 

			Mexico warns Baja California about Hurricane Hilary dangers"
2023/08/20  00:00:00,Borroloola Bushman's Carnival celebrates budding campdraft and rodeo competitors
2023/08/20  00:00:00,"British Columbia wildfires intensify, doubling evacuations to over 35,000"
2023/08/20  00:00:00,ACT Drug and Alcohol Court helping former addicts like Linda turn their lives around
2023/08/20  00:00:00,"Canada fires intensify, more residents set to evacuate"
2023/08/20  00:00:00,Tony taking up the mental health fight for those in regional Tasmania needing services
2023/08/20  00:00:00,"British Columbia wildfires intensify, doubling evacuations to over 35,000"
2023/08/20  00:00:00,"Frances Colonial Legacy, US Security Concerns Intersect In Niger: Russians At Gates Look For New Hunting Grounds  OpEd"
2023/08/20  00:00:00,"After Maui and Canada, can Australia avoid another Black Summer bushfire event?"
2023/08/20  00:00:00,"Canada fires intensify, more residents set to evacuate"
2023/08/20  00:00:00,Minister of Energy and Natural Resources talks wildfire response in Saskatoon
2023/08/20  00:00:00,TROPICS: Almost to the finish line of the Atlantic Hurricane season
2023/08/20  00:00:00,Borroloola Bushman's Carnival celebrates budding campdraft and rodeo competitors
2023/08/20  00:00:00,"Saskatoon city councillor sues health authority, doctors over mental health treatment"
2023/08/20  00:00:00,ACT Drug and Alcohol Court helping former addicts like Linda turn their lives around
2023/08/20  00:00:00,Mandaue City adopts Paleng-QR PH Plus
2023/08/20  00:00:00,ABC audience responds to survey on whether extinct thylacine should be brought back to life
2023/08/20  00:00:00,"Russian Strike On Ukraines Chernihiv Kills At Least Seven, Including Child, Wounds Scores"
2023/08/20  00:00:00,"Misinformation, confusion and scepticism in Mount Isa ahead of Voice referendum"
2023/08/20  00:00:00,"The row over Bradley Coopers prosthetic nose has stolen the headlines, but as CAROLINE GRAHAM writes, his biopic of Leonard Bernstein tells the fascinating story of a genius who said he needed women for emotional support - but men in the bedroom"
2023/08/20  00:00:00,"Saskatoon city councillor sues health authority, doctors over mental health treatment"
2023/08/20  00:00:00,Delhi Police object to We 20 meeting
2023/08/20  00:00:00,Zambry undertakes official visit to Iran
2023/08/20  00:00:00,Uttarakhand: More houses in Yamkeshwar block show cracks
2023/08/20  00:00:00,Yellowknife residents wonder if wildfires are the new normal as western Canada burns
2023/08/20  00:00:00,"Courts are alert, govt not so much"
2023/08/20  00:00:00,Mississippi grand jury cites shoddy investigations by police department at center of mistrial
2023/08/20  00:00:00,Stay inside to avoid wildfire smoke: City of Richmond
2023/08/20  00:00:00,Canada's British Columbia declares state of emergency as thousands are forced to evacuate Kelowna
2023/08/20  00:00:00,"North Korean hackers target US-South Korea military drills, police say"
2023/08/20  00:00:00,Barrie residents honour soldiers from Dieppe Raid on 81st anniversary
2023/08/20  00:00:00,Progressive Culture | Scholars & Rogues
2023/08/20  00:00:00,Stay inside to avoid wildfire smoke: City of Richmond
2023/08/20  00:00:00,"US, Japan, And South Korea at Camp David: The Implications Of Trilateral Summitry  Analysis"
2023/08/20  00:00:00,Canadian firefighters wage epic battle to save communities after mass evacuations
2023/08/20  00:00:00,"Fire tourists, drone fliers told to stay clear of British Columbia blazes"
2023/08/20  00:00:00,Heritage Minister says Meta news block endangers lives as Canadians flee wildfires
2023/08/20  00:00:00,"North Korea's new ICBM looks and works an awful lot like a Russian ICBM, experts say"
2023/08/20  00:00:00,Barrie residents honour soldiers from Dieppe Raid on 81st anniversary
2023/08/20  00:00:00,Canadian firefighters wage epic battle to save communities after mass evacuations
2023/08/20  00:00:00,Ecuador elections dominated by fears of assassination and violence
2023/08/20  00:00:00,Marcos Stressed Economics To Keep China Engaged In Philippines Development Agenda  Analysis
2023/08/20  00:00:00,INTERACTIVE: Malaysias thriving fruits and vegetables
2023/08/20  00:00:00,"Pier skateboardersentenced, police actions reasonable chief says"
2023/08/20  00:00:00,"Fire tourists, drone fliers told to stay clear of British Columbia blazes"
2023/08/20  00:00:00,Ex-UP MLA held for assaulting wife in Lucknow
2023/08/20  00:00:00,"'Stop, stop, stop!' | Mesquite PD release bodycam of officer shooting, killing teen after high-speed chase"
2023/08/20  00:00:00,Tropical flower supply tightens as rain dampens the north's dry season
2023/08/20  00:00:00,"One more body found, Shimla toll 24; IMD forecasts more rain"
2023/08/20  00:00:00,Dax Shepard sets rules for future sex lives of his daughters with Kristen Bell
2023/08/20  00:00:00,"Nearly 30,000 Chinese tourists visit Sri Lanka"
2023/08/20  00:00:00,Missing hikers found after disappearing in Alaskan wilderness for nearly a week
2023/08/20  00:00:00,"'Stop, stop, stop!' | Mesquite PD release bodycam of officer shooting, killing teen after high-speed chase"
2023/08/20  00:00:00,Uttarakhand: More houses in Yamkeshwar block show cracks
2023/08/20  00:00:00,Philippines to Resupply South China Sea Troops After Beijing's Block
2023/08/20  00:00:00,"Man shot by police after tying up woman, sending children running for help"
2023/08/20  00:00:00,Xinhua Commentary: Trilateral meeting at Camp David stokes embers of Cold War
2023/08/20  00:00:00,Committee seeks Unifor funds for proposed Serians St Theresa parish pastoral centre
2023/08/20  00:00:00,Marcos Stressed Economics To Keep China Engaged In Philippines Development Agenda  Analysis
2023/08/20  00:00:00,"Police investigating after Rockland man struck, killed in car crash"
2023/08/20  00:00:00,"'Stop, stop, stop!' | Mesquite PD release bodycam of officer shooting, killing teen after high-speed chase"
2023/08/20  00:00:00,Man returns to college after random acts of kindness from CBS News viewers
2023/08/20  00:00:00,Philippines to Resupply South China Sea Troops After Beijing's Block
2023/08/20  00:00:00,SC says show-cause notice issued to taxpayer must contain all necessary facts
2023/08/20  00:00:00,"Maharashtra CM chair may soon see a change, says Congress neta, BJP state president hits back"
2023/08/20  00:00:00,Philippines to Resupply South China Sea Troops After Beijing's Block
2023/08/20  00:00:00,"Nearly 30,000 Chinese tourists visit Sri Lanka"
2023/08/20  00:00:00,Dax Shepard sets rules for future sex lives of his daughters with Kristen Bell
2023/08/20  00:00:00,Man duped on pretext of Zomato membership
2023/08/20  00:00:00,"'Stop, stop, stop!' | Mesquite PD release bodycam of officer shooting, killing teen after high-speed chase"
2023/08/20  00:00:00,DOJ says D.C. officers suicide after Jan. 6 riot is line of duty death
2023/08/20  00:00:00,"Canada fires intensify, more residents set to evacuate"
2023/08/20  00:00:00,Russia's lunar lander hit by unspecified 'emergency situation'
2023/08/20  00:00:00,"Man shot by police after tying up woman, sending children running for help"
2023/08/20  00:00:00,"Frances Colonial Legacy, US Security Concerns Intersect In Niger: Russians At Gates Look For New Hunting Grounds  OpEd"
2023/08/20  00:00:00,How Putins War Is Unleashing a Crisis Back Home in Russia
2023/08/20  00:00:00,"Civic calendar | Arcata council, planners to discuss Gateway Area Plan"
2023/08/20  00:00:00,Flight heading towards Burlington makes emergency stop in Charlotte
2023/08/20  00:00:00,Ex-UP MLA held for assaulting wife in Lucknow
2023/08/20  00:00:00,4 victims held at gunpoint in carjacking and robbery outside Woodridge movie theater
2023/08/20  00:00:00,UAE Condemns Mob Attack on Christian Community in Pakistan
2023/08/20  00:00:00,Lucy Letby: What prison life will look like with no hope of parole for child killer
2023/08/20  00:00:00,Man charged in Lac du Flambeau stabbing pleads not guilty
2023/08/20  00:00:00,"Pro-Life Activists Can Proceed With Freedom of Speech Lawsuit, Court Rules"
2023/08/20  00:00:00,"Man shot by police after tying up woman, sending children running for help"
2023/08/20  00:00:00,Judge rejects Bryan Kohbergers request for stay of trial
2023/08/20  00:00:00,Missing hikers found after disappearing in Alaskan wilderness for nearly a week
2023/08/20  00:00:00,B.C. orders fire-zone travel bans as evacuations soar
2023/08/20  00:00:00,"Man shot by police after tying up woman, sending children running for help"
2023/08/20  00:00:00,Jeffrey Epsteins notorious multi-million dollar New Mexico 'Zorro Ranch' finally sold to mysterious buyer
2023/08/20  00:00:00,Andrew O'Keefe is arrested: Ex-host of Deal or No Deal spends the night in a police cell after he is accused of breaching a restraining order
2023/08/20  00:00:00,League City shooting: Husband charged with murder in wife's death
2023/08/20  00:00:00,B.C. orders fire-zone travel bans as evacuations soar
