date,title
2023/08/05  00:00:00,"Real Estate | 

			Illinois attorney general sides with Winnetka in Open Meetings Act dispute related to lakefront land controversy"
2023/08/05  00:00:00,US weighs whether to designate US Army soldier in North Korea a POW
2023/08/05  00:00:00,Maugean Skate Recovery Team Denies Protection Action
2023/08/05  00:00:00,Impose more sanctions on Sudan leaders: rights group
2023/08/05  00:00:00,Biden considers raising stakes for escalation with Iran in Gulf
2023/08/05  00:00:00,Biden considers raising stakes for escalation with Iran in Gulf
2023/08/05  00:00:00,Biden considers raising stakes for escalation with Iran in Gulf
2023/08/05  00:00:00,Could WA Govt ditch Aboriginal Cultural Heritage Act?
2023/08/05  00:00:00,Could WA Govt ditch Aboriginal Cultural Heritage Act?
2023/08/05  00:00:00,"Iran proposes long jail terms, AI surveillance in harsh new hijab law"
2023/08/05  00:00:00,"The US Has No Afghan Policy, And It Badly Needs One  Analysis"
2023/08/05  00:00:00,Abhijit Bhattacharyya | Beijing's wolf warriors' in fresh games: Watch out!
2023/08/05  00:00:00,"Niger: FG shuts border, northern senators reject military intervention"
2023/08/05  00:00:00,"After admitting to girlfriends murder, NJ man gets 35 years prison"
2023/08/05  00:00:00,Review: De Niro returns to grumpy dad mode in likeable comedy About My Father
2023/08/05  00:00:00,Review: De Niro returns to grumpy dad mode in likeable comedy About My Father
2023/08/05  00:00:00,HGTV Personality Tarek El Moussa Denies Hes Evicting North Hollywood Tenants To Build New Complex: My Intentions Are To Do Good
2023/08/05  00:00:00,Seventh Bus Carrying Asylum Seekers Sent from Texas Arrives in Downtown Los Angeles
2023/08/05  00:00:00,British pensioner who killed his wife breaks silence after prison release
2023/08/05  00:00:00,Murder suspect in custody in Miracle Street shooting
2023/08/05  00:00:00,Karnataka govt announces lockdown from April 27 for 14 days
2023/08/05  00:00:00,British pensioner who killed his wife breaks silence after prison release
2023/08/05  00:00:00,"Alexandria police officer arrested, accused of lying to arrest person on felony"
2023/08/05  00:00:00,US Defense Under Secretary Moultrie Visits Israel
2023/08/05  00:00:00,Houston volunteer found not guilty for feeding the homeless. Now he's suing the city.
2023/08/05  00:00:00,The politicization of medicine continues apace
2023/08/05  00:00:00,Abhijit Bhattacharyya | Beijing's wolf warriors' in fresh games: Watch out!
2023/08/05  00:00:00,Illinois attorney general sides with Winnetka in Open Meetings Act dispute related to lakefront land controversy
2023/08/05  00:00:00,"Nitish Kumar Starts Getting Ready For National Role, Eyes Lok Sabha Seats In Uttar Pradesh"
2023/08/05  00:00:00,Future of AP Psychology classes in Florida remains uncertain
2023/08/05  00:00:00,Houston volunteer found not guilty for feeding the homeless. Now he's suing the city.
2023/08/05  00:00:00,"Norfolk activist, father of Ali Muhammad speaks out about arrest in son's death"
2023/08/05  00:00:00,Haryana Home Minister says Nuh violence was pre-planned
2023/08/05  00:00:00,AP Psychology could be back on students' schedules in Florida as DOE clarifies guidance
2023/08/05  00:00:00,Impose more sanctions on Sudan leaders: rights group
2023/08/05  00:00:00,UPDATE 1-Saudi Arabia calls on its citizens to quickly leave Lebanon
2023/08/05  00:00:00,Keanu Reeves reaction to 9-year-old who says hes his favorite actor is breaking hearts
2023/08/05  00:00:00,Fargo sues state of North Dakota to uphold ban on home gun sales
2023/08/05  00:00:00,New POST Director chosen after previous choice voted out of consideration
2023/08/05  00:00:00,"Three Years On, Families Of Victims Commemorate Beirut Port Explosion As They Await Truth"
2023/08/05  00:00:00,Indiana man linked to the killing of Cynthia Hoffman enters guilty plea
2023/08/05  00:00:00,Seventh Bus Carrying Asylum Seekers Sent from Texas Arrives in Downtown Los Angeles
2023/08/05  00:00:00,National authors return to Aroostook County for poem reading
2023/08/05  00:00:00,Lansdale works to preserve historic Wells Fargo bank building
2023/08/05  00:00:00,Seventh Bus Carrying Asylum Seekers Sent from Texas Arrives in Downtown Los Angeles
2023/08/05  00:00:00,"Memorial Service for John Green on Sunday, August 6th"
2023/08/05  00:00:00,Ukraine war latest: More explosions reported in occupied Crimea
2023/08/05  00:00:00,Gavin Kish & El Paso Steal the Show in this Jarritos Commercial
2023/08/05  00:00:00,Air-To-Air Missiles From UK Now Being Used By Ukraine As SAMs
2023/08/05  00:00:00,"Russia conscription laws change, leaving some fearful of Ukraine war call-up"
2023/08/05  00:00:00,"Letters to the Editor | 

			Letters: Keep rail | Techs limitations | Unworkable ballots | Moderate America | National issue | Driving fear"
2023/08/05  00:00:00,Gavin Kish & El Paso Steal the Show in this Jarritos Commercial
2023/08/05  00:00:00,Air-To-Air Missiles From UK Now Being Used By Ukraine As SAMs
2023/08/05  00:00:00,Indiana man linked to the killing of Cynthia Hoffman enters guilty plea
2023/08/05  00:00:00,Donald Trump told not to talk to witnesses in 2020 election conspiracy case. It may be a challenge
2023/08/05  00:00:00,Indiana man linked to the killing of Cynthia Hoffman enters guilty plea
2023/08/05  00:00:00,Donald Trump told not to talk to witnesses in 2020 election conspiracy case. It may be a challenge
2023/08/05  00:00:00,Pool company owner details finding suitcase with human remains
2023/08/05  00:00:00,Anti-Trump Republican candidates say they see donor bumps when they attack him
2023/08/05  00:00:00,"Trump Threatens If You Go After Me, Im Coming After You Day After Court Warns Him Not to Issue Threats"
2023/08/05  00:00:00,"For Expeditionary Center airmen, a new challenge in the Pacific"
2023/08/05  00:00:00,"Virginia Politics | 

			Virginia budget negotiations update: Signs of progress"
2023/08/05  00:00:00,CDC data suggests a late summer surge of COVID-19 cases. Are Utahns affected?
2023/08/05  00:00:00,Second man sentenced in Pittsfield Farm and Home theft case
2023/08/05  00:00:00,"For Expeditionary Center airmen, a new challenge in the Pacific"
2023/08/05  00:00:00,"The US Has No Afghan Policy, And It Badly Needs One  Analysis"
2023/08/05  00:00:00,"Countries In Bri Falling Into Chinese Debt Trap, Italy's Pm To Propose Bri Cancellation"
2023/08/05  00:00:00,"For Expeditionary Center airmen, a new challenge in the Pacific"
2023/08/05  00:00:00,It is a nightmare: Family says car remains in shop days after being damaged at Walmart
2023/08/05  00:00:00,"The US Has No Afghan Policy, And It Badly Needs One  Analysis"
2023/08/05  00:00:00,"WWE SmackDown Results: Winners, Live Grades, Reaction, Highlights Before SummerSlam"
2023/08/05  00:00:00,Abhijit Bhattacharyya | Beijing's wolf warriors' in fresh games: Watch out!
2023/08/05  00:00:00,A Pizza Shop in the Middle of New Yorks Migrant Crisis
2023/08/05  00:00:00,"Clifton Oliver, 'The Lion King' and 'Wicked' Broadway actor, dead at 47"
2023/08/05  00:00:00,International pressure mounts on coup leaders in Niger while hundreds rally in support of junta
2023/08/05  00:00:00,Slow-Motion Heist: Midwestern Farmers Accuse Chinese Communist Party Of Stealing Valuable American Seeds
2023/08/05  00:00:00,Australian Christian Lobby says plans to combat social media misinformation will cancel Christian posts
2023/08/05  00:00:00,Australian Christian Lobby says plans to combat social media misinformation will cancel Christian posts
2023/08/05  00:00:00,Review: De Niro returns to grumpy dad mode in likeable comedy About My Father
2023/08/05  00:00:00,Twitch streamer charged with inciting a riot after giveaway draws huge crowds to Union Square in New York City
2023/08/05  00:00:00,Shyanne-Lee Tatnell: Sad family split over proposed memorial to murdered teen at Launceston bridge where she was last seen: 'I just can't'
2023/08/05  00:00:00,Australian Christian Lobby says plans to combat social media misinformation will cancel Christian posts
2023/08/05  00:00:00,Israeli AI Startup Vesttoo Sparks a Global Insurance Scandal
2023/08/05  00:00:00,Just A Joint Declaration Or Towards Sahel African Treaty Organization (SATO)?  OpEd
2023/08/05  00:00:00,Israeli AI Startup Vesttoo Sparks a Global Insurance Scandal
2023/08/05  00:00:00,Just A Joint Declaration Or Towards Sahel African Treaty Organization (SATO)?  OpEd
2023/08/05  00:00:00,"News | 

			California judge arrested on suspicion of murdering his wife"
2023/08/05  00:00:00,United Arab Emirates to release 'Barbie' movie after delay over content issues
2023/08/05  00:00:00,"2 behind bars after more than 40 guns stolen from Orange County storage unit, deputies say"
2023/08/05  00:00:00,Review: De Niro returns to grumpy dad mode in likeable comedy About My Father
2023/08/05  00:00:00,Restored Beckett artworks feature in 'Making it Modern'
2023/08/05  00:00:00,Couple convicted in scheme to smuggle papers soaked with illegal drugs into the Montgomery County jail
2023/08/05  00:00:00,News Corp bullies to be held accountable over one-sided Voice coverage
2023/08/05  00:00:00,News Corp bullies to be held accountable over one-sided Voice coverage
2023/08/05  00:00:00,Review: De Niro returns to grumpy dad mode in likeable comedy About My Father
2023/08/05  00:00:00,International pressure mounts on coup leaders in Niger while hundreds rally in support of junta
2023/08/05  00:00:00,Could WA Govt ditch Aboriginal Cultural Heritage Act?
2023/08/05  00:00:00,British pensioner who killed his wife breaks silence after prison release
2023/08/05  00:00:00,Another lawsuit challenges pending Massachusetts law on pork production
2023/08/05  00:00:00,British pensioner who killed his wife breaks silence after prison release
2023/08/05  00:00:00,Another lawsuit challenges pending Massachusetts law on pork production
2023/08/05  00:00:00,Maugean Skate Recovery Team Denies Protection Action
2023/08/05  00:00:00,Federal judge will not force Governor Abbott to remove Rio Grande River buoy barrier
2023/08/05  00:00:00,Review: De Niro returns to grumpy dad mode in likeable comedy About My Father
2023/08/05  00:00:00,Help Feed Hoosiers in Need: Donate Your Deer During Indianas Deer Season
2023/08/05  00:00:00,"Boree Park Stud, Dinninup hosts educational open day on eID and sheep genetics"
2023/08/05  00:00:00,Sudden Pain in the Land of People
2023/08/05  00:00:00,Lagos hospital killer elevator faulty  since 2020  NMA chairman
2023/08/05  00:00:00,"Boree Park Stud, Dinninup hosts educational open day on eID and sheep genetics"
2023/08/05  00:00:00,"Crime and Public Safety | 

			2 men sentenced to 25 years to life after killing teen, dumping body in Long Beach"
2023/08/05  00:00:00,Lack of action from Congress leaves the courts to dictate US immigration policy
2023/08/05  00:00:00,"Boree Park Stud, Dinninup hosts educational open day on eID and sheep genetics"
2023/08/05  00:00:00,Scarborough: 'I Bend Over Backwards Too Hard' To Understand Other Views
2023/08/05  00:00:00,"Aussies need treaty explained to them, says opposition"
2023/08/05  00:00:00,String of break-ins puts Inglewood businesses on edge
2023/08/05  00:00:00,"Owner told they cant bring dog on plane  so they abandoned it at airport, cops say"
2023/08/05  00:00:00,Maus evades a ban in Iowa after school district cites ambiguity in new state law
2023/08/05  00:00:00,Rare chance to bid on a coveted plot
2023/08/05  00:00:00,Meghan Markle and Prince Harry warned brands 'tainted' but expert points to positive path
2023/08/05  00:00:00,"Man sold 'large amount' of drugs out of RV at B.C. music festival, police allege"
2023/08/05  00:00:00,Financial Literacy Teaches Young Kiwis Self-Management
2023/08/05  00:00:00,"Montgomeryville 7-Eleven employee charged after allegedly groping female worker, police say"
2023/08/05  00:00:00,Blue-green algae advisory issued for Wabamun Lake ahead of August long weekend
2023/08/05  00:00:00,Insignia adviser losses on downward trend
2023/08/05  00:00:00,Companies help women break maritime glass ceiling
2023/08/05  00:00:00,Niger coup: Northern Senators kick against ECOWAS proposed military onslaught
2023/08/05  00:00:00,"Global card linkage will help users, merchants"
2023/08/05  00:00:00,New Mexico City Considered One Of The Best Small Towns In The U.S.
2023/08/05  00:00:00,Temple University celebrates a new medical school class with white coats and proud parents
2023/08/05  00:00:00,"Global card linkage will help users, merchants"
2023/08/05  00:00:00,"Wells Fargo, Sacramento credit agency accused of new fake-accounts scam in suit"
2023/08/05  00:00:00,In pics: flowers' journey from fields to customers
2023/08/05  00:00:00,Financial Literacy Teaches Young Kiwis Self-Management
2023/08/05  00:00:00,In pics: flowers' journey from fields to customers
2023/08/05  00:00:00,Another lawsuit challenges pending Massachusetts law on pork production
2023/08/05  00:00:00,Boulder County sheriff says Marshall Fire investigation slowed by Xcel
2023/08/05  00:00:00,Slow-Motion Heist: Midwestern Farmers Accuse Chinese Communist Party Of Stealing Valuable American Seeds
2023/08/05  00:00:00,Abhijit Bhattacharyya | Beijing's wolf warriors' in fresh games: Watch out!
2023/08/05  00:00:00,Just A Joint Declaration Or Towards Sahel African Treaty Organization (SATO)?  OpEd
2023/08/05  00:00:00,"Montreal police arrest eight people, seize money and magic mushrooms over three raids at 'FunGuyz'"
2023/08/05  00:00:00,"Environment | 

			After 21 alleged home break-ins, bear family captured in South Lake Tahoe"
2023/08/05  00:00:00,"Tistamukh-Bahadurabad route: Tracks abandoned, promises unkept"
2023/08/05  00:00:00,Esk Valley couple who cant get full insurance payout hope buyouts will help
2023/08/05  00:00:00,Couple convicted in scheme to smuggle papers soaked with illegal drugs into the Montgomery County jail
2023/08/05  00:00:00,Professional ballet dancer returns to Tampa to teach next generation of dancers
2023/08/05  00:00:00,"Global card linkage will help users, merchants"
2023/08/05  00:00:00,"Today there is chance to prevent total ethnic cleansing of Nagorno Karabakh, Ambassador-at-Large Edmon Marukyan"
2023/08/05  00:00:00,Engine room of tanker damaged as a result of attack by Ukrainian forces in Kerch Strait
2023/08/05  00:00:00,Inmate who fell from upper bunk bed at McLennan County Jail planning to file lawsuit against county
2023/08/05  00:00:00,"Global card linkage will help users, merchants"
2023/08/05  00:00:00,Airbnb profit jumps to $650 million in Q2
2023/08/05  00:00:00,Imran Khans sisters appear before JIT probing May 9 mayhem
2023/08/05  00:00:00,Harrie P. Woodson Library celebrates children of Caldwell and their summer reading accomplishments
2023/08/05  00:00:00,Imran Khans sisters appear before JIT probing May 9 mayhem
2023/08/05  00:00:00,Houston volunteer found not guilty for feeding the homeless. Now he's suing the city.
2023/08/05  00:00:00,A Bitcoin Bonnie and Clyde Plead Guilty to a $4.5 Billion Cryptocurrency-Laundering Scheme
2023/08/05  00:00:00,'She's part of Rebecca': Grieving B.C. family reunited with dog that ran away after fatal crash
2023/08/05  00:00:00,"Letters to the Editor | 

			Letters: Keep rail | Techs limitations | Unworkable ballots | Moderate America | National issue | Driving fear"
2023/08/05  00:00:00,5 staffers of creditor group booked for abetting art director Nitin Desais suicide
2023/08/05  00:00:00,CTN News - Chiang Rai Times
2023/08/05  00:00:00,St. Bernard Parish DA sues Port NOLA; attempts to block $1.8 billion project
2023/08/05  00:00:00,"Boundary County man charged with shooting wife, setting house on fire in 2020"
2023/08/05  00:00:00,"Alexandria police officer arrested, accused of lying to arrest person on felony"
2023/08/05  00:00:00,Insignia adviser losses on downward trend
2023/08/05  00:00:00,Evers vetoes GOP proposals on unemployment and gas engines but signs bills on crime
2023/08/05  00:00:00,A Bitcoin Bonnie and Clyde Plead Guilty to a $4.5 Billion Cryptocurrency-Laundering Scheme
2023/08/05  00:00:00,Sophia Bush and Grant Hughes Split After 13 Months of Marriage
2023/08/05  00:00:00,Sophia Bush and Grant Hughes Split After 13 Months of Marriage
2023/08/05  00:00:00,Guatemala-based group extends hand on First Nations' residential school searches
2023/08/05  00:00:00,China To Join Jeddah Peace Summit On Ukraine
2023/08/05  00:00:00,'It happens so regularly': New study argues for lowering the age of breast cancer screening in Canada
2023/08/05  00:00:00,Alberta International Airshow set to take off again after 2 years
2023/08/05  00:00:00,"Alexandria police officer arrested, accused of lying to arrest person on felony"
2023/08/05  00:00:00,"Boundary County man charged with shooting wife, setting house on fire in 2020"
2023/08/05  00:00:00,Esk Valley couple who cant get full insurance payout hope buyouts will help
2023/08/05  00:00:00,Lychee exports boom on efficient policies
2023/08/05  00:00:00,"Crime and Public Safety | 

			Excessive force complaints against Colorado Springs officers who beat suspect are unfounded, review finds"
2023/08/05  00:00:00,Donald Trump told not to talk to witnesses in 2020 election conspiracy case. It may be a challenge
2023/08/05  00:00:00,Lychee exports boom on efficient policies
2023/08/05  00:00:00,CriminalDefamationMisusedToSilenceCritics
2023/08/05  00:00:00,"Global card linkage will help users, merchants"
2023/08/05  00:00:00,What the jury didnt hear during Noel Longs cold case trial for murdering Nora Sheehan
2023/08/05  00:00:00,Its important to get a grip: we havent actually seen Walter Sofronoffs report yet
2023/08/05  00:00:00,Family of man shot by law enforcement in Thomas County calls for transparency
2023/08/05  00:00:00,Maus evades a ban in Iowa after school district cites ambiguity in new state law
2023/08/05  00:00:00,Australian Christian Lobby says plans to combat social media misinformation will cancel Christian posts
2023/08/05  00:00:00,Police: man accused in second missing person death
2023/08/05  00:00:00,Pope presides Way of Cross ceremony at youth festival
2023/08/05  00:00:00,Ukraine Is Russias Last Peasant War  OpEd
2023/08/05  00:00:00,Australian Christian Lobby says plans to combat social media misinformation will cancel Christian posts
2023/08/05  00:00:00,Phoenix firefighters rescue two distressed hikers within hours of each other Friday
2023/08/05  00:00:00,Its important to get a grip: we havent actually seen Walter Sofronoffs report yet
2023/08/05  00:00:00,Police lay assault charges at Redcliffe
2023/08/05  00:00:00,Australian Christian Lobby says plans to combat social media misinformation will cancel Christian posts
2023/08/05  00:00:00,"Advocates and intended parents 'urgently' wait for WA's new surrogacy laws, but it's too late for some"
2023/08/05  00:00:00,Blue-green algae advisory issued for Wabamun Lake ahead of August long weekend
2023/08/05  00:00:00,Fox News' Johnny Joey Jones reflects on 13th 'Alive Day' anniversary after losing his legs
2023/08/05  00:00:00,Arizona City Considered One Of The Best Small Towns In The U.S.
2023/08/05  00:00:00,Australian Christian Lobby says plans to combat social media misinformation will cancel Christian posts
2023/08/05  00:00:00,"News | 

			Seventh bus of migrants from Texas arrives in LA"
2023/08/05  00:00:00,Teen charged in fatal after-hours stabbing outside Connecticut elementary school
2023/08/05  00:00:00,"Today there is chance to prevent total ethnic cleansing of Nagorno Karabakh, Ambassador-at-Large Edmon Marukyan"
2023/08/05  00:00:00,Shyanne-Lee Tatnell: Sad family split over proposed memorial to murdered teen at Launceston bridge where she was last seen: 'I just can't'
2023/08/05  00:00:00,Illinois attorney general sides with Winnetka in Open Meetings Act dispute related to lakefront land controversy
2023/08/05  00:00:00,Twitch streamer charged with inciting a riot after giveaway draws huge crowds to Union Square in New York City
2023/08/05  00:00:00,"Norfolk activist, father of Ali Muhammad speaks out about arrest in son's death"
2023/08/05  00:00:00,Levelland mother accepts life sentence in toddler's death
2023/08/05  00:00:00,A guide to breweries and craft beer tours in New Zealand
2023/08/05  00:00:00,"Aussies need treaty explained to them, says opposition"
2023/08/05  00:00:00,"Birmingham area awarded over $300,000 in grants from Gov. Iveys utility assistance program"
2023/08/05  00:00:00,Persons responsible for Punganur violence will be booked: DGP
2023/08/05  00:00:00,Underworld links probed in fatal street shooting
2023/08/05  00:00:00,"News | 

			California judge arrested on suspicion of murdering his wife"
2023/08/05  00:00:00,Shooting victim filed PPO against suspect one week before her murder
2023/08/05  00:00:00,"17-Year-Old Suspect Arrested in Killing of O'Shae Sibley, Voguing Gay Man"
2023/08/05  00:00:00,Police charge youth over Launceston incident
2023/08/05  00:00:00,"XBB, sublineages continue to dominate in Philippines"
2023/08/05  00:00:00,"MCSO: Fort Bragg man arrested for alleged attempted murder, cocaine sales"
2023/08/05  00:00:00,Teen charged in fatal after-hours stabbing outside Connecticut elementary school
2023/08/05  00:00:00,"In Semenyih, voter apathy gives both BN and Perikatan mountain to climb before election day"
2023/08/05  00:00:00,"Activists outside of Lawrence Livermore Lab remember those who died in Hiroshima, Nagasaki"
2023/08/05  00:00:00,Former vice-president of China's top court sentenced to 15 years in prison
2023/08/05  00:00:00,"Meet Window Snyder, the trailblazer who helped secure the internet and billions of devices"
2023/08/05  00:00:00,Former vice-president of China's top court sentenced to 15 years in prison
2023/08/05  00:00:00,"Norfolk activist, father of Ali Muhammad speaks out about arrest in son's death"
2023/08/05  00:00:00,Israeli AI Startup Vesttoo Sparks a Global Insurance Scandal
2023/08/05  00:00:00,Lawsuit filed to remove ban on hemp products like Delta-8
2023/08/05  00:00:00,Case dropped against Chesterfield man who gave money to 'Sound of Freedom' film
2023/08/05  00:00:00,Israeli AI Startup Vesttoo Sparks a Global Insurance Scandal
2023/08/05  00:00:00,"Meet Window Snyder, the trailblazer who helped secure the internet and billions of devices"
2023/08/05  00:00:00,"Elderly Husband Arrested in Connection With Wife's Dismemberment Is 'Upstanding Citizen,' His Lawyer Says"
2023/08/05  00:00:00,Second man sentenced in Pittsfield Farm and Home theft case
2023/08/05  00:00:00,"Missing N.J. teen is found in Georgia, 2 men charged with luring"
2023/08/05  00:00:00,Australian Christian Lobby says plans to combat social media misinformation will cancel Christian posts
2023/08/05  00:00:00,Arizona City Considered One Of The Best Small Towns In The U.S.
2023/08/05  00:00:00,Second man sentenced in Pittsfield Farm and Home theft case
2023/08/05  00:00:00,"News | 

			California judge arrested on suspicion of murdering his wife"
2023/08/05  00:00:00,Teepees exhibit returns to Yellowstone Park for second year
2023/08/05  00:00:00,Maus evades a ban in Iowa after school district cites ambiguity in new state law
2023/08/05  00:00:00,Arizona City Considered One Of The Best Small Towns In The U.S.
2023/08/05  00:00:00,Ukraine war latest: More explosions reported in occupied Crimea
2023/08/05  00:00:00,Israeli AI Startup Vesttoo Sparks a Global Insurance Scandal
2023/08/05  00:00:00,Salem Lakes woman set on fire; Myron Bowie taken into custody
2023/08/05  00:00:00,Pope presides Way of Cross ceremony at youth festival
2023/08/05  00:00:00,HGTV Personality Tarek El Moussa Denies Hes Evicting North Hollywood Tenants To Build New Complex: My Intentions Are To Do Good
2023/08/05  00:00:00,Homicide Squad investigate South Yarra fatal shooting
2023/08/05  00:00:00,"London, Ont. man sentenced for role in Grant Norton homicide case"
2023/08/05  00:00:00,"Wells Fargo, Sacramento credit agency accused of new fake-accounts scam in suit"
2023/08/05  00:00:00,Police shoot at suicidal man after taking fire in Columbia; suspect killed
2023/08/05  00:00:00,"2 people break into camper, paddle 12 miles down southern Indiana river during meth-fueled excursion"
2023/08/05  00:00:00,'We scrounge for that money': Victoria family struggling to afford parking in low-income building
2023/08/05  00:00:00,Houston volunteer found not guilty for feeding the homeless. Now he's suing the city.
2023/08/05  00:00:00,"West Windsor, NJ woman, 71, found killed after neighbors noticed break-in"
2023/08/05  00:00:00,Underworld links probed in fatal street shooting
2023/08/05  00:00:00,A Pizza Shop in the Middle of New Yorks Migrant Crisis
2023/08/05  00:00:00,Esk Valley couple who cant get full insurance payout hope buyouts will help
2023/08/05  00:00:00,Emergency crews recover body from Calgarys Bow River
2023/08/05  00:00:00,"Real Estate | 

			Illinois attorney general sides with Winnetka in Open Meetings Act dispute related to lakefront land controversy"
2023/08/05  00:00:00,Ukraine Seeks To Involve China In Saudi Talks For Peace Blueprint
2023/08/05  00:00:00,Red Bluff Police release weekly crime stats to foster transparency with community
2023/08/05  00:00:00,Israeli AI Startup Vesttoo Sparks a Global Insurance Scandal
2023/08/05  00:00:00,CDC data suggests a late summer surge of COVID-19 cases. Are Utahns affected?
2023/08/05  00:00:00,Israeli AI Startup Vesttoo Sparks a Global Insurance Scandal
2023/08/05  00:00:00,PICTURED: Mugshots of two white 'Goon Squad' Mississippi cops who - along with four others - brutally tortured two black men in shocking racist assault
2023/08/05  00:00:00,Temple University celebrates a new medical school class with white coats and proud parents
2023/08/05  00:00:00,Teepees exhibit returns to Yellowstone Park for second year
