date,title
2023/08/05  00:00:00,A man who tried to sail from Alaska to San Diego has gone missing. A friend tells Insider he urged him not to go.
2023/08/05  00:00:00,Colorado Department of Higher Education reports massive data breach
2023/08/05  00:00:00,Graduate pay to be discussed at next week's meeting - PM
2023/08/05  00:00:00,"Pence discusses military, including death of Sgt. Pichardo at town hall"
2023/08/05  00:00:00,AC Milan contact Barcelona over Clement Lenglet deal
2023/08/05  00:00:00,"Manipur Violence: Fresh Violence In Bishnupur Kills At Least 3 From Meitei Community, Several Kuki Houses Burnt"
2023/08/05  00:00:00,A man who tried to sail from Alaska to San Diego has gone missing. A friend tells Insider he urged him not to go.
2023/08/05  00:00:00,Friends Honor Slain Dancer OShae Sibley With Defiant Vigil at Murder Scene
2023/08/05  00:00:00,Survivors of the Adriana: The captain lost the way ... Thats when we called for help
2023/08/05  00:00:00,Bhopal: Many Left PG Seats Because Of Dr Aruna: OBGYN Doctors
2023/08/05  00:00:00,Making Brakes Is Way More Complicated Than You Thought
2023/08/05  00:00:00,"Police arrest 12 kidnap suspects, rescue 10 victims in Bauchi"
2023/08/05  00:00:00,AP Psychology could be back on students' schedules in Florida as DOE clarifies guidance
2023/08/05  00:00:00,"Elgar case: Vernon Gonsalves, Arun Ferreira to walk out of jail as court issues their release order"
2023/08/05  00:00:00,Conservative lawmaker poised to be Washingtons next state Republican party leader
2023/08/05  00:00:00,Gerakan leader says was with Bersatu's Ahmad Faizal in Seremban during alleged sexual harassment incident in KL
2023/08/05  00:00:00,"Niger: Detained President Calls For Help, Defiant Junta Refuses To Hand Back Power"
2023/08/05  00:00:00,Coinbase Petitions To Dismiss Sec Lawsuit Over Crypto Regulation
2023/08/05  00:00:00,"Police arrest 12 kidnap suspects, rescue 10 victims in Bauchi"
2023/08/05  00:00:00,AC Milan contact Barcelona over Clement Lenglet deal
2023/08/05  00:00:00,No fuel leak from Russian tanker damaged near Crimea
2023/08/05  00:00:00,"Niger: Detained President Calls For Help, Defiant Junta Refuses To Hand Back Power"
2023/08/05  00:00:00,"Argall, Heffley host summit on community revitalization"
2023/08/05  00:00:00,"Ladies, here is the truth about men and party girls"
2023/08/05  00:00:00,"Feds alert judge to Trumps If you go after me, Im coming after you! post"
2023/08/05  00:00:00,Premier apologizes for comments about The Progress Report's Duncan Kinney
2023/08/05  00:00:00,"Missing N.J. teen is found in Georgia, 2 men charged with luring"
2023/08/05  00:00:00,"World's Second-Largest Gem, Jewellery Trade Show Kicks Off In India"
2023/08/05  00:00:00,"Arlington dog trainer under fire after two pets die in his care, district attorney reviewing both cases"
2023/08/05  00:00:00,"$100K raised within days to save chancery; Property hosted pope, who later became a saint"
2023/08/05  00:00:00,Whooping cranes: Wisconsin home to America's tallest flying birds again
2023/08/05  00:00:00,Teens shot Wednesday on West Plains remain hospitalized in serious but stable condition
2023/08/05  00:00:00,Burgum to visit ND National Guard soldiers at border
2023/08/05  00:00:00,Mississippi State University student and Brandon native appears in Barbie movie and volunteers to save lives from human trafficking
2023/08/05  00:00:00,Chandrayaan-3 Is Now Close To The Moon. Here's What Will Happen In The Next 24 Hours
2023/08/05  00:00:00,Mississippi State University student and Brandon native appears in Barbie movie and volunteers to save lives from human trafficking
2023/08/05  00:00:00,"Arlington dog trainer under fire after two pets die in his care, district attorney reviewing both cases"
2023/08/05  00:00:00,DPRK slams US arms aid to Taiwan as 'dangerous' provocation
2023/08/05  00:00:00,Voices from the Arab press: Restoring overdue credit to Egypt
2023/08/05  00:00:00,Ramaphosa will NOT be probing Kill the Boer chant
2023/08/05  00:00:00,Sky is the limit for aviation industry
2023/08/05  00:00:00,Phoenix Childrens Hospital may be dropped by insurance company if agreement isnt reached
2023/08/05  00:00:00,'Incorrect to say Article 370 has been abrogated'
2023/08/05  00:00:00,Attorney sees UNMH taking over care at the Bernalillo County jail as a hopeful sign
2023/08/05  00:00:00,Vietnam leverages rice exports but assures food security
2023/08/05  00:00:00,"Suspect charged in robbing man, stealing his Merle French bulldog at gunpoint"
2023/08/05  00:00:00,Denmark considers enacting laws to prevent burning of Quran
2023/08/05  00:00:00,Making Brakes Is Way More Complicated Than You Thought
2023/08/05  00:00:00,Property in Cook County tied to Warren Jeffs group reportedly sells
2023/08/05  00:00:00,"Insults Are So Phony: DeSantis Blasts Trumps Conduct, Record To New Hampshire Voters"
2023/08/05  00:00:00,7 critically injured in school bus crash that closes major highway in Idaho
2023/08/05  00:00:00,Legal wrangling continues over injection well site
2023/08/05  00:00:00,"99-year-old trucking company closing, impacting nearly 755 NC locations"
2023/08/05  00:00:00,National Assembly concludes debate on TRNUC report |05 August 2023
2023/08/05  00:00:00,Local nonprofit aims to help reptiles through education
2023/08/05  00:00:00,Yanda Biratj group look to introduce Indigenous language in schools
2023/08/05  00:00:00,Applications now open for EP business assistance
2023/08/05  00:00:00,PM Anwar claims extraordinary support for Pakatan in Kedah ahead of state elections
2023/08/05  00:00:00,"Artificial intelligence is gaining state lawmakers' attention, and they have a lot of questions"
2023/08/05  00:00:00,Local nonprofit aims to help reptiles through education
2023/08/05  00:00:00,BARNETT: Bidens Immigration Policy Is A $3 Billion Golden Ticket For Parolees. Not So Much For Taxpayers
2023/08/05  00:00:00,Family and friends remember Sydney Wilsons life at vigil
2023/08/05  00:00:00,Trump's threatening post flagged by US prosecutors to judge
2023/08/05  00:00:00,Family and friends remember Sydney Wilsons life at vigil
2023/08/05  00:00:00,Sky is the limit for aviation industry
2023/08/05  00:00:00,Family histories: Brothers in Arms. The fate of two brothers in World War I
2023/08/05  00:00:00,Justice Department faces biggest test in its history with election conspiracy case against Trump
2023/08/05  00:00:00,Local nonprofit aims to help reptiles through education
2023/08/05  00:00:00,College student stabbed date during sex as 'revenge' for Iranian commander's death
2023/08/05  00:00:00,President to arrive in TN today for three-day visit
2023/08/05  00:00:00,"Artificial intelligence is gaining state lawmakers' attention, and they have a lot of questions"
2023/08/05  00:00:00,Healthcare facilities see uptick in cyber-attacks
2023/08/05  00:00:00,"Ollie D, The Jamaican Reggae Artist, Rocks The Red Carpet In Hollywood While Championing 21St Century Education For Jamaican Schools"
2023/08/05  00:00:00,'Campaign of defamation' about competitor leads to $1.5M judgment against B.C. company
2023/08/05  00:00:00,"Artificial intelligence is gaining state lawmakers' attention, and they have a lot of questions"
2023/08/05  00:00:00,Rich Miller: Misinformation leads to battle over bill
2023/08/05  00:00:00,"Import curbs on laptops, PCs to come into force from Nov 1"
2023/08/05  00:00:00,Yanda Biratj group look to introduce Indigenous language in schools
2023/08/05  00:00:00,"Cameron, Beshear, BBQ: Here's what to look for at the Fancy Farm showdown Saturday"
2023/08/05  00:00:00,Vendors anticipate slowdown ahead of Fulton courthouse road closures
2023/08/05  00:00:00,Russia's US-sanctioned SIG tanker hit in drone attack near Crimea Bridge
2023/08/05  00:00:00,The politician fighting to end period shaming in Kenya
2023/08/05  00:00:00,Could natural gas exports change the Israeli government's trajectory?
2023/08/05  00:00:00,'Incorrect to say Article 370 has been abrogated'
2023/08/05  00:00:00,Josh's Weekend Forecast: Some of the nicest summer weather imaginable awaits all of Western NY
2023/08/05  00:00:00,DPRK slams US arms aid to Taiwan as 'dangerous' provocation
2023/08/05  00:00:00,$4M NIH Grant Secures Decade of National Stress Study
2023/08/05  00:00:00,Fukushima discharge row: Hong Kong experts warn over radioactive contamination risk for Japanese seafood if waste water released
2023/08/05  00:00:00,Leading loyalist Winkie Irvine drops pay claim against former employer
2023/08/05  00:00:00,Redon Systems showcases Indias First barrel launched loitering munition system
2023/08/05  00:00:00,Woman suing Atlanta Popeyes following alleged drive-thru assault
2023/08/05  00:00:00,SWAT team kills suspect after 2 Orlando police officers shot during traffic stop
2023/08/05  00:00:00,Conservative lawmaker poised to be Washingtons next state Republican party leader
2023/08/05  00:00:00,Suspected bank robber worked as a bank security guard and served 42 years in prison for murder
2023/08/05  00:00:00,Family histories: Brothers in Arms. The fate of two brothers in World War I
2023/08/05  00:00:00,Cabinet refutes claims of Minister Radegondes possible link to Gerard Hoaraus death |05 August 2023
2023/08/05  00:00:00,"Ron DeSantis' biggest donor says he's STOPPED giving to Florida gov's 2024 campaign over hardline stance on abortion, with $20M backer urging GOP hopeful to become more moderate"
2023/08/05  00:00:00,China to attend talks on Ukraine in Saudi Arabia that exclude Russia
2023/08/05  00:00:00,"$100K raised within days to save chancery; Property hosted pope, who later became a saint"
2023/08/05  00:00:00,Russian warship appears to have been damaged in Ukrainian drone attack
2023/08/05  00:00:00,SWAT team kills suspect after 2 Orlando police officers shot during traffic stop
2023/08/05  00:00:00,Matties Call issued for 34-year-old Clayton County man
2023/08/05  00:00:00,President to arrive in TN today for three-day visit
2023/08/05  00:00:00,Binh Thuan province certifies investors in LNG-to-power projects
2023/08/05  00:00:00,House adjourned as truce remains elusive on Manipur
2023/08/05  00:00:00,Cabinet refutes claims of Minister Radegondes possible link to Gerard Hoaraus death |05 August 2023
2023/08/05  00:00:00,Community Joins Together for a Balloon Release to Honor the Late Sistrane Edwards
2023/08/05  00:00:00,President to arrive in TN today for three-day visit
2023/08/05  00:00:00,"UCLA in the News August 4, 2023"
2023/08/05  00:00:00,Search for missing 17-year-old girl last seen in Joliette
2023/08/05  00:00:00,Russian warship appears to have been damaged in Ukrainian drone attack
2023/08/05  00:00:00,BARNETT: Bidens Immigration Policy Is A $3 Billion Golden Ticket For Parolees. Not So Much For Taxpayers
2023/08/05  00:00:00,Healthcare facilities see uptick in cyber-attacks
2023/08/05  00:00:00,Not a single Republican wants to run against Tammy Baldwin in 2024 because shes that badass
2023/08/05  00:00:00,Politico: Eight Ukrainian pilots ready to train on F-16s
2023/08/05  00:00:00,Gujarat: Man killed for spitting near his neighbours door
2023/08/05  00:00:00,"Bully DEI trainer paid $7,500 an hour is heard LAUGHING as she taunts beloved gay school principal driven to suicide for questioning her woke diktats - as crony who held no-whites school meetings is also identified"
2023/08/05  00:00:00,State dashboard shows how opioid settlement funds are being used
2023/08/05  00:00:00,Kejriwal pays tribute to 3 army personnel killed in Kulgam encounter
2023/08/05  00:00:00,What next for Russia-Africa relations after awkward summit?
2023/08/05  00:00:00,Shaping Indias agricultural legacy for next 25 years
2023/08/05  00:00:00,Search for missing 17-year-old girl last seen in Joliette
2023/08/05  00:00:00,Gujarat: Man killed for spitting near his neighbours door
2023/08/05  00:00:00,See Meghan Markle's Pre-Birthday Date Night With Prince Harry In Montecito
2023/08/05  00:00:00,Dwarf athlete wins two golds in Germany: Help offered by Dharwad techie
2023/08/05  00:00:00,How High-power politics cost Maryam Shetty ministerial nomination
2023/08/05  00:00:00,Search for missing 17-year-old girl last seen in Joliette
2023/08/05  00:00:00,"Pence discusses military, including death of Sgt. Pichardo at town hall"
2023/08/05  00:00:00,"Residents question, comment on proposed missile defense"
2023/08/05  00:00:00,"Cameron, Beshear, BBQ: Here's what to look for at the Fancy Farm showdown Saturday"
2023/08/05  00:00:00,China's embassy to Russia criticises treatment of citizens at border
2023/08/05  00:00:00,Unmanned surface vessel rams Russian tanker in Kerch Strait
2023/08/05  00:00:00,Family histories: Brothers in Arms. The fate of two brothers in World War I
2023/08/05  00:00:00,"Madhya Pradesh: After Release Of Water From Bagri, Level Of Narmada Rising"
2023/08/05  00:00:00,Justice Department faces biggest test in its history with election conspiracy case against Trump
2023/08/05  00:00:00,"Forgotten Wisconsin Cold Cases: Junelle Marquard, Dakota & Dayna Menger"
2023/08/05  00:00:00,"Residents question, comment on proposed missile defense"
2023/08/05  00:00:00,Emmerdales Cain Dingle gives rare glimpse of caring side to protect another family
2023/08/05  00:00:00,Burn Spokane Down graffiti reported downtown hours before several fires set on west side of town
2023/08/05  00:00:00,New Gilgo Beach Murders Victim Identified After Over 10 Years; Alleged Serial Killer Rex Heuermann's Wife Breaks Silence
2023/08/05  00:00:00,Central Vermont Chamber Music Festival: 31st celebrates the memory of Ed Koren
2023/08/05  00:00:00,Case filed against NCC cadet who whacked juniors during physical training session in Maharashtra
2023/08/05  00:00:00,College student stabbed date during sex as 'revenge' for Iranian commander's death
2023/08/05  00:00:00,"Residents question, comment on proposed missile defense"
2023/08/05  00:00:00,Over 15 persons injured after government bus hits tree in Tiruvannamalai
2023/08/05  00:00:00,The politician fighting to end period shaming in Kenya
2023/08/05  00:00:00,Conservative lawmaker poised to be Washingtons next state Republican party leader
2023/08/05  00:00:00,Case filed against NCC cadet who whacked juniors during physical training session in Maharashtra
2023/08/05  00:00:00,"News | 

			Vermonts flood-wracked capital city ponders a rebuild with one eye on climate change"
2023/08/05  00:00:00,The politician fighting to end period shaming in Kenya
2023/08/05  00:00:00,Lowell man convicted of woman's 2020 murder
2023/08/05  00:00:00,Vietnam leverages rice exports but assures food security
2023/08/05  00:00:00,US man survives being impaled with a flagpole at a fast-food restaurant
2023/08/05  00:00:00,Justice Department faces biggest test in its history with election conspiracy case against Trump
2023/08/05  00:00:00,Suspect Charged With Murder in OShae Sibley Stabbing Death in Brooklyn
2023/08/05  00:00:00,Woman suing Atlanta Popeyes following alleged drive-thru assault
2023/08/05  00:00:00,"Artificial intelligence is gaining state lawmakers' attention, and they have a lot of questions"
2023/08/05  00:00:00,"Pence discusses military, including death of Sgt. Pichardo at town hall"
2023/08/05  00:00:00,JCPS celebrates new Perry Elementary School opening this year in Louisville's west end
2023/08/05  00:00:00,"Cameron, Beshear, BBQ: Here's what to look for at the Fancy Farm showdown Saturday"
2023/08/05  00:00:00,The day M5 motorists spotted a British Airways Boeing 747 being transported through the Midlands
2023/08/05  00:00:00,"Amit Shah to launch highway project, hold meeting on Left-wing extremism in Odisha"
2023/08/05  00:00:00,TikTok unveils new measures ahead of EU Digital Services Act
2023/08/05  00:00:00,21 mn people in Afghanistan facing severe cuts in relief due to funding gaps: UN
2023/08/05  00:00:00,New Indian Defence Attach to Seychelles calls on Foreign Affairs minister   |05 August 2023
2023/08/05  00:00:00,"Cameron, Beshear, BBQ: Here's what to look for at the Fancy Farm showdown Saturday"
2023/08/05  00:00:00,College student stabbed date during sex as 'revenge' for Iranian commander's death
2023/08/05  00:00:00,Yanda Biratj group look to introduce Indigenous language in schools
2023/08/05  00:00:00,Central Vermont Chamber Music Festival: 31st celebrates the memory of Ed Koren
2023/08/05  00:00:00,Justice Department faces biggest test in its history with election conspiracy case against Trump
2023/08/05  00:00:00,"PM says Putrajaya to review salary scheme for fresh graduates, civil servants"
2023/08/05  00:00:00,Rajasthan CM Gehlot mocks BJP for turning upcoming state electionsinto PM vs CM contest
2023/08/05  00:00:00,"Bulletin: Its That Time of Year Again: Edu Fairs, High School Grads Hunting for Colleges and Scholarships"
2023/08/05  00:00:00,New Gilgo Beach Murders Victim Identified After Over 10 Years; Alleged Serial Killer Rex Heuermann's Wife Breaks Silence
2023/08/05  00:00:00,"EPA study: Quality of Ohios rivers rises, Dayton-area rivers among states best"
2023/08/05  00:00:00,"Two books are back in District 20s school libraries, after being removed in April"
2023/08/05  00:00:00,College student charged with felony pot possession
2023/08/05  00:00:00,Barack Obama biographer David Garrow who revealed ex-president's 'gay fantasies' says ex-president is as insecure as DONALD TRUMP
2023/08/05  00:00:00,"Texas Eats: Big Brunch Food Challenge, Steaks & Pizza"
2023/08/05  00:00:00,"Bully DEI trainer paid $7,500 an hour is heard LAUGHING as she taunts beloved gay school principal driven to suicide for questioning her woke diktats - as crony who held no-whites school meetings is also identified"
2023/08/05  00:00:00,President to arrive in TN today for three-day visit
2023/08/05  00:00:00,Rural GP crisis: Meet the foreign doctors whove answered the call
2023/08/05  00:00:00,Sole standing Liberal premier notes 'responsibility'
2023/08/05  00:00:00,"Putin Critic Navalny Sentenced To 19 More Yrs In Prison, UN Rights Chief Condemns 'JudicialHarassment'"
2023/08/05  00:00:00,2 PFI operatives arrested in Bihar's Motihari
2023/08/05  00:00:00,"Slain Fort Worth 77-year-old was not 18-year-old man's intended target, family says"
2023/08/05  00:00:00,TN farmers to protest on Aug 15 against state govt
2023/08/05  00:00:00,Justice Department faces biggest test in its history with election conspiracy case against Trump
2023/08/05  00:00:00,Teen shooting suspect reports to authorities
2023/08/05  00:00:00,Barack Obama biographer David Garrow who revealed ex-president's 'gay fantasies' says ex-president is as insecure as DONALD TRUMP
2023/08/05  00:00:00,"Slain Fort Worth 77-year-old was not 18-year-old man's intended target, family says"
2023/08/05  00:00:00,"News | 

			Vermonts flood-wracked capital city ponders a rebuild with one eye on climate change"
2023/08/05  00:00:00,"Bully DEI trainer paid $7,500 an hour is heard LAUGHING as she taunts beloved gay school principal driven to suicide for questioning her woke diktats - as crony who held no-whites school meetings is also identified"
2023/08/05  00:00:00,Sofia Vergara dazzles in sparkly gown as she arrives at Taylor Swift concert arm in arm with 'eyebrow queen' Anastasia Soare... amid divorce from Joe Manganiello
2023/08/05  00:00:00,Could natural gas exports change the Israeli government's trajectory?
2023/08/05  00:00:00,"City exporters meet customs, DGFT officials"
2023/08/05  00:00:00,Politicians Running Institutions Like Overlords Destrying Education in Maharashtra: Experts
2023/08/05  00:00:00,"3 Killed In Fresh Violence In Manipur, BJP MLA Blames Central Forces"
2023/08/05  00:00:00,How the Mason-Dixon Line Divided the North and the South
2023/08/05  00:00:00,Could natural gas exports change the Israeli government's trajectory?
2023/08/05  00:00:00,AC Milan contact Barcelona over Clement Lenglet deal
2023/08/05  00:00:00,Fitzgibbon brothers on 'toxic' NCA crime list years after heroin bust
2023/08/05  00:00:00,"In a desperate scramble for ammo, Russia's defense chief flew all the way to North Korea to beg for some of theirs"
2023/08/05  00:00:00,Barcelona edge closer to sealing Joao Cancelo deal
2023/08/05  00:00:00,State dashboard shows how opioid settlement funds are being used
2023/08/05  00:00:00,Voices from the Arab press: Restoring overdue credit to Egypt
2023/08/05  00:00:00,Justice Department faces biggest test in its history with election conspiracy case against Trump
2023/08/05  00:00:00,TSRTC merger bill: Telangana Guv seeks clarity from BRS govt on these 5 issues
2023/08/05  00:00:00,Judge allows key U.S. antitrust Google search claims to go to trial
2023/08/05  00:00:00,Diner says she 'can't understand' and felt 'insulted' after meal at popular city Italian restaurant
2023/08/05  00:00:00,Nigerian Newspapers: 10 things you need to know this Saturday morning
2023/08/05  00:00:00,AC Milan contact Barcelona over Clement Lenglet deal
2023/08/05  00:00:00,Illegal kalonite mining racket busted in Kutch
2023/08/05  00:00:00,The Vietnam War  Dan Dybsetter  combat patrols in the Mekong Delta
2023/08/05  00:00:00,Amit Shah to hold crucial meet on left-wing extremism in Odisha
2023/08/05  00:00:00,Toledo kicks off Jeep Fest weekend
2023/08/05  00:00:00,Special counsel cites Truth Social post in arguing for quick court order on evidence sharing as Trump rails against 2020 election charges
2023/08/05  00:00:00,Travis County judge sides with Texas women denied abortions after dangerous pregnancies
2023/08/05  00:00:00,Barcelona edge closer to sealing Joao Cancelo deal
2023/08/05  00:00:00,Theres the traitor!: Pro-Trump protesters gather outside Mike Pence town hall
2023/08/05  00:00:00,"30 Children Hospitalized After School Bus Crash in Idaho, Police Confirm"
2023/08/05  00:00:00,Suspect Charged With Murder in OShae Sibley Stabbing Death in Brooklyn
2023/08/05  00:00:00,Gov. Katie Hobbs selects acting chief Jennie Cunico as state Health Department director
2023/08/05  00:00:00,Leading loyalist Winkie Irvine drops pay claim against former employer
2023/08/05  00:00:00,"Supreme Court Weekly Digest With Nominal And Subject/Statute Wise Index [July 10  16, 2023]"
2023/08/05  00:00:00,Premier Jeremy Rockliff addressed Liberal Party faithful on Saturday
2023/08/05  00:00:00,Chaplain honored in Camp Lejeune retirement ceremony after 41 years of military service
2023/08/05  00:00:00,Two teen murderers in Youngstown sentenced
2023/08/05  00:00:00,The breathtaking hills described as 'Little Switzerland' just 75 minutes from Birmingham
2023/08/05  00:00:00,Sofia Vergara dazzles in sparkly gown as she arrives at Taylor Swift concert arm in arm with 'eyebrow queen' Anastasia Soare... amid divorce from Joe Manganiello
2023/08/05  00:00:00,Conservative lawmaker poised to be Washingtons next state Republican party leader
2023/08/05  00:00:00,Making sense ofrisingcheetah mortality
2023/08/05  00:00:00,"Foul play involved in Cape Coral missing man case, police say"
2023/08/05  00:00:00,Yanda Biratj group look to introduce Indigenous language in schools
2023/08/05  00:00:00,Amit Shah to hold crucial meet on left-wing extremism in Odisha
2023/08/05  00:00:00,Sacked prison officer claims paedophiles and rapists treated me better than her bosses
2023/08/05  00:00:00,"30 Children Hospitalized After School Bus Crash in Idaho, Police Confirm"
2023/08/05  00:00:00,Barack Obama biographer David Garrow who revealed ex-president's 'gay fantasies' says ex-president is as insecure as DONALD TRUMP
2023/08/05  00:00:00,"National News | 

			Texas man who called for mass shooting of poll workers sentenced"
2023/08/05  00:00:00,"Parkersburg City Council to consider lawsuit settlement, budget revisions"
2023/08/05  00:00:00,"Republicans in Congress call for sanctions against Berri, Hezbollahs top ally"
2023/08/05  00:00:00,Generative AI Apps Removed from Apples Chinese App Store
2023/08/05  00:00:00,Secret life of 'dedicated' dad catches up with him after seven years on the run in Spain
2023/08/05  00:00:00,Feud Between Patriarch and Militia Leader Adds to Woes of Iraqi Christians
2023/08/05  00:00:00,US Police Arrest Man Accused Of Entering Women's Homes And Rubbing Their Feet While They Slept
2023/08/05  00:00:00,How High-power politics cost Maryam Shetty ministerial nomination
2023/08/05  00:00:00,"Parkersburg City Council to consider lawsuit settlement, budget revisions"
2023/08/05  00:00:00,Graduate pay to be discussed at next week's meeting - PM
2023/08/05  00:00:00,Barack Obama biographer David Garrow who revealed ex-president's 'gay fantasies' says ex-president is as insecure as DONALD TRUMP
2023/08/05  00:00:00,US Police Arrest Man Accused Of Entering Women's Homes And Rubbing Their Feet While They Slept
2023/08/05  00:00:00,How the haunting song of the humpback whale saved it from extinction
2023/08/05  00:00:00,Voices from the Arab press: Restoring overdue credit to Egypt
2023/08/05  00:00:00,Barcelona edge closer to sealing Joao Cancelo deal
2023/08/05  00:00:00,Theres the traitor!: Pro-Trump protesters gather outside Mike Pence town hall
2023/08/05  00:00:00,Limerick firms link-up ensures its presence on other side of the world
2023/08/05  00:00:00,"Suspected kingpin behind 10,000 illegal migrant Channel crossings into Britain vanishes after German court set him free under EU human rights laws"
2023/08/05  00:00:00,KC to solidify description for safety position in district
2023/08/05  00:00:00,"Cessnock's Paul Hokin stays at St John of God Richmond Hospital, where exercise is a big treatment for mental health"
2023/08/05  00:00:00,Nigerian Newspapers: 10 things you need to know this Saturday morning
2023/08/05  00:00:00,Judge allows key U.S. antitrust Google search claims to go to trial
2023/08/05  00:00:00,"Suspected kingpin behind 10,000 illegal migrant Channel crossings into Britain vanishes after German court set him free under EU human rights laws"
