date,title
2023/08/05  00:00:00,"T.N. CM to visit Ramanathapuram for two days, will address fishers meeting in Mandapam: Minister K.N. Nehru"
2023/08/05  00:00:00,'David vs Goliath' | Former UCSD doctor speaks out after winning $39M whistleblower lawsuit
2023/08/05  00:00:00,"Delhi High Court Allows US National Convicted Under POTA, Sedition To Travel Abroad For Visiting Ailing Father"
2023/08/05  00:00:00,A group of Mississippi cops who pleaded guilty to torturing Black men called themselves the 'Goon Squad' because they were willing to secretly use excessive force
2023/08/05  00:00:00,Green backlash? U.K.s leader fuels battle over driving  which could signal a coming climate fight
2023/08/05  00:00:00,"News | 

			 Expansion likely completed for San Diego County Fire as it takes over cash-strapped Borrego Springs"
2023/08/05  00:00:00,Delco Technical Schools Practical Nursing Program offers opportunities to those seeking new career
2023/08/05  00:00:00,More Baby Boomers are living alone. One reason why: gray divorce
2023/08/05  00:00:00,Attacks on Qur'an 'extremist acts': British academics
2023/08/05  00:00:00,David Hunter shares terminally-ill wife's final four-word sentence before ending her life
2023/08/05  00:00:00,This Massive Viper Has The Longest Fangs of Any Venomous Snake on Earth
2023/08/05  00:00:00,Two riders die as motorcycle crashes into car in Tangail
2023/08/05  00:00:00,Why fewer adults are extremely proud to be American: Experts warn people are focused on individualism
2023/08/05  00:00:00,Dennis Heaney received RUC death threats weeks before his murder
2023/08/05  00:00:00,Transfer: Tottenham Hotspur target Orban as Kanes replacement
2023/08/05  00:00:00,Does your rent keep going up? Tri-Cities workers say 40% rent surge is crushing them
2023/08/05  00:00:00,David Hunter shares terminally-ill wife's final four-word sentence before ending her life
2023/08/05  00:00:00,Donnelly on sidelines of NCH after reportedly not meeting board for 15 months
2023/08/05  00:00:00,Inside the tourist hotspot becoming a nightmare for locals as visitors 'shout all night'
2023/08/05  00:00:00,US and UK scouts abandon too-hot Korean jamboree
2023/08/05  00:00:00,2 Ohio men bound over for trial in murder of unidentified Texas man found dead in Michigan in 1997
2023/08/05  00:00:00,"Google illegally cut contract staffers who worked on AI, union alleges"
2023/08/05  00:00:00,Pope visits shrine in Portuguese town of Fatima
2023/08/05  00:00:00,NYPD police commissioner Edward Caban announces resignations of senior executives in message to department Friday
2023/08/05  00:00:00,"Tillu Tajpuriya murder: Delhi Police files chargesheet, rules out role of jail officials"
2023/08/05  00:00:00,Man accused of bigamy denied bail
2023/08/05  00:00:00,"Ukraine war: Another Russian vessel hit by sea drone near Crimean Bridge, Moscow says"
2023/08/05  00:00:00,David Hunter shares terminally-ill wife's final four-word sentence before ending her life
2023/08/05  00:00:00,Felony charge dismissed against the wife of Rocky's killer
2023/08/05  00:00:00,Inside Trumps alternate electors plot to steal the vote in Georgia
2023/08/05  00:00:00,Trash the vote: Why Arkansas rejects more of its mail-in ballots than almost any other state
2023/08/05  00:00:00,The France Hair Care Market Was Valued More Than Usd 2 Billion In 2022.  X Herald
2023/08/05  00:00:00,Ajit Doval In Jeddah For Saudi Arabia Hosted Ukraine Peace Talks
2023/08/05  00:00:00,"ASI conducts scientific survey of Gyanvapi mosque complex for second day, to continue on Sunday"
2023/08/05  00:00:00,More people go missing and thousands are evacuated as northeast China is hit by more floods
2023/08/05  00:00:00,Chhattisgarh: Pricey tomato now finds space in sweet stall
2023/08/05  00:00:00,Ajit Doval In Jeddah For Saudi Arabia Hosted Ukraine Peace Talks
2023/08/05  00:00:00,Inside Trumps alternate electors plot to steal the vote in Georgia
2023/08/05  00:00:00,Pakistan's history of jailing its former Prime Ministers
2023/08/05  00:00:00,A PINCODE for every dish: Kunal Kapurs new restaurant honours his grandmothers memories
2023/08/05  00:00:00,Philadelphias real minimum wage is among the worst in the U.S.
2023/08/05  00:00:00,Arab Parliament speaker hails Bahrains judicial progress
2023/08/05  00:00:00,Were Going to Start Slitting Throats: DeSantis Death Threat to US Public Servant Draws Ire
2023/08/05  00:00:00,"White Lizzo Trends Online, And You Can Probably Guess Which 2024 Candidate Theyre Talking About"
2023/08/05  00:00:00,RTE star enjoying break as she's pictured with son in rare family photo
2023/08/05  00:00:00,"Ukraine war: Another Russian vessel hit by sea drone near Crimean Bridge, Moscow says"
2023/08/05  00:00:00,Linda Burney encourages Voice to Parliament vote at Garma festival
2023/08/05  00:00:00,Linda Burney encourages Voice to Parliament vote at Garma festival
2023/08/05  00:00:00,What to know about Biden's new student loan plan
2023/08/05  00:00:00,Pentagon Holds Special Talks With Poland Regarding Provocations By Belarus
2023/08/05  00:00:00,Linda Burney encourages Voice to Parliament vote at Garma festival
2023/08/05  00:00:00,Nairobi calling: IndiGo opens door to Africa with direct flights to Safari Capital
2023/08/05  00:00:00,Defence chiefs turn to British firms for war machines
2023/08/05  00:00:00,"Homeless students, teenagers walk a hidden path in rural Oklahoma"
2023/08/05  00:00:00,Linda Burney encourages Voice to Parliament vote at Garma festival
2023/08/05  00:00:00,Take A Haunted Tour In Downtown Waterloo
2023/08/05  00:00:00,Fantasy K-Dramas That Must Be On Your Watchlist: From 'Tale Of The Nine Tailed' To 'Hotel Del Luna'
2023/08/05  00:00:00,Ajit Doval In Jeddah For Saudi Arabia Hosted Ukraine Peace Talks
2023/08/05  00:00:00,Efforts to Reduce Natural Gas Production Costs Can Be a Disincentive
2023/08/05  00:00:00,"Bloomington, Normal police: 278 speeding tickets given in July enforcement detail"
2023/08/05  00:00:00,Ajit Doval In Jeddah For Saudi Arabia Hosted Ukraine Peace Talks
2023/08/05  00:00:00,Vicky Kaushal Answers The Business Call In A Formal Grey Suit
2023/08/05  00:00:00,Fantasy K-Dramas That Must Be On Your Watchlist: From 'Tale Of The Nine Tailed' To 'Hotel Del Luna'
2023/08/05  00:00:00,Inside Trumps alternate electors plot to steal the vote in Georgia
2023/08/05  00:00:00,Defence chiefs turn to British firms for war machines
2023/08/05  00:00:00,Prayut vows army will continue to protect the country
2023/08/05  00:00:00,US to deliver more advanced equipment to Bangladesh military
2023/08/05  00:00:00,Fantasy K-Dramas That Must Be On Your Watchlist: From 'Tale Of The Nine Tailed' To 'Hotel Del Luna'
2023/08/05  00:00:00,Linda Burney encourages Voice to Parliament vote at Garma festival
2023/08/05  00:00:00,Defence chiefs turn to British firms for war machines
2023/08/05  00:00:00,Shiv Sena (UBT) to Host Third Meet of Oppn Bloc INDIA in Mumbai on Aug 31- Sep 1: Sanjay Raut
2023/08/05  00:00:00,Prayut vows army will continue to protect the country
2023/08/05  00:00:00,CBI charges Congress's Jagdish Tytler with murder in 1984 anti-sikhriotscase
2023/08/05  00:00:00,Defence chiefs turn to British firms for war machines
2023/08/05  00:00:00,"'Automated people mover' could save time, cut down on traffic to San Diego airport"
2023/08/05  00:00:00,Saudi Arabias role as mediator centre stage in Ukraine talks
2023/08/05  00:00:00,"How Sophie, Duchess of Edinburgh, turned to an ARCHDUCHESS for her astonishing collection of 74 handbags and clutches - all by the same designer"
2023/08/05  00:00:00,Kenyas offer to send police to Haiti sparks human rights concerns
2023/08/05  00:00:00,When will we get the final message from NASA's Voyager spacecraft?
2023/08/05  00:00:00,Defence chiefs turn to British firms for war machines
2023/08/05  00:00:00,Single mom escapes homelessness with help from CaringWorks
2023/08/05  00:00:00,Inside the tourist hotspot becoming a nightmare for locals as visitors 'shout all night'
2023/08/05  00:00:00,Bank of America Awards $1M Grant to National Juneteenth Museum
2023/08/05  00:00:00,"George Washington knew when it was  time to go, because the founders worried about the judgment of history"
2023/08/05  00:00:00,"Ukraine war: Another Russian vessel hit by sea drone near Crimean Bridge, Moscow says"
2023/08/05  00:00:00,"EXCLUSIVE: Dad reveals he lost half a million dollars, his home and WIFE after falling victim to cruel 'pig butchering' scam - as figures show Americans are losing record amounts to crypto fraudsters"
2023/08/05  00:00:00,"Mutton Pallipalayam in a Kongunadu restaurant, and more good food adventures of Zac OYeah"
2023/08/05  00:00:00,Trash the vote: Why Arkansas rejects more of its mail-in ballots than almost any other state
2023/08/05  00:00:00,"Xinhua Commentary: America, a robber unmasked"
2023/08/05  00:00:00,Two murderers among the criminals locked up in Greater Manchester this week
2023/08/05  00:00:00,"EXCLUSIVE: The Grand Designs project that nobody wants: World War Two observation tower marked as a quirky holiday home with spectacular views attracts zero bids after going on sale for 160,000"
2023/08/05  00:00:00,Edinburgh festival fringe acts outraged by censorship of provocative posters
2023/08/05  00:00:00,"How Sophie, Duchess of Edinburgh, turned to an ARCHDUCHESS for her astonishing collection of 74 handbags and clutches - all by the same designer"
2023/08/05  00:00:00,"Kyrgyzstan: Raids And Fines On Catholics, Protestants, Hare Krishna Devotees"
2023/08/05  00:00:00,Sources: Arsenal express interest in signing Chelsea target Elye Wahi after Gabriel Jesus injury
2023/08/05  00:00:00,Brazil resumes electricity imports from Venezuela after four years
2023/08/05  00:00:00,Wagner Group poised to unleash 'chaos as Niger appeals for help from Prigozhins thugs
2023/08/05  00:00:00,Ministers urged to rocket boost fostering to alleviate shortage of carers
2023/08/05  00:00:00,India authorities raze 200 Muslim homes following raging Hindu-Muslim rift
2023/08/05  00:00:00,"Weather wont stop us celebrating Brighton and Hove Pride, organisers say"
2023/08/05  00:00:00,Redcliffe restaurant owner says he's lucky to be alive after being glassed by two men during an alleged drunken rampage captured on CCTV
2023/08/05  00:00:00,Sources: Arsenal express interest in signing Chelsea target Elye Wahi after Gabriel Jesus injury
2023/08/05  00:00:00,Kenyas offer to send police to Haiti sparks human rights concerns
2023/08/05  00:00:00,Trash the vote: Why Arkansas rejects more of its mail-in ballots than almost any other state
2023/08/05  00:00:00,Bihar Congress chief confident of due representation in Nitish administration
2023/08/05  00:00:00,Urbandale's first full-time fire chief retires after 25 years with the department
2023/08/05  00:00:00,Kate and Camilla's loyal sisters: How Queen and Princess are looking to Elizabeth II's relationship with Princess Margaret for inspiration for their own reign as they keep their siblings close
2023/08/05  00:00:00,Sources: Arsenal express interest in signing Chelsea target Elye Wahi after Gabriel Jesus injury
2023/08/05  00:00:00,Member of the Knesset Ofer Cassif calls out Israeli government for supporting Azeri dictatorial regime
2023/08/05  00:00:00,Kate and Camilla's loyal sisters: How Queen and Princess are looking to Elizabeth II's relationship with Princess Margaret for inspiration for their own reign as they keep their siblings close
2023/08/05  00:00:00,Pope Francis prays for Ukraine with Ukranian pilgrims at the World Youth Day
2023/08/05  00:00:00,Police rescue Bangladeshi woman from prostitution ring
2023/08/05  00:00:00,"T.N. CM to visit Ramanathapuram for two days, will address fishers meeting in Mandapam: Minister K.N. Nehru"
2023/08/05  00:00:00,Planning a wedding? What to do if a vendor backs out before your big day
2023/08/05  00:00:00,Ukraine hits Russian oil tanker with sea drone hours after attacking naval base
2023/08/05  00:00:00,Two murderers among the criminals locked up in Greater Manchester this week
2023/08/05  00:00:00,"Petition demanding action on federal firefighter pay draws more than 13,000 signatures"
2023/08/05  00:00:00,Planning a wedding? What to do if a vendor backs out before your big day
2023/08/05  00:00:00,Uddhav Thackeray's Shiv Sena to host Opposition bloc INDIA's 3rd meet in Mumbai
2023/08/05  00:00:00,"Elgar accused Vernon Gonsalves, Arun Ferreira walk out of jail"
2023/08/05  00:00:00,"Petition demanding action on federal firefighter pay draws more than 13,000 signatures"
2023/08/05  00:00:00,Vehicular traffic likely to be affected on Anna Salai on Monday morning
2023/08/05  00:00:00,Spanish chef admits to Koh Phangan killing: Police
2023/08/05  00:00:00,Sources: Arsenal express interest in signing Chelsea target Elye Wahi after Gabriel Jesus injury
2023/08/05  00:00:00,Ajit Doval In Jeddah For Saudi Arabia Hosted Ukraine Peace Talks
2023/08/05  00:00:00,The worlds best universities in 2024 have been unveiled. 5 of the top 10 are in Europe
2023/08/05  00:00:00,"Price Bailey LLP, seek purchaser of assets of solar PV installation company"
2023/08/05  00:00:00,Last call for neoliberalism: What I saw at the party at the end of the world order
2023/08/05  00:00:00,Uddhav Thackeray's Shiv Sena to host Opposition bloc INDIA's 3rd meet in Mumbai
2023/08/05  00:00:00,"Elgar accused Vernon Gonsalves, Arun Ferreira walk out of jail"
2023/08/05  00:00:00,UK's most violent KFCs revealed: The fried chicken restaurants where the MOST mayhem kicked off last year
2023/08/05  00:00:00,More people go missing and thousands are evacuated as northeast China is hit by more floods
2023/08/05  00:00:00,Families evacuated from Clontarf homes after Storm Antoni flash flooding
2023/08/05  00:00:00,Kate and Camilla's loyal sisters: How Queen and Princess are looking to Elizabeth II's relationship with Princess Margaret for inspiration for their own reign as they keep their siblings close
2023/08/05  00:00:00,Premier: Sarawak committed to improving its health infrastructure
2023/08/05  00:00:00,"Hong Kong heading for small-scale flu outbreak, health adviser warns, as fourth unvaccinated child dies"
2023/08/05  00:00:00,"Current Foreign Office travel advice for Greece, Spain and Turkey after devastating fires"
2023/08/05  00:00:00,"Opinion | 

			Overcoming new vote-by-mail obstacles in Florida | Editorial"
2023/08/05  00:00:00,"How Sophie, Duchess of Edinburgh, turned to an ARCHDUCHESS for her astonishing collection of 74 handbags and clutches - all by the same designer"
2023/08/05  00:00:00,Felony charge dismissed against the wife of Rocky's killer
2023/08/05  00:00:00,UK's most violent KFCs revealed: The fried chicken restaurants where the MOST mayhem kicked off last year
2023/08/05  00:00:00,Last call for neoliberalism: What I saw at the party at the end of the world order
2023/08/05  00:00:00,Akali Dal protests raids on Khalsa Aid offices
2023/08/05  00:00:00,"One of Alabamas largest landfills fined $138,000 after hazardous waste found in open pits"
2023/08/05  00:00:00,Chowdeck Partners With Chicken Republic For Excellent Service Delivery
2023/08/05  00:00:00,Carlsbad's Missi Currier taps into her roots to lead New Mexico Oil and Gas Association
2023/08/05  00:00:00,Police rescue Bangladeshi woman from prostitution ring
2023/08/05  00:00:00,"Rivers: Policeman shoots father of three dead, command begins probe"
2023/08/05  00:00:00,Kuwait calls on Lebanon minister to retract comments
2023/08/05  00:00:00,Ram Mohan Library: A 120-year-old treasure trove of books in Vijayawada
2023/08/05  00:00:00,"Environment | 

			Bay Area air-quality agency a discriminatory old boys club hostile to minorities: lawsuit"
2023/08/05  00:00:00,"Tillu Tajpuriya murder: Delhi Police files chargesheet, rules out role of jail officials"
2023/08/05  00:00:00,Felony charge dismissed against the wife of Rocky's killer
2023/08/05  00:00:00,"B.C. port workers reach agreement, ending weeks of labour dispute"
2023/08/05  00:00:00,Defence chiefs turn to British firms for war machines
2023/08/05  00:00:00,People in Talavadi submit documents to get night passes
2023/08/05  00:00:00,"Tillu Tajpuriya murder: Delhi Police files chargesheet, rules out role of jail officials"
2023/08/05  00:00:00,Tim Scott says presidents can't end birthright citizenship
2023/08/05  00:00:00,"Fancy Farm Picnic 2023: Live updates, whos speaking and how to watch"
2023/08/05  00:00:00,"Environment | 

			Bay Area air-quality agency a discriminatory old boys club hostile to minorities: lawsuit"
2023/08/05  00:00:00,"As student loan payments loom, borrowers weigh deferrals, debt strikes and Deuteronomy"
2023/08/05  00:00:00,People in Talavadi submit documents to get night passes
2023/08/05  00:00:00,'Don't sit at home silently': Ex-Pakistan PM Imran Khan tells supporters after court sentences him to 3-year jail
2023/08/05  00:00:00,"Need to save true Hindutva, BJP using it to divide society, grab power: Akhilesh Yadav"
2023/08/05  00:00:00,People in Talavadi submit documents to get night passes
2023/08/05  00:00:00,Spanish chef admits to Koh Phangan killing: Police
2023/08/05  00:00:00,One Shreveport School Has New Backpack Requirement
2023/08/05  00:00:00,California Supreme Court strikes down county's drilling ban
2023/08/05  00:00:00,Four escape death in Lagos lone auto crash
2023/08/05  00:00:00,11 people injured after bus returning to YMCA summer camp crashes in Idaho
2023/08/05  00:00:00,Trash the vote: Why Arkansas rejects more of its mail-in ballots than almost any other state
2023/08/05  00:00:00,"Pakistan: Barred from politics, Imran Khan's political fate sealed legally"
2023/08/05  00:00:00,"I wish 'Shiv Shakti' helps new generation take pride in our roots, says Siddharth Tewary"
2023/08/05  00:00:00,"Rivers: Policeman shoots father of three dead, command begins probe"
2023/08/05  00:00:00,"Levison Wood: Walking With release date, destinations, animals, episode guide, interview and more"
2023/08/05  00:00:00,Storm Antoni live: Met Office issues danger to life warning and homeowners evacuated as rain and gale force winds hit UK
2023/08/05  00:00:00,"My Lake District adventure: a climb, a walk and a swim"
2023/08/05  00:00:00,California Supreme Court strikes down county's drilling ban
2023/08/05  00:00:00,So glad you could come? A portrait of three notorious party guests that Prince Andrew and Fergie would rather forget!
2023/08/05  00:00:00,"Pakistan: Barred from politics, Imran Khan's political fate sealed legally"
2023/08/05  00:00:00,33 officer arrests in 3 years: Sheriff asks 'What are we doing wrong?'
2023/08/05  00:00:00,Congress members advocate for the Palestinian village of Wadi Fuqin
2023/08/05  00:00:00,"Rivers: Policeman shoots father of three dead, command begins probe"
2023/08/05  00:00:00,'Don't sit at home silently': Ex-Pakistan PM Imran Khan tells supporters after court sentences him to 3-year jail
2023/08/05  00:00:00,Church approved at former preschool site in Chino
2023/08/05  00:00:00,Svitan: Belarusian Helicopter Pilots Deliberately Violated Polands Border
2023/08/05  00:00:00,"Local News | 

			Peace Run torch relay stops in Willoughby"
2023/08/05  00:00:00,Arab Parliament speaker hails Bahrains judicial progress
2023/08/05  00:00:00,Day In Pics: Rahul Gandhi Becomes MP Again
2023/08/05  00:00:00,Congress members advocate for the Palestinian village of Wadi Fuqin
2023/08/05  00:00:00,"Tillu Tajpuriya murder: Delhi Police files chargesheet, rules out role of jail officials"
2023/08/05  00:00:00,Saudi Arabia hosts talks on Ukraine war  without Russia
2023/08/05  00:00:00,Day In Pics: Rahul Gandhi Becomes MP Again
2023/08/05  00:00:00,Uddhav Thackeray's Shiv Sena to host Opposition bloc INDIA's 3rd meet in Mumbai
2023/08/05  00:00:00,Timeline of former prime ministers arrested in Pakistan
2023/08/05  00:00:00,"WWE Smackdown Results for August 4th, 2023"
2023/08/05  00:00:00,Man accused of bigamy denied bail
2023/08/05  00:00:00,Congress members advocate for the Palestinian village of Wadi Fuqin
2023/08/05  00:00:00,ED searches targeting Tamil Nadu Minister Senthil Balaji yield cash and documents
2023/08/05  00:00:00,Kenyas offer to send police to Haiti sparks human rights concerns
2023/08/05  00:00:00,"As the money grows, Washingtons film and TV industry is taking root"
2023/08/05  00:00:00,Does your rent keep going up? Tri-Cities workers say 40% rent surge is crushing them
2023/08/05  00:00:00,Why did Oppenheimer actor Rami Malek and Lucy Boynton spilt after 5 years together? Here's what happened
2023/08/05  00:00:00,Buhr promoted to Bank of Franklin County executive vice president
2023/08/05  00:00:00,At least three civilians killed in Russian strikes on Syria
2023/08/05  00:00:00,Trash the vote: Why Arkansas rejects more of its mail-in ballots than almost any other state
2023/08/05  00:00:00,Spanish man confesses to murder on Thai tourist island: police
2023/08/05  00:00:00,A group of Mississippi cops who pleaded guilty to torturing Black men called themselves the 'Goon Squad' because they were willing to secretly use excessive force
2023/08/05  00:00:00,Inter ready 30m offer for Arsenal's Folarin Balogun after missing out on Gianluca Scamacca
2023/08/05  00:00:00,Angus Cloud's father's cause of death is revealed as death certificate states he died of stage four lung cancer aged 65
2023/08/05  00:00:00,Metallica M72 North American Tour kicks off at MetLife Stadium. Here's the setlist
2023/08/05  00:00:00,"Shah says accept Hindi with goodwill; TN rejects hegemony, retorts Stalin"
2023/08/05  00:00:00,"Phoenix police chief talks about efforts on crime rates, guns and staffing shortages"
2023/08/05  00:00:00,Uddhavs Sena to host INDIA meeting in Mumbai; leaders to meet State government to discuss logistics and security
2023/08/05  00:00:00,"Ukraine war: Another Russian vessel hit by sea drone near Crimean Bridge, Moscow says"
2023/08/05  00:00:00,I cried with anger: the trials and torment when travelling with blindness
2023/08/05  00:00:00,Defence chiefs turn to British firms for war machines
2023/08/05  00:00:00,A group of Mississippi cops who pleaded guilty to torturing Black men called themselves the 'Goon Squad' because they were willing to secretly use excessive force
2023/08/05  00:00:00,CBSE Federalism Class 11 MCQs of NCERT Indian Constitution at Work Chapter 7
2023/08/05  00:00:00,Two sentenced to prison for assaulting Sliema jogger
2023/08/05  00:00:00,"Niger Coup Is Champions League Final Between Russia, NATO; Dont Get Involved  PDP Campaign Urges Tinubu"
2023/08/05  00:00:00,"My Lake District adventure: a climb, a walk and a swim"
2023/08/05  00:00:00,IIT Madras: Check Last 5 Years Cut-Offs For Electrical Engineering
2023/08/05  00:00:00,People in Talavadi submit documents to get night passes
2023/08/05  00:00:00,Woman left infertile by botched surgery has surrogate baby funded by NHS payout
2023/08/05  00:00:00,Special counsel alerts court to Trump's social media post
2023/08/05  00:00:00,The worlds best universities in 2024 have been unveiled. 5 of the top 10 are in Europe
2023/08/05  00:00:00,13 Students and Apprentices from County Cork Set to Compete at Worldskills Ireland 2023
2023/08/05  00:00:00,Moscow says JPMorgan stops processing Russia grain payments
2023/08/05  00:00:00,Skipper of boat in crash that killed US tourist off Italy faces manslaughter investigation
2023/08/05  00:00:00,Trash the vote: Why Arkansas rejects more of its mail-in ballots than almost any other state
2023/08/05  00:00:00,The true scale of how many military weapons are stolen on British soil
2023/08/05  00:00:00,Storm Antoni live: Met Office issues danger to life warning and homeowners evacuated as rain and gale force winds hit UK
2023/08/05  00:00:00,Families evacuated from Clontarf homes after Storm Antoni flash flooding
2023/08/05  00:00:00,The true scale of how many military weapons are stolen on British soil
2023/08/05  00:00:00,"A $2,490 wireless podcasting kit is absurd, but at least Nomono's sounds great"
2023/08/05  00:00:00,"At Gruha Jyothi launch, Karnataka Chief Minister asserts implementation of guarantees will not impact development projects"
2023/08/05  00:00:00,The true scale of how many military weapons are stolen on British soil
2023/08/05  00:00:00,Top legislator expects flourishing trade ties between Vietnam and Indonesia
2023/08/05  00:00:00,U.S. publishing executive killed in Italian boating accident
2023/08/05  00:00:00,Spanish man confesses to murder on Thai tourist island: police
2023/08/05  00:00:00,Saudi Arabias role as mediator centre stage in Ukraine talks
2023/08/05  00:00:00,"After raising $37K on GoFundMe, manager of about-to-close Pittsfield animal shelter to open new one"
2023/08/05  00:00:00,The worlds best universities in 2024 have been unveiled. 5 of the top 10 are in Europe
2023/08/05  00:00:00,The true scale of how many military weapons are stolen on British soil
2023/08/05  00:00:00,"After raising $37K on GoFundMe, manager of about-to-close Pittsfield animal shelter to open new one"
2023/08/05  00:00:00,"Niger Coup: Tinubu Seeking State Of Emergency, Suspension Of Presidential Election Tribunal  APC Chieftain Alleges"
2023/08/05  00:00:00,Defence chiefs turn to British firms for war machines
2023/08/05  00:00:00,So glad you could come? A portrait of three notorious party guests that Prince Andrew and Fergie would rather forget!
2023/08/05  00:00:00,California Supreme Court strikes down county's drilling ban
2023/08/05  00:00:00,"Kala Lumyo, the Tamilians of Moreh in Manipur facing threat amid violence in state"
2023/08/05  00:00:00,Fire devastated this NYC Chinatown bookshop  community has rushed to its aid
2023/08/05  00:00:00,Chinas Chery Omoda 5 SUV Gets 5 Star Safety Rating  ANCAP Crash Test
2023/08/05  00:00:00,Moscow says JPMorgan stops processing Russia grain payments
2023/08/05  00:00:00,PM chairs cabinet meeting for July
