date,title
2019/09/04 0:00:00,UK MPs block no-deal Brexit and PM Boris Johnson’s snap election demand
2019/09/04 0:00:00,Spanish Olympic medallist Blanca Fernandez Ochoa’s body discovered
2019/09/04 0:00:00,Statistician catches fraudster Kashaf Ali Khan’s bizarre lottery lie
2019/09/04 0:00:00,West Australian couple jailed over horrific abuse of adopted child
2019/09/04 0:00:00,New York Jets NFL practice team member Valentine Holmes’ $900k off to return to NRL
2019/09/04 0:00:00,"Inside the life of Sydney’s top PR guru and star of new reality series, Roxy Jacenko"
2019/09/04 0:00:00,Former heavyweight world champ Wladimir Klitschko terrified Borat actor Sacha Baron Cohen
2019/09/04 0:00:00,Brutal front pages slam both Boris Johnson and Jeremy Corbyn following Brexit bombshell
2019/09/04 0:00:00,The emotional segment that reduced Peter Helliar to tears on The Project
2019/09/04 0:00:00,Ashes 2019 | Mark Waugh weighs in on the state of play
2019/09/04 0:00:00,FIBA World Cup 2019 | Andrew Bogut shrugs off Chinese boos in great Boomers start
2019/09/04 0:00:00,Woman suffers spinal injuries on ride at Royal Adelaide Show
2019/09/04 0:00:00,Vaping debate: Use of e-cigarettes under investigation in US as Australia lobbies for law changes
2019/09/04 0:00:00,Cookout planned outside vegan’s house that wants neighbour’s BBQ banned
2019/09/04 0:00:00,Former Hells Angel Ben ‘Notorious’ Geppert vows to avenge younger brother’s death
2019/09/04 0:00:00,SA teacher to run Westpac City-Bay to buy new car for wheelchair-bound Tasman Footner
2019/09/04 0:00:00,Hong Kong leader Carrie Lam announces withdrawal of extradition bill that sparked months of protests
2019/09/04 0:00:00,Rain plays havoc on day one of the fourth Ashes Test
2019/09/04 0:00:00,Woman taken to hospital after being injured on ride at Royal Adelaide Show
2019/09/04 0:00:00,"AFL Teams, Week One of Finals: West Coast v Essendon"
2019/09/04 0:00:00,It Chapter Two: Solid but not particularly terrifying sequel
2019/09/04 0:00:00,Gears of War 5 preview
2019/09/04 0:00:00,HBO series Watchmen drops new trailer
2019/09/04 0:00:00,Model’s insane Burning Man outfit
2019/09/04 0:00:00,Brexit explained: How Britain went from a referendum to a possible no-deal EU exit via three prime ministers
2019/09/04 0:00:00,Vegans freak out as beloved products disappear from Woolies
2019/09/04 0:00:00,Hong Kong protests: Carrie Lam withdraws extradition bill
2019/09/04 0:00:00,The Beauty Diary by Rebekah Scanlan: How to fake a good night’s sleep
2019/09/04 0:00:00,Wallabies veteran Tatafu Polota-Nau announces Test retirement
2019/09/04 0:00:00,Growing concern for older Australians with mortgage debt obligations
2019/09/04 0:00:00,Man charged with murdering Melbourne boy
2019/09/04 0:00:00,Woman’s body discovered in garden bed at a Brisbane park
2019/09/04 0:00:00,Virgin Australia: How its global flight review will impact passengers
2019/09/04 0:00:00,Karen Millen announces closing down sale after administrators appointed
2019/09/04 0:00:00,Everything to remember before you watch the Downton Abbey movie
2019/09/04 0:00:00,Brian Meyerson designed duplex on the Vaucluse clifftops sells
2019/09/04 0:00:00,"Who is Paige Elkington, Flume’s girlfriend and the woman behind the viral Burning Man video?"
2019/09/04 0:00:00,Outrage over chocolate bar Instagram post
2019/09/04 0:00:00,AFL 2019 | Taylor Walker stands down as Adelaide Crows co-captain
2019/09/04 0:00:00,Trainer Paul Preusker won’t be tempted to alter spring course with Surprise Baby
2019/09/04 0:00:00,Listeria found in pastrami prompts a recall and a health alert
2019/09/04 0:00:00,Jockey Sam Clipperton rubbed out for one month by stewards
2019/09/04 0:00:00,AFL 2019 | Collingwood Magpies star Dayne Beams admitted to hospital
2019/09/04 0:00:00,John Doe begs Epstein judge not to name him and others linked to alleged child sex trafficking ring
2019/09/04 0:00:00,Vitalstatistix program Adhocracy celebrates 10 years with a weekend full of new creative works
2019/09/04 0:00:00,Taylor Walker gives up on-field leadership of the Crows he has held for five seasons
2019/09/04 0:00:00,Queensland mum gives birth to daughter while in a coma
2019/09/04 0:00:00,‘Dreadfully weak’: Graph that shows we’re in a world of pain
2019/09/04 0:00:00,Best beaches in Bali you have to visit
2019/09/04 0:00:00,Maroubra home sells prior to auction for above $5.25m price guide
2019/09/04 0:00:00,Family-of-five among 34 presumed dead in California boat fire
2019/09/04 0:00:00,‘A fighting edge’: ‘Deadly’ mission of new ‘bogan’ soldiers
2019/09/04 0:00:00,Wahroonga family hopes spring will bring them a new home
2019/09/04 0:00:00,NRL SuperCoach podcast: Pre-Lockout Round 25
2019/09/04 0:00:00,The Block 2019: Do contestants get bargain tradies?
2019/09/04 0:00:00,Collingwood star Dayne Beams admitted to hospital
2019/09/04 0:00:00,Adelaide Hills and Semaphore blackspot roads win funding boost
2019/09/04 0:00:00,Attorney-General appeals against brave cop’s attacker
2019/09/04 0:00:00,Parramatta property occupied by fried chicken restaurant Butter up for auction
2019/09/04 0:00:00,Raceday focus: Best bets and inside mail for Newcastle (Beaumont) and Ballina
2019/09/04 0:00:00,Rugby World Cup 2019 Countdown: Spotlight on Russia
2019/09/04 0:00:00,Treasurer faces toughest task yet
2019/09/04 0:00:00,"It: Chapter Two is big, dumb, Freudian fun"
2019/09/04 0:00:00,‘Nuisance’ pets in South Australia council’s firing line
2019/09/04 0:00:00,Big W launches 80 per cent off sale featuring big brands
2019/09/04 0:00:00,New car sales fall off a cliff
2019/09/04 0:00:00,"Horror bus crash near Rotorua: Six feared dead, some survivors emerge"
2019/09/04 0:00:00,Back wheels of Sydney bus stuck in sinkhole after water main burst
2019/09/04 0:00:00,Toyota to sell ‘Fast and Furious’ Supras
2019/09/04 0:00:00,Susan Rothwell-designed Rose Bay beachfront of the late Susan Feller sells for about its $20m guide
2019/09/04 0:00:00,Lily Allen spotted on date with Stranger Things actor David Harbour
2019/09/04 0:00:00,One of the stars of The Hills has claimed Miley Cyrus and Kaitlynn Carter had ‘a thing’ last year
2019/09/04 0:00:00,AFL finals teams: Heartbreak for Collingwood trio as guns named
2019/09/04 0:00:00,Youths get stuck inside garbage truck
2019/09/04 0:00:00,Australian Survivor host Jonathan LaPaglia hits out over challenge controversy
2019/09/04 0:00:00,Roger Federer v Grigor Dimitrov: Swiss maestro knocked out of US Open
2019/09/04 0:00:00,My Lounge: Inside Brisbane Airport’s newest passenger offering
2019/09/04 0:00:00,Cairns Woolworths store fined over Food Act breaches
2019/09/04 0:00:00,Tim Paine explains why Marcus Harris was preferred to Usman Khawaja
2019/09/04 0:00:00,‘Oh god’: Bride’s mid-ceremony toilet confession caught on camera
2019/09/04 0:00:00,Rod Laver says suspension might be only answer to keep Nick Kyrgios in line
2019/09/04 0:00:00,Grigor Dimitrov stuns Roger Federer in US Open upset for the ages
2019/09/04 0:00:00,Ben Fordham is the man who could save the endangered Today show from destruction
2019/09/04 0:00:00,AFP officers raid home of former government adviser in Canberra
2019/09/04 0:00:00,Katelyn Ohashi’s gravity-defying ESPN Magazine Body Issue shoot
2019/09/04 0:00:00,Houses of the Holy: Australian churches turned into incredible homes
2019/09/04 0:00:00,Beachfront Gerroa home that is neighbours with Guy Sebastian and Sally Fitzgibbons is for sale
2019/09/04 0:00:00,Meghan Markle fan finds $100 dupe of $2000 designer dress
2019/09/04 0:00:00,Teenager pleads guilty to carrying explosive device onto Adelaide bus
2019/09/04 0:00:00,AFL Finals 2019: Complete guide to the opening week
2019/09/04 0:00:00,Why ‘old mate’ is really crying in new SA Tourism ad
2019/09/04 0:00:00,Rural towns 150km from Melbourne mired in accidental overdose deaths
2019/09/04 0:00:00,This is how Prince Harry wants to change the travel industry
2019/09/04 0:00:00,Bindi Irwin pays tribute to her late dad Steve on anniversary of his death
2019/09/04 0:00:00,Liz Cambage features in ESPN’s Body Issue
2019/09/04 0:00:00,Kim Kardashian West says she leaked her own secret in latest KUWTK preview
2019/09/04 0:00:00,‘Apocalyptic’ devastation caused in nation destroyed by Hurricane Dorian
2019/09/04 0:00:00,Jennifer Lopez shows off fit body during St Tropez photo shoot
2019/09/04 0:00:00,"Teenage boy admits to killing entire family including dad, stepmum and siblings"
2019/09/04 0:00:00,Woman has insides ‘ripped apart’ by water slide
2019/09/04 0:00:00,Banker Paul Rizzo’s Darling Point terrace sells $210k over reserve after quick auction campaign
2019/09/04 0:00:00,Heartbroken dad of kids killed by mum to make time for sex work buries them in carriage funeral
2019/09/04 0:00:00,Extreme ‘underboob’ bras and singlets the latest fashion trend
2019/09/04 0:00:00,Rafael Nadal’s OCD remains undefeated
2019/09/04 0:00:00,Victorian weather: Melbourne temperatures to tumble today
2019/09/04 0:00:00,"US food delivery giant DoorDash launches in Australia to take on Menulog, UberEats and Deliveroo"
2019/09/04 0:00:00,Before and after: Transformation of Wyongah lake house for sale
2019/09/04 0:00:00,Survivor contestant Simon Black explains bizarre behaviour during his final episode
2019/09/04 0:00:00,Bride-to-be scammed groom and mates after ‘mistakenly’ believing he cheated
2019/09/04 0:00:00,Commanding Toorak fortress for sale
2019/09/04 0:00:00,Controversial change to this year’s Macca’s Monopoly board
2019/09/04 0:00:00,British man caught allegedly trying to flee fatal hit and run to face court
2019/09/04 0:00:00,Serena Williams hits top form in 44-minute demolition of Wang Qiang
2019/09/04 0:00:00,California boat victims slept in tightly packed bunk beds as fire ripped through
2019/09/04 0:00:00,Third-biggest Powerball jackpot of 2019 - results
2019/09/04 0:00:00,"The Chase: Samantha Armytage spat the dummy on the game show, Lawrence Mooney claims"
2019/09/04 0:00:00,Free Bondi burgers from September 4 to ‘Fight Against Bland’ lunches
2019/09/04 0:00:00,Federal court decision on Tamil family facing deportation adjourned until Friday
2019/09/04 0:00:00,Chinese student found ‘safe and well’ after alleged kidnapping and $1.27 million ‘bitcoin ransom’
2019/09/04 0:00:00,Ibrahim lover on gun charge blames John
2019/09/04 0:00:00,Sydney woman’s ‘loophole for unemployment’ goes viral
2019/09/04 0:00:00,Prince Andrew’s engagements cancelled by hosts amid Epstein backlash
2019/09/04 0:00:00,Ashley Coulston brought ‘kill kit’ to fatal flatmate interview
2019/09/04 0:00:00,"Liveability index: Melbourne second to Vienna, Sydney third"
2019/09/04 0:00:00,BP ditches Virgin partnership in favour of new points deal with Qantas
2019/09/04 0:00:00,India bowler Mohammed Shami ordered to appear before court over domestic violence case
2019/09/04 0:00:00,Australian man presumed dead after joining IS shows up alive in a Syrian prison
2019/09/04 0:00:00,Renée Zellweger on ‘international humiliation’ of infamous 2014 red carpet appearance
2019/09/04 0:00:00,Giannis Antetokounmpo has no answer for Brazil as Greece suffers shock defeat
2019/09/04 0:00:00,Driver charged with murder after mowing down cyclist who slashed girlfriend
2019/09/04 0:00:00,Collingwood: From The Inside Out documentary captures moment Nathan Buckley cut Jarryd Blair
2019/09/04 0:00:00,Climate crisis: Oceans and polar zones set to unleash hell
2019/09/04 0:00:00,Terminator star Linda Hamilton says she’s been celibate for 15 years
2019/09/04 0:00:00,Britney’s ex Kevin Federline awarded primary custody of kids
2019/09/04 0:00:00,Western Australia a step closer to legalising voluntary euthanasia
2019/09/04 0:00:00,Australia’s economic growth slowest since GFC at 1.4 per cent
2019/09/04 0:00:00,Boris Johnson’s special adviser Dominic Cummings is feared and revered inside Downing Street
2019/09/04 0:00:00,New Hyundai Venue SUV to spark price war
2019/09/04 0:00:00,James Hird becomes football deal wizard in stunning career change
2019/09/04 0:00:00,Michael Owen sparks huge Twitter row with Alan Shearer claiming magpies legend tried to quit Newcastle for Liverpool
2019/09/04 0:00:00,Two Australian Survivor contestants sent packing
2019/09/04 0:00:00,"England axe Chris Woakes for fourth Ashes Test, Craig Overton called in"
2019/09/04 0:00:00,How cheating can make your relationship stronger
2019/09/04 0:00:00,Daniil Medvedev sticks it New York crowd and Stan Wawrinka
2019/09/04 0:00:00,Little girl who vanished on train 20 years ago has finally been found
2019/09/04 0:00:00,"Today in history, September 4: Steve Irwin dies"
2019/09/04 0:00:00,Mystery after Devora Howard found dead near Terrigal boat ramp on the NSW Central Coast
2019/09/04 0:00:00,Walmart will end all handgun ammunition sales after recent spate of mass shootings in US
2019/09/04 0:00:00,Sacked Podcast: Tony Shaw on why he dragged Nathan Buckley early in his captaincy
2019/09/04 0:00:00,Massive American man breaks bench press world record
2019/09/04 0:00:00,"Woman with mysterious, serious injuries found in Athol Park"
2019/09/04 0:00:00,Kristen Stewart: I was told not to hold my girlfriend’s hand in public
2019/09/04 0:00:00,Louisville cheerleader: Quarterback broke my nose with errant pass
2019/09/04 0:00:00,RUSH HOUR: Endangered whale shark spotted in QLD river
2019/09/04 0:00:00,Former American Idol contestant Haley Smith dies in motorcycle crash
2019/09/04 0:00:00,World’s fastest man escapes two-year doping ban on incredible technicality
2019/09/04 0:00:00,Experts rate Brisbane best capital city to invest $500k in property
2019/09/04 0:00:00,NRL star Jorge Taufua catches America’s eye after ferocious hit
2019/09/04 0:00:00,"Australia, England prepare for crucial fourth Ashes Test in Manchester"
2019/09/04 0:00:00,"Cindy Crawford’s daughter, Kaia Gerber, is the latest cover star of British Vogue"
2019/09/04 0:00:00,Hurricane Dorian a ‘tragedy’ for Bahamas
2019/09/04 0:00:00,Former high school cheerleader accused of murdering child over ‘appearances’
2019/09/04 0:00:00,"Trump reignites fiery feud with Khan, telling London Mayor to ‘stay out of our business!’"
2019/09/04 0:00:00,FIBA World Cup 2019 | Team USA dodges major upset against Turkey in a miracle finish
2019/09/04 0:00:00,Donald Trump warns China on delaying trade talks
2019/09/04 0:00:00,A retro time capsule in St Morris proves popular with buyers
2019/09/04 0:00:00,Boost Juice founder Janine Allis reveals Aussie man’s engagement ring blunder
2019/09/04 0:00:00,An 18-year-old has gone blind after a lifetime of eating junk
2019/09/04 0:00:00,Labor heads to Biloela for Tamil family’s deportation decision
2019/09/04 0:00:00,Geelong West warehouse near Pako smashes reserve by $1M
2019/09/04 0:00:00,See Geelong from above as Miramar apartment tower reaches full height as city’s tallest building
2019/09/04 0:00:00,"Sydney property ‘red hot’, says auctioneer Damien Cooley"
2019/09/04 0:00:00,Freelancer Ruth Ritchie revealed as buyer who paid more than $2m over reserve for Palm Beach home
2019/09/04 0:00:00,Luxury off-the-plan apartments set to take off this spring in rising Sydney property market
