date,title
2019/07/23 0:00:00,Will and Kate’s head of PR will take over as CEO of The Royal Foundation started by William and Harry
2019/07/23 0:00:00,What you need to know about Boris Johnson
2019/07/23 0:00:00,Sydney teacher accused of having sex with female student multiple times
2019/07/23 0:00:00,King William St tram line to reopen after three weeks of upgrade works
2019/07/23 0:00:00,George Calombaris slammed on Twitter after shock exit from MasterChef
2019/07/23 0:00:00,Amanda Keller’s big problem with Tom Gleeson’s Logies speech
2019/07/23 0:00:00,Who is Boris Johnson? Everything you need to know about the new British Prime Minister
2019/07/23 0:00:00,Woman spared jail over hot tub sex assaults at party
2019/07/23 0:00:00,Ninja Warrior star Olivia Vivian’s history-making win
2019/07/23 0:00:00,‘It’s a disgrace’: Manly legend Max Krilich’s vicious verbal attack on Cameron Smith
2019/07/23 0:00:00,"Daughter, 20, found stabbed to death beside dad in family Mercedes"
2019/07/23 0:00:00,"Property market: Sydney, Melbourne house prices tipped to rebound"
2019/07/23 0:00:00,Bizarre twist in mafia boss murder as right-wing conspiracy theory emerges as motive for assassination
2019/07/23 0:00:00,UFC 243: Robert Whittaker to fight Israel Adesanya at Melbourne’s Marvel Stadium
2019/07/23 0:00:00,Croydon period home brought back to life with modern elements
2019/07/23 0:00:00,Harris Andrews ruins his own chances at AFL Tribunal
2019/07/23 0:00:00,Australia alarmed over reports China will set up a military base in Cambodia
2019/07/23 0:00:00,MasterChef finale attracts lowest-ever audience
2019/07/23 0:00:00,Adelaide power outages: Power restored to thousands of properties which were without power
2019/07/23 0:00:00,North Sydney Council’s smoking ban blasted by Steve Price
2019/07/23 0:00:00,Can MasterChef Australia survive the exit of all three star judges?
2019/07/23 0:00:00,Acclaimed choreographer Leigh Warren hands over control of rebranded SA dance hub
2019/07/23 0:00:00,Laura Dundovic has been teasing fans with enviable snaps from her European getaway
2019/07/23 0:00:00,City of Sydney council’s X-rated mistake
2019/07/23 0:00:00,"Sydney ranked 11th among world’s most expensive cities, Melbourne at 29"
2019/07/23 0:00:00,"Ben Affleck, Matt Damon: Twitter backlash over stars’ new film"
2019/07/23 0:00:00,England quick Jofra Archer parties rather than rehabbing side strain
2019/07/23 0:00:00,Ricky Martin’s got a loud voice in his new role: Today’s news in pictures
2019/07/23 0:00:00,"Accessing your super savings early is possible, but there are pitfalls"
2019/07/23 0:00:00,"What’s on TV this week: Another Life, The Boys, Orange is the New Black and more"
2019/07/23 0:00:00,SuperFooty Podcast: Alex Rance’s return from knee surgery on agenda
2019/07/23 0:00:00,Tony McEvoy’s nine entries headline big opening for new Murray Bridge racetrack
2019/07/23 0:00:00,Amber Holt avoids jail after attempted egg attack on Scot Morrison
2019/07/23 0:00:00,NFL news: Valentine Holmes’ New York Jets teammate Le’Veon Bell’s airport rant
2019/07/23 0:00:00,Health Minister Greg Hunt slams pill testing as ‘foolish’ and ‘dangerous’
2019/07/23 0:00:00,What income you need to earn to buy a house or unit in Sydney suburbs
2019/07/23 0:00:00,"1950s fixer-upper sold for $120,000+ over starting price"
2019/07/23 0:00:00,"NRL teams Round 19: Sharks shake-up, Gareth Widdop returns"
2019/07/23 0:00:00,Labor relentlessly targets Angus Taylor in extraordinary Question Time grilling
2019/07/23 0:00:00,Will Genia reveals how much James O’Connor has changed
2019/07/23 0:00:00,Mystery ‘pristine’ 500 year old ship found on seabed
2019/07/23 0:00:00,All three MasterChef judges are leaving the show amid pay dispute
2019/07/23 0:00:00,Austic appeal
2019/07/23 0:00:00,Family’s property collection in Hawthorn East a ‘unique’ opportunity
2019/07/23 0:00:00,‘Four bullets left’ to save economy
2019/07/23 0:00:00,Sydney DJ dies from ‘silent killer’ while performing at a club
2019/07/23 0:00:00,Meghan Markle’s laughing all the way to the bank
2019/07/23 0:00:00,Adelaide Turf Cricket Association rejects Cricket Australia’s new junior rules
2019/07/23 0:00:00,South Korea fires at Russian jet in its airspace
2019/07/23 0:00:00,Top Gun sequel trailer: Fans spot new detail in Tom Cruise’s jacket
2019/07/23 0:00:00,Near neighbours are in a fight for survival on a Fijian beach
2019/07/23 0:00:00,Absolute bargain nature reserve listed in Spencer on the Central Coast
2019/07/23 0:00:00,Travel Deal Tuesday: Three stellar overseas deals under $1200
2019/07/23 0:00:00,SuperCoach AFL Unique of the Week for Round 18
2019/07/23 0:00:00,Agricultural land values outperform most asset classes — Rabobank
2019/07/23 0:00:00,Southern Highlands hobby farm owned by green finance advocate Mark Burrows sells for $14.5m
2019/07/23 0:00:00,"Anthony Albanese avoids commenting on Mack Horton, saying ‘sport and politics shouldn’t mix’"
2019/07/23 0:00:00,‘We are damning ourselves’: Big problem with the way Australia treats its elderly population
2019/07/23 0:00:00,Former Kensington milk bar serving the goods
2019/07/23 0:00:00,‘The Art of Banksy’ exhibition to arrive in Sydney this September
2019/07/23 0:00:00,Ex-vegetarian mum feeds family with whatever animals she shoots dead that day
2019/07/23 0:00:00,David Glasheen moved to Restoration Island after losing $37m fortune
2019/07/23 0:00:00,Playboy model reveals her ‘living hell’ as a vodka addict
2019/07/23 0:00:00,The tech tools managers need to master
2019/07/23 0:00:00,Tattooed man on loose near  Canada murder highway
2019/07/23 0:00:00,Food recall: NSW Food Authority issues recall for Bulla ice cream
2019/07/23 0:00:00,‘Not ready’
2019/07/23 0:00:00,"How the mighty mullet is making a comeback in SA: Teenagers, young men embrace 80s style"
2019/07/23 0:00:00,The boss of health insurer NIB has a radical idea to battle rising costs: Get rid of Medicare
2019/07/23 0:00:00,New HSV SportsCat to rival top-shelf Toyota HiLux
2019/07/23 0:00:00,‘Power grab’: Taxpayer group slams push to further empower the ATO
2019/07/23 0:00:00,Manchester United slip from second to sixth in Forbes’ 50 most valuable teams
2019/07/23 0:00:00,‘It’s not like they’ve had to go to uni’: The words that continue to haunt George Calombaris
2019/07/23 0:00:00,Coles Little Shop 2: Woman throws tantrum demanding more toys
2019/07/23 0:00:00,Freak chairlift accident at Thredbo as skier plunges to the ground
2019/07/23 0:00:00,Text message man sent his ex-girlfriend a day before his wedding goes viral
2019/07/23 0:00:00,Sale of big St Albans Park home with garage to match sets street record
2019/07/23 0:00:00,"Flash floods across Manhattan, Queens, Brooklyn in New York"
2019/07/23 0:00:00,Australia’s favourite cake is not actually a cake at all
2019/07/23 0:00:00,‘I have pink eye’: YouTuber Logan Paul’s bizarre TV interview
2019/07/23 0:00:00,Community divided after resident receives ‘rude’ letter complaining about laundry
2019/07/23 0:00:00,Backlash over Instagram influencer’s tear-filled break down
2019/07/23 0:00:00,Bizarre ‘bird of prey’ airliner concept design revealed
2019/07/23 0:00:00,"Adelaide weather: Cold front sweeping metro area, Mount Lofty, South East SA"
2019/07/23 0:00:00,Incredible story behind W-League star Carson Pickett’s ‘photo of the year’
2019/07/23 0:00:00,‘There were no talking points’: Photo of Donald Trump’s notes reveals truth about his ‘squad’ claim
2019/07/23 0:00:00,Western Sydney man charged with abusing baby girl and assaulting woman
2019/07/23 0:00:00,Mack Horton and Sun Yang were back in the pool on day three
2019/07/23 0:00:00,Digital detox helping to forge better leaders
2019/07/23 0:00:00,Bushfire warning as winter temperatures on east coast near record highs
2019/07/23 0:00:00,Millennial backpackers fined $1515 and kicked out of Venice for making coffee by Rialto Bridge
2019/07/23 0:00:00,Rucci’s Roast: Three themes AFL football boss Steve Hocking should not ignore
2019/07/23 0:00:00,The surprising group investing in property as poor housing affordability hits home ownership rates
2019/07/23 0:00:00,Friends star Courteney Cox’s ‘epic’ post: ‘This is the best video of all time’
2019/07/23 0:00:00,Full cast of Australian Survivor revealed: Watch the epic opening segment
2019/07/23 0:00:00,‘She doesn’t actually see her wardrobe’: Secrets behind what the Queen wears
2019/07/23 0:00:00,Pay to play: game-changing tech coming to new cars
2019/07/23 0:00:00,Union boss details grim conditions that led to brutal prison riot
2019/07/23 0:00:00,Police reveal person of interest in murders of Lucas Fowler and Chynna Deese
2019/07/23 0:00:00,Blog with Kenty: Ben Hunt must repay Dragons coach Paul McGregor
2019/07/23 0:00:00,The Paddington house that legendary architect Ken Woolley built for himself hits the market
2019/07/23 0:00:00,Melbourne teen believes she was conned by serial fraudster Samantha Azzopardi
2019/07/23 0:00:00,"Coles launches budget homewares range, with pieces starting from $2"
2019/07/23 0:00:00,Woman shares man’s ‘creepy’ rape rant
2019/07/23 0:00:00,Chaos erupts as female judge hauled from court to begin prison sentence
2019/07/23 0:00:00,Inside OPPO 5G Hotel: Australia’s ‘smartest hotel’ is a game changer
2019/07/23 0:00:00,Interior designer Nicole Chapman shares her Home Truths
2019/07/23 0:00:00,Former Malaysian king makes shock claims about his newborn son with beauty queen wife amid divorce
2019/07/23 0:00:00,Fitness guru Emily Skye’s ‘crazy’ changes to her body after Thai takeaway
2019/07/23 0:00:00,China media swipes back at Aussie star over swimming protest storm
2019/07/23 0:00:00,"ARL Commissioner Mark Coyne’s fate hangs in the balance, Phil Gould blasts media coverage"
2019/07/23 0:00:00,"Girl, 8, crushed to death in China after inflatable water slide collapses at holiday resort"
2019/07/23 0:00:00,Fast & Furious 9 stuntman seriously injured in fall during filming
2019/07/23 0:00:00,Lenny Kravitz says ex-wife’s husband Jason Momoa is ‘like a brother’
2019/07/23 0:00:00,Aussie warns of how tourists risk their lives on holiday ‘every day’
2019/07/23 0:00:00,Salim Mehajer’s $300k Ferrari left in pieces
2019/07/23 0:00:00,Rugby Championship: NZ-Boks clash ‘no’ World Cup pointer says All Blacks coach Steve Hansen
2019/07/23 0:00:00,Australia’s worst female serial killer’s guilt ‘reinforced’
2019/07/23 0:00:00,Rugby World Cup: England coach Eddie Jones leaves Danny Cipriani out of training camp
2019/07/23 0:00:00,Aussie Emma McKeon in emotional public display for rival
2019/07/23 0:00:00,‘Lakers got played’: Fresh twist in NBA superstar Kawhi Leonard’s $400m powerplay
2019/07/23 0:00:00,Riverdale stars Cole Sprouse and Lili Reinhart break up
2019/07/23 0:00:00,Teen girl stabbed by father subject to apprehended domestic violence order to protect parents
2019/07/23 0:00:00,Truck driver dad sacked ‘for calling in sick after he was awake all night caring for his ill triplets’
2019/07/23 0:00:00,AFL Briefs: Legend swipes Stephenson; Lyon rips into Demons
2019/07/23 0:00:00,Stunning 18th century fairytale castle with towers and a helipad on the market for $2.2 million
2019/07/23 0:00:00,Man and woman arrested after double stabbing at Holden Hill
2019/07/23 0:00:00,Remains of supermarket employee missing for 10 years found behind cooler
2019/07/23 0:00:00,Mount Rowan tragedy: Freeway closed after fatal car crash
2019/07/23 0:00:00,Fat-shaming plates yanked from Macy’s after online backlash
2019/07/23 0:00:00,Chloe Weigand’s parents speak out following their daughter’s tragic death after falling on cruise ship
2019/07/23 0:00:00,Novak Djokovic marriage under pressure following Wimbledon no-show
2019/07/23 0:00:00,"Man in critical condition after crash at Kudla, just south of Gawler"
2019/07/23 0:00:00,Actress Bella Thorne comes out: ‘I’m actually a pansexual’
2019/07/23 0:00:00,Teenager’s ‘extravagant’ $40k Swan Lake themed birthday party
2019/07/23 0:00:00,Hong Kong tensions take dark turn as protests hit seventh week
2019/07/23 0:00:00,Hennessey Goliath 6x6 monster truck revealed
2019/07/23 0:00:00,Boys aged 13 and 14 revealed as climbers of  99m AWA tower
2019/07/23 0:00:00,Seth Rogen rips Game of Thrones at Comic-Con
2019/07/23 0:00:00,Noeline Taurua resurrects New Zealand to claim Netball World Cup glory
2019/07/23 0:00:00,Tomb Raider star stabbed at fan event
2019/07/23 0:00:00,Iranian state media releases pictures of inside captured oil tanker
2019/07/23 0:00:00,Donald Trump refutes Iran’s claims of US espionage calling them “totally false”
2019/07/23 0:00:00,The Tour de France workers who convert graffiti penises into artwork
2019/07/23 0:00:00,Soccer superstar Cristiano Ronaldo will not face criminal charges for 2009 rape
2019/07/23 0:00:00,Brisbane’s next boom suburbs: Where house prices are set to grow up to 25pc in 3 yrs
2019/07/23 0:00:00,The Duke and Duchess of Sussex make privacy a key factor at Frogmore Cottage
2019/07/23 0:00:00,Daniel Ricciardo vows to defend himself over claims made by ex-adviser
2019/07/23 0:00:00,19 people have died after drinking alcohol tainted with methanol in Costa Rica
2019/07/23 0:00:00,Australia’s ultimate one-bedroom home will have you go country
2019/07/23 0:00:00,Boys aged 13 and 14 who climbed 99m AWA tower given caution
2019/07/23 0:00:00,Prime Minister Scott Morrison has been invited to a White House state dinner by president Trump
2019/07/23 0:00:00,Aussie Clyde Lewis outshines China’s Sun Yang at World Championships ahead of 200m final
2019/07/23 0:00:00,A Birkenhead converted naval base for those that march to their own beat
2019/07/23 0:00:00,Beloved dies after freak wave breaks his neck
2019/07/23 0:00:00,Largest data breach settlement ever to cost Equifax nearly $1 billion
2019/07/23 0:00:00,Donald Trump refutes Iran’s claims of US espionage calling them ‘totally false’
2019/07/23 0:00:00,Waleed Aly opens up on Richmond Tigers fandom and a freak AFL coincidence
2019/07/23 0:00:00,First-home buyers grant eligibility boosted appeal of near new Lara home
2019/07/23 0:00:00,Executive family home on a 2800sqm-plus block
2019/07/23 0:00:00,Tight Traveller: 5 incredible trips you can take with 8000 Qantas points
2019/07/23 0:00:00,Former NRL star Ben Barba sells Caringbah South home
