date,title
2019/07/04 0:00:00,"A boat of Libyan migrants has capsized off the coast of Tunisia, killing at least 80"
2019/07/04 0:00:00,NRL 2019 | Melbourne Storm defeat St George Illawarra Dragons 16-14 in controversial scenes
2019/07/04 0:00:00,Mercedes-AMG unveils 2020 A45 S hot hatch
2019/07/04 0:00:00,NRL 2019 | Gorden Tallis breaks down in emotional tribute to Kevin Walters ahead of sons NRL debut
2019/07/04 0:00:00,Flu death
2019/07/04 0:00:00,Renewed calls for pedestrians to be fined $200 for looking at their phones
2019/07/04 0:00:00,SA Health warn of measles risk after infected woman spent four days in Adelaide CBD
2019/07/04 0:00:00,Hobart rents are higher than four cities and just $1 behind Melbourne
2019/07/04 0:00:00,Sophie Turner’s breathtaking wedding dress revealed
2019/07/04 0:00:00,Top jockey steps up to challenge in Australian Ninja Warrior
2019/07/04 0:00:00,NSW building standards face inquiry after high-profile disasters
2019/07/04 0:00:00,Jockeys Craig Williams and Damien Oliver to take Flemington Finals Day duel to a whole new level
2019/07/04 0:00:00,State of Origin Game III | James Maloney backs Mitchell Pearce’s path to redemption
2019/07/04 0:00:00,Underutilised
2019/07/04 0:00:00,Glen Boss and Tony Sears rekindling old magic
2019/07/04 0:00:00,Man dies during Annabelle Comes Home movie
2019/07/04 0:00:00,New Australian homes will have to shrink to squeeze in millions of new residents
2019/07/04 0:00:00,Chelsea appoint Frank Lampard as new manager on three-year deal
2019/07/04 0:00:00,Gianluigi Buffon returns to Juventus after season at PSG
2019/07/04 0:00:00,‘Get over it’: Bob Carr’s advice to prospective homeowners concerned about Chinese buyers
2019/07/04 0:00:00,Travelling trainer Lindsey Smith upbeat his Reykjavik will be right at home in Winter Championship
2019/07/04 0:00:00,Deer rescued from water by lifeguards at Wollongong beach
2019/07/04 0:00:00,AFL 2019 | Collingwood Magpies coach Nathan Buckley praises Dayne Beams’ honesty
2019/07/04 0:00:00,Who will be Archie’s godparents?
2019/07/04 0:00:00,William Pike earns title as leading rider as James McDonald enjoys winter break
2019/07/04 0:00:00,SJ Establishment salon has SA’s first PIIQ smart-mirror to chose the perfect hairstyle
2019/07/04 0:00:00,MAFS star Jessika Power confirms she’s dating season 4’s Nick Furphy
2019/07/04 0:00:00,Secret chamber found inside King Tut’s famous tomb may solve hunt for Nefertiti
2019/07/04 0:00:00,Iran has announced it will increase its uranium enrichment beyond nuclear deal limits
2019/07/04 0:00:00,Alek Sigley now ‘safe and well’ after being detained in North Korea
2019/07/04 0:00:00,"Brenton Skanes charged over $300,000 LSD seizure in Adelaide, largest on record in SA"
2019/07/04 0:00:00,Marvel star reveals what it’s like playing video game character
2019/07/04 0:00:00,African parasite infection led to empire worth millions
2019/07/04 0:00:00,Historic Millers Point home part of Wentworth Terrace group up for sale
2019/07/04 0:00:00,"What’s the best pet insurance policy on the market? There isn’t one, according to Choice"
2019/07/04 0:00:00,The shocking photos of syphilis victims before penicillin
2019/07/04 0:00:00,Why young families are charging up the hill to Wandana Heights
2019/07/04 0:00:00,Jesinta Franklin: ‘I put all my savings into it’
2019/07/04 0:00:00,"Rail commuters facing 90-minute delays on Gold Coast, Beenleigh lines"
2019/07/04 0:00:00,Footy media personality explains decision to axe Scott Cummins after Dane Swan podcast
2019/07/04 0:00:00,How time away helped Hugh Bowman understand the impact of Winx’s stellar career
2019/07/04 0:00:00,Cute home with distinctive design hits the market in Arcadia
2019/07/04 0:00:00,Joe Hildebrand: I’ve been up to my ankles in raw sewage. How was your week?’
2019/07/04 0:00:00,‘Never seen again’: Dubai princess a ‘prisoner’ 20 years after failed attempt to flee
2019/07/04 0:00:00,Get tropical at Barwon Heads beauty with ‘relaxing ambience’
2019/07/04 0:00:00,Futurist reveals the next big shopping and payment trends
2019/07/04 0:00:00,Wayne Schwass won an AFL Grand Final but wanted to die
2019/07/04 0:00:00,Raceday focus: Best bets and inside mail for Nowra and Tamworth
2019/07/04 0:00:00,Philadelphia 76ers look to add crucial pieces after turbulent day
2019/07/04 0:00:00,Stranger Things 3: More schlocky than scary
2019/07/04 0:00:00,The ugly truth behind Taylor Swift’s long list of feuds
2019/07/04 0:00:00,Star Wars: Daisy Ridley says there will be a big reveal about Rey’s parents
2019/07/04 0:00:00,Ladbrokes Late Mail: Don’t panic Magpies punters. This week’s tips and best bets
2019/07/04 0:00:00,"Kim Kardashian awarded $A3.8m in damages after suing fashion chain, Missguided"
2019/07/04 0:00:00,Scam alert
2019/07/04 0:00:00,The worrying trend that's sweeping through the halls of power in Canberra
2019/07/04 0:00:00,‘We are terrorists’: Self-declared IS commander arrested in counter-terrorism raids
2019/07/04 0:00:00,Architect-designed house in leafy spot to sell for first time
2019/07/04 0:00:00,Vintage treasure in the heart of Mosman selling after more than 50 years
2019/07/04 0:00:00,Mark Newnham hoping stable’s luck changes heading into spring
2019/07/04 0:00:00,Chaos at ‘Mountain of Hell’ race as cyclists caught in mass glacier pile up
2019/07/04 0:00:00,Big name stars overlooked for Wallabies Rugby Championship squad
2019/07/04 0:00:00,Family claims Jetstar kicked them off a Gold Coast-bound flight
2019/07/04 0:00:00,Man rescued from roof of burning building suffering stab wounds
2019/07/04 0:00:00,Low stock levels start to bite on upper north shore as buyers move
2019/07/04 0:00:00,Dream home: Is this the most stunning Queensland property to hit the market in 2019?
2019/07/04 0:00:00,Mountain of Hell: Huge crash leaves mountain littered with cyclists
2019/07/04 0:00:00,"Spider-Man: Far From Home is a soaring, thrilling adventure"
2019/07/04 0:00:00,‘Perhaps … I’m beneath him’: Martha from MAFS blasts Sunrise co-host David Koch over elbow-gate scandal
2019/07/04 0:00:00,Melissa Hoyer: ‘I bought a fake pair of Crocs and I love them’
2019/07/04 0:00:00,Beaumaris residents fight to save brick art studio facing demolition
2019/07/04 0:00:00,Corruption case driving instructor Masoud Rad to finally stand trial
2019/07/04 0:00:00,Webjet drops crazy flight sale with fares starting from just $25
2019/07/04 0:00:00,John Jarratt claims rape accuser seduced me into sex
2019/07/04 0:00:00,Fire destroys barrels of Jim Beam bourbon
2019/07/04 0:00:00,Kawhi Leonard sighting has Toronto freaking out; Jalen says he’s staying
2019/07/04 0:00:00,Man in court over deadly Riverland head-on crash
2019/07/04 0:00:00,"Relationship Rehab: ‘Help, my wife never wants to have sex’"
2019/07/04 0:00:00,How Meghan Markle won over the Queen
2019/07/04 0:00:00,Curtis Flowers beats murder charges for sixth time but is still not free
2019/07/04 0:00:00,Comment: Wimbledon fans hitting snooze button every second day
2019/07/04 0:00:00,Housing slump bleeds $10.6 billion from NSW government revenue
2019/07/04 0:00:00,‘Truly disturbing’: Beijing slammed for conducting ballistic missile test in South China Sea
2019/07/04 0:00:00,Bombshell report claims Daniel Ricciardo on Ferrari wish list
2019/07/04 0:00:00,What could $3 million buy you in Canberra?
2019/07/04 0:00:00,"Viral job ad hits back at phone addicts, partygoers and ‘psycho boyfriends’"
2019/07/04 0:00:00,Harley Bennell set to be delisted by Fremantle as Ross Lyon urges another club to give him a chance
2019/07/04 0:00:00,Snorkelling tragedy: Respected Kiwi firefighter dies at Great Barrier Reef
2019/07/04 0:00:00,A mother-of-two has been slammed for breastfeeding four-year-old son
2019/07/04 0:00:00,The Beauty Diary by Rebekah Scanlan: Stunning palette’s with bargain price tags
2019/07/04 0:00:00,Rumours swirl over new Woolworths Lion King promotion
2019/07/04 0:00:00,Sharapova’s fury after seeing opponent dance on her Wimbledon grave
2019/07/04 0:00:00,‘A flying death sentence’: China’s terrifying new weapon revealed
2019/07/04 0:00:00,Sydney tenants head to Infinity by Crown at Green Square as owners of older beachside flats struggle
2019/07/04 0:00:00,How Harvey Weinstein outwitted his accusers
2019/07/04 0:00:00,"Facebook, Instagram problems hit users across the world"
2019/07/04 0:00:00,NFL cult hero Jared Lorenzen dead at age 38
2019/07/04 0:00:00,Aberfeldie dream home: record or bust for beauty with 10-car garage
2019/07/04 0:00:00,Webjet drop crazy flight sale with fares starting from just $25
2019/07/04 0:00:00,Wild World Cup streak comes to excruciating end
2019/07/04 0:00:00,Donald Trump issues bizarre quiz to his supporters
2019/07/04 0:00:00,Margot Robbie is absolutely ruling Paris couture fashion week front row at Chanel
2019/07/04 0:00:00,Studs Up: Aussie football owes it to next generation to learn from development mistakes of the past
2019/07/04 0:00:00,AFL trade news 2019: West Coast faces possible logistical nightmare to land Tim Kelly
2019/07/04 0:00:00,‘Spelling Manor’: California’s most expensive house with 123 rooms sets new record
2019/07/04 0:00:00,"Tornado devastates Kaiyuan city in China, killing at least six"
2019/07/04 0:00:00,The seat numbers that don’t exist on some airlines
2019/07/04 0:00:00,Woman who went viral for licking ice cream in supermarket to face charges
2019/07/04 0:00:00,The Government’s sweeping tax cuts package passes Senate
2019/07/04 0:00:00,How you could change someone’s life by ‘tapping on’ this July
2019/07/04 0:00:00,Kenyan officials hint at identity of stowaway who fell from plane
2019/07/04 0:00:00,Nick Kyrgios hits well-known Wimbledon pub hours before taking on Rafael Nadal
2019/07/04 0:00:00,"Nick Kyrgios, Rafael Nadal grudge match could be one for the ages"
2019/07/04 0:00:00,Adelaide buyers are hot under the collar for an Adelaide Hills bargain
2019/07/04 0:00:00,Ellen DeGeneres’ $34.3 million California beachfront compound up for sale
2019/07/04 0:00:00,How real estate careers helped Millie Bobby Brown and David Harbour
2019/07/04 0:00:00,Emily Skye shows off her ‘strong’ bikini body after vowing to get back to her former physique after birth
2019/07/04 0:00:00,How Pauline Hanson has been sidelined by the government
2019/07/04 0:00:00,Air force chief details America’s response to Vladimir Putin’s potential nuclear attack
2019/07/04 0:00:00,Coroner hands down findings into death of 11-month-old Melbourne boy
2019/07/04 0:00:00,What the Coalition’s proposed tax cuts mean for you
2019/07/04 0:00:00,Fatal injuries
2019/07/04 0:00:00,Victoria Police still investigating 18 months after finding woman’s bone fragments in rock pool
2019/07/04 0:00:00,Djokovic engages in tense exchange with reporter over off-court drama
2019/07/04 0:00:00,Queensland dog breeder jailed for six months for supplying dogs for secret fights
2019/07/04 0:00:00,King stands over his son Prince Khalid Al Qasimi’s body at royal funeral after ‘sex and drugs orgy’ death
2019/07/04 0:00:00,The Ashes 2019: England paceman Jimmy Anderson hopeful calf injury isn’t serious as big series looms
2019/07/04 0:00:00,"Paris couture week, Luis Alvarez funeral: News of the day in pictures"
2019/07/04 0:00:00,Robert Irwin is the spitting image of his late father Steve Irwin
2019/07/04 0:00:00,Netherlands expected to be USA roadkill in World Cup final
2019/07/04 0:00:00,One dead as tourists flee in panic after volcano erupts on Italian island of Stromboli
2019/07/04 0:00:00,Las Vegas police officer Cordell Hendrex fired after freezing in Mandalay Bay hallway
2019/07/04 0:00:00,Cricket World Cup 2019: New Zealand skipper Kane Williamson stunned by fingertip dismissal
2019/07/04 0:00:00,Harry and Meghan’s big secret infuriates royal-watchers
2019/07/04 0:00:00,New SUV crowned safest car for kids
2019/07/04 0:00:00,Sam Groth slams Williams over ‘disgraceful’ Ash Barty comments
2019/07/04 0:00:00,Cricket World Cup 2019 | Chris Lynn explains Australia’s Cricket World Cup dressing room shift
2019/07/04 0:00:00,Lawyers for Israel Folau to drag sponsors into legal stoush
2019/07/04 0:00:00,Rundle Mall Plaza’s Little Ban Ban to give away 1000 free fried chicken wings
2019/07/04 0:00:00,‘Absurd’: Tennis scribes in awe as schoolgirl star does it again
2019/07/04 0:00:00,Audra Bear claims she doesn’t eat solid foods and just ‘breathes’ for energy
2019/07/04 0:00:00,New problems for Facebook as users around the world wonder what’s wrong with their newsfeed
2019/07/04 0:00:00,Disney reveals who’ll play Ariel in live-action Little Mermaid
2019/07/04 0:00:00,Wimbledon 2019: US teen Cori Gauff continues dream run with straight sets win over Magdalena Rybarikova
2019/07/04 0:00:00,Workers finalise removal of love locks on University Footbridge
2019/07/04 0:00:00,Entourage star Jeremy Piven says #MeToo movement ruined his career
2019/07/04 0:00:00,RUSH HOUR: Over a million evacuated in Japan in torrential rain chaos
2019/07/04 0:00:00,Sixers tipped as NBA champions; Team’s ‘unforgivable’ moment
2019/07/04 0:00:00,‘Top secret’ submarine’s mysterious mission
2019/07/04 0:00:00,Jonny Bairstow stars as England defeats New Zealand at the Cricket World Cup
2019/07/04 0:00:00,President Trump says his Salute to America to celebrate Independence Day will be ‘show of a lifetime’
2019/07/04 0:00:00,Noel Gallagher accuses Liam of sending threatening messages about his wife to his teenage daughter
2019/07/04 0:00:00,Cricket World Cup 2019: England rounding into form as business end of tournament approaches
2019/07/04 0:00:00,Cricket World Cup 2019: England storm into semifinals with impressive win over New Zealand
2019/07/04 0:00:00,"Teenager accused of rape deserves leniency because he’s from a ‘good family’, judge says"
2019/07/04 0:00:00,Body of Sydney mountaineer Ruth McCance begins journey home
2019/07/04 0:00:00,Meghan gives a special hug to Red Sox superstar ‘Mookie’ Betts when he tells her: ‘We’re kin!’
2019/07/04 0:00:00,Ash Barty cops another snub at Wimbledon
2019/07/04 0:00:00,Thomas Fabbiano wins David vs Goliath clash at Wimbledon
2019/07/04 0:00:00,"Mum begs judge to send her granddad to jail for killing her son, 6, with air rifle"
2019/07/04 0:00:00,Deadly influenza outbreak claims life of ‘beautiful’ toddler: ‘His life was cut short’
2019/07/04 0:00:00,Princess Haya Bint al-Hussein flees Dubai and prepares for legal battle in London
2019/07/04 0:00:00,"Dana Loesch, face of the National Rifle Association, without a platform"
2019/07/04 0:00:00,Hundreds get food poisoning at Imelda Marcos’ 90th birthday party
2019/07/04 0:00:00,Bring on some weekend relaxation
2019/07/04 0:00:00,Leichhardt’s popular Norton Plaza shopping centre hits the market
2019/07/04 0:00:00,An idyllic country village lifestyle awaits
2019/07/04 0:00:00,Restaurateur Elie Griplas sells in Darling Point after almost a year
2019/07/04 0:00:00,Blue Bay duplex with ocean views includes own skateboarding ramp
2019/07/04 0:00:00,Successful mission to banish 1970s brown in funky Newcomb reno
