date,title
2019/05/21 0:00:00,Apology to Magistrate Carney
2019/05/21 0:00:00,Ex-NFL star Kellen Winslow Jr ‘raped homeless woman’
2019/05/21 0:00:00,Game of Thrones foreshadowed controversial ending in first episode
2019/05/21 0:00:00,Amber Kyzer cries for five kids killed by Timothy Jones in South Carolina
2019/05/21 0:00:00,US horseracing death toll continues to rise at Santa Anita Park in California
2019/05/21 0:00:00,Salvation Army data shows growing number of older SA women facing financial difficulties
2019/05/21 0:00:00,Kawasaki Frontale beat youthful Sydney FC side 4-0 in Asian Champions League
2019/05/21 0:00:00,Queensland woman plans to fund her $81k wedding entirely through recycled containers
2019/05/21 0:00:00,Qld traffic: Bruce Highway closed at Kolonga near Bundaberg
2019/05/21 0:00:00,Ash Barty withdraws from French Open lead-up tournament
2019/05/21 0:00:00,The feel good Sydney play you have to see
2019/05/21 0:00:00,Jamie Oliver ‘saddened’ after UK restaurant empire collapses
2019/05/21 0:00:00,Tevita Pangai Jr turns down NSW and stays loyal to Tonga
2019/05/21 0:00:00,Raw voting figures reveal the real losers in Saturday’s shock election
2019/05/21 0:00:00,Tasmania Police seize trail bikes in Bridgewater as part of ongoing police operation
2019/05/21 0:00:00,Man dies in crash from a suspected medical episode at Hope Valley
2019/05/21 0:00:00,Aaron Carter says Michael Jackson was ‘inappropriate’
2019/05/21 0:00:00,MPs want shoppers to be charged a self-checkout machine tax
2019/05/21 0:00:00,Do you like shooting bandits in wastelands? Rage 2 is happy to oblige
2019/05/21 0:00:00,One word Meghan should have put on Archie’s birth certificate
2019/05/21 0:00:00,Family not spared from catfish spotlight
2019/05/21 0:00:00,See what happens when members of the public are asked to man a Meals on Wheels SA charity stall
2019/05/21 0:00:00,Concerns for missing 10-year-old Morayfield girl
2019/05/21 0:00:00,‘The PM was talking about my migrant parents when he spoke about the ‘quiet’ Australians’
2019/05/21 0:00:00,What election results really mean for property market
2019/05/21 0:00:00,Click Frenzy Mayhem sale: How to get a MacBook Air for $14
2019/05/21 0:00:00,SA employers seek flexible work hours to give men more family time and bring women into male-dominated industries
2019/05/21 0:00:00,NRL SuperCoach podcast: Teams Round 11
2019/05/21 0:00:00,GoT author breaks his silence on TV series ending
2019/05/21 0:00:00,Dragons star James Graham set to break 400-game mark
2019/05/21 0:00:00,‘Slater slayers’
2019/05/21 0:00:00,British politics just got a whole lot weirder
2019/05/21 0:00:00,Wallabies and Waratahs star Tolu Latu stood down for drink driving charge
2019/05/21 0:00:00,"Fleabag season two is side-splittingly funny, and just as dark"
2019/05/21 0:00:00,Central station shooting officer had ‘no choice’
2019/05/21 0:00:00,Little Woods: An impressive debut movie for director Nia DaCosta
2019/05/21 0:00:00,Here’s an absolute charmer in Adelaide’s leafy east
2019/05/21 0:00:00,How much more home buyers would be able to borrow under proposed lending changes
2019/05/21 0:00:00,Jeremy Latimore hits out at NRL acting ‘outside CBA’ over Jack de Belin ban
2019/05/21 0:00:00,Best Moments at Eagle Farm: Plush Embassy’s all-the-way win in 1990 Stradbroke Handicap
2019/05/21 0:00:00,Owners of Clovelly Californian bungalows celebrate $9m windfall
2019/05/21 0:00:00,Woman guilty of posing online as Home and Away star loses bid to suppress her own identity
2019/05/21 0:00:00,Gai Waterhouse chases Melbourne Cup start with St Leger winners Runaway and Transact
2019/05/21 0:00:00,Eastender Cup scratching inquiry adjourned
2019/05/21 0:00:00,"Adam Gilchrist, Mark Waugh demand aggressive David Warner open at World Cup"
2019/05/21 0:00:00,‘I do not go out’: Rihanna has given up partying as she prepares for new album and Fenty fashion line
2019/05/21 0:00:00,"Mark Waugh, Adam Gilchrist back David Warner to open for Australia at Cricket World Cup 2019"
2019/05/21 0:00:00,Jada Pinkett Smith opens up about porn on Red Table Talk
2019/05/21 0:00:00,Second suspicious package found at Greens headquarters in Adelaide CBD
2019/05/21 0:00:00,Jail time
2019/05/21 0:00:00,Woman and child found dead at Wollongong lookout named
2019/05/21 0:00:00,Australian star Margot Robbie is the new face of Chanel perfumes
2019/05/21 0:00:00,TV shows to watch after Game of Thrones
2019/05/21 0:00:00,Johnny Depp says Amber Heard painted fake bruises on her face to ‘fabricate’ abuse claims
2019/05/21 0:00:00,Looking back at Game of Thrones: The best moments from season one
2019/05/21 0:00:00,‘I was very nervous’: Victoria’s Secret recruit Barbara Palvin on what it means to be an Angel
2019/05/21 0:00:00,The tweak to your holiday that could save you hundreds
2019/05/21 0:00:00,"Cricket World Cup 2019: A guide to Australia’s fixtures, key dates and squads"
2019/05/21 0:00:00,Spice up your SuperCoach Draft league with these trade proposals
2019/05/21 0:00:00,Alleged Christchurch shooter Brenton Tarrant receives new charges
2019/05/21 0:00:00,Ex-Melbourne United star Josh Boone signs with Illawarra Hawks for 2019-20 NBL season
2019/05/21 0:00:00,Mum’s clever campaign to stop food packaging lies
2019/05/21 0:00:00,Three people injured after helicopter crash in Kakadu National Park
2019/05/21 0:00:00,Rugby to undergo unprecedented faith review after Israel Folau sacking
2019/05/21 0:00:00,Collingwood house acquired for East West Link sold on election day
2019/05/21 0:00:00,Disturbing viral video shows trans woman being beaten weeks before her murder
2019/05/21 0:00:00,Reserve Bank will consider interest rate cut at June meeting
2019/05/21 0:00:00,MAFS star Jess Power debuts new romance
2019/05/21 0:00:00,"People in Melbourne live better than in Sydney, but neither are the best in the world: report"
2019/05/21 0:00:00,VB is giving out free beer this Sunday across Australia
2019/05/21 0:00:00,Austria bans headscarves for girls in primary school in ‘signal against political Islam’
2019/05/21 0:00:00,Brando Yelavich’s record-breaking ride across Australia is the young Kiwi’s latest lifesaving adventure
2019/05/21 0:00:00,Carnival cruise ship rescues sailor from a sinking boat after receiving a distress call near Mexico
2019/05/21 0:00:00,Local investor happy to renovate and reap return in Belmont
2019/05/21 0:00:00,Pet sitter caught having sex with boyfriend on nanny cam
2019/05/21 0:00:00,"Scott Morrison worked phones almost every night in final weeks of campaign, while Labor ran out of steam"
2019/05/21 0:00:00,Snoring or waking up exhausted ‘could be early warning sign of cancer’
2019/05/21 0:00:00,Territorians choose democracy sausages in federal election
2019/05/21 0:00:00,Gas leak shuts down streets in city’s north
2019/05/21 0:00:00,Young Australians holding disturbing beliefs around consent and equality
2019/05/21 0:00:00,Daw Park delivers a quiet lifestyle within easy reach of the CBD
2019/05/21 0:00:00,Players union to open ‘faith’ review as Folau fallout deepens
2019/05/21 0:00:00,Fans claim $13 Kmart frying pan is dupe of $200 high-end version
2019/05/21 0:00:00,We want your vote to help determine Adelaide’s best pizzas
2019/05/21 0:00:00,Scott Morrison could let down 10 million taxpayers over tax cuts
2019/05/21 0:00:00,"Golden State vs Portland Western Conference Finals, Game 4"
2019/05/21 0:00:00,Crashes cause big delays for morning commute into Brisbane
2019/05/21 0:00:00,Devastation as airline makes controversial soft drink decision
2019/05/21 0:00:00,Clive Palmer absent from court during Queensland Nickel’s liquidation trial
2019/05/21 0:00:00,Home seekers set to borrow more as regulators announce move to ditch restrictive lending policy
2019/05/21 0:00:00,Distraught father cradles son cut from mother’s body
2019/05/21 0:00:00,Chinese drones may be spies: US intelligence agency warning
2019/05/21 0:00:00,Poor air quality across the city with smoke to stick around
2019/05/21 0:00:00,Hundreds of travellers descend on tiny town for 800-year-old fair
2019/05/21 0:00:00,Speed’s Keanu Reeves and Sandra Bullock had crushes on each other
2019/05/21 0:00:00,Greens headquarters in second lockdown after suspicious parcel found
2019/05/21 0:00:00,"No steering wheel, wrong colour car just start of McLaren’s monument Indy 500 stuff-up"
2019/05/21 0:00:00,Tech trade war could force Huawei toward ‘plan B’ for its smartphones
2019/05/21 0:00:00,APRA urges banks to ease mortgage criteria
2019/05/21 0:00:00,Nick Kyrgios declares French Open ‘sucks’ in Instagram video
2019/05/21 0:00:00,The bitter leadership fight engulfing Labor
2019/05/21 0:00:00,Game of Thrones season 8 final episode proves ratings dynamite for Foxtel
2019/05/21 0:00:00,Port Melbourne beach on a first-home buyer budget
2019/05/21 0:00:00,Enhanced Victorian terrace in Leichhardt set to be popular with buyers at auction
2019/05/21 0:00:00,Be wary about tiny home deposits through new government scheme
2019/05/21 0:00:00,"Formula One legend, Austria’s Niki Lauda dies aged 70"
2019/05/21 0:00:00,Police release CCTV vision of assault on female jogger near Oaklands Recreation Plaza in Marion
2019/05/21 0:00:00,Alabama rape victim speaks out against anti-abortion bill
2019/05/21 0:00:00,Worker wins unfair dismissal case after refusing to hand over biometric data
2019/05/21 0:00:00,Win the ultimate State of Origin series pass with Daily Telegraph
2019/05/21 0:00:00,The suburban roundabout that signifies why Labor lost the unlosable election
2019/05/21 0:00:00,‘I’m still shocked’: Plastic waste appears to have killed another whale
2019/05/21 0:00:00,"Round 11 teams: Dragons clean-out, SuperCoach cash cow goes down"
2019/05/21 0:00:00,Missing Sydney model found ‘shivering and cold’ after disappearing from dance party
2019/05/21 0:00:00,Confessions of a private jet flight attendant
2019/05/21 0:00:00,Woman’s false rape claim led to her neighbour’s death
2019/05/21 0:00:00,Baby Shark song: Pinkfong Sydney shows the hottest tickets in town
2019/05/21 0:00:00,"WCH teething gel for infants withdrawn because of lidocaine overdoses, parents advised not to use it"
2019/05/21 0:00:00,Electoral Commission hoses down talk of Fraser Anning informal vote conspiracy
2019/05/21 0:00:00,‘Mum sold me for sex’: 12-year-old girl sold for $460 by own mum
2019/05/21 0:00:00,Formula 1 legend Niki Lauda dead at 70
2019/05/21 0:00:00,Flume and Diplo to headline Listen Out festival 2019
2019/05/21 0:00:00,Potential of central Lara property doesn’t go unnoticed on auction day
2019/05/21 0:00:00,Private ballroom to sweep buyers off their feet in Canterbury
2019/05/21 0:00:00,Game of Thrones prequel: What we know about HBO’s spin-off to hit series
2019/05/21 0:00:00,Manus activist says detainees have ‘completely lost hope’ after election result
2019/05/21 0:00:00,"Paul Malgnaggi, Artem Lobov presser explodes in mad scenes"
2019/05/21 0:00:00,Cricket World Cup 2019: Adam Zampa’s secret net session with Rashid Khan
2019/05/21 0:00:00,Two dark horses emerge in the race for Labor leader following Bill Shorten’s devastating defeat
2019/05/21 0:00:00,Concern for cricket legend Michael Slater after he was kicked off Qantas flight
2019/05/21 0:00:00,Tesla to add more in-car video games
2019/05/21 0:00:00,Koolewong and Marmong Point marinas on the market
2019/05/21 0:00:00,"F1 news, Monaco Grand Prix 2019: Renault move not certain to end Daniel Ricciardo’s stunning principality form"
2019/05/21 0:00:00,‘Australia is cancelled’: Aussies rush to NZ visa site after federal election
2019/05/21 0:00:00,Footage reveals shocking scenes at Palmerston Shopping Centre in Darwin
2019/05/21 0:00:00,Tony Abbott’s election defeat will actually make him significantly richer
2019/05/21 0:00:00,Cooper Cronk revealed as real top dog in Melbourne Storm triumvirate of terror
2019/05/21 0:00:00,Prince George gives mum’s new garden the thumbs up as dad joins him on the swing
2019/05/21 0:00:00,Disgraced businessman Salim Mehajer walks free from prison
2019/05/21 0:00:00,Broke labourer discovers he’s an aristocrat’s son after taking DNA test
2019/05/21 0:00:00,Boxer Andy Ruiz reveals his story of ‘fat kid’ about to fight champion Anthony Joshua
2019/05/21 0:00:00,SuperCoach AFL Unique of the Week for Round 9﻿
2019/05/21 0:00:00,Cranbourne tradie Ryan Wells pleads guilty to frightening assault
2019/05/21 0:00:00,"Christie Brinkley, 65, flaunts incredible bikini body"
2019/05/21 0:00:00,Hundreds of migrants occupy Charles de Gaulle Airport in Paris
2019/05/21 0:00:00,Australian share market reaches 12-year high after Coalition victory
2019/05/21 0:00:00,Divers make surprising discovery inside world’s biggest cave
2019/05/21 0:00:00,eBay sellers flog Kate Middleton’s dress for more than four times its price
2019/05/21 0:00:00,Another contender for the Labor leadership emerges
2019/05/21 0:00:00,University of Adelaide: New vaccination to combat influenza and pneumococcal infection
2019/05/21 0:00:00,Abandoned wedding cake has many wondering what happened
2019/05/21 0:00:00,Israel Folau declares intent to keep playing rugby
2019/05/21 0:00:00,TV host apologises after spoiling Game of Thrones finale
2019/05/21 0:00:00,China’s new tech-fuelled social credit system a dystopian nightmare
2019/05/21 0:00:00,Game of Thrones producers’ extreme tactics to avoid finale leaks
2019/05/21 0:00:00,Peak-hour delays after water main bursts on Johnson St
2019/05/21 0:00:00,British man banned from US for life after immigration officials find text to American girlfriend
2019/05/21 0:00:00,Millionaire to be sentenced for having sex with teen on autopiloted plane
2019/05/21 0:00:00,Teenager whose terminal spine cancer was misdiagnosed as arthritis dies aged 17
2019/05/21 0:00:00,"Nine NRL players shopped to English clubs, Jackson Hastings slated to return to Australia"
2019/05/21 0:00:00,Women are raving about this $40 skirt
2019/05/21 0:00:00,The Anthony Davis snub that changed Zion Williamson
2019/05/21 0:00:00,Big Bang Theory showrunners defend finale after fan backlash
2019/05/21 0:00:00,Kit Harington tells GoT critics to ‘go f**k themselves’
2019/05/21 0:00:00,Scott Morrison’s big election promise to cut taxes by $1080 a year delayed
2019/05/21 0:00:00,"Teenagers cause $12,000 of damage in rampage at shopping centre on Sydney’s northern beaches"
2019/05/21 0:00:00,Brooks Koepka’s girlfriend Jena Sims is golf’s new number one WAG
2019/05/21 0:00:00,"iPads, iPhones stolen after men smash into Telstra Ingle Farm"
2019/05/21 0:00:00,The change Tanya Plibersek’s shock election decision proves we need
2019/05/21 0:00:00,Eiffel Tower closed down after intruder tries to scale the famous landmark
2019/05/21 0:00:00,Bogut taunts Lakers as Magic Johnson reveals why he quit
2019/05/21 0:00:00,RUSH HOUR: Students accused of adding bodily fluids to teachers' crepes
2019/05/21 0:00:00,"Huawei apps banned: China hits back at Google, United States"
2019/05/21 0:00:00,"AFL 2019: Chris Judd grilled on Carlton, coach Brendon Bolton and bold list calls"
2019/05/21 0:00:00,This is what a luxury $2M apartment looks like in Adelaide
2019/05/21 0:00:00,"Donald Trump will meet Prince Charles during UK visit, reports"
2019/05/21 0:00:00,Guardians of the Galaxy director James Gunn says he’s a ‘better person’ after being fired
2019/05/21 0:00:00,China denies US claim that trade deal was in place before Beijing ‘changed it’ as new ban hits Huawei
2019/05/21 0:00:00,ALP now at a crossroads following disastrous election results
2019/05/21 0:00:00,Federal Election wash-up gets played out on Q&A
2019/05/21 0:00:00,Swedish prosecutor issues formal request to hold Julian Assange on rape suspicion
2019/05/21 0:00:00,A New York police officer has been accused of plotting to use a hitman to kill her estranged husband and a teenager
2019/05/21 0:00:00,Swift buyer uptick off election result in Queensland
2019/05/21 0:00:00,Securing 11th-hour finance proves stroke of luck for young buyers
