date,title
2019/08/23 0:00:00,Sydney trains boss blames ‘archaic’ network for fault led to widespread delays
2019/08/23 0:00:00,Here's what to expect at this year’s G7 summit in Biarritz
2019/08/23 0:00:00,Billionaire and Republican donor David Koch dead at 79
2019/08/23 0:00:00,Auctions deliver sellers big results as buyers vie for shrinking supply of homes
2019/08/23 0:00:00,How did Australia’s first champion racehorse Phar Lap really die
2019/08/23 0:00:00,AFL 2019: Gregg Popovich snubs Brian Taylor ahead of Collingwood v Essendon at MCG
2019/08/23 0:00:00,"Collingwood and Essendon players belted, battered, bruised in brutal MCG clash"
2019/08/23 0:00:00,Dan ‘the Hangman’ Hooker ready to let fists do talking as he heads to UFC 243 in Melbourne
2019/08/23 0:00:00,Richard Cully keeps faith with old warrior Wells in pursuit of history in Grand National Steeplechase
2019/08/23 0:00:00,Commuters demand refunds after Sydney train chaos
2019/08/23 0:00:00,"Travis Boak’s underwear range to give all profits, from now until Father’s Day, to the Childhood Cancer Association"
2019/08/23 0:00:00,"Hong Kong buyers snatch $10m Bellevue Hill home in fly-in, fly-out two-day visit to Sydney"
2019/08/23 0:00:00,NFL 2019 | Oakland Raiders edge Green Bay Packers on bizarre 80-yard Winnipeg field
2019/08/23 0:00:00,Day two of the third Ashes Test was wild
2019/08/23 0:00:00,13 Reasons Why season three is utterly exhausting
2019/08/23 0:00:00,Phoenix Suns practice gets heated aa Kevin Durant weighs in on Devin Booker
2019/08/23 0:00:00,James Weir on the exhilarating moment trolls Kate and Will leant into the Meghan feud rumours
2019/08/23 0:00:00,10 surprising rules around carry-on luggage that you did not know about
2019/08/23 0:00:00,Trains to run on schedule for Saturday after ‘indefinite’ delays for Friday rush hour
2019/08/23 0:00:00,Victoria Police bid to keep review of James Gargasoulas secret fails
2019/08/23 0:00:00,"GWS Giants star Toby Greene ruled out of Round 23, Essendon swings six changes"
2019/08/23 0:00:00,The Bachelor: Abbie accused of being a ‘wannabe Instagram influencer’
2019/08/23 0:00:00,Donald Trump’s astonishing habit of humiliating his own supporters
2019/08/23 0:00:00,"Libra’s bold move: new campaign shows period blood on TV, divides the nation"
2019/08/23 0:00:00,"Friday NRL Round 23, 2019 | North Queensland Cowboys Vs Penrith Panthers, Brisbane Broncos Vs South Sydney Rabbitohs"
2019/08/23 0:00:00,‘Extremely excessive’: Queensland businessman accused of violent threats against female worker
2019/08/23 0:00:00,Thae Yong-ho: One of the most senior North Koreans ever to defect
2019/08/23 0:00:00,Ex-Sydney magistrate jailed for indecent assault of teenage boy
2019/08/23 0:00:00,The Sydney sandstone house that people find themselves buying
2019/08/23 0:00:00,‘I almost broke’: Jennifer Hawkins reveals secret heartbreak
2019/08/23 0:00:00,Dozens of kangaroos killed fleeing bushfires on Bribie Island
2019/08/23 0:00:00,ABC pushes for 50-50 on-air gender quotas
2019/08/23 0:00:00,Jockey Rachel King hopes to celebrate engagement with stakes success at Royal Randwick
2019/08/23 0:00:00,Man allegedly sexually abused girl after luring her from Sydney wharf
2019/08/23 0:00:00,‘Respiratory distress’: Vaping Texas teenager kept alive by hospital machines after his lungs collapsed
2019/08/23 0:00:00,FruChocs beer sells out in 13 minutes
2019/08/23 0:00:00,Northern Pride co-captains to leave club at end of season
2019/08/23 0:00:00,Three survivors from Knights’ ‘real dark days’ target end to finals drought
2019/08/23 0:00:00,Dwayne Dunn back in hot seat on Assertive Approach
2019/08/23 0:00:00,Miller declares back to business as Lorenzo dodges Ducati return questions
2019/08/23 0:00:00,Weak Aussie dollar has pushed petrol prices to a four-year high
2019/08/23 0:00:00,Brooks Koepka cops heat for nude shoot in ESPN’s Body Issue
2019/08/23 0:00:00,Magpies have one eye on Giants-Fever clash as they chase Super Netball finals berth
2019/08/23 0:00:00,Senior rugby league returns to Iona College
2019/08/23 0:00:00,Bell giving cancer patients the chance to celebrate treatment milestones
2019/08/23 0:00:00,The gruesome final Pacific voyage of James Cook
2019/08/23 0:00:00,The Private Suite: Inside one of the most exclusive airport lounges in the world
2019/08/23 0:00:00,Rare Antarctic phenomenon could plunge Australian temperatures to midwinter lows
2019/08/23 0:00:00,Parents that fed daughter vegan diet brought down by web of lies
2019/08/23 0:00:00,Steel Frost hoping to bounce back to form ahead of spring
2019/08/23 0:00:00,Three growth suburbs from Newcastle property market to buy in
2019/08/23 0:00:00,"The freedom of Michael Guider, a child killer and notorious molester, will be decided within 12 days"
2019/08/23 0:00:00,Rural block near Rylstone with dilapidated shanty sells for $125k
2019/08/23 0:00:00,Onboard Endeavour: Trials and tribulations of the high sea
2019/08/23 0:00:00,Melbourne Demons great Garry Lyon reveals the ultimate pre-season stitch up
2019/08/23 0:00:00,Group of elderly men and a woman arrested over alleged sex in woods
2019/08/23 0:00:00,"Turramurra property comes with a unique, two-storey granny flat"
2019/08/23 0:00:00,ASIC sues NAB over home loan ‘introducers’
2019/08/23 0:00:00,Armed thieves rob The Port Club at Alberton
2019/08/23 0:00:00,‘Absolutely nuts’: Kevin Rudd rebukes Bill Shorten over election strategy
2019/08/23 0:00:00,‘Embarrassing clown’: Barnaby Joyce’s anti-abortion campaign sparks furious debate
2019/08/23 0:00:00,"Woman sacked soon after filing complaint over comment about her breasts, gets $42,000"
2019/08/23 0:00:00,Promoter and Basketball Australia trumpet success of Boomers-USA game after seating farce
2019/08/23 0:00:00,Dark obsession with ‘real-life anime character’ who allegedly stabbed boyfriend
2019/08/23 0:00:00,How four million people in India’s northeast could soon become stateless
2019/08/23 0:00:00,"Duke of York, Jeffrey Epstein got massages from ‘young’ Russian women"
2019/08/23 0:00:00,New UK TV show looking for the loudest snorers whose long-suffering partners have had enough
2019/08/23 0:00:00,William Tyrrell neighbour breaks down at inquest into toddler’s disappearance
2019/08/23 0:00:00,Kate Moss: Supermodel enjoys French holiday in bikini
2019/08/23 0:00:00,Spooky signs of doom as Wallabies’ 31-man World Cup squad revealed
2019/08/23 0:00:00,‘Vast majority of these fires are human-lit’: Humans likely to blame for catastrophic Amazon fires
2019/08/23 0:00:00,Forget a HiLux: Three of the best affordable utes compared
2019/08/23 0:00:00,Sydney’s most exclusive streets and the incredible homes on them
2019/08/23 0:00:00,Global unrest prompts expats to return to Sydney looking to buy
2019/08/23 0:00:00,Mum’s economy flight story goes viral and will make you never dream of first class or business again
2019/08/23 0:00:00,How Miley Cyrus and Liam Hemsworth’s amicable split turned so ugly
2019/08/23 0:00:00,Young cancer survivor Abhi Malik dives into English Channel for charity
2019/08/23 0:00:00,Man believed punished with mysterious penis shooting recorded in medical journal
2019/08/23 0:00:00,Streets Ice Cream has launched its first ever pink cone
2019/08/23 0:00:00,‘Pray for me’: British consulate employee vanishes after making a business trip to the mainland
2019/08/23 0:00:00,‘It’s now or never’: first-home buyer pays $92k above reserve for Kensington apartment at auction
2019/08/23 0:00:00,Former Bachelor Sam Wood gives advice to Matt Agnew
2019/08/23 0:00:00,‘Fought to the last’: The ‘desperate’ final moments of Russian’s doomed Losharik sub
2019/08/23 0:00:00,Leabrook mansion transferred for a state record $8m (and $500k in fees) — but it’s not technically a sale
2019/08/23 0:00:00,Boris Johnson’s faux-pas at key Emmanuel Macron meeting
2019/08/23 0:00:00,Woman claims doctors thought she was too young to have ovarian cancer
2019/08/23 0:00:00,Thirteen starving great danes rescued from Thailand breeding farm
2019/08/23 0:00:00,Home loan trap you don’t want to fall for
2019/08/23 0:00:00,Scott Morrison takes veiled swipe at China during visit to Vietnam
2019/08/23 0:00:00,World’s fastest man Christian Coleman in doping scandal
2019/08/23 0:00:00,Courage in the country
2019/08/23 0:00:00,Athlete and model Margarita Plavunova dies while training
2019/08/23 0:00:00,‘It’s just devastating’: Aldinga Netball Club destroyed in deliberate fire
2019/08/23 0:00:00,Fitzy pushing for cricket bouncer ban after Steve Smith blow
2019/08/23 0:00:00,Virgin Australia just escalated two sisters’ 30-year prank war
2019/08/23 0:00:00,Ferrari-driving kickboxer Suleiman ‘Sam’ Abdulrahim allowed out on parole after elderly woman’s death
2019/08/23 0:00:00,Boy Meets World star spills on his backstage meltdown
2019/08/23 0:00:00,"How Kristen Stewart went from being loved in Twilight, to ‘Hollywood’s most hated woman’"
2019/08/23 0:00:00,Conor McGregor owns up to viral pub punch: ‘That’s not who I am’
2019/08/23 0:00:00,"Playboy model flaunts toned figure in a racy, barely-there bikini"
2019/08/23 0:00:00,15 seconds of plane hell: ‘We all thought we were going to die’
2019/08/23 0:00:00,The secret to Scott Morrison’s surprising victory
2019/08/23 0:00:00,Research the key to understanding cancer
2019/08/23 0:00:00,At home with... interior designer Jacqui Dunn
2019/08/23 0:00:00,Feature: Driving Nissan’s sports car legends
2019/08/23 0:00:00,Overstock CEO resigns after ‘Deep State’ comments roil stock
2019/08/23 0:00:00,Melbourne auction market: clearance rate hits two-year high
2019/08/23 0:00:00,Bushfires in Queensland and New South Wales blanket cities in smoke
2019/08/23 0:00:00,Jade Goody documentary viewers sickened at star being told that she had cancer on TV
2019/08/23 0:00:00,Delays on Melbourne’s Monash Freeway after crash
2019/08/23 0:00:00,AFL trades: Crows urged to make $1.5m offer for Brodie Grundy
2019/08/23 0:00:00,Martha Kalifatidis has been slammed again over another Instagram post
2019/08/23 0:00:00,Apple iPhone 7 radiation test prompts FCC investigation: report
2019/08/23 0:00:00,Donovan Mitchell’s touching gesture to mass shooting victims
2019/08/23 0:00:00,David Warner’s lucky escape from cricket hell
2019/08/23 0:00:00,Female shooter in Los Angeles leaves multiple people wounded
2019/08/23 0:00:00,Mysterious medieval skeleton at Prague Castle reveals its secrets
2019/08/23 0:00:00,Miley Cyrus fired from movie for buying Liam Hemsworth a penis cake
2019/08/23 0:00:00,New Ford Ranger FX4 targets Toyota HiLux
2019/08/23 0:00:00,Basketball in Australia was the winner despite huge backlash at Marvel Stadium set up
2019/08/23 0:00:00,Friends almost had to write Jennifer Aniston out of the show
2019/08/23 0:00:00,Tragic case of malnourished baby girl sparks vegan diet debate
2019/08/23 0:00:00,"‘Nothing to indicate’ Melbourne grandfather knew man who stabbed him to death, police say"
2019/08/23 0:00:00,‘We will continue to represent men at their best’: Gillette’s backflip after ‘toxic masculinity’ backlash
2019/08/23 0:00:00,Venice bridge architect fined nearly $130K because design can’t handle tourist crowds
2019/08/23 0:00:00,Bumper result for Baulkham Hills home that attracted almost 500 groups at open inspection
2019/08/23 0:00:00,Marvel Universe Live! arena show to debut Down Under in 2020
2019/08/23 0:00:00,"Wills, Kate and the family take a budget flight days after Harry and Meghan jet-set through summer"
2019/08/23 0:00:00,Matt and Kristen’s weird date on The Bachelor roasted by viewers
2019/08/23 0:00:00,Amazon fires: Brazilian President Bolsonaro blames NGOs for blazes
2019/08/23 0:00:00,Man behind Jonathan Dick’s citizen’s arrest breaks silence
2019/08/23 0:00:00,Multimillion-dollar plan to overhaul Dreamworld
2019/08/23 0:00:00,"Three separate suspicious fires lit across Adelaide overnight, including one destroying southern suburbs netball club"
2019/08/23 0:00:00,Green light for $7m Mascot Towers repairs
2019/08/23 0:00:00,James Weir recaps The Bachelor 2019 episode 8
2019/08/23 0:00:00,Talking points from day one of the third Ashes Test at Headingley
2019/08/23 0:00:00,Politician Nikki Haley baffles America with tweet shooting down rumours that don’t exist
2019/08/23 0:00:00,Glenhaven property has space for a cricket pitch and team of fielders
2019/08/23 0:00:00,US Open draw: Barty on collision course with Serena; Kyrgios’ path wide open
2019/08/23 0:00:00,Expect fireworks at US Open with Serena Williams to face Maria Sharapova in blockbuster
2019/08/23 0:00:00,RUSH HOUR: Horror at Tesla driver sleeping on freeway
2019/08/23 0:00:00,Meghan shares snaps of ‘stay strong’ and ‘be kind to yourself’ cupcakes from bakery amid backlash over private jet use
2019/08/23 0:00:00,"Prince Andrew must go public with evidence to ‘prove’ sex abuse claims aren’t true, Epstein’s ex lawyer says"
2019/08/23 0:00:00,Former spokesperson announces Michael Jackson Legacy Foundation
2019/08/23 0:00:00,Radio boss: 2GB can survive the loss of Alan Jones
2019/08/23 0:00:00,Miley Cyrus blasts cheating claims in a series of tweets
2019/08/23 0:00:00,"Man killed in New York when apartment building elevator suddenly dropped, crushing him inside"
2019/08/23 0:00:00,A Willunga South lifestyle property to knock your socks off
2019/08/23 0:00:00,"‘One country, two systems’: Why a simple agreement coined decades ago failed in Hong Kong"
2019/08/23 0:00:00,Fans blow up over the seating at Marvel Stadium for Boomers v USA
2019/08/23 0:00:00,European leaders put onus on Boris Johnson to solve Irish border crisis
2019/08/23 0:00:00,Tolmans Hill: Sophistication and opulence with no expense spared
2019/08/23 0:00:00,It was refreshing to see everyone releasing these big kingfish
2019/08/23 0:00:00,Neil Clerehan: one of architect’s final restorations for sale in Hawthorn
