date,title
2019/02/21 0:00:00,Dhaka fire in Bangladesh kills dozens in centuries-old district
2019/02/21 0:00:00,England one-day batsman Jason Roy puts hand up for Ashes debut with swashbuckling innings
2019/02/21 0:00:00,Teachers threaten strike action if current negotiations fail
2019/02/21 0:00:00,J.K. Simmons chats about Counterpart season two
2019/02/21 0:00:00,Con’s Fine Food marks 60 years at the Adelaide Central Market
2019/02/21 0:00:00,Claremont serial killing trial to cost taxpayers millions
2019/02/21 0:00:00,"Breakdancing tipped to be part of the 2024 Olympics in Paris along with surfing, sport climbing and skateboarding"
2019/02/21 0:00:00,Bus driver ‘traumatised’ after toddler found locked on-board after six hours
2019/02/21 0:00:00,Breakdancing to make Olympic debut at Paris 2024
2019/02/21 0:00:00,Labor reveals ‘unprecedented’ compensation scheme for bank victims
2019/02/21 0:00:00,Brisbane Lions thrilled with more TV exposure on Channel 7’s main channel
2019/02/21 0:00:00,Boston Celtics star snaps at journalist over viral video question
2019/02/21 0:00:00,Mullaloo beach sex-attack accused is son of WA Police officer
2019/02/21 0:00:00,Half Panthers starting side picked as captains under Cleary model
2019/02/21 0:00:00,‘I remember how Kate tasted’: Samuel Johnson’s ‘creepy’ Kate Ritchie kiss confession
2019/02/21 0:00:00,Six days of above 30c weather forecast heading into Superloop 500 motor racing event
2019/02/21 0:00:00,Sonny Bill Williams reportedly offered $5 million to play rugby league in Toronto
2019/02/21 0:00:00,Hilltop Hoods team with Canteen to give cancer kids free gigs
2019/02/21 0:00:00,Dragons become second club in a week to move trial game from home ground
2019/02/21 0:00:00,AFLW teams: Father-daughter Abbie McKay to debut for Carlton
2019/02/21 0:00:00,Greg Inglis backs NRL in crackdown on poor off-field behaviour
2019/02/21 0:00:00,Jennings finally inks new deal after long wait in limbo
2019/02/21 0:00:00,Aussie man not guilty over shooting an intruder as self-defence
2019/02/21 0:00:00,Julie Bishop’s greatest achievement in politics
2019/02/21 0:00:00,A rare beachfront home on 1927sqm is full or possibilities
2019/02/21 0:00:00,Laurie Sutton lists Darling Point mansion with $35m price guide
2019/02/21 0:00:00,Manchester United star Anthony Martial apologises for salacious sexting
2019/02/21 0:00:00,Meghan Markle’s makes lavish baby shower exit on $175k plane
2019/02/21 0:00:00,Sailing legend Trevor Barnabas lists stunning Newport headland home
2019/02/21 0:00:00,Meg Ryan has addressed the role that single-handedly ended her career as romantic comedy queen
2019/02/21 0:00:00,Beach penthouse listed for $8.95m
2019/02/21 0:00:00,Kate Hudson reveals the truth about balancing being a mum with work and keeping fit
2019/02/21 0:00:00,‘I’ve been through that kind of ordeal’: GI won’t oppose serious crime stance
2019/02/21 0:00:00,"Leather jacket scam hits Cottesloe, Claremont, Mount Lawley and Swanbourne"
2019/02/21 0:00:00,Scary reason you should check your mum’s Tinder
2019/02/21 0:00:00,Ford legend Dick Johnson first to race Mustang at Superloop Adelaide 500
2019/02/21 0:00:00,"Laneway Series back with food, drink and live music"
2019/02/21 0:00:00,People power gets Urban Ruler a place in $5 million All-Star Mile horse race
2019/02/21 0:00:00,Chiropractor banned from treating children after controversial work on baby
2019/02/21 0:00:00,‘Critical juncture’: Why Today’s biggest challenge is still ahead
2019/02/21 0:00:00,"Accused rapist showed ‘no mercy’, court hears"
2019/02/21 0:00:00,Gambling tycoon’s empire at risk thanks to bizarre family tree
2019/02/21 0:00:00,"Why Burgess rejected ‘good offer’ from Eels, and picked up surprising pursuit"
2019/02/21 0:00:00,Julie Bishop announces she will quit politics at the next election
2019/02/21 0:00:00,Kate Middleton’s secret $9 million fortune
2019/02/21 0:00:00,Anniversary of Prince Charles and Diana’s royal engagement: Their very creepy first meeting
2019/02/21 0:00:00,Southampton bushfire contained but threat still remains
2019/02/21 0:00:00,Raceday focus: preview and tips for Canterbury Park (night) and Scone
2019/02/21 0:00:00,Ex-Ford exec selling South Melbourne home by famed architect Charles Webb
2019/02/21 0:00:00,Teens affected by cancer can now see their favourite bands for free
2019/02/21 0:00:00,The car that spied on me: App to help parents track young drivers
2019/02/21 0:00:00,Kate Iselin: What you don’t know about porn in Australia might shock you
2019/02/21 0:00:00,Meghan Markle has just started a war she can’t possibly win
2019/02/21 0:00:00,Fit-again Greg Inglis on track to make shock early return for South Sydney
2019/02/21 0:00:00,NSW triple murderer granted parole: ‘This man murdered three people in cold blood’
2019/02/21 0:00:00,MAFS star Matthew reveals shock new girlfriend
2019/02/21 0:00:00,Risky pedestrian behaviour under police scrutiny after 23 crashes in Adelaide CBD
2019/02/21 0:00:00,"All-Star Mile final field confirmed with Grunt, Alizee and Amphitrite  the headliners"
2019/02/21 0:00:00,Development pushes up Sydney vacancy rate to highest level
2019/02/21 0:00:00,Basketball fans roast Nike after Zion Williamson goes down
2019/02/21 0:00:00,Aussie dollar crashes back to earth as Westpac becomes first major lender to predict rate cut
2019/02/21 0:00:00,How to pack an emergency kit for a cyclone
2019/02/21 0:00:00,Claremont serial killings: What caused Bradley Robert Edwards’ prison shower injury still unknown
2019/02/21 0:00:00,‘There may be hope’: Tortoise feared extinct for a century found on remote Galapagos island
2019/02/21 0:00:00,Opinion: Don’t fall for this rubbish again this election
2019/02/21 0:00:00,SA Police: ‘Homemade incendiary devices’ found near O-Bahn track
2019/02/21 0:00:00,‘It is worse than being back to square one’: Westpac hit with class action over irresponsible lending
2019/02/21 0:00:00,The bus road rule frustrating Australian motorists
2019/02/21 0:00:00,Court Hotel owner Bree Maddox flies rainbow flag
2019/02/21 0:00:00,AFL great Peter Everitt confronts former coach Grant Thomas over AFL drug bombshell
2019/02/21 0:00:00,Champions League | Formidable Atletico stun Ronaldo and Juventus
2019/02/21 0:00:00,IKEA expands its sleepover event across Australia
2019/02/21 0:00:00,Fashion retailer Zara sparks ‘freckles’ debate after publishing photo of top Chinese model Jing Wen
2019/02/21 0:00:00,Today was not a good day for Apple
2019/02/21 0:00:00,Drug addicted killer Zoe Giannioudis jailed over Richmond stabbing of customer
2019/02/21 0:00:00,Queensland prepares for wild weather as Cyclone Oma nears
2019/02/21 0:00:00,A socialite has been filmed lashing out a couple during their child's first birthday photo shoot
2019/02/21 0:00:00,MAFS: Former ’villain’ Davina  spills huge secret about infamous scene
2019/02/21 0:00:00,Luxury retreat offers lifestyle and second home
2019/02/21 0:00:00,Owner may be forced to give up ‘obscene’ business title
2019/02/21 0:00:00,"RBA to cut rates twice in 2019, says Australian Big Four bank"
2019/02/21 0:00:00,"‘Yep, I would definitely date Dirty John and here’s why’"
2019/02/21 0:00:00,Former MAFS star Troy Delmege running for parliament to ‘improve democracy’ in North Sydney
2019/02/21 0:00:00,Measles vaccination and autism: Father’s shocking admission
2019/02/21 0:00:00,"Toddler, 2, allegedly murdered by his mother had ‘catastrophic internal injuries’"
2019/02/21 0:00:00,The real problem with Mathias Cormann’s Hello World flight
2019/02/21 0:00:00,Internal space bigger than some suburban blocks
2019/02/21 0:00:00,Bonjour! French provincial living in quaint Goolwa South
2019/02/21 0:00:00,The best time to visit Alice Springs
2019/02/21 0:00:00,The world's most beautiful festival returns to Alice Springs
2019/02/21 0:00:00,"Balwyn North house with karaoke bar, gaming lounge sets record"
2019/02/21 0:00:00,President Putin’s Poseidon drone designed to unleash ‘radioactive tsunamis’
2019/02/21 0:00:00,AFL star Patrick Dangerfield defends AFLX
2019/02/21 0:00:00,Nitro Circus’ Brisbane show rescheduled due to Cyclone Oma
2019/02/21 0:00:00,Seinfeld star David Puddy steals the show at NHL match
2019/02/21 0:00:00,How far can you go to protect yourself and your family inside your own home?
2019/02/21 0:00:00,Family plans to sue company allegedly responsible for fatal home explosion
2019/02/21 0:00:00,Why veteran war correspondent Anthony Lloyd says IS bride should return to UK
2019/02/21 0:00:00,South Australia’s jobless rate soars to highest level in 18 months
2019/02/21 0:00:00,Today boss hits back over show’s rating slide
2019/02/21 0:00:00,TOKYO 2019
2019/02/21 0:00:00,SuperCoach BBL|08 Review: Melbourne Renegades
2019/02/21 0:00:00,Opinion: Mark Waugh’s Matthew Wade claim sounds warning bells for domestic cricketers
2019/02/21 0:00:00,US rejects IS bride and former Twitter propagandist who claimed she was brainwashed by group
2019/02/21 0:00:00,Stake a claim for butcher’s shop ready for warehouse conversion
2019/02/21 0:00:00,When to watch Highlanders v Reds
2019/02/21 0:00:00,Fiance’s ‘manipulative’ demands before wedding
2019/02/21 0:00:00,New bayside Mt Martha pad built with a view to impress
2019/02/21 0:00:00,Victoria police officer wins right to four-day work week
2019/02/21 0:00:00,Snake filmed attempting to devour bird on top of woman’s roof
2019/02/21 0:00:00,Salmonella outbreak blamed on handled raw eggs at bakeries
2019/02/21 0:00:00,Aussies have plenty of options as Aaron Finch’s opening partner for limited-overs tour of India
2019/02/21 0:00:00,Period sex smashing taboos and menstrual stigma
2019/02/21 0:00:00,Tanzanian village chief attempting to stop poaching beheaded by gang
2019/02/21 0:00:00,The best things in life await in harbour home with marina berth
2019/02/21 0:00:00,Donald Trump’s extraordinary two-year war on Russia investigations
2019/02/21 0:00:00,"Georges St-Pierre set to announce UFC retirement, but Khabib Nurmagomedov wants a fight with the legend"
2019/02/21 0:00:00,Teenage girl married to a 62-year-old man reveals they’re trying to have a baby
2019/02/21 0:00:00,Toyota Australia victim of cyber attack
2019/02/21 0:00:00,Jordan Silk relives the traumatic moment he left Ricky Ponting fuming
2019/02/21 0:00:00,Qantas and Jetstar to swap paper boarding passes for digital model
2019/02/21 0:00:00,Watch: Diego Simeone’s wild goal celebration in Atletico Madrid’s Champions League win over Juventus
2019/02/21 0:00:00,Empire actor Jussie Smollett charged following attack claims
2019/02/21 0:00:00,Kim Jong-un accused of violent North Korean power purge to grab scarce cash
2019/02/21 0:00:00,Speculation runs wild over Disney-themed collectables campaign
2019/02/21 0:00:00,Investigation opens into cause of Clarendon Vale house fire
2019/02/21 0:00:00,Wesfarmers shareholders will get $1b payout from Coles split
2019/02/21 0:00:00,Dana White addresses blockbuster Conor McGregor claim
2019/02/21 0:00:00,AFL chief executive Gillon McLachlan defends AFLX as team Rampage win 2019 tournament
2019/02/21 0:00:00,Sunshine Coast train lines resume after level crossing accident
2019/02/21 0:00:00,Champions League: Manchester City seal incredible win late on as Atletico upstage Cristiano Ronaldo
2019/02/21 0:00:00,MAFS: Matthew accuses ex-‘wife’ Lauren of ‘relentless abuse’
2019/02/21 0:00:00,Footy legend Garry Lyon addresses AFL drug rumour
2019/02/21 0:00:00,Basketball phenomenon’s absurd 100-pound weight gain
2019/02/21 0:00:00,Australian politics live: Thursday February 21
2019/02/21 0:00:00,Family hit a winner and secure Point Lonsdale holiday house
2019/02/21 0:00:00,Samsung Galaxy Buds aim to be the Apple AirPods killer
2019/02/21 0:00:00,Le’Veon Bell will get his free agency wish from Steelers
2019/02/21 0:00:00,Man to sue his wife after she exposed his micropenis
2019/02/21 0:00:00,"Cyber attackers hack Toyota Australia, Melbourne heart clinic"
2019/02/21 0:00:00,Woman reveals how she deleted nude pics from her ex-boyfriend’s phone
2019/02/21 0:00:00,Chilean fans clean toilets after eliminating Chapecoense from Copa Sudamericana
2019/02/21 0:00:00,Cybercrime gang hacks thousands of medical files and demands ransom from Melbourne hospital
2019/02/21 0:00:00,A woman has shared her overprotective grandad’s list of ‘boyfriend rules’
2019/02/21 0:00:00,Rugby star Nico Lee rubbed out for 13 weeks after gross act
2019/02/21 0:00:00,Gladys Berejiklian filmed mocking a reporter for asking tough questions about an expensive light rail project
2019/02/21 0:00:00,Meghan’s surprise BRIT Awards cameo — in a Beyonce acceptance video
2019/02/21 0:00:00,Hopes fading for backpackers missing near Port Macquarie in NSW
2019/02/21 0:00:00,Air New Zealand plane turned around after not having permission to fly over Iran
2019/02/21 0:00:00,Werribee retirees fall for bay vista from St Leonards beach house
2019/02/21 0:00:00,Tennis Briefs: Roger Federer changes things up; Top seeds tumble in Rio; Dubai tournament rolls on
2019/02/21 0:00:00,This is the moment British IS bride Shamima Begum discovers her citizenship has been revoked
2019/02/21 0:00:00,The mistress of alleged murderer Patrick Frazee says he asked her to kill Kelsey Berreth
2019/02/21 0:00:00,"England vs WI | Chris Gayle’s monster ton, Poms take huge victory"
2019/02/21 0:00:00,Philadelphia 76ers centre Joel Embiid out one week with sore left knee
2019/02/21 0:00:00,High school under fire for awards handed out to cheerleaders
2019/02/21 0:00:00,"Jameela Jamil calls Karl Lagerfeld a ‘ruthless, fat-phobic misogynist’"
2019/02/21 0:00:00,James Weir recaps Married At First Sight 2019 episode 16
2019/02/21 0:00:00,"Aussies want ‘life skills’ taught in school, Monash University research shows"
2019/02/21 0:00:00,Disabled woman accuses staff at Brisbane Eminem concert of ‘segregation’
2019/02/21 0:00:00,Monash Fwy truck rollover causing delays this morning
2019/02/21 0:00:00,RUSH HOUR: Snake eats bird while wrapped around TV aerial
2019/02/21 0:00:00,New red light avoidance tech to make daily commute much easier
2019/02/21 0:00:00,Star’s BRIT Awards wardrobe malfunction in very revealing outfit
2019/02/21 0:00:00,"Samsung reveals flexible Galaxy Fold smartphone, and four Galaxy 10 handsets, including 5G model"
2019/02/21 0:00:00,Hands on review: why the Samsung Galaxy S10 could be overshadowed by the Galaxy Fold
2019/02/21 0:00:00,Samsung unveils new products at Unpacked event
2019/02/21 0:00:00,"Daniel Ricciardo, Daniil Kvyat surprise everyone at F1 testing"
2019/02/21 0:00:00,"46-year-old motorcyclist killed after crashing into roundabout, tree in Fitzroy"
2019/02/21 0:00:00,MAFS: Mike slams Sam over ‘unforgivable’ act
2019/02/21 0:00:00,Balmoral house goes to auction for first time ever
2019/02/21 0:00:00,Fly-in Chinese buyers snare elite Melbourne homes for Lunar New Year
2019/02/21 0:00:00,Robert Mueller’s Russia probe report ‘set to be released next week’
2019/02/21 0:00:00,Chelsea star Antonio Rudiger likens methods of under-fire boss Maurizio Sarri to a ‘school teacher’
2019/02/21 0:00:00,New Zealand ready to unleash teen sensation Amelia Kerr on Aussies as Kiwis eye Rose Bowl redemption
2019/02/21 0:00:00,Perth MP John Carey wants ban on supermarket plastic promotional toys
2019/02/21 0:00:00,Gwyneth Paltrow rejects $4m skiing lawsuit by Terry Sanderson
2019/02/21 0:00:00,"Serena Williams, Amal Clooney co-hosting Meghan, Duchess of Sussex’s baby shower"
2019/02/21 0:00:00,Extravagant party crowns Meghan’s $100k-a-night NYC baby shower
2019/02/21 0:00:00,Jussie Smollett once lied to cops during DUI arrest
2019/02/21 0:00:00,Tory MPs quit to join independents and sabotage Brexit
2019/02/21 0:00:00,Meghan Markle’s baby shower reveals sad secret about her new life
2019/02/21 0:00:00,Baby born without a brain learns to count and surf
2019/02/21 0:00:00,A luxurious lifestyle is on offer in one of Adelaide’s most tightly-held streets
2019/02/21 0:00:00,Yacht racing millionaire’s $3m discount
2019/02/21 0:00:00,UBS to pay billions for helping French clients evade tax
2019/02/21 0:00:00,Donald Trump takes aim at media on Twitter
2019/02/21 0:00:00,CSIRO researchers build tools to map and predict infectious disease outbreaks
2019/02/21 0:00:00,Is this the ultimate Sandy Bay family home?
2019/02/21 0:00:00,Gustave Caillebotte died leaving a great legacy of Impressionist paintings to France
2019/02/21 0:00:00,Mosman home built as a place of recovery for WWI diggers is for sale
