date,title
2019/07/11 0:00:00,Perth landmark The Crawley Edge Boatshed aka Blue Boat House’s hue change shocks tourists
2019/07/11 0:00:00,Woman dead after tree falls on car in Blue Mountains
2019/07/11 0:00:00,Netflix under threat from rival TV giants
2019/07/11 0:00:00,TCR Australia touring car series to be held at The Bend Motorsport Park this weekend
2019/07/11 0:00:00,Amazon charges student thousands over four-day-late textbook
2019/07/11 0:00:00,Cricket World Cup 2019 | Alex Carey stands tall to bouncer barrage
2019/07/11 0:00:00,Global leaders urge restraint after tensions flare between UK and Iran at Strait of Hormuz
2019/07/11 0:00:00,Paul Kent says Josh McGuire’s sledge to Blake Ferguson ‘below the belt’ and ‘defamatory’
2019/07/11 0:00:00,Flock of over 50 native birds die after falling from sky bleeding from eyes
2019/07/11 0:00:00,"Fundraiser for toddler Izabella Smith, who was tragically killed in a driveway accident at Tailem Bend"
2019/07/11 0:00:00,Curiosity Show presenter Dr Rob Morrison says plastic straws are too useful to ban
2019/07/11 0:00:00,Flu death toll hits 300 as season ‘passes peak’
2019/07/11 0:00:00,Two houses destroyed in separate fires at Mount Pleasant and Tailem Bend
2019/07/11 0:00:00,Powerball jackpots again to Australian record $110 million
2019/07/11 0:00:00,Woman with multiple sclerosis granted sex therapist through NDIS on appeal
2019/07/11 0:00:00,Australian Trainers’ Association urge Racing Victoria to address spring bonus imbalance
2019/07/11 0:00:00,Future of Sydney’s Sculpture by the Sea event threatened by new footpath
2019/07/11 0:00:00,State Government closes loophole where people could attempt suicide after signing ACD form refusing treatment
2019/07/11 0:00:00,Time is right to trial star colt as trainer Gary Portelli closes in on milestone
2019/07/11 0:00:00,Woman spent $50k on treatments to cure her ‘agonising’ eczema pain
2019/07/11 0:00:00,Breast implant ban recommended after links to rare cancer
2019/07/11 0:00:00,The Beauty Diary: Martha Kalifatidis’ selfie made this sheet mask sell out
2019/07/11 0:00:00,Free-to-air blackout means it’s the ultimate Queensland footy weekend on Kayo
2019/07/11 0:00:00,Largest unit block sale in Sydney since 2017: $20m deal in Waverley
2019/07/11 0:00:00,Cricket World Cup 2019 | 2nd Semi-Final: England defeat Australia by eight wickets
2019/07/11 0:00:00,"Birds with ‘blood coming out of their mouths’ fall from sky, on to primary school grounds"
2019/07/11 0:00:00,Pictures that prove Meghan just can’t win
2019/07/11 0:00:00,Aldi recalls Whoppers after undeclared allergens were found in the snack
2019/07/11 0:00:00,Guy Sebastian: Hidden detail in Voice coach’s Maroubra home
2019/07/11 0:00:00,Australian consumers hit by EFTPOS outage
2019/07/11 0:00:00,‘Mum cut my throat’: Toddler’s shocking dinner-table confession
2019/07/11 0:00:00,Winners galore as Sydney and Melbourne raise stakes for spring
2019/07/11 0:00:00,Two car fires cause delays on the South Eastern Freeway
2019/07/11 0:00:00,What you need to know about sending nudes
2019/07/11 0:00:00,Daly Cherry-Evans admits one player’s ‘lapse’ cost Queensland
2019/07/11 0:00:00,Economic recession: Debt collectors and universities to boom as Australia’s growth slows
2019/07/11 0:00:00,NBN’s excuse for slow net speeds exposed
2019/07/11 0:00:00,The Voice’s embarrassing track record
2019/07/11 0:00:00,eBay announces insane winter deal on popular Apple product for a limited time only
2019/07/11 0:00:00,Buyer response to Lane Cove apartment brings auction forward
2019/07/11 0:00:00,Gold Coast police hunting mullet man with face tatts over alleged sex toy theft
2019/07/11 0:00:00,Thousands of homes in NSW lose power amid wild winds
2019/07/11 0:00:00,Woman tells of ‘humiliating’ strip search at Sydney music festival at inquest
2019/07/11 0:00:00,"Bride’s lavish $237,000 wedding causes outrage, but not for the reason you think"
2019/07/11 0:00:00,Australia’s favourite chocolate bar is not what you’d expect
2019/07/11 0:00:00,Old property attracts 18 registered bidders on auction day
2019/07/11 0:00:00,New SA campaign urges people to return old pain meds for disposal
2019/07/11 0:00:00,"‘Sorry, this restaurant has flown the coop’: Nando’s in crisis with one in five stores closing"
2019/07/11 0:00:00,Pull-ups vs chin-ups: Which builds more muscle?
2019/07/11 0:00:00,Volunteering with Cancer Council NT is ‘good for the soul’
2019/07/11 0:00:00,The hidden message in Diana’s gym gear
2019/07/11 0:00:00,Raceday focus: Best bets and inside mail for Goulburn and Scone
2019/07/11 0:00:00,Volkswagen Touareg Launch Edition reviewed
2019/07/11 0:00:00,AFL teams: All the ins and outs for Round 17
2019/07/11 0:00:00,"Geoffrey and Brynne Edelsten: Inside Australia’s most expensive, extravagant $3.3 million wedding"
2019/07/11 0:00:00,How one year of cold calls turned Total Image Group into a $15 million-a-year empire
2019/07/11 0:00:00,"Virat Kohli is one of cricket’s greatest batsmen, but it’s not all roses"
2019/07/11 0:00:00,MAFS star Jess Power explains kissing video
2019/07/11 0:00:00,Bagel customer’s furious rant about women leads to brawl
2019/07/11 0:00:00,Ladbrokes Late Mail: Richmond’s AFL flag odds have been slashed
2019/07/11 0:00:00,Lavender Bay trophy home also comes with winning harbour view
2019/07/11 0:00:00,"Sorry dog lovers, you can never trust a big dog"
2019/07/11 0:00:00,Federer ready to end 11-year wait for Wimbledon revenge on Nadal
2019/07/11 0:00:00,Instagrammers warned against swimming in toxic Siberian ‘Maldives’ lake
2019/07/11 0:00:00,Music insiders: Taylor Swift ‘playing victim’
2019/07/11 0:00:00,Michael Hill underpaid staff by millions
2019/07/11 0:00:00,Glen Boss draws strength from old rivals still riding at top of their game
2019/07/11 0:00:00,"Three dead, two rescued after catamaran capsized in Newcastle"
2019/07/11 0:00:00,Relationship Rehab: ‘My husband is lusting after another woman’
2019/07/11 0:00:00,Married At First Sight: Ines Basic accused of photoshopping in latest Instagram post
2019/07/11 0:00:00,Protest as William Tyrrell cop walks from force
2019/07/11 0:00:00,New smaller version of popular console announced
2019/07/11 0:00:00,"Tinder turned woman into porn star, earning $1300 per hour"
2019/07/11 0:00:00,ATO tax refund: How to get your $1080 offset in the next two weeks
2019/07/11 0:00:00,Modbury green space sale for 35 units takes step forward
2019/07/11 0:00:00,Giant new dome built to contain Chernobyl’s radioactive debris revealed
2019/07/11 0:00:00,Madeleine Blanchfield’s renovation creates stylish Paddington terrace that’s full of light
2019/07/11 0:00:00,How to find the best bits of Rome for the kids
2019/07/11 0:00:00,Important pair of Port Adelaide players looking to prove fitness ahead of vital Round 17 game
2019/07/11 0:00:00,NZ man admits offensive behaviour brought CBD to a standstill
2019/07/11 0:00:00,Silicon Valley elites arrive at Sun Valley for Allen & Co’s annual conference
2019/07/11 0:00:00,‘I was lucky I didn’t lose any fingers’: Aussie woman suffers severe infection after henna tattoo in Egypt
2019/07/11 0:00:00,Heroes and villains of iconic final Origin sequence
2019/07/11 0:00:00,SuperCoach jury answer the key questions ahead of the run home
2019/07/11 0:00:00,"Wild weather batters southern Australia, but worst is yet to come"
2019/07/11 0:00:00,‘Weak’ economy on brink of ‘lost decade’
2019/07/11 0:00:00,Glenelg AFL draft prospect Will Gould has been compared to West Coast premiership captain Shannon Hurn - with good reason
2019/07/11 0:00:00,Age matters: 3 rules for travelling with kids
2019/07/11 0:00:00,City in China to install microchips in bed linen to determine cleanliness
2019/07/11 0:00:00,Baker got woman’s Disney-themed birthday cake hilariously wrong
2019/07/11 0:00:00,"Former Liverpool striker Daniel Sturridge got his dog back, but paid less far less than he said"
2019/07/11 0:00:00,Deutsche Bank photo taken after mass job cuts not what it seems
2019/07/11 0:00:00,"Last units up for grabs in leafy, low-rise residential project"
2019/07/11 0:00:00,Welcome to Country ‘booed’ at Sydney Opera House
2019/07/11 0:00:00,Explainer: Australia heading for referendum on constitutional recognition of Indigenous peoples
2019/07/11 0:00:00,Train streaker cheered through packed train slip’n’slide
2019/07/11 0:00:00,The creepy history of Disney’s perfect town
2019/07/11 0:00:00,Teenage heiress to billion dollar fortune tragically dies in horror accident
2019/07/11 0:00:00,Verdant St Kilda dream home for sale for second time in 100 years
2019/07/11 0:00:00,Local agent’s work together to sell dream Long Jetty duplex
2019/07/11 0:00:00,Couple opens up about ‘heartbreaking’ IVF mix-up
2019/07/11 0:00:00,Canterbury house price record: palace vying to smash benchmark
2019/07/11 0:00:00,Mark ‘Bomber’ Thompson’s drug trafficking charges dismissed
2019/07/11 0:00:00,Housing has become more affordable than it was in 1999
2019/07/11 0:00:00,Kayla Simmons makes pitch to join Sports Illustrated’s swimsuit edition
2019/07/11 0:00:00,Star filly Mystic Journey qualifies for new $1 million bonus if she can capture Valley’s Cox Plate
2019/07/11 0:00:00,Yerrinbool has the longest hold period of any Illawarra suburb
2019/07/11 0:00:00,More storms ahead after wild night of wind and rain lashes Victoria
2019/07/11 0:00:00,Amal Clooney’s swipe at Australia on press freedoms
2019/07/11 0:00:00,Buyers looking for privacy and space in Hills semirural market
2019/07/11 0:00:00,Woman caught on video in incredible insurance crash-injury scam
2019/07/11 0:00:00,Big wardrobe change Meghan Markle is making
2019/07/11 0:00:00,The unlikely meal that will help ease your hay fever symptoms
2019/07/11 0:00:00,Amal Clooney slams Australia’s failure to protect press freedoms
2019/07/11 0:00:00,Republican candidate tells female journalist she can’t shadow him without male colleague
2019/07/11 0:00:00,"Now who’s laughing, JT? Blues burn Maroons legend in epic post"
2019/07/11 0:00:00,‘Wall of windows’: Crime scene shows how toddler plunged to her death on-board cruise ship
2019/07/11 0:00:00,Carlton great Mark Maclure wants Chris Judd to apologise to David Teague for ‘disrespectful’ comments
2019/07/11 0:00:00,Mum explains why she walked her gay son down aisle
2019/07/11 0:00:00,How mindsets about destiny are sabotaging our romantic relationships
2019/07/11 0:00:00,Martin Guptill’s stunning run out of MS Dhoni brought into question
2019/07/11 0:00:00,Springboks legend James Small died on Tuesday after suffering a heart attack
2019/07/11 0:00:00,Kim Kardashian’s fans lose it over ‘unrecognisable’ reality star’s bold new look
2019/07/11 0:00:00,"Mark Waugh on training etiquette, Australia’s squad shake-ups"
2019/07/11 0:00:00,A deposit for a Gold Coast house could buy you this whole property
2019/07/11 0:00:00,Award-winning Yarralumla home a sleek showpiece
2019/07/11 0:00:00,ASOS shares clever hack to turn normal socks into invisible socks
2019/07/11 0:00:00,Former One Direction star Liam Payne poses naked in wild Instagram post
2019/07/11 0:00:00,Extinction Rebellion protesters throw Brisbane CBD into chaos
2019/07/11 0:00:00,Teslonda: This proves electric cars aren’t boring
2019/07/11 0:00:00,Aussie selection mystery solved following Maxwell speculation
2019/07/11 0:00:00,Anger as tourists swarm Uluru as climb closure date approaches
2019/07/11 0:00:00,"Cute cubs, a royal outing and US Women’s National Soccer Team celebrations: News of the day in photos"
2019/07/11 0:00:00,Mother dies from cosmetic surgery in Dominican Republic
2019/07/11 0:00:00,‘How is it possible?’ Intruder on the loose at Buckingham Palace
2019/07/11 0:00:00,New Zealand defeats India in thrilling Cricket World Cup semi-final
2019/07/11 0:00:00,All the reaction from Origin III as NSW breaks Queensland’s heart
2019/07/11 0:00:00,Southern Expressway reopens after truck rollover
2019/07/11 0:00:00,Crash on Hale St at Milton causing huge delays for commuters
2019/07/11 0:00:00,Bus driver dies after smashing into truck’s dislodged trailers
2019/07/11 0:00:00,Model mates left ‘embarrassed’ after a shopper spots spelling errors on popular product
2019/07/11 0:00:00,"140 years of The Daily Telegraph: Whitlam sacking, Granville tragedy"
2019/07/11 0:00:00,History-loving renovator with deep pockets wanted for stunning North Adelaide home
2019/07/11 0:00:00,Tiffiny Halls reveals clever household items you can train with
2019/07/11 0:00:00,Maggots found in wound at aged care home: Royal Commission
2019/07/11 0:00:00,Cricket World Cup semi-final: NZ beat India by 18 runs
2019/07/11 0:00:00,"Man killed, woman injured in horror dog attack in Melbourne backyard"
2019/07/11 0:00:00,Bentleigh house transported to Trentham after digital age deal
2019/07/11 0:00:00,Bachelor star Lisa Hyde’s bizarre baby name revealed
2019/07/11 0:00:00,Judge grants Edward Latimer permission to see sex workers
2019/07/11 0:00:00,Angela Merkel seen shaking for third time in Berlin with Finland PM Antti Rinne
2019/07/11 0:00:00,"Final twist in wild free agency as terms of Kawhi, Kyrie and KD’s contracts revealed"
2019/07/11 0:00:00,Tatum O’Neal blasts ‘tacky’ Meghan over Wimbledon photo row
2019/07/11 0:00:00,Thwaites Glacier set to reach ‘tipping point’ that could lead to irreversible melting
2019/07/11 0:00:00,Man found making ‘deep grunting’ noise before MDMA overdose
2019/07/11 0:00:00,Johanna Konta’s Wimbledon press conference divides the tennis world
2019/07/11 0:00:00,Michael Sleggs dead: This Country star’s tragic final interview
2019/07/11 0:00:00,Jeffrey Epstein’s latest accuser says he raped her at 15: ‘He knew exactly what he was doing’
2019/07/11 0:00:00,RUSH HOUR: Confused baker delivers elaborate marijuana cake
2019/07/11 0:00:00,Young man’s freak caffeine overdose death sparks urgent safety review
2019/07/11 0:00:00,Is Nick Kyrgios hiding a ‘brittle’ ego?
2019/07/11 0:00:00,A skull discovered in Greek cave is ‘oldest fossil’ found outside Africa
2019/07/11 0:00:00,"Willy Wonka star Denise Nickerson, who played Violet Beauregarde, dies aged 62"
2019/07/11 0:00:00,Roger Federer wins 100th match at Wimbledon
2019/07/11 0:00:00,Roberto Bautista Agut forced to abandon bachelor party plans amid Wimbledon winning streak
2019/07/11 0:00:00,"Beyonce, Blue Ivy stun in matching looks at Lion King premiere"
2019/07/11 0:00:00,"Girl, three, who drowned after falling off yacht in NSW identified"
2019/07/11 0:00:00,Welsh schools to let boys wear skirts and girls wear pants in gender neutral uniform shake-up
2019/07/11 0:00:00,State of Origin Game 3 live: NSW vs Queensland at ANZ Stadium
2019/07/11 0:00:00,Picture galleries: 50 more of the Territory’s cutest cats
2019/07/11 0:00:00,Royals spotted together on family day out in first public appearance for baby Archie
2019/07/11 0:00:00,The only way to go is up
2019/07/11 0:00:00,"Carlton: Surf’s up, so dive in"
