date,title
2019/07/24 0:00:00,"Abandoned baby left with note outside Orlando apartment, child services notified"
2019/07/24 0:00:00,How Boris Johnson’s affair with Petronella Wyatt nearly ended his career
2019/07/24 0:00:00,"‘Where’s my money, George?’ Unpaid staff turn up heat on Calombaris"
2019/07/24 0:00:00,Premier Steven Marshall rejects claims he called Labor MP Jayne Stinson a ‘nasty bitch’
2019/07/24 0:00:00,Sewage leak forces residents to evacuate Sydney apartment building
2019/07/24 0:00:00,Boeing reports record quarterly loss of $4.1 billion
2019/07/24 0:00:00,World Swimming Championships: Kyle Chalmers set to face off with Caeleb Dressel in speed battle
2019/07/24 0:00:00,"Dirty Melbourne beauty clinic a HIV threat, says health department"
2019/07/24 0:00:00,How Premier will celebrate her 50th
2019/07/24 0:00:00,David Seddon faces Wollongong Local Court charged with possessing child abuse material
2019/07/24 0:00:00,"McDonald’s customer fired gun inside restaurant because her fries were cold, owner says"
2019/07/24 0:00:00,The Bachelor’s Sam and Snezana welcome baby girl
2019/07/24 0:00:00,"Police dog Ice retires after seven years of service, alongside handler Sergeant Darryn Conroy"
2019/07/24 0:00:00,David Wenham opens up about SeaChange and heart-throb label
2019/07/24 0:00:00,Struggling Gold Coast Titans knocked back Wayne Bennett’s offer to be head coach
2019/07/24 0:00:00,Jeffrey Epstein’s alleged teen sex slave pictured on various holidays
2019/07/24 0:00:00,City of Sydney Council doubles number of rat baits as rodents overrun city
2019/07/24 0:00:00,"Raceday focus: Best bets, inside mail for Kembla Grange program"
2019/07/24 0:00:00,"Apprentice Tahlia Hope thanks family, hospital as she continues to make progress from illness"
2019/07/24 0:00:00,Melbourne mosque bombers jailed for Victorian terror attack
2019/07/24 0:00:00,Sun Yang and China got all the respect they deserve from Mack Horton at World Champs
2019/07/24 0:00:00,"Non-compliant gas hot water heater caused Heather Diane Pearce to die from carbon monoxide poisoning, inquest hears"
2019/07/24 0:00:00,"Dawn Fraser backs Mack Horton, calls out FINA, Sun Yang"
2019/07/24 0:00:00,"Aussie woman dies in Fiji, husband falls from balcony"
2019/07/24 0:00:00,Troubled Rio Circus allowed to reopen under restrictions after two accidents in four days at Adelaide event
2019/07/24 0:00:00,GPS RUGBY 2019: Nudgee College season on the brink at Suncorp
2019/07/24 0:00:00,What Australian politicians can learn from Boris Johnson
2019/07/24 0:00:00,NRL SuperCoach podcast: Pre-Lockout Round 19
2019/07/24 0:00:00,Kate Beckinsale shows off new blonde hair on Instagram
2019/07/24 0:00:00,"#MayPac2?: Manny Pacquiao smacks Floyd Mayweather, calls for rematch as feud gets fiery"
2019/07/24 0:00:00,Taika Waititi’s Hitler satire Jojo Rabbit drops first look trailer
2019/07/24 0:00:00,Two die from Listeria after eating smoked salmon
2019/07/24 0:00:00,Stunning designer home breaks an Abbotsford property record
2019/07/24 0:00:00,Historic Kyneton homestead one of the first built during gold rush
2019/07/24 0:00:00,Victorian dies after eating smoked salmon
2019/07/24 0:00:00,Sky light
2019/07/24 0:00:00,Norwood wine company slapped with huge fines for copyright infringement now faces being shut down by Penfolds
2019/07/24 0:00:00,Vaucluse Lighthouse Keepers Cottage gives buyers rare chance to own part of Sydney coastline
2019/07/24 0:00:00,Parliament descends into farce as government struggles to suspend Labor MP
2019/07/24 0:00:00,Em Rusciano talks about the moment she ‘snapped’ at a truck driver
2019/07/24 0:00:00,AFL 2019: Fremantle star Michael Walters reflects on Chris Yarran’s demise on Fox Footy’s On The Mark
2019/07/24 0:00:00,Qantas announces new direct flights from Brisbane to San Francisco and Chicago
2019/07/24 0:00:00,Ex-mayor Paul Pisasale jailed over extortion scam
2019/07/24 0:00:00,"Meghan Markle, Prince Harry anger fans over Prince George birthday wish"
2019/07/24 0:00:00,"Foxtel, Netflix deal will change the way we watch TV"
2019/07/24 0:00:00,Leafy estate in Dural sells to treechanger from the Inner West
2019/07/24 0:00:00,Raceday focus: Best bets for the Echuca card with Michael Manley
2019/07/24 0:00:00,Ben Stokes backs Kane Williamson for New Zealander of the Year
2019/07/24 0:00:00,Original Harris Park home fetches huge price at auction
2019/07/24 0:00:00,Clarkefield organic farm that appeared on The Intolerant Cooks goes to market
2019/07/24 0:00:00,SuperCoach AFL Captain’s Choice for Round 19
2019/07/24 0:00:00,Audi’s new stylish Q3 Sportback SUV revealed
2019/07/24 0:00:00,Apple poaches another executive from electric car maker Tesla
2019/07/24 0:00:00,Chelsea kinder supports family after the death of a young mum while giving birth
2019/07/24 0:00:00,Final cockpit footage of Boeing 737 crashing into a lagoon
2019/07/24 0:00:00,"Curtis Stone, Maggie Beer and Poh Ling Yeow among stars named as favourites to replace MasterChef judges"
2019/07/24 0:00:00,Port Adelaide fans can help Foodbank feed South Australians in need by donating on Saturday
2019/07/24 0:00:00,Margaret Fulton has died at the age of 94
2019/07/24 0:00:00,Depressing reality of swimming furore highlighted by 2012 Olympics report
2019/07/24 0:00:00,Rural property selling for first time has vast views
2019/07/24 0:00:00,New MP reveals cancer diagnosis in powerful maiden speech
2019/07/24 0:00:00,Baby-faced suspects in Canadian murders ‘trained in war and camouflage in the woods’
2019/07/24 0:00:00,Shane Warne reveals real secret behind 14kg weight loss
2019/07/24 0:00:00,Sabrina Lekaj worried about arguing with her father hours before her death
2019/07/24 0:00:00,The big mistake that’s costing Aussie savers and borrowers
2019/07/24 0:00:00,Victorian man who strangled his wife has been forgiven by the couple’s daughter
2019/07/24 0:00:00,Dad found not guilty of murder after stabbing son 76 times
2019/07/24 0:00:00,Manson murders: Why Roman Polanski thought Bruce Lee killed Sharon Tate
2019/07/24 0:00:00,True cost of MasterChef trio’s ‘arrogance’
2019/07/24 0:00:00,The Block’s 2020 season to feature homes from multiple decades and be filmed in Melbourne
2019/07/24 0:00:00,Jetstar launch return flights to Bali from $370 with free return
2019/07/24 0:00:00,Pacific Motorway crash closes two lanes and causes delays on the Gateway Motorway
2019/07/24 0:00:00,New Zealand bar owner tells couple to go to ‘gay bar’ if they want cocktails
2019/07/24 0:00:00,Brighton apartment record: huge penthouse seeks benchmark price
2019/07/24 0:00:00,Craig Kelly defies Scott Morrison’s warning to stop musing on policy in public
2019/07/24 0:00:00,Damien Fleming’s cheeky Ashes XI after Southampton slaughter
2019/07/24 0:00:00,"MasterChef trio plot their ‘risky’ new move after exiting show, with millions of dollars on the line"
2019/07/24 0:00:00,‘Keep your f***ing mouth shut’: How Magic Johnson ruined Lakers’ Kawhi Leonard hunt
2019/07/24 0:00:00,Woolworths’ Lion King Ooshies: Staff sell collectables on the side
2019/07/24 0:00:00,Bernard Tomic gets biggest win of 2019 after Wimbledon fine
2019/07/24 0:00:00,Panthers with money to splurge after James Maloney moves to France
2019/07/24 0:00:00,"Foxtel launches Netflix integration, new user interface"
2019/07/24 0:00:00,‘I’d do it again if I could’: Tourists’ defiant Uluru comments
2019/07/24 0:00:00,Labour of love: MP Amanda Rishworth gives birth to second son
2019/07/24 0:00:00,Grandad refuses to pay ‘unfair’ ticket imposed by ‘bully’ council
2019/07/24 0:00:00,Bec Judd reveals the two-hour workout behind her bikini body
2019/07/24 0:00:00,Politician cries over ‘deepfake’ gay sex video
2019/07/24 0:00:00,Mum charged with murder after dropping her baby on his head in a carpark
2019/07/24 0:00:00,‘I guess celebrities can park wherever they want?’: Kylie Jenner slammed over Instagram post
2019/07/24 0:00:00,"Childcare centre, community hub evacuated after smell of kerosene detected"
2019/07/24 0:00:00,Man discovers untouched In-N-Out burger on New York street
2019/07/24 0:00:00,Foxtel will partner with Netflix to deliver pay-TV and streaming from one device in major TV ‘shake-up’
2019/07/24 0:00:00,David Spade rocked by string of deaths
2019/07/24 0:00:00,NRL star Jack de Belin committed for sexual assault trial
2019/07/24 0:00:00,Alton Towers Smiler ride breaks down with people left hanging 30 metres in the air for 20 minutes
2019/07/24 0:00:00,Arnott’s gobbled up in $3.14 billion sale
2019/07/24 0:00:00,Julie Bishop warns it would be a ‘huge mistake’ to underestimate Boris Johnson
2019/07/24 0:00:00,Star dropped a bombshell on Britney Spears during infamous wedding night
2019/07/24 0:00:00,Eoin Morgan photo has cricket world in a spin
2019/07/24 0:00:00,Staff member spectacularly quits job and slams ‘morally bankrupt’ boss on Twitter
2019/07/24 0:00:00,Apple to release three new ‘iPhone 11’ models in September
2019/07/24 0:00:00,Northlane’s Marcus Bridge opens up about being the child of addicts and how he found escape in music
2019/07/24 0:00:00,"Coles, Woolworths and Aldi shift away from discounting in favour of bottom-line boost"
2019/07/24 0:00:00,Ballarat house: former pub with period details and large cellar hits the market
2019/07/24 0:00:00,Ex Observatory and Space Science Centre on the market in Bucketty
2019/07/24 0:00:00,Cristiano Ronaldo has bizarre brain fart after pitch invader
2019/07/24 0:00:00,Utah couple visiting Mexico fatally shot execution-style after failing to stop at checkpoint
2019/07/24 0:00:00,Studs Up: Why football fans can be excited about the upcoming A-League season
2019/07/24 0:00:00,Wind up
2019/07/24 0:00:00,Woman smashes man with laptop during violent argument on aeroplane: ‘Just take her off the plane!’
2019/07/24 0:00:00,"Murder houses of Jayme Closs, Charles Manson for sale"
2019/07/24 0:00:00,BHP boss warns of climate change risks and ‘mass extinctions’
2019/07/24 0:00:00,Russian activist murdered after details shared website encouraging ‘hunting’ of gay people
2019/07/24 0:00:00,Off-market deal done for Quiksilver’s Asia-Pacific distribution centre at North Geelong
2019/07/24 0:00:00,Film producer Bruna Papandrea buys in Coogee’s Pinnacle as penthouse hits the market
2019/07/24 0:00:00,"Cyclist hit and killed at Taylors Lakes, motorist now assisting police"
2019/07/24 0:00:00,Cops release images of three men in relation to alleged indecent assaults on Sydney public transport
2019/07/24 0:00:00,‘Complete scumbags’ laying dangerous booby traps in national parks
2019/07/24 0:00:00,Woman wearing low-cut body shirt kicked off flight
2019/07/24 0:00:00,Robin Williams’ son opens up on star’s struggles
2019/07/24 0:00:00,Zion Williamson signs second-richest rookie shoe contract in NBA history
2019/07/24 0:00:00,Former Channel 7 media executive arrested over alleged $8 million fraud
2019/07/24 0:00:00,Man charged after allegedly transporting more than $200m of ice
2019/07/24 0:00:00,Brisbane mum discovers a printed letter with a $5 note inside a box of nappies
2019/07/24 0:00:00,World reacts to latest Sun Yang protest at swimming world championships
2019/07/24 0:00:00,Queensland Origin flyer Dane Gagai denies he’s planning to quit South Sydney
2019/07/24 0:00:00,Stone Cold Steve Austin thrills WWE fans at Raw Reunion
2019/07/24 0:00:00,‘I earn $150k but my parents still pay most of my expenses’
2019/07/24 0:00:00,Brit model on the run in Bali now selling porn pics and videos to fund luxury fugitive lifestyle
2019/07/24 0:00:00,NSW couple left out of pocket after tradies botched renovations — twice
2019/07/24 0:00:00,"Health Minister Greg Hunt rejects ‘dangerous’ pill testing, backs Tasmanian Government stance"
2019/07/24 0:00:00,Facebook leader Sheryl Sandberg finds love again
2019/07/24 0:00:00,Rare footage of Amazon tribe emerges as loggers threaten their survival
2019/07/24 0:00:00,All the NBA stars bailing on Team USA — and who’s left
2019/07/24 0:00:00,Aussie stuns le Tour to cement title of ‘fastest man in the world’
2019/07/24 0:00:00,How the Mueller testimony is expected to go down
2019/07/24 0:00:00,Matt Preston’s ominous final interview before quitting MasterChef
2019/07/24 0:00:00,South Korea fires hundreds of warning shots at Russian jets
2019/07/24 0:00:00,Australian islands for sale that are cheaper than a house
2019/07/24 0:00:00,Batsmen flop on dramatic day of Australia’s Ashes preparations
2019/07/24 0:00:00,Boris Johnson wins Conservative party ballot to become Britain’s Prime Minister
2019/07/24 0:00:00,"James Weir recaps the Michelin-starred crap sandwich being force fed to MasterChef’s George, Matt and Gary"
2019/07/24 0:00:00,Sun Yang wins 200m freestyle at World Champs as rival Duncan Scott launches another podium protest
2019/07/24 0:00:00,Kim Kardashian slams former personal photographer amid shock allegations
2019/07/24 0:00:00,Police search for man aged in 60s acting in indecent manner in Adelaide's north
2019/07/24 0:00:00,Hyundai reveals secret weapon to take on Toyota
2019/07/24 0:00:00,Roderick Deakin-White faces Old Bailey court after allegedly killing partner Amy Parsons
2019/07/24 0:00:00,Boxer Maxim Dadashev dead at 28 because of injuries suffered in fight
2019/07/24 0:00:00,MasterChef finale 2019: Larissa crowned youngest ever winner
2019/07/24 0:00:00,Kim Jong-un conducts inspections of North Korean weapons as Chinese sanctioned for arms dealing
2019/07/24 0:00:00,"Teens initially believed missing are suspects in Canadian highway murders, police confirm"
2019/07/24 0:00:00,Sydney day care children sent home ‘immediately’ over discovery of highly toxic substance on site
2019/07/24 0:00:00,New York is the latest state to criminalise ‘sextortion’ in the US
2019/07/24 0:00:00,Ashley Benson shows off her tattoo of Cara Delevingne’s initials
2019/07/24 0:00:00,Fellow classmate has been arrested in the brutal shooting of Ally Kostial
2019/07/24 0:00:00,Liquid ice worth more than $1 million was found in snow globes shipped from Canada
2019/07/24 0:00:00,The International Monetary Fund forecasts sluggish global economy
2019/07/24 0:00:00,The SA suburbs where renters can’t find a home
2019/07/24 0:00:00,"Australian man, 63, held in Nepal over child abuse"
2019/07/24 0:00:00,Aussie drug accused pair turn Bali informants
2019/07/24 0:00:00,Treetop Le Maistre design in premium riverside precinct sells to near neighbours
2019/07/24 0:00:00,Worst house in Marrickville street sells after incredible auction
