date,title
2019/11/02 0:00:00,Democracy protesters have defied authorities again
2019/11/02 0:00:00,"Melbourne Victory makes hot start, collapses to lose 3-2 to Western United"
2019/11/02 0:00:00,How to become fit and healthy using your mobile phone
2019/11/02 0:00:00,Prince Harry spotted at Rugby World Cup final
2019/11/02 0:00:00,TAB’s punting guru Nick Quinn breaks down how to place a bet on the Melbourne Cup
2019/11/02 0:00:00,Instagram star Celeste Barber: ‘I had no intention of becoming famous’
2019/11/02 0:00:00,How to pick a Melbourne Cup winner
2019/11/02 0:00:00,Melbourne United defeats South East Melbourne Phoenix in Throwdown 2
2019/11/02 0:00:00,"‘I had a bit of a Younger moment’: Australian author Jane Cockram on her debut novel, The House of Brides"
2019/11/02 0:00:00,Lifeline training locals to help NSW drought towns in crisis
2019/11/02 0:00:00,Danny O’Brien confident Vow And Declare can repel Melbourne Cup’s 11 international challengers
2019/11/02 0:00:00,Forgotten paceman claims astonishing figures in Sheffield Shield
2019/11/02 0:00:00,Former Blanchetown ghost haunt an arresting opportunity for buyers
2019/11/02 0:00:00,$15 million colt Exceedance franks his stud potential with electrifying win in the Coolmore Stakes
2019/11/02 0:00:00,Adelaide trainers Richard and Chantelle Jolly add to owner Neville Morgan’s huge day with a double
2019/11/02 0:00:00,Rugby World Cup Final 2019 | England Vs South Africa
2019/11/02 0:00:00,City Ford dealer principal Mark Janus selling Riverview family home
2019/11/02 0:00:00,Olympian Genevieve Gregson takes out the 5km Bolt at the Noosa Triathlon Festival
2019/11/02 0:00:00,Redzel Stakes: Tommy Berry’s faith in Pierata rewarded
2019/11/02 0:00:00,Queenslanders vow to surprise Melbourne Cup rivals
2019/11/02 0:00:00,Kieran Foran suffers shoulder injury during international return
2019/11/02 0:00:00,"Golden Eagle 2019: Chris Waller, Glen Boss add to spring riches with Kolding"
2019/11/02 0:00:00,Tonga defeats Australia in stunning upset at Eden Park
2019/11/02 0:00:00,Huge result and hugs galore as Melbourne couple win the keys at Point Lonsdale auction
2019/11/02 0:00:00,Channel 10’s coverage of Derby Day cops heat on social media
2019/11/02 0:00:00,Barry ‘Noodles’ Hall hits back in fiery Instagram video
2019/11/02 0:00:00,Richmond auction: townhouse with rooftop tub cleans up
2019/11/02 0:00:00,Kia Cerato Sport Plus looks and drives better than price indicates
2019/11/02 0:00:00,Melbourne Cup: Glen Boss on how to win the big race
2019/11/02 0:00:00,‘Stands mostly empty’: incessant rain mars Derby Day
2019/11/02 0:00:00,Windsors at war: Hidden truth behind Meghan Markle’s new interview
2019/11/02 0:00:00,World Cup final: South Africa stun England to ruin Eddie Jones' World Cup dream
2019/11/02 0:00:00,Melbourne Cup 2019: Ray Thomas analyses the key lead-up races to this year’s big race
2019/11/02 0:00:00,"First homebuyers, families and downsizers battle it out at North Narrabeen auction"
2019/11/02 0:00:00,Death of Simi: The terrifying story of Simone Loretta Schmidl’s murder
2019/11/02 0:00:00,The one thing Martha Kalifatidis won’t post on Instagram
2019/11/02 0:00:00,Prince Charles’ huge fear over new season of The Crown
2019/11/02 0:00:00,Determined first time bidder wins her dream home in Mosman
2019/11/02 0:00:00,AFP boss promise comes true over operation transparency
2019/11/02 0:00:00,Hawthorn auction: $1m renovation helps Victorian bolt past reserve
2019/11/02 0:00:00,Downdraft wins Hotham Stakes in impressive style to shorten for Melbourne Cup
2019/11/02 0:00:00,Raceday focus: Best bets and inside mail for Goulburn and Muswellbrook
2019/11/02 0:00:00,Scorsese shows why he’s king of the mob movie
2019/11/02 0:00:00,Seize the day: Wayne Bennett dangles World Cup carrot in front of Jackson Hastings
2019/11/02 0:00:00,‘Enormous progress’ on China trade deal: US
2019/11/02 0:00:00,Melbourne buyers quick to act on traditional beach shack at St Leonards
2019/11/02 0:00:00,Results of the Victoria Derby at Flemington
2019/11/02 0:00:00,Rage Against The Machine announce 2020 reunion tour
2019/11/02 0:00:00,Shark sighted at Binalong Bay
2019/11/02 0:00:00,Desperate tourists flock to tragic Thai cave where boys were trapped
2019/11/02 0:00:00,Melbourne Cup 2019: Favourites draw well for Group 1 feature at Flemington
2019/11/02 0:00:00,German couple sue TUI Cruises after being kicked off a two-week cruise on the first day
2019/11/02 0:00:00,Fears mounting for missing hiker Niels Becker after no contact for a week
2019/11/02 0:00:00,No sour grapes from Sunlight's connections after going close in Golden Eagle
2019/11/02 0:00:00,Pink’s shock drug revelation about first-ever music video
2019/11/02 0:00:00,Cathay Pacific: How Hong Kong protests have grounded the country’s flagship carrier
2019/11/02 0:00:00,Rain overnight has helped dampen Tasmanian bushfires
2019/11/02 0:00:00,"Laura Hurst fatally strangled by reticulated python in Oxford, Indiana"
2019/11/02 0:00:00,F1 drivers react to big issues with the track ahead of US Grand Prix
2019/11/02 0:00:00,Joeys beat FIFA Under 17 powerhouse Nigeria to secure World Cup Round of 16 berth
2019/11/02 0:00:00,Linda Hamilton does all the heavy lifting in Terminator: Dark Fate
2019/11/02 0:00:00,The Gurdies quirky home: outback-inspired house up for sale
2019/11/02 0:00:00,McDonald’s Portugal has apologised for insensitive ‘Sundae Bloody Sundae’ ads
2019/11/02 0:00:00,Aussie tennis coach labels Simona Halep a ‘disgrace’ in angry on-court spray
2019/11/02 0:00:00,Steve Waugh says the time is right for Nic Maddinson’s return to international cricket
2019/11/02 0:00:00,Sydney man in Bali lockup after assaulting hotel staff in drunken ‘rampage’
2019/11/02 0:00:00,Derby Day fashion 2019: All the hot looks and frock shocks
2019/11/02 0:00:00,Golden State Warriors will have to do without superstar guard Stephen Curry until February
2019/11/02 0:00:00,Man struck by own car during bushland rescue
2019/11/02 0:00:00,Martin Boyle’s back: Socceroo’s year from injury hell has fairytale ending
2019/11/02 0:00:00,Controversy surrounds Kelvin Gastelum after UFC 244 weigh-in drama
2019/11/02 0:00:00,"Cody Simpson, Miley Cyrus passionately kiss in Halloween costumes"
2019/11/02 0:00:00,Brighton beach box record price: Buyer swoops for quick sale
2019/11/02 0:00:00,First-home buyers to take advantage of new government scheme in 2020
2019/11/02 0:00:00,Meghan Markle visits bakery for disadvantaged women
2019/11/02 0:00:00,Police under investigation after shooting man dead on NSW Central Coast
2019/11/02 0:00:00,Blind ambition: how to dress your windows
2019/11/02 0:00:00,Can an electric car work as a family car in Australia?
2019/11/02 0:00:00,Australia’s favourite vehicle reviewed
2019/11/02 0:00:00,George Bailey up his old tricks as Tasmania dominates Victoria in Sheffield Shield clash
2019/11/02 0:00:00,Five ways to make your new build eco-smart
2019/11/02 0:00:00,First look inside Jetstar’s Airbus A321neos
2019/11/02 0:00:00,Backyard blitz: ‘Upyards’ the new way of life for Brisbane
2019/11/02 0:00:00,Rugby World Cup 2019: Steve Hansen bows out as All Blacks coach in style with big win over Wales
2019/11/02 0:00:00,Inside America’s newest mega mall: ‘It’s the future’
2019/11/02 0:00:00,The dark side of reality television revealed after tragic deaths
2019/11/02 0:00:00,Second Northern Irish man facing manslaughter charges over truck deaths
2019/11/02 0:00:00,Cheap and cheerful: How avoid a hangover in your hip pocket
2019/11/02 0:00:00,Aboriginal Athletics Squad at the Port Adelaide Athletics Club wins Woolworths Sports in the Community Award at SA Community Achievement Awards
2019/11/02 0:00:00,Live large in a stunning Linden Park property fine-tuned for contemporary living
2019/11/02 0:00:00,"Four people dead in Halloween shooting in Orinda, California"
2019/11/02 0:00:00,First-home buyer loan deposit scheme makes western Sydney a hot spot
2019/11/02 0:00:00,"Private, peaceful Huon lifestyle home with a pool, gym and hot tub"
2019/11/02 0:00:00,World-class Clontarf estate sells for highest price this year
2019/11/02 0:00:00,Residential buyers lead interest in Geelong Orphan Asylum and Common School ahead of auctions
