date,title
2019/09/01 0:00:00,Mick Schumacher hugs F2 driver Anthoine Hubert’s family after tragic death
2019/09/01 0:00:00,Pope Francis gets stuck in a lift on his way to service
2019/09/01 0:00:00,"Raceday focus: Best bets, inside mail for Wellington and Kempsey"
2019/09/01 0:00:00,Water cannon trucks deployed in Hong Kong as demonstrators clash with police
2019/09/01 0:00:00,Germany snubs Poland’s call for World War II reparations on 80th anniversary
2019/09/01 0:00:00,Adelaide sister suburbs that could save you thousands
2019/09/01 0:00:00,Woman dies after being hit by car at Prospect
2019/09/01 0:00:00,"The Block: Week 4, main bathroom reveal"
2019/09/01 0:00:00,Tigers out to end horror record in season finales against Sharks
2019/09/01 0:00:00,Diners left on street after being served 86 drinks at Sydney restaurant
2019/09/01 0:00:00,Juggling school and work delivers some valuable financial lessons
2019/09/01 0:00:00,Nude photos that forced palace to impose media blackout
2019/09/01 0:00:00,UK Labour Party to seek Brexit extension in Parliament
2019/09/01 0:00:00,Flying instructor blacks out during lesson
2019/09/01 0:00:00,’I put a ring on it’: Former Bachelorette Georgia Love engaged to boyfriend Lee Elliott
2019/09/01 0:00:00,Dutton lashes out at ‘disgusting’ criticism over Tamil asylum family secretly flown to Christmas Island
2019/09/01 0:00:00,"I thought I was too smart for this ‘scam’, but I had no idea I’d already been stung"
2019/09/01 0:00:00,Pia Miranda on adjusting to normal life after Australian Survivor
2019/09/01 0:00:00,"Kayo Sports reports record online audiences, as Aussies embrace multiple streaming TV services"
2019/09/01 0:00:00,"Police ask public for CCTV, dashcam or mobile footage of incident at Golden Grove"
2019/09/01 0:00:00,Melbourne Vixens steamroll rivals Magpies in sudden-death semi final to keep their title hopes alive
2019/09/01 0:00:00,Adelaide protest against Tamil asylum seeker family deportation
2019/09/01 0:00:00,Rugby World Cup 2019 Countdown: Spotlight on Ireland
2019/09/01 0:00:00,Texas shooting: High school student among seven dead
2019/09/01 0:00:00,Canberra win golden point thriller against Cronulla to seal NRL top four spot
2019/09/01 0:00:00,"The best time to sell your house, according to the universe"
2019/09/01 0:00:00,Melbourne rally calls for government to let Tamil asylum seekers stay
2019/09/01 0:00:00,Six-year-old Bahni having a blast as she picks up a cricket bat for the first time
2019/09/01 0:00:00,Building manager arrested after police discover elaborate underground cave
2019/09/01 0:00:00,"Woman spills on Wayne Rooney’s big night out in Vancouver, Canada"
2019/09/01 0:00:00,Reporters evacuated on live TV as active shooter shot at random
2019/09/01 0:00:00,Brad Fittler touts new home for Sharks as ARLC claims ‘no club will be forced to move’
2019/09/01 0:00:00,Children’s book author Samone Bos lists modernist Parkdale pad
2019/09/01 0:00:00,Thomas Markle Sr slams ‘hypocrites’ Meghan and Harry for cutting him out of Archie’s life
2019/09/01 0:00:00,NRL threatens to strip Manly of home final after fan attack
2019/09/01 0:00:00,Royal Adelaide Show flags fly at half-mast after woodchopping tragedy
2019/09/01 0:00:00,Iconic waterfront address The Boatshed at Woronora hits the market
2019/09/01 0:00:00,Man taken to hospital with stab wounds suffered during an alleged robbery at Christie Downs
2019/09/01 0:00:00,Drunk man tows on-fire trailer for 2km in Parafield Gardens
2019/09/01 0:00:00,"US Open: Andrey Rublev defeats Nick Kyrgios 7-6, 7-6, 6-3"
2019/09/01 0:00:00,Toorak mansion has spectacular extension on edge of Yarra River
2019/09/01 0:00:00,"Naomi Osaka defeats Coco Gauff, two share post-game interview"
2019/09/01 0:00:00,Brisbane to get second NRL team at the cost of another club
2019/09/01 0:00:00,"Camberwell, Box Hill North auctions: ‘berserk’ bidding in full bloom"
2019/09/01 0:00:00,Vasyl Lomachenko defeats Luke Campbell in thrilling London battle
2019/09/01 0:00:00,US Open: Rafael Nadal dominates Chung Hyeon in third round
2019/09/01 0:00:00,"Two men confirmed dead after boat flips on Wuruma Dam, QLD"
2019/09/01 0:00:00,Clifton Hill factory linked to WWI Battle of Beersheba for sale
2019/09/01 0:00:00,Ex-Murray Bridge jockey dies in NT race tragedy
2019/09/01 0:00:00,Tips for buying at auction in spring
2019/09/01 0:00:00,Suburbs with best home deals follow path of Western Sydney transport links
2019/09/01 0:00:00,The big commitment creating conflict for couples
2019/09/01 0:00:00,Valentine Holmes waived by New York Jets as 53-man roster named
2019/09/01 0:00:00,Isuzu teaches you how to be a weekend warrior
2019/09/01 0:00:00,Lexus RC350 review: Save thousands as luxury features come standard
2019/09/01 0:00:00,Taylor Townsend is making waves at the US Open
2019/09/01 0:00:00,Pack up your pencils and head back to school in Saddleworth
2019/09/01 0:00:00,Matt Tilley shares the stories behind some of his favourites
2019/09/01 0:00:00,Charles Leclerc secures pole position for Belgian Grand Prix as Ferrari dominate F1 qualifying
2019/09/01 0:00:00,"At least 10 people stabbed by two men in Villeurbanne, France"
2019/09/01 0:00:00,"The British singer has married her art dealer partner in York, England"
2019/09/01 0:00:00,Miley Cyrus and Liam Hemsworth may finalise their divorce sooner than expected
2019/09/01 0:00:00,"Formula 2 driver Anthoine Hubert, 22, dies after horror crash"
2019/09/01 0:00:00,Australia faces selection dilemma ahead of fourth Ashes Test in Manchester
2019/09/01 0:00:00,Reaction to Michael Zerafa’s shock win over Jeff Horn in Bendigo
2019/09/01 0:00:00,Princess Diana’s brother Lord Spencer is selling copies of the eulogy he read at her funeral
2019/09/01 0:00:00,"Peace and privacy in this Hills home for all seasons at 159 Crossing Rd, Mylor"
2019/09/01 0:00:00,"William, Harry puts aside feud to remember their mum with Kate and Meghan"
2019/09/01 0:00:00,Downsizing: Couple benefit from move to country town
2019/09/01 0:00:00,Sweet dreams of made of this
2019/09/01 0:00:00,Helping hand after Navy dad killed in motorbike crash
