date,title
2019/04/29 0:00:00,‘Worst format’: Viewers slam Channel 7 over ‘frustrating’ debate
2019/04/29 0:00:00,‘Charlatan and wages thief’: Clive Palmer slammed on Q&A
2019/04/29 0:00:00,"Voting in the 2019 election is compulsory, and complicated. Here’s a guide"
2019/04/29 0:00:00,New $13m medical aircraft arrives in Adelaide for Royal Flying Doctor Service
2019/04/29 0:00:00,‘He doesn’t look happy’: Buzz responds to Maloney’s Twitter spray
2019/04/29 0:00:00,"Meghan and Harry’s $12,800 wedding gift to Idris Elba and model wife Sabrina Dhowre"
2019/04/29 0:00:00,Fiery response to David King’s ‘ludicrous’ North Melbourne spray
2019/04/29 0:00:00,Adelaide Liberal candidate Shaun Osborn suffers second gaffe with his name misspelt on flyer
2019/04/29 0:00:00,MAFS star Mike Gunner debuts new romance
2019/04/29 0:00:00,Clint Gutherson could leave Parramatta to return to Manly Sea Eagles
2019/04/29 0:00:00,New Aussie NFL punter Mitch Wishnowsky conference opponents with Pro Bowl Aussie Michael Dickson
2019/04/29 0:00:00,Alex Hales dropped from England following off-field drama
2019/04/29 0:00:00,‘I wash my hair in rainwater and our only neighbours are kangaroos’: Family’s off-grid life in outback
2019/04/29 0:00:00,Scott Morrison and Bill Shorten go head-to-head in first leaders’ debate
2019/04/29 0:00:00,Springboks star Francois Hougaard opens up about being linked to Reeva Steenkamp’s death
2019/04/29 0:00:00,"Car hits fence, house before driver flees at Smithfield Plains"
2019/04/29 0:00:00,GoT showdown between Daenerys and Cersei teased in trailer
2019/04/29 0:00:00,Avengers Endgame: What happened to Loki?
2019/04/29 0:00:00,Criminal profiler believes Sarah Ristevski under killer dad’s ‘spell’
2019/04/29 0:00:00,Here’s a waterfront beauty you can lock up and leave
2019/04/29 0:00:00,NRL 2019 | New Zealand Warriors should have been awarded a penalty
2019/04/29 0:00:00,How NSW Blues and Queensland Maroons incumbents are tracking for Game I of 2019 State of Origin series
2019/04/29 0:00:00,Fast fashion retailer Forever21 has copped criticism for a controversial post on Instagram
2019/04/29 0:00:00,James Weir recaps day 19 of the campaign
2019/04/29 0:00:00,SES warns people to clear drainpipes before rain to avoid flooding
2019/04/29 0:00:00,Daly Cherry-Evans sidelined with ankle injury
2019/04/29 0:00:00,What’s next for Marvel after Avengers: Endgame?
2019/04/29 0:00:00,Woman trolled over allergic reaction to Aldi chocolate
2019/04/29 0:00:00,"Meghan Markle’s due date was Sunday, UK reports claim"
2019/04/29 0:00:00,Les Murray dead: Australian poet dies aged 80
2019/04/29 0:00:00,Brisbane’s best vegetarian restaurant: Courier-Mail poll to determine the city’s best
2019/04/29 0:00:00,"Raceday focus: Best bets, inside mail for Kembla Grange and Taree"
2019/04/29 0:00:00,Property taxes hit record levels
2019/04/29 0:00:00,One of the biggest scams catching out unsuspecting Australians
2019/04/29 0:00:00,Apple defends crackdown on parental control apps that fight iPhone addiction
2019/04/29 0:00:00,The hard skills you need to become a manager
2019/04/29 0:00:00,Futurist Anders Sorman-Nilsson buys Great Mackerel Beach weekender
2019/04/29 0:00:00,Socialite Lady Victoria Hervey’s shockingly skimpy swimsuit
2019/04/29 0:00:00,Enjoy city-fringe living in this updated Unley character home
2019/04/29 0:00:00,Questions raised over 19 of Clive Palmer’s United Australia Party candidates
2019/04/29 0:00:00,"Jaime Osuna, serving life sentence in California for murder, ‘beheaded another inmate’"
2019/04/29 0:00:00,Doctors believe a birth defect caused the death of model Tales Soares
2019/04/29 0:00:00,"Sunlight ruled out of Sangster Stakes, with trainer Tony McEvoy setting course for The Everest"
2019/04/29 0:00:00,‘You have to protect yourself’: The sad origin of Wiggles iconic move
2019/04/29 0:00:00,Rolled rubbish truck causing huge delays after spilling debris onto highway
2019/04/29 0:00:00,Remember the days of the old school yard
2019/04/29 0:00:00,Scammers call claiming to be scam-busters
2019/04/29 0:00:00,SANFL will launch its first inclusive football league in May with the aim of breaking down barries
2019/04/29 0:00:00,Thousands of lions are being bred in brutal ‘farms’ to be shot by hunters are slaughtered for Chinese medicine
2019/04/29 0:00:00,"Game of Thrones Season 8, Episode 3 recap: An epic battle but the tactics were shocking (and where was the Azor Ahai?)"
2019/04/29 0:00:00,Jaguar could pay you every time you drive your car
2019/04/29 0:00:00,Clive Palmer makes explosive claims contradicting Shorten’s staunch denials
2019/04/29 0:00:00,Out-to-town buyers secure slice of history in Geelong West
2019/04/29 0:00:00,Maria Folau’s conflicted past with gay teammate
2019/04/29 0:00:00,Margot Robbie stuns on red carpet in sheer jumpsuit
2019/04/29 0:00:00,State of Origin audition: Tevita Pangai Jr’s chance to impress in Blues bid
2019/04/29 0:00:00,Why the idea of alien life now seems inevitable and possibly imminent
2019/04/29 0:00:00,Loyal dog barks until rescuers find hiker who did not survive his last climb
2019/04/29 0:00:00,Backlash after Melbourne pub replaces playground with iPads
2019/04/29 0:00:00,Game of Thrones fans fume over ‘too dark’ episode
2019/04/29 0:00:00,Avengers: Endgame fan taken to hospital after crying during movie
2019/04/29 0:00:00,Tigers star Jack Riewoldt escalates Twitter war
2019/04/29 0:00:00,Former Paddington home of Michael Hutchence up for rent
2019/04/29 0:00:00,Amazon warehouse tracking system automatically sacks underperforming workers
2019/04/29 0:00:00,The common scam costing Australians millions of dollars
2019/04/29 0:00:00,"2019 Logie Awards: Where, when and who is nominated?"
2019/04/29 0:00:00,"Game of Thrones season 8, episode 3: Fans go wild over Arya moment"
2019/04/29 0:00:00,Prince Harry accused of cropping out elephant’s tethered leg in picture of Malawi visit to mark Earth Day
2019/04/29 0:00:00,Daniil Kvyat accepts Daniel Ricciardo’s apology but hits him with a brutal sledge
2019/04/29 0:00:00,Model savages ‘toxic’ detox teas promoted by celebs
2019/04/29 0:00:00,Couple allegedly blackmailed for $1000 after begging for return of phone with photos of dying baby
2019/04/29 0:00:00,‘Arse over tit’
2019/04/29 0:00:00,‘Eerily quiet’ auction market causes bidding battle for stock
2019/04/29 0:00:00,"Big Ben halted in his tracks, falls short of marathon record bid"
2019/04/29 0:00:00,LG’s C9 4K OLED TV is a smart buy for TV lovers who want premium picture quality
2019/04/29 0:00:00,Your bank account just got hacked — what do you do now?
2019/04/29 0:00:00,"James Dobbie, rapist and killer who fled Victoria after spate of horrific crimes, jailed for 31 years"
2019/04/29 0:00:00,Eerie past of London suburb where Australian woman allegedly murdered
2019/04/29 0:00:00,Baby killer Kathleen Folbigg testifies about her diaries
2019/04/29 0:00:00,Australian accent rated fifth ‘sexiest’ in the world in new list
2019/04/29 0:00:00,Melbourne CBD restaurant fire at corner of Russell and Bourke streets blankets city in smoke
2019/04/29 0:00:00,Anna Khramtsova wins National Guard beauty contest
2019/04/29 0:00:00,Michelangelo Rucci has started cooking another feast for 2019 and this week looks at the build-up to Showdowns
2019/04/29 0:00:00,Anglicare study finds 98 per cent of rental properties are out of reach of minimum wage workers
2019/04/29 0:00:00,Uber driver busted for drink driving while carrying passengers
2019/04/29 0:00:00,Monday Bunker: Bennett v Seibold in a Round 8 grudge match
2019/04/29 0:00:00,Buyers from waterfront precinct purchase close to home
2019/04/29 0:00:00,"Woman, 34, throws herself luxury divorce party after fighting for split for 15 years"
2019/04/29 0:00:00,Vic cold case killer and rapist jailed
2019/04/29 0:00:00,Broncos reportedly facing double-edged poaching raid
2019/04/29 0:00:00,Behind the romance between snooker champion Jimmy White and beauty queen Jade Slusarczyk
2019/04/29 0:00:00,Mum marches accused sex predator son into police station
2019/04/29 0:00:00,Having a beard and owning a compass seen as ‘extremist tendencies’ in China
2019/04/29 0:00:00,Horror hammer attack on teenager
2019/04/29 0:00:00,Why winter in Melbourne is actually the best
2019/04/29 0:00:00,Teenage L-plater accidentally runs over three-year-old boy in driveway
2019/04/29 0:00:00,Arnold Schwarzenegger beams as son Joseph Baena graduates from college
2019/04/29 0:00:00,Big Ben is a little too tall for his own good
2019/04/29 0:00:00,"New York Times apologises for ‘anti-Semitic’ portrayal of Trump, Netanyahu in cartoon"
2019/04/29 0:00:00,Economic growth a win for Donald Trump
2019/04/29 0:00:00,Sri Lanka bans clothing covering the face
2019/04/29 0:00:00,"‘Tremendous pain, suffering and trauma’: lovers’ lane car park killer, rapist jailed after anonymous tip"
2019/04/29 0:00:00,Personal trainer bans sister from family barbecue because she’s overweight
2019/04/29 0:00:00,Game of Thrones: Here’s everyone we lost in the Battle of Winterfell
2019/04/29 0:00:00,Why Halle Berry thought she’d be replaced in John Wick 3
2019/04/29 0:00:00,20 Indian students die by suicide after failing exams
2019/04/29 0:00:00,Elon Musk and Bill Gates took a personality test and each scored low in same category
2019/04/29 0:00:00,Study finds filthy ball pits filled with deadly bacteria
2019/04/29 0:00:00,"China’s quest for clean, limitless energy heats up"
2019/04/29 0:00:00,How an e-commerce retailer learned to ditch short term gains for a powerful marketing plan
2019/04/29 0:00:00,"Game of Thrones recap: Season eight, episode three"
2019/04/29 0:00:00,Chief sniper suing NSW Police over its handling of the Lindt Cafe siege
2019/04/29 0:00:00,‘Lego Masters’ a ratings smash for Nine as viewers rejoice
2019/04/29 0:00:00,Dry spell to end as Victoria farmers prepare for heavy rain
2019/04/29 0:00:00,AFL Briefs: Rocket comes clean over spray; Legend lashes Eagles; Ablett soars to new heights
2019/04/29 0:00:00,Saudi Arabia beheading so many prisoners it will need more executioners as kingdom tipped to set new slaughter record
2019/04/29 0:00:00,Pakistan quick Hasan Ali claims dubious catch against Kent
2019/04/29 0:00:00,Giants NFL Draft pick Corey Ballentine shot hours after selection
2019/04/29 0:00:00,Man charged after woman allegedly hit with galloping horse at anti-Adani protests
2019/04/29 0:00:00,Final pill testing trial at Canberra leg of Groovin the Moo reveals seven pills with deadly substance
2019/04/29 0:00:00,UK’s youngest EuroMillions winner now so ‘bored’ she wants a job
2019/04/29 0:00:00,Sydney buyers to create family home at abandoned Wamberal site
2019/04/29 0:00:00,"Clive Palmer’s explosive, rambling Today show appearance: ‘I don’t give a stuff about you’"
2019/04/29 0:00:00,Indian premier league: No ill effects from Steve Smith aerial show to remove David Warner
2019/04/29 0:00:00,Stikeez delivers Coles sales growth by driving ‘high customer engagement’
2019/04/29 0:00:00,Mr Brown can’t flush it down: Court orders New Zealand man to stop using his toilet
2019/04/29 0:00:00,New MG eZS review: China’s new electric SUV headed to Oz
2019/04/29 0:00:00,Hazard reduction burns lead smoke to settle across Sydney affecting air pollution
2019/04/29 0:00:00,"Tenille Favios flaunted a racy, two-piece swimsuit that was blocked by Channel 10"
2019/04/29 0:00:00,Several people have reportedly been shot outside a US church
2019/04/29 0:00:00,Runner collapses in distressing marathon finish
2019/04/29 0:00:00,Thousands stranded at airports after border force system fails
2019/04/29 0:00:00,My Kitchen Rules: Ibby and Romel thousands of dollars out of pocket
2019/04/29 0:00:00,Hawthorn responds to ‘disgusting’ cancer attack on star Jarryd Roughead
2019/04/29 0:00:00,Moving from Melbourne to East Geelong a no-brainer for buyers
2019/04/29 0:00:00,Melbourne Airport back up and running after national outage
2019/04/29 0:00:00,Julian Assange’s dad shocked by his son’s ‘rapid decline’
2019/04/29 0:00:00,Astonishing scenes as fair play takes priority over promotion
2019/04/29 0:00:00,Bachelor Matty J pops the question to Laura
2019/04/29 0:00:00,Panel van driver cops 33 demerit points as police find five unrestrained children in car
2019/04/29 0:00:00,Bach in Paradise star ‘ashamed’ as furious outburst horrifies viewers
2019/04/29 0:00:00,Leeds United and Aston Villa play out remarkable draw in spiteful showdown
2019/04/29 0:00:00,Tasmania Police search for missing boy Aiden Fry last seen in Launceston
2019/04/29 0:00:00,Major delays for Sydney train commuters caused by ‘external power failure’
2019/04/29 0:00:00,NFL draft pick shot as teammate dies
2019/04/29 0:00:00,Melbourne shootings: Eight men slain in eight weeks
2019/04/29 0:00:00,Avengers: Endgame obliterates box office records
2019/04/29 0:00:00,"Shania McNeill, 21, killed in head-on collision in Sydney"
2019/04/29 0:00:00,"Boston Celtics crush top-ranked Milwaukee, but lose Aron Baynes to injury"
2019/04/29 0:00:00,"NBA Playoffs: Warriors defeat Rockets, Celtics stun Milwaukee"
2019/04/29 0:00:00,Live the country life within 20 minutes of new train station
2019/04/29 0:00:00,"Two teens arrested over liquor store robbery in Adelaide's northeast, using a knife to stop security chasing them."
2019/04/29 0:00:00,Federal election 2019: Live on the campaign trail on Monday April 29
2019/04/29 0:00:00,"Father, brothers of alleged Sri Lanka bombing mastermind killed"
2019/04/29 0:00:00,Male model Tales Soares dies after collapsing on catwalk at Sao Paulo Fashion Week
2019/04/29 0:00:00,"‘Controlling’ Meghan Markle, Prince Harry conducting royal birth ‘in virtual secrecy’"
2019/04/29 0:00:00,Danger in paradise: ‘People are dying to go up there’
2019/04/29 0:00:00,RUSH HOUR: Anti-vaccination group mocked for embarrassing fail
2019/04/29 0:00:00,Massive inferno amid explosions near London’s Heathrow Airport
2019/04/29 0:00:00,"Manchester City move back to top of Premier League, United-Chelsea share the spoils"
2019/04/29 0:00:00,Glenelg South ticks many boxes for those chasing an active lifestyle
2019/04/29 0:00:00,Man shouting ‘Avengers: Endgame’ spoilers gets beating from furious fans
2019/04/29 0:00:00,Total transformation: The home reno you have to see to believe
2019/04/29 0:00:00,"Drones banned from going near Meghan and Harry’s home, as baby nears"
2019/04/29 0:00:00,Parrot seized by cops for warning druggie owner about raid
2019/04/29 0:00:00,F1 Azerbaijan Grand Prix | Daniel Ricciardo’s bizarre retirement at Baku
2019/04/29 0:00:00,Donald Trump slams Democrats over ‘Disneyland’ border
2019/04/29 0:00:00,Hero killed in synagogue shooting took bullet to save her rabbi’s life
2019/04/29 0:00:00,AnglicareSA releases rental affordability snapshot which reveals ‘crisis’ for single parents and people on income support
2019/04/29 0:00:00,‘Bad omen’ sends Daniel Ricciardo to hell in Azerbaijan
2019/04/29 0:00:00,Half of tested properties contain traces of meth
2019/04/29 0:00:00,Views that need to be seen to be believed
2019/04/29 0:00:00,The family favourite property in a beaches’ suburb full of youngsters
