date,title
2019/06/21 0:00:00,Andy Murray rejected for Wimbledon doubles by Australian stars Ash Barty and Nick Kyrgios
2019/06/21 0:00:00,Nando’s chicken billionaire Richard ‘Dick’ Enthoven sells Point Piper waterfront for $21.8m as $9.5m Dover Heights clifftop home sells
2019/06/21 0:00:00,New book paints Kim Jong-un as tiny dictator who bossed staff around as a six-year-old
2019/06/21 0:00:00,Adelaide leads price growth charge
2019/06/21 0:00:00,NSW win back-to-back Women’s State of Origin shields over Queensland in front of big crowd
2019/06/21 0:00:00,"Lance Franklin injures hamstring in Sydney win over Hawthorn, crowd crackdown continues"
2019/06/21 0:00:00,Brisbane weather: High tides mark winter solstice weekend
2019/06/21 0:00:00,Food blogger Ellen Erhardt-Smith swallows loss in Point Piper as rich-lister Steve Duchen finally sells in Darling Point
2019/06/21 0:00:00,Weekend washout: Torrential rain to follow shortest day of year as frost and bitter winds signal winter’s arrival
2019/06/21 0:00:00,Former Miss Universe Australia stranded in Bali because of damp passport
2019/06/21 0:00:00,Model faked depression to get a taxpayer-funded nose job
2019/06/21 0:00:00,Daniel Ricciardo said Renault performances have ‘ignited a pretty nice fire’ in the garage
2019/06/21 0:00:00,Vigilante mob rips off accused child rapist’s testicles
2019/06/21 0:00:00,AFL teams: See all the ins and outs for Round 14
2019/06/21 0:00:00,New FFA technical director Rob Sherman out to reboot stagnant youth development scheme
2019/06/21 0:00:00,Dad wrote of embracing ‘darkness and animal instincts’ before killing family
2019/06/21 0:00:00,James Weir on the next big true crime podcast series we'll be obsessed with
2019/06/21 0:00:00,$1.6m home a dream bargain for just $100
2019/06/21 0:00:00,Anti-Adani rally brings traffic to a halt in Melbourne CBD
2019/06/21 0:00:00,Brisbane traffic: Traffic cleared after crash blocks Gateway Motorway lane
2019/06/21 0:00:00,Kate Middleton ‘is totally different to opinionated Meghan Markle’
2019/06/21 0:00:00,‘Jealous bridesmaids ruined my wedding — and our friendship’
2019/06/21 0:00:00,Why winter could be the right time to buy an island weekender
2019/06/21 0:00:00,Duo from Adelaide’s southwest suburbs take venomous snakes for walkies
2019/06/21 0:00:00,Justin Bieber has agreed to fight Tom Cruise in a UFC showdown — and Dana White is on board
2019/06/21 0:00:00,"A Seaton property offers stylish, low maintenance living"
2019/06/21 0:00:00,Five words that prove Israel Folau is clueless
2019/06/21 0:00:00,"After a slow start, Brock Ryan is making a splash in the apprentice jockey ranks"
2019/06/21 0:00:00,"Inside Maboneng, the neighbourhood that went from super dangerous to seriously cool"
2019/06/21 0:00:00,Beaufort Street
2019/06/21 0:00:00,Australia’s best performing suburbs over the last year as mining towns jump in value
2019/06/21 0:00:00,Time capsule home is state’s most popular ahead of auction day
2019/06/21 0:00:00,The amazing and sad true story behind an iconic Australian invention
2019/06/21 0:00:00,Melbourne Vixens defender Jo Weston ready to kickstart her first Netball World Cup campaign
2019/06/21 0:00:00,A new Monopoly banker will eliminate cheating from the game for good
2019/06/21 0:00:00,Tenants from Mascot Towers ‘insulted’ by lack of information as process traps them in lease
2019/06/21 0:00:00,Crash Bandicoot is back almost 20 years after the original
2019/06/21 0:00:00,Luxury acreage is a 15 minute drive from Castle Hill
2019/06/21 0:00:00,Former professional footballer Craig Wing launches property career
2019/06/21 0:00:00,"Toyota puts the brakes on sales of some Corollas, RAV4s and Camrys"
2019/06/21 0:00:00,Overweight woman left bruised and in tears after Air NZ flight
2019/06/21 0:00:00,Kia joins baby SUV craze with compact Seltos crossover
2019/06/21 0:00:00,Landlord threatens to evict tenant over pet duck called Primadonna
2019/06/21 0:00:00,Kingsford land owners band together to capitalise on light rail and student housing demand
2019/06/21 0:00:00,Report uncovers millionaire philanthropists’ mysterious anti-vax ties
2019/06/21 0:00:00,‘I cried a lot of tears’: Fiona Falkiner on the moment her heart froze
2019/06/21 0:00:00,Georges Yousseff Geagea sentenced after fatal hit and run
2019/06/21 0:00:00,How the Strait of Hormuz became the flashpoint for a looming global crisis
2019/06/21 0:00:00,MAFS’ Elizabeth Sobinoff reveals ‘toxic’ secret to her stunning weight loss
2019/06/21 0:00:00,How I made more than $50k by renting out my campervan
2019/06/21 0:00:00,Shameful reality of Australian cricket snub revealed in Bangladesh battle
2019/06/21 0:00:00,eBay is offering 30 per cent off the new Dyson V11 vacuum
2019/06/21 0:00:00,Cath’s Village helping put smiles on faces of MND warrior Cathy Baker and friends in fight to find cure
2019/06/21 0:00:00,Little boy writes adorable handwritten letter to the police
2019/06/21 0:00:00,NBA Draft from an Aussie perspective: Aron Baynes dumped as 76ers grab ex-Sydney product
2019/06/21 0:00:00,Bedford murders
2019/06/21 0:00:00,England’s form on another planet to Sri Lanka’s as a World Cup mismatch looms
2019/06/21 0:00:00,Massive increase in prizemoney for greyhound racing in NSW
2019/06/21 0:00:00,‘Mr Movies’ Bill Collins dead at 84
2019/06/21 0:00:00,Star Wars: Mark Hamill ‘hopes’ he’s done after The Rise of Skywalker
2019/06/21 0:00:00,Kylie Jenner reveals what she said to Jordyn Woods after Tristan Thompson cheating scandal
2019/06/21 0:00:00,"Tax office receives record 60,000 tip-offs about tax dodgers"
2019/06/21 0:00:00,Joe Hildebrand reveals the most shocking part of Vinnies CEO Sleepout
2019/06/21 0:00:00,‘Hero’ William Tyrrell cop charged
2019/06/21 0:00:00,Israel Folau’s GoFundMe donations pass half a million dollars despite condemnation
2019/06/21 0:00:00,Original family home in Casula sells for first time
2019/06/21 0:00:00,Where to spot Migaloo as the white whale turns 30 this year
2019/06/21 0:00:00,Woolies shoppers taking advantage of the drive-through grocery collection
2019/06/21 0:00:00,Mother of newborn abandoned in NSW backyard has been found
2019/06/21 0:00:00,Keanu Reeves approached for ‘almost every’ Marvel movie
2019/06/21 0:00:00,Kayla Itsines slammed for latest post-pregnancy photo on Instagram
2019/06/21 0:00:00,Regional NSW properties for the price of a Sydney apartment
2019/06/21 0:00:00,Man drives ute into tree in Hindmarsh Square after argument with woman in Adelaide CBD
2019/06/21 0:00:00,Leonardo DiCaprio once sold Russell Crowe a dinosaur skull after ‘a bunch of vodka’
2019/06/21 0:00:00,First drive: Toyota Yaris GRMN hot hatch
2019/06/21 0:00:00,The real reason a mum turned up to her son’s wedding in a wedding bridal gown
2019/06/21 0:00:00,Trump confidante Hope Hicks refused to answer 155 questions about her time in the White House
2019/06/21 0:00:00,In court
2019/06/21 0:00:00,"China sends four fighter jets to highly-contested island in the South China Sea, as tensions grow"
2019/06/21 0:00:00,Three men on the run after stolen ute crashes into tree in Victoria
2019/06/21 0:00:00,Optus showdown
2019/06/21 0:00:00,Recall Alert: Apple recalls certain 15-inch MacBook Pros over faulty batteries
2019/06/21 0:00:00,Sydney worker dies days after coming into contact with sewage during clean-up
2019/06/21 0:00:00,‘A body like mine’: Rihanna’s Fenty label is using size-inclusive mannequins
2019/06/21 0:00:00,Matt Wade goes ballistic in Australia A Ashes warm-up
2019/06/21 0:00:00,NSW skipper Kezie Apps’ prediction for Women’s State of Origin series
2019/06/21 0:00:00,BMW heirs reveal downsides of wealth in surprise interview
2019/06/21 0:00:00,Woman catches boyfriend cheating with his ex on CCTV
2019/06/21 0:00:00,The unexpected perks of being in a middle seat on a plane
2019/06/21 0:00:00,Missing Adelaide man Michael Jeffrey Purse had scammed people out of drugs and money according to former house mate
2019/06/21 0:00:00,‘Disturbing’: The real reason there are so many ‘fake doctors’ in Australia
2019/06/21 0:00:00,"Rami Malek on Bohemian Rhapsody, James Bond and Mr Robot"
2019/06/21 0:00:00,Flight attendants are selling used tights on eBay to earn extra money
2019/06/21 0:00:00,Maroons prop Jarrod Wallace set to answer critics after media ban ahead of Origin II
2019/06/21 0:00:00,Sam Kerr and the Matildas’ path to World Cup glory
2019/06/21 0:00:00,Waratahs coach Daryl Gibson quits after season from hell
2019/06/21 0:00:00,Birmingham looming as likely entry point for women’s cricket into Commonwealth Games fold
2019/06/21 0:00:00,Boris Johnson and Jeremy Hunt in Conservative Party leadership race as Brexit fears persist
2019/06/21 0:00:00,Middle Park auction delayed by fire ready for winter market
2019/06/21 0:00:00,The Claw of Chernobyl: most dangerous thing in the exclusion zone
2019/06/21 0:00:00,Michael Jackson’s deathbed: Photos show creepy doll and needles
2019/06/21 0:00:00,Kids moved
2019/06/21 0:00:00,Belle Gibson worked for five weeks at Maxine’s strip club in Brunswick
2019/06/21 0:00:00,WWE diva Nikki Bella retires instantly after scary brain lump discovery
2019/06/21 0:00:00,Gangland heiress Dhakota Williams sets up GoFundMe with mum for cash to front reality TV show
2019/06/21 0:00:00,Short days
2019/06/21 0:00:00,Christians bid for Netflix to cancel ‘satanic’ show Good Omens suffers hilarious fail
2019/06/21 0:00:00,Crane crashes into house in Newport
2019/06/21 0:00:00,Bizarre tour at top of Australia’s ‘must-do’ list for tourists
2019/06/21 0:00:00,Frugal Aussie explains how she can travel the world on $16.50 a day
2019/06/21 0:00:00,Adam DeVine’s cringeworthy story about full frontal nude scene
2019/06/21 0:00:00,Viral Coolaroo house: inside the boldly decorated home that’s the talk of the internet
2019/06/21 0:00:00,Phil Gould backs NSW winger Blake Ferguson to fix the Blues in Origin II
2019/06/21 0:00:00,"French producer Philippe Zdar, of Cassius, has died in Paris"
2019/06/21 0:00:00,Lonely dog calls police and gets the attention he was chasing
2019/06/21 0:00:00,This loyal dog waited by his owner’s bedside after he had died
2019/06/21 0:00:00,Latrell Mitchell reveals his desire to be a one-team man at Sydney Roosters
2019/06/21 0:00:00,"Working long hours could increase stroke risk, research reveals"
2019/06/21 0:00:00,Respected Aussie storm-chaser and landscape photographer dies in tragic accident
2019/06/21 0:00:00,Shocking photos of ‘major cracking’ in Mascot Towers from the last two days
2019/06/21 0:00:00,Boy ‘scarred for life’ after nasty chemical burns erupt from black henna tattoo while in Bali
2019/06/21 0:00:00,Matthew Wade fires ton for Australia A to make his case for Ashes consideration
2019/06/21 0:00:00,Blues halfback Nathan Cleary admits he needs to be more dominant in Origin II
2019/06/21 0:00:00,TV star Alison Hammond unrecognisable after weight loss
2019/06/21 0:00:00,Jackpot deemed ‘marital property’ despite couple’s two-year separation
2019/06/21 0:00:00,Mum hits back at criticism of ‘genius’ $8 Kmart pram hack
2019/06/21 0:00:00,NBA Draft 2019: Every first round pick analysed as Zion goes No. 1
2019/06/21 0:00:00,Iran ‘ready for war’ after its Revolutionary Guard shot down US drone as tensions rise between the nations
2019/06/21 0:00:00,Small sedan comparison: Mazda3 v Hyundai Elantra v Honda Civic
2019/06/21 0:00:00,"Absolute devastation, unbridled joy in wild night of Women’s World Cup"
2019/06/21 0:00:00,Josh Papalii backs fellow Maroons prop Dylan Napa to play Origin II with broken wrist
2019/06/21 0:00:00,"Why Melbourne man turned down huge $300,000 Shark Tank offer"
2019/06/21 0:00:00,Paul Gallen compares Maroons fullback Kalyn Ponga to Queensland legend Billy Slater at 21
2019/06/21 0:00:00,Teenage girl allegedly raped and murdered by carer following secret sexual relationship
2019/06/21 0:00:00,David Warner reveals new nickname after blasting 166 against Bangladesh
2019/06/21 0:00:00,Frost warning persists for South Australia ahead of winter solstice
2019/06/21 0:00:00,Jada Pinkett Smith shocks with threesome confession — in front of mum and daughter
2019/06/21 0:00:00,Coronation Drive crash causing peak-hour commute headaches
2019/06/21 0:00:00,"Nick Kyrgios tanks, takes aim at umpire and crowd in Queens Club debacle"
2019/06/21 0:00:00,Incredible upset opens No. 1 door for Ash Barty
2019/06/21 0:00:00,Newsreader’s embarrassing gaffe explains Egypt’s muted response to ex-president’s death
2019/06/21 0:00:00,Ashton Kutcher and Mila Kunis: ‘It’s over between us’
2019/06/21 0:00:00,RUSH HOUR: Boss blasted for comment about 'slutty' woman
2019/06/21 0:00:00,Aussies questioned despite monster total in win against Bangladesh
2019/06/21 0:00:00,Vladimir Putin says ‘no proof’ the Russians shot down Malaysia Airlines flight MH17
2019/06/21 0:00:00,Republicans defy Trump in Senate to reject proposed Middle East arms sales
2019/06/21 0:00:00,Women’s Football World Cup 2019: Matildas certainly familar with quarter-final opponents Norway
2019/06/21 0:00:00,Police reportedly seek to appeal Manly centre Dylan Walker’s domestic assault acquittal
2019/06/21 0:00:00,Israel Folau details cost of legal battle with Rugby Australia and asks for public donations
2019/06/21 0:00:00,"The Queen, Princess Eugenie and Zara Tindall turn heads at Ascot"
2019/06/21 0:00:00,Boris Johnson in lead as race to be UK prime minister narrows
2019/06/21 0:00:00,Tranquil One Tree Hill home of White Ribbon activist for sale
2019/06/21 0:00:00,A modern masterpiece that ticks all the right boxes
2019/06/21 0:00:00,Two new calves are named to celebrate World Giraffe Day at Monarto Zoo
2019/06/21 0:00:00,Boutique Victorian distilleries boost regional property markets
2019/06/21 0:00:00,"Brisbane’s hungry for luxury, says richlist developer Kevin Seymour"
2019/06/21 0:00:00,Rookie buyers leap into market after location and room for cat
2019/06/21 0:00:00,‘The house that we always wanted’
2019/06/21 0:00:00,Upgrade hack: Why you should always choose an Qantas A330
