date,title
2019/12/06 0:00:00,New South Wales residents 'living in fear' amid 'megafire' threats as firefighters battle to gain the upper hand
2019/12/06 0:00:00,Australian selectors struggle to unearth Nathan Lyon’s deputy tweaker
2019/12/06 0:00:00,Woman attacked by accused Claremont serial killer recounts terrifying attack in court
2019/12/06 0:00:00,Greta Thunberg surrounded by media as she arrives in Madrid by train after Atlantic crossing
2019/12/06 0:00:00,NFL broadcaster Tim Ryan suspended after controversial Lamar Jackson remarks
2019/12/06 0:00:00,Sporting icon Bruce McAvaney sells waterfront stunner
2019/12/06 0:00:00,Kingston Town Classic: Brad Rawiller believes Best Of Days can land him his third crown
2019/12/06 0:00:00,Inter Dominion: San Carlo heads Aussie charge as Ultimate Sniper firms for title
2019/12/06 0:00:00,Pierre-Emerick Aubameyang’s untimely toilet break shocks Arsenal fans
2019/12/06 0:00:00,Pakenham Cup 2019: Creedence revival has Lindsay Park team aiming for the Adelaide Cup
2019/12/06 0:00:00,Game of Thrones bosses lift the lid on one of the finale’s greatest mysteries
2019/12/06 0:00:00,Group’s nightmare weeks after being stranded in Northern Territory outback
2019/12/06 0:00:00,Tommy Berry upbeat about the chances of debutant Sancy
2019/12/06 0:00:00,Rugby Australia chairman Cameron Clyne promises Folau saga will not impact community rugby
2019/12/06 0:00:00,Downton Abbey’s Maggie Smith brands show ‘unsatisfying’
2019/12/06 0:00:00,Streaming services reveal the songs we couldn’t stops listening to this year
2019/12/06 0:00:00,How a fall saved this young girl’s life
2019/12/06 0:00:00,Ultimate guide for Anthony Joshua vs Andy Ruiz Jr rematch in Saudi Arabia
2019/12/06 0:00:00,Port Adelaide do away with co-captaincy model after one season
2019/12/06 0:00:00,South Sydney to turn focus to Jai Arrow after Sam Burgess’ salary is wiped from salary cap
2019/12/06 0:00:00,Saturday Racebook: Nathan Exelby’s tips and analysis for the Doomben program
2019/12/06 0:00:00,Former Australian captain Ricky Ponting didn’t rate Kane Williamson at first
2019/12/06 0:00:00,Fisherman’s ‘mind blown’ at $20 note find in snapper’s stomach
2019/12/06 0:00:00,Welfare of horses a priority with heat to hit Doomben meeting
2019/12/06 0:00:00,"Brisbane traffic: Trains suspended in both directions on Ferny Grove Line, Bruce Hwy truck rollover"
2019/12/06 0:00:00,Dallas Cowboys ugly season goes from bad to worse against Chicago Bears
2019/12/06 0:00:00,"Western Sydney Zoo opening ‘nothing to celebrate’, says PETA"
2019/12/06 0:00:00,"Family home riddled with termites being auctioned, lots of takers"
2019/12/06 0:00:00,Sydney development approvals to be crucial how the Australian economy will perform in 2020
2019/12/06 0:00:00,Private Mosman trophy home sells early for $8.8m
2019/12/06 0:00:00,Photo shows ‘insane’ price of prepackaged grocery item at Coles
2019/12/06 0:00:00,Ange Postecoglou on cusp of coaching history in Japan’s J League
2019/12/06 0:00:00,Incredible support for Mosshiki surprises trainer Rob Heathcote
2019/12/06 0:00:00,Vaper’s lung scarring likened to metal damage
2019/12/06 0:00:00,Father and daughter ‘lucky to be alive’ after horror moped mugging
2019/12/06 0:00:00,Research reveals the future of Australian jobs
2019/12/06 0:00:00,UK election: Everything you need to know about UK general election 2019
2019/12/06 0:00:00,AJ vs Ruiz II could be the most important fight in a golden era of heavyweight boxing: What you need to know
2019/12/06 0:00:00,Marriage Story is an emotional storytelling masterpiece
2019/12/06 0:00:00,Anti-terror police armed with assault rifles and bomb detection dogs to patrol Aussie airports
2019/12/06 0:00:00,School of Rock Musical cast share rockin’ Christmas message
2019/12/06 0:00:00,Tim Tszyu defeats Jack Brubaker; Darcy Lussick KO's Justin Hodges
2019/12/06 0:00:00,"Sex, drugs and glitter: Secret lives of Uber drivers"
2019/12/06 0:00:00,From Maui to Oahu: A guide to Hawaii’s islands
2019/12/06 0:00:00,Multiple fires merge together to create fire the size of Sydney
2019/12/06 0:00:00,"Jess Duffin opens up about her break from cricket, returning to the game and the balancing act with AFLW"
2019/12/06 0:00:00,Raceday focus: Best bets and inside mail for Randwick (Kensington) and Mudgee
2019/12/06 0:00:00,Optus and Seven to create special 4K UHD streaming channel for Tokyo Olympics
2019/12/06 0:00:00,Commentator transfixed by Trae ‘Quadzilla’ Williams on Australian rugby sevens debut
2019/12/06 0:00:00,"Former trainer Robert Smerdon in bid to reduce ban, fine for his role in sophisticated doping ring"
2019/12/06 0:00:00,The enormous price Owen Wilson pays not to see his daughter
2019/12/06 0:00:00,The documents that revealed Duke of Windsor’s Nazi ties
2019/12/06 0:00:00,Alki David forced to pay more than $84 million in damages for sexual battery and harassment
2019/12/06 0:00:00,Letter from child survivor of Titanic shares rare insight into doomed ship’s sinking
2019/12/06 0:00:00,Indian woman set on fire while heading to testify against accused rapists
2019/12/06 0:00:00,Seven inspiring South Australians take top prizes in 2019 Pride of Australia Awards
2019/12/06 0:00:00,Four dead following dramatic car chase and shootout in Florida
2019/12/06 0:00:00,Hero firefighter ‘defines Australia’ for battling NSW bushfires a day after cancer diagnosis
2019/12/06 0:00:00,SBW joins rugby stars in raising funds to tackle Samoa’s measles outbreak
2019/12/06 0:00:00,Marvelous Mrs Maisel season three: A little bit sickly but so pleasurable
2019/12/06 0:00:00,Wil Anderson announces he’s leaving Triple M breakfast
2019/12/06 0:00:00,Master of ceremonies and TV host Peter Lazer lists in South Yarra
2019/12/06 0:00:00,Sydney real estate: what 2020 will be like for home buyers and sellers
2019/12/06 0:00:00,"Good punters ‘not allowed to win’ at bet365, investigation claims"
2019/12/06 0:00:00,"‘Not a great look’: Co-op Bookshop administrators reach deal over $500,000 worth of hats from CEO’s company"
2019/12/06 0:00:00,NRL reveals rule changes for season 2020
2019/12/06 0:00:00,Mathew Flame pleads not guilty to the murder of Angry Anderson’s son Liam Anderson
2019/12/06 0:00:00,Polar bears play with plastic trash in heartbreaking photos
2019/12/06 0:00:00,Ben Simmons continues his steal-a-thon but Wizards defeat 76ers
2019/12/06 0:00:00,"Photos resurface of Prince Andrew, Ghislaine Maxwell, Donald Trump at Heidi Klum’s party"
2019/12/06 0:00:00,Melbourne suburbs blossom in spring as market bounces back
2019/12/06 0:00:00,Luke Shuey to captain West Coast in 2020 after Shannon Hurn stepped down
2019/12/06 0:00:00,Your Christmas display could earn you $1000
2019/12/06 0:00:00,Former NSW Labor minister Milton Orkopoulos to be released from prison
2019/12/06 0:00:00,Cruise ship stranded for hours after blackout off Adelaide coast
2019/12/06 0:00:00,Bunnings selling out of face masks as bushfire smoke blankets state
2019/12/06 0:00:00,"Jetstar ground crew, handlers to strike at busiest time of year"
2019/12/06 0:00:00,Most-viewed for two weeks running: Castle Cove home sells early
2019/12/06 0:00:00,Dad dies in ‘freak accident’ hanging Christmas lights
2019/12/06 0:00:00,Woman who went on Tinder date with Grace Millane’s killer speaks out
2019/12/06 0:00:00,‘Cold’ video footage of Chris Watts after he killed whole family revealed
2019/12/06 0:00:00,CNN employee claims boss threatened to kill him over discrimination lawsuit
2019/12/06 0:00:00,‘Posh’ Apprentice star Ryan-Mark caught eating Macca’s with silver cutlery — horrifying co-stars
2019/12/06 0:00:00,Quade Cooper dishes on his confrontation with All Blacks legend Richie McCaw
2019/12/06 0:00:00,"Fired Toyota manager denied $379,268 redundancy package seeking $301,000 in damages"
2019/12/06 0:00:00,Oil giant Saudi Aramco set for biggest initial public offering in history
2019/12/06 0:00:00,Aussies are backing Disney over Netflix in 2020
2019/12/06 0:00:00,Man shocked after rescuing vicious animal he thought was a dog
2019/12/06 0:00:00,Why Jerry Maguire sex scene was ‘awkward’ for John Travolta
2019/12/06 0:00:00,Family distressed as road workers unveil parking sign and tow away their van
2019/12/06 0:00:00,Boss of $10 trillion fund sacked over love affair with employee
2019/12/06 0:00:00,NSW bushfires: Homes destroyed and three firefighters injured
2019/12/06 0:00:00,Pipe Masters 2019: Everything you need to know about the most important event in surfing history
2019/12/06 0:00:00,‘You deserve to be honoured’: Pauline Hanson pays tribute to Australian men
2019/12/06 0:00:00,Wests Tigers back in race for Latrell Mitchell as Matt Moylan rejects advances to stick with Cronulla Sharks
2019/12/06 0:00:00,‘No doubt it was him’: Horrific images of former Amazon exec’s now dead wife
2019/12/06 0:00:00,Filmmaker slammed over ‘sick’ rant calling for rape to be legalised
2019/12/06 0:00:00,Uber releases list of the most Ubered-to attractions on the planet
2019/12/06 0:00:00,Studio 10’s Scott Tweedie lands new gig
2019/12/06 0:00:00,Aussie Aaron Mooy stars as Arsenal suffers shock loss to Brighton
2019/12/06 0:00:00,The School of Rock musical cast celebrate Christmas with rocking carol video
2019/12/06 0:00:00,Kim Kardashian gives fans glimpse of $1m luxury wardrobe
2019/12/06 0:00:00,Woman brought back to life after her heart stops for six hours in hiking disaster
2019/12/06 0:00:00,Studio 10 announce new panellist for 2020
2019/12/06 0:00:00,Bushfires bring out the best of fire-affected communities
2019/12/06 0:00:00,Netflix trailer for You season 2 shows Penn Badgley’s character’s fresh start in LA
2019/12/06 0:00:00,LeBron James responds to accusations he ‘disrespected’ the opposition
2019/12/06 0:00:00,Ice hockey legend: How I ended up in Gene Simmons’ bed with Cher
2019/12/06 0:00:00,Ed Kavalee ‘permanently’ replaces Kate Langbroek on drive show
2019/12/06 0:00:00,Anti-vax group’s plea to ditch ‘offensive’ name slammed
2019/12/06 0:00:00,Bushfire watch and act issued for residents in Nambeelup within Shire of Murray as metropolitan area braces for another scorcher
2019/12/06 0:00:00,‘Do it now’: Why Donald Trump is so cocky about impeachment
2019/12/06 0:00:00,Aussie teen Lawson Rankin in critical condition after horror accident while on Schoolies in Bali
2019/12/06 0:00:00,Ian Somerhalder’s surprising on-air sex confession
2019/12/06 0:00:00,Japanese burger chain Mos Burger underpaid workers $1.1 million
2019/12/06 0:00:00,Italian newspaper banned by two clubs after ‘Black Friday’ headline
2019/12/06 0:00:00,NRL star Luke Garner told to ‘eat dirty’ in preparation for season 2020
2019/12/06 0:00:00,Silver eastern brown snake found at Cessnock
2019/12/06 0:00:00,Heatwave to worsen fire conditions into weekend
2019/12/06 0:00:00,Melbourne couple charged over alleged importation of $1 billion worth of methamphetamine
2019/12/06 0:00:00,Suspended Young LNP leader Barclay McGain egged by younger brother for content on TikTok
2019/12/06 0:00:00,F1 backflips over chequered flag call
2019/12/06 0:00:00,"Alan Jones rips into Rugby Australia for a host of mistakes, including handling of Israel Folau saga"
2019/12/06 0:00:00,Borce Ristevski’s sentence increased for death of wife Karen
2019/12/06 0:00:00,‘It’s war’: Rap group OneFour hit out after pokie brawl sentencing
2019/12/06 0:00:00,‘Hundreds’ barred from Elton John’s Adelaide concert over dodgy tickets
2019/12/06 0:00:00,Justin Timberlake apologises to his ‘amazing wife’ over pictures with co-star
2019/12/06 0:00:00,Justin Timberlake affair would cost $730k under Jessica Biel ‘love contract’
2019/12/06 0:00:00,Rebecca Judd shows off super-fit figure in a rare bikini snap
2019/12/06 0:00:00,How to get the perfect pic for your dating profile
2019/12/06 0:00:00,Corey Calliet reveals his top tips to help transform your body
2019/12/06 0:00:00,Sydney Trains announce unexpected delays due to ‘urgent’ repairs in southwest Sydney
2019/12/06 0:00:00,"Today in history, December 6: First sound recording"
2019/12/06 0:00:00,Maisie Williams and Sophie Turner make fun of Sean Bean’s clapper board skills
2019/12/06 0:00:00,Cricket in awe of South African bowler’s magical celebration
2019/12/06 0:00:00,Car of the Year: Australia’s best new car revealed
2019/12/06 0:00:00,Bad energy habits can cost Australians an extra $774 during summer
2019/12/06 0:00:00,‘Plainly inappropriate’: NSW man jailed for sex abuse of underage relative in caravan and house
2019/12/06 0:00:00,RUSH HOUR: Witnesses shocked as rider runs after being thrown in crash
2019/12/06 0:00:00,Kate Middleton reveals sweet story about Prince Louis
2019/12/06 0:00:00,New Toyota C-HR Hybrid review: New green machine is an expensive proposition
2019/12/06 0:00:00,"Former Miss Pakistan World, Zanib Naveed, killed in car crash"
2019/12/06 0:00:00,PM defends government pay packet of TV tradie Scott Cam
2019/12/06 0:00:00,Trafalgar Square Christmas Tree labelled 'drab' by unimpressed Londoners
2019/12/06 0:00:00,Spiers missed Claremont friends by minutes as court hears of ‘blood curdling’ screams
2019/12/06 0:00:00,Nancy Pelosi cracks it at reporter: ‘Don’t mess with me’
2019/12/06 0:00:00,Elon Musk’s ‘pedo guy’ tweet ‘humiliated’ diver who rescued Thai soccer team
2019/12/06 0:00:00,Cambodia says it is considering taking refugees bound for Australia
2019/12/06 0:00:00,"Homes trading unseasonably late this year, right up to Chrissy"
2019/12/06 0:00:00,Sophisticated city style in a hidden pocket of Palm Beach selling
2019/12/06 0:00:00,Selling Houses Australia transforms Drysdale cottage from ‘cowboy rustic’ to country chic
2019/12/06 0:00:00,Two North-West Coast commercial assets heading to auction
