date,title
2019/05/18 0:00:00,New dad Prince Harry makes surprise appearance at wedding without Meghan
2019/05/18 0:00:00,Federal election 2019: Key seats still in doubt
2019/05/18 0:00:00,Pictures of children swimming underwater the new craze
2019/05/18 0:00:00,Campbelltown Hospital’s mental health unit without a psychologist
2019/05/18 0:00:00,Wayne Bennett demands NSW axe incumbent halves pairing
2019/05/18 0:00:00,Federal election 2019: Labor defeat is humiliating
2019/05/18 0:00:00,"How a big-hearted South Australian community has raised $75k to bring home a favourite son, to go fishing, play Lego"
2019/05/18 0:00:00,Clive Palmer claims credit for Coalition’s victory
2019/05/18 0:00:00,Betting agency makes monumental and costly error ahead of election
2019/05/18 0:00:00,"Timmothy Matthew Gardiner, 29, “died in mother’s arms” after being shot in Launceston this morning"
2019/05/18 0:00:00,Federal Election 2019: Eggboy spotted at Labor Party in Melbourne
2019/05/18 0:00:00,Federal election 2019: Tony Abbott loses Warringah to Zali Steggall
2019/05/18 0:00:00,Federal election 2019: Julie Bishop steals the show with ‘Bish Boot’
2019/05/18 0:00:00,Live at the Tiser: Australia decides
2019/05/18 0:00:00,Matt Cumani’s long-term mission could see Declares War put in cotton wool despite impressive win
2019/05/18 0:00:00,"The Goodwood: Despatch front and centre as Tony McEvoy, Todd Pannell combine for Group 1 victory"
2019/05/18 0:00:00,Melbourne home sellers claim 60 per cent majority on election day
2019/05/18 0:00:00,Questions raised after One Nation leader nowhere to be seen today
2019/05/18 0:00:00,Federal election 2019: Treasurer Josh Frydenberg wins Kooyong electorate
2019/05/18 0:00:00,Federal election 2019: Liberals hold on to Higgins
2019/05/18 0:00:00,Israel Folau’s appeal faces major hit with ATO monitoring of donations
2019/05/18 0:00:00,Liberals set to hold onto Julie Bishop’s former seat of Curtin
2019/05/18 0:00:00,"Federal election 2019: Flinders electorate, where Greg Hunt faces Julia Banks"
2019/05/18 0:00:00,Federal election results: How your electorate voted
2019/05/18 0:00:00,"Burnt house in Fairfield West sells under the hammer for $750,000"
2019/05/18 0:00:00,Doomben Roses: Etana justifies price for trainer Ciaron Maher
2019/05/18 0:00:00,"Federal election 2019: Corangamite electorate, where Sarah Henderson faces Libby Coker"
2019/05/18 0:00:00,Federal election results live: Scott Morrison's stunning triumph
2019/05/18 0:00:00,New Galaxy Poll points to a Labor election victory
2019/05/18 0:00:00,Federal election 2019: Melissa McIntosh wins Lindsay for Liberals
2019/05/18 0:00:00,A leafy family home with plenty of flexibility
2019/05/18 0:00:00,Lamar Odom reveals he used a fake penis to pass Team USA drug test
2019/05/18 0:00:00,One simple question leaves Clive Palmer ‘volunteers’ speechless
2019/05/18 0:00:00,"Federal election 2019: Deakin electorate, where Michael Sukkar faces Shireen Morris"
2019/05/18 0:00:00,Inner west houses sell for millions at auction as developers get snared in land grab
2019/05/18 0:00:00,"Federal election 2019: Mayo electorate, where Rebekha Sharkie faces Georgina Downer"
2019/05/18 0:00:00,Federal election 2019: Crucial seat of Pearce Labor has spent big to win
2019/05/18 0:00:00,United Australia Party campaigner allegedly exposes himself
2019/05/18 0:00:00,Federal election 2019: Fiona Martin wins Reid against Sam Crosby
2019/05/18 0:00:00,"Federal election 2019: Gilmore electorate, where Warren Mundine faces Fiona Phillips"
2019/05/18 0:00:00,Here’s why you’ll pay $1200 at this new Bali beach club
2019/05/18 0:00:00,Federal election 2019: ‘Disgraceful’ sign in Cantonese sparks complaints while Islamophobic graffiti outrages
2019/05/18 0:00:00,Federal election 2019: Dave Sharma and Kerryn Phelps battle for Wentworth
2019/05/18 0:00:00,Federal election 2019: Gladys Liu wins seat of Chisholm
2019/05/18 0:00:00,Doomben Cup: Ciaron Maher’s love affair with Queensland winter strengthened by Kenedna success
2019/05/18 0:00:00,Mixed results for home auctions as federal election competes for buyer interest
2019/05/18 0:00:00,Federal election 2019: Home Affairs Minister Peter Dutton set to hold onto seat of Dickson
2019/05/18 0:00:00,Lord Mayors Cup: Stayer Grey Lion continues to thrive under Dale Smith with another stakes success
2019/05/18 0:00:00,Federal election 2019: Labor battle to win back party’s traditional seat of Capricornia
2019/05/18 0:00:00,Neo-Nazi gets life behind bars for plot to murder British MP
2019/05/18 0:00:00,Inside Bunnings flat pack home
2019/05/18 0:00:00,Federal election 2019: When will we know if there is a new prime minister?
2019/05/18 0:00:00,Isaac Israel Warriner: Son ‘cuts off mum’s head with hacksaw’
2019/05/18 0:00:00,Kate Iselin: Should women listen to Alyssa Milano and go on a sex strike to get what we want?
2019/05/18 0:00:00,Melbourne investor sees value in rising attraction of Thomson
2019/05/18 0:00:00,Federal election 2019: What happens if you don’t vote?
2019/05/18 0:00:00,Federal election live results: Coalition set to retain government
2019/05/18 0:00:00,What micro parties on ballot paper stand for
2019/05/18 0:00:00,Entry-level Belmont house proves affordable first step for newlyweds
2019/05/18 0:00:00,Cunning Kubrick evades unkindest cut of all with another tidy victory
2019/05/18 0:00:00,Woman dies in house fire in Adelaide’s northern suburbs
2019/05/18 0:00:00,Canberra Raiders legend Quentin Pongia loses cancer battle aged 48
2019/05/18 0:00:00,"NRL Saturday | Titans vs Bulldogs, Cowboys vs Eels, Raiders vs Rabbitohs"
2019/05/18 0:00:00,Kawhi Leonard receives savage chant during rough loss to Milwaukee Bucks in Game 2
2019/05/18 0:00:00,Suzuki Vitara boosts its cred as a top-value small SUV
2019/05/18 0:00:00,Federal election 2019: Bill Shorten and Scott Morrison make final push on the campaign trail
2019/05/18 0:00:00,Aussie in jail for murder in Bulgaria keeps up desperate hunger strike
2019/05/18 0:00:00,Bachelorette Georgia Love honours mum in charity walk
2019/05/18 0:00:00,"AFL Saturday: Swans buck election trend, Cats win at a cost, Bombers beat Freo, Lions win thriller"
2019/05/18 0:00:00,"MP’s son pleads guilty to 35 child sex offences, avoids jail time over dwarfism"
2019/05/18 0:00:00,Democracy cake stalls dial up the sass at polling booths
2019/05/18 0:00:00,NBA Awards: Giannis Antetokounmpo and Paul George could win big as finalists revealed
2019/05/18 0:00:00,Dashcam video: driver rams police highway patrol car in Frankston
2019/05/18 0:00:00,Near and far: Melbourne’s most affordable suburbs
2019/05/18 0:00:00,To buy or not to buy: Clues hidden in new housing price data
2019/05/18 0:00:00,Teenage passenger killed in Tumby Bay crash on the Eyre Peninsula
2019/05/18 0:00:00,"Novak Djokovic, Rafael Nadal through to Italian open semis as Roger Federer withdraws"
2019/05/18 0:00:00,Voters can’t stop tweeting about Democracy Sausages
2019/05/18 0:00:00,"Renovated Scandi delight at 170 Stanley St, North Adelaide"
2019/05/18 0:00:00,Brooks Koepka produces historic performance as Adam Scott roars back into contention at PGA
2019/05/18 0:00:00,NBA star Tyreke Evans dismissed for two years for drug code violation
2019/05/18 0:00:00,Kim Kardashian and Kanye West name newborn son Psalm West
2019/05/18 0:00:00,Tiger Woods fails to make the cut of PGA Championship
2019/05/18 0:00:00,Federal election 2019: What’s in it for you? Coalition v Labor’s policies compared
2019/05/18 0:00:00,Trent Robinson plays down concerns over Latrell Mitchell’s fitness after poor showing
2019/05/18 0:00:00,Disbelief over staggering referee blunder in J-League
2019/05/18 0:00:00,Altona weatherboard house free to a good home
2019/05/18 0:00:00,Federal election 2019: What it’s like to vote overseas
2019/05/18 0:00:00,Woman dies in a house fire in Adelaide’s northern suburbs
2019/05/18 0:00:00,Ohio State team doctor revealed to have abused 177 students
2019/05/18 0:00:00,Nikki Webster sheds light on Sydney Olympics Opening Ceremony dramas
2019/05/18 0:00:00,Tragic circumstances of WWE star’s death
2019/05/18 0:00:00,Eight great renovation ideas from a Westgarth home
2019/05/18 0:00:00,"Game of Thrones, Season 8: Punters betting on Jon while Dany’s a hot tip to perish"
2019/05/18 0:00:00,"Which safe, reliable car can my P-plater buy with $14K he’s saved?"
2019/05/18 0:00:00,Police in Pakistan have arrested a doctor suspected of infecting 400 children and 100 adults with AIDS virus
2019/05/18 0:00:00,Nick Kyrgios takes another swipe at Rafael Nadal on social media
2019/05/18 0:00:00,Federal election 2019: Live coverage as Australia decides its next PM
2019/05/18 0:00:00,Rachael Kable shares the stories behind some of her favourites
2019/05/18 0:00:00,Stunning green thumb makeover within Brisbane’s middle ring
2019/05/18 0:00:00,Missouri passes strict abortion law outlawing terminations after eight weeks
2019/05/18 0:00:00,Bargain buys: Where you can bag a home for a big discount
2019/05/18 0:00:00,Why I live in … Well-known journalist Neil Doorley reveals why he loves living in Ashgrove
2019/05/18 0:00:00,The Big Bang Theory ends final episode with bombshell
2019/05/18 0:00:00,"Self-help guru Tony Robbins ‘sexually harassed women’, report claims"
2019/05/18 0:00:00,"New climate change A-list says Sydney, Melbourne, Adelaide and Canberra are leading the way in taking action"
2019/05/18 0:00:00,Friends star Courteney Cox shares picture of cast on trip to Las Vegas
2019/05/18 0:00:00,Brexit vote ‘doomed’ to fail for a fourth time after Theresa May and Jeremy Corbyn abandon negotiating table
2019/05/18 0:00:00,Archie’s birth certificate shows he was born at Portland Hospital
2019/05/18 0:00:00,Meghan Markle’s close friend breaks down in tears defending her over ‘difficult’ claims
2019/05/18 0:00:00,Grand Edwardian a rare gem in Newtown
2019/05/18 0:00:00,Short-term letting a big boon for Geelong homeowners
2019/05/18 0:00:00,Sydney homes with a wood-fired pizza oven up for sale
2019/05/18 0:00:00,Western Sydney unit project draws first-home buyers and investors
2019/05/18 0:00:00,‘Mr Fluffy’ land for sale in affluent Sydney suburb
2019/05/18 0:00:00,1920s style combined with every modern luxury
2019/05/18 0:00:00,Former Block contestants Josh and Charlotte selling their own apartment
2019/05/18 0:00:00,Sydney Harbour views now within the reach of first home buyers
2019/05/18 0:00:00,Geelong house prices rise as more first-home buyers encouraged into the market
2019/05/18 0:00:00,Homes are selling half-built as owners abandon renovation projects
2019/05/18 0:00:00,Vendors set to embrace online auctions in new approach to find buyers
2019/05/18 0:00:00,"Renters, landlords: Whose responsibility is it?"
