date,title
2019/10/19 0:00:00,How Sky News reporter Kieran Gilbert lost weight while sleeping more
2019/10/19 0:00:00,ABC chair Ita Buttrose announces iview to go international
2019/10/19 0:00:00,Frankie Muniz can‘t remember starring in Malcolm in the Middle
2019/10/19 0:00:00,Motorist could cop huge penalty after being caught on dashcam callously soaking pedestrian
2019/10/19 0:00:00,We need to stop young men from dying on our roads
2019/10/19 0:00:00,Four people injured in concrete pump explosion
2019/10/19 0:00:00,Man allegedly stabs man who attacked him with a machete and sliced his fingers ‘to the bone’
2019/10/19 0:00:00,Adelaide Strikers legspinner Amanda-Jade Wellington left speechless when boyfriend proposes after a game
2019/10/19 0:00:00,ACRAs 2019: All the highlights from the radio awards
2019/10/19 0:00:00,Caulfield Cup: Damian Lane cops heavy fine and ban as he weaves winning path for Japan’s Mer De Glace
2019/10/19 0:00:00,Taylor Adams shares the five-hour a day fitness routine behind his sculpted AFL body
2019/10/19 0:00:00,Children hospitalised in jumping castle incident
2019/10/19 0:00:00,Brisbane mother and child missing
2019/10/19 0:00:00,The Everest 2019: Santa Ana Lane comes up short after record run
2019/10/19 0:00:00,Pride of Australia: Young Max Taylor saves man from drowning
2019/10/19 0:00:00,Kangaroo filmed taking a dip in a suburban pool in Seaford Rise
2019/10/19 0:00:00,Inside the tragic life of talk show queen Ricki Lake
2019/10/19 0:00:00,Stephen Baster leads throughout on flying Bendigo mare Miss Leonidas
2019/10/19 0:00:00,Behind the scenes of North Korean dictator Kim Jong-un’s bizarre childhood
2019/10/19 0:00:00,Bruce McAvaney’s emotional plea after horse slaughter revelations
2019/10/19 0:00:00,Caulfield Cup 2019 result and finishing order: Mer De Glace wins
2019/10/19 0:00:00,Telethon
2019/10/19 0:00:00,Out-of-control bushfire threatens homes in town of Backwater
2019/10/19 0:00:00,Rugby World Cup 2019 England defeats Australia in quarter final
2019/10/19 0:00:00,"More scam emails sent on Monday than any other, and it only takes one to bring down a whole institution"
2019/10/19 0:00:00,Thought Of That into Victoria Derby favouritism after dominant win; Gamay firms for The Oaks
2019/10/19 0:00:00,Bec Judd’s ‘David Bowie’ inspired outfit at Caulfield Cup
2019/10/19 0:00:00,Glen Iris: huge result for opulent home with spa in the bedroom
2019/10/19 0:00:00,The Everest 2019 result and finishing order: Yes Yes Yes wins
2019/10/19 0:00:00,"Forget Bali and Byron: What to do with a few days in Cape Town, South Africa"
2019/10/19 0:00:00,Leafy locale close to Eastern Gardens pits old friends against each other
2019/10/19 0:00:00,Scoring his first Socceroos hat-trick was a special moment for Jamie Maclaren
2019/10/19 0:00:00,The Kosciuszko: Handle The Truth wins $1.3m sprint
2019/10/19 0:00:00,Emergency warning issued for bushfire burning at Backwater in northern NSW
2019/10/19 0:00:00,Narraweena: the Sydney suburb predicted to see greatest growth
2019/10/19 0:00:00,UFC Boston Fight Night Reyes vs Weidman: Results and updates
2019/10/19 0:00:00,Iraqi man allegedly organised people smuggling venture resulting in more than 350 deaths
2019/10/19 0:00:00,Brutal way Channing Tatum’s ex found out about his new relationship
2019/10/19 0:00:00,"Rugby League World Cup Nines, Day 2 | Kangaroos win men’s title, Kiwi Ferns win women’s"
2019/10/19 0:00:00,Handy young couple to chip away at renovation in Hamlyn Heights
2019/10/19 0:00:00,Video surfaces of ex-football star disarming high school gunman
2019/10/19 0:00:00,"Johnson & Johnson recalls 33,000 bottles of baby powder in US"
2019/10/19 0:00:00,Caulfield Cup 2019: See where every runner finished and what the jockeys said
2019/10/19 0:00:00,Israel Folau reveals his ‘crazy prayer’ before infamous posts
2019/10/19 0:00:00,Inside the life of a Kmart influencer
2019/10/19 0:00:00,Sydney home auctions: Inner west fixer upper sells for $2.35 million
2019/10/19 0:00:00,"Sydney man allegedly kidnapped woman, bound her hands and ordered her to drive to a bank"
2019/10/19 0:00:00,The level 40 penthouse at Harry Seidler’s Horizon passes in on vendor bid of $16m at auction
2019/10/19 0:00:00,Raceday focus: Best bets and inside mail for Wyong and Nowra
2019/10/19 0:00:00,How to stop takeaway food costs from eating into your savings
2019/10/19 0:00:00,Maleficent: Mistress of Evil wastes its greatest asset
2019/10/19 0:00:00,Living With Yourself’s inferiority complex
2019/10/19 0:00:00,Bizarre twist at the end of Meryl Streep’s Netflix movie The Laundromat
2019/10/19 0:00:00,"Behind the kava craze, coming to Aussie shores"
2019/10/19 0:00:00,US forces bomb own bases as part of withdrawal from Syria
2019/10/19 0:00:00,Kensington try before you buy units combat cladding concerns
2019/10/19 0:00:00,Tayla Harris claims Australian Female Middleweight Title with second round knockout over Margarite Butcher
2019/10/19 0:00:00,‘I no longer need to hide my face’: Sydney doctors give young woman new face
2019/10/19 0:00:00,MasterChef stars Matt Preston and George Mehigan ‘cooking up new show on Seven’
2019/10/19 0:00:00,’Chaos’: Violence takes over Barcelona as protests paralyse Catalonia
2019/10/19 0:00:00,Former police officer would ‘trade his life’ to bring back victims of Bourke St mall massacre
2019/10/19 0:00:00,Best restaurants in regional Victoria worth a roadtrip
2019/10/19 0:00:00,Prince Harry reveals ‘festering wounds’ left by Diana’s death
2019/10/19 0:00:00,Jane Fonda arrested again alongside Grace and Frankie co-star
2019/10/19 0:00:00,Anger over release of satellite monitoring pictures of drought-affected Murray-Darling Basin
2019/10/19 0:00:00,Chris Hemsworth posts insane shirtless workout video
2019/10/19 0:00:00,Reid woman volunteers more than 20 hours a week to her kids’ local sporting club despite her cancer diagnosis
2019/10/19 0:00:00,The Everest 2019: Glen Boss compares Yes Yes Yes win to Makybe Diva's third Cup triumph
2019/10/19 0:00:00,"Bec and Bridge unveils new season swim campaign, ‘Wipe Out’, shot in Los Angeles"
2019/10/19 0:00:00,‘No longer a shoe’: Furore erupts over Nikes worn by marathon star
2019/10/19 0:00:00,"Man found dead by passer-by outside of car in Myrtleford, Victoria"
2019/10/19 0:00:00,Darren Thornburgh home: Denise Foster lists house they shared
2019/10/19 0:00:00,Melbourne’s most liveable and affordable suburbs named
2019/10/19 0:00:00,American tourist drowns while swimming at Tangalooma shipwrecks off Moreton Island
2019/10/19 0:00:00,Meghan Markle’s heartbreaking response to simple question: ‘Are you OK?’
2019/10/19 0:00:00,Lady Gaga plummets off stage in a fan’s arms during Vegas show
2019/10/19 0:00:00,Melbourne Victory winless after two home games to start A-League season
2019/10/19 0:00:00,Nadal to marry sweetheart in Majorca fortress but Federer won’t attend
2019/10/19 0:00:00,Air apparent: a Thornbury renovation
2019/10/19 0:00:00,Meet the six-cylinder luxury sedan that isn’t a German import
2019/10/19 0:00:00,Caulfield Cup 2019: Race-by-race guide and betting strategy for 2400m handicap
2019/10/19 0:00:00,The Everest 2019: Runner-by-runner guide
2019/10/19 0:00:00,Rugby World Cup: Australia vs England quarterfinal talking points
2019/10/19 0:00:00,Why Porsche’s ‘budget’ SUV is also its bestselling model by far
2019/10/19 0:00:00,Outside chance: dress up your exterior
2019/10/19 0:00:00,Brexit: Johnson urges support for Brexit deal night before vote
2019/10/19 0:00:00,Crunch time for Boris Johnson as MPs prepare to vote on Brexit deal
2019/10/19 0:00:00,"Donald Trump bashes Democrats as ‘crazy,’ unpatriotic at Texas rally"
2019/10/19 0:00:00,"Killers who shot dead ‘hero’ Australian father ‘will pay for this’, sheriff warns"
2019/10/19 0:00:00,US makes history with first all-female space walk
2019/10/19 0:00:00,Police investigating stash of cash found at Ruinerwold farm
2019/10/19 0:00:00,Adelaide’s blooming market has agents calling for more properties
2019/10/19 0:00:00,Wootoona Matata: No-worries living on St Georges’ most sought-after street
2019/10/19 0:00:00,Danny O’Brien back from the brink after cobalt saga and eyes second Caulfield Cup with Vow And Declare
2019/10/19 0:00:00,Home values are tipped to rise in Belmont’s southeast with high school zone changes
2019/10/19 0:00:00,Manly has a shortage of listings but what is on offer is top quality
2019/10/19 0:00:00,Education is key to a stress-free home buying experience
2019/10/19 0:00:00,Fully renovated Federation house is a rare find in leafy Cammeray
2019/10/19 0:00:00,Selling for the first time with chook house and convict bricks
2019/10/19 0:00:00,NSW HIA-CSR Awards: The best home designs you can build yourself
