date,title
2019/05/23 0:00:00,South Australia’s DreamBIG Children’s Festival adds drag queen story time sessions to its program
2019/05/23 0:00:00,Formula One great Niki Lauda remembered at practice for Monaco Grand Prix
2019/05/23 0:00:00,NRL | Panthers end horror streak in error-riddled win over Eels
2019/05/23 0:00:00,Monaco Grand Prix: Lewis Hamilton slammed for dodging media
2019/05/23 0:00:00,Famous British children’s book author Judith Kerr dies at 95
2019/05/23 0:00:00,Conor McGregor is taking a page out of LeBron James’ book
2019/05/23 0:00:00,Randwick runners vying for spots on winter carnival assault team
2019/05/23 0:00:00,Western Sydney Wanderers sign Swiss goalkeeper Daniel Lopar
2019/05/23 0:00:00,"Nine western swamp tortoises born at Adelaide Zoo, helping survival of critically endangered species"
2019/05/23 0:00:00,Spice Girls reunion tour: Everything you need to know
2019/05/23 0:00:00,Former Secretary of State reveals ‘unprepared’ Trump was on ‘unequal footing’ with Putin
2019/05/23 0:00:00,Enough to get the Heart racing as Bart Sinclair relives some of his finest memories from Eagle Farm
2019/05/23 0:00:00,"Count: Number of people sleeping rough in Adelaide soars to 227, up from 143 at same time last year"
2019/05/23 0:00:00,Drake’s antics during Game 4 drew the ire of many and Kevin Hart joined in
2019/05/23 0:00:00,UK Prime Minister Theresa May could be forced out over Brexit mess
2019/05/23 0:00:00,"Jackson Scott Wood leaps dock of District Court after hearing guilty verdict, is immediately crash-tackled by sheriff’s officers"
2019/05/23 0:00:00,How Ivan Milat’s brother Alex was the accidental architect of his downfall
2019/05/23 0:00:00,Royal kiss sends an important message about Kate’s relationship with the Queen
2019/05/23 0:00:00,Famous LA home featured in movies and television shows hits the market
2019/05/23 0:00:00,Two men seriously injured in bizarre fish tale
2019/05/23 0:00:00,Indian election results: Narendra Modi sweeps to landslide victory
2019/05/23 0:00:00,Peak-hour chaos on the Calder Fwy after multi-car crash
2019/05/23 0:00:00,Kevin Muscat won’t have a say on his Melbourne Victory successor
2019/05/23 0:00:00,Vivid Sydney 2019: How to navigate the chaotic light festival
2019/05/23 0:00:00,Stars lose it over Toy Story 4’s ending
2019/05/23 0:00:00,Delays after earlier crashes on the Pacific Motorway
2019/05/23 0:00:00,Geoffrey Rush awarded $2.9 million defamation payout
2019/05/23 0:00:00,"Woman reports April attack in Oaklands Park, following another assault caught on camera there last week"
2019/05/23 0:00:00,District Court rules Renmark High stabber Amber Rover not guilty by reason of mental incompetence
2019/05/23 0:00:00,AFL 2019 Round 10 teams: Lance Franklin returns; De Goey misses out
2019/05/23 0:00:00,Whale Beach trophy home sells to local buyer for more than $8M
2019/05/23 0:00:00,Kate Iselin: The perks of dating older men
2019/05/23 0:00:00,Why Kate’s $4800 dress looks familiar
2019/05/23 0:00:00,Shoppers are obsessed with $59 dress from Target
2019/05/23 0:00:00,A Christies Beach home is set right on the Esplanade
2019/05/23 0:00:00,Accused incest family heads to trial
2019/05/23 0:00:00,ScUber: Uber announces new rideshare service underwater
2019/05/23 0:00:00,Two words you won’t hear in the Aladdin remake
2019/05/23 0:00:00,How a pair of boots ended Elliotte Frankie’s career
2019/05/23 0:00:00,"Airfares ‘will definitely be higher’, aviation expert warns"
2019/05/23 0:00:00,The consumer watchdog says Kogan ‘misled customers’ with a confusing discount
2019/05/23 0:00:00,A ‘perfect storm’ looks set to stimulate real estate market
2019/05/23 0:00:00,‘Brazen scam’: NDIS fraud accused to seek bail
2019/05/23 0:00:00,Deloitte chief global marketing officer David Redhill selling up in Vaucluse
2019/05/23 0:00:00,Alison Brahe and Cameron Daddo discuss marriage on Studio 10
2019/05/23 0:00:00,Israel Folau’s wife Maria makes Netball World Cup squad
2019/05/23 0:00:00,Inside Sex and the City star Kristin Davis’ LA home that’s just hit the market
2019/05/23 0:00:00,‘Killer’ teen’s chilling 911 call after dad’s grisly dog collar murder
2019/05/23 0:00:00,21-year-old university student falls to her death taking a photo
2019/05/23 0:00:00,Bizarre choice to replace Hugh Jackman as Wolverine
2019/05/23 0:00:00,"Ex-junk food addict who ditched Macca’s, KFC and fizzy drinks lost 31kg without doing any exercise"
2019/05/23 0:00:00,Reject Shop CEO out after profit warning
2019/05/23 0:00:00,Child murderer and rapist to be released from prison in a month
2019/05/23 0:00:00,Rare beachfront home with 15m oceanfront selling in Narrabeen
2019/05/23 0:00:00,Simple trick to getting the most out of your 20s
2019/05/23 0:00:00,Car lover’s paradise listed in semirural Kenthurst
2019/05/23 0:00:00,One Nation truck was ignited by a discarded cigarette according to authorities
2019/05/23 0:00:00,Racing identity Damion Flower charged over alleged smuggling cocaine operation
2019/05/23 0:00:00,Queensland mum raffling off $1.52 million ‘pet resort’
2019/05/23 0:00:00,Why three major changes could signal positive change for Central Coast real estate
2019/05/23 0:00:00,Game of Thrones: How Gwendoline Christie predicted ending in 2017
2019/05/23 0:00:00,Glamorous Moonee Ponds mansion with ‘five-star hotel feel’
2019/05/23 0:00:00,NRL SuperCoach Countdown Show Round 11
2019/05/23 0:00:00,"ABC journalist in Jakarta captures ‘peak Indonesia’ as police, protesters break fast together"
2019/05/23 0:00:00,WA mother admits murdering her baby
2019/05/23 0:00:00,Hatchback proves safer than luxury cars
2019/05/23 0:00:00,Colourful former solicitor Morgan Ryan’s $33m home to test north shore record
2019/05/23 0:00:00,Michael Slater’s World Cup role with Channel 9 clarified
2019/05/23 0:00:00,The Tour de Cure begins it’s inaugural stages in South Australia kicking off this Friday
2019/05/23 0:00:00,Cooper Cronk $21 to win Clive Churchill Medal in final game
2019/05/23 0:00:00,Student accommodation to boost resurrection of Geelong’s central business district
2019/05/23 0:00:00,Sunrise host Samantha Armytage reveals the one word that irritates her when describing her figure
2019/05/23 0:00:00,What it’s like to ride on Sydney’s shiny new Metro Northwest driverless trains
2019/05/23 0:00:00,"Vegan activists fined for abattoir protests, no convictions recorded"
2019/05/23 0:00:00,Husband discovers wife’s multiple affairs after 10 years of marriage
2019/05/23 0:00:00,Spike in flu hospitalisations in 2017 may be related to weak vaccination
2019/05/23 0:00:00,"SA meteorite landed in the Great Australian Bight, US map shows"
2019/05/23 0:00:00,Illegal ozone-depleting gases traced to rogue factories in eastern China
2019/05/23 0:00:00,Bundy begins global rollout of ambitious paternity leave policy
2019/05/23 0:00:00,Mt Lawley
2019/05/23 0:00:00,NRL SuperCoach podcast: Pre-Lockout Round 11
2019/05/23 0:00:00,Three Russian sisters stabbed their ‘mob boss’ father after years of alleged sexual abuse and incest
2019/05/23 0:00:00,The mysterious story behind the murderous Mr White
2019/05/23 0:00:00,Adelaide star Josh Jenkins reveals tough message to wife over mental health
2019/05/23 0:00:00,Showdown explains Anthony Albanese’s rise to Labor leader
2019/05/23 0:00:00,This is why you should double-check your flight number
2019/05/23 0:00:00,Start-up wants to create hypersonic jet to fly from New York to London in 90 minutes
2019/05/23 0:00:00,Ingham’s forced to issue urgent recall on Sweet Chilli Chicken Kiev
2019/05/23 0:00:00,Odds say Bombers are up against it when facing Richmond in Dreamtime game
2019/05/23 0:00:00,Qantas disguises first class seats as $20 ‘cabin in the clouds’ on Airbnb
2019/05/23 0:00:00,Ability at forefront in Endeavour Foundation’s band battle
2019/05/23 0:00:00,Wedding guest shares brutal bill she received from bride after wedding
2019/05/23 0:00:00,Take a look around a new build designed for style and affordability
2019/05/23 0:00:00,The $290 bikini and towel combo that has everyone confused
2019/05/23 0:00:00,AFL teams: See all the ins and outs ahead of a massive Round 10
2019/05/23 0:00:00,"Andrew Bogut and Ben Simmons named in Boomers World Cup squad, Thon Maker forced out"
2019/05/23 0:00:00,Chinese firm suspends Qld mine lease bid
2019/05/23 0:00:00,Sydney teen charged after random police search allegedly reveals backpack contained materials to make bomb
2019/05/23 0:00:00,Man accuses Qantas of ‘fat-shaming’ him out of exit row seat
2019/05/23 0:00:00,Historic Haymarket property to sell for first time in 19 years
2019/05/23 0:00:00,Japan wants international media to put family names first
2019/05/23 0:00:00,NRL welcomes new safety beacon that sends SOS for women in danger
2019/05/23 0:00:00,Adani: Premier Annastacia Palaszczuk’s extraordinary U-turn
2019/05/23 0:00:00,Extremely high cut swimmers slammed online by shoppers
2019/05/23 0:00:00,AFL 2019: Lance Franklin breaks silence on trade chatter
2019/05/23 0:00:00,Kendall Jenner sports bizarre psychedelic outfit amid Ben Simmons breakup claims
2019/05/23 0:00:00,Emotional moment hospital staff create honour guard for dying girl
2019/05/23 0:00:00,Nike accused of low-balling star in sexism storm
2019/05/23 0:00:00,‘Columbine-obsessed’ kids who plotted high school shooting in South Australia released
2019/05/23 0:00:00,Why Aussie workers have trust issues
2019/05/23 0:00:00,Australian couple confess to sharing messages with white supremacists on hate-filled forum
2019/05/23 0:00:00,How Well Do You Know That Star?: Hughesy’s embarrassing quiz show fail
2019/05/23 0:00:00,Vegan protesters fined over Carey Bros abattoir trespass
2019/05/23 0:00:00,Disturbing photo of woman staring at newborn she allegedly cut from pregnant mum
2019/05/23 0:00:00,Weird detail you never noticed about Kate Middleton
2019/05/23 0:00:00,‘Blue collar’ millionaire’s thread about ‘broke people’ goes viral
2019/05/23 0:00:00,Ben Simmons and Kendall Jenner have split
2019/05/23 0:00:00,Mark Jenkin jailed for housing commission manslaughter
2019/05/23 0:00:00,New direction
2019/05/23 0:00:00,Grand home built for Bacchus Marsh founder for sale
2019/05/23 0:00:00,Anthony Albanese unopposed for Labor leadership
2019/05/23 0:00:00,The Pentagon admits to studying existence of UFOs
2019/05/23 0:00:00,Reinvented mid-century design turning heads on South Yarra market
2019/05/23 0:00:00,Cricket World Cup 2019: Every country’s most important player
2019/05/23 0:00:00,"Fonterra closure: Dairy company to shut Victorian plant, 100 jobs lost"
2019/05/23 0:00:00,"Former fraud detective calls on police to investigate mystery of the missing $908,000"
2019/05/23 0:00:00,Harsh reality for GRM: ‘We’re not stoked where we are’
2019/05/23 0:00:00,Nike scraps sneakers after backlash over Panama indigenous row
2019/05/23 0:00:00,Sydney vendors buoyed by increased market sentiment following federal election
2019/05/23 0:00:00,Iconic Whale Beach Wedge House comes to market for the first time
2019/05/23 0:00:00,Whincup: Red Bull Holden can’t afford to ‘drop back to wilderness’
2019/05/23 0:00:00,Chilling detail behind mum and child’s cliff plunge: It was her ‘favourite place’
2019/05/23 0:00:00,Titans on notice as Johns calls for million-dollar Taylor to be dropped
2019/05/23 0:00:00,Collingwood great Tony Shaw says Sydney should shift Lance Franklin to the wing
2019/05/23 0:00:00,"Moby insists that he dated Natalie Portman: ‘I would probably regret dating me, too’"
2019/05/23 0:00:00,Optus says services have been restored after a prolonged outage
2019/05/23 0:00:00,Big wave surfer Mark Mathews takes you inside Shipstern Bluff
2019/05/23 0:00:00,"Pakistani TV news channel accused of ‘justifying’ girls rape, murder"
2019/05/23 0:00:00,Victorian weather: Melbourne’s last warm day of Autumn
2019/05/23 0:00:00,"French Open: Aussie trio bomb out in qualifying to leave five women, six men to fly flag"
2019/05/23 0:00:00,"AFL mid-season draft: How it works, where to watch"
2019/05/23 0:00:00,Coca-Cola revives ‘New Coke’ formula for return of Netflix’s Stranger Things
2019/05/23 0:00:00,England faithful give Steve Smith and Dave Warner perfect welcome back
2019/05/23 0:00:00,‘Are they wasted years?’: The ugly truth behind Panthers’ failed ‘rebuild’
2019/05/23 0:00:00,British woman dies on Ryanair plane just days before her birthday
2019/05/23 0:00:00,Famous couples who had to work together after splitting up
2019/05/23 0:00:00,Pornhub unveils its ‘Bonerless Bathing Suit’ to prevent unwanted public erections
2019/05/23 0:00:00,Healthy dog euthanised to be buried with dead owner as her will requested
2019/05/23 0:00:00,Firefighters stop Campbellfield factory blaze spreading to nearby chemical storage site
2019/05/23 0:00:00,Women’s World Cup: Matildas banking on wealth of experience to get positive results in France
2019/05/23 0:00:00,Margot Robbie goes for a swim in Cannes in white one-piece
2019/05/23 0:00:00,Intoxicated airline passenger faces 20-year jail sentence
2019/05/23 0:00:00,‘F***ing disgusting’: Passenger finds insect ‘baked’ into airport bread roll
2019/05/23 0:00:00,Queen Elizabeth II baffled by self-serve checkout at Sainsbury’s
2019/05/23 0:00:00,Reaction to this year’s NBA All-Defensive Team
2019/05/23 0:00:00,Mum breaks Guinness World Record for longest plank
2019/05/23 0:00:00,Pedestrian struck by truck at intersection of Elwick Rd and King George V Avenue in Glenorchy
2019/05/23 0:00:00,Aladdin remake isn’t the disaster we feared
2019/05/23 0:00:00,Court documents reveal extraordinary details of NFL star’s extortion plot
2019/05/23 0:00:00,Quentin Tarantino snaps at reporter over Margot Robbie question
2019/05/23 0:00:00,British Prime Minister Theresa May faces another coup attempt
2019/05/23 0:00:00,Tesla’s Autopilot has ‘serious safety concerns’ according to Consumer Reports
2019/05/23 0:00:00,‘Busybody’ insult ends in $120k payout
2019/05/23 0:00:00,Trump abruptly storms out of meeting: ‘Get these phony investigations over with’
2019/05/23 0:00:00,"Women work better in warmer offices, study finds"
2019/05/23 0:00:00,Drake blasted for ‘disrespectful’ behaviour during Eastern Conference Finals
2019/05/23 0:00:00,Meghan Markle’s fashion faux pas
2019/05/23 0:00:00,Aussie star Trae ‘Quadzilla’ Williams in rivalry with America’s Carlin Isles
2019/05/23 0:00:00,"Super fast, six camera Samsung S10 5G lands in Australia next week"
2019/05/23 0:00:00,"Credit, debit cards found to be ‘dirtiest payment method’ versus cash, coins, study says"
2019/05/23 0:00:00,Anthony Albanese reveals vision for Labor leadership
2019/05/23 0:00:00,Two men arrested after fatal stabbing in Melbourne’s north
2019/05/23 0:00:00,Prince William’s adorable nickname for Princess Charlotte
2019/05/23 0:00:00,Kevin Durant’s fight with Chris Broussard escalates: Don’t call me a liar
2019/05/23 0:00:00,"Adelaide weather: Last day of sun before cold, rain hits"
2019/05/23 0:00:00,Dustin Johnson ‘still winning’ with Paulina Gretzky after PGA Championship tease
2019/05/23 0:00:00,"Rolls-Royce debuts the $68,000 optional extra"
2019/05/23 0:00:00,Spice Girls offer first look at incredible ‘90s-style reunion tour stage
2019/05/23 0:00:00,FIFA scraps expansion plans for 2022 World Cup in Qatar
2019/05/23 0:00:00,RUSH HOUR: Former WA police officer charged with assault
2019/05/23 0:00:00,Not your average French provincial-style home in Balwyn
2019/05/23 0:00:00,Giro d’Italia: Aussie star Caleb Ewan wins his second stage before pulling out of race
2019/05/23 0:00:00,Super Rugby: Brumbies coach Dan McKellar says getting game on free-to-air television crucial for survival
2019/05/23 0:00:00,2022 FIFA World Cup: Qatar tournament won’t be expanded to 48 teams as FIFA stay with 32
2019/05/23 0:00:00,This may just be the most luxe home ever sold in St Clair
2019/05/23 0:00:00,Game of Thrones stars Maisie Williams and Lena Headey on how show should have ended
2019/05/23 0:00:00,Deadly storms cause havoc across the US with more on the way
2019/05/23 0:00:00,British Prime Minister Theresa May ‘hanging by a thread’ to leadership
2019/05/23 0:00:00,"Jake Patterson sentenced for abducting Jayme Closs, 13, and murdering her parents"
2019/05/23 0:00:00,Not all doom and gloom for Daniel Ricciardo despite Renault’s miserable start
2019/05/23 0:00:00,Democrats and Nancy Pelosi accuse Donald Trump of cover-up
2019/05/23 0:00:00,"Emilia Clarke studied Hitler for epic Game of Thrones finale speech, worried she would ‘f**k it up’"
2019/05/23 0:00:00,Who is the probable new Labor leader Anthony Albanese?
2019/05/23 0:00:00,Zoe Kravitz secretly marries boyfriend Karl Glusman
2019/05/23 0:00:00,"Mass arrests at ‘Go Topless’ event in Galveston, Texas"
2019/05/23 0:00:00,Johnny Depp has accused Amber Heard of abusing multiple ex-girlfriends and her former wife
2019/05/23 0:00:00,Usman Khawaja rocked after Aussies roll the Windies
2019/05/23 0:00:00,Aaron Fraser gets dad Michael Haim jailed in 20-year-old cold case involving his mother
2019/05/23 0:00:00,Sunrise host Samantha Armytage reveals 10kg weight loss
2019/05/23 0:00:00,Bensville home transformed for Selling Houses Australia has been sold
2019/05/23 0:00:00,Is this the ultimate family home on the banks of the Huon River?
2019/05/23 0:00:00,Increased buyer activity sees a Cremorne semi sell in only a week
2019/05/23 0:00:00,Interior decorator’s modern take on a warehouse with eco-cred
2019/05/23 0:00:00,Bargain houses within 50km of CBD on the market around Australia
