date,title
2019/10/29 0:00:00,75k texts in two months: Woman charged with allegedly pushing boyfriend to take his own life
2019/10/29 0:00:00,Bumper avocado crop means luscious fruit is more affordable than ever
2019/10/29 0:00:00,"British tourist yelled ‘shark, shark’ as he was bitten in the Whitsundays"
2019/10/29 0:00:00,The Louw down: Springboks to lean on inside knowledge of England’s ‘kamikaze kids’
2019/10/29 0:00:00,First look inside Kurdish-run prison in northern Syria where hundreds of suspected IS members are held
2019/10/29 0:00:00,Real-life ‘sleeping beauty’ who sleeps for 22 hours a day diagnosed with another rare condition
2019/10/29 0:00:00,Nurse’s job on the line after using gay slur against transgender people on Facebook
2019/10/29 0:00:00,The Project descended into chaos tonight after Tommy dropped a dirty joke
2019/10/29 0:00:00,‘Bring it on’: Billy Vunipola ready for a Bok onslaught after copping tips from his auntie
2019/10/29 0:00:00,Revealed: Every Melbourne Storm fixture for season 2020
2019/10/29 0:00:00,Supanova Comic Con & Gaming asks Adelaide’s fans: ‘Do you want this event in your city or not?’
2019/10/29 0:00:00,Amazing Race evictees Judy and Therese wished they ‘got the boxing gloves out’
2019/10/29 0:00:00,Football superstar Cristiano Ronaldo edges out host of celebs
2019/10/29 0:00:00,Deliveryman destroys ‘swastika’ in case of mistaken identity
2019/10/29 0:00:00,Why it was so strange to hear a crowd boo Donald Trump
2019/10/29 0:00:00,Michelle Payne has teed off at owner over decision to change jockey
2019/10/29 0:00:00,Warning after toy car bursts into flames on the Gold Coast
2019/10/29 0:00:00,"Former world No.1s, grand slam champs descend on Kooyong Classic"
2019/10/29 0:00:00,Tasmania bushfires: Fire service battle blazes across state
2019/10/29 0:00:00,Last chance to enter Tassie’s best (or worst) tatts competition
2019/10/29 0:00:00,Tasmania Fire Service says blaze may put Scamander at high risk
2019/10/29 0:00:00,Recall of Core Powerfoods extended after salmonella outbreak
2019/10/29 0:00:00,Melbourne Cup 2019: Glen Boss appeal adds to pre-race drama
2019/10/29 0:00:00,"Alleged rape victim begged Chinese actor to stop, court told"
2019/10/29 0:00:00,High St house the hottest in Tasmania
2019/10/29 0:00:00,Bidder walks to end 22-minute auction stalemate over Highton property
2019/10/29 0:00:00,Salmonella outbreak widens as SA Health issues urgent recall of CORE Powerfoods with a 2020 best before date
2019/10/29 0:00:00,Aaron Finch wants Australian T20 side to be No.1 in the world ahead of next year’s World Cup
2019/10/29 0:00:00,Melbourne Cup 2019: Jockey Craig Williams bullish about Vow And Declare’s chances in big one
2019/10/29 0:00:00,Delays after tree falls onto wiring at Newtown train station
2019/10/29 0:00:00,Bradley Cooper’s two-year-old daughter pictured at awards ceremony
2019/10/29 0:00:00,NBA Briefs: Joel Embiid detonates on the Hawks; Curry and the Warriors bounce back
2019/10/29 0:00:00,What is the best dog for me? Different breeds discussed by experts
2019/10/29 0:00:00,‘Disobedience is my job’: Royal’s scandalous sex life revealed
2019/10/29 0:00:00,NSW govt refuses to pay for Milat funeral
2019/10/29 0:00:00,GoT creators David Benioff and DB Weiss pull out of Star Wars trilogy
2019/10/29 0:00:00,"Crack heard as deck collapsed, killing two"
2019/10/29 0:00:00,Developer Bill Gertos selling Ashbury home at the centre of a bizarre squatter’s rights case
2019/10/29 0:00:00,"Nathan Schembri, man who had sex with 13yo girl jailed"
2019/10/29 0:00:00,‘It could bring down the monarchy’: Sad truth hidden in ‘candid’ photo of the Queen
2019/10/29 0:00:00,Wentworth Courier: All properties across Sydney’s east up for sale now in your local paper
2019/10/29 0:00:00,Macquarie Sports Radio axed; Mark Allen’s cruel double blow
2019/10/29 0:00:00,Gai Waterhouse chasing Melbourne Cup berth with Japanese-bred stayer Hush Writer
2019/10/29 0:00:00,Virgin Australia announces first-ever flights to Tokyo
2019/10/29 0:00:00,‘Like a 10-year drunk party’: Game of Thrones showrunners slammed for tone-deaf Q&A
2019/10/29 0:00:00,Tax Office to return money from inactive super accounts from Friday
2019/10/29 0:00:00,Two popular petrol stations in Gladesville are set to be sold off by Caltex
2019/10/29 0:00:00,Prince Charles was not Camilla’s first choice – Andrew Parker Bowles was
2019/10/29 0:00:00,Guide for judges advises women ‘dont ask for rape’ and not to call Indigenous people ‘n****r’
2019/10/29 0:00:00,Former GM boss Bob Lutz slams Tesla for ‘terminally ugly’ car
2019/10/29 0:00:00,Rafael Nadal’s honeymoon cut short as ATP Finals approach
2019/10/29 0:00:00,Fight Club: Brad Pitt and Edward Norton both predicted the film would be a flop
2019/10/29 0:00:00,Students protest outside NSW high school following teacher’s rape comments
2019/10/29 0:00:00,Woolwich home to sell after more than 100-years in one family
2019/10/29 0:00:00,Woman’s ‘genius’ hack for sleeping on plane divides opinions
2019/10/29 0:00:00,"Manly star Manase Fainu charged with stabbing offence, stood down by NRL"
2019/10/29 0:00:00,Grandfather charged in death of granddaughter who fell from cruise ship
2019/10/29 0:00:00,Three more NSW apartment towers have ‘significant issues’ according to building commissioner
2019/10/29 0:00:00,Concerning truth behind baseball’s famous flashers
2019/10/29 0:00:00,The naughtiest and nicest baby names of 2019
2019/10/29 0:00:00,Melbourne Cup 2019: Godolphin stayer Ispolini under injury cloud
2019/10/29 0:00:00,Green Point vendor loved childhood street so much she bought house next door
2019/10/29 0:00:00,ACCC challenges Google over location data
2019/10/29 0:00:00,Woolworths to be first in Australia with zero-waste food delivery system
2019/10/29 0:00:00,Three Instagram models banned after ‘exposing’ themselves during game
2019/10/29 0:00:00,Design Sydney’s most exciting building to win a trip to Luna Park
2019/10/29 0:00:00,"St George Bank, Bank SA and Bank of Melbourne all down after outage"
2019/10/29 0:00:00,‘Beating the drums of war’: Photo reveals ‘devastating’ Iran plan
2019/10/29 0:00:00,Father of slain Perth girls ‘found a bloody hammer’ near their bodies
2019/10/29 0:00:00,‘Can you spot the problem?’: Big bank trap costing you thousands
2019/10/29 0:00:00,"Apple announces AirPods Pro with noise cancellation and better fit, but the big problems remain unsolved"
2019/10/29 0:00:00,Two men bitten on legs by shark off Airlie Beach in Queensland
2019/10/29 0:00:00,"Up to 40,000 to sue Australian Government in country’s largest class action"
2019/10/29 0:00:00,Qantas launch new way of earning Frequent Flyer points
2019/10/29 0:00:00,Footy player and TV host Matty Johns has a surprising hobby
2019/10/29 0:00:00,Brisbane’s AFLW side to play games at the Gabba in 2020
2019/10/29 0:00:00,Man dies after getting stuck upside down on 88-metre chimney for 14 hours
2019/10/29 0:00:00,Tammy Hembrow shocks fans with next-level ‘naked’ bikini
2019/10/29 0:00:00,Reality star unrecognisable before losing a staggering 100kg
2019/10/29 0:00:00,Southwest flight attendant says she was warned to stay silent about live-stream allegations
2019/10/29 0:00:00,Confusion over drought policy after David Littleproud’s comments on Q&A
2019/10/29 0:00:00,Real Housewives of Sydney star Krissy Marsh relists Double Bay unit after sale falls through
2019/10/29 0:00:00,How Adele lost nearly 20kgs after splitting from husband
2019/10/29 0:00:00,"Bank staff help woman pay out ex-husband’s divorce fees with $11,000 in coins"
2019/10/29 0:00:00,"Double-headers, 13 new venues and some ticketed AFL Women’s games headline 2020 fixture"
2019/10/29 0:00:00,"One All Black, zero Wallabies: Rugby legend Brian O’Driscoll’s reveals surprising Team of the World Cup"
2019/10/29 0:00:00,Golden Eagle 2019: Arcadia Queen new favourite for $7.5m race after Brutal draws wide
2019/10/29 0:00:00,Newborn babies at the WCH have been hit with a flu outbreak
2019/10/29 0:00:00,Who is Jenny B? Outrage over marketing ‘scam’ sweeping the US
2019/10/29 0:00:00,Coles Little Shop 2 collectables failed to deliver sales results
2019/10/29 0:00:00,Scott Cam snaps at Tess and Luke: ‘Finish the bloody house’
2019/10/29 0:00:00,East Gosford auctions: two properties sold above reserve in a matter of hours
2019/10/29 0:00:00,‘What is that? Take it off’: Woman ‘humiliated’ by bouncer’s request to remove hijab
2019/10/29 0:00:00,Woman dead following explosion at a gender reveal party
2019/10/29 0:00:00,"Girl, 13, found with welts and bruises after alleged abuse by woman known to her in Sydney"
2019/10/29 0:00:00,Weird reality of Queen’s life at Buckingham Palace
2019/10/29 0:00:00,"Moving Mountains launches vegan burger, hot dog with fake meat that bleeds"
2019/10/29 0:00:00,Is premium economy worth it? The new airline battleground
2019/10/29 0:00:00,Secret US ‘space plane’ finally lands after 780 days in orbit – and no one knows what it did
2019/10/29 0:00:00,First look inside Western Sydney’s new international airport terminal
2019/10/29 0:00:00,Major delays on Pakenham line after person struck by train
2019/10/29 0:00:00,Ruby Rose’s lesbian sex scene in Batwoman praised by viewers
2019/10/29 0:00:00,"NSW becomes second state to introduce digital driver’s licence, but don’t throw out your wallet just yet"
2019/10/29 0:00:00,Tallulah Willis’ racy Halloween tribute to dad Bruce
2019/10/29 0:00:00,NRL 2020 season fixture revealed: World first NRL-Super Rugby double header
2019/10/29 0:00:00,‘On fire’: Fierce 21-year-old grazier Kate McBride confronts minister over drought
2019/10/29 0:00:00,Mitchell Starc to miss T20 clash to attend high jump star brother’s wedding
2019/10/29 0:00:00,How a selfie of two schoolgirls exposed a shocking family secret
2019/10/29 0:00:00,Job seekers vent fury at the ‘broken’ Jobactive system and allege ‘rorting’ of taxpayers
2019/10/29 0:00:00,‘I’m just so proud of him’: Emotional Lucy Brownless opens up on Paddy McCartin’s ‘scary’ concussion symptoms
2019/10/29 0:00:00,"Ashleigh Petrie, fiancee of Victorian magistrate Rodney Higgins, has died"
2019/10/29 0:00:00,Dwight Howard’s ‘bizarre’ body transformation
2019/10/29 0:00:00,Madrid supporter is as loyal as they come
2019/10/29 0:00:00,Missing backpacker’s dad disputes Cambodian authorities’ disappearance theory
2019/10/29 0:00:00,Dwayne ‘The Rock’ Johnson’s most epic cheat meals
2019/10/29 0:00:00,Bride’s horror at ‘awful’ wedding cake fail
2019/10/29 0:00:00,‘I don’t feel sorry for them’: Ivan Milat refuses to apologise to victims’ families
2019/10/29 0:00:00,Major delays for V-Line passengers after train fire
2019/10/29 0:00:00,Supernatural star Jared Padalecki’s brutal mugshot after assault arrest
2019/10/29 0:00:00,‘Drug test at the dinner table’: Paul Gallen opens up on ‘demeaning and amateurish’ ASADA
2019/10/29 0:00:00,"Codey Herrmann to be sentenced for rape, murder of Aiia Maasarwe in Melbourne"
2019/10/29 0:00:00,‘A very good boy!’: Trump tweets photo of dog injured in raid to kill ISIS leader Abu Bakr al-Baghdadi
2019/10/29 0:00:00,Cannibalistic smiling salamander may unlock secrets for limb regeneration
2019/10/29 0:00:00,Nissan: Why ute buyers won’t compromise for hybrids
2019/10/29 0:00:00,Clean Sweep: KonMari expert reveals secrets to a tidy and organised house
2019/10/29 0:00:00,Climate change activists and police clash outside mining conference in Melbourne
2019/10/29 0:00:00,Amazing Race viewers bugged by host Beau Ryan’s ‘creepy’ habit
2019/10/29 0:00:00,"Sonny Bill Williams receives richest contract offer in NRL, rugby union history"
2019/10/29 0:00:00,Warren Gatland learns not to question Eddie Jones’ England
2019/10/29 0:00:00,EU agrees to postpone Britain’s Brexit divorce for three months
2019/10/29 0:00:00,"Today in history, October 29: Lindy Chamberlain convicted for daughter’s murder"
2019/10/29 0:00:00,Apple urges iPhone 5 and iPhone 4S users to update now before they lose vital functions
2019/10/29 0:00:00,"Elizabeth South home, car damaged in overnight fire attack"
2019/10/29 0:00:00,‘It’s all gone’: Shock twist in ongoing Block cash crisis
2019/10/29 0:00:00,"‘Pretty daunting’: Industrial unit owners await updates after factory fire in Alexandria, Sydney"
2019/10/29 0:00:00,Cop told to ‘tone down gayness’ for promotion is awarded $29 million
2019/10/29 0:00:00,Death of Islamic State leader sparks controversial comparisons between Donald Trump and Barack Obama
2019/10/29 0:00:00,Jennifer Aniston confirms Friends cast is working on a secret project
2019/10/29 0:00:00,Ben Affleck confirms relapse: ‘I won’t let it derail me’
2019/10/29 0:00:00,Bus gets ‘eaten’ by the streets of Pittsburgh
2019/10/29 0:00:00,Painstaking identification work continues as Vietnamese families come forward
2019/10/29 0:00:00,RUSH HOUR: Shocking details about gender reveal explosion released
2019/10/29 0:00:00,Ash Barty breaks down her stunning rise to the top of women’s tennis
2019/10/29 0:00:00,The German teen was trying to woo his ex-girlfriend
2019/10/29 0:00:00,Second major blow to Islamic State: Al-Baghdadi’s ‘right-hand man’ dead
2019/10/29 0:00:00,Top Guns can fly home to SA’s first residential airpark at Goolwa
2019/10/29 0:00:00,China and US may sign trade deal in Chile
2019/10/29 0:00:00,The Cambridges and Sussexes to reunite on Remembrance Sunday
2019/10/29 0:00:00,Lifeguard ‘threatened with speargun’ at Cronulla beach
2019/10/29 0:00:00,Beerenberg Family Farm reopens pick your own strawberries for the season
2019/10/29 0:00:00,A drought-proof farm in rural Australia? You betcha!
2019/10/29 0:00:00,Six expats share traditional dishes and stories about their journeys at Adelaide’s OzAsia Festival
2019/10/29 0:00:00,Microsoft announces Telstra official partner for Australian launch of Xbox All Access
2019/10/29 0:00:00,Morning Wars review: Does Apple TV+’s big gamble pay off?
2019/10/29 0:00:00,Renovation pays off as Newtown sellers reap $155K auction reward
2019/10/29 0:00:00,Labor offers new spin on climate change crisis: jobs and exports
2019/10/29 0:00:00,Attractive Victorian-era home on the city fringe
