date,title
2019/07/09 0:00:00,What did Jeffrey Epstein’s famous friends know and see?
2019/07/09 0:00:00,President Trump hits back at UK government over Brexit ‘mess’ after leaked emails describing White House as ‘inept’
2019/07/09 0:00:00,Serena Williams wins three-set thriller against Alison Riske at Wimbledon
2019/07/09 0:00:00,"Donald Trump attacks UK’s Theresa May, ambassador over leaked memo"
2019/07/09 0:00:00,"Missing mother and son Sarah Tate and Thomas Bakyrey found by police in Launceston, Tasmania"
2019/07/09 0:00:00,Meghan Markle’s security team allegedly told tennis fans not to take photos at Wimbledon
2019/07/09 0:00:00,The capital city suburb where more than half of properties are selling at a loss
2019/07/09 0:00:00,Vlad Guerrero Jr. hits dingers for days as Home Run Derby records tumble
2019/07/09 0:00:00,Burns ‘peel skin off’ Perth tunnel worker
2019/07/09 0:00:00,PhD candidate tests microbes found in nature to reduce disease and allergies
2019/07/09 0:00:00,Hong Kong scraps extradition bill
2019/07/09 0:00:00,One brothel left in historic WA district
2019/07/09 0:00:00,University cheats could soon face jail and a massive fine under a proposed new law
2019/07/09 0:00:00,‘I’ll pay anything’: Daniel Sturridge issues heartfelt plea to get stolen dog back
2019/07/09 0:00:00,Heartwarming story behind autistic girl’s favourite dress
2019/07/09 0:00:00,Cricket World Cup semi-final between India and New Zealand put on ice
2019/07/09 0:00:00,Facebook and YouTube to tackle fake cancer-treatment videos
2019/07/09 0:00:00,The father of a young man who died of caffeine toxicity speaks about his son’s final hours
2019/07/09 0:00:00,‘The Big One is coming’: Californian earthquakes ignite Yellowstone ‘supervolcano’ fears
2019/07/09 0:00:00,New Zealand landlord mocked for laughable ‘bedroom’ containing laundry
2019/07/09 0:00:00,Man arrested after unconscious woman on back of motorbike dumped
2019/07/09 0:00:00,New measles case in Sydney after young man developed symptoms following a trip to South East Asia
2019/07/09 0:00:00,Aziz Ansari is a changed man after Me Too
2019/07/09 0:00:00,"Girl, 3, drowns after falling from boat on Sydney’s Hawkesbury River"
2019/07/09 0:00:00,Tasmanian trainer Adam Trinder excited about Cox Plate favourite Mystic Journey’s potential
2019/07/09 0:00:00,Floyd Mayweather gets dropped by Larry ‘Bone Collector’ Williams
2019/07/09 0:00:00,Criniti family to sell Parramatta site at auction but restaurant will stay open
2019/07/09 0:00:00,Geelong star Patrick Dangerfield unveils new Surf Coast home design
2019/07/09 0:00:00,Khloe Kardashian accused of ‘excessive spending’ on daughter True
2019/07/09 0:00:00,Luna Atelier’s Alessandra Eddy’s Woollahra townhouse a rare find
2019/07/09 0:00:00,Classic family home appeals to buyers far and wide
2019/07/09 0:00:00,Adelaide flu crisis — everything you need to know to avoid getting sick this winter
2019/07/09 0:00:00,Sydney’s latte line that hides city’s 'shameful secret’
2019/07/09 0:00:00,"SuperFooty Podcast: Listen as Mark Robinson, Jay Clark and Jon Anderson debate all the big footy issues"
2019/07/09 0:00:00,Paul Pogba and Jesse Lingard separated during heated Perth exchange
2019/07/09 0:00:00,Blue Mountains trophy home The Highlands at Leura listed for sale
2019/07/09 0:00:00,Trainer Edward Cummings snares first winner after branching out on his own
2019/07/09 0:00:00,Aldi store in Melbourne’s southeast evacuated over bomb fears
2019/07/09 0:00:00,Travel Deal Tuesday: The escapes to spend your tax refund on
2019/07/09 0:00:00,Champions League pitch invader Kinsey Wolanski claims she was jailed after failed Copa America final stunt
2019/07/09 0:00:00,Large cannabis crop seized at house in Hewett
2019/07/09 0:00:00,LIVE: NRL teams Round 17
2019/07/09 0:00:00,"South Yarra modernist home, Kew mansion with French antiques sell"
2019/07/09 0:00:00,Severe weather warning issued as storm set to sweep into SA
2019/07/09 0:00:00,Man sentenced to jail over one punch death of Queensland dad
2019/07/09 0:00:00,Domino’s Pizza to trial cashless ‘tap-and-take only’ stores
2019/07/09 0:00:00,Top offer breaks $1M but falls short of securing rare Belmont property
2019/07/09 0:00:00,‘Catastrophic’ risk run by doomed Russian nuclear submarine
2019/07/09 0:00:00,Russell Westbrook’s time in Oklahoma looks to have run its course
2019/07/09 0:00:00,Police operation
2019/07/09 0:00:00,The Bachelor: Former contestant claims Nick Cummins was paid staggering amount
2019/07/09 0:00:00,The Castle house: restoration begins at new Beechworth site
2019/07/09 0:00:00,Honeymooners’ shock as British Airways plane starts leaking after storm delays flight
2019/07/09 0:00:00,"Kew East: bar, cinema and billiard room create ultimate man cave"
2019/07/09 0:00:00,‘It’s not what friends do’: Chinese spy ship’s ‘disturbing’ message
2019/07/09 0:00:00,NSW beach evacuated after two metre whaler shark spotted near boardrider
2019/07/09 0:00:00,Luke Howarth wants a positive spin on homelessness. He’s right. There are so many positives
2019/07/09 0:00:00,‘Go lower’: Epstein teen reveals billionaire’s creepy come-on
2019/07/09 0:00:00,Netflix acquires The Rock’s Red Notice
2019/07/09 0:00:00,Woman who developed cystic acne at 30 ditches make-up and is happier than ever
2019/07/09 0:00:00,Tacko Fall is a monster of a player and he makes everyone else look tiny
2019/07/09 0:00:00,Roger Federer and Rafael Nadal butt heads over Wimbledon court speed
2019/07/09 0:00:00,Home of Pat Morley oval namesake sold in Long Jetty
2019/07/09 0:00:00,Explosion at Mortlake gas-fired power station could threaten electricity supply
2019/07/09 0:00:00,Snoop Dogg shares Kurt Cobain photo without realising it’s fake
2019/07/09 0:00:00,Raceday focus: Ray Thomas’s best bets and inside mail for Grafton
2019/07/09 0:00:00,Christians in Australia need to ‘suck it up and calm down’ over religious freedom battle
2019/07/09 0:00:00,Australian Taxation Office to target expats owing on student debts
2019/07/09 0:00:00,Mystery surrounds the tragic death of couple in possible murder-suicide
2019/07/09 0:00:00,The huge cost of taking this popular travel selfie
2019/07/09 0:00:00,Bill Gates says Steve Jobs ‘cast spells on people’ but he saw through it
2019/07/09 0:00:00,Stranger Things breaks Netflix record after four days
2019/07/09 0:00:00,Australia didn’t get to see the real Ash Barty behind the scenes at Wimbledon
2019/07/09 0:00:00,Rev up your retirement savings by working out how much you’ll need
2019/07/09 0:00:00,"SA phonebox shooter, who witchdoctor said was cursed by black magic, avoids jail time"
2019/07/09 0:00:00,"What’s on TV: Squinters, Robbie Hood, My Life is Murder and more"
2019/07/09 0:00:00,Why Roo should not be caught out for speaking on hop
2019/07/09 0:00:00,Rowing Australia has lost a true professional after his sudden death on Monday
2019/07/09 0:00:00,Coles revives free hot chook policy: How to nab a free roast chicken
2019/07/09 0:00:00,Heart-breaking video reveals the last moments of doomed Himalayan climbers
2019/07/09 0:00:00,Pilots soar to Toowoomba for new aviation degree
2019/07/09 0:00:00,Blog with Kenty: Where does Cameron Smith sit among game’s greats?
2019/07/09 0:00:00,Byron Bay-based model Olive Cooke settles on Lennox Head block of land
2019/07/09 0:00:00,South Korean actor faces Thai jail for reality TV stunt
2019/07/09 0:00:00,Roger Federer gets reporter to offer resignation in hilarious press conference
2019/07/09 0:00:00,Famous couple spend whopping $140k on daughter’s first birthday
2019/07/09 0:00:00,Kincumber acreage with original house smashes reserve at auction
2019/07/09 0:00:00,"Roll up, roll up: Fitzroy warehouse home to circus company for sale"
2019/07/09 0:00:00,Ivanka Trump to receive  British apology over ‘embarrassing’ leak slamming Trump administration
2019/07/09 0:00:00,"AFL 2019: Jeff Kennett behaviour is ‘stupid’ and ‘clownish’, says Caroline Wilson"
2019/07/09 0:00:00,Billionaire financier Jeffrey Epstein pleads not guilty to sex trafficking charges
2019/07/09 0:00:00,Matt Gillett officially ruled out of Origin Game 3 after bizarre backflip
2019/07/09 0:00:00,Lance Innes discovered his father had three other secret families — and that was just the start of it
2019/07/09 0:00:00,Kim Kardashian reveals painful reality of her Met Gala look
2019/07/09 0:00:00,Islamic State terrorist who helped kill over 130 people in Paris attacks receives compensation from jail
2019/07/09 0:00:00,Doctor reveals hellish scene as he battled to save man who overdosed at festival
2019/07/09 0:00:00,ATO pleads ‘wait a few weeks’ to lodge tax return as unprecedented call volumes cause staffing chaos
2019/07/09 0:00:00,"Wimbledon 2019 | Ash Barty reacts to shock loss, reveals reason for quirky quotes"
2019/07/09 0:00:00,Toddler falls to her death while on Royal Caribbean cruise ship
2019/07/09 0:00:00,Hemsworth Byron Bay mansion: First glimpse inside the celebrity couple’s amazing new home
2019/07/09 0:00:00,Calls for mobile ban at train stations
2019/07/09 0:00:00,Jessica Chastain reveals fellow Hollywood star she is mistaken for
2019/07/09 0:00:00,Phil Gould roasts Queensland champion with brutal prediction
2019/07/09 0:00:00,Tennis ace Pat Rafter and Thor star Chris Hemsworth good Byron Bay neighbours
2019/07/09 0:00:00,"‘Both were inseparable’: New details of Kameron Cline, Brittney Searson’s friendship emerge"
2019/07/09 0:00:00,AFL Briefs: Crows torched over Showdown; Suns priority pick
2019/07/09 0:00:00,Heidi Klum stuns with racy lingerie Instagram posts
2019/07/09 0:00:00,Could this be KFC’s biggest and best burger yet?
2019/07/09 0:00:00,‘Sexiest doctor alive’ saves passenger’s life on flight to Israel
2019/07/09 0:00:00,Renée Zellweger looks exquisite as Judy Garland in upcoming movie biopic
2019/07/09 0:00:00,"Westpac forced to repay 40,000 customers after home loans error"
2019/07/09 0:00:00,AFP searched journalists’ metadata almost 60 times in one year
2019/07/09 0:00:00,British Airways faces record-breaking fine over data breach
2019/07/09 0:00:00,Kendall Jenner stuns in skimpy bikini during Greek getaway
2019/07/09 0:00:00,Hundreds evacuated as fire destroys buildings at Adels Grove Camping Park
2019/07/09 0:00:00,‘F***ing important’ truth behind American World Cup team’s swimsuit shoot
2019/07/09 0:00:00,"Barbary lion cubs born, bulls in the sea in Spain: News of the day in photos"
2019/07/09 0:00:00,Kawhi Leonard was working the phones behind the scenes of NBA Free Agency
2019/07/09 0:00:00,High-end market picks up in West Pennant Hills
2019/07/09 0:00:00,Volkswagen reveal modern Kombi van concept
2019/07/09 0:00:00,"Nick Kyrgios, Serena Williams, Fabio Fognini fined for Wimbledon antics"
2019/07/09 0:00:00,Chinese warship sending ‘unsubtle’ message to Australian military
2019/07/09 0:00:00,Pair jailed for killing WA man Nathan Haynes outside Pilbara pub
2019/07/09 0:00:00,Vet warns of cases of rare rat disease in dogs visiting Sydney park
2019/07/09 0:00:00,Lisa Oldfield reveals financial problems after split with politician husband
2019/07/09 0:00:00,Q&A: Penny Wong delivers ‘emotional’ message to Israel Folau
2019/07/09 0:00:00,Actor Kip Pardue fined for ‘masturbating in front of horrified co-star’
2019/07/09 0:00:00,"Queen will ‘give up her powers’ in two years, royal expert predicts"
2019/07/09 0:00:00,Alison Riske breaks down after emotional win over Ash Barty at Wimbledon
2019/07/09 0:00:00,Two men arrested after allegedly breaking into old Fort Largs academy
2019/07/09 0:00:00,Sarah Jessica Parker’s shock claims about Sex and the City co-star
2019/07/09 0:00:00,Raid on billionaire’s mansion allegedly uncovers nude photos of underage girls
2019/07/09 0:00:00,Manly set to offer Trbojevic brothers Jake and Tom a monster $10 million deal
2019/07/09 0:00:00,RUSH HOUR: First copycat charged over ice cream licking prank
2019/07/09 0:00:00,Make the most from cans and bottles as recycling goes hi-tech
2019/07/09 0:00:00,Extent of serial killer’s horrendous crimes revealed in new documentary
2019/07/09 0:00:00,Heritage home with ‘timeless renovation’ sells for pretty price
2019/07/09 0:00:00,Rafael Nadal wades into Wimbledon scheduling debate involving Ash Barty
2019/07/09 0:00:00,American Vice President Mike Pence pledges course of maximum pressure against Iran
2019/07/09 0:00:00,Cori ‘Coco’ Gauff loses at Wimbledon but leaves with an army of admirers
2019/07/09 0:00:00,Teenage climber scales London building without a harness
2019/07/09 0:00:00,Mariah Carey pops off a bottle top - using only her voice
2019/07/09 0:00:00,Top 10 SA locations where rent is dropping like it’s hot
2019/07/09 0:00:00,Adelaide’s most diverse suburb offers something for everyone
2019/07/09 0:00:00,Public health professor warns of dangerous ‘natural’ supplements in common use
2019/07/09 0:00:00,Great garaging a rare bonus for new owners of inner city pad
2019/07/09 0:00:00,The Block 2019: Stylish grandads Mitch and Mark are flipping good at selling property
2019/07/09 0:00:00,This Stanmore semi for sale looks unrecognisable after incredible renovation
2019/07/09 0:00:00,Stoney Oak is 60ha of bliss just 15 minutes from Sorell
