date,title
2019/02/11 0:00:00,‘Equine traffic’ Winx’s main danger in Apollo Stakes
2019/02/11 0:00:00,Incredible college basketball buzzer beater stuns US
2019/02/11 0:00:00,Couple forced housemate to sleep in a ‘Harry Potter cupboard’
2019/02/11 0:00:00,Chilling moment woman is abducted in broad daylight captured on camera
2019/02/11 0:00:00,Widow recalls husband’s horror death after mistreatment at nursing home
2019/02/11 0:00:00,Hakeem al-Araibi released as extradition proceedings dropped
2019/02/11 0:00:00,‘Like a job interview’: MAFS virgin roasted
2019/02/11 0:00:00,‘Mel acted in the only way appropriate by calling out the language’: Nine responds
2019/02/11 0:00:00,SEDA College SA sports-focuses school officially opens
2019/02/11 0:00:00,James Weir recaps Married At First Sight 2019 episode 10
2019/02/11 0:00:00,Goodstart Early Learning opens larger new centre in Plympton
2019/02/11 0:00:00,Adelaide Fringe director Heather Croall to guest edit The City
2019/02/11 0:00:00,Raceday focus: Gilbert Gardiner previews Kyneton
2019/02/11 0:00:00,Charity building project home set to go under the hammer to raise funds for the Little Heroes Foundation
2019/02/11 0:00:00,"Gene Charles Bristow denies kidnapping, raping European backpacker at his Meningie property"
2019/02/11 0:00:00,Widow of chef Justin Bull post heartbreaking Instagram messages about late husband
2019/02/11 0:00:00,Football commentator Simon Hill questions FFA culture after sacking of Matildas coach
2019/02/11 0:00:00,The partners of Australia’s brought their fashion A-game to cricket’s night of nights
2019/02/11 0:00:00,Why some people can get cash refunds thanks to franking credits
2019/02/11 0:00:00,Refugee footballer Hakeem Al-Araibi freed from Thai jail
2019/02/11 0:00:00,Topshop staff told to wear ‘revealing clothes’ when boss Philip Green visited
2019/02/11 0:00:00,"Man leaves expletive laden note on window of boutique, wishing failure upon his neighbour"
2019/02/11 0:00:00,Tony Mokbel stabbed in prison
2019/02/11 0:00:00,Shocking reality for Australia’s victims of forced marriage
2019/02/11 0:00:00,Long delays expected after five-vehicle crash near Ipswich Motorway at Darra
2019/02/11 0:00:00,FFA hit back at Alen Stajcic’s accusations over Matildas axing
2019/02/11 0:00:00,Enjoy modern style and rural views in Maslin Beach
2019/02/11 0:00:00,Shane Warne backs Australia to drop two stars for Ashes as Aussie legends lash England
2019/02/11 0:00:00,Run for the Kids is Samantha Bell’s way of saying thanks to the Royal Children’s Hospital
2019/02/11 0:00:00,AFLW MRP: Kangaroo Kaitlyn Ashmore gets reprimand but Giant Nicola Barr sent to tribunal
2019/02/11 0:00:00,"Phoebe Knudsen, 17, fighting for life after Swan River speedboat crash"
2019/02/11 0:00:00,"What’s on TV this week: Miracle Workers, Dirty John, The Umbrella Academy and more"
2019/02/11 0:00:00,Why Brandon Smith is happy to play second fiddle to Storm skipper Cameron Smith
2019/02/11 0:00:00,‘We’re going to get so pissed later!’ Olivia Colman’s hilariously awkward speech steals show at BAFTAs
2019/02/11 0:00:00,Truck’s wide load blocks major NSW highway
2019/02/11 0:00:00,The Australians being evicted from their township
2019/02/11 0:00:00,Majak Daw makes big return to North Melbourne on team photo day
2019/02/11 0:00:00,"Raceday focus: Best bets and tips at Gosford, Lismore"
2019/02/11 0:00:00,Rabbitoh’s young gun Adam Doueihi buys into Bass Hill investment market
2019/02/11 0:00:00,British NFL hopeful Lawrence Okoye was caught out in a police prostitution sting
2019/02/11 0:00:00,Anti-vaxxer movement blamed for rise in measles
2019/02/11 0:00:00,Rüfüs Du Sol use huge Oz tour as Coachella warm up
2019/02/11 0:00:00,"‘I was yelling at Charlie – you’ve got two kids, you’ve got to stop,’ wife told court"
2019/02/11 0:00:00,"Your guide to the Victorian Caravan, Camping and Touring Supershow"
2019/02/11 0:00:00,Brisbane’s most talked about home sells after one inspection
2019/02/11 0:00:00,Dua Lipa rocks safety-pin dress in tribute to Liz Hurley’s iconic look
2019/02/11 0:00:00,Nielsen January 2019: DailyTelegraph.com.au surges 8% in unique audience and whopping 172% in subscribers
2019/02/11 0:00:00,England thump France in rugby Six Nations but Tom Curry’s face steals the show
2019/02/11 0:00:00,Aussie cricket great presents alarming Justin Langer rumour
2019/02/11 0:00:00,New research uncovers why suicide is so hard to predict
2019/02/11 0:00:00,Why Brisbane man snapped up first home in just two weeks
2019/02/11 0:00:00,A perfect example of seamless indoor/outdoor living
2019/02/11 0:00:00,The estate a gold nugget built for a who’s who list of owners
2019/02/11 0:00:00,"Dayne Zorko reveals golfing pressure relief, believes Brisbane Lions can play finals in 2019"
2019/02/11 0:00:00,Buyers make their move in Camperdown and Enmore on first big auction day of 2019
2019/02/11 0:00:00,Internet loves this Grammys audience member
2019/02/11 0:00:00,Robert Whittaker speaks after pulling out of UFC 234
2019/02/11 0:00:00,Why millennials keep getting naked in public
2019/02/11 0:00:00,"Even if you still wanted to visit Venezuela, you probably couldn’t"
2019/02/11 0:00:00,Ariana Grande slams Grammys over ‘trash’ Mac Miller snub; wears dress at home
2019/02/11 0:00:00,How to stop zombie insurance from eating your super nest egg
2019/02/11 0:00:00,The key moments from Scott Morrison’s appearance at the National Press Club
2019/02/11 0:00:00,Manchester United vs PSG: Five United changes that give hope of Champions League progression
2019/02/11 0:00:00,‘He’s so hot’: Ines and Sam confirm shock MAFS affair
2019/02/11 0:00:00,"Tusmore Park tree that fell on partygoer had previously lost a branch, neighbours says"
2019/02/11 0:00:00,‘Aladdin’ movie: First look at Will Smith as Genie fails to impress
2019/02/11 0:00:00,How to help farmers in flood-ravaged Queensland
2019/02/11 0:00:00,Scott Morrison’s very dark message to Australians
2019/02/11 0:00:00,‘He’s been the best for a decade’: Bromance blooms for Mitchell and Chambers
2019/02/11 0:00:00,Labor demands immediate law changes after royal commission
2019/02/11 0:00:00,"Child freak becomes internet phenomenon, breaks ankles in crazy videos"
2019/02/11 0:00:00,Pat Cummins and Alyssa Healy win the Australian Cricket Awards big gongs
2019/02/11 0:00:00,Bloggers are loving this $40 Cotton On skirt that looks expensive
2019/02/11 0:00:00,‘Not a scare campaign’: Mortgage brokers launch massive TV ad blitz warning of higher interest rates
2019/02/11 0:00:00,JB Hi-Fi’s half-year profit lifts 5.5 per cent to $160 million
2019/02/11 0:00:00,Townsville flood victims desperately need pantry staple to treat mould
2019/02/11 0:00:00,"Fittler makes early call on Blues, as NSW prepares for shield defence"
2019/02/11 0:00:00,Big property in Newcomb to become tidy little earner for buyers
2019/02/11 0:00:00,WA Treasurer Ben Wyatt slams John Holland for “selective media leaking” over reported $20m State Government settlement
2019/02/11 0:00:00,"MAFS: Lauren and Matthew ‘banned’ from speaking to each other, reports"
2019/02/11 0:00:00,Ray Beltran floors Hiroki Okada
2019/02/11 0:00:00,Simple tricks to get through airports faster
2019/02/11 0:00:00,How Uber Eats is impacting apartment design
2019/02/11 0:00:00,Disturbing emergency text message scam making the rounds
2019/02/11 0:00:00,Who votes for Grammy Awards and how are winners decided?
2019/02/11 0:00:00,Who will lead the Democrats in the 2020 election?
2019/02/11 0:00:00,W-League grand final: Sydney FC v Perth Glory
2019/02/11 0:00:00,Code brown: ‘Poo cabbie’ caught in the act
2019/02/11 0:00:00,A man has been charged after a pursuit in the Northern Suburbs
2019/02/11 0:00:00,Scott Morrison faces challenging week as parliament returns
2019/02/11 0:00:00,McLaughlin reveals Mustang livery as Supercars title defence nears
2019/02/11 0:00:00,Major WWII shipwreck discovered: Japanese battleship sunk by US found
2019/02/11 0:00:00,Port Macquarie dream farm is frequented by dolphins
2019/02/11 0:00:00,Flood-affected farmers witness entire cattle herds wiped out by catastrophic deluge
2019/02/11 0:00:00,Teenager critical after freak Swan River speedboat accident during WA Speed Boat Club race
2019/02/11 0:00:00,"Yes, Bronson had every right to use that word"
2019/02/11 0:00:00,UFC world still divided over Israel Adesanya after Anderson Silva blockbuster
2019/02/11 0:00:00,US-backed forces in ‘final battle’ to rid Syria of Islamic State
2019/02/11 0:00:00,Historic Lara cottage listed for sale as development site
2019/02/11 0:00:00,Koala and cat’s unlikely friendship
2019/02/11 0:00:00,Investors continue to see value in popular Belmont pockets
2019/02/11 0:00:00,Bank programmer jailed after stealing ‘free’ cash from ATMs
2019/02/11 0:00:00,MAFS: Bronson speaks out after shocking C-bomb outburst
2019/02/11 0:00:00,Humbled F1 driver Max Verstappen serves his F1 punishment
2019/02/11 0:00:00,Brawl involving eight men spills into Melbourne’s Chapel Street
2019/02/11 0:00:00,"Man trapped, traffic at a standstill after highway crash"
2019/02/11 0:00:00,"NBA: Ben Simmons’ first proper three-point attempt stemmed from private chat with Brett Brown, and we may see more of it"
2019/02/11 0:00:00,MAFS Jessika Power’s stunning lingerie pictures
2019/02/11 0:00:00,Boom Broncos recruit picked for Rabbitohs’ country trial match
2019/02/11 0:00:00,Why this innocent-seeming real estate listing has gone viral
2019/02/11 0:00:00,James Weir recaps Married At First Sight 2019 episode 9
2019/02/11 0:00:00,How a birthday cake prank landed a family in hospital
2019/02/11 0:00:00,The resort-like home on the beaches with a strong pedigree
2019/02/11 0:00:00,Duchess of Sussex’s half-sister signs lucrative media deals
2019/02/11 0:00:00,Video shows Elon Musk’s staggering year of private jet flights
2019/02/11 0:00:00,Unions back next school strike in Australia ahead of 2019 federal election
2019/02/11 0:00:00,Internet trolls run wild after Kendall’s wandering eye lands on LeBron
2019/02/11 0:00:00,Agents report ‘different vibe’ to 2019 Melbourne auction market
2019/02/11 0:00:00,Sergio Aguero matches Alan Shearer’s Premier League hat-tricks record as Manchester City thrash Chelsea
2019/02/11 0:00:00,‘We’re Not Gonna Take It’: Universal Music Publishing Group launches legal action against Clive Palmer
2019/02/11 0:00:00,Cricket team’s epic collapse blows minds
2019/02/11 0:00:00,Burgess brothers announce big baby news
2019/02/11 0:00:00,SuperCoach BBL Bible: Semi-Finals
2019/02/11 0:00:00,"‘Grubby, pathetic’: Tim Wilson lashes out during tense interview about franking credits inquiry"
2019/02/11 0:00:00,St. Valentine’s Day Gift Guide 2019
2019/02/11 0:00:00,Auckland Falls Restaurant accused of racism after group called ‘Asians’ on receipt
2019/02/11 0:00:00,El Paso residents have hit back at Trump who claims the border has made the city safer
2019/02/11 0:00:00,‘My Kitchen Rules’: Josh and Austin hit back at ‘weird’ Manu
2019/02/11 0:00:00,Jimmie Johnson wins Daytona exhibition after wild crash wipes out almost entire field
2019/02/11 0:00:00,IMF warns of global economic ‘storm’
2019/02/11 0:00:00,UBank launches world’s first digital home loan adviser
2019/02/11 0:00:00,Lindsey Vonn’s career ends on an emotional high
2019/02/11 0:00:00,Melbourne man Duane Hutchings shot and killed at Oakleigh East
2019/02/11 0:00:00,Wife dishes on secret WAG’s group behind some of the world’s biggest sports stars
2019/02/11 0:00:00,Hitler paintings fail to sell at Germany’s Weidler auction house
2019/02/11 0:00:00,"Senior minister Christopher Pyne unleashes on state of politics, explains why Julie Bishop was snubbed"
2019/02/11 0:00:00,Love rat scams $2.6m from 27 women he seduced
2019/02/11 0:00:00,Tyson Fury confirms he made good on $13 million promise
2019/02/11 0:00:00,Best and worst dressed at the 2019 Grammy Awards
2019/02/11 0:00:00,BAFTAs red carpet: Best and worst dressed
2019/02/11 0:00:00,Australia defeats USA to progress to Fed Cup semi finals
2019/02/11 0:00:00,Model Nikki Phillips moving into Cronulla
2019/02/11 0:00:00,Flooding: Queensland grazier wants money for farmers before foreign aid
2019/02/11 0:00:00,"Scientology High Priestess Shelly Miscavige will ‘never be free’, father-in-law claims"
2019/02/11 0:00:00,The Walking Dead Season 9 finally returns to Foxtel after mid-series cliffhanger
2019/02/11 0:00:00,Jamie Carragher says Maurizio Sarri has ‘turned Chelsea into Arsenal’
2019/02/11 0:00:00,Talk show host Andy Cohen slammed by 'dad-shamers’ over baby’s first flight
2019/02/11 0:00:00,Magic Johnson’s suggestive Ben Simmons statement
2019/02/11 0:00:00,BAFTA Awards 2019: All the nominations
2019/02/11 0:00:00,"Rapidly declining insect populations spell ‘catastrophic’ trouble, scientists warn"
2019/02/11 0:00:00,Melbourne man found with gunshot wound to stomach
2019/02/11 0:00:00,Meghan accuses her ‘Daddy’ of breaking her heart ‘into a million pieces’ in emotional letter
2019/02/11 0:00:00,West Australian man caught drink-driving with whopping BAC
2019/02/11 0:00:00,Famous Titanic line Leonardo DiCaprio almost didn’t say
2019/02/11 0:00:00,I’m a Celeb: Yvie Jones’ tearful confession
2019/02/11 0:00:00,Air New Zealand flight turns back several hours into journey after China denies permission to land
2019/02/11 0:00:00,Daniel Ricciardo reveals frustration at being overlooked by Mercedes and Ferrari
2019/02/11 0:00:00,"Donald Trump has explained what his “executive time” entails, following a leaked report of his schedule"
2019/02/11 0:00:00,Amazing reno: Meet the home turning heads in Teneriffe
2019/02/11 0:00:00,Police still hunting for predator who tackled young girl by waist in brazen daylight attack
2019/02/11 0:00:00,Chelsea manager Maurizio Sarri admits his job is ‘at risk’ after Manchester City demolition
2019/02/11 0:00:00,These are the worst red carpet looks in Grammys history
2019/02/11 0:00:00,How I retired at 38 — and you can too
2019/02/11 0:00:00,"‘I want the truth, my career is in tatters’: Sacked Matildas coach Alen Stajcic breaks silence"
2019/02/11 0:00:00,Inside Kristaps Porzingis’ trade from New York to Dallas
2019/02/11 0:00:00,England thrash France in Six Nations clash at Twickenham
2019/02/11 0:00:00,Kylie Jenner creates theme park for daughter Stormi’s first birthday
2019/02/11 0:00:00,Tony Jones has confirmed he will leave ABC’s Q&A before the year is up
2019/02/11 0:00:00,Cops can’t do much about football ‘scumbags’ who mocked plane crash victim
2019/02/11 0:00:00,Downsizer’s dilemma is finding a car to fit in a very small garage
2019/02/11 0:00:00,New Chevrolet Silverado is bigger than Texas
2019/02/11 0:00:00,Man Utd star with pregnant girlfriend slept with model in budget hotel
2019/02/11 0:00:00,Sydney commuters warned to expect delays after car crashes into signalling box
2019/02/11 0:00:00,Border wall talks break down ahead of second possible government shutdown
2019/02/11 0:00:00,More than 20 large payphones with rotating screens to be installed in Adelaide
2019/02/11 0:00:00,RUSH HOUR: Shoppers filmed brawling at Western Australian store
2019/02/11 0:00:00,Block winners moving on from their Hunter Valley escape that they builtng on
2019/02/11 0:00:00,Why you need to take stock of the royal commission changes
2019/02/11 0:00:00,Sublime Manchester City humiliate Chelsea with a 6-0 thrashing
2019/02/11 0:00:00,"Gone in a flash, an Upper Sturt log cabin is hot property"
2019/02/11 0:00:00,Brad Pitt joins a star-studded crowd at Jennifer Aniston’s 50th birthday bash
2019/02/11 0:00:00,Telethon researchers keep tabs on newbie parents’ journey
2019/02/11 0:00:00,The women left behind by child sex offenders
2019/02/11 0:00:00,Buyers search for value to stretch real estate dollar further
2019/02/11 0:00:00,Meghan Markle stood up NBA personality after he ‘worked up the courage’ to ask her out
2019/02/11 0:00:00,Saudis deny involvement with National Enquirer-Bezos ‘blackmail’ plot
2019/02/11 0:00:00,Chimps use branch as ladder to escape Belfast zoo enclosure
2019/02/11 0:00:00,Third suspect linked to poisoning of ex Russian spy and daughter carried out other attacks
2019/02/11 0:00:00,Rolf Harris ‘under house arrest’ after wandering onto school grounds following prison release
2019/02/11 0:00:00,Expats cashing in on a favourable lower north shore property market
2019/02/11 0:00:00,Luxury home smashes Hamlyn Heights suburb record
2019/02/11 0:00:00,North Shore home sells after 50 years to local family
2019/02/11 0:00:00,Buyer pays $40K premium on post war Hamlyn Heights house on a big block
2019/02/11 0:00:00,Luxurious family home with endless appeal
