date,title
2019/08/10 0:00:00,Wallabies defeat All Blacks in record Bledisloe boilover
2019/08/10 0:00:00,US President Trump says Kim has asked for another meeting and has apologised for ‘ridiculous’ missile tests
2019/08/10 0:00:00,Billionaire paedophile Jeffrey Epstein found dead in jail cell
2019/08/10 0:00:00,Jeffrey Epstein’s Australian ‘sex slave’ Virginia Giuffre reacts to disgraced financier’s death
2019/08/10 0:00:00,Drought doesn’t deter search for 2019 Farmer of the Year
2019/08/10 0:00:00,John Fordham meets his idol Billy Joel as he battles cancer again
2019/08/10 0:00:00,Sledging war heats up ahead of second Ashes Test at Lord’s
2019/08/10 0:00:00,Young couple to roll up sleeves after snapping updated Belmont home at bumper hot auction
2019/08/10 0:00:00,Video shows Aussie tourist caught in Bali rampage
2019/08/10 0:00:00,Ute fire on Port River Expressway leads to drugs discovery at Wingfield
2019/08/10 0:00:00,Rodney Fox’s stolen signed Jaws book returned after 25 years
2019/08/10 0:00:00,Luke Nolen has last laugh as So Si Bon ends winless streak in Aurie’s Star Handicap
2019/08/10 0:00:00,ATT: Steve Smith keeps scoring as Hogmanay digs deep to win
2019/08/10 0:00:00,Rick Stein spruiks local for the Delicious Harvey Norman Produce Awards
2019/08/10 0:00:00,Sunday fix: Jungle’s Edge’s bleed ban; outsider’s incredible run
2019/08/10 0:00:00,The Bachelor: Matt Agnew’s pre-show makeover
2019/08/10 0:00:00,Scuffles break out as protesters face off at CPAC in Sydney
2019/08/10 0:00:00,Anthony Freedman youngster opens door to Caulfield Guineas
2019/08/10 0:00:00,Silent Command bounces back to winning form at Murray Bridge
2019/08/10 0:00:00,Australian fantasy author Jay Kristoff says his Nevernight trilogy won’t end like TV’s Game of Thrones
2019/08/10 0:00:00,Raceday focus: Best bets and inside mail for Narromine and Wagga Wagga
2019/08/10 0:00:00,Bledisloe Cup 2019 | Wallabies thrash All Blacks at Optus Stadium in Perth
2019/08/10 0:00:00,AFL score review under fire as fans believe wrong replay used in Collingwood v Demons clash
2019/08/10 0:00:00,Rosehill wrap: Alizee’s Missile Stakes win raises more questions than answers
2019/08/10 0:00:00,Out-of-control bushfire threatened homes on NSW mid-north coast
2019/08/10 0:00:00,Downsizers pay a whopping $740k above reserve for a Kirribilli unit with Sydney Harbour views
2019/08/10 0:00:00,South Australian man killed after hitting tree in Thredbo
2019/08/10 0:00:00,The Hundred: Shane Warne’s Ed Sheeran pledge for new Lord’s team
2019/08/10 0:00:00,Seddon auction: Albert St dump’s big sale a happy ending for owner
2019/08/10 0:00:00,Gold Coast teen dies after crashing stolen ute
2019/08/10 0:00:00,"Three killed in two truck crashes in three days, as police crackdown snares 100 dodgy drivers"
2019/08/10 0:00:00,A star is prawn: This guy is no shrimp
2019/08/10 0:00:00,Woman reveals her sister’s ‘staged’ Instagram post
2019/08/10 0:00:00,Kylie Jenner celebrates 22nd birthday with week-long festivities
2019/08/10 0:00:00,Greensborough auction: buyers take it to the limit and beyond
2019/08/10 0:00:00,Antonio Brown threatens to walk away from the NFL over helmet
2019/08/10 0:00:00,"Trans-tasman Bubble: Breathtaking two-day road trip, coast to coast in New Zealand"
2019/08/10 0:00:00,Money versus sex: the big gender divide that affects our thinking
2019/08/10 0:00:00,"Robbie Farah's career in jeopardy as Bulldogs shock Tigers, Eels beat Knights, Dragons slay Titans"
2019/08/10 0:00:00,Prince Andrew accused of groping woman at Jeffrey Epstein’s home
2019/08/10 0:00:00,North Korea points to end of nuclear talks with hostile move
2019/08/10 0:00:00,"AFL Saturday: Bulldogs embarrass Essendon, Lions smash Suns, Cats beat North, Port power past Sydney, Pies down Dees"
2019/08/10 0:00:00,Pro-democracy activists stage airport sit-in as China bans Cathay staff
2019/08/10 0:00:00,Why the time is ripe for home buyers and sellers in Brisbane
2019/08/10 0:00:00,"Altona fantasy house with Alice in Wonderland, Harry Potter themes sold"
2019/08/10 0:00:00,AFL teams Round 21: See all the ins and outs for this week’s games
2019/08/10 0:00:00,‘Ideal role model’: Meghan Markle and Prince Harry pay tribute to late Princess Diana on social media
2019/08/10 0:00:00,Tiger Woods in doubt for Presidents Cup amid fresh injury scare
2019/08/10 0:00:00,Mum has huge growth on leg removed after 10 years
2019/08/10 0:00:00,US President’s ‘thumbs up’ picture with orphaned baby sparks outrage
2019/08/10 0:00:00,Brisbane prices at bottom of property price cycle
2019/08/10 0:00:00,Rogers Cup 2019: Serena smokes Osaka; Nadal emerges from Fog
2019/08/10 0:00:00,Sydney home auctions: Couple pay $100k above reserve for Tempe home in quick and firey auction
2019/08/10 0:00:00,US President Donald Trump says he wants ‘meaningful’ background checks for gun owners
2019/08/10 0:00:00,MotoGP Austria: Andrea Dovizioso upbeat as Marc Marquez lights up practice timesheets
2019/08/10 0:00:00,‘Oldest move in the book’: Taylor Swift slammed after Vogue cover
2019/08/10 0:00:00,Pop star John Mayer’s press conference piss-take
2019/08/10 0:00:00,"Rural NSW residents told ‘threats to homes have eased,’ as fire crews battle to contain the blaze"
2019/08/10 0:00:00,Williamstown Osborne House: mansion for sale for first time in decades
2019/08/10 0:00:00,Tarantino’s fabulously flawed love letter to Golden Age of Hollywood
2019/08/10 0:00:00,Why it is important to complete due diligence when buying an off-the-plan apartment
2019/08/10 0:00:00,Alastair Clarkson stars in the AFL’s first snow game
2019/08/10 0:00:00,Warriors halfback Blake Green explodes: ‘Why not just kick us out of comp?’
2019/08/10 0:00:00,The Lion King: Remake gets ‘deepfake’ makeover
2019/08/10 0:00:00,"‘Insane’ weather, including snow and 113km winds hits south east Australia"
2019/08/10 0:00:00,New Jaguar F-Pace SVR review: Underneath the SUV is a hardcore performance car
2019/08/10 0:00:00,Regional Victorian property: ‘cheapie’ towns best bets for investors
2019/08/10 0:00:00,How two edgy architects have designed their Collingwood home
2019/08/10 0:00:00,Snow tumbles in Canberra during GWS v Hawthorn game
2019/08/10 0:00:00,Cricket Australia tour match vs Worcestershire: Ashes hopefuls’ late push spoiled by weather
2019/08/10 0:00:00,Saudi Arabia to host world heavyweight championship rematch between Andy Ruiz and Anthony Joshua
2019/08/10 0:00:00,‘So humiliating’: Taylor Swift gets real about feud with Kim Kardashian and Kanye West
2019/08/10 0:00:00,The new car sales winners and losers
2019/08/10 0:00:00,England drop Ashes selection bombshell ahead of second Ashes test
2019/08/10 0:00:00,Two accessed photos of dead football star
2019/08/10 0:00:00,The Ashes 2019: England dump Moeen Ali for Lord’s showdown; Jofra Archer set to face Aussies
2019/08/10 0:00:00,Brooke Hogan reveals the stories behind some of her favourites
2019/08/10 0:00:00,Canada murders: Bryer Schmegelsky’s father apologises to victims’ families on 60 Minutes
2019/08/10 0:00:00,Wallabies legend Drew Mitchell backs James O’Connor to cause the All Blacks headaches
2019/08/10 0:00:00,Australian UFC Champion Robert Whittaker’s jab at trash talking Israel Adesanya
2019/08/10 0:00:00,‘Don’t burst into tears’: Moment Steve Smith nearly lost it again
2019/08/10 0:00:00,Celebrities who spat the dummy in interviews
2019/08/10 0:00:00,El Paso shooter Patrick Crusius was targeting ‘Mexicans’
2019/08/10 0:00:00,Drunk flight attendant busted after passing out for entire trip
2019/08/10 0:00:00,"Meghan, Duchess of Sussex wants to change how women see their bodies after childbirth"
2019/08/10 0:00:00,Olympian Michael Barisone shoots Lauren Kanarek who feared for her life
2019/08/10 0:00:00,"Polar blast: Cold front brings strong winds, freezing conditions"
2019/08/10 0:00:00,Donald Trump says Washington isn’t ready to finalise a trade deal with Beijing as tensions simmer
2019/08/10 0:00:00,"Come home to a luxurious lifestyle that just works at 17 Opey St, Hyde Park"
2019/08/10 0:00:00,NT News changing to new tabloid format from Monday
2019/08/10 0:00:00,Elite commandos join hunt for Nora Quoirin as family open up about her rare brain condition
2019/08/10 0:00:00,Can rebooted SeaChange spark another surge to Geelong lifestyle properties?
2019/08/10 0:00:00,The retreat guaranteed to de-stress the most jangled of nerves
2019/08/10 0:00:00,Home seekers urged to buy Sydney property soon or risk paying a higher price
2019/08/10 0:00:00,Is the time right to pack up and move to Little Swanport?
