date,title
2019/06/22 0:00:00,Sam Kerr offered near $1 million two-year contract to join Chelsea
2019/06/22 0:00:00,"‘I was a skinny, nerdy, pimply kid’: Luke Mitchell on his acting rise and his first major US role"
2019/06/22 0:00:00,Friends create film to help mental health of rural farmers
2019/06/22 0:00:00,Super Rugby: Brumbies beat Sharks 38-13 in quarter-final
2019/06/22 0:00:00,Ash Barty one win away from No. 1 ranking after semi-final win in Birmingham
2019/06/22 0:00:00,Rebel bikie member Bradley Danielle wanted for breaching sentencing order
2019/06/22 0:00:00,Former Liverpool star Dietmar Hamman arrested over alleged Sydney assault
2019/06/22 0:00:00,Elwin Soto wins light flyweight title in controversy
2019/06/22 0:00:00,Barefoot Investor Scott Pape urges homeowners to focus on paying down their debt
2019/06/22 0:00:00,"From rags to soft drink riches, George Marchant’s extraordinary story lives on"
2019/06/22 0:00:00,Nine dead after small plane crashes on Hawaiian island of Oahu
2019/06/22 0:00:00,Child’s Play spat: Original creator hits out at reboot
2019/06/22 0:00:00,Sold sticker goes up at Bellevue Hill mansion once owned by former PM Sir William McMahon
2019/06/22 0:00:00,Tudor house wins Game of Owns with $7.1 million record price at auction
2019/06/22 0:00:00,Queensland State of Origin star Moses Mbye almost dies in training camp mishap
2019/06/22 0:00:00,Northcote architects sell stylish and unassuming home
2019/06/22 0:00:00,"India looks way too good for Afghanistan, but can the Kiwis cement their semi-final spot?"
2019/06/22 0:00:00,Engaging underdogs ensnare audience in award-winning tale Parasite
2019/06/22 0:00:00,Exuberant Beatles rom-com hits all the right notes
2019/06/22 0:00:00,Six kids arrested after abandoned Big Brother house set on fire
2019/06/22 0:00:00,Dannii Minogue’s private Hawthorn East home sells after auction
2019/06/22 0:00:00,"RL Test Saturday: NZ v Tonga, Fiji v Lebanon, Samoa v PNG"
2019/06/22 0:00:00,Formjacking: the card skimming online threat you need to watch
2019/06/22 0:00:00,Local buyer secures Geelong home for less than it sold for a year ago
2019/06/22 0:00:00,Marrickville unit described as ‘trickiest sale’ turns surprise result at auction
2019/06/22 0:00:00,"Major bank cuts off Blair Cottrell for ‘commercial’ reasons, prompting a bizarre response"
2019/06/22 0:00:00,Sesar still learning but future looks bright after winning Winter Dash
2019/06/22 0:00:00,Man charged after ‘significant’ shooting incident in suburban Brisbane
2019/06/22 0:00:00,Man crushed by car in DIY accident as ACCC warns of big home car repair toll
2019/06/22 0:00:00,Renter’s highest bid makes move to Newtown’s Skene St permanent
2019/06/22 0:00:00,Millions of reasons Israel Folau doesn’t deserve your money
2019/06/22 0:00:00,"AFL Saturday: Demons-Dockers, Saints-Lions, Power-Cats"
2019/06/22 0:00:00,Joel Creasey challenges Israel Folau to a ‘tougher fight’ than his Rugby Australia legal fundraiser
2019/06/22 0:00:00,Sold for $666: Cheeky punter snaps up Folau’s Wallabies jersey
2019/06/22 0:00:00,Ash Barty can smell No. 1 ranking after quarterfinal win in Birmingham
2019/06/22 0:00:00,Anthony Albanese’s ‘difficult year’ after break-up with Carmel Tebbutt
2019/06/22 0:00:00,Canada’s teen king slams Kyrgios after knocking him out of Queen’s
2019/06/22 0:00:00,Inglis family on a winner with unbeaten filly Funstar
2019/06/22 0:00:00,Raceday focus: Best bets and inside mail for Coonamble and Wagga Wagga
2019/06/22 0:00:00,Tasmania Police statement on Central Highlands incident
2019/06/22 0:00:00,Police called to Boris Johnson’s home over reports of a domestic disturbance
2019/06/22 0:00:00,"Toy Story 4 star Ally Maki on playing Giggles, her mum and getting engaged"
2019/06/22 0:00:00,Scandinavian brothers build stylish hilltop home
2019/06/22 0:00:00,‘We love u from the earth to the moon’: Theo Hayez’s father thanks Byron locals as search for missing son is suspended
2019/06/22 0:00:00,Venus Williams and boyfriend Nicky Hammond split up
2019/06/22 0:00:00,Queensland winger Dane Gagai reveals horror Origin lead-up
2019/06/22 0:00:00,Top interior designer Andrew Parr selling bold Prahran house
2019/06/22 0:00:00,Man shot during home invasion after three armed men storm property
2019/06/22 0:00:00,British Islamic State member ‘Jihadi Jack’ speaks as his parents are found guilty of funding terrorism
2019/06/22 0:00:00,Puck me: World’s sexiest goalkeeper hangs ‘em up
2019/06/22 0:00:00,French GP: Hamilton dices with danger; Vettel attacks F1 culture
2019/06/22 0:00:00,Angus McDonald’s remarkable film Manus only possible after video journalists ‘smuggled in’
2019/06/22 0:00:00,Missing pieces let down haunting mother/daughter drama
2019/06/22 0:00:00,Matthew Perry: Friends star responds after pictures emerge for first time in 2 years | Photo
2019/06/22 0:00:00,Child’s Play killer doll already feels outdated
2019/06/22 0:00:00,"Throwing knives, drugs, cash seized in southeast bust, police allege"
2019/06/22 0:00:00,Famed columnist E. Jean Carroll claims President Trump sexually assaulted her in 1990s
2019/06/22 0:00:00,Tacko Fall offered glimmer of hope; Team-by-team NBA Draft grades
2019/06/22 0:00:00,Melbourne’s property price boom suburbs resisting the downturn
2019/06/22 0:00:00,Cave lair for sale: Wildman of Tallarook and Man from Snowy River site up for grabs
2019/06/22 0:00:00,‘Ready for war’: Tensions between Iran and US reach dangerous new level
2019/06/22 0:00:00,AFL trade news: Bradley Hill ponders requesting a trade to Hawthorn for second straight season
2019/06/22 0:00:00,"Thousands of protesters egged Hong Kong police HQ, barricading officers inside"
2019/06/22 0:00:00,95m in 12 secs: U18 Blues winger Teagan Berry scores with incredible show of pace
2019/06/22 0:00:00,New Citroen C3 Aircross is the antidote to boring cars
2019/06/22 0:00:00,The House Rules chippies share their reno advice
2019/06/22 0:00:00,Meghan and Harry wish William happy birthday on Instagram with an oddly formal message amid reported rift
2019/06/22 0:00:00,England’s World Cup semi-final spot under serious threat
2019/06/22 0:00:00,New BMW 3 Series review: Is the sedan too skewed towards men
2019/06/22 0:00:00,Australia needs to prepare itself as LaVar and LaMelo Ball head to our shores
2019/06/22 0:00:00,Death of Lionheart exposes the true tragedy of professional wrestling
2019/06/22 0:00:00,Donald Trump called off Iran strikes at the last minute after saying drone attack was a ‘very big mistake!’
2019/06/22 0:00:00,Bol Bol vows to ‘prove everyone wrong’ after NBA Draft night shocker
2019/06/22 0:00:00,Verity Hunt-Ballard reveals the stories behind some of her favourites
2019/06/22 0:00:00,Women’s Football World Cup 2019: Noway plan on exploiting Matildas leaky defence in round of 16
2019/06/22 0:00:00,Donald Trump threatens to imprison Time journalist during interview
2019/06/22 0:00:00,"Want for nothing in a family stunner at 5 Wolseley Rd, Blackwood"
2019/06/22 0:00:00,Paris driver in blind man road rage video charged with assault
2019/06/22 0:00:00,Nicki Minaj casts sex offender boyfriend in latest music video
2019/06/22 0:00:00,Rapper Cardi B has been indicted in connection to wild strip club brawl and faces multiple charges
2019/06/22 0:00:00,"Morphettville Racecourse set to burn as Red Rock & Ribs festival brings barbecues, rock music, red wine and classic cars trackside"
2019/06/22 0:00:00,European Union leaders warn next British PM there will be no new Brexit deal
2019/06/22 0:00:00,Spain’s Supreme Court sentences five men known as ‘The Wolf Pack’ to 15 years prison for rape
2019/06/22 0:00:00,Farmers Union Ice Coffee splashes in fashion
2019/06/22 0:00:00,Stunning photos emerge of Caroline Wozniacki and David Lee’s wedding
2019/06/22 0:00:00,Top suburbs peaking in the Territory
2019/06/22 0:00:00,Jacinda Ardern shares deeply relatable Instagram post about parenting
2019/06/22 0:00:00,Towradgi leads the charge for boom suburbs in the Illawarra
2019/06/22 0:00:00,FOMO and stock shortage brings sales surge in upper north shore
2019/06/22 0:00:00,Property prices surge in parts of Sydney’s north and Hunter Region
2019/06/22 0:00:00,Island home closest to Sydney mainland selling for $2 million
2019/06/22 0:00:00,Home buyers say getting loan approval is like winning things or scoring first kiss
2019/06/22 0:00:00,Homelessness increase not helped by failure to provide adequate social and affordable housing
2019/06/22 0:00:00,"In this northern suburbs hot spot, houses sell in an average of just seven days"
2019/06/22 0:00:00,Grand old homes on large northern beaches blocks sell well
2019/06/22 0:00:00,Homeowner and investor confidence to rise
2019/06/22 0:00:00,The Geelong suburbs where buyers can bank on for growth
