date,title
2019/10/21 0:00:00,Meghan Markle may have turned the tide of public opinion with simple sentence in documentary
2019/10/21 0:00:00,Rugby 2019 | Wallabies legends tee off after World Cup failure
2019/10/21 0:00:00,Young woman’s fight for breast cancer diagnosis
2019/10/21 0:00:00,Cody Simpson endures awkward run-in with ex’s big sister
2019/10/21 0:00:00,The Masked Singer: Gorgi Coghlan revealed as the monster
2019/10/21 0:00:00,The headline that highlighted the revolution Australia missed out on
2019/10/21 0:00:00,Press freedom: Australia’s ‘draconian laws’ spark global concern
2019/10/21 0:00:00,Warning about Kmart chew toy
2019/10/21 0:00:00,Kate Ritchie’s marriage to Stuart Webb years before police make AVO application
2019/10/21 0:00:00,The Masked Singer finale proved us all right
2019/10/21 0:00:00,The Masked Singer: Cody Simpson revealed as the robot
2019/10/21 0:00:00,Teenage girl tells of ‘humiliating’ strip search at music festival
2019/10/21 0:00:00,The Masked Singer: Rob Mills revealed as the Wolf
2019/10/21 0:00:00,Rabbitohs want to ‘pay Sam Burgess $3.6M’ to retire from rugby league
2019/10/21 0:00:00,Trip home
2019/10/21 0:00:00,Helping hand
2019/10/21 0:00:00,Teen girls filmed causing chaos in Maitland David Jones store
2019/10/21 0:00:00,Golden Eagle 2019: Arcadia Queen set to soar again in rich sprint
2019/10/21 0:00:00,Seven new Sydney train stations revealed as part of the Western Sydney Metro line
2019/10/21 0:00:00,Rugby World Cup 2019 | Referee sparks
2019/10/21 0:00:00,Comedian Katherine Ryan describes the moment she was robbed
2019/10/21 0:00:00,"Former NRL player, and reserve grader friend, found guilty of assaulting woman"
2019/10/21 0:00:00,Melbourne City’s Connor Metcalfe says FFA Cup final win can give their A-League title hopes a boost
2019/10/21 0:00:00,Kylie Jenner cashes in on ‘rise and shine’ meme with new clothing
2019/10/21 0:00:00,Owner will be ‘livid’ if Humidor misses Cox Plate field
2019/10/21 0:00:00,Bathurst 2019 | Holden drivers lash ‘light’ DJR Team Penske punishments
2019/10/21 0:00:00,Police investigate nine car burglaries in Blackmans Bay
2019/10/21 0:00:00,"Cox Plate 2019: Te Akau Shark, Lys Gracieux draw wide as Humidor misses place in final field"
2019/10/21 0:00:00,New marijuana breathalyser dubbed a ‘game changer’
2019/10/21 0:00:00,Three-year-old colt Castelvecchio tipped to make Cox Plate field
2019/10/21 0:00:00,Georgia Love reveals she’s ‘sick’ of being asked this question on Instagram
2019/10/21 0:00:00,AFL 2019 | Collingwood Magpies go international on Sportscentre interview
2019/10/21 0:00:00,"Australian Mint releases coin for Chinese New Year, Year of the Rat"
2019/10/21 0:00:00,Bart Heart Bart’s connections have a ‘free hit’ in Cox Plate chase
2019/10/21 0:00:00,What it’s really like to travel in Saudi Arabia as a solo female tourist
2019/10/21 0:00:00,Physio who secretly filmed teen avoids jail
2019/10/21 0:00:00,Lucy McEvoy preparing to fly the nest and move to the big smoke as top draft selection looms
2019/10/21 0:00:00,Georgia Patrikios has turned down the noise on social media ahead of the AFL Women’s draft
2019/10/21 0:00:00,"Australian man killed in Philippines shooting, another arrested"
2019/10/21 0:00:00,"Tennis 2019 | Andy Murray wins European Open title, nine month after emotional retirement"
2019/10/21 0:00:00,SA Health warns South Australians of a nation-wide recall for CORE Powerfoods
2019/10/21 0:00:00,"NRL would lose game’s ‘best winger’ if Suliasi Vunivalu leaves, says teammate"
2019/10/21 0:00:00,Raceday focus: Best bets and inside mail for Muswellbrook and Lismore
2019/10/21 0:00:00,Things you shouldn't put on your resume if you want to get the job
2019/10/21 0:00:00,Enoteca Sileno: original home of Carlton North icon sold
2019/10/21 0:00:00,Election roadblock
2019/10/21 0:00:00,"AFP, politicians respond to Your Right to Know campaign"
2019/10/21 0:00:00,Five-year-old helps mum win keys at Bentleigh auction
2019/10/21 0:00:00,Australia’s most expensive home revealed: One Sydney Harbour penthouse sells for over $140m
2019/10/21 0:00:00,Kate Middleton shares first Instagram post from Pakistan tour
2019/10/21 0:00:00,Sydney auction market: Clearance rate above 82 per cent as inner west and Blacktown lead the way
2019/10/21 0:00:00,Byron Bay woman’s ‘dismay’ over restaurant’s reaction to near death
2019/10/21 0:00:00,Trudeau under pressure as Canada heads to polls
2019/10/21 0:00:00,‘Unbelievable’: Lebanon’s cities filled with people protesting government corruption
2019/10/21 0:00:00,Council approves a ‘Wellness Centre’ to be built within new residential estate at Norwest
2019/10/21 0:00:00,Accused Claremont serial killer confesses to rapes
2019/10/21 0:00:00,Singer Maggie Rogers left ‘fuming’ over foul mid-show catcall
2019/10/21 0:00:00,"Flight Centre pays $252,000 in penalties for dodgy holiday ad"
2019/10/21 0:00:00,Daniel Ricciardo wants Renault to finish F1 season strongly
2019/10/21 0:00:00,Mitchell Starc’s revival continues as NSW belt Tasmania by eight wickets
2019/10/21 0:00:00,Brooklyn Beckham has a new girlfriend — and she looks just like his mum
2019/10/21 0:00:00,Canberra woman reveals her weekly expenses and $9000-a-month salary
2019/10/21 0:00:00,Controversy hits surfing’s world title race after Gabriel Medina interference furore
2019/10/21 0:00:00,Question Time: Labor attack Prime Minister Scott Morrison over drought funding
2019/10/21 0:00:00,Trump protesters sprayed after clash at rally on Santa Monica Pier
2019/10/21 0:00:00,Mad Men style house next to idyllic Budgewoi beach up for auction
2019/10/21 0:00:00,Free workshop aims to destigmatise mental health at work to save lives
2019/10/21 0:00:00,Superannuation’s new rule changes that could save you plenty of cash
2019/10/21 0:00:00,Liam Payne says being in One Direction ‘nearly killed’ him
2019/10/21 0:00:00,British Airways stewardess suspended over ‘boozy bust-up between boyfriend and pilot’
2019/10/21 0:00:00,Mystery poo jogger ‘not doing well’ as Jacenko gets slammed for being ‘more gross’
2019/10/21 0:00:00,Aussie superstar in doubt for first T20 vs Sri Lanka as injury worsens
2019/10/21 0:00:00,Woman fined for tiny G-string bikini took precautions to avoid flashing
2019/10/21 0:00:00,Entry-level brick house proves ideal starting point for young buyers in Newtown
2019/10/21 0:00:00,Insight: Melbourne gay couple’s co-parenting arrangement with woman they met online
2019/10/21 0:00:00,Michelle Obama sends Instagram followers into spin with gym photo
2019/10/21 0:00:00,Construction worker falls down hole at site in Sydney’s west
2019/10/21 0:00:00,Surveillance footage shows football coach disarming and hugging student
2019/10/21 0:00:00,New discovery may reveal Amelia Earhart’s fate
2019/10/21 0:00:00,The ‘real reason’ behind the Alan Jones stoush with Scott Morrison
2019/10/21 0:00:00,Woman has perhaps the most Australian name ever and didn’t even realise it
2019/10/21 0:00:00,Melbourne Demons recruit Adam Tomlinson scores big payday after selling Sydney home
2019/10/21 0:00:00,"Mitchell Starc, Marnus Labuschagne shine in the Sheffield Shield"
2019/10/21 0:00:00,Xilong set for Melbourne mission after dominant Rebel Raider Series Final win at Morphettville
2019/10/21 0:00:00,"When government keeps the truth from you, what are they covering up?"
2019/10/21 0:00:00,‘Selfish’ Wallabies coach let down players against England
2019/10/21 0:00:00,Sarah Jessica Parker offers rare glimpse into marriage with Matthew Broderick
2019/10/21 0:00:00,Soldier severs own leg to save crewmates following freak accident
2019/10/21 0:00:00,"One man dead, three motorcyclists injured after car and group of mates collide in Kyogle, NSW"
2019/10/21 0:00:00,Man fighting for life after balcony fall while trying to get into his Adelaide apartment
2019/10/21 0:00:00,New LDV T60 Trailrider brings tough looks at a budget price
2019/10/21 0:00:00,"‘Unreal’ photos show city covered in thick, low hanging cloud"
2019/10/21 0:00:00,Sam Burgess: NRL star’s Insta post after he was reportedly called to face court for AVO application
2019/10/21 0:00:00,SuperCoach Racing: Did you scream ‘Yes Yes Yes’ on Saturday when Mer De Glace won the Caulfield Cup on Saturday if your stable came up a winner?
2019/10/21 0:00:00,NFL: 49ers stay perfect in the mud; Rodgers has a day out
2019/10/21 0:00:00,Jockey Laura Cheshire shares messages of hate she received after watching beloved horse tortured
2019/10/21 0:00:00,"Baby girl, two children injured in Melbourne head-on collision"
2019/10/21 0:00:00,"Don’t use buy now, pay later services if you want a home loan, mortgage brokers warn"
2019/10/21 0:00:00,Has The Masked Singer’s winner just been unmasked?
2019/10/21 0:00:00,‘An arrogant opinion of being invincible’: Manly star Joel Thompson quits the booze after terrifying accident
2019/10/21 0:00:00,Cops release 911 call after Australian father was shot dead by intruders
2019/10/21 0:00:00,Heat-vision drone finds missing boy and his dog alive in field after 10 hours in freezing weather
2019/10/21 0:00:00,Plants vs Zombies Battle for Neighborville Review: Better than most current shooters
2019/10/21 0:00:00,Former Light Square restaurant building floods overnight
2019/10/21 0:00:00,Sam Kerr stars for Chicago in NWSL semi-final win
2019/10/21 0:00:00,30 perfectly preserved Ancient Egyptian coffins unearthed
2019/10/21 0:00:00,Meghan reveals friends warned her marrying Harry would ‘destroy her life’
2019/10/21 0:00:00,The true traits of spenders and savers
2019/10/21 0:00:00,Mum’s sinister find on baby cam was actually a hilariously relatable mistake
2019/10/21 0:00:00,Porn director Erika Lust reveals most common sexual fantasies
2019/10/21 0:00:00,Felicity Huffman pictured in California jail
2019/10/21 0:00:00,Congestion charge plan for Sydney and Melbourne outlined by think tank
2019/10/21 0:00:00,Wicklow Brave euthanised after falling mid-race
2019/10/21 0:00:00,Teargas and water cannons fired on Hong Kong protesters
2019/10/21 0:00:00,Newspoll: Coalition keeps Labor at bay
2019/10/21 0:00:00,‘Peru Two’ drug mule admits she was 'stupid' to be seduced by drug-smuggling reward
2019/10/21 0:00:00,AFP orders review after media raids
2019/10/21 0:00:00,What it’s really like to travel in the ‘world’s best plane seat’
2019/10/21 0:00:00,‘We’ll show you the heads’: Turkey-backed rebels’ chilling Islamic State-style video warning
2019/10/21 0:00:00,"Man burns ‘$16,000’ worth of Cadbury Caramilk and people are furious"
2019/10/21 0:00:00,London insists UK leaving EU on October 31 despite delay request
2019/10/21 0:00:00,Why have these news.com.au stories been restricted?
2019/10/21 0:00:00,Jennifer Lawrence and Cooke Maroney tie the knot in Rhode Island
2019/10/21 0:00:00,Margot Robbie and Nicole Kidman pose on black carpet at Elle magazine’s annual Women in Hollywood gala
2019/10/21 0:00:00,Mini to set weird world record at Nurburgring
2019/10/21 0:00:00,"Stradivarius, Enable and Beauty Generation taste rare racing defeats"
2019/10/21 0:00:00,All the draft picks from cricket’s newest tournament The Hundred
2019/10/21 0:00:00,Andy Murray can’t hold back the tears after miracle return from injury
2019/10/21 0:00:00,US Navy’s deadly ‘doomsday’ plane designed to survive nuclear war grounded by strike
2019/10/21 0:00:00,"Dog walker attacked, sexually assaulted in park in Thornbury"
2019/10/21 0:00:00,Harry and Meghan planning to break from royal duties
2019/10/21 0:00:00,Police make AVO application for protection of Kate Ritchie against her husband Stuart Webb
2019/10/21 0:00:00,Dad’s mole turns into harrowing one-year ordeal to save his life
2019/10/21 0:00:00,Six reforms Australia needs right now
2019/10/21 0:00:00,Rugby World Cup 2019: Wales defeat France in controversial quarter-final
2019/10/21 0:00:00,New six-bin system proposed for Victoria to make recycling easier
2019/10/21 0:00:00,"‘I might’ve taken 40 shots to get one selfie’: Georgia Fowler on social media, self-confidence and spring style"
2019/10/21 0:00:00,President Trump corrected during call to astronauts on first all-female spacewalk
2019/10/21 0:00:00,Sydney to host WorldPride LGBTQI festival
2019/10/21 0:00:00,"Today in history, October 21: Aberfan disaster kills 144 people"
2019/10/21 0:00:00,19 hours NY to SYD: Qantas Dreamliner makes record non-stop flight
2019/10/21 0:00:00,The slide into secrecy must stop
2019/10/21 0:00:00,The question all Australians should be asking
2019/10/21 0:00:00,"Man seriously injured in CBD apartment fall, second man hurt in stairwell"
2019/10/21 0:00:00,Why Jared Leto wanted Joker stand-alone film canned
2019/10/21 0:00:00,Man stabbed as driver flees crash in southwest Sydney
2019/10/21 0:00:00,"8 mistakes that first-home buyers make, and how to avoid them"
2019/10/21 0:00:00,RUSH HOUR: Woman transforms home using $30 worth of Bunnings items
2019/10/21 0:00:00,Florida peeping Tom beaten to death by naked man he saw having sex: police
2019/10/21 0:00:00,Meghan and Harry documentary: Harry finally confirms rift with brother William
2019/10/21 0:00:00,Glam Winner
2019/10/21 0:00:00,Revealed: Adelaide’s best coastal suburbs for property buyers
2019/10/21 0:00:00,Massive cover-up of aged care chaos
2019/10/21 0:00:00,Rugby World Cup 2019 | Michael Cheika not seeking reappointment as Australian team coach
2019/10/21 0:00:00,The Duchess of Cambridge staked her claim on Prince William early
2019/10/21 0:00:00,A historic Millicent manor offers buyers the ultimate country escape
2019/10/21 0:00:00,Rugby World Cup 2019 | Japan lose to South Africa in heartbreaking scenes
2019/10/21 0:00:00,The policeman was parked near a stop sign
2019/10/21 0:00:00,Buckets of black ink and chronic culture of cover-ups reveal chaotic state
2019/10/21 0:00:00,Family grateful for media’s work to uncover ’catastrophic failings’
2019/10/21 0:00:00,Australians fear laws denying them basic information
2019/10/21 0:00:00,Family seals deal for dream home in Leopold’s Estuary estate after auction
2019/10/21 0:00:00,Dromedary’s coveted lifestyle of peace and serenity
