date,title
2020/05/05 0:00:00,Coronavirus: Queen congratulates Australia on success against virus
2020/05/05 0:00:00,"Sam Cane named All Blacks captain, succeeding Kieran Read"
2020/05/05 0:00:00,Australian church selling bleach that its US leader claims is a cure for coronavirus
2020/05/05 0:00:00,Eta Aquarids meteor shower and Comet SWAN over Australia
2020/05/05 0:00:00,Coronavirus: Australian workplaces face new rules as Scott Morrison meets with Jacinda Ardern
2020/05/05 0:00:00,Trucking company Connect Logistics raided over police deaths
2020/05/05 0:00:00,Ash Barty and Pat Rafter visit COVID-19 ward in Brisbane
2020/05/05 0:00:00,BRC Sprint: Tambo’s Mate secures ticket to Stradbroke Handicap
2020/05/05 0:00:00,MasterChef: Back to Win 2020: Rose Adam eliminated
2020/05/05 0:00:00,Melbourne Storm banned from training on Albury council-owned grounds
2020/05/05 0:00:00,Enter Via Laundry Melbourne: MasterChef: All Stars restaurant crashes during episode
2020/05/05 0:00:00,Chris Hemsworth explains why he left Hollywood for Byron Bay
2020/05/05 0:00:00,Thousands of catering company workers told they are no longer eligible for JobKeeper payments
2020/05/05 0:00:00,Coronavirus NSW: Tearful apology during Ruby Princess inquiry
2020/05/05 0:00:00,Australian cricketers David Warner and Aaron Finch lose the plot on TikTok
2020/05/05 0:00:00,Ablaze wins Grand Annual Steeplechase: Ciaron Maher unearths new jumps star
2020/05/05 0:00:00,Coronavirus Australia: Scott Morrison warns COVID-19 cases will increase when schools re-open
2020/05/05 0:00:00,Coronavirus in Australia: Melbourne meatworks cluster a sign of things to come as economy roars back to life
2020/05/05 0:00:00,The things Australians won’t be able to do again until a COVID-19 vaccine is found
2020/05/05 0:00:00,Amanda Bynes pregnancy: Star’s lawyer sets record straight
2020/05/05 0:00:00,"Seven movies to watch at home this week: The Nice Guys, The Talented Mr Ripley and more"
2020/05/05 0:00:00,"Former Essendon and GWS fitness boss John Quinn says players will need a six-week lead-in to season restart, with injuries still a huge risk"
2020/05/05 0:00:00,People who refuse to download the COVIDSafe virus tracing app are the new anti-vaxxers
2020/05/05 0:00:00,Carnival Cruise Lines cancel all services until August 31st
2020/05/05 0:00:00,Coronavirus vaccine for animals is most important step for human cure
2020/05/05 0:00:00,Rainbow Reach retreat with island billabong listed for sale
2020/05/05 0:00:00,Coronavirus in Australia: The next COVID-19 curve the country need to flatten – and quickly
2020/05/05 0:00:00,"Australia, New Zealand ‘travel bubble’: What new model may look like"
2020/05/05 0:00:00,Run is a sexually charged TV series you won’t be able to resist
2020/05/05 0:00:00,"Daily blog, May 5: New cases break streak"
2020/05/05 0:00:00,Information stored on COVIDSafe app not accessible until Friday
2020/05/05 0:00:00,How Titans star who will refuse a flu shot was transformed into an anti-vaxxer
2020/05/05 0:00:00,Huge cost of shutting down schools
2020/05/05 0:00:00,Developer lodges plans for 30 units on Country Women’s Association Elizabeth Bay HQ site
2020/05/05 0:00:00,"Jockey hospitalised, horse euthanised after horror fall"
2020/05/05 0:00:00,Coronavirus: Melbourne median house value tipped to fall 9.2 per cent
2020/05/05 0:00:00,"Going, going gone: Four Tasmanian homes join the million dollar club"
2020/05/05 0:00:00,Mick Malthouse opens up on pressures Dean Laidley was under
2020/05/05 0:00:00,Warrnambool carnival: Steve Pateman injured as Sir Isaac Newton euthanised after fall
2020/05/05 0:00:00,"President Trump’s theory on origin of coronavirus dismissed by WHO, health experts"
2020/05/05 0:00:00,Thousands of eyes on this Penna prize
2020/05/05 0:00:00,Michelle Obama reveals her frustration at Democratic voters in Netflix documentary Becoming
2020/05/05 0:00:00,Qantas CEO Alan Joyce promises cheap flights when travel resumes
2020/05/05 0:00:00,Woman has 20 lip filler injections to have world’s biggest lips
2020/05/05 0:00:00,Coronavirus: United States and China race to find COVID-19 vaccine
2020/05/05 0:00:00,Late property developer Marshall Brentnall’s luxury Drummoyne waterfront home for sale
2020/05/05 0:00:00,Can you still earn Velocity Frequent Flyer points amid Virgin Airlines woes?
2020/05/05 0:00:00,New car sales fall off a cliff in April
2020/05/05 0:00:00,Author Neil Gaiman and singer Amanda Palmer’s messy public split during lockdown
2020/05/05 0:00:00,Real reason TV star Scott Disick checked into rehab facility
2020/05/05 0:00:00,UFC: Paige VanZant claps back at Curtis Blaydes over ‘sex appeal’ insult
2020/05/05 0:00:00,F1 salary cap agreed on for 2021 as teams slash costs
2020/05/05 0:00:00,Ross House: Century-old Kew Italianate mansion could almost double record
2020/05/05 0:00:00,Apple to reopen Australian retail stores
2020/05/05 0:00:00,Elon Musk and Grimes welcome first child together
2020/05/05 0:00:00,Coronavirus in Australia: One million people lost their jobs in a month due to COVID-19 crisis
2020/05/05 0:00:00,Housing supply plummets in Sydney as coronavirus drives drop in new listings
2020/05/05 0:00:00,Eta Aquariid meteor shower: Where and when to watch in Australia
2020/05/05 0:00:00,Prisoners sent death threats to Manchester United star after racism row
2020/05/05 0:00:00,Israeli scientists’ ‘significant breakthrough’ isolating COVID-19 antibodies
2020/05/05 0:00:00,Coronavirus Australia: Northern Territory is the best state complying with restrictions
2020/05/05 0:00:00,Michael Jordan defends his most controversial quote
2020/05/05 0:00:00,Transfer whispers: Bulldogs in the hunt for prodigal son Josh Reynolds
2020/05/05 0:00:00,Elon Musk lists LA mansions for sale after pledging to ‘own no house’
2020/05/05 0:00:00,Riverside resort-like home in Lower Macdonald listed with yard bigger than a Sydney block
2020/05/05 0:00:00,NRL Briefs: Coaches ‘dirty as hell’; Cartwright’s stance ‘unacceptable’; Bellamy’s concerns
2020/05/05 0:00:00,"Kate Beckinsale, 46, steps out with boyfriend Goody Grace, 22"
2020/05/05 0:00:00,Coronavirus treatment: Antibody that blocks infection discovered
2020/05/05 0:00:00,Coronavirus Australia: Qantas extends flight cancellations until end of July
2020/05/05 0:00:00,Troubled life and times of AFL premiership star Dean Laidley
2020/05/05 0:00:00,First detailed images show coronavirus multiplying in gut
2020/05/05 0:00:00,Olympia Valance swiftly sells stylish Southbank apartment
2020/05/05 0:00:00,Fans praise MasterChef judge Melissa Leong for taking restaurant reservation
2020/05/05 0:00:00,Coronavirus: What restaurants could look like after COVID-19
2020/05/05 0:00:00,Coronavirus: Retested flu samples find first French COVID-19 case in December
2020/05/05 0:00:00,"Scrub Hill, Newlyn: Restored country church graces market"
2020/05/05 0:00:00,"Coronavirus: Bergamo, Italy suffered 568 per cent rise in deaths during March"
2020/05/05 0:00:00,Coronavirus in Australia: Key number shows New South Wales has turned the corner on COVID-19
2020/05/05 0:00:00,Jess Marais emerges on social media for first time since being rushed to hospital
2020/05/05 0:00:00,Injured star Jayden Brailey forced out of Knights squad due to coronavirus restrictions
2020/05/05 0:00:00,Big Bang Theory star Melissa Rauch gives birth to baby boy
2020/05/05 0:00:00,RBA interest rate: Reserve Bank holds rates at 0.25%
2020/05/05 0:00:00,Victoria’s Secret Kelly Gale causes confusion with bikini photo
2020/05/05 0:00:00,Trump defends handling of coronavirus pandemic saying Dr Fauci claimed it ‘isn’t gonna be a big deal’
2020/05/05 0:00:00,Security guard shot dead in US after ‘refusing entry to customer not wearing mask’
2020/05/05 0:00:00,Baseball player Blake Bivens found out family was murdered on Facebook
2020/05/05 0:00:00,Coronavirus Australia: Parents shut-out of QLD school grounds
2020/05/05 0:00:00,Weatherman Sven Sundgaard fired over tweet comparing anti-lockdown protesters with ‘Nazi sympathisers’
2020/05/05 0:00:00,"Trent Robinson, Latrell Mitchell and other Rabbitohs test negative to coronavirus"
2020/05/05 0:00:00,"Coles reveals new store opening hours, ending Community Hour"
2020/05/05 0:00:00,First property of five on unique Pretty Beach ridge line to sell for first time in 12 years
2020/05/05 0:00:00,Coronavirus: call for Victoria to revive private on-site auctions
2020/05/05 0:00:00,"Former Kangaroos teammates, AFL stars and media react to Dean Laidley’s arrest"
2020/05/05 0:00:00,‘Horrific timing’ of brutal Anna Wintour takedown by former friend
2020/05/05 0:00:00,Monkey cycling on a bike snatches child in shocking video
2020/05/05 0:00:00,Premier provides latest on new coronavirus cases in Queensland
2020/05/05 0:00:00,Former Triple J hosts Matt Okine and Alex Dyson reunite for new show
2020/05/05 0:00:00,Rostrevor house comes with basketball half-court and putting green
2020/05/05 0:00:00,Sun Yang appeals doping ban in bid to swim at Tokyo Olympics
2020/05/05 0:00:00,Rosie O’Donnell says Bill Cosby once ‘sexually harassed’ her producer
2020/05/05 0:00:00,NSW Health official apologises in teaful Ruby Princess inquiry
2020/05/05 0:00:00,"Lockdown restrictions eased in Italy as locals crowd stations, parks"
2020/05/05 0:00:00,Hamish Blake admits Lego Masters copied a ‘MasterChef trick’
2020/05/05 0:00:00,Craig Bellamy says short time-frame for contact work for NRL players is ‘unrealistic’
2020/05/05 0:00:00,Alistair Knox original on market in Wonga Park for the first time
2020/05/05 0:00:00,Oscar winner Taika Waititi will direct a new ‘Star Wars’ movie
2020/05/05 0:00:00,Anti-vax Titans player asked to explain why he refuses flu shot
2020/05/05 0:00:00,"Coronavirus: China hid virus’ severity to hoard supplies, US claims"
2020/05/05 0:00:00,‘We never got caught’: Hawks greats reveal their sneaky decade-long skinfold test trick
2020/05/05 0:00:00,Tiger King: Nicolas Cage to play Joe Exotic in new series
2020/05/05 0:00:00,NFL player Roquan Smith enjoys his time on a boat with adult film star
2020/05/05 0:00:00,RUSH HOUR: Naomi Campbell's cameraperson spotted in full PPE
2020/05/05 0:00:00,Officer stood down after leaked photos show AFL great Dean Laidley with Victorian Police
2020/05/05 0:00:00,Coronavirus Australia live coverage: City of Melbourne reinstates parking fines
2020/05/05 0:00:00,"Internet erupts after Twilight author Stephenie Meyer announces release date new book in vampire series, Midnight Sun"
2020/05/05 0:00:00,CORONAVIRUS: WHO envoy warns vaccine may never be developed
2020/05/05 0:00:00,"Protect your business from COVID crooks, warns Business SA"
2020/05/05 0:00:00,Calm your senses with Statesman Homes' Glenside Alfresco
2020/05/05 0:00:00,QandA: Coronavirus pandemic is changing how the world sees China
2020/05/05 0:00:00,Grandeur of days gone by meets the comforts of modern living
2020/05/05 0:00:00,Opal Tower: $2.14m sale of three-bedroom unit to boost interest in local market
2020/05/05 0:00:00,Historic Rose and Crown Inn turned delightful modern home
2020/05/05 0:00:00,Four buyers make early offers on updated Herne Hill house
