date,title
2020/06/28 0:00:00,Coronavirus Australia: Victorian man caught breaching self isolation restrictions after drunken car crash in South Australia
2020/06/28 0:00:00,"Global Goal concert: Coldplay, Justin Bieber, Usher part of $10bn COVID-19 fundraiser"
2020/06/28 0:00:00,60 Minutes Australia: Inside the depraved world of Maddie McCann’s key suspect
2020/06/28 0:00:00,Wests Tigers thrash Canterbury Bulldogs in NRL round 7
2020/06/28 0:00:00,MasterChef 2020: Judges face hardest decision yet
2020/06/28 0:00:00,Hawthorn hang on after seven minute scare against North Melbourne
2020/06/28 0:00:00,Former F1 boss Bernie Ecclestone takes second shot after being slammed by Lewis Hamilton
2020/06/28 0:00:00,Tony Jones’ brutally awkward apology after Steve Johnson sledge
2020/06/28 0:00:00,Coronavirus Australia: Three new cases in New South Wales including 34-year-old overseas cargo airline crew
2020/06/28 0:00:00,"Coronavirus: 49 new cases of COVID-19 recorded in Victoria, the highest daily number since April"
2020/06/28 0:00:00,AFL round 4: Geelong Cats secure narrow victory over Melbourne in low-scoring affair
2020/06/28 0:00:00,Bizarre pre-match NRL animal omen before Sharks performance over the Sea Eagles
2020/06/28 0:00:00,Worst defence in Broncos history heaps pressure on Anthony Seibold
2020/06/28 0:00:00,Louisville: Man shot dead at Black Lives Matter rally
2020/06/28 0:00:00,‘I hate it’: Paul Gallen slams smiling Broncos after Titans loss as legends take aim
2020/06/28 0:00:00,AFL round 4: Charlie Cameron blunder leaves commentators in hysterics during Brisbane Lions victory
2020/06/28 0:00:00,Animal rights groups call for full investigation before bear execution
2020/06/28 0:00:00,"Walmart shooting: Several deaths, injuries, following incident in Red Bluff, California"
2020/06/28 0:00:00,Pete Evans new social media posts with bizarre COVID-19 claims
2020/06/28 0:00:00,Victoria records 49 new cases as returned travellers set for mandatory testing
2020/06/28 0:00:00,AFL round 4: Adelaide Crows completely outclassed by Brisbane Lions
2020/06/28 0:00:00,Why Tracy Grimshaw is not on TV
2020/06/28 0:00:00,Coronavirus Australia: NT News’ savage response to Victoria virus spike
2020/06/28 0:00:00,John and Jacqueline Dinan sell Ivanhoe East home after lengthy campaign
2020/06/28 0:00:00,Sydney properties sell for up to $6 million as more sellers put homes under the hammer
2020/06/28 0:00:00,"Coronavirus Victoria: Daniel Andrews refuses to blame specific race, religion for Melbourne outbreaks"
2020/06/28 0:00:00,"ALP branch stacking: Adem Somyurek breaks his silence, threatens enemies"
2020/06/28 0:00:00,AFL: Matt Rowell continues to feel the love
2020/06/28 0:00:00,Victoria imposes 10-day penalty on anti-testers
2020/06/28 0:00:00,Innocent act that contributed to virus spike
2020/06/28 0:00:00,New Zealand PM Jacinda Ardern’s very bad week
2020/06/28 0:00:00,Peter FitzSimons condemns Prince William and England’s Football Association for controversial World Cup vote
2020/06/28 0:00:00,Coronavirus: Dan Andrews threatens Melbourne hot spots with stay-at-home order
2020/06/28 0:00:00,Vehicle destroyed after jackknife crash on highway
2020/06/28 0:00:00,Bryson DeChambeau’s long bomb is out of this world
2020/06/28 0:00:00,Demand for new housing remains weak after the COVID-19 pandemic
2020/06/28 0:00:00,‘Let’s not be tricky here’: MP grilled over funding cut
2020/06/28 0:00:00,No new COVID-19 cases in Queensland
2020/06/28 0:00:00,NRL 2020: Melbourne Storm could be stuck on Sunshine Coast for weeks
2020/06/28 0:00:00,"Family Guy accused of racism, voice actor steps down from role"
2020/06/28 0:00:00,Australian surfer Jack Robinson marries Julia Muniz
2020/06/28 0:00:00,Why some Adelaide residents are expected to leave the city over the next few years
2020/06/28 0:00:00,‘Baggers’: Bryce Gibbs joins Carlton chorus following thrilling Blues win
2020/06/28 0:00:00,Big Brother Australia 2021: How to apply for next season of Channel 7 show
2020/06/28 0:00:00,UFC Las Vegas: Octagon witnesses a bloodbath; Tanner Boser knocks out Philipe Lins
2020/06/28 0:00:00,Emergency nurse tests positive at Melbourne hospital
2020/06/28 0:00:00,Videos found in secret lair of Maddie McCann suspect Christian Brueckner
2020/06/28 0:00:00,Property sales since COVID-19: the Sydney regions with the biggest price falls
2020/06/28 0:00:00,Under Armour wants out of its $408m sponsorship deal
2020/06/28 0:00:00,L’Oreal to remove words like ‘whitening’ from products
2020/06/28 0:00:00,Boxer Jarrell Miller tests positive to performance-enhancing substance again
2020/06/28 0:00:00,Alannah Hill’s former St Kilda West home for sale featuring her style
2020/06/28 0:00:00,"Melbourne liveability: Outer-ring suburbs surge, PwC report"
2020/06/28 0:00:00,Football star Aleksandar Mitrovic blasted for ‘disgusting’ act
2020/06/28 0:00:00,Woman charged with murder after allegedly hitting man with car
2020/06/28 0:00:00,One in hospital after home invasion
2020/06/28 0:00:00,AFL: Wild fight between Suns-Dockers; Bryce Gibbs tweets; Liam Jones uses his head
2020/06/28 0:00:00,Hyundai to drastically overhaul its range in the next 18 months
2020/06/28 0:00:00,Friends star Matt LeBlanc’s wild Logies night finally revealed
2020/06/28 0:00:00,"India passes 500,000 coronavirus cases"
2020/06/28 0:00:00,2016: Territory pooch Princess Scrumpy launches campaign to become chief minister
2020/06/28 0:00:00,"A sophisticated and cosy place to live, work and play"
