date,title
2020/12/02 0:00:00,Former NRL player Todd Carney and reality TV star Susie Bradley are expecting their first child
2020/12/02 0:00:00,"Pakenham Cup 2020: Princess Jenni primed for 2500m feature, says trainer David Brideoake"
2020/12/02 0:00:00,Marnus Labuschagne experiment backfires as India avoid series whitewash
2020/12/02 0:00:00,Leading jockeys Nash Rawiller and Brenton Avdulla back in front of stewards in the coming days
2020/12/02 0:00:00,Coronavirus Australia: 12 Sydney suburbs put on COVID alert
2020/12/02 0:00:00,NSW looking at a warning and fine based system for personal illegal drug possession
2020/12/02 0:00:00,Australian captain Aaron Finch posts half-century after Indian fielding blunders
2020/12/02 0:00:00,"F1 2020: Mick Schumacher to drive in Formula One, Lewis Hamilton replacement named"
2020/12/02 0:00:00,Justis Huni v Arsene Fosso: Cameroon boxer faced death for refusing to give up gay teammates
2020/12/02 0:00:00,Liberal MP Bridget Archer speaks against government’s cashless debit card program
2020/12/02 0:00:00,Steve Price slams upcoming Port Arthur movie as ‘awful’ on The Project
2020/12/02 0:00:00,‘Owe them everything’: Mick Schumacher joins Formula One with Haas for 2021 season
2020/12/02 0:00:00,George Russell to replace Lewis Hamilton after COVID positive in Sakhir Grand Prix
2020/12/02 0:00:00,Dog dies after being left tied to Queensland clothesline
2020/12/02 0:00:00,Pervert Sebastian Richard McKay says methamphetamine caused him to expose genitals to women and schoolgirls
2020/12/02 0:00:00,"Kyle Daniels: Detective changed word ‘bottom’ to ‘vagina’ in mum’s statement, court hears"
2020/12/02 0:00:00,Planning Minister’s chief of staff concedes lack of transparency with lobbyists
2020/12/02 0:00:00,Woman finds spider inside bra while shopping at Kmart
2020/12/02 0:00:00,Baby and two adults die after Point Cook home destroyed by fire
2020/12/02 0:00:00,"Neil Cross on the Luther movie, his new series The Sister and his love for reality TV"
2020/12/02 0:00:00,Flight prices spike after WA announces border reopening to NSW and Victoria
2020/12/02 0:00:00,India captain Virat Kohli thwarted by ‘bizarre’ review following record milestone
2020/12/02 0:00:00,2021 Australian Open start date confirmed by Tennis Australia CEO Craig Tiley
2020/12/02 0:00:00,La Nina ‘overwhelmed’ as 57 Australian towns record hottest ever November day
2020/12/02 0:00:00,Lowering the bar could produce a summer windfall for La Falaise in the VOBIS Gold Bullion at Pakenham
2020/12/02 0:00:00,Australian sharemarket virtually unchanged despite end to technical recession
2020/12/02 0:00:00,Coffs Harbour preview: Slice Of Heaven to showcase her quality
2020/12/02 0:00:00,"Donald Trump omits coronavirus, mask wearing from White House Christmas invitations"
2020/12/02 0:00:00,Cop charged over AFL icon Dani Laidley photo leak
2020/12/02 0:00:00,"Donald Trump considering pardons for Donald Jr, Eric and Ivanka"
2020/12/02 0:00:00,‘Destruction therapy’ allows you to destroy car with tank
2020/12/02 0:00:00,Donald Trump confirms plan to run for presidency in 2024
2020/12/02 0:00:00,No criminal charges laid for Woodville Pizza Bar ‘liar’
2020/12/02 0:00:00,Boost Juice scion Riley Allis lists Glen Iris house after 18 months
2020/12/02 0:00:00,NSW chief health officer says COVID-19 ‘virtually eliminated’
2020/12/02 0:00:00,Caps on crowds will be removed at stadiums in NSW just in time for some massive cricket matches
2020/12/02 0:00:00,Jana Hocking on why men should always pay on the first date
2020/12/02 0:00:00,Surprising demand for $1 Aldi item at Christmas
2020/12/02 0:00:00,"Watchdog accuses Qld pharmaceutical provider of price fixing, rigging bids"
2020/12/02 0:00:00,Belt and Road Initiative: Deal Daniel Andrews can’t back out of
2020/12/02 0:00:00,‘Weak’: Chinese President Xi Jinping’s huge leadership problem
2020/12/02 0:00:00,‘Don’t look like taking a wicket’: Aussie great takes aim at India over glaring selection blunders
2020/12/02 0:00:00,Dawid Malan smacks unbeaten 99 as England romp to series sweep
2020/12/02 0:00:00,NBA: Australian rookie guard Josh Green faces ultimate Christmas Day challenge against LeBron James
2020/12/02 0:00:00,Jude Law’s 20-year-old daughter Iris flaunts figure in ‘intimate’ bikini
2020/12/02 0:00:00,Qld’s ‘dumbest’ trading laws set to cause another round of panic buying before Christmas
2020/12/02 0:00:00,Police search for man missing from his boat in Perth’s Swan River
2020/12/02 0:00:00,"Byron Bay tops strongest property price growth in Australia as coastal, regional house prices surge"
2020/12/02 0:00:00,"Barnaby Joyce, Llew O’Brien harassed by ‘Irish backpackers’ at Canberra pub"
2020/12/02 0:00:00,Eclectic Brompton character home snapped up before auction
2020/12/02 0:00:00,Devastated Qantas workers hit back over 2000 jobs outsourcing move
2020/12/02 0:00:00,"Bandits storm Brazilian city, taking hostages and shooting people before robbing bank and leaving street littered with cash"
2020/12/02 0:00:00,Big Bash: Tasmanian officials call Channel 7 claims ‘Trump-like’
2020/12/02 0:00:00,"Almost 50,000 for rugby league in Brisbane but Magic Millions racing crowd to be capped"
2020/12/02 0:00:00,Hospitality sector calls for eased restrictions to help keep sector viable during Christmas
2020/12/02 0:00:00,Let’s Talk: Watch a replay of our chat with AMA SA President Dr Chris Moy and Business SA chair and Star of Greece owner Nikki Govan on the devastating effects of COVID-19 on running a small business
2020/12/02 0:00:00,Catherine O’Hara has recreated her iconic Home Alone scream and faint in a viral TikTok
2020/12/02 0:00:00,Question time: Stoush over Australia’s economic ‘comeback’
2020/12/02 0:00:00,Ardent Leisure issued improvement notice after girl suffers traumatic injury on slide
2020/12/02 0:00:00,US Ambassador: China should learn from Australia
2020/12/02 0:00:00,Parnham hoping history repeats in Kingston Town Classic
2020/12/02 0:00:00,Fears over convicted terrorist Abdul Nacer Benbrika’s future plans
2020/12/02 0:00:00,Person ‘shedding virus’ reason why COVID-19 traces were found in Colac waste water
2020/12/02 0:00:00,Beheaded tiger and big cat body parts found in raid at private Thailand zoo
2020/12/02 0:00:00,"Hayne’s fame does not give him ‘pass’ over sexual assault allegations, court told"
2020/12/02 0:00:00,"Pakenham Cup fancy Princess Jenni primed for the 2500m Listed feature, according to trainer David Brideoake"
2020/12/02 0:00:00,Melbourne anti-lockdown and freedom protesters set to rally again on Saturday
2020/12/02 0:00:00,AFL legend Chris Judd and actor Gary Sweet team up with Ballarat trainer Matt Cumani to debut Tycoon Bec at Kyneton on Thursday
2020/12/02 0:00:00,Dumped Sydney Swans player Elijah Taylor ‘lost control’ when punching girlfriend: court
2020/12/02 0:00:00,Australia lashed as ‘suicidal’ by former UN climate chief
2020/12/02 0:00:00,Violent ‘over-reaction’ alleged as cause of fatal Gold Coast bird feeding brawl
2020/12/02 0:00:00,Tradie in critical condition after being struck by metal at Carlingford construction site
2020/12/02 0:00:00,Rebel Wilson confesses members of the industry didn’t accept her 28kg weight loss
2020/12/02 0:00:00,EasyJet introduces charges for overhead baggage
2020/12/02 0:00:00,"Australian economy turns corner but bumpy ride ahead, RBA chief warns"
2020/12/02 0:00:00,Sodium cyanide spill shuts down parts of the Port of Brisbane
2020/12/02 0:00:00,Iran targets Kylie Moore-Gilbert in sick propaganda video
2020/12/02 0:00:00,Joe Biden fitted with moon boot after injuring foot playing with dog
2020/12/02 0:00:00,Former junior rugby league coach walks free after being sentenced for child exploitation
2020/12/02 0:00:00,"Justice Department investigating ‘bribery conspiracy scheme’ involving presidential pardon, documents show"
2020/12/02 0:00:00,Crazy moment men punch up in the middle of a busy Adelaide road
2020/12/02 0:00:00,Carly Jane Wren pleads guilty to criminal neglect after leaving the drug fantasy in reach of her young son
2020/12/02 0:00:00,India come back to win third ODI despite 'ridiculous' Glenn Maxwell madness
2020/12/02 0:00:00,DNA key in case against alleged abductions and rapes in Melbourne
2020/12/02 0:00:00,Obsessive recycler shows off two months of trash and it’s miniscule
2020/12/02 0:00:00,NSW to allow one person per two square metres under new COVID-19 rule
2020/12/02 0:00:00,Nash Rawiller started his career on the old Pakenham track but will take on son Campbell on the new Pakenham course
2020/12/02 0:00:00,Footage shows moment Perth man stabbed ex-girlfriend in driveway
2020/12/02 0:00:00,Qld Govt orders review into Fraser Island management as bushfires rages out of control
2020/12/02 0:00:00,Football giant’s Real Madrid on verge of unwanted 23-year first
2020/12/02 0:00:00,Hyundai details new electric car range with ultra fast charging
2020/12/02 0:00:00,NSW woman shocked to find enormous spider lurking in car door handle
2020/12/02 0:00:00,"US Election 2020: Rudy Giuliani, Donald Trump discuss potential pardon"
2020/12/02 0:00:00,"China’s tweet could prove ‘huge mistake’, former Australian Foreign Minister warns"
2020/12/02 0:00:00,Tiktok chef cooks burgers with hotel iron in quarantine | Video
2020/12/02 0:00:00,Sydney Kings sign Andrew Bogut‘s replacement – former first-round NBA draft pick Jarell Martin
2020/12/02 0:00:00,Fresh explanation behind virus traces found in Colac wastewater
2020/12/02 0:00:00,Woman hits a python with roll of Christmas wrapping paper as it strangles her nine-week-old puppy Jasper
2020/12/02 0:00:00,Man’s wife forces him to sell PS5 after discovering it’s not an air purifier
2020/12/02 0:00:00,How much of Australia does China own?
2020/12/02 0:00:00,Kaley Cuoco cops birthday trolling from ex Johnny Galecki
2020/12/02 0:00:00,"Daniel Andrews condemns Chinese government tweet as ‘wrong, appalling’"
2020/12/02 0:00:00,TikTok user explains Aussie slang word – but people have never heard of it
2020/12/02 0:00:00,117-page official document shows China downplayed COVID-19 pandemic from the start
2020/12/02 0:00:00,Decision on Aquanita horse disqualifications delayed
2020/12/02 0:00:00,Tiffiny Hall shares ‘honest’ and ‘real’ post to remind fans of one thing
2020/12/02 0:00:00,Jack de Belin won’t get retrial before 2021 NRL season
2020/12/02 0:00:00,Baby dies falling into hot tub while mum was working from home
2020/12/02 0:00:00,More than one in 10 Australians will be having a meat-free Christmas
2020/12/02 0:00:00,Photographer detained in Egyptian jail after arrest over pyramids photo
2020/12/02 0:00:00,"SA’s hero doctor, Dharminy Thurairatnam, returns to work after finishing quarantine"
2020/12/02 0:00:00,Diver fights off 2.5m hammerhead shark with camera stick while diving for crayfish
2020/12/02 0:00:00,Former A-League championship-winning coach Kevin Muscat sacked by Sint-Truiden
2020/12/02 0:00:00,"Double Bay penthouse sells for $10.26m at auction, $2.26m over reserve"
2020/12/02 0:00:00,Dallas restaurant owner apologises after telling twerking women to ‘get the f**k out’
2020/12/02 0:00:00,Daniel Andrews flags more changes to virus restrictions as Victoria aims for ‘COVID-normal’
2020/12/02 0:00:00,Doctors take months to cure woman after she eats old sushi from service station
2020/12/02 0:00:00,"Anti-LGBT Hungarian MEP resigns after being caught at gay sex party, breaching COVID rules"
2020/12/02 0:00:00,‘I saw death’: Romain Grosjean details terrifying aftermath of crash
2020/12/02 0:00:00,Rosie Perez reveals she had COVID-19 before Wuhan’s December outbreak
2020/12/02 0:00:00,Girl drowns on ride at school trip to Drayton Manor theme park
2020/12/02 0:00:00,Norton Summit acreage estate’s bunker attracting househunters’ attention
2020/12/02 0:00:00,ACTU chief Sally McManus labels casual work a ‘virus’
2020/12/02 0:00:00,Australia’s economic rebound: GDP rises 3.3 per cent
2020/12/02 0:00:00,Coles shopper shares surprising double-yolk find in dozen egg carton
2020/12/02 0:00:00,Millie Bobby Brown breaks down on Instagram after creepy fan encounter
2020/12/02 0:00:00,Mad scramble to fill Lewis Hamilton’s seat for Sakhir Grand Prix
2020/12/02 0:00:00,‘Hold your babies tighter’: Mum’s heartbreaking message after losing children
2020/12/02 0:00:00,Wellard hit-and-run: Medina man charged over crash involving 19-year-old Iziah Hayward
2020/12/02 0:00:00,How Big Bang Theory star Kaley Cuoco escaped sitcom curse with edgy reinvention
2020/12/02 0:00:00,Oil tycoon heir John Gilbert Getty found ‘with eyes and mouth open in Indian-style sitting pose’ in hotel room
2020/12/02 0:00:00,Crucial resource to help thousands of grieving families after baby loss
2020/12/02 0:00:00,Armidale woman finds huge huntsman spider under car door handle
2020/12/02 0:00:00,Australian boycott of Chinese goods would leave us exposed and have little impact on them
2020/12/02 0:00:00,Candice’s cheeky joke about husband David Warner’s groin injury
2020/12/02 0:00:00,CEO calls on Aussie businesses to find non-Chinese suppliers
2020/12/02 0:00:00,The hidden meaning behind Cleveland Cavalier’s City Edition uniform
2020/12/02 0:00:00,Research reveals Australia’s most popular barbecue habits
2020/12/02 0:00:00,‘Mum’s head is on the path over there’: Court hears wild police bodycam recording
2020/12/02 0:00:00,Terrifying moment ‘stalker’ bursts into woman’s apartment
2020/12/02 0:00:00,"Heatwave continues in northern parts of Australia, temperatures set to soar into mid-40s"
2020/12/02 0:00:00,Monash Freeway crash causes road closure at Ferntree Gully Road
2020/12/02 0:00:00,Kerrin McEvoy won’t travel to Hong Kong to ride Classique Legend in Hong Kong International Sprint
2020/12/02 0:00:00,AFC Champions League: Sydney FC thrash Aaron Mooy’s Shanghai SIPG
2020/12/02 0:00:00,Celebrities show off their elaborate Christmas trees
2020/12/02 0:00:00,‘Still bogged down in that s**t’: Issue Australia can’t seem to overcome
2020/12/02 0:00:00,Sophie Monk says she’s not engaged to boyfriend Joshua Gross
2020/12/02 0:00:00,Barack Obama knows the truth about aliens and government UFO files
2020/12/02 0:00:00,Melissa Caddick: Missing businesswoman fails to shows up in hundreds of hours of CCTV
2020/12/02 0:00:00,US Attorney-General William Barr rejects Donald Trump’s claim that fraud decided the election
2020/12/02 0:00:00,Hugh Grant’s cheeky comment about clashing with female co-stars
2020/12/02 0:00:00,Woman who suffered a stillbirth left furious after a shock text from a friend
2020/12/02 0:00:00,Telcos face new rules to stop scam calls
2020/12/02 0:00:00,Watermark detail means Chinese government may have commissioned sick image
2020/12/02 0:00:00,Inside the life of Instagram model and World Series flasher Julia Rose
2020/12/02 0:00:00,David Nofoaluma’s pay standoff could see him join NRL rival
2020/12/02 0:00:00,Scott Morrison appeals directly to Chinese citizens on WeChat
2020/12/02 0:00:00,Elliot Page’s wife speaks out after transgender reveal: ‘Love you so much’
2020/12/02 0:00:00,Inspirational Girl stands firm as Kingston Town favourite
2020/12/02 0:00:00,"Rex pledges to offer 100,000 Sydney to Melbourne fares for $79"
2020/12/02 0:00:00,"Man shot by police at Alberton after allegedly charging at cops, assaulting policewoman"
2020/12/02 0:00:00,Shocking picture emerges of Australian soldier drinking out of dead man’s fake leg
2020/12/02 0:00:00,Dramatic moment bell tower erupts in flames after it was struck by lightning
2020/12/02 0:00:00,Mike Tyson attacked by crazy fan after Roy Jones Jr fight
2020/12/02 0:00:00,Ryan Seacrest is selling his Beverly Hills mansion for $115.5 million
2020/12/02 0:00:00,Sydney weather: Storm warning as NSW swelters through first day of summer
2020/12/02 0:00:00,Mental Health 360: ‘It’s really scary to be in a psych ward’
2020/12/02 0:00:00,"Juno star formerly known as Ellen Page comes out as transgender, now goes by Elliot"
2020/12/02 0:00:00,NRL star rivals Greg Norman with unintentionally hilarious detail in dog photo
2020/12/02 0:00:00,Melbourne Football Club responds after copping it over ‘disgusting’ advert
2020/12/02 0:00:00,Donald Trump’s lawyer Joe diGenova says fired cybersecurity official should be ‘taken out and shot’ for contradicting the President
2020/12/02 0:00:00,Baby among five killed in Germany after car ploughs into crowd on shopping street
2020/12/02 0:00:00,China’s Global Times publishes new offensive cartoon against Australia in scathing editorial
2020/12/02 0:00:00,At home with abstract artist Rachel Carapetis
2020/12/02 0:00:00,Rhodes waterfront estate shatters suburb record by nearly $1 million after selling for $5.611 million
2020/12/02 0:00:00,Park Orchards manor made from European antiques to set record
2020/12/02 0:00:00,Riverside Highton renovation beats hopes by $100K amid pre-auction bidding war
2020/12/02 0:00:00,"First-home buyers are dominating the real estate market, according REIA"
