date,title
2020/08/18 0:00:00,Victorians flouting self-isolation have been hit with hefty fines as the state records 216 new cases
2020/08/18 0:00:00,"Scott Morrison announces free COVID-19 vaccines for Australians, backtracks on ‘mandatory’ comments"
2020/08/18 0:00:00,Christine Anu drops F-bomb on The Project after The Masked Singer appearance
2020/08/18 0:00:00,Shannon Brett Morrison: Videos show aftermath of alleged stabbing
2020/08/18 0:00:00,Coronavirus Canada: Toronto strip club at epicentre of COVID-19 outbreak
2020/08/18 0:00:00,"Coronavirus Australia: Baby, mum reunited after separation across border"
2020/08/18 0:00:00,The Valley races: Trainer Danny O’Brien eyes Caulfield Guineas with Flying Award
2020/08/18 0:00:00,Pensioners denied payment increase
2020/08/18 0:00:00,Model Tess Holliday furious over trending strawberry dress
2020/08/18 0:00:00,Michelle Obama’s necklace sparks frenzy during Democratic National Convention speech
2020/08/18 0:00:00,Documents reveal Palmer is a ‘rank liar’ in $30b legal stoush
2020/08/18 0:00:00,Homeless South Australians provided additional services to brave severe weather warning
2020/08/18 0:00:00,Racist man on London Tube knocked out with a single punch
2020/08/18 0:00:00,Constance Hall’s husband hospitalised after serious motorbike crash
2020/08/18 0:00:00,The Bachelorette 2020: Sharna Burgess confirms she was asked before Elly and Becky Miles
2020/08/18 0:00:00,"Former Frankston council manager scammed ratepayers out of almost $500,000"
2020/08/18 0:00:00,NRL 2020: Investigators reveal NRL links to Anthony Seibold rumours
2020/08/18 0:00:00,Five teens arrested after alleged Sydney crime spree
2020/08/18 0:00:00,LIVE: Masked Singer 2020: Masked Singer star revealed as Katie Noonan
2020/08/18 0:00:00,Coronavirus Victoria: Melbourne nurse to return to work days after virus battle
2020/08/18 0:00:00,"Democratic National Convention, day one: Three danger signs for Donald Trump"
2020/08/18 0:00:00,Milsons Point penthouse next door to Nicole Kidman and Keith Urban has $8m to $8.8m price guide
2020/08/18 0:00:00,Georgia Love shares wedding fears as Tasmania keeps its border shut
2020/08/18 0:00:00,"Ruby Princess saga: national protocols not adhered to, ABF were being ‘helpful’"
2020/08/18 0:00:00,"Raceday focus: Best bets, analysis for Victorian midweek meetings"
2020/08/18 0:00:00,P-plater Bailey Hogan-Jones high on ice when he crashed and killed girlfriend
2020/08/18 0:00:00,Super Rugby 2020: Relief for Reds as Paisami’s knee injury not as severe as feared
2020/08/18 0:00:00,A-League 2020: Besart Berisha has another title in his sights with Western United
2020/08/18 0:00:00,NRL 2020: New Zealand Warriors forced to cut ties with Vodafone after 22 years
2020/08/18 0:00:00,"Coronavirus Victoria: Man, 95, out of isolation after beating COVID-19"
2020/08/18 0:00:00,Coronavirus NSW: Paramedics reportedly refused to take patient Qld border
2020/08/18 0:00:00,Jennifer Aniston and Brad Pitt to reunite in a virtual table read for charity
2020/08/18 0:00:00,Two women charged for allegedly escaping WA hotel quarantine and catching a taxi to suburbs
2020/08/18 0:00:00,NRL: Judiciary introduce big penalties on the crusher tackle
2020/08/18 0:00:00,AFL 2020: Port Adelaide coaches deny shutting down Charlie Dixon can shut the Power down too
2020/08/18 0:00:00,Shock price for cheapest Toyota Yaris
2020/08/18 0:00:00,"18 million flu vaccine doses, physical distancing avoid flu outbreak but renewed warning about symptoms"
2020/08/18 0:00:00,Influencers Allie and Sam announce ‘sperm giveaway’ on Instagram
2020/08/18 0:00:00,NRL: Jayden Brailey back running but won’t return to help Newcastle’s premiership assault this season
2020/08/18 0:00:00,"DIY pizza to chicken curry: How to recreate fast, cheap takeaway meals at home from Taste.com.au"
2020/08/18 0:00:00,"Adelaide man Amin Derakhshan left ‘stranded’ after South Australia and New South Wales both refused him entry, court hears"
2020/08/18 0:00:00,Prince Charles send message of hope to Victoria during coronavirus pandemic
2020/08/18 0:00:00,Positive finish for Australian share market despite bank weakness
2020/08/18 0:00:00,Airbnb launches ‘screening program’ to stop guests throwing parties
2020/08/18 0:00:00,No Credit: Broncos accused of ‘playing pokies and drinking’ during banned pub lunch
2020/08/18 0:00:00,Lovecraft Country on Binge: Scene from first episode is terrifying
2020/08/18 0:00:00,Coronavirus: Two women escape hotel quarantine in Western Australia
2020/08/18 0:00:00,The hidden cases that caused Victoria’s coronavirus outbreak
2020/08/18 0:00:00,Chance to join ‘second generation’ in tightly held Campbell cul-de-sac
2020/08/18 0:00:00,General Motors Special Vehicles launches in Australia
2020/08/18 0:00:00,NZ coronavirus conspiracy: Man comes clean over Reddit post
2020/08/18 0:00:00,Premier Steven Marshall defends return of international students to create jobs
2020/08/18 0:00:00,Portugal’s President Marcelo Rebelo de Sousa saves women from drowning
2020/08/18 0:00:00,Ashley Tisdale explains why she had breast implant removal surgery
2020/08/18 0:00:00,Coronavirus: Premier hopeful overseas tourists will be back in 2021
2020/08/18 0:00:00,Democratic National Convention: Donald Trump takes aim at Michelle Obama on Twitter
2020/08/18 0:00:00,Invisible Boys author Holden Sheppard has sold the film and television rights to his debut novel
2020/08/18 0:00:00,David James O’Toole to stand trial over alleged screwdriver attack at West Lakes
2020/08/18 0:00:00,Sydney hotel quarantine guard tests positive to COVID
2020/08/18 0:00:00,AFL 2020: Marcus Bontempelli ready to stare down midfield bull Christian Petracca
2020/08/18 0:00:00,Woman cops it for exposing medical professional’s ‘worrying’ pick-up attempt
2020/08/18 0:00:00,"Meghan Markle, Harry’s Twitter mistake reveals looming PR disaster"
2020/08/18 0:00:00,Two arrested after massive police operation in Ambarvale
2020/08/18 0:00:00,"COVID-19 to make it cheaper and faster to build new homes, but tradies face decade of pain"
2020/08/18 0:00:00,Dave ‘Hughesy’ Hughes cops backlash over filming Masked Singer during lockdown
2020/08/18 0:00:00,NRL 2020: Shaun Johnson breaks silence on Kevin Proctor ‘bite’
2020/08/18 0:00:00,"AFL 2020: Wild details emerge of Elijah Taylor, girlfriend’s COVID breach"
2020/08/18 0:00:00,Hearing implant firm Cochlear sheds millions in US litigation case loss
2020/08/18 0:00:00,"Man ordered to pay $20,000 for importing steroids into WA"
2020/08/18 0:00:00,University of Sydney study shows low humidity causes coronavirus spread
2020/08/18 0:00:00,YouTuber Allen Pan invents ‘gun’ that fires masks onto people’s faces
2020/08/18 0:00:00,SA’s 5-star hotel to open dubbed ‘dream come true’ for tourism sector
2020/08/18 0:00:00,NRL: Cronulla winger Sione Katoa set to re-sign with Sharks following stellar season
2020/08/18 0:00:00,"Troye Sivan on his ultra-personal new EP, body images and getting a ’sneaky’ gift from Taylor Swift"
2020/08/18 0:00:00,Modelling reveals whether Victoria will be able to ease stage 4 restrictions after six weeks
2020/08/18 0:00:00,Celebrity chef Pete Evans lists Malabar home with $3.2m guide
2020/08/18 0:00:00,Ryan Reynolds’ hilarious out-of-office email after $845m Aviation Gin deal
2020/08/18 0:00:00,New Zealand’s new coronavirus policy forces couples apart
2020/08/18 0:00:00,Cranbourne West phone tower fire: Counter-terrorism police take charge of investigation
2020/08/18 0:00:00,Ultimate V8-powered ‘T-Rex’ ute revealed
2020/08/18 0:00:00,Beauty and fashion products MAFs star Jules Robinson used during pregnancy
2020/08/18 0:00:00,BHP profits dip but iron ore offsets other commodity price volatility
2020/08/18 0:00:00,Very high fire danger for southeast Qld as winds and temperatures soar
2020/08/18 0:00:00,Full list of winners for the MTV Video Music Awards: Lady Gaga cleans up
2020/08/18 0:00:00,Glenn Robbins turned down role in ‘Pitch Perfect 3’
2020/08/18 0:00:00,Young people can’t afford private health cover during coronavirus pandemic
2020/08/18 0:00:00,LOL dolls video reveals X-rated outfits when submerged in ice water
2020/08/18 0:00:00,Bird experts concerned swooping magpies may fear those in face masks
2020/08/18 0:00:00,Paedophile would buy victim ice-cream before abuse
2020/08/18 0:00:00,Tasmania will keep state border closed until at least December
2020/08/18 0:00:00,China targets Australian wine exporters
2020/08/18 0:00:00,Croydon house buyers are dying to inspect after stage four eased
2020/08/18 0:00:00,Democratic National Convention: Urquiza blames dad’s death on US politicians
2020/08/18 0:00:00,Microsoft ending support for Internet Explorer in Office 365
2020/08/18 0:00:00,Oz Lotto $10 million jackpot winning numbers| Lottery draw 1383
2020/08/18 0:00:00,"Lack of support detailed during COVID, disability royal commission hears"
2020/08/18 0:00:00,Coronavirus New Zealand: 12 new cases linked to Auckland cluster
2020/08/18 0:00:00,Valentino Rossi’s girlfriend ‘destroyed’ by horror MotoGP crash
2020/08/18 0:00:00,AFL 2020: Lions skipper Dayne Zorko says the season has also been hard on Brisbane
2020/08/18 0:00:00,West Footscray California bungalow renovated with contemporary industrial edge
2020/08/18 0:00:00,Virus cases could drop to 100s as Victoria records 222 new infections
2020/08/18 0:00:00,Coronavirus Australia: How to get a mental health plan to see a psychologist or counsellor
2020/08/18 0:00:00,Coronavirus NSW: Dry weather could increase COVID-19 risk
2020/08/18 0:00:00,Popular Melbourne live music venue wants instant testing before entry
2020/08/18 0:00:00,‘Every day must be leg day’: NFL freaks out over 112kg rookie beast
2020/08/18 0:00:00,Man earns $70k during lockdown with campervan transformation | Photo
2020/08/18 0:00:00,"Melbourne, Adelaide weather: Fierce winds, snow forecast to slam south east"
2020/08/18 0:00:00,AFL 2021 season start date: Report claims COVID-19 delays footy until June
2020/08/18 0:00:00,Jacinda Ardern hits back as Trump slams New Zealand‘s ’big surge’ in COVID-19 cases
2020/08/18 0:00:00,What is narcolepsy? Woman’s battle with rare sleep condition
2020/08/18 0:00:00,WA’s phase five COVID-19 restrictions pushed back as Tas keeps borders shut
2020/08/18 0:00:00,Kmart’s $20 Super High Rise Straight Jeans send fans into frenzy
2020/08/18 0:00:00,Coronavirus: Mutated virus strain spreading around the world
2020/08/18 0:00:00,Concerns SA restrictions would negatively impact psychological and financial wellbeing of aged care workers
2020/08/18 0:00:00,NSW records three new cases of coronavirus
2020/08/18 0:00:00,NRL 2020: ‘Prominent name’ behind Anthony Seibold rumours
2020/08/18 0:00:00,‘Officially up for grabs’: UFC’s most dominant star drops bombshell
2020/08/18 0:00:00,"NBA playoffs 2020: Kristaps Porzingis ejection, LeBron James loses it"
2020/08/18 0:00:00,Robert Poate’s father demands justice as Afghan murderer Hekmatullah set to walk free
2020/08/18 0:00:00,"Three Melbourne Woolworths workers, one Dan Murphy’s, test positive for coronavirus"
2020/08/18 0:00:00,Sharon Stone’s grim warning as family members battle coronavirus
2020/08/18 0:00:00,"Apple deletes Fortnite over direct payment, despite Music on Android doing it too"
2020/08/18 0:00:00,"IN PHOTOS: Refugee activists march through Brisbane, causing traffic mayhem"
2020/08/18 0:00:00,Coles reports retail profit uplift as sales surge from coronavirus pandemic buying
2020/08/18 0:00:00,AFL 2020: Garry Lyon hated Hawthorn players laughing with Eagles
2020/08/18 0:00:00,F1 2020: Sebastian Vettel scolds team in radio blow up during Spanish Grand Prix
2020/08/18 0:00:00,Ellen DeGeneres Show axes executive producers amid ‘toxic’ workplace claims
2020/08/18 0:00:00,Qld premier to take border issues to Scott Morrison at National Cabinet
2020/08/18 0:00:00,Fran Drescher opens up about horrifying home invasion and rape ordeal
2020/08/18 0:00:00,‘Trump has got a shocking record’: Labor MP Bill Shorten
2020/08/18 0:00:00,Bison rips off woman’s pants in horrifying attack caught on video
2020/08/18 0:00:00,Chrissy Teigen flaunts baby bump in daring cut-out swimsuit
2020/08/18 0:00:00,Setback for Labor with small and medium-sized Qld businesses to vote for LNP at October election
2020/08/18 0:00:00,Carbone Lawyers launch class action against Epping Gardens aged-care facility
2020/08/18 0:00:00,NRL Round 15 teams and KFC SuperCoach NRL latest news
2020/08/18 0:00:00,Police release CCTV footage in the hope of finding missing Langwarrin cyclist Malcolm Bohmeyer
2020/08/18 0:00:00,‘Is she alive?’: Woman’s swim in New York’s Hudson River goes viral | Video
2020/08/18 0:00:00,California’s Death Valley records world‘s hottest temperature
2020/08/18 0:00:00,Lovecraft Country review: The killer monsters are the least scary part
2020/08/18 0:00:00,Grant Denyer’s wife Chezzi reveals horrific pregnancy side effect
2020/08/18 0:00:00,Earnings season ramps up with many Aussie companies taking a coronavirus hit
2020/08/18 0:00:00,ACTU secretary Sally McManus defends security guards
2020/08/18 0:00:00,"Rydges, Stamford Plaza hotels source of Victoria’s COVID-19 outbreak"
2020/08/18 0:00:00,Mum transforms old dressing table using just two Bunnings items
2020/08/18 0:00:00,An earthquake with a magnitude 3.2 has been felt around Apollo Bay in Victoria’s south west
2020/08/18 0:00:00,"Victoria records 222 new coronavirus cases, 17 more deaths"
2020/08/18 0:00:00,HomeBuilder grants: 1100 Victorians apply in a week
2020/08/18 0:00:00,"One in eight small, medium businesses in Melbourne may never reopen Liberal leader Michael O’Brien claims"
2020/08/18 0:00:00,Peter Nygard accused in lawsuit of hiring sex worker for his teenage sons
2020/08/18 0:00:00,"Coronavirus Victoria: 222 new cases, 17 deaths recorded"
2020/08/18 0:00:00,"Exploding black dwarf star‘s supernova will destroy universe, study predicts"
2020/08/18 0:00:00,Meghan Markle’s friendship with Ivanka Trump ‘airbrushed’ from Finding Freedom
2020/08/18 0:00:00,Westpac holds dividend from shareholders to preserve capital during coronavirus pandemic
2020/08/18 0:00:00,JB Hi-Fi profits: Clever trick retailer used to boost sales
2020/08/18 0:00:00,All staff who attended banned party at Epping Gardens aged care tested positive to COVID-19
2020/08/18 0:00:00,Democratic National Convention live: Michelle Obama and Bernie Sanders speak
2020/08/18 0:00:00,"Hotel quarantine Victoria: Photos of rooms, sleeping guards shows depth of bungle"
2020/08/18 0:00:00,Sydneysiders face disruptions to bus network as drivers threaten strike action over virus concerns
2020/08/18 0:00:00,Melania Trump refuses Donald Trump’s hand
2020/08/18 0:00:00,Coronavirus: Photos show transformation of China’s original virus epicentre
2020/08/18 0:00:00,Mum sparks Facebook debate over ‘correct’ way to hang washing
2020/08/18 0:00:00,"Boy, 2, dies after he was left in hot bus for six hours"
2020/08/18 0:00:00,"Madonna celebrates 62nd birthday with boyfriend Ahlamalik Williams, 26"
2020/08/18 0:00:00,"Melbourne weather: Cold blast of rain, thunderstorms and snow to hit Victoria"
2020/08/18 0:00:00,Sunshine Coast aged care facility in lockdown over fears of COVID-19
2020/08/18 0:00:00,"NRL 2020: Tevita Pangai Jr faces contract rejection, Broncos players divided"
2020/08/18 0:00:00,Coronavirus: PM Scott Morrison’s plea over state borders
2020/08/18 0:00:00,Bernie Sanders urges his supporters to vote for Joe Biden over Donald Trump
2020/08/18 0:00:00,Two charged over infamous 2002 murder of Run-DMC star Jam Master Jay
2020/08/18 0:00:00,How do you eat Weet-Bix? Crushed vs. uncrushed debate erupts on Facebook
2020/08/18 0:00:00,Police intercept boat allegedly carrying hundreds of kilos of cocaine off NSW coast
2020/08/18 0:00:00,Queen’s closest aide ‘upset’ about being dragged into Meghan Markle ‘tiaragate’
2020/08/18 0:00:00,Police allege death of businessman in Cairns hotel was ‘sex act gone wrong’
2020/08/18 0:00:00,Coronavirus Australia: Victoria’s failed lockdown deadline
2020/08/18 0:00:00,Ellen DeGeneres’ ex Anne Heche weighs in on toxic workplace scandal
2020/08/18 0:00:00,Coronavirus Australia: ‘Can’t be forced’ to wear masks in Sydney
2020/08/18 0:00:00,"AFL: Sam Collins doesn’t flinch, emerges from Tom Lynch battle a winner"
2020/08/18 0:00:00,WNBL: Aussie star Liz Cambage signs with Southside Flyers after flirting with retirement and opting out of a US return this year
2020/08/18 0:00:00,Cricket 2020: Legends slam washed out England-Pakistan Test match after ‘ridiculous’ drama
2020/08/18 0:00:00,Body recovered from burnt-out campervan in Sydney’s west
2020/08/18 0:00:00,Olga Freeman charged with alleged murder of boy in London
2020/08/18 0:00:00,Coronavirus Australia: Health Minister Greg Hunt says COVID-19 deaths are a consequence of high community transmission
2020/08/18 0:00:00,At home with... Squid the griff’s mum Susanne Nicholls
2020/08/18 0:00:00,Medieval masterpiece at Hillbank a work of art
2020/08/18 0:00:00,Coronavirus Australia: City of Sydney declared a COVID-19 hotspot
2020/08/18 0:00:00,Barnaby Joyce fires up over Q&A on media privacy: ‘Saying the bleeding obvious’
2020/08/18 0:00:00,Former NSW Premier Barrie ­Unsworth sells Mona Vale townhouse
2020/08/18 0:00:00,This large family home in Rosetta has got it all
2020/08/18 0:00:00,Point Lonsdale: 1970s beach house sets huge price in quick sale
2020/08/18 0:00:00,Film director George Miller buys Upper Kangaroo River ­retreat of INXS guitarist Tim Farriss
2020/08/18 0:00:00,Geelong: Sub-$600K price point drives bidders for rare city chance
2020/08/18 0:00:00,Middle Park house price record: Beaconsfield Parade home could become suburb’s most expensive
