date,title
2020/11/19 0:00:00,AFC Champions League: Aaron Mooy’s Shanghai SIPG beat Sydney FC 2-1
2020/11/19 0:00:00,"Coronavirus ‘will fight back’ against vaccination, expert warns following Oxford University, AstraZeneca results"
2020/11/19 0:00:00,Unique Cherry Gardens home has Disneyland-style layout
2020/11/19 0:00:00,Severe heatwave to hit parts of Australia today as temperatures soar
2020/11/19 0:00:00,MMA fighter knocked out three times before referee steps in
2020/11/19 0:00:00,Fears as plague locusts ‘clusters’ spotted in Victoria
2020/11/19 0:00:00,"Pacodali could be a shoe-in in Ballarat Cup with some luck, says trainer Maddie Raymond"
2020/11/19 0:00:00,SA COVID-19 lockdown enters day two: Some bakeries allowed to trade as Premier says public exercise ban will be first to go
2020/11/19 0:00:00,Former leading trainer Liam Birchley looking to rebuild career following scandal
2020/11/19 0:00:00,Queensland and Wayne Bennett could part ways despite 2020 State of Origin miracle
2020/11/19 0:00:00,Gladys Berejiklian removes Catherine Cusack as Parliamentary secretary
2020/11/19 0:00:00,PM backs SA’s lockdown despite previously criticising Victoria’s
2020/11/19 0:00:00,Singer Lizzo emotionally breaks down on TikTok
2020/11/19 0:00:00,A-League: Ex-EPL striker Rudy Gestede linked with a move to Melbourne Victory
2020/11/19 0:00:00,Sterling First rent-for-life scam ‘gatekeeper’ slapped with $2m penalty
2020/11/19 0:00:00,Jack Steven announces retirement with year to go with Geelong Cats
2020/11/19 0:00:00,Rosehill races: Kerry Parker has duo ready to rumble at Rosehill before focusing on The Gong
2020/11/19 0:00:00,The ‘special’ treatment that bred alleged killers
2020/11/19 0:00:00,Don’t bag horse: James Cummings leaps to defence of Cascadian
2020/11/19 0:00:00,Fears for Aussie icon Bert Newton after wife Patti shares photo from hospital
2020/11/19 0:00:00,NSW opposition says world’s slowest and most expensive light rail project ‘just got worse’
2020/11/19 0:00:00,Murder charge laid over Celeste Manno’s alleged killing
2020/11/19 0:00:00,A-League: FFA assessing Adelaide United’s lockdown plight as players call for a schedule that can be altered
2020/11/19 0:00:00,Test star Nathan Lyon says he’s only getting better as he prepares to tackle India
2020/11/19 0:00:00,West Coast delist two-time AFL Premiership winner Lewis Jetta
2020/11/19 0:00:00,Elly Miles addresses rumours that she’s split from Bachelorette winner Frazer Neate
2020/11/19 0:00:00,Australia’s first female finance minister hailed as a political trailblazer
2020/11/19 0:00:00,Far better than expected jobs data boosts Australian sharemarket
2020/11/19 0:00:00,Digital wagering mastermind Matt Tripp warns of post-COVID bookie blues for operators
2020/11/19 0:00:00,Close-knit WA family ‘shattered’ by sudden deaths of toddler and grandmother
2020/11/19 0:00:00,NSW coach Brad Fittler fires back in Jai Arrow controversy after QLD star cops fine
2020/11/19 0:00:00,Australia’s most decorated living soldier in inquiry’s sights
2020/11/19 0:00:00,Mooloolaba Cup: While the market says Ballistic Boy is primed for a win his trainer isn’t so sure
2020/11/19 0:00:00,Tony Robbins ticket holders lose faith in months-long wait for refunds from events promoter SRA
2020/11/19 0:00:00,County Court Judge sets path forward for Darren Weir and others
2020/11/19 0:00:00,Zac Efron trapped in locked-down SA as production is paused on his upcoming film
2020/11/19 0:00:00,This week: Why dogs eat grass
2020/11/19 0:00:00,‘Jai has to live with it’: Brad Fittler filthy on NRL over punishment for Arrow’s ‘ugly’ act
2020/11/19 0:00:00,Teen with medical condition goes missing from her Brisbane home
2020/11/19 0:00:00,Guy Sebastian’s fate on The Voice 2021 revealed
2020/11/19 0:00:00,"‘Tiny terrorist’ Momena Shoma stabbed fellow prisoner, police allege"
2020/11/19 0:00:00,"Sweden’s herd immunity strategy has failed, hospitals inundated"
2020/11/19 0:00:00,"Cheers, SA: Alcohol sales spike ahead of statewide lockdown"
2020/11/19 0:00:00,Simon Told Helen ready to rock and roll in Melbourne Cup
2020/11/19 0:00:00,Victorian jockey Noel Callow in hot water with stewards
2020/11/19 0:00:00,"Robert De Niro on dodgy producers, The Comeback Trail and working in comedy"
2020/11/19 0:00:00,How common drive thru mistake could cost you $500
2020/11/19 0:00:00,Shameful lie that changes Australia forever
2020/11/19 0:00:00,Hugh Bowman set to climb premiership rankings with his return to Sydney racing
2020/11/19 0:00:00,Virgin Australia: Aviation expert questions airline’s ‘mid-market’ approach
2020/11/19 0:00:00,"Sam Aziz questioned on $600,000 handover with developer John Woodman at anti-corruption inquiry"
2020/11/19 0:00:00,Trainer Matthew Williams seeking Ballarat brilliance from ‘weird unit’
2020/11/19 0:00:00,"Cops seize $400,000 in early morning raids across southeast Queensland"
2020/11/19 0:00:00,Huge $1 billion in superannuation sitting with ATO expected to be handed back to Aussies
2020/11/19 0:00:00,Crown Resorts resists call to slash James Packer’s voting power
2020/11/19 0:00:00,State of Origin 2020: Damien Cook’s touching act of mateship after Cody Walker knocked out
2020/11/19 0:00:00,Summer targets on the line at Kembla on Saturday
2020/11/19 0:00:00,Why sex robots are recommended for older people
2020/11/19 0:00:00,Bobby Brown’s son Bobby Brown Jr. found dead in his LA home
2020/11/19 0:00:00,NBA Draft 2020: Michael Jordan gets his wish with LaMelo Ball pick
2020/11/19 0:00:00,Anna Paul shares painful TikTok video of lip filler being dissolved
2020/11/19 0:00:00,Coronavirus vaccine: Aussies could pay to get jab earlier
2020/11/19 0:00:00,Security staff and cleaners at quarantine hotels in WA to be tested weekly for COVID-19
2020/11/19 0:00:00,Trump campaign pays $4 million for Wisconsin recount
2020/11/19 0:00:00,Sydney’s Josh Green will play for Dallas while NBL pathway star LaMelo Ball went pick three in the NBA draft
2020/11/19 0:00:00,KFC SuperCoach BBL: Dan Batten’s team and unique picks to set your side apart
2020/11/19 0:00:00,Why Freshwater Creek Cakes passionfruit cake is worth a drive to Victoria
2020/11/19 0:00:00,Big Bash League: English star Joe Clarke offered lifeline at Perth Scorchers despite sordid sex incident
2020/11/19 0:00:00,Afghanistan war crimes: What you didn’t get to see
2020/11/19 0:00:00,Fight to keep ‘essential’ Back on Track kids cancer education program going
2020/11/19 0:00:00,Embarrassing thing Sophie Monk was famous for in LA
2020/11/19 0:00:00,Truck fire M4: Driver escapes serious injury after truck blaze
2020/11/19 0:00:00,New Kids on the Block’s Donnie Wahlberg leaves waitress $2020 tip in #2020tipchallenge
2020/11/19 0:00:00,One-time cult figure Aku Uate announces his retirement
2020/11/19 0:00:00,Mum hits back after being slammed for hubby’s lunch box snacks
2020/11/19 0:00:00,Candice Warner reveals terrifying toll of hitting rock bottom
2020/11/19 0:00:00,Meghan Markle’s court confession makes things awkward for the Queen
2020/11/19 0:00:00,Family fight to keep photo of teenage giving rude finger on tombstone
2020/11/19 0:00:00,War crimes report so bad it could spark terror attacks
2020/11/19 0:00:00,Mental health and suicide: ‘Ten seconds is all that stands between me and the end of my life’
2020/11/19 0:00:00,WA Treasurer says the ‘rise of unhelpful public commentary’ is causing tension with China
2020/11/19 0:00:00,Adelaide couple Paul and Rainey Wood reschedule wedding with just hours of notice ahead of state virus shutdown
2020/11/19 0:00:00,Jack de Belin takes stand in sex assault trial
2020/11/19 0:00:00,Sarah Silverman gives heartbreaking account of Adam Schlesinger’s coronavirus death
2020/11/19 0:00:00,You Got This: Woman unveils 55kg transformation at daughter’s wedding
2020/11/19 0:00:00,Kyle Daniels trial: Dad’s breakdown over daughter’s confession
2020/11/19 0:00:00,Britain’s worst paedophile Richard Huckle brutally murdered in vigilante attack
2020/11/19 0:00:00,Nurse slams South Australians complaining about six-day lockdown
2020/11/19 0:00:00,Father of young Qld woman who fell to her death can’t attend funeral because of SA lockdown
2020/11/19 0:00:00,Carmela’s mother sold her and her sisters to a foreign paedophile
2020/11/19 0:00:00,"Second at the Masters, a message from Shane Warne and a Queensland win made for a good Cameron Smith week"
2020/11/19 0:00:00,‘War on drugs’: Cops granted new powers to crack down on drug crime
2020/11/19 0:00:00,Woman charged with high-range drink driving with 4yo in car
2020/11/19 0:00:00,Facebook content moderators slam CEO Mark Zuckerberg in open letter
2020/11/19 0:00:00,The ending of Origin III was a chaotic farce. Here’s why the refs got it RIGHT
2020/11/19 0:00:00,Infant dies of brain injuries caused by ‘excessive force’ during forceps delivery
2020/11/19 0:00:00,Home Affairs Minister Peter Dutton slams Qld Premier Annastacia Palaszczuk over Origin crowd
2020/11/19 0:00:00,Bitesoft Co.: How 23yo couple made $1.8m in 6 months
2020/11/19 0:00:00,South Australia’s top cop fires up at reporter in defence of hotel quarantine workers
2020/11/19 0:00:00,Yatala Vale hilltop home that’s out of the box
2020/11/19 0:00:00,Coronavirus Adelaide: Couple forced to cancel wedding for the second time this year
2020/11/19 0:00:00,China allegedly used a secret ‘microwave weapon’ on enemy troops
2020/11/19 0:00:00,Coronavirus Australia: Quarantine oversight could cause big issue
2020/11/19 0:00:00,"If you were hoping for a pay rise in 2021, we’ve got bad news for you"
2020/11/19 0:00:00,Zero local cases of COVID-19 in NSW as state relaxes restrictions
2020/11/19 0:00:00,SA police out on empty streets as state goes into first day of lockdown
2020/11/19 0:00:00,Chance of wild parties in Tokyo just got cut after Olympics announcement
2020/11/19 0:00:00,Aussie radio host reveals mid-air death experience on flight to Paris
2020/11/19 0:00:00,Rare white giraffe in Kenya fitted with GPS tracker to combat poachers
2020/11/19 0:00:00,"Testing requirements change for police, medical professionals at Qld hotel quarantine"
2020/11/19 0:00:00,Why Crown Sydney casino at Barangaroo won’t open on schedule
2020/11/19 0:00:00,Valley 955m sprint king Meteorite not out to break any records this time
2020/11/19 0:00:00,"Adelaide, SA lockdown: Residents flee interstate ahead of restrictions"
2020/11/19 0:00:00,Thursday’s Powerball  $8 million prize jackpots after no division one winner | Draw 1279
2020/11/19 0:00:00,Woman falls pregnant after being given flu shot instead of birth control
2020/11/19 0:00:00,NSW Labor Leader Jodi McKay delivers budget reply
2020/11/19 0:00:00,"International flights into Adelaide cancelled until at least November 30, Premier Steven Marshall announces"
2020/11/19 0:00:00,Shocking claims about young recruits’ ‘first kill’ in war crimes report
2020/11/19 0:00:00,Adrian Grenier took a trip to Las Vegas with Mark Wahlberg for Entourage role research
2020/11/19 0:00:00,List changes continue at Essendon after review finds coaching divide
2020/11/19 0:00:00,How to choose the right mobile plan
2020/11/19 0:00:00,South Australia’s lockdown is not a walk in the park
2020/11/19 0:00:00,Horror movie-inspired stabber seeks release on parole
2020/11/19 0:00:00,"Dale Thomas: Former Collingwood, Carlton player lists Glen Iris home"
2020/11/19 0:00:00,War crimes report includes ‘possibly the most disgraceful episode in Australia’s military history’
2020/11/19 0:00:00,Freebirthing mum-of-eight gives birth to twins in living room
2020/11/19 0:00:00,‘Deeply disturbing’ war crimes report: 39 Afghanis allegedly killed by SAS
2020/11/19 0:00:00,Megan Is Missing warning: ‘Do not watch this film at night’
2020/11/19 0:00:00,Police arrest ‘Bonnie & Clyde’ couple who fled restaurants without paying
2020/11/19 0:00:00,16 Amazon products with thousands of 5-star reviews
2020/11/19 0:00:00,"No new COVID-19 cases in SA, as lockdown begins"
2020/11/19 0:00:00,Man sustains leg injuries after falling off roof at workplace in Sydney’s southwest
2020/11/19 0:00:00,South Australians told to ‘calm the farm’ after toilet paper panic
2020/11/19 0:00:00,Pottsville: Mystery surrounds death of woman found with fatal head injuries
2020/11/19 0:00:00,Zero new cases as SA starts six-day lockdown to stop COVID-19 outbreak growing
2020/11/19 0:00:00,Man fined after dog attacked rare Australian fur seal at Long Reef beach
2020/11/19 0:00:00,Man left bloodied by female MMA fighter
2020/11/19 0:00:00,‘Can’t wait’: Porsche tragedy driver Richard Pusey a court no-show
2020/11/19 0:00:00,Bizarre ‘nappy’ detail in bride’s dress roasted
2020/11/19 0:00:00,Hush hush $17.8m sale of Mosman family home shatters street record
2020/11/19 0:00:00,‘Bizarre’ texts to stop Bourke St rampage driver: inquest
2020/11/19 0:00:00,Daniel Ricciardo complains about F1 'robbery’
2020/11/19 0:00:00,China leaks dossier of 14 disputes with Australia as tensions increase
2020/11/19 0:00:00,Police officer faces sack for allegedly switching price tags to get cheaper doughnuts from Tesco
2020/11/19 0:00:00,Buyer discovers South Geelong character home just before auction
2020/11/19 0:00:00,‘Queen of Richmond’ jailed for flight attendant heroin smuggling syndicate
2020/11/19 0:00:00,ANZ hit savers with rate cut higher than what was prescribed by the RBA
2020/11/19 0:00:00,SA supermarket trading hours extended to allow social distancing
2020/11/19 0:00:00,"Naya Rivera’s ex-husband files wrongful death lawsuit on behalf of son, Josey"
2020/11/19 0:00:00,Guns N’ Roses announce 2021 Australian stadium tour
2020/11/19 0:00:00,UK Instagram star Mrs Hinch makes millions with cleaning tips
2020/11/19 0:00:00,Hyundai Kona Electric recalled in Australia
2020/11/19 0:00:00,Moments before fatal Sydney samurai sword attack revealed
2020/11/19 0:00:00,Mariah Huthmann Grace dies after fall from Gold Coast balcony
2020/11/19 0:00:00,State of Origin 2020: Major Brad Fittler blunder costs NSW the series
2020/11/19 0:00:00,Organisers of illegal Melbourne beach parties fined after large crowds gather
2020/11/19 0:00:00,No Aussie based jockeys for HK series but still a huge influence
2020/11/19 0:00:00,Republican election officials threatened during Zoom call for refusing to certify Michigan results
2020/11/19 0:00:00,Prince William comments on investigation into Diana’s 1995 Panorama interview
2020/11/19 0:00:00,Scott Morrison’s phone call before bombshell war crimes report
2020/11/19 0:00:00,Speed camera warning signs scrapped and harsher penalties for DUI
2020/11/19 0:00:00,Unemployment hits 7 per cent as federal government payments to workers taper
2020/11/19 0:00:00,"Alleged one-punch attack after State of Origin leaves man dead, another in custody"
2020/11/19 0:00:00,South Australia lockdown: Tough restriction that’s not going away
2020/11/19 0:00:00,Couple and baby killed in beach cliff collapse in Brazil
2020/11/19 0:00:00,White House Press Secretary Kayleigh McEnany labels Thanksgiving COVID restrictions ‘Orwellian’
2020/11/19 0:00:00,Why Queen Elizabeth II will never abdicate the throne
2020/11/19 0:00:00,George Clooney reveals the hilarious prank Brad Pitt pulled on him
2020/11/19 0:00:00,Kaley Cuoco is an addicted trainwreck in The Flight Attendant
2020/11/19 0:00:00,Pope Francis’ Instagram page ‘liked’ Brazilian model’s sexy photo
2020/11/19 0:00:00,Phil Gould certain Blues were robbed as ‘fastest man on the planet’ denied
2020/11/19 0:00:00,Apple cuts commission costs for small business as Epic Games sues after App Store removal
2020/11/19 0:00:00,AFLW great Moana Hope and model wife Isabella Carlstrom reveal baby name
2020/11/19 0:00:00,Subaru reinvents smash-hit BRZ coupe
2020/11/19 0:00:00,Australia reacts to ‘chaotic’ SA shutdown amid coronavirus outbreak
2020/11/19 0:00:00,Celeste Manno’s heartbroken boyfriend posts moving tribute following tragic murder
2020/11/19 0:00:00,"Victoria records 20th day of no new COVID-19 infections, deaths"
2020/11/19 0:00:00,SA lockdown: Terrifying coronavirus strain gripping the state
2020/11/19 0:00:00,SA wakes up to full lockdown as circuit-breaker restrictions begin for six days
2020/11/19 0:00:00,Frydenberg muscles up to China
2020/11/19 0:00:00,This stadium could change cricket forever as America prepares for takeover
2020/11/19 0:00:00,Score 60% off wardrobe essentials at Birdsnest
2020/11/19 0:00:00,An Adelaide mother whose son has been missing for six weeks sends a desperate plea
2020/11/19 0:00:00,Meghan Markle says she did pass private information onto Finding Freedom authors
2020/11/19 0:00:00,‘Brad’s kidding himself’: Bennett slams Fittler over Arrow shot
2020/11/19 0:00:00,Man dies in Derrimut after police called to injured man lying on the road
2020/11/19 0:00:00,Premier jockey Baylee Nothdurft ready to hit ground running in return from 11-day suspension
2020/11/19 0:00:00,"COVID-19 vaccine’s two side effects, Pfizer vaccine 95% effective"
2020/11/19 0:00:00,The Firebirds overlook former national coach Lisa Alexander for her former assistant
2020/11/19 0:00:00,"Georgia recount ‘error’ nearly gave Biden 9600 extra votes, as more uncounted Trump ballots discovered"
2020/11/19 0:00:00,Anika Learoyd’s luckless start to professional career in the WBBL bubble
2020/11/19 0:00:00,Harry Grant’s spectacular Origin debut marks the arrival of a new pin-up boy for Australian sport
2020/11/19 0:00:00,US election lawsuits: Rudy Giuliani’s performance in Trump’s Pennsylvania case panned
2020/11/19 0:00:00,Skipper’s mic drop after being labelled the ‘worst Queensland team in history’
2020/11/19 0:00:00,"President Trump could face ‘lame duck’ status at G20 Saudi Arabia, if he chooses to attend"
2020/11/19 0:00:00,Careful restoration puts spotlight on charms of the 1870s
2020/11/19 0:00:00,Willowcrest estate at Dural with two lakes and award-winning gardens on the market
2020/11/19 0:00:00,Belmont buyers ditch investment property plan to move in
2020/11/19 0:00:00,Frankston Kananook Creek home in suburb’s ‘best kept secret’
