date,title
2020/04/26 0:00:00,"Kim Jong-un ‘alive and well’ in resort, according to government official"
2020/04/26 0:00:00,‘COVID toes’: Mystery skin rash could be symptom of coronavirus
2020/04/26 0:00:00,Former NRL star Daniel Vidot reflects on WWE debut
2020/04/26 0:00:00,Coronavirus: Spain’s first step in return to normal life
2020/04/26 0:00:00,Lego Masters: Contestants break record in ‘Australian television’ first
2020/04/26 0:00:00,Emmanuel Acho’s brutal swipe at Russell Wilson’s former wife
2020/04/26 0:00:00,Coronavirus: Australia still faces $400b hit as zero cases in four states
2020/04/26 0:00:00,MasterChef judges stunned by Reynold’s ‘magic’ dessert on tonight’s episode
2020/04/26 0:00:00,Demon Kate Hore wins AFLW goal of the year and Giant Rebecca Privitelli wins mark of the year
2020/04/26 0:00:00,Coronavirus China: Wuhan COVID-19 hospital patients discharged
2020/04/26 0:00:00,Tommy Little gives angry coronavirus app rant on The Project
2020/04/26 0:00:00,"Coronavirus: WHO warns over virus immunity as global death toll nears 200,000"
2020/04/26 0:00:00,Russian boxer Svetlana Soluyanova names sexiest female fighters from her homeland
2020/04/26 0:00:00,NRL players and staff to undergo strict biosecurity protocols ahead of season’s return
2020/04/26 0:00:00,Woman dead and man in ICU after Hocking ‘dispute’
2020/04/26 0:00:00,"Inside Australia’s ‘most dangerous place’, a coronavirus intensive care unit"
2020/04/26 0:00:00,Lawyer claims Carole Baskin’s dead husband Don Lewis was “murdered” and “dropped out of a plane”
2020/04/26 0:00:00,Australian Olympian Madeline Groves’ ongoing battle with endometriosis and adenomyosis
2020/04/26 0:00:00,Coronavirus updates: How the Federal Government’s COVID-19 tracing app really works
2020/04/26 0:00:00,"How a racing driver lost his home, cars and $20 million in an elaborate scheme"
2020/04/26 0:00:00,Get back to work: NBA players can start training again this week
2020/04/26 0:00:00,Melbourne Cup winner Vow And Declare fails to flatter with trainer Danny O’Brien sending him for a spell
2020/04/26 0:00:00,Coronavirus: Western Australia attempts ‘cautious relaxation’ of lockdown restrictions
2020/04/26 0:00:00,Former St Kilda player Arryn Siposs turned punter signed by Detroit Lions
2020/04/26 0:00:00,Coronavirus Australia: COVIDSafe app now online to trace virus contacts
2020/04/26 0:00:00,"Coronavirus: new listings drop prevented Sydney housing market crash in April, March"
2020/04/26 0:00:00,Coronavirus: Mexican gang violence on the rise despite lockdown
2020/04/26 0:00:00,"Coronavirus: Nepean Hospital doctor tests positive, other staff members go into isolation"
2020/04/26 0:00:00,‘I’m not trying to dramatise it’: Paul Kent and RLPA boss in fiery clash over May 28 restart
2020/04/26 0:00:00,Melbourne Storm’s Sandor Earl slams ‘misguided’ media over NRL return
2020/04/26 0:00:00,Actor Nick Cordero gets temporary pacemaker amid coronavirus battle
2020/04/26 0:00:00,Coronavirus: Queensland Premier announces COVID-19 restrictions will ease up
2020/04/26 0:00:00,Peter Sterling backs Origin foes to be game’s next two Immortals
2020/04/26 0:00:00,"Karl Stefanovic reveals PTSD diagnosis after marriage end, Today axing"
2020/04/26 0:00:00,Australia considers opening borders with New Zealand
2020/04/26 0:00:00,"Female doctor at Nepean Hospital contracts COVID-19, as the NSW death toll rises to 36"
2020/04/26 0:00:00,"Coronavirus vaccines and treatment are in development, but what is the world’s Plan C?"
2020/04/26 0:00:00,"Today in history, April 26: Chernobyl nuclear accident"
2020/04/26 0:00:00,Coronavirus: Sydney beaches hit by crowds again
2020/04/26 0:00:00,Coronavirus: CNN host Anderson Cooper breaks down speaking to virus widow
2020/04/26 0:00:00,Kim Jong-un’s sister Kim Yo Jong could take over North Korea if he dies: reports
2020/04/26 0:00:00,Nurse left petrified after neighbour spits on her car for dobbing on him
2020/04/26 0:00:00,Mike Tyson’s love life has been a wild ride
2020/04/26 0:00:00,Craig Bellamy hails proactive Peter V’landys for making NRL return happen
2020/04/26 0:00:00,Buyers ‘infatuated’ with early 1800s Tasmanian homes
2020/04/26 0:00:00,The Last Dance director talks all things Michael Jordan and the Chicago Bulls
2020/04/26 0:00:00,Coronavirus Australia: Queensland and Western Australia to lift some social distancing restrictions
2020/04/26 0:00:00,Adelaide crash: Two women dead after 'horrific' collision in Adelaide
2020/04/26 0:00:00,"Coronavirus: Spanish police have fined people for walking bizarre pets including hens, fish and toy dogs"
2020/04/26 0:00:00,Peter FitzSimons issues blunt message to Wallaby captains who want change
2020/04/26 0:00:00,Coronavirus: Brazil becoming COVID-19 hot spot as testing falters
2020/04/26 0:00:00,NSW Police Commissioner cancels 32 COVID-19 related fines
2020/04/26 0:00:00,One in three parents unaware flu vaccination is recommended for kids
2020/04/26 0:00:00,"Normal People review: A sensual, intimate and complex love story"
2020/04/26 0:00:00,"Daily blog, April 26: Four new coronavirus cases confirmed"
2020/04/26 0:00:00,Coronavirus: Surprising benefit of COVID-19 lockdown restrictions
2020/04/26 0:00:00,Footballer Moise Kean condemned for throwing lockdown party
2020/04/26 0:00:00,Premier Annastacia Palaszczuk provides update on COVID-19 cases in Queensland
2020/04/26 0:00:00,Android app network removed from Google Play Store
2020/04/26 0:00:00,"Coronavirus: Global COVID-19 death toll passes 200,000"
2020/04/26 0:00:00,Folau supporter’s Castle death threat forced RA to take drastic measures
2020/04/26 0:00:00,Kanye West’s angry text after being named a billionaire by Forbes
2020/04/26 0:00:00,Trump unfollows Piers Morgan on Twitter after ‘batsh*t crazy’ taunt
2020/04/26 0:00:00,Russell Crowe doubles down on push for Shane Richardson to become NRL CEO
2020/04/26 0:00:00,Future Immortal and fallen star: Andrew Johns and Brad Fittler pick their best five NRL fullbacks ever
2020/04/26 0:00:00,"Coronavirus Australia: COVID-19 has limited transmissibility for students, NSW Health report finds"
2020/04/26 0:00:00,Is this Australia’s next NBA star? Giant teen Makur Maker enters draft
2020/04/26 0:00:00,St Kilda legend Steven Baker remembers costly bender before training
2020/04/26 0:00:00,Coronavirus rent relief: Wave of requests expected in Victoria
2020/04/26 0:00:00,East Melbourne mansion built for Young and Jackson publican for sale
2020/04/26 0:00:00,First look inside the new Australian Big Brother house
2020/04/26 0:00:00,Tributes flow for brave police heroes
2020/04/26 0:00:00,Plane chartered to bring vital medicine from Japan to Australia
2020/04/26 0:00:00,The innovative idea that could allow fans to attend Origin games
2020/04/26 0:00:00,Football star Junior Sambia in ‘artificial coma’ after testing positive to coronavirus
2020/04/26 0:00:00,Sunday Telegraph readers share their precious Anzac Day photos
2020/04/26 0:00:00,Transform a rundown home in sought-after Medindie Gardens
2020/04/26 0:00:00,Coronavirus Australia live updates: How COVIDSafe app works
2020/04/26 0:00:00,Coronavirus: WHO warns countries against handing out ‘immunity passports’
2020/04/26 0:00:00,Ashton homestead a grand family entertainer with room to grow
2020/04/26 0:00:00,That Acton lifestyle: spacious living and close to every need or desire
2020/04/26 0:00:00,COVID-19: Confused tenants looking for baseless rent reductions
2020/04/26 0:00:00,Sydney real estate: Chippendale building housing the secret Saga Bar is offering a cool opportunity
