date,title
2020/11/21 0:00:00,Josh Dunkley breaks his silence after dropping Bulldogs bombshell
2020/11/21 0:00:00,Railway Stakes 2020: Willie Pike does it again with third straight success in Perth’s premier Group 1
2020/11/21 0:00:00,A man has died after trying to rescue his son at Woonona Beach
2020/11/21 0:00:00,Ballarat Cup 2020: Irish Flame continues to be revelation for Mornington trainer Brett Scott
2020/11/21 0:00:00,The Gong: Archedemus breaks drought in Kembla Grange homecoming
2020/11/21 0:00:00,Sunlight’s sister Sisstar rolls yet another favourite at Ballarat
2020/11/21 0:00:00,WA Premier won’t apologise for hard border with South Australia
2020/11/21 0:00:00,Wallabies mistakes come back to bite them against Pumas
2020/11/21 0:00:00,Health Hacker: Tips on how to get the best night’s sleep
2020/11/21 0:00:00,"How to tell war stories to children, by We Are Wolves author Katrina Nannestad"
2020/11/21 0:00:00,My Octopus Teacher: Six lessons we can learn from Netflix documentary
2020/11/21 0:00:00,Paul Bettany on his own father’s coming out and how marriage to Jennifer Connelly saved him
2020/11/21 0:00:00,Australia v India: Fox Cricket launch new summer jingle as Nathan Lyon joins commentary box
2020/11/21 0:00:00,Netflix drama The Crown has officially lost the plot
2020/11/21 0:00:00,Why Donald Trump’s refusal to concede defeat will kill cinemas
2020/11/21 0:00:00,CAS basketball: Waverley too strong for St Aloysius in Round 5
2020/11/21 0:00:00,Australian Open in ‘chaos’ over historic date change
2020/11/21 0:00:00,Star Of Michelin hits top gear for trainer Stuart Kendrick
2020/11/21 0:00:00,"Vaucluse house in same family for 100 years sells for $16.6m, $6m above reserve"
2020/11/21 0:00:00,Los Angeles Lakers make monster moves in NBA 2020 free agency
2020/11/21 0:00:00,Newtown: Stunning laneway home beats price hopes by $50K
2020/11/21 0:00:00,Queanbeyan Cup 2020: Weight claim gives Pecuniary Interest a push in the right direction
2020/11/21 0:00:00,Wrongfully jailed WA man may get compensation after acquittal of  pregnant lover’s murder
2020/11/21 0:00:00,Trail bike rider injured in Lancelin crash
2020/11/21 0:00:00,15-year-old girl with Down syndrome who survived cancer dies of COVID-19
2020/11/21 0:00:00,Footage captures man ramming cars in wild Brisbane police chase
2020/11/21 0:00:00,Superspreader events key driver in COVID-19 pandemic
2020/11/21 0:00:00,Quirindi preview: Choice barrier draw puts Very Sharp in picture
2020/11/21 0:00:00,"NBA 2020 Free Agency explodes in $1.2 billion frenzy, Dwight Howard’s Sixers backflip"
2020/11/21 0:00:00,Terrified mum’s warning after home intruder ‘attempted to snatch her toddler’
2020/11/21 0:00:00,Man fights for life after horror Ludlow crash that killed two women
2020/11/21 0:00:00,Spanish man may be deported after causing South Australian lockdown
2020/11/21 0:00:00,The Undoing: Nicole Kidman’s daughters loved giant Sydney mural of mum
2020/11/21 0:00:00,Supermarket Giant Foods apologises for “super spread” ad
2020/11/21 0:00:00,How to earn money while Christmas shopping according to budget expert
2020/11/21 0:00:00,Aussie ice cream chain Peters accused of freezing out competition
2020/11/21 0:00:00,Chris Hemsworth stuns fans with ‘shredded’ workout photo
2020/11/21 0:00:00,"Insane $5m-plus beachfront pad has a rooftop deck, pool and eight-car basement"
2020/11/21 0:00:00,Starbucks’ customer finds cheeky secret message written on coffee cup by barista
2020/11/21 0:00:00,Did Cameron Smith accidentally open box on Melbourne Storm payments secret?
2020/11/21 0:00:00,Elderly man pulled from bed and mauled to death by pack of hyenas in Zimbabwe
2020/11/21 0:00:00,Cleaning-mad mum reveals why you shouldn’t make your bed first thing in the morning
2020/11/21 0:00:00,Bobby Brown speaks out on son’s death: It’s ‘devastated my family’
2020/11/21 0:00:00,Sydney Auctions: One-bedroom Manly unit in famed Dungowan building sells for $1.9 million
2020/11/21 0:00:00,US election: Reporter asks Donald Trump if he’s ‘being a sore loser’
2020/11/21 0:00:00,"The Pack is the wholesome, expensive reality TV show we need"
2020/11/21 0:00:00,Motorcyclist killed after bike slams into tree on Sunshine Coast
2020/11/21 0:00:00,Prince Harry accused of failing to stand by William in fight for BBC’s Diana interview truth
2020/11/21 0:00:00,Pregnant woman keeps pregnancy secret from boss while working from home
2020/11/21 0:00:00,Full moon photograph looks like mysterious giant eye through rock arch in Utah
2020/11/21 0:00:00,"Adelaide, SA regions to scorch as temperatures tip 45 degrees"
2020/11/21 0:00:00,Meghan Markle and Prince Harry hand Frogmore Cottage to Princess Eugenie and move belongings to California in dead of night
2020/11/21 0:00:00,Contestant dead after TV tragedy during filming for series re-boot
2020/11/21 0:00:00,Bank sells abandoned Mosman trophy home of failed businessman Michael Gu for $12m
2020/11/21 0:00:00,Pregnant dog Matilda saves four from hospice fire
2020/11/21 0:00:00,Terminally ill Alabama man confesses to 1995 cold-case killing
2020/11/21 0:00:00,WWE star sacked for adult film contract dispute
2020/11/21 0:00:00,Donald Trump Jr tests positive for COVID-19
2020/11/21 0:00:00,Full houses spark desire for space
2020/11/21 0:00:00,Target reissues recall for blender that can leave blades exposed
2020/11/21 0:00:00,Worst parking fail ever as Porsche drives over wall and onto another car
2020/11/21 0:00:00,"Drug trafficker executed for kidnapping and raping teen, burying her alive"
2020/11/21 0:00:00,Little Mix’s Perrie Edwards reveals she sent X-rated messages to an ex-boyfriend’s dad by mistake
2020/11/21 0:00:00,Tri-Nations: Michael Hooper calls on Wallabies to take advantage of the chance to win a major trophy
2020/11/21 0:00:00,‘Poster girl’ sergeant who posted racy snaps and travelled world while on sick leave quits force blaming ‘bullying’
2020/11/21 0:00:00,China attacks Australia’s ties with US in Global Times article
2020/11/21 0:00:00,Coronavirus Victoria: Melbourne suburbs on alert after fragments found in wastewater
2020/11/21 0:00:00,Rudy Giuliani press conference fact-checked: Do the Trump campaign’s claims have merit?
2020/11/21 0:00:00,First-home buyers: COVID spurs young Victorians to become homeowners
2020/11/21 0:00:00,Rudy Giuliani’s son Andrew tests positive for COVID
2020/11/21 0:00:00,Recruiters reveal if jobseekers still need to include a cover letter with their job application
2020/11/21 0:00:00,South Australian lockdown to lift on Saturday night after lie to contact tracers was uncovered
2020/11/21 0:00:00,Pros and cons you should consider before buying a short term holiday home
2020/11/21 0:00:00,Anthony Davis headlines the NBA’s top 30 free agents as bidding opens
2020/11/21 0:00:00,At home with popular Aussie singer Samantha Jade
2020/11/21 0:00:00,"Police discover secret drug lab in Port Melbourne, $13 million stash found"
2020/11/21 0:00:00,Coming 2 America 2 acquired by Amazon Prime for streaming debut
2020/11/21 0:00:00,NSW HIA-CSR awards: The best new homes in NSW revealed
2020/11/21 0:00:00,Best in state: NSW renovation winners revealed
2020/11/21 0:00:00,Cheating signs: How to tell if your partner is unfaithful
2020/11/21 0:00:00,The meme up that sums up Nine boss Hugh Marks’ decision to quit
2020/11/21 0:00:00,Family’s tribute for Leading Senior Constable Dennis Cox killed while cycling at Sea Lake
2020/11/21 0:00:00,Australian Museum’s renovations give Scotty the tyrannosaurus rex room to roar
2020/11/21 0:00:00,‘He took one for the team’: The mid-game sacrifice that unleashed Maroons sensation
2020/11/21 0:00:00,The secrets behind the most controversial royal outfits of all time
2020/11/21 0:00:00,Genesis G80 sedan review: New luxury arrival takes the fight to the Germans
2020/11/21 0:00:00,Matty Johns gets revenge on son Cooper for cruel paternity prank
2020/11/21 0:00:00,Mike Tyson makes a terrifying promise ahead of boxing return against Roy Jones Jr
2020/11/21 0:00:00,The woman behind Cameron Smith – and the moment that ‘crossed the line’
2020/11/21 0:00:00,Fun-filled Drysdale backyard rivals many public parks for playtime
2020/11/21 0:00:00,Character-filled cottage heading to auction
2020/11/21 0:00:00,Popularity of regional towns grows due to impact of COVID-19
