date,title
2020/06/19 0:00:00,‘Not fair’: Craig Bellamy hits out at rumours Canterbury Bulldogs set for million dollar offer
2020/06/19 0:00:00,Lord of the Rings star Ian Holm dies aged 88
2020/06/19 0:00:00,Sydney barista sacked after being told Bondi locals ‘a bit racist’
2020/06/19 0:00:00,‘Nothing to do with you’: Rabbitohs coach Wayne Bennett lashes out at questions over emotional Latrell Mitchell
2020/06/19 0:00:00,Coronavirus: Is it actually possible that mass protests haven’t caused a spike in coronavirus infections?
2020/06/19 0:00:00,What do the hackers want from Australia?
2020/06/19 0:00:00,"NRL 2020, round 6 | Penrith Panthers defeat Melbourne Storm in thriller"
2020/06/19 0:00:00,Coronavirus: Why the ‘second wave’ theory is flawed
2020/06/19 0:00:00,Cyber attack in Australia: China the chief suspect behind attack
2020/06/19 0:00:00,How to ask for a pay rise: Expert reveals three words you must avoid
2020/06/19 0:00:00,‘Slow drip of trauma’: Go behind The Night Watch
2020/06/19 0:00:00,Royal Ascot: Stradivarius thrashes rivals in Ascot Gold Cup; Cross Counter poised to return to Flemington
2020/06/19 0:00:00,AFL Friday night: Western Bulldogs 8.9 (57) defeat GWS Giants 4.9 (33)
2020/06/19 0:00:00,"NRL 2020, round 6 | Rabbitohs thrash Warriors after ugly incident mars clash"
2020/06/19 0:00:00,Doomben races: Tony Gollan first trainer to notch 100 metro wins in season in Queensland
2020/06/19 0:00:00,Bachelor in Paradise: Abbie Chatfield shares terrifying death threat
2020/06/19 0:00:00,Humanities graduates earn more than those who study science and maths
2020/06/19 0:00:00,X-rated book ‘Penguins’ by Nick Thornton mistaken for children’s story
2020/06/19 0:00:00,"NRL 2020, round 6 | South Sydney Rabbitohs thrash New Zealand Warriors 40-12"
2020/06/19 0:00:00,John Bolton labelled a ‘traitor’ amid backlash to his book about Donald Trump
2020/06/19 0:00:00,Music from the Home Front: Behind the scenes of lockdown’s biggest event
2020/06/19 0:00:00,Flemington races: Front Page grabs spotlight with big win in Creswick Stakes
2020/06/19 0:00:00,James Weir: Reality of Harry and Meghan’s unfortunate fate
2020/06/19 0:00:00,Sam Newman and Channel 9 part ways following recent backlash
2020/06/19 0:00:00,Jamie Foxx packed on the muscles for upcoming Mike Tyson movie
2020/06/19 0:00:00,Core problem with expensive Netflix show The Politician
2020/06/19 0:00:00,Stockbroker Angus Aitken and his wife Sarah list $10m Nick Tobias-designed Woollahra home
2020/06/19 0:00:00,MasterChef 2020: Reece Hignell responds to Reynold Poernomo’s past homophobic comments
2020/06/19 0:00:00,Canterbury Bulldogs deny reports of million dollar Craig Bellamy raid
2020/06/19 0:00:00,"Perth man Tyson John Vacher ‘masquerading as psychologist’, warns Consumer Protection"
2020/06/19 0:00:00,Hackers reportedly demanding $1 million ransom from beer producer Lion
2020/06/19 0:00:00,"Man’s racist rant at 7-Eleven, blaming Asians for coronavirus I Video"
2020/06/19 0:00:00,Cyber attack in Australia: Malicious code and ‘cyber bombs’ risk cyber security
2020/06/19 0:00:00,Radio station 2SM Sydney flooded with prank calls asking about male brothels
2020/06/19 0:00:00,LeBron James and Ben Simmons flout NBA’s strict shutdown rules
2020/06/19 0:00:00,Labor MP Julia Finn stands aside amid branch stacking scandal
2020/06/19 0:00:00,Coronavirus: COVID-19 death risk for people with low vitamin D levels
2020/06/19 0:00:00,New double-decker seat design on planes would let all passengers lie flat in economy
2020/06/19 0:00:00,Kristen Wiig and Avi Rothman welcome twins via surrogate
2020/06/19 0:00:00,Paige Spiranac opens up on the gruelling mental side of golf
2020/06/19 0:00:00,Demand for pet-friendly rental property is on the rise across Sydney
2020/06/19 0:00:00,Two whales freed from shark nets off the Gold Coast
2020/06/19 0:00:00,Qantas savaged over coronavirus refund policy
2020/06/19 0:00:00,Big W Toy Mania: Mum shares massive $5465 sale receipt
2020/06/19 0:00:00,Brandy Creek: Incredible rural resort property 1.5 hours from city
2020/06/19 0:00:00,Plans to double arts degrees blasted as ‘incredibly shortsighted’
2020/06/19 0:00:00,Spy agencies sounded warning on suspected Chinese cyber attacks
2020/06/19 0:00:00,Galwan Valley water turned China-India dispute fatal
2020/06/19 0:00:00,Two arrested after police officers shot in New Zealand
2020/06/19 0:00:00,What can we learn from this revealing moment at Melania and Donald Trump’s fairytale wedding
2020/06/19 0:00:00,The COVID-19 waste problem we must address
2020/06/19 0:00:00,Cyber attack Australia: What can I do to protect myself?
2020/06/19 0:00:00,Salisbury locals spot giant runaway pig in middle of Adelaide suburbia
2020/06/19 0:00:00,Twitter flags Donald Trump’s ‘racist baby’ tweet as manipulated media
2020/06/19 0:00:00,Surry Hills landlord holds tenant hostage over rent
2020/06/19 0:00:00,Constable Aaron Vidal killed in Sydney motorcycle crash was expecting baby
2020/06/19 0:00:00,How Chelsea signed Timo Werner at bargain price of $90 million
2020/06/19 0:00:00,The ultimate ‘tree change’ on Canberra city’s doorstep
2020/06/19 0:00:00,Mike Pompeo labels John Bolton ‘traitor’ over tell-all book
2020/06/19 0:00:00,The Last of Us Two review: Best game of the year so far
2020/06/19 0:00:00,Affordable homes boost: Social welfare enterprise Junction helps make housing dream a reality
2020/06/19 0:00:00,UK hairdressers told not to chat to customers under new coronavirus rules
2020/06/19 0:00:00,Canberra auctions: three hot properties going under the hammer
2020/06/19 0:00:00,"England rugby could ban Swing Low, Sweet Chariot because of slavery links"
2020/06/19 0:00:00,ALDI: Shopper claims she wasn’t allowed to pay for items in coins
2020/06/19 0:00:00,Michael Gudinski admits on radio: ‘I’m not the biggest Delta Goodrem fan’
2020/06/19 0:00:00,Australia’s lowest paid workers will get a wage increase by $13 weekly
2020/06/19 0:00:00,Lewis Hamilton’s quarantine body transformation: Nothing changed
2020/06/19 0:00:00,Joe Hildebrand: Real villains in ALP are the ‘lunatic left’
2020/06/19 0:00:00,Student journalist sacked for column calling institutional racism a ‘myth’
2020/06/19 0:00:00,Jeans for Genes Day: Mum Kate New reveals how son’s sleeping habits led to rare diagnosis
2020/06/19 0:00:00,Selma Blair spotted out and about in LA amid MS battle
2020/06/19 0:00:00,Rising number of coronavirus cases in Victoria signal second wave
2020/06/19 0:00:00,Kobe Bryant helicopter crash: NBA legend changed flight time to watch game
2020/06/19 0:00:00,Business owner’s scathing attack of QLD Premier over border closures
2020/06/19 0:00:00,Pabst Blue Ribbon 99-pack of beer coming to Australia
2020/06/19 0:00:00,Travel bubble: NSW and Victoria excluded from travelling to SA
2020/06/19 0:00:00,Jamila Rizvi blasted as ‘awful piece of work’ by MP in texts
2020/06/19 0:00:00,Woman who torched cars faces jail after she was exposed by her customised Etsy T-shirt
2020/06/19 0:00:00,How to protect yourself from the cyber attack on Australia
2020/06/19 0:00:00,Unemployment figure of 7.1% doesn’t show eveyone who’s lost their job
2020/06/19 0:00:00,The best essentials to boost your next yoga session
2020/06/19 0:00:00,Historic Lower Portland riverside block with private beach for sale
2020/06/19 0:00:00,AFL 2020: Wayne Carey slams Mark Ricciuto critics after Adelaide Crows furore
2020/06/19 0:00:00,"Australian Government and businesses hit by massive cyber attack from ‘sophisticated, state-based actor’"
2020/06/19 0:00:00,Cops involved in fatal Rayshard Brooks shooting hand themselves in
2020/06/19 0:00:00,Coronavirus US: Florida to be new epicentre of virus as cases soar
2020/06/19 0:00:00,Reality TV star June ‘Mama June’ Shannon’s shocking drug confession
2020/06/19 0:00:00,‘Surely this can’t be right?’: English captains blow up at call to ban iconic rugby song over slavery link
2020/06/19 0:00:00,Emily Skye: Influencer gives birth to baby boy in an unexpected way
2020/06/19 0:00:00,NRL 2020: Andrew Johns says drop million-dollar man Anthony Milford
2020/06/19 0:00:00,"Supercars 2020: Schedule revealed, 11-round calendar, two events dumped"
2020/06/19 0:00:00,Coronavirus UK: 13-day-old baby dies after contracting COVID-19
2020/06/19 0:00:00,Rebel Wilson reveals she was paid to ‘stay bigger’ by film bosses
2020/06/19 0:00:00,Most popular suburbs to buy a home: northwest Sydney tops preferences
2020/06/19 0:00:00,Sam Newman: Should Channel 9 sack AFL great?
2020/06/19 0:00:00,Richmond’s 59-year first in shock Hawthorn defeat
2020/06/19 0:00:00,JobSeeker payment finally set to increase
2020/06/19 0:00:00,Facebook removes Trump campaign ads for ‘violating our policy against organised hate’
2020/06/19 0:00:00,Tevita Pangai’s monster hit on David Klemmer as Knights beat Broncos
2020/06/19 0:00:00,"Morning Star Estate, Mt Eliza for sale for $40 million"
2020/06/19 0:00:00,Why you should take your property to auction now instead of waiting until spring
2020/06/19 0:00:00,Kate Middleton opens up about ‘really difficult time’ during lockdown
2020/06/19 0:00:00,Elon Musk denies threesome with Amber Heard and Cara Delevingne
2020/06/19 0:00:00,Cheap flights: Qantas and Jetstar launch massive sale in Australia
2020/06/19 0:00:00,China-India border clash: Photo reveals brutal weapons used
2020/06/19 0:00:00,2020 Skoda Karoq review: Sportline version adds spice to compact SUV segment
2020/06/19 0:00:00,Supreme Court rejects Donald Trump’s bid to end Obama’s ‘Dreamer’ immigrant program
2020/06/19 0:00:00,University fees set for biggest shake-up in a decade
2020/06/19 0:00:00,Coronavirus Australia live updates: Five new coronavirus cases linked to Melbourne's Stamford Plaza Hotel cluster
2020/06/19 0:00:00,Madeleine McCann case: Letter from German authorities sparks confusion
2020/06/19 0:00:00,2004: Darwin locals bare bums as Ghan becomes first passenger train from Adelaide to Darwin
2020/06/19 0:00:00,"Geelong Arts Centre, clifftop house nominated for architecture gongs"
2020/06/19 0:00:00,Rare chance to buy significant New Norfolk landmark property
