date,title
2020/09/22 0:00:00,Pregnant Bindi Irwin reveals she is expecting a baby girl with Chandler Powell
2020/09/22 0:00:00,How to score a great deal on pet insurance
2020/09/22 0:00:00,Time right for young buyers to get foot in the door
2020/09/22 0:00:00,Woman left with $25k dental bill after being struck by cyclist
2020/09/22 0:00:00,"Victoria records 15 new coronavirus cases, Premier hints at easing of restrictions"
2020/09/22 0:00:00,Woman suffers miscarriage after being flung from car driven by a friend
2020/09/22 0:00:00,Rothfire hot favourite for Golden Rose with Mo’Unga to be aimed at Caulfield Guineas
2020/09/22 0:00:00,Bryson DeChambeau puts Masters officials on notice after US Open demolition
2020/09/22 0:00:00,Adam Hyeronimus backflips and pleads guilty to bets
2020/09/22 0:00:00,Behemoth barges his way into The Everest field
2020/09/22 0:00:00,Carrie Bickmore spits out her food live on The Project
2020/09/22 0:00:00,"Woman cons $800,000 from Tinder dates for fake blueberry farm"
2020/09/22 0:00:00,Laura Byrne makes a shocking pregnancy confession about her nipples
2020/09/22 0:00:00,Six mates turn $6 into $202k with ludicrous 15-leg NFL multibet
2020/09/22 0:00:00,Canterbury races: Brad Widdup happy to put his trust in James McDonald with Switched and Night Flyer
2020/09/22 0:00:00,Accused rapist tells jurors he met alleged victim at pub before she invited him over
2020/09/22 0:00:00,Man arrested after woman struck with arrow in Ipswich supermarket
2020/09/22 0:00:00,Excitement over Aldi’s new $179 wood-fired pizza oven
2020/09/22 0:00:00,Hotel quarantine inquiry: Texts warn of ‘rogue’ guards ‘prowling corridors’
2020/09/22 0:00:00,AFL: Lions forward Eric Hipwood says Brisbane’s kicking accuracy needs further improvement
2020/09/22 0:00:00,Lead and other heavy metals found in alternative medicine
2020/09/22 0:00:00,Prince Harry shows off his dashing new haircut makeover in charity video
2020/09/22 0:00:00,Spy agency wants terror laws extended
2020/09/22 0:00:00,Top Vic health bureaucrat Michelle Giles reveals ‘heavy responsibility’ of signing off on curfew
2020/09/22 0:00:00,Redundancy advice: a career coach and psychologist share their tips
2020/09/22 0:00:00,NRL to experiment with rule changes in two games in round 20
2020/09/22 0:00:00,Mortgage approvals on the rise as more buyers report it’s ‘a good time to buy’
2020/09/22 0:00:00,"Man jailed for nine years for ‘protracted’, year-long abuse of 5-year-old girl"
2020/09/22 0:00:00,"Australian shares slump to three-month low, follow overseas markets into the red"
2020/09/22 0:00:00,‘Posted in error’: CDC updates and then deletes COVID-19 guidance
2020/09/22 0:00:00,NRL: Maroons back Dane Gagai says Gold Coast flyer AJ Brimson is ready for Origin
2020/09/22 0:00:00,Animal activist Arkadiusz Swiebodzinski put in ‘chokehold’ by police at Queensland pig farm
2020/09/22 0:00:00,Bachelorette Ali Oetjen breaks down in tears over split with Taite Radley
2020/09/22 0:00:00,Axed Channel 7 presenter Simon Reeve alleges network breached contract
2020/09/22 0:00:00,AFL: Brisbane star Harris Andrews set to make welcome return from hamstring injury in the club’s first final
2020/09/22 0:00:00,AFL All Australian 40-man squad revealed: Power and Cats lead the way
2020/09/22 0:00:00,Mr Quickie reverts to proven Group 1 formula in Underwood Stakes
2020/09/22 0:00:00,Bachelor 2020 finale theory is crazier than Honey Badger’s season
2020/09/22 0:00:00,Bella Nipotina to take on big names in Moir Stakes
2020/09/22 0:00:00,Westpac expects house prices to surge 15 per cent in late 2021
2020/09/22 0:00:00,Heidi Klum goes completely topless in a series of bikini photos
2020/09/22 0:00:00,Video: Doctor accused of supplying prescription drugs to bikie gangs after Brisbane raid
2020/09/22 0:00:00,Coronavirus Victoria: Channel 7 reporter slammed for Dan Andrews treatment
2020/09/22 0:00:00,Storm star Felise Kaufusi lets slip hint on Cameron Smith’s future
2020/09/22 0:00:00,Mazda reveals prices for new Toyota HiLux rival
2020/09/22 0:00:00,The Dark Crystal: Age of Resistance axed from Netflix after Emmy win
2020/09/22 0:00:00,"Powerhouse Museum: Sex toys, empty trains in Sydney COVID exhibition"
2020/09/22 0:00:00,Decline in mental health care in NSW hospitals during pandemic
2020/09/22 0:00:00,AFL backtracks over St Kilda snub in 2020 finals series fixture announcement
2020/09/22 0:00:00,Vanderpump Rules’ Jax and Brittany are expecting their first child together
2020/09/22 0:00:00,Souths lock Cameron Murray ready to take on schoolboy idol Sonny Bill Williams
2020/09/22 0:00:00,Melbourne young rich lister sues anonymous stock market Twitter account for defamation
2020/09/22 0:00:00,Why JobKeeper won’t be extended past March 2021
2020/09/22 0:00:00,Craig Williams to replace Michael Walker on Tagaloa in Caulfield Guineas
2020/09/22 0:00:00,"WA confirms three new virus cases, one hospitalised"
2020/09/22 0:00:00,Victorian MP Dr Anne Webster awarded more than $800k in conspiracy defamation payout
2020/09/22 0:00:00,Fashion des­igner Collette Dinnigan to sell Rosedale block of home destroyed by bushfire
2020/09/22 0:00:00,Cricket: Alyssa Healy to unveil new tricks when Australia’s women’s team start the home summer this weekend
2020/09/22 0:00:00,"Vatican, China prepare to renew historic deal to US anger"
2020/09/22 0:00:00,"New Zealand man faces court, admits plane bomb hoax was ‘stupid joke’"
2020/09/22 0:00:00,BizRebuild: Sir Peter Cosgrove helps bushfire victim get back on the road
2020/09/22 0:00:00,"Domenic Perre, charged over 1994 NCA bombing in Adelaide, jailed for ‘central’ role in drug trafficking operation"
2020/09/22 0:00:00,New book claims Prince Andrew is a ‘sex addict’ and ‘daring lover’
2020/09/22 0:00:00,"Sylvester Stallone’s mum, Jackie, dead at 98"
2020/09/22 0:00:00,NSW allocates extra $400 million to projects in regional areas
2020/09/22 0:00:00,World reacts to Michael Jordan’s baller move
2020/09/22 0:00:00,"Meghan Markle to hand over emails, WhatsApp messages in Daily Mail case"
2020/09/22 0:00:00,Towie star Lauren Goodger opts for a daring outfit to celebrate her birthday
2020/09/22 0:00:00,"NRL: Canberra coach Ricky Stuart fined $10,000 for his blow-up last weekend which included throwing a water bottle"
2020/09/22 0:00:00,University study: Homemade masks filter at least 50 per cent of virus particles
2020/09/22 0:00:00,Fierce Impact to skip Group 1 Underwood Stakes
2020/09/22 0:00:00,John Edwards trained for shooting ’accuracy’ before murdering his kids
2020/09/22 0:00:00,Jacinda Ardern in hot water after breaking social distancing for selfie
2020/09/22 0:00:00,Bella from The Bachelor used to date Cody Simpson
2020/09/22 0:00:00,"New, cheap flights to celebrate borders finally opening to NSW"
2020/09/22 0:00:00,2020 NRL fans’ poll: Have your say on rugby league’s biggest issues
2020/09/22 0:00:00,"QLD border reopens to some NSW towns, Western Sydney calls for boycott"
2020/09/22 0:00:00,Queensland throws open borders to parts of NSW
2020/09/22 0:00:00,UK woman falls from moving car filming a Snapchat video
2020/09/22 0:00:00,Coronavirus: Australia joins new vaccine agreement
2020/09/22 0:00:00,AFL: Carlton re-sign 10 players for 2021 including former captain Marc Murphy for one more year
2020/09/22 0:00:00,The Block 2020 listings: Asking prices revealed as houses hit market
2020/09/22 0:00:00,Son jailed after dispute over using too much water on the garden ended in father’s death
2020/09/22 0:00:00,Western Sydney Airport: Government paid for land at 10 times market value
2020/09/22 0:00:00,Reserve Bank says rate cuts on the table but move to negative rate unlikely
2020/09/22 0:00:00,Heavy rain across Queensland not enough to break drought
2020/09/22 0:00:00,NSW Police Commissioner defends arrest of NRL star Curtis Scott after charges dropped
2020/09/22 0:00:00,Peter Lavac: Colourful life of Sydney barrister with ‘offensive’ Lamborghini plate
2020/09/22 0:00:00,Oliver McGowan: Mum’s medication warning to Disability Royal Commission
2020/09/22 0:00:00,Premier says it is a ‘significant day’ after court rules Malka Leifer can be extradited to Australia
2020/09/22 0:00:00,Thomas Burgess pours cold water on brother Sam’s NRL comeback with South Sydney
2020/09/22 0:00:00,"Aussie man creates ‘ultimate’ meal, ‘Big Mac Kebab’, calls it the McKebab"
2020/09/22 0:00:00,Ricardo Barbaro murder trial: Doctor to be questioned about appointment
2020/09/22 0:00:00,Favourite Pixar characters come to life in minigolf course
2020/09/22 0:00:00,Louis Vuitton building: Melbourne Collins Street landmark for sale with $50m price expectations
2020/09/22 0:00:00,Brisbane residents hit with illegal dumping fines after donating to St Vincent de Paul
2020/09/22 0:00:00,"Big step for regional airline’s plan to take on Qantas, Virgin"
2020/09/22 0:00:00,AFL trade rumours: ‘Festering’ Essendon crisis may spark player exodus
2020/09/22 0:00:00,Man snapped allegedly sniffing substance off phone while driving
2020/09/22 0:00:00,"Cleveland Winery, Lancefield for sale as regional Victoria reopens"
2020/09/22 0:00:00,Sydney’s most famous voice: The woman behind Sydney Trains announcements
2020/09/22 0:00:00,Drew Barrymore and Paris Hilton discuss being placed in solitary confinement as teens
2020/09/22 0:00:00,Woman forced to leave gym for wearing sports bra that flashed waist
2020/09/22 0:00:00,Michael Rawson: Attempted child snatch captured on CCTV
2020/09/22 0:00:00,NSW plans taxi crackdown after driver worked while COVID-positive
2020/09/22 0:00:00,Woman estimates hundreds of siblings from doctor sperm donor dad after DNA testing
2020/09/22 0:00:00,Police hope dress ring can solve the identity of mystery woman left at Qld hospital two weeks ago
2020/09/22 0:00:00,Qld border: ACT reopening overshadowed by ‘penis bird’ photo
2020/09/22 0:00:00,Instagram model jailed for bizarre masked robberies
2020/09/22 0:00:00,"Xbox Series X and S pre-orders exhausted, consoles show up on eBay"
2020/09/22 0:00:00,Police release image after man demands woman get in his car in Horsham
2020/09/22 0:00:00,Todd Sampson reveals shocking family secret on Anh’s Brush with Fame
2020/09/22 0:00:00,Chelsea coach Emma Hayes in battle with Italian great Carolina Morace for Matildas job
2020/09/22 0:00:00,Reaction to Woolworths ending Disney Ooshies promo early divides internet
2020/09/22 0:00:00,2035 emissions reduction target ‘a couple of years’ off
2020/09/22 0:00:00,Malcolm Turnbull’s swipe at Coalition as it releases its new energy plan
2020/09/22 0:00:00,"Disney Ooshies end early, Woolworths responds to public outcry"
2020/09/22 0:00:00,Eddie Cahill on what it was like playing Jen Aniston’s toyboy Tag on Friends
2020/09/22 0:00:00,US expat reveals Macca’s item we don’t get in Australia
2020/09/22 0:00:00,Woolworths Ooshies: Australian shoppers unleash fury after promo ends early
2020/09/22 0:00:00,Man arrested after bizarre horse protest on major Chicago expressway
2020/09/22 0:00:00,Experts warn of sharp fall in house prices
2020/09/22 0:00:00,Jaimi Kenny: Lisa Curry’s heartbreaking post as she grieves daughter’s death
2020/09/22 0:00:00,Man dies in floodwaters after Broken Hill cops month of rain in 15 minutes
2020/09/22 0:00:00,Former NSW Nationals leader Troy Grant leaves party
2020/09/22 0:00:00,SA’s borders will open to NSW residents from midnight Wednesday
2020/09/22 0:00:00,"Coronavirus NSW: New rules for beaches, parks this summer"
2020/09/22 0:00:00,Sharemarket slips as global COVID-19 fears and political unrest rises
2020/09/22 0:00:00,"UberEats, Deliveroo, Menulog: Survey finds drivers earning $10 an hour, only half have access to PPE"
2020/09/22 0:00:00,Craig Bellamy takes defiant stand amid Cameron Smith mystery
2020/09/22 0:00:00,Push to strip China of right to host Beijing Winter Olympics
2020/09/22 0:00:00,Huge huntsman eats gecko in viral TikTok video
2020/09/22 0:00:00,No community transmission in NSW as borders look to reopen
2020/09/22 0:00:00,Broken Hill rain: Man dies after car swept off road by floodwaters
2020/09/22 0:00:00,Diplo posts naked photo on Instagram to lure US voters
2020/09/22 0:00:00,Dan Andrews grilled over comment about ADF support
2020/09/22 0:00:00,Aussie all-rounder Mitch Marsh sent for scans on ankle injury suffered in the IPL
2020/09/22 0:00:00,Phillip Stokes excited about Guineas contenders Savannah Cloud and Instant Celebrity
2020/09/22 0:00:00,"Ellen DeGeneres apology ‘lacked remorse’ and was ‘incredibly rehearsed’, PR expert says"
2020/09/22 0:00:00,Hilary Duff’s husband Matthew Koma gets intimate tattoo of her
2020/09/22 0:00:00,Tony Higgins: Boatie missing again for second time in two weeks after ‘taking on water’ in SA
2020/09/22 0:00:00,Truth behind tiny black dots on kitchen tiles
2020/09/22 0:00:00,Oz Lotto results: $2m jackpot numbers revealed
2020/09/22 0:00:00,It’s nicknamed the ‘Death Star’ and cost a whopping $2.6 billion — inside ‘badass’ new NFL stadium
2020/09/22 0:00:00,Emissions reduction plan won’t help jobless: Labor
2020/09/22 0:00:00,Kobe Bryant’s wife Vanessa accused of kicking mum out in explosive interview
2020/09/22 0:00:00,Roger Federer truth is hard to swallow for Novak Djokovic
2020/09/22 0:00:00,Kmart cubby house hack leaves thousands shocked
2020/09/22 0:00:00,Super Netball: Firebirds coach Roselee Jencke says Mi Mi’s Indigenous round snub was tactical
2020/09/22 0:00:00,Photo of sole gardener mowing lawn outside Labor MP’s office in Nepean sparks heated debate
2020/09/22 0:00:00,"Gold Coast bub couldn’t wait 10 minutes to the hospital, so dad delivered him on a busy highway"
2020/09/22 0:00:00,How much room to give cyclists quiz devolves into debate over registration
2020/09/22 0:00:00,Botswana solves mystery of mass elephant deaths
2020/09/22 0:00:00,Melbourne homes told to shut windows due to toxic smoke from Bulla tip fire
2020/09/22 0:00:00,MAFS star Jessika Power’s naked photo divides followers
2020/09/22 0:00:00,Donald Trump suggests Ruth Bader Ginsburg’s dying wish was faked
2020/09/22 0:00:00,Cricket: Steve Smith is available to play IPL opener after head knocks in England
2020/09/22 0:00:00,Stunning revelations from England star about Rugby World Cup
2020/09/22 0:00:00,Two-thirds of Queenslanders back Annastacia Palaszczuk as state election looms
2020/09/22 0:00:00,Jennifer Lopez stuns in tiny bikini at age 51
2020/09/22 0:00:00,Sport doesn’t get any pettier than the Italian Open prize money
2020/09/22 0:00:00,Rugby league team kicked out of competition after horrifying sideline fight
2020/09/22 0:00:00,"Victoria records 28 new coronavirus cases, three more deaths"
2020/09/22 0:00:00,Coles Queensland: Stores to use renewable energy from 2022
2020/09/22 0:00:00,Traffic chaos on Princes Freeway as emergency services rush to scene of serious crash
2020/09/22 0:00:00,Future Wallabies coach battle could come down to Super Rugby  AU rivals Brad Thorn and Dan McKellar
2020/09/22 0:00:00,Jeffrey Epstein’s flight logs sought by US Virgin Islands prosecutor
2020/09/22 0:00:00,Two-thirds of Victorian voters back Daniel Andrews despite controversial management of COVID-19 crisis
2020/09/22 0:00:00,Coronavirus Victoria: Two words crushing lockdown hopes
2020/09/22 0:00:00,Sydney traffic: ‘Heavy’ delays after car rollover in Redfern
2020/09/22 0:00:00,Orlando Bloom spotted with pepper spray after stalker threatens to snap his neck
2020/09/22 0:00:00,What we learned from Skyhooks founder’s ‘stupid’ death after falling off a ladder
2020/09/22 0:00:00,Bitter Renault boss opens up on Daniel Ricciardo frustration
2020/09/22 0:00:00,"Australia weather: 2000km cold front brings rain, storms to east coast"
2020/09/22 0:00:00,Missing boy James O’Reilly’s mum injured in WA car accident
2020/09/22 0:00:00,The Project’s UK correspondent Lucy McDonald blasts Britain’s virus response
2020/09/22 0:00:00,Health authorities desperately chasing nine taxi passengers at risk of COVID
2020/09/22 0:00:00,NSW Premier Gladys Berejiklian hints at reopening border to regional Victorians
2020/09/22 0:00:00,More than 3000 millionaires claiming JobSeeker as new rules due to come into effect
2020/09/22 0:00:00,"Succession, Watchmen and Schitt’s Creek dominate Emmys"
2020/09/22 0:00:00,Friends of Qld drowning victim take to social media to remember the ‘beautiful soul’
2020/09/22 0:00:00,"Coronavirus: UK warned of 50,000 cases per day by mid October if trend continues"
2020/09/22 0:00:00,"Paige Spiranac, Rory McIlroy react to Bryson DeChambeau’s US Open win"
2020/09/22 0:00:00,Who is Bryson DeChambeau’s girlfriend Sophia Phalen Bertolami?
2020/09/22 0:00:00,Man accused of sexually touching a woman he had just met while out at a restaurant
2020/09/22 0:00:00,"Australia’s new National Preventive Health Strategy must include climate change, 30 health groups say"
2020/09/22 0:00:00,"Ellen DeGeneres returns to TV, addresses misconduct allegations in opening monologue"
2020/09/22 0:00:00,"NSW weather: Storms bring hail, rain and damaging winds"
2020/09/22 0:00:00,Ellen DeGeneres Show returns: Viewers and critics alike unimpressed by Ellen’s TV apology
2020/09/22 0:00:00,Quirky Kangaroo Island home made up of pod-style rooms on the market
2020/09/22 0:00:00,Steph Claire Smith bikini photo sparks bizarre backlash over mask wearing outside
2020/09/22 0:00:00,Megan Gale breaks silence on brother Jason Gale’s death
2020/09/22 0:00:00,Statesman Homes’ Glengowrie Alfresco offers the best of both worlds
2020/09/22 0:00:00,QandA: Panel members gasp at praise for US President Donald Trump’s handling of coronavirus pandemic
2020/09/22 0:00:00,Penn Badgley welcomes first child after wife suffers two miscarriages
2020/09/22 0:00:00,Buyers purchase classic South Geelong home sight unseen
2020/09/22 0:00:00,Private Mornington Peninsula beach sells with dream home
2020/09/22 0:00:00,Renovated Balmain semi comes with complete ownership records dating back to 1800
2020/09/22 0:00:00,Palm Beach home of Lisa Keighery sells in record breaking deal
