date,title
2020/11/20 0:00:00,The Great Reset: Wild new coronavirus conspiracy theory takes hold
2020/11/20 0:00:00,‘It’s not too late’: Renault’s futile plea for Daniel Ricciardo
2020/11/20 0:00:00,Dr Samantha Crompvoets tells inside story of Afghanistan war crimes report
2020/11/20 0:00:00,Ian Healy calls for all matches of summer of cricket to be played in Sydney
2020/11/20 0:00:00,‘Time to say goodbye’: Controversial celebrity chef turned conspiracy theorist Pete Evans quits Facebook
2020/11/20 0:00:00,Coronavirus Australia live: COVID-19 restrictions eased in Victoria
2020/11/20 0:00:00,NFL WAG Kelly Stafford lashes out over Detroit COVID restrictions
2020/11/20 0:00:00,Mum talks of how dead teen son called the colour yellow “Greg” because of The Wiggles
2020/11/20 0:00:00,Australian sharemarket ends strong week on a bum note with late sell-off
2020/11/20 0:00:00,Kate Langbroek is stuck in Italy with no flights returning home
2020/11/20 0:00:00,Donald Trump’s daughter-in-law Lara reportedly considering Senate run in 2022
2020/11/20 0:00:00,How to make Christmas stress-free while supporting the economy
2020/11/20 0:00:00,SAS instructor Mark ‘Billy’ Billingham has slammed Roxy Jacenko for performance
2020/11/20 0:00:00,AFC Champions League: Teenage keepers in selection battle as Sydney FC’s goalkeeper stocks wear thin
2020/11/20 0:00:00,Mum horrified after trolls slam her daughter’s ‘manky’ lunch on Facebook
2020/11/20 0:00:00,"‘Enjoy the Titans, baldy’: Matty Johns burns son Cooper with hilarious Cameron Smith prank"
2020/11/20 0:00:00,Looking to inspect a home – try Sunday
2020/11/20 0:00:00,Cameron Munster’s hilarious insight into wild Maroons celebrations
2020/11/20 0:00:00,"PM’s industrial relations reform plan ‘chilling’, Labor says"
2020/11/20 0:00:00,"Severe storms with heavy rain, hail and winds forecast for NSW regions"
2020/11/20 0:00:00,Police sniffer dog outsmarts alleged drug smuggler
2020/11/20 0:00:00,Jeff Lloyd having an immediate impact as Robbie Fradd’s new manager
2020/11/20 0:00:00,Super Netball: Chris Symington quits as CEO a week after Netball Australia boss defects to cycling
2020/11/20 0:00:00,Crown chief had to be ‘led by nose’ to ‘irresistible’ money laundering realisation: inquiry
2020/11/20 0:00:00,NSW police release sketch of man found dead in Sydney
2020/11/20 0:00:00,Ohio wedding infects 32 with coronavirus
2020/11/20 0:00:00,Ben Roberts-Smith flogs medal for legal fight
2020/11/20 0:00:00,North Melbourne announce new coach to replace Rhyce Shaw
2020/11/20 0:00:00,John Howard says accused SAS troops are ‘innocent until proven guilty’ after war crimes report
2020/11/20 0:00:00,Crowd sizes increased in boost for arts sector
2020/11/20 0:00:00,WA Premier Mark McGowan mocked after T-shirt to raise cash for election funds pokes fun at lockdown
2020/11/20 0:00:00,Fans try to figure out what Carrie Bickmore got tattooed on her
2020/11/20 0:00:00,Paul Walton jailed for bestiality with neighbour’s Kelpie
2020/11/20 0:00:00,Glenn Maxwell says he learned to cope with COVID world during last summer’s break
2020/11/20 0:00:00,Claims of dead people voting in the US election debunked
2020/11/20 0:00:00,How young Australian teacher went blind on holidays in Europe
2020/11/20 0:00:00,"Girl, 13, preyed on by man for sex, forced to have abortion: court"
2020/11/20 0:00:00,Five people treated after Hunter Valley lightning strike
2020/11/20 0:00:00,Four buyers battle it out to pick up a Mosman fixer-upper top spot
2020/11/20 0:00:00,NSW government issued debt recovery orders against returning travellers
2020/11/20 0:00:00,"Sneaky, and entirely legal, way Donald Trump could stay in power"
2020/11/20 0:00:00,Stafanie Taylor: West Indies and Adelaide Strikers star explains why taking a knee has been so important for her
2020/11/20 0:00:00,"Sony PS5, Xbox audio features gives gamers an edge in Call of Duty"
2020/11/20 0:00:00,"Flight routes that COVID killed off, why Australia isn’t immune"
2020/11/20 0:00:00,Al Horford’s family take aim at ‘miserable’ Philadelphia 76ers fans
2020/11/20 0:00:00,Trainer Gai Waterhouse is confident Dawn Passage can sound The Gong
2020/11/20 0:00:00,Palm Springs movie review: Winning and captivating rom-com that still manages to surprise
2020/11/20 0:00:00,NSW woman walks free from court after pleading guilty to sending child abuse material
2020/11/20 0:00:00,The Blues’ post-mortem has begun — there are three key problems Fittler must solve
2020/11/20 0:00:00,"Major building empire Grocon collapses, blames Crown Barangaroo development"
2020/11/20 0:00:00,How Australia broke Prince Charles and Princess Diana
2020/11/20 0:00:00,The reaction to war crimes exposes Australia’s shame
2020/11/20 0:00:00,Kerrin McEvoy eyes second  Ballarat Cup and first ride for sister-in-law Michelle Payne
2020/11/20 0:00:00,The Block finale 2020: Jimmy and Tam's record-breaking win
2020/11/20 0:00:00,‘He took one for the team’: The Origin sacrifice that unleashed Maroons sensation and killed off NSW
2020/11/20 0:00:00,Sydney students tackle COVID-19 economic disruption with handy new tool
2020/11/20 0:00:00,James Weir: One lucrative gig we should let Pete Evans keep
2020/11/20 0:00:00,COVID-19 crisis: Coronavirus now killing one person every eight seconds
2020/11/20 0:00:00,"Castlecrag home of late artist Charmian Ogilvie sells, all profits donated to charity"
2020/11/20 0:00:00,Dead in ’seconds’: Court shown graphic crime scene photos
2020/11/20 0:00:00,TikTok video of US woman excited by Australian Kmart goes viral
2020/11/20 0:00:00,Tammin Sursok reveals miscarriage heartbreak and fertility struggles
2020/11/20 0:00:00,Jockey Ben Thompson to continue successful Queensland transition
2020/11/20 0:00:00,Test batsman Travis Head is preparing for the Test series in Coffs Harbour after being forced out of Adelaide
2020/11/20 0:00:00,Hidden message to Harry in new Queen portrait
2020/11/20 0:00:00,Nadia Bokody: The steep price women pay for men
2020/11/20 0:00:00,NBA GM Daryl Morey solves Philly’s $363 million headache
2020/11/20 0:00:00,The Block finale 2020: Auction clearance rates should have contestants nervous
2020/11/20 0:00:00,"Paul Higgins, Michael Wittner selling homes in Brighton and Caulfield North"
2020/11/20 0:00:00,Pro-Trump rally in Sydney draws small but dedicated crowd
2020/11/20 0:00:00,Mum charged with baby’s murder after scalding daughter with hot water
2020/11/20 0:00:00,Australia’s Favourite: What is our best beach?
2020/11/20 0:00:00,The Herald Sun’s digital editors answer your questions about our redesigned website
2020/11/20 0:00:00,NBA draftee and NBL Next Star Justinian Jessup expected to stay with the Hawks for now
2020/11/20 0:00:00,Trump campaign drops lawsuit in challenging Michigan results
2020/11/20 0:00:00,Coronavirus: South Australia’s ‘dangerous’ new virus strain claim falls apart
2020/11/20 0:00:00,COVID business interruption test case panics insurer IAG
2020/11/20 0:00:00,Cops use secret weapon to spy on Gold Coast schoolies
2020/11/20 0:00:00,Children’s cancer charity Redkite call for donations after COVID impact
2020/11/20 0:00:00,Navy submarines to receive enhanced tracking capabilities
2020/11/20 0:00:00,"Zlatko Sikorsky, Larissa Beilby’s alleged killer, dies after jail bashing"
2020/11/20 0:00:00,Derelict to divine: Yass church conversion a stairway to heaven
2020/11/20 0:00:00,"Kyle Daniels: Girl ‘scared’ to tell parents about alleged touching, court hears"
2020/11/20 0:00:00,Paulina Gretzky stuns in bikini in beach celebrations with Dustin Johnson
2020/11/20 0:00:00,Chocolate lovers lose it over new Cadbury items
2020/11/20 0:00:00,"Twitter Fleets slammed for being just like Snapchat, Instagram stories"
2020/11/20 0:00:00,New data finds single-parent households struggle more than any other in Australia
2020/11/20 0:00:00,Heartwarming detail in Queen and Prince Philip wedding anniversary portraits
2020/11/20 0:00:00,China’s ‘major’ Australian miscalculation
2020/11/20 0:00:00,US Election: Fresh legal blow for Donald Trump as Georgia recount delivers win for Joe Biden
2020/11/20 0:00:00,"Pizza worker’s ‘customer’ lie caused 6-day lockdown, but he won’t be charged"
2020/11/20 0:00:00,Queensland legend Kevin Walters scares fan during ‘circus’ Suncorp Stadium live cross
2020/11/20 0:00:00,Restrictions in SA ease after close contact of COVID-19 case lied about whereabouts
2020/11/20 0:00:00,"Man allegedly bites, punches police trying to break up fight at St Kilda beach"
2020/11/20 0:00:00,Sonia Kruger once reported a creepy doctor who asked her to strip
2020/11/20 0:00:00,"Brendan Julian, Mark Waugh, Adam Gilchrist, Mel Jones among stars at Fox Sports cricket season launch"
2020/11/20 0:00:00,Teen YouTuber crashes billionaire dad’s Pagani hypercar
2020/11/20 0:00:00,Why do we keep going back to our exes like Bachelorette Becky Miles and runner-up Adrian Baena?
2020/11/20 0:00:00,WAG Rebekah Vardy says she was blackmailed with fake sex tape claims
2020/11/20 0:00:00,‘You’re lying!’: Rudy Giuliani explodes at journalist during Trump campaign press conference
2020/11/20 0:00:00,Super changes: How the average Australian could be $1630 worse off
2020/11/20 0:00:00,Ex-Bachelor contestant Georgia Tripos sold drugs on Craigslist
2020/11/20 0:00:00,Training partnership hold all the aces for Breeders Crown harness card
2020/11/20 0:00:00,Rolls-Royce Ghost review: Proper luxury is properly expensive
2020/11/20 0:00:00,iPhone 12 mini review: World’s smallest 5G phone needs bigger battery
2020/11/20 0:00:00,Railway Stakes: Willie Pike needs everything to go right for another Group 1 win
2020/11/20 0:00:00,Indonesia records highest COVID case day as crowds flock to Bali beaches
2020/11/20 0:00:00,Qld man stuck in Adelaide medi-hotel faces third stint of hotel quarantine
2020/11/20 0:00:00,"Truth about Dominion, Scytl conspiracy theory"
2020/11/20 0:00:00,Jack de Belin trial: Co-accused Callan Sinclair admits ‘bad smell’ comment was a mistake
2020/11/20 0:00:00,Tiger Woods will play a tournament with his son who is considered a golfing prodigy
2020/11/20 0:00:00,Richard Branson loses half his stake in Virgin Australia
2020/11/20 0:00:00,Owl almost killed when its home chosen to be the New York Rockefeller Christmas tree
2020/11/20 0:00:00,Woman sparks huge online debate after sending tradie a text at 12am
2020/11/20 0:00:00,Dietitian reveals the healthiest chocolate bars on Aussie supermarket shelves
2020/11/20 0:00:00,Dustin Martin and Cameron Munster were the scallywags we  needed in 2020
2020/11/20 0:00:00,Eddie McGuire reacts to rumour Marty Sheargold will replace him on Triple M in 2021
2020/11/20 0:00:00,New twist in Tigers star’s ‘dicey’ cash grab; Dragons reach standoff with young gun: Transfer Whispers
2020/11/20 0:00:00,Coronavirus SA: Who can leave home during lockdown
2020/11/20 0:00:00,"One new COVID case announced on Sunday, but it's not linked to the Parafield cluster"
2020/11/20 0:00:00,Mystery creature washes up on Greek island Crete after storm
2020/11/20 0:00:00,Batemans Bay on alert as NSW records 13th day of no new local infections
2020/11/20 0:00:00,Trump lawyer Jenna Ellis unloads on media in fiery news conference: ‘Your opinion doesn’t matter’
2020/11/20 0:00:00,NSW-Victorian border reopens for racing participants but SA forced to quarantine
2020/11/20 0:00:00,The Crown season 4: The royal cousins who were registered ‘dead’ and institutionalised for years
2020/11/20 0:00:00,"UK girl, 14, pregnant following Romanian sex traffickers’ gang rape"
2020/11/20 0:00:00,‘Sub-human’: Right-wing terrorist sentenced to at least nine years jail
2020/11/20 0:00:00,Four-carry schooner glass has revolutionised beer drinking
2020/11/20 0:00:00,National Geographic names best places to travel to in 2021
2020/11/20 0:00:00,Queensland Premier Annastacia Palaszczuk backs change to Australia's national anthem
2020/11/20 0:00:00,Melissa Caddick: Sydney business woman’s mysterious disappearance after AFP raids
2020/11/20 0:00:00,More than 30 per cent of Australians ‘hesitant’ about COVID-19 vaccine
2020/11/20 0:00:00,Up to 3000 Australian troops could lose awards after war crimes report
2020/11/20 0:00:00,"Wife discovered her husband and mum were having an affair, while living under the same roof"
2020/11/20 0:00:00,"Gross TikTok video shows how filthy your iPhone, AirPods can get"
2020/11/20 0:00:00,"Best reader photos of the week: 20 November 2020, #newscomauphotos"
2020/11/20 0:00:00,Alaskan city plunges into two months of darkness in ‘polar night’ as sun sets for final time in 2020
2020/11/20 0:00:00,Nanny job roasted on Reddit for ‘slave’ demands
2020/11/20 0:00:00,Marvel Stadium’s $225 million redevelopment to lure sporting fans all year
2020/11/20 0:00:00,Travellers share top tips for what not to do in another country
2020/11/20 0:00:00,New Zealand singer Lorde reveals why she disappeared
2020/11/20 0:00:00,"What really happens at Sydney sex clubs, swingers nights"
2020/11/20 0:00:00,"Without a ball bowled in the Test series against India, the Aussies are already in front"
2020/11/20 0:00:00,"Rug pulled from underneath Benji Marshall, Wests Tigers ‘major gamble’ on star"
2020/11/20 0:00:00,"Fourdrinier House, YarraBend, to feature super stylish apartments"
2020/11/20 0:00:00,Wuhan launches glossy advert to attract tourists back to the city
2020/11/20 0:00:00,Family blasts Qld’s funeral limit while allowing packed crowds at State of Origin
2020/11/20 0:00:00,Coronavirus NSW: How Sydney’s New Year’s Eve permit system will work
2020/11/20 0:00:00,Will Smith buries feud with his Fresh Prince co-star Janet Hubert
2020/11/20 0:00:00,Amelia Hamlin reveals why she got a breast reduction at 16
2020/11/20 0:00:00,"Super increase plan ‘would hit wages’, faces the axe"
2020/11/20 0:00:00,US election: Trump lawyers’ wild press conference
2020/11/20 0:00:00,AFL proposes radical scheduling changes for 2021 premiership
2020/11/20 0:00:00,"Victoria records 21st day with no new coronavirus cases, no new deaths"
2020/11/20 0:00:00,"Family of Bradley Ward, killed in neighbour dispute over birds, remember him as ‘unique’"
2020/11/20 0:00:00,Rebel Wilson slams decision to cancel ‘Hedwig and the Angry Inch’ with Hugh Sheridan
2020/11/20 0:00:00,Belgian mayor apologises over X-rated Christmas lights
2020/11/20 0:00:00,Staffordshire bull terrier puppy Junior stolen from Melbourne home
2020/11/20 0:00:00,Afghanistan labels Australian war crimes report ‘unforgivable’ as world reacts to allegations
2020/11/20 0:00:00,Lynn Kellogg’s death prompts new coronavirus warning
2020/11/20 0:00:00,Oxford-AstraZeneca vaccine shows promising signs in the elderly
2020/11/20 0:00:00,Payne Haas and Leilani Mohenoa fell pregnant in midst of family tragedy
2020/11/20 0:00:00,‘Madness’ driving Lionel Messi into arms of Manchester City
2020/11/20 0:00:00,Michael J. Fox quits acting over declining health
2020/11/20 0:00:00,Homicide squad charge 81-year-old woman over Greensborough murder
2020/11/20 0:00:00,Former AFLW star Moana Hope reveals incredible details of model wife’s natural birth
2020/11/20 0:00:00,Shocking allegations buried in war crimes report laid bare
2020/11/20 0:00:00,"US election results: Wayne County, Michigan certification drama after Trump phone call"
2020/11/20 0:00:00,Reese Witherspoon has offloaded her $9.2 million Malibu ranch
2020/11/20 0:00:00,Peter Tighe reveals Winx is recovering slowly after pregnancy tragedy
2020/11/20 0:00:00,Buy Australian: International demand drives sales for NSW-based Buckaroo Leatherworks
2020/11/20 0:00:00,This week: Why pet parrots preend owners’ hair
2020/11/20 0:00:00,"Posh Plonk, Bethanga, winery for sale with dream lakeside home"
2020/11/20 0:00:00,Buyers plan renovation after $4.5M-plus sale sets record on Geelong’s Western Beach
2020/11/20 0:00:00,"After crunching the numbers, Tassie well positioned post-COVID"
2020/11/20 0:00:00,Dilapidated Newtown cottage with outdoor toilet on the market with DA plans for designer residence
2020/11/20 0:00:00,How to take the stress and arguments out of home buying
