date,title
2020/05/17 0:00:00,Disability carer sacked over ‘serious misconduct’ after woman’s ‘disgusting and degrading’ death
2020/05/17 0:00:00,MasterChef Australia favourite Hayden Quinn eliminated
2020/05/17 0:00:00,Dubai royal family member’s terrifying video trying to escape the country
2020/05/17 0:00:00,Coronavirus Australia live updates: Crowded SA trains spark outrage
2020/05/17 0:00:00,The Project host Lisa Wilkinson’s tough question for NSW Premier Gladys Berejiklian
2020/05/17 0:00:00,Cody Walker is reportedly talking to police over blackmail claims of a fight in 2019
2020/05/17 0:00:00,NSW TAB agencies set to re-open
2020/05/17 0:00:00,Eagle Farm races: Rothfire stamps his authority in Champagne Classic
2020/05/17 0:00:00,Former Cleveland Cavaliers champion Channing Frye slammed over Michael Jordan hot take
2020/05/17 0:00:00,Climber rescued from rock cliff in Blue Mountains
2020/05/17 0:00:00,Funding needed to quench community groups’ growing need for support
2020/05/17 0:00:00,World Health Organisation says staging Olympics in 2021 ‘will not be easy’
2020/05/17 0:00:00,Monday racebook: Michael Rodd out of isolation and back on track
2020/05/17 0:00:00,Quade Cooper reveals he’s on the carnivore diet
2020/05/17 0:00:00,Charles Leclerc reveals girlfriend had to join Twitch to get him to open front door after he left her stranded
2020/05/17 0:00:00,"Daily blog, May 17: Coronavirus restrictions set to ease"
2020/05/17 0:00:00,MMA fighter Walt Harris makes UFC return after stepdaughter’s death
2020/05/17 0:00:00,"Coronavirus: Sewage testing for virus genome could save us, Spanish researchers find"
2020/05/17 0:00:00,Nicole Kidman injury revealed after moon boot photo
2020/05/17 0:00:00,Man faces court after assaulting a woman with a wine bottle in Woolworths
2020/05/17 0:00:00,Diners discover upside to eating in half-empty restaurants
2020/05/17 0:00:00,Brad Fittler slams NRL referees’ union for strike threat
2020/05/17 0:00:00,Melbourne murder accused Ricardo Barbaro tells court he is in drug withdrawal
2020/05/17 0:00:00,China hasn’t returned Australia’s phone calls as fears of trade wars rise
2020/05/17 0:00:00,NSW Health Minister Brad Hazzard’s warning: ‘We’re all sitting ducks’ in virus fight
2020/05/17 0:00:00,Mum-of-five spends turns dilapidated caravan into mobile coffee business using Bunnings items
2020/05/17 0:00:00,Coronavirus: Florida family virtually adopts two-year-old girl over a Zoom call
2020/05/17 0:00:00,NSW tells Queensland to reopen border
2020/05/17 0:00:00,"Boy, 9, dies in France from Kawasaki-like disease believed to be linked to COVID-19"
2020/05/17 0:00:00,Geelong Cats player Jack Steven in hospital after Saturday night incident
2020/05/17 0:00:00,Self-proclaimed ‘Sperminator’ brings five more children into the world since coronavirus started
2020/05/17 0:00:00,"NSW light plane crashes near Newcastle, kills one person"
2020/05/17 0:00:00,"Sebastian Vettel still ‘passionate’ about F1, says Ferrari’s boss"
2020/05/17 0:00:00,Coronavirus: American priest blesses people with holy water using a water gun
2020/05/17 0:00:00,Prince Andrew faces fresh accusation linking him to another sex slave
2020/05/17 0:00:00,Women charged over $27k COVID-19 JobSeeker fraud
2020/05/17 0:00:00,Bad Education movie review: Greed and hubris in compelling true-life story
2020/05/17 0:00:00,Coronavirus US: Evangelical preachers and their congregations dying from COVID-19 in droves
2020/05/17 0:00:00,Eaglemont house with Mediterranean ‘amphitheatre’ hits the market
2020/05/17 0:00:00,Coronavirus crisis: Independent broadcaster RTRFM 92.1 presenters reveal the challenge of radio during COVID-19 lockdown
2020/05/17 0:00:00,Rugby league icon Arthur Summons dies aged 84
2020/05/17 0:00:00,Behind Daniel Ricciardo’s tumultuous season at Renault
2020/05/17 0:00:00,Luxury Coromandel Valley log cabin attracting househunters in droves
2020/05/17 0:00:00,"Mum, 29, survived by twin toddlers in crash identified"
2020/05/17 0:00:00,"Coronavirus Australia: Victoria to reopen its pubs, clubs, cafes, restaurants in weeks"
2020/05/17 0:00:00,How to beat the cash crunch in bank deposits and share dividends
2020/05/17 0:00:00,Cable Beach man Conlin James Lee charged over female relative’s murder in Broome
2020/05/17 0:00:00,Coronavirus: Western Australia sends everyone back to work
2020/05/17 0:00:00,Former president Barack Obama criticises Donald Trump in commencement speech
2020/05/17 0:00:00,The United States may restore some of its funding to the World Health Organisation
2020/05/17 0:00:00,Coronavirus: Queensland Premier slams infected aged care nurse’s return to work
2020/05/17 0:00:00,Acclaimed director Lynn Shelton dies suddenly at 54
2020/05/17 0:00:00,Nick Kyrgios didn’t hold back when talking about tennis’ biggest names
2020/05/17 0:00:00,Crumbling homes get ‘honeymoon’ prices as COVID-19 drives down listings
2020/05/17 0:00:00,UFC Fight Night Jacksonville: Updates and results from every fight
2020/05/17 0:00:00,Wandin East: Award-winning Five Oaks winery a top drop
2020/05/17 0:00:00,Fans go wild as Eugenie Bouchard auctions off a dinner date
2020/05/17 0:00:00,The Flash star Logan Williams’ cause of death revealed
2020/05/17 0:00:00,"Bundesliga returns: Empty stadiums and social distancing, fans reaction"
2020/05/17 0:00:00,"Best in Show, Modern Family comedic actor Fred Willard dies"
2020/05/17 0:00:00,Melbourne auctions: big sales results and listing jump as coronavirus ban ends
2020/05/17 0:00:00,Coronavirus: Protesters scuffle with police at anti-lockdown rally in London’s Hyde Park
2020/05/17 0:00:00,Coronavirus vaccine: French government demands equal access in COVID-19 vaccine distribution row
2020/05/17 0:00:00,Write the next chapter of this historic homestead at Crafers
2020/05/17 0:00:00,"Cellar, vineyard, tennis court, Mona views and a ton of space too"
2020/05/17 0:00:00,St Ives property with three homes and pool house party room up for sale
2020/05/17 0:00:00,‘Buyer teleportation’: why it is the future of real estate
