date,title
2020/10/27 0:00:00,"Two new cases linked to northern suburbs virus cluster, Melbourne’s 111-day lockdown finally ends"
2020/10/27 0:00:00,Borat sequel’s surprise star reveals brutal truth behind the film
2020/10/27 0:00:00,Transport Workers’ Union considers a boycott on working on Qatar Airways after strip search
2020/10/27 0:00:00,Desperate recall of ‘life-threatening’ AFL Grand Final LED wristbands
2020/10/27 0:00:00,Halloween decorations at McLaren Vale likened to KKK lynching
2020/10/27 0:00:00,Aldi Special Buys brings back popular $99 pre-lit Christmas tree
2020/10/27 0:00:00,Aussie comic Fiona O’Loughlin virtually unrecognisable in Project interview
2020/10/27 0:00:00,Golden Eagle 2020: Chris Waller and Tommy Berry hoping smart mare can claim new premier race
2020/10/27 0:00:00,Big change as Kmart introduces a booking system in Melbourne after restrictions lift
2020/10/27 0:00:00,Why Bulldogs star Josh Dunkley is eyeing a move to Essendon next year
2020/10/27 0:00:00,James Weir recaps SAS Australia 2020 episode 4 |  Celebs rip apart Firass Dirani in angry fight
2020/10/27 0:00:00,"Bad Airbnb guests face public shaming, five-year ban"
2020/10/27 0:00:00,"Docklands murder: Liam Cahill stabbed through heart, court told"
2020/10/27 0:00:00,Golden Eagle 2020: The Godolphin galloper Darren Beadman would ride in the Sydney classic
2020/10/27 0:00:00,Queensland storms: State battered by wild weather
2020/10/27 0:00:00,Woman discovers bottles full of pee in sister’s bedroom
2020/10/27 0:00:00,WA judge frees two sexual predators despite safety concerns
2020/10/27 0:00:00,"Michael Caton on The Castle, old mate Sam Neill and why his Rams character is a complete ‘a---hole’"
2020/10/27 0:00:00,Jackson Warne wishes he wasn’t Shane Warne’s son in SAS interrogation
2020/10/27 0:00:00,Man arrested as police investigate murder of Mejid Hamzy
2020/10/27 0:00:00,Detail about Annastacia Palaszczuk and Deb Frecklington fooling voters before Qld election
2020/10/27 0:00:00,Mert Ney: Sydney CBD stabber pleads guilty to murder
2020/10/27 0:00:00,Viewers side with Merrick Watts after his explosive fight with Firass Dirani on SAS Australia
2020/10/27 0:00:00,SA hospital will continue sending paediatric heart patients to Melbourne: review
2020/10/27 0:00:00,‘Darkest US Day’: Amy Coney Barrett appointed in big win for Trump
2020/10/27 0:00:00,Melbourne Cup 2020: Anthony Van Dyck heads to Flemington in career peak form after hot run
2020/10/27 0:00:00,Green light for Coronavirus Supplement extension
2020/10/27 0:00:00,"What to stream this week: The Night Of, The Mandalorian, Truth Seekers and more"
2020/10/27 0:00:00,"No inquest after WA man murdered his four grandchildren, daughter and wife"
2020/10/27 0:00:00,Diplo denies living with 19-year-old TikTok star Quenlin Blackwell
2020/10/27 0:00:00,Eden Dally describes living conditions on SAS: ‘You’re shivering on ice’
2020/10/27 0:00:00,NBL: The Sydney Kings remain interested in veteran big man Andrew Bogut and are willing to wait until he decides his future
2020/10/27 0:00:00,Rajesh Kumar fined for betting on fixed tennis matches
2020/10/27 0:00:00,BBL: Family comes first for South African star AB de Villiers
2020/10/27 0:00:00,Eugenie Bouchard fuels romance rumours with NFL star
2020/10/27 0:00:00,Diet drinks may be just as bad for your health as full-sugar versions
2020/10/27 0:00:00,Marngoneet prison boss Wayne Harper could be jailed for child porn
2020/10/27 0:00:00,Seven Network wants to be repaid if axed star Simon Reeve wins in court
2020/10/27 0:00:00,"Australian sharemarket slumps to three-week low, weaker oil price hits energy stocks"
2020/10/27 0:00:00,Qld election 2020 party policy quiz: Who should I vote for?
2020/10/27 0:00:00,‘I voted!’: Ex-inmates cast ballots in Florida
2020/10/27 0:00:00,Legendary referee Bill Harrigan would have binned Cameron Smith for remarks
2020/10/27 0:00:00,Greg Inglis reveals he knocked back the chance to make his Origin comeback for Queensland this year
2020/10/27 0:00:00,Charities set to benefit from rich prize pool in Golden Eagle
2020/10/27 0:00:00,Seniors urged to check eligibility for a $500 cash payment before the deadline hits
2020/10/27 0:00:00,Tricky maths question NSW HSC students struggled to solve
2020/10/27 0:00:00,Hamilton dog attack New Zealand: Newborn baby dies
2020/10/27 0:00:00,Reserve Bank indicates recession is over
2020/10/27 0:00:00,Drake’s fan disgusted over strange menu from 34th birthday party
2020/10/27 0:00:00,Ron Quinton mare Alchermes has the bloodlines to make easy work of a heavy Kensington surface
2020/10/27 0:00:00,Philadelphia erupts after police fatally shoot Walter Wallace Jr in front of family
2020/10/27 0:00:00,"Tradie falls 10m off roof in Rydalmere, Sydney"
2020/10/27 0:00:00,WWE legend shows off shredded new physique after undergoing dramatic body transformation
2020/10/27 0:00:00,Baby and young child diagnosed with coronavirus in WA
2020/10/27 0:00:00,King’s Legacy out to break 40-year 3YO drought in Cantala
2020/10/27 0:00:00,Victoria’s victory is no one else’s: Treasurer Josh Frydenberg
2020/10/27 0:00:00,Jordan Childs picks up Melbourne Cup ride on Stratum Albion among jockey merry-go-round
2020/10/27 0:00:00,Woolworths launches new collectable glass storage containers
2020/10/27 0:00:00,Celebrities turn up to Melbourne Cup Carnival event in their best frocks
2020/10/27 0:00:00,Keith Dryden hoping Handle The Truth can aim up
2020/10/27 0:00:00,"The Boulevard, Ivanhoe Christmas stretch pioneer lights up market"
2020/10/27 0:00:00,NBL: Victoria emerges as favourite to host hub to start the 2021 NBL season with games in regional centres
2020/10/27 0:00:00,‘Life threatening’ flooding expected in Brisbane as commuters sit stranded on top of cars
2020/10/27 0:00:00,Tasmania borders to reopen to NSW from November 6
2020/10/27 0:00:00,Bjorn Baker thinks his mare can reverse last week’s result
2020/10/27 0:00:00,Australia Post’s bizarre excuse for refusing to disclose corporate credit card spending
2020/10/27 0:00:00,Tourism Council WA poll reveals most West Australians want Premier Mark McGowan to set reopening date
2020/10/27 0:00:00,A-League: Wellington Phoenix could spend entire season based in NSW
2020/10/27 0:00:00,Christmas 2020: last postage and delivery dates for sending gifts
2020/10/27 0:00:00,Vitamins giant Blackmores’ dogged determination to lift pet health profits
2020/10/27 0:00:00,Qld airport bomb hoaxer jailed for ‘criminally appalling behaviour’ that could have had ‘catastrophic outcomes’
2020/10/27 0:00:00,US woman reveals how she found out husband’s alleged plot to kill her
2020/10/27 0:00:00,Phil Gould calls out social media hypocrisy after Grand Final backlash
2020/10/27 0:00:00,Melbourne Cup 2020: Nadia Bartel’s plunging mini dress kicks off fashion festivities
2020/10/27 0:00:00,Melbourne anti-lockdown protest to go ahead on Cup Day despite restrictions easing
2020/10/27 0:00:00,"Victorians lost lives, jobs and a part of themselves during lockdown"
2020/10/27 0:00:00,Brett Sutton once starred on Channel 7 reality show Medical Emergency
2020/10/27 0:00:00,Mortgagee to sell failed businessman Michael Gu’s Mosman trophy home
2020/10/27 0:00:00,Australian Museum announces 2020 reopening date with free entry
2020/10/27 0:00:00,How coronavirus lies spread worldwide: ASPI report
2020/10/27 0:00:00,"Flinders Medical Centre nurse Michelle Scutchings convicted, suspended after she stole opioids from hospital 168 times"
2020/10/27 0:00:00,Piers Morgan savages ‘gutless’ UK leaders – and spills on his feud with Donald Trump
2020/10/27 0:00:00,Schools in NSW evacuated after receiving threatening email
2020/10/27 0:00:00,Las Vegas father arrested after throwing his baby from a balcony
2020/10/27 0:00:00,Nissan Leaf e+ review: New electric car’s range anxiety questions answered
2020/10/27 0:00:00,Liberal MP Tim Smith trolled over awkward doughnut photo
2020/10/27 0:00:00,Team Corstens with two strong hopes in Coolmore Stud Stakes
2020/10/27 0:00:00,Ryan Phillippe makes a dig at Ellen DeGeneres
2020/10/27 0:00:00,Maher and Eustace launch three-pronged Coolmore attack
2020/10/27 0:00:00,Wallabies: Former All Black Brad Thorn has been ’cheering hard’ for his Reds players forging a bold Test path
2020/10/27 0:00:00,Victoria could need 28-days of no community transmission before SA border opens
2020/10/27 0:00:00,Brett Sutton responds after poll gives him higher approval rating than Premier Dan Andrews
2020/10/27 0:00:00,First Lady Melania Trump to make campaign trail debut one week from election day
2020/10/27 0:00:00,Oz Lotto $5 million jackpot winning numbers: Lottery draw 1393 results
2020/10/27 0:00:00,Jetstar takes swipe at Byron Bay model who held up flight
2020/10/27 0:00:00,Convicted terrorist Abdul Nacer Benbrika stays behind bars for now
2020/10/27 0:00:00,Storm warning: Homes at risk on Wamberal Beach due to erosion
2020/10/27 0:00:00,Blue Mountains Grammar School students rescued from kayaking trip
2020/10/27 0:00:00,How to fold towels: Photo sparks online debate
2020/10/27 0:00:00,"Qld election 2020: Decision on reopening border to NSW by Friday, day before election"
2020/10/27 0:00:00,AFL: Brisbane don’t want Collingwood midfielder Adam Treloar as speculation swirls around his future
2020/10/27 0:00:00,Bendigo and Adelaide Bank board takes six month pay cut
2020/10/27 0:00:00,US therapist kills her twin daughters in their sleep in murder-suicide
2020/10/27 0:00:00,TPG Telecom CEO Iñaki Berroeta calls ‘unlimited’ data like Vodafone Infinite ‘the future’
2020/10/27 0:00:00,"Candice Warner shuts down Channel 7 hosts, defends David Warner over cheating claim on SAS Australia"
2020/10/27 0:00:00,Shocking rise in youth presentations to Victorian hospital emergency departments over self-harm
2020/10/27 0:00:00,Ikea’s 2021 catalogue delayed as company removes potentially offensive image
2020/10/27 0:00:00,Karen Leek murder: Twist in greyhound trainer killing case
2020/10/27 0:00:00,Hillary Clinton unleashes with brutal Donald Trump dig before US election
2020/10/27 0:00:00,HomeBuilder: Regional Victorian estates ready for last-minute surge
2020/10/27 0:00:00,"Two-year-old girl tied to pole, dangled upside down in Thailand | Video"
2020/10/27 0:00:00,TAB outlets to re-open in Melbourne after restrictions ease
2020/10/27 0:00:00,Rugby: Storm flyer Suliasi Vunivalu’s move to the Reds a boost for Queensland and the Wallabies
2020/10/27 0:00:00,Kim Kardashian poses in sexy bikini snaps on 40th birthday | Photos
2020/10/27 0:00:00,Torana owner reunited with car 28 years after it was stolen
2020/10/27 0:00:00,Watch: Shocking footage emerges of brawl between schoolboys and man
2020/10/27 0:00:00,Warning that complementary medicines bought online can be contaminated with lead
2020/10/27 0:00:00,Premier Daniel Andrews reveals plans for COVID normal Christmas
2020/10/27 0:00:00,‘Adultery is one of my theories’ and ‘time to channel Sherlock Holmes’: The Binge Club reviews The Undoing
2020/10/27 0:00:00,Qatar strip search: Witness opens up about terrifying ordeal
2020/10/27 0:00:00,Boxing star Ryan Garcia busted cheating on pregnant partner
2020/10/27 0:00:00,Tanning addict who ignores medical advice on sun beds claims his ‘dark’ skin boosts love life
2020/10/27 0:00:00,Richard Murray: JB Hi-Fi CEO sells Toorak mansion
2020/10/27 0:00:00,Prince Azim: Playboy son of the Sultan of Brunei suddenly dies
2020/10/27 0:00:00,"Parent’s ‘terrified’ as fit boy, 4, spends six days in a coma with COVID-19"
2020/10/27 0:00:00,Jury discharged in trial of Mosman swim teacher Kyle Daniels
2020/10/27 0:00:00,The strict cap on home visits allowed in Victoria
2020/10/27 0:00:00,NRL Grand Final sparks $5 million Cameron Smith blunder
2020/10/27 0:00:00,Terrifying image of a ‘winged tarantula’ freaks out social media – can you guess what it really is?
2020/10/27 0:00:00,Keanu Reeves spotted with a shaved head in Berlin | Photos
2020/10/27 0:00:00,NSW records two new local cases of COVID-19
2020/10/27 0:00:00,Jamie Foxx’s younger sister DeOndra Dixon dead at 36
2020/10/27 0:00:00,Dustin Martin turned his back on absurd $11m offers from North Melbourne and Adelaide
2020/10/27 0:00:00,Empire Rose Stakes: Pizza and champagne on the way for Nettoyer
2020/10/27 0:00:00,NSW police slap public safety orders on 22 members of rival families
2020/10/27 0:00:00,Phil Gould responds to social media backlash over Grand Final commentary
2020/10/27 0:00:00,Qld election 2020: Early voters smash election record
2020/10/27 0:00:00,CCTV captures moment stolen car explodes in Bendigo
2020/10/27 0:00:00,Instagram to update breast-covering policy after Celeste Barber post
2020/10/27 0:00:00,‘High anxiety’: What the US election means for Australia
2020/10/27 0:00:00,SuperCoach Racing 2020: The Racing League ambassadors reveal their Round 5 teams
2020/10/27 0:00:00,Couple stranded in field after car gets stuck following X-rated night
2020/10/27 0:00:00,"Voters say Australia has enough people, survey reveals"
2020/10/27 0:00:00,Fury as shopper told she can’t buy sanitary pads at Tesco in Wales because they are not essential
2020/10/27 0:00:00,China coronavirus: Kashgar authorities claims to test 4.5 million residents in two days after outbreak
2020/10/27 0:00:00,Where is your Melbourne Cup fancy in the order of entry?
2020/10/27 0:00:00,Ferrari boss hits back after Sebastian Vettel floats conspiracy theory
2020/10/27 0:00:00,"Michigan man accidentally buys two lottery tickets, wins $1 million twice"
2020/10/27 0:00:00,SuperCoach Racing 2020: Our experts reveal their Round 8 stables
2020/10/27 0:00:00,Cricket: Summer schedule close to being locked in as India confirms squads for Australia tour
2020/10/27 0:00:00,Sydney light rail shut down after gun scare
2020/10/27 0:00:00,SAS Australia: Candice Warner fires back at Roxy Jacenko as feud intensifies
2020/10/27 0:00:00,SuperCoach Racing 2020: Our experts reveal their Round 5 stables
2020/10/27 0:00:00,Queensland woman teaches housework with online training program
2020/10/27 0:00:00,Woman trolled for being ‘too pretty to be a real doctor’
2020/10/27 0:00:00,QLD/NSW border: Peter Beattie says state must follow NSW’s lead
2020/10/27 0:00:00,Richmond star Jayden Short breaks down over dad’s death during premiership celebrations
2020/10/27 0:00:00,Australia Post pays for CEO Christine Holgate’s stay at Grand Hyatt in Melbourne
2020/10/27 0:00:00,Piers Morgan compares watching Meghan and Harry’s ‘woke’ Netflix shows to ‘having a root canal’
2020/10/27 0:00:00,Victoria records no new coronavirus cases for second straight day
2020/10/27 0:00:00,NASA: Water and ice discovered on the moon’s Clavius Crater ahead of Artemis program return
2020/10/27 0:00:00,Jim’s Mowing desperate for workers after surge in demand amid COVID-19 pandemic
2020/10/27 0:00:00,"Kyle Flanagan ‘shocked’ by Roosters axing, triggers contract ‘frenzy’ with three-year Bulldogs deal"
2020/10/27 0:00:00,Richmond’s Jack Higgins told ‘he may be traded’ this off-season
2020/10/27 0:00:00,Eden Hills home’s impressive design makes it look like it’s perched in the treetops
2020/10/27 0:00:00,‘It’s strange’: Decision to keep Melbourne’s 25km radius rule questioned
2020/10/27 0:00:00,Emily Ratajkowski is expecting her first child with Sebastian Bear-McClard
2020/10/27 0:00:00,Ex-AFL player and The Block star Darren Jolly ‘safe’ after distressing Instagram post
2020/10/27 0:00:00,Social media backlash after Daniel Andrews shares picture of ‘top shelf’ drink on Twitter
2020/10/27 0:00:00,Donald Trump convinced he’s going to win election
2020/10/27 0:00:00,NBA star Dion Waiters loves Brandon Smith’s Grand Final celebration
2020/10/27 0:00:00,Donald Trump’s Supreme Court will change America for decades
2020/10/27 0:00:00,‘All they talk about is COVID’: Trump complains about media’s coronavirus coverage as cases surge across US
2020/10/27 0:00:00,"What happens if Donald Trump loses the US election, but refuses to concede?"
2020/10/27 0:00:00,Coronavirus Victoria live: No changes to face mask rules in Victoria
2020/10/27 0:00:00,"Ex-Fifth Harmony singer Ally Brooke, 27: ‘Don’t let me die a virgin’"
2020/10/27 0:00:00,Manifold Heights: Worst house in best street beats reserve by $60K
2020/10/27 0:00:00,Melbourne’s family homes dubbed ‘COVID-19 proof’ as auctions return
2020/10/27 0:00:00,Former Westpac chief executive Brian Hartzer buys Paddington terrace for over $6.5m
2020/10/27 0:00:00,"Melbourne lockdown lifting: Regional Victoria to be open to Melburnians, inspection rules relaxed"
2020/10/27 0:00:00,Unsurpassed elegance and opportunity in Ellington
2020/10/27 0:00:00,Director of Taronga Zoo Simon Duffy lists in Rozelle
