date,title
2020/06/04 0:00:00,US protests live updates: K-pop's genius #WhiteLivesMatter takeover
2020/06/04 0:00:00,Liz Cambage sends fiery message to Australian ‘allies’ ahead of weekend protests
2020/06/04 0:00:00,Madeleine McCann suspect named by German media as prosecutors say child is ‘assumed dead’
2020/06/04 0:00:00,US riots: Model forced to barricade herself in bathroom as looters raid apartment building
2020/06/04 0:00:00,"NRL 2020, Round 4 |  Sydney Roosters destroy Brisbane Broncos at Suncorp Stadium"
2020/06/04 0:00:00,Woolworths: Supermarket under fire for new shopping bags that are made in China
2020/06/04 0:00:00,Scott Morrison reveals what he likes about US President Donald Trump
2020/06/04 0:00:00,How to survive a recession: Expert tips for your finances
2020/06/04 0:00:00,What were the Australian songs you were buying in the 1990s?
2020/06/04 0:00:00,Sydney Swans great Kieren Jack opens up on lessons from Adam Goodes’ AFL racism saga
2020/06/04 0:00:00,The realities of a four-day work week
2020/06/04 0:00:00,Black Lives Matter protests Australia this weekend: Thousands of Aussies to join protests across the country
2020/06/04 0:00:00,Mum addicted to Coca Cola dies after drinking 2 litres a day
2020/06/04 0:00:00,Right-wing commentator Candace Owens divides with comments about George Floyd
2020/06/04 0:00:00,Former Australian cricketer Michael Slater and wife Jo put Newport property on the market
2020/06/04 0:00:00,Commonwealth Bank to suspend users over abuse in online transaction descriptions
2020/06/04 0:00:00,"US protests: At least 13 people killed, 10,000 arrested as protests continue across the US"
2020/06/04 0:00:00,NSW drivers using phone could lose 10 demerit points
2020/06/04 0:00:00,Meghan Markle Black Lives Matter: Duchess shares powerful video message
2020/06/04 0:00:00,Shoalhaven zoo lions won’t be euthanised after attacking zookeeper
2020/06/04 0:00:00,White House press secretary says police have a ‘right to defend themselves’ after Sunrise crew beaten on live TV
2020/06/04 0:00:00,Coronavirus: Warning of Australian ‘dead malls’ as a result of COVID-19
2020/06/04 0:00:00,Craig Bellamy says calls Josh Hodgson has passed Cameron Smith as NRL’s best No.9 are premature
2020/06/04 0:00:00,Crown reopens top restaurants
2020/06/04 0:00:00,Relationship Rehab: Husband's sex bombshell after affair
2020/06/04 0:00:00,"Urgent recall of more than 20,000 Ford Rangers and Ford Everests"
2020/06/04 0:00:00,Melbourne teens’ digital agency idea sparks $5 million business
2020/06/04 0:00:00,NBA star Aron Baynes pens powerful letter on racism
2020/06/04 0:00:00,"Forget coffee, it’s time to be serious about our tea choices"
2020/06/04 0:00:00,Inside the secret language of LEGO fans
2020/06/04 0:00:00,Jennifer Aniston auctions off nude portrait for coronavirus relief
2020/06/04 0:00:00,How to resupply for lockdown wine cellar
2020/06/04 0:00:00,Tax refund July 1: How to claim big tax deduction
2020/06/04 0:00:00,Sex workers outline proposal for industry to start up again during pandemic
2020/06/04 0:00:00,Major League Baseball season in jeopardy while MLS deal done
2020/06/04 0:00:00,NBN: Labor accuse network of ‘dumping’ customers onto Satellite
2020/06/04 0:00:00,Where can you travel now? Holiday destinations available as restrictions ease
2020/06/04 0:00:00,James Tedesco ruled out of Thursday’s game against Brisbane Broncos
2020/06/04 0:00:00,George Floyd autopsy reveals he had coronavirus infection before murder
2020/06/04 0:00:00,Fears CBD protest could spark second coronavirus wave as Premier promises no fines
2020/06/04 0:00:00,Prince William urges Prince Harry to move ‘somewhere safer’ than LA
2020/06/04 0:00:00,Resilient and Resourceful: It’s what defines South  Australians and their businesses
2020/06/04 0:00:00,"George Floyd protests: New York woman calls for an end to looting, destruction"
2020/06/04 0:00:00,NRL bans Dally M Awards betting following scandal
2020/06/04 0:00:00,James Mattis slams Donald Trump's response to George Floyd protests across the US
2020/06/04 0:00:00,Snapchat moves against Donald Trump for ‘inciting racial violence’
2020/06/04 0:00:00,Students at Brisbane boy’s school  re-enact George Floyd’s death
2020/06/04 0:00:00,New York Times slammed for article headline ‘endangering’ black staff
2020/06/04 0:00:00,George Floyd protests: Nine News reporter ‘ambushed’ in London
2020/06/04 0:00:00,Sisters In Law: What are your rights with apartment noise complaints?
2020/06/04 0:00:00,Lion Air stops flights after reopening because passengers can’t follow rules
2020/06/04 0:00:00,Video shows Washington police officer telling team to hit protesters ‘hard’
2020/06/04 0:00:00,Slow cooker penne pasta recipe divides Facebook
2020/06/04 0:00:00,US riots: Fears organised looters are strategically leaving bricks out
2020/06/04 0:00:00,Chance for Ben Simmons to revive season as NBA unveils 22-team return plan
2020/06/04 0:00:00,Karen Leek: Woman charged with murder of greyhound trainer in Victoria
2020/06/04 0:00:00,The CW to create completely new role after Ruby Rose quits Batwoman
2020/06/04 0:00:00,Man sends haunting group photo to mum before fatal plane crash
2020/06/04 0:00:00,London’s Downing St attacked after Black Lives Matter protests
2020/06/04 0:00:00,Baseball great Torii Hunter recounts ugly encounter with police officers at his home
2020/06/04 0:00:00,Hydroxychloroquine: WHO resumes trials for coronavirus treatment
2020/06/04 0:00:00,China and US ban flights from each other’s country amid tensions
2020/06/04 0:00:00,A-League new boys Macarthur FC may want assurances from FFA before committing to paying fee
2020/06/04 0:00:00,Protesters sing ‘Lean On Me’ outside White House amid riots
2020/06/04 0:00:00,New Toyota HiLux revealed: More power and increased tech
2020/06/04 0:00:00,Man surprises newsagent with gift after winning $100K on scratchie
2020/06/04 0:00:00,Scott Morrison’s press conference interrupted by bloke yelling to everyone to get off his grass
2020/06/04 0:00:00,Double demerits kick in tonight ahead of long weekend
2020/06/04 0:00:00,No community-derived COVID-19 cases in NSW for eight days
2020/06/04 0:00:00,Malcolm Jenkins responds to NFL teammate Drew Brees as protesting video goes viral
2020/06/04 0:00:00,George Floyd protests: Cops charged after African-American students tasered
2020/06/04 0:00:00,Bali governor says island economy needs to stop relying on tourism
2020/06/04 0:00:00,Remains found at 1000 Steps in Dandenong Ranges
2020/06/04 0:00:00,Tito Ortiz desperate to fight Mike Tyson but warns 53-year-old he may not survive
2020/06/04 0:00:00,HomeBuilder scheme: Backlash over who will and won’t receive money
2020/06/04 0:00:00,Big Brother 2020: All of this year's contestants revealed
2020/06/04 0:00:00,Wife of Broadway star Nick Cordero told to ‘say goodbye’ amid COVID-19 battle
2020/06/04 0:00:00,"Qantas, Jetstar domestic flights resume as travel restrictions ease"
2020/06/04 0:00:00,Ikea online sales to help furniture giant flourish amid pandemic
2020/06/04 0:00:00,Queen’s Birthday long weekend weather: Cool days and frosty nights across southeast
2020/06/04 0:00:00,Star Wars’ John Boyega gives stirring speech at Black Lives Matter rally
2020/06/04 0:00:00,Swallow and Ariell Biscuit Factory conversion for sale in Port Melbourne
2020/06/04 0:00:00,French Princess Hermine of Clermont-Tonnerre in coma after ‘serious’ car crash
2020/06/04 0:00:00,Essendon rookie Tom Hird sidelined indefinitely with stress fracture
2020/06/04 0:00:00,Cian English: Two girls charged with murder over teen’s Gold Coast balcony death
2020/06/04 0:00:00,Renovated Killarney Vale home on tiny 384sqm block sold for top dollar
2020/06/04 0:00:00,New look for Australia’s favourite ute
2020/06/04 0:00:00,NRL: Biggest stars slammed as Dragons cop more criticism
2020/06/04 0:00:00,Derelict Kadina cottage with $35k price tag is Australia’s cheapest property listing
2020/06/04 0:00:00,Pete Evans tells 60 Minutes he’s ‘suspicious’ about coronavirus in preview ahead of interview
2020/06/04 0:00:00,George Floyd: Australia isn’t a world away – Indigenous deaths in custody occur frequently
2020/06/04 0:00:00,Homebuyers grant: Scott Morrison’s HomeBuilder scheme panned
2020/06/04 0:00:00,"HomeBuilder scheme: $25k grants for new builds, renovations will boost construction but not prices"
2020/06/04 0:00:00,Politician strips naked during government Zoom call thinking camera was off
2020/06/04 0:00:00,Coronavirus: Melbourne property listings jump in May
2020/06/04 0:00:00,Dan Carter set to take staggering salary cut to sign with Blues
2020/06/04 0:00:00,Road trip of rediscovery
2020/06/04 0:00:00,"QLD, NSW border closure: Billboards demand borders reopen to save jobs"
2020/06/04 0:00:00,George Floyd protests: Police take action after attack on Seven News crew
2020/06/04 0:00:00,Kmart walk-in wardrobe transformation stuns Facebook
2020/06/04 0:00:00,Madeleine McCann disappearance: Police reveal German suspect
2020/06/04 0:00:00,New Zealand and Australia ‘travel bubble’ plans revealed
2020/06/04 0:00:00,George Floyd protests: Barack Obama speaks about police brutality
2020/06/04 0:00:00,New HomeBuilder scheme: What Scott Morrison’s new grant means for you
2020/06/04 0:00:00,Dyson reveals new details about abandoned electric car to rival Tesla
2020/06/04 0:00:00,Backlash over Lea Michele’s apology amid wave of fresh accusations
2020/06/04 0:00:00,Homebuyers grant: Scott Morrison announces HomeBuilders scheme details
2020/06/04 0:00:00,Sam Burgess blasts ‘snake’ who used him as a ‘pawn’ and scapegoat for England’s failure
2020/06/04 0:00:00,Woolworths’ ‘amazing’ $5 cookies and cream mud cake goes viral on TikTok
2020/06/04 0:00:00,Fitness influencer’s post sparks ‘coregasm’ confessions
2020/06/04 0:00:00,George Floyd protests: Trump claims he was in bunker for ‘an inspection’
2020/06/04 0:00:00,Mercedes not shutting the door on Sebastian Vettel
2020/06/04 0:00:00,June penumbral lunar eclipse: When and how to watch from Australia
2020/06/04 0:00:00,Elephant killed after being fed pineapple filled with explosives
2020/06/04 0:00:00,Couples told to wear face masks during sex during coronavirus pandemic
2020/06/04 0:00:00,Collingwood coach Nathan Buckley has a message for Donald Trump
2020/06/04 0:00:00,"Amazing natural sights, hikes, rides and views around Victoria"
2020/06/04 0:00:00,"Kayleigh McEnany compares Trump church photo to WWII, 9/11 response"
2020/06/04 0:00:00,Kit Harington horrified to find out his love interest in original Game of Thrones storyline idea
2020/06/04 0:00:00,"Stadium-sized asteroid to make ‘close approach’ with Earth, NASA warns"
2020/06/04 0:00:00,NFL star Drew Brees slammed for interview ‘disgrace’ as US protests continue
2020/06/04 0:00:00,Quoll caught on CCTV breaking into Cairns pub bottle shop
2020/06/04 0:00:00,George Floyd killing: All four police officers charged
2020/06/04 0:00:00,‘I’ve been one of the lucky ones’: Ex-Magpie’s powerful message for Australia
2020/06/04 0:00:00,Eddie McGuire takes aim at David Koch over Port Adelaide play
2020/06/04 0:00:00,Public picking up part of the bill for COVID-9 commission chair’s private jet flights
2020/06/04 0:00:00,Lea Michele apologises following accusations from Glee co-stars
2020/06/04 0:00:00,US Protests: US curfews defied but violence subsides
2020/06/04 0:00:00,Coronavirus Australia live updates: 1 week in NSW without community transmission
2020/06/04 0:00:00,"1982-3: Royals leave their mark on the Territory with visits from the Queen, Prince Charles and Princess Diana"
2020/06/04 0:00:00,Donald Trump claims he has ‘done more for black Americans’ than any other President after days of US protests
2020/06/04 0:00:00,Drummoyne waterfront home of late property developer Marshall Brentnall sells above expectations
2020/06/04 0:00:00,Former St Leonards post office selling after award-winning reno
2020/06/04 0:00:00,History shows why we can have housing market confidence
