date,title
2020/07/11 0:00:00,AFL round 6: Essendon Bombers secure gritty victory over rivals North Melbourne Kangaroos
2020/07/11 0:00:00,Raiders injury toll deepens after Josh Hodgson ‘tragedy’
2020/07/11 0:00:00,Lewis Hamilton claims pole position for Styrian Grand Prix
2020/07/11 0:00:00,"NRL 2020, round 9 | Melbourne Storm defeat Canberra Raiders in icy thriller"
2020/07/11 0:00:00,England and Leeds United legend Jack Charlton dies aged 85
2020/07/11 0:00:00,"Aringa Ave, Highton auction attracts six bidders"
2020/07/11 0:00:00,"More Australians cook at home, ditching takeaway, meal kits but have 30 minutes to make dinner"
2020/07/11 0:00:00,"NRL 2020, round 9 | Brisbane Broncos defeat Canterbury Bulldogs to end six game losing streak"
2020/07/11 0:00:00,Women of Les Miserables become the heroes in new book
2020/07/11 0:00:00,Sydney residents queue for testing amid second-wave fears
2020/07/11 0:00:00,AFL round 6: Gold Coast debutant Izak Rankine scores with first touch
2020/07/11 0:00:00,Comedian Tahir Bilgic’s tips on how to achieve happiness
2020/07/11 0:00:00,Mount Barney: Hiker dies after falling from cliff in Queensland
2020/07/11 0:00:00,Brisbane Broncos training gamble exposes side in Canterbury Bulldogs clash
2020/07/11 0:00:00,NRL round 9: Penrith Panthers rookie Charlie Staines scores four tries on debut against Cronulla Sharks
2020/07/11 0:00:00,Hundreds turn out of Alex ‘Chumpy’ Pullin paddle out tribute
2020/07/11 0:00:00,"The NBA’s second richest man behind Michael Jordan, Junior Bridgeman"
2020/07/11 0:00:00,"Coronavirus Melbourne: Sport, exercise rules for locked down residents"
2020/07/11 0:00:00,Armie Hammer and Elizabeth Chambers’ shock split after 10 years of marriage
2020/07/11 0:00:00,It’s never too late for a stab at a love song
2020/07/11 0:00:00,Kazakhstan denies China’s claim of new deadly virus
2020/07/11 0:00:00,Nic Naitanui makes Reilly O’Brien pay after accidental Twitter notes
2020/07/11 0:00:00,South east coast prepares for seven days of wild weather
2020/07/11 0:00:00,"Wooli Beach, NSW shark attack: Surfer, 15, dies after shark mauls legs"
2020/07/11 0:00:00,Fremantle defeat St Kilda in absolute nailbiting rollercoaster
2020/07/11 0:00:00,"Bali to reopen, but can you go there?"
2020/07/11 0:00:00,Robert De Niro ‘lucky’ to make $10.7 million this year because of coronavirus
2020/07/11 0:00:00,Shawn West lands illegal knee to head of downed opponent Boston Salmon
2020/07/11 0:00:00,Kim Kardashian ‘furious’ as Kanye West’s controversial comments ‘ruin 2024 presidential plans’
2020/07/11 0:00:00,Coronavirus Australia: Sydney pub closed after five virus cases
2020/07/11 0:00:00,Labor urges government to release JobKeeper review as businesses face September cut-off
2020/07/11 0:00:00,Chrissy Teigen shows off bikini body after breast implant removal surgery
2020/07/11 0:00:00,AFL: Michael Walters’ monumental brain fade at opening centre bounce
2020/07/11 0:00:00,Coronavirus Melbourne: Positive test shuts Frankston police station
2020/07/11 0:00:00,Patty Mills talks about racism growing up and its ongoing impact on the AFL
2020/07/11 0:00:00,Coronavirus Victoria: Daniel Andrews’ blunt warning for those flouting rules
2020/07/11 0:00:00,Coronavirus Melbourne: Where to get a COVID-19 test
2020/07/11 0:00:00,Victorian COVID-19 cases jump by 216 as ‘cumulative outbreaks’ pass 100
2020/07/11 0:00:00,"Girl, 8, rescued from floodwaters by police officer in Ohio | Video"
2020/07/11 0:00:00,Delays expected at Queensland’s long-awaited border reopening
2020/07/11 0:00:00,‘Devastated’ Jessica Mulroney calling former BFF Meghan Markle ‘non-stop’
2020/07/11 0:00:00,AFL 2020: Brian Taylor rips Tom Browne over grand final speculation
2020/07/11 0:00:00,Coronavirus US: Blood clots found in ‘almost every organ’ of patients
2020/07/11 0:00:00,Wimbledon hailed a ‘class act’ after incredible $18M move
2020/07/11 0:00:00,Powerball Lotto $80 million: Winner purchased ticket in Dromana
2020/07/11 0:00:00,Tom Hanks and Charlize Theron in epic streaming face-off
2020/07/11 0:00:00,Donald Trump commutes ally Roger Stone’s jail sentence
2020/07/11 0:00:00,ESPN’s Adrian Wojnarowski apologises for explicit email to US Senator
2020/07/11 0:00:00,Man charged for attacking cancer patient who refused to share cigarettes
2020/07/11 0:00:00,F1 2020: Red Bull rejects Sebastian Vettel
2020/07/11 0:00:00,Man held up at knifepoint in Stafford fast-food carpark
2020/07/11 0:00:00,"‘Sweet kid’ Harry Guscott killed in fiery Lesmurdie crash, passenger taken to hospital with burns"
2020/07/11 0:00:00,Naya Rivera: Underwater footage released amid search for missing Glee star
2020/07/11 0:00:00,"New real estate platform offers way to become property owner for as little as $25,000"
2020/07/11 0:00:00,Truck driver refused bail for Menangle Crash
2020/07/11 0:00:00,"Michael Clarke holidays with new girlfriend Pip Edwards, kids"
2020/07/11 0:00:00,"US sets one-day record with more than 60,500 coronavirus cases"
2020/07/11 0:00:00,Jada Pinkett Smith admits to affair with August Alsina while married to Will Smith
2020/07/11 0:00:00,Woolies cops massive fine for shouting gamblers alcohol
2020/07/11 0:00:00,Departing legend James Graham opens up on donating his brain to science after his death
2020/07/11 0:00:00,Johnny Depp asked Amber Heard to ‘cut’ him in chilling audio played in court
2020/07/11 0:00:00,NRL commentator Ray Warren reveals row with Snoop Dogg
2020/07/11 0:00:00,"Coronavirus: Online auctions a success, but less transparent"
2020/07/11 0:00:00,Frank Valentic: The Block expert sets Elwood house price record
2020/07/11 0:00:00,Hobart leads the capital cities in profit-making property sales
2020/07/11 0:00:00,"Ghislaine Maxwell begs for bail, says ‘I’m not Jeffrey Epstein’"
2020/07/11 0:00:00,Striking Geelong West home offers a breath of fresh air
2020/07/11 0:00:00,What to consider when buying a house and land package
2020/07/11 0:00:00,Property experts warning prospective tenants to look out for rental scams
2020/07/11 0:00:00,Entertain in style and enjoy enviable views over the city
2020/07/11 0:00:00,Remdesivir approved for use in Australia for treatment of severe coronavirus
2020/07/11 0:00:00,Coronavirus Australia live updates: Victoria records 216 new virus cases
2020/07/11 0:00:00,"Unique design, quality build combine to create glorious house"
2020/07/11 0:00:00,Unusual Mosman duplex comes to market after an amazing makeover
2020/07/11 0:00:00,Superb Sandy Bay family home set to be a hit with families
2020/07/11 0:00:00,Coronavirus real estate: Geelong first-home buyers out in force
2020/07/11 0:00:00,Tax deductions to rise this year as rental income impacted by COVID-19 and bushfires
