date,title
2020/02/17 0:00:00,‘He’s not a fullback:’ Andrew Johns reveals big concern for Latrell Mitchell move
2020/02/17 0:00:00,‘Agonising’: Holden’s demise in Australia puts dealer staff in limbo
2020/02/17 0:00:00,Renault’s Alain Prost predicts another tough year for Daniel Ricciardo
2020/02/17 0:00:00,"Ten comedy and circus Fringe acts perform on Kangaroo Island, and more visitors are expected for Cup Carnival"
2020/02/17 0:00:00,Survivor: All-Stars tribal council delivers ‘complete and utter blindside’
2020/02/17 0:00:00,Mothers are up in arms over Constance Hall’s DIY backyard spa
2020/02/17 0:00:00,‘Betrayed’: Headmaster gave reference to coach who groomed student at St Kevin’s College
2020/02/17 0:00:00,Hanseatic primed to give Godolphin back-to-back Blue Diamond Stakes
2020/02/17 0:00:00,Volunteer firefighter’s tough time battling Aussie bushfires
2020/02/17 0:00:00,James Weir recaps Married At First Sight 2020 episode 10
2020/02/17 0:00:00,NFL gun JJ Watt and soccer star Kealia Ohai get married in stunning Bahamas wedding
2020/02/17 0:00:00,Australians leave Christmas Island quarantine after being cleared of coronavirus
2020/02/17 0:00:00,Victress: New book by WBBL cricketer Corinne Hall celebrates Aussie sportswomen
2020/02/17 0:00:00,"Sydney woman baffles Americans with her budget, including health care and cost of birth control"
2020/02/17 0:00:00,‘Horrific’ viral pig hunting video sparks debate
2020/02/17 0:00:00,India agree to a Gabba Test and day-night match in 2020 four-match series
2020/02/17 0:00:00,Family violence survivor helps introduce groundbreaking policy to help colleagues
2020/02/17 0:00:00,Woman dies after travelling to Turkey to undergo ‘deadly’ bum lift surgery
2020/02/17 0:00:00,‘Cosmos: Possible Worlds’ makers accuse PM Scott Morrison of being ‘woefully dishonest’ on climate change
2020/02/17 0:00:00,Brisbane Broncos cross-code back Izaia Perese stood down after being charged with drug offences
2020/02/17 0:00:00,There are calls for people on the dole to be encouraged to help bushfire-ravaged towns
2020/02/17 0:00:00,AFL to ‘keep with tradition’: 2020 Grand Final timeslot revealed
2020/02/17 0:00:00,"Raceday focus: Benalla best bets, trainer to watch"
2020/02/17 0:00:00,Zion Williamson has already far exceeded expectations following knee injury
2020/02/17 0:00:00,Prime Minister slams Holden’s Australian exit after $2 billion handout
2020/02/17 0:00:00,Raceday focus: Muswellbrook best bets and inside mail
2020/02/17 0:00:00,Sonic the Hedgehog went from ‘disaster’ to box office record
2020/02/17 0:00:00,Global pandemic fears after Westerdam former passenger tests positive for coronavirus
2020/02/17 0:00:00,"SA buyers want room to move, realestate.com.au’s most-viewed auction list shows"
2020/02/17 0:00:00,Former pilot says he knows where doomed MH370 wreckage is
2020/02/17 0:00:00,Cars we’re farewelling with the disappearance of Holden
2020/02/17 0:00:00,Hundreds of Australians to lose jobs over Holden axing
2020/02/17 0:00:00,Sydney auctions: Inner west home sets record as it sells $400k above guide in crazy weekend
2020/02/17 0:00:00,Inside legendary carmaker’s stunning withdrawal from Aussie market
2020/02/17 0:00:00,Outlander season 5 returns: Everything you need to know
2020/02/17 0:00:00,Why visiting a doctor is the ‘worst thing you can do’ if you have coronavirus
2020/02/17 0:00:00,Cobargo: A complete travel guide to visiting the NSW south coast
2020/02/17 0:00:00,Push to abolish major upfront cost to buying a house
2020/02/17 0:00:00,Man in bushfire-ravaged area wins $2.5m in Saturday Superdraw Lotto
2020/02/17 0:00:00,Broulee: A complete travel guide to visiting the NSW south coast
2020/02/17 0:00:00,‘We were deceived’: China’s ‘vile’ attempt to weaponise coronavirus against enemy state exposed
2020/02/17 0:00:00,How the Holden disappearance will impact the value of different models
2020/02/17 0:00:00,Mogo: A complete travel guide to visiting the NSW south coast
2020/02/17 0:00:00,Supercars teams uncertain after Holden bombshell announced
2020/02/17 0:00:00,Woman posing as a baby photographer is accused of feeding a mum laced cupcake in an attempt to steal baby
2020/02/17 0:00:00,A ‘toy boy’ with the ‘body of a god’ has left one mum broke and stranded away from home
2020/02/17 0:00:00,Batemans Bay: A complete travel guide to visiting the NSW south coast
2020/02/17 0:00:00,SA sporting clubs urged to pull their socks up for a good cause and help fight Motor Neurone Disease
2020/02/17 0:00:00,Driver allegedly caught speeding at 228km/h in Victoria
2020/02/17 0:00:00,AFLW star praised for incredible courage in painful highlight
2020/02/17 0:00:00,Fears of robo-debt ‘disaster’ repeat
2020/02/17 0:00:00,What the coronavirus actually looks like
2020/02/17 0:00:00,"NSW weather: Heavy rain, strong winds as thunderstorm rolls in"
2020/02/17 0:00:00,Mum wows with ‘perfect’ cheese slice hack
2020/02/17 0:00:00,Instagrammer fools fans with fake holiday in Bali
2020/02/17 0:00:00,Music icon Chaka Khan roasted after singing American national anthem at the NBA All-Star game
2020/02/17 0:00:00,Collette Dinnigan lists Paddington terrace with focus now on Italy projects
2020/02/17 0:00:00,‘Abuse of female cows’: Topless animal rights protesters crash Bernie Sanders campaign rally
2020/02/17 0:00:00,Melbourne auctions: Why buyers shouldn’t despair amid big sales
2020/02/17 0:00:00,ABC forced to pay costs of Australian Federal Police legal fight
2020/02/17 0:00:00,Holden brand to disappear by the end of 2020
2020/02/17 0:00:00,Kate Middleton says she ‘really liked’ labour thanks to ‘hypnobirth’
2020/02/17 0:00:00,Bernard Tomic thrashed again in rapid time — but still stays alive at Delray Beach
2020/02/17 0:00:00,Sarah Ristevski says half brother’s claims he had a relationship with her mother ‘completely untrue’
2020/02/17 0:00:00,"Aldi’s 2021 graduate program comes with $90,000 starting salary"
2020/02/17 0:00:00,Couple’s nine lessons for successful marriage go viral
2020/02/17 0:00:00,Wendell Sailor opens up on the question he never got to ask his birth mum
2020/02/17 0:00:00,Prime Minister Scott Morrison says he was misrepresented over fire comments
2020/02/17 0:00:00,"E-cigarette maker Juul buys ads on Cartoon Network, Nickelodeon to target kids"
2020/02/17 0:00:00,Chilling CCTV of accused predator minutes before attack
2020/02/17 0:00:00,Jump in coronavirus deaths as total number of cases continue to rise
2020/02/17 0:00:00,China authorities are cleaning and storing bank notes across the country to stop coronavirus spread
2020/02/17 0:00:00,YouTube star accused of ‘fatphobia’ after shaming model’s weight
2020/02/17 0:00:00,Midnight Oil drummer Rob Hirst opens up on being reunited with his secret daughter after 36 years
2020/02/17 0:00:00,Sarah Ristevski speaks for the first time about her mother’s killing
2020/02/17 0:00:00,"Today in history, February 21: Malcolm X assassinated"
2020/02/17 0:00:00,Mortlake block with DA approved plans for 36 apartments sells prior to auction for $9.6m
2020/02/17 0:00:00,"Duva’s XI: Another Cahill on national scout’s radar, Ange back in Australia, Man City’s Brexit"
2020/02/17 0:00:00,Hilarious reason filming Rebel Wilson’s Pitch Perfect scenes was difficult
2020/02/17 0:00:00,Apple could be hit with a wage payments scandal of its own over employee bag checks
2020/02/17 0:00:00,‘We had to stop’: Caroline Flack’s secret relationship with Prince Harry
2020/02/17 0:00:00,"‘Intense, fast moving’ storms during a wild week of weather"
2020/02/17 0:00:00,BBC weather map of Storm Dennis looks like a penis | Photo
2020/02/17 0:00:00,Backpackers to come to the rescue in Australian bushfires rebuild
2020/02/17 0:00:00,Adam Scott breaks lengthy drought by winning on the US PGA Tour
2020/02/17 0:00:00,Uproar over Coles’ individually packaged hot cross buns
2020/02/17 0:00:00,Amanda Bynes announces engagement to ‘lover’ on Instagram
2020/02/17 0:00:00,New Aldi item labelled ‘lazy’ but is it really?
2020/02/17 0:00:00,Georgia man takes down shoplifting suspect with trolley during police chase
2020/02/17 0:00:00,Achini Kulasuriya hospitalised after shocking blow to the head in T20 World Cup warm-up game
2020/02/17 0:00:00,Former Love Island host Caroline Flack’s death throws hit reality show into turmoil
2020/02/17 0:00:00,NBA All Star Game 2020: Team LeBron triumphs in wild thriller
2020/02/17 0:00:00,RFS denies firefighter was sacked after slamming Prime Minister Scott Morrison
2020/02/17 0:00:00,"Don’t blame the person who reclines their seat, blame the airline"
2020/02/17 0:00:00,Tourist arrested over bikini on Maldives beach thought she was being ‘abducted’
2020/02/17 0:00:00,Smart stadiums are coming. Here’s what you can expect to see
2020/02/17 0:00:00,‘Open to ridicule’: Meghan Markle’s ‘behind the scenes’ Vogue video left Palace aides ‘cringing’
2020/02/17 0:00:00,Serious crash at Maslin Beach in Adelaide’s south
2020/02/17 0:00:00,Quirky Sydney Collectionist Hotel hits the market
2020/02/17 0:00:00,Terrifying footage of plane trying to land in 146km per hour gales of wind
2020/02/17 0:00:00,Hot rod garage drives buyer to builder’s own Mornington home
2020/02/17 0:00:00,What we learnt from F1’s launch week ahead of season 2020
2020/02/17 0:00:00,Full toll of Hawthorn great Dermott Brereton’s AFL career revealed ahead of 26th major operation
2020/02/17 0:00:00,Young woman had already begun eating burger when she found a metal bar
2020/02/17 0:00:00,"Tradie finds lizard drowning in beer, performs CPR and saves its life"
2020/02/17 0:00:00,Teammates’ shocking reaction to star’s dramatic stand against racism
2020/02/17 0:00:00,"Celeste Barber, fundraising group clash over $52m raised for bushfire aid"
2020/02/17 0:00:00,Jennifer Lopez shares ‘killer’ bikini selfie with fans
2020/02/17 0:00:00,"Karl Stefanovic pictured in rare snap with his daughter, Ava"
2020/02/17 0:00:00,‘Impossible to find’: Jeffrey Epstein’s ‘madam’ Ghislaine Maxwell slapped with court papers by email
2020/02/17 0:00:00,Passenger slammed for ‘creepy’ video of couple kissing mid-flight
2020/02/17 0:00:00,Family affair as Belmont house in Barwon River precinct sells $56K above reserve
2020/02/17 0:00:00,NRL to return to North Sydney Oval after 15-year hiatus
2020/02/17 0:00:00,Passenger caught manspreading at the airport divides opinion after he takes up three seats
2020/02/17 0:00:00,5 Seconds of Summer announce Australian tour
2020/02/17 0:00:00,How the Cowboys poached Nines young superstar from Reds for $2k
2020/02/17 0:00:00,Naked man goes swimming in Melbourne’s Yarra River
2020/02/17 0:00:00,Former MAFS star Dean Wells slams the show in explosive interview
2020/02/17 0:00:00,MAFS star Cyrell Paule welcomes baby with Love Island’s Eden Dally
2020/02/17 0:00:00,Josh Morris determined to leave Cronulla Sharks after club’s act of disrespect
2020/02/17 0:00:00,Tayla Harris responds after Stacey Livingstone’s swipe; David King says it’s just what AFLW needs
2020/02/17 0:00:00,New Facebook design branded ‘ugly’ and ‘gross’ now rolling out to users
2020/02/17 0:00:00,Snapchat video shows car speeding before fiery Valentine’s Day crash that left mum-of-two dead
2020/02/17 0:00:00,Urgent recall issued for RoyalBaby Kids’ Bikes
2020/02/17 0:00:00,Five Things: Peugeot 508 Sportswagon
2020/02/17 0:00:00,Josh Morris determined to leave Sharks after club’s act of disrespect
2020/02/17 0:00:00,Top Instagram leaker reveals secret redesign that finally lets you see new posts first again
2020/02/17 0:00:00,First 24 hours for Australians taking part in Diamond Princess evacuation will be crucial
2020/02/17 0:00:00,"Fire Fight Australia: Queen, Russell Crowe, Olivia Newton-John, John Farnham help raise millions"
2020/02/17 0:00:00,Israel Folau may be confronted with more rainbow colours after controversy erupts on Super League debut
2020/02/17 0:00:00,US Space Force looking for ideas ‘in good taste’ on what it should call its members
2020/02/17 0:00:00,Nike shoes or not – a sub-13 minute 5km is insane
2020/02/17 0:00:00,Backpackers to help with bushfire recovery
2020/02/17 0:00:00,Sex and the City star Lynn Cohen dead at 86
2020/02/17 0:00:00,Researchers pinpoint facility near Wuhan seafood market as possible ground zero
2020/02/17 0:00:00,"Today in history, February 17: World’s first superhero appears in comics"
2020/02/17 0:00:00,Sydney man dies in neighbourhood dispute
2020/02/17 0:00:00,Disgusting brawl erupts at England Boxing Youth Championships
2020/02/17 0:00:00,Bushfire stricken regions bounce back as tourists start to return
2020/02/17 0:00:00,MORNING SERVE: The sports stories to see this morning
2020/02/17 0:00:00,Rush hour: The stories you need to know today
2020/02/17 0:00:00,Patty Mills praised for helping local communities during NBA All-Star Weekend
2020/02/17 0:00:00,Celeste Barber’s dig at Scott Morrison during Fire Fight Australia
2020/02/17 0:00:00,‘My husband is in the water’: Wife screams as husband drowns at Bondi Beach
2020/02/17 0:00:00,Fire Fight Australia: Music festival raises millions
2020/02/17 0:00:00,Teenager who was shot dead in Sydney’s southwest was related to slain IS terrorist
2020/02/17 0:00:00,"Teen, 17, ‘confessed to raping 11-year-old relative 100 times before she gave birth in bathtub’"
2020/02/17 0:00:00,"Australia’s pest problem: Spike in infestations sparks major housing concerns, hipages data reveals"
2020/02/17 0:00:00,Cheryl Sanders was shot dead by her ex-husband
2020/02/17 0:00:00,Meghan Markle’s homeless brother says he’s sick of her helping charities but not her family
2020/02/17 0:00:00,James Weir recaps Married At First Sight 2020 episode 9
2020/02/17 0:00:00,Margot Robbie says she backs Megxit and plans to invite Meghan Markle and Prince Harry to dinner in Los Angeles
