date,title
2020/09/02 0:00:00,Kayla Itsines puts family home up for sale amid split from fiance Tobi Pearce
2020/09/02 0:00:00,"Millions in funding for virus vaccine, treatment hope"
2020/09/02 0:00:00,New Mercedes-Benz S-Class revealed
2020/09/02 0:00:00,Sydney mum Melissa Inkster arrives home after being stranded in Africa by COVID-19
2020/09/02 0:00:00,NBA: Giannis Antetokounmpo questioned for not guarding Jimmy Butler
2020/09/02 0:00:00,Victoria lockdown: Foreign companies killing Melbourne retail
2020/09/02 0:00:00,Mining giant BHP to cut emissions by 50 per cent in its Queensland coal mines
2020/09/02 0:00:00,Treasurer says NSW dealt with COVID-19 ‘much better’ than other states
2020/09/02 0:00:00,Man accused of assaulting heavily pregnant woman undergoes mental health assessment
2020/09/02 0:00:00,Randwick races: Vanna Girl steps up for big test in Tramway Stakes
2020/09/02 0:00:00,Brett Prebble to ride for the first time in 10 weeks at The Valley
2020/09/02 0:00:00,James Weir recaps The Bachelor Australia 2020 episode 7
2020/09/02 0:00:00,Teenage guard asked female quarantine guest out for coffee: inquiry
2020/09/02 0:00:00,"AFL Round 15 teams: Collingwood name debutant to help Brodie Grundy, Carlton makes three changes"
2020/09/02 0:00:00,Constance Hall shares update on husband Denim Cooke’s condition following his motorbike accident
2020/09/02 0:00:00,‘I was very scared’: Jury in Caroline Nilsson trial hears police interview on night of alleged murder
2020/09/02 0:00:00,"China pushing to double nuclear warhead arsenal, Pentagon says"
2020/09/02 0:00:00,UFC: Jon Jones calls out Brock Lesnar for heavyweight showdown
2020/09/02 0:00:00,Chef’s Table BBQ: Firedoor’s Lennox Hastie reveals how you should barbecue
2020/09/02 0:00:00,"A-League: Glory confirm exit of coach Tony Popovic, while future of star pair is unclear"
2020/09/02 0:00:00,King of Thailand Maha Vajiralongkorn ‘releases’ his mistress from jail
2020/09/02 0:00:00,"Refugee who set himself on fire asked for help, inquest hears"
2020/09/02 0:00:00,Epsom hopefuls Niccanova and The Candy Man move to Sydney
2020/09/02 0:00:00,Business coach charged with child homicide over seven-month-old baby death
2020/09/02 0:00:00,Australia in recession: How much money should you have in your emergency fund?
2020/09/02 0:00:00,Super Rugby: A four-point win on Saturday will secure a first-ever finals berth for the Melbourne Rebels
2020/09/02 0:00:00,"Best rental affordability since 2007, says the Real Estate Institute of Australia"
2020/09/02 0:00:00,Teacher Monica Young to have sex offence charges combed
2020/09/02 0:00:00,Australian lenders are offering bargain home loan rates
2020/09/02 0:00:00,New research shows retesting four weeks later could curb COVID-19 infection risk
2020/09/02 0:00:00,Melbourne Cup raider’s plea for common sense on scans
2020/09/02 0:00:00,AFL: Carlton captain Patrick Cripps has a sore knee but the Blues need him with their season on the line
2020/09/02 0:00:00,Kenosha protests: Donald Trump accused of lying for photo op
2020/09/02 0:00:00,"Herald Sun Footy Podcast: Lauren Wood, Jon Anderson, Michael Warner and Scott Gullan debate the hot Round 14 issues"
2020/09/02 0:00:00,Extra support for ‘most vulnerable’ stranded Aussie travellers
2020/09/02 0:00:00,SA runs second but ‘stands ready’ if Queensland can’t host AFL grand final
2020/09/02 0:00:00,Australian stock market jumps despite confirmation of economic recession
2020/09/02 0:00:00,AFL: Gold Coast’s Pearce Hanley retires after 169 games with Suns and Lions
2020/09/02 0:00:00,Farmer Wants A Wife 2021: New farmers unveiled for next season
2020/09/02 0:00:00,"Neighbours, TV dramas at risk amid local content quota changes"
2020/09/02 0:00:00,Centre Stage star Ethan Stiefel shocks fans with completely unrecognisable new look
2020/09/02 0:00:00,Coronavirus pandemic delays transplants for babies with biliary atresia
2020/09/02 0:00:00,MasterChef Emelia Jackson to share best cooking hacks on South East Melbourne Phoenix webinar series
2020/09/02 0:00:00,One of Seaforth’s grandest estates sells to Melbourne buyer for more than $9.5m
2020/09/02 0:00:00,‘Hey hw r u’: Supermarket shopper’s contact tracing details used for pick-up text
2020/09/02 0:00:00,Warnings for drivers who lie to get cheaper car insurance
2020/09/02 0:00:00,Socceroos attacker Brandon Borrello has switched clubs in Germany in the hope of more game time
2020/09/02 0:00:00,Disney’s live action remake of Mulan has been a long time coming … and it’s perfect for the #MeToo era
2020/09/02 0:00:00,Rugby stars Saia and Anthony Fainga’a refused to let quarantine rules stop them from attending their grandmother’s funeral
2020/09/02 0:00:00,Comedian goes viral after sharing photo of tiny mask bra
2020/09/02 0:00:00,Beloved Pilbara hitchhiking canine Red Dog honoured again
2020/09/02 0:00:00,Nadia Bokody: The secret I kept about my sexuality
2020/09/02 0:00:00,Convicted drug trafficker Vicky Morris successfully argues her WorkCover payments should not be cut
2020/09/02 0:00:00,AFL: Michael Hibberd out of clash with Sydney but Melbourne coach has finals ambitions with four rounds to go
2020/09/02 0:00:00,Coronavirus: Woman cops $2000 in fines for sneaky border crossing attempt
2020/09/02 0:00:00,The Valley races: Harbour Views tackles Feehan Stakes in search of golden ticket into Cox Plate
2020/09/02 0:00:00,‘Devastating day’: Prime Minister Scott Morrison reacts to grim economic outlook
2020/09/02 0:00:00,Zoom shares spike 35 per cent after coronavirus lockdown
2020/09/02 0:00:00,All aboard: Sydney’s newest passenger train hits the tracks
2020/09/02 0:00:00,US Open tennis: Guido Pella seethes over COVID-19 drama
2020/09/02 0:00:00,Single trial expected for Pell contempt case
2020/09/02 0:00:00,A historic AFL grand final at the Gabba will only be a retail bonanza if SA or WA club is playing
2020/09/02 0:00:00,Dog theft: Heartless thief nabs homeless Sydney man’s dog from Circular Quay
2020/09/02 0:00:00,The items even a recession won’t stop Aussies from buying
2020/09/02 0:00:00,Westpac figures show Victorian wages have slumped during the June quarter due to COVID-19
2020/09/02 0:00:00,Former Twelve Tribes cult leader killed in house fire
2020/09/02 0:00:00,Big Sean reveals biggest regret about ex Naya Rivera
2020/09/02 0:00:00,US Open women’s tennis: Kim Clijsters collapses late; Venus in retrograde as Serena marches on
2020/09/02 0:00:00,How flatmates made $250k during the coronavirus pandemic
2020/09/02 0:00:00,Why millionaire allegedly hired hitman to kill ex-wife
2020/09/02 0:00:00,Western Australia Premier Mark McGowan responds to AFL Grand Final snub
2020/09/02 0:00:00,Steve Jacobs’ ex-wife Rose Jacobs reveals private health battle behind makeover
2020/09/02 0:00:00,Kenosha shooting suspect Kyle Rittenhouse thanks supporters via phone in lawyer’s Twitter post
2020/09/02 0:00:00,Kmart launches $49 weighted blanket that people use to help fall asleep
2020/09/02 0:00:00,NRL: Kerrod Holland’s NRL career appears to be over after being told he is unwanted at Canterbury
2020/09/02 0:00:00,"Sisters Dassi Erlich, Elly Sapper and Nicole Meyer win alleged sexual assault gag order fight"
2020/09/02 0:00:00,NSW Police launch appeal after labrador puppy died from fractured skull
2020/09/02 0:00:00,Pic of orphaned possum awarded prize at the 2020 Australian Geographic Nature Photographer of the Year awards
2020/09/02 0:00:00,"Australia in recession: Economic plunge worse than feared, huge decline due to COVID crisis"
2020/09/02 0:00:00,Border frustration after shops destroyed in overnight blaze
2020/09/02 0:00:00,Aldi Special Buys camping sale prices beaten by Coles ‘best buys’
2020/09/02 0:00:00,Daniel Andrews’ Belt and Road deal with China rejected by Victorian voters
2020/09/02 0:00:00,Super Rugby AU: Reds lock Angus Blyth pushing for Wallabies selection
2020/09/02 0:00:00,Facebook could be hit with a new tax over threat to ban Australian news
2020/09/02 0:00:00,Brave survivors of alleged predator principal win right to be heard
2020/09/02 0:00:00,Wonder Woman 1984 star Pedro Pascal reveals fallout from spoiler
2020/09/02 0:00:00,Victoria Police top cop Luke Cornelius wins praise for ‘tin foil hat’ take-down
2020/09/02 0:00:00,Elon Musk passes Mark Zuckerberg to become world’s third-richest man
2020/09/02 0:00:00,Body hunter: Human remains expert solving 500 mysteries
2020/09/02 0:00:00,NSW rocked by 26 public place shootings in a month
2020/09/02 0:00:00,NBA playoffs 2020: Donovan Mitchell breaks Steph Curry’s three-point record
2020/09/02 0:00:00,New ways of connecting with customers scores Central Market business a City Award nomination
2020/09/02 0:00:00,Cruel joke that got Real Housewives star Dorinda Medley fired
2020/09/02 0:00:00,Chinese woman skewered by steel rod in building site accident
2020/09/02 0:00:00,Coronavirus Australia: A 10-year crisis is coming after COVID in the form of a mental health disaster
2020/09/02 0:00:00,Ambulance superstation planned for central Sydney
2020/09/02 0:00:00,Melbourne woman has spent $135k on plastic surgery – including five boob jobs
2020/09/02 0:00:00,Report: Lionel Messi agrees to $1.1 billion deal with City Football Group
2020/09/02 0:00:00,Marnus Labuschagne and Alex Carey post 100s in final warm-up game for T20 series v England
2020/09/02 0:00:00,Beleaguered financial services giant AMP considers asset sales
2020/09/02 0:00:00,Counter terror cops in Sydney police attack probe
2020/09/02 0:00:00,FaZe Clan welcomes LeBron James’ son Bronny as “member”
2020/09/02 0:00:00,Mum killed when unborn baby cut from her at ‘fake baby shower’
2020/09/02 0:00:00,Melbourne stage four: How to get ready to buy this spring
2020/09/02 0:00:00,Former anti-Islamic State fighter jailed for interfering with corpse but has already served his time
2020/09/02 0:00:00,Wine Society collapse: Australian company goes bust
2020/09/02 0:00:00,Anderson Cooper vows revenge on Andy Cohen for uploading his revealing photos
2020/09/02 0:00:00,Mystery cases make up 15 per cent of Victorian virus infections
2020/09/02 0:00:00,COVID-19 spread via ‘fecal aerosol transmission’ in Chinese high-rise tower
2020/09/02 0:00:00,Australia’s first recession in 30 years confirmed as economy plunges due to virus
2020/09/02 0:00:00,"Puppy dies after being found injured, unresponsive"
2020/09/02 0:00:00,"Victoria records 90 new coronavirus cases, six more deaths"
2020/09/02 0:00:00,The Reject Shop introduces surprising new grocery staples
2020/09/02 0:00:00,Kanye West says he interrupted Taylor Swift’s VMAs speech because God intended it
2020/09/02 0:00:00,"Victorian bikie who sparked COVID-19 fear was infectious one day, not the next"
2020/09/02 0:00:00,All 12 episodes of I May Destroy You drop on Binge
2020/09/02 0:00:00,NRL 2020: Melbourne Storm powerbrokers ask for Cameron Smith answers
2020/09/02 0:00:00,"Student, healthcare worker test positive as police warn Vics they won’t get in for AFL grand final"
2020/09/02 0:00:00,South Australian couple killed in double shooting ‘wanted to change the world’
2020/09/02 0:00:00,How you can rent a private island in China for just $700 a year
2020/09/02 0:00:00,"Mark Anthony Villani jailed for theft, discharging firearm after he was recruited in vigilante-style plan to investigate missing opals"
2020/09/02 0:00:00,Mum allegedly killed man she thought was a paedophile
2020/09/02 0:00:00,"Major events in question, with Schoolies ‘unlikely’ and ‘alternative plans’ discussed for Christmas Pageant"
2020/09/02 0:00:00,Max Markson fined for allegedly claiming device could prevent COVID-19
2020/09/02 0:00:00,Fire damaged Prospect character home snapped up before auction
2020/09/02 0:00:00,Coronavirus Australia: Premier slammed after unborn baby’s death
2020/09/02 0:00:00,FBI investigating American Airlines pilot claim a “guy in a jet pack” flying around LAX
2020/09/02 0:00:00,"Married female teacher, 35, ‘had sex with pupil, 15, in field and sent him topless pic on Snapchat’"
2020/09/02 0:00:00,Comment: Bruce McAvaney asked 55 rhetorical questions in one AFL game — it’s almost time to go
2020/09/02 0:00:00,AFL: Lions skipper Dayne Zorko predicts code to boom with a Gabba Grand Final
2020/09/02 0:00:00,"AFL Grand Final 2020: MCG decider two weeks away, report claims"
2020/09/02 0:00:00,New Pepsi Max flavour cashes in on Aussie obsession
2020/09/02 0:00:00,Melbourne lockdown protest organiser Fanos Panayides arrested
2020/09/02 0:00:00,Thousands of Aussies stranded overseas due to passenger caps
2020/09/02 0:00:00,Royal Australian Mint unveils heartfelt initiative behind new $1 coin
2020/09/02 0:00:00,Man badly burned in Ingleburn workplace accident
2020/09/02 0:00:00,Prince Harry’s final phone call with Princess Diana before her death
2020/09/02 0:00:00,Max Twigg forced to surrender Porsche in $155 million family feud
2020/09/02 0:00:00,Melbourne lockdown worse than Wuhan
2020/09/02 0:00:00,"Man killed by police after being stopped riding a bike, sparking protests"
2020/09/02 0:00:00,Red Cross: Bushfire spending increased in affected communities
2020/09/02 0:00:00,Two new COVID-19 cases in Queensland
2020/09/02 0:00:00,Plate of Origin cooking show is ‘dead’ after three nights of poor ratings
2020/09/02 0:00:00,Us Open men’s tennis: Andy Murray pulls off incredible comeback
2020/09/02 0:00:00,Jake Trbojevic expects his brother Tom to return for Manly and NSW this season after hamstring injury
2020/09/02 0:00:00,NFL 2020: Gisele says Bill Belichick’s treatment of Tom Brady was ‘bulls***’
2020/09/02 0:00:00,Coronavirus Australia: PM takes swipe at Victorian roadmap
2020/09/02 0:00:00,Australia Post asks workers to ‘volunteer’ to deliver parcels
2020/09/02 0:00:00,"Coles’ catchy jingle “Down Down, Prices are Down” and Big Red Hand celebrate 10 years"
2020/09/02 0:00:00,Protesters are clashing with police in Melbourne
2020/09/02 0:00:00,The Bachelor: Osher gives dramatic coronavirus pandemic update to contestants
2020/09/02 0:00:00,Man dies after being hit by a car in Brisbane
2020/09/02 0:00:00,New Volkswagen Tiguan Allspace 140TDI returns
2020/09/02 0:00:00,Married At First Sight expert rumoured to be replaced by a ‘sex therapist’
2020/09/02 0:00:00,"NSW, Qld borders: Berejiklian asks Palaszczuk to show ‘compassion’"
2020/09/02 0:00:00,Seventeen new cases of coronavirus recorded in NSW
2020/09/02 0:00:00,‘Covidiots’ refusing to wear face masks blamed for virus outbreak on flight
2020/09/02 0:00:00,Overseas travel ban for Australians extended until December 17
2020/09/02 0:00:00,Melbourne lockdown fines: Police not buying the left-mask-at-home excuse
2020/09/02 0:00:00,AFL 2020: Footy world reacts to Hawthorn’s alarming low
2020/09/02 0:00:00,Tourist arrested over naked photos on sacred bridge in India
2020/09/02 0:00:00,NRL 2020: Ben Hunt linked to shock Broncos return
2020/09/02 0:00:00,Arrested woman’s GoFundMe shut down
2020/09/02 0:00:00,Wife discovers husband was cheating via New York Times wedding announcement
2020/09/02 0:00:00,Aussie boxing sensation Ebanie Bridges making a fortune from ‘creepy’ side-project
2020/09/02 0:00:00,Video captures wild brawl between two women at New York airport
2020/09/02 0:00:00,NSW’s top pollies slam QLD Premier Annastacia Palaszczuk over border restrictions
2020/09/02 0:00:00,Elon Musk told to implant Neuralink in his own brain by PETA after pig demo
2020/09/02 0:00:00,Serial sex sadist to die in jail for murder
2020/09/02 0:00:00,"Donald Trump insists he never had a ‘series of mini-strokes’, despite no one suggesting he did"
2020/09/02 0:00:00,Popular almond milk recalled over contamination fears
2020/09/02 0:00:00,AFL to reportedly announce the Gabba as host of the 2020 grand final
2020/09/02 0:00:00,"KFC SuperCoach NRL: Countback decides weekly winner, new contenders for overall honours"
2020/09/02 0:00:00,Ridley Scott’s Raised By Wolves hits Foxtel tomorrow
2020/09/02 0:00:00,Coronavirus Australia: Scott Morrison pushes border opening deadline
2020/09/02 0:00:00,Blue Mountains ‘circus family’ breaks silence over false child sex abuse charges
2020/09/02 0:00:00,Tony Abbott blasts Dan Andrews government and calls for end to national lockdowns
2020/09/02 0:00:00,Prospect factory theft: Man accused of swiping sanitiser and face masks worth $7000
2020/09/02 0:00:00,Southern Storm sweep in to claim victory in third game
2020/09/02 0:00:00,Australians robbed of pay rise under Coalition’s ‘cruel’ superannuation plan
2020/09/02 0:00:00,Aubrey O’Day slams unrecognisable paparazzi photos as clickbait
2020/09/02 0:00:00,Queensland Health’s awkward coronavirus backtrack over former Victorian bikie
2020/09/02 0:00:00,‘It’s not a good look’: Fox Footy commentators puzzled by Joe Daniher’s mid-game fence sit
2020/09/02 0:00:00,Sydney’s New Year’s Eve fireworks set to be axed due to coronavirus
2020/09/02 0:00:00,How Smallville actress Allison Mack showed devotion to Nxivm sex cult
2020/09/02 0:00:00,Research shows Australians have no idea who some of their most powerful politicians are
2020/09/02 0:00:00,Brad Pitt’s rumoured girlfriend Nicole Poturalski seen in picture with her husband
2020/09/02 0:00:00,DJ and ‘I Like to Move It’ hitmaker Erick Morillo dead at 49
2020/09/02 0:00:00,"Sydney, Canberra weather forecasts: Warmest weather since April forecast for Thursday"
2020/09/02 0:00:00,China bans Australian barley imports as trade war escalates
2020/09/02 0:00:00,AFL: Adelaide Crows 12.11 (83) defeat Hawthorn 7.6 (48)
2020/09/02 0:00:00,AFL 2020: Nathan Buckley hits out at Cale Hooker tribute
2020/09/02 0:00:00,"Meghan Markle, Prince Harry plant flowers on 23rd anniversary of Princess Diana’s death"
2020/09/02 0:00:00,Dark secret behind Sydney’s glittering beaches
2020/09/02 0:00:00,The suburbs where rare Little Treehouse mini books have been found
2020/09/02 0:00:00,Dan delivers ‘dagger in heart of democracy
2020/09/02 0:00:00,Toilet brush pioneer Donald Hay’s Noosa mansion sells for $12m
2020/09/02 0:00:00,Samsung Galaxy Z Fold 2 available for pre-order from September 9 for $2999
2020/09/02 0:00:00,Sydney Swans captain Kieren Jack lists Randwick investment apartment
2020/09/02 0:00:00,Surge in Victorian home building approvals
2020/09/02 0:00:00,Couple gets lucky property break with quick Thomson sale
2020/09/02 0:00:00,Eight first-home buyers compete for 1970s era Belmont property
2020/09/02 0:00:00,Low listing levels have kept housing market from plunging
2020/09/02 0:00:00,How to nail working-from-home life and avoid bad habit traps
2020/09/02 0:00:00,Sydney housing market ‘uneven’ as price changes vary across regions
2020/09/02 0:00:00,Former NRL player Todd Carney sells Waverley investment apartment
2020/09/02 0:00:00,Michael Roberts: AFL identity sells renovated Malvern house
