date,title
2020/07/01 0:00:00,Looking to keep the grandparents close by? Look no further
2020/07/01 0:00:00,Wigan enter administration; English Football League to hand club 12-point penalty
2020/07/01 0:00:00,Jade Tunchy Tiktok: Influencer passes out during wedding
2020/07/01 0:00:00,Minister for Defence Linda Reynolds confirms Australia ‘briefed’ China over boost to defence spending as tensions rise
2020/07/01 0:00:00,New South Wales coach Brad Fittler backs State of Origin for 33-year first
2020/07/01 0:00:00,Coronavirus: The important virus question Victorian Premier Daniel Andrews has to answer
2020/07/01 0:00:00,"Princess Diana, Meghan Markle: Mistake Queen keeps making with ex-royals"
2020/07/01 0:00:00,US election: What will COVID-19 pandemic mean for November 3 vote?
2020/07/01 0:00:00,Merv Hughes reveals Ian Chappell’s scathing assessment of debut Test match
2020/07/01 0:00:00,Alice Springs protesters denounce fracking outside Chief Minister Michael Gunner’s event
2020/07/01 0:00:00,Collingwood president Eddie McGuire responds to Steele Sidebottom’s mammoth suspension
2020/07/01 0:00:00,Adelaide man shocked to receive ‘sketchy’ $253 fine
2020/07/01 0:00:00,Mark Wahlberg reveals test results: ‘I’m allergic to everything’
2020/07/01 0:00:00,Royals at War: Kate Middleton ‘expressed concerns’ about Meghan Markle to Harry
2020/07/01 0:00:00,Guy Sebastian paid a surprise visit to a primary school choir rehearsal
2020/07/01 0:00:00,Sam Dastyari: Australian Government’s $270 billion defence boost is ‘money being pissed up the wall’
2020/07/01 0:00:00,Darren Lockyer responds to Brisbane Broncos’ management concerns
2020/07/01 0:00:00,Coronavirus: One in ten people in Melbourne still refusing virus tests
2020/07/01 0:00:00,NBL 2020-2021: Melbourne want Goulding to stay
2020/07/01 0:00:00,Missing man Daniel Barker unseen for six weeks after Blue Mountains crash
2020/07/01 0:00:00,Phil Gould tells Raiders to forget about John Bateman and ‘never deal with him again’
2020/07/01 0:00:00,KFC SuperCoach podcast: Pre-Lockout Round 8
2020/07/01 0:00:00,Collingwood Magpies star Jordan De Goey under scrutiny for lacklustre performances
2020/07/01 0:00:00,Super Rugby AU: Thorn questions Gallen’s entry into Waratahs ‘bubble’
2020/07/01 0:00:00,"Singer Sia, 44, reveals she’s a grandmother"
2020/07/01 0:00:00,The misconception Australians have about Victoria’s coronavirus outbreak
2020/07/01 0:00:00,AFL 2020: Banned Bulldog out to make amends after drink driving charge
2020/07/01 0:00:00,"Man, 20, charged with armed robbery of boys over scooter, mobile phone"
2020/07/01 0:00:00,"Paige Spiranac baby food admission, golf star reveals diet secret on podcast"
2020/07/01 0:00:00,Angie Kent Carlin Sterritt: Bachelorette couple confirm split
2020/07/01 0:00:00,"Victorian Police Assistance Line get 800,000 crime calls in a year"
2020/07/01 0:00:00,Coronavirus real estate: Geelong home values drop in June
2020/07/01 0:00:00,"Teenage girl dies after being hit by school bus in Ulladulla, NSW"
2020/07/01 0:00:00,Coronavirus: Victoria records single largest day of community transmissions
2020/07/01 0:00:00,AFL 2020: St Kilda captain Jarryn Geary will return to play Carlton but Zak Jones likely to miss
2020/07/01 0:00:00,Hot spot locals urge people to comply with coronavirus restrictions
2020/07/01 0:00:00,Toilet paper hoarding: Store owner’s nightmare over haul video
2020/07/01 0:00:00,‘We will never surrender’: Scott Morrison’s ‘deliberate’ words of war during defence boost speech
2020/07/01 0:00:00,"Melbourne, Adelaide forecast: Severe weather warning for strong winds, rain"
2020/07/01 0:00:00,Jennifer Aniston implores Instagram followers to wear face masks in public
2020/07/01 0:00:00,Benjamin Sara: Appeal against Sydney heroin plotter’s sentence fails
2020/07/01 0:00:00,Lions star preparing to leave pregnant wife at home to continue the AFL season
2020/07/01 0:00:00,Family saves drowning bear with plastic tub stuck on head
2020/07/01 0:00:00,Billy Brownless addresses falling out with Garry Lyon after Fox Footy return
2020/07/01 0:00:00,Queensland Reds v NSW Waratahs: Old enemies launch new Super Rugby AU competition
2020/07/01 0:00:00,"Three Finks bikies charged as police seize drugs, taser in western Sydney raids"
2020/07/01 0:00:00,NRL 2020: Wakeham’s bold call: “I don’t like any team”
2020/07/01 0:00:00,Adelaide Target joins long list of store closures
2020/07/01 0:00:00,"Bonnyrigg Heights shooting: Adam Saliba, 33, charged with attempted murder"
2020/07/01 0:00:00,Some airlines are doing away with the overhead luggage compartment
2020/07/01 0:00:00,Who is Pip Edwards? Everything you need to know about Michael Clarke’s new love
2020/07/01 0:00:00,"Australia defence budget: $270b earmarked on new weapons, fleets, troops"
2020/07/01 0:00:00,Amazon Games’ Crucible back in closed beta just weeks after release
2020/07/01 0:00:00,Victoria lockdown: Decision that could cost Queenslanders thousands
2020/07/01 0:00:00,Harvey Weinstein: Former employees of The Weinstein Company to receive compensation
2020/07/01 0:00:00,AFL in 2020: Footy’s glaring ugliness impossible to ignore
2020/07/01 0:00:00,"Curious pattern in coronavirus infection rate emerges, hinting it can ‘burn out’ at a certain point"
2020/07/01 0:00:00,"Bikini designer, Karina Irby, 29, shows off her six-year  transformation"
2020/07/01 0:00:00,Victorian unit approvals plunge in May an ‘alarm bell’: UDIA
2020/07/01 0:00:00,"Trump the ‘most informed person on earth’, says White House press secretary"
2020/07/01 0:00:00,Sydney’s new M8 tunnel to open as early as this weekend but tolls won’t come cheap
2020/07/01 0:00:00,Queensland Government opens second round of small business grants
2020/07/01 0:00:00,Meeting Becks and jumping on Katy Perry: AFL stars’ hilarious LA trip after GF heartbreak
2020/07/01 0:00:00,Australian Opals finally answer Liz Cambage’s call to make a stand and join the Black Lives Matter movement
2020/07/01 0:00:00,Coronavirus kills more than 1000 US citizens every single day
2020/07/01 0:00:00,Singer claims he had an affair with Jada Pinkett Smith and that Will Smith approved of it
2020/07/01 0:00:00,Vicious brawl breaks out in Arkansas steakhouse over social distancing
2020/07/01 0:00:00,G4 virus: Concern for pandemic potential flu strain found in China
2020/07/01 0:00:00,"WWDC 2020: Big changes to iPhone, iPad, Mac, Apple Watch explained"
2020/07/01 0:00:00,NSW Treasurer plans to end stamp duty
2020/07/01 0:00:00,"INEOS Automotive unveils new Grenadier to rival Toyota HiLux, LandCruiser"
2020/07/01 0:00:00,A-League season ready to return with packed schedule ahead of August 23 decider
2020/07/01 0:00:00,NRL 2020: Rooster Aubusson’s big decision
2020/07/01 0:00:00,Susan Yara: Inside Naturium skin care scandal
2020/07/01 0:00:00,"Qantas launches Sydney to Byron Bay route, first flights to Orange"
2020/07/01 0:00:00,"Victorian virus hotspot residents face fines, jail time for entering NSW"
2020/07/01 0:00:00,"Colorado ‘throuple’ expect first baby, hope girlfriend will breastfeed"
2020/07/01 0:00:00,Fate decided by house number for residents on Melbourne lockdown borders
2020/07/01 0:00:00,NRL: What’s next for John Bateman after confirming he’s leaving Canberra?
2020/07/01 0:00:00,Melbourne virus lockdown: Daniel Andrews warns of possible ‘whole state’ lockdown
2020/07/01 0:00:00,Adelaide suburbs where property prices are climbing and dropping most
2020/07/01 0:00:00,Murgon cops arrest 34 people in Operation Knuckle
2020/07/01 0:00:00,Coronavirus: NSW adds border restrictions to keep some Victorians out
2020/07/01 0:00:00,"Morrison warns of ‘haunting’ global uncertainty, ‘dire economic circumstances’ in post-COVID world"
2020/07/01 0:00:00,Victoria lockdown: How coronavirus second wave will affect economy
2020/07/01 0:00:00,Want to win this Henley Beach stunner?
2020/07/01 0:00:00,‘Like a virus’: Confusion over new Australian Made logo
2020/07/01 0:00:00,Families furious as Transport NSW’s weekend travel cap ’more than doubles’
2020/07/01 0:00:00,Sissy Sheridan TikTok: Horror as actress’ piercing goes wrong
2020/07/01 0:00:00,Queensland’s tourism and hospitality industry ready to get back to work
2020/07/01 0:00:00,Victoria records 73 new coronavirus cases
2020/07/01 0:00:00,Boxing: Tyson Fury slams ‘bulls***’ claims from Deontay Wilder’s camp he cheated in rematch
2020/07/01 0:00:00,Tennis star Andrea Petkovic takes aim at male counterparts
2020/07/01 0:00:00,High stakes on the visa frontline: An immigration lawyer reveals the tough realities of a gruelling job
2020/07/01 0:00:00,"Coronavirus Victoria: Where the new cases are coming from on Wednesday, July 1"
2020/07/01 0:00:00,Family injured after boat hits humpback whale near Alaska
2020/07/01 0:00:00,Rush for early access to super causes ATO website to crash
2020/07/01 0:00:00,AFL 2020: Essendon coach weighing up whether to pick Irishman after his COVID-19 positive
2020/07/01 0:00:00,Aussies to get better deals from banks under new data-sharing program
2020/07/01 0:00:00,Google unveils augmented reality Jurassic World dinosaurs
2020/07/01 0:00:00,Home prices fall at double previous rate in Sydney amid weaker economy
2020/07/01 0:00:00,Koray Kuroz: Sydney motivational speaker on trial for alleged MDMA supply
2020/07/01 0:00:00,Mum tries Matt Preston’s wooden spoon trick and uncovers something ‘revolting’
2020/07/01 0:00:00,Australia’s dumbest virus restriction: Premier Annastacia Palaszczuk mocked online for nightclub rule
2020/07/01 0:00:00,‘Ripped’ GI feeling as fresh as a teenager as comeback nears
2020/07/01 0:00:00,Turkey holiday: Bodrum tourists charged fee to swim in sea | Photo
2020/07/01 0:00:00,Coronavirus restrictions to ease further in NSW from today
2020/07/01 0:00:00,205 gym goers forced to quarantine after member tests positive
2020/07/01 0:00:00,Ross Noble’s hilariously savage Victoria sledge on The Project
2020/07/01 0:00:00,F1: Daniel Ricciardo reacts to ‘insane’ possibility of a second race in Italy
2020/07/01 0:00:00,Golf: Delicious diet behind PGA star Bryson DeChambeau’s bulk
2020/07/01 0:00:00,Protesters gather at Hawthorn East after workers assaulted
2020/07/01 0:00:00,Life in a COVID world: The ‘new normal’ for Australia is going to be weird for a long time
2020/07/01 0:00:00,Coles has launched a new $12 ‘Mexican-inspired’ roast chook
2020/07/01 0:00:00,Coronavirus Australia: $4000 fine for Victoria visitors sneaking into Qld
2020/07/01 0:00:00,"‘Fines or sanctions’ for Victoria’s COVID rebels, PM says"
2020/07/01 0:00:00,Australian cricketer Alex Hepburn loses appeal after rape conviction
2020/07/01 0:00:00,‘There’s an election’: PM responds to Premier’s ‘rhetoric’ over borders
2020/07/01 0:00:00,Apple iOS 14 widgets: What you need to know about iPhone redesign
2020/07/01 0:00:00,"Grandma, 60, details ‘mind-blowing’ sex life with 21-year-old boyfriend"
2020/07/01 0:00:00,"Paris Jackson, worth $145m, was ‘living in a van’ with her boyfriend"
2020/07/01 0:00:00,‘Dangerous and disorderly’: PM Scott Morrison’s warning on post-COVID world
2020/07/01 0:00:00,World reacts to China’s Hong Kong national security legislation
2020/07/01 0:00:00,"Victoria lockdown: Postcodes to be shut down, patrolled by police from midnight"
2020/07/01 0:00:00,"Johnny Depp hid texts asking assistant to buy him cocaine, ecstasy: UK court finds"
2020/07/01 0:00:00,Mark Hamill describes ‘Star Wars’ scenes that he regrets were cut
2020/07/01 0:00:00,F1: Ferrari planning ‘significant change’ in 2020
2020/07/01 0:00:00,Hotel quarantine: Major breach that led to Victoria being cut off
2020/07/01 0:00:00,Unlicensed driver faces seven charges after police pursuit
2020/07/01 0:00:00,Jacinda Ardern shows off ‘unusual’ household item in live Facebook video
2020/07/01 0:00:00,"Coronavirus US: Anthony Fauci warns cases could pass 100,000 a day"
2020/07/01 0:00:00,Positive COVID-19 cases on the rise in the WWE
2020/07/01 0:00:00,New laws coming for Australia on July 1: All the changes you need to know
2020/07/01 0:00:00,Sixth person charged with murder over suspicious death of Sydney dad Vergel Velasquez
2020/07/01 0:00:00,$1 million reward for dancer Shari Davison missing since 1995
2020/07/01 0:00:00,How will players in the NBA ‘bubble’ cope without their partners?
2020/07/01 0:00:00,Adam Savage of ‘Mythbusters’ allegedly raped sister as a child: lawsuit
2020/07/01 0:00:00,Black Lives Matter: Couple who pointed guns at protesters on their lawn being investigated
2020/07/01 0:00:00,2019: Uluru permanently closed to climbers on October 26 following board decision
2020/07/01 0:00:00,At home with graphic designer Todd Fischer
2020/07/01 0:00:00,17-year-old high school basketball prodigy Brandon Hendricks fatally shot in the Bronx
2020/07/01 0:00:00,Coronavirus Australia live updates: Victoria records highest increase in community transmission
2020/07/01 0:00:00,Rare Palm Beach waterfront comes to market with a $10m price guide
2020/07/01 0:00:00,Former Australian cricketer-turned-commentator ­Michael Slater sells Newport home
2020/07/01 0:00:00,Ocean Grove knockdown rebuild site beats prices hopes by $50K
2020/07/01 0:00:00,"Musician The Weeknd selling incredible $36.3 million LA mansion featuring walk-in wine cellar, disco garage and full basketball court"
2020/07/01 0:00:00,Skinny Coffs Harbour block that can’t be built on is for sale with $69k guide
2020/07/01 0:00:00,Champion horse trainer David Hayes lists Coogee apartment
