date,title
2020/01/31 0:00:00,Chinese official admits remorse over failure to crack down on deadly coronavirus
2020/01/31 0:00:00,Dominic Thiem challenge gesture in Australian Open semi-final
2020/01/31 0:00:00,Emergency warning for Winkleigh bushfire in Tasmania’s north
2020/01/31 0:00:00,"The Peanut Butter Falcon is a feel-good, compassionate story"
2020/01/31 0:00:00,Controversial tennis star Nick Kyrgios reignites feud with Novak Djokovic on Instagram
2020/01/31 0:00:00,How coronavirus is being spread
2020/01/31 0:00:00,Jake Paul and AnEsonGib bout slammed as talentless ‘joke’
2020/01/31 0:00:00,BBL09 - The Qualifier | Sydney Sixers defeated Melbourne Stars by 43 runs at MCG
2020/01/31 0:00:00,Passengers stranded for hours after virus scare on Jetstar flight
2020/01/31 0:00:00,Queensland school students in isolation over coronavirus fears
2020/01/31 0:00:00,New evidence appears to link Scott Morrison’s office to sporting grant scandal
2020/01/31 0:00:00,James Weir: Michelle Bridges’ DUI kickstarts a career rejuvenation as she goes from unattainable to relatable
2020/01/31 0:00:00,Vanessa Hudgens posts a series of swimsuit snaps after split from Austin Butler
2020/01/31 0:00:00,Missing Sydney baby found safe and taken to hospital
2020/01/31 0:00:00,John Millman scorches radio star over ‘lazy’ tennis smear
2020/01/31 0:00:00,Taylor Swift slams claims she skipped the Grammys because she wasn’t guaranteed a win
2020/01/31 0:00:00,Alexander Zverev's finals hopes crushed by classy Dominic Thiem
2020/01/31 0:00:00,Philadelphia 76ers lose to Atlanta Hawks as Ben Simmons and Trae Young go head-to-head
2020/01/31 0:00:00,Timeline shows how deadly coronavirus spread around the world
2020/01/31 0:00:00,Artist’s heritage-listed acreage retreat in Avalon for sale
2020/01/31 0:00:00,Bridget McKenzie’s empty chair and Scott Morrison’s empty suit: A week of the government dodging accountability
2020/01/31 0:00:00,‘I feel so ashamed’: Erin Barnett’s confession after 8kg weight loss
2020/01/31 0:00:00,Elton John forced to flee stage as flash storm hits concert in Yarra Valley
2020/01/31 0:00:00,Sydney property market: Chiswick apartment record set following huge sale of waterfront residence
2020/01/31 0:00:00,Sydney’s lower north shore posts bullish auction clearance rates
2020/01/31 0:00:00,Beacon Hill house is the second most viewed online nationwide
2020/01/31 0:00:00,Job ad’s description could be one of Australia’s craziest ones yet
2020/01/31 0:00:00,"Sport, stats and more live and in real time"
2020/01/31 0:00:00,Prince William and Prince Harry’s charity face off
2020/01/31 0:00:00,Shania Twain speaks about ‘twisted’ relationship with husband
2020/01/31 0:00:00,Deadline passes for US mother Lori Vallow to ‘produce’ missing kids to authorities
2020/01/31 0:00:00,Amazon founder Jeff Bezos makes billions as shares soar
2020/01/31 0:00:00,Crime scenes declared over Connor Horan’s death
2020/01/31 0:00:00,Measures to stop the spread of ‘pandemic’ coronavirus outbreak
2020/01/31 0:00:00,"You Got This: Mum, 45, boasts six-pack after completing 20-week challenge"
2020/01/31 0:00:00,The humble 5c coin’s days are numbered
2020/01/31 0:00:00,Extreme heatwave and thunderstorms hit south east
2020/01/31 0:00:00,First satellite images reveal Mallacoota bushfire devastation
2020/01/31 0:00:00,World’s richest man Jeff Bezos and his transformation from modest businessman
2020/01/31 0:00:00,Sisters In Law: Angry mum discovers son is ‘barely making minimum wage’ at busy pub job
2020/01/31 0:00:00,Why Princess Beatrice and her sister pose a growing problem for the Queen
2020/01/31 0:00:00,Tom Brady keeps the mystery alive with latest social media activity
2020/01/31 0:00:00,"Mean, green: Electric Hummer on the way"
2020/01/31 0:00:00,How Chinese government’s failed system allowed coronavirus to spread globally
2020/01/31 0:00:00,Scientists rush to find ‘Patient Zero’ in a bid to stop the coronavirus
2020/01/31 0:00:00,Coast’s first retiree vertical village The Rise at Wood Glen nearing completion
2020/01/31 0:00:00,Lewis Hamilton responds to F1 contract rumours
2020/01/31 0:00:00,Poo bandit caught on camera outside Sydney law firm pleads guilty
2020/01/31 0:00:00,"Research reveals Friday, January 31 is the most common date to resign"
2020/01/31 0:00:00,Australians warned not to travel to China amid virus outbreak
2020/01/31 0:00:00,5G an opportunity to turbocharge Australia’s smart cities
2020/01/31 0:00:00,CNN complains Donald Trump coronavirus taskforce ‘mostly white men’
2020/01/31 0:00:00,"Helium dating app allows users to talk to anyone without matching, but you need to watch what you say"
2020/01/31 0:00:00,"People are making coronavirus masks out of fruit, bras, water cooler bottles and even sanitary pads"
2020/01/31 0:00:00,Sydney’s hardest and easiest suburbs to be a buyer: family-friendly living trumps high-rise
2020/01/31 0:00:00,"Glee star Mark Salling’s ex opens up about his suicide, 2 years on"
2020/01/31 0:00:00,"Moment Margot Robbie made it, and it wasn’t Wolf of Wall Street"
2020/01/31 0:00:00,These habits can help multiply your frequent flyer points
2020/01/31 0:00:00,Rashid Khan was smashed last start with a new tactic. The Strikers won’t let it happen again
2020/01/31 0:00:00,Tonga coach Kristian Woolf opens door for Israel Folau selection
2020/01/31 0:00:00,Multimillion-dollar prize won by western Sydney lottery player still unclaimed
2020/01/31 0:00:00,World Health Organisation declares global emergency over coronavirus
2020/01/31 0:00:00,American quarantined after attempting to flee US military base during coronavirus lockdown
2020/01/31 0:00:00,Vegan model pleads to Queensland piggery raid
2020/01/31 0:00:00,Alex Hales defended his unusual fielding ploy. Ricky Ponting says he broke the rules
2020/01/31 0:00:00,Joe Hildebrand on Australia’s dirty little secret
2020/01/31 0:00:00,Donald Trump’s defence team puts forward stunning new argument in impeachment trial
2020/01/31 0:00:00,SuperCoach NRL: No Go Zone – players to avoid
2020/01/31 0:00:00,Woman finds handwritten note shaming her for eating meat stuffed in Coles ‘Wellness Bowl’
2020/01/31 0:00:00,‘Massive disaster’: Fears coronavirus could rapidly spread through Xinjiang concentration camps
2020/01/31 0:00:00,Spooky destinations: These are said to be the most cursed places in the world
2020/01/31 0:00:00,Brexit: What will actually change when the UK leaves the EU on January 31?
2020/01/31 0:00:00,"Wyong Hospital rejects donation from coal company due to ‘public sentiment’, health concerns"
2020/01/31 0:00:00,Pub gives out $20 vouchers as reward for not drink driving
2020/01/31 0:00:00,Possession of cannabis legal in Canberra from today
2020/01/31 0:00:00,You got this: Surfer reveals eight-week challenge behind lifestyle transformation
2020/01/31 0:00:00,Fringe World show cancelled after circus performer Anthony Tran falls 6m
2020/01/31 0:00:00,’We will defend this to the last breath’: Star Raiders recruit pleads not guilty to six charges
2020/01/31 0:00:00,ACT declares state of emergency as bushfire threat increases
2020/01/31 0:00:00,"Fotis Dulos, New York man charged with murdering wife, has died"
2020/01/31 0:00:00,Ex-76ers coach rages over Trae Young starting ahead of Ben Simmons
2020/01/31 0:00:00,"Damm family, of Damm Fine Food fame, lists pure Portsea pad"
2020/01/31 0:00:00,Bathurst 12 Hour Preview: World’s best cars set to do battle
2020/01/31 0:00:00,Meghan Markle ‘looking for a new agent’ as she plans ‘future projects’
2020/01/31 0:00:00,Hanging Monasteries of Meteora in Greece: Incredible destination that should be on your bucket list
2020/01/31 0:00:00,Magistrate lashes NRL star Tyrone May as he faces court over sex tapes scandal
2020/01/31 0:00:00,Queensland drivers to be fined $1000 for texting and driving
2020/01/31 0:00:00,Queen’s reign questioned amid her family’s ongoing legal drama
2020/01/31 0:00:00,Laurie Daley forecasts shock positional switch for Latrell Mitchell in All Stars clash
2020/01/31 0:00:00,Investors targeting Geelong city fringe act early to secure character home
2020/01/31 0:00:00,Comment: Jury still out on Ash Barty’s Grand Slam credentials
2020/01/31 0:00:00,Masterful prank on ‘most hated woman’
2020/01/31 0:00:00,Married At First Sight 2020: Show boss reacts to rumour production got too wild and was shut down
2020/01/31 0:00:00,Chance for first homebuyers to nab affordable land in the Hunter Valley
2020/01/31 0:00:00,Family’s Sydney home running on Powerwall costs them 46c per day
2020/01/31 0:00:00,Tennis commentators weigh in on Ash Barty’s response to losing in the Australian Open semi-finals
2020/01/31 0:00:00,The Co-op Bookshop brand’s days numbered after Booktopia sale
2020/01/31 0:00:00,Wagga gun Alyce Parker heading home with AFLW ‘family’ for Giants v Richmond
2020/01/31 0:00:00,Will & Grace star Megan Mullally claims she’s being ‘bullied’ at work
2020/01/31 0:00:00,"Airlines remove hot food, blankets, magazines and more amid coronavirus outbreak"
2020/01/31 0:00:00,Optus pays $500k fine after continually sending consumers spam texts and emails
2020/01/31 0:00:00,Couple kicked off flight over body odour now suing for discrimination
2020/01/31 0:00:00,Disturbing fire video shows fire turning ‘day to night’ in just three minutes
2020/01/31 0:00:00,‘We will admit them if they’re dying’: Wuhan hospitals running low on test kits and beds
2020/01/31 0:00:00,World’s sexiest athlete Alica Schmidt hits new heights
2020/01/31 0:00:00,Greta Thunberg’s legal move hits back at ‘impostors’
2020/01/31 0:00:00,"Today in history, January 31: Willem Jansz lands on Australian coast"
2020/01/31 0:00:00,Meant to be: Sofia Kenin follows in Anna Kournikova’s footsteps
2020/01/31 0:00:00,"Egyptian toyboy, 35, lifts lid on ‘passionate’ sex with pensioner"
2020/01/31 0:00:00,‘Cancel all flights’: Calls intensify for flight ban from China
2020/01/31 0:00:00,Firestorm erupts after cyclist’s comments about female reporter’s top
2020/01/31 0:00:00,Stikeez returning to Coles to encourage kids to eat more fresh produce
2020/01/31 0:00:00,Jessica Simpson reveals post-divorce fling with Justin Timberlake
2020/01/31 0:00:00,I’m a Celeb: Perez Hilton exposes Ryan Gallagher’s ‘mean’ side
2020/01/31 0:00:00,An LA love story: Highs and lows of Kobe and Vanessa Bryant’s marriage
2020/01/31 0:00:00,How Nauru squandered its staggering fortune and ended up bankrupt
2020/01/31 0:00:00,Wanted woman calls out police for using ‘trailer trash’ mugshot of her
2020/01/31 0:00:00,Woman loses 38kg in revenge body transformation
2020/01/31 0:00:00,Kmart launches new living range with products as little as $8
2020/01/31 0:00:00,Victorian kid comic absolutely roasts Simon Cowell on America’s Got Talent
2020/01/31 0:00:00,Racing host Francesca Cumani splits with partner Oli Bell
2020/01/31 0:00:00,ABC suspends correspondent over major mistake in Kobe Bryant crash report
2020/01/31 0:00:00,James Corden on Carpool Karaoke scandal: Is it worse than Cats?
2020/01/31 0:00:00,No shortage of ‘experts’ in real estate but most are off the mark
2020/01/31 0:00:00,West Coast midfielders set to dominate SuperCoach selections in 2020
2020/01/31 0:00:00,Qantas sending crew to Hong Kong in first step of Wuhan evacuation
2020/01/31 0:00:00,Prince Harry loses complaint against UK tabloid Mail on Sunday
2020/01/31 0:00:00,Queen and Prince Charles hold emergency meeting to discuss scandal-hit Prince Andrew
2020/01/31 0:00:00,Executive believes car industry has peaked
2020/01/31 0:00:00,"Ute carjacked in targeted attack by three males, suspects wore balaclavas, holding hand gun and hammer"
2020/01/31 0:00:00,"7000 cruise passengers, including Australians, still held on cruise ship amid coronavirus fears"
2020/01/31 0:00:00,Novak Djokovic confronts Margaret Court controversy
2020/01/31 0:00:00,RUSH HOUR: 'Insane' driver flees after being surrounded by police
2020/01/31 0:00:00,French Island Glamping property on auction block
2020/01/31 0:00:00,"Eye-watering cost of attending the 2020 Super Bowl in Miami, US"
2020/01/31 0:00:00,Meghan and Harry collab with Canadian telco on mental health campaign
2020/01/31 0:00:00,Girlfriend of Kobe Bryant’s helicopter pilot will ‘never be over’ his death
2020/01/31 0:00:00,Tigerair provides passenger details to health authorities over flight
2020/01/31 0:00:00,Jonathan Hernandez says NFL star brother told mum he was gay before his death
2020/01/31 0:00:00,Charming family living with the lot
2020/01/31 0:00:00,Cruise companies rechart itineraries and airlines cull freebies amid coronavirus panic
2020/01/31 0:00:00,Second Queensland coronavirus case takes national toll to nine
2020/01/31 0:00:00,"Northern beaches homeowners going hard and early, selling well"
2020/01/31 0:00:00,Hamilton Group mulls plans for Dimmeys building after buying Geelong Market Square Mall site
2020/01/31 0:00:00,Inner west rental prices in decline as vacancy rates reach record highs due to oversupply in stock
