date,title
2020/11/16 0:00:00,South Australia imposes new COVID-19 restrictions as 12 ‘critical’ hours begins
2020/11/16 0:00:00,List of Adelaide locations visited by members of coronavirus infected family continues to grow
2020/11/16 0:00:00,Tim Horan: Wallabies can’t afford to underestimate Argentina after All Blacks win
2020/11/16 0:00:00,F1 drivers slam ‘terrible’ conditions in chaotic Turkish Grand Prix
2020/11/16 0:00:00,"Lori Vallow now person of interest in husband’s death, child death investigation continues"
2020/11/16 0:00:00,SAS Australia: Olympic swimmer James Magnussen spills on drug-taking saga at London 2012
2020/11/16 0:00:00,Kmart $20 linen pants spark frenzy thanks to flattering style
2020/11/16 0:00:00,Fan backlash after reports Pete Evans ‘confirmed’ as star on I’m a Celebrity Get Me Out of Here 2021
2020/11/16 0:00:00,Love Island star Megan Barton Hanson reveals $1.5 million per month OnlyFans income
2020/11/16 0:00:00,"NSW Budget 2020: jobs, health, infrastructure – the big announcements"
2020/11/16 0:00:00,"Troop deal, energy top agenda as PM Scott Morrison travels to Japan"
2020/11/16 0:00:00,Chris Waller stable favourite to defy the odds in $1 million The Gong
2020/11/16 0:00:00,"What employers look for in resumes when hiring teenage, first-time workers for part-time jobs"
2020/11/16 0:00:00,Fox Sports presenter Yvonne Sampson slams ‘malicious’ rumours involving Cameron Smith
2020/11/16 0:00:00,Promise that `world-class’ tennis will return to Queensland in 2022
2020/11/16 0:00:00,Test captain Tim Paine is back in the Big Bash signing with Hobart Hurricanes
2020/11/16 0:00:00,"Christopher Peregi, accused of glassing Hilltop Hoods band member Daniel Smith, tells court: ‘it was a pure accident’"
2020/11/16 0:00:00,‘Get ahead of this madness’: Panic buyers rush to get toilet paper after SA virus explosion
2020/11/16 0:00:00,James Weir recaps SAS Australia 2020 episode 9 | Honey Badger’s harrowing run-in
2020/11/16 0:00:00,Healthy snack ideas for kids from A-Z
2020/11/16 0:00:00,South Australia imposes raft of new restrictions following virus outbreak
2020/11/16 0:00:00,Fresh Prince of Bel-Air reunion will stream in Australia on Stan
2020/11/16 0:00:00,South Australia’s Covid-19 cluster forces Queensland government to impose bans on Adelaide Lightning players’ families.
2020/11/16 0:00:00,Kurraba Point trophy site comes to market with $60m-$65m price guide
2020/11/16 0:00:00,"Surfing world mourns loss of Aussie star John Shimooka, found dead at 51"
2020/11/16 0:00:00,Grafton races: Trainer Matthew Dunn says it’s time for promising filly to step up
2020/11/16 0:00:00,Bonus points and substitutes to bring in X-factor players new rules for this year’s Big Bash
2020/11/16 0:00:00,Three more cases in SA as new restrictions come in to tackle outbreak
2020/11/16 0:00:00,Donald Trump mocked after falsely claiming election win on Twitter
2020/11/16 0:00:00,Army veteran Matthew Luke Cristea jailed after threatening police with weapons during siege
2020/11/16 0:00:00,Departing Nine Entertainment boss Hugh Marks on the move after leaving Balmoral Slopes rental
2020/11/16 0:00:00,Phil Gould’s brutal selection call Wayne Bennett must make for Maroons to win Origin decider
2020/11/16 0:00:00,"NBL: Brisbane Bullets forced to quarantine, sign American swingman Orlando Johnson"
2020/11/16 0:00:00,‘Disturbing’: Neighbours star Bonnie Anderson’s ex Matthew Arnautovic jailed
2020/11/16 0:00:00,Travellers ‘broke out in tears’: Inside flight from Adelaide to Perth turned around at airport
2020/11/16 0:00:00,ASX tech meltdown shuts markets on eight-month high
2020/11/16 0:00:00,KFC SuperCoach BBL champion Tom Aitken reveals his hints for BBL10
2020/11/16 0:00:00,Going local in Queensland
2020/11/16 0:00:00,Urgent COVID-19 alert issued for Coles and pizza bar
2020/11/16 0:00:00,Panthers star Brent Naden enters rehab after speaking to club
2020/11/16 0:00:00,Mass exodus at Adelaide Airport as borders shut
2020/11/16 0:00:00,‘Over 50 sharks’ spotted lurking at NSW beach between Moruya and Broulee
2020/11/16 0:00:00,WA Treasurer Ben Wyatt announces he is quitting politics
2020/11/16 0:00:00,Prince Harry’s deal with Netflix could cause further tensions with the royal family
2020/11/16 0:00:00,Prime Minister Scott Morrison take barre class after mispronunciation gaffe
2020/11/16 0:00:00,Gailo Chop ready for Railway Stakes test
2020/11/16 0:00:00,‘Belittled’: Ex-staffer of Minister Alan Tudge speaks out
2020/11/16 0:00:00,"US Election: Ivanka Trump, Jared Kushner face ‘difficult’ return to NYC"
2020/11/16 0:00:00,Motorbike rider’s ‘ignorant’ Bunnings park sparks social media debate
2020/11/16 0:00:00,Eight must-dos in Queensland’s beautiful backyard
2020/11/16 0:00:00,"More than one in 10 Aussies are struggling to pay their mortgage due to COVID, ABS study reveals"
2020/11/16 0:00:00,Palaszczuk predicts LNP will split after Qld election loss
2020/11/16 0:00:00,"The Philips Premium Air fryer XXL offers a hi-tech, healthy way to fry food"
2020/11/16 0:00:00,Mental health hits Australian economy by $200bn every year
2020/11/16 0:00:00,Jennifer Hawkins and Jake Wall reveal $3m plans for northern beaches home
2020/11/16 0:00:00,Australian cricket team agrees to barefoot stand against racism before Indian series
2020/11/16 0:00:00,Conservatives flee to Parler after Facebook‘s US election crackdown
2020/11/16 0:00:00,Unfinished business? Blues three-peat could see Freddy end 11-year NRL coaching hiatus
2020/11/16 0:00:00,Melbourne United captain Chris Goulding is desperate to play as the NBL continues to delay confirming the 2021 NBL season start
2020/11/16 0:00:00,Trainer Kerry Parker eyes boilover in $1 million The Gong
2020/11/16 0:00:00,Coronavirus Australia: How Adelaide’s outbreak started
2020/11/16 0:00:00,Odeon to have crucial jockey change for Ballarat Cup test
2020/11/16 0:00:00,‘Can’t disclose that yet’: Donald Trump’s lawyers claim to have ‘proof’ of Dominion voting machine rigging
2020/11/16 0:00:00,Unions protest against NSW wage cap for public servants
2020/11/16 0:00:00,Command’n’conquer set to join David Hayes in Hong Kong
2020/11/16 0:00:00,Victim of music teacher Malcolm Winston Day tells court she reported him to protect others from ‘monster’
2020/11/16 0:00:00,Miracle play stuns America after Arizona pulls off Hail Mary winner
2020/11/16 0:00:00,WA shut to SA after COVID-19 outbreak and Premier warns the hard border may return
2020/11/16 0:00:00,Victorians urged to get tested for STIs after drop in numbers raises concern
2020/11/16 0:00:00,Settlement in robodebt class action
2020/11/16 0:00:00,Melbourne house prices: ANZ reverses ‘pessimistic’ 2021 forecast
2020/11/16 0:00:00,Mother of 5yo allegedly beaten with stick denied bail as court hears abuse was ongoing
2020/11/16 0:00:00,Michael J. Fox reveals ‘tough’ toll his Parkinson’s battle has on his family
2020/11/16 0:00:00,Milan Ardalic: Driver sentenced over Liverpool bus smash
2020/11/16 0:00:00,The Daily Telegraph’s website has a brand new look and feel – here’s your guide to all the changes
2020/11/16 0:00:00,Woman charged with murder after Balga death
2020/11/16 0:00:00,Cameron Smith almost quit NRL over diamond ring furore
2020/11/16 0:00:00,Former Test coach Darren Lehmann calls for Joe Burns to be given selection nod ahead of Will Pucovski
2020/11/16 0:00:00,The Daily Telegraph’s digital editors answer your questions about our redesigned website
2020/11/16 0:00:00,Bega triumphs over Kraft in three-year peanut butter legal stoush
2020/11/16 0:00:00,Donald Trump to launch media outlet to fight ‘fake news’
2020/11/16 0:00:00,Ronal Eresto’s family reveal heartbreaking recovery in months after deadly Qld brawl
2020/11/16 0:00:00,Trump email deluge demanding cash for ‘slush fund’
2020/11/16 0:00:00,PM denies border battle has damaged Andrews relationship
2020/11/16 0:00:00,Ikea launches Christmas menu so you can have your ham and new bed frame too
2020/11/16 0:00:00,Woman charged with murdering her relative at a Perth home
2020/11/16 0:00:00,"New report reveals consumers are skipping meals to meet buy now, pay later payments"
2020/11/16 0:00:00,"‘Coming for Blacks, Indians’: Disturbing sign spotted at MAGA rally during Fox broadcast"
2020/11/16 0:00:00,"Nine CEO Hugh Marks handed potential $2 million bonus, days before controversy over his office relationship erupts"
2020/11/16 0:00:00,NSW Budget 2020 – Travel time to the new Sydney airport could be slashed
2020/11/16 0:00:00,Son of Aussie football legend dating American tennis star
2020/11/16 0:00:00,More Republicans abandon Donald Trump as he refuses to concede to Joe Biden
2020/11/16 0:00:00,"NSW Budget 2020: From free food to new trains, here’s what’s in it for you"
2020/11/16 0:00:00,Kylie Jenner posts revealing Instagram pictures in leather corset
2020/11/16 0:00:00,Tehan under pressure to make childcare tax deductible
2020/11/16 0:00:00,Huge offer rolls in for Sandown Guineas winner Allibor
2020/11/16 0:00:00,‘For the love of God’: Jonathan Swan sick of Donald Trump election meme
2020/11/16 0:00:00,ASX session abandoned after shut down due to market data tech glitch
2020/11/16 0:00:00,"NASA, JAXA astronauts head to International Space Station on SpaceX Crew Dragon"
2020/11/16 0:00:00,Dan Andrews says Victorian border with South Australia will remain open after outbreak
2020/11/16 0:00:00,Australian borders: More states close to South Australia as outbreak explodes
2020/11/16 0:00:00,Cameron Smith sets deadline for decision on NRL future
2020/11/16 0:00:00,"Goose falls in love, follows man‘s car down Nebraska road"
2020/11/16 0:00:00,Daniel Ricciardo crippled after clashing with teammate Esteban Ocon
2020/11/16 0:00:00,‘Echoes of Victoria’: SA could be forced to reconsider virus restrictions
2020/11/16 0:00:00,SAS Australia instructor Billy Billingham put Penelope Cruz in a headlock
2020/11/16 0:00:00,Kim Ravaillion slams Collingwood after Pies push Adam Treloar out
2020/11/16 0:00:00,Inside Russell Crowe’s turbulent love life
2020/11/16 0:00:00,New names for ‘racist’ Red Skins and Chicos lollies revealed
2020/11/16 0:00:00,"Nathan Buckley addresses Adam Treloar bombshells, reveals brutal toll of Collingwood crisis"
2020/11/16 0:00:00,New Zealand harness duo to pull the pin at the end of the year
2020/11/16 0:00:00,"US election: Will Ivanka, Don Jr, Eric Trump run for president in 2024?"
2020/11/16 0:00:00,Indonesia considers national ban on alcohol as controversial bill debated
2020/11/16 0:00:00,ALDI Special Buys brings back popular wine advent calendar for 2020
2020/11/16 0:00:00,18-storey portrait of Nicole Kidman unveiled in Sydney to promote TV series The Undoing
2020/11/16 0:00:00,The Crown viewers conflicted over Gillian Anderson’s portrayal of Margaret Thatcher
2020/11/16 0:00:00,NSW state budget: scholarship funds for Indigenous students
2020/11/16 0:00:00,Corning Gorilla Glass maker claims new Guardiant paint kills 99.9 per cent of coronavirus
2020/11/16 0:00:00,NSW will keep its borders open to South Australia despite latest outbreak
2020/11/16 0:00:00,Free beer for a year from Gage for one lucky drinker
2020/11/16 0:00:00,Horse goes full Steven Bradbury in racing farce after finishing seventh
2020/11/16 0:00:00,Barack Obama rips into Donald Trump for refusing to concede US presidential election
2020/11/16 0:00:00,Paul Walton admits to disgusting act to neighbour’s dog
2020/11/16 0:00:00,"Division one Lotto winners share how they won, ahead of Tuesday’s Oz Lotto $30 million jackpot"
2020/11/16 0:00:00,What we know about the Parafield COVID-19 cluster so far
2020/11/16 0:00:00,Bride’s ‘sexy’ butt grab in wedding picture sparks divide
2020/11/16 0:00:00,"Origin Scout: Legends back Brad Fittler’s rookie snub, calls for Maroons debutant to oust Valentine Holmes"
2020/11/16 0:00:00,Rebel Wilson’s trainer Jono Castano reveals workout secret
2020/11/16 0:00:00,Homicide squad investigating after Celeste Manno found dead at house in Melbourne
2020/11/16 0:00:00,Queensland Premier Annastacia Palaszczuk reveals border restriction to South Australia
2020/11/16 0:00:00,CCTV released of Sam Burgess in hours before he allegedly threatened ex-wife Phoebe’s father
2020/11/16 0:00:00,Prosecutors reject no case submissions in George Pell media contempt trial
2020/11/16 0:00:00,Qantas turns 100 in its most challenging year yet
2020/11/16 0:00:00,Joe Rogan blows up over Aussie boxing star’s Las Vegas robbery
2020/11/16 0:00:00,Police close Dromana Beach after suspicious explosives found
2020/11/16 0:00:00,"SA records new cases of locally acquired COVID-19, contact tracers try to prevent an outbreak"
2020/11/16 0:00:00,Reports Meghan and Harry to show private videos in Netflix documentary
2020/11/16 0:00:00,‘Buddy the rat’ rides New York City subway in viral TikTok
2020/11/16 0:00:00,Aussie tennis star makes adult website debut with reality TV star on OnlyFans
2020/11/16 0:00:00,MAFS star Jessika Power teases about joining OnlyFans in racy snap
2020/11/16 0:00:00,Channel 7 star Abbey Holmes and AFL player Keegan Brooksby engaged
2020/11/16 0:00:00,Cricket Australia unveil drastic rule changes for upcoming BBL tournament
2020/11/16 0:00:00,Fans stunned by Chris and Liam Hemsworth’s ageless mum Leonie at 60
2020/11/16 0:00:00,"Tens of thousands without power after hot, windy night"
2020/11/16 0:00:00,Boris Johnson self-isolating after contact with coronavirus-infected MP
2020/11/16 0:00:00,"Victoria records 17th day with no new coronavirus cases, no new deaths"
2020/11/16 0:00:00,"Mum bribes sons to do chores, homework without complaining with money reward board"
2020/11/16 0:00:00,War memorial restoration fund went overwhelmingly to Coalition seats
2020/11/16 0:00:00,McDonald’s employee reveals the secret to getting free food
2020/11/16 0:00:00,Karl grills Trade Minister Simon Birmingham over new deal with China
2020/11/16 0:00:00,Immigration Minister Alan Tudge apologises for affair with staffer on Facebook
2020/11/16 0:00:00,Cameron Smith will return to Augusta in April knowing he can win after a history-making Masters finish
2020/11/16 0:00:00,Footage of wild party at St Kilda and Black Rock beach
2020/11/16 0:00:00,Eric Abetz likens China to the rise of Nazi Germany
2020/11/16 0:00:00,Olivia Wilde takes to Instagram after news of split with Jason Sudeikis
2020/11/16 0:00:00,Dozens spotted partying at Maroubra Beach in major COVID breach
2020/11/16 0:00:00,Wine bundles to gift your favourite vino lover
2020/11/16 0:00:00,Margaret River: WA police and gunman in tense 11-hour standoff
2020/11/16 0:00:00,Health officials front parliamentary inquiry into Victoria’s COVID-19 contact tracing system
2020/11/16 0:00:00,Tougher restrictions in place for SA despite cases remaining at 17
2020/11/16 0:00:00,‘Scum’: Trump slams violent protests after ‘Million MAGA March’
2020/11/16 0:00:00,"Revealed: The real reason behind Smith, Cronk’s frosty feud"
2020/11/16 0:00:00,Donald Trump’s embarrassing slip up saying Joe Biden ‘won’ the US election
2020/11/16 0:00:00,How Scream star David Arquette almost died
2020/11/16 0:00:00,"Woman, 26, dies a week after gastric bypass surgery"
2020/11/16 0:00:00,R&B singer Jeremih’s ‘bleak’ coronavirus prognosis
2020/11/16 0:00:00,‘10 out of 10’: Paulina Gretzky’s daring Masters outfit as Dustin Johnson wins
2020/11/16 0:00:00,Melbourne to get $1.8 billion CSL vaccine factory to respond to future pandemics
2020/11/16 0:00:00,Brisbane and Sydney brace for heatwave as strong winds lash southern states
2020/11/16 0:00:00,‘Very troubling’: Three new community transmitted cases in South Australia
2020/11/16 0:00:00,Coronavirus LIVE:  South Australian Opposition Leader's dig at Victoria
2020/11/16 0:00:00,"Babysitter, 30, ‘squeezed baby girl, 1, to death until she felt her bones pop’"
2020/11/16 0:00:00,Police Lamborghini saves lives with speed
2020/11/16 0:00:00,"Meghan Markle, Prince Harry did not publicly wish Prince Charles a happy birthday"
2020/11/16 0:00:00,Toongabbie: Man dies after being stabbed in the chest multiple times
2020/11/16 0:00:00,Sebastian Vettel first person to congratulate Lewis Hamilton on seventh World Championship as tributes pour in
2020/11/16 0:00:00,Wedding snub behind Cameron Smith's feud with Storm teammate Cooper Cronk
2020/11/16 0:00:00,"US Masters: Dustin Johnson makes history, Cameron Smith is Augusta's unluckiest player"
2020/11/16 0:00:00,"Elyse Knowles on her battle with acne, new skin ambassador role"
2020/11/16 0:00:00,At home with State Opera South Australia singer Desiree Frahn
2020/11/16 0:00:00,Western Australia brings in hotel quarantine for South Australians after cluster outbreak
2020/11/16 0:00:00,Executive family living at its finest
2020/11/16 0:00:00,Belmont riverside address beats auction reserve by $136K
2020/11/16 0:00:00,"Apartment House, Toorak’s artful design and lush garden impress"
2020/11/16 0:00:00,Kemps Creek 2ha property near new Badgerys Creek airport sells $1.2m above reserve at auction
2020/11/16 0:00:00,Hawkesbury River home originally built by late stockbroker Rene Rivkin for sale with $12m guide
