date,title
2020/10/29 0:00:00,"Victoria on track to drop ring of steel, two of four new cases could be false positives"
2020/10/29 0:00:00,‘Lost for words’: Adelaide 500 canned by South Australian government
2020/10/29 0:00:00,"Second baby on the way for Jesinta, Buddy Franklin"
2020/10/29 0:00:00,"Rugby Confidential: All Blacks warn NRL Bulldogs, Steve Hansen off poaching"
2020/10/29 0:00:00,Mother and son jailed over six-kilogram meth sale in Melbourne
2020/10/29 0:00:00,Dustin Martin’s career-defining $3.5m phone call from 2013
2020/10/29 0:00:00,Chris Watts’ mistress Nichol Kessinger’s request two years after horror murder case
2020/10/29 0:00:00,"28,000 still owed $24 million in Centrelink robodebt refunds"
2020/10/29 0:00:00,"Three dead in Nice, France mass stabbing as ‘simultaneous’ attacks reported elsewhere"
2020/10/29 0:00:00,Ryan Papenhuyzen robbed of State of Origin debut after ‘ridiculous’ feat
2020/10/29 0:00:00,Surf Life Saving Queensland summer safety campaign targets men over 50
2020/10/29 0:00:00,There’s something wild going on with The Bachelorette finale
2020/10/29 0:00:00,Struggling mum receives packed meals from stranger
2020/10/29 0:00:00,Big Bash: Renegades add teenage Afghan spinner Noor Ahmad as international signing for BBL
2020/10/29 0:00:00,Australian skipper Aaron Finch brutally axed by Royal Challengers Bangalore
2020/10/29 0:00:00,A-League: Roar defend plan play home matches outside of Brisbane
2020/10/29 0:00:00,Fight to save sacred Indigenous trees hits Victorian court
2020/10/29 0:00:00,Senior diplomat warns China is the ‘challenge of our age’
2020/10/29 0:00:00,Golden Eagle 2020: Ratings expert backs Alligator Blood and Funstar to peak in Rosehill feature
2020/10/29 0:00:00,‘Read the facts’: Craig Kelly pushes anti-malaria drug
2020/10/29 0:00:00,How to carve the perfect pumpkin for Halloween
2020/10/29 0:00:00,Public transport services chief James Pinder sacked amid IBAC investigations
2020/10/29 0:00:00,Victoria Derby 2020: Runner-by-runner preview and tips
2020/10/29 0:00:00,Urgent covid alert for fortnight of F45 Leppington classes
2020/10/29 0:00:00,Is voter fraud a serious risk in the US election?
2020/10/29 0:00:00,Kyle Daniels: Court hears 8yo girl say swim instructor’s touch made her feel ’weird’ and ‘uncomfortable’
2020/10/29 0:00:00,Cops found guilty of Melbourne pensioner assault to appeal
2020/10/29 0:00:00,Cricket Australia anticipating $120 million in lost revenue this summer
2020/10/29 0:00:00,Elevated ‘Golden Mile’ home ticks all the boxes
2020/10/29 0:00:00,Footscray eco-friendly oasis has jungle of fruit trees and veggies
2020/10/29 0:00:00,‘Staggering level of deaths’: Russia readies for war in bloody Nagorno-Karabakh conflict
2020/10/29 0:00:00,SAS star Ali Oetjen surprises fans with great singing voice
2020/10/29 0:00:00,James Weir recaps The Bachelorette Australia 2020 episode 8 | Elly breaks down during brutal roasting
2020/10/29 0:00:00,AFL: A new 22-team second-tier competition for the eastern seaboard will replace the VFL in 2021
2020/10/29 0:00:00,Ben Cousins’ ex-partner says she feels like the one on trial
2020/10/29 0:00:00,"Australian sharemarket tumbles on northern hemisphere COVID, US election worries"
2020/10/29 0:00:00,There’s a shake up coming to the Ellen DeGeneres show
2020/10/29 0:00:00,Panic as two schoolgirls disappear from Sydney homes
2020/10/29 0:00:00,Financial abuse: ‘I’m still paying off his debt six years later’
2020/10/29 0:00:00,Melbourne cemetery workers make unsettling discovery
2020/10/29 0:00:00,BBL: Marnus Labuschagne has ‘point to prove’ at T20 level
2020/10/29 0:00:00,Uncapped prodigy set to be unleashed in one-day series against India
2020/10/29 0:00:00,Grill’d Burgers cheeky fast food ad featuring Donald Trump
2020/10/29 0:00:00,Katy Perry and Orlando Bloom post made-up voting song on Instagram
2020/10/29 0:00:00,Schools in Brisbane and Sydney evacuated after a series of emailed bomb threats
2020/10/29 0:00:00,Cricket: Former Test batsman Marcus Harris won’t let late start to summer hinder national ambitions
2020/10/29 0:00:00,New report reveals what drugs are most popular in every state
2020/10/29 0:00:00,Legal battle with ‘lying snake’ brother over parent’s invalid will
2020/10/29 0:00:00,Disturbing video: Police find children on the floor and in boot of a car during a routine patrol
2020/10/29 0:00:00,BLUES 17: Freddy settles on halves as injuries force reshuffle
2020/10/29 0:00:00,"How Australian airports, passports will change for future travel"
2020/10/29 0:00:00,Major ‘deal breaker’ of Facebook’s Oculus Quest 2 VR headset
2020/10/29 0:00:00,Daniel Andrews dodges questions about driving test backlog amid heated question time
2020/10/29 0:00:00,"Wagga, Moree races: Trainer Mick Smith torn between staying pair in 3200m test"
2020/10/29 0:00:00,Nissan Qashqai Midnight Edition review: New styling keeps ageing SUV fresh
2020/10/29 0:00:00,Woman’s hilarious response to   online order mistake shared on TikTok
2020/10/29 0:00:00,"Former footballer knew of mate’s heinous torture of young woman, court told"
2020/10/29 0:00:00,Huge clue suggests possible Donald Trump election victory despite polls favouring Biden win
2020/10/29 0:00:00,ANZ in huge profit plunge but ratings agency applauds bad loan provisioning move
2020/10/29 0:00:00,Four men found guilty of murdering Albanian man Urim Gjabri at Para Vista drug house in 2018
2020/10/29 0:00:00,Australia Post CEO Christine Holgate says PM had ‘no basis’ to stand her down
2020/10/29 0:00:00,Nadia Bokody: Why women stop wanting sex
2020/10/29 0:00:00,Michael Clarke’s ex wife Kyly Clarke flaunts ripped figure in bikini
2020/10/29 0:00:00,Fifty Stars shining for Cantala Stakes tilt
2020/10/29 0:00:00,How Melbourne Cup owner will spend Cup day
2020/10/29 0:00:00,NSW‘s worst beaches revealed in State of the Beaches survey
2020/10/29 0:00:00,English Channel migrant crisis: Toddler still missing after family drowns
2020/10/29 0:00:00,Cox Plate winning owners chase Golden Eagle glory
2020/10/29 0:00:00,Nine-time Grand Prix winner Mark Webber predicts Oscar Piastri can be racing in Formula One by 2023
2020/10/29 0:00:00,"Let’s Talk: Join Monash University Professor Jane Fisher, Lived Experience Australia founder Janne McMahon OAM and Maddie Sarre, from the Working Women’s Centre SA, for a live Q&A on women’s mental health"
2020/10/29 0:00:00,"Best denim shorts for curvy women: high-waisted, frayed, super-stretch"
2020/10/29 0:00:00,Hillary Clinton tweets in support of Chrissy Teigen following star’s pregnancy loss
2020/10/29 0:00:00,Celebrity vet Lisa Chimes and husband Natuzzi GM Bradley Nissen sell in Dover Heights
2020/10/29 0:00:00,"Poveglia Island, Italy: Inside world’s most haunted island | Photos"
2020/10/29 0:00:00,NRL backflips on decision to scrap pre-Origin national anthem
2020/10/29 0:00:00,Federal Labor MP Chris Hayes recovering in hospital after collapsing in parliament
2020/10/29 0:00:00,Firass Dirani has mocked the SAS instructors in a brutal Instagram video
2020/10/29 0:00:00,Multi million dollar payouts if Trump victorious
2020/10/29 0:00:00,The bitter feud at the centre of Qld election campaign
2020/10/29 0:00:00,Myer chair quits but biggest shareholder Solomon Lew wants entire board gone
2020/10/29 0:00:00,Grim find in drunk driver’s car after crash at Melbourne petrol station
2020/10/29 0:00:00,Foster son of Britain’s most sadistic mum opens up about horror childhood
2020/10/29 0:00:00,Eels set to offer former Titan  Bryce Cartwright career lifeline
2020/10/29 0:00:00,US Election 2020 Results: Live results state by state map in race to be President
2020/10/29 0:00:00,Serial pervert Sebastian McKay cried as court told he was bashed in custody and moved to protection prison
2020/10/29 0:00:00,NRL backflips on national anthem ban for State of Origin
2020/10/29 0:00:00,Disneyland fails caught on camera revealed
2020/10/29 0:00:00,"Fears Melbourne crowds, businesses flouting contact tracing rules could spark new cases"
2020/10/29 0:00:00,Khloe Kardashian reveals the extreme symptoms she had with COVID-19
2020/10/29 0:00:00,Why Joe Biden’s China approach could be bad news for Australia
2020/10/29 0:00:00,Charming Woolowin house looks like something out of a storybook
2020/10/29 0:00:00,Qld election 2020: Premier refuses to open borders to international students while infections rise overseas
2020/10/29 0:00:00,‘How to summon the police’: Man’s realistic Halloween decorations worry neighbours
2020/10/29 0:00:00,"Retailer behind iconic brands Katies, Rivers, Noni B to close 250 stores"
2020/10/29 0:00:00,Pro-choice: SA opposition spokesman hopes Libs can work through abortion bill differences without ‘personal attacks’
2020/10/29 0:00:00,Australia’s brand new $100 banknote enters circulation
2020/10/29 0:00:00,‘Embarrassment’: New York Times mocked after identity of ‘Anonymous’ Trump insider revealed
2020/10/29 0:00:00,New prestige listings in Mosman bucking seasonal sales trends
2020/10/29 0:00:00,Entertainment icon Kamahl sells Warrawee family home in six days
2020/10/29 0:00:00,Toorak Spanish-style mansion once home to Ian Dicker for sale
2020/10/29 0:00:00,Former Miss Universe Australia Erin McNaught calls Donald Trump a ‘crazy person’
2020/10/29 0:00:00,Sheffield Shield: Mitch Swepson excited to have chance to play against Nathan Lyon
2020/10/29 0:00:00,Loophole in metadata retention laws could leak Aussie data
2020/10/29 0:00:00,Why Michael Clarke’s girlfriend Pip Edwards didn’t like this portrait
2020/10/29 0:00:00,Cricket: Moises Henriques’ new approach earns call-up to the Australian ODI and T20 squad
2020/10/29 0:00:00,EX-AFL player Matthew Shir escapes conviction for assault on Rosie Jacobs
2020/10/29 0:00:00,"Qld election 2020: Pubs, clubs lobby chief health officer to ease restrictions ahead of border reopening"
2020/10/29 0:00:00,"Private investigator working for Adani followed, photographed activist’s 9-year-old daughter"
2020/10/29 0:00:00,Wild Ruler leads Snowdens’ Flemington assault
2020/10/29 0:00:00,Cristiano Ronaldo rages over ‘bulls***’ COVID-19 test
2020/10/29 0:00:00,Why a Joe Biden election win could make certain Australians very rich
2020/10/29 0:00:00,Coronavirus Australia: Australia bought 10 million doses of the Pfizer vaccine last week
2020/10/29 0:00:00,Coronavirus Victoria: ‘Significant announcements’ flagged for Sunday
2020/10/29 0:00:00,‘Hermit nation’: World’s astonishment at Australia’s response to COVID-19
2020/10/29 0:00:00,Coronavirus NSW: Child ‘likely acquired’ COVID-19 at trampoline park
2020/10/29 0:00:00,Coronavirus Australia: Hughesy slams ‘jammed’ Melbourne venues
2020/10/29 0:00:00,Tupperware’s sales skyrocket as more people stay home and cook
2020/10/29 0:00:00,Absurd quiz claims to reveal Trump or Biden voters based on their refrigerators
2020/10/29 0:00:00,"Double game weeks, weather radar and more: The 11 keys to KFC SuperCoach BBL success"
2020/10/29 0:00:00,Coronavirus Melbourne: Little Collins St bar slams selfish customers
2020/10/29 0:00:00,Trainer Bryce Stanaway allegedly threatened officials at Bendigo
2020/10/29 0:00:00,Interior designer Nina Skrzynski’s Darlinghurst Glasshouse with $3.5m guide a cut above the rest
2020/10/29 0:00:00,Ron Jeremy charged with 7 more counts of sexual assault
2020/10/29 0:00:00,"Alakiir Deng avoids jail for role in high-speed crash that killed Bor Mabil, sister of Socceroo Awer Mabil"
2020/10/29 0:00:00,Glen Boss supremely confident of Coolmore Stud Stakes triumph
2020/10/29 0:00:00,Composer of Bunnings Warehouse iconic jingle revealed
2020/10/29 0:00:00,Early US election results between Trump and Biden could be a ‘mirage’
2020/10/29 0:00:00,Ashley Graham opens up about sex after pregnancy
2020/10/29 0:00:00,YouTubers create ‘world’s worst Airbnb’ in North London | Photos
2020/10/29 0:00:00,North Sydney Boys High School evacuated after threat
2020/10/29 0:00:00,"Boy, 15, unconscious in hospital after fight between youths in Doncaster"
2020/10/29 0:00:00,Melbourne Cup 2020 barrier draw: Aidan O'Brien still has strong hand despite mixed fortunes for Tiger Moth and Anthony Van Dyck
2020/10/29 0:00:00,Daniel Andrews says other premiers cautious of Victorian border reopening despite falling infections
2020/10/29 0:00:00,Is your ex a narcissist or just not that into you?
2020/10/29 0:00:00,Essendon sacks football boss Dan Richardson after season from hell
2020/10/29 0:00:00,Chance to call a historic South Australian house that was once a police station home
2020/10/29 0:00:00,Sam Groth and Britt Groth’s Alphington home sale a smash hit
2020/10/29 0:00:00,Two-way travel with New Zealand ‘very close’
2020/10/29 0:00:00,US Election 2020: Border closure stops people ‘moving to Canada’ if Trump wins
2020/10/29 0:00:00,Qld election 2020: 10 things you don’t know about LNP leader Deb Frecklington
2020/10/29 0:00:00,"Hotel quarantine inquiry final report delayed, key documents still missing"
2020/10/29 0:00:00,SAS Australia: Jackie O reveals which star turned down an offer to be on the Channel 7 show
2020/10/29 0:00:00,Three Melbourne Cup aspirants will need to pass vet checks if they are to run
2020/10/29 0:00:00,Daniel Andrews hits out at Gladys Berejiklian’s comments about Victoria’s virus situation
2020/10/29 0:00:00,US dad charged with murder of two sons faces execution
2020/10/29 0:00:00,Firefighter Andrew Dadley gets bail after being jailed for rape
2020/10/29 0:00:00,NBA WAG Olivia Harlan-Dekker fires back at J.R. Smith over accusation
2020/10/29 0:00:00,The Bachelorette Australia 2020: James Boggia reflects on explosive display
2020/10/29 0:00:00,Avoid tax fines before October 31 deadline and get your $1080 tax cut
2020/10/29 0:00:00,The Advertiser’s website has a brand new look and feel – here’s your guide to all the changes
2020/10/29 0:00:00,QLD election 2020 live updates: Deb Frecklington goes toe-to-toe with volunteer
2020/10/29 0:00:00,NRL: Former All Blacks coach Steve Hansen won’t accept ’airy-fairy’ culture at Bulldogs
2020/10/29 0:00:00,O’Shea targets Rosehill Gold Cup with new import
2020/10/29 0:00:00,Where you can vote in the Queensland election
2020/10/29 0:00:00,Embarrassing truth behind Meghan Markle and Prince Harry’s wedding photos
2020/10/29 0:00:00,World’s fastest man Christian Coleman exposed by receipts before Tokyo Olympics ban
2020/10/29 0:00:00,"Truck driver who spread Chadstone coronavirus cluster to Kilmore, Shepparton fined"
2020/10/29 0:00:00,Small businesses unable to contact telcos’ overseas call centres fuels complaint surge
2020/10/29 0:00:00,"Port Adelaide confirms Orazio Fantasia move, Essendon compensation for Joe Daniher"
2020/10/29 0:00:00,Qld election 2020: Manure dumped outside parliament two days before poll
2020/10/29 0:00:00,Maserati Ghibli Hybrid review: Mild hybrid isn’t about saving fuel
2020/10/29 0:00:00,"Black Lives Matter protests, Philadelphia: Looter takes washing machine from store"
2020/10/29 0:00:00,"Anonymous revealed: Miles Taylor identifies himself as Trump official behind explosive op-ed, book"
2020/10/29 0:00:00,Global human rights group slams Western Australia’s hard border
2020/10/29 0:00:00,Women strip searched at Qatar Airport in ‘grossly disturbing’ incident after baby found in bin
2020/10/29 0:00:00,France and Germany locked down amid coronavirus chaos in Europe
2020/10/29 0:00:00,$8 million Powerball jackpot winning numbers: Draw 1276
2020/10/29 0:00:00,Bull on the loose after it escapes Saint Ignatius’ College Riverview
2020/10/29 0:00:00,"Dandenong Family Court listed for sale, could be redeveloped"
2020/10/29 0:00:00,Four new local cases of COVID-19 diagnosed in NSW
2020/10/29 0:00:00,Hidden detail featuring Nicole Kidman in The Undoing opening credits
2020/10/29 0:00:00,Brad Pitt and girlfriend Nicole Poturalski break up
2020/10/29 0:00:00,Runner-by-Runner wet track  assessment for Golden Eagle
2020/10/29 0:00:00,Qantas announces new ‘flight to somewhere’ and stay for $2500
2020/10/29 0:00:00,What is Australia’s favourite soft drink?
2020/10/29 0:00:00,Smallville actress Alaina Huffman says Allison Mack invited her to NXIVM
2020/10/29 0:00:00,"State of Origin teams for Game 1 revealed: Cody Walker snubbed, Jake Friend wins Maroons battle"
2020/10/29 0:00:00,Woman will stand trial for alleged cold case murder of own mother
2020/10/29 0:00:00,Teen ‘too scared’ to reveal pregnancy gives birth in secret then puts baby in freezer
2020/10/29 0:00:00,Food recall: Bounce protein ball cashew caramel may contain plastic
2020/10/29 0:00:00,CCTV footage of baby found dumped in bin at Doha Airport
2020/10/29 0:00:00,"Man charged for allegedly punching, pushing police onto road in drug-fuelled assault"
2020/10/29 0:00:00,"iPhone repairman finds $100 bill, note from cheating husband"
2020/10/29 0:00:00,SAS Australia: Firass Dirani calls Shannan Ponton a ‘redneck’
2020/10/29 0:00:00,Steph Claire Smith announces pregnancy on Instagram post
2020/10/29 0:00:00,Victoria records three new coronavirus cases
2020/10/29 0:00:00,Costco pulling products allegedly made with forced monkey labour
2020/10/29 0:00:00,‘Thanks for nothing’: Daniel Andrews’ post sparks backlash
2020/10/29 0:00:00,Why Melbourne could wind up back in lockdown
2020/10/29 0:00:00,Shane Warne smacks Marlon Samuels after his ugly social media WAG slur
2020/10/29 0:00:00,Cameron Smith makes another chapter of NRL folklore with grand final injury secret
2020/10/29 0:00:00,"Part of George Street, Parramatta closed as police operation unfolds"
2020/10/29 0:00:00,"Southeast Qld, northern NSW hit by storms second day as BOM warns there’s more to come"
2020/10/29 0:00:00,‘Remarkable’ Cameron Smith played Grand Final with brutal secret injuries
2020/10/29 0:00:00,"Ben Cousins ‘totally out of control’, ex-partner tells court"
2020/10/29 0:00:00,Inside Kim Kardashian-West’s 40th birthday party on a private island in Tahiti
2020/10/29 0:00:00,Dominic West’s wife calls family crisis talks
2020/10/29 0:00:00,Police officer killed by rooster at illegal cockfight
2020/10/29 0:00:00,Man crashes into ‘ring of steel’ coronavirus checkpoint in Melbourne
2020/10/29 0:00:00,‘Someone got it wrong’: Brad Fittler takes aim at Tigers over Ryan Papenhuyzen axing
2020/10/29 0:00:00,$1.6 billion sale of NBA’s Utah Jazz is insane for many reasons
2020/10/29 0:00:00,Meghan Markle launches 11th-hour bid to delay High Court privacy battle to prevent giving evidence
2020/10/29 0:00:00,Central Coast: Murder charge laid over alleged stabbing death of Corey Breceljnik
2020/10/29 0:00:00,"KFC SuperCoach BBL basics: How to sign up, choose your team and battle your mates during BBL10"
2020/10/29 0:00:00,Kiss frontman Gene Simmons lists his long time rock star estate with water slide and 35-car garage
2020/10/29 0:00:00,"Bledisloe Cup: Wallabies team for match three, Noah Lolesio to play at five-eighth"
2020/10/29 0:00:00,Tennis star rocked by baby bombshell as ex-girlfriend reveals pregnancy
2020/10/29 0:00:00,Paige VanZant has a line on how far she’ll go with saucy snaps
2020/10/29 0:00:00,The Block viewers turn on guest judge Bec Judd
2020/10/29 0:00:00,"Luxury living in an idyllic setting, a ‘joy’"
2020/10/29 0:00:00,Ryrie Home: Young buyers flock to coastal city living
2020/10/29 0:00:00,Aldi Supermarkets to sell Auburn store site to developers with $15m price expectations
2020/10/29 0:00:00,Coronavirus real estate: SA buyer grabs Geelong West home in video deal
2020/10/29 0:00:00,"Alexandria converted warehouse breaks suburb record ahead of auction by $600,000"
2020/10/29 0:00:00,This restored and updated Sandy Bay home has few peers
2020/10/29 0:00:00,"Regional Victorian rents have largest jumps, led by Benalla"
