date,title
2020/03/06 0:00:00,Kim Kardashian attempts intervention in execution of man convicted in killing of three police
2020/03/06 0:00:00,Herald Sun team takes out top sports gong
2020/03/06 0:00:00,Australia’s most popular suburbs: Newtown and Collaroy top house and unit buyer preferences
2020/03/06 0:00:00,South By Southwest festival cancelled because of coronavirus fears
2020/03/06 0:00:00,Italian media declares Formula One war over Ferrari settlement with FIA
2020/03/06 0:00:00,‘Abhorrent’: Man who raped two-year-old girl jailed for 13 years
2020/03/06 0:00:00,There’s a catch that comes with having the world’s most powerful passport
2020/03/06 0:00:00,‘Co-existence’: Study claims patients may have had two types of coronavirus
2020/03/06 0:00:00,Bidet surge sparks warning over cheap imports as toilet paper shortage boosts enquiries
2020/03/06 0:00:00,Super Rugby 2020: Queensland Reds push champions Crusaders but dire kicking game proves costly
2020/03/06 0:00:00,Steph Curry’s behind the back pass on NBA return against Toronto Raptors
2020/03/06 0:00:00,Inmate’s bizarre choice of meal before execution
2020/03/06 0:00:00,Miracle Mile 2020: AG White Socks back in fast lane after mighty resurrection
2020/03/06 0:00:00,Billy Connolly quitting stand-up due to worsening Parkinson’s disease
2020/03/06 0:00:00,Coles and Woolworths see major online delivery delays due to coronavirus stockpiling
2020/03/06 0:00:00,"Anchorage, Alaska: America’s weird, wonderful, worst-dressed city"
2020/03/06 0:00:00,John Millman musters ‘all-time great comeback’ in Davis Cup thriller
2020/03/06 0:00:00,"Sixth teenager charged over attack on Matthew Henson, 20, at Stirling train station"
2020/03/06 0:00:00,Radio host’s shoe shopping trick becomes viral sensation
2020/03/06 0:00:00,Claudia Karvan discusses growing up with nightclub owner ‘punk’ parents on DWTS
2020/03/06 0:00:00,"SA’s new coronavirus clinic up and running, four people currently in hospital with the virus"
2020/03/06 0:00:00,Falling prices in regional areas are creating a growing real estate divide
2020/03/06 0:00:00,Auctioneer Damien Cooley auctions off a 24-pack of Kleenex
2020/03/06 0:00:00,Syrian table tennis star Hend Zaza to be the fifth youngest competitor in Olympic history
2020/03/06 0:00:00,Family accidentally buys 2300 rolls of toilet paper
2020/03/06 0:00:00,Coronavirus: how a COVID-19 outbreak in Australia could impact the property market
2020/03/06 0:00:00,UFC 251 Perth: Alexander Volkanovski cleared for title defence
2020/03/06 0:00:00,Woman’s ultimate revenge on ‘cheap’ date
2020/03/06 0:00:00,Baulkham Hills: Home on rare 297 sqm block sells at auction
2020/03/06 0:00:00,$1 million on offer in quest to find Australia’s best footy tipster
2020/03/06 0:00:00,Meghan and Harry’s farewell tour highlights major headache for royal family
2020/03/06 0:00:00,"Australia needs immigration ‘more now than ever before’ to offset coronavirus impact, expert says"
2020/03/06 0:00:00,Demi Lovato has spoken out about her ‘controlling’ former management team
2020/03/06 0:00:00,The cost of renting property on the rise across greater Adelaide
2020/03/06 0:00:00,Professional eating superstar Joey Chestnut slams 32 Big Macs in 38 minutes
2020/03/06 0:00:00,‘We love Double Bay’: Home of OVATO chief operating officer James Hannan hits market
2020/03/06 0:00:00,James Weir: Celebrity faces of The Great Toilet Paper Shortage of 2020
2020/03/06 0:00:00,Fiona McIntyre crowned Lady of Racing 2020 for retraining and rehoming retired racehorses
2020/03/06 0:00:00,Sam Clench: Donald Trump’s effort to sow discord in the Democratic Party is painfully obvious – and brilliant
2020/03/06 0:00:00,The truth behind the coronavirus spreading
2020/03/06 0:00:00,Mayor who called off wedding hours after engagement says it’s been a ‘rough week’
2020/03/06 0:00:00,Ex-tropical cyclone Esther leaves ‘500km rain band’ across Australia’s east coast
2020/03/06 0:00:00,Ben Affleck elevates humdrum sports movie The Way Back
2020/03/06 0:00:00,‘Morally blameworthy’: Man who waited days to get help after wife was bashed loses appeal
2020/03/06 0:00:00,Huge level site 180m from Manly Beach for sale – investors needed
2020/03/06 0:00:00,Mayor who called off wedding days after engagement says it’s been a ‘rough week’
2020/03/06 0:00:00,US college student was ‘insane’ when he fatally attacked a couple
2020/03/06 0:00:00,Orlando Bloom and Katy Perry have reportedly postponed their wedding amid coronavirus panic
2020/03/06 0:00:00,‘We won’t see Meeky grow up’: Tearful farewell for three-year-old boy found dead on Cairns bus
2020/03/06 0:00:00,"UFC 248: ‘If he dies, he dies’ Israel Adesanya’s threat to Yoel Romero"
2020/03/06 0:00:00,Todman Stakes: Farnan favourite for Golden Slipper after Randwick win
2020/03/06 0:00:00,UK supermarkets prepare for ‘food riots’
2020/03/06 0:00:00,Misleading photo that contributed mass panic buying over coronavirus
2020/03/06 0:00:00,Iconic community art event Sculpture by the Sea opens at Cottesloe Beach
2020/03/06 0:00:00,"Today in history, March 15: First escalator patented"
2020/03/06 0:00:00,"Today in history, March 14: Jack Ruby found guilty of murdering JFK assassin"
2020/03/06 0:00:00,Steven Spielberg’s Amazing Stories returns with Apple TV+ revival
2020/03/06 0:00:00,Now THAT’S how you do it: Why AFL season ad is simply the best
2020/03/06 0:00:00,SuperCoach Racing returns this weekend and we’ve got the complete guide to choosing your stable ahead of Round 1
2020/03/06 0:00:00,‘Misunderstood’ Pussycat Dolls hit back: ‘I thought we were beyond this’
2020/03/06 0:00:00,"Children are just as likely to be infected by the coronavirus, study suggests"
2020/03/06 0:00:00,Gig of the week: Laura Marling brings the noise to Sydney
2020/03/06 0:00:00,The Daily Telegraph NRL Podcast episode 1
2020/03/06 0:00:00,‘Jaw dropping’: This Rose Bay resort-style home is a Sydney house like no other
2020/03/06 0:00:00,"Sad downfall of footballer Ronaldinho, the $137m star who had it all"
2020/03/06 0:00:00,Renowned composer diagnosed with the coronavirus
2020/03/06 0:00:00,Tenant’s request sparks debate over decorating rules
2020/03/06 0:00:00,A man who filmed himself licking ice cream has been jailed
2020/03/06 0:00:00,Catalans’ show of goodwill amid Israel Folau rainbow flag controversy
2020/03/06 0:00:00,Coronavirus wreaks havoc on the sporting world
2020/03/06 0:00:00,Restaurant criticised for honouring customer’s racist request
2020/03/06 0:00:00,Bob Hawke’s former chief of staff Christopher Conybeare sells in Cremorne Point
2020/03/06 0:00:00,Sheik Mohammed bin Rashid Al Maktoum guilty of ‘intimidating and frightening’ wife
2020/03/06 0:00:00,Queensland nurse loses 50kg after feeling ashamed for giving patients health advice
2020/03/06 0:00:00,How to find yourself the best Samsung Galaxy S20 plans
2020/03/06 0:00:00,Dallas Mavericks players make football superstar look like an infant
2020/03/06 0:00:00,Viewers shocked by the Pussycat Dolls’ ‘inappropriate’ performance on Sunrise
2020/03/06 0:00:00,Richmond former boarding house brings Hungarian flair to market
2020/03/06 0:00:00,Government’s plan to restrict porn in Australia
2020/03/06 0:00:00,Developer Bill Gertos sells Ashbury home at the centre of bizarre squatter’s rights case
2020/03/06 0:00:00,Newborn baby boy found dead in woodland in Hampshire as police launch investigation
2020/03/06 0:00:00,Port Adelaide great Kane Cornes says Ben Brown should be insulted by North Melbourne’s offer
2020/03/06 0:00:00,Coronavirus: How the outbreak will have a multi-billion impact on the travel industry alone
2020/03/06 0:00:00,Female prison worker arrested over alleged relationship with inmate
2020/03/06 0:00:00,Dubai royals’ private nightmare exposed after judge’s landmark ruling
2020/03/06 0:00:00,Prime Minister strikes deal with states on coronavirus
2020/03/06 0:00:00,Twitter fans of all 18 AFL clubs gave us the insight into rookies and breakout contenders of their club for you to consider in your KFC SuperCoach team
2020/03/06 0:00:00,Surprised reaction after AFLW captain labels Dustin Martin the GOAT
2020/03/06 0:00:00,Sonny Bill Williams’ Wolfpack cop almighty hiding from Leeds
2020/03/06 0:00:00,Starbucks bans BYO cups in US stores to prevent virus spread
2020/03/06 0:00:00,KFC SuperCoach NRL 2020: Phil ‘Buzz’ Rothfield’s team revealed
2020/03/06 0:00:00,South Carolina mum names snake for it penis scale pattern
2020/03/06 0:00:00,Mary Kay blames ‘market conditions’ for closing Australian operation
2020/03/06 0:00:00,Ex-Google engineer accused of stealing trade secrets files for bankruptcy
2020/03/06 0:00:00,‘Likely human-to-animal transmission’: Hong Kong woman’s pet dog has ‘low-level’ coronavirus infection
2020/03/06 0:00:00,Donald Trump casually suggests the World Health Organisation’s official coronavirus death rate is a ‘false number’
2020/03/06 0:00:00,Inside the special bond between Prince Harry and the Queen
2020/03/06 0:00:00,Glenbrook trophy sale sets new suburb price record
2020/03/06 0:00:00,Viral photo reveals ‘heartbreaking’ cost of toilet paper shortage
2020/03/06 0:00:00,Dangerous ‘knockout’ bottles used to put babies to sleep slammed
2020/03/06 0:00:00,"Violist Brett Dean, who was due to play at this year’s Adelaide Festival, has coronavirus"
2020/03/06 0:00:00,Multiple Vodafone outlets close in Perth following fears of coronavirus exposure
2020/03/06 0:00:00,Cameron Smith could opt to extend his Storm career into a 20th season
2020/03/06 0:00:00,Victorian woman’s emotional support dog barred from doctor’s waiting room after complaints
2020/03/06 0:00:00,Fears of a global pandemic escalate as virus hits India
2020/03/06 0:00:00,Reason why we can’t stop touching our faces
2020/03/06 0:00:00,Cameron Smith rejects claims NRL’s new ad isn’t inclusive
2020/03/06 0:00:00,How the test for coronavirus works
2020/03/06 0:00:00,KFC SuperCoach NRL Draft Ultimate Guide 2020: Everything you need to know
2020/03/06 0:00:00,Your coronavirus quarantine survival shopping list
2020/03/06 0:00:00,Prince Harry says he will “always” serve the Queen in emotional speech
2020/03/06 0:00:00,Daniel Ricciardo weighs in on F1 uncertainty over coronavirus concerns
2020/03/06 0:00:00,The eight tips and tricks which can make or break your KFC SuperCoach season
2020/03/06 0:00:00,‘It’s going to get more people’: Fears Australia will get more cases as Sydney becomes epicentre
2020/03/06 0:00:00,Aussie share market suffers heavy losses yet again
2020/03/06 0:00:00,Jackie O’s mum says she’ll ‘never forgive’ the radio star for MAFS prank
2020/03/06 0:00:00,Police launch investigation after a newborn baby boy was found dead
2020/03/06 0:00:00,Brodie Smith and Tom Rockliff headline season 2 of The Advertiser’s AFL podcast ‘The Lowdown’ this season
2020/03/06 0:00:00,Report reveals where Geelong’s favourite housing estates are amid rise in sales and lot supply
2020/03/06 0:00:00,Victorian pets in rentals law could save pets from shelters: RSPCA
2020/03/06 0:00:00,Karolina Kowalkiewicz’s UFC career in doubt after shocking injury
2020/03/06 0:00:00,"Murdered woman, 24, found ‘partially naked’ in a motel room"
2020/03/06 0:00:00,"Former Anglican priest, 81, moves to Romania with model husband, 27, paying for his partying lifestyle"
2020/03/06 0:00:00,Coronavirus fears take hold of Davis Cup press conference in Italy
2020/03/06 0:00:00,Aldi has just released a $20 anti-snoring device designed to put an end to the noisy problem
2020/03/06 0:00:00,Katie Hopkins slams Meghan Markle in shocking live TV rant
2020/03/06 0:00:00,Darius Boyd reveals the ‘light bulb’ moment he knew his time in the NRL was up
2020/03/06 0:00:00,Flybe stewardess breaks down in tears after airline announces collapse via email
2020/03/06 0:00:00,Floyd Mayweather’s insane $911m demand to fight Conor Mcgregor and Khabib Nurmagomedov in epic crossover double bout
2020/03/06 0:00:00,Carlton North auction: 1960s unit block soars to $6m in three bids
2020/03/06 0:00:00,Football legend Ronaldinho in court over fake passport drama
2020/03/06 0:00:00,Mum claims dieting and going to the gym are ‘useless’
2020/03/06 0:00:00,‘Pull out all the stops’: World Health Organisation makes coronavirus plea
2020/03/06 0:00:00,Sophie Monk reacts to people panic buying toilet paper
2020/03/06 0:00:00,"Today in history, March 6: First pre-packaged frozen food sold"
2020/03/06 0:00:00,NRL star Darius Boyd announces retirement
2020/03/06 0:00:00,How two Melbourne mates turned their side hustle into a global electronics business
2020/03/06 0:00:00,Mercedes announces game-changing customer guarantee
2020/03/06 0:00:00,Todd Greenberg’s future as NRL boss beyond 2020 uncertain
2020/03/06 0:00:00,‘Recovered’ coronavirus patient dies in China
2020/03/06 0:00:00,Simple savings tricks to balancing the budget and saving money
2020/03/06 0:00:00,Australian UFC star Alex Volkanovski says he would ‘crumble’ Conor McGregor
2020/03/06 0:00:00,FIA responds after rivals protest against Ferrari decision
2020/03/06 0:00:00,William Shatner gets horse semen in divorce settlement
2020/03/06 0:00:00,Prince Harry and Meghan Markle attend one of their final events as senior royals
2020/03/06 0:00:00,Cricket world outraged over T20 World Cup ‘shambles’
2020/03/06 0:00:00,‘Not a square to spare’: World responds to Australia’s toilet paper panic
2020/03/06 0:00:00,Jeep betting ‘flying doctors’ will help rebuild its reputation
2020/03/06 0:00:00,SuperCoach Racing: The Round One stable the bookies would pick
2020/03/06 0:00:00,Good Friday Appeal volunteers thanked at 2020 fundraising launch
2020/03/06 0:00:00,Swiss miss: The best cars that were supposed to be at Geneva motor show
2020/03/06 0:00:00,RUSH HOUR: Health official licks finger during virus warning
2020/03/06 0:00:00,Convicted rapist Harvey Weinstein finally moved to prison
2020/03/06 0:00:00,Republican Aaron Schock comes out as gay after anti-gay history of voting in Congress
2020/03/06 0:00:00,"Dubai ruler sheik Mohammed bin Rashid al-Maktoum ordered daughters be abducted, court rules"
2020/03/06 0:00:00,Joe Biden brags about surging past Bernie Sanders on Super Tuesday
2020/03/06 0:00:00,Britney Spears takes to social media after son Jayden’s Instagram Live video
2020/03/06 0:00:00,"Netflix to make Roald Dahl animations, taps Taika Waititi"
2020/03/06 0:00:00,The average age of a first-home buyer in metropolitan Adelaide
2020/03/06 0:00:00,Property with pieces from the set of Mad Max Beyond Thunderdome listed on NSW north coast
2020/03/06 0:00:00,Rise of the $10m northern beaches home
2020/03/06 0:00:00,Selling like toilet paper: Sydney property is rolling out the door
2020/03/06 0:00:00,World’s priciest homes: How Australian house prices compare to the rest of the world
2020/03/06 0:00:00,Greenwich: landmark home owned by artist Melissa McElhone up for sale
2020/03/06 0:00:00,Albert Park house with tower: Local landmark for sale
2020/03/06 0:00:00,Rare chance to by waterfront property in Howrah
