date,title
2020/01/15 0:00:00,Australian Open 2020: Everything you need to know ahead of the year’s first tennis major
2020/01/15 0:00:00,Aussie NBA star Joe Ingles’ most brutal piece of trash talk has been revealed
2020/01/15 0:00:00,Prince Harry and Meghan quietly delete claim from Sussex Royal website
2020/01/15 0:00:00,Socialite given suspended sentence after thieving from nana with dementia
2020/01/15 0:00:00,Boss receives death threats after video shows worker downing alcohol
2020/01/15 0:00:00,Father and son thought missing between Victoria and Townsville found safe and well
2020/01/15 0:00:00,Details of Prince Harry and Meghan Markle’s ‘Megxit’ from royal family revealed
2020/01/15 0:00:00,Aldi Special Buys: $90 ‘insomnia cure’ set to hit supermarket shelves
2020/01/15 0:00:00,Wollemi pines known as ‘dinosaur trees’ saved from NSW bushfires thanks to a secret firefighting mission
2020/01/15 0:00:00,The time has come for a measured discussion on climate change in the wake of Australia’s bushfire crisis
2020/01/15 0:00:00,"A woman patient at the WCH has tuberculosis, sparking a health alert"
2020/01/15 0:00:00,World’s top tennis stars rally for bushfire relief
2020/01/15 0:00:00,"Model, blocked by Lionel Messi for her social media snaps, gets mroe ink of the football superstar"
2020/01/15 0:00:00,"Two people treated for smoke inhalation, two pet cats died in house fire at Adelaide's north"
2020/01/15 0:00:00,Steve Price issues grovelling apology to Jacinda Ardern: ‘What I said was dumb’
2020/01/15 0:00:00,Fears of contaminated fish as ash washes into state’s waterways
2020/01/15 0:00:00,Pat Cummins and Marnus Labuschagne honoured at 2019 ICC Awards
2020/01/15 0:00:00,Stephen A. Smith’s Lakers/Suns trade proposal gets roasted by fans
2020/01/15 0:00:00,"Baby critical after allegedly being left in hot Melbourne car, mother charged with endangering life"
2020/01/15 0:00:00,Miguel says Amanda Keller ‘probably won’t even go’ to the Logies this year
2020/01/15 0:00:00,Perth to Melbourne Qantas flight diverted to Adelaide during storm
2020/01/15 0:00:00,Police pull over car after people see girl holding ’scary’ sign
2020/01/15 0:00:00,NSW bushfires: How you can help all those in need
2020/01/15 0:00:00,Melbourne Renegades secure first victory of BBL09
2020/01/15 0:00:00,AFL nominates best of best for State of Origin bushfire relief match
2020/01/15 0:00:00,NBA Briefs: Giannis dismantles Knicks in 21 minutes; Jingles lights up Brooklyn
2020/01/15 0:00:00,"Raceday focus: Best bets, inside mail for Gosford"
2020/01/15 0:00:00,Andy Murray trolls mother after Instagram gaffe
2020/01/15 0:00:00,Housing shortage looming: new building projects drop to lowest level in five years
2020/01/15 0:00:00,All-Star Mile: Setback for Mystic Journey with soft tissue injury
2020/01/15 0:00:00,Ultimate Guide to UFC 246: Conor McGregor attempts to get MMA career back on track
2020/01/15 0:00:00,Car crashes down embankment after driver hits accelerator
2020/01/15 0:00:00,Te Akau Shark to follow the same Group 1 Sydney autumn path taken by Winx
2020/01/15 0:00:00,Air quality ‘very poor’ as smoke haze chokes Melbourne for third day straight
2020/01/15 0:00:00,Instagram model Veronica Zinger’s roadside drugs bust
2020/01/15 0:00:00,"UFC 246: Conor McGregor vs Donald Cowboy Cerrone, Mystic Mac’s greatest challenge"
2020/01/15 0:00:00,A healthy outlook predicted for the ACT property market
2020/01/15 0:00:00,"Georgia Love’s fiance, Lee Elliott, lashes out at Dean Wells following DWTS announcement"
2020/01/15 0:00:00,"‘Swift, devastating, irreparable’:  The human cost of online witch hunts"
2020/01/15 0:00:00,Carolina Panthers linebacker Luke Kuechly retires amid health concerns
2020/01/15 0:00:00,Police locate three missing children after car allegedly stolen in Sydney
2020/01/15 0:00:00,Why Marco Kurz had to go and how Melbourne Victory plans to replace him
2020/01/15 0:00:00,AgriWebb steps in to connect bushfire-hit farmers with help
2020/01/15 0:00:00,Gerroa oceanfront home offering chance to call Guy Sebastian and Sally Fitzgibbons neighbours
2020/01/15 0:00:00,Meghan Markle spotted at first public engagement since royal split
2020/01/15 0:00:00,Rain to bring relief to NSW and Vic but wet weather could cause more issues
2020/01/15 0:00:00,"Amid a deadly and devastating bushfire season, experts warn Australia should get used to it"
2020/01/15 0:00:00,Racing Victoria confirm Saturday’s Flemington meeting will go ahead
2020/01/15 0:00:00,Jackie O reveals she almost left Kyle Sandilands and jumped ship to Nova
2020/01/15 0:00:00,‘Wild ride’: Edwina Bartholomew gets candid about motherhood
2020/01/15 0:00:00,Melbourne airport passengers face delays as severe thunderstorms lash parts of Victoria
2020/01/15 0:00:00,‘Haunted’ Frozen Elsa doll keeps returning to family after being thrown out
2020/01/15 0:00:00,Blake Lively is unrecognisable in selfie promoting her latest movie
2020/01/15 0:00:00,Man Of His Word connections hopeful of big Flemington run as they eye All-Star Mile start
2020/01/15 0:00:00,David Moresi is Victoria’s fifth bushfire victim after vehicle rollover
2020/01/15 0:00:00,Melbourne Victory sack coach Marco Kurz
2020/01/15 0:00:00,"Top secret UFO files could ‘gravely damage’ US national security, navy says"
2020/01/15 0:00:00,Chef jailed for ‘brazen’ sex acts on himself next to girls on trains
2020/01/15 0:00:00,Murchison meteorite that struck Victorian town in 1969 contained the oldest matter ever found on Earth
2020/01/15 0:00:00,‘Not a halfway house’: Canada turns on Meghan and Harry
2020/01/15 0:00:00,Wests Tigers set to hit the open market with $1m to spend after Latrell Mitchell snub
2020/01/15 0:00:00,Car rolls down cliff after accident at Bondi Icebergs
2020/01/15 0:00:00,Dad in custody after family found dead in Disney World community
2020/01/15 0:00:00,Maris Sharapova and Grigor Dimitrov enjoy playful exchange at Kooyong
2020/01/15 0:00:00,‘Where there’s smoke’: Aussie retail icon’s shock announcement
2020/01/15 0:00:00,Volunteer firefighters back bushfire royal commission but UFU pushes back against national review
2020/01/15 0:00:00,‘Pillar of the community’: Victorian grandfather confirmed as fifth victim of state’s bushfires
2020/01/15 0:00:00,Meghan Markle’s dad prepared to testify against her in court
2020/01/15 0:00:00,Australian scientists announce the discovery of a new dinosaur in Queensland
2020/01/15 0:00:00,Airline worker sends woman creepy texts after stealing number from luggage tag
2020/01/15 0:00:00,Scathing assessment of Tennis Australia’s handling of smoke crisis at Melbourne Park
2020/01/15 0:00:00,Wildlife rescuers find signs of life among Kangaroo Island devastation
2020/01/15 0:00:00,Coles accused on Facebook of changing plastic bag providers
2020/01/15 0:00:00,Virat Kohli fires back after greats slam the Indian captain over his batting tactics in loss to Australia
2020/01/15 0:00:00,"Boy, 7, found living in filthy home so awful, police ‘almost threw up’"
2020/01/15 0:00:00,Fury over Stephen King’s controversial tweet about Oscars diversity debate
2020/01/15 0:00:00,"White Island volcano rescuers, police dismiss ‘offensive’ allegation"
2020/01/15 0:00:00,‘There’s still blood on the road’: Cruel reality of life in ‘wiped-out’ town
2020/01/15 0:00:00,US police officer accused of sending fake ticket after road rage spat
2020/01/15 0:00:00,From NRL player to the owner and operator of a multimillion-dollar fitness empire
2020/01/15 0:00:00,Dated Belmont waterfront sold for surprise sum at lively auction
2020/01/15 0:00:00,Angus Biddiscombe’s heartwarming gift for the CFA
2020/01/15 0:00:00,Royal poll: Have your say on Harry and Meghan’s extraordinary decision
2020/01/15 0:00:00,Swim coach Paul Frost in court on child sex charges
2020/01/15 0:00:00,David Warner’s manager blasts Cricket Australia over scheduling dilemma
2020/01/15 0:00:00,McDonald’s launches their all-new vegetarian-friendly burger
2020/01/15 0:00:00,GM to complete 180 turn and bring back Hummer as an electric ute
2020/01/15 0:00:00,Man allegedly sacked for showing his boss video of employees mishandling food
2020/01/15 0:00:00,Woman covers 90 per cent of body in tattoos to be ‘daddy’s girl’
2020/01/15 0:00:00,Inside Australia’s 2020 retail bloodbath as brands rocked by mass closures by mid-January
2020/01/15 0:00:00,Australia makes history by thrashing India in first ODI of three-match series
2020/01/15 0:00:00,‘Star Wars: The Rise of Skywalker’ original script leaked online is very different
2020/01/15 0:00:00,Conspiracists say lasers and exploding smart meters used to start bushfires to make way for a new train network
2020/01/15 0:00:00,Hundreds falling for Kmart Facebook scam that promises six-months of baby products
2020/01/15 0:00:00,McDonald’s customer snaps worker with his hand stuck down his pants
2020/01/15 0:00:00,Teacher jailed for abusing a student who ‘looked like her husband’
2020/01/15 0:00:00,Robbie Williams to perform one-off Australian show in March 2020
2020/01/15 0:00:00,Second day of Australian Open qualifying again affected by smoke
2020/01/15 0:00:00,NSA reveals ‘severe’ flaw that could compromise almost one billion PCs around the world
2020/01/15 0:00:00,Prince Harry to reunite with Meghan Markle at Canadian mansion this week
2020/01/15 0:00:00,A look at Conor McGregor’s body transformations over the years
2020/01/15 0:00:00,Prince Harry and Meghan Markle’s decision to step back raises questions over monetisation of royal brand
2020/01/15 0:00:00,McDonald’s Japan mocked over awkward dessert translation
2020/01/15 0:00:00,Australian opening pair David Warner and Aaron Finch eyeing 2023 World Cup
2020/01/15 0:00:00,Plane drops jet fuel on school playground near LAX
2020/01/15 0:00:00,Liz Cambage and WNBA players set for huge pay rise in new CBA deal
2020/01/15 0:00:00,"G-string debate splits Taupō swimmers, mum calls for ban at public spots"
2020/01/15 0:00:00,Ricky Gervais and James Corden have become the best of enemies after years of insults
2020/01/15 0:00:00,Bushfire smoke: Melbourne chokes through another ‘hazardous’ air quality day
2020/01/15 0:00:00,Blogger Jessica Hood gives candid account of sex after having kids
2020/01/15 0:00:00,New footage shows the moment two missiles are launched before hitting passenger plane in Iran
2020/01/15 0:00:00,"‘Double-edged sword’: Heavy rainfall brings risks to fire grounds, residents fled to beach overnight"
2020/01/15 0:00:00,‘National disgrace’: Karl Stefanovic unloads on children’s deaths
2020/01/15 0:00:00,Lawyer for Jeffrey Epstein’s ex-cellmate calls for probe into destroyed footage
2020/01/15 0:00:00,Defence Force advised to leave expensive Future Submarine Project in France
2020/01/15 0:00:00,Nancy Pelosi to get House to vote sending articles of impeachment to the Senate tomorrow
2020/01/15 0:00:00,Spy admits he helped Harvey Weinstein investigate Rose McGowan
2020/01/15 0:00:00,Youths plan ‘return’ after fracas with police at popular Perth water park
2020/01/15 0:00:00,"Today in history, January 15: First Logies awards"
2020/01/15 0:00:00,Olyroos reach AFC U23 Championships quarter-finals despite draw with Bahrain
2020/01/15 0:00:00,YouTube star Nikkie de Jager reveals ‘vile’ blackmail plot forced her to reveal ‘secret’
2020/01/15 0:00:00,Drug shocks rock tennis ahead of the Australian Open
2020/01/15 0:00:00,iPhone charging cable: Apple could be forced to change to USB-C
2020/01/15 0:00:00,"MORNING SERVE: Footballer assaults teen official, David Warner makes history against India"
2020/01/15 0:00:00,Steve Waugh hands Marnus Labuschagne ODI cap No. 229 with reminder of what it means
2020/01/15 0:00:00,How Meghan is spending her days in Canada amid royal crisis
2020/01/15 0:00:00,"Fires at homes, religious information centre overnight | Gun shots fired into house"
2020/01/15 0:00:00,"Huge sinkhole swallows bus, kills six in China"
2020/01/15 0:00:00,Prince William and Prince Harry reportedly had a ‘furious row’ in July last year
2020/01/15 0:00:00,David Warner becomes fastest Australian to reach 5000 ODI runs after century against India
2020/01/15 0:00:00,"Meghan Markle will never live in Britain again, friend claims"
2020/01/15 0:00:00,Taal volcano: Philippines warns of ‘explosive eruption’
2020/01/15 0:00:00,Sia texted Diplo to see if he was interested in ‘no-strings sex’
2020/01/15 0:00:00,Canadian PM Justin Trudeau blames downing of Ukraine plane on ‘US escalation’
2020/01/15 0:00:00,Adam Zampa’s ability to out fox Virat Kohli makes him a potential world beater
2020/01/15 0:00:00,Former cop shop an arresting opportunity for interstate buyer
2020/01/15 0:00:00,Royal crisis talks ramp up as palace explains why Meghan Markle didn’t phone in
2020/01/15 0:00:00,Investor paradise: Brisbane a landlords’ market as rents rise
2020/01/15 0:00:00,Adam Zampa removes Virat Kohli for sixth time in international cricket
2020/01/15 0:00:00,Virginia chapel hits the market for the first time in 83 years
2020/01/15 0:00:00,Turn your home into a cash cow with these simple tips
2020/01/15 0:00:00,MCC condemn proposed introduction of four-day Test cricket in 2023
2020/01/15 0:00:00,2020 property predictions for the northern beaches: short supply
2020/01/15 0:00:00,Golden Triangle draws buyers to East Geelong california bungalow
2020/01/15 0:00:00,Uncertain future for holiday rentals in bushfire-affected areas
2020/01/15 0:00:00,Inner west hot spot St Peters named one of Australia’s best growth suburbs in 2019
2020/01/15 0:00:00,More top end growth tipped for the upper north shore in 2020
