date,title
2020/12/03 0:00:00,Stick your head in to Darling Harbour
2020/12/03 0:00:00,Belmont shopping centre security guards caught on camera attacking Uber driver
2020/12/03 0:00:00,‘Slave labour’: America’s brutal new moves against China exports and immigration
2020/12/03 0:00:00,Apprentice Lachlan Neindorf set to extend Victorian stint at stables of Anthony and Sam Freedman
2020/12/03 0:00:00,"Champion jockey Michael Rodd kicks off homecoming at Ipswich, Doomben and Sunshine Coast"
2020/12/03 0:00:00,The Toyota Yaris GR is the biggest surprise package of the past decade
2020/12/03 0:00:00,Australia v India T20 series: D’Arcy Short hopes wearing Indigenous shirt sends inspirational message
2020/12/03 0:00:00,Why Josh Groban thought Robbie Williams was mocking him
2020/12/03 0:00:00,Woman who was horrifically tortured tells man who turned blind eye he is ’careless of life’
2020/12/03 0:00:00,Presidential pardons: What Donald Trump is protecting his kids from
2020/12/03 0:00:00,Victorian real estate agencies Brad Teal and Woodards form strategic partnership
2020/12/03 0:00:00,Snoop Dogg’s boxing commentary leads to offer calling porn for blind people
2020/12/03 0:00:00,Collapsed roof that killed worker at Curtin Uni reassembled to determine what happened
2020/12/03 0:00:00,Ivanka Trump deposed as part of inauguration fund lawsuit
2020/12/03 0:00:00,China lays into NZ PM Jacinda Ardern for supporting Australia
2020/12/03 0:00:00,Will Magnay anointed the NBL’s perfect poster boy after picking up an NBA contract
2020/12/03 0:00:00,W-League: Matildas legend Lisa De Vanna joins Melbourne Victory for a third time
2020/12/03 0:00:00,Argentina captain Pablo Matera reinstated as captain after racist tweet drama
2020/12/03 0:00:00,"As one promising horse exits, another steps up for Steve O’Dea, Matt Hoysted operation"
2020/12/03 0:00:00,Coronavirus US: America facing ‘most difficult’ public health crisis in history
2020/12/03 0:00:00,"RHOBH stars Kyle Richards, Kathy Hilton and Dorit Kemsley all test positive for COVID-19"
2020/12/03 0:00:00,Tane Chatfield’s family members speak at NSW parliament hearing
2020/12/03 0:00:00,"Woman charged with murder after mum, partner and baby die in house fire"
2020/12/03 0:00:00,ScoMo: Internal arguments a sign of confidence
2020/12/03 0:00:00,Ciaron Maher upbeat seasoned traveller Enigman capable of holding form on Pakenham Cup Day
2020/12/03 0:00:00,Oatlands crash: Abdallah and Sakr parents speak about grief ahead of Christmas
2020/12/03 0:00:00,"Reports Josh Addo-Carr offered $2 million deal for Bulldogs move, Benji Marshall rejects Hull offer"
2020/12/03 0:00:00,KFC SuperCoach BBL: Blossoming romance created by fantasy
2020/12/03 0:00:00,Kensington preview: Sally’s Day primed for another first-up win
2020/12/03 0:00:00,Uplift in mining and energy stocks causes 5-day trading high
2020/12/03 0:00:00,Baseball Hall of Famer Manny Ramirez is out to bring his big-hitting best for the Sydney Blue Sox
2020/12/03 0:00:00,$500 million dollar upgrade for RAAF Edinburgh Base brings hi-tech highflyers to Adelaide
2020/12/03 0:00:00,Mystery woman pays off $16k worth lay-by toys for Gold Coast kids
2020/12/03 0:00:00,AFC Champions League: Sydney FC intent on upsetting Postecoglou’s Yokohama F. Marinos
2020/12/03 0:00:00,Bulldogs set to blow Tigers out of water with fresh $2m plus deal for Josh Addo-Carr
2020/12/03 0:00:00,Child drowns in public pool in remote NT community
2020/12/03 0:00:00,Alleged fake lawyer nabbed at airport after police claim she ripped off immigrants: court
2020/12/03 0:00:00,Wild Gold Coast road rage brawl captured on dashcam
2020/12/03 0:00:00,"Rita Ora’s biggest A-list feuds, from her ‘toxic’ split with Calvin Harris to those Jay Z affair rumours"
2020/12/03 0:00:00,Andrew Bolt sells Malvern East home
2020/12/03 0:00:00,Generous woman anonymously pays off $16k of toys on lay-by at Mr Toys Toyworld store in Qld
2020/12/03 0:00:00,East Gosford mega-mansion with incredible views and spa room to shatter property records
2020/12/03 0:00:00,New WA museum removes reference to COVID-19 ‘originating in China’ after complaint
2020/12/03 0:00:00,Kmart Anko light up mousepad is a $25 gaming must-have
2020/12/03 0:00:00,Pfizer coronavirus vaccination: Everything you need to know
2020/12/03 0:00:00,"Supercars 2021 schedule revealed: dates, Bathurst events, Gold Coast return"
2020/12/03 0:00:00,COVID quarantine: Huge problem with high-risk hotel program
2020/12/03 0:00:00,"RHOC star Braunwyn Windham-Burke comes out as lesbian, but remains married to husband"
2020/12/03 0:00:00,Harry Styles shades Candace Owens for saying he wasn’t ‘manly’ in viral post
2020/12/03 0:00:00,New Zealand and West Indies cricketer wear black armbands to honour Kemar Roach’s father
2020/12/03 0:00:00,Anthony Griffin challenges St George Illawarra’s stars
2020/12/03 0:00:00,Victorian Racing Tribunal to hand down Richard Laming’s cobalt penalty before Christmas
2020/12/03 0:00:00,Ivona Jovanovic death: Gold Coast woman’s shooting still a mystery as cops turn the heat up
2020/12/03 0:00:00,Coffee machines and devices that deliver barista results
2020/12/03 0:00:00,7-Eleven offers $1 postage service Australia-wide deal for Christmas packages
2020/12/03 0:00:00,Jarryd Hayne speaks after jury unable to reach verdict in sexual assault trial
2020/12/03 0:00:00,Camberwell Victoria & Burke penthouses raise price bar
2020/12/03 0:00:00,Bec Judd reveals the item she’s asked about almost every day
2020/12/03 0:00:00,Karen Margaret Ryan faces court charged with setting fire to 13-year-old girl’s hair in random attack on bus
2020/12/03 0:00:00,Stockdale keen to take advantage of good Rosehill book
2020/12/03 0:00:00,NSW restaurant voucher program to be rolled out next week
2020/12/03 0:00:00,Missing man from canoe found dead in reeds
2020/12/03 0:00:00,Donald Trump’s final stand against China will help Australia’s trade war
2020/12/03 0:00:00,"Sign up to Best Of’s newsletter for dazzling deals, products reviews and more"
2020/12/03 0:00:00,Joe Burns prepared to step up as Australia’s senior opening batsman
2020/12/03 0:00:00,Rebel Wilson sizzles in bikini photo shoot
2020/12/03 0:00:00,Texas waitress gets $2700 tip but restaurant refuses to give her a cent
2020/12/03 0:00:00,Qld budget: Opposition Leader David Crisafulli criticises government’s debt position
2020/12/03 0:00:00,Scott Morrison ‘unnerved’ by controversial Port Arthur massacre movie
2020/12/03 0:00:00,BBL: Heat recruit Tom Cooper hopes to add stability to hot and cold batting order
2020/12/03 0:00:00,Qantas CEO accused of ‘throwing workers to the kerb’
2020/12/03 0:00:00,Coles and Woolies back inspectors on patrol for ham scams across Christmas
2020/12/03 0:00:00,What happened to the McCain Super Juicy Corn Cobettes girl
2020/12/03 0:00:00,Teenager Jasmine Morris who disappeared from Grafton likely dead: inquest
2020/12/03 0:00:00,Woman awarded $1.5m after plane crashed into Ferris wheel | Video
2020/12/03 0:00:00,Which Aussies will get access to the coronavirus vaccine first
2020/12/03 0:00:00,Phil Collins’ ex-wife’s ‘outrageous’ claims cut from lawsuit in messy split
2020/12/03 0:00:00,"Talent agent Chrystofa Stratton Aarons of CSA Models to pay $12,000 for ‘preying’ on ‘naive’ aspiring models"
2020/12/03 0:00:00,New Zealand and West Indies greeted by green deck in Hamilton
2020/12/03 0:00:00,King Of The Coast set to come out of retirement
2020/12/03 0:00:00,‘Ludicrous’ reason for Sydney hotel worker’s positive COVID test
2020/12/03 0:00:00,Woman infected with COVID-19 travelled on public transport 12 times
2020/12/03 0:00:00,"Duty free airport products auctioned off, stores forced to offload stock"
2020/12/03 0:00:00,Unusual string of consecutive numbers drawn in South African lottery draw
2020/12/03 0:00:00,"Queensland, WA borders in doubt as NSW records new virus case"
2020/12/03 0:00:00,Black beauty set to make a name for himself at Rosehill on Saturday
2020/12/03 0:00:00,Warburton former jailhouse with holding cell on the market
2020/12/03 0:00:00,Former MP turned lobbyist denies backdoor to reach politicians during IBAC hearing
2020/12/03 0:00:00,Bill Clinton’s former top adviser says former US president did visit Jeffrey Epstein’s island
2020/12/03 0:00:00,NBL announces first five rounds as a mid-season hub based in Victoria looms
2020/12/03 0:00:00,Aussie phenom Makur Maker’s gamble blows up in his face
2020/12/03 0:00:00,SA records no new COVID-19 cases five days in a row
2020/12/03 0:00:00,Reprieve in Victoria’s sacred Indigenous tree fight
2020/12/03 0:00:00,Nairne in Adelaide Hills named ME Bank’s top regional Australian town for first-home buyers
2020/12/03 0:00:00,Queensland cafe chain fined for paying staff in ‘food and drinks’
2020/12/03 0:00:00,‘Only in Australia’: Koala moves into woman’s Christmas tree
2020/12/03 0:00:00,Russell Westbrook John Wall traded in Houston-Washington deal
2020/12/03 0:00:00,Woman claims to ‘boost her libido’ by sunbaking vagina for two hours a day
2020/12/03 0:00:00,‘Marked person’: Woodville Pizza Bar worker’s lawyer hits out
2020/12/03 0:00:00,Question Time: Labor goes a week without questioning the PM
2020/12/03 0:00:00,Nike facing new boycott over Japanese anti bullying campaign
2020/12/03 0:00:00,‘Gobbledygook’: Qld court tosses out man’s laughable appeal over driving charge
2020/12/03 0:00:00,Test opener Joe Burns ready for India after facing thousands of balls during coastal escape
2020/12/03 0:00:00,Watch Me Dance a big show in Kingston Town Classic
2020/12/03 0:00:00,$3 million Powerball jackpot after $20 million win | Draw 1281
2020/12/03 0:00:00,Australian holidays: Chalets are surging in popularity among holiday-makers
2020/12/03 0:00:00,‘It’s overkill’: Calls for mandatory mask rule in workplaces to be scrapped
2020/12/03 0:00:00,Why Texas restaurant won’t let waitress have $2000 tip from customer
2020/12/03 0:00:00,CIA puzzle: Can you tell what time it is just by looking at this photo?
2020/12/03 0:00:00,NFL star Orlando Franklin reveals staggering weight loss
2020/12/03 0:00:00,"Jarryd Hayne’s ‘terrible’ sexual prowess caused accidental injuries, barrister says"
2020/12/03 0:00:00,Victoria police detective charged after allegedly leaking picture of Dani Laidley
2020/12/03 0:00:00,Belmont buyers ignore approved plans to redevelop parkside home
2020/12/03 0:00:00,Verrazano Bridge heaves as wild wind lashes New York City | Video
2020/12/03 0:00:00,Fraser Island bushfire: Blaze may burn for two more weeks without rain
2020/12/03 0:00:00,"Porsche driver Richard Pusey to fight assault, theft charges"
2020/12/03 0:00:00,Meghan and Harry are in hot water over The Crown and their Netflix deal
2020/12/03 0:00:00,Woman blasts mum over ‘secret brother’ only to discover hilarious truth
2020/12/03 0:00:00,Miley Cyrus talks Liam Hemsworth split and sex life in quarantine
2020/12/03 0:00:00,Bring back Toobs: Shane Warne spearheads campaign to return discontinued chip to supermarkets
2020/12/03 0:00:00,Australia confirms coronavirus vaccine is close
2020/12/03 0:00:00,Tones and I pockets a whopping $12 million from Dance Monkey Spotify streams
2020/12/03 0:00:00,China threatens ‘lasting punishment’ as Biden backs Australia
2020/12/03 0:00:00,"Mike Tyson and Evander Holyfield re-match secret, call-out"
2020/12/03 0:00:00,Thompson back in Queensland to pilot country star
2020/12/03 0:00:00,Latham loving life in the fast lane in Australia
2020/12/03 0:00:00,Obama slammed by the Left after criticising ‘defund the police’ slogan
2020/12/03 0:00:00,Coronavirus Qld: Push to strip ‘unfettered power’ from CHO Dr Jeannette Young
2020/12/03 0:00:00,Perth woman stabbed by boyfriend after break-up shares warning
2020/12/03 0:00:00,Police arrest Jason Burdon after prisoner escaped Adelaide Remand Centre with clothing rope
2020/12/03 0:00:00,Porsche driver Eastern Freeway tragedy: What caused Mohinder Singh to crash into cops revealed
2020/12/03 0:00:00,"High-profile Gold Coast lawyer facing money laundering, drug charges"
2020/12/03 0:00:00,Westpac pledges to clean up act after money laundering scandal
2020/12/03 0:00:00,Beijing threatens Australia with ‘lasting punishment’ as WeChat removes Scott Morrison’s post
2020/12/03 0:00:00,English gun Jonny Bairstow is a confirmed out for the Big Bash with the Stars signing a West Indian replacement
2020/12/03 0:00:00,Fight over pristine Whitsundays beach reaches fever pitch
2020/12/03 0:00:00,Kangaroo attack on woman blamed on Sarah Jessica Parker perfume
2020/12/03 0:00:00,Channel 10 star Sarah Harris apologises over Elliot Page pronoun ‘mishap’
2020/12/03 0:00:00,NSW government to debate bill to soften punishment for drug users
2020/12/03 0:00:00,Jodi Gordon’s boyfriend has appeared in court to challenge AVO conditions
2020/12/03 0:00:00,Qantas says domestic travel is financially mending the airline
2020/12/03 0:00:00,Harry Styles claps back at Candace Owens in brilliant new post
2020/12/03 0:00:00,Power to declare national emergency introduced in parliament
2020/12/03 0:00:00,Qantas: International travel to be at a ‘standstill’ until July 2021
2020/12/03 0:00:00,Toyota recalls HiLux and Fortuner for potentially faulty brakes
2020/12/03 0:00:00,Donald Trump posts speech on Facebook repeating US election misinformation
2020/12/03 0:00:00,"Woman, 32, who had sex with boy, 14, claims ‘he definitely didn’t tell me he was in Year 9’"
2020/12/03 0:00:00,Glenn Maxwell says his switch-hitting isn’t outside the laws of the game
2020/12/03 0:00:00,"‘Nose under fridge, eyeballs on tiles, tongue to the right’: cop describes horrific crime scene"
2020/12/03 0:00:00,Man accused of killing 16-year-old niece reveals details of attack to court
2020/12/03 0:00:00,LeBron James’ $115m contract extension links him with Bronny James’ NBA Draft year
2020/12/03 0:00:00,Curved Gisborne ‘Glass House’ wows with 180-degree views
2020/12/03 0:00:00,Treasurer Josh Frydenberg says Australia will not give ground to China’s grievances
2020/12/03 0:00:00,Meghan Markle’s friend reveals why she shared miscarriage news
2020/12/03 0:00:00,Mourners say a heartbreaking farewell to rising rugby league star Keith Titmuss
2020/12/03 0:00:00,Taylor Swift’s rerecordings released in hilarious new ad with Ryan Reynolds
2020/12/03 0:00:00,‘Serious situation’: Hotel quarantine worker tests positive in NSW
2020/12/03 0:00:00,"Fellow inmate charged over death of Zlatko Sikorsky, accused of murdering 16yo Larissa Beilby"
2020/12/03 0:00:00,"Australians close to coronavirus vaccine, Victoria records 34th consecutive ‘zero day’"
2020/12/03 0:00:00,Romain Grosjean posts harrowing video of Formula 1 fireball rescue
2020/12/03 0:00:00,Victoria dominates best regional towns for first-home buyers: ME
2020/12/03 0:00:00,Victorians urged to buy wine at local cellar doors after ‘perfect storm’ hits industry
2020/12/03 0:00:00,Savvy Shopper: Top tips for making extra cash for Christmas
2020/12/03 0:00:00,UK to get COVID vaccine next week after jab is approved by regulator
2020/12/03 0:00:00,Man accused of attacking two boys on a Sydney bus
2020/12/03 0:00:00,Reports suggest Elliot Page’s Umbrella Academy character will not be changed
2020/12/03 0:00:00,WWE’s first openly gay superstar dead at age 79
2020/12/03 0:00:00,"Glenn Maxwell defends controversial, ‘unfair’ tactic after cricket storm"
2020/12/03 0:00:00,China’s Global Times publishes new cartoon mocking Australia’s Defence Force as feud escalates
2020/12/03 0:00:00,Instructor and trainee killed in chopper crash at Tallong in NSW Southern Highlands
2020/12/03 0:00:00,Neighbours watched woman inside burning house fire ‘gasping for air’ as police say inferno is suspicious
2020/12/03 0:00:00,Tri Nations: James O’Connor returns to Wallabies line-up for final game of 2020 against Argentina
2020/12/03 0:00:00,‘It devastated me’: Aussie star’s brave new mission
2020/12/03 0:00:00,Tim Horan: It’s time rugby took the lead from NRL and AFL  about giving fans what they want
2020/12/03 0:00:00,Blackwood home with creepy wallpaper snapped up
2020/12/03 0:00:00,Access 2 Place and Rossdale Homes bridge the gap for accessible living
2020/12/03 0:00:00,Furious Republican election official in Georgia demands Donald Trump stop spreading misinformation
2020/12/03 0:00:00,Controversial YouTube star drags legend’s daughter into boxing beef
2020/12/03 0:00:00,United Nations report says countries need to reduce fossil fuel production by six per cent
2020/12/03 0:00:00,"Pfizer vaccination provides ‘best immunity’ four weeks after first jab, regulators say"
2020/12/03 0:00:00,Are Hobart’s boom times back again? New CoreLogic report would say yes
2020/12/03 0:00:00,Art dealer Trevor Harvey lists epic Terrey Hills estate with incredible lagoon and parklike grounds
