date,title
2020/03/04 0:00:00,‘He’s a dirty swimmer’: Olympic champ still angry at ‘unheard of’ Sun Yang burst that stole his gold
2020/03/04 0:00:00,‘Everyone has just gone a little bit crazy’: Australia’s toilet roll panic
2020/03/04 0:00:00,Todd Greenberg defends controversial NRL advertising campaign
2020/03/04 0:00:00,How long will the coronavirus outbreak crisis grip Australia?
2020/03/04 0:00:00,James Weir recaps Married At First Sight 2020 episode 20
2020/03/04 0:00:00,Global box office could be hit with $7.85 billion loss due to coronavirus
2020/03/04 0:00:00,‘We are very vulnerable’: Experts weigh in on coronavirus spread
2020/03/04 0:00:00,"‘Don’t panic!’: Toilet paper firm Kimberly-Clark, which manufactures Kleenex, tells Australia"
2020/03/04 0:00:00,AFL legends jump to Eddie Betts’ defence after Adelaide Crows comments
2020/03/04 0:00:00,AAP closes down: Global tech giants put media jobs at risk
2020/03/04 0:00:00,Qantas cancels flight to London after passenger with coronavirus on board aircraft
2020/03/04 0:00:00,ICC hypocrisy exposed after World Cup reserve days refused
2020/03/04 0:00:00,Rebels recruit Gideon Koegelenberg doesn’t have to worry about safety after leaving Durban for Melbourne
2020/03/04 0:00:00,Hoyts open Australia’s first cinema using Samsung Onyx LED display
2020/03/04 0:00:00,The Queen made a noticeable coronavirus precaution during her latest public appearance
2020/03/04 0:00:00,Bolivian girl’s emergency surgery after rape by 12 year old
2020/03/04 0:00:00,New York Islanders player Johnny Boychuk takes skate to face
2020/03/04 0:00:00,Supreme Court to consider whether foreigners are immune to NT law once overseas
2020/03/04 0:00:00,UFC champ Israel Adesanya issues ruthless Robert Whittaker conditions
2020/03/04 0:00:00,Another Vaucluse home with ‘wow’ factor hits market with $15m guide
2020/03/04 0:00:00,"Shoppers turn to baby wipes, paper towel and tissues amid toilet paper panic buying crisis"
2020/03/04 0:00:00,LeBron James stuns Lakers teammates with ’incredible’ 3-pointer
2020/03/04 0:00:00,Man in critical condition after allegedly setting himself on fire at Qld school
2020/03/04 0:00:00,Couple trick clingy cat by creating a fake lap
2020/03/04 0:00:00,Bondi Icebergs and CicciaBella  restaurateur Maurice Terzini lists in Bondi Beach
2020/03/04 0:00:00,Brisbane’s new MedTech partnerships could change the world
2020/03/04 0:00:00,Northern Territory records first coronavirus case
2020/03/04 0:00:00,Charming renovated cottage with detached studio in Queanbeyan
2020/03/04 0:00:00,Australian stockpiling queen shares her top tips
2020/03/04 0:00:00,"Prince Harry, Duke of Sussex, prepares to farewell royal life"
2020/03/04 0:00:00,Max Verstappen unhappy with his portrayal in Netflix series
2020/03/04 0:00:00,Dark Waters is more terrifying than any horror movie
2020/03/04 0:00:00,Real reason for Canberra ban on Real reason for Canberra ban on white cars
2020/03/04 0:00:00,Jean-Claude van Damme chats health and fitness ahead of his Australian tour
2020/03/04 0:00:00,Sports presenter Erin Molan shares bizarre request from social media admirer
2020/03/04 0:00:00,KFC SuperCoach podcast: One week to season
2020/03/04 0:00:00,The one big clue Lizzie will break Seb’s heart
2020/03/04 0:00:00,Mum’s photo of a dirty stove top reveals her heartbreaking struggles with mental health
2020/03/04 0:00:00,‘Don’t be rude’: Quaden Bayles’ message to bullies
2020/03/04 0:00:00,Hunters Hill: A classic circa 1910 home on a corner block sells for $4.2m
2020/03/04 0:00:00,Amazon employee tests positive for the coronavirus in the US
2020/03/04 0:00:00,Megan Gale says the public’s reaction to her Andy Lee break-up was ‘very demeaning’
2020/03/04 0:00:00,KFC SuperCoach NRL Draft: Fox Sports experts go head to head in a draft league
2020/03/04 0:00:00,Toilet paper buying frenzy ruthlessly mocked online
2020/03/04 0:00:00,"Port Macquarie races, tips, Matt Jones’ best bets and analysis"
2020/03/04 0:00:00,Kim Kardashian accused of cultural appropriation for wearing hair in braids
2020/03/04 0:00:00,"From a man, the behaviour of MAFS favourite Connie would look a lot like control"
2020/03/04 0:00:00,Toilet paper panic buying: Plumber warns shoppers not to flush tissue alternative
2020/03/04 0:00:00,Can you catch coronavirus more than once?
2020/03/04 0:00:00,Iran’s coronavirus boast backfires as country becomes new disease epicentre
2020/03/04 0:00:00,Rare Palmdale acreage listing proving popular with buyers
2020/03/04 0:00:00,What are the symptoms of the killer coronavirus?
2020/03/04 0:00:00,"South Australia confirms two more cases of coronavirus, bringing total to five, with dedicated clinic to open on Thursday"
2020/03/04 0:00:00,Shaq forced to reveal hairline after losing bet with D-Wade
2020/03/04 0:00:00,Breaking: NRL clear Curtis Scott to play despite seven police charges
2020/03/04 0:00:00,Gordon Richards has two chances to build on an imposing Flemington record this weekend
2020/03/04 0:00:00,Police seize more than one tonne of MDMA hidden in tubs of ‘tile adhesive’ from overseas
2020/03/04 0:00:00,Man gets his driver’s licence and  almost immediately drives into a river
2020/03/04 0:00:00,Melbourne’s prestige price growth one of the best in the world
2020/03/04 0:00:00,KFC SuperCoach NRL: Five PODs you should be thinking about with low current ownership
2020/03/04 0:00:00,"Today in history, March 4: Australia wins first Oscar"
2020/03/04 0:00:00,Major Australian retailers limit toilet paper pack purchases per customer
2020/03/04 0:00:00,Largest undeveloped residential block in Narellan listed
2020/03/04 0:00:00,Police continue baby body dig at religious sect farms
2020/03/04 0:00:00,How does coronavirus spread?
2020/03/04 0:00:00,Jackie O: radio host’s Vaucluse home comes up for auction
2020/03/04 0:00:00,St Kilda AFLW skipper Kate Shierlaw handed $700 fine after being found guilty of misconduct
2020/03/04 0:00:00,Australian economy beats expectation and grows by 0.5%
2020/03/04 0:00:00,Married At First Sight: Drew reveals real reason his housemate didn’t attend his wedding
2020/03/04 0:00:00,Man who tested positive for coronavirus visited Woolworths in Launceston before self-isolating
2020/03/04 0:00:00,Latrell Mitchell hits back at Karl Stefanovic’s criticism of new NRL ad
2020/03/04 0:00:00,‘Breaking point’: NSW motel closes after dispute with guest over ‘false’ online review
2020/03/04 0:00:00,The new-look Broncos were 1-2 in the trials. Anthony Seibold is sticking solid
2020/03/04 0:00:00,Man allegedly steals Versace necklace from business using fishing rod
2020/03/04 0:00:00,KFC SuperCoach AFL 2020: Everything you need to know
2020/03/04 0:00:00,Man kills Russian blogger after she allegedly mocked his sexual performance
2020/03/04 0:00:00,"Report suggests up to 96,000 Aussies could die in coronavirus global pandemic"
2020/03/04 0:00:00,Bella Hadid wears Miu Miu bodysuit as Rita Ora makes a model cameo at Paris Fashion Week
2020/03/04 0:00:00,Husband who killed the kids case has eerie links to Hannah Clarke murder
2020/03/04 0:00:00,‘I’m a little scared’: Olympics surfing competition to be held at Teahupo’o
2020/03/04 0:00:00,Students beat coronavirus travel ban by partying and dining out in exotic locations
2020/03/04 0:00:00,Secret war behind Judge Judy’s decision to quit
2020/03/04 0:00:00,Experts reveal the common habits you need to stop to prevent the spread of deadly coronavirus
2020/03/04 0:00:00,Employees unable to take sick leave may downplay Coronavirus symptoms to keep working
2020/03/04 0:00:00,Aussie market back into negative after aggressive interest rate moves and virus fears
2020/03/04 0:00:00,Hunt for dangerous man escaped from Sydney hospital
2020/03/04 0:00:00,Thomas ‘Snacks’ Lee goes viral after awesome basketball play
2020/03/04 0:00:00,Daly Cherry-Evans is the king of 40/20s. But the NRL’s new 20/40 rule is a tougher sell
2020/03/04 0:00:00,Peugeot boss says electric cars are only for ‘green addicts’
2020/03/04 0:00:00,Cringe-worthy moment Donald Trump learns the coronavirus is different from regular flu
2020/03/04 0:00:00,Vladimir Putin wants to ban gay marriage in revised hard-line Russian constitution
2020/03/04 0:00:00,Ways to keep your family safe from coronavirus
2020/03/04 0:00:00,Shoppers rush to Kmart for $18 item after fans rave about it online
2020/03/04 0:00:00,Knicks superfan Spike Lee doubles down on feud with owner James Dolan
2020/03/04 0:00:00,Donald Trump donates part of his presidential salary to the coronavirus fight
2020/03/04 0:00:00,Princess Diana’s former secretary concerned about Harry’
2020/03/04 0:00:00,Vanessa Marquez: Tragic bodycam video shows fatal shooting of ER actress
2020/03/04 0:00:00,Mum and daughter face court for allegedly attacking pilot in cockpit
2020/03/04 0:00:00,Golfer Paige Spiranac opens up on horrific nude photo scandal
2020/03/04 0:00:00,"Warburton Hospital for sale, stills looks like it did when it closed"
2020/03/04 0:00:00,Airline forced to park half its fleet amid coronavirus global outbreak
2020/03/04 0:00:00,ESPN host Stephen. A. Smith reignites his feud with NBA star Kevin Durant with Olympics rant
2020/03/04 0:00:00,Wyong: Top selling home on the Wyong River listed for sale
2020/03/04 0:00:00,Katie Lolas shares brutally honest selfie of her body
2020/03/04 0:00:00,Para-athlete Madison de Rozario honoured with ‘Shero’ Barbie for International Women’s Day
2020/03/04 0:00:00,Deluge set to intensify as low dumps huge amounts of rain on Australia’s east
2020/03/04 0:00:00,Review: Virgin’s Scarlet Lady ‘rock star’ cruise is missing one vital ingredient
2020/03/04 0:00:00,Fans question new Bachelor Locky Gilbert after Survivor romance with Brooke Jowett
2020/03/04 0:00:00,"Cassandra Thorburn opens up on divorce podcast: ‘Yes, I’m over my ex-husband’"
2020/03/04 0:00:00,Married At First Sight: Mishel Karen blasts Elizabeth Sobinoff again
2020/03/04 0:00:00,Paul Gallen says Darcy Lussick is out of his league. But he will take the fight on one condition
2020/03/04 0:00:00,People are mocking this detail on the new British passport
2020/03/04 0:00:00,‘Most Beautiful Girl in the World’ Thylane Blondeau stuns fans with bikini selfie
2020/03/04 0:00:00,Mask hoarding is ‘playing with lives’ as coronavirus spread
2020/03/04 0:00:00,‘Destined to fail’: Why Australia is unable to stop the spread of deadly coronavirus
2020/03/04 0:00:00,Better than an upgrade: The third-class experience I’ll never forget
2020/03/04 0:00:00,Head-turning new Hyundai electric car concept revealed
2020/03/04 0:00:00,Grandmother shows off her ripped physique in stunning Instagram snap
2020/03/04 0:00:00,An injury crisis is keeping Josh Morris at the Sharks. A salary cap crisis could force him out
2020/03/04 0:00:00,Lewis Hamilton rejects rivals’ Mercedes claims
2020/03/04 0:00:00,"‘Uncharted territory’: Iran plans to send 300,000 military members door-to-door"
2020/03/04 0:00:00,Bear Grylls accidentally flashes his privates as he live streams himself naked on Instagram
2020/03/04 0:00:00,More delays on South Eastern Freeway avoided as truck that broke down in Heysen Tunnels removed
2020/03/04 0:00:00,KFC SuperCoach NRL whizzkid Sebastian Rennie reveals his team for round one
2020/03/04 0:00:00,New York Knicks call Spike Lee’s claims of mistreatment ‘laughable’
2020/03/04 0:00:00,"Coronavirus: New case in Victoria, Sydney hospital staff quarantined"
2020/03/04 0:00:00,Coronavirus: Shock move to slash US interest rates misfires
2020/03/04 0:00:00,Tom Burgess looks like THIS now — thanks to an eccentric Dutch guru called ‘The Iceman’
2020/03/04 0:00:00,RUSH HOUR: 'Idiot' Brisbane teens live stream crime spree
2020/03/04 0:00:00,"Land values rise in Archerfield, Durack and Brisbane’s inner north"
2020/03/04 0:00:00,Coronavirus outbreak: Why are Australians panic buying toilet paper?
2020/03/04 0:00:00,Oscar winner Timothy Hutton denies teen sex assault claims
2020/03/04 0:00:00,Rescuers search rubble for tornado survivors in Nashville
2020/03/04 0:00:00,Downsizers tipped to get the most out of the market in 2020
2020/03/04 0:00:00,Australian housing market: Bank of Mum and Dad lending surges to $92 billion in property assistance
2020/03/04 0:00:00,Cricket legend Allan Border sells long-time Mosman investment
2020/03/04 0:00:00,Big city-fringe luxury with natural green surrounds
2020/03/04 0:00:00,New York State estate where Ian Fleming wrote James Bond books up for sale
2020/03/04 0:00:00,Melbourne buyers beat overseas interest to purchase Olympian Mary Hanna’s Bellarine property
