date,title
2020/03/08 0:00:00,Coronavirus: Leaders’ fatal error in US COVID-19 response
2020/03/08 0:00:00,F1 Bahrain Grand Prix to be TV only event after coronavirus outbreak
2020/03/08 0:00:00,Live coverage: Third ADF case as schools close over diagnoses
2020/03/08 0:00:00,Coronavirus in Australia: Third Australian death as COVID-19 cases rise across the country
2020/03/08 0:00:00,Coronavirus: Doctor’s honest post about coronavirus goes viral
2020/03/08 0:00:00,RAH coronavirus clinic has tested almost 100 people since opening last week; SA has seven confirmed cases
2020/03/08 0:00:00,Mum who cleared breast cancer and defied odds to have children is struck with disease again
2020/03/08 0:00:00,World reacts to Australian record crowd at women’s T20 World Cup final
2020/03/08 0:00:00,How behaviour can help control the spread of COVID-19
2020/03/08 0:00:00,Ellenbrook man creates own speed bumps to target skaters on Aveley Road
2020/03/08 0:00:00,A-League: Melbourne City forced to dig deep to fend off late fight from Perth Glory
2020/03/08 0:00:00,Public health expert warns coronavirus ‘could infect 60 per cent of world population’
2020/03/08 0:00:00,James Weir recaps Married At First Sight 2020 episode 21
2020/03/08 0:00:00,"Only one pack of toilet paper per person, Coles announces after coronavirus panic"
2020/03/08 0:00:00,Channel 9 cop backlash after Women’s T20 World Cup Final pushed to secondary channel
2020/03/08 0:00:00,Horror story behind Corey Feldman exposing Hollywood abuse
2020/03/08 0:00:00,Brooklyn’s own Anglers Rest Hotel listed for sale
2020/03/08 0:00:00,Missy Higgins’ dad Dr Chris Higgins confirmed to have coronavirus
2020/03/08 0:00:00,Taxi driver with passengers reported for high-range drink driving
2020/03/08 0:00:00,Katy Perry kicks off Women’s T20 World Cup Final in style with dancing cricket bats
2020/03/08 0:00:00,Hobart man with coronavirus went clubbing at Obar and Cargo
2020/03/08 0:00:00,Emerging star Rothfire was deemed not good enough for sale
2020/03/08 0:00:00,Joanna Jedrzejczyk left disfigured after ‘all-time classic’ UFC battle with Weili Zhang
2020/03/08 0:00:00,Cystic fibrosis patient’s desperate plea for tissues amid coronavirus panic buying
2020/03/08 0:00:00,"Raceday focus: Best bets, analysis for Coff Harbour and Canberra"
2020/03/08 0:00:00,Coronavirus around the world: Italy locks down 16 million people after death toll soars
2020/03/08 0:00:00,Three new cases of coronavirus case confirmed as Victorian cases reach 15
2020/03/08 0:00:00,Israel Adesanya tipped for Jon Jones showdown after rolling Romero at UFC 248
2020/03/08 0:00:00,Australian Cup winner Fifty Stars ruled out of All-Star Mile
2020/03/08 0:00:00,T-Rex says ‘I’m not done yet’ after shedding 27kg and a career-saving call to Des Hasler
2020/03/08 0:00:00,Australia win T20 World Cup Final against India by 85 runs at the MCG
2020/03/08 0:00:00,Toilet paper is ‘like gold’: Coronavirus fears create queues out the door at grocery shops
2020/03/08 0:00:00,"Israel Adesanya v Yoel Romero fight: UFC 248 start time Australia, live stream, blog, how to watch"
2020/03/08 0:00:00,Justin Hemmes’ pub empire Merivale uses a system logging every worker’s unpaid hours
2020/03/08 0:00:00,Tony Williams primed for a big season after body transformation
2020/03/08 0:00:00,UFC 248: Yoel Romero produces ‘terrifying’ motivational speech
2020/03/08 0:00:00,Coronavirus: Hunt for passengers on board domestic Australian flights
2020/03/08 0:00:00,"Peter FitzSimons defends new NRL commercial, tells critics to ‘get nicked’"
2020/03/08 0:00:00,Devs demands your full attention
2020/03/08 0:00:00,John Hastings: Aussie cricketer snags a buyer for St Kilda pad
2020/03/08 0:00:00,UFC 248: Israel Adesanya defeats Yoel Romero in snoozefest
2020/03/08 0:00:00,Tasmania’s Director of Public Health has provided an update on the state’s second confirmed coronavirus case
2020/03/08 0:00:00,New guidelines in place for tennis players amid coronavirus scare
2020/03/08 0:00:00,How to save thousands: Rate cuts create opportunities for homeowners to save big
2020/03/08 0:00:00,Sun Yang’s Aussie coach cuts ties with Chinese swimming
2020/03/08 0:00:00,A scavenger hunt is taking over public transport in Australia
2020/03/08 0:00:00,"‘I can see, mate’: Finch rips into Marnus for not following orders"
2020/03/08 0:00:00,Man sought over Renmark stabbing found
2020/03/08 0:00:00,"Housing market outlook: prices still poised to rise, but so are risks"
2020/03/08 0:00:00,Joe Marler gets intimate with rival during Six Nations clash
2020/03/08 0:00:00,"Tim Demetriou, nephew of Andrew Demetriou, lists Windsor pad"
2020/03/08 0:00:00,First-home buyers turn to parents for help as Melbourne home values soar
2020/03/08 0:00:00,Tony Ferguson shuts down reporter at UFC 249 press conference
2020/03/08 0:00:00,Coronavirus: China quarantine hotel collapse ‘traps 70’
2020/03/08 0:00:00,New Nissan Qashqai N-Sport review: Added tech to boost sales
2020/03/08 0:00:00,Toyota HiLux Rugged X review: Toyota’s most adventurous ute
2020/03/08 0:00:00,Lisa Wilkinson reveals the best thing about quitting Today
2020/03/08 0:00:00,You’re Next star Nick Tucci dies at 38 after secret battle with cancer
2020/03/08 0:00:00,Ben Affleck has been snapped out and about with co-star Ana de Armas
2020/03/08 0:00:00,"Roam to roam: Relax and unwind at Tanahmerah Homestead, a tranquil slice of Hills paradise"
2020/03/08 0:00:00,Former Wallaby Dean Mumm’s new challenge to raise money for BorneHRMI
2020/03/08 0:00:00,"Hollywood’s grandest mansion, The Beverly House, up for grabs"
