date,title
2020/09/30 0:00:00,"Cardinal George Pell arrives in Rome, months after he was cleared of child sex abuse"
2020/09/30 0:00:00,Serena Williams pulls out of French Open before second round match
2020/09/30 0:00:00,US presidential debate: Hillsong issues apology after employee’s accidental Trump post on Twitter
2020/09/30 0:00:00,Heartbreaking case of the woman no one has missed
2020/09/30 0:00:00,VRC still hold hope for at least some crowds at Spring Carnival
2020/09/30 0:00:00,Tarni Brown and Alice Burke to carry on famous names as AFLW players at Collingwood and St Kilda
2020/09/30 0:00:00,Authorities search for 'patient zero' in Chadstone cluster: Live coronavirus updates
2020/09/30 0:00:00,WA drivers warned to remove radar detectors from cars or face $1200 fine from October 12
2020/09/30 0:00:00,New Zealand election: Prime Minister Jacinda Ardern admits she tried marajuana ‘a long time ago’
2020/09/30 0:00:00,Major blast from fighter jet brings French Open play to a halt
2020/09/30 0:00:00,Trainer says Group 1 runner isn’t a 50/1 chance
2020/09/30 0:00:00,Flight Centre to close another 90 stores around Australia amid COVID-19 pandemic
2020/09/30 0:00:00,"Incentives for JobSeeker, Youth Allowance as farmers call for more help ahead of peak season"
2020/09/30 0:00:00,Brisbane Broncos coach Kevin Walters fights back tears in emotional interview
2020/09/30 0:00:00,Mick Price and Michael Kent Jr up the ante with promising trio to contest Group 2 Manifold Stakes
2020/09/30 0:00:00,"More than 10,000 supporters set to attend St Kilda-Western Bulldogs elimination final"
2020/09/30 0:00:00,Sydney man tasered during dramatic arrest bailed
2020/09/30 0:00:00,Seinfeld’s Jason Alexander was punched over his role in Pretty Woman
2020/09/30 0:00:00,James McDonald suspended but won’t miss Group 1 raceday
2020/09/30 0:00:00,‘Unreasonably stringent’: WA border will stay firm until there’s 28 days of no community spread
2020/09/30 0:00:00,"Teen charged after woman, 66, allegedly raped in Townsville park"
2020/09/30 0:00:00,The Everest 2020: Trekking and Eduardo join field for glamour $15 million sprint at Royal Randwick
2020/09/30 0:00:00,Diamond Head: Teen drowns after swimming at unpatrolled beach
2020/09/30 0:00:00,Kyle Sandilands leaves Machinegun Kelly offended and confused in awkward interview
2020/09/30 0:00:00,Catholic headmaster walks free despite concealing abuse allegations
2020/09/30 0:00:00,Amanda Nunes and Nina Ansaroff show off brand new baby daughter
2020/09/30 0:00:00,‘No idea’ claim in share house shooting case
2020/09/30 0:00:00,Australian captain Meg Lanning backs her decision to take Georgia Wareham out of the attack
2020/09/30 0:00:00,Sydney Swan Elijah Taylor pleads guilty to assaulting ex-girlfriend
2020/09/30 0:00:00,Qld paramedics respond to helicopter crash
2020/09/30 0:00:00,Crew hurt in high speed drama on Virgin flight from Melbourne to Adelaide
2020/09/30 0:00:00,‘Bring back Aussie manufacturing’: Ute ‘bling’ maker plans Vic mega-factory
2020/09/30 0:00:00,"NRL: Kalyn Ponga has backed Wayne Bennett’s appointment as Queensland coach, but first he wants to beat the master mentor"
2020/09/30 0:00:00,The Bachelor runner-up Bella Varelis spills on fling with Cody Simpson
2020/09/30 0:00:00,"Melbourne mum’s fear after man grabs daughter, 2, in snatch attempt"
2020/09/30 0:00:00,"What to stream this week: Staged, Jack Whitehall, Briarpatch and more"
2020/09/30 0:00:00,Farm work pitch: Find a job and the ‘love of your life’
2020/09/30 0:00:00,"Trump debate comments freak out investors, wipe $41b from All Ords"
2020/09/30 0:00:00,Single act that could cost you your licence this long weekend
2020/09/30 0:00:00,Anya Bradford: Cop ‘incorrect’ about brawl with woman he tasered
2020/09/30 0:00:00,Viewers shocked after ‘sex tourist grannies’ fly out for flings with younger Gambian men
2020/09/30 0:00:00,Millionaire Hot Seat contestants can choose Eddie McGuire as their lifeline
2020/09/30 0:00:00,"Raceday focus: Best bets, analysis for Geelong with Brad Waters"
2020/09/30 0:00:00,The role sporting legends like Mat Rogers play in our national mental health crisis
2020/09/30 0:00:00,Pat Mahomes’ fiancee brings out the receipts during dominant display
2020/09/30 0:00:00,Joseph O’Brien has Irish eyes for another Melbourne Cup; all silent on whips debate and Lloyd Williams
2020/09/30 0:00:00,Queensland election 2020: Mirani candidates go head to head in live debate
2020/09/30 0:00:00,Two talented brothers bring luxurious Lyneham home to life
2020/09/30 0:00:00,Tim Clark rapt with Golden Slipper winner Farnan
2020/09/30 0:00:00,Melania Trump’s ‘uncomfortable’ moment with Donald Trump after US presidential debate
2020/09/30 0:00:00,Toyota HiLux Rogue and Rugged X Australian prices revealed
2020/09/30 0:00:00,Investigation underway after attempted SA prison break where inmate climbed into roof space
2020/09/30 0:00:00,Drew Barrymore reveals she held onto the cowboy hat she wore in E.T.
2020/09/30 0:00:00,New report warns JobSeeker is a ’pre-age pension’
2020/09/30 0:00:00,"JobSeeker changes, loan deferrals creates uncertainty for Australia’s economy"
2020/09/30 0:00:00,"Who won US presidential debate: Donald Trump, Joe Biden go head-to-head"
2020/09/30 0:00:00,Sydney terrorism: Man convicted of plotting Bankstown knife attack dragged into courtroom
2020/09/30 0:00:00,Mandurah mother Chantal Markey warns parents after her daughter is attacked by a swooping magpie
2020/09/30 0:00:00,Sacha Baron Cohen’s bold move against Donald Trump
2020/09/30 0:00:00,NRL: Penrith hooker Api Koroisau is expecting a ruthless Roosters side after their record loss to South Sydney
2020/09/30 0:00:00,Brand new $15m home comes to market on Manly’s prestigious Bower St
2020/09/30 0:00:00,Mercedes-Benz X Class cars recalled over hydraulic line defect
2020/09/30 0:00:00,WA government demands Commonwealth help over virus-affected ship and stop more from coming
2020/09/30 0:00:00,Sydney Lord Mayor criticised for picture of Greta Thunberg in Central Square plans
2020/09/30 0:00:00,Danica Patrick has a warning for her next boyfriend after Aaron Rodgers split
2020/09/30 0:00:00,Rugby: Another all-Australian Super Rugby competition is likely for 2021 after South Africa officially withdrew its teams
2020/09/30 0:00:00,Clive Palmer setback in High Court stoush with WA: Ordered to submit new file after judge found it ‘impenetrable’
2020/09/30 0:00:00,Trainer Gary Portelli makes dry argument as he changes his tune on Provide flop
2020/09/30 0:00:00,"Cops find $2 million in cash, weapons after intercepting car on the Gold Coast"
2020/09/30 0:00:00,‘Makes me so happy’: Far-right group celebrate shoutout from Donald Trump
2020/09/30 0:00:00,Port Macquarie strawberry farm has the world’s best scones
2020/09/30 0:00:00,McKenzie Lorraine Robinson to plead guilty to leaking sex tape of Broncos’ Kotoni Staggs
2020/09/30 0:00:00,"Mum-of-two prison guard, 32, ‘had four-month fling with man who strangled girlfriend and baby daughter to death’"
2020/09/30 0:00:00,Dean Jones tortured teammate Damien Fleming with classic prank
2020/09/30 0:00:00,Woman at centre of Broncos sex tape scandal to plead guilty as X-rated request revealed
2020/09/30 0:00:00,TikTok video reveals truth behind favourite McDonald’s burger ingredient
2020/09/30 0:00:00,Hiker plummets to his death after posing for photo on Oregon cliff
2020/09/30 0:00:00,Man in custody after allegedly shooting gun at Kurri Kurri hospital
2020/09/30 0:00:00,The Block 2020: Scott Cam says copycat bedroom designs are ‘identical’
2020/09/30 0:00:00,AFL: Lions CEO Greg Swann urges Queenslanders to get behind Brisbane’s AFL premiership bid
2020/09/30 0:00:00,Verge Girl: $40 million success that started with loan from parents
2020/09/30 0:00:00,Ellen DeGeneres loses it when Amy Schumer drops the F-bomb during interview
2020/09/30 0:00:00,‘I guess I’m debating you’: Donald Trump fires up at debate moderator
2020/09/30 0:00:00,"Maher-Eustace, Waller target Melbourne Cup qualifier over Metropolitan start"
2020/09/30 0:00:00,AFL: Fremantle star Jesse Hogan kicked out of his house after a ‘female friend’ comes to visit
2020/09/30 0:00:00,Disabled man fined for breaching coronavirus rules by eating McDonald’s by river in Shepparton
2020/09/30 0:00:00,Dan Murphy’s and BWS want to hire 1600 new employees over summer
2020/09/30 0:00:00,"US presidential debate: Celebs react to Donald Trump, Joe Biden’s performance"
2020/09/30 0:00:00,NBL: Brazilian NBA hopeful Didi Louzada will return to the Sydney Kings next season
2020/09/30 0:00:00,Fire burns for more than 12 hours near AFL finals hub on Gold Coast
2020/09/30 0:00:00,Essendon ups the ante in fight to keep high-profile star
2020/09/30 0:00:00,"Transfer Whispers: Expansion team targets Storm star, Broncos set to pay for Bird to fly the coop"
2020/09/30 0:00:00,Sydney Swans star Elijah Taylor pleads guilty to assaulting girlfriend
2020/09/30 0:00:00,Andrew Forrest’s Tattarang to open Cooee to bring life back to Old Swan Brewery
2020/09/30 0:00:00,Kmart’s famous $20 churros maker to return after selling out
2020/09/30 0:00:00,Amanda Holden hits back over Britain’s Got Talent revealing dress controversy
2020/09/30 0:00:00,"Woman run over, killed by dredging tractor while sunbaking on beach"
2020/09/30 0:00:00,Sydney Swans player Elijah Taylor pleads guilty to assault
2020/09/30 0:00:00,La Nina declared: Unexpected effect of climate driver
2020/09/30 0:00:00,Cattle station Pine Ridge at Dunedoo sells to Sydney buyer for $3.3m
2020/09/30 0:00:00,Ex-Home and Away actor Joel McIlroy’s assault charges dismissed on mental health grounds
2020/09/30 0:00:00,Call one of the Barossa Valley’s historic wine estates home
2020/09/30 0:00:00,Coronavirus: What Australia’s COVID-normal summer will look like
2020/09/30 0:00:00,"Peter Andre, 47, flaunts body after building home gym | Photos"
2020/09/30 0:00:00,Sydney’s queen chasing the childhood dream in Epsom Handicap
2020/09/30 0:00:00,Billionaire cryptocurrency boss and ex-child star Brock Pierce opens up about sex ring claims
2020/09/30 0:00:00,Japan Airlines removes gendered greetings from flights
2020/09/30 0:00:00,Lake killer mum Akon Guode’s sentence reduced to 18 years
2020/09/30 0:00:00,Tofane stays home for last step towards Everest
2020/09/30 0:00:00,US presidential debate: Joe Biden tells Donald Trump to ‘shut up’
2020/09/30 0:00:00,Daylight saving kicks in this weekend. That means you lose an hour
2020/09/30 0:00:00,Target’s $89 wooden Christmas tree slammed as an ‘eyesore’
2020/09/30 0:00:00,Cyclist badly injured after hitting telegraph pole in the middle of bike lane
2020/09/30 0:00:00,Coronavirus Victoria: Fines for party guests hiding in garden
2020/09/30 0:00:00,Tommy Berry says he’s only just beginning to feel ‘normal’ as he recovers from loss of twin brother
2020/09/30 0:00:00,Men charged over alleged dodgy betting scheme at The Star
2020/09/30 0:00:00,"Coronavirus restrictions leave 26,000 fruit picking jobs unfilled"
2020/09/30 0:00:00,"Woman, 19, dies after horrific gang rape by four men in India"
2020/09/30 0:00:00,Queensland election 2020: Bundaberg live debates REPLAY
2020/09/30 0:00:00,"Teaching assistant jailed for sexually abusing boy, 16"
2020/09/30 0:00:00,Harvey Norman pushes ahead with 12 new stores overseas despite COVID-19 disruption
2020/09/30 0:00:00,Australian singer Helen Reddy dead at 78
2020/09/30 0:00:00,Mystery as woman missing for two years found alive floating at sea by baffled fishermen
2020/09/30 0:00:00,Eric Trump clarifies comments about being ‘part of’ LGBTQ community
2020/09/30 0:00:00,Former Premier League star lashes out over ‘false’ sex claims
2020/09/30 0:00:00,DIY fanatic divides internet with extreme lengths she goes to when planning a room
2020/09/30 0:00:00,Drug kingpin Tony Mokbel faces delays in legal challenge against drug trafficking conviction
2020/09/30 0:00:00,Brisbane Broncos get their man as Kevin Walters agrees to two-year deal in late-night signing
2020/09/30 0:00:00,12 people on first cruise ship to sail since pandemic test positive for COVID-19
2020/09/30 0:00:00,Epsom favourite out to break Group 1 duck
2020/09/30 0:00:00,New COVID app calls on Victorian government to provide clearer contact tracing advice to businesses
2020/09/30 0:00:00,"Boy, 2, dies a week after being ‘torn apart’ by his family’s pet German Shepherds on his birthday"
2020/09/30 0:00:00,RBA sets October date for new $100 bill circulation
2020/09/30 0:00:00,"Apple Music, TV+, email, iCloud suffer outages following Google, Microsoft issues"
2020/09/30 0:00:00,Mum baffled by question in 7-year-old son’s maths homework
2020/09/30 0:00:00,"Australia, NZ travel bubble: Big problem with border reopening plan"
2020/09/30 0:00:00,Text messages show Tinder creep’s demand for woman’s sexual history
2020/09/30 0:00:00,Aldi launches massive kitchen sale with $100 air fryer and bar fridge
2020/09/30 0:00:00,Naya Rivera’s ex-husband Ryan Dorsey responds to rumours about dating her sister Nickayla
2020/09/30 0:00:00,Positive traces of coronavirus found in sewage water in Anglesea
2020/09/30 0:00:00,"Allison Mack’s actress wife, Nicki Clyne, defends NXIVM sex cult"
2020/09/30 0:00:00,Former Ipswich mayor Paul Pisasale jailed on raft of criminal charges
2020/09/30 0:00:00,4 new COVID cases in NSW as state marks fifth day of no community transmission
2020/09/30 0:00:00,Elon Musk says he wouldn’t get vaccinated for COVID-19
2020/09/30 0:00:00,Reporter smashed beer bottle on man’s head during ‘political argument’
2020/09/30 0:00:00,Uber ‘wasted’ $3.5 billion on self-driving cars with no ‘meaningful progress’
2020/09/30 0:00:00,"Man, 19, charged with rape of woman, 66, in Cranbrook park near Ross River"
2020/09/30 0:00:00,The Candy Man will have Queensland behind him in Epsom Handicap
2020/09/30 0:00:00,Hotel quarantine inquiry budget blows out to $5.7 million
2020/09/30 0:00:00,"Donald Trump and Joe Biden clash over Antifa, white supremacists"
2020/09/30 0:00:00,The Voice Australia: Boy George’s sassy swipe amid new judge rumours
2020/09/30 0:00:00,Graffiti vandals target Premier Daniel Andrews’ electoral office in Noble Park
2020/09/30 0:00:00,Zero new Qld COVID-19 cases as police replace defence personnel at border
2020/09/30 0:00:00,Conspiracy about Joe Biden ‘earpiece’ explodes before US presidential debate
2020/09/30 0:00:00,Coronavirus droplets can linger for an hour after being propelled two metres
2020/09/30 0:00:00,NRL and NSW govt lock in ANZ Stadium for 2020 Grand Final at increased capacity
2020/09/30 0:00:00,Brutal reaction to Jake Gyllenhaal’s Instagram photo
2020/09/30 0:00:00,Hunt on for armed men who stormed home with baby inside
2020/09/30 0:00:00,Narrabri gas project in NSW gets green light with ‘stringent conditions’
2020/09/30 0:00:00,Victoria’s opposition wants to re-open hotel quarantine inquiry’s evidentiary phase
2020/09/30 0:00:00,SuperCoach Racing 2020: Five top contenders for The Metropolitan
2020/09/30 0:00:00,RACQ quiz reveals Queensland  drivers don’t know their give way rules
2020/09/30 0:00:00,Italian model makes fresh claims about Michael Schumacher’s health condition
2020/09/30 0:00:00,'Will you shut up?': Donald Trump and Joe Biden bicker during debate
2020/09/30 0:00:00,Kim Kardashian West uploads candid pictures of Kanye West amid relationship drama
2020/09/30 0:00:00,Wife’s final texts before Chris Watts killed family revealed in Netflix documentary
2020/09/30 0:00:00,Wharfies offer peace deal to resolve Port Botany dispute
2020/09/30 0:00:00,French Open: Marc Polmans lone Aussie male into second round at Roland Garros
2020/09/30 0:00:00,Qld Nationals Senator Matt Canavan has labelled NSW residents ‘Mexicans’
2020/09/30 0:00:00,Motorcyclist critical after Sydney bus crash
2020/09/30 0:00:00,The Block 2020: Jasmin and Luke defend ‘copycat’ bedroom and hit back at Shaynna Blaze
2020/09/30 0:00:00,Parrots moved from wildlife park after swearing at visitors
2020/09/30 0:00:00,"NRL: ANZ Stadium set to host 40,000 fans for the 2020 NRL Grand Final"
2020/09/30 0:00:00,New coronavirus guidelines for parents concerned over Halloween
2020/09/30 0:00:00,The Bunnings sausage sizzle is finally coming back
2020/09/30 0:00:00,Social circles across Melbourne could be new COVID way of socialising in public
2020/09/30 0:00:00,Coronavirus: UK confirms record spike in cases and worrying surge in deaths
2020/09/30 0:00:00,"Harry Potter, Marvel pens recalled over fears of choking hazard to children"
2020/09/30 0:00:00,Massive differences in petrol prices depending on area you live in: report
2020/09/30 0:00:00,"6000 Toyota Corolla ZZE122, ZZE123 added to Takata airbags recall"
2020/09/30 0:00:00,Boy in viral magpie swooping video faces off with bird
2020/09/30 0:00:00,Food delivery driver pulled from car in alleged Melbourne carjacking
2020/09/30 0:00:00,State Government funds research into ‘game changer’ in fight against COVID-19
2020/09/30 0:00:00,Gladys issues plea to save Sydney
2020/09/30 0:00:00,South Africa blames New Zealand for being forced to quit Super Rugby
2020/09/30 0:00:00,"Six teens, aged 15 and under, involved in stolen vehicle rollover"
2020/09/30 0:00:00,Aussie tradie’s severe headache leads to horror diagnosis
2020/09/30 0:00:00,"Victoria records 13 new coronavirus cases, four more deaths"
2020/09/30 0:00:00,Big Bang Theory star lost sense of taste and smell when he had COVID-19
2020/09/30 0:00:00,Recently retired star Jack Watts ‘charged’ over car crash incident
2020/09/30 0:00:00,Shannen Doherty gives stage four breast cancer update
2020/09/30 0:00:00,‘We miss you’: Jacinda Ardern on travel bubble with NSW
2020/09/30 0:00:00,Former AFL coach Dean Laidley heads home after rehab
2020/09/30 0:00:00,Heckling Roger Federer fan laughs as Novak Djokovic delivers frightening glare
2020/09/30 0:00:00,"‘Delusional’ Smith slammed over future, claims of media’s anti-Storm conspiracy"
2020/09/30 0:00:00,Warning that states like Western Australia could be a tinderbox for the spread of the coronavirus
2020/09/30 0:00:00,French Open rocked by controversy as legend accuses star of bad sportsmanship
2020/09/30 0:00:00,Convicted paedophile Peter John O‘Neill avoids jail due to obesity problems
2020/09/30 0:00:00,Latest image of unrecognisable star forces NBA owner to step in
2020/09/30 0:00:00,CCTV captures two men setting vehicle alight in Brunswick East
2020/09/30 0:00:00,Coronavirus Australia: Inside the life of a funeral director in Victoria
2020/09/30 0:00:00,Police charge two teens and arrest alleged getaway driver over car thefts
2020/09/30 0:00:00,"Meghan Markle speaks at women's summit, discusses life in LA and criticism"
2020/09/30 0:00:00,Inala: Search to locate a two-year-old who went missing last week
2020/09/30 0:00:00,Balmain stabbing: Two teenagers charged over alleged bloody stabbing assault
2020/09/30 0:00:00,Young Australian guitar prodigy’s first-hand experience with Ellen DeGeneres on TV
2020/09/30 0:00:00,Social media lights up over absurd image of high-flying 17-year-old footy star
2020/09/30 0:00:00,Meghan Markle loses court battle in her privacy lawsuit against newspaper
2020/09/30 0:00:00,GoFundMe created for teacher Danielle Idai-Jawai who died one day after giving birth
2020/09/30 0:00:00,Connect to the outdoors with Gallery Living’s Mondrian 230
2020/09/30 0:00:00,Complaints about telco call centres surge 1500 per cent amid coronavirus
2020/09/30 0:00:00,First-home buyers pay record price for riverside Belmont address
2020/09/30 0:00:00,Bubble Gum House brings the haters
2020/09/30 0:00:00,Sydney Swans co-captain Luke Parker sells Malabar property at auction
2020/09/30 0:00:00,"Regional Australia gets $135m to promote recovery, resilience"
