date,title
2020/10/07 0:00:00,Essendon leaking ‘bad comments’ about star Adam Saad after trade request
2020/10/07 0:00:00,Federal budget 2020: Expert says Stage 3 tax cuts ‘may never happen’
2020/10/07 0:00:00,Kotoni Staggs breaks silence on sex tape with McKenzie Lorraine Robinson
2020/10/07 0:00:00,Coronavirus Australia live: St Vincent's Hospital nurse infected with COVID-19
2020/10/07 0:00:00,"Punter collects $621,840 windfall after mistake quinella bet"
2020/10/07 0:00:00,"Ben Long appeal upheld at AFL tribunal, Saints star ruled out of semi-final with Richmond"
2020/10/07 0:00:00,The Block 2020: Harry threatens to quit the show
2020/10/07 0:00:00,‘Carried on like a sour tart’: Why Fittler dropped Klemmer
2020/10/07 0:00:00,Coronavirus Australia: Prime Minister Scott Morrison accused of failing on aged care on ABC’s 7.30 program
2020/10/07 0:00:00,Ben Simmons explains Footy Show ‘idiots’ comment towards Kane Cornes
2020/10/07 0:00:00,Candidates for seat of McConnel go head to head
2020/10/07 0:00:00,NSW man sentenced for entering SA after lying about ‘terminally ill relative’
2020/10/07 0:00:00,Famous Victorians write love letters to the city in 30 words
2020/10/07 0:00:00,The Herald Sun front pages from the last three decades that shocked and inspired
2020/10/07 0:00:00,"Boy, 17, dies in Kookynie crash after car leaves road and strikes tree"
2020/10/07 0:00:00,James Weir recaps The Bachelorette Australia 2020 episode 1
2020/10/07 0:00:00,WAxit: West Australian Premier Mark McGowan says secession referendum ‘won’t be happening’
2020/10/07 0:00:00,High paying Australian jobs bosses can’t find staff for
2020/10/07 0:00:00,Police search for man after series of home invasions and car thefts across Perth suburbs
2020/10/07 0:00:00,Police allege man contaminated products with syringe at supermarket
2020/10/07 0:00:00,Champion surfer Matt Wilkinson’s near miss with shark caught on camera
2020/10/07 0:00:00,Change of tactics for Miravalle in Spring Champion Stakes
2020/10/07 0:00:00,Fiery exchange as Tyrrell inquest draws to an end
2020/10/07 0:00:00,Australia equals Ricky Ponting’s world record-breaking ODI team
2020/10/07 0:00:00,Former Crown bosses let me down over China risks: Packer
2020/10/07 0:00:00,Martin Wani clings to bonnet after alleged road rage attack in Orange Grove in Perth’s south
2020/10/07 0:00:00,Spring Champion ride for Ryan Maloney a bonus as Alligator Blood targets Silver Eagle
2020/10/07 0:00:00,Group 1-winning jockey Ben Melham exonerated on rules interpretation
2020/10/07 0:00:00,‘Arrogant’ businessman’s secret life of heroin comes unstuck
2020/10/07 0:00:00,One in custody in operation at Broadway in Sydney CBD
2020/10/07 0:00:00,Queensland Squad announced for State of Origin 2020: Broncos snubbed
2020/10/07 0:00:00,AFLW: Zimmorlei Farquharson achieves dream of playing for the Brisbane Lions
2020/10/07 0:00:00,"Gosford, Armidale races: John Sargent has Brash Sammy ready to win at Gosford"
2020/10/07 0:00:00,Tasmania JackJumpers interested in Australian NBA star Matthew Dellavedova as the franchise‘s first marquee player.
2020/10/07 0:00:00,Seattle Storm’s Ezi Magbegor becomes second youngest player to win WNBA title
2020/10/07 0:00:00,Two deep cleans ordered for The Butcher Club after first failed DHHS standards
2020/10/07 0:00:00,Maserati Ghibli damaged in bizarre towing fail on NSW beach
2020/10/07 0:00:00,Cops crack down on gel blasters
2020/10/07 0:00:00,Cricket: With a display of complete domination Australia equalled a world record with its 21st straight ODI win
2020/10/07 0:00:00,CBA says it has reached capacity for first home deposit loan applications
2020/10/07 0:00:00,Aussie shares higher as budget boosts consumer spending prospects
2020/10/07 0:00:00,‘The whole of NZ want to kill me’: How Willie Mason swore during the haka and lived to regret it
2020/10/07 0:00:00,Michael Kent Jr on the road to Group 1 glory after starting at the picnics
2020/10/07 0:00:00,Lauren Jackson hails Opals stars Ezi Magbegor and Sami Whitcomb for winning WNBA championship with Seattle
2020/10/07 0:00:00,Man charged after teacher allegedly stabbed in her far north Qld home
2020/10/07 0:00:00,AFL: Brisbane’s Ryan Lester is eyeing off a premiership after 10 years of toil and before list cuts potentially send him in to the real workforce in 2021
2020/10/07 0:00:00,Reviews: Dirt Music is dishy but dull; true terror in American Murder: The Family Next Door
2020/10/07 0:00:00,Josh Frydenberg distances himself from Donald Trump over COVID-19 claims
2020/10/07 0:00:00,TAB Footy Form: Will Richmond bounce back against St Kilda in cutthroat semi-final?
2020/10/07 0:00:00,Cruise lines insist on negative COVID test before cruising
2020/10/07 0:00:00,Whitelion: How meeting with not-for-profit changed teen’s life
2020/10/07 0:00:00,Lawyer X Nicola Gobbo will be struck off legal roll for acting as police snitch
2020/10/07 0:00:00,SNL guest Morgan Wallen poses COVID threat after wild weekend
2020/10/07 0:00:00,NRL: South Sydney halfback Adam Reynolds says the Rabbitohs’ red-hot attack can net them a premiership
2020/10/07 0:00:00,Marnus Labuschagne planning to stay ‘one step ahead’ of India
2020/10/07 0:00:00,"Budget 2020: Pauline Hanson slams spend, questions gas plan"
2020/10/07 0:00:00,Eskimo Pie to change its ‘derogatory’ name
2020/10/07 0:00:00,Spring Confidential: Former jockey Nick Hall enjoying life away from the racetrack
2020/10/07 0:00:00,Air New Zealand rejects passenger with Tourette’s from flight
2020/10/07 0:00:00,Driver charged over fatal Adelaide Hills crash flips the bird after court hears of his neuropsychological tests
2020/10/07 0:00:00,Virgin Australia launch massive flight sale
2020/10/07 0:00:00,Gytrash on track for The Everest
2020/10/07 0:00:00,Schitt’s Creek star Dan Levy slams Comedy Central for censoring same-sex kiss
2020/10/07 0:00:00,Question Time: ScoMo ‘mansplains’ Albo on women’s issues
2020/10/07 0:00:00,Urgent virus alert for Kmart store
2020/10/07 0:00:00,Mercedes-Benz reveals electric car onslaught
2020/10/07 0:00:00,Michelle Obama brands Donald Trump a ‘racist’ and a ‘liar’ in plea to voters
2020/10/07 0:00:00,Eerie photos capture teens’ death march ‘Down the hill’
2020/10/07 0:00:00,How fake tax agent Polevia Sioli ripped off friends and family
2020/10/07 0:00:00,Canterbury Bulldogs powerbrokers forced out as civil war rages
2020/10/07 0:00:00,Relationship Rehab: Husband’s ‘terrible’ 10-year sex secret
2020/10/07 0:00:00,Bizarre tiny bikini roasted in reviews: ‘My boobs fell out’
2020/10/07 0:00:00,LA Lakers one game away from NBA championship after beating Miami in Game 4 thriller
2020/10/07 0:00:00,"Jessica Simpson was ‘horrified’ by John Mayer, Perez Hilton pash"
2020/10/07 0:00:00,Super Rugby: Brad Thorn to renew Queensland Reds contract
2020/10/07 0:00:00,Best picks from Woolworths Big Brand Cosmetic Sale
2020/10/07 0:00:00,Bondi Beach club owner hits back at critics
2020/10/07 0:00:00,Dad pleads for ‘bastards’ who killed his son Jarrad Lovison in the Latrobe Valley to be dobbed in
2020/10/07 0:00:00,Reality star Kat Von D’s ‘torturous’ experience at school for troubled teens
2020/10/07 0:00:00,Australian credit card debt hits lowest level in 16 years
2020/10/07 0:00:00,The Butcher Club Chadstone manager rushed to ICU for second time after testing positive to coronavirus
2020/10/07 0:00:00,Fight erupts on flight after passenger refused to wear a mask
2020/10/07 0:00:00,NRL: South Sydney stars are using the pain of preliminary final failure to drive their premiership surge
2020/10/07 0:00:00,Award-winning Point Piper home with pool and dream view set for auction with $13m price guide
2020/10/07 0:00:00,2020 Federal Budget: Property industry laments missed chances
2020/10/07 0:00:00,Wotif.com reveals where you can get Australia’s best schnitzel
2020/10/07 0:00:00,"Woolworths Ooshies swap day returns in NSW, Queensland, Western Australia, Tasmania, the Northern Territory and ACT"
2020/10/07 0:00:00,Ex-NRL star Sam Burgess’s lawyer slams domestic violence allegations as propaganda
2020/10/07 0:00:00,Fans shocked over detail in Chris Evans’ video
2020/10/07 0:00:00,Aldi plans to reduce plastic use in packaging by 25 per cent by 2025
2020/10/07 0:00:00,Joseph O’Brien’s team lands for bid for second Melbourne Cup
2020/10/07 0:00:00,Man impaled by stingray barb off Cape York
2020/10/07 0:00:00,"Ubisoft’s Watch Dogs: Legion release due October 29 for PS4, Xbox"
2020/10/07 0:00:00,Qld could scrap plans to reopen NSW border after new coronavirus cases
2020/10/07 0:00:00,"EB Games’ buy now pay later move shuns Afterpay, Zip"
2020/10/07 0:00:00,Brisbane council doggy waste bags supply hit by ongoing maritime dispute
2020/10/07 0:00:00,Federal Budget 2020: ‘Scandalous’ Vales Point coal project slammed
2020/10/07 0:00:00,"#LetUsSpeak: Man sexually assaults, rapes girl, 13, after camping trip | Exclusive"
2020/10/07 0:00:00,NRL: Charlie Staines scored four tries on debut for Penrith and the Panthers have fended off rivals to re-sign the gun rookie winger
2020/10/07 0:00:00,Sargent desperate to see Favreau in Spring Champion
2020/10/07 0:00:00,Serena Williams feels ‘underpaid’ and ‘undervalued’
2020/10/07 0:00:00,Two WA men separately charged for importing childlike sex doll into Australia
2020/10/07 0:00:00,Woman accused of ‘breathing on’ pet shop staff after mask request
2020/10/07 0:00:00,Michael Walker won’t tell fibs — and that costs him rides
2020/10/07 0:00:00,"Heavy rainfall, damaging winds forecast for northern Tasmania"
2020/10/07 0:00:00,"Vaughan Mark Hildebrand: Rapist ex-cop appeals jail sentence, complains of ‘onerous’ conditions"
2020/10/07 0:00:00,Rod Stewart reveals ‘big falling out’ with Elton John
2020/10/07 0:00:00,Joe Daniher makes huge call on his playing future
2020/10/07 0:00:00,Eczema Support Australia: COVID-19 pandemic difficulties for people allergic to soap
2020/10/07 0:00:00,"Kmart sells $29 silk pillowcase dupe of $115 Slip item, sparking frenzy"
2020/10/07 0:00:00,Rachael Finch trolled over video of kid’s ‘hack job’ haircut
2020/10/07 0:00:00,"Donald Trump walks away from stimulus talks, stock market plummets"
2020/10/07 0:00:00,Grim forecast about when you can travel overseas
2020/10/07 0:00:00,Police blitz during school holidays ends in scores of arrests and 500 charges laid
2020/10/07 0:00:00,Woman charged with sexually assaulting two teenage boys
2020/10/07 0:00:00,‘I’m gutted’: Justin Hodges reveals sting of Wayne Bennett’s QLD Origin snub
2020/10/07 0:00:00,A man allegedly committed sex act on train in Redfern
2020/10/07 0:00:00,Chris Waller goes for blinkers on Thousand Guineas favourite Hungry Heart
2020/10/07 0:00:00,Queensland election: Premier Annastacia Palaszczuk heads into her toughest seat
2020/10/07 0:00:00,Former Leichhardt Salvation Army hall converted into character home for sale after 23 years
2020/10/07 0:00:00,Sydney police crack down on delivery drivers who ride bikes on footpaths
2020/10/07 0:00:00,Cuties: Netflix indicted by US grand jury over controversial film
2020/10/07 0:00:00,Farnan to miss lead-up race for The Everest after injury setback
2020/10/07 0:00:00,Kate Moss’ lookalike daughter Lila makes fashion runway debut
2020/10/07 0:00:00,The Bachelorette 2020: Having two bachelorettes removes power from Elly and Becky
2020/10/07 0:00:00,Mars closer to Earth than it will be until 2035: How to watch it
2020/10/07 0:00:00,Melbourne lockdown: Group cops massive fine for gathering in city’s east
2020/10/07 0:00:00,"Federal budget 2020: Experts tell people to save, not spend tax cuts"
2020/10/07 0:00:00,US expat raves about barbecues at beaches as Australians admit they ‘take them for granted’
2020/10/07 0:00:00,Instagram’s most popular house plants
2020/10/07 0:00:00,England’s attempt to get cricket back included putting COVID on balls
2020/10/07 0:00:00,"Aaron David Marriage faces court for allegedly making death threats to Premier, Chief Health Officer"
2020/10/07 0:00:00,Federal Budget 2020: Labor to promise free childcare for low income earners
2020/10/07 0:00:00,Nick Cordero’s widow Amanda Kloots delivers powerful message to Donald Trump
2020/10/07 0:00:00,Porsche driver Richard Pusey cops new charge over unusual device
2020/10/07 0:00:00,Nasty Gal Emily Ratajkowski collection
2020/10/07 0:00:00,Federal Budget 2020: Australia’s national debt won’t be paid off until ‘early 2080s’
2020/10/07 0:00:00,The people the budget left behind
2020/10/07 0:00:00,Eddie McGuire outlines two major gripes ahead of blockbuster Collingwood clash
2020/10/07 0:00:00,Police close case of elderly woman who says she knows who she is but won’t tell authorities
2020/10/07 0:00:00,A-League: Sydney FC allow English goal-machine Adam Le Fondre to leave on a loan deal to India
2020/10/07 0:00:00,Stalled US stimulus package dents the start of trading day
2020/10/07 0:00:00,AFL: Local clubs in Queensland will get more than 300 free AFL Grand Final tickets
2020/10/07 0:00:00,Match-fixing claims rock French Open after suspect service game
2020/10/07 0:00:00,"Melbourne, Adelaide weather: Huge “wave” of rain set to hit country"
2020/10/07 0:00:00,Joe Rogan hits back at ‘woke’ mob who want to censor his podcast
2020/10/07 0:00:00,The Bachelorette 2020: Elly Miles has already dated one of the contestants
2020/10/07 0:00:00,"Chadstone cluster: Shopping centre outbreak grows, putting lockdown plans at risk"
2020/10/07 0:00:00,Sydney apartment’s ‘humiliating’ bikini rule bans ‘G-strings’ from pool
2020/10/07 0:00:00,"Facebook, Instagram ban all QAnon conspiracy theory content ahead of US election"
2020/10/07 0:00:00,China tourist attractions swarmed by tourists ignoring social distancing
2020/10/07 0:00:00,Italy islands now popular for tourists wanting a sex holiday
2020/10/07 0:00:00,Stephen Miller tests positive for the coronavirus amid growing White House cluster
2020/10/07 0:00:00,Federal Budget 2020: Why Australia’s record-breaking debt isn’t as bad as it seems
2020/10/07 0:00:00,Daniel Andrews faces grilling after Andrew Crisp writes to hotel quarantine inquiry to retract evidence
2020/10/07 0:00:00,Moment heckler is dragged away by police as Treasurer speaks on live TV
2020/10/07 0:00:00,SuperCoach Racing: Dan Batten shows you don’t have to be a racing expert to succeed
2020/10/07 0:00:00,Killer dad Chris Watts reveals sick details of how he murdered his family
2020/10/07 0:00:00,Cosmo’s Midnight break down the perfect summer soundtrack with more artists to add to your playlist
2020/10/07 0:00:00,Britney Spears shocks fans with photo of ‘real’ look on Instagram
2020/10/07 0:00:00,"As Qld marks 27th day of no community transmission, premier reminds state it ‘could have been worse’"
2020/10/07 0:00:00,Ed Sheeran’s manager blasts Princess Beatrice for cutting the singer with a sword
2020/10/07 0:00:00,Plan to introduce paid beach club on section of Bondi Beach
2020/10/07 0:00:00,Eddie Van Halen secretly did the guitar solo on Michael Jackson’s ‘Beat It’
2020/10/07 0:00:00,Bachelorette sisters Elly and Becky Miles meet their contestants
2020/10/07 0:00:00,Queensland sets 48-hour deadline for NSW to find source of three new cases of community transmission
2020/10/07 0:00:00,Golf: Aussie Hannah Green has put aside her parents’ COVID-19 fears and travelled to the US to defend her PGA title this week
2020/10/07 0:00:00,SuperCoach Racing 2020: Five top contenders for the Toorak Handicap
2020/10/07 0:00:00,‘I’m fine now’: PM’s coughing fit caught on camera
2020/10/07 0:00:00,Western Australia plans to keep border closed until April 2021
2020/10/07 0:00:00,Adelaide property market proves resilient through COVID-19
2020/10/07 0:00:00,New York Knicks’ plan to return to relevancy includes twin stars
2020/10/07 0:00:00,Cruise ships look to ‘cruises to nowhere’ after Qantas success
2020/10/07 0:00:00,Federal Budget: Opposition says it won’t stand in the way of tax cut relief
2020/10/07 0:00:00,Woman’s boyfriend mistaken for her dad due to 29-year age gap
2020/10/07 0:00:00,"Victoria records six new coronavirus cases, two more deaths"
2020/10/07 0:00:00,"iPhone 12: Apple to announce new iPhone, AirTags, Mac Silicone at October event"
2020/10/07 0:00:00,Adam Saad’s bombshell trade request from Essendon to Carlton broken down
2020/10/07 0:00:00,Awesome sportsmanship reveals tennis star’s true class in Paris
2020/10/07 0:00:00,Charlie Teo’s ‘miracle girl’ Milli Lucas rushed home to family after surgery
2020/10/07 0:00:00,Sydney Swans star Isaac Heeney puts Lake Macquarie investment property up for sale
2020/10/07 0:00:00,New Hyundai i20 N: Fresh hot hatch aims to rock turbo rivals
2020/10/07 0:00:00,Premier pledges she will work ‘right up until Christmas’ to deliver budget if re-elected
2020/10/07 0:00:00,Federal Budget shows that the pandemic will make Australia’s population go backwards
2020/10/07 0:00:00,Jakob Thornton: Texting driver who seriously injured police has jail appeal dismissed
2020/10/07 0:00:00,"Aldi, Coles supermarkets added to Victorian Department of Health coronavirus high-risk location list"
2020/10/07 0:00:00,Eddie Van Halen dead: Why Jimmy Barnes rejected offer to join Van Halen
2020/10/07 0:00:00,Farmers erupt over brutal slayings in South Africa
2020/10/07 0:00:00,Anne Heche reveals brutal fallout of her three-year Ellen DeGeneres relationship
2020/10/07 0:00:00,New York man charged after fight over face mask turns deadly
2020/10/07 0:00:00,"Rugby star Danny Cipriani reveals his, fiancee’s tragic baby loss"
2020/10/07 0:00:00,Police looking for man armed with syringe who attempted to rob Qld bank
2020/10/07 0:00:00,Opposition Leader Anthony Albanese says Budget ‘leaving too many people behind’
2020/10/07 0:00:00,NSW Government reveals how it compromised on koala policy that threatened the Coalition
2020/10/07 0:00:00,David Letterman makes Kim Kardashian cry in new Netflix trailer
2020/10/07 0:00:00,Man arrested after allegedly stealing credit cards from 12 Melbourne suburbs
2020/10/07 0:00:00,Australian Federal Budget 2020: What it means for you
2020/10/07 0:00:00,Political scientist: Qlders will make their decision at the polls based on two ‘referendums’
2020/10/07 0:00:00,Shirtless man allegedly tries to stab police in Eltham
2020/10/07 0:00:00,Port Macquarie busker accused of sex assault with 14-year-old girl
2020/10/07 0:00:00,Eddie Van Halen dead at 65 from throat cancer
2020/10/07 0:00:00,Police divers join search for missing judge Guy Andrew
2020/10/07 0:00:00,"Federal Budget 2020: Instant asset write-offs up to $150,000 revealed"
2020/10/07 0:00:00,Man drowns at holiday spot as lifesavers rescue dozens over long weekend
2020/10/07 0:00:00,Meghan Markle’s Suits co-star Patrick J. Adams admits he’s ‘intimidated’ to reach out
2020/10/07 0:00:00,Donald Trump’s post deleted after he compares coronavirus to the flu
2020/10/07 0:00:00,"Rabbitohs frustrated with Joseph Suaalii’s contract demands, Roosters could swoop"
2020/10/07 0:00:00,Photographer says this image is ‘everything that’s wrong with sports today’
2020/10/07 0:00:00,Federal Budget 2020 poll: What Australians think about the 2020-21 economic recovery plan
2020/10/07 0:00:00,La Nina phenomenon poses weather warning for pool owners
2020/10/07 0:00:00,Federal Budget 2020: The problem with Federal Government’s big tax cuts
2020/10/07 0:00:00,Federal budget 2020: Tax cuts for high income earners slammed
2020/10/07 0:00:00,Character-filled ‘50s home our most popular of the week
2020/10/07 0:00:00,Victoria the Homeowner State: How to rebuild our new-home economy
2020/10/07 0:00:00,Former model Kate Elsworth and husband Nicolas Blistene buy Byron Bay townhouse
2020/10/07 0:00:00,Unliveable Hamlyn Heights house attracts multiple bidders
