date,title
2020/06/22 0:00:00,Adem Somyurek: Labor leader Anthony Albanese’s mystery catch-up with disgraced powerbroker
2020/06/22 0:00:00,Coronavirus live updates: ATO targeting fraudsters using government help
2020/06/22 0:00:00,NSW Police taser man in the face after foot pursuit in Sydney
2020/06/22 0:00:00,SA looks for COVID-19 vaccine volunteers
2020/06/22 0:00:00,St George Illawarra Dragons star James Graham to return to St Helen ‘where it all started’
2020/06/22 0:00:00,Newmarch House coronavirus outbreak: ‘They’re sitting there waiting to die’
2020/06/22 0:00:00,Sam Newman refuses to apologise for George Floyd and kneeling criticism after Channel 9 exit
2020/06/22 0:00:00,Quiz is one of the strongest TV shows of the year
2020/06/22 0:00:00,Vaping ban: Australia set to ban import of e-cigarettes and nicotine refills
2020/06/22 0:00:00,"New maps reveal Zealandia, lost continent beneath New Zealand"
2020/06/22 0:00:00,Reading stabbing attack: Joe Ritchie-Bennett and James Furlong named as victims
2020/06/22 0:00:00,"WA to end coronavirus rules, enters ‘Phase 4’ of easing restrictions while keeping borders closed"
2020/06/22 0:00:00,Nick Kyrgios blows up after Borna Coric becomes second positive COVID-19 test from Adria Tour exhibition
2020/06/22 0:00:00,James Weir recaps Big Brother Australia 2020 episode 8
2020/06/22 0:00:00,China-India border skirmish: 155-year-old map fuelling dispute
2020/06/22 0:00:00,Former High Court Justice Dyson Heydon could be stripped of honour over ‘disturbing’ sexual harassment findings
2020/06/22 0:00:00,Japan set to pull out of FIFA Women’s World Cup bid with Australia-New Zealand bid firming in favouritism
2020/06/22 0:00:00,Cadbury Caramilk chocolate bars to return to shelves in Australia
2020/06/22 0:00:00,‘Bula Bubble’ proposed for Australians to visit Fiji
2020/06/22 0:00:00,Yulin dog festival returns in China despite government campaign
2020/06/22 0:00:00,Emilee Hembrow shares pregnancy loss to followers on Instagram
2020/06/22 0:00:00,At home with Folklore Cafe’s Anika Havey
2020/06/22 0:00:00,Fresh search launched in relation to William Tyrrell disappearance
2020/06/22 0:00:00,"Prince Harry, Meghan Markle: William photo that must break Harry's heart"
2020/06/22 0:00:00,Teenager charged with attempted sexual assault of elderly woman
2020/06/22 0:00:00,Keelian Jensen: Family calls on Google to ‘stop assisting suicide’ after teen’s death
2020/06/22 0:00:00,"Max Tuerk, former NFL lineman, dead at 26"
2020/06/22 0:00:00,"Andrew Moloney vs Joshua Franco: live, start time, fight card, Fox Sports 505"
2020/06/22 0:00:00,Where Are You Really From? presenter Michael Hing on multicultural stories in Australia
2020/06/22 0:00:00,Perth Stadium permitted to host full crowds next month
2020/06/22 0:00:00,Plane food unused due to coronavirus given away for $2 per meal
2020/06/22 0:00:00,"Judiciary Round 6: Bulldogs winger charged, Brown to fight shoulder charge ban"
2020/06/22 0:00:00,Big mistakes to avoid on your CV
2020/06/22 0:00:00,Elon Musk sells LA mansion for $42.3 million amid quest to ‘own no house’
2020/06/22 0:00:00,"How to ask for a salary increase: Trick to getting a pay rise, even during a pandemic"
2020/06/22 0:00:00,"Coronavirus crisis: Stage four of roadmap to allow 30,000 fans at Optus Stadium from this Saturday"
2020/06/22 0:00:00,Radio host Jackie O buys incredible $11m Woollahra home
2020/06/22 0:00:00,Mercedes-AMG A35 review: Go-fast sedan delivers tonnes of thrills
2020/06/22 0:00:00,NSW man charged for abducting baby from woman at knifepoint
2020/06/22 0:00:00,Penrith Panthers vs South Sydney Rabbitohs fixture moved from Campbelltown Stadium following scrutiny
2020/06/22 0:00:00,38 French bulldogs found dead on Ukraine International Airlines flight
2020/06/22 0:00:00,Coronavirus Victoria: Did protests cause Victorian COVID-19 spike?
2020/06/22 0:00:00,Why most families are loving COVID-19 induced lockdown life
2020/06/22 0:00:00,Ruby Princess inquiry: St Patrick’s Day party held before ship docked in Sydney
2020/06/22 0:00:00,Long queues at Melbourne coronavirus testing clinics after spike in cases
2020/06/22 0:00:00,Samantha Armytage engaged: What we know about her fiancee Richard Lavender
2020/06/22 0:00:00,Must have cookbooks: Melissa Leong reveals her favourites
2020/06/22 0:00:00,NT places you must visit when border restrictions end on July 17
2020/06/22 0:00:00,How Pink saved her marriage: ‘It’s the only reason we’re still together’
2020/06/22 0:00:00,Sydney radio host says Conor McKenna flouting AFL virus restrictions a ‘typical Victorian’
2020/06/22 0:00:00,SA home accidentally snapped up at auction 42 years ago sells under the hammer again
2020/06/22 0:00:00,Bedding and quilt covers to brighten up your bedroom
2020/06/22 0:00:00,John Bolton says Trump’s impeachment excuse is ‘utter nonsense’ in explosive TV interview
2020/06/22 0:00:00,Lara Central Estate big drawcard in pre-auction sale
2020/06/22 0:00:00,Radio host Jackie O admits women don’t wash their black bras
2020/06/22 0:00:00,Northern beaches: Palm Beach in a sales boom as an Ocean Rd estate sells for $11.5 million
2020/06/22 0:00:00,KFC releases Zinger parmy recipe
2020/06/22 0:00:00,Sony Action Cam camera found at Bondi survived 7 years underwater
2020/06/22 0:00:00,MasterChef fan-favourite Reece Hignell reveals how to make gin tart
2020/06/22 0:00:00,‘Modern warfare has changed’: Cyber attack threat rising in Australia
2020/06/22 0:00:00,NASCAR says a noose was found in Black driver Bubba Wallace’s garage stall at Talladega Superspeedway
2020/06/22 0:00:00,Coronavirus: Aussie researchers say COVID-19 drug could arrive by end of the year
2020/06/22 0:00:00,Jack de Belin in court to defend rape charges | NRL news
2020/06/22 0:00:00,Melbourne auctions: Homes defy COVID-19 doom to smash reserves
2020/06/22 0:00:00,Jacinda Ardern faces pressure over people leaving coronavirus quarantine
2020/06/22 0:00:00,MPs want next year’s 12 per cent superannuation guarantee to be dumped
2020/06/22 0:00:00,"Toddler at Reservoir childcare centre, and Black Lives Matter protester test positive to COVID-19"
2020/06/22 0:00:00,Donald Trump’s own words blow up in his face as crowd size at Tulsa rally disappoints
2020/06/22 0:00:00,NFL star Marquette King mocked by global rugby union fanbase for daring claim
2020/06/22 0:00:00,"AFL 2020: Essendon’s Conor McKenna a ‘typical Victorian’, Ray Hadley says"
2020/06/22 0:00:00,Rumours about the demise of flagship show 60 Minutes addressed by Channel 9
2020/06/22 0:00:00,Australia enters ‘new normal’ in fifth phase of coronavirus fight
2020/06/22 0:00:00,240+ of Tasmania’s Cutest Dogs
2020/06/22 0:00:00,Kate Middleton photo shows Prince Louis looks exactly like his mum
2020/06/22 0:00:00,Victorian hot spots identified as six local government areas
2020/06/22 0:00:00,Couple finds X-rated carrot resembling a penis
2020/06/22 0:00:00,"Coronavirus: China-US ‘cold war’ will be worse than COVID-19 pandemic, expert warns"
2020/06/22 0:00:00,MasterChef’s Tessa Boersma reveals how to make her winning dish of scarlet prawn crudo at home
2020/06/22 0:00:00,MasterChef Australia: Brendan Pang is keen to star in a spin-off show with Reece Hignell
2020/06/22 0:00:00,Coronavirus: Largest single-day increase in virus cases globally
2020/06/22 0:00:00,Victoria border closures: NSW residents told not to visit Melbourne
2020/06/22 0:00:00,Sasha Mielczarek finishes shack he purchased while dating Bachelorette star Sam Frost
2020/06/22 0:00:00,Stain 91: the tiny blood spot that caught a mass killer
2020/06/22 0:00:00,Coronavirus Australia: Mystery over new COVID-19 case in NSW
2020/06/22 0:00:00,Australian Formula 1 superstar Daniel Ricciardo spills on reason behind move to McLaren in 2021
2020/06/22 0:00:00,"Ultimate guide to Australia’s best ski, snowboarding destinations for 2020"
2020/06/22 0:00:00,AFL 2020: Should Essendon be forced to play after Conor McKenna positive test?
2020/06/22 0:00:00,World tennis in shock as world No.19 Grigor Dimitrov tests positive to COVID-19
2020/06/22 0:00:00,Coronavirus: COVID-19 cases spiking in 22 US states
2020/06/22 0:00:00,MasterChef star Poh Ling Yeow’s recipe for perfect scrambled eggs
2020/06/22 0:00:00,Apple WWDC June 2020: Rumours claim big hardware reveals were axed
2020/06/22 0:00:00,Man sparks debate over ‘ridiculous’ $40 takeaway bill
2020/06/22 0:00:00,China-India border dispute: Beijing warns it is ‘not afraid’ to go to war on Himalayan border as tensions rise
2020/06/22 0:00:00,Sione Faumuina bluntly condemns New Zealand Warriors following Stephen Kearney’s sacking
2020/06/22 0:00:00,China cyber attacks: Beijing’s misinformation war against Australia
2020/06/22 0:00:00,Oscar Isaac’s brutal response to Star Wars question
2020/06/22 0:00:00,North Korea’s Kim Yo Jong’s power play
2020/06/22 0:00:00,"Teen died after inhaling deodorant at a sleepover, in disturbing ‘chroming’ trend"
2020/06/22 0:00:00,YouTuber Friendlyjordies lashed for ‘racist’ depiction of NSW Premier Gladys Berejiklian and deputy John Barilaro
2020/06/22 0:00:00,Dallas Goedert punch video: NFL teammates promise violence after king hit in bar
2020/06/22 0:00:00,The Voice 2020: Jackie O drops major spoiler on radio
2020/06/22 0:00:00,Reading stabbing: Khairi Saadallah identified as suspect in terrorist attack
2020/06/22 0:00:00,Who is Luka Magnotta? Don’t F**k With Cats Netflix true story
2020/06/22 0:00:00,Best of Brisbane 2020: Who makes Brisbane’s best babycino?
2020/06/22 0:00:00,How Australia’s favourite celebrities will be holidaying this year
2020/06/22 0:00:00,Jeffrey Epstein’s ‘madam’ Ghislaine Maxwell hiding out in luxury Paris flat minutes from paedophile’s $12k pad
2020/06/22 0:00:00,WA Premier Mark McGowan reacts to Perth teenager kicked out of pub because of his mullet
2020/06/22 0:00:00,EPL 2020: Liverpool forced to wait after ‘cruel’ end to Everton game
2020/06/22 0:00:00,How to fold towels: Facebook post sparks heated debate
2020/06/22 0:00:00,Comedian tests positive for coronavirus after dramatic onstage collapse
2020/06/22 0:00:00,AFL 2020: Deluded Trent Cotchin troll highlights uphill battle in online fight
2020/06/22 0:00:00,More people searching for food support since coronavirus
2020/06/22 0:00:00,Korean Peninsula poised to return to its dark and bloody past after peace deal comes to dramatic end
2020/06/22 0:00:00,Bondi teen missing for three days: NSW Police in frantic search for Bronti Cuello
2020/06/22 0:00:00,Coronavirus: NSW residents on Centrelink can get a 50 per cent discount on fines
2020/06/22 0:00:00,The Project: Waleed Aly hit by ‘abhorrent’ false story
2020/06/22 0:00:00,Designer lists Thornbury art gallery house with eccentric decor
2020/06/22 0:00:00,Ford’s classic Mustang Mach 1 muscle car returns
2020/06/22 0:00:00,"NRL 2020: America freaks over savage hits in Eels, Bulldogs games"
2020/06/22 0:00:00,Cop charged over George Floyd murder harassed at supermarket
2020/06/22 0:00:00,Brad Pitt reveals which of his movie roles makes him wince
2020/06/22 0:00:00,"Girl, 4, suffers severe allergic reaction to caterpillar, prompting warning"
2020/06/22 0:00:00,Australian border closures: Why states should stay closed
2020/06/22 0:00:00,"Man, 21, dead after stabbing in Melbourne CBD"
2020/06/22 0:00:00,Two women allege unwanted sexual encounters by Justin Bieber
2020/06/22 0:00:00,Hugh Greenwood savages Adelaide Crows football director Mark Ricciuto in scathing Twitter burn
2020/06/22 0:00:00,US politics: Donald Trump’s re-election rally undermined by TikTok teens and K-Pop fans
2020/06/22 0:00:00,Cronulla Sharks’ Matt Moylan takes shot at Matty Johns after Canterbury Bulldogs’ Dallin Watene-Zelezniak hit
2020/06/22 0:00:00,"Coronavirus: Australians still shouldn’t kiss, hug or handshake"
2020/06/22 0:00:00,Coronavirus live updates: WA to keep borders closed in response to Vic outbreak
2020/06/22 0:00:00,2009/10: Baxter the dog lucky to survive after eating owner’s lacy black G-string
2020/06/22 0:00:00,Coronavirus: Victoria records 16 new COVID-19 cases
2020/06/22 0:00:00,Striking modern design in a historic Tassie town
2020/06/22 0:00:00,New home sites to offer the pinnacle of Geelong living
2020/06/22 0:00:00,Epic Sydney home has indoor soccer pitch and glass wall pool
