date,title
2021/05/29 0:00:00,Andrews government’s Canberra fury; five new local cases; nursing home in lockdown
2021/05/29 0:00:00,Postponed Indian Premier League creates dilemma for Cricket Australia
2021/05/29 0:00:00,‘Hurt like hell’: Umpire cops footy to the face
2021/05/29 0:00:00,Most expensive school catchments: home prices boom near high ranked public schools
2021/05/29 0:00:00,Fake schoolgirl Samantha Azzopardi jailed for two years for child stealing
2021/05/29 0:00:00,Sydney Kings reign supreme with overtime win against Melbourne United
2021/05/29 0:00:00,Suns outshine Hawks in relocated clash
2021/05/29 0:00:00,Essendon Bombers snap West Coast Eagles’ ridiculous streak
2021/05/29 0:00:00,New DR Congo volcanic eruption a 'false alarm': govt
2021/05/29 0:00:00,Reds become first Aussies to beat a Kiwi side this season
2021/05/29 0:00:00,Roosters make the most of another Raiders collapse
2021/05/29 0:00:00,Second DR Congo volcano eruption 'low intensity': govt
2021/05/29 0:00:00,Sydney thrash Adelaide to consolidate place in finals
2021/05/29 0:00:00,Roosters teen prodigy Joseph Suaalii becomes first 17yo to score an NRL try since 2009
2021/05/29 0:00:00,Brett Ratten defends Brad Hill after another quiet performance
2021/05/29 0:00:00,‘Giving me attitude’: NHL fan lets loose at arena security
2021/05/29 0:00:00,Second volcano erupts near DR Congo's Goma city: govt
2021/05/29 0:00:00,‘Strange’ injury blow for Collingwood ruckman Brodie Grundy
2021/05/29 0:00:00,Souths send statement with Eels victory
2021/05/29 0:00:00,‘In trouble’: Rabbits rout of Eels sparks Origin headaches
2021/05/29 0:00:00,AFL St Kilda v North Melbourne: Scrappy Saints back in the winner’s circle
2021/05/29 0:00:00,Morphettville Parks: Travis Doudle doubles up with former Kiwi longshots Jaguary and Not Usual Glorious
2021/05/29 0:00:00,‘Just a nonsense’: Bizarre AFL sub scenario exposes ‘horrible look’
2021/05/29 0:00:00,"Lachie Neale a chance to return against Dees, says Chris Fagan"
2021/05/29 0:00:00,Kidnapped teen found two years later thanks to broken car light
2021/05/29 0:00:00,Randwick: Dream Circle continues his rise with third city win in four starts
2021/05/29 0:00:00,'Friends': The One Where China Censors Lady Gaga And Justin Bieber
2021/05/29 0:00:00,Super Netball: Debutant Samason seals Vixens’ first win of the year
2021/05/29 0:00:00,Caulfield: Riot And Rose lifts spirits in the Peter Moody camp with another win
2021/05/29 0:00:00,Why comedian Em Rusciano believes in positive affirmations
2021/05/29 0:00:00,"Geelong shifting focus to Port clash after Pies ‘stinker’, says Scott"
2021/05/29 0:00:00,Jones combines with racing powerhouse to score on Gravina
2021/05/29 0:00:00,Photos from Jack de Belin’s return to footy
2021/05/29 0:00:00,Military deployed to Cali as Colombia marks full month of protests
2021/05/29 0:00:00,Serena’s stunner: Incredible hidden detail in star’s outfit
2021/05/29 0:00:00,Price of bitcoin drops amid cryptocurrencies worst month in nearly 10 years
2021/05/29 0:00:00,Panthers become first team undefeated after 12 rounds in 26 years
2021/05/29 0:00:00,Anti-vaxxer dies of Covid-19 complications
2021/05/29 0:00:00,Queensland Derby: Kukeracha edges out Senor Toba as James McDonald gets the pick of Chris Waller’s runners
2021/05/29 0:00:00,‘Unbelievable’: Jack Hetherington’s horror return from suspension
2021/05/29 0:00:00,At Sea Handicap: Adelong repays trainer Brad Widdup’s faith to get back in winners’ stall
2021/05/29 0:00:00,Woman dies after falling from Manhattan apartment building
2021/05/29 0:00:00,Lewis Hamilton slams rival’s ‘childish’ mind games
2021/05/29 0:00:00,"Gunnedah preview: Tips, best bets and inside mail"
2021/05/29 0:00:00,Tragic true story behind novel being compared to Trent Dalton’s Boy Swallows Universe
2021/05/29 0:00:00,BRC Sires’ Produce: Tiger Of Malay gives trainers Michael and Richard Freedman another 2YO victory for the season
2021/05/29 0:00:00,Pies and Cats play out ‘stinker’ at MCG
2021/05/29 0:00:00,California shooter an employer's worst nightmare
2021/05/29 0:00:00,Man City and Chelsea set for Champions League final showdown in Porto
2021/05/29 0:00:00,Couple sells wedding flowers from car after nuptials get cancelled for a second time
2021/05/29 0:00:00,Dragons ‘excited’ to welcome back de Belin
2021/05/29 0:00:00,Jarryd Hayne has quietly been moved to a new prison
2021/05/29 0:00:00,Dog owner kills three pit bulls who mauled his dog to death
2021/05/29 0:00:00,Melbourne’s anti-lockdown protesters face lengthy stints behind bars
2021/05/29 0:00:00,Aussies have rated the ‘best chocolate’ in the country
2021/05/29 0:00:00,Navy warship ‘swarmed by UFOs’ in leaked footage
2021/05/29 0:00:00,Young family snaps up modern Newtown home as auctions move online for Covid lockdown
2021/05/29 0:00:00,US targets Belarus with sanctions amid Western outcry over plane
2021/05/29 0:00:00,Fred Best Classic: Apache Chase topples Ayrton to secure spot in Stradbroke Handicap
2021/05/29 0:00:00,"Chinese scientists created Covid in a lab, new report claims"
2021/05/29 0:00:00,Police find giant bitcoin ‘mine’ during warehouse drug raid
2021/05/29 0:00:00,"Sydney auctions: Agent and seller baffled as fibro house in St Marys sells for $1.81 million, double the reserve"
2021/05/29 0:00:00,Big NRL halves dominoes fall with two mid-season switches confirmed
2021/05/29 0:00:00,Fashion designer Edwina Horseman dies at the age of 36
2021/05/29 0:00:00,Crews working to rescue missing Qld man found in deep forest
2021/05/29 0:00:00,Tourists scarce as travel bubbles fail to inflate
2021/05/29 0:00:00,Wife suing NRL star Michael Jennings over rape claim
2021/05/29 0:00:00,Coronavirus storm engulfs Everest
2021/05/29 0:00:00,Five Magic Millions horses dead in horrific truck crash
2021/05/29 0:00:00,Five local coronavirus cases as Health Minister Martin Foley provides update
2021/05/29 0:00:00,Southwest Airlines banned passenger accused of knocking out flight attendant’s teeth
2021/05/29 0:00:00,"NSW breaks daily vaccination record with 14,190 jabs on Friday"
2021/05/29 0:00:00,Newtown: Luxury living is on another level in this contemporary residence
2021/05/29 0:00:00,Sydney Eat Street: ClubsNSW Perfect Plate competition
2021/05/29 0:00:00,Thornbury dairy conversion blows $1.43m reserve out of the water
2021/05/29 0:00:00,Experts issue warning about shiba inu as prices surge
2021/05/29 0:00:00,"Nearly 400,000 flee DR Congo city over fears volcano could erupt again"
2021/05/29 0:00:00,"In US, tipped workers still feel the pandemic crunch"
2021/05/29 0:00:00,Canadian MP caught naked during telework for second time in a month
2021/05/29 0:00:00,What you can buy in Sydney: how much of the housing is affordable for each income group
2021/05/29 0:00:00,Leading epidemiologist says Victorian lockdown may be extended
2021/05/29 0:00:00,Mum’s warning after baby swallows Aldi trolley token
2021/05/29 0:00:00,Colombia's Duque says deploying military to protest-hit Cali
2021/05/29 0:00:00,Long wait times and technical issues crash Victoria’s vaccine hubs across Melbourne
2021/05/29 0:00:00,Craig McLachlan blasts reports of ‘fresh’ allegations against him
2021/05/29 0:00:00,"Nick Kyrgios, surely this trolling message is a joke?"
2021/05/29 0:00:00,The one where China cut the guest stars out of the Friends reunion
2021/05/29 0:00:00,MLS fine Inter Miami $2 mn over Matuidi salary rules violation
2021/05/29 0:00:00,"Nadal, Djokovic eye history as French Open settles down for quiet night in"
2021/05/29 0:00:00,US says will impose sanctions on Belarus after plane diversion
2021/05/29 0:00:00,‘Infuriating’ video emerges inside Melbourne pub before lockdown
2021/05/29 0:00:00,AFL player competes for Brunswick home with ‘awkward’ outdoor toilet
2021/05/29 0:00:00,Kylie Jenner stuns in revealing new bikini photo
2021/05/29 0:00:00,Sydney truckie pelted with rocks and bashed with crowbar
2021/05/29 0:00:00,Neymar responds to ‘absurd’ sexual assault claim that cost him $210m a year
2021/05/29 0:00:00,What is dusting? How hackers are exposing holes in cryptocurrency privacy
2021/05/29 0:00:00,Man charged after $3 million worth of marijuana seized in massive drug raids
2021/05/29 0:00:00,"14yo football player going viral for absurd physique, athleticism"
2021/05/29 0:00:00,School student from Mount Ridley College tests positive to Covid-19
2021/05/29 0:00:00,Mortifying way Jana Hocking discovered jail boyfriend was cheating
2021/05/29 0:00:00,"Rafael Nadal, Ash Barty delicately drop truth bombs on Naomi Osaka"
2021/05/29 0:00:00,"Mitch McConnell keeps saving Donald Trump, who nevertheless hates his guts"
2021/05/29 0:00:00,Playboy Constantine Arvanitis’s sex texts detailed in defamation trial against ex
2021/05/29 0:00:00,Mali constitutional court declares Colonel Goita transitional president
2021/05/29 0:00:00,Notorious wheel cactus weed infestations spreading ‘like a plague’ in Victoria
2021/05/29 0:00:00,Caroline Wozniacki pays $24m for penthouse in America’s priciest postcode
2021/05/29 0:00:00,'Known radical' killed in shootout after knife attack on French police
2021/05/29 0:00:00,2021 Audi SQ5 TDI review: Popular performance SUV returns
2021/05/29 0:00:00,Surf Coast seachange surge sees median house prices hit $1m
2021/05/29 0:00:00,Neymar says Nike claim of split over sex assault probe a 'lie'
2021/05/29 0:00:00,Remains of 215 children found at closed Canada indigenous boarding school
2021/05/29 0:00:00,"Germany admits Namibia genocide, but critics want more"
2021/05/29 0:00:00,"Man City, Chelsea get set for Champions League final clash in Porto"
2021/05/29 0:00:00,Biden proposes huge $6 tn budget to 'reimagine' US economy
2021/05/29 0:00:00,Impasse on commission underscores Republican angst over Jan 6
2021/05/29 0:00:00,Israeli forces kill Palestinian in West Bank: health ministry
2021/05/29 0:00:00,Church of Scientology tried to muzzle alleged rape victims of That 70s Show star Danny Masterson
2021/05/29 0:00:00,US calls on Myanmar to free detained American journalist
2021/05/29 0:00:00,US Senate Republicans block commission on Jan 6 Capitol riot
2021/05/29 0:00:00,Lukashenko tells Putin West is seeking to 'rock the boat' in Belarus
2021/05/29 0:00:00,Prince Harry didn’t pick up calls from his family the night Prince Philip died
2021/05/29 0:00:00,Aussie boxing star Isaac Hardman’s live TV best man proposal is too good
2021/05/29 0:00:00,Russian hackers of SolarWinds back on the attack
2021/05/29 0:00:00,Sri Lanka battles waves of plastic waste from burning ship
2021/05/29 0:00:00,The naked truth:  SA real estate agents recount their weirdest property stories
2021/05/29 0:00:00,EMA approves Pfizer jab for 12- to 15-year olds
2021/05/29 0:00:00,WHO Europe director says 'worried' about new more transmissible variants
2021/05/29 0:00:00,Pandemic won't be over until 70% are vaccinated: WHO to AFP
2021/05/29 0:00:00,"Port Melbourne, Epping and South Melbourne venues among new Covid exposure locations"
2021/05/29 0:00:00,Sydney auctions: Old brick house sells for record $9 million as more price records tumble
2021/05/29 0:00:00,"Same house, different address: Essendon couple list recreated California bungalow"
2021/05/29 0:00:00,Patonga beachfront beauty set to smash local sale price record
2021/05/29 0:00:00,Canberra home with its own soccer pitch in the backyard up for sale
2021/05/29 0:00:00,Unit market a gateway into Melbourne’s top suburbs
2021/05/29 0:00:00,Leigh Tudor: AFL figure and VFL coach lists Essendon home
