date,title
2021/03/16 0:00:00,Notorious football hooligan has been executed in front of daughter in ‘gangland revenge’
2021/03/16 0:00:00,Prince Philip leaves hospital after four-week stay and heart operation
2021/03/16 0:00:00,Mathias Cormann says he did not know about Brittany Higgins’ alleged rape before quitting politics but was briefed on CCTV
2021/03/16 0:00:00,MG reveals two new electric cars
2021/03/16 0:00:00,Des Hasler contract saga takes dramatic twist over clause
2021/03/16 0:00:00,James Weir recaps Married At First Sight Australia 2021 episode 15 | Bisexual MAFS groom forced to reveal sex list
2021/03/16 0:00:00,Attorney-General Christian Porter asked to give up some duties by PM after legal advice
2021/03/16 0:00:00,Investigation launched after newborn baby dies at Blacktown Hospital
2021/03/16 0:00:00,March 4 Justice: Jagajaga MP Kate Thwaites’ incredulous reaction to Senator Ben Small’s ‘mansplaining’
2021/03/16 0:00:00,Activation books spot in Country Championships Final after winning at Coonamble
2021/03/16 0:00:00,NFL’s secret ridiculously rich star gambled it all and won big time
2021/03/16 0:00:00,William Reid Stakes locked in as Brooklyn Hustle’s next Group 1 target
2021/03/16 0:00:00,Oakbank Easter Carnival has been reformed into a week-long event
2021/03/16 0:00:00,‘I’m going to light you up and kill you’: Man who threw petrol on ex and neighbour spared jail
2021/03/16 0:00:00,"Zack and Deborah Snyder on the pain, healing and how Justice League is helping to save lives"
2021/03/16 0:00:00,"Significant rain for NSW, Qld for the next week, forecasters say"
2021/03/16 0:00:00,Snake catcher finds dozens of snake skins in roof of Gold Coast home
2021/03/16 0:00:00,Hollywood’s biggest do-over: Just how bad was Joss Whedon’s Justice League cut?
2021/03/16 0:00:00,Racing Victoria disqualifies 72 horses embroiled in Aquanita scandal but owners won’t be forced to repay prizemoney
2021/03/16 0:00:00,Victorian MP Brad Battin resigns from shadow cabinet following failed leadership spill
2021/03/16 0:00:00,Rugby star’s hilarious interview goes viral for all the right reasons
2021/03/16 0:00:00,"ASX rises, materials ‘conspicuously absent’ from rally and analysts tip ASX200 returning above 7000"
2021/03/16 0:00:00,"NRL 2021 Round 2 Teams: Souths dump Josh Mansour, Jacob Host for clash with Manly"
2021/03/16 0:00:00,North Korea warns US against ‘causing a stink’
2021/03/16 0:00:00,Vanderpump Rules star Lala Kent gives birth to daughter Ocean
2021/03/16 0:00:00,Gerald Ryan says his filly Mallory is flying under the radar ahead of the Golden Slipper
2021/03/16 0:00:00,Brett Halcro: Fresh charges for teens in alleged Pyrmont stabbing attack
2021/03/16 0:00:00,Mia Farrow claims Woody Allen ‘weaponised’ adopted daughter Soon-Yi Previn against her: ‘I love’ her
2021/03/16 0:00:00,Randwick-Kensington preview: Jason Deamer is excited to see what Double Ex can do in town
2021/03/16 0:00:00,Qld Health Minister Yvette D’Ath reveals she was sexually harassed
2021/03/16 0:00:00,Graeme Carey previews Doomben’s Wednesday card
2021/03/16 0:00:00,Richmond agrees to contract with coach Damien Hardwick after summer of drama
2021/03/16 0:00:00,Did Meghan need to say Kate’s nasty nickname during Oprah interview?
2021/03/16 0:00:00,Bindi Irwin’s baby: Bizarre birth theory has surfaced
2021/03/16 0:00:00,South Australia offers free vouchers up to $200 to spend on experiences and hosted tours
2021/03/16 0:00:00,Michelle Payne reveals warmer climate and rising money on offer in Queensland key reasons behind her training expansion
2021/03/16 0:00:00,"NRL team lists Round 2: Josh Mansour dropped by Rabbitohs, Sharks’ shake-up"
2021/03/16 0:00:00,"NFTs explained: What is a non-fungible token and why are Elon Musk, Kings of Leon and Jack Dorsey selling them"
2021/03/16 0:00:00,Chinese diplomat says people should reconsider investing or living in Australia
2021/03/16 0:00:00,"Gold Coast mum accused of murdering adult kids ‘controlled’ son’s life, court told"
2021/03/16 0:00:00,How Melbourne property market went from doom to boom in three months
2021/03/16 0:00:00,Adelaide young gun Kusini Yengi wants racist trolls to be educated after receiving ugly messages last weekend
2021/03/16 0:00:00,Scott Morrison says March4Justice slur claims false and ‘twisted’
2021/03/16 0:00:00,Ford Shelby Mustang Super Snake revealed
2021/03/16 0:00:00,GWS Giants AFL news: Greater Western Sydney Giants onballer Josh Kelly eyeing repeat of his 2017 All-Australian campaign
2021/03/16 0:00:00,Bada Bing nightspot owners have COVID-19 fine slashed due to money woes
2021/03/16 0:00:00,Kim K calls the past year ‘a huge cleanse’ amid her divorce from husband Kanye West
2021/03/16 0:00:00,"Aussie actors Simon Baker, Bryan Brown, Marta Dusseldorp and Justine Clarke take demands to Canberra"
2021/03/16 0:00:00,Australian Banking Association says most loans put on hold during pandemic have resumed repayments
2021/03/16 0:00:00,NSW Labor leader Jodi McKay addresses caucus after catastrophic polling released
2021/03/16 0:00:00,Question time: Scott Morrison defends ‘bullets’ remark about Australian democracy
2021/03/16 0:00:00,"Friends stars Rachel, Phoebe and Monica have bare arms blurred by Turkish newspaper"
2021/03/16 0:00:00,"‘Complete mess’: Butler slams PM over Canavan, vaccine rollout delays"
2021/03/16 0:00:00,Young doctors join class action against Victorian hospitals over unpaid wages
2021/03/16 0:00:00,Khloe Kardashian and Tristan Thompson engagement ring rumours
2021/03/16 0:00:00,Lindsay Park trainers Tom Dabernig and Ben Hayes to go their separate ways
2021/03/16 0:00:00,Basketball Australia: Mitch Creek’s Olympic hopes in limbo after assault charge
2021/03/16 0:00:00,Ormeau: Police warn public not to approach Mark Lutgenau amid manhunt after Gold Coast school plunged into lockdown
2021/03/16 0:00:00,Rob Gronkowski inks $13 million deal to stay with Tom Brady in Tampa Bay
2021/03/16 0:00:00,5G vs NBN — what’s better for home internet?
2021/03/16 0:00:00,Man who allegedly filmed child in shower to plead not guilty
2021/03/16 0:00:00,Why you can’t put Kmart drink bottles in dishwasher
2021/03/16 0:00:00,Canterbury Bulldogs coach Trent Barrett gets approval for $770k home in Barrack Point
2021/03/16 0:00:00,International student arrivals to Australia massively down in January
2021/03/16 0:00:00,Bondi boomer couple convicted of $6m fraud
2021/03/16 0:00:00,Tube House: Architect’s award-winning Carlton ‘Tube House’ for sale
2021/03/16 0:00:00,‘The story was a hoax’: Donald Trump hits out after stunning Washington Post retraction
2021/03/16 0:00:00,The Amazing Race Australia: Aleisha’s panic in the Empress Canyon: ‘I’m gonna die’
2021/03/16 0:00:00,Shocking Rui Patricio knock halts Liverpool game for 15 minutes
2021/03/16 0:00:00,NRL to warn Toby Rudolf for saying he would ‘pull something’ at Northies
2021/03/16 0:00:00,New parents choosing ‘calendar’ names for their babies in 2021
2021/03/16 0:00:00,Ancestry set to back-up in the Group 1 William Reid Stakes at The Valley
2021/03/16 0:00:00,Man killed co-worker then pretended to be her in texts
2021/03/16 0:00:00,"CCTV image released after Penelope Katsavos, 78, allegedly attacked outside church"
2021/03/16 0:00:00,Golden Slipper: Profiteer and Stay Inside share favouritism after barrier draw
2021/03/16 0:00:00,University cop shared intimate images of slain student after she asked for his help
2021/03/16 0:00:00,Grand Theft Auto 5 fan fixes slow loading times for GTA Online
2021/03/16 0:00:00,Marise Payne’s no-show at Women’s March 4 Justice is not good enough
2021/03/16 0:00:00,"Residential prices record strongest quarterly growth in a year, ABS figures show"
2021/03/16 0:00:00,Questions raised over AstraZeneca vaccine as Europe pauses roll out over safety concerns
2021/03/16 0:00:00,‘Stop demonising men’: Pauline Hanson lashes out at Brittany Higgins
2021/03/16 0:00:00,Shane Heal set to be named Sydney Flames coach
2021/03/16 0:00:00,Samantha Markle says Meghan and Harry could be ‘headed for divorce’ after Oprah interview
2021/03/16 0:00:00,"Man attacked mother, thinking she as an alien, to be supervised for more than decade"
2021/03/16 0:00:00,Facts and figures for the Golden Slipper
2021/03/16 0:00:00,Woman fell pregnant with triplets while on the pill
2021/03/16 0:00:00,"Hollywood war explodes via new open letter to HFPA, with the body now promising to make changes"
2021/03/16 0:00:00,Titans plan fresh Broncos raid as plot thickens in Manly crisis
2021/03/16 0:00:00,Bronte home of Indigo Cafe owner sells for circa $9.5m as Sydney Kings founder lists for $6m
2021/03/16 0:00:00,Marcus Harris scored his first century since last November in gutsy style and tough conditions in Brisbane
2021/03/16 0:00:00,Indigenous elders deny tourists access to Cape York Tip over ‘disrespectful’ behaviour
2021/03/16 0:00:00,Waterfront character home just outside Port Lincoln stands out from the crowd
2021/03/16 0:00:00,Five of the most popular Airbnb homes in the UK
2021/03/16 0:00:00,Mount Vernon estate shatters record by $1.6m after selling for $1m over reserve at epic auction
2021/03/16 0:00:00,Sarah Everard death: Police officer investigated after sharing ‘inappropriate’ memes
2021/03/16 0:00:00,Donald Trump facing ‘stunning collapse’ as support wanes and legal issues loom
2021/03/16 0:00:00,Jarryd Hayne called sex assault accuser a ‘young cow’: court
2021/03/16 0:00:00,Call for ‘Hell Yeah’ sex education program on consent as 10-year-olds access violent porn
2021/03/16 0:00:00,"Teenage boy found deadm inside Charlestown apartment, man arrested"
2021/03/16 0:00:00,Papua New Guinea Covid cases surge as The Quad nations announce vaccine plan
2021/03/16 0:00:00,The 16 runners and their starting positions for the Golden Slipper
2021/03/16 0:00:00,"Michelle Obama encourages Meghan Markle, Prince Harry to forgive royal family"
2021/03/16 0:00:00,Actor gets five years for killing rapper with sword
2021/03/16 0:00:00,Brighton siege gunman started looking at extremist material when his mentor went on leave: inquest
2021/03/16 0:00:00,Line of Duty returns in two weeks with season 6 going to Britbox
2021/03/16 0:00:00,Tesla release new video of semi electric truck test drive
2021/03/16 0:00:00,March 4 Justice: Scott Morrison ‘completely missed the moment’ says Anthony Albanese
2021/03/16 0:00:00,"Australians with disability more likely to experience violence, new report shows"
2021/03/16 0:00:00,Brendan Fevola is furious at his daughter’s slut-shaming: ‘It pisses me off’
2021/03/16 0:00:00,Mount Macedon: ‘The Laurels’ showcasing the best of autumn
2021/03/16 0:00:00,17 best first birthday present ideas  in 2022
2021/03/16 0:00:00,Collingwood captain Scott Pendlebury likes the new substitute rule as other new rules take effect
2021/03/16 0:00:00,"No new community COVID-19 cases as restrictions on hospitals, aged care homes continue"
2021/03/16 0:00:00,March for justice: World’s media reacts to Australia’s big moment
2021/03/16 0:00:00,"Alexander Zverev complains about rankings, Roger Federer favouritism"
2021/03/16 0:00:00,Brett Sutton says he felt ‘awful’ as a father during the coronavirus pandemic in Victoria
2021/03/16 0:00:00,"From expensive drinks to bagging Vegemite, these are the 20 things to never do in Australia"
2021/03/16 0:00:00,Daniel Ricciardo already benefiting from McLaren’s bold calls
2021/03/16 0:00:00,How Meghan and Harry’s Oprah interview tricked viewers
2021/03/16 0:00:00,Debate erupts over Joey Leilua’s furious tweet after NRL temper tantrum
2021/03/16 0:00:00,James Robert Davis charged by AFP over allegedly keeping woman as sex slave
2021/03/16 0:00:00,"Afterpay launches European operation Clearpay in France, Spain and Italy"
2021/03/16 0:00:00,Woman buys hilariously long jeans in online shopping mistake
2021/03/16 0:00:00,Ronan Farrow makes shocking allegation about Woody in final episode of Allen v Farrow
2021/03/16 0:00:00,‘There’s no reason for borders to close’: Gladys Berejiklian’s demand after virus case
2021/03/16 0:00:00,Treasurer Josh Frydenberg puts states on notice over future border closures
2021/03/16 0:00:00,Inside Meghan Markle’s thorny relationship with Kate Middleton
2021/03/16 0:00:00,How China is building nightmarish surveillance state with cameras checking emotions and tracking ‘social credit’
2021/03/16 0:00:00,‘Fly high’: Tributes flow for renowned skydiver killed during competition in Jurien Bay
2021/03/16 0:00:00,Bivouac set to race at Royal Ascot before retirement to stud
2021/03/16 0:00:00,The Sex Clinic mum Tracy Kiss trolled for 11 times a day claim
2021/03/16 0:00:00,TikTok user says you should poo backwards to watch Netflix
2021/03/16 0:00:00,Melbourne grandmother bashed on steps of church by ‘gutless’ thug
2021/03/16 0:00:00,Facebook and News Corp Australia reach agreement for tech giant to pay for journalism
2021/03/16 0:00:00,Police investigate woman’s death in Melbourne’s northwest
2021/03/16 0:00:00,Kia EV6 revealed: First of brand’s seven electric cars
2021/03/16 0:00:00,Mt Gambier father fined for allowing 2yo to drive car while sitting on his lap
2021/03/16 0:00:00,WA Police launch major operation believed to be linked to killing of  Rebels bikie boss Nick Martin
2021/03/16 0:00:00,‘Waiting in the wings’: Caro’s stunning claim over Clarkson’s AFL coaching future
2021/03/16 0:00:00,Brad Battin fails in Victorian Liberal Party leadership challenge to overthrow Michael O’Brien
2021/03/16 0:00:00,Craig Kelly’s push to suspend AstraZeneca vaccine rollout in Australia
2021/03/16 0:00:00,Tennis freak hits two insane trick shots against stunned opponent
2021/03/16 0:00:00,Newspoll: Sexual assault allegations rock Coalition support
2021/03/16 0:00:00,"Police, ambulance crews abseiling into Blue Mountains canyon to rescue two hikers"
2021/03/16 0:00:00,‘The Talk’ goes on hiatus after Sharon Osbourne’s meltdown
2021/03/16 0:00:00,How Australia aiming for full employment could lead to higher wages
2021/03/16 0:00:00,Fury as Prime Minister Scott Morrison ‘too busy’ to attend March4Justice
2021/03/16 0:00:00,Baby boy allegedly freezes to death while mum gets hair dyed
2021/03/16 0:00:00,Mia Fevola unveils new romance with Bulldogs rookie Jamarra Ugle-Hagan
2021/03/16 0:00:00,Zack Snyder’s Justice League: The reviews are in
2021/03/16 0:00:00,Mia Fevola is being slut-shamed after going public with new AFL boyfriend
2021/03/16 0:00:00,Photos show why cricket crowds scrapped for India vs England T20s
2021/03/16 0:00:00,Experts slam handling of Tiger Woods crash probe after troubling discovery
2021/03/16 0:00:00,‘Perception is important’: Broncos legend embroiled in Dally M Medal voting controversy
2021/03/16 0:00:00,‘We may never find the link’: Gladys Berejiklian’s coronavirus confession
2021/03/16 0:00:00,Disqualified driver charged after allegedly crashing car during test drive in Lurnea
2021/03/16 0:00:00,Live breaking news: Sydney P-plater totals dad's brand new $70k Mustang
2021/03/16 0:00:00,Pippa Middleton gives birth to second child
2021/03/16 0:00:00,‘You might not be the coach’: NRL legend warns Payten’s ‘brave’ call could cost him a job
2021/03/16 0:00:00,Anthony Joshua-Tyson Fury is official: Here’s everything you need to know
2021/03/16 0:00:00,"COVID-19 vaccine: France, Germany and Italy suspend use of AstraZeneca jab"
2021/03/16 0:00:00,Prince Charles ‘hurt’ by Harry and Meghan’s Oprah interview
2021/03/16 0:00:00,"Meghan and Harry’s backyard wedding ‘didn’t happen’, says vicar"
2021/03/16 0:00:00,Oscars 2021: History making year and rogue nominations as nominees announced for 93rd Academy Awards
2021/03/16 0:00:00,Sarah Everard vigil: Patsy Stevenson reveals truth about arrest photo
2021/03/16 0:00:00,Four bidders contest riverside Highton house with bay views
2021/03/16 0:00:00,New $10m program to speak to 2000 people living with mental illness
2021/03/16 0:00:00,Brighton house tops reserve by $1m in flying Melbourne market
2021/03/16 0:00:00,Sydney investor pays $195K premium at Newcomb auction
2021/03/16 0:00:00,Eltham Montsalvat-connected mansion from Olivia Newton-John doco for sale
