date,title
2021/11/18 0:00:00,US high school quarterback has eight touchdowns one day after mother’s death
2021/11/18 0:00:00,Tupou and Alaalatoa return from concussion for Test against Wales
2021/11/18 0:00:00,Landlord wants ex-tenant to pay $385k for rowdy pandemic parties
2021/11/18 0:00:00,AFL veteran Shane Mumford’s surprising move after retiring for second time
2021/11/18 0:00:00,Scott Morrison says Australian government ‘very open’ to talks with China after surprise US meeting
2021/11/18 0:00:00,James Weir recaps The Bachelorette Australia 2021 episode 9
2021/11/18 0:00:00,Woman arrested after shocking video of hurling spicy soup in restaurant worker’s face goes viral
2021/11/18 0:00:00,WTA threatens to cancel tournaments in China unless missing star’s safety is proven
2021/11/18 0:00:00,Legendary jockey Malcolm Johnston says James McDonald can be the greatest ever
2021/11/18 0:00:00,Dominic Perrottet’s Bradfield oration on NSW’s post-Covid future
2021/11/18 0:00:00,Manly makes big call on utility star Dylan Walker
2021/11/18 0:00:00,Manta ray sighting: Darwin man catches video of giant ray
2021/11/18 0:00:00,Luxury Manly oceanfront apartment sells more than $4m over guide
2021/11/18 0:00:00,"Jarrad Lovison death: Witness tells of shirtless, late night visit from murder accused"
2021/11/18 0:00:00,‘QAnon Shaman’ Jacob Chansley sentenced to 41 months over US Capitol riots
2021/11/18 0:00:00,Sky Blues desperate to regain A-League title after a barren season
2021/11/18 0:00:00,Former Labor MP and trade union official Craig Thomson granted bail amid migration fraud accusations
2021/11/18 0:00:00,Ballarat Cup: Zayydani can take short way home again from barrier one
2021/11/18 0:00:00,Victorian greyhound trainer Rinaldo Divirgilio cops life ban for live baiting-related offences
2021/11/18 0:00:00,"Indian Prime Minister Narendra Modi takes veiled swipe at China, saying technology shouldn’t be misused"
2021/11/18 0:00:00,Reserve Bank official says The Great Resignation is a ‘US story’ and Australia is different
2021/11/18 0:00:00,Renters at risk of homelessness after Covid-19 disaster payments end
2021/11/18 0:00:00,"Raceday focus: Best bets, analysis for The Valley on Friday"
2021/11/18 0:00:00,A NT business owner has received hundreds of abusive phone calls after anti-vaxxers spread his phone number
2021/11/18 0:00:00,"HIV positive woman ‘cured’ herself without treatment, study suggests"
2021/11/18 0:00:00,"Best & Less blames sales slump on lockdowns, consumer caution … and cold weather"
2021/11/18 0:00:00,Blue Bayou review: Emotional story that did too much
2021/11/18 0:00:00,SA Deputy Premier could be following vote of no-confidence
2021/11/18 0:00:00,"The genius way Squid Game is being snuck into North Korea, where citizens are watching in secret"
2021/11/18 0:00:00,"Australian sharemarket snaps two-day losing streak, investors cheer Evolution’s $1bn Qld copper-gold mine buyout"
2021/11/18 0:00:00,‘Fed up’ Aussies willing to take a pay cut for a better work experience
2021/11/18 0:00:00,Ex-AFL star Dane Swan announces overseas move
2021/11/18 0:00:00,Malkovich can continue Bjorn Baker’s early season momentum in The Warra
2021/11/18 0:00:00,Canada’s Saad Bin Zafar makes history with mind-boggling spell against Panama
2021/11/18 0:00:00,Why a wider world media diet might help restore our mojo
2021/11/18 0:00:00,"Lady Gaga’s striking, braless red carpet look at House of Gucci premiere"
2021/11/18 0:00:00,‘Significant storm event’ set to ruin weekend
2021/11/18 0:00:00,Geelong towns where stamp duty bills have risen most
2021/11/18 0:00:00,Rare north shore development site in prime Neutral Bay location comes to market
2021/11/18 0:00:00,Eels star Isaiah Papali’i makes shock $1.8m move to Wests Tigers
2021/11/18 0:00:00,‘Troubled’: SAS accused ‘killer’ squadmate turns against Ben Roberts-Smith
2021/11/18 0:00:00,US man reveals phrases he never heard of until moving to Australia
2021/11/18 0:00:00,"Sterling First victims fall through gaps for social security support, draft compensation scheme"
2021/11/18 0:00:00,Wisdom teeth removals: will you be out of pocket?
2021/11/18 0:00:00,Godolphin trainer James Cummings taking the glass half full approach
2021/11/18 0:00:00,Raceday focus: Best bets for Grafton and Orange
2021/11/18 0:00:00,Big autumn plans for Godolphin colt Anamoe could include Royal Ascot
2021/11/18 0:00:00,Victoria will go to Covid normal from Friday with full capacity for all sports venues including the MCG for Boxing Day Test
2021/11/18 0:00:00,More than $2 billion owed to Australians in unclaimed cash
2021/11/18 0:00:00,Melbourne City coach Patrick Kisnorbo won’t accept complacency in his side’s title defence
2021/11/18 0:00:00,Fashion e-tailer Shein marks launch in Australia with Sydney runway show
2021/11/18 0:00:00,GoPro Hero 10: From new features to image quality
2021/11/18 0:00:00,’We did nothing wrong’: Sellers say taking couple’s $75k was ‘fair’
2021/11/18 0:00:00,Queen repeats subtle snub of Meghan Markle
2021/11/18 0:00:00,Eagle Farm meeting delayed as officials prepare plans for embattled track
2021/11/18 0:00:00,NBA Wrap: Josh Giddey continues to impress as Patty Mills stars
2021/11/18 0:00:00,Last Night in Soho drops you in its hallucinogenic horrors
2021/11/18 0:00:00,Truck driver shares secret road trip rule no one told you about
2021/11/18 0:00:00,Tony Gollan turns to rehab master to get Zoustyle back to the races
2021/11/18 0:00:00,Qantas launches ‘double dip’ campaign for frequent flyer members
2021/11/18 0:00:00,"Preview, Tips and Best Bets for Sunshine Coast Saturday"
2021/11/18 0:00:00,How the cancellation of joint-school production Grease in Perth made headlines in New York
2021/11/18 0:00:00,Shawn Mendes and Camila Cabello release joint statement confirming break-up
2021/11/18 0:00:00,Apple will allow users to repair their own devices in a major shake-up
2021/11/18 0:00:00,Supercars driver Dave Reynolds returns after Covid-19 vaccine saga
2021/11/18 0:00:00,Nanny accused of crimes against humanity fights extradition
2021/11/18 0:00:00,Peter Dutton slams China as a bully amid Taiwan war threat
2021/11/18 0:00:00,Triple M host Mark Geyer says he was ‘shocked’ by Lawrence Mooney’s abrupt exit
2021/11/18 0:00:00,Experts clear up common misconception about Covid vaccines
2021/11/18 0:00:00,Fake doctor Zhi Sin Lee pleads guilty to working while unregistered at Bankstown-Lidcombe Hospital
2021/11/18 0:00:00,Parasailing couple survive after rope snaps at Nagoa Beach | Video
2021/11/18 0:00:00,"Raceday focus: Tips, analysis and best bets for Ballarat Cup day on Saturday"
2021/11/18 0:00:00,Scott Morrison blasted for allegedly trying to gain support from ‘coalition of anti-vaxxers’
2021/11/18 0:00:00,Cassandra Sainsbury says she’s engaged to be married
2021/11/18 0:00:00,First swelter of spring in Victoria as Melbourne climbs to 25C
2021/11/18 0:00:00,Eve Black: Infamous Covid-19 breacher pleads guilty to licence charge
2021/11/18 0:00:00,Birthmark on best friend’s baby helps woman learn of affair
2021/11/18 0:00:00,Covid-19 vaccinations will be mandatory at Queensland racetracks from next month
2021/11/18 0:00:00,Relationship Rehab: Man’s sex reason for wanting to leave wife
2021/11/18 0:00:00,‘Cowardly’: Olympics bosses slammed over call on transgender athletes
2021/11/18 0:00:00,Clifton Springs: Buyers flock to unusual A-frame home
2021/11/18 0:00:00,Matthew Wade reveals he played through the pain of an injury suffered the day before the T20 World Cup final victory
2021/11/18 0:00:00,DoorDash delivery driver relives herself outside customer’s building
2021/11/18 0:00:00,‘Bite your tongue’: Relationships in trouble
2021/11/18 0:00:00,"NT records no new cases overnight, but Chief Minister Michael Gunner warns next two days are ‘crucial’"
2021/11/18 0:00:00,Sydney and Melbourne residents locked out by ‘ludicrous’ border rule
2021/11/18 0:00:00,Black Duke heading in the right direction
2021/11/18 0:00:00,ALDI issues national recall for two cheese products amid suspected Listeria infection
2021/11/18 0:00:00,Bentleigh property price record: Penthouse priced for benchmark
2021/11/18 0:00:00,William Tyrrell’s foster parents say they have ‘nothing to hide’
2021/11/18 0:00:00,McDonald’s Australia has revealed its mammoth 2020 shopping list
2021/11/18 0:00:00,Move to ban bags from WA Schoolies labelled ‘sexist’
2021/11/18 0:00:00,‘I am a woman’: Female footballer accused of being a man fires back
2021/11/18 0:00:00,Grafton preview: Jim Jarvis’ stable additions Havieron and Hauraki Gulf already paying their way
2021/11/18 0:00:00,Piers Morgan slams Adele for ‘sharing her son’s divorce pain to flog her album’
2021/11/18 0:00:00,Glen Boss aiming for big spring carnival finish with Spanish Mission in Zipping Classic
2021/11/18 0:00:00,Jetstar brings back Return for Free sale for domestic and international destinations
2021/11/18 0:00:00,Husband charged over the murder of Kenyan Olympic star
2021/11/18 0:00:00,5 reasons why you need hospital insurance cover
2021/11/18 0:00:00,Netflix reveals weekly top 10 lists by number of hours viewed – Red Notice tops first movies list
2021/11/18 0:00:00,Police release new footage of search as PM breaks silence on William Tyrrell investigation
2021/11/18 0:00:00,"Scott Morrison slams Melbourne rally, insists violent protests have ‘no place in Australia’"
2021/11/18 0:00:00,American rapper Young Dolph shot dead in hometown
2021/11/18 0:00:00,Gala cryptocurrency surges 45 per cent as experts make bullish predictions
2021/11/18 0:00:00,AFP uses ground penetrative radar to look for disturbances as focus shifts to garage
2021/11/18 0:00:00,Hospice nurse reveals what most people say before they die and what happens when they do
2021/11/18 0:00:00,Police use replica Spider-Man suit as they search new site for William Tyrrell’s body
2021/11/18 0:00:00,Powerball to jackpot from $40 million
2021/11/18 0:00:00,Comedian Andy Lee buys unliveable $8.5m Melbourne mansion
2021/11/18 0:00:00,Three reasons the Australian dollar could decline in 2022
2021/11/18 0:00:00,John Sargent’s advice could work against him on Saturday
2021/11/18 0:00:00,New Zealand’s ‘most expensive house’ sells for $17 million
2021/11/18 0:00:00,‘So stupid’: New Zealand cricketers expose scheduling farce
2021/11/18 0:00:00,2021 Citroen C4 has arrived in Australia
2021/11/18 0:00:00,Covid update: Restrictions end at midnight in Victoria
2021/11/18 0:00:00,Major plot twist hits Netflix’s Tiger King sequel
2021/11/18 0:00:00,‘Tim Tszyu is a monster’: America reacts to Aussie boxing beast
2021/11/18 0:00:00,Experts warn of a bumper flu season that could come early
2021/11/18 0:00:00,Prime Minister Scott Morrison makes awkward Irish remark during visit to Tooheys Brewery
2021/11/18 0:00:00,Teaching assistant who told fake sob story to go on Rome holiday caught out in single post
2021/11/18 0:00:00,Disgraced businessman Ron Brierley fights to be released from jail
2021/11/18 0:00:00,Meet the influencers making millions off DIY content
2021/11/18 0:00:00,‘What the hell’: World can’t believe China’s ‘fake’ email from missing star
2021/11/18 0:00:00,"Woman charged over alleged fake doctor, Covid exemption racket faces more court delays"
2021/11/18 0:00:00,Ellen DeGeneres pokes fun at Meghan Markle’s TV appearance in unearthed clip
2021/11/18 0:00:00,Aaron Finch stands down as captain of the Melbourne Renegades
2021/11/18 0:00:00,"Kyle Rittenhouse defence requests mistrial, alleging prosecution withheld evidence"
2021/11/18 0:00:00,Moment tradie discovers he won the lotto captured on camera
2021/11/18 0:00:00,‘Domino effect’ warning as $200 billion wiped off cryptocurrency market
2021/11/18 0:00:00,Adam Scott opens up on 2021 battles and pandemic issues but declares he’s not done winning
2021/11/18 0:00:00,Byron Bay tops 2022 hostel list as Aussies embrace holidaying at home
2021/11/18 0:00:00,‘Prettiest girl on TikTok’ accused of racist slur in Russian TV interview
2021/11/18 0:00:00,Former England cricketer Ebony Rainford-Brent shares ‘utterly disgusting’ letter
2021/11/18 0:00:00,Brittany Higgins rape case: Bruce Lehrmann to face trial next year
2021/11/18 0:00:00,Big Bash: Aaron Finch makes surprising call to stand down as Melbourne Renegades captain
2021/11/18 0:00:00,NSW records 262 new local cases of coronavirus and three deaths
2021/11/18 0:00:00,‘Finish your honeymoon’: Tim Tszyu calls out next opponent after Inoue win
2021/11/18 0:00:00,Rust script supervisor’s bombshell gun claim in lawsuit
2021/11/18 0:00:00,Counter-terrorism police charge Melbourne man after alleged Daniel Andrews death threat
2021/11/18 0:00:00,‘Extremely harmful’: China’s harsh new cryptocurrency move sends shudders through the market
2021/11/18 0:00:00,‘Crowd not happy’: Tim Tszyu’s problem exposed in Inoue obliteration
2021/11/18 0:00:00,"Fresh virus threat as Victoria records 1007 new cases, 12 coronavirus deaths"
2021/11/18 0:00:00,Forbes flood levels dropping but residents told to stay on alert
2021/11/18 0:00:00,Ashes: Australian vice-captain Pat Cummins expects changes to fast-bowling group during five-Test series against England
2021/11/18 0:00:00,US general says China could use hypersonic missile to launch surprise nuclear strike
2021/11/18 0:00:00,Tried and tested: Tech expert’s pick of security cameras
2021/11/18 0:00:00,Gary Jubelin defends early William Tyrrell investigation from criticism
2021/11/18 0:00:00,Why Nissan GT-R owners are asking Ferrari prices
2021/11/18 0:00:00,Radio hosts’ shock at beautician’s gross find when waxing
2021/11/18 0:00:00,"Fight Club: Australia’s premier boxing and MMA column, news"
2021/11/18 0:00:00,Charles’ update on Queen’s health: ‘It’s not as easy as it used to be’
2021/11/18 0:00:00,Tragedy as rugby star Jannie du Plessis’ 10-month-old son drowns in family pool
2021/11/18 0:00:00,Two men convicted for Malcolm X assassination to be exonerated
2021/11/18 0:00:00,Northern Beaches clubs continue to ban unvaccinated patrons beyond December 15
2021/11/18 0:00:00,Boy arrested over $46 million crypto theft in biggest-ever heist from one person
2021/11/18 0:00:00,William Tyrrell’s foster parents charged with alleged assault of a child
2021/11/18 0:00:00,Perks of working for Emirates as airline goes on massive recruitment drive
2021/11/18 0:00:00,Daniel Andrews government’s ‘flawed’ pandemic policy in limbo
2021/11/18 0:00:00,William Tyrrell’s grandmother concedes she has lost all hope of the mystery being solved
2021/11/18 0:00:00,‘Do some work’: Tim Tszyu sledges dad Kostya after latest win
2021/11/18 0:00:00,Catastrophic overfishing in South China Sea could lead to extinction
2021/11/18 0:00:00,Model found dead on footpath after night out in LA
2021/11/18 0:00:00,‘We want you’: Scott Morrison urges hundreds of thousands of Aussies to fill jobs this summer
2021/11/18 0:00:00,Meghan Markle makes surprise appearance on The Ellen Show
2021/11/18 0:00:00,‘Made of granite’: Takeshi Inoue blows Australia away after Tim Tszyu onslaught
2021/11/18 0:00:00,Most vaccinated place on Earth told to cancel holiday plans amid ‘exponential’ rise in Covid cases
2021/11/18 0:00:00,Regulator pings Tabcorp over illegal in-play betting on US college basketball
2021/11/18 0:00:00,Rose Bay home of MasterChef Josh Niland’s famous fish restaurant up for auction
2021/11/18 0:00:00,Ascot Vale property market boosted by Rothwell Hill houses as suburb becomes ‘exclusive’
2021/11/18 0:00:00,Family pays $150K premium to lock in riverside Newtown location
