date,title
2021/09/06 0:00:00,Fresh hope in Somerton Man mystery as forensic researchers examine DNA
2021/09/06 0:00:00,"Marchers walk 7,000 steps for Canadian pair detained by China"
2021/09/06 0:00:00,Nigeria troops raid bandit camps in northwest
2021/09/06 0:00:00,Teenager on a ventilator as rule-breakers blamed for Victoria’s soaring Covid cases
2021/09/06 0:00:00,‘Red flag’: Teenage boxer’s tragic death sparks calls for change
2021/09/06 0:00:00,Details of vaccine passport trial revealed amid plan to get Sydneysiders back into pubs
2021/09/06 0:00:00,’It is rarified air’: Chris Scott says Geelong Cats won’t take preliminary final lightly
2021/09/06 0:00:00,SuperCoach Racing 2021: Every round and Group 1 race for the 2021 spring carnival
2021/09/06 0:00:00,Rapper crashes flying Tesla into building
2021/09/06 0:00:00,Luke and Josh furious over Kirsty’s pointed cheating song on The Block
2021/09/06 0:00:00,Moment missing three-year-old Anthony ‘AJ’ Elfalak discovered goes viral across the globe
2021/09/06 0:00:00,The Block 2021 episode 18 recap: Superior organisational skills or cheats? Mitch and Mark in hot water
2021/09/06 0:00:00,At least 30 dead in DR Congo massacre blamed on jihadists
2021/09/06 0:00:00,NSW grabs unfair share of vaccines in ‘hunger games’ with other states
2021/09/06 0:00:00,‘Putrid’ Tigers exposed for ‘mickey mouse review’ that won’t target ‘problem’ people
2021/09/06 0:00:00,Steve Price’s pointed question to Grace Tame as she doubles down on the PM on The Project
2021/09/06 0:00:00,High inflation looms over ECB meeting
2021/09/06 0:00:00,Man charged over stabbing death of father at Dandenong caravan park fronts court
2021/09/06 0:00:00,Scott Morrison granted travel exemption for Father’s Day dash to Sydney on VIP jet
2021/09/06 0:00:00,Barbora Krejcikova called ‘unprofessional’ by Garbine Muguruza at US Open
2021/09/06 0:00:00,‘Sirens going off’: Madeline Woods relives scary moment her newborn son Hudson tested positive to Covid
2021/09/06 0:00:00,Hysterical cyclist films brutal magpie attack for TikTok video
2021/09/06 0:00:00,Healthy baby terminated instead of sick twin by accident
2021/09/06 0:00:00,Ole Miss Rebels softball coach in middle of crazy scandal after alleged affair with player
2021/09/06 0:00:00,Sydney drug kingpin’s shocking $7000-a-day cocaine habit revealed
2021/09/06 0:00:00,NBL: Tom Digbeu joins Brisbane Bullets as part of Next Stars program
2021/09/06 0:00:00,NSW hospitals preparing to move to ‘code black’ as Covid-19 ICU admissions surge
2021/09/06 0:00:00,Mother of Caroline Lovell tells court about aftermath of allegedly botched home birth
2021/09/06 0:00:00,Socceroos: Martin Boyle battling a hamstring injury ahead of qualifier against Vietnam
2021/09/06 0:00:00,Fans blushing over Jessica Chastain and Oscar Isaac’s Venice red carpet antics
2021/09/06 0:00:00,World falls in love with new UFC star Paddy Pimblett
2021/09/06 0:00:00,Exciting colt Home Affairs could follow the same path as another Coolmore star to The Everest
2021/09/06 0:00:00,Manly superstar Tom Trbojevic sends finals rivals a serious attacking warning
2021/09/06 0:00:00,Australia being ‘left behind’ globally due to lack of net zero goal
2021/09/06 0:00:00,"Warriors prop Matt Lodge apologises, cops $5000 fine following brain fade"
2021/09/06 0:00:00,AFL 2021: Melbourne Demons skipper Max Gawn predicts ‘crazy’ scenes in preliminary final with Geelong Cats
2021/09/06 0:00:00,Surfing 2021: Stephanie Gilmore chasing historic eighth World Surf League title in revised format
2021/09/06 0:00:00,"Race day focus: Best bets, analysis for Pakenham Synthetic on Tuesday"
2021/09/06 0:00:00,Wendell Sailor reveals hilarious Mad Monday tale after grand final win
2021/09/06 0:00:00,NRL finals: Melbourne Storm still being influenced by legendary captain Cameron Smith
2021/09/06 0:00:00,"Australian sharemarket finishes marginally in the green, gold stocks up but ex-dividend FMG weighs"
2021/09/06 0:00:00,Pharmacists four times more likely to have complaints recorded
2021/09/06 0:00:00,Medvedev to face Dutch qualifier in US Open quarter-finals
2021/09/06 0:00:00,"Kiyomarcroos Jacob, who allegedly tried to kill best mate after drunken argument over money, to argue self defence: court"
2021/09/06 0:00:00,"Raceday Focus: Best bets, inside mail for Scone and Queanbeyan"
2021/09/06 0:00:00,‘Spoiled brat’: Piers Morgan blasts Naomi Osaka after US Open exit
2021/09/06 0:00:00,Flemington specialist Zoutori chasing a third Bobbie Lewis Quality win on Saturday
2021/09/06 0:00:00,Deputy Premier John Barilaro rules out Covid-19 curfew for regional NSW
2021/09/06 0:00:00,Uproar as Brazil v Argentina clash abandoned following Covid controversy
2021/09/06 0:00:00,Pacer disqualified after it was found to have competed in wrong race
2021/09/06 0:00:00,Melissa Leong debuts new romance on Instagram after split from husband last year
2021/09/06 0:00:00,Scone preview: Brett Cavanough says it time for Street Power to show just what he got
2021/09/06 0:00:00,Former South Sydney Rabbitohs player Luke Burgess sells Chifley home
2021/09/06 0:00:00,Denis Villeneuve says Dune is ‘sadly’ more relevant than ever
2021/09/06 0:00:00,Tasmania Police fine Victorian man for falsely claiming to be essential worker
2021/09/06 0:00:00,Moderna vaccine to arrive in Australia from US next week
2021/09/06 0:00:00,Lauren Jackson named in the WNBA’s best ever top 25 players
2021/09/06 0:00:00,Vigil review: Adrenaline-pumping murder mystery full of twists and turns
2021/09/06 0:00:00,"AFL 2021: Western Bulldogs suffer ‘big’ injury blow, sweating on Marcus Bontempelli’s fitness"
2021/09/06 0:00:00,Trainer Mike Moroney to use Tofane’s Makybe Diva Stakes run to decide on Cox Plate bid
2021/09/06 0:00:00,Wallabies coaching staff adamant three All Blacks thrashings are not all doom and gloom
2021/09/06 0:00:00,Taliban says last pocket of resistance in Afghanistan’s Panjshir Valley has been ‘completely captured’
2021/09/06 0:00:00,"Married teacher, 39, arrested for ‘raping schoolboy, 14, three times during one-to-one private study sessions’"
2021/09/06 0:00:00,Georgia Love apologises for Asian restaurant cat video
2021/09/06 0:00:00,Country trialling four-day working week with no salary cut
2021/09/06 0:00:00,Afghanistan: Pregnant former police officer executed by the Taliban in front of family
2021/09/06 0:00:00,JoJo Siwa makes red carpet debut with girlfriend Kylie Prew
2021/09/06 0:00:00,"Melbourne lockdown: online auctions smash reserves by up to $700,000"
2021/09/06 0:00:00,Melbourne Star shut down for good as Covid-19 lockdowns continue
2021/09/06 0:00:00,Trainer calls time on career of ‘old marvel’ Dreamforce
2021/09/06 0:00:00,How to claim investments and EFTs on Australian tax returns
2021/09/06 0:00:00,‘We wouldn’t be misled’: Crown assured regulator Perth casino was not embroiled in money laundering scandal
2021/09/06 0:00:00,Woman accused of murdering ex-husband faces court delays as ‘significant’ evidence outstanding
2021/09/06 0:00:00,Twist as charges dropped against Louay Shaker over alleged cockroach-infested pizza shop
2021/09/06 0:00:00,WA Premier Mark McGowan wants 90 per cent jab rate before reopening borders
2021/09/06 0:00:00,Islamic State group menace rebounds in Afghanistan
2021/09/06 0:00:00,Aldi reveals its 10 most popular products as voted by customers
2021/09/06 0:00:00,NRL: Sydney Roosters back returning star Victor Radley to keep playing on the edge
2021/09/06 0:00:00,Singer Mahalia Barnes sells Southern Highlands cottage
2021/09/06 0:00:00,Kyle Sandilands reveals which A-list celebrity he ‘hated’
2021/09/06 0:00:00,"Premier snaps as NSW records 1281 cases and five deaths, with worse to come within days"
2021/09/06 0:00:00,Cricket: Tasmanian Premier Peter Gutwein raises questions about November Test against Afghanistan
2021/09/06 0:00:00,Australian Survivor’s final three contestants revealed
2021/09/06 0:00:00,34 Best Watch Brands For Women To Buy In Australia In 2022
2021/09/06 0:00:00,NRL: Warriors forward Kane Evans could miss opening five weeks of 2022 season
2021/09/06 0:00:00,Historical aircraft enthusiasts embroiled in defamation battle over PNG museum agreement
2021/09/06 0:00:00,Melania hiding away while Donald Trump plans next presidential run
2021/09/06 0:00:00,Victoria lockdown: renter grants welcomed amid call for eviction ban
2021/09/06 0:00:00,Richard E. Grant posts heartbreaking tribute to wife of 35 years
2021/09/06 0:00:00,"Australians will soon be able to test themselves for Covid-19, Greg Hunt says"
2021/09/06 0:00:00,"Badja Forest bushfire: deadly blaze’s movement was ‘extraordinary’, inquiry hears"
2021/09/06 0:00:00,2022 Mercedes-AMG EQS 53 revealed
2021/09/06 0:00:00,Ex-F1 world champ Nico Rosberg’s gross pre-race reveal
2021/09/06 0:00:00,Emotional moment AJ Elfalak's family find out he's been found alive
2021/09/06 0:00:00,Trainer Norm Loy to appeal three month suspension for Facebook comments
2021/09/06 0:00:00,Luke Hemsworth lodges renovation plans for Suffolk Park home
2021/09/06 0:00:00,Bitcoin surges ahead of major change to El Salvador economy
2021/09/06 0:00:00,Pussycat Dolls reunion implodes as founder sues Nicole Scherzinger
2021/09/06 0:00:00,Cameron Smith’s hilarious response to ref’s truth bomb
2021/09/06 0:00:00,Queensland Premier blames slow rollout on federal government
2021/09/06 0:00:00,"Golf: Cameron Smith reunited with his father after $800,000 collect to end the season"
2021/09/06 0:00:00,"Nadia Bartel fined for Melbourne covid breach, dropped by vitamin brand"
2021/09/06 0:00:00,246 new cases in Victoria as mystery infections rise sharply
2021/09/06 0:00:00,Dad released from custody after killing mate who raped his daughter
2021/09/06 0:00:00,Hurley steps out in plunging gown in celebration of TV star’s birthday
2021/09/06 0:00:00,Harvey Weinstein calls Angelina Jolie accusations ‘brazenly untrue’
2021/09/06 0:00:00,Virgin Australia sale has one million flights from $49
2021/09/06 0:00:00,From lockup to landslide: meet DC's first leader elected from jail
2021/09/06 0:00:00,Meet Nadia Bartel’s inner-circle of former WAGS and Instagram stars
2021/09/06 0:00:00,"Army seizes power in Guinea, holds president"
2021/09/06 0:00:00,9/11: Ground Zero's forgotten migrant cleaners demand recognition
2021/09/06 0:00:00,Inside Nadia Bartel’s fall from grace after career triumph
2021/09/06 0:00:00,Sons’ search for answers in bookshop murder as inquest begins
2021/09/06 0:00:00,One-off $1500 payments for Victorians who have lost income during Covid-19 pandemic
2021/09/06 0:00:00,AFL 2021: Fremantle champion Matthew Pavlich urges caution in deal for Brownlow medallist Lachie Neale
2021/09/06 0:00:00,NSW reveals grim picture of ICU demand when Sydney outbreak peaks
2021/09/06 0:00:00,Calls for police to be barred from snooping on QR code check-in data
2021/09/06 0:00:00,Comedians Fuquan Johnson and Enrico Colangeli die of drug overdose
2021/09/06 0:00:00,Australia was living the good life before Delta came along
2021/09/06 0:00:00,Twilight Payment among three Joseph O’Brien Melbourne Cup entries to run in Irish St Leger
2021/09/06 0:00:00,'Freedom Tower' - the skyscraper symbolizing New York's resilience
2021/09/06 0:00:00,Seven weird things I miss about Australia
2021/09/06 0:00:00,NRL: Balmain royalty calls on Wests Tigers to be upfront with under-fire coach following ‘embarrassing’ loss
2021/09/06 0:00:00,"Truck carrying garlic bread catches fire, causes chaos on M1"
2021/09/06 0:00:00,Canberra records 11 new cases; changes announced to jab doses
2021/09/06 0:00:00,Mining worker crushed by machinery in tragic workplace accident
2021/09/06 0:00:00,NSW braces for surge in Covid-19 hospitalisations by October
2021/09/06 0:00:00,Man charged with murder after 65-year-old found dead at Maylands home
2021/09/06 0:00:00,Footage captures moment missing three-year-old Anthony ‘AJ’ Elfalak was spotted by police
2021/09/06 0:00:00,Rundown Sydney home sells for $3.8 million in Darlinghurst
2021/09/06 0:00:00,Josh Frydenberg urges Australian businesses to adopt ‘China plus’ strategy against economic coercion
2021/09/06 0:00:00,Daniel Ricciardo sacrifices race for Lando Norris in ultimate teammate move
2021/09/06 0:00:00,"‘Listen to your body’: Tasmanian Premier Peter Gutwein returns to work after hospital scare, drops two portfolios"
2021/09/06 0:00:00,"Posh shares rude, candid photo of husband Beckham"
2021/09/06 0:00:00,Controversial scintigraphy scans get Vow And Declare back on track for Melbourne Cup
2021/09/06 0:00:00,Sydney’s CheekyGlo make $1m in 11 months with exfoliating glove
2021/09/06 0:00:00,NRL 2021: Penrith Panthers star Brian To’o using prayer and chicken for finals success
2021/09/06 0:00:00,US tennis star Sloane Stephens shares abusive social media posts
2021/09/06 0:00:00,Australia is on the ‘frontline’ of China’s global strategic competition: Josh Frydenberg
2021/09/06 0:00:00,Shaynna Blaze sensationally slams Josh and Luke’s cinema room
2021/09/06 0:00:00,Three Adelaide homes that were once a city hotel listed for sale
2021/09/06 0:00:00,1281 new locally acquired Covid-19 cases in NSW: Gladys Berejiklian
2021/09/06 0:00:00,"Why Woolworths, Coles and Aldi shelves across Sydney are looking bare"
2021/09/06 0:00:00,Demi Moore showcases incredible figure in racy red carpet outfit
2021/09/06 0:00:00,Jailed footballer Jarryd Hayne hit with lawsuit by woman he sexually assaulted
2021/09/06 0:00:00,"Grace Tame, Brittany Higgins hit back after Scott Morrison’s keynote Women’s Safety Summit speech"
2021/09/06 0:00:00,Fake nanny Samantha Azzopardi abandons sentence appeal
2021/09/06 0:00:00,Dead coach walking: Ugly rift shows it’s over
2021/09/06 0:00:00,Kate Hudson stuns in revealing cut-out gown at Venice Film Festival
2021/09/06 0:00:00,Covid-19 Victoria: Authorities target jab hesitant  vaccine supplies increase
2021/09/06 0:00:00,Protests as Montenegro's new Orthodox head inaugurated
2021/09/06 0:00:00,Social cost of 2019's plastic more than GDP of India
2021/09/06 0:00:00,Man charged with horrific murder dies of cancer while awaiting trial
2021/09/06 0:00:00,"Climate action cannot wait for pandemic to end, medical journals warn"
2021/09/06 0:00:00,Flights begin to Singapore for vaccinated travellers
2021/09/06 0:00:00,Cycling: Australian Jack Haig joins some great names after finishing third in Tour of Spain
2021/09/06 0:00:00,Mum shares son’s maths question that’s stumped the internet
2021/09/06 0:00:00,The NT News’ website has a brand new look and feel - here’s your guide to all the changes
2021/09/06 0:00:00,More than 900 families isolated as Queensland records zero new local Covid-19 infections
2021/09/06 0:00:00,‘Frankly ridiculous’: Sky News blasts YouTube ban at media diversity inquiry
2021/09/06 0:00:00,Matt Jones opinion: Aussie middle distance and staying horses ‘average’
2021/09/06 0:00:00,Slow vaccine rollout risks leaving Queensland ‘underprepared’ for Covid-19 outbreak
2021/09/06 0:00:00,States are ‘locked in’ to begin reopening at 80 per cent vaccinated says Barnaby Joyce
2021/09/06 0:00:00,Covid-19 Victoria: Freedoms on horizon as state smashes out vaccination rates
2021/09/06 0:00:00,"Mark Currie has Soxagon “flying” ahead of return to racing, Weetwood Handicap target"
2021/09/06 0:00:00,New York protesters ‘pour petrol’ over police van after man killed by off-duty cops
2021/09/06 0:00:00,Nadia Bartel’s apology falls flat with fans who brand it ‘gutless’
2021/09/06 0:00:00,Star colt Anamoe headlines Run To The Rose nominations
2021/09/06 0:00:00,Stanley Tucci secretly battled cancer three years ago
2021/09/06 0:00:00,US TikTok users slam Woolies shopper over Aussie word
2021/09/06 0:00:00,Toddler rushed to hospital after being pulled from water on Qld farm
2021/09/06 0:00:00,Lando Norris leaves himself in stitches with F1 interview gaffe
2021/09/06 0:00:00,Lindy Rama-Ellis details her family’s ‘terrifying’ Covid-19 ordeal
2021/09/06 0:00:00,Woolies worker reveals self-serve checkout hacks
2021/09/06 0:00:00,"Sotrovimab being used to keep young, unvaccinated people out of ICU"
2021/09/06 0:00:00,Disturbing footage of road rage incident at KFC in Sydney west
2021/09/06 0:00:00,Leigh Sales vs. Annastacia Palaszczuk: What’s behind the high-profile spat?
2021/09/06 0:00:00,AFL star shuts down vicious teammate lie
2021/09/06 0:00:00,Victoria records 246 new local cases of coronavirus
2021/09/06 0:00:00,2021 Kia Sportage Australian details revealed
2021/09/06 0:00:00,"Gladys Berejiklian to release Covid-19 outbreak modelling, showing worse yet to come for NSW"
2021/09/06 0:00:00,Australian Survivor contestant Wai on her challenge wins and struggles
2021/09/06 0:00:00,Kaley Cuoco and Karl Cook have an ‘iron-clad prenup’
2021/09/06 0:00:00,Victorian Liberal MPs push to overthrow leader and beat Dan Andrews
2021/09/06 0:00:00,Mum issues hot tub warning as son ‘sucked into filter’
2021/09/06 0:00:00,Anarchy as authorities try to deport stars in the middle of a match
2021/09/06 0:00:00,"Hopes grow Qld lockdown disaster avoided after zero cases, but concerns remain"
2021/09/06 0:00:00,Taliban battle for Panjshir as US warns of Afghanistan civil war
2021/09/06 0:00:00,Angelina Jolie feared for the safety of her kids during marriage
2021/09/06 0:00:00,"More than one in 10 Covid-19 patients admitted to hospital in NSW, peak still to come"
2021/09/06 0:00:00,"Victoria, NSW Covid news live: Matt Canavan slams Telstra staff vaccination mandate"
2021/09/06 0:00:00,Finance Minister Simon Birmingham snaps at reporter as he comes under fire for JobKeeper failure
2021/09/06 0:00:00,Girls Aloud singer Sarah Harding dead at 39
2021/09/06 0:00:00,Prince Harry and Meghan Markle make ‘breathtaking’ offer to the Queen
2021/09/06 0:00:00,Moonee Valley Park development wins buyers with green appeal
2021/09/06 0:00:00,Auction: Original Grovedale home beats price hopes by $100K
2021/09/06 0:00:00,NSW Covid-19: Western Sydney tipped to kickstart state resurgence
2021/09/06 0:00:00,Close friend reveals major Michael Schumacher development
2021/09/06 0:00:00,Brazil v Argentina clash halted following Covid controversy
2021/09/06 0:00:00,"After six months on Mars, NASA's tiny copter is still flying high"
2021/09/06 0:00:00,‘Scary’ moment which nearly derailed Daniel Ricciardo’s Dutch Grand Prix
2021/09/06 0:00:00,Domestic violence and homelessness groups in new push for safe and affordable social housing
2021/09/06 0:00:00,Max Verstappen wins Dutch Grand Prix to regain championship lead
2021/09/06 0:00:00,First Pfizer doses land in Australia after securing four million vaccines from UK in swap deal
2021/09/06 0:00:00,"Plan to relocate Sydney airport controllers to Melbourne could impact noise, union says"
