date,title
2021/08/02 0:00:00,‘Terrible’: Aussie cyclist’s bike falls apart mid-race at Tokyo Olympics
2021/08/02 0:00:00,Weightlifter Hubbard becomes first trans woman at Olympics
2021/08/02 0:00:00,Tokyo Olympics 2021: Aussie 800m star Peter Bol runs in final on Wednesday night
2021/08/02 0:00:00,Tom Trbojevic stars as Sea Eagles dismantle Sharks
2021/08/02 0:00:00,Cash for jabs: Vaccine lottery could still be on the table for vaccinated Australians
2021/08/02 0:00:00,"Tokyo Olympics 2021: Colour, hairstyles, eye lashes - the track fashion that has captivated the Games"
2021/08/02 0:00:00,Adelaide Thunderbirds win hands Melbourne Vixens first Super Netball wooden spoon
2021/08/02 0:00:00,Millions under virus lockdown as China battles Delta outbreak
2021/08/02 0:00:00,Canada women’s football team defeats US for the first time in 20 year
2021/08/02 0:00:00,Survivor tribal council shock: ‘What just happened?’
2021/08/02 0:00:00,‘Angry’ Kerri-Anne Kennerley furious at the government over the National Disability Insurance Scheme
2021/08/02 0:00:00,Nicole Kidman had a special message for BMX gold medallist Logan Martin after Olympic win
2021/08/02 0:00:00,Brisbane Girls Grammar School student tests positive to Covid-19
2021/08/02 0:00:00,Farmer Will issues first detailed statement about Hayley’s pregnancy
2021/08/02 0:00:00,Melbourne Demons star Jack Viney sent straight to AFL tribunal for shot on Gold Coast’s Sam Collins
2021/08/02 0:00:00,Elite soldier Ian Turner died by suicide shortly after doctors ordered he be watched: inquest
2021/08/02 0:00:00,Brisbane inner-south suburbs on alert as exposure list explodes
2021/08/02 0:00:00,Professional development short courses are best to learn new skills on the job
2021/08/02 0:00:00,Rohan Browning reveals ‘semi-stupid’ secret to mixing it with world’s best sprinters
2021/08/02 0:00:00,‘Cocky’ star kicked out of Olympics for ‘unforgivable’ act
2021/08/02 0:00:00,Husband murdered bride then told her brother to ‘come and get the dead body’
2021/08/02 0:00:00,American defies Olympic rules by conducting banned act after winning silver
2021/08/02 0:00:00,Panthers star Stephen Crichton in hot water for giving Cameron Munster a taste of his own medicine
2021/08/02 0:00:00,Sydney Roosters finally catch a break amid injury horror-show
2021/08/02 0:00:00,Racing NSW CEO Peter V’landys is confident racing will continue through pandemic
2021/08/02 0:00:00,Man charged with impersonating federal cop following probe into fake video of AFP commissioner
2021/08/02 0:00:00,Nick Kyrgios drops cryptic retirement hint in revealing statement
2021/08/02 0:00:00,Socceroos: Football Australia officials hopeful of securing travel bubble for clash against China in Sydney
2021/08/02 0:00:00,China mocks Australia’s lockdown ‘double standard’
2021/08/02 0:00:00,Troops to enforce Sydney lockdown as Brisbane extends virus curbs
2021/08/02 0:00:00,"Australian sharemarket rockets to yet another fresh record high, boosted by massive M&A activity"
2021/08/02 0:00:00,Queenslanders urged to strongly consider getting AstraZeneca vaccine
2021/08/02 0:00:00,SA Cardiologist found with child exploitation material on his phone and disturbing sex messages
2021/08/02 0:00:00,Caulfield trainer Gemma Rielly with 2021 Victoria Derby hopes for Claidheamh Mor
2021/08/02 0:00:00,No 'eureka moment': the evolution of climate science
2021/08/02 0:00:00,Doctors sue Western Health as part of underpayment class action
2021/08/02 0:00:00,YouTuber Marcus Dibble’s sick communications with teen revealed in court
2021/08/02 0:00:00,Collingwood Magpies prepare for all-time first as AFL announces amended round 21 fixture
2021/08/02 0:00:00,Ash Barty posts one-word farewell to Tokyo after up-and-down Olympics
2021/08/02 0:00:00,Australian stars in tears after shocking Olympics upset
2021/08/02 0:00:00,System likely to remain in place after Pannell’s final day success
2021/08/02 0:00:00,Western Bulldogs confirm star recruit is in the frame to return this weekend
2021/08/02 0:00:00,Tokyo Olympics 2021: Kookaburras to face Germany in men’s hockey semi-final
2021/08/02 0:00:00,Chinese Tapei winning doubles badminton and dedicating it to Taiwan angers China
2021/08/02 0:00:00,"News briefs: August 2, 2021"
2021/08/02 0:00:00,"Raceday focus: Best bets, inside mail for Scone, Moruya"
2021/08/02 0:00:00,Centrelink bills Sydney families thousands over childcare subsidy during Covid lockdown
2021/08/02 0:00:00,New property report shows strength of Adelaide’s property market
2021/08/02 0:00:00,Why does the sand never stick to beach volleyball athletes in Tokyo?
2021/08/02 0:00:00,Tokyo Olympics 2021: Hockeyroos knocked out after quarter-final loss to India
2021/08/02 0:00:00,Big mobile phone price hike you need to know about
2021/08/02 0:00:00,Kaylee McKeown’s dog goes viral for his ‘naughty’ behaviour
2021/08/02 0:00:00,Essendon and Western Bulldogs rivalries put on hold when Fight In The Dog steps out at Pakenham
2021/08/02 0:00:00,"HSBC first-half profits more than double, resumes dividends"
2021/08/02 0:00:00,AMA vice-president says CHO’s views on vaccine are ‘inappropriate’
2021/08/02 0:00:00,Mitchell Moses set to return from injury for blockbuster clash with Rabbitohs
2021/08/02 0:00:00,'Powerless and angry': Japan's anti-Olympic activists fight on
2021/08/02 0:00:00,Doris Younane completely at home on the set of Five Bedrooms
2021/08/02 0:00:00,How Australia can beat its Olympics record in Tokyo
2021/08/02 0:00:00,Judge slams Liam Casley’s ‘low act’ while tradie bleeding out
2021/08/02 0:00:00,Jockey Craig Newitt happy to keep booting home long-priced winners going into spring
2021/08/02 0:00:00,Blake Lively and Ryan Reynolds celebrate 10 years together
2021/08/02 0:00:00,Australia name Wade captain for Bangladesh T20s
2021/08/02 0:00:00,Sharon Stone claims she’s ‘being threatened’ after vaccine request
2021/08/02 0:00:00,"Housing price boom ‘losing steam’, values climb at slower rate as affordability crisis deepens"
2021/08/02 0:00:00,Peter Dutton trapped in Queensland amid lockdown
2021/08/02 0:00:00,Qld coroner’s court receives report from police on death of Deklan Babington-MacDonald
2021/08/02 0:00:00,Island resort six hours from Brisbane hopes to be next Bali
2021/08/02 0:00:00,Dorsey's Square to buy Australia fintech Afterpay for $29 billion
2021/08/02 0:00:00,Father jailed for raping his biological son and daughter in Qld
2021/08/02 0:00:00,Portelli’s Sky Command ready to take on the boys in Listed feature
2021/08/02 0:00:00,Donald Trump’s political supporters have raised $112m in 2021
2021/08/02 0:00:00,"What to watch on streaming in August: Netflix, Disney, Binge, ABC iview, SBS, Amazon and more"
2021/08/02 0:00:00,Two fan favourite couples are sent home on Beauty and the Geek
2021/08/02 0:00:00,AFL: Crowds hold the key to MCG grand final return
2021/08/02 0:00:00,'Just part of the team' - McKeon humble despite historic swimming haul
2021/08/02 0:00:00,"Moruya, Scone previews: Giddy Up Gidleigh to provide an emotional win for Joseph and Jones families"
2021/08/02 0:00:00,"A few bizarre ‘sightings’ aside, Chinese tech billionaire Jack Ma hasn’t been seen in nine months"
2021/08/02 0:00:00,Mosman home where the late serial killer John Wayne Glover lived has sold again
2021/08/02 0:00:00,Why Queensland mum lets her kids swear
2021/08/02 0:00:00,Federal homelessness support cuts near $1bn: Homelessness Australia
2021/08/02 0:00:00,Omarjan Azari: Convicted terrorist won’t stand for a judge despite claiming to have renounced extremism
2021/08/02 0:00:00,US lawmakers finish $1 trillion infrastructure proposal
2021/08/02 0:00:00,American swimming villain drops a bomb on way out of Tokyo
2021/08/02 0:00:00,Median Sydney house price is now $1m as values rise 1.6% in July
2021/08/02 0:00:00,Neutrogena sunscreen recalled over fears it contains a potentially cancer causing substance
2021/08/02 0:00:00,"One year on, political interference besets Beirut blast probe"
2021/08/02 0:00:00,"Man, 24, needed double lung transplant after Covid-19 infection"
2021/08/02 0:00:00,Rafael Nadal criticises Novak Djokovic’s ‘strange’ Olympics tantrum
2021/08/02 0:00:00,Jimmy Barnes and wife Jane list Botany warehouse with it tipped to sell for over $4m
2021/08/02 0:00:00,Employers may have legal right to require staff  get vaccinated
2021/08/02 0:00:00,"Whatsapp messages reveal ‘inconsistency’ in Nine’s witness, Ben Roberts-Smith claims"
2021/08/02 0:00:00,Ismail Haniyeh re-elected as leader of Palestinian Islamist group Hamas
2021/08/02 0:00:00,Matthew Wade will captain Australia for five T20s in Bangladesh with Aaron Finch injured
2021/08/02 0:00:00,Former World Bank supremo Ian Goldin warns against China ‘sabre-rattling’
2021/08/02 0:00:00,Surprise detail in Melbourne Coles stuns shoppers on TikTok
2021/08/02 0:00:00,Queensland industry pleads for QRIC rethink with ‘racing people’
2021/08/02 0:00:00,Troops on Sydney streets as coronavirus response ramps up
2021/08/02 0:00:00,Ultra Tune legal battle: judge laments ‘mudslinging’ in court
2021/08/02 0:00:00,World losing it over Sifan Hassan’s ‘mind-blowing’ run in the women’s 1500m
2021/08/02 0:00:00,Billionaires’ ex-wives Melinda Gates and MacKenzie Scott team up to donate $54m
2021/08/02 0:00:00,"Clever mask hacks to stop the fog, lipstick transfer and get loops off ears"
2021/08/02 0:00:00,Police helicopter warning Sydney beachgoers to move on sparks debate
2021/08/02 0:00:00,Gladys Berejiklian hits back at criticism over Central Coast Pfizer supplies
2021/08/02 0:00:00,"South Australia eases Covid-19 restrictions, mask rules to remain"
2021/08/02 0:00:00,Wallabies: Quade Cooper giving coach Dave Rennie a pleasant selection headache
2021/08/02 0:00:00,#LetUsSpeak campaign helps Chrissie Foster win the right to say her daughter’s name
2021/08/02 0:00:00,Limp Bizkit frontman Fred Durst unrecognisable at Lollapalooza
2021/08/02 0:00:00,The White Lotus episode 4 recap: An X-rated cliffhanger
2021/08/02 0:00:00,North Bondi block sells for $22m+ but duplex next door for sale for about $20m
2021/08/02 0:00:00,Concern over Australia’s vaccination targets as expert says the country ‘must do better’
2021/08/02 0:00:00,Gladys Berejiklian reveals an additional number will help determine when Sydney’s lockdown will end
2021/08/02 0:00:00,Anti-lockdown protesters ‘tying up Qld police resources’ after lockdown extended
2021/08/02 0:00:00,Most popular properties over the past five years: the Sydney homes that attracted the most interest
2021/08/02 0:00:00,"Southeast Queensland lockdown extended by five days, Ekka cancelled as Delta cluster grows to 31 cases"
2021/08/02 0:00:00,‘Universal’ Aussie word baffles US expat
2021/08/02 0:00:00,Venues will soon be able to ask patrons for proof of coronavirus vaccinations
2021/08/02 0:00:00,Digital payment platform Square to buy Afterpay for $29 bn
2021/08/02 0:00:00,Michael Jordan reveals biggest Luc Longley regret
2021/08/02 0:00:00,Why the Mazda MX-5 can’t be beaten
2021/08/02 0:00:00,Jason Taylor returns to racing after suffering horrific injuries in barrier incident
2021/08/02 0:00:00,Best streetwear brands to populate your closet with
2021/08/02 0:00:00,"No jab, no game: Fans could be locked out of sporting events if they refuse to get the vaccine"
2021/08/02 0:00:00,The Matildas aren’t afraid of taking on the haters
2021/08/02 0:00:00,Qld CHO ‘genuinely doesn’t know’ how Covid-19 outbreak started as most cases revealed to be children
2021/08/02 0:00:00,Key vax target to ‘start saying goodbye’ to lockdowns
2021/08/02 0:00:00,Toyota LandCruiser celebrated with limited-edition model
2021/08/02 0:00:00,Insider’s guide to investing $5k
2021/08/02 0:00:00,Australia’s Pupnaps grows into $1m a month dog bed business
2021/08/02 0:00:00,How many days until Australia hits crucial covid vaccination targets and will be free from future lockdowns
2021/08/02 0:00:00,Qld records 13 new locally acquired Covid-19 cases as pin pulled on Ekka
2021/08/02 0:00:00,Aussie company Afterpay sells for $39 billion to Twitter founder Jack Dorsey’s Square
2021/08/02 0:00:00,Flight attendant reveals why you should not wear shorts on a plane
2021/08/02 0:00:00,Rebel Wilson to recreate Britney Spears film clip in new movie
2021/08/02 0:00:00,Humiliating stat as Zverev routs Khachanov to win Olympic gold
2021/08/02 0:00:00,Sarah ‘Fergie’ Ferguson dishes on a day in the life of a royal
2021/08/02 0:00:00,New modelling shows Sydney has avoided disaster so far
2021/08/02 0:00:00,"Fans stunned by incredibly youthful photo of Paul Rudd, 52"
2021/08/02 0:00:00,Iran rejects Israel's 'baseless accusations' over ship attack
2021/08/02 0:00:00,Transgender weightlifter in Olympic debut as Games hot up
2021/08/02 0:00:00,Three Hezbollah among 5 dead in Lebanon funeral ambush: security source
2021/08/02 0:00:00,"Ocon wins chaotic Hungarian GP, Hamilton takes championship lead"
2021/08/02 0:00:00,Scuffles in Berlin as Covid sceptics defy protest ban
2021/08/02 0:00:00,Heat reducing in Melbourne’s hot market as Australian home values rise by fastest rate in 17 years
2021/08/02 0:00:00,More than 700 saved from Mediterranean this weekend: aid group
2021/08/02 0:00:00,US music fest Lollapalooza drops DaBaby over AIDS comments
2021/08/02 0:00:00,Isner beats Nakashima to capture sixth ATP Atlanta title
2021/08/02 0:00:00,Benfica and PSV continue Champions League qualifying slog
2021/08/02 0:00:00,Zoom to settle US privacy lawsuit for $85 mn
2021/08/02 0:00:00,Home prices rise at rapid pace during Sydney lockdown but slowdown imminent: CoreLogic
2021/08/02 0:00:00,St Bernadette’s Primary Castle Hill second Sydney school to shut
2021/08/02 0:00:00,Two-headed turtle found on South Carolina beach
2021/08/02 0:00:00,Tributes flow for instructor who died saving skydiver in horror incident at Torqauy
2021/08/02 0:00:00,Early preview: Missile Stakes at Royal Randwick
2021/08/02 0:00:00,Disturbing video emerges after Olympic ‘kidnapping’
2021/08/02 0:00:00,Queensland lockdown extended until Sunday as state records 13 new local cases
2021/08/02 0:00:00,"Best Deals of the Week: $161 off Apple AirPods Max, up to 75% off Canningvale"
2021/08/02 0:00:00,Tokyo Olympics 2021: Raven Saunders risks disciplinary action for podium protest
2021/08/02 0:00:00,Shocking photo of Kanye West’s prison-like new living conditions
2021/08/02 0:00:00,‘Straight up cheated’: Americans blast Australia after women’s 4x100m medley win
2021/08/02 0:00:00,Foxtel and Amazon Prime Video integrate in new streaming deal
2021/08/02 0:00:00,Celeste Barber hilariously reveals Pfizer side effect
2021/08/02 0:00:00,"NRL CEO Andrew Abdo says league preparing plans for finals amid worsening Qld, Sydney Covid-19 situation"
2021/08/02 0:00:00,Incredible moment after crushing fall in 800m semi-final
2021/08/02 0:00:00,AFL: Port Adelaide has every motivation to keep getting better as the finals loom
2021/08/02 0:00:00,Rolling Stone picks the greatest music video of all time
2021/08/02 0:00:00,NSW records 207 new Covid cases and one death with dozens infected in the community
2021/08/02 0:00:00,Fetty Wap’s four-year-old daughter has died
2021/08/02 0:00:00,Turkey fires ‘like a horror movie’ as blazes hit Mediterranean
2021/08/02 0:00:00,"Shane Warne in isolation after catching coronavirus in London, UK"
2021/08/02 0:00:00,"Tokyo Olympics speed climbing rules, how does it work?"
2021/08/02 0:00:00,Here’s what happens if you test positive to Covid-19 in Australia
2021/08/02 0:00:00,Call-out fees for SA ambulances rise
2021/08/02 0:00:00,Actor Jay Pickett dies suddenly on set of new movie
2021/08/02 0:00:00,"Deadly drug 25B-NBOH sold as powdered LSD in Melbourne, spike in Victorian hospitalisations"
2021/08/02 0:00:00,‘He can win gold’: Peter Bol first Aussie in Olympic 800m final since 1968
2021/08/02 0:00:00,Dr Paul Griffin warns South East Qld could be on track for Sydney-style Covid-19 outbreak
2021/08/02 0:00:00,F1: Sebastian Vettel disqualified from  Hungarian Grand Prix
2021/08/02 0:00:00,Live Breaking News: Epidemiologist says rapid antigen tests in workplaces could be the key out of lockdown
2021/08/02 0:00:00,"Victoria records two new local cases of coronavirus, tightens border bubble with NSW"
2021/08/02 0:00:00,Live breaking news: Qld doubles down on controversial advice
2021/08/02 0:00:00,Tokyo Olympics Day 10: Opals pull off 'crazy' miracle
2021/08/02 0:00:00,‘I know nothing about him’: Shock winner in 100m final after star booted
2021/08/02 0:00:00,‘What the hell?’: World reacts as stars agree to share gold medal
2021/08/02 0:00:00,Australian Survivor 2021: George from Bankstown makes no apologies
2021/08/02 0:00:00,Shannah Kennedy: How to thrive through change
2021/08/02 0:00:00,"Australian property: 70 per cent of Millennials believe housing market needs more regulation, stamp duty changes"
2021/08/02 0:00:00,"US authorities scramble, trade blame as millions face eviction"
2021/08/02 0:00:00,Jacobs claims shock Olympic 100m win and Dressel joins elite club
2021/08/02 0:00:00,Daniel Ricciardo cops awful bad luck at crazy Hungarian Grand Prix
2021/08/02 0:00:00,"Fires rage across southern Europe, forcing hundreds to evacuate"
2021/08/02 0:00:00,"Rising rents a big burden on Aussie essential workers, costing more than two thirds of their weekly income in some areas"
2021/08/02 0:00:00,The Melbourne suburbs where the median house price has fallen
2021/08/02 0:00:00,Brett McLeod lists Fitzroy North home with marriage equality art
2021/08/02 0:00:00,Manifold Heights home smashes hopes as six bidders drive big sale
2021/08/02 0:00:00,Dean Capobianco’s Clovelly home sells for more than $5.4m after 10 days on the market
