date,title
2021/11/19 0:00:00,Booked out: Huge waitlists into New Year for Sydney restaurants
2021/11/19 0:00:00,True Marvel will be given his chance at the Group 2 Sandown Cup after massive win at The Valley
2021/11/19 0:00:00,Sound chases back-to-back Zipping Classics in what looms as Australian racing swan song for German import
2021/11/19 0:00:00,Pandemic Bill extremists have gone way too far
2021/11/19 0:00:00,"Teammate, cricket world react to Tim Paine sexting scandal"
2021/11/19 0:00:00,Justin Hemmes’ Merivale moves in on SCG in new six-year contract
2021/11/19 0:00:00,Victorian child youngest Australian to die with Covid
2021/11/19 0:00:00,Unvaccinated risk venue lock out as Qld businesses voice confusion on double-dose restrictions
2021/11/19 0:00:00,Public servant jailed for stealing $27m from taxpayers to buy luxury home and racehorses
2021/11/19 0:00:00,Best deals at Vogue American Express Fashion’s Night Out Melbourne
2021/11/19 0:00:00,"Man jailed for plotting to kill police, attack buildings in terror acts has sentenced reduced"
2021/11/19 0:00:00,Report: Philadelphia 76ers draw up list of players to swap with Ben Simmons
2021/11/19 0:00:00,‘Absolute genius’: South African cricket legend AB de Villiers announces retirement
2021/11/19 0:00:00,"Star comedian Josh Hawkins, of hijosh fame, reveals his weird, faux hipster, ugg boot world"
2021/11/19 0:00:00,Lunar eclipse 2021: Friday’s full blood moon to break 600-year record
2021/11/19 0:00:00,Scott Morrsion could be banned from Western Australia until next year
2021/11/19 0:00:00,Iconic broadcaster Gerard Healy steps down as On The Couch host after 20-year run
2021/11/19 0:00:00,Railway Stakes: Owner Bob Peters says favourite Western Empire’s price ‘a bit silly’
2021/11/19 0:00:00,Sad end of Aussie TV shows that died on the air
2021/11/19 0:00:00,Cricket Tasmania reveals theft charges after Tim Paine sexting scandal
2021/11/19 0:00:00,Divine Mercy College principal blasted for ‘bizarre threat’ to shut down school rather than get Covid-19 vaccine
2021/11/19 0:00:00,Oysters from Coffin Bay recalled after 56 Vibrio parahaemolyticus infections
2021/11/19 0:00:00,Former Irish galloper Blue Soldier can march to an upset win in The Gong
2021/11/19 0:00:00,"Australian sharemarket closes in the green, Crown rockets on fresh Blackstone bid"
2021/11/19 0:00:00,Kate borrowing Queen’s Bentley reveals big plans for duchess
2021/11/19 0:00:00,Coronavirus crisis: ‘Bring Cleo Home’ members lash out after Facebook page renamed to spruik anti-vax protests
2021/11/19 0:00:00,Australian Test captain Tim Paine quits following sexting bombshell
2021/11/19 0:00:00,WWE legend Rey Mysterio snubbed after suffering brutal defeat
2021/11/19 0:00:00,$50 Bunnings hack solves annoying fridge gap problem
2021/11/19 0:00:00,"Terri Irwin confronts relentless rumour about love life, says ‘Steve was it for me’"
2021/11/19 0:00:00,"Tick, Tick... Boom: Lin-Manuel Miranda’s poignant adaptation of Jonathan Larson’s story"
2021/11/19 0:00:00,"Cowboy Bebop: John Cho on fan expectations, genre play and that shirtless scene"
2021/11/19 0:00:00,"Man, 59, charged with sexually abusing boys in Philippines, paying ‘child abuse facilitator’"
2021/11/19 0:00:00,Who will replace Tim Paine as Australian Test cricket captain?
2021/11/19 0:00:00,"‘Brutal attack’: Man jailed for violent assault, rape of British backpacker"
2021/11/19 0:00:00,Superannuation: Must-read tips and tools to help you plan your retirement
2021/11/19 0:00:00,Brittany Graham at forefront of refreshing male dominated Queensland harness racing
2021/11/19 0:00:00,Girlfriend of Kyle Rittenhouse victim Anthony Huber says she has ‘a lot of sympathy’ for teen
2021/11/19 0:00:00,Cupitt’s Estate Ulladulla NSW launches five-star ‘wine pods’
2021/11/19 0:00:00,Andy Meddick’s daughter Kielan attacked on the street
2021/11/19 0:00:00,The Gong: Trainer Robert Price hopes Count De Rupee can silence the doubters
2021/11/19 0:00:00,How 23yo made $1.9m from lockdown sleepwear idea
2021/11/19 0:00:00,Missing tennis player Peng Shuai exposes China’s brutal reaction to #MeToo
2021/11/19 0:00:00,Tayla Damir stuns in black cut-out dress at Melbourne Fashion Week
2021/11/19 0:00:00,World’s most popular castles revealed: the top 20 buildings as global travel resumes
2021/11/19 0:00:00,What led to William Tyrrell’s disappearance and what’s happened since?
2021/11/19 0:00:00,More than 800 people in home quarantine after five days of Qld border pass
2021/11/19 0:00:00,Australian vice-captain Pat Cummins didn’t think he’d be needed but is ready to captain Australia
2021/11/19 0:00:00,Tim Paine resigns as men’s cricket captain after sexual harassment scandal
2021/11/19 0:00:00,"Robert Vicosa, ex Baltimore police officer found dead with daughters and suspected accomplice"
2021/11/19 0:00:00,Kenn Brodziak: South Melbourne terrace where The Beatles dined for sale
2021/11/19 0:00:00,Bulldogs investigate photo leak after pulling off $3m Kikau raid
2021/11/19 0:00:00,Huge rise in demand for men’s beauty products since Harry Styles dropped his
2021/11/19 0:00:00,Fisheries issue alert after multiple detections of white shark in Perth metropolitan beaches
2021/11/19 0:00:00,Adelaide United coach Carl Veart wants an expanded and fairer A-League
2021/11/19 0:00:00,Iron ore price falls to lowest since May 2020
2021/11/19 0:00:00,Meghan Markle’s Ellen DeGeneres appearance a sign of her political goals
2021/11/19 0:00:00,Ballarat Cup: Owner never lost faith Thought Of That would rediscover his old spark
2021/11/19 0:00:00,"NAB upgrades 2022 housing price predictions, ANZ predicts fall in 2023"
2021/11/19 0:00:00,Analysis of first Covid-19 cases suggests Wuhan market was origin of outbreak and WHO report was wrong
2021/11/19 0:00:00,Max Verstappen breaks silence on ‘smoking gun’ incident with Lewis Hamilton
2021/11/19 0:00:00,Daughter of Carla Zampatti eyes political debut in Wentworth
2021/11/19 0:00:00,Jim Byrne out of hotel quarantine after riding in Sydney for the Golden Eagle
2021/11/19 0:00:00,Brian Henderson’s Middle Cove family home trades in top secret record deal believed to be $11m+
2021/11/19 0:00:00,Mike Tyson would have sex with ‘groupies’ in dressing room just before fights
2021/11/19 0:00:00,Kate Middleton stuns in green gown at London show
2021/11/19 0:00:00,‘Cried the whole time’: Serena breaks down over sister’s death
2021/11/19 0:00:00,Australia’s first person to get Covid vaccine gets booster shot with Prime Minister Scott Morrison
2021/11/19 0:00:00,Sydney man Craig Anthony Wheatman accused of using plastic bag to sexually assault elderly woman in ‘heinous’ act
2021/11/19 0:00:00,Panthers blindsided as Bulldogs swoop on superstar with $3.2m deal
2021/11/19 0:00:00,Kourtney Kardashian hits back at troll for suggesting she never sees her kids
2021/11/19 0:00:00,"Dung Thi Ngoc Ngo, Kevin Ly have convictions for murdering drug cook and partner quashed"
2021/11/19 0:00:00,Football star breaks silence after legs beaten with iron bar
2021/11/19 0:00:00,"Kim Kardashian, Pete Davidson first photo as ‘official’ couple"
2021/11/19 0:00:00,The Wheel of Time: Madeleine Madden reveals what it’s like to be thrust into fantasy franchise
2021/11/19 0:00:00,‘Doesn’t add up’: Christy Giles’ husband speaks
2021/11/19 0:00:00,LeBron James slammed by NBA star over ‘disgusting’ China silence
2021/11/19 0:00:00,Chinese man banned from all-you-can-eat restaurant for eating too much
2021/11/19 0:00:00,Perth primary school gives preschoolers choice to go barefoot
2021/11/19 0:00:00,Man with ‘world’s biggest penis’ stuns hosts with explicit pic
2021/11/19 0:00:00,Zoe Foster-Blake releases Go-To Gin with Four Pillars
2021/11/19 0:00:00,First trailer for ‘Pam & Tommy’ shows the real villains of that sex tape scandal
2021/11/19 0:00:00,Property Fit author Luke Harris on how to build a real estate portfolio
2021/11/19 0:00:00,Dr Zac Turner explains why too much sleep can be bad for you
2021/11/19 0:00:00,"Big 4 analysis: Railway, The Gong, Ballarat Cup, The Warra"
2021/11/19 0:00:00,Australian influencer Chloe Morello unleashes on ‘rort’ $170 Disneyland ticket
2021/11/19 0:00:00,Pressure is mounting on China to confirm the safety of star player Peng Shuai amid fears she is missing
2021/11/19 0:00:00,Nobel Peace Prize winner Maria Ressa on the dangers of Facebook and the ‘virus of lies’ on social media
2021/11/19 0:00:00,New Victory coach Tony Popovic ready for challenge of returning the fallen giants to the top of the A-League
2021/11/19 0:00:00,Coolangatta installed short favourite for Magic Millions 2YO Classic
2021/11/19 0:00:00,The WFP explains how Elon Musk could greatly reduce world hunger with $6.6 billion
2021/11/19 0:00:00,"Michael MacRae found guilty of manslaughter over fatal injuries sustained by his infant son, Nathaniel"
2021/11/19 0:00:00,Tammin Sursok had gun pointed at her by Joe Exotic in US bar
2021/11/19 0:00:00,Sydney Football Stadium engineer Ray Massoud: ‘I wake up every day and look forward to work’
2021/11/19 0:00:00,Covid-19 SA: Border restrictions for Byron Bay
2021/11/19 0:00:00,Sisters in Law: Man looks to sue council over ‘dangerous’ tree
2021/11/19 0:00:00,Bjorn Baker changes tack for Edison’s third Magic Millions assault
2021/11/19 0:00:00,‘A stunning act of political cowardice’: Libs slammed over move to scrap parliamentary sitting after no confidence vote
2021/11/19 0:00:00,Tony Gollan rates comeback sprinter Zoustyle the best of his runners in Swiss Ace Plate
2021/11/19 0:00:00,Rising fertiliser prices and inflation will impact living expenses
2021/11/19 0:00:00,Classy stayer Our Candidate on the long road back from injury
2021/11/19 0:00:00,Chrysler pulls out of Australia
2021/11/19 0:00:00,Barry Humphries: Rotherwood apartment block built by entertainer’s father for sale in Camberwell
2021/11/19 0:00:00,Scott Morrison condemns anti vax protests but has ‘sympathy’ with cause
2021/11/19 0:00:00,Covid-19: Queensland border could open nearly two weeks earlier than planned
2021/11/19 0:00:00,Olympian Jana Pittman praised for honest pregnancy post on Instagram
2021/11/19 0:00:00,Halifax Road puts unbeaten record on the line at Morphettville Parks
2021/11/19 0:00:00,Covid ‘fourth wave’ erupts in Europe as WHO declares it the only place deaths still rising
2021/11/19 0:00:00,Dani Laidley praised after stepping out for major Kangaroos milestone
2021/11/19 0:00:00,ANZ predicts house prices to fall but never to pre-pandemic levels
2021/11/19 0:00:00,"Victoria records 1273 new cases, eight Covid deaths"
2021/11/19 0:00:00,Tom Cruise pictured looking back to normal after ‘puffy’ viral photos
2021/11/19 0:00:00,Queen’s purple hands spark further health concerns
2021/11/19 0:00:00,"Scary footage as waterfall cascades over road in Dorrigo, New South Wales"
2021/11/19 0:00:00,Northern Territory saltwater croc camouflaged in the mud shocks the internet
2021/11/19 0:00:00,Simon Birmingham slams Labor for ‘co-ordinated’ attack on Scott Morrison
2021/11/19 0:00:00,Sunshine Coast: Tony Gollan’s exciting filly Honey Pot ready to make a winning debut
2021/11/19 0:00:00,‘Disturbing’ call to James Gandolfini led to iconic The Sopranos line
2021/11/19 0:00:00,Blackstone lobs fresh $8.5bn takeover bid for James Packer-controlled Crown Resorts
2021/11/19 0:00:00,Three minute routine busy mum-of-four swears by
2021/11/19 0:00:00,Former prep-school student gets off with probation for raping teen girls
2021/11/19 0:00:00,Breeders Crown: Bettor Twist and Amazing Dream heads up quartet of chances for Nathan Purdon at Melton
2021/11/19 0:00:00,Tim Tszyu snubbed for world title fight in brutal delay
2021/11/19 0:00:00,Stimulation of the Australian economy could backfire in 2022
2021/11/19 0:00:00,Sheffield Shield match postponed after Victorian bowler’s Covid-19 test
2021/11/19 0:00:00,Victoria politics: Pandemic debate postponed as MP’s daughter attacked
2021/11/19 0:00:00,Cafe ‘publicly shames’ mum and toddler for leaving a ‘mess’
2021/11/19 0:00:00,Mark Hunter: Former Footscray footballer lists Williamstown home
2021/11/19 0:00:00,Drink spiking on the rise in Sydney ahead of Christmas
2021/11/19 0:00:00,Car crash victim made to walk across border after accident in Queensland
2021/11/19 0:00:00,Chinese coast guard blasts Filipino vessels with water cannons
2021/11/19 0:00:00,"St Basil’s inquest: Death was ‘manslaughter’, victim’s daughter tells court"
2021/11/19 0:00:00,Inside Lufthansa Technik’s new private jet cabin for billionaires
2021/11/19 0:00:00,Police rule disappearance of Anthony ‘AJ’ Elfalak from family home ‘a result of misadventure’
2021/11/19 0:00:00,Sydney man makes $50k fortune on crypto
2021/11/19 0:00:00,A possible Covid case has forced a Sheffield Shield match to be suspended
2021/11/19 0:00:00,Woman’s head teeming with bugs after five years of head lice
2021/11/19 0:00:00,Will Smith’s face baffles viewers in ‘unrecognisable British TV appearance
2021/11/19 0:00:00,"Dominic Perrottet defends the one Covid-19 rule to stay, saying he won’t ‘be compared with Victoria’"
2021/11/19 0:00:00,WA Premier Mark McGowan tees off at Covid protesters after altercation caught on video
2021/11/19 0:00:00,How stay-at-home dad finally found a new job after five years out of work
2021/11/19 0:00:00,Meghan Markle’s interview with Ellen DeGeneres: All the highlights
2021/11/19 0:00:00,Mum shamed for not letting her kids attend sleepovers
2021/11/19 0:00:00,Golf: Australians Hannah Green and Minjee Lee right in the mix at $2m Tour Championship in Florida
2021/11/19 0:00:00,Loophole means Dally M winner Jack Wighton could jump ship
2021/11/19 0:00:00,HMAS Sydney’s ‘Unknown Sailor’ identified after 80 years
2021/11/19 0:00:00,‘Barking dog’: China mocks Australia as spat escalates
2021/11/19 0:00:00,New find at William Tyrrell search site as ’potential evidence’ found near creek
2021/11/19 0:00:00,NSW could roll back more restrictions this week
2021/11/19 0:00:00,‘Devastated and shocked’: Serena reacts to missing Chinese star
2021/11/19 0:00:00,Western Sydney Wanderers sign former Manchester City star Jack Rodwell
2021/11/19 0:00:00,Ashes: Test opener Marcus Harris ready as ever to finally cement his spot in Australian side
2021/11/19 0:00:00,"‘Dangerous views’: Scott Morrison’s vaccine comments savaged by Mark McGowan, Daniel Andrews and Steven Miles"
2021/11/19 0:00:00,Western Freeway closed after car and truck collide
2021/11/19 0:00:00,Bitcoin crashes to its lowest level since mid-October as ominous signs emerge
2021/11/19 0:00:00,Kim Kardashian helped rescue Afghan women’s football team from Taliban
2021/11/19 0:00:00,Meghan Markle laughs as Ellen DeGeneres introduces her as The Duchess of Sussex
2021/11/19 0:00:00,"12 Best Sustainable Homewares, Bedding & Towels 2021"
2021/11/19 0:00:00,Rain threatening to disrupt search for William Tyrrell on NSW mid-north coast
2021/11/19 0:00:00,MMA fighter fumes after being ‘exposed’ in nude documentary scene
2021/11/19 0:00:00,Hugh Sheridan announces split from fiance Kurt Roberts
2021/11/19 0:00:00,Major media outlet banned from Kyle Rittenhouse trial by judge
2021/11/19 0:00:00,"Weekend Best Bets: Tips for Kembla Grange, Ballarat and Sunshine Coast"
2021/11/19 0:00:00,Dr Xanthe Mallett says she has never been suspicious of William Tyrrell’s foster mum on The Project
2021/11/19 0:00:00,Man saved hours before execution: ‘Thank you so much’
2021/11/19 0:00:00,Shocking video allegedly shows former NFL star beating ex-girlfriend
2021/11/19 0:00:00,"Aussies’ fear of getting Covid is rising, according to study tracking wellbeing during the pandemic"
2021/11/19 0:00:00,Adele reveals secret boyfriend after Simon Konecki divorce
2021/11/19 0:00:00,Patty Mills wins hilarious ‘mismatch’ with NBA’s tallest player
2021/11/19 0:00:00,Industries and states where wages have shot up
2021/11/19 0:00:00,How a 24-year-old go-getter sold 32 properties worth more than $22 million from his bedroom
2021/11/19 0:00:00,Belkin Soundform Freedom True Wireless Earbuds review
2021/11/19 0:00:00,Towards a Better Future: Eddie Betts on a mission to help kids live healthier lives
2021/11/19 0:00:00,Meghan Markle tells Ellen Degeneres about Toronto Halloween party with Princess Eugenie and Jack Brooksbank
2021/11/19 0:00:00,Dead model Christy Giles had just celebrated her birthday before being found dead in Los Angeles
2021/11/19 0:00:00,Historic Bellarine Peninsula church has makings of a heavenly home
2021/11/19 0:00:00,Luxury Portsea pad with direct beach access listed
