date,title
2021/02/16 0:00:00,"Serena Williams’ husband rips ‘racist, sexist clown’ after win"
2021/02/16 0:00:00,Grace Tame on Brittany Higgins: Australian of Year shares post of support
2021/02/16 0:00:00,Shane Warne shakes his head at England’s odd policy
2021/02/16 0:00:00,Buffy the Vampire Slayer is more than just Joss Whedon
2021/02/16 0:00:00,Dylan Alcott shares magical Australian Open moment with great mate
2021/02/16 0:00:00,Rolling coverage: Positive travellers wearing garbage bags for privacy not PPE
2021/02/16 0:00:00,Hot favourite Enthaar has drawn wide for $1.5m Blue Diamond Stakes at Caulfield
2021/02/16 0:00:00,Unbeaten Kiwi ready for Sydney autumn test
2021/02/16 0:00:00,American entrepreneur Ethan Oberman’s Double Bay house smashes street record by $3m
2021/02/16 0:00:00,Ben Simmons makes NBA history with incredible career-high
2021/02/16 0:00:00,Why Are You Like This is a fresh voice in Australian comedy
2021/02/16 0:00:00,Biloela Tamil family win court battle but remain in detention limbo
2021/02/16 0:00:00,COVID vaccine Australia: Nearly 10 per cent of Australians will refuse jab
2021/02/16 0:00:00,COVID breath test from Aussie company GreyScan could open our borders
2021/02/16 0:00:00,A-League: Melbourne City’s weekend battle against the Glory in Perth won’t go ahead
2021/02/16 0:00:00,Jockey Neil Farley suspended for overuse of the whip in heat of modified whip rules series
2021/02/16 0:00:00,The Project hosts question Meghan Markle and Prince Harry over Oprah interview plan
2021/02/16 0:00:00,Accused self-quarantine dodger Ashlee Marie Jackson faces Perth court
2021/02/16 0:00:00,World stunned as unknown tennis star does the unthinkable
2021/02/16 0:00:00,Worrying trend in nation that has vaccinated half the population
2021/02/16 0:00:00,Murderer who claimed woman choked herself during erotic sex jailed for life in Western Australia
2021/02/16 0:00:00,DPP seeks convictions in Pell media contempt case
2021/02/16 0:00:00,Olympic swimmer Scott Miller arrested after police claim $2m of ‘ice’ found in candles
2021/02/16 0:00:00,Art Cadeau and Leg Work secure starts in Country Championships Final
2021/02/16 0:00:00,"COVID vaccine Australia: Almost 10 per cent of Aussie not taking jab, government findings show"
2021/02/16 0:00:00,Randwick races: Harmony Rose to blossom into ATC Oaks contender
2021/02/16 0:00:00,Anthony Mundine reveals how many millions he’s made in boxing
2021/02/16 0:00:00,Sellers’ market as Australian property prices rise and buyers line up
2021/02/16 0:00:00,Review reveals reporting ‘failure’ in SA govt handling of child sexual abuse cases
2021/02/16 0:00:00,A-League: Reeling Reds suffer another blow with loss of Nathan Konstandopoulos for the rest of the season
2021/02/16 0:00:00,"Five-time Logie winner Deborah Mailman on 2067, Total Control, and Secret Life Of Us"
2021/02/16 0:00:00,Susie Burrell: Five easy ways to bust stress eating
2021/02/16 0:00:00,Kylie Moore-Gilbert thanks Prime Minister Scott Morrison after release from detention in Iran
2021/02/16 0:00:00,Brutal childhood matches behind Russian tennis takeover: ‘We’re nuts’
2021/02/16 0:00:00,Isla Fisher shares a rare throwback with husband Sacha Baron Cohen
2021/02/16 0:00:00,The West Live: Perth property market panic buying hits fever pitch with 200 attending single home open
2021/02/16 0:00:00,Woman swept 100m from beach after trying to help dog
2021/02/16 0:00:00,AFL 2021: Chris Fagan says David Noble’s departure won’t derail Lions
2021/02/16 0:00:00,Amazing Race Australia: Contestants in hot air balloon crash
2021/02/16 0:00:00,Tofu macaroni and cheese on menu at Australia’s first vegan preschool
2021/02/16 0:00:00,Australian sharemarket lunges higher on busiest reporting season day so far
2021/02/16 0:00:00,"Cognitively impaired woman isolated for 23 hours a day, inquiry told"
2021/02/16 0:00:00,Marcus Harris gets the chance to right some Test wrongs when he turns out for Victoria against NSW
2021/02/16 0:00:00,Government urged to deliver long-term economic and social benefits to Australians
2021/02/16 0:00:00,NBL says virtual signage not ‘viable’ as Players’ Association monitors the league’s next move on slippery decals
2021/02/16 0:00:00,NSW Health Minister Brad Hazzard told off for not socially distancing in parliament
2021/02/16 0:00:00,"Man crushed by truck, hospitalised after Greenacre road rage incident"
2021/02/16 0:00:00,Star Reds recruit Suliasi Vunivalu has been stood down after an incident in January involving a security guard
2021/02/16 0:00:00,Afghanistan war: 30 Taliban fighters killed in disastrous bomb-making class
2021/02/16 0:00:00,"AFLW: Despite the AFL’s new concussion protocols being put under the microscope, Carlton coach Daniel Harford has defended a dangerous-looking tackle"
2021/02/16 0:00:00,Police officer rushed to hospital after alleged stabbing at Cairns shopping centre
2021/02/16 0:00:00,Florida man steals engagement ring from one girlfriend to propose to another
2021/02/16 0:00:00,Meghan and Harry’s ‘nuclear’ Oprah interview could be disastrous
2021/02/16 0:00:00,Family shattered after former trainee Buddhist monk’s ice binge causes two deaths
2021/02/16 0:00:00,Body found during search for two men in remote part of Western Australia
2021/02/16 0:00:00,Four million Texans left without power as extreme cold freezes southern state
2021/02/16 0:00:00,"Boy, 10, injured after being hit by van"
2021/02/16 0:00:00,Maori All Stars: Penrith young gun Jarome Luai ready to partner his idol Benji Marshall
2021/02/16 0:00:00,Stockbroker Rob Fiani’s $20m Bellevue Hill mansion sells
2021/02/16 0:00:00,Retired jockey Damian Browne reflects on two Blue Diamond triumphs from as many rides
2021/02/16 0:00:00,Myanmar protests: Brutal move to silence nation after military coup
2021/02/16 0:00:00,General Beau’s owners pay late entry fee for shot at Blue Diamond Stakes
2021/02/16 0:00:00,Heatwave to sweep across multiple states over next week with temperatures up to 15C above average
2021/02/16 0:00:00,Hobartville Stakes: Peltzer ready to win on home track at Rosehill
2021/02/16 0:00:00,"Bumper payday for BHP investors as record dividend declared, stunning iron ore prices pocketed"
2021/02/16 0:00:00,TikTok of flight attendant packing Kitchen Aid in carry-on goes viral
2021/02/16 0:00:00,‘Take responsibility’: New Zealand PM Jacinda Ardern scolds Scott Morrison for stripping dual national terror suspect’s citizenship
2021/02/16 0:00:00,Google strikes $30 million deal with Nine to avoid Australian media law precedent
2021/02/16 0:00:00,"Reserve Bank keeps close eye on house prices, jobs market"
2021/02/16 0:00:00,Perth Festival’s City of Lights display unveiled at Perth Cultural Centre in Northbridge
2021/02/16 0:00:00,Valheim: Norse survival game passes two million sales in Steam early access
2021/02/16 0:00:00,Ferntree Gully family heirloom sells in frenzied auction
2021/02/16 0:00:00,Luxury brand reveals shock EV strategy
2021/02/16 0:00:00,Jockey Dwayne Dunn to shoot for fifth Blue Diamond Stakes win
2021/02/16 0:00:00,Government ditches plan to suspend Better Off Overall Test
2021/02/16 0:00:00,Scott Morrison ‘not happy’ Brittany Higgins’ alleged rape was kept secret
2021/02/16 0:00:00,Miguel Maestre has shown off an epic body transformation after losing 18kg
2021/02/16 0:00:00,Photo fuels speculation about Cameron Smith bombshell move
2021/02/16 0:00:00,Salma Hayek ‘cried with fear’ during sex scene with Antonio Banderas in 1995 film Desperado
2021/02/16 0:00:00,Question Time: Scott Morrison grilled for being in the dark over alleged rape at Parliament House
2021/02/16 0:00:00,Danielle Johnson closes in on 1000 winners
2021/02/16 0:00:00,How to support Victoria’s lockdown affected businesses online without leaving your house
2021/02/16 0:00:00,"ANU urges staff to say ‘chestfeeding’ instead of ‘breastfeeding’, ‘gestational parent’ instead of mother"
2021/02/16 0:00:00,Dan Andrews confirms international flights into Melbourne to remain suspended
2021/02/16 0:00:00,Regional Victoria publican hits back at five-day lockdown as streak of zero cases continues
2021/02/16 0:00:00,Russian Camelot entered for Futurity Stakes but first-up crack at the All-Star Mile
2021/02/16 0:00:00,Jacinda Ardern slams Scott Morrison after alleged ISIS terrorist stripped of citizenship
2021/02/16 0:00:00,Super Rugby AU: Wallabies legend Tim Horan wants excitement machine Jordan Petaia to spend time in Queensland’s No.15 jersey
2021/02/16 0:00:00,Brittany Higgins alleged rape: Scott Morrison’s ‘dad of daughters’ response slammed
2021/02/16 0:00:00,Ruslan Kogan: Tech entrepreneur spends $15m on neighbouring Flinders properties
2021/02/16 0:00:00,Melbourne man becomes online star after refusing to stop BBQing in lockdown
2021/02/16 0:00:00,Father of nine-year-old Emmett Taylor speaks out about horrific crash that killed his son
2021/02/16 0:00:00,Ivan Milat inquest: Serial killer’s miserable final years in jail
2021/02/16 0:00:00,Brittany Higgins responds to Scott Morrison’s apology over handling of alleged Parliament House rape
2021/02/16 0:00:00,South East Melbourne Phoenix to help Ryan Broekhoff cement Olympic selection for the Boomers
2021/02/16 0:00:00,Chrissy Teigen shows off scars from endometriosis surgery with a nude selfie
2021/02/16 0:00:00,‘Phenomenal’ result as 114 contacts linked to Victorian psych worker case test negative
2021/02/16 0:00:00,Homeless kid becomes Lamborghini driving millionaire at 25
2021/02/16 0:00:00,AstraZeneca coronavirus vaccine provisionally approved by TGA
2021/02/16 0:00:00,Health insurance question couples need to ask
2021/02/16 0:00:00,Kamala Harris slammed for repeating claim debunked by Dr Fauci that vaccine rollout ‘starting from scratch’
2021/02/16 0:00:00,US sex offender charged after ‘deep-fried’ body parts found
2021/02/16 0:00:00,Imitation of Penfolds Aussie wine being sold in China
2021/02/16 0:00:00,Slipper chance Forbes forced to trial again after failing to load
2021/02/16 0:00:00,Donald Trump’s acquittal leaves the Republican Party bitterly divided yet again
2021/02/16 0:00:00,Activities you can do naked around Australia
2021/02/16 0:00:00,Johnny Galecki leaves cheeky comment on Kaley Cuoco’s Valentine’s Day post
2021/02/16 0:00:00,Coronavirus Australia: Elderly urged to receive AstraZeneca jab as TGA plays down fears
2021/02/16 0:00:00,Queensland colt Alpine Edge poised for Golden Slipper assault
2021/02/16 0:00:00,NT Police investigate 38 ‘potential breaches’ of Melbourne traveller self-isolation rules
2021/02/16 0:00:00,Fiona Falkiner and fiancee Hayley Willis used turkey baster before IVF pregnancy success
2021/02/16 0:00:00,"Police charge four teens, including a 13yo, over alleged joy ride in stolen Audi"
2021/02/16 0:00:00,"Australian Open: Novak Djokovic goes berserk, smashes racquet before beating Alexander Zverev"
2021/02/16 0:00:00,Boy filmed chasing alleged attacker at Western Sydney arcade
2021/02/16 0:00:00,South Australia’s COVID hotel quarantine rules tightened after concerns
2021/02/16 0:00:00,Parler back following Amazon removing servers after Trump supporters stormed US Capitol
2021/02/16 0:00:00,‘Fake heiress’ Anna Sorokin treated like a celebrity in prison after early release from 12 year term
2021/02/16 0:00:00,"Victoria will build new cabin-style quarantine facility, Premier Daniel Andrews says"
2021/02/16 0:00:00,Mum discovers ‘disgusting’ thing she can do with her armpit
2021/02/16 0:00:00,Gough Whitlam’s Cabramatta home set for fierce auction as ALP veterans seek to buy it
2021/02/16 0:00:00,‘Admit One’ paper tickets handed out at Adelaide Airport for entry into South Australia
2021/02/16 0:00:00,Score this bundle of expert led painting and drawing classes for just $45.99
2021/02/16 0:00:00,Kyle Sandilands’ shock drug confession about controversial 60 Minutes interview
2021/02/16 0:00:00,‘Populist and wildly subjective’: War over fluoride erupts between Port Macquarie councillors
2021/02/16 0:00:00,Kia Stonic review: Little SUV fills gap in brand’s range
2021/02/16 0:00:00,Deputy Labor leader Richard Marles joins push for Victorian regional quarantine facility
2021/02/16 0:00:00,"Britney Spears treated like ‘a toddler’, says Claude Kelly"
2021/02/16 0:00:00,Nettoyer’s swan song to be on trainer’s terms
2021/02/16 0:00:00,Scott Morrison orders Parliament work culture inquiry after Brittany Higgins’ alleged rape
2021/02/16 0:00:00,Holiday Inn Flinders Lane quarantine hotel evacuated with patient leaving with garbage bag over head
2021/02/16 0:00:00,Karen Knowles: Singer’s Surrey Hills home bought by fellow artist
2021/02/16 0:00:00,The real jobs and lives of Australia’s Gogglebox stars
2021/02/16 0:00:00,Robinhood trading app’s CEO Vlad Tenev admits mistakes on halting trading on GameStop
2021/02/16 0:00:00,How to watch Meghan and Harry’s Oprah interview in Australia - and the Queen's speech
2021/02/16 0:00:00,‘Embarrassing’: Dave Hughes reveals private convo with Nick Kyrgios’ brother
2021/02/16 0:00:00,English jockey Tom Marquand snares key autumn carnival rides
2021/02/16 0:00:00,‘Possible war’ looming on Australia’s doorstep as China ramps up attacks on Taiwan
2021/02/16 0:00:00,Aussie skipper Tim Paine declares he has no interest in his critics unless they are part of his team
2021/02/16 0:00:00,Scott Morrison expected to tear up Victoria’s Belt and Road deal with China within weeks
2021/02/16 0:00:00,NSW Labor Leader Jodi McKay defends herself after letter in support of convicted sex offender
2021/02/16 0:00:00,Aldi launches $20 hot cross bun gin for Easter
2021/02/16 0:00:00,TikTok sale to Oracle scrapped by ByteDance after Donald Trump left White House
2021/02/16 0:00:00,Country Road sale: Save up to $200 on your next order
2021/02/16 0:00:00,Bulldogs player Adam Elliott allegedly caught ‘making out’ with ex-teammate’s partner
2021/02/16 0:00:00,Americans most disliked pizza topping revealed in survey
2021/02/16 0:00:00,You don’t have to watch those Netflix shows with the terrible English dubbing
2021/02/16 0:00:00,Passenger seriously injured as ute slams into car in Cooloongup
2021/02/16 0:00:00,SERA Country Championships Qualifier runner-by-runner preview
2021/02/16 0:00:00,Three new Australian events have been announced as the World Surf League returns for 2021
2021/02/16 0:00:00,"Coronavirus Australia: Lindsay Fox, John Wagner launch bid to rethink hotel quarantine"
2021/02/16 0:00:00,Wetherill Park: Teen rescued after being trapped for more than 2 hours in wrecked car
2021/02/16 0:00:00,Daniel Ricciardo already eyeing next car after McLaren unveiling
2021/02/16 0:00:00,Mum makes 10 dinners for family- of-four for $123
2021/02/16 0:00:00,Tim Clark gives Farnan the thumbs up after Randwick trial win
2021/02/16 0:00:00,"YouTube videos showing monkey abuse slammed by PETA, Action for Primates"
2021/02/16 0:00:00,US expert rubbishes Dan Andrews’ lockdown excuse
2021/02/16 0:00:00,Eugenie Bouchard and NFL quarterback Mason Rudolph are Instagram official
2021/02/16 0:00:00,Tim Paine left red-faced by Ravi Ashwin’s heroics against England
2021/02/16 0:00:00,Bernard Tomic’s girlfriend Vanessa Sierra reveals natural curly hair
2021/02/16 0:00:00,Oz Lotto’s division one prize hits $5 million and provides the chance to change someone’s life
2021/02/16 0:00:00,How PM’s wife made him take action on rape
2021/02/16 0:00:00,Ashlee Marie Jackson charged after allegedly breaching Perth quarantine
2021/02/16 0:00:00,Nurse caught in crossfire of shooting at Hamzy family home in Auburn
2021/02/16 0:00:00,Police release footage of moment ute driver pelts speed camera with bottle on NYE
2021/02/16 0:00:00,Brittany Higgins alleged rape: Parliament office ‘steam cleaned’ after alleged attack
2021/02/16 0:00:00,"Victoria records two new locally acquired cases, two in hotel quarantine"
2021/02/16 0:00:00,Olivia Wilde praises Harry Styles as pair pose in first social media picture
2021/02/16 0:00:00,COVID prediction: Former CDC director says next pandemic is ‘inevitable’
2021/02/16 0:00:00,"McDonald’s unveils new range of smoothies, wraps and salads"
2021/02/16 0:00:00,"Nadals call bulls*** on Djokovic: Rafa, uncle Toni weigh in on injury farce"
2021/02/16 0:00:00,Buffy’s male cast members break their silence over Joss Whedon abuse allegations
2021/02/16 0:00:00,BMW driver allegedly three times the limit with child who had blood nose in car
2021/02/16 0:00:00,NSW greyhound racing stronger than ever after animal welfare wake up call
2021/02/16 0:00:00,Brisbane grandfather rescued by granddaughter after motorcycle fall
2021/02/16 0:00:00,Consumer group names $4000 retro-style Smeg fridge as ‘the worst’
2021/02/16 0:00:00,Megan Fox’s boyfriend Machine Gun Kelly wears her blood on a necklace
2021/02/16 0:00:00,Only in Australia could animal invasions stop a tennis match
2021/02/16 0:00:00,Tiffiny Hall: Why we keep falling into the bikini body trap
2021/02/16 0:00:00,"Larry King’s widow, Shawn King, to contest his secret will in court"
2021/02/16 0:00:00,COVID-19 vaccine rollout comes with ‘escape mutation’ risk if hotel quarantine program fails
2021/02/16 0:00:00,"Kendall Jenner, Devin Booker make relationship Instagram official"
2021/02/16 0:00:00,Victoria Covid hotspots: Full list of venue alerts
2021/02/16 0:00:00,Tom Brady trophy pass slammed as ‘disrespectful’ by designer’s family
2021/02/16 0:00:00,Victorian Premier in running for prestigious prize despite COVID-19 mayhem as other leaders snubbed
2021/02/16 0:00:00,Woman poisoned to death by son’s girlfriend
2021/02/16 0:00:00,"Meghan and Harry set up interview with Oprah Winfrey, to air in March"
2021/02/16 0:00:00,Live breaking news: Study finds seven new 'highly contagious' strains
2021/02/16 0:00:00,Pools the coolest backyard feature in the wake of COVID-19
2021/02/16 0:00:00,Worrying Australian Open trend emerges after quarantine
2021/02/16 0:00:00,Rodney the Gnome firmly planted in Newtown after creator sells up
2021/02/16 0:00:00,Wall-less bathroom trend attracting buyers across Australia
2021/02/16 0:00:00,Founder of Concrete Playground Richard Fogarty buys $8m Bronte home
2021/02/16 0:00:00,Mornington Racecourse: House next to horseracing track for sale
