date,title
2021/04/21 0:00:00,German parliament passes disputed national virus law amendment
2021/04/21 0:00:00,"Prince Harry met Queen twice and spoke to William and Charles on UK trip, says friend"
2021/04/21 0:00:00,Oil spill found where missing Indonesian submarine lost contact: ministry
2021/04/21 0:00:00,Paul Gallen demolishes Lucas Browne in heavyweight bout
2021/04/21 0:00:00,Chad reopens borders after Deby's death: military rulers
2021/04/21 0:00:00,Government announces $500m plan to attract foreign investment in clean energy
2021/04/21 0:00:00,Police fire tear gas at Berlin protest against virus law: AFP reporter
2021/04/21 0:00:00,India Covid surge hits new record as oxygen runs short
2021/04/21 0:00:00,Macron to attend funeral of slain Chadian leader: spokesman
2021/04/21 0:00:00,Punjab Kings drop Australian pace duo Jhye Richardson and Riley Meredith
2021/04/21 0:00:00,Chad opposition denounces 'institutional coup d'etat'
2021/04/21 0:00:00,Crewed SpaceX flight to ISS postponed by one day due to weather: NASA
2021/04/21 0:00:00,Mrs World quits title after savage onstage crown attack
2021/04/21 0:00:00,Any other Chauvin verdict would have been 'travesty of justice': UN
2021/04/21 0:00:00,France to impose 10-day quarantine for India travellers
2021/04/21 0:00:00,"Queen Elizabeth II thanks public after husband's death, as she turns 95"
2021/04/21 0:00:00,Brussels delays decision on whether gas is green
2021/04/21 0:00:00,Germany plans to pull troops out of Afghanistan by July 4
2021/04/21 0:00:00,Ivorian soldier injured in attack on military camp: security source
2021/04/21 0:00:00,UK's queen 'deeply touched' by support after husband's death
2021/04/21 0:00:00,MasterChef Australia 2021: Emelia Jackson jokes with contestants as guest judge
2021/04/21 0:00:00,Broncos handed huge Kotoni Staggs boost as rival club pulls offer
2021/04/21 0:00:00,Super Netball: NSW Swifts to wear iconic yellow dress in Heritage Round
2021/04/21 0:00:00,Indonesia navy says searching for submarine with 53 aboard
2021/04/21 0:00:00,‘Huge challenge to figure out’ how NZ COVID case tested positive
2021/04/21 0:00:00,Australia cancels state's Belt and Road deal with China
2021/04/21 0:00:00,"Olympics 2021: Olyroos, Matildas handed tough Tokyo draws"
2021/04/21 0:00:00,COVID-19 cases in WA confirmed as acquired inside hotel quarantine
2021/04/21 0:00:00,"Two new COVID cases caught in hotel quarantine in Perth, released guests forced to self-isolate"
2021/04/21 0:00:00,Putin warns foreign rivals against 'crossing red line' with Russia
2021/04/21 0:00:00,Chemical weapons watchdog votes to suspend Syria's rights
2021/04/21 0:00:00,Putin denounces Western silence on Belarus 'coup attempt'
2021/04/21 0:00:00,Collingwood Football Club appoints Mark Korda as 13th President
2021/04/21 0:00:00,Paul Gallen arrives late after last-minute drug test drama
2021/04/21 0:00:00,Victorian returning from New Zealand urged to monitor for coronavirus symptoms
2021/04/21 0:00:00,Putin vows Russia will fight climate change
2021/04/21 0:00:00,"Whispering Wall deaths: Man, baby die after fall from 36m high dam wall"
2021/04/21 0:00:00,Russian government's main task is to boost incomes: Putin
2021/04/21 0:00:00,Russia aiming for herd immunity against virus by autumn: Putin
2021/04/21 0:00:00,Deby's son named 'president of the republic' of Chad
2021/04/21 0:00:00,Putin begins annual state of nation address
2021/04/21 0:00:00,Queen’s 95th birthday message as photo shared by Buckingham Palace
2021/04/21 0:00:00,Matthew Wade and Will Pucovski reportedly not included in Cricket Australia contract list
2021/04/21 0:00:00,Paul Gallen vs Lucas Browne now has $2 million on the line
2021/04/21 0:00:00,COVID-19 vaccine side effects Australians are experiencing
2021/04/21 0:00:00,Catherine Zeta-Jones celebrates daughter’s 18th birthday with swimsuit photo
2021/04/21 0:00:00,Mitch Creek’s Tokyo Olympic hopes remain alive after Victorian police withdrew assault charges
2021/04/21 0:00:00,"Fraudster Matthew Waij conned family out of super, spent money on Kmart and Gucci spree, strippers"
2021/04/21 0:00:00,Paul Gallen knocks out Lucas Browne: NRL star destroys former champion
2021/04/21 0:00:00,Nicola Peltz explains ‘weird’ wisdom tooth necklace from Brooklyn Beckham
2021/04/21 0:00:00,Donald Trump Jr now Donald Trump’s most senior political adviser
2021/04/21 0:00:00,Under the Southern Stars festival organisers cancel 2021 concert series over COVID-19 fears
2021/04/21 0:00:00,"‘Gut-wrenching’: Families, police speak one year since horror Eastern Freeway crash tragedy"
2021/04/21 0:00:00,WA Premier Mark McGowan says home quarantine idea is a ‘recipe for disaster’
2021/04/21 0:00:00,Goodstart Early Learning faces fresh charges over horror death of child left in bus
2021/04/21 0:00:00,German court throws out challenge against EU virus recovery fund
2021/04/21 0:00:00,India reels from Covid-19 'storm' as Europe vows vaccine push
2021/04/21 0:00:00,Chris Waller targets Queensland Derby with improving stayer Yangtze Rapids after Canterbury win
2021/04/21 0:00:00,"Pfizer, Moderna COVID-19 vaccines could soon be made in Melbourne"
2021/04/21 0:00:00,Trainer Bjorn Baker to launch a three-pronged attack on Group 1 Champagne Stakes
2021/04/21 0:00:00,South African strain of coronavirus may have spread in Sydney hotel: NSW Health
2021/04/21 0:00:00,Russian police detain Navalny activists before protests
2021/04/21 0:00:00,"Raceday focus: Best bets, analysis for Pakenham"
2021/04/21 0:00:00,South Sydney Rabbitohs great George Piggins rushed to hospital
2021/04/21 0:00:00,Australian sharemarket eases for second straight day after negative Wall Street lead over rising COVID cases
2021/04/21 0:00:00,Tassie Decides: Your say on state election issues that matter to you
2021/04/21 0:00:00,Keepers stunned by ‘incredible’ friendly jabiru
2021/04/21 0:00:00,"Veni, vidi, bici: Is Rome ready for a cycling 'revolution'?"
2021/04/21 0:00:00,Parliamentarian: Meghan Markle’s claims could spell end of British monarchy
2021/04/21 0:00:00,Haas driver Mick Schumacher reveals Formula 1 ‘torture’
2021/04/21 0:00:00,"Anzac Day 2021: What’s open in Brisbane, Dawn Service, parade times"
2021/04/21 0:00:00,Man’s body found at Henry Street home in Melton identified as father of two Shane Brown
2021/04/21 0:00:00,NZ cleaner who tested positive for COVID-19 also worked on planes bound for Australia
2021/04/21 0:00:00,"Newcastle, Grafton previews: Edward Cummings is hungry for success and is eyeing off a Hunter double"
2021/04/21 0:00:00,Ohio police shoot dead Makhia Bryant on same day as George Floyd murder verdict
2021/04/21 0:00:00,Furious Russian billionaire pulls out of football mutilation in shame: Super League timeline
2021/04/21 0:00:00,"Early Oil: Best bets, analysis and latest odds for Caulfield plus Nick Quinn’s Mailbag"
2021/04/21 0:00:00,Apple adds podcast subscriptions as competition mounts
2021/04/21 0:00:00,Science without gravity at the International Space Station
2021/04/21 0:00:00,Video goes viral showing man’s reckless swimming pool diving stunt
2021/04/21 0:00:00,Economists believe Australia’s migration program needs an overhaul
2021/04/21 0:00:00,Police investigate after Snapchat video shows man firing gun at western Sydney brawlers
2021/04/21 0:00:00,Relationship Rehab: Husband fuming over wife’s act after affair
2021/04/21 0:00:00,"Deshaun Watson’s girlfriend, Jilly Anais, posts defiant photo amid accusations"
2021/04/21 0:00:00,Miss Universe Australia unveils national costume for pageant final
2021/04/21 0:00:00,AFL: Jesse Hogan is in the frame to play his first game for GWS this Friday
2021/04/21 0:00:00,Zara’s Barbie collection dubbed bizarre and harmful by shoppers
2021/04/21 0:00:00,Six ways to say goodbye: how English clubs announced Super League pull-outs
2021/04/21 0:00:00,"Raceday focus: Best bets, inside mail for Newcastle, Grafton"
2021/04/21 0:00:00,Simple steps to making the perfect bed
2021/04/21 0:00:00,Dragons star Trent Merrin retires from NRL effective immediately at 31
2021/04/21 0:00:00,Trentham East: Sacred Heart Church conversion a heavenly home
2021/04/21 0:00:00,Jury to decide fate of Block star Suzi Taylor and co-accused over alleged extortion ordeal
2021/04/21 0:00:00,Parramatta Eels confirm current player is at centre of NRL sex tape scandal
2021/04/21 0:00:00,World records largest ever number of coronavirus cases over a seven day period
2021/04/21 0:00:00,Millionaire NFL owner responsible for George Floyd tweet that shocked America
2021/04/21 0:00:00,All Aged Stakes is the fork in the career of Tagaloa
2021/04/21 0:00:00,KFC SuperFooty TV: Could Ross Lyon take Carlton to the promised land?
2021/04/21 0:00:00,‘Not safe’: Broken Hill nurses call for more resources
2021/04/21 0:00:00,"Traumatised SA doctor David Hooper forced to ‘shop’ around dying teen Alex Braes at Broken Hill, inquest hears"
2021/04/21 0:00:00,"Neighbours remember slain mother Kelly Wilkinson as doting parent, say speaking about her death is ‘like reliving it’"
2021/04/21 0:00:00,Novak Djokovic rejects Rafael Nadal’s ‘obsessed’ claim
2021/04/21 0:00:00,Queensland bus driver used early access to super to pay off $60K debt
2021/04/21 0:00:00,Bathurst 1000: Russell Ingall to race a wildcard entry at Mount Panorama in 2021
2021/04/21 0:00:00,"India records more than 2,000 Covid deaths in 24 hours"
2021/04/21 0:00:00,Fifty Two Black: Luxe Brighton development’s Ralph Lauren twist
2021/04/21 0:00:00,"Chinese diplomat Wang Xining on Huawei, Cheng Lei and trade tensions"
2021/04/21 0:00:00,Graveyard of the bikes: China's failed share-cycle scheme from above
2021/04/21 0:00:00,Assault charges against NBL star Mitch Creek dropped
2021/04/21 0:00:00,Queen Elizabeth marks first birthday without Prince Philip
2021/04/21 0:00:00,Comeback jockey Baylee Nothdurft gets the nod to ride The Candy Man at Doomben
2021/04/21 0:00:00,India’s crematoriums burning bodies ‘day and night’ as COVID death toll rises again
2021/04/21 0:00:00,"European Parliament, EU member states agree target to cut CO2: statement"
2021/04/21 0:00:00,Champion New Zealand jockey Lisa Allpress to ride in Australia for first time in 12 years at Sandown
2021/04/21 0:00:00,Trent Merrin announces immediate retirement from NRL
2021/04/21 0:00:00,"Queen’s double tragedy as good friend and racing adviser Sir Michael Oswald, 86, dies"
2021/04/21 0:00:00,New search for Hayley Dodd’s remains comes after killer’s comments during trial
2021/04/21 0:00:00,Perth influencer shares Coles capsicum hack to save money
2021/04/21 0:00:00,Prince Harry skips Queen’s birthday to arrive back home in LA and reunite with pregnant Meghan Markle
2021/04/21 0:00:00,Documentary tells 'unknown' story of Titanic's Chinese survivors
2021/04/21 0:00:00,Eva Mendes sparks debate with comment about spanking children
2021/04/21 0:00:00,Law change to stop Aussies using loophole to travel outside trans-Tasman bubble
2021/04/21 0:00:00,Palatial Dural mansion with 10 bedrooms and wall-less ensuite for sale after epic renovation
2021/04/21 0:00:00,"Jack de Belin, Callan Sinclair trial hears housemate lied about seeing footballers"
2021/04/21 0:00:00,One year on from historic sub-zero plunge oil prices recover
2021/04/21 0:00:00,What Derek Chauvin wrote on his hand before George Floyd murder verdict
2021/04/21 0:00:00,Brett Sutton drives fans wild with ‘sexy’ AstraZeneca vaccine photos
2021/04/21 0:00:00,Sixth track rider banned over positive test following stewards’ raid at Ballarat
2021/04/21 0:00:00,"Apple Event 2021: Fans, experts react to new AirTag, iMac and iPad"
2021/04/21 0:00:00,Chad Townsend quitting Sharks to join Cowboys after John Morris sacked
2021/04/21 0:00:00,Two-sentence response shredded after mass Super League exodus
2021/04/21 0:00:00,Jury discharged in trial of man accused of sharing Christchurch massacre footage
2021/04/21 0:00:00,Milkshake ad a product of tone deaf Morrison government
2021/04/21 0:00:00,‘Shameful’: Federal government lashed over vaccine black hole
2021/04/21 0:00:00,All Aged Stakes: James Cummings has strong hand to topple favourite Masked Crusader
2021/04/21 0:00:00,For sale sign goes up on Perth’s historic London Court for first time in 80 years
2021/04/21 0:00:00,Horrific map exposes impact of domestic violence in Australia
2021/04/21 0:00:00,Landmark decision as Tasmanian Cup Final harness result overturned after protracted investigation
2021/04/21 0:00:00,Sydney woman warned in note from ‘neighbours’ that dog will be poisoned
2021/04/21 0:00:00,Champion hoop Glen Boss relocates to Queensland again for winter carnival
2021/04/21 0:00:00,Judge throws out fraud case against Victorian Nationals MP Tim McCurdy
2021/04/21 0:00:00,"Hong Kong woman, 90, loses US$32 million in phone scam"
2021/04/21 0:00:00,BHP reports record iron ore production from flagship WA mines as price surges to 10-year highs
2021/04/21 0:00:00,Talking to kids about consent: Tough conversations parents need to have with their sons
2021/04/21 0:00:00,Lexus LS500 review: Top shelf machine can feel a bit old school
2021/04/21 0:00:00,Under the Southern Stars tour organisers blast government over postponement
2021/04/21 0:00:00,"Ted Lasso charms with season 2 trailer, reveals premiere date"
2021/04/21 0:00:00,"Saturday fields, form and information for metropolitan race meetings"
2021/04/21 0:00:00,Former MasterChef star Ben Ungermann represented by another former contestant
2021/04/21 0:00:00,The eight contenders for the best picture Oscar
2021/04/21 0:00:00,Pet market dodges Covid malaise in dog-crazy Brazil
2021/04/21 0:00:00,China's Xi to attend online Biden climate summit
2021/04/21 0:00:00,Mum’s desperate plea after Qld burning death
2021/04/21 0:00:00,Carla Zampatti’s final interview and photo shoot for Women’s Weekly
2021/04/21 0:00:00,Victorian chief health officer Brett Sutton gets COVID-19 vaccine
2021/04/21 0:00:00,Liam Hemsworth’s unruly new look that’s sending fans wild
2021/04/21 0:00:00,AFL: Melbourne won’t bring Ben Brown and Sam Weideman in at the same time
2021/04/21 0:00:00,NRL investigating after Parramatta Eels player allegedly in toilet sex tape scandal
2021/04/21 0:00:00,Pregnant Ellie Goulding poses naked for Paper magazine
2021/04/21 0:00:00,ABS reveals people who accessed super early used it to pay down mortgages and bills
2021/04/21 0:00:00,"NRL, Parramatta Eels investigating toilet sex tape"
2021/04/21 0:00:00,Victorian Racing Tribunal rules trainer Archie Alexander breached administration rules in cobalt case
2021/04/21 0:00:00,Murderer found guilty of choking girlfriend writes bizarre letter to judge
2021/04/21 0:00:00,'Joints for jabs': free marijuana for vaccinated New Yorkers
2021/04/21 0:00:00,Ukraine leader Zelensky urges Putin to meet in war-torn east
2021/04/21 0:00:00,Super League in ruins as all six English clubs pull out
2021/04/21 0:00:00,Morrissey blasted by his own fans for over-reaction to Simpsons parody
2021/04/21 0:00:00,A whale chorus reveals how climate change may be shifting migration
2021/04/21 0:00:00,Target Australia to become mostly online retailer as stores close down
2021/04/21 0:00:00,China's Xi to attend online Biden climate summit: foreign ministry
2021/04/21 0:00:00,Pip Edwards accused of photoshopping Byron Bay hotel bikini photo
2021/04/21 0:00:00,Scientists pose new theory about Melbourne’s fatal thunderstorm asthma event
2021/04/21 0:00:00,Crichton reveals reason for one-year deal and Rugby World Cup ‘has nothing to do with it’
2021/04/21 0:00:00,Kyle Sandilands reveals why Zac Efron and Vanessa Valladares split up
2021/04/21 0:00:00,Super League responds as all six EPL clubs quit after ferocious backlash
2021/04/21 0:00:00,Troye Sivan: Aussie actor and singer-songwriter takes fans inside his renovated Carlton pad
2021/04/21 0:00:00,Unhappy NBL players to seek legal advice over hardship fund
2021/04/21 0:00:00,"Traumatised doctor forced to ‘shop’ around dying teen Alex Braes, inquest hears"
2021/04/21 0:00:00,Gymnast ‘threw newborn baby to her death down rubbish chute’ after texting the dad that she ‘didn’t want her’
2021/04/21 0:00:00,Biden calls 'systemic racism' a 'stain on our nation's soul'
2021/04/21 0:00:00,AFL: Western Bulldogs expect GWS to share the ‘physical love’ when they clash this week
2021/04/21 0:00:00,Brisbane man hospitalised for clots days after receiving Pfizer vaccine
2021/04/21 0:00:00,'Justice': America reacts to Floyd murderer's conviction
2021/04/21 0:00:00,Click Frenzy Travel 2021: Best flight & holiday deals | Full list
2021/04/21 0:00:00,George Floyd trial verdict: Derek Chauvin found guilty of murder
2021/04/21 0:00:00,Siegemund sets up Barty clash in Stuttgart
2021/04/21 0:00:00,‘Medical incident’: Initial police account of George Floyd’s death goes viral after murder conviction
2021/04/21 0:00:00,271kg bluefin tuna the ‘biggest ever’ fish sold at Sydney Fish Markets
2021/04/21 0:00:00,"Paul Gallen vs Lucas Browne: Start time, how to watch"
2021/04/21 0:00:00,Women who wake up at night twice as likely to die young
2021/04/21 0:00:00,Racing industry remembers ‘true racing man’ Neville Layt
2021/04/21 0:00:00,NRMA study finds 70 per cent of drivers experienced road rage in last 12 months
2021/04/21 0:00:00,"LeBron James, NBA react to George Floyd murder verdict"
2021/04/21 0:00:00,Biden calls on US 'to unite as Americans' and avoid violence
2021/04/21 0:00:00,Cold snap hits southeast as Melbourne has coldest night of year and torrential rain continues in Queensland
2021/04/21 0:00:00,Nikki Grahame’s heartbreaking final text to ex-boyfriend
2021/04/21 0:00:00,‘Murder in the full light of day’: Biden speaks after George Floyd verdict
2021/04/21 0:00:00,Dreamworld boss resigns amid update revealing the recent Brisbane lockdown dented the park’s performance
2021/04/21 0:00:00,Woman allegedly filmed rape attack instead of saving victim
2021/04/21 0:00:00,Controversial Lindfield Learning Village to be investigated
2021/04/21 0:00:00,EU agency says clot 'very rare' J&J vaccine side effect
2021/04/21 0:00:00,What happens next after Derek Chauvin’s guilty verdict in George Floyd murder case
2021/04/21 0:00:00,"Sesame Street costume found: ‘Big Bird Bandits’ dump costume, apologise for theft with note in beak"
2021/04/21 0:00:00,MasterChef E2 recap: Conor refuses to be hurried by chaotic cooking challenge
2021/04/21 0:00:00,China bans ‘weird’ and ‘ugly’ buildings to appease Xi Jinping
2021/04/21 0:00:00,"Gerard Whateley slams AFL ‘arrogance’ after Pies breach, calls for $1m fine"
2021/04/21 0:00:00,"South Melbourne: artist’s home sells, media lawyer’s mansion seeking $7.2m sale"
2021/04/21 0:00:00,Scott Morrison responds after Brittany Higgins writes letter to PM asking for urgent meeting
2021/04/21 0:00:00,World rejoices as Super League burns to the ground
2021/04/21 0:00:00,Raiders make mass changes after massive loss — NRL round 7 teams named
2021/04/21 0:00:00,UK PM Johnson welcomes guilty verdict for US policeman Chauvin
2021/04/21 0:00:00,CCTV captures moment man guns down wife in US restaurant
2021/04/21 0:00:00,Biden to deliver remarks on George Floyd trial verdict: W.House
2021/04/21 0:00:00,Royals who snubbed Harry at Prince Philip’s funeral revealed
2021/04/21 0:00:00,Biden tells Floyd family he's 'so relieved' by verdict
2021/04/21 0:00:00,Wife marries father-in-law after divorcing husband
2021/04/21 0:00:00,Vaccination rollout could take four years: Dr Sanjaya Senanayake
2021/04/21 0:00:00,GoFundMe for Kelly Wilkinson’s three children: How to help
2021/04/21 0:00:00,2021 Maserati Levante Hybrid revealed
2021/04/21 0:00:00,Prince Charles and Prince William refused to meet with Prince Harry one-on-one
2021/04/21 0:00:00,Veteran Chad leader Deby dies battling rebels: army
2021/04/21 0:00:00,"Barrett’s fresh poaching raid on Panthers duo, Dragons star 50/50 to stay: Transfer Whispers"
2021/04/21 0:00:00,White ex-policeman Chauvin convicted of George Floyd's murder
2021/04/21 0:00:00,Music legend and songwriter Jim Steinman dead at 73
2021/04/21 0:00:00,"Apple unveils new slim iMacs, ‘AirTags’ in overnight product launch"
2021/04/21 0:00:00,Court: Brian Johnston charged with Kelly Wilkinson’s murder after her body was found burned in a backyard
2021/04/21 0:00:00,US ex-cop Derek Chauvin convicted of George Floyd's murder
2021/04/21 0:00:00,31 Melbourne suburbs on alert after coronavirus fragments found in wastewater
2021/04/21 0:00:00,Live breaking news: Sydney man facing 47 sexual assault charges
2021/04/21 0:00:00,‘I must be from another planet’: Gus blasts judiciary inconsistency in Latrell and Radley rulings
2021/04/21 0:00:00,"Kelly Wilkinson, Gold Coast: Mystery plea before mum’s horrific death"
2021/04/21 0:00:00,Zac Efron and Vanessa Valladares have broken up
2021/04/21 0:00:00,Derek Chauvin trial: World reacts to George Floyd verdict
2021/04/21 0:00:00,Doctors denied access to 'very weak' Kremlin foe Navalny
2021/04/21 0:00:00,Netflix shares tumble as subscriber growth cools
2021/04/21 0:00:00,23 dead in weekend Egypt train accident: new toll
2021/04/21 0:00:00,Czechs threaten to expel all Russian diplomats
2021/04/21 0:00:00,"COVID etiquette: Are you getting it right, or very wrong in your neighbourhood"
2021/04/21 0:00:00,Simple ways to support struggling veterans this ANZAC Day
2021/04/21 0:00:00,Modbury home on the market for the first time in 60 years offers blast from the past
2021/04/21 0:00:00,George Floyd murder trial: Jury reaches verdict
2021/04/21 0:00:00,Turkey says Afghanistan peace talks postponed: foreign minister
2021/04/21 0:00:00,Ukraine President Zelensky invites Putin to meet in war-torn east
2021/04/21 0:00:00,Verdict reached in George Floyd murder trial
2021/04/21 0:00:00,NRL judiciary ban Latrell and Panthers star as Radley free to play
2021/04/21 0:00:00,US urges Russia to allow doctors for Navalny 'immediately'
2021/04/21 0:00:00,"Dutch to end curfew, let cafes serve outdoors from April 28"
2021/04/21 0:00:00,Chad sets state funeral for Deby on Friday: presidency
2021/04/21 0:00:00,"Mexican president gets Covid vaccine, says 'no risk'"
2021/04/21 0:00:00,George W. Bush speaks out about state of the Republican Party under Donald Trump
2021/04/21 0:00:00,Rebels vow to pursue Chad offensive after Deby's death
2021/04/21 0:00:00,Biden says evidence 'overwhelming' in George Floyd trial
2021/04/21 0:00:00,Czech minister says ready to send all Russian diplomats home
2021/04/21 0:00:00,Pakistan parliament postpones debate on expelling French ambassador
2021/04/21 0:00:00,J&J and other drugmakers go on trial over US opioid crisis
2021/04/21 0:00:00,Blood clots should be listed as rare Johnson & Johnson side effect: EMA
2021/04/21 0:00:00,France hails Chad president Deby as 'courageous friend'
2021/04/21 0:00:00,Former Prime Minister Malcolm Turnbull lashes ‘pathetic’ Scott Morrison
2021/04/21 0:00:00,Eltham: fun-filled Ryans Road house has mini golf course
2021/04/21 0:00:00,Hamlyn Heights vendor relieved as renovator buys beloved home
