date,title
2021/03/03 0:00:00,NBL21: South East Melbourne import Keifer Sykes to miss 3-6 weeks with ankle injury
2021/03/03 0:00:00,Defence Minister Linda Reynolds called Brittany Higgins a ‘lying cow’ in office
2021/03/03 0:00:00,Seven Network exec Bruce McWilliam sells Point Piper waterfront for about $33m
2021/03/03 0:00:00,Ugly twist in bitter dispute between Cricket Australia and Cricket South Africa
2021/03/03 0:00:00,"NBL 21: Kyle Adnam on fire, but South East Melbourne Phoenix lose thriller against Perth Wildcats"
2021/03/03 0:00:00,Australians superannuation funds over frustration on climate change
2021/03/03 0:00:00,Live breaking news: Emotional Scott Morrison responds to Christian Porter allegation
2021/03/03 0:00:00,Shadowplay is a vivid portrait of a complex place
2021/03/03 0:00:00,Aaron Finch smacks half-century in long-awaited return to form
2021/03/03 0:00:00,Explosion hits COVID-19 testing centre in the Netherlands
2021/03/03 0:00:00,‘Terrified’: Erin Molan’s life-changing plea after first colonoscopy
2021/03/03 0:00:00,Troubling detail in Aussie weather data
2021/03/03 0:00:00,Far North could host Aussie stars in lead-up to Ashes
2021/03/03 0:00:00,James Weir recaps Married At First Sight Australia 2021 episode 8 | Tricked: MAFS star slept with married ex
2021/03/03 0:00:00,"Investigation to continue into death of woman who alleged she was raped by Christian Porter, SA Coroner says"
2021/03/03 0:00:00,Constellation Cup 2021: Diamonds strike back against Silver Ferns to level the series
2021/03/03 0:00:00,Newcastle Knights fullback Kalyn Ponga’s plea to the NRL
2021/03/03 0:00:00,Grace Tame confronts Scott Morrison over response to sexual assault allegations
2021/03/03 0:00:00,"What Christian Porter remembers from night of alleged rape, which he denies"
2021/03/03 0:00:00,Qld claims it’s being ‘picked on’ in bizarre health department tweet about vaccine rollout
2021/03/03 0:00:00,Port Macquarie preview: Nathan Doyle confident drop in distance can see Oslo atone
2021/03/03 0:00:00,Shop at Westfield Miranda mistakenly displays swastika face mask in window sparking outrage
2021/03/03 0:00:00,Shane Warne’s drastic proposal to fix cricket’s glaring issue
2021/03/03 0:00:00,Hells Angels bikie who bashed Rebels boss Nick Martin weeks before his murder targeted in drive-by shooting
2021/03/03 0:00:00,Attorney-General Christian Porter won’t resign after denying rape historical claim
2021/03/03 0:00:00,"Australian sharemarket driven higher by banks, mining stocks, record GDP rebound"
2021/03/03 0:00:00,Grace Tame’s Australian Press Club speech in full
2021/03/03 0:00:00,‘Profound humiliation’: Ex-headmaster caught in massive lie
2021/03/03 0:00:00,‘I want Tuivasa-Sheck before he leaves’: Ponga calls for player names on club jerseys
2021/03/03 0:00:00,Racing NSW stewards employ  Labrador to help catch cheats
2021/03/03 0:00:00,Graham Arnold to name a 34-man Socceroos squad for qualifying hub
2021/03/03 0:00:00,How former homeless man made up to $2k a week driving a Chrysler through Uber
2021/03/03 0:00:00,‘I had to make decisions’: Freddy hints at end to Latrell’s Origin exile
2021/03/03 0:00:00,Ballarat trainer Matt Cumani wants San Huberto to emulate 2012 winner Manighar in Saturday’s Australian Cup at Flemington
2021/03/03 0:00:00,Essendon great Tim Watson accuses AFL of snubbing fans
2021/03/03 0:00:00,Driver escapes injury after two solar panels hurtle down major motorway and hit vehicle
2021/03/03 0:00:00,NSW Police ask Supreme Court to shut down Mardi Gras ‘Pride in Protest’ split-off rally
2021/03/03 0:00:00,"‘School of Rock’ child star says role resulted in addiction, bullying"
2021/03/03 0:00:00,Secrets of serial killer: What Ivan Milat’s body after death revealed
2021/03/03 0:00:00,"Christian Porter: Who is the cabinet minister, what does he do, wife and family details"
2021/03/03 0:00:00,"We Try: The Dyson V11 Outsize cordless vacuum, the latest, most powerful model"
2021/03/03 0:00:00,Australia’s Attorney-General Christian Porter denies historical rape allegation
2021/03/03 0:00:00,Boost Juice founder Janine Allis lists Fairhaven’s Mad Max house
2021/03/03 0:00:00,Why a reserve grade stint won’t hurt teen sensation Joseph Suaalii: Friend
2021/03/03 0:00:00,Chris D’Elia faces lawsuit after allegedly possessing child pornography
2021/03/03 0:00:00,NAB survey finds young Sydneysiders top the nation’s most anxious about their finances
2021/03/03 0:00:00,Bringing veteran ruckman Stefan Martin to the Western Bulldogs could have the added effect of unleashing a new forward line weapon
2021/03/03 0:00:00,Australian Cup 2021: Patrick Payne puts Defibrillate to the test in  weight-for-age feature
2021/03/03 0:00:00,Chaos Walking could’ve been so much worse
2021/03/03 0:00:00,Meghan Markle faces bullying claims ahead of tell-all Oprah interview
2021/03/03 0:00:00,Football Ferns defender Rebekah Stott reveals blood cancer diagnosis
2021/03/03 0:00:00,Melissa Caddick mystery: Human remains found at Mollymook Beach identified as belonging to missing Ingleburn man
2021/03/03 0:00:00,Finch and Maxwell unload as Agar makes T20 history in Aussies win over NZ in third T20I
2021/03/03 0:00:00,‘Crushed’ Eddie McGuire reportedly ‘in a bad way’ after Collingwood demise
2021/03/03 0:00:00,Australia develops surface disinfectant to kill COVID-19 in 90 seconds
2021/03/03 0:00:00,Nadia Bokody: Sex blunder most couples make
2021/03/03 0:00:00,Miranda Kerr reveals she lost her grandmother weeks after her grandfather
2021/03/03 0:00:00,Newmarket Handicap 2021: Craig Newitt chasing riding record on Prophet’s Thumb at Flemington
2021/03/03 0:00:00,"Lowy Institute report reveals racism, discrimination against Chinese Australians"
2021/03/03 0:00:00,"Newcastle siege: Elderly man, woman held hostage while one of the accused is on the run"
2021/03/03 0:00:00,Hamish and Zoe Foster Blake encourage big city escapes in Tourism Australia campaign
2021/03/03 0:00:00,Twitter strike system will ban users who post COVID vaccine misinformation
2021/03/03 0:00:00,Last chance: Vote for the Territory’s Best Pizza
2021/03/03 0:00:00,Avocado farm in Mountain Top with over 14k trees up for sale
2021/03/03 0:00:00,La Nina results in nation’s wettest summer in four years
2021/03/03 0:00:00,Parliamentary committee recommends swastika ban in Victoria after rise in neo-Nazi activity
2021/03/03 0:00:00,Collingwood coach Nathan Buckley concedes he failed to properly grasp the ‘trauma’ felt by former player Heritier Lumumba
2021/03/03 0:00:00,Learmonth blacksmith and bakery revamped as country retreat
2021/03/03 0:00:00,‘Big year for myself’: Milford concedes 2021 is make or break for his Broncos career
2021/03/03 0:00:00,Adam Margolis found guilty of murdering 26yo girlfriend Mai Vang
2021/03/03 0:00:00,Inside SOMA Collection: Luxury Sydney gym celebrities love
2021/03/03 0:00:00,"Russian variant sparks fear in Qld, prompting extension of hotel quarantine for dozens"
2021/03/03 0:00:00,Joel Creasey and Courtney Act talk about Mardi Gras 2021
2021/03/03 0:00:00,St Kilda star recruit Brad Crouch needs to earn ‘respect’ before judgment day
2021/03/03 0:00:00,Victorian state of emergency powers: Opposition accuses Daniel Andrews government of backroom dealings
2021/03/03 0:00:00,Emily Ratajkowski bares all for a pregnancy photoshoot
2021/03/03 0:00:00,The advice women should ignore when trying to succeed in male-dominated fields
2021/03/03 0:00:00,‘I can do a hell of a lot of damage’: Former Victorian official plots anti-lockdown political movement
2021/03/03 0:00:00,Alex Jones regrets meeting Donald Trump but is happy to make ‘millions’ out of his followers who will ‘buy anything’
2021/03/03 0:00:00,Jockey Tom Marquand bullish about Addeybb’s Sydney autumn carnival chances
2021/03/03 0:00:00,Victoria’s government wants coronavirus lawsuits thrown out
2021/03/03 0:00:00,‘Fire in my belly’: Tasmanian tiger hunter’s passion to prove disbelievers wrong
2021/03/03 0:00:00,"Family of woman who alleged she was raped by current federal minister experiencing ‘considerable grief’, lawyer says"
2021/03/03 0:00:00,Grace Tame talks about child sex abuse at Australian Press Club
2021/03/03 0:00:00,Hackers access personal details of Oxfam Australia charity supporters
2021/03/03 0:00:00,WA Police Commissioner Chris Dawson to push for tough border controls to remain in place permanently
2021/03/03 0:00:00,"Scott Morrison and Kamala Harris talk China, climate change in phone call"
2021/03/03 0:00:00,Meghan’s diamond earrings allegedly gifted by Saudi Prince linked to journalist murder
2021/03/03 0:00:00,Australian of the Year Grace Tame’s National Press Club address
2021/03/03 0:00:00,FAQ: How to customise the My News Feed
2021/03/03 0:00:00,Woolworths scraps cashless store trial after customers threaten to boycott
2021/03/03 0:00:00,Australian new cars sales soar on the back of Chinese brands
2021/03/03 0:00:00,Event now ‘an absurdity’: Alternative Mardi Gras parade could attract thousands
2021/03/03 0:00:00,Mum who gave birth via IVF at 64 loses custody of twins
2021/03/03 0:00:00,Cruise industry’s plea to have COVID-safe plan approved so they’re ready to sail again
2021/03/03 0:00:00,"Rio Tinto chair to step down over Juukan Gorge cave blast scandal, says he’s ‘accountable’"
2021/03/03 0:00:00,Randwick Guineas 2021: Mo’unga up for the challenge against unbeaten Aegon
2021/03/03 0:00:00,"Sydney woman Katie McCarthy turns side hustle business Scrunchiko into $100,000 success"
2021/03/03 0:00:00,Chanel Contos petition: Sydney school principal calls on parents to instil ‘self-respect’ in their daughters
2021/03/03 0:00:00,Meghan Markle asks Mail on Sunday to pay $2.7 million in legal fees
2021/03/03 0:00:00,Kiaarn Holland making her mark as a racing educator in Queensland
2021/03/03 0:00:00,Homebuyers avoid physical inspections in hope of getting into booming market faster
2021/03/03 0:00:00,"Christian Porter reveals himself as minister accused of rape, denies claims"
2021/03/03 0:00:00,"South Australia passes historic bill, decriminalises abortion"
2021/03/03 0:00:00,Bizarre find in bin outside Armie Hammer’s house
2021/03/03 0:00:00,Melissa Caddick death: Police divers search cliffs near Dover Heights
2021/03/03 0:00:00,W-League: Adelaide United captain Dylan Holmes sold to Swedish heavyweights
2021/03/03 0:00:00,Love KFC SuperCoach? Why it’s good to subscribe to the Herald Sun
2021/03/03 0:00:00,Latest national accounts data shows GDP has improved
2021/03/03 0:00:00,Sydney party mum on escaping Jehovah’s Witness religion
2021/03/03 0:00:00,iCarly teen star Jennette McCurdy on why she quit acting
2021/03/03 0:00:00,NRL great’s ‘conspiracy theory’ exposes petty loophole in new player transfer system
2021/03/03 0:00:00,"Scene that had to be cut from Lena Dunham’s new series, Generation"
2021/03/03 0:00:00,Proof Aussie tennis star Alex de Minaur ‘just isn’t human’
2021/03/03 0:00:00,Cardiology professor pleads guilty to possessing child abuse material on his phone
2021/03/03 0:00:00,Stray cat hijacks Tarco Airlines flight forcing emergency landing
2021/03/03 0:00:00,‘Blue Eyes White Dragon’ Amber Luke to learn fate for serious drug charges
2021/03/03 0:00:00,Inside Lady Gaga’s houses and her $36.1 million real estate portfolio
2021/03/03 0:00:00,Former first daughter relaxes on boat during post-White House family outing
2021/03/03 0:00:00,Challenge Stakes 2021: Stephanie Thornton joins her favourite horse on the big stage in Sydney
2021/03/03 0:00:00,Two cops lose appeal against guilty findings for assaulting disabled man
2021/03/03 0:00:00,"Mardi Gras 2021: COVID-19 restrictions, how to watch, RuPaul’s Drag Race reveal"
2021/03/03 0:00:00,Qantas demands assurances domestic borders will not close
2021/03/03 0:00:00,Matcham dream home features fireplace designed by The Block’s Darren Palmer
2021/03/03 0:00:00,"Bees more dangerous to Australians than snakes, spiders and jellyfish"
2021/03/03 0:00:00,‘Don’t report MPs’: Shocking report outlines sexual harassment in SA parliament
2021/03/03 0:00:00,Kmart urged to fast-track safety improvements after boy injuries himself on clothing rack hook
2021/03/03 0:00:00,Scott Morrison called out of handling of rape claim against Cabinet Minister
2021/03/03 0:00:00,David Warner admits major mistake in India Test series ahead of long-awaited cricket return
2021/03/03 0:00:00,Majority of Aussies would use a COVID vaccine passport: SkyScanner
2021/03/03 0:00:00,"Overseas labour shortage causes fruit, vegie production to fall, prices to rise"
2021/03/03 0:00:00,Police officers Brad McLeod and Florian Hilgart lose appeal over assault of Preston pensioner
2021/03/03 0:00:00,Kiwi star obliterates hapless club cricketers in stunning performance
2021/03/03 0:00:00,NSW Liberal MP John Sidoti resigns from ministry after ICAC announces probe
2021/03/03 0:00:00,Eugenie Bouchard bombs out after striking major deal
2021/03/03 0:00:00,"Wild HBO documentary, There Is No ‘I’ In Threesome, drops in Australia"
2021/03/03 0:00:00,Nine Entertainment names Mike Sneesby as new CEO after Hugh Marks steps down
2021/03/03 0:00:00,COVID-19 causes postponement of women’s Rugby World Cup
2021/03/03 0:00:00,"State of Emergency Extension Bill could last all year, debate resumes in Victorian parliament"
2021/03/03 0:00:00,AstraZeneca vaccine to be rolled out in NSW from March 10 in Sydney
2021/03/03 0:00:00,ADF chief tells cadets they should avoid making themselves ‘prey’ to sexual predators
2021/03/03 0:00:00,Doctor reveals ‘gross’ reason you need to change your pillow every two years
2021/03/03 0:00:00,"Senior diplomat labels Australians who criticise China ‘scumbags’, embassy omits insult in English translation"
2021/03/03 0:00:00,Neo-Nazi leader Thomas Sewell charged over alleged assault of Channel 9 security guard
2021/03/03 0:00:00,Channel 7 makes prickly call to dismiss outside contenders for Bruce McAvaney throne
2021/03/03 0:00:00,"Ex-senator David Leyonhjelm blasted over ‘crass, puerile, objectively sexist’ comments as he loses defamation appeal against Greens’ Sarah Hanson-Young"
2021/03/03 0:00:00,Zack Snyder’s Justice League drops on BINGE and Foxtel tonight
2021/03/03 0:00:00,"Audi RS Q8 review: Big, strong and good looking SUV"
2021/03/03 0:00:00,"Southwest, western Sydney cheapest for petrol according to NRMA"
2021/03/03 0:00:00,Palaszczuk government again demands JobKeeper extension for struggling tourism industry
2021/03/03 0:00:00,Group 1 features galore at Flemington and Randwick on Saturday
2021/03/03 0:00:00,Qantas to bring back ‘90s trend of mystery flights
2021/03/03 0:00:00,Coworkers who became friends discover they are biological sisters
2021/03/03 0:00:00,Home cleaning tips: What needs a daily wipe down and what can be left for months
2021/03/03 0:00:00,Major super fund Rest taken to court for misleading customers
2021/03/03 0:00:00,"MyHeritage Deepfake feature brings photos of dead relatives, historical figures back to life"
2021/03/03 0:00:00,Inside Don McLean’s 48-year age gap romance with model Paris Dylan
2021/03/03 0:00:00,What to do before private health insurance premiums rise on April 1
2021/03/03 0:00:00,Dr Seuss’ author second highest paid dead celebrity as six books cease publication due to racism
2021/03/03 0:00:00,"Dr Seuss cancelled: Six books to cease publication over racist, insensitive portrayals"
2021/03/03 0:00:00,"Qantas brings back $737 mystery flights from Brisbane, Melbourne and Sydney"
2021/03/03 0:00:00,Women’s Rugby World Cup: Tournament set to be delayed until 2022 due to COVID-19
2021/03/03 0:00:00,AFL star Gary Rohan was wife’s rock before baby tragedy and relationship breakdown
2021/03/03 0:00:00,Mozambique: Hundreds of civilians indiscriminately killed as nation plunges into chaos
2021/03/03 0:00:00,Nike rocked by executive’s $100k credit card bill after sneaker side project
2021/03/03 0:00:00,"‘Loving’ mum, 32, died by suicide after she was gang raped"
2021/03/03 0:00:00,Tiger Woods reveals ‘inner demons’ as world reels from car crash
2021/03/03 0:00:00,Victoria records no new cases of coronavirus for fifth consecutive day
2021/03/03 0:00:00,Aldi brings back robot vacuum for $399
2021/03/03 0:00:00,Furious Alec Baldwin blasts speculation about mystery sixth baby with wife Hilaria
2021/03/03 0:00:00,NSW government not told of federal plan to use ADF in vaccinating aged care residents
2021/03/03 0:00:00,Wild weather hits southeast Qld while state’s north hammered by tropical cyclone Niran
2021/03/03 0:00:00,"Best deals of the week: Score hundreds off Michael Kors watch, Sony TVs and more"
2021/03/03 0:00:00,Jessie J shows off new boyfriend Max Pham after splitting from Channing Tatum
2021/03/03 0:00:00,Porter rape claim ‘nowhere near’ being resolved: Hanson-Young
2021/03/03 0:00:00,World Cup: Socceroos clash against Nepal is rescheduled to later date
2021/03/03 0:00:00,Man walks himself to hospital after unprovoked attack in Colac
2021/03/03 0:00:00,Mercedes won’t reveal secrets as Hamilton keeps everyone guessing
2021/03/03 0:00:00,Degrassi: The Next Generation star Jahmil French dies aged 29
2021/03/03 0:00:00,Arrests after teenage girls allegedly sexually assaulted on jet ski at Altona Beach
2021/03/03 0:00:00,Watch: Shocking video of jockey riding dead horse horrifies racing
2021/03/03 0:00:00,Thomas Sewell: Leader of neo-Nazi group charged after alleged attack on TV channel security guard
2021/03/03 0:00:00,Australian government extends overseas travel ban by three months to June
2021/03/03 0:00:00,"California crash kills at least 13 people, 12 more in hospital"
2021/03/03 0:00:00,Live Breaking News: Attorney-General Christian Porter denies rape allegation
2021/03/03 0:00:00,Doctor’s vaccine post slams TGA warning Aussie medicos against spruiking virus vaccine
2021/03/03 0:00:00,Stunning secret meaning behind Meghan Markle’s dress for Oprah interview
2021/03/03 0:00:00,Gordon Elliott deserted after photo of him sitting on dead horse rocks racing
2021/03/03 0:00:00,Security called as 40 buyers camp four days to get land in Sydney’s southwest
2021/03/03 0:00:00,West Lakes sellers in shock as home sells for ”phenomenal” amount
2021/03/03 0:00:00,FBI Director: ‘No evidence’ fake Trump supporters were behind the Capitol riot
2021/03/03 0:00:00,Australia’s Ashes preparation sacrificed in pursuit of maiden T20 World Cup title
2021/03/03 0:00:00,Attorney-General Christian Porter revealed as Liberal Party Cabinet Minister at centre of unproven rape allegations
2021/03/03 0:00:00,"New overseas buyers from UK, US, Singapore and Hong Kong could impact Aussie housing prices"
2021/03/03 0:00:00,Geelong: Swanston Street homes beat reserves by $160K amid flood of young buyers
2021/03/03 0:00:00,Westpac slashes lending rate on coronavirus small business loans
2021/03/03 0:00:00,First-home buyer market activity up 50.4 per cent as housing affordability set to worsen
2021/03/03 0:00:00,Victorian unit approvals plunge to lowest level since GFC
