date,title
2021/06/02 0:00:00,Burnt-out container ship sinking off Sri Lanka
2021/06/02 0:00:00,Hulk Hogan shows off 68-year-old ‘pythons’ after insane workout
2021/06/02 0:00:00,Daniel Andrews sends message to Victorians responding to latest Covid lockdown
2021/06/02 0:00:00,Russian court remands Kremlin critic Andrei Pivovarov for two months
2021/06/02 0:00:00,Floyd Mayweather to earn five times as much as Logan Paul for fight
2021/06/02 0:00:00,Lebanon special tribunal says it risks closure over funding
2021/06/02 0:00:00,The three-and-a-half hours at the centre of Michael Jennings civil trial
2021/06/02 0:00:00,EU deficit rules to remain suspended in 2022: commission
2021/06/02 0:00:00,Pandemic plunges 100 mn more workers into poverty: UN
2021/06/02 0:00:00,Big Brother challenge leaves housemates gasping for air
2021/06/02 0:00:00,Russian senators adopt 'extremist' bill that would bar critics from polls
2021/06/02 0:00:00,202cm monster picked first in 2021 AFL mid-season draft 2020 snub
2021/06/02 0:00:00,OnlyFans model suffers heart attack mid-striptease after trying out dangerous ‘dry scooping’ fad
2021/06/02 0:00:00,Mel Leong comforts Therese after her ice cream fail
2021/06/02 0:00:00,Daly Cherry-Evans grilled over reported player plan to oust V’landys
2021/06/02 0:00:00,Labor veteran Herzog elected Israel's 11th president
2021/06/02 0:00:00,Ikea says ‘plant based’ restaurant choices are helping it become more environmentally friendly
2021/06/02 0:00:00,"WA and ACT’s new, harder restrictions on travellers who visited NSW virus exposure sites"
2021/06/02 0:00:00,Crown Sydney in Barangaroo runs competition for frontline workers
2021/06/02 0:00:00,"South Australian MP’s alleged butt slap ‘no different’ to shoulder pat, court hears"
2021/06/02 0:00:00,Indigenous Sport Month: AFL stars open up on life and footy as Indigenous Australians
2021/06/02 0:00:00,"Victorian Acting Premier James Merlino demands Morrison government provide financial support to businesses, workers"
2021/06/02 0:00:00,Liberal Party powerbroker Michael Kroger urges ABC chairwoman Ita Buttrose to ‘just resign’
2021/06/02 0:00:00,Huge sinkhole threatens to swallow rural home in Mexico
2021/06/02 0:00:00,Former Attorney-General Christian Porter in new relationship with criminal lawyer Karen Espiner
2021/06/02 0:00:00,"Untapped sprinter Curran has turned $600 into $160,000 for Mornington trainers Lyn Tolson and Leonie Proctor"
2021/06/02 0:00:00,Collingwood board hit back after Jeff Browne’s boardroom coup was revealed
2021/06/02 0:00:00,"Unwashed dishes cast doubt on Natasha Darcy’s guilt, court hears"
2021/06/02 0:00:00,"Chloe Lee, 10, loses fight for life after horror WA crash that also seriously injured her family"
2021/06/02 0:00:00,‘Very old’ human remains found near Harry and Meghan’s California mansion
2021/06/02 0:00:00,"NGV, QAGOMA blockbuster exhibitions bring masterpieces to Australia"
2021/06/02 0:00:00,Champion NSW country jockey Greg Ryan has retired after three decades in the saddle
2021/06/02 0:00:00,The Collingwood board won’t bow down after a ‘coup’ attempt to take over the club
2021/06/02 0:00:00,Ben Roberts-Smith’s lawyers say ex-wife behind leak of SAS drinking game with Taliban prosthetic leg: court
2021/06/02 0:00:00,Why NSW hasn’t introduced restrictions despite Covid-19 positive family visiting Jervis Bay
2021/06/02 0:00:00,‘We’ll just walk away’: Huni camp’s threat over $5k glove dispute
2021/06/02 0:00:00,Justis Huni v Paul Gallen: Champ camp hits out at former NRL star after alleged sparring troubles
2021/06/02 0:00:00,"KFC SuperFooty TV: Michael Warner, Jay Clark and Jack Watts preview Round 12"
2021/06/02 0:00:00,Woman charged with murder after fatal stabbing in Shepparton
2021/06/02 0:00:00,A-League: Adelaide United coach Carl Veart insists comments about referee ‘didn’t come out’ the way he wanted
2021/06/02 0:00:00,Queensland’s Jaydn Su’A has a point to prove to Wayne Bennett when he runs out for the Maroons
2021/06/02 0:00:00,"Raceday focus: Best bets, analysis for Wangaratta on Thursday"
2021/06/02 0:00:00,"Experts warn age verification for porn sites could be unworkable, push kids to the dark web"
2021/06/02 0:00:00,Backyard mechanics use Queensland’s lax laws to make fast cash while second-hand cars are scarce
2021/06/02 0:00:00,"Australian sharemarket once again rallies to fresh record high, propelled by commodities prices, economy figures"
2021/06/02 0:00:00,Fourth person linked to Arcare Maidstone tests positive to coronavirus
2021/06/02 0:00:00,Amazon shifts policy on controversial worker monitoring system
2021/06/02 0:00:00,Opposition demands government provide answers amid extension of Covid lockdown
2021/06/02 0:00:00,Prime Minister under pressure to offer JobKeeper to Victorians as lockdown extended for second week
2021/06/02 0:00:00,"Iran navy says vessel sinks after fire in Gulf of Oman, crew safe"
2021/06/02 0:00:00,Brenlyn’s Trooper gets another crack in the city at Flemington
2021/06/02 0:00:00,"A third child? No, thanks, say young Chinese"
2021/06/02 0:00:00,Naomi Osaka French Open withdrawal exposes tennis’ awkward truth
2021/06/02 0:00:00,Boom three-year-old Orbisyn powers to fourth straight win at Doomben
2021/06/02 0:00:00,‘Don’t touch that ball’: SA health chief’s bizarre plea to fans as AFL exemption granted
2021/06/02 0:00:00,Wyong preview: Trainer Nick Mitchell’s decision to break his budget looks set to pay off
2021/06/02 0:00:00,'We got our ass kicked' says LeBron after Lakers mauling
2021/06/02 0:00:00,Let's-a go! Nintendo announces plans for Japan museum
2021/06/02 0:00:00,KFC SuperCoach AFL jury gives its verdict on how to survive the byes
2021/06/02 0:00:00,A new trial could allow vaccinated Australians to travel overseas within weeks
2021/06/02 0:00:00,‘Drink until she’s pretty’: Plan to ban sexist and demeaning slogans from vehicles in Western Australia
2021/06/02 0:00:00,Brett Sutton reveals why travel limit was eased to 10km during latest Victorian lockdown
2021/06/02 0:00:00,"Coronavirus real estate: Geelong live auctions, inspections to return"
2021/06/02 0:00:00,"Covid Victoria: Melbourne lockdown extended another week, 6 new cases"
2021/06/02 0:00:00,Sunbury Macca’s police car rammer Joel Papa jailed
2021/06/02 0:00:00,Indigenous Sport Month: Eels star Will Smith opens up on why he feels so strongly about his identity
2021/06/02 0:00:00,Julie Bishop steals show at Afterpay Fashion Week
2021/06/02 0:00:00,Two missing words in star’s interview shows Ricciardo’s fall
2021/06/02 0:00:00,How long do covid vaccines take to start working?
2021/06/02 0:00:00,Brian Higgins grabs opportunity to ride in town for debut of Black Caviar’s daughter Invincible Caviar
2021/06/02 0:00:00,Daredevils take a dip in world’s first floating sky pool as it opens 35 metres above ground
2021/06/02 0:00:00,T20 World Cup poised to be moved from India to United Arab Emirates
2021/06/02 0:00:00,Crippled ship at risk of sinking off Sri Lanka
2021/06/02 0:00:00,Nathan Cleary’s big chance to finally dominate on the Origin stage
2021/06/02 0:00:00,Mali suspended from African Union after second coup in nine months
2021/06/02 0:00:00,Victorian retailers brace for $2 billion hit from extended Melbourne lockdown
2021/06/02 0:00:00,Jana Hocking: How Candice Warner slid into husband David’s DMs
2021/06/02 0:00:00,Breastfeeding ban scrapped in Western Australia’s parliament
2021/06/02 0:00:00,"Defence department considering a Plan B to French subs, senate estimates told"
2021/06/02 0:00:00,Acting QRIC Commissioner and former top cop Mark Ainsworth announces his retirment
2021/06/02 0:00:00,AFL star Trent Cotchin’s future unknown after daughter admitted to hospital
2021/06/02 0:00:00,Former health department secretary Jane Halton urges Scott Morrison to do more on quarantine
2021/06/02 0:00:00,Woman donates kidney to husband’s ex-wife
2021/06/02 0:00:00,Melbourne extends lockdown as 'Kappa' variant spreads
2021/06/02 0:00:00,Matthew Perry and Molly Hurwitz break off engagement
2021/06/02 0:00:00,A-League: Socceroos great Mark Milligan to call time on his stellar career
2021/06/02 0:00:00,Adelaide High School students walk out of class to protest ‘toxic’ and ‘prevalent’ sexual violence culture
2021/06/02 0:00:00,Experts warn of economic hit from Victorian lockdown
2021/06/02 0:00:00,Footy great Dane Swan blows up deluxe on lockdown failure
2021/06/02 0:00:00,Five Australians tee off in this week’s US Open at one of the toughest courses imaginable
2021/06/02 0:00:00,"Lockdown extension: Melbourne auctions stalled for fortnight, but regions win"
2021/06/02 0:00:00,"Customers using $49 Kmart dog bed as footstool, kids’ lounge"
2021/06/02 0:00:00,State loses bid to keep man who doused girl in petrol and set her alight locked up
2021/06/02 0:00:00,Star pacer King Of Swing targets Queensland Group 1 features
2021/06/02 0:00:00,Aldi selling ‘incredible’ new cheese for $6
2021/06/02 0:00:00,Indigenous Sport Month: Big barrier holding Australian sports back
2021/06/02 0:00:00,How much the Friends cast were paid for the reunion special
2021/06/02 0:00:00,Pentagon report revealing classified UFO encounter secrets to be released imminently
2021/06/02 0:00:00,Gould responds to Bulldogs’ shock move to poach him from Warriors
2021/06/02 0:00:00,Boeing 777 captain shares incredible time-lapse video from cockpit
2021/06/02 0:00:00,Oil majors vow energy transition - at their own pace
2021/06/02 0:00:00,Dreamtime match between Essendon and Richmond at Optus Stadium sells out in just 17 hours
2021/06/02 0:00:00,Woman’s eyelid bitten off by chihuahua during ‘worst’ lash appointment
2021/06/02 0:00:00,More than 200 NSW residents potentially crossed paths with positive Victorian coronavirus case
2021/06/02 0:00:00,Meatpacking giant JBS believes Russia behind hack that hit plants
2021/06/02 0:00:00,Queensland Oaks: Media Award can give Chris Calthorpe something to cheer about after turbulent fortnight
2021/06/02 0:00:00,Melbourne lockdown extended as authorities track bizarre transmission
2021/06/02 0:00:00,Exhaustion and fear for India's frontline doctors in Covid battle
2021/06/02 0:00:00,Alan Cumming dishes on three of his most memorable movie roles ahead of his Australian tour
2021/06/02 0:00:00,Rachel Bilson and Melinda Clarke respond to Mischa Barton’s The O.C ‘bullying’ claims
2021/06/02 0:00:00,Kelly Osbourne has opened up about her drug and alcohol addictions on Red Table Talk
2021/06/02 0:00:00,Professional cleaner reveals the hidden part that’s making your toilet smell
2021/06/02 0:00:00,"IMF, World Bank prioritize vaccine access to end pandemic"
2021/06/02 0:00:00,Serena looks to take advantage of open draw at Roland Garros
2021/06/02 0:00:00,Kyle Daniels varies bail conditions ahead of second trial
2021/06/02 0:00:00,Daniel Ricciardo winds down by joining mystery blonde on a luxury yacht
2021/06/02 0:00:00,Worker injured after he was stuck by metal while down a 5m hole
2021/06/02 0:00:00,Airbnb billionaire CEO names his favourite house to stay at in Australia
2021/06/02 0:00:00,"Dodo, iPrimus fork out $2.5m for misleading customers with exaggerated NBN speed claims"
2021/06/02 0:00:00,Victorian health authorities urge people to get tested after multiple ‘unexpected detections’
2021/06/02 0:00:00,Truck rear ends school bus carrying 50 children in Perth
2021/06/02 0:00:00,Australian defence bosses quizzed over British Army concerns with Israeli military technology
2021/06/02 0:00:00,‘People will die’ in Victoria if virus is not contained: James Merlino
2021/06/02 0:00:00,WA Premier Mark McGowan takes another swipe at Scott Morrison’s handling of hotel quarantine
2021/06/02 0:00:00,Theranos founder Elizabeth Holmes has over 100 questions for jurors
2021/06/02 0:00:00,‘Don’t think the players would have trusted me’: Maroons star ‘shocked’ over Origin recall
2021/06/02 0:00:00,"James McDonald has careless riding ban overturned for Queensland Oaks, picks up ride on Ayrton"
2021/06/02 0:00:00,Virus lockdown in Australia's second-largest city extended by a week
2021/06/02 0:00:00,Young people moonlight as nurses in Colombia's social unrest
2021/06/02 0:00:00,Greens propose converting destroyed Callide power station into big battery
2021/06/02 0:00:00,WHO approves China's Sinovac Covid jab
2021/06/02 0:00:00,Wallabies great George Gregan accused of withholding evidence in court battle
2021/06/02 0:00:00,David Warner sheds light on ‘terrifying’ Indian Covid-19 tragedy
2021/06/02 0:00:00,Socceroos: National coach Graham Arnold calls for more A-League matches to better prepare players
2021/06/02 0:00:00,All the Covid-19 rule changes in Victoria as lockdown extended for greater Melbourne
2021/06/02 0:00:00,Zaaki trainer Annabel Neasham wants more water applied to ‘very firm’ Eagle Farm track
2021/06/02 0:00:00,"Victorians are used to lockdowns now, but that doesn’t make it any easier"
2021/06/02 0:00:00,GDP figures show Australia’s economy has recovered from pandemic
2021/06/02 0:00:00,Queensland rocked as Kalyn Ponga officially ruled out
2021/06/02 0:00:00,Cocaine Cassie hints at return to Australia in Instagram post
2021/06/02 0:00:00,Super coach Brian Goorjian sets sights high after steering Illawarra from last to the playoffs
2021/06/02 0:00:00,The AFL has finally locked in all games after an OK from the South Australian government to travel
2021/06/02 0:00:00,Resurfaced viral clip with Coco Gauff reveals the real Naomi Osaka
2021/06/02 0:00:00,China warns of ‘nuclear showdown’ with the United States
2021/06/02 0:00:00,Public transport fares to increase for NSW commuters
2021/06/02 0:00:00,"Taylor Swift joins Margot Robbie, Christian Bale in mystery David O. Russell film"
2021/06/02 0:00:00,AFL and AFLW indigenous player map: Celebrating cultural heritage
2021/06/02 0:00:00,Former bikie Dillon Mancuso rescued after allegedly being kidnapped in Sydney
2021/06/02 0:00:00,Everything we know about the Gossip Girl reboot characters
2021/06/02 0:00:00,Weakest Link takes a ratings nosedive as viewers point out one big problem with the show
2021/06/02 0:00:00,Biden administration halts oil drilling in Alaska wildlife refuge
2021/06/02 0:00:00,Man killed hotel receptionist because of ‘the way she smiled and looked at him’
2021/06/02 0:00:00,NSW paramedics to take industrial action to protest effective pay cuts
2021/06/02 0:00:00,Matty Johns clips Broncos over Nicho Hynes ‘faux pas’
2021/06/02 0:00:00,Chris Hemsworth shows off ‘huge’ biceps as he wraps on the fourth Thor film
2021/06/02 0:00:00,Meatpacking giant JBS says most plants operational by Wednesday after hack
2021/06/02 0:00:00,Plans for double decker planes that give everyone proper leg room and let you recline without causing a row
2021/06/02 0:00:00,Scary Indian variant behind Melbourne’s Covid outbreak and lockdown a risk for all Australians
2021/06/02 0:00:00,Jumps jockey Darryl Horner Jr suspended for failed drug test at Warrnambool
2021/06/02 0:00:00,Trans Tasman Trophy: Hockeyroos claim first series win under new coach Katrina Powell
2021/06/02 0:00:00,Rimac Nevera revaled: Wild electric car brings serious speed
2021/06/02 0:00:00,Bonds Australia launches new genderless clothing line to ensure ‘comfort for all’
2021/06/02 0:00:00,Melbourne Assessment Prison plunged into lockdown amid Covid fears
2021/06/02 0:00:00,Canada faces reckoning after remains of indigenous students found
2021/06/02 0:00:00,"US to hand Bagram base to Afghan forces in 20 days, says official"
2021/06/02 0:00:00,Huge sinkhole threatens to swallow Mexican home
2021/06/02 0:00:00,Adelaide: Man’s ear bitten off in argument with two men
2021/06/02 0:00:00,Coles partners with Roll’d to sell a range of its popular items
2021/06/02 0:00:00,What is mina? Investors warned about ‘wild price swings’ in new cryptocurrency
2021/06/02 0:00:00,Teen machine smashes 18-year-old Usain Bolt record
2021/06/02 0:00:00,Florida bans transgender women from school sports
2021/06/02 0:00:00,Suck it up: Study probes elephants' suction powers
2021/06/02 0:00:00,Sinead O’Connor finally reveals truth about infamous SNL live TV moment
2021/06/02 0:00:00,2021 Toyota Kluger Australian details revealed
2021/06/02 0:00:00,Tax return: How to receive your $1080 refund payment
2021/06/02 0:00:00,Australia’s youngest influencers Mia and Tatiana steal show at fashion week
2021/06/02 0:00:00,Ash Barty’s troubling revelation sparks French Open concerns
2021/06/02 0:00:00,Donald Trump returns to electoral battlefield
2021/06/02 0:00:00,Girl‘s brutal Lion King birthday cake request goes viral
2021/06/02 0:00:00,French tourist charged with espionage after taking photos in Iranian desert
2021/06/02 0:00:00,"Biden honors victims of 'forgotten' Tulsa race massacre, 100 years on"
2021/06/02 0:00:00,Newcastle median sale price up 7.4 per cent in three months with Sydney buyers behind rise
2021/06/02 0:00:00,"Star injured in freak press conference incident, quits French Open"
2021/06/02 0:00:00,World shocked by horrific courtroom act in chaos-stricken Belarus
2021/06/02 0:00:00,Melbourne business ‘won’t survive’ extended lockdown amid calls for government assistance
2021/06/02 0:00:00,Rider agent disqualified for six months by Racing NSW stewards
2021/06/02 0:00:00,"Crazy queue for Covid testing in Deer Park as 51,033 results received in past 24 hours"
2021/06/02 0:00:00,Hostie on TikTok shares hacks for making flying comfortable
2021/06/02 0:00:00,Rapper shared cryptic post before taking his own life
2021/06/02 0:00:00,Elderly woman’s body found eaten from the waist up by her cats
2021/06/02 0:00:00,Jane Halton hits out at Australia’s quarantine system
2021/06/02 0:00:00,Millionaire Peter Morgan killed escort over threesome video
2021/06/02 0:00:00,Ten charged after alleged kidnapping of former bikie Dillion Mancuso in Bringelly
2021/06/02 0:00:00,"Djokovic hails 'bold, brave' Osaka as Nadal, Barty cruise at French Open"
2021/06/02 0:00:00,"Burgess’ bid for NRL return with Dragons, Bulldogs confirm Tigers’ DWZ approach: Transfer Whispers"
2021/06/02 0:00:00,Qld star Kurt Capewell says two former coaches have been crucial to his rise to the Maroons
2021/06/02 0:00:00,Nadal makes stunning prediction for Aussie after epic choke
2021/06/02 0:00:00,TCL 20L+ review: Game-changing features on cheap phone
2021/06/02 0:00:00,China’s plan slapped down with incredible 10.3 per cent rise in iron ore price
2021/06/02 0:00:00,Ransomware attack on meat producer JBS forces mass shutdown and could spark a beef shortage
2021/06/02 0:00:00,Disrupt Land Forces protesters turn out for second day at Brisbane exposition
2021/06/02 0:00:00,Victoria records six new local cases of coronavirus
2021/06/02 0:00:00,Aussie tennis legend fumes at Ash Barty accusation during French Open scare
2021/06/02 0:00:00,UK records zero deaths from Covid-19 for first time since July 30
2021/06/02 0:00:00,Woman pushes bear off garden wall to stop it mauling her dogs
2021/06/02 0:00:00,Venus Williams has best response yet to Naomi Osaka media storm
2021/06/02 0:00:00,Ellie Kemper once crowned queen at ball allegedly linked to white supremacy
2021/06/02 0:00:00,Gunman allegedly shoots two firefighters before setting own house on fire
2021/06/02 0:00:00,‘Dark and violent period’: Reward announced for cold case murder of Raymond Keam
2021/06/02 0:00:00,Piers Morgan takes down Naomi Osaka after Meghan Markle comparison
2021/06/02 0:00:00,Melbourne’s lockdown extension confirmed as six new cases recorded
2021/06/02 0:00:00,Veronicas pen furious open letter to Celebrity Apprentice: ‘Shame on you’
2021/06/02 0:00:00,Polisario leader leaving Spain tonight: Spanish govt
2021/06/02 0:00:00,"Marking Tulsa massacre, Biden says Black voting rights 'under assault'"
2021/06/02 0:00:00,Biden vows to 'fill the silence' over 1921 massacre of African Americans
2021/06/02 0:00:00,Prince Harry in doubt for UK return for Princess Diana statue unveiling
2021/06/02 0:00:00,NSW authorities hunt contacts on south coast after infected traveller from Victoria visited several towns
2021/06/02 0:00:00,‘Sorry’ Eels star breaks silence on ‘lazy’ tackle that sent Rooster to hospital
2021/06/02 0:00:00,NSW Covid-19 hot spots: Virus alert for Foodworks supermarket
2021/06/02 0:00:00,Realm Adelaide penthouse sells in multimillion-dollar deal
2021/06/02 0:00:00,Osaka crisis throws light on stars' mental health and media 'voyeurism'
2021/06/02 0:00:00,NSW records no new cases of Covid as Victoria’s battles outbreak
2021/06/02 0:00:00,‘It’s good to be good’: How Australians can get involved with the Feed Appeal
2021/06/02 0:00:00,Renovated Belmont home delights with $30K lockdown bonus
2021/06/02 0:00:00,Live breaking news: Second Melbourne aged care resident with Covid
2021/06/02 0:00:00,Why you need to watch the reboot of Kung Fu
2021/06/02 0:00:00,Paul Gallen’s gloves are off after Huni camp’s ‘donkey’ sledge
2021/06/02 0:00:00,White House says JBS sees Russia group behind cyberattack
2021/06/02 0:00:00,Nadal notches 101st French Open win as tournament reels from Osaka shockwave
2021/06/02 0:00:00,A man in China has become the first person to be infected by a new strain of bird flu
2021/06/02 0:00:00,UK reports zero daily Covid deaths for first time since July
2021/06/02 0:00:00,Heathmont Menarock LIFE facility in lockdown after staff contact with covid case
2021/06/02 0:00:00,Barty survives as French Open reels from Osaka shockwave
2021/06/02 0:00:00,WHO approves China's Sinovac Covid vaccine
2021/06/02 0:00:00,Mum makes week’s worth of air fryer meals for $1.90 per serve
2021/06/02 0:00:00,"OPEC+ approves planned oil output rises, no decision on August"
2021/06/02 0:00:00,Russia expects no 'breakthrough' at Putin-Biden summit
2021/06/02 0:00:00,Geelong home values rise as show goes on despite lockdown
2021/06/02 0:00:00,"Donvale ‘Hollywood Hills’ house has $22,000 garage doors"
2021/06/02 0:00:00,Patricia Ilhan named as owner of Brighton waterfront block listed for $18.5-$20m
