date,title
2021/09/10 0:00:00,Denmark becomes only European country with no Covid curbs
2021/09/10 0:00:00,AFL 2021: Melbourne Demons thrash Geelong Cats to storm into first grand final since 2000
2021/09/10 0:00:00,Councillors swear new Hong Kong loyalty oath after hundreds quit
2021/09/10 0:00:00,Melbourne Storm thrash Manly Sea Eagles in first finals game of 2021 NRL season
2021/09/10 0:00:00,NSW path from lockdown will be a bumpy ‘experiment’
2021/09/10 0:00:00,Bulldogs toilet tryst star loses $900k in ugly exit
2021/09/10 0:00:00,AFL 2021: Jordan Dawson has played his last game for Sydney Swans
2021/09/10 0:00:00,NRL 2021: Penrith Panthers confirm injury blow one day out from finals clash with South Sydney Rabbitohs
2021/09/10 0:00:00,Cory Bernardi launches ABC legal action over Sarah Hanson-Young claims
2021/09/10 0:00:00,The Project’s Hamish Macdonald clashes with guest over NSW premier’s press conference call
2021/09/10 0:00:00,AFL: Brisbane Lions coach Chris Fagan has nothing but praise for Lachie Neale
2021/09/10 0:00:00,Two people who entered WA without valid exemptions ‘wanted to watch the footy’
2021/09/10 0:00:00,Inside Mail and The Judgement: Expects give their final word on Kembla Grange
2021/09/10 0:00:00,"AFL 2021: Port Adelaide Power coach Ken Hinkley says Western Bulldogs will be ‘very, very tough’ to beat"
2021/09/10 0:00:00,England vs India fifth Test cancelled due to Covid-19 concerns
2021/09/10 0:00:00,NRL 2021: Panthers coach Ivan Cleary accuses Rabbitohs of poor discipline in lead-up to finals series
2021/09/10 0:00:00,Raducanu to face Fernandez in historic all-teen US Open final
2021/09/10 0:00:00,Small businesses won’t have to pay back $180m in JobKeeper due to ‘honest mistakes’
2021/09/10 0:00:00,Vaccinated NSW residents could still be shut-out of WA over Christmas
2021/09/10 0:00:00,PSG kept waiting for record-setting Messi's home bow
2021/09/10 0:00:00,Defending Everest champ Classique Legend tunes up for racetrack return with trial win
2021/09/10 0:00:00,‘No data’ to point to Victorian freedom day as state records 334 new Covid cases
2021/09/10 0:00:00,Former Carlton coach Denis Pagan’s damning ‘snake pit’ claim
2021/09/10 0:00:00,Come From Away: The extraordinary 9/11 musical now streaming on Apple TV+
2021/09/10 0:00:00,Australian GPs banned from prescribing Ivermectin to Covid-19 patients
2021/09/10 0:00:00,"Kristen Stewart felt ‘spooky, spiritual feelings’ portraying Princess Diana"
2021/09/10 0:00:00,Hankstar helps firefighter Peter Nolan catch the training bug
2021/09/10 0:00:00,"Toyota cuts production further on virus issues, chip woes"
2021/09/10 0:00:00,What natural therapies are covered by extras health insurance
2021/09/10 0:00:00,"Denmark ditches vaccine passports, its last remaining covid restriction"
2021/09/10 0:00:00,‘Egregious’: Why disgraced ex-MP Eddie Obeid is facing more jail time
2021/09/10 0:00:00,Western Sydney temperatures to reach 30C as high-pressure system hits
2021/09/10 0:00:00,Howard Stern unleashes on ‘idiots’ who died from Covid after refusing vaccine
2021/09/10 0:00:00,Scott Morrison returns to Sydney following Father’s Day weekend criticism
2021/09/10 0:00:00,Shocking post after NRL star Josh Dugan’s contract torn up
2021/09/10 0:00:00,Wildest red carpet outfits at the Met Gala
2021/09/10 0:00:00,PE teacher Robert Graham Sebbens admits historical sex crimes against boys at school
2021/09/10 0:00:00,MG Cyberster roadster likely for Aussie roads
2021/09/10 0:00:00,Freedman stable confident Golden Slipper winner Stay Inside can make a statement in Run To The Rose
2021/09/10 0:00:00,Nadia Bartel spotted leaving home after white powder video
2021/09/10 0:00:00,New 'Life is Strange' debuts as LGBTQ video games take off
2021/09/10 0:00:00,Anti-vaxxers target popular Sydney restaurant after it announces new post-lockdown double-vax rule
2021/09/10 0:00:00,Dr Zac Turner on what will happen in Sydney after ‘freedom day’
2021/09/10 0:00:00,Jetstar launches $39 flight sale to Byron Bay
2021/09/10 0:00:00,"Biden, Xi talk to avoid US-China 'conflict:' W.House"
2021/09/10 0:00:00,"Train passengers, crew in isolation after positive Covid-19 case stops in regional NSW"
2021/09/10 0:00:00,Rising grocery prices to hit households
2021/09/10 0:00:00,Elderly accountant accused of massive investment fraud of nearly $19m
2021/09/10 0:00:00,‘Who’s Gladys?’: Mark McGowan interrupts journalist to mock NSW counterpart
2021/09/10 0:00:00,China puts its military on ‘alert’ as US carrier prowls the South China Sea
2021/09/10 0:00:00,Bulldogs coach ‘seething’ over AFL Covid comedy
2021/09/10 0:00:00,‘It’s given him a sense of safety’: Plea to fund ‘lifesaving’ watch for domestic violence victims
2021/09/10 0:00:00,Gossip Girl reboot renewed for season 2
2021/09/10 0:00:00,"September 11, 2001: 9/11 Photos that no one will forget"
2021/09/10 0:00:00,Kate on Netflix: Mary Elizabeth Winstead action-thriller misses the mark
2021/09/10 0:00:00,Queensland home sells for $1.8m without any pictures
2021/09/10 0:00:00,Christopher Nolan’s next movie to be centred on Oppenheimer and the nuclear bomb
2021/09/10 0:00:00,NRL finals: Sydney Roosters coach Trent Robinson won’t let his players get lost in their hard road to the finals
2021/09/10 0:00:00,Push to ban credit cards in online gambling
2021/09/10 0:00:00,Wild detail proves Australian Survivor is the toughest game on TV
2021/09/10 0:00:00,British teenager Emma Raducanu books her place in the US Open final
2021/09/10 0:00:00,New Adelaide coach CJ Bruton has a championship vision for the 36ers
2021/09/10 0:00:00,Woman’s clever Bunnings hack goes viral on TikTok
2021/09/10 0:00:00,Gai Waterhouse to get a gauge on Converge and Silent Impact at Kembla Grange
2021/09/10 0:00:00,Has the trans-Tasman bubble burst for good?
2021/09/10 0:00:00,Aussie woman’s warning after ‘devastating’ scam message
2021/09/10 0:00:00,Police to deploy extra officers to stop Melburnians sneaking into regional Victoria
2021/09/10 0:00:00,‘Never knew’: Wife of Maria James’s lover tells court about affair
2021/09/10 0:00:00,Report of active shooter locks down US air base
2021/09/10 0:00:00,Homebuyer FAQs: should I buy or sell first? How do I compete at auction?
2021/09/10 0:00:00,World mystified as Donald Trump confirms surprising new gig
2021/09/10 0:00:00,Nadia Bokody: Surprising answer to common sex question
2021/09/10 0:00:00,Former Wests Tigers great Robbie Farah puts Concord West property on the market
2021/09/10 0:00:00,Fans unearth Matt Damon’s hidden Instagram account with 40 followers
2021/09/10 0:00:00,"Ed Sheeran’s NFL cameo sets internet, US Twitter alight"
2021/09/10 0:00:00,Postal strike threatens to cause major delays in online shopping deliveries
2021/09/10 0:00:00,Rob Heathcote backs Prince Of Boom to get the better of stablemate Startantes at Doomben
2021/09/10 0:00:00,"Elderly couple dead after falling tree crushes car in Cockatoo, Victoria"
2021/09/10 0:00:00,Salim Mehajer to stand trial over alleged assault of ex-girlfriend Missy Tysoe
2021/09/10 0:00:00,Deadly snake warning for NSW as warmer weather approaches
2021/09/10 0:00:00,Teenager Leylah Annie Fernandez stuns world No. 2 in huge US Open upset
2021/09/10 0:00:00,Kylie Minogue sells Melbourne home for $1.715m after 31 years
2021/09/10 0:00:00,McMahons Point hold held for more than 60 years sells for $4.286m
2021/09/10 0:00:00,Man jailed for stabbing woman with syringe of his semen
2021/09/10 0:00:00,America in turmoil after Biden’s ‘terrifying’ and ‘gross’ vaccine demand
2021/09/10 0:00:00,Cops’ horrific discovery inside NSW home still haunts them
2021/09/10 0:00:00,Dover Heights award-winning home of recruiter Jason Johnson has $10m guide
2021/09/10 0:00:00,Woman filmed coughing on supermarket shoppers get sacked from her IT job
2021/09/10 0:00:00,Kate and William’s $22 million charity haul trumps Meghan and Harry
2021/09/10 0:00:00,Katie Holmes attends New York Fashion Week in revealing cut-out gown
2021/09/10 0:00:00,Australian real estate: How Alex Veljancevski built his eight-property portfolio at just 31
2021/09/10 0:00:00,Cromer’s price record broken for the second time in as many weeks with $4.95m sale
2021/09/10 0:00:00,CEO Cain Liddle sacked as Carlton upheaval continues
2021/09/10 0:00:00,Taliban takeover sparks fear for Afghanistan's heritage
2021/09/10 0:00:00,The Beauty Diary: How to deal with grey hairs and regrowth
2021/09/10 0:00:00,NRL: Wayne Bennett calls out Penrith’s illegal block plays to protect Nathan Cleary
2021/09/10 0:00:00,Thieves steal $8m worth of cigarettes inside truck from Melbourne’s west
2021/09/10 0:00:00,Victoria reluctant to offer ‘false hope’ as it awaits road map modelling
2021/09/10 0:00:00,Wallabies news: Australian coach Dave Rennie couldn’t ignore Quade Cooper any longer
2021/09/10 0:00:00,Medical student lashed for ‘inappropriate’ dress
2021/09/10 0:00:00,"Supply issues, time between doses to blame for slowing NSW vaccine rates, putting opening date at risk"
2021/09/10 0:00:00,"Messi breaks Pele record as Argentina rout Bolivia, Brazil stroll"
2021/09/10 0:00:00,"Georgia Love pulled from on-air role at Channel 7, dumped as Chadstone shopping ambassador"
2021/09/10 0:00:00,Lloyd Williams pair Pondus and King Of Leogrance kick off Melbourne Cup campaigns at Flemington
2021/09/10 0:00:00,"If Qld and WA don’t want to get vaccinated, give Victoria and NSW their doses"
2021/09/10 0:00:00,Jackie O reveals ex experienced adverse reaction to Pfizer vaccine
2021/09/10 0:00:00,"Brighton pad boasts concealed TVs, luxurious hidden features"
2021/09/10 0:00:00,Byron Bay house where ‘Nine Perfect Strangers’ was filmed is available to live in for $6100 a night
2021/09/10 0:00:00,Trio raped 11-year-old girl after plying her with drugs and alcohol at Werribee home
2021/09/10 0:00:00,NSW Premier denies report she ignored chief health officer’s advice on reopening plan
2021/09/10 0:00:00,Three words that sent Dr Kerry Chant global
2021/09/10 0:00:00,Teen Fernandez beats Sabalenka to reach US Open final
2021/09/10 0:00:00,Queensland mum’s tragic plea as she loses both sons to suicide
2021/09/10 0:00:00,"Divided, bruised US marks 9/11's 20th anniversary"
2021/09/10 0:00:00,Bobbie Lewis Quality: Tony Gollan won’t change Jonker’s tactics in first attempt down Flemington straight
2021/09/10 0:00:00,"UN chief calls for 'dialogue' with the Taliban, fears for the Sahel"
2021/09/10 0:00:00,Teen to stand trial over alleged murder of 10-year-old cousin at Gunnedah property
2021/09/10 0:00:00,WAG Erin Holland says Nadia Bartel is ‘struggling’ after sniffing saga
2021/09/10 0:00:00,Ronaldo makes Man Utd return as Arteta seeks Arsenal salvation
2021/09/10 0:00:00,Makybe Diva Stakes: Betting plunge on Melbourne Cup favourite Incentivise
2021/09/10 0:00:00,ACT records 24 new local Covid-19 infections; Child under 12 hospitalised
2021/09/10 0:00:00,America’s withdrawal from Afghanistan is a looming disaster for Australia’s economy
2021/09/10 0:00:00,Britney Spears strips off for unfiltered Instagram video: ‘This is really my ass’
2021/09/10 0:00:00,‘Are you going into hiding?’: Gladys Berejiklian slammed for ending daily Covid-19 pressers
2021/09/10 0:00:00,Zaaki will be missing from George Main Stakes and the mouth-watering clash with Verry Elleegant
2021/09/10 0:00:00,Dog goes viral on TikTok after getting high from toxic mushrooms
2021/09/10 0:00:00,Inside one of world’s most isolated homes in Western Australia
2021/09/10 0:00:00,AFL finals: Western Bulldogs captain Marcus Bontempelli will be close to full fitness for preliminary final
2021/09/10 0:00:00,"Kristina Keneally to make switch to lower house, ends Senate feud"
2021/09/10 0:00:00,NSW Covid-19 lockdown: All the restrictions changing for fully-vaccinated from Monday
2021/09/10 0:00:00,Fiona Falkiner shows off her post-baby weight loss
2021/09/10 0:00:00,Restrictions will be eased along the Qld-NSW border from Monday but there is a catch
2021/09/10 0:00:00,India eye historic series win over England after Covid all-clear
2021/09/10 0:00:00,More than 100 passengers leave Kabul in first flight since US pullout
2021/09/10 0:00:00,Australia’s vaccination certificates can be easily forged with fake documents available for $270
2021/09/10 0:00:00,How 25-year-old university graduate scored $525k Melbourne home
2021/09/10 0:00:00,Woolworths to roll out Covid-19 rapid antigen testing across all Australian distribution sites
2021/09/10 0:00:00,"Best Deals of the Week: 15% off Bed Threads, up to 75% off everything at House"
2021/09/10 0:00:00,Group 1-winning trainer John Sadler to form training partnership with his son Thomas
2021/09/10 0:00:00,UK migrant plan stokes tensions with France
2021/09/10 0:00:00,"The Matrix Resurrections releases first full trailer, hints at sequel’s secret plot"
2021/09/10 0:00:00,NSW Covid News: Gladys Berejiklian to end daily updates as young people rush to get vaccinated
2021/09/10 0:00:00,Idina Menzel spills on John Travolta’s infamous Oscars gaffe
2021/09/10 0:00:00,Woolworths period care rebrand won’t be completed until 2022
2021/09/10 0:00:00,"NSW records 1542 new cases of Covid-19, nine deaths after announcing lockdown exit plan"
2021/09/10 0:00:00,Four historic police cases reopened after the non-fatal alleged shooting of a US lawyer
2021/09/10 0:00:00,State of Place 2021 Australian Liveability Census: Melbourne rated
2021/09/10 0:00:00,"Office air quality affects workers' cognitive function, study shows"
2021/09/10 0:00:00,AFL finals: Western Bulldogs coach Luke Beveridge hits out at being denied permission to train in Adelaide
2021/09/10 0:00:00,France stages rare national tribute to film icon Belmondo
2021/09/10 0:00:00,Thompson-Herah leads host of Olympic champions to Diamond League glory
2021/09/10 0:00:00,Sisters in Law: Can I fight a compensation claim for medical bills?
2021/09/10 0:00:00,Celine Gaudray has Airbnb ban increased for giving false evidence to stewards
2021/09/10 0:00:00,Novavax Covid vaccine better than Pfizer coming to Australia
2021/09/10 0:00:00,Why China is unleashing ​air assaults on Taiwan and Japan
2021/09/10 0:00:00,"‘He got spooked’: Why Lachie Neale, wife Jules are staying put"
2021/09/10 0:00:00,"My family is starving so I’m selling my daughter for $800, desperate dad says"
2021/09/10 0:00:00,Guterres to AFP: We must have 'dialogue' with the Taliban and avoid 'millions of deaths'
2021/09/10 0:00:00,Australia’s international travel ban could be lifted in November with UK being the first route to open
2021/09/10 0:00:00,F1 villain Nikita Mazepin hits back amid Schumacher family feud
2021/09/10 0:00:00,NSW Treasurer says WA Premier the ‘Gollum’ of Australian politics
2021/09/10 0:00:00,Star sprinters Classique Legend and Lost And Running impress in Randwick barrier trial
2021/09/10 0:00:00,What happens at Woolworths before doors open to shoppers
2021/09/10 0:00:00,Donald Trump boasts about ‘obscene’ payday from surprise new job
2021/09/10 0:00:00,Invergowrie: $40.5m Hawthorn mansion owners want public to connect
2021/09/10 0:00:00,Email about the Queen that will trigger mayhem
2021/09/10 0:00:00,Abbie Chatfield defends getting hair done for TV show
2021/09/10 0:00:00,Dover Heights home with glass-walled pool is the ultimate summer party house
2021/09/10 0:00:00,Olivia Munn and John Mulaney’s romance timeline questioned
2021/09/10 0:00:00,McDonald’s diner horrified as he finds ‘nipple’ in his bacon roll
2021/09/10 0:00:00,Cricket: Test captain Tim Paine says countries could boycott playing Afghanistan at T20 World Cup
2021/09/10 0:00:00,Biden ramps up vaccine mandates in Covid battle
2021/09/10 0:00:00,"Tourist finds mysterious shaped object in tiny town of Banana, Qld"
2021/09/10 0:00:00,10yo boy stranded in rural NSW will be reunited with his family after Queensland Health has change of heart
2021/09/10 0:00:00,AFL: Four-time premiership winner Grant Birchall retires
2021/09/10 0:00:00,Port Willunga acreage estate on the coastline offering rare opportunity
2021/09/10 0:00:00,Covid-19 Qld: St Thomas More College student tests positive as lockdown fears grow
2021/09/10 0:00:00,Karl Cook returns to social media amid Kaley Cuoco divorce
2021/09/10 0:00:00,The seismic zone worrying quake-hit Mexico
2021/09/10 0:00:00,Rashid Khan steps down as Afghanistan’s T20 captain
2021/09/10 0:00:00,‘One case’ could spark a new lockdown in NSW after opening plan was revealed
2021/09/10 0:00:00,"Victoria records 334 new local cases of coronavirus, one new death"
2021/09/10 0:00:00,Allison Williams steps away from ESPN after refusing Covid-19 vaccine
2021/09/10 0:00:00,Man dies in ‘freak accident’ at Macca’s drive-through
2021/09/10 0:00:00,Unvaxxed woman’s harrowing final video before dying from Covid-19
2021/09/10 0:00:00,Experts shocked at North Korean leader Kim Jong-un’s dramatic weight change
2021/09/10 0:00:00,"Covid-19: Australia could have had 15-46 times more deaths if followed Canada, UK, Sweden"
2021/09/10 0:00:00,Police close creepy case into Loveday ‘evil spirits’ disappearance
2021/09/10 0:00:00,‘You’re not that good’: Shaq slams Ben Simmons as attacks turn personal
2021/09/10 0:00:00,Fans worried for Phil Collins after rare TV interview
2021/09/10 0:00:00,Jonah Hill goes public with new girlfriend Sarah Brady
2021/09/10 0:00:00,AMA says NSW reopening plan ignored warning in modelling
2021/09/10 0:00:00,Jennifer Aniston’s awkward TV interview leaves viewers cringing
2021/09/10 0:00:00,What exactly is Grimace? 50-year-old McDonald’s mystery finally solved
2021/09/10 0:00:00,"Weekend Best Bets: Tips for Flemington, Kembla Grange and Doomben"
2021/09/10 0:00:00,Flash actor Logan Williams cause of death finally confirmed
2021/09/10 0:00:00,Victoria Covid news live: 334 locally acquired cases and one death
2021/09/10 0:00:00,Boxing tragedy unfolding before our eyes with fears over Evander Holyfield
2021/09/10 0:00:00,Shocking allegations as Jerome Boateng fined $2.9 for assaulting ex
2021/09/10 0:00:00,Quade Cooper to play for the Wallabies for the first time in four years
2021/09/10 0:00:00,Quade Cooper returns after four years in Wallabies selection stunner
2021/09/10 0:00:00,Zana Pali: My Kitchen Rules star’s new Brighton pad to have nightclub
2021/09/10 0:00:00,On-trend Highton reno draws big money prior to auction
2021/09/10 0:00:00,Historic Tynwald mansion has a story to tell new owners
2021/09/10 0:00:00,Mega Glenorie house with epic gym and 750sqm of internal space breaks suburb record
2021/09/10 0:00:00,England-India fifth Test to go ahead after negative PCR results
2021/09/10 0:00:00,Relief and emotion as special charter flight leaves Afghanistan
2021/09/10 0:00:00,England v India Test in doubt after 'new virus case'
2021/09/10 0:00:00,Islamists thrashed in Morocco election
2021/09/10 0:00:00,Ray-Ban Stories review: Cool features on stylish smart glasses technology
2021/09/10 0:00:00,"Donald Trump pushes claim that he was at ground zero on September 11, 2001"
2021/09/10 0:00:00,Photographer reveals twist in September 11 Falling Man story
2021/09/10 0:00:00,NAB changes logo to JAB to encourage vaccination
2021/09/10 0:00:00,More than 75 per cent of Aussie parents likely to vaccinate their children against Covid-19
