date,title
2021/05/23 0:00:00,Monica Lewinsky’s cheeky response to tweet goes viral
2021/05/23 0:00:00,Italian Eurovision singer to take 'voluntary drug test': organisers
2021/05/23 0:00:00,Max Verstappen wins 2021 Monaco Grand Prix as F1 champion flipped on its head
2021/05/23 0:00:00,Inside Mail: Best bets and value selections plus jockey to follow
2021/05/23 0:00:00,Exiled opposition figure held at Belarus airport: opposition
2021/05/23 0:00:00,Italy cable car accident kills eight: emergency services
2021/05/23 0:00:00,Gymnast Simone Biles pulls off latest first to leave LeBron James speechless
2021/05/23 0:00:00,21 runners dead as extreme weather hits China ultramarathon
2021/05/23 0:00:00,‘Not good enough’: David Noble takes aim at North’s biggest issue
2021/05/23 0:00:00,AP terminates Emily Wilder after Facebook post resurfaces
2021/05/23 0:00:00,Martin Bryant accused of killing two people before Port Arthur massacre
2021/05/23 0:00:00,"Hinkley applauds Port’s ‘scrappy, hard fought’ win"
2021/05/23 0:00:00,Adelaide United defeat Victory to close in on finals dream
2021/05/23 0:00:00,Manly legend and rugby league Immortal Bob Fulton has died
2021/05/23 0:00:00,Country’s perfect COVID-19 record ends as it records two deaths
2021/05/23 0:00:00,Elliot Yeo a chance to return for West Coast next week
2021/05/23 0:00:00,Bombers take flight to thrash Kangaroos
2021/05/23 0:00:00,Manly dedicate ‘statement win’ over Eels to late Immortal Bob Fulton
2021/05/23 0:00:00,Goma city 'spared' as lava from volcano halts: military governor
2021/05/23 0:00:00,Wayne Bennett takes brutal swipe at Benji Marshall after Rabbitohs thrashing
2021/05/23 0:00:00,Schuster stars as Sea Eagles stun Eels
2021/05/23 0:00:00,Power fight back to break Pies’ hearts
2021/05/23 0:00:00,Collingwood unveils super petty banner in AFL feud
2021/05/23 0:00:00,‘Can’t allow that’: Sneaky AFL star gets away with murder
2021/05/23 0:00:00,Thousands flee Goma city in DR Congo after volcano erupts
2021/05/23 0:00:00,Wildcats hold off fesity Sixers
2021/05/23 0:00:00,Relationship Rehab: How to know when you are ready to start a family?
2021/05/23 0:00:00,Giants into top eight with courageous Eagles win
2021/05/23 0:00:00,Lightning edge out Swifts in Sunshine Coast thriller
2021/05/23 0:00:00,Amanda Rose: How to nail the one-way video interview
2021/05/23 0:00:00,Shadow minister for Aged Care Services Clare O’Neil impresses Insiders viewers
2021/05/23 0:00:00,DR Congo volcano lava flow halts in suburbs of Goma: AFP correspondent
2021/05/23 0:00:00,Thousands flee after volcano Mount Nyiragongo erupts in the Democratic Republic of Congo
2021/05/23 0:00:00,ABC responds to ‘offensive’ allegations it ‘manipulated’ Craig McLachlan accusers
2021/05/23 0:00:00,Kiwi coach says it’s ‘a real shame’ that Aussie rugby union sides aren’t competitive
2021/05/23 0:00:00,A-League: Adelaide United star Ben Halloran overlooked again for Socceroos duty
2021/05/23 0:00:00,Kendall Jenner’s 818 tequila launch party: Best celeb pics of the week
2021/05/23 0:00:00,Ex-BBC chief steps down from high-profile job over Diana probe
2021/05/23 0:00:00,Scotland's Taylor drops Ramirez twice to unify four titles
2021/05/23 0:00:00,Broncos write blueprint for shutting down rookie sensation Sam Walker
2021/05/23 0:00:00,Clayton Douglas wins Australian Steeplechase aboard Riding High for Henry Dwyer
2021/05/23 0:00:00,"Melbourne City have ‘so much work to do’, says Kisnorbo"
2021/05/23 0:00:00,‘We got smacked’: Longmire laments another Swans loss
2021/05/23 0:00:00,Indigenous Sport Month: Josh Addo-Carr joins Baker Boy to launch Fox League’s Indigenous Round
2021/05/23 0:00:00,‘I’m confident with my game’: Townsend hits back at Cronulla’s critics
2021/05/23 0:00:00,Unmanned supermarkets to the rescue in Sweden's rural areas
2021/05/23 0:00:00,NBL 21: Sydney Kings adopt Street Fighter attitude in hunt for finals as coach looks to family
2021/05/23 0:00:00,Tillakaratne Dilshan: Former Sri Lankan cricket captain spins his own property game
2021/05/23 0:00:00,Horse transport debacle resolved with Queensland gives green light for flight
2021/05/23 0:00:00,‘We got beaten by a better team’: Demons humbled by shock loss
2021/05/23 0:00:00,Growing pains: post-Brexit 'protocol' stunts N.Irish business
2021/05/23 0:00:00,"Fever must improve opening quarters, says Marinkovich"
2021/05/23 0:00:00,Gold Logie winner and A Country Practice star Lorrae Desmond dead aged 91
2021/05/23 0:00:00,Waleed Aly asks glaring question amid Collingwood crisis
2021/05/23 0:00:00,Italian rockers Maneskin win pandemic-defying Eurovision
2021/05/23 0:00:00,Germany serves up Covid jabs in the company canteen
2021/05/23 0:00:00,Different DNA evidence found on weapon after US man Ledell Lee was executed for murder
2021/05/23 0:00:00,Twenty-one runners dead as disaster rocks cross-country marathon in China
2021/05/23 0:00:00,Queen ‘deeply upset’ at Prince Harry’s ‘very personal’ criticisms of the royal family
2021/05/23 0:00:00,Sydney man hospitalised after home invasion which police say is a case of mistaken identity
2021/05/23 0:00:00,"Farmer Trevor Badger identified as plane crash victim, remembered as a ‘family man’"
2021/05/23 0:00:00,Glen Boss locks in all Queensland Stradbroke ride on The Harrovian
2021/05/23 0:00:00,Top four rivals set for dramatic finish to Premier League season
2021/05/23 0:00:00,Sizzling Cat set to atone at Albury after luckless run in Wagga Guineas run
2021/05/23 0:00:00,New star Zaaki emerges for on the rise trainer Annabel Neasham
2021/05/23 0:00:00,Big US companies pushed to tally progress on racial justice
2021/05/23 0:00:00,Second India repatriation flight lands in Darwin with 165 people on-board
2021/05/23 0:00:00,Body cam footage shows police officer avoiding breath test on Sunshine Coast
2021/05/23 0:00:00,UK suffers history-making Eurovision defeat with zero points from jury and public
2021/05/23 0:00:00,20 dead as freak weather hits China ultramarathon: officials
2021/05/23 0:00:00,Michael Clarke: I saved Ricky Ponting from selectors’ axe
2021/05/23 0:00:00,Golden reaction of fed-up footy fan humiliates AFL team
2021/05/23 0:00:00,The lamington that is worth the road trip
2021/05/23 0:00:00,Apple iMac review: Brand brings back iconic bright colour computers
2021/05/23 0:00:00,Mickelson clings to lead at PGA in quest of historic win
2021/05/23 0:00:00,"Hsu, Moriya, share LPGA Pure Silk Championship lead"
2021/05/23 0:00:00,Watch: Roger Federer ruins rival’s chances of having kids
2021/05/23 0:00:00,Friends star Matt LeBlanc’s father says pair haven’t spoken in nine years
2021/05/23 0:00:00,Pies star Steele Sidebottom handballs Kew cottage
2021/05/23 0:00:00,"Australia to see boost in Pfizer vaccine, with full immunisation possible by end of year"
2021/05/23 0:00:00,Lava reaches Goma airport in DR Congo after volcanic eruption: official
2021/05/23 0:00:00,Martin Bashir hits back at Prince William over “deceitful” 1995 Princess Diana interview
2021/05/23 0:00:00,"Ethereum, bitcoin, dogecoin price: China crackdown sends cryptos into the red"
2021/05/23 0:00:00,Townsville stabbing murder victim identified as 29-year-old Kayla Golding
2021/05/23 0:00:00,Italy wins Eurovision Song Contest in Rotterdam
2021/05/23 0:00:00,Marananga home inspired by old medieval walled towns a hit with househunters
2021/05/23 0:00:00,China's Mars rover starts roaming the Red Planet
2021/05/23 0:00:00,Princess Latifa seen alive in Dubai for first time since ‘hostage’ videos emerged in February
2021/05/23 0:00:00,Nigeria buries army chief after air crash
2021/05/23 0:00:00,Receipt at centre of Victoria’s coronavirus bungle which identified the wrong supermarket
2021/05/23 0:00:00,Dilapidated Melbourne dumps earning sellers millions
2021/05/23 0:00:00,DR Congo orders Goma evacuation after volcano erupts
2021/05/23 0:00:00,"LeBron James breaks COVID protocols, says vaccine ‘no big deal’"
2021/05/23 0:00:00,Sydney and Melbourne apartment price drop is good news for first home buyers
2021/05/23 0:00:00,At least 16 dead as extreme weather hits China cross-country race: Xinhua
2021/05/23 0:00:00,A post-match blast will be the start of a tough week at St Kilda with several players set to be dropped
2021/05/23 0:00:00,"China lashes out at Australia for joining military exercise with Japan, France and US"
2021/05/23 0:00:00,Fresh vision ends debate over controversial Crows deliberate non-call
2021/05/23 0:00:00,Woman spied on by her ‘awkward’ boss in sinister stalking case
2021/05/23 0:00:00,Nationals candidate Dave Layzell claims victory in Upper Hunter by-election in NSW
2021/05/23 0:00:00,'Man of character' Suarez leads Atletico to La Liga as Real fall short
2021/05/23 0:00:00,The Beauty Diary by Rebekah Scanlan: Review of Goldwell’s $28 Color Revive conditioner
2021/05/23 0:00:00,Download your ultimate COVID-19 vaccine guide
2021/05/23 0:00:00,Australia Post’s latest collectables campaign celebrate the Akubra hat and iconic symbols of Aussie life
2021/05/23 0:00:00,Driving the new Alfa Romeo Giulia GTA
2021/05/23 0:00:00,Australians urged to get active amid ‘unacceptable crisis’
2021/05/23 0:00:00,Viral video brought American golden boy Ryan Leaf crashing down
2021/05/23 0:00:00,Ricciardo baffled by Monaco mess: ‘I refuse to believe I’m that slow’
2021/05/23 0:00:00,Palestinians pick up pieces in ravaged Gaza after Israel ceasefire
2021/05/23 0:00:00,MasterChef Australia 2021: What happens to all the show’s leftover food
2021/05/23 0:00:00,"Holiday at home at 8 Dwiar Rd, Victor Harbor"
2021/05/23 0:00:00,Molesworth fixer upper is Tasmania’s most viewed home of the year
2021/05/23 0:00:00,Suarez strike leads Atletico to La Liga title as Real fall short
2021/05/23 0:00:00,UN Security Council calls for 'full adherence' to Gaza ceasefire: statement
2021/05/23 0:00:00,In 1958 US considered nuclear strike on China over Taiwan: documents
2021/05/23 0:00:00,"‘Crazy end’ as Monaco qualifying ends in Charles Leclerc crash, Daniel Ricciardo 12th"
2021/05/23 0:00:00,Prince William has opened up about his ‘dark days’ following Diana’s death
