date,title
2021/02/19 0:00:00,Prince Harry and Meghan Markle no longer working royals
2021/02/19 0:00:00,"Reds flogging, red card, injured skipper: Ultimate humiliation in Tahs’ horror start"
2021/02/19 0:00:00,Australian Open 2021: Daniil Medvedev beats Stefanos Tsitsipas as crowd boos
2021/02/19 0:00:00,Australian Fashion Week first of 2021 to bring back live catwalk
2021/02/19 0:00:00,Blue Diamond-winning jockey Lauren Stojakovic reveals her battle to transition to life after racing
2021/02/19 0:00:00,‘Never want to feel like that again’: Broncos’ Jake Turpin on horror 2020 season
2021/02/19 0:00:00,A-League: Golgol Mebrahtu cleared to make his Brisbane Roar debut
2021/02/19 0:00:00,Legendary racecaller Greg Miles reveals his most memorable Group 1 Blue Diamond winners
2021/02/19 0:00:00,Public drunkenness: Victoria radically changes booze rules
2021/02/19 0:00:00,Why Kevin Rudd is wrong about News Corp
2021/02/19 0:00:00,"WandaVision creator Jac Shaeffer on fan theories, returning characters"
2021/02/19 0:00:00,Former home of Gough Whitlam sells for $1.15m ahead of auction
2021/02/19 0:00:00,"Quad meeting: China’s military ambitions dealt blow by Australia, Japan, US and India"
2021/02/19 0:00:00,More than 150 people allegedly caught speeding by faulty camera spared court action
2021/02/19 0:00:00,Two-year-old boy fighting for life after being struck by a car in Fairfield Heights
2021/02/19 0:00:00,Nathan Lyon achieves huge milestone as Victoria thuumps NSW
2021/02/19 0:00:00,A-League: Western United vice-captain Tomi Uskok beaming over birth of his baby son
2021/02/19 0:00:00,Facebook news ban kills ‘wanky’ trick
2021/02/19 0:00:00,Court hears alleged ‘slave’ was locked in house and only slept an hour each night
2021/02/19 0:00:00,NRL stars’ faces turn up on turf at Bankwest Stadium
2021/02/19 0:00:00,Brittany Higgins requests to reopen police investigation into alleged Parliament House rape
2021/02/19 0:00:00,Mark Thompson jailed for stabbing police officer at Sydney’s Central Station
2021/02/19 0:00:00,UFC fighter Casey O’Neill reveals her battle with COVID and traversing four countries for Octagon debut
2021/02/19 0:00:00,Brutal truth Serena Williams can’t cop after Australian Open exit
2021/02/19 0:00:00,Coronavirus: ‘Sewage submarine’ a major development in tracking COVID-19
2021/02/19 0:00:00,Who are the Uighurs and why is China being accused of genocide?
2021/02/19 0:00:00,"Australian sharemarket has its worst week in February so far, resources stocks sold off"
2021/02/19 0:00:00,Tackle Your Feelings: Chad Cornes and Nathan van Berlo help community coaches with mental health training
2021/02/19 0:00:00,Mona Vale beachfront apartment sells under the hammer for more than $1m over reserve.
2021/02/19 0:00:00,Leading surgeon reveals six secrets to being happy with your implants
2021/02/19 0:00:00,Man rushed to hospital in critical condition following stabbing at Ermington
2021/02/19 0:00:00,Record-breaking Ben Simmons cops rude NBA All-Star snub
2021/02/19 0:00:00,"Man facing almost two dozen fraud charges over  $800,000 migrant visa scam"
2021/02/19 0:00:00,"Khloe Kardashian unleashes on a fan, telling them to ‘shut the f**k up’"
2021/02/19 0:00:00,ABC Sport broadcaster Karen Tighe’s recovery after contracting viral encephalitis
2021/02/19 0:00:00,Hearing implants pioneer Cochlear urged to cough up JobKeeper in full but stays firm
2021/02/19 0:00:00,‘Mobile death vans’: Inside China’s brutal execution system
2021/02/19 0:00:00,Man’s disturbing email after choking girlfriend to death detailed in court
2021/02/19 0:00:00,Bitcoin: How to deal with cryptocurrency in your will
2021/02/19 0:00:00,"Maddie Ziegler’s bizarre role as Sia’s ‘muse’, Shia LaBeouf controversy"
2021/02/19 0:00:00,‘Can’t believe this’: Michael Clarke fumes at Aaron Finch’s IPL snub
2021/02/19 0:00:00,Cameron Diaz opens up about retiring from acting after having first child
2021/02/19 0:00:00,Joe Biden says Xi Jinping ‘most serious competitor’ to US as South China Sea freedom under threat
2021/02/19 0:00:00,Five people rushed to hospital after chemical spill south of Brisbane
2021/02/19 0:00:00,Prince Harry sidelined by Meghan Markle for Oprah interview
2021/02/19 0:00:00,"UK Love Island star, 31, reveals she has lost work because of her age"
2021/02/19 0:00:00,How a few drinks on United Airlines flight cost passenger $65k
2021/02/19 0:00:00,Trainer Richard Laming has been suspended for three months
2021/02/19 0:00:00,Amateur Cage fighter John Beirouti going more than 115km before horror fatal crash: court
2021/02/19 0:00:00,A-League: March matches to include Melbourne derby
2021/02/19 0:00:00,Hung jury in trial of police officer Harry Little’s trial over horror crash with Gai Vieira
2021/02/19 0:00:00,A teenage boy charged in relation to alleged car chase that killed Jennifer Board
2021/02/19 0:00:00,Maslin Beach: Search continues for suspected human bones
2021/02/19 0:00:00,Boy hurls thick shake at McDonald’s worker before adult throws him out the door
2021/02/19 0:00:00,‘Cocaine Cassie’ Sainsbury selling photos on OnlyFans
2021/02/19 0:00:00,"David Gray, Gesticulations, Split Enz: Latest album reviews"
2021/02/19 0:00:00,FIFA eWorld Cup 2021: Three Oceania qualifiers to represent Australia
2021/02/19 0:00:00,Liberal MP Bernie Finn backs down on claim lockdown ‘not about the virus’
2021/02/19 0:00:00,Police looking for three men on the run after a Holden Commodore was torched at Brookvale
2021/02/19 0:00:00,Rosamund Pike unleashes as remorseless monster in I Care A Lot
2021/02/19 0:00:00,Queensland winter racing carnival prizemoney boost gets tick of approval
2021/02/19 0:00:00,Symptom that led to 22-year-old being diagnosed with ovarian cancer
2021/02/19 0:00:00,Hope iconic paint brand Wattyl could return to Aussie hands dashed as Danes buy company from Americans
2021/02/19 0:00:00,Adelaide Hills: Woman escapes injury after car crashes into her home
2021/02/19 0:00:00,"Tasmania deems Victoria ‘low-risk’ state, eases border restrictions"
2021/02/19 0:00:00,The Beauty Diary: Review of Bondi Sands Pure face mist and sleep mask
2021/02/19 0:00:00,The Cameron Smith era at the Melbourne Storm is officially over
2021/02/19 0:00:00,"Glenn Ian Morrison: Busker claimed ‘she’s my daughter’ before abusing girl, 13, in his Mascot home"
2021/02/19 0:00:00,Two more key characters axed from Sex and the City reboot
2021/02/19 0:00:00,Gold Coast woman filmed drinking wine in driver’s seat
2021/02/19 0:00:00,Marilyn Manson being investigated by police for sex and domestic abuse claims as cops ‘set to meet with victim’
2021/02/19 0:00:00,Sex scammers targeting Australians with threats to release intimate footage from Zoom calls
2021/02/19 0:00:00,Fast bowler Jhye Richardson Australia’s new $2.4m man
2021/02/19 0:00:00,Prince Philip entering third day in hospital after being taken in as a ‘precautionary measure’
2021/02/19 0:00:00,Documents reveal boxing star Anthony Joshua’s staggering riches
2021/02/19 0:00:00,Star pacer Lochinvar Art to get his Miracle Mile spot
2021/02/19 0:00:00,"Coles marks 10 years of ‘Down, Down’ with profits and prices going up"
2021/02/19 0:00:00,Man filmed sucking woman’s toes at a bar – horrifying internet
2021/02/19 0:00:00,Adam Blencowe’s betting guide for the Group 1 Oakleigh Plate
2021/02/19 0:00:00,Russia v China: One thing Putin and Xi both fear
2021/02/19 0:00:00,"Sisters rake in $300,000 in matter of months by launching stylish scrubs business Scrub Lab"
2021/02/19 0:00:00,Australians are living through a smart home boom
2021/02/19 0:00:00,Melbourne taxi driver allegedly punched in the head in dispute over fare
2021/02/19 0:00:00,"Tortured life of megastar Mel Gibson’s brother, Andrew, inside a Sydney housing commission flat"
2021/02/19 0:00:00,Inside America’s ‘severely botched’ Afghan War mission
2021/02/19 0:00:00,Rosehill races: King’s Legacy ready to restore his reputation in Hobartville Stakes
2021/02/19 0:00:00,Suspicious house fire completely guts home in Lavington
2021/02/19 0:00:00,Why you should always pick the worst seat on the plane
2021/02/19 0:00:00,Samantha Armytage shares cheeky snap from her wedding day
2021/02/19 0:00:00,Woman who lied about attending Perth funeral jailed for repeatedly breaching quarantine
2021/02/19 0:00:00,NBA swingman Ryan Broekhoff can pave the way for the NBL to increase player wages
2021/02/19 0:00:00,James McDonald primed for big-race double at Rosehill Gardens
2021/02/19 0:00:00,Sydney star Tom Papley is back in the Swans’ leadership group two years after wanting out of the club
2021/02/19 0:00:00,Kanye West is ‘not doing well’ amid Kim Kardashian divorce reports
2021/02/19 0:00:00,Joseph Suaalii: The young giant who is going to rock rugby league
2021/02/19 0:00:00,Adelaide man discovers $2.5 million Lotto ticket in drawer
2021/02/19 0:00:00,UK Home Office releases ‘dystopian’ COVID-19 lockdown ad ripping off ‘You Wouldn’t Steal a Car’ anti-piracy PSA
2021/02/19 0:00:00,IPL auction 2021: Every Aussie bought and those who were shunned
2021/02/19 0:00:00,Djokovic dismisses threat of rising stars: ‘They still have a lot of work to do’
2021/02/19 0:00:00,Anti-Djoker Jennifer Brady is the hero tennis needed at Aus Open
2021/02/19 0:00:00,Naomi Osaka’s sister’s ‘disturbing’ group chat message revealed
2021/02/19 0:00:00,The death that rocked a young Daniel Ricciardo: ‘I was crying’
2021/02/19 0:00:00,Djokovic blown away by stunning recovery: ‘Best match so far’
2021/02/19 0:00:00,World reacts to Serena’s teary exit from Aus Open: ‘She’s not even close’
2021/02/19 0:00:00,Northern beaches posts 100 per cent clearance rate as eager buyers pounce
2021/02/19 0:00:00,It’s beer o’clock for Ash Barty as she licks wounds with tennis legends
2021/02/19 0:00:00,Broncos open to signing Cameron Smith: ‘We’d send a limo’
2021/02/19 0:00:00,Nadia Bokody: Surprising truth about how long sex should last
2021/02/19 0:00:00,"Girl, 5, rushed to hospital with her tongue stuck in a water bottle"
2021/02/19 0:00:00,Alleged chemist thief tried to use towel to disguise himself in Oxenford burglary: cops
2021/02/19 0:00:00,Prince Harry isolating in California to prepare for UK return amid Prince Philip’s hospitalisation
2021/02/19 0:00:00,Another One fancied to make Country Championships Final
2021/02/19 0:00:00,Chris Hemsworth debuts hilarious new ad for fitness app Centr
2021/02/19 0:00:00,Last Australian jurisdiction to decriminalise abortion passes pregnancy termination bill
2021/02/19 0:00:00,Premier Gladys Berejiklian will wait to get jabbed as COVID vaccine roll out begins in Australia
2021/02/19 0:00:00,Elly Awesome reviews best Apple Watch dupes for under $50
2021/02/19 0:00:00,"Square waves beach warning: What are they, why you should avoid"
2021/02/19 0:00:00,Archaeologists unearth 2000-year-old penis engraving on rock
2021/02/19 0:00:00,Concerns surround hot favourite Enthaar and two other youngsters leading into Saturday’s Blue Diamond Stakes
2021/02/19 0:00:00,Facebook news ban slammed as world reacts to Australian code
2021/02/19 0:00:00,Fourth person charged with murder of Ballarat mum Kobie Parfitt
2021/02/19 0:00:00,"Police charge 24-year-old man with planned terror attack on civilians, cops, military and correctional personnel"
2021/02/19 0:00:00,Irish-bred sprinter Ventura Ocean to have first Australian start at Eagle Farm
2021/02/19 0:00:00,"Sisters in Law: Brothers borrow mum’s car, rack up fines and demerit points"
2021/02/19 0:00:00,Scott Morrison responds to Brittany Higgins rape allegations
2021/02/19 0:00:00,"Reply All host PJ Vogt steps down over toxic workplace, racism claims"
2021/02/19 0:00:00,The Courier-Mail online: How to access news in wake of Facebook ban
2021/02/19 0:00:00,Australia’s coronavirus vaccination rollout to begin on Feb 22
2021/02/19 0:00:00,House in unliveable condition with mouldy walls and collapsed ceiling on sale for $3600
2021/02/19 0:00:00,Social media giant facing major self-inflicted damage after shock Aussie news ban
2021/02/19 0:00:00,‘Music’ review: Sia’s first film is unwatchable and offensive
2021/02/19 0:00:00,"App, newsletters, alerts: How to access everything from the Mercury"
2021/02/19 0:00:00,Woman with two vaginas details agonising period pain and fertility struggles
2021/02/19 0:00:00,"Full cast, hosts and judges of Dancing With The Stars: All Stars finally revealed"
2021/02/19 0:00:00,Hannah Clarke's family devastated after Facebook bans tribute page
2021/02/19 0:00:00,Man resorts to drinking out of puddles and eating grass to survive in rugged terrain
2021/02/19 0:00:00,Qantas launches new flights to Coffs Harbour and Byron Bay
2021/02/19 0:00:00,Jock Landale and cast of rising stars ready to impress as the world watches on
2021/02/19 0:00:00,Kia ranked most dependable car brand in US study
2021/02/19 0:00:00,Media diversity inquiry: News Corp executives Michael Miller and Campbell Reid give evidence
2021/02/19 0:00:00,Face-sook: Facebook ban an ‘act of war’
2021/02/19 0:00:00,Pfizer and Moderna executives and directors cash in billions from COVID-19 vaccine success
2021/02/19 0:00:00,Gogglebox cast lose it over raunchy Netflix hit Bridgerton
2021/02/19 0:00:00,SDRA Country Championships runner-by-runner analysis
2021/02/19 0:00:00,Hillsong founder Brian Houston to hand over global reins amid sex scandal
2021/02/19 0:00:00,Labor MP exiled as investigation into alleged cocaine sex scandal continues
2021/02/19 0:00:00,Ivanka Trump rules out Senate primary challenge against Marco Rubio in 2022
2021/02/19 0:00:00,Strike Force Raptor beefed up as NSW Police vows to reel in ‘urban terrorists’
2021/02/19 0:00:00,Former Trump press secretary clashes with CNN reporter over Biden tweet
2021/02/19 0:00:00,"Mount Etna in Italy erupts twice in 48 hours, stunning pictures show"
2021/02/19 0:00:00,Rundown home offering househunters a chance to own property in sough-after Springfield
2021/02/19 0:00:00,Millions of Aussies in line for cash boost as JobSeeker rate set to rise
2021/02/19 0:00:00,"Trailer for Mortal Kombat, filmed in Australia drops"
2021/02/19 0:00:00,Throuple split as bizarre 21-day diet before sex proves too much
2021/02/19 0:00:00,Six wickets from Test spinner Nathan Lyon was a return to the glory days of turn at the SCG
2021/02/19 0:00:00,"Victoria records 3 new locally acquired cases, zero in hotel quarantine"
2021/02/19 0:00:00,Mercedes-AMG E63 S review: Muscle car brilliance in a luxury package
2021/02/19 0:00:00,How to read news.com.au without social media platform Facebook
2021/02/19 0:00:00,Dirty habits of Australian politicians revealed by insider
2021/02/19 0:00:00,Ex-Home And Away star supports controversial celebrity chef in freedom of speech tirade
2021/02/19 0:00:00,Coronavirus fragments found in wastewater in east and southeast Melbourne suburbs
2021/02/19 0:00:00,New Nissan Qashqai revealed
2021/02/19 0:00:00,FKA Twigs shuts down Gayle King’s question amid Shia LaBeouf lawsuit
2021/02/19 0:00:00,News Media Bargaining Code: Treasurer Josh Frydenberg and Mark Zuckerberg in crisis talks
2021/02/19 0:00:00,"Peter Jackson, Harvey Weinstein feud that nearly killed Lord of the Rings franchise"
2021/02/19 0:00:00,World watches as Israel’s fast-tracked vaccination program delivers promising results
2021/02/19 0:00:00,"Brisbane siege ends after 26-hour stand-off as woman, boy, 3, walk free"
2021/02/19 0:00:00,Police search for mystery Crime Stoppers caller in relation to Ju ‘Kelly’ Zhang disappearance
2021/02/19 0:00:00,Parliament House rape allegations: New text messages reveal trouble for PM’s office
2021/02/19 0:00:00,"Former priest charged over alleged child sex assault of boy, nine, in Bathurst"
2021/02/19 0:00:00,"All-Star Mile 2021: Top 10 leaderboard revealed, Arcadia Queen reigns supreme in race towards world’s richest mile"
2021/02/19 0:00:00,The great Phil ‘Buzz’ Rothfield celebrates 45 years at The Daily Telegraph
2021/02/19 0:00:00,AFL champion Daniel Kerr behind bars after fire at parent’s home
2021/02/19 0:00:00,Live breaking news: Hunt for sex offender after Melbourne pier attack
2021/02/19 0:00:00,Ted Cruz flies to Cancun as winter storm leaves Texas without power
2021/02/19 0:00:00,Australia’s most viewed: Incredible Byron hinterland estate with epic barn and private rainforest for sale
2021/02/19 0:00:00,Bitcoin entrepreneur Kain Warwick revealed as $16.5m buyer of Shane Smollen Tamarama mansion
2021/02/19 0:00:00,Historic Geelong Black Swan pub building back on the market
2021/02/19 0:00:00,Guy King: Double-sized Toorak property with incredible gardens listed for $30-$33m
