date,title
2021/03/01 0:00:00,WNCL: Mooney and Redmayne set records as Queensland Fire run riot against Western Australia
2021/03/01 0:00:00,Rolling COVID coverage: No new cases as Victoria’s vaccine rollout ramps up
2021/03/01 0:00:00,Essendon’s bold request creates more chaos for AFL administrators
2021/03/01 0:00:00,The Golden Globes winning TV shows to watch — and where to watch them
2021/03/01 0:00:00,Vladimir Putin critic Alexei Navalny sent to brutal penal colony
2021/03/01 0:00:00,Nathan Lyon’s blunt message for Ashes rivals after Ahmedabad defeat
2021/03/01 0:00:00,Open for Business: How tiny town lost everything in Northern Rivers bushfires
2021/03/01 0:00:00,Shock Australian Guineas winner Lunar Fox handed All-Star Mile wildcard
2021/03/01 0:00:00,Beth Mooney belts Queensland’s highest score in WNCL history
2021/03/01 0:00:00,James Weir recaps Married At First Sight Australia 2021 episode 6: Man’s X-rated admission about other MAFS wife
2021/03/01 0:00:00,"Miners, energy workers vote to split from CFMMEU"
2021/03/01 0:00:00,Model Elyse Knowles welcomes new baby Sunny Barker with partner Josh Barker
2021/03/01 0:00:00,Jodie Foster’s weird moment during Golden Globes acceptance speech
2021/03/01 0:00:00,Beauty queen Emma Coronel Aispuro’s downfall after meeting drug kingpin El Chapo
2021/03/01 0:00:00,Major delays after police stop trains at Flinders Street
2021/03/01 0:00:00,Constellation Cup: Absence of crowd to help Diamonds against Silver Ferns
2021/03/01 0:00:00,Richmond Tigers great Royce Hart hospitalised after car crash
2021/03/01 0:00:00,Buyer of Michael Gu’s Mosman mansion revealed as Robert Mead
2021/03/01 0:00:00,Five teens arrested over home invasions in Melbourne
2021/03/01 0:00:00,Anya Taylor-Joy wears Dior Haute Couture over $2.3m in Tiffany diamonds to the Golden Globes
2021/03/01 0:00:00,Brisbane first homebuyers spend overseas relocation savings to buy home at auction
2021/03/01 0:00:00,David Warner will make his return to the field in a one-day game for NSW on Thursday
2021/03/01 0:00:00,Geelong real estate: Home values surge as market hits boom
2021/03/01 0:00:00,Kembla preview: Socrates to begin his a charge towards Rosehill Guineas
2021/03/01 0:00:00,Victoria: Wallaby shot dead in spate of arrow attacks on native wildlife
2021/03/01 0:00:00,Nicole Kidman and Keith Urban’s daughters make a rare appearance at the virtual Golden Globes
2021/03/01 0:00:00,Kelly Marie Tran on beating the Star Wars trolls and Asian pride for Raya and the Last Dragon
2021/03/01 0:00:00,James Roberts is looking to rekindle his NRL career at Wests Tigers after nearly walking away from the game
2021/03/01 0:00:00,A-League: Jamie Maclaren out to inflict further pain on Western Sydney
2021/03/01 0:00:00,Steve ‘Commando’ Willis could be recalled in AVO case as fresh evidence to be revealed
2021/03/01 0:00:00,Bryce Dallas Howard’s sequin number at the Golden Globes savaged by fans
2021/03/01 0:00:00,AFL icon Robert ‘Dipper’ DiPierdomenico separates from wife of 41 years
2021/03/01 0:00:00,Fears Docklands may not recover from COVID-19 lockdown despite easing of restrictions
2021/03/01 0:00:00,‘Menace to Society’ says don’t mess with my family
2021/03/01 0:00:00,Number of Australians taking out private health insurance increases despite price rises
2021/03/01 0:00:00,China warships conduct dangerous combat drill in secret sea
2021/03/01 0:00:00,"Everything new to streaming in March 2021: Netflix, Disney+, Amazon Prime, Binge and more"
2021/03/01 0:00:00,How to watch Golden Globes movies
2021/03/01 0:00:00,Scott Morrison denies reading crucial evidence detailing rape allegations
2021/03/01 0:00:00,Prince Charles cuts off Meghan and Harry from royal family wealth
2021/03/01 0:00:00,Perth weather: SES volunteers called out to 10 homes as rain and thunderstorms hit
2021/03/01 0:00:00,SA’s single-use plastic ban comes into effect
2021/03/01 0:00:00,The first look at Meghan Markle and Prince Harry’s Oprah interview has landed
2021/03/01 0:00:00,Bassam Hamzy’s lawyers make bid to bring him to Sydney for court date
2021/03/01 0:00:00,Facebook to pay US users $838m in facial recognition tag suggestion class action
2021/03/01 0:00:00,Children playing games on Xboxes and PlayStations groomed by paedophiles
2021/03/01 0:00:00,NRL star grilled over ‘love triangle’ with ex-teammate’s fiancee
2021/03/01 0:00:00,Beaten Guineas favourite Tagaloa to head to Sydney to chase desperately needed 3YO Group 1 win
2021/03/01 0:00:00,AFL: Lions legend Jonathan Brown says Joe Daniher’s arrival has lifted Brisbane to genuine contender status
2021/03/01 0:00:00,Everything you need to know about the Botticelli to van Gogh exhibition at National Gallery of Australia
2021/03/01 0:00:00,Sports reporter cries in car after backlash to rugby interview
2021/03/01 0:00:00,"Open for Business: Best things to do in Northern Rivers, NSW"
2021/03/01 0:00:00,Teenage boy arrested after young girl locked inside Albion Park toilet block
2021/03/01 0:00:00,Melbourne auctions: reserves ‘almost irrelevant’ as market surges
2021/03/01 0:00:00,Golden Globes 2021: Full winners list
2021/03/01 0:00:00,Battle for Bellamy central to Storm feud with Broncos
2021/03/01 0:00:00,Australian OnlyFans star Anna Paul ‘permanently banned’ from TikTok
2021/03/01 0:00:00,The subtle early signs of hearing loss
2021/03/01 0:00:00,"Tina Fey, Amy Poehler trash HFPA amid diversity scandal"
2021/03/01 0:00:00,Margot Robbie makes a rare appearance at the Golden Globes in a Chanel slit dress
2021/03/01 0:00:00,Joseph Suaalii issues bold message after explosive pre-season debut
2021/03/01 0:00:00,Woman filmed drinking from wine bottle was five times over limit: cops
2021/03/01 0:00:00,‘I'm ready for the NRL’: Suaalii breaks silence as game set to grant exemption
2021/03/01 0:00:00,Lara Worthington shows off abs in yellow floral bikini
2021/03/01 0:00:00,Toby Edmonds concedes The Harrovian needs to lift to be competitive in All-Star Mile
2021/03/01 0:00:00,Post-lockdown cancer spike predicted in Victoria
2021/03/01 0:00:00,Controversial Chinese company Huawei in surprising product shift
2021/03/01 0:00:00,The Walking Dead: Why I went back to the beginning of the zombie phenomenon
2021/03/01 0:00:00,Aged Care Royal Commission hands down final report
2021/03/01 0:00:00,Nine reveals Melissa Caddick mystery will be turned into TV adaptation
2021/03/01 0:00:00,Rape culture in schools: Shocking reason former Gold Coast high school student was assaulted at party
2021/03/01 0:00:00,Golden Globes red carpet: Who was the best dressed celebrity? Vote in our poll
2021/03/01 0:00:00,‘Time for potential is over’: Legend calls on Latrell to become NRL’s ‘best player’
2021/03/01 0:00:00,Australia to play final three T20s against New Zealand in Wellington in empty stadiums
2021/03/01 0:00:00,TikTok star Mikaela Testa mistakes Sydney for Australia’s capital city
2021/03/01 0:00:00,‘Hard to explain’: Tiger Woods’ first public comments after horror crash
2021/03/01 0:00:00,Facebook apologises to Australian pig loving widow over post ban
2021/03/01 0:00:00,Queensland Premier Annastacia Palaszczuk snaps at reporters over private email scandal
2021/03/01 0:00:00,‘Truly absurd’: Celebrities take stand against Golden Globes
2021/03/01 0:00:00,Ningaloo Nino: The climate phenomenon worrying scientists
2021/03/01 0:00:00,Scott Morrison has spoken to Minister accused of rape
2021/03/01 0:00:00,All-Star Mile 2021: Owner-ambassadors revealed for world’s richest mile race
2021/03/01 0:00:00,Unbeaten colt Profiteer out to continue charge to Golden Slipper in Todman Stakes at Randwick
2021/03/01 0:00:00,Comanchero sergeant-at-arms Tarek Zahed extradited to Sydney after Melbourne arrest
2021/03/01 0:00:00,"Qantas, Virgin competitor Rex Airlines is finally flying Melbourne to Sydney"
2021/03/01 0:00:00,Mercedes-Benz G400d on the way to Australia
2021/03/01 0:00:00,Lawsuits filed against Apple after iPhone and smartwatch overheat and catch fire
2021/03/01 0:00:00,Jenny Hayes: Sex worker accused of starting fire that killed young family
2021/03/01 0:00:00,‘Proof’ Tasmanian tiger still exists with new photos of family released
2021/03/01 0:00:00,January Jones re-wears the same plunging dress from the Golden Globes 10 years ago
2021/03/01 0:00:00,More remains found on south coast as Melissa Caddick case baffles cops
2021/03/01 0:00:00,Prince Philip health: Prince Charles bedside visit to plan royal family future
2021/03/01 0:00:00,Brian Locke facing 136 charges relating to $1.9 million fraud of mining company Gold and Copper Resources
2021/03/01 0:00:00,West Live: Law expert Andrew Stewart says COVID vaccine roll-out a legal minefield for employers
2021/03/01 0:00:00,ASOS worker reveals what happens to clothes after you return them
2021/03/01 0:00:00,Zoom fatigue: Four main causes and how to stop it
2021/03/01 0:00:00,Adelaide real estate: buyers travel up to 300km to view property
2021/03/01 0:00:00,Coronavirus origin Wuhan: Grim fate of China’s COVID-19 whistleblowers
2021/03/01 0:00:00,‘Not NRL standard’: Dragons’ pack roasted over ‘lack of desperation’ in defence
2021/03/01 0:00:00,"Girl, 11, finds her parents dead in bed from COVID after they ‘moved into basement to quarantine’"
2021/03/01 0:00:00,West Kempsey: Police officer suffers ‘serious leg injuries’ in savage dog attack
2021/03/01 0:00:00,"Girl, 7, selling lemonade to fund five-figure brain surgery she needs"
2021/03/01 0:00:00,‘Goodness bloody me’: AFL froths over No. 2 draft pick
2021/03/01 0:00:00,Chinese investment in Australia plunged by more than 60 per cent in 2020 as trade war rages
2021/03/01 0:00:00,Sydney housing market: Property prices grow at fastest rate in 17 years
2021/03/01 0:00:00,Melbourne real estate: Australian housing market in midst of boom
2021/03/01 0:00:00,Star mare Verry Elleegant could go on to be all-time great after incredible win in Chipping Norton
2021/03/01 0:00:00,"Mandurah men Jackson Perry, Noah Palmer drift to sea on inflatable mattress"
2021/03/01 0:00:00,Kyle and Jackie O banned from Golden Globes red carpet
2021/03/01 0:00:00,NRL rule changes take players’ breath away — literally
2021/03/01 0:00:00,Man charged over alleged St Kilda cafe stabbing
2021/03/01 0:00:00,Married maths teacher accused of allegedly sexually assaulting student turns herself in
2021/03/01 0:00:00,Golden Globes 2021 red carpet: Best and worst dressed celebrities
2021/03/01 0:00:00,‘We need certainty’: Gladys Berejiklian’s swipe at vaccine rollout issue
2021/03/01 0:00:00,Report: Broncos coach in pub bust-up with club legend
2021/03/01 0:00:00,China’s fresh swipe at Australia over Five Eyes network ‘priorities’
2021/03/01 0:00:00,$118 million superyacht crashes into Caribbean pier after computer malfunction
2021/03/01 0:00:00,Overwhelmed with raising your puppy? This $39.99 online course will help
2021/03/01 0:00:00,Kaley Cuoco breaks down as husband Karl Cook surprises her before Golden Globes
2021/03/01 0:00:00,OnlyFans model whose kids were expelled when her job exposed now makes $130k-a-day
2021/03/01 0:00:00,"Man locates Windows XP photo location in Sonoma, California"
2021/03/01 0:00:00,Yorkshire parents slammed for camping with child on edge of cliff
2021/03/01 0:00:00,"NZ daycare shortens Māori child’s name, declaring it ‘too hard’ to pronounce"
2021/03/01 0:00:00,Heartwarming act of respect for Tiger Woods as golfers don iconic outfits
2021/03/01 0:00:00,Finally learn how to play the guitar with 98% off expert-led online classes
2021/03/01 0:00:00,Olivia Wilde forced to form coronavirus lockdown ‘bubble’ with ex Jason Sudeikis
2021/03/01 0:00:00,Nautilus Maldives resort costs $1m to rent for VIP treatment
2021/03/01 0:00:00,Crown Resorts director John Poynton quits from embattled casino giant
2021/03/01 0:00:00,Police issue alert for stolen car driving dangerously in Toongabbie
2021/03/01 0:00:00,Dr Seuss celebration dropped after books found to have ‘racial undertones’
2021/03/01 0:00:00,Watch: Joe Daniher goal the latest example of AFL rule change chaos
2021/03/01 0:00:00,"Chris Hemsworth, Matt Damon and Idris Elba attend ‘80s themed party in Sydney"
2021/03/01 0:00:00,Porsche driver Richard Pusey pleads guilty to disgusting act after Eastern Freeway crash
2021/03/01 0:00:00,"‘My mum mates tried to make me ‘cure’ my son’s autism with ‘bleach therapy’, it makes me sick I thought we were friends’"
2021/03/01 0:00:00,"Golden Globes 2021 live updates: Winners, speeches and best moments"
2021/03/01 0:00:00,Geelong’s top growth suburbs of the last decade revealed
2021/03/01 0:00:00,Melbourne CBD Dior store ram raided
2021/03/01 0:00:00,Ex-heroin addict who ‘used at 15 and overdosed 19 times’ reveals sober transformation
2021/03/01 0:00:00,Horrific photos emerge from Myanmar as regime begins brutal crackdown
2021/03/01 0:00:00,Sydney mother films Golden-crowned snake hiding among toys in child’s bedroom
2021/03/01 0:00:00,NASA Perseverance Mars Rover directed from Lewisham apartment above hair salon
2021/03/01 0:00:00,Revealed: Why banned NRL player agent was spotted at Suaalii debut
2021/03/01 0:00:00,Who returned Lady Gaga’s stolen dogs?
2021/03/01 0:00:00,Historical rape allegations involving cabinet minister revealed in letter from victim’s friend
2021/03/01 0:00:00,Mitsubishi Eclipse Cross review: Value is the name of the game
2021/03/01 0:00:00,Bruce McAvaney’s replacement revealed after AFL icon walks away
2021/03/01 0:00:00,Melbourne luxury suburbs tipped to hit a $3m median in 2021
2021/03/01 0:00:00,"Rory Sloane, wife Belinda reveal devastation of losing their baby"
2021/03/01 0:00:00,Liam O’Connor’s ‘heroic 0 not out’ saves WA in Sheffield Shield thriller
2021/03/01 0:00:00,Ben Simmons hits three as 76ers shooting woes exposed in Cavaliers loss
2021/03/01 0:00:00,Terrifying vision as ‘aeroplane crash’ rocks motorsport
2021/03/01 0:00:00,NSW moves to ban ‘toxic’ firefighting foam containing PFAS chemicals
2021/03/01 0:00:00,Ikenasio ‘Sio’ Tuivasa shot dead outside pool hall in Ravenhall drive-by shooting
2021/03/01 0:00:00,"Police, family launch new appeal into 2009 shooting death of Omega Ruston, fears of bikie links"
2021/03/01 0:00:00,World in awe of Australian skiing madman Mark Pollock
2021/03/01 0:00:00,Armie Hammer quietly moves out of LA home in dead of night
2021/03/01 0:00:00,Live breaking news: Virus detected in Queensland wastewater
2021/03/01 0:00:00,"Heavy rainfall, strong winds for north Qld as tropical cyclone approaches"
2021/03/01 0:00:00,Melissa Caddick: Police say conwoman may have been on the run for months before meeting her death
2021/03/01 0:00:00,"New rules for ‘buy now, pay later’ companies in Australia"
2021/03/01 0:00:00,Richmond coach Damien Hardwick steps out with new girlfriend
2021/03/01 0:00:00,Chinese football in chaos as billions finally run out
2021/03/01 0:00:00,Donald Trump’s CPAC speech: Crowd cheers as former president repeats false claim that he won the 2020 election
2021/03/01 0:00:00,Minister rape claims: Warning to PM Scott Morrison in letter
2021/03/01 0:00:00,Survey reveals Aussie women leading the world as Airbnb hosts
2021/03/01 0:00:00,Point Piper penthouse sells for $16m+ as dentist David Penn buys a $7.75m Double Bay investment
2021/03/01 0:00:00,Southern Hemisphere’s largest Koi farm is for sale near new Western Sydney airport in Bringelly
