date,title
2021/06/05 0:00:00,"NBL21: Sydney Kings win thriller over Brisbane Bullets, need miracle to play finals"
2021/06/05 0:00:00,Daniel Ricciardo crashes out in chaotic qualifying session
2021/06/05 0:00:00,At least 11 civilians killed in NE Mali: armed group
2021/06/05 0:00:00,Matthew Nicks says Covid-19 fine had no bearing on Crows’ shock loss
2021/06/05 0:00:00,"France hails G7 tax decision, backs 'highest' tax rate"
2021/06/05 0:00:00,Yellen hails 'unprecedented' G7 commitment on corporate tax
2021/06/05 0:00:00,Goma airport reopens two weeks after volcanic eruption: AFP
2021/06/05 0:00:00,Tigers make it 11 in a row against Bombers
2021/06/05 0:00:00,3 civilians die in Turkish drone attack on Iraq refugee camp: MP
2021/06/05 0:00:00,Exposure sites added; new cases linked to Arcare Maidstone nursing home
2021/06/05 0:00:00,Fans fume at ‘ridiculous’ umpiring in Dreamtime Clash
2021/06/05 0:00:00,Germany hails G7 global corporate tax decision
2021/06/05 0:00:00,Max Verstappen crashes into wall at Practice 3 in Baku
2021/06/05 0:00:00,About 100 killed in Burkina Faso in deadliest attack since 2015
2021/06/05 0:00:00,"Prince Edward jokes about Prince Harry, Meghan Markle Oprah interview"
2021/06/05 0:00:00,British finance minister hails G7 'historic agreement' on global tax
2021/06/05 0:00:00,G7 commits to 'at least 15% global minimum corporate tax'
2021/06/05 0:00:00,Remy Gardner to debut in MotoGP next season
2021/06/05 0:00:00,"Radio host Mitch Churi got his start as a chicken, just like Brad Pitt"
2021/06/05 0:00:00,US judge lifts California ban on assault weapons
2021/06/05 0:00:00,Titans’ bench press monster Greg Marzhew scores on NRL debut
2021/06/05 0:00:00,Woolworths drops prices on 220 winter essentials
2021/06/05 0:00:00,14 killed in Burkina Faso village attack: security sources
2021/06/05 0:00:00,South East Melbourne Phoenix outlast fast-finishing Breakers
2021/06/05 0:00:00,Jamie Elliott bags six as Collingwood sinks Adelaide
2021/06/05 0:00:00,Morphettville: Leon Macdonald pays tribute to David ‘DT’ Thomas after Pearl Bandit’s win in race named in his honour
2021/06/05 0:00:00,Adelaide Oval spectator’s hilarious move after bizarre Covid remark
2021/06/05 0:00:00,"Fabio Fognini has epic tantrum, requires medical timeout"
2021/06/05 0:00:00,Central Coast Mariners too good for Western United
2021/06/05 0:00:00,Relief Run 2021: Samantha Gash to raise money for Covid-ravaged India
2021/06/05 0:00:00,Rosehill: Tommy Berry brings up 100th winner as Chris Waller breaks $40 million again
2021/06/05 0:00:00,"Firefighters battle huge blaze in Hunter Region for hours, multiple houses destroyed"
2021/06/05 0:00:00,Victoria lockdown: Delta Covid-19 variant has state on edge as five new cases recorded
2021/06/05 0:00:00,AFL 2021: Richmond-West Coast fixture change means for KFC SuperCoach
2021/06/05 0:00:00,Careless riding ban dents Berry’s Sydney premiership pursuit
2021/06/05 0:00:00,Swimmer Bronte Campbell talks about life after Tokyo Olympic Games
2021/06/05 0:00:00,Duncan Lay: Could A Quiet Place II help save world cinema?
2021/06/05 0:00:00,John Longmire applauds Buddy’s ‘selfless’ act in Swans win
2021/06/05 0:00:00,Girl placed in induced coma after suffering serious head injury in football tackle
2021/06/05 0:00:00,Queensland Oaks: Edward Cummings joins family dynasty of Group 1 winners
2021/06/05 0:00:00,Multiple bidders drive big price for renovated Geelong home
2021/06/05 0:00:00,Saints star’s ‘disgraceful’ moment infuriates footy legends
2021/06/05 0:00:00,Sisters in Law: Are Australia’s international border closures legal with no end date in sight?
2021/06/05 0:00:00,AFL coach left baffled by shocking miss
2021/06/05 0:00:00,Sydney FC silence Brisbane Roar to lock up second place on A-League ladder
2021/06/05 0:00:00,"Raceday focus: Best bets, analysis Ballarat Synthetic Monday"
2021/06/05 0:00:00,Insane French Open photo stuns tennis world
2021/06/05 0:00:00,Sluggish Magpies struck down by red hot Fever
2021/06/05 0:00:00,Covid-19 vaccination: New Zealanders spot hilarious mistake on world map
2021/06/05 0:00:00,The Phoenix: Gai Waterhouse and Adrian Bott finally on the board in the winter carnival as Volcanic Rock emerges as a JJ contender
2021/06/05 0:00:00,Delta plane diverted after man tries to storm cockpit
2021/06/05 0:00:00,Kick accuracy haunts Saints in last-minute loss to Swans
2021/06/05 0:00:00,Newtown house sells $305K over reserve to buyers in lockdown
2021/06/05 0:00:00,Victoria extends state of emergency powers enabling lockdowns until July 1
2021/06/05 0:00:00,"Significant snow, rain forecast for Victoria as slow-moving cold front blasts up from Antarctica"
2021/06/05 0:00:00,A-League: Mathew Leckie joins Melbourne City on a three-year deal
2021/06/05 0:00:00,Brad Thorn’s advice ahead of Mac Grealy’s dream debut
2021/06/05 0:00:00,Shocking scenes as two kids assault Neymar
2021/06/05 0:00:00,"Positive test shuts CBD site, five new local cases"
2021/06/05 0:00:00,Super Netball: Giants and Swifts prepare to face off in NSW
2021/06/05 0:00:00,Mali opposition supporters rally as France warns ruling junta
2021/06/05 0:00:00,"Daughter’s adorable, ultimate betrayal of footy star"
2021/06/05 0:00:00,How Kysaiah Pickett inspired famous Demons win
2021/06/05 0:00:00,Flemington: Frankel filly Argentia defeats Black Caviar’s daughter Invincible Caviar
2021/06/05 0:00:00,Robbie Farah throws support behind unlucky Liddle
2021/06/05 0:00:00,"Deer spotted roaming streets in Fitzroy, Melbourne, during lockdown"
2021/06/05 0:00:00,Moreton Cup: Tony Gollan rules out Stradbroke Handicap for impressive Baller
2021/06/05 0:00:00,Property boom: house cordoned off with danger tape and deemed health hazard sells for huge price
2021/06/05 0:00:00,Black Summer RFS hero on ‘last stand’ during New Year’s Eve blaze on south coast
2021/06/05 0:00:00,Aussie NFL star hits $20m jackpot in US
2021/06/05 0:00:00,Melbourne lockdown due to end on Thursday as contact tracers track highly infectious strain
2021/06/05 0:00:00,Man charged over violent road rage attack in Sydney CBD
2021/06/05 0:00:00,US couple charged with child neglect after toddler allegedly overdosed on cocaine
2021/06/05 0:00:00,"Murwillumbah preview: Tips, best bets and inside mail"
2021/06/05 0:00:00,China blasts US and EU consulates in Hong Kong for Tiananmen candles
2021/06/05 0:00:00,Super Netball: How the league is looking to encourage more Indigenous players
2021/06/05 0:00:00,Mia Fevola reveals ‘shock’ diagnosis after health battle
2021/06/05 0:00:00,Woman’s excruciating reaction to steroid cream withdrawal after eczema treatment
2021/06/05 0:00:00,"Crowded House, James, Billy F. Gibbons: New album reviews"
2021/06/05 0:00:00,Victoria records 5 new local Covid-19 cases
2021/06/05 0:00:00,Life of Pikelet animal rescue is saving dogs born with cleft palates
2021/06/05 0:00:00,Ivan Cleary gives laughable four-word response to cruel treatment by Tigers fans
2021/06/05 0:00:00,"Shock video shows police chase and taser semi-naked and bloodied man, Laemin Forbes, in Perth"
2021/06/05 0:00:00,‘Extraordinary’ iron ore price has Australian economy rivalling Russia
2021/06/05 0:00:00,"In rural India, fear of testing and vaccines hampers Covid-19 fight"
2021/06/05 0:00:00,Bunnings’ timber shortage forces retailer to issue warning to customers about staff abuse
2021/06/05 0:00:00,Huge drama in Mayweather-Paul undercard change
2021/06/05 0:00:00,Fury as football coach forces child to eat: ‘It was done intentionally’
2021/06/05 0:00:00,"Miami, looking to be next crypto hotspot, hosts huge bitcoin event"
2021/06/05 0:00:00,Baker mulling over blinkers for Group 1 contender Overpass
2021/06/05 0:00:00,Rosehill: Unbeaten 2YO Cape Breton to press on to Group 1 JJ Atkins next week
2021/06/05 0:00:00,St Kilda: Families drawn to compound living in Covid age
2021/06/05 0:00:00,Four decades of AIDS
2021/06/05 0:00:00,Crows smashed with fine for damning photo
2021/06/05 0:00:00,Discovery in Woolworths aisle sparks debate: ‘That’s discriminatory’
2021/06/05 0:00:00,Zayn Malik filmed topless in a heated argument with a man outside Manhattan bar
2021/06/05 0:00:00,"Frank Zumbo to fight charges of alleged sexual misconduct against three women, teenage girl"
2021/06/05 0:00:00,"Melbourne protests: Two arrested outside Flinders St Station, heavy police presence at vaccination hubs"
2021/06/05 0:00:00,Eight renovations has prestige Newtown home sitting pretty
2021/06/05 0:00:00,Daniel Ricciardo reveals crucial change after messy McLaren start
2021/06/05 0:00:00,"Bitcoin price will increase tenfold, argue the famous Winklevoss twins"
2021/06/05 0:00:00,Mayweather and Paul ultimate guide: War of words that started rivalry
2021/06/05 0:00:00,Myanmar poets square off against junta's war on words
2021/06/05 0:00:00,How Donald Trump can become president again in 2024
2021/06/05 0:00:00,Taylor Fritz speaks after being carried off court on a wheelchair
2021/06/05 0:00:00,"Adorable illustrations of Harry and Archie feature in Meghan’s book, The Bench"
2021/06/05 0:00:00,Tigers star’s taunt with extra hot sauce made it personal with Penrith
2021/06/05 0:00:00,Melbourne United lock up NBL minor premiership
2021/06/05 0:00:00,Royal expert predicts Meghan and Harry’s marriage will last despite widespread doubt
2021/06/05 0:00:00,Map shows movements of Melbourne family with Delta strain of Covid-19
2021/06/05 0:00:00,US hiring underwhelms in May as economic reopening hits turbulence
2021/06/05 0:00:00,Biden administration will restore key environmental protections
2021/06/05 0:00:00,Canada PM urges Church to 'take responsibility' for school abuses
2021/06/05 0:00:00,Rio mayor says he could cancel Copa America games
2021/06/05 0:00:00,History-chasing Serena into French Open second week after Sabalenka exit
2021/06/05 0:00:00,US intel report on UFOs inconclusive: reports
2021/06/05 0:00:00,"Facebook imposes 2-year Trump ban, revises rules for politicians"
2021/06/05 0:00:00,Toddler drowns in paddling pool as family begs paramedics to save their boy
2021/06/05 0:00:00,Floyd Mayweather vs Logan Paul: Late rule change makes fight even more violent
2021/06/05 0:00:00,Essendon Edwardian snapped up midweek after only one viewing
2021/06/05 0:00:00,Bitcoin price crash: Host slams Elon Musk after broken heart tweet
2021/06/05 0:00:00,Former child actor Drake Bell has been charged with ‘attempted endangerment of children’
2021/06/05 0:00:00,Indigenous Sport Month: Cowboys legend Matt Bowen opens up about helping kids in remote areas
2021/06/05 0:00:00,Man wants to split from fiancee after she became a paraplegic
2021/06/05 0:00:00,"AFL star Dayne Zorko slammed for dirty, dumb act as Melbourne beat Lions"
2021/06/05 0:00:00,Russian tennis star Yana Sizikova arrested after massage for alleged match fixing
2021/06/05 0:00:00,Picturesque property steeped in Stirling’s history hits the market
2021/06/05 0:00:00,Donald Trump’s Facebook ban to last until 2023
2021/06/05 0:00:00,Sad truth about Naomi Osaka’s incredible transformation is revealed
2021/06/05 0:00:00,Woman dies five days after Sydney multi-car crash
2021/06/05 0:00:00,‘Nobody else is Serena’: Williams sends a warning after French Open twist
2021/06/05 0:00:00,Bonds introduces new ‘genderless’ clothing range
2021/06/05 0:00:00,What Singapore GP cancellation means for F1 2021 calendar
2021/06/05 0:00:00,Australian TV host Megan Waters reflects on ‘shameful’ mistake she’ll never make again
2021/06/05 0:00:00,2021 Hyundai Sonata N-Line: This car proves why you don’t need an SUV
2021/06/05 0:00:00,Geelong property searches show price rise pressure on buyers
2021/06/05 0:00:00,Live like royalty in a cosmopolitan hotspot
2021/06/05 0:00:00,Sydney housing market: 43 per cent of all property buyers now looking to spend over $1.5 million
2021/06/05 0:00:00,Trump calls Facebook ban an 'insult'
2021/06/05 0:00:00,Facebook bans former US president Trump for 2 years
2021/06/05 0:00:00,Joe Biden says he remains confident in Dr Anthony Fauci after release of bombshell emails
2021/06/05 0:00:00,Nigeria govt says 'indefinitely' suspending Twitter in country
2021/06/05 0:00:00,Biden calls US jobs figures 'great news'
2021/06/05 0:00:00,Daniel Ricciardo’s Baku start shows he’s still got it
2021/06/05 0:00:00,Putin says wants to find ways with Biden to improve ties
2021/06/05 0:00:00,"Gunning home built with the winnings from a 1915 horse race, is on the hunt for a new owner"
2021/06/05 0:00:00,Ivanhoe East: Mid-century pad modernised with flair-filled renovation
