date,title
2021/09/21 0:00:00,"US, European stocks rebound after Evergrande-driven rout"
2021/09/21 0:00:00,‘Will hurt me to the day I die’: Adam Treloar’s brutal Grand Final loss
2021/09/21 0:00:00,Daniel Ricciardo’s McLaren boss delivers Dutch reality check
2021/09/21 0:00:00,Iron curtain falls on Hong Kong cinema as censors demand cuts
2021/09/21 0:00:00,Former fugitive Darko Desic’s long-lost relative comes forward
2021/09/21 0:00:00,James Weir recaps SAS Australia 2021 episode 5
2021/09/21 0:00:00,Aaron Jones reveals tragic truth behind hidden NFL tribute
2021/09/21 0:00:00,Sam Burgess chokes up over father’s death on SAS Australia
2021/09/21 0:00:00,Taliban says girls to return to school 'soon as possible'
2021/09/21 0:00:00,Trudeau's Liberals set to win minority government in Canada election
2021/09/21 0:00:00,Statesman Homes’ Ashville Alfresco: small details create better homes
2021/09/21 0:00:00,Sydney’s NYE fireworks scaled back due to public health concerns
2021/09/21 0:00:00,Delta variant more deadly than Doherty Institute forecast
2021/09/21 0:00:00,Melbourne Storm star Felise Kaufusi reveals Bellamy’s hidden side
2021/09/21 0:00:00,No Sudden Move: Steven Soderbergh’s playful caper
2021/09/21 0:00:00,"Tradies prepare for war with Victorian Government over Covid vaccine mandate, with violent CFMEU protest a sign of things to come"
2021/09/21 0:00:00,‘This was not cheating’: Panthers fire back in NRL stoppage storm
2021/09/21 0:00:00,"Dating app match allegedly drugged, raped and filmed by two men"
2021/09/21 0:00:00,Teen boy charged over alleged stabbing at Sawtell beach party brawl
2021/09/21 0:00:00,"US Covid-19 death toll surpasses 1918 flu pandemic, data reveals"
2021/09/21 0:00:00,Elliot Page spotted on celebrity dating app Raya
2021/09/21 0:00:00,Top Irish filly Mother Earth set to soar at Breeders Cup meeting instead of the Golden Eagle
2021/09/21 0:00:00,"Race day focus: Best bets, analysis for Flemington on Wednesday"
2021/09/21 0:00:00,Newgate Farm has a strong Golden Rose presence with a crack quartet of colts
2021/09/21 0:00:00,"Picturesque Mt Macedon hideaway has home cinema, gym, pool, gallery and a library"
2021/09/21 0:00:00,Wallabies star Len Ikitau’s golden streak to continue until 2023
2021/09/21 0:00:00,Kanye West reportedly buys a $78.8 million Malibu house amid divorce
2021/09/21 0:00:00,"Jones scores four TDs, loses father's ashes in endzone"
2021/09/21 0:00:00,Nonconformist escapes weight penalty with 72 left in the Caulfield Cup
2021/09/21 0:00:00,NSW Premier’s approval rating slumps in pandemic-handling poll
2021/09/21 0:00:00,Double murder accused takes the stand to deny one killing and claim self-defence in the other
2021/09/21 0:00:00,"Australian sharemarket shakes off Wall Street, commodity price falls as bargain hunters pounce on resources stocks"
2021/09/21 0:00:00,Moonee Valley Racing Club concedes no punters will be on track on Cox Plate Day
2021/09/21 0:00:00,NRL teams: Storm handed huge boost ahead of 2020 GF rematch
2021/09/21 0:00:00,England slammed after cancelling historic Pakistan cricket tour
2021/09/21 0:00:00,Wild protesters force closure of Melbourne freeway as trade union and anti-lockdown tensions merge
2021/09/21 0:00:00,"Tools up for NSW tradies going back to work next week, while chaos continues on Melbourne streets"
2021/09/21 0:00:00,The Inferno’s hopes of an Everest run hinge on his performance in Group 1 Moir Stakes at The Valley
2021/09/21 0:00:00,Brian Laundrie: Private investigator weighs in on man’s location
2021/09/21 0:00:00,"Sex And The City reboot, And Just Like That, drops first teaser at Emmys"
2021/09/21 0:00:00,"Crunch time for Evergrande, but no 'Lehman moment'"
2021/09/21 0:00:00,"Time for ‘cautious optimism’ about Covid-19 future, says Dr Nick Coatsworth"
2021/09/21 0:00:00,The School That Tried to End Racism: Giving kids the skills to combat Australia’s ‘horrible hand grenade’
2021/09/21 0:00:00,Golden Rose contender Royalzel to accept in Group 3 on same card
2021/09/21 0:00:00,Gosford preview: Everything’s looking all Peaches and Cream for Singo’s classy gelding
2021/09/21 0:00:00,"Real estate reopening Victoria: Everything you need to know about home inspections, moving"
2021/09/21 0:00:00,Ben Dorries opinion: Victoria has gone mad with Caulfield Cup and Cox Plate crowd bans
2021/09/21 0:00:00,Queensland fire rescue authorities downgrade watch and act warning
2021/09/21 0:00:00,Australian teenager Darcie Brown claims four-wicket haul in ‘breakout performance’ against India
2021/09/21 0:00:00,Peter Dutton to give evidence at defamation trial against activist over ‘rape apologist’ tweet
2021/09/21 0:00:00,Exciting Victorian stayer on Group 2 Sydney Cup trail
2021/09/21 0:00:00,Shocking twist as Tigers make huge call on Michael Maguire’s future
2021/09/21 0:00:00,Wanted mum Sammi Kendrick who allegedly stabbed stepdad in back breaks silence in social media posts
2021/09/21 0:00:00,"Body modifier ‘panicked’ at death of woman after snowflake procedure, court told"
2021/09/21 0:00:00,Illawarra Hawks release import guard Travis Trice due to his desire to remain unvaccinated
2021/09/21 0:00:00,Woman shares hack to get free extra hand luggage on plane using a pillow case
2021/09/21 0:00:00,‘Rusty’: Australian superstar Ellyse Perry ‘all over the shop’ in first ODI
2021/09/21 0:00:00,AFL Grand Final: All-Australian Melbourne defender Jake Lever says backline partner Steven May will play against the Western Bulldogs
2021/09/21 0:00:00,Lawyer for family of Gabby Petito’s partner abruptly cancels press conference
2021/09/21 0:00:00,"Man charged over fatal Brisbane bashing alleged to be ’agitator’ but did not throw punch, court told"
2021/09/21 0:00:00,Matildas coach Tony Gustavsson’s stunning Sam Kerr claim
2021/09/21 0:00:00,Why Australians could be wearing masks indefinitely
2021/09/21 0:00:00,Interstate jockeys still a small chance of being allowed into Victoria for Cox Plate and Melbourne Cup rides
2021/09/21 0:00:00,Sophie Monk shares ‘crazy’ discovery about American homes
2021/09/21 0:00:00,Body found in Brisbane River remains a police mystery
2021/09/21 0:00:00,Recall issued for popular gadget used by TikTok and Instagram influencers
2021/09/21 0:00:00,Councils to cop the massive bill for federal government’s climate inaction as experts warn it could hit $54 million a year
2021/09/21 0:00:00,Mum accused of locking 63yo woman in storage unit secures bail despite previous breach
2021/09/21 0:00:00,2022 Mazda BT-50 XS and SP added to the range
2021/09/21 0:00:00,French defence minister warns Mali against Russian 'mercenary' firm
2021/09/21 0:00:00,RSPCA Victoria announces investigation into alleged dog kicking at Melbourne protest
2021/09/21 0:00:00,"Penrith Panthers cop monster $25,000 fine for illegal stoppage in semi-final"
2021/09/21 0:00:00,"Channel 7 reporter attacked, sprayed with ‘urine’ by protesters in Melbourne"
2021/09/21 0:00:00,Tax time: best way to make WFH tax deductions
2021/09/21 0:00:00,What happened to famous Chinese YouTuber Li Ziqi
2021/09/21 0:00:00,Penrith cops big fine and suspension for trainer breach
2021/09/21 0:00:00,Extra security for N.Z. women's cricketers in Britain
2021/09/21 0:00:00,Jeff Penza picks up two Group 1 rides at Randwick on Epsom day
2021/09/21 0:00:00,AFL names umpires for the 2021 grand final
2021/09/21 0:00:00,Fiery Essendon DFO plane crash pilot Max Quartermain failed key test two years before fatal crash
2021/09/21 0:00:00,Controlling partner’s bizarre ‘motorboat’ claim
2021/09/21 0:00:00,The Oracle’s runner-by-runner preview: Golden Rose at Rosehill Gardens
2021/09/21 0:00:00,Judge rules boss’ use of word ‘birds’ in the workplace an example of ‘sexist language’
2021/09/21 0:00:00,Revealed: where to find Sydney’s biggest houses
2021/09/21 0:00:00,Woman who processed interstate travellers allegedly ‘helped plan border breach’: cops
2021/09/21 0:00:00,Cricket: The future of Australian cricket on show as Darcie Brown snares four wickets in the opening one-day international against India
2021/09/21 0:00:00,Blunder in lingerie advert leaves model with lopsided breast
2021/09/21 0:00:00,Iron ore price drops below $US100 with warnings China could cause disaster for Australia
2021/09/21 0:00:00,"Byron, Tweed and Kempsey Shires to enter lockdown after positive case visited area"
2021/09/21 0:00:00,Pubgoer allegedly killed unborn baby girl by kicking pregnant woman’s stomach
2021/09/21 0:00:00,"What Merkel, the belated feminist, did for women"
2021/09/21 0:00:00,Best Great Barrier Reef tours
2021/09/21 0:00:00,Uproar over mounted border agents turning back Haitian migrants
2021/09/21 0:00:00,Canberra concedes Covid zero return unlikely
2021/09/21 0:00:00,Baby-faced Idris Elba spotted in unearthed Bond GoldenEye video
2021/09/21 0:00:00,Biden to announce 'good news' on $100 billion UN climate fund
2021/09/21 0:00:00,Walmart worker’s epic resignation goes viral on Facebook
2021/09/21 0:00:00,EU rallies behind angry France in US row but Biden budges on travel
2021/09/21 0:00:00,Matthew McConaughey roasted in hilarious interview out-take
2021/09/21 0:00:00,Full details: Nissan’s final GT-R supercar
2021/09/21 0:00:00,NRL 2021: The only thing Melbourne Storm star Reimis Smith fears
2021/09/21 0:00:00,San Francisco mayor’s defiant message after breaking own mask rule
2021/09/21 0:00:00,Gold digger killer Charles Bisucci’s cold words before murder-suicide
2021/09/21 0:00:00,Team ‘seriously interested’ in Simmons trade emerges as saga rolls on
2021/09/21 0:00:00,Why you shouldn’t make a habit of doing a ‘just in case’ wee
2021/09/21 0:00:00,The unanswered questions about the tragic death of Gabby Petito
2021/09/21 0:00:00,Ben Simmons continues to stand his ground with pre-season training just a week away
2021/09/21 0:00:00,"Barnaby Joyce says reopening is like ‘herding cats’, in swipe at WA and Qld"
2021/09/21 0:00:00,Kanye West ‘bragged’ about hooking up with Christina Milian
2021/09/21 0:00:00,YOU GOT THIS: Personal trainer’s low calorie ‘Big Mac’ from Aldi
2021/09/21 0:00:00,Awkward photo emerges at the worst time for Justin Trudeau during Canadian election
2021/09/21 0:00:00,Five reasons why China is destroying Aussie iron ore price
2021/09/21 0:00:00,SAS Australia celebrity who got paid nothing to appear on the reality series
2021/09/21 0:00:00,"‘Disgusted, heartbroken’: Boxing star kicked off flight over face mask"
2021/09/21 0:00:00,Coles shopper spots hilarious typo in BBQ chook sign
2021/09/21 0:00:00,"UK heiress ‘murdered for cash by debt-ridden boyfriend’, court hears"
2021/09/21 0:00:00,Queensland filly to tangle with big guns in Sydney again on Saturday
2021/09/21 0:00:00,Tokyo's Nikkei plunges more than 2% on China debt crisis fears
2021/09/21 0:00:00,‘It sucks’: What keeps F1 star Daniel Ricciardo up at night
2021/09/21 0:00:00,Koeman defends direct approach after Barca held by Granada
2021/09/21 0:00:00,Firefighters race to protect giant sequoias in California fires
2021/09/21 0:00:00,Apple rolls out iOS 15 update for iPhones
2021/09/21 0:00:00,"‘Brainless’ Australia a target for ‘nuclear war’, warns top China expert"
2021/09/21 0:00:00,The Iconic launches new homewares and home living range
2021/09/21 0:00:00,US Democrats unveil plans to suspend debt limit
2021/09/21 0:00:00,Pointed accusation emerges as NRL finals controversy erupts
2021/09/21 0:00:00,NASA selects Moon site for ice-hunting rover
2021/09/21 0:00:00,Goldolphin gun Anamoe to meet 12 rivals in Group 1 Golden Rose
2021/09/21 0:00:00,"Rock lobster served on Aussie tables as offal gets thumbs down, ABS supermarket scanning data shows"
2021/09/21 0:00:00,Queensland grandfather fined for carrying pocket knife
2021/09/21 0:00:00,AFL Grand Final: Former Melbourne skipper Nathan Jones has no regrets about leaving Perth ahead of Saturday’s decider
2021/09/21 0:00:00,"Alert issued for multiple venues inside Brisbane Airport, border bubble busted after Tweed case"
2021/09/21 0:00:00,Date scheduled for US man's execution despite doubts about guilt
2021/09/21 0:00:00,Fewer Europe fans no worry for Harrington at Ryder Cup
2021/09/21 0:00:00,Updated mapping shows Aussie beaches and homes at risk from sea level rise
2021/09/21 0:00:00,‘Honey Badger’ Nick Cummins rescues sheep stuck in barbed wire fence
2021/09/21 0:00:00,Ben Simmons trade: Houston Rockets show interest in Philadelphia 76ers star
2021/09/21 0:00:00,Queensland owner trying to boost worth of Gold Coast Magic Millions champion
2021/09/21 0:00:00,Prince Andrew missed meeting new granddaughter to remain in hiding at Balmoral
2021/09/21 0:00:00,‘Winter returns’: Polar mass to blast Aus
2021/09/21 0:00:00,Scott Morrison unable to secure Macron meeting as relations sour
2021/09/21 0:00:00,NRL finals: Storm stars reveal why Melbourne’s success is about more than famed ‘big three’ as another GF spot awaits
2021/09/21 0:00:00,The Handmaid’s Tale breaks Emmys record no show wants
2021/09/21 0:00:00,‘Dark’ pro-vaccine advert fools anti-vaxxers
2021/09/21 0:00:00,‘Flat for 10 years’: the NSW suburbs where home prices grew least since 2011
2021/09/21 0:00:00,Tiffiny Hall reveals family forced to stage an ‘intervention’
2021/09/21 0:00:00,Waterhouse-Bott likely to abort spring campaign and turn focus to autumn with Group 1 winner Converge
2021/09/21 0:00:00,GoFundMe set up to cover funeral costs of anti-vax mum of four who died of Covid-19
2021/09/21 0:00:00,US to end travel bans for vaccinated passengers
2021/09/21 0:00:00,Change to NSW Covid rules with government to introduce ‘friends bubble’ for kids
2021/09/21 0:00:00,Adam Campton to shortly be up and running training on the Gold Coast
2021/09/21 0:00:00,Gabby Petito: Tips that may have led to discovery of body
2021/09/21 0:00:00,"Melbourne tradie protests: protests escalate with police, tradie showdown on Westgate Bridge"
2021/09/21 0:00:00,Career expert reveals the online meeting mistake we need to stop
2021/09/21 0:00:00,‘Harden up’: Brutal criticism strikes a nerve at Port Adelaide
2021/09/21 0:00:00,Collapse of indebted developer China Evergrande Group could cause global disaster
2021/09/21 0:00:00,Annastacia Palaszczuk waits on new modelling as border dispute heats up
2021/09/21 0:00:00,Queen’s Gambit star Anya Taylor-Joy hits Emmys afterparty in lingerie-inspired outfit
2021/09/21 0:00:00,"Contour Cubes beauty product makes $100,000 in months"
2021/09/21 0:00:00,Victoria records 603 new local cases of coronavirus as testing numbers lashed by experts
2021/09/21 0:00:00,Roger Federer reveals what ‘hurts me a lot’ as injury rehab continues
2021/09/21 0:00:00,Glenelg South character home smashes street’s sale price record by more than $1m
2021/09/21 0:00:00,"Melbourne 'freedom' protest: Chaos erupts on CBD streets, West Gate Freeway over construction sector shutdown"
2021/09/21 0:00:00,David Beckham’s son Romeo impresses on professional football debut
2021/09/21 0:00:00,"$344 billion crypto price plunge: Why Bitcoin, Ethereum, Cardano, Solana have dropped"
2021/09/21 0:00:00,"‘He was slapping her’: New audio of distressing Gabby Petito, Brian Laundrie fight"
2021/09/21 0:00:00,Gillian Anderson’s American accent at Emmys shocks the internet
2021/09/21 0:00:00,Craig Williams has been snapped up for the mount on a star European import for his Cups carnival assault
2021/09/21 0:00:00,‘Starting to take effect’: Why Covid cases in NSW are dropping
2021/09/21 0:00:00,Mum’s fury at explicit school book with sexual details she ‘had to Google’
2021/09/21 0:00:00,‘I am in awe’: Ben Affleck breaks silence on J.Lo romance
2021/09/21 0:00:00,Truck company Connect Logistics hit with new charges over crash that killed four police officers
2021/09/21 0:00:00,Global stocks sink on Evergrande contagion fears
2021/09/21 0:00:00,"Emmys 2021 live updates: Winners, speeches and highlights"
2021/09/21 0:00:00,Mandy Moore’s hilarious post-Emmy’s confession
2021/09/21 0:00:00,‘How many times?’: Broadcast slammed for inappropriate close-up of star
2021/09/21 0:00:00,James Weir recaps SAS Australia 2021 episode 4
2021/09/21 0:00:00,Live breaking news: Greg Hunt pushes to get vaccine for kids
2021/09/21 0:00:00,Fresh probe into Macquarie Fields house fire that killed teen Tahma Teara-Jones
2021/09/21 0:00:00,"Man allegedly tried to rob, kidnap 34yo woman on early morning Gold Coast walk: cops"
2021/09/21 0:00:00,Former President Donald Trump reveals ‘obvious’ sign behind Wuhan Covid lab leak theory
2021/09/21 0:00:00,Biden administration doubles US refugee admissions
2021/09/21 0:00:00,"Mother, two children and friend murdered during sleepover"
2021/09/21 0:00:00,Nicole Kidman’s rare comments about marriage
2021/09/21 0:00:00,’What an idiot’: Mark Philippoussis reveals ‘ridiculous’ lifestyle
2021/09/21 0:00:00,Pfizer and BioNTech says Covid-19 vaccine is safe for kids aged 5-11
2021/09/21 0:00:00,Victorian construction industry enters partial shut down after protests
2021/09/21 0:00:00,Former Socceroo Harry Kewell sacked by fifth-tier English side after seven matches
2021/09/21 0:00:00,Friday star Anthony ‘AJ’ Johnson dead at 55
2021/09/21 0:00:00,Looming disaster of ‘Hemsworth effect’ could see house prices fall
2021/09/21 0:00:00,"Long lockdowns still needed to keep Covid-19 cases down despite vaccinations, new modelling suggests"
2021/09/21 0:00:00,‘Need a complete reboot’: Tigers cop all-time whack over Maguire ‘shambles’
2021/09/21 0:00:00,Plastic-eating enzymes trialled in Australian first to create infinitely recyclable plastic
2021/09/21 0:00:00,BTS dance through UN to promote youth solutions for planet
2021/09/21 0:00:00,'Hotel Rwanda' hero sentenced to 25 years on terror charges
2021/09/21 0:00:00,Shock at Russia university campus as gunman kills six
2021/09/21 0:00:00,Russia opposition claims mass fraud after Putin party sweeps vote
2021/09/21 0:00:00,Lava engulfs 100 homes as Canary Islands volcano erupts
2021/09/21 0:00:00,US to require adults to be vaccinated against Covid before being allowed in
2021/09/21 0:00:00,Afghan women outraged by new Taliban restrictions on work
2021/09/21 0:00:00,"US to lift Covid travel ban for vaccinated EU, UK passengers: reports"
2021/09/21 0:00:00,"Victorian, Melbourne lockdowns drive buyers off the plan"
2021/09/21 0:00:00,Big Thomson auction result confirms ‘sleeping giant’ status
2021/09/21 0:00:00,Sydney auctions: Haberfield home sets suburb record after selling $2.02 million above reserve
2021/09/21 0:00:00,Original Glen Waverley home’s baffling mega sale
