date,title
2021/10/16 0:00:00,David Amess murder suspect named as Ali Harbi Ali
2021/10/16 0:00:00,‘Corruption’ could have been behind controversial call in Fury-Wilder fight
2021/10/16 0:00:00,Morphettville: Philonize shows she has a love of victory
2021/10/16 0:00:00,James Weir recaps the slew of Channel 7 stars going rogue
2021/10/16 0:00:00,Craven Plate: Think It Over set to chase $1m bonus in Rosehill Gold Cup
2021/10/16 0:00:00,Sonny Bill Williams open to fighting Paul Gallen and Barry Hall
2021/10/16 0:00:00,NASA launches Lucy probe to explore Jupiter asteroids
2021/10/16 0:00:00,‘It’s not an issue’: Kane Richardson backs Aussies despite disruptive preparation for T20 World Cup
2021/10/16 0:00:00,The Everest: James McDonald says he could feel rivals come at Nature Strip
2021/10/16 0:00:00,Caulfield Cup: Incentivise demolishes his rivals and tightens grip on Melbourne Cup
2021/10/16 0:00:00,Mark Steketee picks up seven wickets on day two of Queensland’s clash with South Australia
2021/10/16 0:00:00,Nash Rawiller to miss big carnival day after heavy whip breach penalty in The Everest
2021/10/16 0:00:00,WBBL|07: Melbourne Renegades hold off Hobart Hurricanes in front of empty stands
2021/10/16 0:00:00,The Everest: Nature Strip finally delivers in the world’s richest race on turf
2021/10/16 0:00:00,"Nature Strip wins turf's biggest prize, The Everest"
2021/10/16 0:00:00,Chris Munce Magic Millions bound with talented filly Rhapsody Rose
2021/10/16 0:00:00,Live stream: Huge night of group 1 greyhound action at Wentworth Park
2021/10/16 0:00:00,"Police outsmart anti-lockdown protesters in Melbourne, more than 50 arrested"
2021/10/16 0:00:00,Global law firm stops representing HKU in Tiananmen sculpture row
2021/10/16 0:00:00,Peter Moody may have been beaming under his mask but we’ll never know just how the Cup affected the big Queenslander
2021/10/16 0:00:00,Bali 4.8 magnitude earthquake leaves locals dead including 3yo girl
2021/10/16 0:00:00,The Everest crowd rubs NSW freedom in Victoria’s face
2021/10/16 0:00:00,Cox Plate champion Sir Dragonet dies after ‘catastrophic’ training injury
2021/10/16 0:00:00,Lausanne tackles toxic soil after shock discovery
2021/10/16 0:00:00,‘One of the greats’: Incentivise wins Caulfield Cup
2021/10/16 0:00:00,The Everest: Masked Crusader within a whisker of astonishing win but Neil Werrett says ‘the best horse won today’
2021/10/16 0:00:00,Telethon: Birds of Tokyo’s Ian Kenny & Glenn Sarangapany to play opening show
2021/10/16 0:00:00,France marks first anniversary since teacher killed over Mohammed cartoon
2021/10/16 0:00:00,Vibrant Afghan radio reduced to religious relic
2021/10/16 0:00:00,First-home buyers finally catch a break in ‘bananas’ Belmont market
2021/10/16 0:00:00,Tristarc Stakes: Godolphin to mull over Cox Plate back-up after Colette gets campaign back on track
2021/10/16 0:00:00,"NSW records 319 new local Covid-19 cases, down from almost 400 a day prior"
2021/10/16 0:00:00,"NSW hits vaccine milestone faster than expected, Premier declares ‘summer is looking good’"
2021/10/16 0:00:00,The Kosciuszko: Art Cadeau’s win in country showpiece a popular result at Randwick
2021/10/16 0:00:00,Four people shot at football game in US state of Alabama
2021/10/16 0:00:00,Massive boost for Bitcoin as SEC set to allow futures ETFs
2021/10/16 0:00:00,AFL 2021: Fremantle coach Justin Longmuir reveals plan to lure Josh Kennedy from West Coast
2021/10/16 0:00:00,Everest Cup: Best celebrity outfits as Spring Racing Carnival begins
2021/10/16 0:00:00,‘Fine doesn’t fit the crime’: Premier calls for harsher penalty for quarantine breacher who caused lockdown
2021/10/16 0:00:00,‘Tragic’: Victorian teenager dies with Covid and ‘a number’ of other conditions
2021/10/16 0:00:00,Neds Classic: Mick Price following Tarzino template with Gunstock for VRC Derby
2021/10/16 0:00:00,Ethereal Stakes: Daisies firms for VRC Oaks as favourite Kapalua Sunset flops
2021/10/16 0:00:00,Rising fertiliser and energy prices could hit Aussie supermarkets hard
2021/10/16 0:00:00,Sydney auctions: Hunters Hill once infested by feral cats sells for $2.33 million
2021/10/16 0:00:00,How The Block stars Josh and Luke Packham deal with pressure
2021/10/16 0:00:00,"Lismore preview: Tips, best bets and inside mail"
2021/10/16 0:00:00,Ben Popham goes from Telethon Kid to Paralympic gold medallist
2021/10/16 0:00:00,Aussie comedian Hannah Gadsby slams Netflix over Dave Chapelle transphobia drama
2021/10/16 0:00:00,Nature Strip wins $15m Everest ‘for the ages’
2021/10/16 0:00:00,Searchers scramble to find four-year-old girl missing from rugged coastal campsite in remote WA
2021/10/16 0:00:00,Dramatic start at Eagle Farm with six protests in first two races
2021/10/16 0:00:00,Woman in lockdown slept metre from neighbour’s dead body for 8 weeks
2021/10/16 0:00:00,Brian Laundrie hunt intensifies as armed cops tape off area
2021/10/16 0:00:00,Wayne Bennett to sign monster deal as Eels star pledges to join
2021/10/16 0:00:00,Tasmanian Government gives WBBL fixtures the green light amid three-day snap lockdown
2021/10/16 0:00:00,T20 Cricket World Cup - six to watch
2021/10/16 0:00:00,"Phoebe Burgess details abusive marriage to SAS star, Sam"
2021/10/16 0:00:00,Gold Coast woman accused of handing out more than 600 fake Covid medical exemption certificates
2021/10/16 0:00:00,A real-life ‘Squid Game’ is set to begin this month in South Korea
2021/10/16 0:00:00,‘Shocker’: F1 great Johnny Herbert suggests Daniel Ricciardo’s talent may have ‘evaporated’
2021/10/16 0:00:00,Elon Musk net worth: World’s richest person worth more than Bill Gates and Warren Buffett combined
2021/10/16 0:00:00,America’s Got Talent Extreme TV stunt goes horribly wrong
2021/10/16 0:00:00,Malaysian man arrested over largest ever heroin haul in Australia’s history
2021/10/16 0:00:00,Caulfield Cup 2021: The pros and cons for every runner in the big race on Saturday
2021/10/16 0:00:00,Chinese astronauts arrive at space station for longest mission
2021/10/16 0:00:00,Backlash over ‘kill us all’ sign at Gosford Anglican Church
2021/10/16 0:00:00,Eleven Eleven chasing historic Magic Millions three-peat
2021/10/16 0:00:00,New Zealand to cast out its official wizard
2021/10/16 0:00:00,‘Nightmare choices’: Why the Northern Territory is so strict with Covid
2021/10/16 0:00:00,Queensland opener Joe Burns vents frustration with ‘crap wickets’ in the Sheffield Shield
2021/10/16 0:00:00,Queensland’s tough new border rules declare parts of Tasmania a hotspot
2021/10/16 0:00:00,‘We feel invisible’: Cheerleaders hit back amid NFL scandal
2021/10/16 0:00:00,Cricket 2021: New SmartBall cricket tech that could change the game forever
2021/10/16 0:00:00,Fatal stabbing of UK MP declared terrorist incident
2021/10/16 0:00:00,ACT records 20 new Covid-19 cases as some freedoms for cross border travel permitted
2021/10/16 0:00:00,PSG scrape victory with late Mbappe penalty
2021/10/16 0:00:00,Golden Globes to go ahead despite TV blackout over diversity row
2021/10/16 0:00:00,"Bitcoin tops $60,000 on US fund approval hopes"
2021/10/16 0:00:00,"Zverev, Tsitsipas sent crashing out of ATP Indian Wells Masters"
2021/10/16 0:00:00,New stimulus package to help hard-hit western Sydney residents
2021/10/16 0:00:00,UK mum’s mould horror after roof collapsed four times in housing commission unit
2021/10/16 0:00:00,"Sydney, Brisbane, Melbourne house prices: 22% national rise predicted"
2021/10/16 0:00:00,IS claims deadly suicide attack on Shiite mosque in Afghanistan's Kandahar
2021/10/16 0:00:00,Bill Clinton to spend another night hospitalized for infection
2021/10/16 0:00:00,"The Everest 2021: When’s it on, how to watch"
2021/10/16 0:00:00,What time is the 2021 Caulfield Cup?
2021/10/16 0:00:00,‘Knockdown’ Richmond house listed for the first time since 1976 reaps massive result
2021/10/16 0:00:00,MP Sir David Amess stabbed to death in church
2021/10/16 0:00:00,Paris Hilton’s wild bridal look for wedding ‘carnival’
2021/10/16 0:00:00,Junior referee jailed for sex crimes against teenage girls
2021/10/16 0:00:00,$590 mn in ransomware payments reported to US in 2021 as attacks surge
2021/10/16 0:00:00,Victoria records 1993 new locally acquired cases of Covid-19
2021/10/16 0:00:00,Kate Middleton caught ‘off guard’ with actor Rami Malek
2021/10/16 0:00:00,Cox Plate shock as defending champion Sir Dragonet dies
2021/10/16 0:00:00,Should I buy a property or continue to rent?
2021/10/16 0:00:00,Full keyboard feature on Series 7 Apple Watch is hard to pass up
2021/10/16 0:00:00,China misses out on record 23-race Formula 1 calendar in 2022
2021/10/16 0:00:00,Covid-19 live updates: Victorians now have a date for the latest lockdown will lift.
2021/10/16 0:00:00,Australian speedster Josh Hazlewood wins IPL title with Chennai Super Kings
2021/10/16 0:00:00,US to reopen borders to vaccinated travelers Nov 8
2021/10/16 0:00:00,Mob beats child killer to death
2021/10/16 0:00:00,Police probe woman’s ‘suspicious’ death north of Adelaide
2021/10/16 0:00:00,How 23yo university grad scored a home in Queensland
2021/10/16 0:00:00,The horror moment a loose horse causes carnage at British racetrack
2021/10/16 0:00:00,Teenager in serious condition with multiple stab wounds after Sydney attack
2021/10/16 0:00:00,NSW government wins landmark court challenge to public health orders
2021/10/16 0:00:00,Fox presenter Terry Bradshaw catching heat for ‘cringey’ Erin Andrews comment
2021/10/16 0:00:00,Biden government to ask Supreme Court to block Texas abortion ban
2021/10/16 0:00:00,Amazing home site listed next to Great Ocean Road lighthouse
2021/10/16 0:00:00,2021 Mazda BT-50 XT review: Dual-cab is a more than capable workhorse
2021/10/16 0:00:00,Parkland school shooter to plead guilty to killing 17
2021/10/16 0:00:00,Mental illness may have triggered Norway bow-and-arrow attack
2021/10/16 0:00:00,Fully vaccinated foreign visitors can enter US from Nov 8: W.House
2021/10/16 0:00:00,Bruce Stevenson: Premiership player and former Hawthorn board member sells in Hawthorn East
2021/10/16 0:00:00,Journo finds Wild Wellness Retreat transformative
2021/10/16 0:00:00,Victorian teenager dies with Covid as state records 1993 new cases
2021/10/16 0:00:00,"Docklands $7m house for sale with whisky room, rooftop spa, boat berth"
2021/10/16 0:00:00,Getting a home loan: The surprising things that can drag down your borrowing capacity
2021/10/16 0:00:00,New sales record for exclusive north shore suburb of Longueville
2021/10/16 0:00:00,Win for buyers: Bump in listings following eased Covid restrictions to halt booming prices
