date,title
2021/08/29 0:00:00,Large ‘explosion’ heard near Kabul airport blamed on ‘rocket’
2021/08/29 0:00:00,Ange Postecoglou’s Celtic taste defeat against Glasgow rivals
2021/08/29 0:00:00,"73 new cases, Dandenong Hospital added to exposure site list"
2021/08/29 0:00:00,HSC 2021: Twins Tomeka and Bojanna Main make the best out of it
2021/08/29 0:00:00,Afghan Paralympians in tears while Brits light up Super Sunday
2021/08/29 0:00:00,Australia slammed as a ‘mess’ in American media
2021/08/29 0:00:00,NRL 2021: Jared Waerea-Hargreaves unleashes on Latrell Mitchell after controversial shoulder charge
2021/08/29 0:00:00,Brutal reality of the new Knockouts segment on The Voice
2021/08/29 0:00:00,Tokyo Paralympics 2021: Bear attack survivor Ma Lin wins table tennis silver medal for Australia
2021/08/29 0:00:00,The Block 2021 episode 13 recap: Cheating scandal erupts as Love Island twins win for controversial master bedroom
2021/08/29 0:00:00,Ronnie and Georgia call-out ‘biggest cheating scandal in TV history’ on The Block
2021/08/29 0:00:00,Japan detects more Moderna vaccine contamination
2021/08/29 0:00:00,"Evacuations, fear as Hurricane Ida grows to Category 4 storm"
2021/08/29 0:00:00,AFL reveals draw for week two and three of finals series
2021/08/29 0:00:00,NRL 2021: Ivan Cleary weighs in on Panthers’ minor premiership hopes
2021/08/29 0:00:00,Essendon fans optimistic 6302-day drought will end soon despite ‘nightmare’ loss
2021/08/29 0:00:00,Dogs young gun boots four as fans rage over ‘ridiculous’ AFL farce
2021/08/29 0:00:00,The Daily Telegraph is giving away caravan and camping holiday prizes
2021/08/29 0:00:00,Lee Horner makes it back-to-back Grand Nationals with win on Inayforhay
2021/08/29 0:00:00,Tokyo Paralympics 2021: Legendary rower Erik Horrie picks up third silver medal in singles sculls
2021/08/29 0:00:00,The Bowraville Murders documentary exposes racism in Australia
2021/08/29 0:00:00,Newlyweds send $328 bill to no-show guests
2021/08/29 0:00:00,Tokyo Paralympics 2021: Aussie Lauren Parker misses triathlon gold by barest of margins
2021/08/29 0:00:00,Ross Lyon reveals ex-star's apology after scathing swipe
2021/08/29 0:00:00,SA’s defence sector in the spotlight in Advertiser/Flinders University Fearless Conversations series | Watch a full replay
2021/08/29 0:00:00,NRL 2021: Tom Trbojevic stars as Sea Eagles hold off Bulldogs
2021/08/29 0:00:00,Unvaccinated schoolteacher spread Covid-19 to 26 people
2021/08/29 0:00:00,NSW Police: Port Stephens man who died from gunshot wound identified as David King
2021/08/29 0:00:00,Celebrities pay tribute to Chadwick Boseman on anniversary of his death
2021/08/29 0:00:00,"Israel strikes Gaza after fire balloons, border clashes"
2021/08/29 0:00:00,On The Punt: Best bets and value selections for Benalla races Monday
2021/08/29 0:00:00,Ash Barty’s US Open omen in Sam Stosur grand slam anniversary
2021/08/29 0:00:00,"Police officer allegedly assaulted, three arrested at Coolangatta lockdown protest"
2021/08/29 0:00:00,Damian Lane has been snapped up for one of the favourites in the Cox Plate after the suspensions of high profile jockeys
2021/08/29 0:00:00,Netflix’s He’s All That: TikTok star Addison Rae was set up to fail
2021/08/29 0:00:00,William and Kate ‘seriously considering’ move to Windsor
2021/08/29 0:00:00,How to save money on energy bills
2021/08/29 0:00:00,Prison guard Melissa Goodwin’s secret love letter to inmate boyfriend revealed
2021/08/29 0:00:00,Inside sick ‘Bowl Gang’ that celebrates white supremacist church shooter Dylann Roof
2021/08/29 0:00:00,AFL 2021: Brisbane Lions forced to reshuffle forward line after qualifying final loss to Melbourne Demons
2021/08/29 0:00:00,Western Australia records no new cases after two NSW truckies bring Covid-19 to the state
2021/08/29 0:00:00,"Breezy Mt Martha house has trap-door wine cellar, pool"
2021/08/29 0:00:00,"Health Minister Greg Hunt blasts Sydney Covid-19 rule breakers, assures Australia on track to hit vaccination target"
2021/08/29 0:00:00,Bizarre scene in India’s cricket demolition
2021/08/29 0:00:00,Rebel Wilson’s ‘tone deaf’ vitamin advert slammed amid pandemic
2021/08/29 0:00:00,"Man allegedly grabbed officer’s gun while resisting arrest, refusing Covid compliance"
2021/08/29 0:00:00,Latrell Mitchell officially done for 2021
2021/08/29 0:00:00,Crypto money gains traction in adult industry amid OnlyFans drama
2021/08/29 0:00:00,Abdul Razak Alhassan rocks UFC with insane 17-second finish
2021/08/29 0:00:00,"Two-thirds of Victoria’s 92 local Covid-19 cases linked back to Melbourne’s northern, western suburbs"
2021/08/29 0:00:00,Twitch video gamers rise up against 'hate raids'
2021/08/29 0:00:00,London's City finance hub mulls post-Covid future
2021/08/29 0:00:00,Parklea Correctional Centre in NSW records 31 coronavirus cases
2021/08/29 0:00:00,Tamworth Preview: Cody Morgan has lofty plans for Edit starting Monday
2021/08/29 0:00:00,Tamworth & Grafton Monday: Best Bets and Inside Mail – Jackson Searle the jockey to follow at Tamworth
2021/08/29 0:00:00,Child star Matthew Mindler found dead after being reported missing
2021/08/29 0:00:00,Slipper curse continues but all is not lost for star colt Stay Inside
2021/08/29 0:00:00,"Daniel Andrews calls for fairer distribution of Covid-19 vaccines among states, territories"
2021/08/29 0:00:00,Pandemic pushes new homeless onto Sao Paulo streets
2021/08/29 0:00:00,Michael Bublé’s sweet birthday post after son’s cancer battle
2021/08/29 0:00:00,‘What the f*** did I say’: Sebastian Vettel slams Lando Norris carnage
2021/08/29 0:00:00,"Jamie Kah, Mark Zahra cause Tony Gollan to search for new Melbourne jockey for Jonker"
2021/08/29 0:00:00,Furious crowd forces Justin Trudeau to cancel campaign event
2021/08/29 0:00:00,Osaka defends US Open crown with Barty leading top rivals
2021/08/29 0:00:00,Tokyo Paralympics: Wheelchair racer Rheed McCracken’s passion for tattoos
2021/08/29 0:00:00,Jake Paul’s cheeky act sparks all-in melee in heated weigh-in
2021/08/29 0:00:00,Study suggests prior Covid-19 infection more effective against Delta than Pfizer vaccine
2021/08/29 0:00:00,Tokyo Paralympics: Evan O’Hanlon’s Winter Olympic goal after Paralympic bronze
2021/08/29 0:00:00,Tennis’ Covid hypocrisy brutally exposed
2021/08/29 0:00:00,"Covid NSW updates: State hits high of 1218 local cases, six deaths and double-vaxxed patient in ICU"
2021/08/29 0:00:00,Gytrash trainer Gordon Richards to base himself in NSW from this week
2021/08/29 0:00:00,"Baby born at 30,000ft on board evacuation flight from Afghanistan"
2021/08/29 0:00:00,Tuchel praises 10-man Chelsea's response as 'world turned upside down' at Liverpool
2021/08/29 0:00:00,Thousands protest curbs on minority voting rights in US
2021/08/29 0:00:00,The Oracle rates performance of every Group 1 Memsie Stakes runner
2021/08/29 0:00:00,"DeChambeau, Cantlay share three-shot lead at BMW Championship"
2021/08/29 0:00:00,Ivashka rolls over Ymer to capture Winston-Salem Open title
2021/08/29 0:00:00,Final UK plane carrying military leaves Kabul
2021/08/29 0:00:00,Judge bans mum from seeing son until she gets Covid-19 vaccine
2021/08/29 0:00:00,Giants star’s interview torched after ugly incident
2021/08/29 0:00:00,"St Mary’s Covid-19 testing clinic set alight, police investigating"
2021/08/29 0:00:00,Can Australian employers force workers to wear face masks
2021/08/29 0:00:00,Adelaide suburbs tipped to be hot under the hammer this spring
2021/08/29 0:00:00,"Shops in Dubbo, western Sydney basketball courts exposed to Covid-19"
2021/08/29 0:00:00,Demons star’s scathing character reference for former coach
2021/08/29 0:00:00,United States drone strikes suicide bomber car packed with explosives headed for Kabul airport
2021/08/29 0:00:00,Afghan athletes in Tokyo after secret operation
2021/08/29 0:00:00,Fashions on your Front Lawn back for 2021 Melbourne Cup Carnival
2021/08/29 0:00:00,"US hits IS targets in Afghanistan, says new airport attack 'likely'"
2021/08/29 0:00:00,NSW records 1218 new local cases of coronavirus and six deaths
2021/08/29 0:00:00,"ACT records 13 new local cases of coronavirus, with 10 people in hospital"
2021/08/29 0:00:00,Ricciardo’s huge result in insane F1 qualifying
2021/08/29 0:00:00,Victoria records 92 new local cases of coronavirus as lockdown extended beyond September 2
2021/08/29 0:00:00,Budget food hacks from Tik Tok cooking star Nathan Lyons
2021/08/29 0:00:00,2021 Genesis G70 3.3T review: New luxury sedan is packed with value
2021/08/29 0:00:00,Sydney auctions: record sale in Cherrybrook deemed the ‘new normal’
2021/08/29 0:00:00,"Liverpool held by 10-man Chelsea, Man City pile on misery for Arsenal"
2021/08/29 0:00:00,US Marine Nicole Gee pictured cradling Afghan baby before her death in Kabul terror attack
2021/08/29 0:00:00,Christian church leaders lobby Morrison government to boost Afghan refugee intake
2021/08/29 0:00:00,Retro Sunshine home on massive block listed for $1.5m+
