date,title
2021/03/13 0:00:00,Kerry Parnell: Royal Family members as Disney princesses
2021/03/13 0:00:00,Sarah Everard: Wayne Couzens appears in court over 33yo’s death
2021/03/13 0:00:00,Michael Zerafa eyes Tim Tszyu after ending Anthony Mundine’s boxing career
2021/03/13 0:00:00,Rolling coverage: City office blocks remain empty as workers choose to stay home
2021/03/13 0:00:00,F1 pre-season testing: Dan Ricciardo maintains the rage while Lewis Hamilton shock with ‘rare’ mistake
2021/03/13 0:00:00,Cowboys bench Jason Taumalolo as tactic slammed in Panthers thrashing
2021/03/13 0:00:00,Roosters send ‘scary’ message with all-time round one thrashing of Manly
2021/03/13 0:00:00,Morphettville races: Trainer Travis Doudle eyes Port Adelaide Guineas with Casino Seventeen
2021/03/13 0:00:00,All-Star Mile winner Mugatoo makes dream home a reality for ambassador Matt Forys
2021/03/13 0:00:00,Roosters’ Jake Friend suffers scary head injury amid concussion fears
2021/03/13 0:00:00,Gold Coast races: Sweet Dolly wins 2YO Jewel
2021/03/13 0:00:00,Health authorities contacting recent arrivals into Tasmania from Brisbane
2021/03/13 0:00:00,All-Star Mile: Mugatoo gets the better of Russian Camelot in battle of wet-trackers
2021/03/13 0:00:00,Jennifer Lopez and Alex Rodriguez deny breakup rumours
2021/03/13 0:00:00,‘World-class’ Addin Fonua-Blake shows Titans big money stars how it’s done
2021/03/13 0:00:00,Krone wins Coolmore Classic to continue her stunning autumn rise
2021/03/13 0:00:00,"Sydney auctions: family ‘blown away’ after getting nearly $500,000 over reserve"
2021/03/13 0:00:00,AFLW 2021: Full teams and expert tips for Round 7
2021/03/13 0:00:00,Duncan Lay: WandaVision’s small-screen success proves Disney’s evil plan
2021/03/13 0:00:00,Join the NRL’s State of Mind program to get physically and mentally fit
2021/03/13 0:00:00,New York senators join chorus for governor Andrew Cuomo to resign amid sexual harassment claims
2021/03/13 0:00:00,"Virus warning for 14 Melbourne suburbs, border to remain open to Queensland"
2021/03/13 0:00:00,"Samantha Armytage, Candice Warner shine in Chandon Ladies Day for McGrath Foundation"
2021/03/13 0:00:00,Anthony Mundine vs Michael Zerafa live: Staggering two-minute knockout ends Mundine
2021/03/13 0:00:00,Coronavirus crisis: Brisbane COVID-19 threat prompts pre-election day emergency meeting in WA
2021/03/13 0:00:00,High school basketball commentators slur ‘why they kneel’
2021/03/13 0:00:00,‘No surgery for now’: Dan Andrews out of intensive care
2021/03/13 0:00:00,Riverside Belmont home smashes suburb’s top auction price
2021/03/13 0:00:00,Mugatoo wins the 2021 All-Star Mile
2021/03/13 0:00:00,Shaquero and Arcaded win final Golden Slipper qualifiers at Rosehill Gardens
2021/03/13 0:00:00,Grandslam bound for Australian Derby after easy win in the Alister Clark Stakes
2021/03/13 0:00:00,‘Shame on him’: Announcer slammed for ‘disturbing’ Simmons comment
2021/03/13 0:00:00,Am I alone? Girl In The Walls writer AJ Gnuse on houses and fear
2021/03/13 0:00:00,Warriors perform classy welcome ceremony before NRL season opener
2021/03/13 0:00:00,Krone wins the Coolmore Classic
2021/03/13 0:00:00,Eco-friendly cleaner that costs 18 cents to make
2021/03/13 0:00:00,Sydney teen charged with animal cruelty over alleged bird stomp
2021/03/13 0:00:00,Anthony Mackie and Sebastian Stan reveal their biggest fears for The Falcon and the Winter Soldier
2021/03/13 0:00:00,Sunrise host David Koch says texting and social media are good for kids’ literacy
2021/03/13 0:00:00,"Man stole 180kg playground slide for kid’s bunk bed, cops say"
2021/03/13 0:00:00,Sword Of State connections weigh up late charge for Golden Slipper
2021/03/13 0:00:00,Genie Bouchard gets her wish by breaking agonising dry spell
2021/03/13 0:00:00,Anthony Mundine will finally bring down the curtain on his hyped fight career in an anonymous fight
2021/03/13 0:00:00,Little Creatures Brewery neighbour attracts $100K premium at auction
2021/03/13 0:00:00,Oprah Winfrey memes dubbed ‘digital blackface’ after epic Meghan and Harry interview
2021/03/13 0:00:00,"Woman charged over drugs, weapons following police pursuit"
2021/03/13 0:00:00,Truth about Justin Olam’s inexplicable brain explosion
2021/03/13 0:00:00,Anthony Mundine vs Michael Zerafa: What time does their fight start?
2021/03/13 0:00:00,Everything you need to know about Brisbane COVID warning
2021/03/13 0:00:00,Four arrested in alleged Sydney coke ring bust
2021/03/13 0:00:00,Anthony Mundine vs Michael Zerafa: How to watch boxing blockbuster
2021/03/13 0:00:00,Alleged attackers described as ‘gutless’ after brutal bashing of boy sitting in skate park
2021/03/13 0:00:00,US Mexico border: footage shows people smugglers crossing Rio Grande
2021/03/13 0:00:00,Lights literally go out on Australian rugby
2021/03/13 0:00:00,Boxing 2021: Dennis Hogan believes raging favourite Tim Tszyu has made a big mistake ahead of blockbuster fight
2021/03/13 0:00:00,Federal Health Minister Greg Hunt discharged from hospital
2021/03/13 0:00:00,Anthony Mundine brings down the curtain on his hyped fight career
2021/03/13 0:00:00,Dramatic video shows massive fire engulfing cruise ship docked in Corfu
2021/03/13 0:00:00,WRA Country Championships Qualifier analysis
2021/03/13 0:00:00,"Volleyball player fired, sued after getting pregnant"
2021/03/13 0:00:00,Movements of Brisbane doctor who caught coronavirus revealed
2021/03/13 0:00:00,Woman found dead inside burned Canberra home
2021/03/13 0:00:00,Coach accuses Eels of blatant disrespect in win over Broncos
2021/03/13 0:00:00,Hilary Duff says she’s experiencing ‘traumatic lightning crotch’ during third pregnancy
2021/03/13 0:00:00,Meghan Markle’s close confidant shares ‘leaked’ email to back her claims against Kensington Palace
2021/03/13 0:00:00,Breakthrough in hunt for driver who allegedly struck six-year-old boy
2021/03/13 0:00:00,Model Brenda Patea gives birth to Alexander Zverev’s daughter
2021/03/13 0:00:00,"Disgraced Theranos founder Elizabeth Holmes is pregnant, delaying fraud trial"
2021/03/13 0:00:00,Michele Bootes injured in shark attack off Merimbula beach on NSW south coast
2021/03/13 0:00:00,Tom Brady extends his stay in Tampa Bay to chase another Super Bowl ring
2021/03/13 0:00:00,Cricket world goes wild over ‘greatest shot ever played’
2021/03/13 0:00:00,Queen speaks for first time since Harry and Meghan row as she’s delighted watching NASA’s Mars footage
2021/03/13 0:00:00,Rise in caravan scams in Victoria after lockdown
2021/03/13 0:00:00,NSW’s cheapest suburbs and towns: where you can pay off a house for $250 a week or less
2021/03/13 0:00:00,China reports Australia to the UN for ‘human rights violations’ in offshore detention centres
2021/03/13 0:00:00,Police officer Wayne Couzens charged with murder and kidnap of Sarah Everard
2021/03/13 0:00:00,KFC SuperCoach 2021: Quick guide to picking a winning team
2021/03/13 0:00:00,Xerri looking to live up to his breeding at Sunshine Coast
2021/03/13 0:00:00,Victorian camper killed in freak tree branch fall
2021/03/13 0:00:00,"Preview, tips and Best Bets for Sunshine Coast Sunday 14th March"
2021/03/13 0:00:00,"Reports Jennifer Lopez and Alex Rodriguez break up, call off two-year engagement"
2021/03/13 0:00:00,Wild photos of apocalyptic sandstorm during F1 testing
2021/03/13 0:00:00,World Health Organisation says AstraZeneca COVID-19 vaccine OK to use despite blood clot fears
2021/03/13 0:00:00,Pledge to distribute a billion COVID-19 vaccines after historic Quad meeting
2021/03/13 0:00:00,Stephen Coniglio reflects as brutal axing made public
2021/03/13 0:00:00,Former Australian finance Minister Mathias Cormann elected head of OECD
2021/03/13 0:00:00,"Stargate SG-1 actor Cliff Simon, 58, dies in tragic kiteboarding accident"
2021/03/13 0:00:00,UFC fighter Jimmy Crute is no longer living in a van following a string of exciting UFC wins
2021/03/13 0:00:00,"Saturday Herald Sun the best way to start the weekend, according to emma data"
2021/03/13 0:00:00,Where you can pay off a house for $250 a week: Most affordable Victorian suburbs and towns
2021/03/13 0:00:00,Kim Ravaillion slams Collingwood for ‘s***ty lies’ amid Adam Treloar saga
2021/03/13 0:00:00,"Man stabbed multiple times in street robbery in Wollongong, New South Wales"
2021/03/13 0:00:00,NRL legend ambushed in live TV cross ‘circus’
2021/03/13 0:00:00,Daniel Ricciardo the fastest driver in opening session of pre-season testing
2021/03/13 0:00:00,Lap up a piece of lakeside paradise at 44 McDonald Grove West Lakes
2021/03/13 0:00:00,Top tips for buying in a popular school zone in Melbourne
2021/03/13 0:00:00,Recruiters reveal: Is it ever OK to lie in a job interview?
2021/03/13 0:00:00,Maserati Ghibli Trofeo review: Is this the end of the V8 sedan?
2021/03/13 0:00:00,2021 Sydney Easter Show’s Royal Cat Show competition is fierce
2021/03/13 0:00:00,SBS reporter’s double life as a wellness influencer exposed
2021/03/13 0:00:00,The Queen’s response to Meghan and Harry’s interview is not good enough
2021/03/13 0:00:00,Sarah Everard: Human remains found in woods belong to missing woman
2021/03/13 0:00:00,Mathias Cormann elected next secretary-general of OECD
2021/03/13 0:00:00,Victorian rental reforms: Changes could spur landlords to sell up
2021/03/13 0:00:00,End of an era for Allan’s House in Cammeray as it sells to a young family for $3 million
