date,title
2021/07/15 0:00:00,Anti-lockdown protesters storm Melbourne hours after Daniel Andrews’ announcement
2021/07/15 0:00:00,Daniel Ricciardo’s McLaren team rocked by positive Covid-19 case
2021/07/15 0:00:00,Fremantle home crowd joins together for ‘beautiful’ moment during match against Geelong
2021/07/15 0:00:00,"Australians react to lockdown, compares Victoria to NSW"
2021/07/15 0:00:00,NRL players’ families in limbo after Queensland government backflip
2021/07/15 0:00:00,‘We didn’t learn’: Expert’s frank admission about Sydney lockdown
2021/07/15 0:00:00,Olympics 2021: Mack Horton and Madi Wilson among Aussies using sauna suit to prepare for Tokyo
2021/07/15 0:00:00,Boy found safe and well following amber alert
2021/07/15 0:00:00,Lisa Wilkinson admits Sydney has failed ‘test’ for lockdowns
2021/07/15 0:00:00,"Tradies and supplies shortages drive up prices, massively push out wait times for building work"
2021/07/15 0:00:00,A-League: John Aloisi signs two-year coaching deal with Western United
2021/07/15 0:00:00,S.Africa calls up army reserves in bid to crush looting
2021/07/15 0:00:00,NRL: Melbourne Storm scramble in response to Covid-19 outbreak
2021/07/15 0:00:00,Muhammad Khan admits repeated vile public sex acts on women
2021/07/15 0:00:00,Melissa Doyle opens up about her struggles on Sunrise
2021/07/15 0:00:00,Ben Hunt reveals he was invited to infamous Dragons BBQ
2021/07/15 0:00:00,Burglar rappels down garden hose to steal power tools from Bunnings in Mission Impossible-style heist
2021/07/15 0:00:00,Opals coach’s hope for Liz Cambage ahead of Tokyo Olympics
2021/07/15 0:00:00,Bindi Irwin returns to social media
2021/07/15 0:00:00,Underrated Steely flying the flag for Gerald Ryan and Sterling Alexiou stable
2021/07/15 0:00:00,Daniel Andrews makes subtle dig at NSW when announcing Victoria’s snap lockdown
2021/07/15 0:00:00,AFL Teams: Adelaide Crows confirm huge boost after hitting all-time low
2021/07/15 0:00:00,Former AFL star Dane Swan lets rip at covid rule-breakers in rant
2021/07/15 0:00:00,"South African government asks for 25,000 troops to curb unrest"
2021/07/15 0:00:00,Lockdown home renovations: the perfect time to reinvigorate and refresh your home – here’s how
2021/07/15 0:00:00,NSW’s Covid exposure sites list grows again with 37 new alerts
2021/07/15 0:00:00,Melbourne’s fifth lockdown: Why next five days are critical
2021/07/15 0:00:00,Millie Bobby Brown slams TikToker for ‘dishonest’ sex claims
2021/07/15 0:00:00,"SEEK, Nine, Dominos to pay back JobKeeper but calls for others to come forward"
2021/07/15 0:00:00,"States slam borders shut to Victoria, Trans Tasman bubble halted"
2021/07/15 0:00:00,The artist (again) known as Chet Faker on the mystery of his Hotel Surrender album and long Covid
2021/07/15 0:00:00,Melbourne’s Covid-19 outbreak threatens to crash Jack Riewoldt’s party
2021/07/15 0:00:00,Scott Morrison has announced financial aid for Victorians who have lost work due to the lockdown
2021/07/15 0:00:00,Mona Vale beach house sells in six days for about $1 million above its price guide
2021/07/15 0:00:00,‘Harsh warning’ becomes reality as South Australia imposes new Covid restrictions
2021/07/15 0:00:00,Randwick: Annabel Neasham on march for more success with import Blue Soldier to cap stunning season
2021/07/15 0:00:00,Gunpowder Milkshake review: Fizzy confection of an action thriller
2021/07/15 0:00:00,Tokyo Olympics 2021: Boomers on high alert after Team USA is star struck down with Covid scare
2021/07/15 0:00:00,Photo of Blues celebration reveals State of Origin’s ‘huge shame’
2021/07/15 0:00:00,Former House Rules star David Clarson found alive after two-day bush search
2021/07/15 0:00:00,"Australian sharemarket in the red, weighed down by tech, healthcare, bank and travel stocks"
2021/07/15 0:00:00,What Melbourne’s fifth lockdown means for real estate
2021/07/15 0:00:00,Garry Lunn confident Ollivander can notch back-to-back wins at Dubbo after ending long drought
2021/07/15 0:00:00,"Victoria Covid updates: Melbourne to go into snap lockdown as ‘active, aggressive’ outbreak grows"
2021/07/15 0:00:00,Police officer guilty of failing to investigate rapist Anthony Sampieri over menacing phone calls
2021/07/15 0:00:00,China weighs risk and reward in a Taliban-led Afghanistan
2021/07/15 0:00:00,Russia races to build giant ice-breakers for Arctic dominance
2021/07/15 0:00:00,NRL: Brisbane Broncos tie down Jake Turpin until end of 2022
2021/07/15 0:00:00,Tammy Hembrow reveals insane transformation
2021/07/15 0:00:00,Quick emergency payments will be available from the get-go for future lockdowns nationwide
2021/07/15 0:00:00,"Slight cough reason Ryan family stayed home after Tanami mine infection, saved SA from lockdown"
2021/07/15 0:00:00,China’s abandoned debt traps costing nations billions
2021/07/15 0:00:00,AstraZeneca: Everything you need to know about the vaccine
2021/07/15 0:00:00,Mum’s Bunnings party hack with Coles item saves $300
2021/07/15 0:00:00,‘I will bash them’: Jamil Hopoate’s verbal tirade before he assaulted partner revealed
2021/07/15 0:00:00,Supreme Court overturns prison sentence for ‘selfish’ man who breached self-quarantine to ‘see a girl’
2021/07/15 0:00:00,Top jockey Michael Rodd set for return after two-month battle with illness
2021/07/15 0:00:00,Bellawongarah home built for Australian arts legend Barbara Blackman comes to market
2021/07/15 0:00:00,Oaklands Plate: Surprise packet Belle Of Yorkes chasing stakes win at Morphettville Parks
2021/07/15 0:00:00,NRL: Former Sharks coach John Morris joins Rabbitohs as assistant coach
2021/07/15 0:00:00,Michael Maguire tears up over Wests Tigers’ horror NRL season
2021/07/15 0:00:00,Documentary reveals chef Anthony Bourdain’s rise to fame and final days
2021/07/15 0:00:00,Olympics 2021: Opals ready to send Liz Cambage ‘out with a bang’ if she decides Tokyo is the end
2021/07/15 0:00:00,Katy Perry and Miranda Kerr show how close they are with loved-up video
2021/07/15 0:00:00,Montefilia ready to step out for trial at Rosehill on Friday
2021/07/15 0:00:00,Desperate search for oxygen in Myanmar as latest Covid wave hits
2021/07/15 0:00:00,The series in the West Indies is lost but Mitch Marsh put on a power-hitting display for Australia who won game four
2021/07/15 0:00:00,"Eastern suburbs teens breach lockdown, travel 280km from Sydney outbreak"
2021/07/15 0:00:00,Man dies after being mauled by a shark at a beach in Brazil
2021/07/15 0:00:00,"Weekly Horoscopes: What’s in store July 19-25, 2021"
2021/07/15 0:00:00,Hailey Baldwin sets record straight on Justin Bieber ‘yelling’ video
2021/07/15 0:00:00,Three more Thai islands open to vaccinated travellers
2021/07/15 0:00:00,Fed-up tradie exposes common illegal dumping problem
2021/07/15 0:00:00,YouTube comedian Friendlyjordies raises $1m for John Barilaro defamation case
2021/07/15 0:00:00,Wallabies coach Dave Rennie rings the changes as Australia must beat France to win the series
2021/07/15 0:00:00,Woman rescued after car plunges 100m down cliff on treacherous Tasmanian road
2021/07/15 0:00:00,Sennheiser CX True Wireless review: Great affordable headphones
2021/07/15 0:00:00,15 best Australian shoe brands to invest in for 2022
2021/07/15 0:00:00,Australia’s inflation rate could skyrocket as US CPI rises
2021/07/15 0:00:00,‘Unreal’: NBA world stunned by Giannis Antetokounmpo’s epic move
2021/07/15 0:00:00,Mexico announces new plan to protect near-extinct porpoise
2021/07/15 0:00:00,Lamar Odom: Tristan Thompson feud ‘could have turned ugly’
2021/07/15 0:00:00,Victoria to enter fifth lockdown at midnight
2021/07/15 0:00:00,Terrifying moment two women fall off swing on the edge of 1830m cliff when chain snaps
2021/07/15 0:00:00,WTO convenes trade ministers to net fisheries deal
2021/07/15 0:00:00,"Raceday focus: Best bets, inside mail for Dubbo and Taree on Friday"
2021/07/15 0:00:00,Melbourne friends’ hair idea makes $7 million in first six months
2021/07/15 0:00:00,Sydney woman unable to buy house with $88k savings turns to bank of mum and dad
2021/07/15 0:00:00,Melbourne Cup favourite Incentivise faces Covid transport headache
2021/07/15 0:00:00,Brisbane international airport worker infectious for three days at work
2021/07/15 0:00:00,Aged care job ads up 21 per cent during Covid lockdowns
2021/07/15 0:00:00,Virus cluster at Japan hotel hosting Brazilian Olympians
2021/07/15 0:00:00,"Bendigo, Ballarat, Geelong, Mildura and Shepparton among Victoria’s tightest housing markets"
2021/07/15 0:00:00,Australia avoids series whitewash after Mitchell Marsh’s all-round heroics
2021/07/15 0:00:00,Europe wants to ban petrol and diesel cars by 2035
2021/07/15 0:00:00,"Tokyo Olympics 2021: Full schedule, how to watch Australia’s best medal hopes"
2021/07/15 0:00:00,Brad Hazzard says NSW will ‘review’ Pfizer vaccine eligibility advice after supply increase
2021/07/15 0:00:00,7 signs you’re dating an emotional abuser and what to do about it
2021/07/15 0:00:00,Redbridge Council launches investigation after actor in monkey suit with fake penis encourages kids to read
2021/07/15 0:00:00,When will Gossip Girl episode 2 come out in Australia?
2021/07/15 0:00:00,Item in Richard Branson’s kitchen raises eyebrows and distracts from space launch announcement
2021/07/15 0:00:00,Ethical Australian labels to add to your wardrobe rotation
2021/07/15 0:00:00,Relationship Rehab: Woman’s ‘infuriating’ issue with husband
2021/07/15 0:00:00,How your wardrobe is silently increasing your expenses
2021/07/15 0:00:00,Sydney man with autism launches chocolate business in lockdown
2021/07/15 0:00:00,"Deirdre Naughton, daughter Leela identified as victims of fatal Tallarook house fire"
2021/07/15 0:00:00,Melbourne is no longer a safe haven for Super Netball with the competition on the move amid an escalating crisis
2021/07/15 0:00:00,NBA executives watch as ‘special’ Aussie talent Josh Giddey nails  final draft audition
2021/07/15 0:00:00,Winter polar blast to send temperatures plummeting across south eastern Australia
2021/07/15 0:00:00,Dotti fashion group manager Deanna Moylan lists renovated South Yarra family home
2021/07/15 0:00:00,"Darling Point apartment sells for $10,095,000, $1.5m over reserve at online auction"
2021/07/15 0:00:00,‘RIP Serge’: Carlton legend Serge Silvagni dead at 83
2021/07/15 0:00:00,Flemington: Enver Jusufovic targets another win with Lindhout
2021/07/15 0:00:00,$8m Powerball to jackpot again after no division one winners
2021/07/15 0:00:00,Woman’s agony after ‘falling into mouldy swimming pool’ on Greece holiday
2021/07/15 0:00:00,"Brazil's Bolsonaro in hospital, may need surgery: govt"
2021/07/15 0:00:00,Power Boom to race at Eagle Farm for Tom Rockliff and Port Adelaide teammates
2021/07/15 0:00:00,On-set secrets from Australian Survivor’s toughest season ever
2021/07/15 0:00:00,Almost three-quarters of Australians say they will get vaccinated: ABS
2021/07/15 0:00:00,Harry and Meghan’s money pressures over Netflix and Spotify deals
2021/07/15 0:00:00,NSW star Latrell Mitchell says even club teammates are fair game in Origin after his battle with Queensland’s Dane Gagai
2021/07/15 0:00:00,Chrissy Teigen says she’s depressed and ‘lost’ after bullying scandal
2021/07/15 0:00:00,"Unemployment down to 4.9 per cent, its lowest level in a decade"
2021/07/15 0:00:00,AFL great Gavin Wanganeen on being a role model and his plan to win Survivor
2021/07/15 0:00:00,Megan Fox says Donald Trump ‘a legend’ at Conor McGregor fight
2021/07/15 0:00:00,Foe to friend: Fishermen join fight to save endangered Pakistan dolphin
2021/07/15 0:00:00,Man’s penis rots after being wrapped in rubber bands for three days
2021/07/15 0:00:00,The new kids on their blocks at the Tokyo Games
2021/07/15 0:00:00,Retail boss says it’s ‘irresponsible to stay open’ amid Sydney’s Covid lockdown
2021/07/15 0:00:00,Gladys Berejiklian hammered over Sydney lockdown in tense confrontation with Sky News reporter Andrew Clennell
2021/07/15 0:00:00,"Qld extends restrictions, warns against Melbourne travel"
2021/07/15 0:00:00,Honeymooners fined for touching endangered monk seal in Hawaii
2021/07/15 0:00:00,Comedian Jon-Bernard Kairouz correctly predicts NSW Covid cases for a second consecutive day
2021/07/15 0:00:00,Most common mistakes people make during job interviews
2021/07/15 0:00:00,More than 70 Sydney lockdown suburbs listed as ‘increased concern’ of Covid-19 outbreak
2021/07/15 0:00:00,Scott Morrison addresses Engadine McDonald’s rumour on Kyle and Jackie O
2021/07/15 0:00:00,Britney Spears wins right to new lawyer in battle to remove dad
2021/07/15 0:00:00,NSW captain James Tedesco has no regrets over decision to take long shot for goal
2021/07/15 0:00:00,"British Open ready for 'emotional' return in front of 32,000 fans"
2021/07/15 0:00:00,Apprentice jockey Madison Lloyd rejuvenated after moving to Ballarat and is now riding winners again
2021/07/15 0:00:00,Mr Inbetween season finale: Will there be a season 4?
2021/07/15 0:00:00,"Flemington races: Mathew Ellerton and Simon Zahra stable lockdown lifted, Damien Oliver out"
2021/07/15 0:00:00,AFL: Star young Carlton forward Charlie Curnow could be back this season after two years of injury dramas
2021/07/15 0:00:00,Naked woman rescued after becoming trapped between two buildings
2021/07/15 0:00:00,"Cuba restores internet access after protests, but not social media"
2021/07/15 0:00:00,Lions suffer first tour loss in South Africa despite comeback
2021/07/15 0:00:00,"US capital gets its own, petite Statue of Liberty"
2021/07/15 0:00:00,"Qld records three new local cases after new exposure sites listed, restrictions to ease"
2021/07/15 0:00:00,65 new locally acquired Covid-19 cases diagnosed in NSW
2021/07/15 0:00:00,What it‘s like for Sydney Covid patients in St Vincent’s ICU
2021/07/15 0:00:00,UN warns of 'perfect storm' as childhood vaccination plummets
2021/07/15 0:00:00,GM warns Bolt owners after two cars catch fire
2021/07/15 0:00:00,Foresters Beer and Music Hall sells to New Guernica bar operator
2021/07/15 0:00:00,"Fitness influencer, 23, dies after operation to reduce underarm sweating"
2021/07/15 0:00:00,Simiona Tuteru: Connect Logistics boss to stand trial over Eastern Freeway crash
2021/07/15 0:00:00,The Bachelor’s Jimmy Nicholson reveals why he cracked the ‘sh*ts’
2021/07/15 0:00:00,Federal government waives gap fees for NSW parents who keep their kids at home
2021/07/15 0:00:00,Mum reveals how she remembers seven kids’ birthdays
2021/07/15 0:00:00,Qld mum did not take dying daughter to hospital because she thought God would heal her
2021/07/15 0:00:00,Demi Moore enjoys beach day with daughter Rumer Willis
2021/07/15 0:00:00,Influencer who fell to her death made chilling final post before fall
2021/07/15 0:00:00,NSW loses its chance of a 3-0 series win but coach Brad Fittler says it wasn’t the fault of new halfback Mitch Moses
2021/07/15 0:00:00,Lead singer gets 28 years prison for raping girls as young as 12
2021/07/15 0:00:00,Chaos for Melbourne passengers as WA border shuts minutes before plane lands
2021/07/15 0:00:00,Former Channel 7 game show host Andrew O’Keefe lists North Bondi home
2021/07/15 0:00:00,Carrie Bickmore fumes over new lockdown rule on The Project: ‘I was amazed’
2021/07/15 0:00:00,London’s Fortnum and Mason selling $46 vegan chips
2021/07/15 0:00:00,Australian TV host blasts ‘national disgrace’ amid Covid double standards
2021/07/15 0:00:00,Coronavirus in SA: New Tailem Bend exposure site identified as Grant Stevens issues ‘harsh warning’ to SA
2021/07/15 0:00:00,JoJo Siwa reveals celebrity who made her realise she was gay
2021/07/15 0:00:00,Aldi trialling baskets at select supermarkets
2021/07/15 0:00:00,Arnott’s launches new range of gluten-free biscuits
2021/07/15 0:00:00,"‘It’s disgusting, corrupt’: Joe Rogan slams Olympics in angry rant"
2021/07/15 0:00:00,"‘Throw the book’ at Sydney removalists who spread virus into Victoria, health authorities say"
2021/07/15 0:00:00,Britney Spears rails against her father in emotional new court hearing
2021/07/15 0:00:00,Victoria’s Secret shopper filmed allegedly lunging at customer
2021/07/15 0:00:00,$950m detail in Messi’s new Barcelona contract revealed
2021/07/15 0:00:00,Chinese surveillance ship Tianwangxing one of many ways China ‘listening in’: Barnaby Joyce
2021/07/15 0:00:00,Epidemiologist says Melbourne lockdown ‘reasonable’ as Covid-19 cases spike
2021/07/15 0:00:00,Sydney nurse at Westmead hospital tests positive for covid
2021/07/15 0:00:00,Queensland coach Paul Green deflects Origin question on everyone’s lips
2021/07/15 0:00:00,New Cupra Born electric car tipped for Australian launch
2021/07/15 0:00:00,"Victoria’s Covid-19 outbreak grows to 18, including new cases at the MCG"
2021/07/15 0:00:00,Meghan Markle announces production on new Netflix animated series ‘Pearl’
2021/07/15 0:00:00,Andrew Johns caught in Origin hot mic sledge
2021/07/15 0:00:00,Hollywood actor to replace Sharon Osbourne on The Talk
2021/07/15 0:00:00,NSW Health defends decision to let elite Sydney schoolboys escape lockdown
2021/07/15 0:00:00,Meghan’s friend seemingly ignores Kate and William at Ash Barty Wimbledon final
2021/07/15 0:00:00,"Coles, health club and rowing club added to Victoria’s list of exposure sites"
2021/07/15 0:00:00,AFL star Jaidyn Stephenson says Covid-19 is a media beat-up
2021/07/15 0:00:00,"Britney Spears’ controversial former manager Sam Lutfi apologises, admits he ‘failed her’"
2021/07/15 0:00:00,Live Breaking News: Victoria plunged into snap-lockdown as outbreak grows to 18 covid cases
2021/07/15 0:00:00,"‘Never forget’: Maroons, DCE savagely booed on Queensland soil"
2021/07/15 0:00:00,Roxy Jacenko says police officers came to her door to check a Covid breach tip-off after she was dobbed in again
2021/07/15 0:00:00,US to evacuate Afghan interpreters as Taliban seize border town
2021/07/15 0:00:00,"Kourtney Kardashian, Travis Barker fuel engagement rumours after Las Vegas trip"
2021/07/15 0:00:00,"Victoria issues new Covid rules after teacher tests positive, cases rise"
2021/07/15 0:00:00,Three neighbouring Penrith homes on the market with DA plans for 38 apartments
2021/07/15 0:00:00,"Woolies, pharmacy, BP, Guzman Y Gomez and airport added to list of  exposure sites"
2021/07/15 0:00:00,The SA locations where it’s cheaper to pay off a mortgage than rent
2021/07/15 0:00:00,Kevin Durant ‘blown away’ by NBA 2K22 cover honour alongside legends
2021/07/15 0:00:00,#FreeBritney: online army rallies behind 'silenced' Spears
2021/07/15 0:00:00,George W. Bush warns US withdrawal from Afghanistan will have ‘unbelievably bad’ consequences
2021/07/15 0:00:00,ECB inches closer to 'digital euro'
2021/07/15 0:00:00,"Warming, deforestation turn Amazon into source of CO2"
2021/07/15 0:00:00,Pregnant woman tested positive for covid after Caesarean at Liverpool Hospital
2021/07/15 0:00:00,"Brighton dream home has underground nightclub, bar and lounge looking into pool"
2021/07/15 0:00:00,"Lake Connewarre, Leopold lifestyle property attracts four bidders"
