date,title
2021/10/26 0:00:00,Queen Elizabeth back to work with first official engagements after hospital stay
2021/10/26 0:00:00,Sam Clipperton still a chance to ride in Golden Eagle despite broken jaw
2021/10/26 0:00:00,Crew were shooting live rounds before Halyna Hutchins was killed
2021/10/26 0:00:00,Tasmanian mares Still A Star and Mystic Journey ready to strike in Empire Rose
2021/10/26 0:00:00,Scott Morrison pitches climate plan in late night interview
2021/10/26 0:00:00,Final show in France for looted Benin treasures
2021/10/26 0:00:00,Energy Minister Angus Taylor grilled over new emissions reduction ‘plan’
2021/10/26 0:00:00,Fans roast Mike Tyson statue as fight as plot thickens for next fight.
2021/10/26 0:00:00,Mission Zero: Bid to save Australia’s marine habitats with blue carbon
2021/10/26 0:00:00,Firearms expert says ‘buck stops with Alec Baldwin’ in tragic film set shooting
2021/10/26 0:00:00,TAB secure the services of champion trainer Jason Thompson for inaugural The Phoenix
2021/10/26 0:00:00,Police cleared of wrongdoing after Aboriginal teenager seriously injured during Sydney arrest
2021/10/26 0:00:00,‘Extraordinary’: Brazilian women’s side pulls off miraculous one-run victory over Canada
2021/10/26 0:00:00,Axed Matildas coach Alen Stajcic lands surprising new role
2021/10/26 0:00:00,"Qld cops, health workers fighting Covid jab mandate granted temporary lifeline by court"
2021/10/26 0:00:00,ABC board not consulted over decision to cover journalist’s legal costs
2021/10/26 0:00:00,Victoria Derby barrier draw: Fred Kersley fired up to win  after near miss last year
2021/10/26 0:00:00,"Rescued from extinction, bison rediscover Romania mountains"
2021/10/26 0:00:00,Knights add Andrew Johns to coaching staff amid Mitchell Pearce drama
2021/10/26 0:00:00,Hunger forces Afghans to sell young daughters into marriage
2021/10/26 0:00:00,Steve Smith backs Aaron Finch and David Warner to fire after horror start
2021/10/26 0:00:00,Racing Victoria in race against the clock to fix CT scanner for Melbourne Cup runners
2021/10/26 0:00:00,Japan's princess Mako marries years after 'pain' of rumours
2021/10/26 0:00:00,Travel Deal Tuesday: Massive Bali sail for less than $300 return
2021/10/26 0:00:00,Perth royal commission: Crown Resorts’ chief ‘confident’ in promoted executive who was high up during scandalous era
2021/10/26 0:00:00,Health officials say certain groups of Victorians are most at risk of Covid
2021/10/26 0:00:00,A wide draw hasn’t dented trainer Joe Pride’s faith in his star four-year-old Private Eye
2021/10/26 0:00:00,New Audi RS3 hot hatch brings supercar thrills
2021/10/26 0:00:00,Gladys Berejiklian told chief of staff in 2018 relationship with Daryl Maguire was in the past: ICAC
2021/10/26 0:00:00,Success in The Four Pillars will be bittersweet for cancer survivor Felicity Krzanic
2021/10/26 0:00:00,Palaszczuk government ‘urgently’ rushes amendment to avoid CHO double-dipping on pension fund
2021/10/26 0:00:00,"Women working in STEM are underpaid and want to leave the industry, according to new report"
2021/10/26 0:00:00,Steve Smith says he’s ‘glad’ Ben Stokes is returning in time for the Ashes
2021/10/26 0:00:00,Master trainer Gai Waterhouse warns Melbourne Cup hope Sir Lucan could be ‘a preparation away’
2021/10/26 0:00:00,New television deal to take harness racing’s premier event to a wider audience
2021/10/26 0:00:00,"Samsung boss convicted, fined for anaesthetic misuse"
2021/10/26 0:00:00,Jacinda Ardern responds to accusation she ‘barged’ sign language interpreter out of the way
2021/10/26 0:00:00,James Weir recaps SAS Australia: Hell Week finale
2021/10/26 0:00:00,Asia suffered hottest year on record in 2020: UN
2021/10/26 0:00:00,Major warm-up for Australian Open tennis cancelled again over virus
2021/10/26 0:00:00,Organizers take first step to unionize at Amazon New York warehouse
2021/10/26 0:00:00,Albanian artist offers 'therapy' with portraits painted in coffee
2021/10/26 0:00:00,Barnaby makes incoherent speech and thanks Labor MP in odd Question Time appearance
2021/10/26 0:00:00,Australian sharemarket closes barely changed again as investors remain ‘tentative’
2021/10/26 0:00:00,Bizarre reason Floyd Mayweather rejected fan’s photo request
2021/10/26 0:00:00,Antlers review: Horror movie becomes too muddled with too many allegories
2021/10/26 0:00:00,Social media star Jayne Rivera slammed over ‘vile’ Instagram post
2021/10/26 0:00:00,Best Gold Coast Hotels for your next Queensland holiday
2021/10/26 0:00:00,Expert team formed to hunt Covid origin will be met with resistance
2021/10/26 0:00:00,Sydney man’s descent into QAnon and how he got out
2021/10/26 0:00:00,Mixed barrier fortunes for the favourites ahead of Saturday’s Golden Eagle
2021/10/26 0:00:00,Police officer at scene of fatal hit and run discovers the victim is her father
2021/10/26 0:00:00,Blow to China’s $82 trillion property industry could impact Australia
2021/10/26 0:00:00,Classique Legend Stakes: Gai Waterhouse and Adrian Bott target late spring riches with Dawn Passage
2021/10/26 0:00:00,TikTok user reveals air fryer cleaning hack
2021/10/26 0:00:00,‘Bleak’ outlook for first home buyers in Australia but much depends on how re-opening is managed
2021/10/26 0:00:00,Golden Eagle imports Laws Of Indices and Reve De Vol take Annabel Neasham’s mind off Cox Plate disappointment
2021/10/26 0:00:00,Woman reveals supermarket aisle hack to save money
2021/10/26 0:00:00,Netflix to defy Prince William’s plea to never again air Diana’s Panorama interview
2021/10/26 0:00:00,Former Ireland bowler Kim Garth produces best bowling performance in WBBL history
2021/10/26 0:00:00,Cleo Smith’s mum and stepdad deny having anything to do with her mystery disappearance
2021/10/26 0:00:00,Scott Morrison faces questions over his net zero ‘plan’
2021/10/26 0:00:00,"Victoria’s proposed pandemic laws could see rulebreakers fined $90,000, jailed for two years"
2021/10/26 0:00:00,"Jarrod Mullen getting a 'few nibbles’, eyes NRL return"
2021/10/26 0:00:00,‘Haven’t read it’: Bridget McKenzie confesses she hasn’t read climate plan
2021/10/26 0:00:00,How switching super funds could make a $261k difference in retirement
2021/10/26 0:00:00,"Preview, Tips and Best Bets for Ipswich Wednesday"
2021/10/26 0:00:00,Daughter reveals how years of abuse led to mum stabbing dad
2021/10/26 0:00:00,Wallabies’ SOS to Kurtley Beale after double blow
2021/10/26 0:00:00,NSW Environment Minister Matt Kean concedes government needs to do more to protect koalas
2021/10/26 0:00:00,Strange signal detected by Parkes telescope prompts alien search
2021/10/26 0:00:00,NBA: Patty Mills produces yet another ‘insanely good’ performance for Brooklyn Nets
2021/10/26 0:00:00,‘Disappointing’ issue throws Melbourne Cup preparation into turmoil
2021/10/26 0:00:00,Norfolk Island to switch from NSW to Qld jurisdiction under new federal funding deal
2021/10/26 0:00:00,Sydney TikTok star making six figures a year from working 14 hours a week
2021/10/26 0:00:00,Burglar Jarrod Frank ‘suffered enough’ watching mum die in court
2021/10/26 0:00:00,Tributes flow for beloved ABC radio host Russell Woolf after his shock death
2021/10/26 0:00:00,Mother of Dean Jones’ son makes claim over cricket legend’s estate
2021/10/26 0:00:00,Teenage spinner Tanveer Sangha ‘bloody close’ to Sheffield Shield debut
2021/10/26 0:00:00,Doctors sue Eastern Health and Royal Women’s as part of underpayment class actions
2021/10/26 0:00:00,Climate holdout Australia sets 2050 net zero emissions target
2021/10/26 0:00:00,Why glamorous alleged fraudster was freed from prison on bail
2021/10/26 0:00:00,Davis Cup: Nick Kyrgios sits out as Alex de Minaur leads Aussie team in to next month’s finals in Italy
2021/10/26 0:00:00,Teen equestrian star Cienna Knowles hospitalised with blood clots after Pfizer vaccine
2021/10/26 0:00:00,South Australia’s road map out of the pandemic has finally been revealed
2021/10/26 0:00:00,Abbie Chatfield slams comedian Nikki Osborne for ‘disgusting’ Weinstein joke
2021/10/26 0:00:00,South Australia announces its roadmap to Covid-normal
2021/10/26 0:00:00,‘Happy to be dirty’: Daniel Ricciardo hits back at rival’s accusation
2021/10/26 0:00:00,Rust assistant director had a previous safety complaint against him
2021/10/26 0:00:00,Abbotsford ‘rare gem’ listed for first time since the ‘80s
2021/10/26 0:00:00,Aussies admit to risky on-road behaviour
2021/10/26 0:00:00,Telstra’s Australia Government-backed purchase of Digicel is ‘clearly directed’ at China
2021/10/26 0:00:00,‘Wild weather change’ set to smash huge swathes of Australia
2021/10/26 0:00:00,Thailand protests fade but the hardcore battle on
2021/10/26 0:00:00,Horror Victoria Derby draw for Gunstock
2021/10/26 0:00:00,Big problem that could crush travel options as borders reopen
2021/10/26 0:00:00,"Automotive finance advice: Crazy mistake that cost me $10,000 and my car"
2021/10/26 0:00:00,"Raceday focus: Best bets, preview for Bendigo on Wednesday"
2021/10/26 0:00:00,NASA finds first evidence of planet beyond our galaxy
2021/10/26 0:00:00,Terrorist ‘guiding light’ Abdul Nacer Benbrika bid to get out of jail
2021/10/26 0:00:00,Cumberland Park home sets new record sale price for suburb
2021/10/26 0:00:00,"As US debt limit looms again, calls intensify for reform"
2021/10/26 0:00:00,Man accused of compelling woman into bestiality act walks free from court after charges against him are dropped
2021/10/26 0:00:00,Canterbury preview: Track and conditions look tailor-made for Rammstein to break through
2021/10/26 0:00:00,NFL fan gets paid after trading away history Tom Brady game ball
2021/10/26 0:00:00,Scott Morrison reveals plans to achieve net zero emissions by 2050
2021/10/26 0:00:00,Mum shamed for having a 14yo son at 25 years old
2021/10/26 0:00:00,Woolworth's shopper’s parking outrages onlooker
2021/10/26 0:00:00,Australian summer of tennis dealt big blow as Kooyong Classic cancelled again
2021/10/26 0:00:00,John Wayne Gacy victim finally confirmed 45 years after murder
2021/10/26 0:00:00,‘Do the work’: Geelong address star’s ugly exit
2021/10/26 0:00:00,Maximal draws carpark for his Golden Eagle tilt
2021/10/26 0:00:00,Net zero target needs credible plan to cut climate pollution
2021/10/26 0:00:00,"Vic royal commission advises against cancelling Crown Melbourne licence, govt goes hard on two-year ‘probation’"
2021/10/26 0:00:00,Woman bulldozed in terrifying cycling incident caught on film
2021/10/26 0:00:00,Billionaire Mike Cannon-Brookes slams Scott Morrison’s 2050 net zero plan
2021/10/26 0:00:00,Why Kmart $8 sandals have shoppers panicking
2021/10/26 0:00:00,Melbourne real estate restrictions: Open homes set to return to Melbourne market
2021/10/26 0:00:00,"Sudan coup: PM arrested, general seizes power, protests erupt"
2021/10/26 0:00:00,Sign Australia’s commodities boom is about to end
2021/10/26 0:00:00,Victorian opener Marcus Harris ready to plant early Ashes flag as season starts against NSW
2021/10/26 0:00:00,Jack Ma disappearance prompts $497b loss for Alibaba in just one year
2021/10/26 0:00:00,Surprise shift to Hunter New England region in NSW’s Covid outbreak
2021/10/26 0:00:00,There’s no Nick Kyrgios in Australia’s Davis Cup team headed to next month’s finals in Italy
2021/10/26 0:00:00,CELEBRATING CHILDREN'S WEEK: Free fun events for the whole family
2021/10/26 0:00:00,Anne Heche on the brutal fallout from her relationship with Ellen
2021/10/26 0:00:00,Photos of Grant Denyer with his hand on DWTS partner’s leg released
2021/10/26 0:00:00,Federal government claims energy bills will plummet under new net zero plan
2021/10/26 0:00:00,Dave Chappelle sledges Hannah Gadsby in defiant response to Netflix blow-up
2021/10/26 0:00:00,Seven-metre-high Collaroy wall erected to protect beachside mansions sparks debate among locals
2021/10/26 0:00:00,Will Clarken keen to target Beau Rossa at Group 1 Winterbottom Stakes
2021/10/26 0:00:00,Verstappen has stronger hand in F1 title thriller - Hamilton
2021/10/26 0:00:00,Roadworker dead after alleged hit-and-run incident near Mackay
2021/10/26 0:00:00,Newcastle’s Mitchell Pearce shadow games ‘would be their downfall’
2021/10/26 0:00:00,You stars reveal secret struggle behind season 3 sex scenes
2021/10/26 0:00:00,Four biggest wins at the T20 World Cup
2021/10/26 0:00:00,Leaked documents reveal Australia tried to water down urgency of UN’s climate report
2021/10/26 0:00:00,Tesla tops $1 tn in market value as Hertz deal fuels latest surge
2021/10/26 0:00:00,Daniel Andrews given power to declare pandemics under proposed pandemic laws
2021/10/26 0:00:00,Chappelle 'more than willing' to meet LGBTQ groups over special
2021/10/26 0:00:00,Michael McCormack confronts Barnaby Joyce after text blow-up in Nationals group chat over bizarre net zero video
2021/10/26 0:00:00,"Bomb cyclone slams rain-starved US west, bringing floods"
2021/10/26 0:00:00,7 Best Bronzers For Every Skin Shade & Tone In 2023
2021/10/26 0:00:00,Qantas plane makes emergency landing over fuel concerns during flight from Perth to Adelaide
2021/10/26 0:00:00,"Spanx founder surprises staff with first class holiday and $10,000 after selling business"
2021/10/26 0:00:00,"Exposed: New contact tracing locations for Gold Coast, Bundaberg, Caboolture"
2021/10/26 0:00:00,Kylie Jenner’s extreme tan sparks fresh blackfishing accusations
2021/10/26 0:00:00,Unvaccinated teen among two new local Covid cases in Queensland
2021/10/26 0:00:00,"1510 new cases, four deaths; Melbourne’s southeast now state’s new Covid epicentre"
2021/10/26 0:00:00,Starting list at first Sandbelt Classic in Melbourne takes on new look with borders set to open
2021/10/26 0:00:00,At least 10 bodies found in hunt for Gabby Petito’s boyfriend Brian Laundrie
2021/10/26 0:00:00,Neighbour’s sign asking people to ‘stop feeding’ cat divides
2021/10/26 0:00:00,Coles launches ‘Best Buys’ website to take on Aldi and Woolworths
2021/10/26 0:00:00,"Melbourne woman details ‘terrifying’ DiDi trip, claims driver tried to abduct her"
2021/10/26 0:00:00,'Rust' shooting: assistant director previously sacked over gun safety
2021/10/26 0:00:00,‘Beat us into submission’: Floyd Mayweather supports anti-vaxxer Kyrie Irving
2021/10/26 0:00:00,Greenhouse gas levels reach record high amid COP26 worries
2021/10/26 0:00:00,Crypto millionaires move to Puerto Rico as US territory becomes tax haven
2021/10/26 0:00:00,$30m lottery jackpot up for grabs
2021/10/26 0:00:00,Carrie Bickmore announces launch of the Brain Cancer Centre
2021/10/26 0:00:00,Australian Federal Police using ‘advanced capabilities’ to help find Cleo Smith
2021/10/26 0:00:00,Police launch manhunt for alleged cocaine importer and millionaire restaurateur Mostafa Baluch
2021/10/26 0:00:00,Donald Trump Jr slammed for selling ‘tacky’ Alec Baldwin T-shirts
2021/10/26 0:00:00,Abbie Chatfield issues hilarious response to Candace Owens
2021/10/26 0:00:00,Ashes 2021-22: Aussie Test captain Tim Paine in England’s crosshairs after news Ben Stokes is coming
2021/10/26 0:00:00,Gladys’ ‘private’ revelation about lover as former top staffers front ICAC
2021/10/26 0:00:00,"Gold Coast teenager miraculously survives lightning strike, but is roasted by members of his family"
2021/10/26 0:00:00,Angelina Jolie’s disastrous hair mistake on Eternals red carpet
2021/10/26 0:00:00,"Sydney’s house price crisis worst it’s been for a decade, new report reveals"
2021/10/26 0:00:00,NSW records 282 new Covid infections and one death
2021/10/26 0:00:00,'Facebook Papers' hit as platform reports billions in profit
2021/10/26 0:00:00,Controversial burger takes out ‘Australia’s best burger’ title
2021/10/26 0:00:00,Celebrity surgeon Dr Daniel Lanzer hits back at horror allegations on Four Corners
2021/10/26 0:00:00,Benji Marshall was almost aroused watching his wife give birth
2021/10/26 0:00:00,Ben Simmons divorce turned on its head by shock 76ers U-turn
2021/10/26 0:00:00,Tesla is worth more than the next nine most valuable car makers
2021/10/26 0:00:00,Essendon legend Dustin Fletcher’s second son joins huge US college as a punter
2021/10/26 0:00:00,World’s biggest jumping castle coming to Australia
2021/10/26 0:00:00,Victoria records 1510 new Covid cases as infection rate stabilises
2021/10/26 0:00:00,‘Shocking’ aftermath of Pakistan’s T20 World Cup demolition
2021/10/26 0:00:00,TikTok guy to face court next year over Covid rally
2021/10/26 0:00:00,Elon Musk becomes $25 billion richer after Hertz electric car deal with Tesla
2021/10/26 0:00:00,We try the Peppy Co LED Mask that delivers glowing skin
2021/10/26 0:00:00,"Myanmar in spotlight at summit, with junta chief barred"
2021/10/26 0:00:00,Japan's Princess Mako to marry after years of controversy
2021/10/26 0:00:00,‘History will not judge us kindly’: Facebook employees rip Zuckerberg in leaked messages
2021/10/26 0:00:00,‘I’m in pieces’: Wife’s heartbreaking admission after star dies
2021/10/26 0:00:00,Cleo Smith’s mum posts TikTok plea after tearful interview
2021/10/26 0:00:00,Questions about future of Alec Baldwin’s film Rust as production shuts down
2021/10/26 0:00:00,Devastating new details revealed in Alec Baldwin shooting
2021/10/26 0:00:00,Donovanosis: ‘Flesh-eating STI’ on the rise in the UK
2021/10/26 0:00:00,F1 icon Martin Brundle’s stinging response to viral snub
2021/10/26 0:00:00,"Experts say texts, emails could notify Australians when they’re eligible for Covid-19 booster shot"
2021/10/26 0:00:00,"Google Pixel 6 Pro Review: Price, Specs & Australian Release"
2021/10/26 0:00:00,Daniel Andrews issues blunt reply to Australian Open vaccination storm
2021/10/26 0:00:00,Two lanes closed near Eastern Creek after truck spills 2000 litres of cream
2021/10/26 0:00:00,Melbourne cafe Blacksheep targeted with anti-vax graffiti after enforcing government rules
2021/10/26 0:00:00,Kristen Stewart’s awkward career confession
2021/10/26 0:00:00,Australia Covid news live: South Australia unveils reopening plan
2021/10/26 0:00:00,"Ham products recalled from Woolworths, IGA stores over fears of listeria contamination"
2021/10/26 0:00:00,Missing hiker repeatedly screened calls from frustrated rescue team
2021/10/26 0:00:00,Biden pushes to get Democrats over finish line on spending package
2021/10/26 0:00:00,Alec Baldwin’s wife Hilaria breaks silence on shooting tragedy
2021/10/26 0:00:00,‘Staggering’: Shane Warne blown away by $2.1 billion cricket mega deal
2021/10/26 0:00:00,Afghanistan thrash Scotland in historic World Cup bloodbath
2021/10/26 0:00:00,Upsizers see better value as Grovedale home beats reserve by $100K
2021/10/26 0:00:00,Couple slammed for wearing ‘inappropriate’ T-shirts to Disney World
2021/10/26 0:00:00,Baldwin was practicing drawing gun when he fired fatal shot: director
2021/10/26 0:00:00,Photo exposes South African cricket team’s glaring Black Lives Matter divide
2021/10/26 0:00:00,'Facebook Papers' explode ahead of platform's earnings report
2021/10/26 0:00:00,Cleo Smith search: Ellie Smith and Jake Gliddon make heart-wrenching plea for their little girl’s return
2021/10/26 0:00:00,‘Iconic’ Elm St: Inside horror’s most infamous home
2021/10/26 0:00:00,Melbourne auctions: Mont Albert stunner’s ‘surprise’ $4m sale in first week after lockdown
