date,title
2021/03/28 0:00:00,Richmond Tigers coach Damien Hardwick slams AFL’s ‘laughable’ rule change
2021/03/28 0:00:00,Scott Morrison’s approval rating plummets in latest Newspoll
2021/03/28 0:00:00,Josh McGuire slams ‘embarrassing’ Cowboys after third consecutive loss
2021/03/28 0:00:00,James Weir recaps Married At First Sight Australia 2021 episode 21 | Cruel stunt stuns devastated MAFS wife
2021/03/28 0:00:00,"Mystery shoppers sought for Australian Venue Co, which has 160 venues around the country"
2021/03/28 0:00:00,‘Storm in a teacup’: Why Ricky Stuart won’t be fined for ref spray — revealed
2021/03/28 0:00:00,‘May as well scrap it’: League world reacts to Jason Taumalolo’s State of Origin plea
2021/03/28 0:00:00,"Piers Morgan writes about Meghan Markle debacle, rails against cancel culture, ‘woke brigade’"
2021/03/28 0:00:00,Lisa Wilkinson fumes at Scott Morrison over Andrew Laming scandal on The Sunday Project
2021/03/28 0:00:00,"Former Sunday Times editor quits Society of Editors, pens response to media after Royal debacle"
2021/03/28 0:00:00,Fremantle captain Nat Fyfe knocked out after nasty collision against GWS Giants
2021/03/28 0:00:00,T20 2021 results: Incredible Ash Gardner knock saves Australia against New Zealand
2021/03/28 0:00:00,Queen’s grandson Peter Phillips quizzed by cops after 740km lockdown trip to see married woman
2021/03/28 0:00:00,Ellyse Perry’s worrying snub in Australia’s victory over New Zealand
2021/03/28 0:00:00,Australia’s cyber security chiefs investigating Parliament House hack
2021/03/28 0:00:00,NSW Waratahs sack coach on the spot after nightmare start to 2021 season
2021/03/28 0:00:00,NSW Health identifies nine close contacts of Queensland COVID-19 outbreak in returned travellers
2021/03/28 0:00:00,Australian prodigy Oscar Piastri registers maiden Formula 2 victory
2021/03/28 0:00:00,Sloppy Knights let milestone man down as rival No.7 leads Tigers to drought-breaker: 3 Big Hits
2021/03/28 0:00:00,Cyber attack forces Nine programs off air
2021/03/28 0:00:00,‘Flat-out bullying’: Liam Ryan’s ruthless move in Western Bulldogs victory
2021/03/28 0:00:00,How Queensland Health’s superspreader ‘house party’ stuff-up happened
2021/03/28 0:00:00,NRL team official speaks out after her viral Scott Morrison reaction caught on camera
2021/03/28 0:00:00,China accused of gaslighting Philippines over South China Sea maritime militia
2021/03/28 0:00:00,Relationship Rehab: Hubby left fuming over wife’s sex toy
2021/03/28 0:00:00,Investigative journalist points finger at world governments in new MH370 book
2021/03/28 0:00:00,Canberra Raiders coach Ricky Stuart reportedly under investigation for sideline behaviour
2021/03/28 0:00:00,Mystery acid drum closes Newcastle beach
2021/03/28 0:00:00,AFLW 2021: Get the latest injury news on Chelsea Randall and Daisy Pearce
2021/03/28 0:00:00,Bad Girls Club star killed in Virginia Beach shooting
2021/03/28 0:00:00,Royal expert says Princess Diana statue unveiling may end brothers’ rift
2021/03/28 0:00:00,‘We’ve got to be brave’: Wallabies name bombshell 40-man training squad ahead of France Test series
2021/03/28 0:00:00,Australia’s ‘Superman’ economy is more like Clark Kent recovering from Kryptonite
2021/03/28 0:00:00,Apprentice Jacob Opperman starred at Morphettville on Saturday
2021/03/28 0:00:00,"Tomahawk, Evanescence, Skegss: New album reviews"
2021/03/28 0:00:00,"Oklahoma jail inmate is shot, killed after taking corrections officer hostage inside lockup"
2021/03/28 0:00:00,"Stabbing rampage in Vancouver library leaves one dead, multiple injured"
2021/03/28 0:00:00,UFC 260: Ngannou vs Miocic: Wild drama in staggering series of knockout results
2021/03/28 0:00:00,John Blackman responds to Kamahl saying he felt ‘humiliated’ by racist segments on Hey Hey It’s Saturday
2021/03/28 0:00:00,‘We won’t stop till we find you’: Vow to find missing swimmer
2021/03/28 0:00:00,Golden Slipper winner Stay Inside can get to richest race says trainer
2021/03/28 0:00:00,Ed Sheeran shows classy message after being spotted in stands at AFL game
2021/03/28 0:00:00,World champion surfer Pauline Menczer to be honoured at Bondi Beach
2021/03/28 0:00:00,Peter Maddison: Grand Designs host’s property journey
2021/03/28 0:00:00,Gold Coast mother recounts tragic miscarriage on her wedding day
2021/03/28 0:00:00,Grandfather-of-seven left seriously injured in ‘horrific’ hit-run crash
2021/03/28 0:00:00,Inside Mail and Best Bets for Grafton Monday
2021/03/28 0:00:00,Suez Canal crisis continues as experts hope to float ship in hours
2021/03/28 0:00:00,Naomi Osaka shares emotional post about boyfriend
2021/03/28 0:00:00,Why Queensland hasn’t gone into lockdown this time
2021/03/28 0:00:00,UFC 260: Francis Ngannou ends Stipe Miocic heavyweight reign
2021/03/28 0:00:00,Brisbane Lions players pulled off bus by 11th hour COVID-19 travel order
2021/03/28 0:00:00,Hilary Duff welcomes second daughter with husband Matthew Koma
2021/03/28 0:00:00,Female Liberal MPs slam scandal-hit Andrew Laming
2021/03/28 0:00:00,Qld records one new local coronavirus case
2021/03/28 0:00:00,"On The Punt: Best bets for Kyneton races, apprentice jockey Tayla Childs hoping to get a win aboard Sunflare"
2021/03/28 0:00:00,Thomas Markle hand delivers letter to Oprah asking to be interviewed about Meghan
2021/03/28 0:00:00,John Sprague’s two might cross the line together at Grafton on Monday
2021/03/28 0:00:00,Trainer David Eustace tempers expectations around Persan ahead of Easter Cup at Caulfield
2021/03/28 0:00:00,Dillian Whyte destroys Alexander Povetkin in heavyweight blockbuster
2021/03/28 0:00:00,Nine hit by cyber attack as massive IT crash brings network down
2021/03/28 0:00:00,Two photos sum up NRL’s shocking weekend from hell
2021/03/28 0:00:00,Most shocking revelations in career-spanning Tina Turner documentary
2021/03/28 0:00:00,Keilor North house price record: Inside $6m ‘Great Gatsby’ mansion
2021/03/28 0:00:00,"Liberal backbenchers call for MPs to be drug, alcohol tested at Parliament House"
2021/03/28 0:00:00,Body of missing 16-year-old found after being swept off rock
2021/03/28 0:00:00,Flagstaff Hill home’s quirky character makes it stands out from its neighbours
2021/03/28 0:00:00,UberEats driver’s murder by carjacking teenagers captured by shocked bystanders
2021/03/28 0:00:00,Jarryd Hayne faces fresh blow after conviction
2021/03/28 0:00:00,Star filly poised for Australian Derby assault after Rosehill Guineas performance
2021/03/28 0:00:00,House party held by new Queensland COVID case
2021/03/28 0:00:00,NRL 2021: Canterbury coach Trent Barrett jumps to the defence of embattled halfback Kyle Flanagan
2021/03/28 0:00:00,"Cummings to weigh up Sires’ tilt with Golden Slipper placegetters Anamoe, Ingratiating"
2021/03/28 0:00:00,Health expert says Australia’s vaccine rollout is falling behind
2021/03/28 0:00:00,Rogue F1 bad boy makes ultimate faux pas at Bahrain GP qualifying
2021/03/28 0:00:00,"Space, style and views at 5 Wembley Ave, Bridgewater"
2021/03/28 0:00:00,Stranger removes face mask to kiss supermarket shopper’s one-year-old baby on the lips
2021/03/28 0:00:00,"Accused Boulder gunman Ahmad Al Aliwi Alissa was ‘laughing’ during massacre, report claims"
2021/03/28 0:00:00,Daniel Ricciardo reacts to impressive first qualifying with McLaren
2021/03/28 0:00:00,Max Verstappen dominates Lewis Hamilton at Bahrain GP qualifying
2021/03/28 0:00:00,Myanmar coup: Security forces gun down dozens of protesters in nation’s deadliest day
2021/03/28 0:00:00,What Ash Barty must do to remain world No. 1
2021/03/28 0:00:00,ABC newsreader taken off the air after bizarre incident
2021/03/28 0:00:00,"Police searching for missing Muswellbrook boy Colin Ghananburgh, 12"
2021/03/28 0:00:00,NRL referee mocked for losing his voice mid-game
2021/03/28 0:00:00,At The Track: Glen Boss cops Bivouac sacking on the chin
2021/03/28 0:00:00,"Aussie sprint king books Olympic berth, breaks 17-year drought"
2021/03/28 0:00:00,‘You ain’t see nothing yet’: what house prices will cost in 2030
2021/03/28 0:00:00,Scott Morrison won’t skol a beer despite NRL star’s changeroom plea
2021/03/28 0:00:00,Tim Tszyu: My dream fight is against middleweight monster GGG
2021/03/28 0:00:00,"Sydneysiders more confident to explore own backyard, study shows"
2021/03/28 0:00:00,"Formula One 2021: Full list of must-watch cars, racing car drivers"
2021/03/28 0:00:00,Kia Stonic GT-Line review: New SUV is late to the party
2021/03/28 0:00:00,NRL star James Tedesco releases first kids’ book Hat-Trick Teddy
2021/03/28 0:00:00,Jarryd Hayne: When fame and adulation goes horribly wrong
2021/03/28 0:00:00,Tony Lockett part of spine-tingling scenes that bring AFL to a standstill
2021/03/28 0:00:00,Andrew Laming: Why PM needs to fear rogue MP
2021/03/28 0:00:00,Bridge to Brisbane: Early-bird entry now open
2021/03/28 0:00:00,Hamilton Musical Sydney opening night: Glam Gladys shines on red carpet
