date,title
2021/05/06 0:00:00,"Australian overseas travel ban ‘breach of human rights’, Federal Court told"
2021/05/06 0:00:00,India-Australia flights to resume with quarantine at Howard Springs
2021/05/06 0:00:00,French boats leave Jersey waters after fishing protest: fishermen
2021/05/06 0:00:00,"New US jobless claims plunged 92,000 last week: govt"
2021/05/06 0:00:00,Putin supports Russia waiving patents on its Covid jabs
2021/05/06 0:00:00,Steve Kean slams wasted chances in Victory’s loss to Macarthur
2021/05/06 0:00:00,Australia’s India travel ban slammed as ‘miscalculation’ by Scott Morrison
2021/05/06 0:00:00,How to clean washing machine filter and pump every three months
2021/05/06 0:00:00,Russia registers one-dose Sputnik Light coronavirus jab
2021/05/06 0:00:00,Josh Addo-Carr bags six tries as Storm annihilate Rabbitohs
2021/05/06 0:00:00,UK economy to rebound by 7.25% this year: BoE
2021/05/06 0:00:00,Man arrested after truck ploughed into pedestrians in Melbourne
2021/05/06 0:00:00,Inside Jarryd Hayne’s staggering fall from grace
2021/05/06 0:00:00,Bank of England keeps interest rate at record-low 0.1%
2021/05/06 0:00:00,Having Imogen home is Mother’s Day magic
2021/05/06 0:00:00,Comeback victory underlines Macarthur’s top-six credentials
2021/05/06 0:00:00,African Union hails US for 'remarkable' leadership on vaccine waiver
2021/05/06 0:00:00,UK mum gives birth in just ‘27 seconds’
2021/05/06 0:00:00,Powerball jackpot hits $20 million giving someone the chance to change their life
2021/05/06 0:00:00,"Uganda's brutal Lord's Resistance Army, past and present"
2021/05/06 0:00:00,EU and India set to restart long-suspended trade talks
2021/05/06 0:00:00,Germany 'open' to discuss waiving Covid-19 jab patents: minister
2021/05/06 0:00:00,Ukraine president says country still under Russian military threat
2021/05/06 0:00:00,Macron backs waiving Covid-19 vaccine patents
2021/05/06 0:00:00,Blinken calls on Russia to cease 'reckless and aggressive actions' against Ukraine
2021/05/06 0:00:00,Two French patrol boats deployed to Jersey: coast guard
2021/05/06 0:00:00,Kate Hudson’s Fabletics investigating staff sexual abuse complaints
2021/05/06 0:00:00,Bill and Melinda Gates’ divorce sends shockwaves through China
2021/05/06 0:00:00,Blinken in Ukraine reaffirms US commitment to Kiev against Russia
2021/05/06 0:00:00,‘Shocking and disappointing’ reaction to Jarryd Hayne sentence as fans show support
2021/05/06 0:00:00,"Archie’s birthday messages from Kate, William and royals dubbed ‘awkward’ for using old photos"
2021/05/06 0:00:00,Sydney Chase won’t ‘be called a liar’ in Tristan Thompson cheating scandal
2021/05/06 0:00:00,Newcastle hold out Sydney to seal tense draw
2021/05/06 0:00:00,France 'won't be intimidated' by UK manoeuvres around Jersey: minister
2021/05/06 0:00:00,Supercars: Doubts over readiness of Gen3 program grow as Cam Waters warns against a rushed product
2021/05/06 0:00:00,Rarely seen video of Bill Gates talking about love
2021/05/06 0:00:00,Wagga or Gosford as Paths Of Glory targets back-to-back stakes victories
2021/05/06 0:00:00,The Project’s Lisa Wilkinson questions Sydney COVID outbreak timing
2021/05/06 0:00:00,‘I just want to get on with my life’: Former Block star Suzi Taylor speaks after prison release
2021/05/06 0:00:00,Australia’s Indian Premier League stars flee coronavirus-ravaged nation
2021/05/06 0:00:00,Japan town builds giant squid statue with Covid grant
2021/05/06 0:00:00,Daniel John Prunster has firearm licence revoked after pointing a weapon at his young child
2021/05/06 0:00:00,"Date set for Porsche driver Richard Pusey to fight assault, theft charges"
2021/05/06 0:00:00,Willie Mason wants life bans for footy players with a history of violence against women
2021/05/06 0:00:00,MasterChef's Therese attempts the impossible despite judges warning her against it
2021/05/06 0:00:00,NRL reintroduces COVID-19 restrictions as Sydney scrambles to contain COVID-19 scare
2021/05/06 0:00:00,Josh Parr and Tim Clark give new manager Tye Angland that winning feeling
2021/05/06 0:00:00,Warrnambool Cup: Le Don De Vie finds form with dominant victory
2021/05/06 0:00:00,Microsoft pledges to store European cloud data in Europe
2021/05/06 0:00:00,Joe Pride confident of snaring feature treble at Gosford
2021/05/06 0:00:00,Christian Porter launches legal action to ensure ABC’s ‘scandalous’ defence kept secret
2021/05/06 0:00:00,Too little too late for Tigers as Titans snap slump
2021/05/06 0:00:00,Man charged after allegedly raping teenager inside Melbourne toilet block
2021/05/06 0:00:00,"NRL rivals circle Storm skipper, Sharks half offered to Super League clubs: Transfer Whispers"
2021/05/06 0:00:00,Gosford races: Brad Davidson’s tips and extended preview
2021/05/06 0:00:00,China 'strongly condemns' G7 rights criticism
2021/05/06 0:00:00,Kim Waugh will fight to clear her name against serious charges from Racing NSW stewards
2021/05/06 0:00:00,Son of Sam murderer David Berkowitz’s ‘last victim’ revealed in chilling Netflix documentary
2021/05/06 0:00:00,NT Health Minister warns ‘flights must not create a burden on the health system’
2021/05/06 0:00:00,Super Rugby AU: Benched Queensland Reds captain Liam Wright still has an important part to play in the grand final
2021/05/06 0:00:00,China suspends dialogue agreement with Australia
2021/05/06 0:00:00,EU ready to 'discuss' Covid vaccine patent waivers
2021/05/06 0:00:00,VFL on Kayo: Sam Weideman out to push case for Melbourne selection with Casey Demons
2021/05/06 0:00:00,Nintendo logs record $4.4 bn annual profit in 2020-21
2021/05/06 0:00:00,"Wagga, Grafton previews: Richard Litt is eyeing off a feature double with Mr Marathon Man and Black Duke"
2021/05/06 0:00:00,"Australian sharemarket snaps three-day winning streak, tech stocks hammered"
2021/05/06 0:00:00,Blinken reaffirms US support for Ukraine's 'sovereignty and territorial integrity'
2021/05/06 0:00:00,SA nurses on high alert after computer glitch adds extra digit to medicine dosages
2021/05/06 0:00:00,"India sees record COVID-19 deaths, new cases in 24 hours"
2021/05/06 0:00:00,Collingwood list manager Ned Guy to depart club after mid-season draft
2021/05/06 0:00:00,Willie Pike needed a push from his wife to get out of Perth
2021/05/06 0:00:00,‘She should go’: Liberal leader calls for Emma Cassar to be sacked
2021/05/06 0:00:00,Jarryd Hayne sentence: Disgraceful scenes after former NRL superstar jailed
2021/05/06 0:00:00,Victorian Top Tourism Town Awards finalists revealed ahead of public vote
2021/05/06 0:00:00,New Zealand weightlifter set to be first transgender Olympian
2021/05/06 0:00:00,Abducted Nigerian college students freed
2021/05/06 0:00:00,"Hosting IPL not a mistake, insists India cricket chief"
2021/05/06 0:00:00,Inside the cut-throat battle to build K-pop's next superstars
2021/05/06 0:00:00,Essendon unearth three future stars and they won’t be benched anytime soon
2021/05/06 0:00:00,"Raceday focus: Best bets, inside mail for Wagga"
2021/05/06 0:00:00,Wagga Town Plate: Tom Sherry wins feature race with only ride for the meeting
2021/05/06 0:00:00,Jarryd Hayne’s victim details devastating impact in front of his wife
2021/05/06 0:00:00,Federal Court challenge on India travel ban to be heard next week
2021/05/06 0:00:00,Grand Annual Steeplechase: Gold Medals too strong for brave Zed Em in another epic battle at Warrnambool
2021/05/06 0:00:00,"Jack de Belin, Callan Sinclair jury says it is prepared to deliberate into next week"
2021/05/06 0:00:00,AFL: Darcy Gardiner’s return leaves Lions coach Chris Fagan with a tough selection choice
2021/05/06 0:00:00,AFL announces changes to round eight fixtures in response to Sydney COVID-19 scare
2021/05/06 0:00:00,Steel giant ArcelorMittal posts 'strongest quarter in a decade'
2021/05/06 0:00:00,Dog breeds: the internet’s most popular dog revealed
2021/05/06 0:00:00,Huge boost for AFL Sydney’s Premier Division with Kayo streaming
2021/05/06 0:00:00,Volkswagen profits rise despite semiconductor crunch
2021/05/06 0:00:00,This week: Reasons dogs pant at night and what causes their lumps
2021/05/06 0:00:00,Boomers big man Will Magnay signs with Perth in a big boost to Wildcats’ three-peat hopes
2021/05/06 0:00:00,Pressure mounts on Colombia as protests begin second week
2021/05/06 0:00:00,Adelaide left to rue missed opportunities in draw with Wellington
2021/05/06 0:00:00,Coronavirus crisis: West Aussie among five more Australians to develop blood clots after AstraZeneca jab
2021/05/06 0:00:00,Hilarious sketch of George Clooney fanboying over Brad Pitt
2021/05/06 0:00:00,Apple iPhone 12 purple review: Big reason to upgrade
2021/05/06 0:00:00,History made as euthanasia bill passes in state’s upper house
2021/05/06 0:00:00,Hong Kong's Joshua Wong handed extra jail time for Tiananmen vigil
2021/05/06 0:00:00,Most restrictions to be lifted in Perth and Peel regions this weekend but some to stay including masks
2021/05/06 0:00:00,Pandemic pushes Air France-KLM into 1.5-billion-euro loss in Q1
2021/05/06 0:00:00,James Cummings hopes to celebrate first hole-in-one with an Avilius victory in Hollindale Stakes
2021/05/06 0:00:00,Josh Schuster re-signs with Sea Eagles until end of 2024
2021/05/06 0:00:00,‘Continued to fester’: Schoolyard tension allegedly escalates into violent stabbing
2021/05/06 0:00:00,Grand Toorak tower mansion once owned by Steve Vizard for sale
2021/05/06 0:00:00,Leading provincial trainer Kim Waugh faces welfare charges
2021/05/06 0:00:00,AFL: North Melbourne coach David Noble goes up against his son John in Saturday’s clash with Collingwood
2021/05/06 0:00:00,The Lott lists names and ages most likely to win lotto
2021/05/06 0:00:00,Britney Spears: Perez Hilton says singer ‘would be dead’ if not for conservatorship
2021/05/06 0:00:00,James Blunt roasts himself alongside announcement he will play Royal Albert Hall in July
2021/05/06 0:00:00,Jarryd Hayne sentenced to jail for sex assault
2021/05/06 0:00:00,AFL power couple quietly go separate ways
2021/05/06 0:00:00,"India sees record Covid deaths, new cases in 24 hours"
2021/05/06 0:00:00,YOU GOT THIS: Melbourne mum loses 25kg ahead of wedding day
2021/05/06 0:00:00,SA Derby: Explosive Jack favourite to complete rare Derby hat-trick and join turf legends
2021/05/06 0:00:00,US backs plan to waive Covid-19 vaccine patents
2021/05/06 0:00:00,Melbourne fitness influencer Steph Claire Smith gives birth to boy
2021/05/06 0:00:00,Swans cleared to travel interstate for Demons clash
2021/05/06 0:00:00,Leila Abdallah named Mother of the Year after losing three kids in horror Oatlands crash
2021/05/06 0:00:00,Locked Down movie review: As deflating and monotonous as quarantine itself
2021/05/06 0:00:00,Kiwi weightlifter will make history by becoming the first transgender Olympian
2021/05/06 0:00:00,John Edwards’ extensive domestic violence history before killing children Jack and Jennifer
2021/05/06 0:00:00,Jesy Nelson doesn’t want to stay friends with Little Mix and won’t work with them again
2021/05/06 0:00:00,Nicholas Emmanuel Athans: DJ who groomed teens for sex was ‘not much older than victims’
2021/05/06 0:00:00,China suspends economic accord with Australia
2021/05/06 0:00:00,"Authorities provide update on Australia’s vaccine rollout, blood clot reports"
2021/05/06 0:00:00,AFL: Carlton wants to answer defensive deficiencies by simply kicking more goals
2021/05/06 0:00:00,China ‘indefinitely suspends’ economic talks with Australia
2021/05/06 0:00:00,China “indefinitely suspends” all activities under the China-Australia Strategic Economic Dialogue
2021/05/06 0:00:00,International border closures costing Australia $8bn a month: research group
2021/05/06 0:00:00,Hong Kong dissident Joshua Wong jailed for Tiananmen protest
2021/05/06 0:00:00,New Zealand to ‘pause’ travel bubble with NSW amid COVID-19 outbreak
2021/05/06 0:00:00,Ugg boot inventor and surf legend Shane Stedman sells Mona Vale beach house for $5.306 million
2021/05/06 0:00:00,Jana Hocking on a simple way to get what you want from a man
2021/05/06 0:00:00,‘Do not touch’: Warning about deadly ‘bat disease’ lyssavirus in Sydney
2021/05/06 0:00:00,2021 Lexus LX570 S review: Big SUV is coming to the end of its life
2021/05/06 0:00:00,Kris Lees takes on The Coast with I Say Hello and Game Of Thrones
2021/05/06 0:00:00,Jarryd Hayne’s outburst before sentencing: ‘I didn’t do it’
2021/05/06 0:00:00,Parramatta set to re-sign star lock Nathan Brown in a big boost
2021/05/06 0:00:00,’Torrential rain’ to smash east coast
2021/05/06 0:00:00,Jarryd Hayne reveals bombshell lost NRL offer after sexual assault
2021/05/06 0:00:00,Bali deports Russia influencer behind painted face mask prank
2021/05/06 0:00:00,Descendants of Melbourne knight collect $100m+ for family farm
2021/05/06 0:00:00,Kate playfully corrects William in new royal video
2021/05/06 0:00:00,Nadia Bokody: Why women need to stop praising men for doing bare minimum in relationships
2021/05/06 0:00:00,Five Australians suffer blood clots after AstraZeneca jab in one week
2021/05/06 0:00:00,Blue Mountains Meadow Flat becomes tourist hotspot with stunning tree-lined streets
2021/05/06 0:00:00,Dietitian on why being called ‘too fat’ and ‘too thin’ doesn’t hurt anymore
2021/05/06 0:00:00,Baz Luhrmann reveals star who almost scored lead role in Moulin Rouge
2021/05/06 0:00:00,Jarryd Hayne will be sentenced at 2.30pm today
2021/05/06 0:00:00,Rex Lipp doesn’t want to see any seagulls when Simply Fly contests Gold Coast Guineas
2021/05/06 0:00:00,Two Vaucluse mansions owned by Moshav Financial boss Tal Silberman set to fetch $45m plus
2021/05/06 0:00:00,Mexico president hits back at critics over metro crash
2021/05/06 0:00:00,Marilyn Manson accuser Ashley Morgan Smithline details graphic assault allegations against musician
2021/05/06 0:00:00,NSW Premier Gladys Berejiklian’s warning to other states over coronavirus cases
2021/05/06 0:00:00,‘Torrential falls’ to hit NSW south coast as rain pelts Sydney
2021/05/06 0:00:00,Qantas agrees to expand aircraft maintenance program in Queensland
2021/05/06 0:00:00,Ex-MasterChef star will seek to have sex assault case thrown out
2021/05/06 0:00:00,Melbourne TikTok star Rustam Raziev kind supermarket gesture goes viral
2021/05/06 0:00:00,Floyd Mayweather’s stripper fiancee forced to leave $11 million mansion
2021/05/06 0:00:00,New COVID restrictions for Sydney as state records new locally acquired case
2021/05/06 0:00:00,Nets Irving fined $35k for refusing reporters interviews
2021/05/06 0:00:00,James Merlino reveals Dan Andrews ‘close’ to returning to work
2021/05/06 0:00:00,Joe Biden’s chief medical adviser Anthony Fauci on India travel ban
2021/05/06 0:00:00,Source of Sydney COVID-19 infection revealed as virus spreads to man’s wife
2021/05/06 0:00:00,AFLW star Tayla Harris’ money demand divides footy
2021/05/06 0:00:00,Police watchdog to investigate cops over their dealings with Kelly Wilkinson before her death
2021/05/06 0:00:00,Brazilian President suggests COVID-19 is ‘biological warfare’
2021/05/06 0:00:00,Barry ‘Bunny’ Reilly dead: Eastern Suburbs Roosters legend passes away
2021/05/06 0:00:00,Scott Morrison says chances of repatriation flight from India by May 15 ‘looking good’
2021/05/06 0:00:00,Tim Tszyu confirms $1 million grudge rumble with Michael Zerafa
2021/05/06 0:00:00,Shocked mum gives birth to nine babies after medics missed two on scan
2021/05/06 0:00:00,"KFC SuperCoach: How to survive, and get ahead, after the first seven rounds"
2021/05/06 0:00:00,Man roasts typo on $55 Kmart item oil heater
2021/05/06 0:00:00,Woman shares FaceTime video of Matthew Perry after matching with the star on Raya
2021/05/06 0:00:00,Scott Morrison has no plans to call Michael Slater over India travel ban
2021/05/06 0:00:00,"Pandemic, war, climate change fuel food fears"
2021/05/06 0:00:00,Malian woman who gave birth to 9 babies 'doing well'
2021/05/06 0:00:00,Vacant Sanctuary Lakes block sets Point Cook residential record
2021/05/06 0:00:00,Matildas captain Sam Kerr nets a double as Chelsea edge closer to retaining English title
2021/05/06 0:00:00,"Nadal cruises into Madrid last 16, Barty faces surprising Badosa in semis"
2021/05/06 0:00:00,UK sends Navy ships to Jersey as French fishing row escalates
2021/05/06 0:00:00,Japanese town Noto spends COVID relief money on giant squid statue
2021/05/06 0:00:00,Liechtenstein prince accused of killing Romania's 'largest' bear
2021/05/06 0:00:00,Trump moves to assert party control despite Facebook ban
2021/05/06 0:00:00,Pfizer/BioNTech jab confirmed to protect 95% in largest study yet
2021/05/06 0:00:00,‘Talk like an adult’: Politician slams Michael Slater over Scott Morrison attack
2021/05/06 0:00:00,Touchdown! SpaceX successfully lands Starship rocket
2021/05/06 0:00:00,‘Spoiled prat’: David Littleproud slams Michael Slater over India tweets
2021/05/06 0:00:00,Finance Minister Simon Birmingham says no overseas travel until later in 2022
2021/05/06 0:00:00,ACCC denies Qantas and Japan Airlines deal to co-ordinate flights
2021/05/06 0:00:00,Brisbane dominatrix Mistress Marita reveals what it’s like to work in the industry
2021/05/06 0:00:00,"Searching for missing campers Russell Hill, Carol Clay halts after police redirected search back to Wonnangatta"
2021/05/06 0:00:00,MasterChef Australia E13 recap: Pantry staples
2021/05/06 0:00:00,Apprentice jockey Stacey Metcalfe suspended for failing to ride horse out in narrow defeat at Murray Bridge
2021/05/06 0:00:00,NSW Treasurer Dominic Perrottet in isolation after negative COVID-19 test
2021/05/06 0:00:00,Bill Gates sent Melinda $2.3b in shares when couple announced divorce
2021/05/06 0:00:00,Hamish Blake and Zoe Foster Blake spruik ‘big’ holidays in new Tourism Australia campaign
2021/05/06 0:00:00,Meghan Markle slammed for dad book when she’s estranged from her own
2021/05/06 0:00:00,Qantas confirms global headquarters will remain in Sydney
2021/05/06 0:00:00,Dyson V15 cordless vacuum uses laser to detect dust
2021/05/06 0:00:00,NRL clubs provided updated list of potential COVID exposure venues
2021/05/06 0:00:00,"Man found dead in Melton driveway, two men stabbed nearby"
2021/05/06 0:00:00,Rumours Meghan Markle paid staggering advance for children’s book
2021/05/06 0:00:00,Sacked Hillsong pastor Carl Lentz’s wife breaks silence after his affairs
2021/05/06 0:00:00,SpaceX successfully lands Starship rocket: livestream
2021/05/06 0:00:00,Expat details the difference between Australian and US water temperatures
2021/05/06 0:00:00,Malaysia Airlines flight MH370 left ‘false trails’ before disappearing
2021/05/06 0:00:00,NAB warns some sectors are still being hit hard by the coronavirus pandemic
2021/05/06 0:00:00,Mum shocked by note about ‘unbearable’ kids
2021/05/06 0:00:00,Chelsea dominate Real Madrid to set up all-English Champions League final
2021/05/06 0:00:00,Kyle and Jackie O launch a search for the most beautiful penis
2021/05/06 0:00:00,Pharma federation IFPMA says US support for patent waiver 'disappointing'
2021/05/06 0:00:00,"Marise Payne caught up in COVID-19 scare at G7, summit takes aim at China"
2021/05/06 0:00:00,Eden Hazard reaction goes viral in Chelsea’s Champions League win over Real Madrid
2021/05/06 0:00:00,Brazil's central bank raises interest rate to 3.5%
2021/05/06 0:00:00,"Ferrari reveals 812 Competizione, the ultimate V12 supercar"
2021/05/06 0:00:00,"Twist in awkward coaching saga of Andrew Johns, Matthew Johns"
2021/05/06 0:00:00,NSW Police charge Luke ‘Fatboy’ Sparos in relation to Samer Marcus shooting
2021/05/06 0:00:00,Large factory fire closes South Melbourne Primary School
2021/05/06 0:00:00,Two Americans given life sentences for Italy cop murder
2021/05/06 0:00:00,South Melbourne Primary School forced to close after toxic warehouse fire
2021/05/06 0:00:00,Perth dad lashes Mulberry Tree Childcare’s ‘pathetic’ fine after son left in hot bus
2021/05/06 0:00:00,Donald Trump personally intervenes in effort to oust Liz Cheney from Republican Party’s leadership team
2021/05/06 0:00:00,"Woolworths, Chemist Warehouse, and other venues added after Sydney man tests positive for COVID-19"
2021/05/06 0:00:00,"Plot thickens in MacGill kidnapping after drugs charge, alleged bikie link"
2021/05/06 0:00:00,‘Bridesmaids’ director reveals cringeworthy scene cut from movie
2021/05/06 0:00:00,Ash Barty loses it over hilarious tennis blooper in Madrid
2021/05/06 0:00:00,WHO's Tedros hails 'historic' US decision to support vaccine patent waiver vog/kjl/har
2021/05/06 0:00:00,Israeli army kills Palestinian teen in West Bank: Palestinian sources
2021/05/06 0:00:00,Coronavirus fragments detected after wastewater testing of the Marrickville sewage network
2021/05/06 0:00:00,"G7 ends talks with criticism of China, Russia, Iran"
2021/05/06 0:00:00,Bikie link revealed as Stuart MacGill allegedly ‘betrayed’ by friend
2021/05/06 0:00:00,Michael Slater lashes Scott Morrison over ‘dead bodies’ as India ban faces court challenge
2021/05/06 0:00:00,Cricket Australia reveal player plans after IPL suspension
2021/05/06 0:00:00,Adele shows off weight loss in new photos for 33rd birthday
2021/05/06 0:00:00,Live breaking news: List of NSW exposure sites explodes
2021/05/06 0:00:00,15 soldiers killed in Niger 'terrorist' attack: govt
2021/05/06 0:00:00,Ash Barty beats Petra Kvitova with 15th straight red clay court win
2021/05/06 0:00:00,Buyers’ California dream in North Shore starts $70K over reserve
2021/05/06 0:00:00,Joe Biden announces support for COVID-19 vaccine patent waiver
2021/05/06 0:00:00,McLaren boss calls out Daniel Ricciardo’s big blunder
2021/05/06 0:00:00,US announces support for Covid-19 vaccine patent waiver
2021/05/06 0:00:00,Sam Newman’s eerie premonition before discovering wife Amanda Brown’s body
2021/05/06 0:00:00,Facebook oversight board affirms Trump ban -- for now
2021/05/06 0:00:00,Melinda Gates hinted at tensions in her marriage to Bill in 2019 interview on Australian radio
2021/05/06 0:00:00,Abducted Nigerian college students freed: official
2021/05/06 0:00:00,"G7 criticises China, Russia and Iran after in-person talks"
2021/05/06 0:00:00,France marks bicentenary of Napoleon's death amid debate over legacy
2021/05/06 0:00:00,London and Brussels agree EU ambassador status post-Brexit
2021/05/06 0:00:00,"Game of Thrones prequel, House of the Dragon, releases first photos"
2021/05/06 0:00:00,1.5C warming cap could 'halve' sea level rise from melting ice
2021/05/06 0:00:00,Israel president gives opposition chief Lapid mandate to form govt
2021/05/06 0:00:00,UK denounces French threats on post-Brexit fishing
2021/05/06 0:00:00,Canada authorizes Pfizer Covid vaccine for kids age 12 and up
2021/05/06 0:00:00,Trump reiterates election fraud claim after Facebook upholds ban
2021/05/06 0:00:00,"Mount Dandenong house features own tavern, the “Tudor Inn”"
