date,title
2021/05/21 0:00:00,"IMF vows pandemic recovery, as vaccine firms pledge billions of doses"
2021/05/21 0:00:00,‘Mass confusion’ strikes NRL with sin bin drama dividing the league
2021/05/21 0:00:00,AFL fans fume at umpiring ‘farce’ in heated clash of premiership heavyweights
2021/05/21 0:00:00,Garry Lyon tees off on Lions Joe Daniher’s costly misses against Richmond
2021/05/21 0:00:00,IMF proposes $50 bn plan to end the pandemic: official
2021/05/21 0:00:00,Dragons’ injury crisis intensifies in Friday night thriller
2021/05/21 0:00:00,UK govt mulls action against BBC after Diana cover-up
2021/05/21 0:00:00,Moderate separatist elected regional Catalan president
2021/05/21 0:00:00,Mum asks people to watch her kids on Facebook Live while she smokes
2021/05/21 0:00:00,"Israeli police, Palestinians in fresh clashes at Al-Aqsa compound"
2021/05/21 0:00:00,Hawks’ finals hopes alive after win over 36ers
2021/05/21 0:00:00,"Muswellbrook preview: Tips, best bets and inside mail"
2021/05/21 0:00:00,"Global system outage hits Australian airline, causing major delays"
2021/05/21 0:00:00,Netanyahu hails Gaza operation as 'exceptional success'
2021/05/21 0:00:00,Six killed by blast at pro-Palestinian rally in Pakistan: officials
2021/05/21 0:00:00,All aboard the night train: Paris-Nice sleeper returns
2021/05/21 0:00:00,Warriors’ Reece Walsh ‘brilliance’ sticks boot in Broncos
2021/05/21 0:00:00,Contentious selection decision the key to Warriors win
2021/05/21 0:00:00,Spain to allow all vaccinated travellers in from June 7
2021/05/21 0:00:00,Hydralyte strawberry kiwi effervescent electrolyte tablets recalled due to pregnancy risk
2021/05/21 0:00:00,BBC under pressure over Diana interview 'cover-up'
2021/05/21 0:00:00,"5 bodies found, about 10 survivors rescued in Gaza tunnel: officials"
2021/05/21 0:00:00,Eurozone business activity growth fastest in three years in May
2021/05/21 0:00:00,Prince Harry says family showed ‘total neglect’ for his mental health and Charles said he would ‘suffer’ in new attack
2021/05/21 0:00:00,‘You couldn’t make this up’: How a woman ‘terrorised’ her lover and his family
2021/05/21 0:00:00,China slams EU's 'confrontational approach' after investment deal blocked
2021/05/21 0:00:00,A-League: Ufuk Talay commits to Wellington Phoenix for another two seasons
2021/05/21 0:00:00,Excess deaths due to pandemic up to three times higher than reported Covid toll: WHO
2021/05/21 0:00:00,Army of the Dead is an over-the-top zombie gore-fest
2021/05/21 0:00:00,France backs US 15% global minimum corporate tax proposal
2021/05/21 0:00:00,Jesse Hogan to miss at least a month with calf injury
2021/05/21 0:00:00,Trade Minister Dan Tehan opens up on awkward taunts from allies of UK counterpart Liz Truss
2021/05/21 0:00:00,Lando Norris exposes Daniel Ricciardo’s McLaren ‘confidence’ problem
2021/05/21 0:00:00,District Six: Terrible decision saw thriving suburb disappear
2021/05/21 0:00:00,Woolworths Epping North: Shoppers on May 8 ordered to isolate after it was missed as an exposure site
2021/05/21 0:00:00,Man has wrong leg amputated at Austrian hospital
2021/05/21 0:00:00,Genius iPhone trick lets you close all your tabs instantly without swiping for ages
2021/05/21 0:00:00,Corica already planning for Socceroos ‘concern’
2021/05/21 0:00:00,"Junction Club, Moonee Ponds, near Moonee Valley Racecourse hits market"
2021/05/21 0:00:00,AFL 2021: See all the teams for Round 10
2021/05/21 0:00:00,Vietnam's first openly gay candidate seeks change with parliament run
2021/05/21 0:00:00,Tuchuzy snaps up home of former model and Bondi Beach businesswoman Tali Jatali
2021/05/21 0:00:00,Mideast ceasefire 'good' but conflict causes must be addressed: Germany
2021/05/21 0:00:00,Federer serves up memorabilia treasure trove
2021/05/21 0:00:00,Australian schoolchildren cut class to renew climate protest
2021/05/21 0:00:00,‘Be kinder’: Single mum fuming after copping $1000 in fines
2021/05/21 0:00:00,Maria Axiak spared jail for boiling water attack on husband
2021/05/21 0:00:00,Port Adelaide Power responds to artist’s guernsey plagiarism allegations
2021/05/21 0:00:00,Police divers work to retrieve body after car plunges off boat ramp on NSW Central Coast
2021/05/21 0:00:00,Australian sharemarket closes marginally higher as tech stock volatility spreads to resources sector
2021/05/21 0:00:00,20-year-old woman allegedly pulled over by fake police in Sydney’s northwest
2021/05/21 0:00:00,Seven under manslaughter investigation after Diego Maradona death
2021/05/21 0:00:00,Brett Cavanough has bigger races in sight for Patino Ruby and Fender
2021/05/21 0:00:00,Melody Belle has track experience on her side in Doomben Cup
2021/05/21 0:00:00,Lord Mayors Cup: Looks Like Elvis primed for elusive win
2021/05/21 0:00:00,Australia continues to fight for justice almost seven years after MH17 downing
2021/05/21 0:00:00,Queensland mum finds venomous snake in son’s bedroom
2021/05/21 0:00:00,UK retail sales surge in April on reopening
2021/05/21 0:00:00,Fury-Wilder reach tentative agreement for third fight: report
2021/05/21 0:00:00,Expanded e-tailer caught out as shoppers return to normal habits
2021/05/21 0:00:00,Drew Barrymore reveals she accidentally sent a video of herself getting changed to a 16-year-old boy
2021/05/21 0:00:00,Australia invites drug manufacturers to set up local mRNA operations
2021/05/21 0:00:00,Five Australian suburbs with the biggest property price spikes over 10 years
2021/05/21 0:00:00,Clovelly house price record smashed with circa $13.5m sale as Isador Magid grandson pounces
2021/05/21 0:00:00,Lisa Curry’s ‘sad and exhausting’ months since daughter Jaimi’s death
2021/05/21 0:00:00,Frosty start on the east coast for the weekend and possible snow in WA
2021/05/21 0:00:00,Top cop fears recent failings may deter DV victims from reporting crimes to police
2021/05/21 0:00:00,Perfect bedtime tech for a dreamy night's sleep
2021/05/21 0:00:00,William and Harry hit out at BBC over 'deceitful' Diana interview
2021/05/21 0:00:00,Mum shares how she has transformed her tiles using a $10 Bunnings product
2021/05/21 0:00:00,Aussies have rated the top 10 ‘best coffee’ in the country
2021/05/21 0:00:00,Australian Federal Police respond to disturbing child abuse investigation claims
2021/05/21 0:00:00,Prince Harry says he is ‘ashamed’ of how he responded Meghan Markle’s suicidal thoughts
2021/05/21 0:00:00,Brisbane Broncos officials ‘seething’ after secret talks
2021/05/21 0:00:00,Dogecoin price: Melbourne man makes millions from joke cryptocurrency
2021/05/21 0:00:00,China's 'shaking building' to stay closed for inspection
2021/05/21 0:00:00,Key Princess Diana detail Prince Harry is ignoring after Panorama investigation findings
2021/05/21 0:00:00,"Generation Alpha: Socially conscious, glued to screens and with far less focus on ‘ownership’"
2021/05/21 0:00:00,Brazilian singer MC Kevin dies ‘hiding from wife’ after threesome
2021/05/21 0:00:00,Major Crash investigators call for information after man dies in fiery crash near Albany
2021/05/21 0:00:00,Dr Zac on how to lose weight from stubborn pockets of fat
2021/05/21 0:00:00,Doomben Cup: How former English stayer Mugatoo turned into a weight-for-age star
2021/05/21 0:00:00,"Gaza has been destroyed and despite a ceasefire, the fight will continue"
2021/05/21 0:00:00,Diver taken to hospital after shark attack near popular West Australian beach
2021/05/21 0:00:00,Everest hopefuls 'camp' at home to avoid Covid-19 in Nepal
2021/05/21 0:00:00,Jana Hocking reveals millennial way to dump your boyfriend
2021/05/21 0:00:00,‘Work until I drop dead’: NSW bus drivers say they’re driving while fatigued
2021/05/21 0:00:00,'Slippery slope': All Blacks great fears US equity deal
2021/05/21 0:00:00,Africa has much higher mortality rate for very ill Covid patients: study
2021/05/21 0:00:00,Alleged meth dealer caught asleep at the wheel in a McDonald's car park
2021/05/21 0:00:00,Jamie Kah poised for another big day at Flemington with five favourites among her eight rides
2021/05/21 0:00:00,Japan bullet train driver left controls for high-speed toilet dash
2021/05/21 0:00:00,Warning over TikTok trend where children go missing on purpose
2021/05/21 0:00:00,‘Sad’ sight of boarded up branches of failed UK retailer Debenhams
2021/05/21 0:00:00,"The home decor trends from the 90s dating your home, according to an interior designer"
2021/05/21 0:00:00,West Australian coroner rules man found in abandoned mine shaft was homicide victim and his missing wife is also dead
2021/05/21 0:00:00,There’s still something about Byron Bay beyond the Instagram influencers and beige linen
2021/05/21 0:00:00,Kim Kardashian says Kourtney ‘degraded’ her nanny on KUWTK
2021/05/21 0:00:00,Reality of leaving a domestic violent relationship ‘nobody tells you about’
2021/05/21 0:00:00,Microsoft announces retirement of Internet Explorer
2021/05/21 0:00:00,Why you may need a vaccine passport sooner than you think
2021/05/21 0:00:00,Folau asked awkward ‘lesbian’ question at wild press conference
2021/05/21 0:00:00,Sydney property boom: winter market to remain hot as listings increase
2021/05/21 0:00:00,Aussie heavyweight Justin Tafa outlines his rise from NRL wannabe to UFC fighter
2021/05/21 0:00:00,Champion indigenous jockey Darby McCarthy has race named in his honour on Doomben Cup day
2021/05/21 0:00:00,Jim Jefferies blasts Manu Feildel and Channel 7 after being dumped from Australia’s Got Talent
2021/05/21 0:00:00,"Annastacia Palaszczuk, Jeannette Young have not received COVID-19 vaccine"
2021/05/21 0:00:00,Ex-MasterChef star Ben Ungermann cleared of sex assault but accepts responsibility for common assault of teenage girl
2021/05/21 0:00:00,School Strike 4 Climate protests: Students vent climate fury at protests
2021/05/21 0:00:00,Daniel Ricciardo’s ex-girlfriend moves on with another driver
2021/05/21 0:00:00,Reddit user shares photo of foul-smelling mysterious fungi in Mount Nebo
2021/05/21 0:00:00,Gisborne glass house is Australia’s most viewed property for sale
2021/05/21 0:00:00,Prince Harry reveals Meghan Markle fight that forced him to seek therapy
2021/05/21 0:00:00,"In new docuseries, Prince Harry again insists his family lacks empathy"
2021/05/21 0:00:00,Gunnedah man dies after being tasered by NSW Police
2021/05/21 0:00:00,Old Macca’s highway billboards fuels ‘conspiracy’ in viral TikTok
2021/05/21 0:00:00,"Health experts fear rise in gonorrhoea, amid soaring syphilis cases in Melbourne suburbs"
2021/05/21 0:00:00,All three leading men will return for ‘Sex And The City’ revival
2021/05/21 0:00:00,Search ends for good mystery sparkie who came to the aid of two women injured in horror crash
2021/05/21 0:00:00,Jumbled’s Pip Brett shares 4 lessons learned from career mistakes
2021/05/21 0:00:00,‘Impractical and dysfunctional’: Farmers slam government’s ‘napalm’ mouse-killing method
2021/05/21 0:00:00,Annastacia Palaszczuk and Scott Morrison stoush over regional quarantine heats up again
2021/05/21 0:00:00,Why vaccinated people are still catching COVID-19
2021/05/21 0:00:00,Acupuncture benefits: Everything you need to know about extras insurance
2021/05/21 0:00:00,Business network puts travel proposal to federal government
2021/05/21 0:00:00,The wait is over: Friends reunion will stream in Australia on BINGE
2021/05/21 0:00:00,"Randwick house price record broken with $8.5m+ sale, $2m over price guide, in 3 days"
2021/05/21 0:00:00,‘No chance’: China’s empty threat to harm Australia by stepping up domestic iron ore mining
2021/05/21 0:00:00,New Ford F-150 Lightning revealed: Electric pick-up due in 2022
2021/05/21 0:00:00,Kendall Jenner accused of cultural appropriation over 818 Tequila ad
2021/05/21 0:00:00,El Salvador ex-cop had 14 victims buried at his home
2021/05/21 0:00:00,Doomben Cup: Annabel Neasham up against her former boss Ciaron Maher for Group 1 bragging rights
2021/05/21 0:00:00,One ‘reckless’ decision that killed UK retail giant Debenhams
2021/05/21 0:00:00,"Inside house of horrors which held guns, trash – and the rotting corpses of two dead men"
2021/05/21 0:00:00,Australia’s vaccination rollout issues laid bare in tweet from Anthony Albanese
2021/05/21 0:00:00,Risky new trend sees stars like Kylie Jenner and Bella Hadid barely covering their boobs
2021/05/21 0:00:00,Man jailed after being caught trying to meet with 14yo girl
2021/05/21 0:00:00,Prince Harry and Meghan Markle have a habit of trying to rewrite history
2021/05/21 0:00:00,Blinken to travel to Middle East 'in the coming days': State Department
2021/05/21 0:00:00,John Daly kickstarts the PGA Championship with an incredible shot
2021/05/21 0:00:00,‘Be vigilant’: Alert for 15 Sydney suburbs after COVID-19 detected in sewage
2021/05/21 0:00:00,Former Arsenal striker Nicklas Bendtner’s girlfriend matches with Spider-Man star Tom Holland
2021/05/21 0:00:00,Greek villages evacuated as forest fire rages
2021/05/21 0:00:00,Folau asked awkward question over reported ‘lesbian’ line
2021/05/21 0:00:00,This week: Dr Magdoline Awad explains why vet bills tend to be high
2021/05/21 0:00:00,Folau’s shock return locked in: ‘He’s been cleared by the Broncos’
2021/05/21 0:00:00,Prince William’s use of ‘I’ and ‘my’ in Diana statement will break Harry’s heart
2021/05/21 0:00:00,Hamas claims victory in conflict with Israel after ceasefire
2021/05/21 0:00:00,Cancer conwoman’s Belle Gibson Melbourne home raided over unpaid fines
2021/05/21 0:00:00,"US seizes tigers, lions from 'Tiger King' park"
2021/05/21 0:00:00,"Man filmed family dogs licking his penis because he was ‘bored’, sent videos on Snapchat"
2021/05/21 0:00:00,Snapchat claims 500 mn users amid pandemic-fueled surge
2021/05/21 0:00:00,Solar panel maintenance: The hidden cost of green energy
2021/05/21 0:00:00,Canada's Conners grabs PGA lead with 67 at windy Kiawah
2021/05/21 0:00:00,Inter Milan agree multi-million euro loan with US investment firm
2021/05/21 0:00:00,European clubs set to lose 8.7 billion euros as a result of virus
2021/05/21 0:00:00,Commonwealth Bank has bumped up its three and four year fixed rates on home loans
2021/05/21 0:00:00,Backlash over Victorian town’s fight against tourist influx
2021/05/21 0:00:00,Earl Charles Spencer thanks journalist Andy Webb for Diana investigations
2021/05/21 0:00:00,Indigenous artist fuming over ‘stolen’ AFL club guernsey design
2021/05/21 0:00:00,Opposition Leader Anthony Albanese opens up about his health kick
2021/05/21 0:00:00,Jake Paul rips Tyson Fury’s cringe call out: ‘It’s quite embarrassing’
2021/05/21 0:00:00,Friends reunion to stream on BINGE in Australia express from US May 27
2021/05/21 0:00:00,Thousands have applied to ‘Work in Paradise’ within 24 hours of scheme being launched
2021/05/21 0:00:00,Stamp duty savings for inner Melbourne: Apartment buyer budget a boost for Australia 108
2021/05/21 0:00:00,Cryptocurrency founder’s grim ‘bubble’ warning after market crash
2021/05/21 0:00:00,Tayla Harris seeking third AFLW club after Carlton talks called off
2021/05/21 0:00:00,"Ceasefire between Israel, Hamas comes into force"
2021/05/21 0:00:00,Scott Morrison grilled over response to state border closures
2021/05/21 0:00:00,Bitcoin price rises above $40k after cryptocurrency market crash
2021/05/21 0:00:00,Nurse cleared of murdering kids by reason of ‘insanity’
2021/05/21 0:00:00,Australia finally scores Kiwi Cadbury block
2021/05/21 0:00:00,CCTV footage shows jogger being followed by alleged killer before murder
2021/05/21 0:00:00,Infamous royal interview that rocked the world
2021/05/21 0:00:00,Tradie goes viral on TikTok after ripping up the backyard of the wrong house
2021/05/21 0:00:00,Prince Harry’s extraordinary statement amid Princess Diana Panorama interview findings
2021/05/21 0:00:00,All sides must make 'welcome' Gaza ceasefire durable: UK's Raab
2021/05/21 0:00:00,Bette Midler announces ‘Hocus Pocus 2’ is coming
2021/05/21 0:00:00,Biden sees 'genuine opportunity' after Gaza ceasefire
2021/05/21 0:00:00,Double Bay cements itself as hottest commercial market in Australia with $25.5m auction sale
2021/05/21 0:00:00,Prince William slams ‘deceitful’ BBC interview with Princess Diana
2021/05/21 0:00:00,Australian parliament workplace culture under microscope
2021/05/21 0:00:00,Unusual way woman claims to have busted her cheating ex
2021/05/21 0:00:00,AFL club’s cheeky message to sexbot who said dad prefers her naked
2021/05/21 0:00:00,Clashes on Morocco border as Madrid accuses Rabat of 'blackmail'
2021/05/21 0:00:00,Melbourne shivers through coldest morning of the year as cold snap freezes east coast of Australia
2021/05/21 0:00:00,'Culture of exploitation' in Diana interview 'ultimately took her life': Harry
2021/05/21 0:00:00,Buyer snaps up Strathalbyn home moments after seeing inside it for the first time
2021/05/21 0:00:00,Biggera Waters: Qld police seek assistance to find Brooke Patterson-Buckton and infant daughter
2021/05/21 0:00:00,Lappa: Former mining town west of Cairns for sale for $340K
2021/05/21 0:00:00,M. Night Shyamalan reveals truth about drunken night with Matthew Perry
2021/05/21 0:00:00,Roadside worker crushed by truck in tragic accident at Allawah
2021/05/21 0:00:00,'Deceitful' Diana interview 'should never be aired again': Prince William
2021/05/21 0:00:00,Joel Edgerton welcomes first child with Christine Centenera
2021/05/21 0:00:00,Dogecoin price: Image sends volatile crypto coin wild
2021/05/21 0:00:00,Biden to make televised remarks after Israel ceasefire: W.House
2021/05/21 0:00:00,Devastating scenes at the Sydney home where baby boy died after ’near drowning’
2021/05/21 0:00:00,Arctic nations pledge to fight global warming despite rising tensions
2021/05/21 0:00:00,Ricciardo fumes at Ferrari during Monaco flop: ‘What the f***?’
2021/05/21 0:00:00,Egypt to monitor Israel-Gaza ceasefire: diplomatic sources
2021/05/21 0:00:00,2021 Volkswagen Tiguan 162TSI R-Line review: SUV jumps to the front of the pack
2021/05/21 0:00:00,Woman dies days after desperate call for help during Wollongong house fire
2021/05/21 0:00:00,Gaza ceasefire: Israel and Hamas agree to stop fighting
2021/05/21 0:00:00,"Israel, Palestinian groups, agree Gaza ceasefire"
2021/05/21 0:00:00,Vance Joy reveals long distance relationship inspired new single
2021/05/21 0:00:00,Highton Mid Century Modernist house snapped up in huge deal
2021/05/21 0:00:00,Killer dad John Edwards lurked at daughter’s ice skating rink before murdering kids
2021/05/21 0:00:00,Dark secrets of rural backwater where teen girls vanished
2021/05/21 0:00:00,Live breaking news: ‘Destroying our future’: Teen unleashes
2021/05/21 0:00:00,Mine kills 16 civilians in northern Mali: hospital sources
2021/05/21 0:00:00,US Treasury backs global minimum corporate tax of at least 15%
2021/05/21 0:00:00,New sensation: pioneering mind-controlled arm restores sense of touch
2021/05/21 0:00:00,"Chris Cuomo: CNN anchor inappropriately gave political advice to brother Andrew Cuomo, but won’t be disciplined"
2021/05/21 0:00:00,AU seeks 'democratic transition' in Chad in 18 months
2021/05/21 0:00:00,Tinnie of the Week: Whisky Business whisky sour beer from South Fremantle’s Running With Thieves
2021/05/21 0:00:00,"Palestinian envoy, Israel accuse other of 'genocide' at UN"
2021/05/21 0:00:00,Snapchat claims 500 mn monthly active users
2021/05/21 0:00:00,Maradona's medical team face manslaughter probe over star's death: source
2021/05/21 0:00:00,Eiffel Tower to reopen July 16: operator
2021/05/21 0:00:00,"EU member states, European Parliament reach deal on Covid travel pass"
2021/05/21 0:00:00,"Five more killed in Gaza, death toll rises to 232: ministry"
2021/05/21 0:00:00,French court rejects key article of Macron security law on filming police
2021/05/21 0:00:00,All adults in France eligible for Covid jabs from May 31: PM
2021/05/21 0:00:00,EU parliament blocks China investment deal over sanctions
2021/05/21 0:00:00,"Merkel, Abbas back Middle East ceasefire efforts"
2021/05/21 0:00:00,"Attacks between Israel, Palestinian militants 'unacceptable': Guterres"
2021/05/21 0:00:00,Unique Baulkham Hills home set to break local property records
2021/05/21 0:00:00,Zagame family behind hospitality empire lists $27m Brighton mansion
2021/05/21 0:00:00,Sydney housing: The cheapest homes with a backyard on the market in NSW and Sydney
2021/05/21 0:00:00,Australian housing affordability: What different incomes can buy in the property market right now
