date,title
2021/11/25 0:00:00,James Weir recaps The Bachelorette Australia 2021 finale
2021/11/25 0:00:00,Zoos SA staff in ‘tastefully disrobed’ calendar shoot for animal conservation
2021/11/25 0:00:00,Family of man accused of murdering missing campers Greg Lynn breaks silence
2021/11/25 0:00:00,AFL Draft 2021 Night 2: Prospect suspended for banned substance
2021/11/25 0:00:00,Candice Warner weighs in on Tim Paine sexting scandal
2021/11/25 0:00:00,"‘Smells bad’: Tim Paine, Cricket Australia torched in brutal Q&A"
2021/11/25 0:00:00,‘No words’: Rare diamond duck as Melbourne Renegades batting order collapses in WBBL Challenger
2021/11/25 0:00:00,"Covid cases in Adelaide, SA: Exposure sites listed at airport and Brighton"
2021/11/25 0:00:00,Millionaire Hot Seat’s $1m quiz: Can you answer the questions correctly?
2021/11/25 0:00:00,Mick Price focused solely on the future at Cranbourne after locking up Caulfield stable for the last time
2021/11/25 0:00:00,"Kamahl opens up on marriage breakdown, addiction struggle"
2021/11/25 0:00:00,Mac Andrew’s AFL milestone is just the beginning
2021/11/25 0:00:00,"Andrew Garfield’s answer to Stephen Colbert, explaining the grief of losing his mother, strikes a chord with viewers"
2021/11/25 0:00:00,Moe trainer Allison Bennett giving honest stayer Monmouth another crack at the Sandown Cup
2021/11/25 0:00:00,Sheffield Shield: Usman Khawaja’s selfless call amid Ashes battle
2021/11/25 0:00:00,Decision on Victoria’s troubled pandemic laws looms over MPs heads
2021/11/25 0:00:00,NRL 2021: Melbourne Storm star Christian Welch makes call on playing future
2021/11/25 0:00:00,Still wary Australians ‘persistently’ hoarding savings
2021/11/25 0:00:00,Racing Queensland officials face scheduling nightmare as deluge threatens Gold Coasting meeting
2021/11/25 0:00:00,Scott Morrison defends Religious Discrimination Bill with a promise to gay students and teachers
2021/11/25 0:00:00,22-month-old toddler found unresponsive in Traralgon property
2021/11/25 0:00:00,Tameka Yallop to make her 100th Matildas appearance at Stadium Australia against USA
2021/11/25 0:00:00,Age Of Chivalry to be Mathew Ellerton and Simon Zahra’s last city runner at Caulfield
2021/11/25 0:00:00,Venom: Let There Be Carnage skates by on witty banter
2021/11/25 0:00:00,Justis Huni boxing return an unbeaten All-Aussie fight with Joseph Goodall
2021/11/25 0:00:00,Tyler Schiller has sights on ­apprentice’s metro title after breakthrough weekend
2021/11/25 0:00:00,Staff member who attended official AFL draft event tests positive to Covid-19
2021/11/25 0:00:00,Australia to send ADF and AFP to Solomon Islands amid mounting unrest
2021/11/25 0:00:00,‘Happy tears’: Stricken footballer Danny Hodgson moved out of ICU ward
2021/11/25 0:00:00,Kogan lashed by investors after share price plunge but dodges board spill
2021/11/25 0:00:00,US woman found dead and may have been mauled by her own dogs
2021/11/25 0:00:00,Jockey Tom Ryan has high-pressure Valley ride before key Jericho Cup mount
2021/11/25 0:00:00,Unvaccinated Year 12 students granted exemptions for end of year formals
2021/11/25 0:00:00,"Drama-packed session on ASX, with bank spanked, cannabis company chair quitting and bedlinen retailer bulking on furniture"
2021/11/25 0:00:00,Iron ore export numbers show how reliant Australia is on China
2021/11/25 0:00:00,Lockdown emails from Gladys Berejiklian’s resignation day revealed
2021/11/25 0:00:00,Australian football fans set for festive treat as FFA Cup will have seven games in eight days
2021/11/25 0:00:00,Senate explodes with anger as PM’s lack of action on anti-vax MP is revealed
2021/11/25 0:00:00,Former Socceroo Neil Kilkenny ‘happy’ at Western United after controversial split with Perth Glory
2021/11/25 0:00:00,Shaquille O’Neal explains dramatic body transformation
2021/11/25 0:00:00,AFL draft: Finn Callaghan weighs in on GWS Giants’ decision to bid on Nick Daicos
2021/11/25 0:00:00,Titane review: Wholly original and wholly shocking
2021/11/25 0:00:00,Former ABC journalist Zoe Daniel to run at next federal election
2021/11/25 0:00:00,Mum of slain jogger Ahmaud Arbery hails guilty verdict: ‘He will now rest in peace’
2021/11/25 0:00:00,How Jessica Sepel created a $426 million wellness empire
2021/11/25 0:00:00,Tex Walker returns to Crows training for first time after Robbie Young racism row
2021/11/25 0:00:00,AFL draft: No.1 pick Jason Horne-Francis slept in North Melbourne guernsey
2021/11/25 0:00:00,Mark Newnham has faith young duo Tyler Schiller and Tom Sherry can overcome wide barriers
2021/11/25 0:00:00,Raceday focus: Best bets and analysis for The Valley on Friday
2021/11/25 0:00:00,Masks to stay in more places in NSW under Covid road map changes
2021/11/25 0:00:00,Jacinda Ardern breaks record as Judith Collins is ousted as National leader in New Zealand
2021/11/25 0:00:00,Idris Elba thought he’d been shot by Denzel Washington on set of American Gangster
2021/11/25 0:00:00,NSW voluntary assisted dying Bill passes the parliament’s lower house
2021/11/25 0:00:00,"Disgraced ex-MP Barry Urban jailed in WA for lying about work, police, military experience"
2021/11/25 0:00:00,Lollipop lady says there is a downside to making $2k every week
2021/11/25 0:00:00,AFL world loses it over draftee’s wardrobe blunder
2021/11/25 0:00:00,How renewable energy will impact Australian electricity bills
2021/11/25 0:00:00,Crypto donors to pay $1.4 million in fees for failed bid to buy US Constitution
2021/11/25 0:00:00,Russell’s Old Corner Shop: Melbourne’s oldest home sells for first time in 100+ years
2021/11/25 0:00:00,Ellsberg ready to strike in Festival Stakes after skipping The Gong
2021/11/25 0:00:00,Champion jockey Glen Boss calls time on decorated riding career after 90 Group 1 wins
2021/11/25 0:00:00,David Payne goes into bat for Canterbury pair Caboteur and Chappelli
2021/11/25 0:00:00,Melbourne prestige property: Spike in sales at market’s top end following onset of Covid-19
2021/11/25 0:00:00,NBA wrap: Josh Giddey propels himself into elite company as Patty Mills can’t stop scoring
2021/11/25 0:00:00,"Raceday focus: Best bets, inside mail for Canterbury and Muswellbrook"
2021/11/25 0:00:00,Global interest in Fremantle harbour’s Little Creatures brewery site
2021/11/25 0:00:00,Scott Morrison unleashes over Gladys Berejiklian in strongest attack yet on NSW ICAC
2021/11/25 0:00:00,Queensland jockey Jake Bayliss fulfils Singapore dream along with Ronnie Stewart
2021/11/25 0:00:00,‘Am I going to live?’: Victim of gay hate crime speaks out after attacker sentenced to prison
2021/11/25 0:00:00,Colourful Seddon entertainer anything but ‘vanilla’
2021/11/25 0:00:00,"Indonesia bans Christmas, New Year leave to stop Covid surge"
2021/11/25 0:00:00,Rugby: Australia set to host the 2027 World Cup after being endorsed as the preferred candidate
2021/11/25 0:00:00,Twins charged with historical child sex abuse during cold case investigation
2021/11/25 0:00:00,Wowbeds Duo Mattress review: Key to getting a good night’s sleep
2021/11/25 0:00:00,Home prices to plunge as early as next year for some capital cities
2021/11/25 0:00:00,Fury over vile ‘White Rose’ stickers in Melbourne
2021/11/25 0:00:00,Acreage sets new record for Dooralong Valley
2021/11/25 0:00:00,Tim Paine out for seven runs in second innings of Tasmania second XI clash with South Australia
2021/11/25 0:00:00,Boeing knew doomed 737-MAX plane was ‘pig swith lipstick’ but still let it fly
2021/11/25 0:00:00,Concerns raised over Viral Adventure’s Brisbane restaurant Karen’s Diner
2021/11/25 0:00:00,JP Morgan CEO Jamie Dimon apologises after Chinese Communist Party joke furore
2021/11/25 0:00:00,ABC upfronts: Israel Folou documentary among 2022 programming
2021/11/25 0:00:00,"La Nina explained: How the climate driver forms, its effects and the difference climate change brings"
2021/11/25 0:00:00,‘Controversial’ detail in Emily Ratajkowski’s latest Instagram post
2021/11/25 0:00:00,In-demand Eels star Reed Mahoney signs four-year deal with Bulldogs
2021/11/25 0:00:00,‘Get a life’: Chief Minister hits back at ‘unhinged’ international trolls spreading misinformation about NT’s Covid response
2021/11/25 0:00:00,Allan Chau becomes dual-licence trainer with backing from Hong Kong-based A List Stud
2021/11/25 0:00:00,Interview with UK reality ‘diva’ resurfaces after Matt Doran’s unfortunate meeting with Adele
2021/11/25 0:00:00,‘Got to be careful’: Michael Clarke’s captaincy warning for Steve Smith
2021/11/25 0:00:00,KFC SuperCoach BBL: Expert teams revealed for BBL11
2021/11/25 0:00:00,Relationship Rehab: Reason woman has ‘very low sex drive’
2021/11/25 0:00:00,Rugby rule change opens the door for Israel Folau to play for Tonga
2021/11/25 0:00:00,Tennis stars to serve up the heat at 2022 Australian Open
2021/11/25 0:00:00,PM accused of ‘losing control’ as Parliament erupts into chaos
2021/11/25 0:00:00,‘I sleep with married men – here’s how to spot a cheater’
2021/11/25 0:00:00,New data reveals Queensland will struggle to reach 90 per cent vaccine coverage
2021/11/25 0:00:00,Rugby: Tonga coach Toutai Kefu has declared for former Wallaby Israel Folau will play for him after a change to eligibility rules
2021/11/25 0:00:00,Scandal-plagued marriage of Prince Albert and Princess Charlene
2021/11/25 0:00:00,YOU GOT THIS: Mum’s ‘life-changing’ transformation
2021/11/25 0:00:00,Art Cadeau ready to leap out of country class in Festival Stakes
2021/11/25 0:00:00,Australian Open: Record 17 tournaments will be played around Australia before 2022 Australian Open
2021/11/25 0:00:00,"Big 4 analysis: Zipping Classic, Guineas, Festival, Winterbottom"
2021/11/25 0:00:00,Jelly sandals and Paddle Pop prizes: TikTok is getting nostalgic
2021/11/25 0:00:00,Inside secret rooms in airports you need to know about
2021/11/25 0:00:00,"Apple HomePod mini review: Sound quality, features, price and battery"
2021/11/25 0:00:00,US woman shares heartbreak over abortion at five months
2021/11/25 0:00:00,"Raceday focus: Tips, analysis and best bets for Zipping Classic Day on Saturday"
2021/11/25 0:00:00,Minogue family makes almost $20m in Hawthorn property deal
2021/11/25 0:00:00,Madonna breaks Instagram rules with racy photo spree
2021/11/25 0:00:00,Sydney couple to make $50K a year after buying 11 unit block for $575k
2021/11/25 0:00:00,Karl Stefanovic rants after sisters compare jailed climate protester brother to Nelson Mandela
2021/11/25 0:00:00,Scott Morrison government’s proposed Religious Discrimination Bill leaves room for refusing to hire gay teachers
2021/11/25 0:00:00,Ashes: Test spinner Nathan Lyon declares former Australian captain Tim Paine must play
2021/11/25 0:00:00,"Evie Toombes, sues mother’s doctor, in landmark ‘wrongful conception’ case"
2021/11/25 0:00:00,Treasurer taunted with cruel nickname after he struggled to open a bottle of water
2021/11/25 0:00:00,Sydney CBD fringe attracts new wave of tenants as employers try to entice workers back to office
2021/11/25 0:00:00,Australia relies on China for 90 per cent of solar panel imports
2021/11/25 0:00:00,Family who started investing while earning money serving snacks now own over 50 properties
2021/11/25 0:00:00,Boris Johnson attacks France after dozens of migrants killed in English Channel tragedy
2021/11/25 0:00:00,"Concern after NFL star wields gun, sends alarming text messages"
2021/11/25 0:00:00,Argentinian girl loses toe in mass piranha attack
2021/11/25 0:00:00,"Police divers search dam, creek for William Tyrrell on 11th day of search"
2021/11/25 0:00:00,Ashes: England’s preparations for next month’s first Test suffer a blow because of constant Brisbane rain
2021/11/25 0:00:00,DiDi suspends driver after investigating Melbourne passenger’s attempted abduction complaint
2021/11/25 0:00:00,Brisbane woman claims bank error saw her lose her dream home
2021/11/25 0:00:00,"Sam Neill leads star-studded cast for upcoming Foxtel original, The Twelve"
2021/11/25 0:00:00,"Kids witnessed fatal Ravenswood stabbing, police want to speak with Kerry Whiting"
2021/11/25 0:00:00,Woman’s extreme act to make ex-boyfriend jealous
2021/11/25 0:00:00,Passenger claims woman breastfed cat on-board flight
2021/11/25 0:00:00,‘Breaking rules’: Debate after Marnus wins controversial honour
2021/11/25 0:00:00,Gold Coast mum loses battle with stage four melanoma cancer
2021/11/25 0:00:00,Sydney woman’s Gumtree ads mysteriously disappear after trying to sell belongings before vanishing
2021/11/25 0:00:00,"Aquarius Backpackers: 84 guests, staff at Byron Bay hostel locked down due to unvaccinated staff member"
2021/11/25 0:00:00,George Christiansen condemned by Nats colleague David Littleproud for ‘civil disobedience’ comments
2021/11/25 0:00:00,"Woman almost lost $260,000 Instant Scratch-Its ticket, threw it in rubbish bin"
2021/11/25 0:00:00,An astronomy expert has recommended not staring at the asteroid as it hurtles towards Earth
2021/11/25 0:00:00,Whopping $80m Powerball prize up for grabs next week
2021/11/25 0:00:00,Man cuts down his possessions to just 44 things
2021/11/25 0:00:00,Ex-Playboy bunny lifts lid on ‘wild’ sex parties
2021/11/25 0:00:00,NRL star Nicho Hynes clarifies sexuality after Instagram post
2021/11/25 0:00:00,Doctors warn of new Covid strain found in Botswana with ‘incredibly high’ number of mutations
2021/11/25 0:00:00,Key difference in these photos led cops to pilot in missing campers case
2021/11/25 0:00:00,Why opening international borders could ruin Australia’s economic recovery
2021/11/25 0:00:00,Sweden’s first female Prime Minister Magdalena Andersson resigns on day one
2021/11/25 0:00:00,Flight attendant advises when you should avoid touching the call button
2021/11/25 0:00:00,New religious freedom laws will give private schools right to refuse to hire gay teachers
2021/11/25 0:00:00,Real Madrid star Karim Benzema found guilty in sex tape blackmail plot
2021/11/25 0:00:00,John O’Shea changes it up for Southern Lad in an attempt to keep streak going
2021/11/25 0:00:00,NSW records 276 new Covid cases and no new deaths on Thursday
2021/11/25 0:00:00,NSW’s new top cop Karen Webb considering ‘SVU-style’ squads to fight sex crimes
2021/11/25 0:00:00,Serious knee injury to sideline Sydney FC midfielder Luke Brattan for season
2021/11/25 0:00:00,Santa gets a boyfriend in new Norwegian Christmas ad
2021/11/25 0:00:00,New police boss says no DNA evidence has been found in new William Tyrrell search
2021/11/25 0:00:00,The messiest celebrity breakups ever
2021/11/25 0:00:00,American star’s ex-wife enjoys last laugh with wild divorce party
2021/11/25 0:00:00,"Told a month ago he was Ashes bound, Test opener Marcus Harris is ready to change his fortunes against England"
2021/11/25 0:00:00,"More than 10,000 feral horses to be removed from Kosciuszko National Park"
2021/11/25 0:00:00,Clive Palmer ‘won’t rule out’ a return to parliament as United Australia Party gears up for election
2021/11/25 0:00:00,Three men who killed unarmed jogger Ahmaud Arbery learn fate
2021/11/25 0:00:00,Jessie J reveals miscarriage heartbreak after secretly deciding to have baby on her own
2021/11/25 0:00:00,"Tigers star Luciano Leilua to play out contract, missing $700k pay day"
2021/11/25 0:00:00,Victoria records 1254 new local cases of coronavirus
2021/11/25 0:00:00,A North Korean student will be executed for sharing the hit Netflix show with their classmates
2021/11/25 0:00:00,Keanu Reeves confirms wild Winona Ryder rumour
2021/11/25 0:00:00,Teen ‘abducted’ while on her way to see her boyfriend
2021/11/25 0:00:00,Warnings in place as 4000km rain band to lash several states
2021/11/25 0:00:00,The Voice contestant’s brutal live TV accident
2021/11/25 0:00:00,Australia urged to consider bold move against China amid Peng Shuai saga
2021/11/25 0:00:00,Shock Harry move that ‘blew Charles out of the water’
2021/11/25 0:00:00,Amanda-Jade Wellington smashes WBBL bowling record in insane spell
2021/11/25 0:00:00,Australian property prices: Regional renaissance unearths towns with extraordinary price growth
2021/11/25 0:00:00,Harry Potter reunion to stream express in Australia on Binge
2021/11/25 0:00:00,Ford ‘not proud’ of Ranger problems
2021/11/25 0:00:00,AFL Draft 2021: Tears flow as No. 1 pick named in bizarre fashion
2021/11/25 0:00:00,‘Best interview ever’: AFL world loses it at draftee’s rowdy celebration
2021/11/25 0:00:00,Where to buy in Australia with a deposit of less than $100k
2021/11/25 0:00:00,"Mean Girls star Lacey Chabert reveals death of sister, Wendy"
2021/11/25 0:00:00,Best Canningvale Black Friday deals in 2022
2021/11/25 0:00:00,France and China take aim at Australia in latest AUKUS drama
2021/11/25 0:00:00,Advocates call for dramatic change to Indigenous domestic violence approach
2021/11/25 0:00:00,Young Victorian girl becomes South Australia’s first Covid case since reopening borders
2021/11/25 0:00:00,Gippsland poised to be regional Victoria’s next property star
2021/11/25 0:00:00,Ian Cohen: Sports media veteran lists slick Clifton Hill pad
2021/11/25 0:00:00,Warning over how kids are taught maths
