date,title
2021/01/02 0:00:00,How to take comfort from 2020: Knit the weather into one big temperature blanket
2021/01/02 0:00:00,Indian cricket legend Sourav Ganguly hospitalised after ‘mild heart attack’
2021/01/02 0:00:00,Eagle Farm races: Apache Chase shows true colours in Vo Rogue Plate
2021/01/02 0:00:00,Seven easy ways to keep the calories down this year
2021/01/02 0:00:00,Pregnant influencer Emily Mitchell dead at 36
2021/01/02 0:00:00,The verdict: Glen Boss suffers concussion after fall at Eagle Farm
2021/01/02 0:00:00,Joe Burns fails but Brisbane Heat bounce back with upset four wicket win over Sydney Sixers
2021/01/02 0:00:00,Montepulciano set for ambitious campaign after impressive win at Gawler for Chantelle Jolly
2021/01/02 0:00:00,Man catches six in his beer in Aussiest crowd catch you’ll ever see
2021/01/02 0:00:00,Lleyton Hewitt Evening Glory wins with part-owner Lleyton Hewitt in the stands at Caulfield
2021/01/02 0:00:00,Former umpire Daryl Harper’s Tim Paine advice as calls for umpire’s call ban intensify
2021/01/02 0:00:00,Kerry Parnell: What the Royal Family really wants for 2021
2021/01/02 0:00:00,Health Hacker: How to stick to your New Year resolutions
2021/01/02 0:00:00,Star Wars: New Mandalorian controversy has fans fighting again
2021/01/02 0:00:00,Jodie Whittaker reveals more about her fears playing Doctor Who as new season drops
2021/01/02 0:00:00,Inside Zac Efron’s low key Australian life
2021/01/02 0:00:00,GALLERY: Tasmanian Ocean Swim series enters second leg
2021/01/02 0:00:00,Prison cook arrested for soliciting sex act from an inmate
2021/01/02 0:00:00,WA health minister says COVID-19 jumped into Victoria because NSW failed to control its outbreak
2021/01/02 0:00:00,Adam Zampa banned for one match as Melbourne Stars and Hobart Hurricanes ring in the changes
2021/01/02 0:00:00,Indian cricket stars caught in potential COVID-19 biosecurity breach at Melbourne restaurant
2021/01/02 0:00:00,"Coronavirus: Pair who fled from Melbourne airport to avoid quarantine will be fined $38,000"
2021/01/02 0:00:00,Coronavirus WA: Health Minister Roger Cook says no Victorian in WA has tested positive for COVID-19
2021/01/02 0:00:00,Semi-professional basketball player questioned after body found in Perth home
2021/01/02 0:00:00,Randwick races: Four Moves Ahead shows Golden Slipper potential after sizzling debut
2021/01/02 0:00:00,Racing Australia scrap X-rated horse names following social media reaction
2021/01/02 0:00:00,Man stabbed to death in North Melbourne apartment
2021/01/02 0:00:00,A-League: Tomi’s time to shine for Adelaide United against Melbourne City
2021/01/02 0:00:00,Police release CCTV of alleged Melbourne equipment heist
2021/01/02 0:00:00,Man allegedly hid meth in hamburger for person in hotel quarantine in Perth
2021/01/02 0:00:00,Najee Harris’ ‘Superman’ leap in College Football Playoff semi-final stuns sporting world
2021/01/02 0:00:00,Appeals court vacates order delaying execution of Lisa Montgomery
2021/01/02 0:00:00,Investors reveal how they make money on the stock market
2021/01/02 0:00:00,Traffic queues into Canberra as the ACT bans travellers from NSW coronavirus hot spots
2021/01/02 0:00:00,Queen ‘took two seconds’ to ban Prince Harry from Cenotaph wreath ceremony
2021/01/02 0:00:00,Busy Philipps reveals 12-year-old child Birdie is gay
2021/01/02 0:00:00,Gold Coast Titans 2021 preview: Anticipation builds as David Fifita and Tino Fa’asuamaleaui strengthen line-up
2021/01/02 0:00:00,Justin Bieber shocks fans with revealing underwear video
2021/01/02 0:00:00,NSW Premier Gladys Berejiklian takes swipe at Victoria with huge COVID-19 boast
2021/01/02 0:00:00,New Year’s Test match remains at SCG despite new COVID-19 restrictions
2021/01/02 0:00:00,Victoria’s health minister makes ‘no apology’ for shutting NSW border
2021/01/02 0:00:00,Premier Gladys Berejiklian announces tough new restrictions across state
2021/01/02 0:00:00,Highly infectious coronavirus mutation from UK now tearing across US
2021/01/02 0:00:00,‘Highly doubtful’: David Warner’s dire confession about New Year’s Test match against India
2021/01/02 0:00:00,Sydney introduces mask mandate from midnight as coronavirus cases rise
2021/01/02 0:00:00,Seven cases recorded in NSW as government moves to mandate masks in Sydney and surrounds
2021/01/02 0:00:00,Love Island star Jamie Jewitt vows to ditch ‘dad bod’
2021/01/02 0:00:00,Woman shares hilarious Woolworths lasagne mishap after meal goes horribly wrong
2021/01/02 0:00:00,Several Victorian venues placed on alert as state records 10 new local cases
2021/01/02 0:00:00,Venomous red-belly black snake found slithering through sand dunes at a popular Sydney beach
2021/01/02 0:00:00,One body found as the search continues for nine missing others after Norwegian landslide
2021/01/02 0:00:00,Man to face court after allegedly jumping into a lake to avoid police
2021/01/02 0:00:00,BBL: Renegades confident Aaron Finch will be allowed to enter Perth
2021/01/02 0:00:00,Victorian outbreak’s Sydney link confirmed as state records 10 new local cases
2021/01/02 0:00:00,What to expect in Melbourne property market in 2021
2021/01/02 0:00:00,"US Congress delivers rare presidential snub, overriding Trump’s veto of crucial bill"
2021/01/02 0:00:00,Football world explodes in outrage over ‘ridiculous’ Edinson Cavani punishment
2021/01/02 0:00:00,"BWS, Coffee Club, Officeworks and Hillsong among latest NSW virus exposure sites"
2021/01/02 0:00:00,Ocean Grove’s Broome Cottage sale wrapped up
2021/01/02 0:00:00,US Government set to reveal UFO secrets
2021/01/02 0:00:00,Anthony Albanese promises no changes to franking credits if Labor wins the next election
2021/01/02 0:00:00,Black Summer bushfires inspire children’s book Brave-Bottomed Wombat
2021/01/02 0:00:00,Oncology nurse’s shock breast cancer diagnosis before wedding
2021/01/02 0:00:00,Which SUV should I buy? Toyota RAV4 the logical choice
2021/01/02 0:00:00,South Australian property experts reveal where to buy in 2021
2021/01/02 0:00:00,Watch heartwarming moment The Rock leaves lifelong friend in tears
2021/01/02 0:00:00,Forgotten Aussie batsman Usman Khawaja wins hearts with stunning midgame speech
2021/01/02 0:00:00,‘Hero s***’: Aussie surfer Mikey Wright saves a life in scary waves in Hawaii
2021/01/02 0:00:00,Sydney Thunder young gun Tanveer Sangha turning heads in maiden Big Bash League campaign
2021/01/02 0:00:00,"Coronavirus NSW, Vic: Lyle Shelton's Queensland border brag tips off police"
2021/01/02 0:00:00,NSW real estate spending hit new heights in 2020 as COVID spurred home buying frenzy
2021/01/02 0:00:00,Geelong’s most in-demand suburbs for househunters in 2020
2021/01/02 0:00:00,"Suburbs set to boom in 2021: Central Coast, Greater Byron region to lead growth"
