date,title
2021/10/02 0:00:00,Mitchell Starc’s classy gesture to help Australia’s women’s Test team
2021/10/02 0:00:00,China is being choked by Xi Jinping’s crackdown
2021/10/02 0:00:00,Gabby Petito: Police receive tips that Brian Laundrie may be hiding on Appalachian Trail
2021/10/02 0:00:00,‘You’re dying tonight’: Former kids’ TV presenter Paul Ballard’s chilling threat to woman as he raped her
2021/10/02 0:00:00,Australia v India player ratings: Historic pink ball Test peters out to draw
2021/10/02 0:00:00,Aussie NFL star Jordan Mailata’s message to South Sydney ahead of NRL Grand Final
2021/10/02 0:00:00,‘Are you double dosed?’: How to ask friends and family if they’re vaccinated
2021/10/02 0:00:00,Fresh training partnership of John Hickmott and Carrina Riggs delivered once again at Morphettville on Saturday
2021/10/02 0:00:00,Alaska man killed when debris pierces windshield in freak accident on highway
2021/10/02 0:00:00,Sydney auctions: Marrickville house gets record price due to prized feature
2021/10/02 0:00:00,Rugby Championship: Andrew Kellaway hat-trick inspires Wallabies’ fourth straight win
2021/10/02 0:00:00,‘I have no idea’: Daniel Ricciardo’s surprising F1 admission
2021/10/02 0:00:00,Socceroos defender Brad Smith tests positive for Covid-19
2021/10/02 0:00:00,QLD bidders win keys to Moorabbin townhouse
2021/10/02 0:00:00,Fighting Spirit photos and poems salute Aussie communities smashed by the Black Summer
2021/10/02 0:00:00,Covid fears for ship crew rushed to hospital after berthing in WA
2021/10/02 0:00:00,Herne Hill home beats price hopes by $120K
2021/10/02 0:00:00,Police chief blasted for ‘insensitive’ comment about Sarah Everard’s murder
2021/10/02 0:00:00,US media platform Ozy to close after accusations of deceptive conduct
2021/10/02 0:00:00,SA records Covid-19 case after woman catches Jetstar flight from Victoria
2021/10/02 0:00:00,‘Wonderful’: Rachael Haynes’ heartwarming family reveal
2021/10/02 0:00:00,Superfans lie low as China cracks down on 'false idols'
2021/10/02 0:00:00,Queensland Health identifies new Covid-19 exposure sites
2021/10/02 0:00:00,Aristocrats flock to Russia for first royal wedding in century
2021/10/02 0:00:00,Ben Dorries rates Incentivise’s fabulous Turnbull Stakes triumph
2021/10/02 0:00:00,Treasurer Tim Pallas slams Prime Minister for ‘mean-spirited’ tradie support snub
2021/10/02 0:00:00,NSW planning Minister Rob Stokes announces tilt to replace fallen Premier Gladys Berejiklian
2021/10/02 0:00:00,AFL 2021: Carlton confirms George Hewett as first signing of Michael Voss’ senior coaching tenure
2021/10/02 0:00:00,Trainer Rob Heathcote had a day of mixed emotions at Randwick on Saturday with stable stars Rothfire and Startantes
2021/10/02 0:00:00,Sydney auctions: Burnt house in shocking conditions becomes hot property at auction
2021/10/02 0:00:00,Two children survive 10-metre fall from Coffs Harbour cliff
2021/10/02 0:00:00,Most vaxxed country jabbed 119 per cent of its eligible population
2021/10/02 0:00:00,Draymond Green’s ‘embarrassing’ remarks on Covid-19 vaccine
2021/10/02 0:00:00,Brick home on big block in Geelong’s East sells $107k over reserve
2021/10/02 0:00:00,NRL 2021: Penrith Panthers coach Ivan Cleary weighs in on last clash with South Sydney Rabbitohs ahead of NRL Grand Final
2021/10/02 0:00:00,NSW Liberals line up to replace outgoing Premier Gladys Berejiklian
2021/10/02 0:00:00,Vision for Melbourne’s new floating bar revealed
2021/10/02 0:00:00,Bachelor host Osher Günsberg shares his health and fitness tips
2021/10/02 0:00:00,‘Malevolent’: Victoria’s extraordinary swipe at PM over tradie support
2021/10/02 0:00:00,Brad Hazzard warns NSW success could easily come undone
2021/10/02 0:00:00,Venezuela's inflation-battered bolivar sheds 6 zeroes
2021/10/02 0:00:00,Record 38 Chinese jets enter Taiwan defence zone on National Day
2021/10/02 0:00:00,Disturbing video shows Mexican cartel lining up rivals for mass execution
2021/10/02 0:00:00,South Sydney Rabbitohs assistant coach Jason Demetriou makes hilarious Wayne Bennett joke ahead of NRL Grand Final
2021/10/02 0:00:00,"Bitcoin price: Cryptocurrencies ether, cardano, solana, binance and dogecoin in huge surge"
2021/10/02 0:00:00,Ballina Sunday: Shayne O’Cass gives his Best Bets and Inside Mail
2021/10/02 0:00:00,"US surpasses 700,000 Covid deaths: Johns Hopkins"
2021/10/02 0:00:00,"Commissioner resigns, US women's soccer league calls off matches"
2021/10/02 0:00:00,Horror moment man loses leg in shark attack
2021/10/02 0:00:00,Kementari turned heartbreaker at Flemington while Tasmanian mare Still A Star has set connections up for a $1m bonus
2021/10/02 0:00:00,Princess Mako diagnosed with PTSD amid controversial wedding
2021/10/02 0:00:00,US dad captures moment king-size alligator eats another for lunch
2021/10/02 0:00:00,New Covid-19 antiviral pill claims to cut death and hospitalisation risk
2021/10/02 0:00:00,Star SA jockey Jess Eaton has failed to get her running and handling ban overturned on appeal
2021/10/02 0:00:00,Red Bull attempted to poach McLaren driver Lando Norris
2021/10/02 0:00:00,International travel ban: Everything Aussies need to do to get overseas
2021/10/02 0:00:00,Landmark 100th running of Arc set for Snowfall
2021/10/02 0:00:00,Gladys Berejiklian resignation: Chris Minns says election win still a ‘huge ask’ for NSW Labor
2021/10/02 0:00:00,Canberra records 52 new Covid cases for second day in a row
2021/10/02 0:00:00,Kimberley Garner stuns in dangerously high slit dress | Best celeb pictures
2021/10/02 0:00:00,More than 100 furious protesters arrested as anti-vaccination chanters block traffic
2021/10/02 0:00:00,Custom home on the river is a natural treasure at Newtown
2021/10/02 0:00:00,Police admit Sarah Everard’s killer Wayne Couzens could have been stopped
2021/10/02 0:00:00,"Sunshine Coast preview, tips and best bets for Sunday, October 3"
2021/10/02 0:00:00,Tom Brady addresses ‘super personal’ break-up with coach Bill Belichick
2021/10/02 0:00:00,Roxy Jacenko reveals her son wants $200 from the tooth fairy
2021/10/02 0:00:00,‘Shocker’: Controversial umpiring decision sparks debate after IPL thriller
2021/10/02 0:00:00,Luigi Rosselli house shoots for Redfern record
2021/10/02 0:00:00,House prices: Sydney’s shame after staggering surge
2021/10/02 0:00:00,"Cards, flowers left at home of Gladys Berejiklian, as Australians react to her bombshell resignation"
2021/10/02 0:00:00,Melbourne Storm clear the air with Cameron Smith after video scandal
2021/10/02 0:00:00,Lote Tuqiri reveals how Wayne Bennett let his hair down after premiership win
2021/10/02 0:00:00,Who will prevail in mouth-watering clash between Verry Elleegant and Incentivise in Turnbull Stakes? Experts have their say
2021/10/02 0:00:00,Sophie Turner and Joe Jonas downsize to $15 million Miami beachfront mansion
2021/10/02 0:00:00,Breen leads as night falls in Finland while Ogier struggles
2021/10/02 0:00:00,"From Taliban to Ronaldo's land, Afghan women footballers train again"
2021/10/02 0:00:00,Google pulls plug on plan for mobile banking in Pay app
2021/10/02 0:00:00,iPad mini review: Apple’s ‘hilariously awesome’ new gadget
2021/10/02 0:00:00,Port Melbourne ‘gem’ sells for first time in almost 20 years
2021/10/02 0:00:00,Qld records two new local Covid-19 cases
2021/10/02 0:00:00,"As Democrats feud over historic spending plans, Biden vows to 'get this done'"
2021/10/02 0:00:00,Why did ICAC make its decision to investigate Berejiklian a week before reopening
2021/10/02 0:00:00,School bans parents from wearing dressing gowns as they drop off children
2021/10/02 0:00:00,‘Atrocious’: Aussie MotoGP star’s fury after 15-year-old’s tragic death
2021/10/02 0:00:00,‘Pr**k’: England unloads on Tim Paine over tone-deaf Ashes call
2021/10/02 0:00:00,Horse with “similar profile to Zaaki” set to arrive Down Under for rising star Annabel Neasham
2021/10/02 0:00:00,Disturbing video sparks grave fears as UFC star strips off
2021/10/02 0:00:00,My wife’s been having an affair with my twin brother for three years
2021/10/02 0:00:00,The $11 million ‘declaration of war’ that ‘closes the door’ on Simmons
2021/10/02 0:00:00,NSW records 813 new local coronavirus cases and 10 deaths
2021/10/02 0:00:00,North Korea fires anti-aircraft missile in latest test
2021/10/02 0:00:00,Guinea coup leader sworn in as transitional president
2021/10/02 0:00:00,Australian miners hit hard by Evergrande woes
2021/10/02 0:00:00,Devondale sparkling apple juice recalled amid glass fears
2021/10/02 0:00:00,"Victoria records 1488 new Covid-19 cases, two deaths"
2021/10/02 0:00:00,Premier Gladys Berejiklian to resign after ICAC confirms it is investigating her
2021/10/02 0:00:00,UK army to deliver petrol from Monday amid fuel crisis: govt
2021/10/02 0:00:00,SA’s coast set for its hottest summer
2021/10/02 0:00:00,Philadelphia 76ers declare war on Ben Simmons with $11.4m blow
2021/10/02 0:00:00,North Melbourne star Ben Cunnington breaks down following battle with cancer
2021/10/02 0:00:00,Georgia arrests ex-president upon return from exile on election eve
2021/10/02 0:00:00,Ex-South Sydney star Sam Burgess opens up on ‘great relationship’ with Wayne Bennett
2021/10/02 0:00:00,Blinken seeks to patch up ties on France trip after subs furor
2021/10/02 0:00:00,Aspirational Glenbrook home with manicured lawns and stylish interiors drawing buyers in
2021/10/02 0:00:00,Geelong estates offer hope to young homebuyers
2021/10/02 0:00:00,2021 Toyota Yaris GR review: Little hatch on steroids
2021/10/02 0:00:00,Ringside seat for fearful villagers as Canaries volcano spews fire
2021/10/02 0:00:00,Thousands brave heat as delayed Dubai Expo finally opens
2021/10/02 0:00:00,"From slavery to police abuse, new museum documents US history of racism"
2021/10/02 0:00:00,Princess Beatice and Edoardo Mapelli Mozzi call daughter Sienna Elizabeth in touching nod to Queen
2021/10/02 0:00:00,Albert Park: Formula One driver signatures hidden behind walls of incredible renovated house
2021/10/02 0:00:00,Real estate terms explained: Definitions and buzzwords words you need to know
2021/10/02 0:00:00,Effie Kats: Fashion designer buys Malvern ‘fixer upper’
2021/10/02 0:00:00,Melbourne’s most popular suburbs for house flippers: Ray White
2021/10/02 0:00:00,Mosman stunner is a private slice of paradise ready for summer
