date,title
2021/06/26 0:00:00,Alerts for five flights across three states after crew member catches Covid-19
2021/06/26 0:00:00,Covid Victoria: Border slams shut as NSW extends lockdown
2021/06/26 0:00:00,Buddy brilliance not enough to prevent Port win
2021/06/26 0:00:00,AFL Fans slam umpires as Demons outlast Bombers
2021/06/26 0:00:00,NZ travel bubble paused with Australia for at least three days
2021/06/26 0:00:00,Essendon’s Nick Hind comes off second best in brutal goalpost collision
2021/06/26 0:00:00,Origin III could be moved from Sydney due to Covid lockdown
2021/06/26 0:00:00,Morphettville: Ex-Kiwi galloper Not Usual Glorious maintains unbeaten record in South Australia
2021/06/26 0:00:00,Chaotic scenes in NSW supermarkets as panic buying takes hold
2021/06/26 0:00:00,Dean Vickerman reflects on rocky road to Melbourne’s title win
2021/06/26 0:00:00,Brayden Maynard slammed for ‘unforgivable’ act against Fremantle
2021/06/26 0:00:00,A-League: Melbourne City coach Patrick Kisnorbo predicts a ‘special’ grand final
2021/06/26 0:00:00,‘They stopped trying’: Chris Close rips into Queenslanders
2021/06/26 0:00:00,"Sonny Bill Williams survived six-year boxing scare, calls out Barry Hall"
2021/06/26 0:00:00,Fremantle crashes Collingwood’s party with thrilling win
2021/06/26 0:00:00,Man in court for string of ‘dine and dash crimes’ at UK gastropubs
2021/06/26 0:00:00,Civic Stakes: Brenton Avdulla leads all the way with Bandersnatch
2021/06/26 0:00:00,Andrew Bogut wants Ben Simmons to give Boomers clarity on Olympic commitment
2021/06/26 0:00:00,Feud between Tassie Premier and Suns president only brings out 6719 fans
2021/06/26 0:00:00,"Kerry Parnell: Harry, William should end family feud for their mum’s sake"
2021/06/26 0:00:00,"Richard Wilkins: ‘The older I get, the more I think about my health’"
2021/06/26 0:00:00,Duncan Lay: Suicide Squad remake will test the return of cinemas
2021/06/26 0:00:00,TV host fights back the giggles as board spells out rude word
2021/06/26 0:00:00,Trio arrested after allegedly flying plane from NSW into outback South Australia
2021/06/26 0:00:00,Tatt’s Tiara: Craig Williams makes right decision as Tofane captures back-to-back Group 1 wins
2021/06/26 0:00:00,Ben Elias’ ultimate praise for Blues star Damien Cook
2021/06/26 0:00:00,Hong Kong police chief calls for fake news law
2021/06/26 0:00:00,Lightning defeat Magpies in Super Netball nailbiter
2021/06/26 0:00:00,"Tesla to 'recall' over 285,000 cars in China due to faulty software"
2021/06/26 0:00:00,Caulfield: Damian Lane shows his class with treble
2021/06/26 0:00:00,NSW Premier Gladys Berejiklian urges infected delivery drivers to get tested as state battles outbreak
2021/06/26 0:00:00,Swimming Australia says 'unacceptable behaviour' a decades-long problem
2021/06/26 0:00:00,East Geelong record house price broken as four vie for top street
2021/06/26 0:00:00,Fans divided in women’s State of Origin debate
2021/06/26 0:00:00,Tattersall’s Cup: Incentivise rockets to Melbourne Cup favouritism after making a mess of his rivals again
2021/06/26 0:00:00,Brad Hazzard warns public with massive fines for breaching new Covid-19 restrictions
2021/06/26 0:00:00,‘Not again’: Nick Kyrgios reacts to tricky first round Wimbledon match-up
2021/06/26 0:00:00,Tigers left licking their wounds after shock loss to St Kilda
2021/06/26 0:00:00,Britney Spears fans call for ‘free Britney’ after singer’s court appearance
2021/06/26 0:00:00,Stayers Cup: Sweet Thomas is small but tough as history repeats in 3200m feature
2021/06/26 0:00:00,Costly blow to Clive Palmer
2021/06/26 0:00:00,Tim Paine’s World Test Championship clanger
2021/06/26 0:00:00,A-League 2021 Grand Final: All the Melbourne City news
2021/06/26 0:00:00,Covid-19: Auctions and open homes cancelled under two week lockdown in Greater Sydney
2021/06/26 0:00:00,Brother of beloved Qld MP urges crowd to chase their dreams at touching memorial service
2021/06/26 0:00:00,Childcare to remain open during NSW lockdown
2021/06/26 0:00:00,Fitzroy North home with ‘angel wings’ finds new guardians
2021/06/26 0:00:00,A-League 2021 Grand Final: All the Sydney FC news
2021/06/26 0:00:00,Spring weather will be a pointer to Icebath’s targets
2021/06/26 0:00:00,The one thing Sunrise co-host Natalie Barr won’t take for granted
2021/06/26 0:00:00,Eagle Farm: Hayes brothers Ben and JD notch first winner in new era for Lindsay Park
2021/06/26 0:00:00,Queen spotted driving to Frogmore as Harry arrives in UK
2021/06/26 0:00:00,Fans expose very rude hidden Daniel Ricciardo detail
2021/06/26 0:00:00,All the new Covid-19 restrictions for NSW explained
2021/06/26 0:00:00,Subtle signs to look out for to find out if your partner is cheating
2021/06/26 0:00:00,"NT mine in lockdown, 900 FIFO workers isolate after man tests positive to COVID-19"
2021/06/26 0:00:00,St Kilda stars deliver perfect comeback to Caroline Wilson storm
2021/06/26 0:00:00,Matthew Benns on his favourite character in The Dying Diplomats Club: the dog
2021/06/26 0:00:00,Sydney lockdown: NSW Premier Gladys Berejiklian widens tough Covid-19 restrictions to greater Sydney
2021/06/26 0:00:00,"Business group urges Biden to lift Europe travel ban, revive economies"
2021/06/26 0:00:00,"Sydney auctions: Wahroonga cottage sells $600,000 over reserve after 22 bidders register"
2021/06/26 0:00:00,Police seize $209 million in record cryptocurrency bust
2021/06/26 0:00:00,A-League: Sydney FC coach Steve Corica eyeing off more silverware in grand final
2021/06/26 0:00:00,David Payne believes Montefilia can stay the distance
2021/06/26 0:00:00,"Sudden, bitter exit makes Broncos crisis even worse"
2021/06/26 0:00:00,French woman Valerie Bacot killed rapist husband after ‘extreme hell’
2021/06/26 0:00:00,Battle for John McAfee’s fortune begins as wife and ‘47 kids’ fight for his inheritance
2021/06/26 0:00:00,McDonald’s Australia to inject $600m into economy with new restaurants
2021/06/26 0:00:00,Sydney flags broader lockdown as Delta variant cases swell
2021/06/26 0:00:00,US ex-cop sentenced to over 22 years for George Floyd murder
2021/06/26 0:00:00,Melbourne auction results: Canterbury home on ‘iconic street’ sells for $8m+
2021/06/26 0:00:00,Demands for answers in aftermath of Florida building collapse
2021/06/26 0:00:00,Australia’s ‘fleeting’ virus spread claim disputed
2021/06/26 0:00:00,Dad saves daughter’s life after learning CPR from The Office
2021/06/26 0:00:00,Italy ready for last 16 as Wales face Denmark at Euro 2020
2021/06/26 0:00:00,Michael Schumacher’s wife Corinna reveals important detail
2021/06/26 0:00:00,Jockeys to enter the ring in Charity fight for fallen rider
2021/06/26 0:00:00,NSW records 12 new cases of coronavirus
2021/06/26 0:00:00,Industrial style on show in new Geelong West residence
2021/06/26 0:00:00,"With another premiership title secured, is the great TJ Smith’s record in danger?"
2021/06/26 0:00:00,Fully vaccinated Aussies still not given hope they’ll be exempt from future lockdowns
2021/06/26 0:00:00,Alex De Minaur stuns tennis commentators with incredible point
2021/06/26 0:00:00,No new local Covid cases in Queensland but CHO says more cases imminent
2021/06/26 0:00:00,Man stabbed to death after fight broke out at apartment complex in Bentleigh East
2021/06/26 0:00:00,Global stocks mostly rise to conclude good week for equities
2021/06/26 0:00:00,French woman who killed rapist husband spared more jail time
2021/06/26 0:00:00,Amazon hydropower plant contributes significant greenhouse emissions: study
2021/06/26 0:00:00,Brittany hill scrap opens 2021 Tour de France
2021/06/26 0:00:00,Day grabs Travelers lead despite sore back with Bubba one back
2021/06/26 0:00:00,Three MSF aid workers killed in Ethiopia's Tigray
2021/06/26 0:00:00,Evidence on UFOs 'largely inconclusive': US intelligence report
2021/06/26 0:00:00,Prisoner smuggles suspected sex worker into cell in gobsmacking security breach
2021/06/26 0:00:00,Dashcam footage captures shocking moment truck flips
2021/06/26 0:00:00,Former Defence insider says UFOs ‘may be threat to national security’
2021/06/26 0:00:00,Scottie Pippen reveals truth about his relationship with Michael Jordan
2021/06/26 0:00:00,Woman discovers note hidden in wedding dress
2021/06/26 0:00:00,Daniel Ricciardo takes down F1 rival with cruel Instagram insult
2021/06/26 0:00:00,New study reveals worrying mental health numbers for those stuck in lockdown
2021/06/26 0:00:00,Afghan leader meets Biden as US exit looms
2021/06/26 0:00:00,Victoria records one new local case of coronavirus as restrictions ease
2021/06/26 0:00:00,Ange Postecoglou delivers perfect reply to journo’s prickly Celtic question
2021/06/26 0:00:00,Prince Harry lands in UK ahead of Diana statue unveiling
2021/06/26 0:00:00,‘It’s a lie’: Plot thickens in messy Ben Simmons-76ers trade saga
2021/06/26 0:00:00,‘An absolute disgrace’: Premier’s super petty move slammed
2021/06/26 0:00:00,Melbourne auctions: Hottest auction suburbs in record winter week
2021/06/26 0:00:00,Derek Chauvin sentenced to 22.5 years for murder of George Floyd
2021/06/26 0:00:00,How much of a pay rise workers should ask their employer for in 2021
2021/06/26 0:00:00,Police officer killed trying to stop suspected stolen car on Qld highway
2021/06/26 0:00:00,Answer the call of the coast – while you still can
2021/06/26 0:00:00,Huge boost for Ash Barty as Wimbledon draw announced
2021/06/26 0:00:00,‘Cheeky grin’ exposes women’s State of Origin ‘milking’ drama
2021/06/26 0:00:00,Somali kills three in 'brutal' Germany knife attack
2021/06/26 0:00:00,2021 Subaru Outback review: Good to drive and great value
2021/06/26 0:00:00,Dylan Alcott reveals ‘disgusting’ backlash to AFL joke
2021/06/26 0:00:00,Denmark football fan wins the internet after beer video goes viral
2021/06/26 0:00:00,"Hunt for survivors as Florida collapse leaves four dead, 159 unaccounted for"
2021/06/26 0:00:00,What a sight to sea on South Brighton’s Esplanade
2021/06/26 0:00:00,Sydney lockdown: Residents party before seven-day lockdown
2021/06/26 0:00:00,'Dragon Man': Scientists say new human species is our closest ancestor
2021/06/26 0:00:00,"Australia, Israel impose new curbs as Delta threatens"
2021/06/26 0:00:00,"18 killed, 16 injured in fire at China martial arts school"
2021/06/26 0:00:00,Regional Victoria real estate offering better bang for buck
2021/06/26 0:00:00,Sydney property: why regional NSW offers affordable housing and where to buy
2021/06/26 0:00:00,"Victoria’s hottest regional housing markets for demand, price growth"
